[I 2025-04-15 23:41:58,053] Trial 692 finished with value: -0.19363758753013854 and parameters: {'n_estimators': 12, 'min_samples_split': 197, 'max_features': 0.3, 'min_samples_leaf': 39, 'criterion': 'absolute_error', 'max_depth': 30, 'min_weight_fraction_leaf': 0.07, 'max_leaf_nodes': 50, 'bootstrap': True, 'ccp_alpha': 0.053, 'max_samples': 0.5}. Best is trial 621 with value: -0.18112741123578058.
[I 2025-04-15 23:41:58,437] Trial 693 finished with value: -0.18641892115312783 and parameters: {'n_estimators': 227, 'min_samples_split': 27, 'max_features': 0.76, 'min_samples_leaf': 10, 'criterion': 'absolute_error', 'max_depth': 45, 'min_weight_fraction_leaf': 0.01, 'max_leaf_nodes': 100, 'bootstrap': True, 'ccp_alpha': 0.091, 'max_samples': 0.5}. Best is trial 621 with value: -0.18112741123578058.
[I 2025-04-15 23:41:58,833] Trial 694 finished with value: -0.18593256185940388 and parameters: {'n_estimators': 205, 'min_samples_split': 20, 'max_features': 0.8300000000000001, 'min_samples_leaf': 53, 'criterion': 'absolute_error', 'max_depth': 30, 'min_weight_fraction_leaf': 0.02, 'max_leaf_nodes': 150, 'bootstrap': True, 'ccp_alpha': 0.073, 'max_samples': 0.5}. Best is trial 621 with value: -0.18112741123578058.
[I 2025-04-15 23:42:01,393] Trial 695 finished with value: -0.18385474730104573 and parameters: {'n_estimators': 2235, 'min_samples_split': 65, 'max_features': 0.81, 'min_samples_leaf': 28, 'criterion': 'absolute_error', 'max_depth': 45, 'min_weight_fraction_leaf': 0.01, 'max_leaf_nodes': 100, 'bootstrap': True, 'ccp_alpha': 0.046, 'max_samples': 0.5}. Best is trial 621 with value: -0.18112741123578058.
[I 2025-04-15 23:42:02,215] Trial 696 finished with value: -0.18689030799396042 and parameters: {'n_estimators': 531, 'min_samples_split': 178, 'max_features': 0.8300000000000001, 'min_samples_leaf': 26, 'criterion': 'absolute_error', 'max_depth': 30, 'min_weight_fraction_leaf': 0.02, 'max_leaf_nodes': 20, 'bootstrap': True, 'ccp_alpha': 0.067, 'max_samples': 0.5}. Best is trial 621 with value: -0.18112741123578058.
[I 2025-04-15 23:42:07,356] Trial 697 finished with value: -0.18352919441446072 and parameters: {'n_estimators': 4596, 'min_samples_split': 164, 'max_features': 0.79, 'min_samples_leaf': 68, 'criterion': 'absolute_error', 'max_depth': 20, 'min_weight_fraction_leaf': 0.0, 'max_leaf_nodes': 100, 'bootstrap': True, 'ccp_alpha': 0.081, 'max_samples': 0.5}. Best is trial 621 with value: -0.18112741123578058.
[I 2025-04-15 23:42:09,378] Trial 698 finished with value: -0.18739191402821226 and parameters: {'n_estimators': 1785, 'min_samples_split': 42, 'max_features': 0.77, 'min_samples_leaf': 34, 'criterion': 'absolute_error', 'max_depth': 30, 'min_weight_fraction_leaf': 0.02, 'max_leaf_nodes': 100, 'bootstrap': True, 'ccp_alpha': 0.094, 'max_samples': 0.5}. Best is trial 621 with value: -0.18112741123578058.
[I 2025-04-15 23:42:11,899] Trial 699 finished with value: -18.22711908374777 and parameters: {'n_estimators': 2431, 'min_samples_split': 159, 'max_features': 0.14, 'min_samples_leaf': 37, 'criterion': 'friedman_mse', 'max_depth': None, 'min_weight_fraction_leaf': 0.01, 'max_leaf_nodes': 50, 'bootstrap': True, 'ccp_alpha': 0.061, 'max_samples': 0.5}. Best is trial 621 with value: -0.18112741123578058.
[I 2025-04-15 23:42:12,398] Trial 700 finished with value: -0.1936417107583833 and parameters: {'n_estimators': 430, 'min_samples_split': 184, 'max_features': 0.32, 'min_samples_leaf': 30, 'criterion': 'absolute_error', 'max_depth': 45, 'min_weight_fraction_leaf': 0.02, 'max_leaf_nodes': None, 'bootstrap': False, 'ccp_alpha': 0.054}. Best is trial 621 with value: -0.18112741123578058.
[I 2025-04-15 23:42:17,022] Trial 701 finished with value: -0.18316560854622646 and parameters: {'n_estimators': 4235, 'min_samples_split': 175, 'max_features': 0.81, 'min_samples_leaf': 12, 'criterion': 'absolute_error', 'max_depth': 60, 'min_weight_fraction_leaf': 0.01, 'max_leaf_nodes': 150, 'bootstrap': True, 'ccp_alpha': 0.088, 'max_samples': 0.5}. Best is trial 621 with value: -0.18112741123578058.
[I 2025-04-15 23:42:17,374] Trial 702 finished with value: -0.18493751619510249 and parameters: {'n_estimators': 175, 'min_samples_split': 169, 'max_features': 0.85, 'min_samples_leaf': 27, 'criterion': 'absolute_error', 'max_depth': 5, 'min_weight_fraction_leaf': 0.02, 'max_leaf_nodes': 100, 'bootstrap': True, 'ccp_alpha': 0.07, 'max_samples': 0.5}. Best is trial 621 with value: -0.18112741123578058.
[I 2025-04-15 23:42:18,406] Trial 703 finished with value: -0.18652281385149672 and parameters: {'n_estimators': 799, 'min_samples_split': 129, 'max_features': 0.88, 'min_samples_leaf': 25, 'criterion': 'absolute_error', 'max_depth': 30, 'min_weight_fraction_leaf': 0.02, 'max_leaf_nodes': 100, 'bootstrap': True, 'ccp_alpha': 0.041, 'max_samples': 0.5}. Best is trial 621 with value: -0.18112741123578058.
[I 2025-04-15 23:42:21,761] Trial 704 finished with value: -0.18284541346184763 and parameters: {'n_estimators': 2805, 'min_samples_split': 39, 'max_features': 0.36000000000000004, 'min_samples_leaf': 33, 'criterion': 'absolute_error', 'max_depth': 15, 'min_weight_fraction_leaf': 0.04, 'max_leaf_nodes': 150, 'bootstrap': True, 'ccp_alpha': 0.064, 'max_samples': 0.5}. Best is trial 621 with value: -0.18112741123578058.
[I 2025-04-15 23:42:25,823] Trial 705 finished with value: -0.1831750452676369 and parameters: {'n_estimators': 3451, 'min_samples_split': 30, 'max_features': 0.8200000000000001, 'min_samples_leaf': 31, 'criterion': 'absolute_error', 'max_depth': 45, 'min_weight_fraction_leaf': 0.06, 'max_leaf_nodes': 100, 'bootstrap': True, 'ccp_alpha': 0.096, 'max_samples': 0.5}. Best is trial 621 with value: -0.18112741123578058.
[I 2025-04-15 23:42:29,457] Trial 706 finished with value: -0.18290654356665703 and parameters: {'n_estimators': 3299, 'min_samples_split': 34, 'max_features': 0.05, 'min_samples_leaf': 29, 'criterion': 'absolute_error', 'max_depth': 30, 'min_weight_fraction_leaf': 0.0, 'max_leaf_nodes': 50, 'bootstrap': True, 'ccp_alpha': 0.226, 'max_samples': 0.5}. Best is trial 621 with value: -0.18112741123578058.
[I 2025-04-15 23:42:32,360] Trial 707 finished with value: -0.182888108821538 and parameters: {'n_estimators': 2644, 'min_samples_split': 46, 'max_features': 0.27, 'min_samples_leaf': 25, 'criterion': 'absolute_error', 'max_depth': 30, 'min_weight_fraction_leaf': 0.01, 'max_leaf_nodes': 100, 'bootstrap': True, 'ccp_alpha': 0.077, 'max_samples': 0.5}. Best is trial 621 with value: -0.18112741123578058.
[I 2025-04-15 23:42:35,888] Trial 708 finished with value: -17.81965447316689 and parameters: {'n_estimators': 3637, 'min_samples_split': 18, 'max_features': 0.24000000000000002, 'min_samples_leaf': 27, 'criterion': 'squared_error', 'max_depth': 45, 'min_weight_fraction_leaf': 0.02, 'max_leaf_nodes': 100, 'bootstrap': True, 'ccp_alpha': 0.058, 'max_samples': 0.5}. Best is trial 621 with value: -0.18112741123578058.
[I 2025-04-15 23:42:36,047] Trial 709 finished with value: -0.1936418667110586 and parameters: {'n_estimators': 6, 'min_samples_split': 25, 'max_features': 0.35000000000000003, 'min_samples_leaf': 36, 'criterion': 'absolute_error', 'max_depth': 15, 'min_weight_fraction_leaf': 0.01, 'max_leaf_nodes': 150, 'bootstrap': True, 'ccp_alpha': 0.085, 'max_samples': None}. Best is trial 621 with value: -0.18112741123578058.
[I 2025-04-15 23:42:39,201] Trial 710 finished with value: -0.18291440975054077 and parameters: {'n_estimators': 2850, 'min_samples_split': 178, 'max_features': 0.72, 'min_samples_leaf': 24, 'criterion': 'absolute_error', 'max_depth': 30, 'min_weight_fraction_leaf': 0.02, 'max_leaf_nodes': 300, 'bootstrap': True, 'ccp_alpha': 0.073, 'max_samples': 0.5}. Best is trial 621 with value: -0.18112741123578058.
[I 2025-04-15 23:42:39,754] Trial 711 finished with value: -0.18761068511112788 and parameters: {'n_estimators': 343, 'min_samples_split': 173, 'max_features': 0.8400000000000001, 'min_samples_leaf': 45, 'criterion': 'absolute_error', 'max_depth': 45, 'min_weight_fraction_leaf': 0.0, 'max_leaf_nodes': 100, 'bootstrap': True, 'ccp_alpha': 0.048, 'max_samples': 0.5}. Best is trial 621 with value: -0.18112741123578058.
[I 2025-04-15 23:42:43,585] Trial 712 finished with value: -0.18255279843360217 and parameters: {'n_estimators': 2980, 'min_samples_split': 186, 'max_features': 0.87, 'min_samples_leaf': 32, 'criterion': 'absolute_error', 'max_depth': 20, 'min_weight_fraction_leaf': 0.02, 'max_leaf_nodes': 100, 'bootstrap': True, 'ccp_alpha': 0.10200000000000001, 'max_samples': 0.5}. Best is trial 621 with value: -0.18112741123578058.
[I 2025-04-15 23:42:48,612] Trial 713 finished with value: -0.18363584442953754 and parameters: {'n_estimators': 5165, 'min_samples_split': 161, 'max_features': 0.8, 'min_samples_leaf': 29, 'criterion': 'absolute_error', 'max_depth': 30, 'min_weight_fraction_leaf': 0.01, 'max_leaf_nodes': 50, 'bootstrap': True, 'ccp_alpha': 0.092, 'max_samples': 0.5}. Best is trial 621 with value: -0.18112741123578058.
[I 2025-04-15 23:42:52,091] Trial 714 finished with value: -0.18278800934900769 and parameters: {'n_estimators': 3223, 'min_samples_split': 89, 'max_features': 0.89, 'min_samples_leaf': 28, 'criterion': 'absolute_error', 'max_depth': 15, 'min_weight_fraction_leaf': 0.02, 'max_leaf_nodes': 150, 'bootstrap': True, 'ccp_alpha': 0.08, 'max_samples': 0.5}. Best is trial 621 with value: -0.18112741123578058.
[I 2025-04-15 23:42:59,298] Trial 715 finished with value: -0.1838532249014025 and parameters: {'n_estimators': 6454, 'min_samples_split': 151, 'max_features': 0.75, 'min_samples_leaf': 30, 'criterion': 'absolute_error', 'max_depth': None, 'min_weight_fraction_leaf': 0.01, 'max_leaf_nodes': None, 'bootstrap': True, 'ccp_alpha': 0.052000000000000005, 'max_samples': 0.5}. Best is trial 621 with value: -0.18112741123578058.
[I 2025-04-15 23:43:01,927] Trial 716 finished with value: -18.061202742090252 and parameters: {'n_estimators': 2550, 'min_samples_split': 167, 'max_features': 0.8300000000000001, 'min_samples_leaf': 40, 'criterion': 'poisson', 'max_depth': 45, 'min_weight_fraction_leaf': 0.0, 'max_leaf_nodes': 100, 'bootstrap': True, 'ccp_alpha': 0.066, 'max_samples': 1.0}. Best is trial 621 with value: -0.18112741123578058.
[I 2025-04-15 23:43:11,703] Trial 717 finished with value: -0.19154349378165852 and parameters: {'n_estimators': 7884, 'min_samples_split': 39, 'max_features': 0.78, 'min_samples_leaf': 25, 'criterion': 'absolute_error', 'max_depth': 60, 'min_weight_fraction_leaf': 0.01, 'max_leaf_nodes': 100, 'bootstrap': True, 'ccp_alpha': 0.098, 'max_samples': 0.75}. Best is trial 621 with value: -0.18112741123578058.
[I 2025-04-15 23:43:14,856] Trial 718 finished with value: -0.18258971160814266 and parameters: {'n_estimators': 2930, 'min_samples_split': 180, 'max_features': 0.86, 'min_samples_leaf': 8, 'criterion': 'absolute_error', 'max_depth': 30, 'min_weight_fraction_leaf': 0.02, 'max_leaf_nodes': 100, 'bootstrap': True, 'ccp_alpha': 0.105, 'max_samples': 0.5}. Best is trial 621 with value: -0.18112741123578058.
[I 2025-04-15 23:43:18,031] Trial 719 finished with value: -0.1936417107583833 and parameters: {'n_estimators': 3409, 'min_samples_split': 101, 'max_features': 0.85, 'min_samples_leaf': 33, 'criterion': 'absolute_error', 'max_depth': 5, 'min_weight_fraction_leaf': 0.02, 'max_leaf_nodes': 150, 'bootstrap': False, 'ccp_alpha': 0.061}. Best is trial 621 with value: -0.18112741123578058.
[I 2025-04-15 23:43:18,733] Trial 720 finished with value: -0.18687003789248494 and parameters: {'n_estimators': 544, 'min_samples_split': 146, 'max_features': 0.88, 'min_samples_leaf': 35, 'criterion': 'absolute_error', 'max_depth': 30, 'min_weight_fraction_leaf': 0.05, 'max_leaf_nodes': 100, 'bootstrap': True, 'ccp_alpha': 0.185, 'max_samples': 0.5}. Best is trial 621 with value: -0.18112741123578058.
[I 2025-04-15 23:43:21,268] Trial 721 finished with value: -0.18374499509887277 and parameters: {'n_estimators': 2348, 'min_samples_split': 157, 'max_features': 0.21000000000000002, 'min_samples_leaf': 27, 'criterion': 'absolute_error', 'max_depth': 45, 'min_weight_fraction_leaf': 0.01, 'max_leaf_nodes': 100, 'bootstrap': True, 'ccp_alpha': 0.088, 'max_samples': 0.5}. Best is trial 621 with value: -0.18112741123578058.
[I 2025-04-15 23:43:24,823] Trial 722 finished with value: -0.1827852615437196 and parameters: {'n_estimators': 3222, 'min_samples_split': 26, 'max_features': 0.3, 'min_samples_leaf': 63, 'criterion': 'absolute_error', 'max_depth': 15, 'min_weight_fraction_leaf': 0.08, 'max_leaf_nodes': 50, 'bootstrap': True, 'ccp_alpha': 0.077, 'max_samples': 0.5}. Best is trial 621 with value: -0.18112741123578058.
[I 2025-04-15 23:43:25,227] Trial 723 finished with value: -0.18653386308133654 and parameters: {'n_estimators': 231, 'min_samples_split': 190, 'max_features': 0.8200000000000001, 'min_samples_leaf': 30, 'criterion': 'absolute_error', 'max_depth': 30, 'min_weight_fraction_leaf': 0.02, 'max_leaf_nodes': 20, 'bootstrap': True, 'ccp_alpha': 0.068, 'max_samples': 0.5}. Best is trial 621 with value: -0.18112741123578058.
[I 2025-04-15 23:43:27,468] Trial 724 finished with value: -0.18574420154982713 and parameters: {'n_estimators': 1961, 'min_samples_split': 33, 'max_features': 0.67, 'min_samples_leaf': 32, 'criterion': 'absolute_error', 'max_depth': 45, 'min_weight_fraction_leaf': 0.0, 'max_leaf_nodes': 150, 'bootstrap': True, 'ccp_alpha': 0.084, 'max_samples': 0.5}. Best is trial 621 with value: -0.18112741123578058.
[I 2025-04-15 23:43:34,536] Trial 725 finished with value: -17.588792386349837 and parameters: {'n_estimators': 6859, 'min_samples_split': 81, 'max_features': 0.5700000000000001, 'min_samples_leaf': 24, 'criterion': 'friedman_mse', 'max_depth': 30, 'min_weight_fraction_leaf': 0.01, 'max_leaf_nodes': 100, 'bootstrap': True, 'ccp_alpha': 0.059000000000000004, 'max_samples': 0.5}. Best is trial 621 with value: -0.18112741123578058.
[I 2025-04-15 23:43:37,756] Trial 726 finished with value: -0.18275348024221527 and parameters: {'n_estimators': 2776, 'min_samples_split': 164, 'max_features': 0.79, 'min_samples_leaf': 27, 'criterion': 'absolute_error', 'max_depth': 15, 'min_weight_fraction_leaf': 0.06, 'max_leaf_nodes': 100, 'bootstrap': True, 'ccp_alpha': 0.096, 'max_samples': 0.5}. Best is trial 621 with value: -0.18112741123578058.
[I 2025-04-15 23:43:41,157] Trial 727 finished with value: -0.18265456556673856 and parameters: {'n_estimators': 3050, 'min_samples_split': 171, 'max_features': 0.9, 'min_samples_leaf': 28, 'criterion': 'absolute_error', 'max_depth': 45, 'min_weight_fraction_leaf': 0.02, 'max_leaf_nodes': None, 'bootstrap': True, 'ccp_alpha': 0.11, 'max_samples': 0.5}. Best is trial 621 with value: -0.18112741123578058.
[I 2025-04-15 23:43:45,032] Trial 728 finished with value: -0.18342571452277837 and parameters: {'n_estimators': 3633, 'min_samples_split': 50, 'max_features': 0.8400000000000001, 'min_samples_leaf': 30, 'criterion': 'absolute_error', 'max_depth': 30, 'min_weight_fraction_leaf': 0.01, 'max_leaf_nodes': 50, 'bootstrap': True, 'ccp_alpha': 0.074, 'max_samples': 0.5}. Best is trial 621 with value: -0.18112741123578058.
[I 2025-04-15 23:43:48,803] Trial 729 finished with value: -0.18289694546059126 and parameters: {'n_estimators': 3293, 'min_samples_split': 22, 'max_features': 0.49, 'min_samples_leaf': 34, 'criterion': 'absolute_error', 'max_depth': 20, 'min_weight_fraction_leaf': 0.02, 'max_leaf_nodes': 100, 'bootstrap': True, 'ccp_alpha': 0.055, 'max_samples': 0.5}. Best is trial 621 with value: -0.18112741123578058.
[I 2025-04-15 23:43:52,141] Trial 730 finished with value: -0.1827678020843168 and parameters: {'n_estimators': 2920, 'min_samples_split': 175, 'max_features': 0.87, 'min_samples_leaf': 25, 'criterion': 'absolute_error', 'max_depth': None, 'min_weight_fraction_leaf': 0.01, 'max_leaf_nodes': 150, 'bootstrap': True, 'ccp_alpha': 0.09, 'max_samples': 0.5}. Best is trial 621 with value: -0.18112741123578058.
[I 2025-04-15 23:44:01,120] Trial 731 finished with value: -17.496842117089162 and parameters: {'n_estimators': 8804, 'min_samples_split': 28, 'max_features': 0.81, 'min_samples_leaf': 37, 'criterion': 'squared_error', 'max_depth': 60, 'min_weight_fraction_leaf': 0.02, 'max_leaf_nodes': 100, 'bootstrap': True, 'ccp_alpha': 0.10400000000000001, 'max_samples': 0.5}. Best is trial 621 with value: -0.18112741123578058.
[I 2025-04-15 23:44:03,861] Trial 732 finished with value: -0.18282112566329997 and parameters: {'n_estimators': 2624, 'min_samples_split': 155, 'max_features': 0.62, 'min_samples_leaf': 32, 'criterion': 'absolute_error', 'max_depth': 30, 'min_weight_fraction_leaf': 0.0, 'max_leaf_nodes': 100, 'bootstrap': True, 'ccp_alpha': 0.066, 'max_samples': 0.5}. Best is trial 621 with value: -0.18112741123578058.
[I 2025-04-15 23:44:04,193] Trial 733 finished with value: -0.1850248841564699 and parameters: {'n_estimators': 177, 'min_samples_split': 45, 'max_features': 0.26, 'min_samples_leaf': 26, 'criterion': 'absolute_error', 'max_depth': 45, 'min_weight_fraction_leaf': 0.02, 'max_leaf_nodes': 150, 'bootstrap': True, 'ccp_alpha': 0.048, 'max_samples': 0.5}. Best is trial 621 with value: -0.18112741123578058.
[I 2025-04-15 23:44:07,661] Trial 734 finished with value: -0.19329971611668015 and parameters: {'n_estimators': 3133, 'min_samples_split': 166, 'max_features': 0.46, 'min_samples_leaf': 23, 'criterion': 'absolute_error', 'max_depth': 5, 'min_weight_fraction_leaf': 0.04, 'max_leaf_nodes': 100, 'bootstrap': True, 'ccp_alpha': 0.168, 'max_samples': None}. Best is trial 621 with value: -0.18112741123578058.
[I 2025-04-15 23:44:08,979] Trial 735 finished with value: -0.18654128004876042 and parameters: {'n_estimators': 1014, 'min_samples_split': 36, 'max_features': 0.85, 'min_samples_leaf': 28, 'criterion': 'absolute_error', 'max_depth': 15, 'min_weight_fraction_leaf': 0.01, 'max_leaf_nodes': 50, 'bootstrap': True, 'ccp_alpha': 0.083, 'max_samples': 0.5}. Best is trial 621 with value: -0.18112741123578058.
[I 2025-04-15 23:44:12,876] Trial 736 finished with value: -0.18325460714806555 and parameters: {'n_estimators': 3483, 'min_samples_split': 140, 'max_features': 0.91, 'min_samples_leaf': 30, 'criterion': 'absolute_error', 'max_depth': 30, 'min_weight_fraction_leaf': 0.02, 'max_leaf_nodes': 100, 'bootstrap': True, 'ccp_alpha': 0.073, 'max_samples': 0.5}. Best is trial 621 with value: -0.18112741123578058.
[I 2025-04-15 23:44:14,637] Trial 737 finished with value: -0.1865096750955781 and parameters: {'n_estimators': 1490, 'min_samples_split': 17, 'max_features': 0.12, 'min_samples_leaf': 31, 'criterion': 'absolute_error', 'max_depth': 45, 'min_weight_fraction_leaf': 0.01, 'max_leaf_nodes': 100, 'bootstrap': True, 'ccp_alpha': 0.098, 'max_samples': 0.5}. Best is trial 621 with value: -0.18112741123578058.
[I 2025-04-15 23:44:17,089] Trial 738 finished with value: -0.1936417107583833 and parameters: {'n_estimators': 2798, 'min_samples_split': 183, 'max_features': 0.93, 'min_samples_leaf': 34, 'criterion': 'absolute_error', 'max_depth': 30, 'min_weight_fraction_leaf': 0.0, 'max_leaf_nodes': 150, 'bootstrap': False, 'ccp_alpha': 0.063}. Best is trial 621 with value: -0.18112741123578058.
[I 2025-04-15 23:44:17,261] Trial 739 finished with value: -0.19363813473054853 and parameters: {'n_estimators': 14, 'min_samples_split': 42, 'max_features': 0.77, 'min_samples_leaf': 24, 'criterion': 'absolute_error', 'max_depth': 30, 'min_weight_fraction_leaf': 0.02, 'max_leaf_nodes': 100, 'bootstrap': True, 'ccp_alpha': 0.113, 'max_samples': 0.5}. Best is trial 621 with value: -0.18112741123578058.
[I 2025-04-15 23:44:17,851] Trial 740 finished with value: -18.00784137515215 and parameters: {'n_estimators': 407, 'min_samples_split': 161, 'max_features': 0.89, 'min_samples_leaf': 28, 'criterion': 'poisson', 'max_depth': 15, 'min_weight_fraction_leaf': 0.02, 'max_leaf_nodes': None, 'bootstrap': True, 'ccp_alpha': 0.091, 'max_samples': 1.0}. Best is trial 621 with value: -0.18112741123578058.
[I 2025-04-15 23:44:21,150] Trial 741 finished with value: -0.1826057798697139 and parameters: {'n_estimators': 3015, 'min_samples_split': 176, 'max_features': 0.8300000000000001, 'min_samples_leaf': 56, 'criterion': 'absolute_error', 'max_depth': 45, 'min_weight_fraction_leaf': 0.0, 'max_leaf_nodes': 100, 'bootstrap': True, 'ccp_alpha': 0.055, 'max_samples': 0.5}. Best is trial 621 with value: -0.18112741123578058.
[I 2025-04-15 23:44:24,994] Trial 742 finished with value: -0.18292211104519382 and parameters: {'n_estimators': 3276, 'min_samples_split': 170, 'max_features': 0.74, 'min_samples_leaf': 26, 'criterion': 'absolute_error', 'max_depth': 30, 'min_weight_fraction_leaf': 0.06, 'max_leaf_nodes': 300, 'bootstrap': True, 'ccp_alpha': 0.106, 'max_samples': 0.5}. Best is trial 621 with value: -0.18112741123578058.
[I 2025-04-15 23:44:31,143] Trial 743 finished with value: -0.1913035633946168 and parameters: {'n_estimators': 5555, 'min_samples_split': 13, 'max_features': 0.01, 'min_samples_leaf': 31, 'criterion': 'absolute_error', 'max_depth': 20, 'min_weight_fraction_leaf': 0.02, 'max_leaf_nodes': 50, 'bootstrap': True, 'ccp_alpha': 0.08, 'max_samples': 0.75}. Best is trial 621 with value: -0.18112741123578058.
[I 2025-04-15 23:44:32,031] Trial 744 finished with value: -0.18588528498516727 and parameters: {'n_estimators': 683, 'min_samples_split': 32, 'max_features': 0.8, 'min_samples_leaf': 35, 'criterion': 'absolute_error', 'max_depth': 45, 'min_weight_fraction_leaf': 0.01, 'max_leaf_nodes': 150, 'bootstrap': True, 'ccp_alpha': 0.04, 'max_samples': 0.5}. Best is trial 621 with value: -0.18112741123578058.
