[I 2025-04-16 02:16:37,287] Trial 4405 finished with value: -17.528986382274862 and parameters: {'n_estimators': 660, 'min_samples_split': 6, 'max_features': 0.76, 'min_samples_leaf': 6, 'criterion': 'squared_error', 'max_depth': 15, 'min_weight_fraction_leaf': 0.0, 'max_leaf_nodes': 10, 'bootstrap': False, 'ccp_alpha': 0.013000000000000001}. Best is trial 4065 with value: 0.057524275121161005.
[I 2025-04-16 02:16:38,010] Trial 4406 finished with value: -39.766870834431934 and parameters: {'n_estimators': 165, 'min_samples_split': 2, 'max_features': 0.74, 'min_samples_leaf': 1, 'criterion': 'absolute_error', 'max_depth': 15, 'min_weight_fraction_leaf': 0.0, 'max_leaf_nodes': 50, 'bootstrap': False, 'ccp_alpha': 0.0}. Best is trial 4065 with value: 0.057524275121161005.
[I 2025-04-16 02:16:39,005] Trial 4407 finished with value: -0.1936417107583833 and parameters: {'n_estimators': 466, 'min_samples_split': 9, 'max_features': 0.8400000000000001, 'min_samples_leaf': 4, 'criterion': 'absolute_error', 'max_depth': 15, 'min_weight_fraction_leaf': 0.0, 'max_leaf_nodes': 300, 'bootstrap': False, 'ccp_alpha': 0.194}. Best is trial 4065 with value: 0.057524275121161005.
[I 2025-04-16 02:16:40,327] Trial 4408 finished with value: -0.1936417107583833 and parameters: {'n_estimators': 868, 'min_samples_split': 6, 'max_features': 0.72, 'min_samples_leaf': 3, 'criterion': 'absolute_error', 'max_depth': 20, 'min_weight_fraction_leaf': 0.0, 'max_leaf_nodes': 300, 'bootstrap': False, 'ccp_alpha': 0.034}. Best is trial 4065 with value: 0.057524275121161005.
[I 2025-04-16 02:16:41,392] Trial 4409 finished with value: -0.1936417107583833 and parameters: {'n_estimators': 579, 'min_samples_split': 200, 'max_features': 0.66, 'min_samples_leaf': 6, 'criterion': 'absolute_error', 'max_depth': 15, 'min_weight_fraction_leaf': 0.0, 'max_leaf_nodes': 300, 'bootstrap': False, 'ccp_alpha': 0.01}. Best is trial 4065 with value: 0.057524275121161005.
[I 2025-04-16 02:16:42,363] Trial 4410 finished with value: -19.219960522666476 and parameters: {'n_estimators': 377, 'min_samples_split': 5, 'max_features': 0.75, 'min_samples_leaf': 1, 'criterion': 'poisson', 'max_depth': 45, 'min_weight_fraction_leaf': 0.0, 'max_leaf_nodes': 300, 'bootstrap': False, 'ccp_alpha': 0.018000000000000002}. Best is trial 4065 with value: 0.057524275121161005.
[I 2025-04-16 02:16:43,188] Trial 4411 finished with value: -0.13124944151821108 and parameters: {'n_estimators': 206, 'min_samples_split': 12, 'max_features': 0.81, 'min_samples_leaf': 3, 'criterion': 'absolute_error', 'max_depth': 15, 'min_weight_fraction_leaf': 0.0, 'max_leaf_nodes': 300, 'bootstrap': False, 'ccp_alpha': 0.005}. Best is trial 4065 with value: 0.057524275121161005.
[I 2025-04-16 02:16:44,606] Trial 4412 finished with value: -0.1936417107583833 and parameters: {'n_estimators': 699, 'min_samples_split': 9, 'max_features': 0.7000000000000001, 'min_samples_leaf': 5, 'criterion': 'absolute_error', 'max_depth': 15, 'min_weight_fraction_leaf': 0.0, 'max_leaf_nodes': 300, 'bootstrap': False, 'ccp_alpha': 0.009000000000000001}. Best is trial 4065 with value: 0.057524275121161005.
[I 2025-04-16 02:16:45,517] Trial 4413 finished with value: -33.93675082892868 and parameters: {'n_estimators': 323, 'min_samples_split': 2, 'max_features': 0.78, 'min_samples_leaf': 1, 'criterion': 'absolute_error', 'max_depth': 15, 'min_weight_fraction_leaf': 0.0, 'max_leaf_nodes': 300, 'bootstrap': False, 'ccp_alpha': 0.0}. Best is trial 4065 with value: 0.057524275121161005.
[I 2025-04-16 02:16:47,094] Trial 4414 finished with value: -0.1936417107583833 and parameters: {'n_estimators': 976, 'min_samples_split': 5, 'max_features': 0.73, 'min_samples_leaf': 3, 'criterion': 'absolute_error', 'max_depth': 15, 'min_weight_fraction_leaf': 0.0, 'max_leaf_nodes': 300, 'bootstrap': False, 'ccp_alpha': 0.017}. Best is trial 4065 with value: 0.057524275121161005.
[I 2025-04-16 02:16:48,333] Trial 4415 finished with value: 0.057046338838274965 and parameters: {'n_estimators': 510, 'min_samples_split': 2, 'max_features': 0.8300000000000001, 'min_samples_leaf': 1, 'criterion': 'absolute_error', 'max_depth': 15, 'min_weight_fraction_leaf': 0.0, 'max_leaf_nodes': None, 'bootstrap': False, 'ccp_alpha': 0.005}. Best is trial 4065 with value: 0.057524275121161005.
[I 2025-04-16 02:16:49,906] Trial 4416 finished with value: -0.1936417107583833 and parameters: {'n_estimators': 852, 'min_samples_split': 9, 'max_features': 0.8400000000000001, 'min_samples_leaf': 5, 'criterion': 'absolute_error', 'max_depth': 10, 'min_weight_fraction_leaf': 0.0, 'max_leaf_nodes': None, 'bootstrap': False, 'ccp_alpha': 0.027}. Best is trial 4065 with value: 0.057524275121161005.
[I 2025-04-16 02:16:51,328] Trial 4417 finished with value: -0.1936417107583833 and parameters: {'n_estimators': 930, 'min_samples_split': 13, 'max_features': 0.8200000000000001, 'min_samples_leaf': 3, 'criterion': 'absolute_error', 'max_depth': 15, 'min_weight_fraction_leaf': 0.0, 'max_leaf_nodes': None, 'bootstrap': False, 'ccp_alpha': 0.013000000000000001}. Best is trial 4065 with value: 0.057524275121161005.
[I 2025-04-16 02:16:52,542] Trial 4418 finished with value: 0.056325817470121865 and parameters: {'n_estimators': 826, 'min_samples_split': 2, 'max_features': 0.8400000000000001, 'min_samples_leaf': 1, 'criterion': 'absolute_error', 'max_depth': 15, 'min_weight_fraction_leaf': 0.0, 'max_leaf_nodes': None, 'bootstrap': False, 'ccp_alpha': 0.005}. Best is trial 4065 with value: 0.057524275121161005.
[I 2025-04-16 02:16:53,954] Trial 4419 finished with value: -0.1936417107583833 and parameters: {'n_estimators': 1014, 'min_samples_split': 6, 'max_features': 0.8400000000000001, 'min_samples_leaf': 4, 'criterion': 'absolute_error', 'max_depth': 15, 'min_weight_fraction_leaf': 0.0, 'max_leaf_nodes': None, 'bootstrap': False, 'ccp_alpha': 0.01}. Best is trial 4065 with value: 0.057524275121161005.
[I 2025-04-16 02:16:55,584] Trial 4420 finished with value: -9.411876316495817 and parameters: {'n_estimators': 1116, 'min_samples_split': 9, 'max_features': 0.8400000000000001, 'min_samples_leaf': 6, 'criterion': 'absolute_error', 'max_depth': 15, 'min_weight_fraction_leaf': 0.0, 'max_leaf_nodes': None, 'bootstrap': False, 'ccp_alpha': 0.0}. Best is trial 4065 with value: 0.057524275121161005.
[I 2025-04-16 02:16:57,136] Trial 4421 finished with value: -17.528986382276027 and parameters: {'n_estimators': 1223, 'min_samples_split': 2, 'max_features': 0.8200000000000001, 'min_samples_leaf': 1, 'criterion': 'friedman_mse', 'max_depth': 15, 'min_weight_fraction_leaf': 0.0, 'max_leaf_nodes': None, 'bootstrap': False, 'ccp_alpha': 0.02}. Best is trial 4065 with value: 0.057524275121161005.
[I 2025-04-16 02:16:58,725] Trial 4422 finished with value: -0.1936417107583833 and parameters: {'n_estimators': 1200, 'min_samples_split': 6, 'max_features': 0.8200000000000001, 'min_samples_leaf': 3, 'criterion': 'absolute_error', 'max_depth': 15, 'min_weight_fraction_leaf': 0.0, 'max_leaf_nodes': None, 'bootstrap': False, 'ccp_alpha': 0.01}. Best is trial 4065 with value: 0.057524275121161005.
[I 2025-04-16 02:17:00,276] Trial 4423 finished with value: -0.1936417107583833 and parameters: {'n_estimators': 1121, 'min_samples_split': 13, 'max_features': 0.8400000000000001, 'min_samples_leaf': 1, 'criterion': 'absolute_error', 'max_depth': 15, 'min_weight_fraction_leaf': 0.0, 'max_leaf_nodes': None, 'bootstrap': False, 'ccp_alpha': 0.006}. Best is trial 4065 with value: 0.057524275121161005.
[I 2025-04-16 02:17:01,823] Trial 4424 finished with value: -0.1936417107583833 and parameters: {'n_estimators': 1169, 'min_samples_split': 5, 'max_features': 0.8400000000000001, 'min_samples_leaf': 3, 'criterion': 'absolute_error', 'max_depth': 15, 'min_weight_fraction_leaf': 0.0, 'max_leaf_nodes': None, 'bootstrap': False, 'ccp_alpha': 0.014}. Best is trial 4065 with value: 0.057524275121161005.
[I 2025-04-16 02:17:03,157] Trial 4425 finished with value: -0.1936417107583833 and parameters: {'n_estimators': 925, 'min_samples_split': 8, 'max_features': 0.8300000000000001, 'min_samples_leaf': 6, 'criterion': 'absolute_error', 'max_depth': 15, 'min_weight_fraction_leaf': 0.0, 'max_leaf_nodes': None, 'bootstrap': False, 'ccp_alpha': 0.009000000000000001}. Best is trial 4065 with value: 0.057524275121161005.
[I 2025-04-16 02:17:04,404] Trial 4426 finished with value: -0.08906288517368803 and parameters: {'n_estimators': 834, 'min_samples_split': 2, 'max_features': 0.8400000000000001, 'min_samples_leaf': 4, 'criterion': 'absolute_error', 'max_depth': 15, 'min_weight_fraction_leaf': 0.0, 'max_leaf_nodes': 50, 'bootstrap': False, 'ccp_alpha': 0.005}. Best is trial 4065 with value: 0.057524275121161005.
[I 2025-04-16 02:17:05,848] Trial 4427 finished with value: -0.1936417107583833 and parameters: {'n_estimators': 962, 'min_samples_split': 9, 'max_features': 0.8400000000000001, 'min_samples_leaf': 1, 'criterion': 'absolute_error', 'max_depth': 15, 'min_weight_fraction_leaf': 0.0, 'max_leaf_nodes': None, 'bootstrap': False, 'ccp_alpha': 0.018000000000000002}. Best is trial 4065 with value: 0.057524275121161005.
[I 2025-04-16 02:17:07,091] Trial 4428 finished with value: -0.1936417107583833 and parameters: {'n_estimators': 803, 'min_samples_split': 120, 'max_features': 0.8400000000000001, 'min_samples_leaf': 3, 'criterion': 'absolute_error', 'max_depth': 15, 'min_weight_fraction_leaf': 0.0, 'max_leaf_nodes': None, 'bootstrap': False, 'ccp_alpha': 0.265}. Best is trial 4065 with value: 0.057524275121161005.
[I 2025-04-16 02:17:08,501] Trial 4429 finished with value: -15.82655416738188 and parameters: {'n_estimators': 1030, 'min_samples_split': 13, 'max_features': 0.8400000000000001, 'min_samples_leaf': 1, 'criterion': 'squared_error', 'max_depth': 15, 'min_weight_fraction_leaf': 0.0, 'max_leaf_nodes': None, 'bootstrap': False, 'ccp_alpha': 0.0}. Best is trial 4065 with value: 0.057524275121161005.
[I 2025-04-16 02:17:09,753] Trial 4430 finished with value: -0.1936417107583833 and parameters: {'n_estimators': 831, 'min_samples_split': 5, 'max_features': 0.8400000000000001, 'min_samples_leaf': 5, 'criterion': 'absolute_error', 'max_depth': 15, 'min_weight_fraction_leaf': 0.0, 'max_leaf_nodes': None, 'bootstrap': False, 'ccp_alpha': 0.013000000000000001}. Best is trial 4065 with value: 0.057524275121161005.
[I 2025-04-16 02:17:10,989] Trial 4431 finished with value: -0.0032399406250188225 and parameters: {'n_estimators': 716, 'min_samples_split': 6, 'max_features': 0.8400000000000001, 'min_samples_leaf': 3, 'criterion': 'absolute_error', 'max_depth': 15, 'min_weight_fraction_leaf': 0.0, 'max_leaf_nodes': None, 'bootstrap': False, 'ccp_alpha': 0.006}. Best is trial 4065 with value: 0.057524275121161005.
[I 2025-04-16 02:17:12,327] Trial 4432 finished with value: -9.443407698673514 and parameters: {'n_estimators': 1037, 'min_samples_split': 2, 'max_features': 0.8400000000000001, 'min_samples_leaf': 6, 'criterion': 'absolute_error', 'max_depth': 45, 'min_weight_fraction_leaf': 0.0, 'max_leaf_nodes': None, 'bootstrap': False, 'ccp_alpha': 0.0}. Best is trial 4065 with value: 0.057524275121161005.
[I 2025-04-16 02:17:13,840] Trial 4433 finished with value: -0.1936417107583833 and parameters: {'n_estimators': 1174, 'min_samples_split': 9, 'max_features': 0.8200000000000001, 'min_samples_leaf': 1, 'criterion': 'absolute_error', 'max_depth': 20, 'min_weight_fraction_leaf': 0.0, 'max_leaf_nodes': None, 'bootstrap': False, 'ccp_alpha': 0.024}. Best is trial 4065 with value: 0.057524275121161005.
[I 2025-04-16 02:17:15,023] Trial 4434 finished with value: -0.1936417107583833 and parameters: {'n_estimators': 750, 'min_samples_split': 2, 'max_features': 0.8200000000000001, 'min_samples_leaf': 3, 'criterion': 'absolute_error', 'max_depth': 15, 'min_weight_fraction_leaf': 0.0, 'max_leaf_nodes': None, 'bootstrap': False, 'ccp_alpha': 0.014}. Best is trial 4065 with value: 0.057524275121161005.
[I 2025-04-16 02:17:16,263] Trial 4435 finished with value: -0.1936417107583833 and parameters: {'n_estimators': 719, 'min_samples_split': 12, 'max_features': 0.81, 'min_samples_leaf': 1, 'criterion': 'absolute_error', 'max_depth': 15, 'min_weight_fraction_leaf': 0.0, 'max_leaf_nodes': None, 'bootstrap': False, 'ccp_alpha': 0.178}. Best is trial 4065 with value: 0.057524275121161005.
[I 2025-04-16 02:17:17,436] Trial 4436 finished with value: -0.09230549855048673 and parameters: {'n_estimators': 634, 'min_samples_split': 6, 'max_features': 0.8200000000000001, 'min_samples_leaf': 5, 'criterion': 'absolute_error', 'max_depth': 15, 'min_weight_fraction_leaf': 0.0, 'max_leaf_nodes': None, 'bootstrap': False, 'ccp_alpha': 0.005}. Best is trial 4065 with value: 0.057524275121161005.
[I 2025-04-16 02:17:18,868] Trial 4437 finished with value: -0.1936417107583833 and parameters: {'n_estimators': 907, 'min_samples_split': 9, 'max_features': 0.8400000000000001, 'min_samples_leaf': 3, 'criterion': 'absolute_error', 'max_depth': 15, 'min_weight_fraction_leaf': 0.0, 'max_leaf_nodes': None, 'bootstrap': False, 'ccp_alpha': 0.011}. Best is trial 4065 with value: 0.057524275121161005.
[I 2025-04-16 02:17:20,396] Trial 4438 finished with value: -18.741649286643955 and parameters: {'n_estimators': 798, 'min_samples_split': 2, 'max_features': 0.8200000000000001, 'min_samples_leaf': 1, 'criterion': 'poisson', 'max_depth': 15, 'min_weight_fraction_leaf': 0.0, 'max_leaf_nodes': None, 'bootstrap': False, 'ccp_alpha': 0.005}. Best is trial 4065 with value: 0.057524275121161005.
[I 2025-04-16 02:17:21,522] Trial 4439 finished with value: -0.1936417107583833 and parameters: {'n_estimators': 610, 'min_samples_split': 6, 'max_features': 0.8400000000000001, 'min_samples_leaf': 4, 'criterion': 'absolute_error', 'max_depth': 15, 'min_weight_fraction_leaf': 0.0, 'max_leaf_nodes': None, 'bootstrap': False, 'ccp_alpha': 0.019}. Best is trial 4065 with value: 0.057524275121161005.
[I 2025-04-16 02:17:23,054] Trial 4440 finished with value: -9.427770497750933 and parameters: {'n_estimators': 1169, 'min_samples_split': 13, 'max_features': 0.81, 'min_samples_leaf': 6, 'criterion': 'absolute_error', 'max_depth': 15, 'min_weight_fraction_leaf': 0.0, 'max_leaf_nodes': None, 'bootstrap': False, 'ccp_alpha': 0.0}. Best is trial 4065 with value: 0.057524275121161005.
[I 2025-04-16 02:17:24,175] Trial 4441 finished with value: -0.1936417107583833 and parameters: {'n_estimators': 617, 'min_samples_split': 6, 'max_features': 0.8400000000000001, 'min_samples_leaf': 3, 'criterion': 'absolute_error', 'max_depth': 15, 'min_weight_fraction_leaf': 0.0, 'max_leaf_nodes': None, 'bootstrap': False, 'ccp_alpha': 0.01}. Best is trial 4065 with value: 0.057524275121161005.
[I 2025-04-16 02:17:25,563] Trial 4442 finished with value: -0.007326515014780544 and parameters: {'n_estimators': 929, 'min_samples_split': 2, 'max_features': 0.81, 'min_samples_leaf': 1, 'criterion': 'absolute_error', 'max_depth': 15, 'min_weight_fraction_leaf': 0.0, 'max_leaf_nodes': None, 'bootstrap': False, 'ccp_alpha': 0.006}. Best is trial 4065 with value: 0.057524275121161005.
[I 2025-04-16 02:17:26,537] Trial 4443 finished with value: -0.1936417107583833 and parameters: {'n_estimators': 530, 'min_samples_split': 9, 'max_features': 0.81, 'min_samples_leaf': 48, 'criterion': 'absolute_error', 'max_depth': 15, 'min_weight_fraction_leaf': 0.0, 'max_leaf_nodes': None, 'bootstrap': False, 'ccp_alpha': 0.016}. Best is trial 4065 with value: 0.057524275121161005.
[I 2025-04-16 02:17:27,793] Trial 4444 finished with value: -0.1936417107583833 and parameters: {'n_estimators': 740, 'min_samples_split': 5, 'max_features': 0.8400000000000001, 'min_samples_leaf': 3, 'criterion': 'absolute_error', 'max_depth': 15, 'min_weight_fraction_leaf': 0.0, 'max_leaf_nodes': None, 'bootstrap': False, 'ccp_alpha': 0.009000000000000001}. Best is trial 4065 with value: 0.057524275121161005.
[I 2025-04-16 02:17:28,786] Trial 4445 finished with value: -9.753287783912395 and parameters: {'n_estimators': 562, 'min_samples_split': 2, 'max_features': 0.8200000000000001, 'min_samples_leaf': 1, 'criterion': 'friedman_mse', 'max_depth': 10, 'min_weight_fraction_leaf': 0.0, 'max_leaf_nodes': None, 'bootstrap': False, 'ccp_alpha': 0.0}. Best is trial 4065 with value: 0.057524275121161005.
[I 2025-04-16 02:17:30,179] Trial 4446 finished with value: -0.1936417107583833 and parameters: {'n_estimators': 990, 'min_samples_split': 13, 'max_features': 0.8, 'min_samples_leaf': 5, 'criterion': 'absolute_error', 'max_depth': 15, 'min_weight_fraction_leaf': 0.0, 'max_leaf_nodes': None, 'bootstrap': False, 'ccp_alpha': 0.014}. Best is trial 4065 with value: 0.057524275121161005.
[I 2025-04-16 02:17:31,768] Trial 4447 finished with value: -0.1936417107583833 and parameters: {'n_estimators': 1197, 'min_samples_split': 9, 'max_features': 0.8400000000000001, 'min_samples_leaf': 3, 'criterion': 'absolute_error', 'max_depth': 15, 'min_weight_fraction_leaf': 0.0, 'max_leaf_nodes': None, 'bootstrap': False, 'ccp_alpha': 0.029}. Best is trial 4065 with value: 0.057524275121161005.
[I 2025-04-16 02:17:33,000] Trial 4448 finished with value: -0.1936417107583833 and parameters: {'n_estimators': 776, 'min_samples_split': 6, 'max_features': 0.8, 'min_samples_leaf': 1, 'criterion': 'absolute_error', 'max_depth': 15, 'min_weight_fraction_leaf': 0.0, 'max_leaf_nodes': None, 'bootstrap': False, 'ccp_alpha': 0.023}. Best is trial 4065 with value: 0.057524275121161005.
[I 2025-04-16 02:17:34,059] Trial 4449 finished with value: -0.1936417107583833 and parameters: {'n_estimators': 582, 'min_samples_split': 128, 'max_features': 0.8200000000000001, 'min_samples_leaf': 6, 'criterion': 'absolute_error', 'max_depth': 15, 'min_weight_fraction_leaf': 0.0, 'max_leaf_nodes': None, 'bootstrap': False, 'ccp_alpha': 0.005}. Best is trial 4065 with value: 0.057524275121161005.
[I 2025-04-16 02:17:35,061] Trial 4450 finished with value: -0.1936417107583833 and parameters: {'n_estimators': 499, 'min_samples_split': 2, 'max_features': 0.8300000000000001, 'min_samples_leaf': 4, 'criterion': 'absolute_error', 'max_depth': 15, 'min_weight_fraction_leaf': 0.0, 'max_leaf_nodes': None, 'bootstrap': False, 'ccp_alpha': 0.01}. Best is trial 4065 with value: 0.057524275121161005.
[I 2025-04-16 02:17:36,351] Trial 4451 finished with value: -0.04346745257588451 and parameters: {'n_estimators': 856, 'min_samples_split': 9, 'max_features': 0.8, 'min_samples_leaf': 1, 'criterion': 'absolute_error', 'max_depth': 15, 'min_weight_fraction_leaf': 0.0, 'max_leaf_nodes': None, 'bootstrap': False, 'ccp_alpha': 0.005}. Best is trial 4065 with value: 0.057524275121161005.
[I 2025-04-16 02:17:37,369] Trial 4452 finished with value: -0.1936417107583833 and parameters: {'n_estimators': 483, 'min_samples_split': 6, 'max_features': 0.8400000000000001, 'min_samples_leaf': 3, 'criterion': 'absolute_error', 'max_depth': 15, 'min_weight_fraction_leaf': 0.0, 'max_leaf_nodes': None, 'bootstrap': False, 'ccp_alpha': 0.017}. Best is trial 4065 with value: 0.057524275121161005.
[I 2025-04-16 02:17:38,547] Trial 4453 finished with value: -0.0598567519930366 and parameters: {'n_estimators': 729, 'min_samples_split': 13, 'max_features': 0.8, 'min_samples_leaf': 5, 'criterion': 'absolute_error', 'max_depth': 15, 'min_weight_fraction_leaf': 0.0, 'max_leaf_nodes': None, 'bootstrap': False, 'ccp_alpha': 0.005}. Best is trial 4065 with value: 0.057524275121161005.
[I 2025-04-16 02:17:39,617] Trial 4454 finished with value: -0.1936417107583833 and parameters: {'n_estimators': 534, 'min_samples_split': 2, 'max_features': 0.8300000000000001, 'min_samples_leaf': 1, 'criterion': 'absolute_error', 'max_depth': 20, 'min_weight_fraction_leaf': 0.0, 'max_leaf_nodes': None, 'bootstrap': False, 'ccp_alpha': 0.011}. Best is trial 4065 with value: 0.057524275121161005.
[I 2025-04-16 02:17:40,534] Trial 4455 finished with value: -17.528986382274876 and parameters: {'n_estimators': 431, 'min_samples_split': 9, 'max_features': 0.8200000000000001, 'min_samples_leaf': 3, 'criterion': 'squared_error', 'max_depth': 15, 'min_weight_fraction_leaf': 0.0, 'max_leaf_nodes': None, 'bootstrap': False, 'ccp_alpha': 0.005}. Best is trial 4065 with value: 0.057524275121161005.
[I 2025-04-16 02:17:42,182] Trial 4456 finished with value: -0.1936417107583833 and parameters: {'n_estimators': 1041, 'min_samples_split': 6, 'max_features': 0.8, 'min_samples_leaf': 6, 'criterion': 'absolute_error', 'max_depth': 45, 'min_weight_fraction_leaf': 0.0, 'max_leaf_nodes': None, 'bootstrap': False, 'ccp_alpha': 0.021}. Best is trial 4065 with value: 0.057524275121161005.
[I 2025-04-16 02:17:43,392] Trial 4457 finished with value: -11.5386524339546 and parameters: {'n_estimators': 764, 'min_samples_split': 2, 'max_features': 0.8200000000000001, 'min_samples_leaf': 3, 'criterion': 'absolute_error', 'max_depth': 15, 'min_weight_fraction_leaf': 0.0, 'max_leaf_nodes': None, 'bootstrap': False, 'ccp_alpha': 0.0}. Best is trial 4065 with value: 0.057524275121161005.
[I 2025-04-16 02:17:44,491] Trial 4458 finished with value: -0.1936417107583833 and parameters: {'n_estimators': 648, 'min_samples_split': 12, 'max_features': 0.8400000000000001, 'min_samples_leaf': 51, 'criterion': 'absolute_error', 'max_depth': 15, 'min_weight_fraction_leaf': 0.0, 'max_leaf_nodes': 50, 'bootstrap': False, 'ccp_alpha': 0.014}. Best is trial 4065 with value: 0.057524275121161005.
[I 2025-04-16 02:17:45,466] Trial 4459 finished with value: -19.585710896096952 and parameters: {'n_estimators': 434, 'min_samples_split': 6, 'max_features': 0.8, 'min_samples_leaf': 1, 'criterion': 'poisson', 'max_depth': 15, 'min_weight_fraction_leaf': 0.0, 'max_leaf_nodes': None, 'bootstrap': False, 'ccp_alpha': 0.01}. Best is trial 4065 with value: 0.057524275121161005.
