[I 2025-04-16 02:14:15,935] Trial 4293 finished with value: -10.379203099246602 and parameters: {'n_estimators': 183, 'min_samples_split': 12, 'max_features': 0.68, 'min_samples_leaf': 3, 'criterion': 'absolute_error', 'max_depth': 15, 'min_weight_fraction_leaf': 0.0, 'max_leaf_nodes': 300, 'bootstrap': False, 'ccp_alpha': 0.0}. Best is trial 4065 with value: 0.057524275121161005.
[I 2025-04-16 02:14:16,845] Trial 4294 finished with value: -0.1936417107583833 and parameters: {'n_estimators': 345, 'min_samples_split': 2, 'max_features': 0.79, 'min_samples_leaf': 1, 'criterion': 'absolute_error', 'max_depth': 15, 'min_weight_fraction_leaf': 0.05, 'max_leaf_nodes': 300, 'bootstrap': False, 'ccp_alpha': 0.016}. Best is trial 4065 with value: 0.057524275121161005.
[I 2025-04-16 02:14:18,194] Trial 4295 finished with value: -0.1936417107583833 and parameters: {'n_estimators': 789, 'min_samples_split': 9, 'max_features': 0.73, 'min_samples_leaf': 5, 'criterion': 'absolute_error', 'max_depth': 15, 'min_weight_fraction_leaf': 0.0, 'max_leaf_nodes': 300, 'bootstrap': False, 'ccp_alpha': 0.01}. Best is trial 4065 with value: 0.057524275121161005.
[I 2025-04-16 02:14:19,272] Trial 4296 finished with value: -14.800195351472905 and parameters: {'n_estimators': 543, 'min_samples_split': 6, 'max_features': 0.76, 'min_samples_leaf': 3, 'criterion': 'absolute_error', 'max_depth': 15, 'min_weight_fraction_leaf': 0.0, 'max_leaf_nodes': 300, 'bootstrap': False, 'ccp_alpha': 0.0}. Best is trial 4065 with value: 0.057524275121161005.
[I 2025-04-16 02:14:20,063] Trial 4297 finished with value: -0.1936417107583833 and parameters: {'n_estimators': 172, 'min_samples_split': 12, 'max_features': 0.8200000000000001, 'min_samples_leaf': 1, 'criterion': 'absolute_error', 'max_depth': 15, 'min_weight_fraction_leaf': 0.0, 'max_leaf_nodes': 300, 'bootstrap': False, 'ccp_alpha': 0.014}. Best is trial 4065 with value: 0.057524275121161005.
[I 2025-04-16 02:14:20,621] Trial 4298 finished with value: -0.1936417107583833 and parameters: {'n_estimators': 1, 'min_samples_split': 2, 'max_features': 0.74, 'min_samples_leaf': 6, 'criterion': 'absolute_error', 'max_depth': 15, 'min_weight_fraction_leaf': 0.0, 'max_leaf_nodes': 300, 'bootstrap': False, 'ccp_alpha': 0.006}. Best is trial 4065 with value: 0.057524275121161005.
[I 2025-04-16 02:14:21,525] Trial 4299 finished with value: -17.528986382274873 and parameters: {'n_estimators': 466, 'min_samples_split': 6, 'max_features': 0.7100000000000001, 'min_samples_leaf': 3, 'criterion': 'friedman_mse', 'max_depth': 20, 'min_weight_fraction_leaf': 0.0, 'max_leaf_nodes': 50, 'bootstrap': False, 'ccp_alpha': 0.021}. Best is trial 4065 with value: 0.057524275121161005.
[I 2025-04-16 02:14:22,611] Trial 4300 finished with value: -0.1936417107583833 and parameters: {'n_estimators': 631, 'min_samples_split': 9, 'max_features': 0.79, 'min_samples_leaf': 1, 'criterion': 'absolute_error', 'max_depth': 15, 'min_weight_fraction_leaf': 0.0, 'max_leaf_nodes': 300, 'bootstrap': False, 'ccp_alpha': 0.011}. Best is trial 4065 with value: 0.057524275121161005.
[I 2025-04-16 02:14:23,421] Trial 4301 finished with value: -0.13524552602826398 and parameters: {'n_estimators': 311, 'min_samples_split': 2, 'max_features': 0.6900000000000001, 'min_samples_leaf': 5, 'criterion': 'absolute_error', 'max_depth': 15, 'min_weight_fraction_leaf': 0.0, 'max_leaf_nodes': 300, 'bootstrap': False, 'ccp_alpha': 0.005}. Best is trial 4065 with value: 0.057524275121161005.
[I 2025-04-16 02:14:24,002] Trial 4302 finished with value: -17.488567049780023 and parameters: {'n_estimators': 3, 'min_samples_split': 6, 'max_features': 0.77, 'min_samples_leaf': 3, 'criterion': 'absolute_error', 'max_depth': 15, 'min_weight_fraction_leaf': 0.0, 'max_leaf_nodes': 300, 'bootstrap': False, 'ccp_alpha': 0.0}. Best is trial 4065 with value: 0.057524275121161005.
[I 2025-04-16 02:14:25,193] Trial 4303 finished with value: -0.1936417107583833 and parameters: {'n_estimators': 796, 'min_samples_split': 12, 'max_features': 0.8400000000000001, 'min_samples_leaf': 1, 'criterion': 'absolute_error', 'max_depth': 15, 'min_weight_fraction_leaf': 0.0, 'max_leaf_nodes': 300, 'bootstrap': False, 'ccp_alpha': 0.027}. Best is trial 4065 with value: 0.057524275121161005.
[I 2025-04-16 02:14:31,568] Trial 4304 finished with value: -0.1936417107583833 and parameters: {'n_estimators': 6103, 'min_samples_split': 5, 'max_features': 0.73, 'min_samples_leaf': 3, 'criterion': 'absolute_error', 'max_depth': 15, 'min_weight_fraction_leaf': 0.0, 'max_leaf_nodes': 300, 'bootstrap': False, 'ccp_alpha': 0.018000000000000002}. Best is trial 4065 with value: 0.057524275121161005.
[I 2025-04-16 02:14:32,491] Trial 4305 finished with value: -0.1936417107583833 and parameters: {'n_estimators': 440, 'min_samples_split': 9, 'max_features': 0.75, 'min_samples_leaf': 6, 'criterion': 'absolute_error', 'max_depth': 10, 'min_weight_fraction_leaf': 0.0, 'max_leaf_nodes': 10, 'bootstrap': False, 'ccp_alpha': 0.009000000000000001}. Best is trial 4065 with value: 0.057524275121161005.
[I 2025-04-16 02:14:33,062] Trial 4306 finished with value: -0.1936417107583833 and parameters: {'n_estimators': 2, 'min_samples_split': 2, 'max_features': 0.81, 'min_samples_leaf': 1, 'criterion': 'absolute_error', 'max_depth': 15, 'min_weight_fraction_leaf': 0.0, 'max_leaf_nodes': 300, 'bootstrap': False, 'ccp_alpha': 0.014}. Best is trial 4065 with value: 0.057524275121161005.
[I 2025-04-16 02:14:34,116] Trial 4307 finished with value: -0.10099170427092445 and parameters: {'n_estimators': 647, 'min_samples_split': 6, 'max_features': 0.65, 'min_samples_leaf': 4, 'criterion': 'absolute_error', 'max_depth': 15, 'min_weight_fraction_leaf': 0.0, 'max_leaf_nodes': 300, 'bootstrap': False, 'ccp_alpha': 0.005}. Best is trial 4065 with value: 0.057524275121161005.
[I 2025-04-16 02:14:34,924] Trial 4308 finished with value: -13.67327468089728 and parameters: {'n_estimators': 301, 'min_samples_split': 12, 'max_features': 0.7100000000000001, 'min_samples_leaf': 3, 'criterion': 'squared_error', 'max_depth': 15, 'min_weight_fraction_leaf': 0.0, 'max_leaf_nodes': 300, 'bootstrap': False, 'ccp_alpha': 0.0}. Best is trial 4065 with value: 0.057524275121161005.
[I 2025-04-16 02:14:36,168] Trial 4309 finished with value: -0.1936417107583833 and parameters: {'n_estimators': 784, 'min_samples_split': 2, 'max_features': 0.77, 'min_samples_leaf': 5, 'criterion': 'absolute_error', 'max_depth': 15, 'min_weight_fraction_leaf': 0.0, 'max_leaf_nodes': 300, 'bootstrap': False, 'ccp_alpha': 0.009000000000000001}. Best is trial 4065 with value: 0.057524275121161005.
[I 2025-04-16 02:14:37,147] Trial 4310 finished with value: -0.1936417107583833 and parameters: {'n_estimators': 515, 'min_samples_split': 9, 'max_features': 0.81, 'min_samples_leaf': 1, 'criterion': 'absolute_error', 'max_depth': 15, 'min_weight_fraction_leaf': 0.0, 'max_leaf_nodes': 300, 'bootstrap': False, 'ccp_alpha': 0.018000000000000002}. Best is trial 4065 with value: 0.057524275121161005.
[I 2025-04-16 02:14:45,137] Trial 4311 finished with value: -0.006365012981459195 and parameters: {'n_estimators': 8037, 'min_samples_split': 6, 'max_features': 0.73, 'min_samples_leaf': 3, 'criterion': 'absolute_error', 'max_depth': 15, 'min_weight_fraction_leaf': 0.0, 'max_leaf_nodes': 300, 'bootstrap': False, 'ccp_alpha': 0.006}. Best is trial 4065 with value: 0.057524275121161005.
[I 2025-04-16 02:14:45,916] Trial 4312 finished with value: -0.1936417107583833 and parameters: {'n_estimators': 250, 'min_samples_split': 2, 'max_features': 0.67, 'min_samples_leaf': 1, 'criterion': 'absolute_error', 'max_depth': 15, 'min_weight_fraction_leaf': 0.0, 'max_leaf_nodes': 50, 'bootstrap': False, 'ccp_alpha': 0.013000000000000001}. Best is trial 4065 with value: 0.057524275121161005.
[I 2025-04-16 02:14:46,930] Trial 4313 finished with value: -7.543649132832011 and parameters: {'n_estimators': 603, 'min_samples_split': 13, 'max_features': 0.79, 'min_samples_leaf': 6, 'criterion': 'absolute_error', 'max_depth': 15, 'min_weight_fraction_leaf': 0.0, 'max_leaf_nodes': 300, 'bootstrap': False, 'ccp_alpha': 0.0}. Best is trial 4065 with value: 0.057524275121161005.
[I 2025-04-16 02:14:47,802] Trial 4314 finished with value: -21.91886259582906 and parameters: {'n_estimators': 323, 'min_samples_split': 9, 'max_features': 0.8300000000000001, 'min_samples_leaf': 3, 'criterion': 'poisson', 'max_depth': 15, 'min_weight_fraction_leaf': 0.0, 'max_leaf_nodes': 300, 'bootstrap': False, 'ccp_alpha': 0.006}. Best is trial 4065 with value: 0.057524275121161005.
[I 2025-04-16 02:14:49,180] Trial 4315 finished with value: -0.1936417107583833 and parameters: {'n_estimators': 864, 'min_samples_split': 6, 'max_features': 0.75, 'min_samples_leaf': 1, 'criterion': 'absolute_error', 'max_depth': 15, 'min_weight_fraction_leaf': 0.0, 'max_leaf_nodes': None, 'bootstrap': False, 'ccp_alpha': 0.01}. Best is trial 4065 with value: 0.057524275121161005.
[I 2025-04-16 02:14:50,148] Trial 4316 finished with value: -0.1936417107583833 and parameters: {'n_estimators': 471, 'min_samples_split': 2, 'max_features': 0.6900000000000001, 'min_samples_leaf': 4, 'criterion': 'absolute_error', 'max_depth': 15, 'min_weight_fraction_leaf': 0.0, 'max_leaf_nodes': 300, 'bootstrap': False, 'ccp_alpha': 0.02}. Best is trial 4065 with value: 0.057524275121161005.
[I 2025-04-16 02:14:50,867] Trial 4317 finished with value: -0.1936417107583833 and parameters: {'n_estimators': 196, 'min_samples_split': 6, 'max_features': 0.72, 'min_samples_leaf': 1, 'criterion': 'absolute_error', 'max_depth': 15, 'min_weight_fraction_leaf': 0.0, 'max_leaf_nodes': 300, 'bootstrap': False, 'ccp_alpha': 0.013000000000000001}. Best is trial 4065 with value: 0.057524275121161005.
[I 2025-04-16 02:14:55,811] Trial 4318 finished with value: -0.11361383397020111 and parameters: {'n_estimators': 5644, 'min_samples_split': 9, 'max_features': 0.76, 'min_samples_leaf': 5, 'criterion': 'absolute_error', 'max_depth': 15, 'min_weight_fraction_leaf': 0.0, 'max_leaf_nodes': 300, 'bootstrap': False, 'ccp_alpha': 0.005}. Best is trial 4065 with value: 0.057524275121161005.
[I 2025-04-16 02:14:56,376] Trial 4319 finished with value: -0.1936417107583833 and parameters: {'n_estimators': 1, 'min_samples_split': 13, 'max_features': 0.79, 'min_samples_leaf': 3, 'criterion': 'absolute_error', 'max_depth': 20, 'min_weight_fraction_leaf': 0.0, 'max_leaf_nodes': 300, 'bootstrap': False, 'ccp_alpha': 0.039}. Best is trial 4065 with value: 0.057524275121161005.
[I 2025-04-16 02:15:05,299] Trial 4320 finished with value: 0.027130897113198004 and parameters: {'n_estimators': 9434, 'min_samples_split': 5, 'max_features': 0.7000000000000001, 'min_samples_leaf': 1, 'criterion': 'absolute_error', 'max_depth': 15, 'min_weight_fraction_leaf': 0.0, 'max_leaf_nodes': 300, 'bootstrap': False, 'ccp_alpha': 0.005}. Best is trial 4065 with value: 0.057524275121161005.
[I 2025-04-16 02:15:06,350] Trial 4321 finished with value: -3.8626994390117466 and parameters: {'n_estimators': 622, 'min_samples_split': 2, 'max_features': 0.46, 'min_samples_leaf': 6, 'criterion': 'absolute_error', 'max_depth': 15, 'min_weight_fraction_leaf': 0.0, 'max_leaf_nodes': 300, 'bootstrap': False, 'ccp_alpha': 0.0}. Best is trial 4065 with value: 0.057524275121161005.
[I 2025-04-16 02:15:07,253] Trial 4322 finished with value: -0.1936417107583833 and parameters: {'n_estimators': 387, 'min_samples_split': 9, 'max_features': 0.74, 'min_samples_leaf': 3, 'criterion': 'absolute_error', 'max_depth': 15, 'min_weight_fraction_leaf': 0.0, 'max_leaf_nodes': 300, 'bootstrap': False, 'ccp_alpha': 0.015}. Best is trial 4065 with value: 0.057524275121161005.
[I 2025-04-16 02:15:08,528] Trial 4323 finished with value: -17.5289863822753 and parameters: {'n_estimators': 862, 'min_samples_split': 6, 'max_features': 0.81, 'min_samples_leaf': 1, 'criterion': 'friedman_mse', 'max_depth': 15, 'min_weight_fraction_leaf': 0.0, 'max_leaf_nodes': 300, 'bootstrap': False, 'ccp_alpha': 0.026000000000000002}. Best is trial 4065 with value: 0.057524275121161005.
[I 2025-04-16 02:15:09,642] Trial 4324 finished with value: -0.1936417107583833 and parameters: {'n_estimators': 673, 'min_samples_split': 2, 'max_features': 0.8400000000000001, 'min_samples_leaf': 4, 'criterion': 'absolute_error', 'max_depth': 15, 'min_weight_fraction_leaf': 0.0, 'max_leaf_nodes': 300, 'bootstrap': False, 'ccp_alpha': 0.01}. Best is trial 4065 with value: 0.057524275121161005.
[I 2025-04-16 02:15:10,382] Trial 4325 finished with value: -0.1936417107583833 and parameters: {'n_estimators': 187, 'min_samples_split': 13, 'max_features': 0.77, 'min_samples_leaf': 1, 'criterion': 'absolute_error', 'max_depth': 15, 'min_weight_fraction_leaf': 0.0, 'max_leaf_nodes': 50, 'bootstrap': False, 'ccp_alpha': 0.01}. Best is trial 4065 with value: 0.057524275121161005.
[I 2025-04-16 02:15:11,269] Trial 4326 finished with value: -14.564470243682086 and parameters: {'n_estimators': 439, 'min_samples_split': 6, 'max_features': 0.72, 'min_samples_leaf': 3, 'criterion': 'absolute_error', 'max_depth': 10, 'min_weight_fraction_leaf': 0.0, 'max_leaf_nodes': 300, 'bootstrap': False, 'ccp_alpha': 0.0}. Best is trial 4065 with value: 0.057524275121161005.
[I 2025-04-16 02:15:12,095] Trial 4327 finished with value: -0.1936417107583833 and parameters: {'n_estimators': 311, 'min_samples_split': 9, 'max_features': 0.8200000000000001, 'min_samples_leaf': 5, 'criterion': 'absolute_error', 'max_depth': 15, 'min_weight_fraction_leaf': 0.0, 'max_leaf_nodes': 300, 'bootstrap': False, 'ccp_alpha': 0.019}. Best is trial 4065 with value: 0.057524275121161005.
[I 2025-04-16 02:15:13,551] Trial 4328 finished with value: 0.00010123716367897995 and parameters: {'n_estimators': 953, 'min_samples_split': 5, 'max_features': 0.74, 'min_samples_leaf': 3, 'criterion': 'absolute_error', 'max_depth': 15, 'min_weight_fraction_leaf': 0.0, 'max_leaf_nodes': 300, 'bootstrap': False, 'ccp_alpha': 0.006}. Best is trial 4065 with value: 0.057524275121161005.
[I 2025-04-16 02:15:14,624] Trial 4329 finished with value: -0.1936417107583833 and parameters: {'n_estimators': 567, 'min_samples_split': 2, 'max_features': 0.7100000000000001, 'min_samples_leaf': 6, 'criterion': 'absolute_error', 'max_depth': 15, 'min_weight_fraction_leaf': 0.0, 'max_leaf_nodes': 300, 'bootstrap': False, 'ccp_alpha': 0.014}. Best is trial 4065 with value: 0.057524275121161005.
[I 2025-04-16 02:15:15,858] Trial 4330 finished with value: -0.1936417107583833 and parameters: {'n_estimators': 784, 'min_samples_split': 13, 'max_features': 0.78, 'min_samples_leaf': 1, 'criterion': 'absolute_error', 'max_depth': 15, 'min_weight_fraction_leaf': 0.0, 'max_leaf_nodes': 300, 'bootstrap': False, 'ccp_alpha': 0.006}. Best is trial 4065 with value: 0.057524275121161005.
[I 2025-04-16 02:15:16,627] Trial 4331 finished with value: -0.1936417107583833 and parameters: {'n_estimators': 193, 'min_samples_split': 9, 'max_features': 0.67, 'min_samples_leaf': 3, 'criterion': 'absolute_error', 'max_depth': 15, 'min_weight_fraction_leaf': 0.0, 'max_leaf_nodes': 10, 'bootstrap': False, 'ccp_alpha': 0.023}. Best is trial 4065 with value: 0.057524275121161005.
[I 2025-04-16 02:15:17,166] Trial 4332 finished with value: -131.90871951073274 and parameters: {'n_estimators': 1, 'min_samples_split': 2, 'max_features': 0.76, 'min_samples_leaf': 1, 'criterion': 'absolute_error', 'max_depth': 15, 'min_weight_fraction_leaf': 0.0, 'max_leaf_nodes': 300, 'bootstrap': False, 'ccp_alpha': 0.0}. Best is trial 4065 with value: 0.057524275121161005.
[I 2025-04-16 02:15:18,093] Trial 4333 finished with value: -17.528986382274873 and parameters: {'n_estimators': 457, 'min_samples_split': 114, 'max_features': 0.8, 'min_samples_leaf': 5, 'criterion': 'squared_error', 'max_depth': 15, 'min_weight_fraction_leaf': 0.0, 'max_leaf_nodes': 300, 'bootstrap': False, 'ccp_alpha': 0.013000000000000001}. Best is trial 4065 with value: 0.057524275121161005.
[I 2025-04-16 02:15:19,184] Trial 4334 finished with value: -0.03371035362537329 and parameters: {'n_estimators': 646, 'min_samples_split': 6, 'max_features': 0.6900000000000001, 'min_samples_leaf': 3, 'criterion': 'absolute_error', 'max_depth': 15, 'min_weight_fraction_leaf': 0.0, 'max_leaf_nodes': 300, 'bootstrap': False, 'ccp_alpha': 0.005}. Best is trial 4065 with value: 0.057524275121161005.
[I 2025-04-16 02:15:20,025] Trial 4335 finished with value: -0.1936417107583833 and parameters: {'n_estimators': 324, 'min_samples_split': 9, 'max_features': 0.73, 'min_samples_leaf': 56, 'criterion': 'absolute_error', 'max_depth': 15, 'min_weight_fraction_leaf': 0.0, 'max_leaf_nodes': 300, 'bootstrap': False, 'ccp_alpha': 0.009000000000000001}. Best is trial 4065 with value: 0.057524275121161005.
[I 2025-04-16 02:15:20,750] Trial 4336 finished with value: -0.1936417107583833 and parameters: {'n_estimators': 189, 'min_samples_split': 5, 'max_features': 0.8400000000000001, 'min_samples_leaf': 1, 'criterion': 'absolute_error', 'max_depth': 15, 'min_weight_fraction_leaf': 0.0, 'max_leaf_nodes': 300, 'bootstrap': False, 'ccp_alpha': 0.016}. Best is trial 4065 with value: 0.057524275121161005.
[I 2025-04-16 02:15:21,978] Trial 4337 finished with value: -7.832183006785544 and parameters: {'n_estimators': 768, 'min_samples_split': 2, 'max_features': 0.75, 'min_samples_leaf': 6, 'criterion': 'absolute_error', 'max_depth': 15, 'min_weight_fraction_leaf': 0.0, 'max_leaf_nodes': 300, 'bootstrap': False, 'ccp_alpha': 0.0}. Best is trial 4065 with value: 0.057524275121161005.
[I 2025-04-16 02:15:22,997] Trial 4338 finished with value: -16.41890677714752 and parameters: {'n_estimators': 435, 'min_samples_split': 13, 'max_features': 0.7100000000000001, 'min_samples_leaf': 3, 'criterion': 'poisson', 'max_depth': 15, 'min_weight_fraction_leaf': 0.0, 'max_leaf_nodes': 50, 'bootstrap': False, 'ccp_alpha': 0.01}. Best is trial 4065 with value: 0.057524275121161005.
[I 2025-04-16 02:15:24,404] Trial 4339 finished with value: -0.26520718320529035 and parameters: {'n_estimators': 1000, 'min_samples_split': 9, 'max_features': 0.79, 'min_samples_leaf': 1, 'criterion': 'absolute_error', 'max_depth': 15, 'min_weight_fraction_leaf': 0.0, 'max_leaf_nodes': 300, 'bootstrap': False, 'ccp_alpha': 0.005}. Best is trial 4065 with value: 0.057524275121161005.
[I 2025-04-16 02:15:25,448] Trial 4340 finished with value: -0.1936417107583833 and parameters: {'n_estimators': 587, 'min_samples_split': 5, 'max_features': 0.8200000000000001, 'min_samples_leaf': 4, 'criterion': 'absolute_error', 'max_depth': 15, 'min_weight_fraction_leaf': 0.0, 'max_leaf_nodes': None, 'bootstrap': False, 'ccp_alpha': 0.018000000000000002}. Best is trial 4065 with value: 0.057524275121161005.
[I 2025-04-16 02:15:26,321] Trial 4341 finished with value: -0.1936417107583833 and parameters: {'n_estimators': 325, 'min_samples_split': 6, 'max_features': 0.77, 'min_samples_leaf': 4, 'criterion': 'absolute_error', 'max_depth': 20, 'min_weight_fraction_leaf': 0.0, 'max_leaf_nodes': 300, 'bootstrap': False, 'ccp_alpha': 0.009000000000000001}. Best is trial 4065 with value: 0.057524275121161005.
[I 2025-04-16 02:15:27,658] Trial 4342 finished with value: -36.85884387179051 and parameters: {'n_estimators': 825, 'min_samples_split': 2, 'max_features': 0.73, 'min_samples_leaf': 1, 'criterion': 'absolute_error', 'max_depth': 15, 'min_weight_fraction_leaf': 0.0, 'max_leaf_nodes': 300, 'bootstrap': False, 'ccp_alpha': 0.0}. Best is trial 4065 with value: 0.057524275121161005.
[I 2025-04-16 02:15:28,683] Trial 4343 finished with value: -0.1936417107583833 and parameters: {'n_estimators': 493, 'min_samples_split': 9, 'max_features': 0.7000000000000001, 'min_samples_leaf': 6, 'criterion': 'absolute_error', 'max_depth': 15, 'min_weight_fraction_leaf': 0.0, 'max_leaf_nodes': 300, 'bootstrap': False, 'ccp_alpha': 0.03}. Best is trial 4065 with value: 0.057524275121161005.
[I 2025-04-16 02:15:29,402] Trial 4344 finished with value: -0.1936417107583833 and parameters: {'n_estimators': 166, 'min_samples_split': 13, 'max_features': 0.75, 'min_samples_leaf': 3, 'criterion': 'absolute_error', 'max_depth': 15, 'min_weight_fraction_leaf': 0.0, 'max_leaf_nodes': 300, 'bootstrap': False, 'ccp_alpha': 0.013000000000000001}. Best is trial 4065 with value: 0.057524275121161005.
[I 2025-04-16 02:15:30,512] Trial 4345 finished with value: -0.1936417107583833 and parameters: {'n_estimators': 665, 'min_samples_split': 2, 'max_features': 0.8, 'min_samples_leaf': 63, 'criterion': 'absolute_error', 'max_depth': 15, 'min_weight_fraction_leaf': 0.0, 'max_leaf_nodes': 300, 'bootstrap': False, 'ccp_alpha': 0.005}. Best is trial 4065 with value: 0.057524275121161005.
[I 2025-04-16 02:15:31,376] Trial 4346 finished with value: -0.1936417107583833 and parameters: {'n_estimators': 348, 'min_samples_split': 6, 'max_features': 0.72, 'min_samples_leaf': 1, 'criterion': 'absolute_error', 'max_depth': 15, 'min_weight_fraction_leaf': 0.0, 'max_leaf_nodes': 300, 'bootstrap': False, 'ccp_alpha': 0.022}. Best is trial 4065 with value: 0.057524275121161005.
[I 2025-04-16 02:15:32,116] Trial 4347 finished with value: -0.1936417107583833 and parameters: {'n_estimators': 190, 'min_samples_split': 9, 'max_features': 0.6, 'min_samples_leaf': 4, 'criterion': 'absolute_error', 'max_depth': 15, 'min_weight_fraction_leaf': 0.0, 'max_leaf_nodes': 300, 'bootstrap': False, 'ccp_alpha': 0.009000000000000001}. Best is trial 4065 with value: 0.057524275121161005.
[I 2025-04-16 02:15:33,560] Trial 4348 finished with value: -17.52898638227545 and parameters: {'n_estimators': 917, 'min_samples_split': 2, 'max_features': 0.77, 'min_samples_leaf': 3, 'criterion': 'friedman_mse', 'max_depth': 10, 'min_weight_fraction_leaf': 0.0, 'max_leaf_nodes': 300, 'bootstrap': False, 'ccp_alpha': 0.005}. Best is trial 4065 with value: 0.057524275121161005.
