[I 2025-04-16 00:03:02,694] Trial 1116 finished with value: -0.18687036046393707 and parameters: {'n_estimators': 1578, 'min_samples_split': 164, 'max_features': 0.26, 'min_samples_leaf': 28, 'criterion': 'absolute_error', 'max_depth': 45, 'min_weight_fraction_leaf': 0.02, 'max_leaf_nodes': 100, 'bootstrap': True, 'ccp_alpha': 0.05, 'max_samples': 0.5}. Best is trial 621 with value: -0.18112741123578058.
[I 2025-04-16 00:03:06,592] Trial 1117 finished with value: -0.19328822835808063 and parameters: {'n_estimators': 3030, 'min_samples_split': 123, 'max_features': 0.9, 'min_samples_leaf': 32, 'criterion': 'absolute_error', 'max_depth': 5, 'min_weight_fraction_leaf': 0.02, 'max_leaf_nodes': 100, 'bootstrap': True, 'ccp_alpha': 0.10400000000000001, 'max_samples': None}. Best is trial 621 with value: -0.18112741123578058.
[I 2025-04-16 00:03:09,545] Trial 1118 finished with value: -0.1936417107583833 and parameters: {'n_estimators': 3470, 'min_samples_split': 171, 'max_features': 0.61, 'min_samples_leaf': 41, 'criterion': 'absolute_error', 'max_depth': 30, 'min_weight_fraction_leaf': 0.03, 'max_leaf_nodes': 50, 'bootstrap': False, 'ccp_alpha': 0.111}. Best is trial 621 with value: -0.18112741123578058.
[I 2025-04-16 00:03:09,930] Trial 1119 finished with value: -19.402116064198474 and parameters: {'n_estimators': 175, 'min_samples_split': 15, 'max_features': 0.87, 'min_samples_leaf': 67, 'criterion': 'squared_error', 'max_depth': 45, 'min_weight_fraction_leaf': 0.01, 'max_leaf_nodes': 100, 'bootstrap': True, 'ccp_alpha': 0.07, 'max_samples': 0.5}. Best is trial 621 with value: -0.18112741123578058.
[I 2025-04-16 00:03:13,677] Trial 1120 finished with value: -0.18294821797975586 and parameters: {'n_estimators': 2861, 'min_samples_split': 160, 'max_features': 0.81, 'min_samples_leaf': 30, 'criterion': 'absolute_error', 'max_depth': 30, 'min_weight_fraction_leaf': 0.02, 'max_leaf_nodes': None, 'bootstrap': True, 'ccp_alpha': 0.06, 'max_samples': 0.5}. Best is trial 621 with value: -0.18112741123578058.
[I 2025-04-16 00:03:14,953] Trial 1121 finished with value: -0.18635879090838392 and parameters: {'n_estimators': 986, 'min_samples_split': 30, 'max_features': 0.92, 'min_samples_leaf': 26, 'criterion': 'absolute_error', 'max_depth': 30, 'min_weight_fraction_leaf': 0.01, 'max_leaf_nodes': 100, 'bootstrap': True, 'ccp_alpha': 0.095, 'max_samples': 0.5}. Best is trial 621 with value: -0.18112741123578058.
[I 2025-04-16 00:03:17,083] Trial 1122 finished with value: -0.1869131414716184 and parameters: {'n_estimators': 1857, 'min_samples_split': 150, 'max_features': 0.85, 'min_samples_leaf': 33, 'criterion': 'absolute_error', 'max_depth': 45, 'min_weight_fraction_leaf': 0.05, 'max_leaf_nodes': 300, 'bootstrap': True, 'ccp_alpha': 0.079, 'max_samples': 0.5}. Best is trial 621 with value: -0.18112741123578058.
[I 2025-04-16 00:03:17,825] Trial 1123 finished with value: -0.18737780598030912 and parameters: {'n_estimators': 495, 'min_samples_split': 167, 'max_features': 0.22, 'min_samples_leaf': 76, 'criterion': 'absolute_error', 'max_depth': 30, 'min_weight_fraction_leaf': 0.02, 'max_leaf_nodes': 10, 'bootstrap': True, 'ccp_alpha': 0.08700000000000001, 'max_samples': 0.5}. Best is trial 621 with value: -0.18112741123578058.
[I 2025-04-16 00:03:20,825] Trial 1124 finished with value: -0.1830254807650636 and parameters: {'n_estimators': 2588, 'min_samples_split': 177, 'max_features': 0.97, 'min_samples_leaf': 24, 'criterion': 'absolute_error', 'max_depth': 20, 'min_weight_fraction_leaf': 0.03, 'max_leaf_nodes': 100, 'bootstrap': True, 'ccp_alpha': 0.171, 'max_samples': 0.5}. Best is trial 621 with value: -0.18112741123578058.
[I 2025-04-16 00:03:24,569] Trial 1125 finished with value: -0.19328044732465846 and parameters: {'n_estimators': 3270, 'min_samples_split': 184, 'max_features': 0.89, 'min_samples_leaf': 28, 'criterion': 'absolute_error', 'max_depth': 30, 'min_weight_fraction_leaf': 0.04, 'max_leaf_nodes': 100, 'bootstrap': True, 'ccp_alpha': 0.055, 'max_samples': 1.0}. Best is trial 621 with value: -0.18112741123578058.
[I 2025-04-16 00:03:27,951] Trial 1126 finished with value: -0.19085595450082735 and parameters: {'n_estimators': 3084, 'min_samples_split': 99, 'max_features': 0.8300000000000001, 'min_samples_leaf': 30, 'criterion': 'absolute_error', 'max_depth': 45, 'min_weight_fraction_leaf': 0.02, 'max_leaf_nodes': 50, 'bootstrap': True, 'ccp_alpha': 0.107, 'max_samples': 0.75}. Best is trial 621 with value: -0.18112741123578058.
[I 2025-04-16 00:03:31,913] Trial 1127 finished with value: -17.81669824832356 and parameters: {'n_estimators': 3745, 'min_samples_split': 21, 'max_features': 0.33, 'min_samples_leaf': 26, 'criterion': 'poisson', 'max_depth': None, 'min_weight_fraction_leaf': 0.02, 'max_leaf_nodes': 100, 'bootstrap': True, 'ccp_alpha': 0.075, 'max_samples': 0.5}. Best is trial 621 with value: -0.18112741123578058.
[I 2025-04-16 00:03:35,635] Trial 1128 finished with value: -0.18302009605282904 and parameters: {'n_estimators': 3390, 'min_samples_split': 173, 'max_features': 0.29000000000000004, 'min_samples_leaf': 58, 'criterion': 'absolute_error', 'max_depth': 30, 'min_weight_fraction_leaf': 0.01, 'max_leaf_nodes': 100, 'bootstrap': True, 'ccp_alpha': 0.067, 'max_samples': 0.5}. Best is trial 621 with value: -0.18112741123578058.
[I 2025-04-16 00:03:38,820] Trial 1129 finished with value: -0.18280754644814126 and parameters: {'n_estimators': 2793, 'min_samples_split': 153, 'max_features': 0.4, 'min_samples_leaf': 34, 'criterion': 'absolute_error', 'max_depth': 60, 'min_weight_fraction_leaf': 0.02, 'max_leaf_nodes': 100, 'bootstrap': True, 'ccp_alpha': 0.12, 'max_samples': 0.5}. Best is trial 621 with value: -0.18112741123578058.
[I 2025-04-16 00:03:42,558] Trial 1130 finished with value: -0.18273873684315123 and parameters: {'n_estimators': 3079, 'min_samples_split': 197, 'max_features': 0.2, 'min_samples_leaf': 28, 'criterion': 'absolute_error', 'max_depth': 5, 'min_weight_fraction_leaf': 0.02, 'max_leaf_nodes': 10, 'bootstrap': True, 'ccp_alpha': 0.097, 'max_samples': 0.5}. Best is trial 621 with value: -0.18112741123578058.
[I 2025-04-16 00:03:43,026] Trial 1131 finished with value: -0.1867086779459755 and parameters: {'n_estimators': 239, 'min_samples_split': 162, 'max_features': 0.87, 'min_samples_leaf': 31, 'criterion': 'absolute_error', 'max_depth': 45, 'min_weight_fraction_leaf': 0.01, 'max_leaf_nodes': 100, 'bootstrap': True, 'ccp_alpha': 0.043000000000000003, 'max_samples': 0.5}. Best is trial 621 with value: -0.18112741123578058.
[I 2025-04-16 00:03:45,661] Trial 1132 finished with value: -0.1838930605980928 and parameters: {'n_estimators': 2335, 'min_samples_split': 28, 'max_features': 0.8, 'min_samples_leaf': 24, 'criterion': 'absolute_error', 'max_depth': 30, 'min_weight_fraction_leaf': 0.06, 'max_leaf_nodes': 50, 'bootstrap': True, 'ccp_alpha': 0.10300000000000001, 'max_samples': 0.5}. Best is trial 621 with value: -0.18112741123578058.
[I 2025-04-16 00:03:50,750] Trial 1133 finished with value: -0.18307983879617185 and parameters: {'n_estimators': 4158, 'min_samples_split': 180, 'max_features': 0.93, 'min_samples_leaf': 36, 'criterion': 'absolute_error', 'max_depth': 10, 'min_weight_fraction_leaf': 0.02, 'max_leaf_nodes': 100, 'bootstrap': True, 'ccp_alpha': 0.083, 'max_samples': 0.5}. Best is trial 621 with value: -0.18112741123578058.
[I 2025-04-16 00:03:51,670] Trial 1134 finished with value: -17.545223153399366 and parameters: {'n_estimators': 725, 'min_samples_split': 168, 'max_features': 0.85, 'min_samples_leaf': 97, 'criterion': 'friedman_mse', 'max_depth': 30, 'min_weight_fraction_leaf': 0.02, 'max_leaf_nodes': 100, 'bootstrap': True, 'ccp_alpha': 0.034, 'max_samples': 0.5}. Best is trial 621 with value: -0.18112741123578058.
[I 2025-04-16 00:03:54,028] Trial 1135 finished with value: -0.1936417107583833 and parameters: {'n_estimators': 3007, 'min_samples_split': 157, 'max_features': 0.36000000000000004, 'min_samples_leaf': 29, 'criterion': 'absolute_error', 'max_depth': 45, 'min_weight_fraction_leaf': 0.02, 'max_leaf_nodes': None, 'bootstrap': False, 'ccp_alpha': 0.064}. Best is trial 621 with value: -0.18112741123578058.
[I 2025-04-16 00:03:58,680] Trial 1136 finished with value: -0.18296485838144835 and parameters: {'n_estimators': 3321, 'min_samples_split': 144, 'max_features': 0.48000000000000004, 'min_samples_leaf': 39, 'criterion': 'absolute_error', 'max_depth': 30, 'min_weight_fraction_leaf': 0.03, 'max_leaf_nodes': 100, 'bootstrap': True, 'ccp_alpha': 0.091, 'max_samples': 0.5}. Best is trial 621 with value: -0.18112741123578058.
[I 2025-04-16 00:04:01,619] Trial 1137 finished with value: -0.182888108821538 and parameters: {'n_estimators': 2644, 'min_samples_split': 24, 'max_features': 0.9, 'min_samples_leaf': 26, 'criterion': 'absolute_error', 'max_depth': 30, 'min_weight_fraction_leaf': 0.01, 'max_leaf_nodes': 20, 'bootstrap': True, 'ccp_alpha': 0.056, 'max_samples': 0.5}. Best is trial 621 with value: -0.18112741123578058.
[I 2025-04-16 00:04:03,070] Trial 1138 finished with value: -0.18679163568661356 and parameters: {'n_estimators': 1215, 'min_samples_split': 188, 'max_features': 0.88, 'min_samples_leaf': 33, 'criterion': 'absolute_error', 'max_depth': 45, 'min_weight_fraction_leaf': 0.01, 'max_leaf_nodes': 100, 'bootstrap': True, 'ccp_alpha': 0.268, 'max_samples': 0.5}. Best is trial 621 with value: -0.18112741123578058.
[I 2025-04-16 00:04:09,332] Trial 1139 finished with value: -0.18387269461081107 and parameters: {'n_estimators': 5945, 'min_samples_split': 172, 'max_features': 0.8300000000000001, 'min_samples_leaf': 12, 'criterion': 'absolute_error', 'max_depth': 30, 'min_weight_fraction_leaf': 0.02, 'max_leaf_nodes': 50, 'bootstrap': True, 'ccp_alpha': 0.07200000000000001, 'max_samples': 0.5}. Best is trial 621 with value: -0.18112741123578058.
[I 2025-04-16 00:04:09,553] Trial 1140 finished with value: -0.19363866746586048 and parameters: {'n_estimators': 8, 'min_samples_split': 162, 'max_features': 1.0, 'min_samples_leaf': 31, 'criterion': 'absolute_error', 'max_depth': 45, 'min_weight_fraction_leaf': 0.01, 'max_leaf_nodes': 100, 'bootstrap': True, 'ccp_alpha': 0.112, 'max_samples': 0.5}. Best is trial 621 with value: -0.18112741123578058.
[I 2025-04-16 00:04:12,730] Trial 1141 finished with value: -0.18299333684513716 and parameters: {'n_estimators': 2877, 'min_samples_split': 16, 'max_features': 0.9500000000000001, 'min_samples_leaf': 27, 'criterion': 'absolute_error', 'max_depth': 20, 'min_weight_fraction_leaf': 0.02, 'max_leaf_nodes': 100, 'bootstrap': True, 'ccp_alpha': 0.006, 'max_samples': 0.5}. Best is trial 621 with value: -0.18112741123578058.
[I 2025-04-16 00:04:16,243] Trial 1142 finished with value: -0.18272741908931275 and parameters: {'n_estimators': 3186, 'min_samples_split': 154, 'max_features': 0.91, 'min_samples_leaf': 29, 'criterion': 'absolute_error', 'max_depth': 30, 'min_weight_fraction_leaf': 0.03, 'max_leaf_nodes': 10, 'bootstrap': True, 'ccp_alpha': 0.136, 'max_samples': 0.5}. Best is trial 621 with value: -0.18112741123578058.
[I 2025-04-16 00:04:20,176] Trial 1143 finished with value: -0.19329825956295094 and parameters: {'n_estimators': 3473, 'min_samples_split': 11, 'max_features': 0.86, 'min_samples_leaf': 72, 'criterion': 'absolute_error', 'max_depth': 60, 'min_weight_fraction_leaf': 0.02, 'max_leaf_nodes': 100, 'bootstrap': True, 'ccp_alpha': 0.047, 'max_samples': None}. Best is trial 621 with value: -0.18112741123578058.
[I 2025-04-16 00:04:20,729] Trial 1144 finished with value: -19.244731088353483 and parameters: {'n_estimators': 335, 'min_samples_split': 178, 'max_features': 0.81, 'min_samples_leaf': 6, 'criterion': 'squared_error', 'max_depth': None, 'min_weight_fraction_leaf': 0.02, 'max_leaf_nodes': 100, 'bootstrap': True, 'ccp_alpha': 0.079, 'max_samples': 0.5}. Best is trial 621 with value: -0.18112741123578058.
[I 2025-04-16 00:04:24,168] Trial 1145 finished with value: -0.18278293277027263 and parameters: {'n_estimators': 2925, 'min_samples_split': 166, 'max_features': 0.79, 'min_samples_leaf': 24, 'criterion': 'absolute_error', 'max_depth': 5, 'min_weight_fraction_leaf': 0.07, 'max_leaf_nodes': 50, 'bootstrap': True, 'ccp_alpha': 0.095, 'max_samples': 0.5}. Best is trial 621 with value: -0.18112741123578058.
[I 2025-04-16 00:04:27,042] Trial 1146 finished with value: -0.18298081747126033 and parameters: {'n_estimators': 2536, 'min_samples_split': 31, 'max_features': 0.09999999999999999, 'min_samples_leaf': 44, 'criterion': 'absolute_error', 'max_depth': 30, 'min_weight_fraction_leaf': 0.06, 'max_leaf_nodes': 100, 'bootstrap': True, 'ccp_alpha': 0.063, 'max_samples': 0.5}. Best is trial 621 with value: -0.18112741123578058.
[I 2025-04-16 00:04:30,757] Trial 1147 finished with value: -0.18261356063279574 and parameters: {'n_estimators': 3127, 'min_samples_split': 149, 'max_features': 0.88, 'min_samples_leaf': 34, 'criterion': 'absolute_error', 'max_depth': 45, 'min_weight_fraction_leaf': 0.01, 'max_leaf_nodes': 300, 'bootstrap': True, 'ccp_alpha': 0.089, 'max_samples': 0.5}. Best is trial 621 with value: -0.18112741123578058.
[I 2025-04-16 00:04:34,514] Trial 1148 finished with value: -0.18287677188660098 and parameters: {'n_estimators': 2815, 'min_samples_split': 67, 'max_features': 0.8300000000000001, 'min_samples_leaf': 31, 'criterion': 'absolute_error', 'max_depth': 30, 'min_weight_fraction_leaf': 0.02, 'max_leaf_nodes': None, 'bootstrap': True, 'ccp_alpha': 0.101, 'max_samples': 0.5}. Best is trial 621 with value: -0.18112741123578058.
[I 2025-04-16 00:04:38,248] Trial 1149 finished with value: -17.828920114637604 and parameters: {'n_estimators': 3605, 'min_samples_split': 182, 'max_features': 0.85, 'min_samples_leaf': 27, 'criterion': 'poisson', 'max_depth': 45, 'min_weight_fraction_leaf': 0.02, 'max_leaf_nodes': 100, 'bootstrap': True, 'ccp_alpha': 0.084, 'max_samples': 0.5}. Best is trial 621 with value: -0.18112741123578058.
[I 2025-04-16 00:04:38,639] Trial 1150 finished with value: -0.19299997461839774 and parameters: {'n_estimators': 171, 'min_samples_split': 62, 'max_features': 0.92, 'min_samples_leaf': 23, 'criterion': 'absolute_error', 'max_depth': 30, 'min_weight_fraction_leaf': 0.01, 'max_leaf_nodes': 10, 'bootstrap': True, 'ccp_alpha': 0.07100000000000001, 'max_samples': 1.0}. Best is trial 621 with value: -0.18112741123578058.
[I 2025-04-16 00:04:42,420] Trial 1151 finished with value: -0.18291942727696245 and parameters: {'n_estimators': 3275, 'min_samples_split': 25, 'max_features': 0.24000000000000002, 'min_samples_leaf': 37, 'criterion': 'absolute_error', 'max_depth': 30, 'min_weight_fraction_leaf': 0.04, 'max_leaf_nodes': 100, 'bootstrap': True, 'ccp_alpha': 0.052000000000000005, 'max_samples': 0.5}. Best is trial 621 with value: -0.18112741123578058.
[I 2025-04-16 00:04:43,164] Trial 1152 finished with value: -0.19184564648011007 and parameters: {'n_estimators': 516, 'min_samples_split': 175, 'max_features': 0.88, 'min_samples_leaf': 25, 'criterion': 'absolute_error', 'max_depth': 45, 'min_weight_fraction_leaf': 0.02, 'max_leaf_nodes': 100, 'bootstrap': True, 'ccp_alpha': 0.117, 'max_samples': 0.75}. Best is trial 621 with value: -0.18112741123578058.
[I 2025-04-16 00:04:46,428] Trial 1153 finished with value: -0.18259985062572456 and parameters: {'n_estimators': 3013, 'min_samples_split': 160, 'max_features': 0.27, 'min_samples_leaf': 29, 'criterion': 'absolute_error', 'max_depth': 30, 'min_weight_fraction_leaf': 0.01, 'max_leaf_nodes': 100, 'bootstrap': True, 'ccp_alpha': 0.062, 'max_samples': 0.5}. Best is trial 621 with value: -0.18112741123578058.
[I 2025-04-16 00:04:48,660] Trial 1154 finished with value: -0.1936417107583833 and parameters: {'n_estimators': 2657, 'min_samples_split': 20, 'max_features': 0.8200000000000001, 'min_samples_leaf': 32, 'criterion': 'absolute_error', 'max_depth': 20, 'min_weight_fraction_leaf': 0.03, 'max_leaf_nodes': 100, 'bootstrap': False, 'ccp_alpha': 0.107}. Best is trial 621 with value: -0.18112741123578058.
[I 2025-04-16 00:04:52,029] Trial 1155 finished with value: -0.18263922366546845 and parameters: {'n_estimators': 3136, 'min_samples_split': 169, 'max_features': 0.17, 'min_samples_leaf': 28, 'criterion': 'absolute_error', 'max_depth': 30, 'min_weight_fraction_leaf': 0.08, 'max_leaf_nodes': 50, 'bootstrap': True, 'ccp_alpha': 0.076, 'max_samples': 0.5}. Best is trial 621 with value: -0.18112741123578058.
[I 2025-04-16 00:04:55,180] Trial 1156 finished with value: -0.1828799000659623 and parameters: {'n_estimators': 2816, 'min_samples_split': 155, 'max_features': 0.31, 'min_samples_leaf': 30, 'criterion': 'absolute_error', 'max_depth': 45, 'min_weight_fraction_leaf': 0.02, 'max_leaf_nodes': 100, 'bootstrap': True, 'ccp_alpha': 0.058, 'max_samples': 0.5}. Best is trial 621 with value: -0.18112741123578058.
[I 2025-04-16 00:04:58,914] Trial 1157 finished with value: -0.18298239496875818 and parameters: {'n_estimators': 3350, 'min_samples_split': 185, 'max_features': 0.86, 'min_samples_leaf': 35, 'criterion': 'absolute_error', 'max_depth': None, 'min_weight_fraction_leaf': 0.02, 'max_leaf_nodes': 100, 'bootstrap': True, 'ccp_alpha': 0.096, 'max_samples': 0.5}. Best is trial 621 with value: -0.18112741123578058.
[I 2025-04-16 00:05:01,144] Trial 1158 finished with value: -18.289965041601597 and parameters: {'n_estimators': 2083, 'min_samples_split': 27, 'max_features': 0.9, 'min_samples_leaf': 26, 'criterion': 'friedman_mse', 'max_depth': 60, 'min_weight_fraction_leaf': 0.01, 'max_leaf_nodes': 10, 'bootstrap': True, 'ccp_alpha': 0.069, 'max_samples': 0.5}. Best is trial 621 with value: -0.18112741123578058.
[I 2025-04-16 00:05:04,556] Trial 1159 finished with value: -0.18280926392912877 and parameters: {'n_estimators': 2916, 'min_samples_split': 165, 'max_features': 0.9500000000000001, 'min_samples_leaf': 33, 'criterion': 'absolute_error', 'max_depth': 30, 'min_weight_fraction_leaf': 0.02, 'max_leaf_nodes': 20, 'bootstrap': True, 'ccp_alpha': 0.088, 'max_samples': 0.5}. Best is trial 621 with value: -0.18112741123578058.
[I 2025-04-16 00:05:05,115] Trial 1160 finished with value: -0.18751087961455842 and parameters: {'n_estimators': 326, 'min_samples_split': 174, 'max_features': 0.78, 'min_samples_leaf': 42, 'criterion': 'absolute_error', 'max_depth': 45, 'min_weight_fraction_leaf': 0.01, 'max_leaf_nodes': 100, 'bootstrap': True, 'ccp_alpha': 0.079, 'max_samples': 0.5}. Best is trial 621 with value: -0.18112741123578058.
[I 2025-04-16 00:05:09,643] Trial 1161 finished with value: -0.1829430182473089 and parameters: {'n_estimators': 3899, 'min_samples_split': 151, 'max_features': 0.8400000000000001, 'min_samples_leaf': 22, 'criterion': 'absolute_error', 'max_depth': 10, 'min_weight_fraction_leaf': 0.02, 'max_leaf_nodes': 50, 'bootstrap': True, 'ccp_alpha': 0.10200000000000001, 'max_samples': 0.5}. Best is trial 621 with value: -0.18112741123578058.
[I 2025-04-16 00:05:12,378] Trial 1162 finished with value: -0.18389007435322302 and parameters: {'n_estimators': 2422, 'min_samples_split': 178, 'max_features': 0.5, 'min_samples_leaf': 30, 'criterion': 'absolute_error', 'max_depth': 5, 'min_weight_fraction_leaf': 0.06, 'max_leaf_nodes': 100, 'bootstrap': True, 'ccp_alpha': 0.112, 'max_samples': 0.5}. Best is trial 621 with value: -0.18112741123578058.
[I 2025-04-16 00:05:16,369] Trial 1163 finished with value: -0.18332759561918316 and parameters: {'n_estimators': 3544, 'min_samples_split': 162, 'max_features': 0.8, 'min_samples_leaf': 65, 'criterion': 'absolute_error', 'max_depth': 30, 'min_weight_fraction_leaf': 0.01, 'max_leaf_nodes': 100, 'bootstrap': True, 'ccp_alpha': 0.066, 'max_samples': 0.5}. Best is trial 621 with value: -0.18112741123578058.
[I 2025-04-16 00:05:20,194] Trial 1164 finished with value: -0.18268830617641374 and parameters: {'n_estimators': 3172, 'min_samples_split': 158, 'max_features': 0.89, 'min_samples_leaf': 27, 'criterion': 'absolute_error', 'max_depth': 30, 'min_weight_fraction_leaf': 0.03, 'max_leaf_nodes': 100, 'bootstrap': True, 'ccp_alpha': 0.05, 'max_samples': 0.5}. Best is trial 621 with value: -0.18112741123578058.
[I 2025-04-16 00:05:20,405] Trial 1165 finished with value: -0.1936368481708542 and parameters: {'n_estimators': 10, 'min_samples_split': 171, 'max_features': 0.93, 'min_samples_leaf': 1, 'criterion': 'absolute_error', 'max_depth': 45, 'min_weight_fraction_leaf': 0.02, 'max_leaf_nodes': None, 'bootstrap': True, 'ccp_alpha': 0.201, 'max_samples': 0.5}. Best is trial 621 with value: -0.18112741123578058.
[I 2025-04-16 00:05:21,498] Trial 1166 finished with value: -0.18669962561665474 and parameters: {'n_estimators': 823, 'min_samples_split': 31, 'max_features': 0.87, 'min_samples_leaf': 25, 'criterion': 'absolute_error', 'max_depth': 30, 'min_weight_fraction_leaf': 0.02, 'max_leaf_nodes': 100, 'bootstrap': True, 'ccp_alpha': 0.093, 'max_samples': 0.5}. Best is trial 621 with value: -0.18112741123578058.
[I 2025-04-16 00:05:24,861] Trial 1167 finished with value: -0.18281946482068 and parameters: {'n_estimators': 2671, 'min_samples_split': 18, 'max_features': 0.8200000000000001, 'min_samples_leaf': 9, 'criterion': 'absolute_error', 'max_depth': 45, 'min_weight_fraction_leaf': 0.01, 'max_leaf_nodes': 50, 'bootstrap': True, 'ccp_alpha': 0.08600000000000001, 'max_samples': 0.5}. Best is trial 621 with value: -0.18112741123578058.
[I 2025-04-16 00:05:28,537] Trial 1168 finished with value: -0.1932870656140752 and parameters: {'n_estimators': 3020, 'min_samples_split': 23, 'max_features': 0.8400000000000001, 'min_samples_leaf': 28, 'criterion': 'absolute_error', 'max_depth': 30, 'min_weight_fraction_leaf': 0.02, 'max_leaf_nodes': 10, 'bootstrap': True, 'ccp_alpha': 0.153, 'max_samples': None}. Best is trial 621 with value: -0.18112741123578058.
