[I 2025-04-16 01:59:17,571] Trial 3397 finished with value: 0.018217094846041948 and parameters: {'n_estimators': 382, 'min_samples_split': 2, 'max_features': 0.77, 'min_samples_leaf': 3, 'criterion': 'absolute_error', 'max_depth': 15, 'min_weight_fraction_leaf': 0.0, 'max_leaf_nodes': 300, 'bootstrap': False, 'ccp_alpha': 0.005}. Best is trial 3267 with value: 0.055170387637108485.
[I 2025-04-16 01:59:18,370] Trial 3398 finished with value: -0.1936417107583833 and parameters: {'n_estimators': 366, 'min_samples_split': 5, 'max_features': 0.72, 'min_samples_leaf': 1, 'criterion': 'absolute_error', 'max_depth': 15, 'min_weight_fraction_leaf': 0.0, 'max_leaf_nodes': 300, 'bootstrap': False, 'ccp_alpha': 0.009000000000000001}. Best is trial 3267 with value: 0.055170387637108485.
[I 2025-04-16 01:59:19,285] Trial 3399 finished with value: -18.351584146366108 and parameters: {'n_estimators': 560, 'min_samples_split': 2, 'max_features': 0.67, 'min_samples_leaf': 3, 'criterion': 'poisson', 'max_depth': 15, 'min_weight_fraction_leaf': 0.0, 'max_leaf_nodes': 300, 'bootstrap': False, 'ccp_alpha': 0.018000000000000002}. Best is trial 3267 with value: 0.055170387637108485.
[I 2025-04-16 01:59:19,926] Trial 3400 finished with value: -32.416467494027984 and parameters: {'n_estimators': 181, 'min_samples_split': 5, 'max_features': 0.74, 'min_samples_leaf': 1, 'criterion': 'absolute_error', 'max_depth': 15, 'min_weight_fraction_leaf': 0.0, 'max_leaf_nodes': 300, 'bootstrap': False, 'ccp_alpha': 0.0}. Best is trial 3267 with value: 0.055170387637108485.
[I 2025-04-16 01:59:20,772] Trial 3401 finished with value: 0.018412911158123935 and parameters: {'n_estimators': 429, 'min_samples_split': 5, 'max_features': 0.76, 'min_samples_leaf': 3, 'criterion': 'absolute_error', 'max_depth': 15, 'min_weight_fraction_leaf': 0.0, 'max_leaf_nodes': 300, 'bootstrap': False, 'ccp_alpha': 0.005}. Best is trial 3267 with value: 0.055170387637108485.
[I 2025-04-16 01:59:21,734] Trial 3402 finished with value: -0.1936417107583833 and parameters: {'n_estimators': 568, 'min_samples_split': 2, 'max_features': 0.7000000000000001, 'min_samples_leaf': 3, 'criterion': 'absolute_error', 'max_depth': 15, 'min_weight_fraction_leaf': 0.0, 'max_leaf_nodes': 300, 'bootstrap': False, 'ccp_alpha': 0.033}. Best is trial 3267 with value: 0.055170387637108485.
[I 2025-04-16 01:59:22,521] Trial 3403 finished with value: -0.1936417107583833 and parameters: {'n_estimators': 338, 'min_samples_split': 5, 'max_features': 0.73, 'min_samples_leaf': 1, 'criterion': 'absolute_error', 'max_depth': 15, 'min_weight_fraction_leaf': 0.0, 'max_leaf_nodes': 300, 'bootstrap': False, 'ccp_alpha': 0.013000000000000001}. Best is trial 3267 with value: 0.055170387637108485.
[I 2025-04-16 01:59:23,111] Trial 3404 finished with value: -0.1936417107583833 and parameters: {'n_estimators': 126, 'min_samples_split': 2, 'max_features': 0.77, 'min_samples_leaf': 3, 'criterion': 'absolute_error', 'max_depth': 15, 'min_weight_fraction_leaf': 0.0, 'max_leaf_nodes': 300, 'bootstrap': False, 'ccp_alpha': 0.009000000000000001}. Best is trial 3267 with value: 0.055170387637108485.
[I 2025-04-16 01:59:24,042] Trial 3405 finished with value: 0.03274267595929805 and parameters: {'n_estimators': 551, 'min_samples_split': 5, 'max_features': 0.75, 'min_samples_leaf': 1, 'criterion': 'absolute_error', 'max_depth': 15, 'min_weight_fraction_leaf': 0.0, 'max_leaf_nodes': 300, 'bootstrap': False, 'ccp_alpha': 0.005}. Best is trial 3267 with value: 0.055170387637108485.
[I 2025-04-16 01:59:24,541] Trial 3406 finished with value: -0.1936417107583833 and parameters: {'n_estimators': 4, 'min_samples_split': 5, 'max_features': 0.72, 'min_samples_leaf': 3, 'criterion': 'absolute_error', 'max_depth': 15, 'min_weight_fraction_leaf': 0.0, 'max_leaf_nodes': 300, 'bootstrap': False, 'ccp_alpha': 0.02}. Best is trial 3267 with value: 0.055170387637108485.
[I 2025-04-16 01:59:25,456] Trial 3407 finished with value: -36.960726951443824 and parameters: {'n_estimators': 555, 'min_samples_split': 5, 'max_features': 0.78, 'min_samples_leaf': 1, 'criterion': 'absolute_error', 'max_depth': 15, 'min_weight_fraction_leaf': 0.0, 'max_leaf_nodes': 300, 'bootstrap': False, 'ccp_alpha': 0.0}. Best is trial 3267 with value: 0.055170387637108485.
[I 2025-04-16 01:59:26,219] Trial 3408 finished with value: -0.1936417107583833 and parameters: {'n_estimators': 318, 'min_samples_split': 2, 'max_features': 0.75, 'min_samples_leaf': 3, 'criterion': 'absolute_error', 'max_depth': 15, 'min_weight_fraction_leaf': 0.0, 'max_leaf_nodes': 300, 'bootstrap': False, 'ccp_alpha': 0.014}. Best is trial 3267 with value: 0.055170387637108485.
[I 2025-04-16 01:59:27,252] Trial 3409 finished with value: 0.04547801762985981 and parameters: {'n_estimators': 612, 'min_samples_split': 2, 'max_features': 0.7000000000000001, 'min_samples_leaf': 1, 'criterion': 'absolute_error', 'max_depth': 15, 'min_weight_fraction_leaf': 0.0, 'max_leaf_nodes': 300, 'bootstrap': False, 'ccp_alpha': 0.005}. Best is trial 3267 with value: 0.055170387637108485.
[I 2025-04-16 01:59:28,293] Trial 3410 finished with value: -17.528986382274866 and parameters: {'n_estimators': 617, 'min_samples_split': 2, 'max_features': 0.65, 'min_samples_leaf': 3, 'criterion': 'friedman_mse', 'max_depth': 15, 'min_weight_fraction_leaf': 0.0, 'max_leaf_nodes': 300, 'bootstrap': False, 'ccp_alpha': 0.011}. Best is trial 3267 with value: 0.055170387637108485.
[I 2025-04-16 01:59:29,351] Trial 3411 finished with value: -0.1936417107583833 and parameters: {'n_estimators': 653, 'min_samples_split': 2, 'max_features': 0.68, 'min_samples_leaf': 1, 'criterion': 'absolute_error', 'max_depth': 15, 'min_weight_fraction_leaf': 0.0, 'max_leaf_nodes': 300, 'bootstrap': False, 'ccp_alpha': 0.022}. Best is trial 3267 with value: 0.055170387637108485.
[I 2025-04-16 01:59:30,105] Trial 3412 finished with value: -0.003222437746542894 and parameters: {'n_estimators': 332, 'min_samples_split': 2, 'max_features': 0.6900000000000001, 'min_samples_leaf': 3, 'criterion': 'absolute_error', 'max_depth': 15, 'min_weight_fraction_leaf': 0.0, 'max_leaf_nodes': 300, 'bootstrap': False, 'ccp_alpha': 0.006}. Best is trial 3267 with value: 0.055170387637108485.
[I 2025-04-16 01:59:31,104] Trial 3413 finished with value: -14.305855353130152 and parameters: {'n_estimators': 668, 'min_samples_split': 2, 'max_features': 0.7100000000000001, 'min_samples_leaf': 3, 'criterion': 'absolute_error', 'max_depth': 15, 'min_weight_fraction_leaf': 0.0, 'max_leaf_nodes': 300, 'bootstrap': False, 'ccp_alpha': 0.0}. Best is trial 3267 with value: 0.055170387637108485.
[I 2025-04-16 01:59:31,741] Trial 3414 finished with value: -0.1936417107583833 and parameters: {'n_estimators': 183, 'min_samples_split': 5, 'max_features': 0.6900000000000001, 'min_samples_leaf': 1, 'criterion': 'absolute_error', 'max_depth': 15, 'min_weight_fraction_leaf': 0.0, 'max_leaf_nodes': 300, 'bootstrap': False, 'ccp_alpha': 0.014}. Best is trial 3267 with value: 0.055170387637108485.
[I 2025-04-16 01:59:32,586] Trial 3415 finished with value: -0.1936417107583833 and parameters: {'n_estimators': 449, 'min_samples_split': 2, 'max_features': 0.66, 'min_samples_leaf': 3, 'criterion': 'absolute_error', 'max_depth': 15, 'min_weight_fraction_leaf': 0.0, 'max_leaf_nodes': 300, 'bootstrap': False, 'ccp_alpha': 0.01}. Best is trial 3267 with value: 0.055170387637108485.
[I 2025-04-16 01:59:33,804] Trial 3416 finished with value: -0.1936417107583833 and parameters: {'n_estimators': 792, 'min_samples_split': 5, 'max_features': 0.7100000000000001, 'min_samples_leaf': 1, 'criterion': 'absolute_error', 'max_depth': 15, 'min_weight_fraction_leaf': 0.0, 'max_leaf_nodes': 300, 'bootstrap': False, 'ccp_alpha': 0.028}. Best is trial 3267 with value: 0.055170387637108485.
[I 2025-04-16 01:59:34,786] Trial 3417 finished with value: -17.528986382274873 and parameters: {'n_estimators': 594, 'min_samples_split': 5, 'max_features': 0.72, 'min_samples_leaf': 3, 'criterion': 'squared_error', 'max_depth': 15, 'min_weight_fraction_leaf': 0.0, 'max_leaf_nodes': 300, 'bootstrap': False, 'ccp_alpha': 0.005}. Best is trial 3267 with value: 0.055170387637108485.
[I 2025-04-16 01:59:35,579] Trial 3418 finished with value: -0.1936417107583833 and parameters: {'n_estimators': 383, 'min_samples_split': 2, 'max_features': 0.73, 'min_samples_leaf': 1, 'criterion': 'absolute_error', 'max_depth': 15, 'min_weight_fraction_leaf': 0.0, 'max_leaf_nodes': 300, 'bootstrap': False, 'ccp_alpha': 0.018000000000000002}. Best is trial 3267 with value: 0.055170387637108485.
[I 2025-04-16 01:59:36,654] Trial 3419 finished with value: -14.884139758685205 and parameters: {'n_estimators': 796, 'min_samples_split': 5, 'max_features': 0.7000000000000001, 'min_samples_leaf': 3, 'criterion': 'absolute_error', 'max_depth': 15, 'min_weight_fraction_leaf': 0.0, 'max_leaf_nodes': 300, 'bootstrap': False, 'ccp_alpha': 0.0}. Best is trial 3267 with value: 0.055170387637108485.
[I 2025-04-16 01:59:37,347] Trial 3420 finished with value: -0.1936417107583833 and parameters: {'n_estimators': 235, 'min_samples_split': 2, 'max_features': 0.73, 'min_samples_leaf': 1, 'criterion': 'absolute_error', 'max_depth': 15, 'min_weight_fraction_leaf': 0.0, 'max_leaf_nodes': 300, 'bootstrap': False, 'ccp_alpha': 0.009000000000000001}. Best is trial 3267 with value: 0.055170387637108485.
[I 2025-04-16 01:59:38,326] Trial 3421 finished with value: -0.1936417107583833 and parameters: {'n_estimators': 575, 'min_samples_split': 5, 'max_features': 0.67, 'min_samples_leaf': 3, 'criterion': 'absolute_error', 'max_depth': 15, 'min_weight_fraction_leaf': 0.0, 'max_leaf_nodes': 300, 'bootstrap': False, 'ccp_alpha': 0.014}. Best is trial 3267 with value: 0.055170387637108485.
[I 2025-04-16 01:59:39,446] Trial 3422 finished with value: 0.03869346260811746 and parameters: {'n_estimators': 782, 'min_samples_split': 6, 'max_features': 0.74, 'min_samples_leaf': 1, 'criterion': 'absolute_error', 'max_depth': 15, 'min_weight_fraction_leaf': 0.0, 'max_leaf_nodes': 300, 'bootstrap': False, 'ccp_alpha': 0.005}. Best is trial 3267 with value: 0.055170387637108485.
[I 2025-04-16 01:59:40,074] Trial 3423 finished with value: -0.1936417107583833 and parameters: {'n_estimators': 164, 'min_samples_split': 6, 'max_features': 0.77, 'min_samples_leaf': 3, 'criterion': 'absolute_error', 'max_depth': 15, 'min_weight_fraction_leaf': 0.0, 'max_leaf_nodes': 300, 'bootstrap': False, 'ccp_alpha': 0.01}. Best is trial 3267 with value: 0.055170387637108485.
[I 2025-04-16 01:59:40,922] Trial 3424 finished with value: -14.166442302679178 and parameters: {'n_estimators': 460, 'min_samples_split': 6, 'max_features': 0.7000000000000001, 'min_samples_leaf': 3, 'criterion': 'absolute_error', 'max_depth': 15, 'min_weight_fraction_leaf': 0.0, 'max_leaf_nodes': 300, 'bootstrap': False, 'ccp_alpha': 0.0}. Best is trial 3267 with value: 0.055170387637108485.
[I 2025-04-16 01:59:41,984] Trial 3425 finished with value: -0.1936417107583833 and parameters: {'n_estimators': 646, 'min_samples_split': 2, 'max_features': 0.72, 'min_samples_leaf': 1, 'criterion': 'absolute_error', 'max_depth': 15, 'min_weight_fraction_leaf': 0.0, 'max_leaf_nodes': 300, 'bootstrap': False, 'ccp_alpha': 0.241}. Best is trial 3267 with value: 0.055170387637108485.
[I 2025-04-16 01:59:43,234] Trial 3426 finished with value: -0.1936417107583833 and parameters: {'n_estimators': 914, 'min_samples_split': 6, 'max_features': 0.75, 'min_samples_leaf': 3, 'criterion': 'absolute_error', 'max_depth': 15, 'min_weight_fraction_leaf': 0.0, 'max_leaf_nodes': 300, 'bootstrap': False, 'ccp_alpha': 0.019}. Best is trial 3267 with value: 0.055170387637108485.
[I 2025-04-16 01:59:43,990] Trial 3427 finished with value: -13.42360769353337 and parameters: {'n_estimators': 339, 'min_samples_split': 6, 'max_features': 0.74, 'min_samples_leaf': 1, 'criterion': 'poisson', 'max_depth': 15, 'min_weight_fraction_leaf': 0.0, 'max_leaf_nodes': 300, 'bootstrap': False, 'ccp_alpha': 0.005}. Best is trial 3267 with value: 0.055170387637108485.
[I 2025-04-16 01:59:44,980] Trial 3428 finished with value: -0.1936417107583833 and parameters: {'n_estimators': 602, 'min_samples_split': 6, 'max_features': 0.78, 'min_samples_leaf': 3, 'criterion': 'absolute_error', 'max_depth': 15, 'min_weight_fraction_leaf': 0.0, 'max_leaf_nodes': 300, 'bootstrap': False, 'ccp_alpha': 0.01}. Best is trial 3267 with value: 0.055170387637108485.
[I 2025-04-16 01:59:45,471] Trial 3429 finished with value: -0.1936417107583833 and parameters: {'n_estimators': 7, 'min_samples_split': 6, 'max_features': 0.7000000000000001, 'min_samples_leaf': 1, 'criterion': 'absolute_error', 'max_depth': 15, 'min_weight_fraction_leaf': 0.0, 'max_leaf_nodes': 300, 'bootstrap': False, 'ccp_alpha': 0.014}. Best is trial 3267 with value: 0.055170387637108485.
[I 2025-04-16 01:59:46,273] Trial 3430 finished with value: -0.1936417107583833 and parameters: {'n_estimators': 403, 'min_samples_split': 6, 'max_features': 0.67, 'min_samples_leaf': 3, 'criterion': 'absolute_error', 'max_depth': 15, 'min_weight_fraction_leaf': 0.0, 'max_leaf_nodes': 300, 'bootstrap': False, 'ccp_alpha': 0.023}. Best is trial 3267 with value: 0.055170387637108485.
[I 2025-04-16 01:59:47,456] Trial 3431 finished with value: 0.008653551150224726 and parameters: {'n_estimators': 841, 'min_samples_split': 6, 'max_features': 0.78, 'min_samples_leaf': 1, 'criterion': 'absolute_error', 'max_depth': 15, 'min_weight_fraction_leaf': 0.0, 'max_leaf_nodes': 300, 'bootstrap': False, 'ccp_alpha': 0.006}. Best is trial 3267 with value: 0.055170387637108485.
[I 2025-04-16 01:59:48,077] Trial 3432 finished with value: -13.875523204923317 and parameters: {'n_estimators': 197, 'min_samples_split': 6, 'max_features': 0.72, 'min_samples_leaf': 3, 'criterion': 'absolute_error', 'max_depth': 15, 'min_weight_fraction_leaf': 0.0, 'max_leaf_nodes': 300, 'bootstrap': False, 'ccp_alpha': 0.0}. Best is trial 3267 with value: 0.055170387637108485.
[I 2025-04-16 01:59:49,167] Trial 3433 finished with value: -0.1936417107583833 and parameters: {'n_estimators': 649, 'min_samples_split': 2, 'max_features': 0.75, 'min_samples_leaf': 1, 'criterion': 'absolute_error', 'max_depth': 15, 'min_weight_fraction_leaf': 0.0, 'max_leaf_nodes': 300, 'bootstrap': False, 'ccp_alpha': 0.017}. Best is trial 3267 with value: 0.055170387637108485.
[I 2025-04-16 01:59:50,027] Trial 3434 finished with value: -17.528986382274873 and parameters: {'n_estimators': 470, 'min_samples_split': 6, 'max_features': 0.73, 'min_samples_leaf': 3, 'criterion': 'friedman_mse', 'max_depth': 15, 'min_weight_fraction_leaf': 0.0, 'max_leaf_nodes': 300, 'bootstrap': False, 'ccp_alpha': 0.009000000000000001}. Best is trial 3267 with value: 0.055170387637108485.
[I 2025-04-16 01:59:51,380] Trial 3435 finished with value: -0.051923937959883724 and parameters: {'n_estimators': 936, 'min_samples_split': 2, 'max_features': 0.6900000000000001, 'min_samples_leaf': 3, 'criterion': 'absolute_error', 'max_depth': 15, 'min_weight_fraction_leaf': 0.0, 'max_leaf_nodes': 300, 'bootstrap': False, 'ccp_alpha': 0.005}. Best is trial 3267 with value: 0.055170387637108485.
[I 2025-04-16 01:59:52,409] Trial 3436 finished with value: -18.4595859821789 and parameters: {'n_estimators': 723, 'min_samples_split': 6, 'max_features': 0.76, 'min_samples_leaf': 1, 'criterion': 'absolute_error', 'max_depth': 15, 'min_weight_fraction_leaf': 0.0, 'max_leaf_nodes': 300, 'bootstrap': False, 'ccp_alpha': 0.0}. Best is trial 3267 with value: 0.055170387637108485.
[I 2025-04-16 01:59:53,144] Trial 3437 finished with value: -0.1936417107583833 and parameters: {'n_estimators': 305, 'min_samples_split': 6, 'max_features': 0.77, 'min_samples_leaf': 3, 'criterion': 'absolute_error', 'max_depth': 15, 'min_weight_fraction_leaf': 0.0, 'max_leaf_nodes': 300, 'bootstrap': False, 'ccp_alpha': 0.256}. Best is trial 3267 with value: 0.055170387637108485.
[I 2025-04-16 01:59:54,129] Trial 3438 finished with value: -0.1936417107583833 and parameters: {'n_estimators': 564, 'min_samples_split': 2, 'max_features': 0.7100000000000001, 'min_samples_leaf': 1, 'criterion': 'absolute_error', 'max_depth': 15, 'min_weight_fraction_leaf': 0.0, 'max_leaf_nodes': 300, 'bootstrap': False, 'ccp_alpha': 0.014}. Best is trial 3267 with value: 0.055170387637108485.
[I 2025-04-16 01:59:55,384] Trial 3439 finished with value: -0.1936417107583833 and parameters: {'n_estimators': 925, 'min_samples_split': 6, 'max_features': 0.74, 'min_samples_leaf': 3, 'criterion': 'absolute_error', 'max_depth': 15, 'min_weight_fraction_leaf': 0.0, 'max_leaf_nodes': 300, 'bootstrap': False, 'ccp_alpha': 0.01}. Best is trial 3267 with value: 0.055170387637108485.
[I 2025-04-16 01:59:56,118] Trial 3440 finished with value: 0.053427123492717096 and parameters: {'n_estimators': 217, 'min_samples_split': 2, 'max_features': 0.73, 'min_samples_leaf': 1, 'criterion': 'absolute_error', 'max_depth': 15, 'min_weight_fraction_leaf': 0.0, 'max_leaf_nodes': 300, 'bootstrap': False, 'ccp_alpha': 0.005}. Best is trial 3267 with value: 0.055170387637108485.
[I 2025-04-16 01:59:56,714] Trial 3441 finished with value: -17.528986382274926 and parameters: {'n_estimators': 112, 'min_samples_split': 2, 'max_features': 0.73, 'min_samples_leaf': 3, 'criterion': 'squared_error', 'max_depth': 15, 'min_weight_fraction_leaf': 0.0, 'max_leaf_nodes': 300, 'bootstrap': False, 'ccp_alpha': 0.023}. Best is trial 3267 with value: 0.055170387637108485.
[I 2025-04-16 01:59:57,228] Trial 3442 finished with value: -0.1936417107583833 and parameters: {'n_estimators': 20, 'min_samples_split': 6, 'max_features': 0.7000000000000001, 'min_samples_leaf': 1, 'criterion': 'absolute_error', 'max_depth': 15, 'min_weight_fraction_leaf': 0.0, 'max_leaf_nodes': 300, 'bootstrap': False, 'ccp_alpha': 0.017}. Best is trial 3267 with value: 0.055170387637108485.
[I 2025-04-16 01:59:57,879] Trial 3443 finished with value: -0.1936417107583833 and parameters: {'n_estimators': 224, 'min_samples_split': 2, 'max_features': 0.7100000000000001, 'min_samples_leaf': 3, 'criterion': 'absolute_error', 'max_depth': 15, 'min_weight_fraction_leaf': 0.0, 'max_leaf_nodes': 300, 'bootstrap': False, 'ccp_alpha': 0.009000000000000001}. Best is trial 3267 with value: 0.055170387637108485.
[I 2025-04-16 01:59:58,529] Trial 3444 finished with value: -30.947468511720217 and parameters: {'n_estimators': 217, 'min_samples_split': 2, 'max_features': 0.68, 'min_samples_leaf': 1, 'criterion': 'absolute_error', 'max_depth': 15, 'min_weight_fraction_leaf': 0.0, 'max_leaf_nodes': 300, 'bootstrap': False, 'ccp_alpha': 0.0}. Best is trial 3267 with value: 0.055170387637108485.
[I 2025-04-16 01:59:59,401] Trial 3445 finished with value: -0.1936417107583833 and parameters: {'n_estimators': 401, 'min_samples_split': 5, 'max_features': 0.72, 'min_samples_leaf': 3, 'criterion': 'absolute_error', 'max_depth': 15, 'min_weight_fraction_leaf': 0.0, 'max_leaf_nodes': 300, 'bootstrap': False, 'ccp_alpha': 0.01}. Best is trial 3267 with value: 0.055170387637108485.
[I 2025-04-16 02:00:00,182] Trial 3446 finished with value: 0.01913974826982858 and parameters: {'n_estimators': 362, 'min_samples_split': 2, 'max_features': 0.74, 'min_samples_leaf': 3, 'criterion': 'absolute_error', 'max_depth': 15, 'min_weight_fraction_leaf': 0.0, 'max_leaf_nodes': 300, 'bootstrap': False, 'ccp_alpha': 0.005}. Best is trial 3267 with value: 0.055170387637108485.
[I 2025-04-16 02:00:00,683] Trial 3447 finished with value: -0.1936417107583833 and parameters: {'n_estimators': 17, 'min_samples_split': 2, 'max_features': 0.66, 'min_samples_leaf': 1, 'criterion': 'absolute_error', 'max_depth': 15, 'min_weight_fraction_leaf': 0.0, 'max_leaf_nodes': 300, 'bootstrap': False, 'ccp_alpha': 0.016}. Best is trial 3267 with value: 0.055170387637108485.
[I 2025-04-16 02:00:01,390] Trial 3448 finished with value: -15.7875046811098 and parameters: {'n_estimators': 256, 'min_samples_split': 6, 'max_features': 0.7000000000000001, 'min_samples_leaf': 3, 'criterion': 'poisson', 'max_depth': 15, 'min_weight_fraction_leaf': 0.0, 'max_leaf_nodes': 300, 'bootstrap': False, 'ccp_alpha': 0.005}. Best is trial 3267 with value: 0.055170387637108485.
[I 2025-04-16 02:00:02,325] Trial 3449 finished with value: -0.1936417107583833 and parameters: {'n_estimators': 536, 'min_samples_split': 6, 'max_features': 0.73, 'min_samples_leaf': 1, 'criterion': 'absolute_error', 'max_depth': 15, 'min_weight_fraction_leaf': 0.0, 'max_leaf_nodes': 300, 'bootstrap': False, 'ccp_alpha': 0.014}. Best is trial 3267 with value: 0.055170387637108485.
[I 2025-04-16 02:00:03,146] Trial 3450 finished with value: -0.1936417107583833 and parameters: {'n_estimators': 392, 'min_samples_split': 2, 'max_features': 0.75, 'min_samples_leaf': 3, 'criterion': 'absolute_error', 'max_depth': 15, 'min_weight_fraction_leaf': 0.0, 'max_leaf_nodes': 300, 'bootstrap': False, 'ccp_alpha': 0.026000000000000002}. Best is trial 3267 with value: 0.055170387637108485.
[I 2025-04-16 02:00:03,754] Trial 3451 finished with value: -39.228213452223216 and parameters: {'n_estimators': 162, 'min_samples_split': 2, 'max_features': 0.72, 'min_samples_leaf': 1, 'criterion': 'absolute_error', 'max_depth': 15, 'min_weight_fraction_leaf': 0.0, 'max_leaf_nodes': 300, 'bootstrap': False, 'ccp_alpha': 0.0}. Best is trial 3267 with value: 0.055170387637108485.
[I 2025-04-16 02:00:04,735] Trial 3452 finished with value: -0.1936417107583833 and parameters: {'n_estimators': 534, 'min_samples_split': 2, 'max_features': 0.75, 'min_samples_leaf': 3, 'criterion': 'absolute_error', 'max_depth': 15, 'min_weight_fraction_leaf': 0.0, 'max_leaf_nodes': 300, 'bootstrap': False, 'ccp_alpha': 0.009000000000000001}. Best is trial 3267 with value: 0.055170387637108485.
