[I 2025-04-15 23:10:44,906] Trial 109 finished with value: -18.164067839594182 and parameters: {'n_estimators': 2737, 'min_samples_split': 8, 'max_features': 0.62, 'min_samples_leaf': 2, 'criterion': 'friedman_mse', 'max_depth': None, 'min_weight_fraction_leaf': 0.02, 'max_leaf_nodes': 300, 'bootstrap': True, 'ccp_alpha': 0.171, 'max_samples': 0.5}. Best is trial 74 with value: -0.18167313469617832.
[I 2025-04-15 23:10:47,955] Trial 110 finished with value: -0.1932635644215782 and parameters: {'n_estimators': 2744, 'min_samples_split': 5, 'max_features': 0.61, 'min_samples_leaf': 3, 'criterion': 'absolute_error', 'max_depth': None, 'min_weight_fraction_leaf': 0.02, 'max_leaf_nodes': 300, 'bootstrap': True, 'ccp_alpha': 0.203, 'max_samples': 1.0}. Best is trial 74 with value: -0.18167313469617832.
[I 2025-04-15 23:10:50,935] Trial 111 finished with value: -0.1837090107489881 and parameters: {'n_estimators': 2281, 'min_samples_split': 11, 'max_features': 0.6900000000000001, 'min_samples_leaf': 6, 'criterion': 'absolute_error', 'max_depth': None, 'min_weight_fraction_leaf': 0.02, 'max_leaf_nodes': 300, 'bootstrap': True, 'ccp_alpha': 0.176, 'max_samples': 0.5}. Best is trial 74 with value: -0.18167313469617832.
[I 2025-04-15 23:10:53,866] Trial 112 finished with value: -0.18388668555696097 and parameters: {'n_estimators': 2421, 'min_samples_split': 11, 'max_features': 0.7100000000000001, 'min_samples_leaf': 5, 'criterion': 'absolute_error', 'max_depth': None, 'min_weight_fraction_leaf': 0.02, 'max_leaf_nodes': 300, 'bootstrap': True, 'ccp_alpha': 0.19, 'max_samples': 0.5}. Best is trial 74 with value: -0.18167313469617832.
[I 2025-04-15 23:10:57,600] Trial 113 finished with value: -0.18290654356665703 and parameters: {'n_estimators': 3299, 'min_samples_split': 6, 'max_features': 0.77, 'min_samples_leaf': 6, 'criterion': 'absolute_error', 'max_depth': None, 'min_weight_fraction_leaf': 0.03, 'max_leaf_nodes': 300, 'bootstrap': True, 'ccp_alpha': 0.17500000000000002, 'max_samples': 0.5}. Best is trial 74 with value: -0.18167313469617832.
[I 2025-04-15 23:11:00,801] Trial 114 finished with value: -0.18286424833172737 and parameters: {'n_estimators': 2811, 'min_samples_split': 10, 'max_features': 0.73, 'min_samples_leaf': 1, 'criterion': 'absolute_error', 'max_depth': None, 'min_weight_fraction_leaf': 0.03, 'max_leaf_nodes': 300, 'bootstrap': True, 'ccp_alpha': 0.17500000000000002, 'max_samples': 0.5}. Best is trial 74 with value: -0.18167313469617832.
[I 2025-04-15 23:11:05,815] Trial 115 finished with value: -0.18353084100800499 and parameters: {'n_estimators': 3730, 'min_samples_split': 11, 'max_features': 0.8, 'min_samples_leaf': 2, 'criterion': 'absolute_error', 'max_depth': None, 'min_weight_fraction_leaf': 0.03, 'max_leaf_nodes': 300, 'bootstrap': True, 'ccp_alpha': 0.155, 'max_samples': 0.5}. Best is trial 74 with value: -0.18167313469617832.
[I 2025-04-15 23:11:11,209] Trial 116 finished with value: -0.18329948716494182 and parameters: {'n_estimators': 4387, 'min_samples_split': 2, 'max_features': 0.75, 'min_samples_leaf': 1, 'criterion': 'absolute_error', 'max_depth': None, 'min_weight_fraction_leaf': 0.03, 'max_leaf_nodes': 300, 'bootstrap': True, 'ccp_alpha': 0.17300000000000001, 'max_samples': 0.5}. Best is trial 74 with value: -0.18167313469617832.
[I 2025-04-15 23:11:15,064] Trial 117 finished with value: -0.18293818469897824 and parameters: {'n_estimators': 3282, 'min_samples_split': 12, 'max_features': 0.77, 'min_samples_leaf': 1, 'criterion': 'absolute_error', 'max_depth': None, 'min_weight_fraction_leaf': 0.04, 'max_leaf_nodes': 300, 'bootstrap': True, 'ccp_alpha': 0.17300000000000001, 'max_samples': 0.5}. Best is trial 74 with value: -0.18167313469617832.
[I 2025-04-15 23:11:19,713] Trial 118 finished with value: -17.825548850795393 and parameters: {'n_estimators': 3784, 'min_samples_split': 11, 'max_features': 0.8, 'min_samples_leaf': 1, 'criterion': 'squared_error', 'max_depth': 20, 'min_weight_fraction_leaf': 0.04, 'max_leaf_nodes': 300, 'bootstrap': True, 'ccp_alpha': 0.159, 'max_samples': 0.5}. Best is trial 74 with value: -0.18167313469617832.
[I 2025-04-15 23:11:25,067] Trial 119 finished with value: -0.18330732413120546 and parameters: {'n_estimators': 4391, 'min_samples_split': 15, 'max_features': 0.75, 'min_samples_leaf': 3, 'criterion': 'absolute_error', 'max_depth': None, 'min_weight_fraction_leaf': 0.04, 'max_leaf_nodes': 300, 'bootstrap': True, 'ccp_alpha': 0.17400000000000002, 'max_samples': 0.5}. Best is trial 74 with value: -0.18167313469617832.
[I 2025-04-15 23:11:30,009] Trial 120 finished with value: -0.18310627322140097 and parameters: {'n_estimators': 4204, 'min_samples_split': 15, 'max_features': 0.75, 'min_samples_leaf': 3, 'criterion': 'absolute_error', 'max_depth': None, 'min_weight_fraction_leaf': 0.04, 'max_leaf_nodes': 300, 'bootstrap': True, 'ccp_alpha': 0.17500000000000002, 'max_samples': 0.5}. Best is trial 74 with value: -0.18167313469617832.
[I 2025-04-15 23:11:34,971] Trial 121 finished with value: -0.1832473827964045 and parameters: {'n_estimators': 4348, 'min_samples_split': 15, 'max_features': 0.76, 'min_samples_leaf': 3, 'criterion': 'absolute_error', 'max_depth': None, 'min_weight_fraction_leaf': 0.04, 'max_leaf_nodes': 300, 'bootstrap': True, 'ccp_alpha': 0.17300000000000001, 'max_samples': 0.5}. Best is trial 74 with value: -0.18167313469617832.
[I 2025-04-15 23:11:40,325] Trial 122 finished with value: -0.18329604969037142 and parameters: {'n_estimators': 4384, 'min_samples_split': 15, 'max_features': 0.75, 'min_samples_leaf': 3, 'criterion': 'absolute_error', 'max_depth': None, 'min_weight_fraction_leaf': 0.04, 'max_leaf_nodes': 300, 'bootstrap': True, 'ccp_alpha': 0.17300000000000001, 'max_samples': 0.5}. Best is trial 74 with value: -0.18167313469617832.
[I 2025-04-15 23:11:46,453] Trial 123 finished with value: -0.18352206574430596 and parameters: {'n_estimators': 5057, 'min_samples_split': 16, 'max_features': 0.76, 'min_samples_leaf': 1, 'criterion': 'absolute_error', 'max_depth': 10, 'min_weight_fraction_leaf': 0.04, 'max_leaf_nodes': 300, 'bootstrap': True, 'ccp_alpha': 0.171, 'max_samples': 0.5}. Best is trial 74 with value: -0.18167313469617832.
[I 2025-04-15 23:11:51,726] Trial 124 finished with value: -0.18340067646659342 and parameters: {'n_estimators': 4481, 'min_samples_split': 14, 'max_features': 0.75, 'min_samples_leaf': 3, 'criterion': 'absolute_error', 'max_depth': 10, 'min_weight_fraction_leaf': 0.04, 'max_leaf_nodes': 300, 'bootstrap': True, 'ccp_alpha': 0.169, 'max_samples': 0.5}. Best is trial 74 with value: -0.18167313469617832.
[I 2025-04-15 23:11:57,500] Trial 125 finished with value: -0.1833053659135487 and parameters: {'n_estimators': 4390, 'min_samples_split': 15, 'max_features': 0.73, 'min_samples_leaf': 3, 'criterion': 'absolute_error', 'max_depth': None, 'min_weight_fraction_leaf': 0.04, 'max_leaf_nodes': 300, 'bootstrap': True, 'ccp_alpha': 0.17300000000000001, 'max_samples': 0.5}. Best is trial 74 with value: -0.18167313469617832.
[I 2025-04-15 23:12:02,673] Trial 126 finished with value: -17.697081034111722 and parameters: {'n_estimators': 4476, 'min_samples_split': 16, 'max_features': 0.86, 'min_samples_leaf': 3, 'criterion': 'poisson', 'max_depth': None, 'min_weight_fraction_leaf': 0.05, 'max_leaf_nodes': 300, 'bootstrap': True, 'ccp_alpha': 0.177, 'max_samples': 0.5}. Best is trial 74 with value: -0.18167313469617832.
[I 2025-04-15 23:12:07,255] Trial 127 finished with value: -0.1831375815130037 and parameters: {'n_estimators': 4187, 'min_samples_split': 21, 'max_features': 0.72, 'min_samples_leaf': 4, 'criterion': 'absolute_error', 'max_depth': None, 'min_weight_fraction_leaf': 0.04, 'max_leaf_nodes': 300, 'bootstrap': True, 'ccp_alpha': 0.16, 'max_samples': 0.5}. Best is trial 74 with value: -0.18167313469617832.
[I 2025-04-15 23:12:12,167] Trial 128 finished with value: -0.19334770885356098 and parameters: {'n_estimators': 4065, 'min_samples_split': 21, 'max_features': 0.72, 'min_samples_leaf': 14, 'criterion': 'absolute_error', 'max_depth': None, 'min_weight_fraction_leaf': 0.04, 'max_leaf_nodes': 50, 'bootstrap': True, 'ccp_alpha': 0.14200000000000002, 'max_samples': None}. Best is trial 74 with value: -0.18167313469617832.
[I 2025-04-15 23:12:17,441] Trial 129 finished with value: -0.18323259386125726 and parameters: {'n_estimators': 4268, 'min_samples_split': 8, 'max_features': 0.8300000000000001, 'min_samples_leaf': 1, 'criterion': 'absolute_error', 'max_depth': None, 'min_weight_fraction_leaf': 0.03, 'max_leaf_nodes': 300, 'bootstrap': True, 'ccp_alpha': 0.158, 'max_samples': 0.5}. Best is trial 74 with value: -0.18167313469617832.
[I 2025-04-15 23:12:21,920] Trial 130 finished with value: -0.18280009555566093 and parameters: {'n_estimators': 3231, 'min_samples_split': 8, 'max_features': 0.89, 'min_samples_leaf': 1, 'criterion': 'absolute_error', 'max_depth': None, 'min_weight_fraction_leaf': 0.03, 'max_leaf_nodes': 300, 'bootstrap': True, 'ccp_alpha': 0.129, 'max_samples': 0.5}. Best is trial 74 with value: -0.18167313469617832.
[I 2025-04-15 23:12:25,716] Trial 131 finished with value: -0.1828247080223541 and parameters: {'n_estimators': 3240, 'min_samples_split': 7, 'max_features': 0.78, 'min_samples_leaf': 1, 'criterion': 'absolute_error', 'max_depth': None, 'min_weight_fraction_leaf': 0.03, 'max_leaf_nodes': 300, 'bootstrap': True, 'ccp_alpha': 0.127, 'max_samples': 0.5}. Best is trial 74 with value: -0.18167313469617832.
[I 2025-04-15 23:12:30,236] Trial 132 finished with value: -0.18298310513390073 and parameters: {'n_estimators': 3936, 'min_samples_split': 7, 'max_features': 0.8300000000000001, 'min_samples_leaf': 10, 'criterion': 'absolute_error', 'max_depth': None, 'min_weight_fraction_leaf': 0.03, 'max_leaf_nodes': 300, 'bootstrap': True, 'ccp_alpha': 0.115, 'max_samples': 0.5}. Best is trial 74 with value: -0.18167313469617832.
[I 2025-04-15 23:12:33,971] Trial 133 finished with value: -0.18280103007109322 and parameters: {'n_estimators': 3215, 'min_samples_split': 10, 'max_features': 0.92, 'min_samples_leaf': 10, 'criterion': 'absolute_error', 'max_depth': None, 'min_weight_fraction_leaf': 0.03, 'max_leaf_nodes': 300, 'bootstrap': True, 'ccp_alpha': 0.126, 'max_samples': 0.5}. Best is trial 74 with value: -0.18167313469617832.
[I 2025-04-15 23:12:37,616] Trial 134 finished with value: -0.18303504979547217 and parameters: {'n_estimators': 3349, 'min_samples_split': 7, 'max_features': 0.9400000000000001, 'min_samples_leaf': 11, 'criterion': 'absolute_error', 'max_depth': 30, 'min_weight_fraction_leaf': 0.03, 'max_leaf_nodes': 300, 'bootstrap': True, 'ccp_alpha': 0.124, 'max_samples': 0.5}. Best is trial 74 with value: -0.18167313469617832.
[I 2025-04-15 23:12:41,302] Trial 135 finished with value: -0.18280283646840828 and parameters: {'n_estimators': 3232, 'min_samples_split': 7, 'max_features': 0.93, 'min_samples_leaf': 11, 'criterion': 'absolute_error', 'max_depth': 30, 'min_weight_fraction_leaf': 0.03, 'max_leaf_nodes': 300, 'bootstrap': True, 'ccp_alpha': 0.113, 'max_samples': 0.5}. Best is trial 74 with value: -0.18167313469617832.
[I 2025-04-15 23:12:45,794] Trial 136 finished with value: -0.19333625559696585 and parameters: {'n_estimators': 3911, 'min_samples_split': 7, 'max_features': 0.9400000000000001, 'min_samples_leaf': 11, 'criterion': 'absolute_error', 'max_depth': 30, 'min_weight_fraction_leaf': 0.03, 'max_leaf_nodes': 300, 'bootstrap': True, 'ccp_alpha': 0.112, 'max_samples': 1.0}. Best is trial 74 with value: -0.18167313469617832.
[I 2025-04-15 23:12:49,391] Trial 137 finished with value: -17.911831364088055 and parameters: {'n_estimators': 3249, 'min_samples_split': 9, 'max_features': 0.91, 'min_samples_leaf': 9, 'criterion': 'friedman_mse', 'max_depth': 30, 'min_weight_fraction_leaf': 0.03, 'max_leaf_nodes': 300, 'bootstrap': True, 'ccp_alpha': 0.127, 'max_samples': 0.5}. Best is trial 74 with value: -0.18167313469617832.
[I 2025-04-15 23:12:53,369] Trial 138 finished with value: -0.1829463638758393 and parameters: {'n_estimators': 3314, 'min_samples_split': 11, 'max_features': 0.91, 'min_samples_leaf': 10, 'criterion': 'absolute_error', 'max_depth': 30, 'min_weight_fraction_leaf': 0.03, 'max_leaf_nodes': 100, 'bootstrap': True, 'ccp_alpha': 0.123, 'max_samples': 0.5}. Best is trial 74 with value: -0.18167313469617832.
[I 2025-04-15 23:12:57,318] Trial 139 finished with value: -0.1834256825185044 and parameters: {'n_estimators': 3642, 'min_samples_split': 11, 'max_features': 1.0, 'min_samples_leaf': 11, 'criterion': 'absolute_error', 'max_depth': 30, 'min_weight_fraction_leaf': 0.03, 'max_leaf_nodes': 100, 'bootstrap': True, 'ccp_alpha': 0.101, 'max_samples': 0.5}. Best is trial 74 with value: -0.18167313469617832.
[I 2025-04-15 23:13:01,226] Trial 140 finished with value: -0.18278800934900769 and parameters: {'n_estimators': 3223, 'min_samples_split': 7, 'max_features': 0.89, 'min_samples_leaf': 13, 'criterion': 'absolute_error', 'max_depth': 30, 'min_weight_fraction_leaf': 0.03, 'max_leaf_nodes': 100, 'bootstrap': True, 'ccp_alpha': 0.122, 'max_samples': 0.5}. Best is trial 74 with value: -0.18167313469617832.
[I 2025-04-15 23:13:04,912] Trial 141 finished with value: -0.18289427233611072 and parameters: {'n_estimators': 3292, 'min_samples_split': 6, 'max_features': 0.9600000000000001, 'min_samples_leaf': 14, 'criterion': 'absolute_error', 'max_depth': 30, 'min_weight_fraction_leaf': 0.03, 'max_leaf_nodes': 100, 'bootstrap': True, 'ccp_alpha': 0.123, 'max_samples': 0.5}. Best is trial 74 with value: -0.18167313469617832.
[I 2025-04-15 23:13:08,599] Trial 142 finished with value: -0.1829622282761733 and parameters: {'n_estimators': 3320, 'min_samples_split': 5, 'max_features': 0.97, 'min_samples_leaf': 14, 'criterion': 'absolute_error', 'max_depth': 30, 'min_weight_fraction_leaf': 0.03, 'max_leaf_nodes': 100, 'bootstrap': True, 'ccp_alpha': 0.117, 'max_samples': 0.5}. Best is trial 74 with value: -0.18167313469617832.
[I 2025-04-15 23:13:11,784] Trial 143 finished with value: -0.18292038380772163 and parameters: {'n_estimators': 2829, 'min_samples_split': 191, 'max_features': 0.97, 'min_samples_leaf': 13, 'criterion': 'absolute_error', 'max_depth': 30, 'min_weight_fraction_leaf': 0.03, 'max_leaf_nodes': 100, 'bootstrap': True, 'ccp_alpha': 0.136, 'max_samples': 0.5}. Best is trial 74 with value: -0.18167313469617832.
[I 2025-04-15 23:13:15,071] Trial 144 finished with value: -0.18290205709215127 and parameters: {'n_estimators': 2846, 'min_samples_split': 2, 'max_features': 0.89, 'min_samples_leaf': 13, 'criterion': 'absolute_error', 'max_depth': 30, 'min_weight_fraction_leaf': 0.03, 'max_leaf_nodes': 100, 'bootstrap': True, 'ccp_alpha': 0.135, 'max_samples': 0.5}. Best is trial 74 with value: -0.18167313469617832.
[I 2025-04-15 23:13:18,096] Trial 145 finished with value: -0.1827310629286205 and parameters: {'n_estimators': 2769, 'min_samples_split': 199, 'max_features': 0.91, 'min_samples_leaf': 21, 'criterion': 'absolute_error', 'max_depth': 30, 'min_weight_fraction_leaf': 0.03, 'max_leaf_nodes': 100, 'bootstrap': True, 'ccp_alpha': 0.134, 'max_samples': 0.5}. Best is trial 74 with value: -0.18167313469617832.
[I 2025-04-15 23:13:21,470] Trial 146 finished with value: -0.18289550823006978 and parameters: {'n_estimators': 2821, 'min_samples_split': 191, 'max_features': 0.88, 'min_samples_leaf': 21, 'criterion': 'absolute_error', 'max_depth': 30, 'min_weight_fraction_leaf': 0.03, 'max_leaf_nodes': 100, 'bootstrap': True, 'ccp_alpha': 0.135, 'max_samples': 0.5}. Best is trial 74 with value: -0.18167313469617832.
[I 2025-04-15 23:13:24,543] Trial 147 finished with value: -0.18282650890894994 and parameters: {'n_estimators': 2799, 'min_samples_split': 200, 'max_features': 0.88, 'min_samples_leaf': 21, 'criterion': 'absolute_error', 'max_depth': 30, 'min_weight_fraction_leaf': 0.03, 'max_leaf_nodes': 100, 'bootstrap': True, 'ccp_alpha': 0.132, 'max_samples': 0.5}. Best is trial 74 with value: -0.18167313469617832.
[I 2025-04-15 23:13:27,386] Trial 148 finished with value: -18.183349182272288 and parameters: {'n_estimators': 2914, 'min_samples_split': 199, 'max_features': 0.9, 'min_samples_leaf': 21, 'criterion': 'squared_error', 'max_depth': 30, 'min_weight_fraction_leaf': 0.03, 'max_leaf_nodes': 100, 'bootstrap': True, 'ccp_alpha': 0.133, 'max_samples': 0.5}. Best is trial 74 with value: -0.18167313469617832.
[I 2025-04-15 23:13:31,388] Trial 149 finished with value: -0.18259640233345595 and parameters: {'n_estimators': 3121, 'min_samples_split': 172, 'max_features': 0.86, 'min_samples_leaf': 24, 'criterion': 'absolute_error', 'max_depth': 30, 'min_weight_fraction_leaf': 0.03, 'max_leaf_nodes': 100, 'bootstrap': True, 'ccp_alpha': 0.108, 'max_samples': 0.5}. Best is trial 74 with value: -0.18167313469617832.
[I 2025-04-15 23:13:34,834] Trial 150 finished with value: -0.18280086885070612 and parameters: {'n_estimators': 2618, 'min_samples_split': 169, 'max_features': 0.88, 'min_samples_leaf': 23, 'criterion': 'absolute_error', 'max_depth': 30, 'min_weight_fraction_leaf': 0.03, 'max_leaf_nodes': 100, 'bootstrap': True, 'ccp_alpha': 0.108, 'max_samples': 0.5}. Best is trial 74 with value: -0.18167313469617832.
[I 2025-04-15 23:13:38,772] Trial 151 finished with value: -0.18256640512953376 and parameters: {'n_estimators': 3107, 'min_samples_split': 178, 'max_features': 0.88, 'min_samples_leaf': 26, 'criterion': 'absolute_error', 'max_depth': 30, 'min_weight_fraction_leaf': 0.03, 'max_leaf_nodes': 100, 'bootstrap': True, 'ccp_alpha': 0.109, 'max_samples': 0.5}. Best is trial 74 with value: -0.18167313469617832.
[I 2025-04-15 23:13:41,857] Trial 152 finished with value: -0.1825113842604346 and parameters: {'n_estimators': 3088, 'min_samples_split': 176, 'max_features': 0.86, 'min_samples_leaf': 28, 'criterion': 'absolute_error', 'max_depth': 30, 'min_weight_fraction_leaf': 0.03, 'max_leaf_nodes': 100, 'bootstrap': True, 'ccp_alpha': 0.10400000000000001, 'max_samples': 0.5}. Best is trial 74 with value: -0.18167313469617832.
[I 2025-04-15 23:13:45,184] Trial 153 finished with value: -0.18266916680713713 and parameters: {'n_estimators': 3055, 'min_samples_split': 175, 'max_features': 0.86, 'min_samples_leaf': 28, 'criterion': 'absolute_error', 'max_depth': 30, 'min_weight_fraction_leaf': 0.03, 'max_leaf_nodes': 100, 'bootstrap': True, 'ccp_alpha': 0.107, 'max_samples': 0.5}. Best is trial 74 with value: -0.18167313469617832.
[I 2025-04-15 23:13:48,451] Trial 154 finished with value: -0.18262230648659367 and parameters: {'n_estimators': 3039, 'min_samples_split': 173, 'max_features': 0.86, 'min_samples_leaf': 27, 'criterion': 'absolute_error', 'max_depth': 30, 'min_weight_fraction_leaf': 0.03, 'max_leaf_nodes': 100, 'bootstrap': True, 'ccp_alpha': 0.105, 'max_samples': 0.5}. Best is trial 74 with value: -0.18167313469617832.
[I 2025-04-15 23:13:51,695] Trial 155 finished with value: -0.18268081115762436 and parameters: {'n_estimators': 3059, 'min_samples_split': 175, 'max_features': 0.86, 'min_samples_leaf': 31, 'criterion': 'absolute_error', 'max_depth': 30, 'min_weight_fraction_leaf': 0.03, 'max_leaf_nodes': 100, 'bootstrap': True, 'ccp_alpha': 0.10200000000000001, 'max_samples': 0.5}. Best is trial 74 with value: -0.18167313469617832.
[I 2025-04-15 23:13:55,274] Trial 156 finished with value: -17.852364604961018 and parameters: {'n_estimators': 3571, 'min_samples_split': 175, 'max_features': 0.86, 'min_samples_leaf': 30, 'criterion': 'poisson', 'max_depth': 30, 'min_weight_fraction_leaf': 0.03, 'max_leaf_nodes': 100, 'bootstrap': True, 'ccp_alpha': 0.089, 'max_samples': None}. Best is trial 74 with value: -0.18167313469617832.
[I 2025-04-15 23:13:58,523] Trial 157 finished with value: -0.18250848157685207 and parameters: {'n_estimators': 3087, 'min_samples_split': 174, 'max_features': 0.8400000000000001, 'min_samples_leaf': 27, 'criterion': 'absolute_error', 'max_depth': 30, 'min_weight_fraction_leaf': 0.03, 'max_leaf_nodes': 100, 'bootstrap': True, 'ccp_alpha': 0.106, 'max_samples': 0.5}. Best is trial 74 with value: -0.18167313469617832.
[I 2025-04-15 23:14:00,983] Trial 158 finished with value: -0.1936417107583833 and parameters: {'n_estimators': 3022, 'min_samples_split': 174, 'max_features': 0.8300000000000001, 'min_samples_leaf': 27, 'criterion': 'absolute_error', 'max_depth': 30, 'min_weight_fraction_leaf': 0.03, 'max_leaf_nodes': 100, 'bootstrap': False, 'ccp_alpha': 0.106}. Best is trial 74 with value: -0.18167313469617832.
[I 2025-04-15 23:14:04,200] Trial 159 finished with value: -0.18268269917119717 and parameters: {'n_estimators': 3170, 'min_samples_split': 175, 'max_features': 0.86, 'min_samples_leaf': 32, 'criterion': 'absolute_error', 'max_depth': 30, 'min_weight_fraction_leaf': 0.03, 'max_leaf_nodes': 100, 'bootstrap': True, 'ccp_alpha': 0.108, 'max_samples': 0.5}. Best is trial 74 with value: -0.18167313469617832.
[I 2025-04-15 23:14:07,589] Trial 160 finished with value: -0.19328880864471681 and parameters: {'n_estimators': 3035, 'min_samples_split': 174, 'max_features': 0.92, 'min_samples_leaf': 31, 'criterion': 'absolute_error', 'max_depth': 30, 'min_weight_fraction_leaf': 0.03, 'max_leaf_nodes': 100, 'bootstrap': True, 'ccp_alpha': 0.106, 'max_samples': 1.0}. Best is trial 74 with value: -0.18167313469617832.
[I 2025-04-15 23:14:10,816] Trial 161 finished with value: -0.18258939471345811 and parameters: {'n_estimators': 3115, 'min_samples_split': 168, 'max_features': 0.85, 'min_samples_leaf': 32, 'criterion': 'absolute_error', 'max_depth': 30, 'min_weight_fraction_leaf': 0.03, 'max_leaf_nodes': 100, 'bootstrap': True, 'ccp_alpha': 0.1, 'max_samples': 0.5}. Best is trial 74 with value: -0.18167313469617832.
