[I 2025-04-15 23:23:33,929] Trial 321 finished with value: -0.1933051682871004 and parameters: {'n_estimators': 3545, 'min_samples_split': 194, 'max_features': 0.98, 'min_samples_leaf': 22, 'criterion': 'absolute_error', 'max_depth': 30, 'min_weight_fraction_leaf': 0.01, 'max_leaf_nodes': 10, 'bootstrap': True, 'ccp_alpha': 0.111, 'max_samples': 1.0}. Best is trial 74 with value: -0.18167313469617832.
[I 2025-04-15 23:23:37,603] Trial 322 finished with value: -0.1828871337168835 and parameters: {'n_estimators': 3263, 'min_samples_split': 165, 'max_features': 0.9600000000000001, 'min_samples_leaf': 26, 'criterion': 'absolute_error', 'max_depth': 30, 'min_weight_fraction_leaf': 0.02, 'max_leaf_nodes': 100, 'bootstrap': True, 'ccp_alpha': 0.066, 'max_samples': 0.5}. Best is trial 74 with value: -0.18167313469617832.
[I 2025-04-15 23:23:44,124] Trial 323 finished with value: -0.1837500409771557 and parameters: {'n_estimators': 6318, 'min_samples_split': 172, 'max_features': 1.0, 'min_samples_leaf': 18, 'criterion': 'absolute_error', 'max_depth': 30, 'min_weight_fraction_leaf': 0.03, 'max_leaf_nodes': 100, 'bootstrap': True, 'ccp_alpha': 0.148, 'max_samples': 0.5}. Best is trial 74 with value: -0.18167313469617832.
[I 2025-04-15 23:23:50,392] Trial 324 finished with value: -0.19131219294051288 and parameters: {'n_estimators': 5620, 'min_samples_split': 161, 'max_features': 0.99, 'min_samples_leaf': 21, 'criterion': 'absolute_error', 'max_depth': 30, 'min_weight_fraction_leaf': 0.05, 'max_leaf_nodes': 100, 'bootstrap': True, 'ccp_alpha': 0.10200000000000001, 'max_samples': 0.75}. Best is trial 74 with value: -0.18167313469617832.
[I 2025-04-15 23:23:53,673] Trial 325 finished with value: -0.18266476865118345 and parameters: {'n_estimators': 3145, 'min_samples_split': 178, 'max_features': 0.3, 'min_samples_leaf': 24, 'criterion': 'absolute_error', 'max_depth': 30, 'min_weight_fraction_leaf': 0.02, 'max_leaf_nodes': 150, 'bootstrap': True, 'ccp_alpha': 0.051000000000000004, 'max_samples': 0.5}. Best is trial 74 with value: -0.18167313469617832.
[I 2025-04-15 23:24:01,282] Trial 326 finished with value: -17.554556350613595 and parameters: {'n_estimators': 8092, 'min_samples_split': 170, 'max_features': 0.79, 'min_samples_leaf': 31, 'criterion': 'friedman_mse', 'max_depth': 30, 'min_weight_fraction_leaf': 0.03, 'max_leaf_nodes': 100, 'bootstrap': True, 'ccp_alpha': 0.1, 'max_samples': 0.5}. Best is trial 74 with value: -0.18167313469617832.
[I 2025-04-15 23:24:04,947] Trial 327 finished with value: -0.1830020339850973 and parameters: {'n_estimators': 3383, 'min_samples_split': 167, 'max_features': 0.8300000000000001, 'min_samples_leaf': 26, 'criterion': 'absolute_error', 'max_depth': 30, 'min_weight_fraction_leaf': 0.02, 'max_leaf_nodes': 100, 'bootstrap': True, 'ccp_alpha': 0.073, 'max_samples': 0.5}. Best is trial 74 with value: -0.18167313469617832.
[I 2025-04-15 23:24:07,819] Trial 328 finished with value: -0.18293448706632826 and parameters: {'n_estimators': 2658, 'min_samples_split': 160, 'max_features': 1.0, 'min_samples_leaf': 28, 'criterion': 'absolute_error', 'max_depth': 45, 'min_weight_fraction_leaf': 0.02, 'max_leaf_nodes': 100, 'bootstrap': True, 'ccp_alpha': 0.129, 'max_samples': 0.5}. Best is trial 74 with value: -0.18167313469617832.
[I 2025-04-15 23:24:10,266] Trial 329 finished with value: -0.18386943363690578 and parameters: {'n_estimators': 2239, 'min_samples_split': 175, 'max_features': 0.8400000000000001, 'min_samples_leaf': 33, 'criterion': 'absolute_error', 'max_depth': 30, 'min_weight_fraction_leaf': 0.03, 'max_leaf_nodes': 100, 'bootstrap': True, 'ccp_alpha': 0.066, 'max_samples': 0.5}. Best is trial 74 with value: -0.18167313469617832.
[I 2025-04-15 23:24:13,760] Trial 330 finished with value: -0.1826183501076008 and parameters: {'n_estimators': 3146, 'min_samples_split': 166, 'max_features': 0.9400000000000001, 'min_samples_leaf': 23, 'criterion': 'absolute_error', 'max_depth': 30, 'min_weight_fraction_leaf': 0.02, 'max_leaf_nodes': 20, 'bootstrap': True, 'ccp_alpha': 0.11800000000000001, 'max_samples': 0.5}. Best is trial 74 with value: -0.18167313469617832.
[I 2025-04-15 23:24:15,983] Trial 331 finished with value: -0.1936417107583833 and parameters: {'n_estimators': 2862, 'min_samples_split': 159, 'max_features': 0.86, 'min_samples_leaf': 25, 'criterion': 'absolute_error', 'max_depth': 30, 'min_weight_fraction_leaf': 0.01, 'max_leaf_nodes': None, 'bootstrap': False, 'ccp_alpha': 0.106}. Best is trial 74 with value: -0.18167313469617832.
[I 2025-04-15 23:24:18,620] Trial 332 finished with value: -0.1838754713230733 and parameters: {'n_estimators': 2433, 'min_samples_split': 182, 'max_features': 0.81, 'min_samples_leaf': 29, 'criterion': 'absolute_error', 'max_depth': 30, 'min_weight_fraction_leaf': 0.02, 'max_leaf_nodes': 100, 'bootstrap': True, 'ccp_alpha': 0.093, 'max_samples': 0.5}. Best is trial 74 with value: -0.18167313469617832.
[I 2025-04-15 23:24:22,539] Trial 333 finished with value: -0.18352179017641163 and parameters: {'n_estimators': 3726, 'min_samples_split': 136, 'max_features': 0.88, 'min_samples_leaf': 27, 'criterion': 'absolute_error', 'max_depth': 30, 'min_weight_fraction_leaf': 0.03, 'max_leaf_nodes': 10, 'bootstrap': True, 'ccp_alpha': 0.079, 'max_samples': 0.5}. Best is trial 74 with value: -0.18167313469617832.
[I 2025-04-15 23:24:26,565] Trial 334 finished with value: -0.1830841139484336 and parameters: {'n_estimators': 3415, 'min_samples_split': 163, 'max_features': 0.8300000000000001, 'min_samples_leaf': 31, 'criterion': 'absolute_error', 'max_depth': 15, 'min_weight_fraction_leaf': 0.08, 'max_leaf_nodes': 100, 'bootstrap': True, 'ccp_alpha': 0.056, 'max_samples': 0.5}. Best is trial 74 with value: -0.18167313469617832.
[I 2025-04-15 23:24:29,728] Trial 335 finished with value: -17.9748788009806 and parameters: {'n_estimators': 3128, 'min_samples_split': 172, 'max_features': 0.78, 'min_samples_leaf': 16, 'criterion': 'squared_error', 'max_depth': 10, 'min_weight_fraction_leaf': 0.02, 'max_leaf_nodes': 100, 'bootstrap': True, 'ccp_alpha': 0.111, 'max_samples': 0.5}. Best is trial 74 with value: -0.18167313469617832.
[I 2025-04-15 23:24:32,719] Trial 336 finished with value: -0.18266976251677042 and parameters: {'n_estimators': 2750, 'min_samples_split': 176, 'max_features': 0.91, 'min_samples_leaf': 20, 'criterion': 'absolute_error', 'max_depth': 30, 'min_weight_fraction_leaf': 0.02, 'max_leaf_nodes': 100, 'bootstrap': True, 'ccp_alpha': 0.097, 'max_samples': 0.5}. Best is trial 74 with value: -0.18167313469617832.
[I 2025-04-15 23:24:36,375] Trial 337 finished with value: -0.1825947393130562 and parameters: {'n_estimators': 2994, 'min_samples_split': 145, 'max_features': 0.85, 'min_samples_leaf': 25, 'criterion': 'absolute_error', 'max_depth': 30, 'min_weight_fraction_leaf': 0.03, 'max_leaf_nodes': 100, 'bootstrap': True, 'ccp_alpha': 0.10300000000000001, 'max_samples': 0.5}. Best is trial 74 with value: -0.18167313469617832.
[I 2025-04-15 23:24:39,953] Trial 338 finished with value: -0.18296485838144835 and parameters: {'n_estimators': 3321, 'min_samples_split': 64, 'max_features': 0.93, 'min_samples_leaf': 71, 'criterion': 'absolute_error', 'max_depth': 60, 'min_weight_fraction_leaf': 0.02, 'max_leaf_nodes': 100, 'bootstrap': True, 'ccp_alpha': 0.089, 'max_samples': 0.5}. Best is trial 74 with value: -0.18167313469617832.
[I 2025-04-15 23:24:48,849] Trial 339 finished with value: -0.18473118276783862 and parameters: {'n_estimators': 8593, 'min_samples_split': 168, 'max_features': 0.8, 'min_samples_leaf': 45, 'criterion': 'absolute_error', 'max_depth': 30, 'min_weight_fraction_leaf': 0.01, 'max_leaf_nodes': 100, 'bootstrap': True, 'ccp_alpha': 0.123, 'max_samples': 0.5}. Best is trial 74 with value: -0.18167313469617832.
[I 2025-04-15 23:24:53,065] Trial 340 finished with value: -0.18328114684588287 and parameters: {'n_estimators': 3572, 'min_samples_split': 152, 'max_features': 0.87, 'min_samples_leaf': 22, 'criterion': 'absolute_error', 'max_depth': 5, 'min_weight_fraction_leaf': 0.02, 'max_leaf_nodes': 100, 'bootstrap': True, 'ccp_alpha': 0.085, 'max_samples': 0.5}. Best is trial 74 with value: -0.18167313469617832.
[I 2025-04-15 23:24:56,115] Trial 341 finished with value: -18.17842931519488 and parameters: {'n_estimators': 2907, 'min_samples_split': 157, 'max_features': 0.9600000000000001, 'min_samples_leaf': 29, 'criterion': 'poisson', 'max_depth': 30, 'min_weight_fraction_leaf': 0.04, 'max_leaf_nodes': 100, 'bootstrap': True, 'ccp_alpha': 0.113, 'max_samples': 0.5}. Best is trial 74 with value: -0.18167313469617832.
[I 2025-04-15 23:24:59,046] Trial 342 finished with value: -0.19324799583507185 and parameters: {'n_estimators': 2634, 'min_samples_split': 163, 'max_features': 0.8200000000000001, 'min_samples_leaf': 34, 'criterion': 'absolute_error', 'max_depth': 30, 'min_weight_fraction_leaf': 0.02, 'max_leaf_nodes': 10, 'bootstrap': True, 'ccp_alpha': 0.094, 'max_samples': None}. Best is trial 74 with value: -0.18167313469617832.
[I 2025-04-15 23:24:59,201] Trial 343 finished with value: -0.1936354417750235 and parameters: {'n_estimators': 39, 'min_samples_split': 185, 'max_features': 0.8400000000000001, 'min_samples_leaf': 27, 'criterion': 'absolute_error', 'max_depth': 30, 'min_weight_fraction_leaf': 0.03, 'max_leaf_nodes': 100, 'bootstrap': True, 'ccp_alpha': 0.10400000000000001, 'max_samples': 0.5}. Best is trial 74 with value: -0.18167313469617832.
[I 2025-04-15 23:25:03,159] Trial 344 finished with value: -0.18265910004164015 and parameters: {'n_estimators': 3143, 'min_samples_split': 169, 'max_features': 0.89, 'min_samples_leaf': 23, 'criterion': 'absolute_error', 'max_depth': 45, 'min_weight_fraction_leaf': 0.03, 'max_leaf_nodes': 100, 'bootstrap': True, 'ccp_alpha': 0.07, 'max_samples': 0.5}. Best is trial 74 with value: -0.18167313469617832.
[I 2025-04-15 23:25:06,452] Trial 345 finished with value: -0.18252264530381224 and parameters: {'n_estimators': 2970, 'min_samples_split': 174, 'max_features': 0.86, 'min_samples_leaf': 37, 'criterion': 'absolute_error', 'max_depth': 30, 'min_weight_fraction_leaf': 0.02, 'max_leaf_nodes': 50, 'bootstrap': True, 'ccp_alpha': 0.08, 'max_samples': 0.5}. Best is trial 74 with value: -0.18167313469617832.
[I 2025-04-15 23:25:09,873] Trial 346 finished with value: -0.1828799000659623 and parameters: {'n_estimators': 2816, 'min_samples_split': 179, 'max_features': 0.87, 'min_samples_leaf': 37, 'criterion': 'absolute_error', 'max_depth': 30, 'min_weight_fraction_leaf': 0.02, 'max_leaf_nodes': 50, 'bootstrap': True, 'ccp_alpha': 0.078, 'max_samples': 0.5}. Best is trial 74 with value: -0.18167313469617832.
[I 2025-04-15 23:25:13,661] Trial 347 finished with value: -0.19328055720598852 and parameters: {'n_estimators': 3271, 'min_samples_split': 173, 'max_features': 0.86, 'min_samples_leaf': 31, 'criterion': 'absolute_error', 'max_depth': 30, 'min_weight_fraction_leaf': 0.02, 'max_leaf_nodes': 50, 'bootstrap': True, 'ccp_alpha': 0.069, 'max_samples': 1.0}. Best is trial 74 with value: -0.18167313469617832.
[I 2025-04-15 23:25:16,432] Trial 348 finished with value: -0.18305881934616242 and parameters: {'n_estimators': 2521, 'min_samples_split': 178, 'max_features': 0.91, 'min_samples_leaf': 40, 'criterion': 'absolute_error', 'max_depth': 30, 'min_weight_fraction_leaf': 0.06, 'max_leaf_nodes': 50, 'bootstrap': True, 'ccp_alpha': 0.058, 'max_samples': 0.5}. Best is trial 74 with value: -0.18167313469617832.
[I 2025-04-15 23:25:19,655] Trial 349 finished with value: -0.1826105440082686 and parameters: {'n_estimators': 3035, 'min_samples_split': 174, 'max_features': 0.89, 'min_samples_leaf': 76, 'criterion': 'absolute_error', 'max_depth': 30, 'min_weight_fraction_leaf': 0.03, 'max_leaf_nodes': None, 'bootstrap': True, 'ccp_alpha': 0.081, 'max_samples': 0.5}. Best is trial 74 with value: -0.18167313469617832.
[I 2025-04-15 23:25:23,715] Trial 350 finished with value: -0.1911424725469586 and parameters: {'n_estimators': 3460, 'min_samples_split': 169, 'max_features': 0.8400000000000001, 'min_samples_leaf': 33, 'criterion': 'absolute_error', 'max_depth': 30, 'min_weight_fraction_leaf': 0.01, 'max_leaf_nodes': 50, 'bootstrap': True, 'ccp_alpha': 0.117, 'max_samples': 0.75}. Best is trial 74 with value: -0.18167313469617832.
[I 2025-04-15 23:25:26,496] Trial 351 finished with value: -18.167616031581915 and parameters: {'n_estimators': 2760, 'min_samples_split': 181, 'max_features': 0.41000000000000003, 'min_samples_leaf': 30, 'criterion': 'friedman_mse', 'max_depth': 30, 'min_weight_fraction_leaf': 0.02, 'max_leaf_nodes': 10, 'bootstrap': True, 'ccp_alpha': 0.108, 'max_samples': 0.5}. Best is trial 74 with value: -0.18167313469617832.
[I 2025-04-15 23:25:31,490] Trial 352 finished with value: -0.1835130422162466 and parameters: {'n_estimators': 4619, 'min_samples_split': 165, 'max_features': 0.25, 'min_samples_leaf': 36, 'criterion': 'absolute_error', 'max_depth': 30, 'min_weight_fraction_leaf': 0.02, 'max_leaf_nodes': 50, 'bootstrap': True, 'ccp_alpha': 0.099, 'max_samples': 0.5}. Best is trial 74 with value: -0.18167313469617832.
[I 2025-04-15 23:25:34,159] Trial 353 finished with value: -0.1936417107583833 and parameters: {'n_estimators': 3191, 'min_samples_split': 173, 'max_features': 0.93, 'min_samples_leaf': 32, 'criterion': 'absolute_error', 'max_depth': 5, 'min_weight_fraction_leaf': 0.02, 'max_leaf_nodes': 50, 'bootstrap': False, 'ccp_alpha': 0.093}. Best is trial 74 with value: -0.18167313469617832.
[I 2025-04-15 23:25:38,581] Trial 354 finished with value: -0.1830537161864339 and parameters: {'n_estimators': 3968, 'min_samples_split': 177, 'max_features': 0.86, 'min_samples_leaf': 28, 'criterion': 'absolute_error', 'max_depth': 60, 'min_weight_fraction_leaf': 0.01, 'max_leaf_nodes': 100, 'bootstrap': True, 'ccp_alpha': 0.074, 'max_samples': 0.5}. Best is trial 74 with value: -0.18167313469617832.
[I 2025-04-15 23:25:41,663] Trial 355 finished with value: -0.18260030324207216 and parameters: {'n_estimators': 2944, 'min_samples_split': 170, 'max_features': 0.97, 'min_samples_leaf': 25, 'criterion': 'absolute_error', 'max_depth': 30, 'min_weight_fraction_leaf': 0.04, 'max_leaf_nodes': 100, 'bootstrap': True, 'ccp_alpha': 0.08600000000000001, 'max_samples': 0.5}. Best is trial 74 with value: -0.18167313469617832.
[I 2025-04-15 23:25:45,301] Trial 356 finished with value: -0.18293442275599917 and parameters: {'n_estimators': 3357, 'min_samples_split': 165, 'max_features': 0.88, 'min_samples_leaf': 34, 'criterion': 'absolute_error', 'max_depth': 30, 'min_weight_fraction_leaf': 0.03, 'max_leaf_nodes': 150, 'bootstrap': True, 'ccp_alpha': 0.101, 'max_samples': 0.5}. Best is trial 74 with value: -0.18167313469617832.
[I 2025-04-15 23:25:48,787] Trial 357 finished with value: -0.18252010676334668 and parameters: {'n_estimators': 3091, 'min_samples_split': 183, 'max_features': 0.91, 'min_samples_leaf': 29, 'criterion': 'absolute_error', 'max_depth': 45, 'min_weight_fraction_leaf': 0.02, 'max_leaf_nodes': 100, 'bootstrap': True, 'ccp_alpha': 0.113, 'max_samples': 0.5}. Best is trial 74 with value: -0.18167313469617832.
[I 2025-04-15 23:25:50,724] Trial 358 finished with value: -0.18715459749555183 and parameters: {'n_estimators': 1656, 'min_samples_split': 182, 'max_features': 0.91, 'min_samples_leaf': 67, 'criterion': 'absolute_error', 'max_depth': 45, 'min_weight_fraction_leaf': 0.02, 'max_leaf_nodes': 100, 'bootstrap': True, 'ccp_alpha': 0.12, 'max_samples': 0.5}. Best is trial 74 with value: -0.18167313469617832.
[I 2025-04-15 23:25:54,924] Trial 359 finished with value: -0.1834559114271445 and parameters: {'n_estimators': 3655, 'min_samples_split': 188, 'max_features': 0.9400000000000001, 'min_samples_leaf': 29, 'criterion': 'absolute_error', 'max_depth': 45, 'min_weight_fraction_leaf': 0.02, 'max_leaf_nodes': 100, 'bootstrap': True, 'ccp_alpha': 0.127, 'max_samples': 0.5}. Best is trial 74 with value: -0.18167313469617832.
[I 2025-04-15 23:25:58,421] Trial 360 finished with value: -0.18267146334877554 and parameters: {'n_estimators': 3166, 'min_samples_split': 186, 'max_features': 0.9, 'min_samples_leaf': 26, 'criterion': 'absolute_error', 'max_depth': 45, 'min_weight_fraction_leaf': 0.03, 'max_leaf_nodes': 20, 'bootstrap': True, 'ccp_alpha': 0.113, 'max_samples': 0.5}. Best is trial 74 with value: -0.18167313469617832.
[I 2025-04-15 23:26:01,263] Trial 361 finished with value: -18.15757987046055 and parameters: {'n_estimators': 2710, 'min_samples_split': 192, 'max_features': 0.92, 'min_samples_leaf': 23, 'criterion': 'squared_error', 'max_depth': 45, 'min_weight_fraction_leaf': 0.03, 'max_leaf_nodes': None, 'bootstrap': True, 'ccp_alpha': 0.108, 'max_samples': 0.5}. Best is trial 74 with value: -0.18167313469617832.
[I 2025-04-15 23:26:04,537] Trial 362 finished with value: -0.1825750758135402 and parameters: {'n_estimators': 3023, 'min_samples_split': 178, 'max_features': 0.89, 'min_samples_leaf': 28, 'criterion': 'absolute_error', 'max_depth': 45, 'min_weight_fraction_leaf': 0.02, 'max_leaf_nodes': 100, 'bootstrap': True, 'ccp_alpha': 0.117, 'max_samples': 0.5}. Best is trial 74 with value: -0.18167313469617832.
[I 2025-04-15 23:26:08,489] Trial 363 finished with value: -0.1829761313803575 and parameters: {'n_estimators': 3373, 'min_samples_split': 184, 'max_features': 0.89, 'min_samples_leaf': 27, 'criterion': 'absolute_error', 'max_depth': 45, 'min_weight_fraction_leaf': 0.02, 'max_leaf_nodes': 100, 'bootstrap': True, 'ccp_alpha': 0.11900000000000001, 'max_samples': 0.5}. Best is trial 74 with value: -0.18167313469617832.
[I 2025-04-15 23:26:09,806] Trial 364 finished with value: -0.18660763814528708 and parameters: {'n_estimators': 1166, 'min_samples_split': 179, 'max_features': 0.9400000000000001, 'min_samples_leaf': 24, 'criterion': 'absolute_error', 'max_depth': 45, 'min_weight_fraction_leaf': 0.01, 'max_leaf_nodes': 10, 'bootstrap': True, 'ccp_alpha': 0.125, 'max_samples': 0.5}. Best is trial 74 with value: -0.18167313469617832.
[I 2025-04-15 23:26:12,990] Trial 365 finished with value: -0.18279199295555362 and parameters: {'n_estimators': 2928, 'min_samples_split': 176, 'max_features': 0.92, 'min_samples_leaf': 80, 'criterion': 'absolute_error', 'max_depth': 45, 'min_weight_fraction_leaf': 0.02, 'max_leaf_nodes': 100, 'bootstrap': True, 'ccp_alpha': 0.116, 'max_samples': 0.5}. Best is trial 74 with value: -0.18167313469617832.
[I 2025-04-15 23:26:15,473] Trial 366 finished with value: -18.212541266471362 and parameters: {'n_estimators': 2439, 'min_samples_split': 195, 'max_features': 0.89, 'min_samples_leaf': 20, 'criterion': 'poisson', 'max_depth': 45, 'min_weight_fraction_leaf': 0.05, 'max_leaf_nodes': 100, 'bootstrap': True, 'ccp_alpha': 0.112, 'max_samples': 0.5}. Best is trial 74 with value: -0.18167313469617832.
[I 2025-04-15 23:26:16,537] Trial 367 finished with value: -0.18588860843208885 and parameters: {'n_estimators': 670, 'min_samples_split': 182, 'max_features': 0.87, 'min_samples_leaf': 28, 'criterion': 'absolute_error', 'max_depth': 45, 'min_weight_fraction_leaf': 0.02, 'max_leaf_nodes': 50, 'bootstrap': True, 'ccp_alpha': 0.123, 'max_samples': 0.5}. Best is trial 74 with value: -0.18167313469617832.
[I 2025-04-15 23:26:20,787] Trial 368 finished with value: -0.19328272650244557 and parameters: {'n_estimators': 3291, 'min_samples_split': 90, 'max_features': 0.9500000000000001, 'min_samples_leaf': 25, 'criterion': 'absolute_error', 'max_depth': 45, 'min_weight_fraction_leaf': 0.03, 'max_leaf_nodes': 100, 'bootstrap': True, 'ccp_alpha': 0.108, 'max_samples': None}. Best is trial 74 with value: -0.18167313469617832.
[I 2025-04-15 23:26:23,719] Trial 369 finished with value: -0.1825433052533692 and parameters: {'n_estimators': 3099, 'min_samples_split': 174, 'max_features': 0.91, 'min_samples_leaf': 22, 'criterion': 'absolute_error', 'max_depth': 45, 'min_weight_fraction_leaf': 0.01, 'max_leaf_nodes': 100, 'bootstrap': True, 'ccp_alpha': 0.131, 'max_samples': 0.5}. Best is trial 74 with value: -0.18167313469617832.
[I 2025-04-15 23:26:27,218] Trial 370 finished with value: -0.18336929243007796 and parameters: {'n_estimators': 3609, 'min_samples_split': 177, 'max_features': 0.93, 'min_samples_leaf': 17, 'criterion': 'absolute_error', 'max_depth': 45, 'min_weight_fraction_leaf': 0.0, 'max_leaf_nodes': 100, 'bootstrap': True, 'ccp_alpha': 0.135, 'max_samples': 0.5}. Best is trial 74 with value: -0.18167313469617832.
[I 2025-04-15 23:26:29,656] Trial 371 finished with value: -0.1936417107583833 and parameters: {'n_estimators': 2807, 'min_samples_split': 172, 'max_features': 0.91, 'min_samples_leaf': 21, 'criterion': 'absolute_error', 'max_depth': 45, 'min_weight_fraction_leaf': 0.01, 'max_leaf_nodes': 100, 'bootstrap': False, 'ccp_alpha': 0.14400000000000002}. Best is trial 74 with value: -0.18167313469617832.
[I 2025-04-15 23:26:32,439] Trial 372 finished with value: -0.18287316393893124 and parameters: {'n_estimators': 2606, 'min_samples_split': 186, 'max_features': 0.97, 'min_samples_leaf': 22, 'criterion': 'absolute_error', 'max_depth': 45, 'min_weight_fraction_leaf': 0.0, 'max_leaf_nodes': 100, 'bootstrap': True, 'ccp_alpha': 0.129, 'max_samples': 0.5}. Best is trial 74 with value: -0.18167313469617832.
[I 2025-04-15 23:26:42,664] Trial 373 finished with value: -0.18477064857980077 and parameters: {'n_estimators': 9560, 'min_samples_split': 179, 'max_features': 0.91, 'min_samples_leaf': 19, 'criterion': 'absolute_error', 'max_depth': 45, 'min_weight_fraction_leaf': 0.01, 'max_leaf_nodes': 100, 'bootstrap': True, 'ccp_alpha': 0.106, 'max_samples': 0.5}. Best is trial 74 with value: -0.18167313469617832.
