[I 2025-04-16 01:53:24,503] Trial 3117 finished with value: 0.02033680332036536 and parameters: {'n_estimators': 2335, 'min_samples_split': 17, 'max_features': 0.9, 'min_samples_leaf': 6, 'criterion': 'absolute_error', 'max_depth': None, 'min_weight_fraction_leaf': 0.04, 'max_leaf_nodes': 300, 'bootstrap': False, 'ccp_alpha': 0.005}. Best is trial 2774 with value: 0.046571421912873.
[I 2025-04-16 01:53:27,057] Trial 3118 finished with value: -0.1936417107583833 and parameters: {'n_estimators': 2076, 'min_samples_split': 9, 'max_features': 0.86, 'min_samples_leaf': 9, 'criterion': 'absolute_error', 'max_depth': None, 'min_weight_fraction_leaf': 0.0, 'max_leaf_nodes': 300, 'bootstrap': False, 'ccp_alpha': 0.013000000000000001}. Best is trial 2774 with value: 0.046571421912873.
[I 2025-04-16 01:53:28,629] Trial 3119 finished with value: -0.1936417107583833 and parameters: {'n_estimators': 1447, 'min_samples_split': 13, 'max_features': 0.91, 'min_samples_leaf': 4, 'criterion': 'absolute_error', 'max_depth': None, 'min_weight_fraction_leaf': 0.0, 'max_leaf_nodes': 300, 'bootstrap': False, 'ccp_alpha': 0.009000000000000001}. Best is trial 2774 with value: 0.046571421912873.
[I 2025-04-16 01:53:30,504] Trial 3120 finished with value: -0.1936417107583833 and parameters: {'n_estimators': 1886, 'min_samples_split': 9, 'max_features': 0.93, 'min_samples_leaf': 7, 'criterion': 'absolute_error', 'max_depth': None, 'min_weight_fraction_leaf': 0.0, 'max_leaf_nodes': None, 'bootstrap': False, 'ccp_alpha': 0.023}. Best is trial 2774 with value: 0.046571421912873.
[I 2025-04-16 01:53:32,311] Trial 3121 finished with value: -0.1936417107583833 and parameters: {'n_estimators': 1649, 'min_samples_split': 17, 'max_features': 0.89, 'min_samples_leaf': 4, 'criterion': 'absolute_error', 'max_depth': None, 'min_weight_fraction_leaf': 0.0, 'max_leaf_nodes': 300, 'bootstrap': False, 'ccp_alpha': 0.016}. Best is trial 2774 with value: 0.046571421912873.
[I 2025-04-16 01:53:33,731] Trial 3122 finished with value: -4.519692945270897 and parameters: {'n_estimators': 1250, 'min_samples_split': 14, 'max_features': 0.53, 'min_samples_leaf': 6, 'criterion': 'absolute_error', 'max_depth': None, 'min_weight_fraction_leaf': 0.0, 'max_leaf_nodes': 20, 'bootstrap': False, 'ccp_alpha': 0.0}. Best is trial 2774 with value: 0.046571421912873.
[I 2025-04-16 01:53:35,781] Trial 3123 finished with value: -0.1936417107583833 and parameters: {'n_estimators': 2127, 'min_samples_split': 9, 'max_features': 0.92, 'min_samples_leaf': 9, 'criterion': 'absolute_error', 'max_depth': None, 'min_weight_fraction_leaf': 0.0, 'max_leaf_nodes': 300, 'bootstrap': False, 'ccp_alpha': 0.029}. Best is trial 2774 with value: 0.046571421912873.
[I 2025-04-16 01:53:37,551] Trial 3124 finished with value: -0.1936417107583833 and parameters: {'n_estimators': 1471, 'min_samples_split': 13, 'max_features': 0.87, 'min_samples_leaf': 4, 'criterion': 'absolute_error', 'max_depth': None, 'min_weight_fraction_leaf': 0.0, 'max_leaf_nodes': 300, 'bootstrap': False, 'ccp_alpha': 0.009000000000000001}. Best is trial 2774 with value: 0.046571421912873.
[I 2025-04-16 01:53:39,542] Trial 3125 finished with value: -17.528986382276578 and parameters: {'n_estimators': 1787, 'min_samples_split': 9, 'max_features': 0.9, 'min_samples_leaf': 7, 'criterion': 'squared_error', 'max_depth': None, 'min_weight_fraction_leaf': 0.05, 'max_leaf_nodes': 300, 'bootstrap': False, 'ccp_alpha': 0.005}. Best is trial 2774 with value: 0.046571421912873.
[I 2025-04-16 01:53:41,114] Trial 3126 finished with value: -0.1936417107583833 and parameters: {'n_estimators': 1309, 'min_samples_split': 18, 'max_features': 0.93, 'min_samples_leaf': 5, 'criterion': 'absolute_error', 'max_depth': None, 'min_weight_fraction_leaf': 0.09, 'max_leaf_nodes': 300, 'bootstrap': False, 'ccp_alpha': 0.01}. Best is trial 2774 with value: 0.046571421912873.
[I 2025-04-16 01:53:43,194] Trial 3127 finished with value: -7.1204069952330205 and parameters: {'n_estimators': 2306, 'min_samples_split': 13, 'max_features': 0.88, 'min_samples_leaf': 8, 'criterion': 'absolute_error', 'max_depth': None, 'min_weight_fraction_leaf': 0.0, 'max_leaf_nodes': 300, 'bootstrap': False, 'ccp_alpha': 0.0}. Best is trial 2774 with value: 0.046571421912873.
[I 2025-04-16 01:53:44,546] Trial 3128 finished with value: -0.1936417107583833 and parameters: {'n_estimators': 1104, 'min_samples_split': 9, 'max_features': 0.91, 'min_samples_leaf': 4, 'criterion': 'absolute_error', 'max_depth': None, 'min_weight_fraction_leaf': 0.0, 'max_leaf_nodes': 300, 'bootstrap': False, 'ccp_alpha': 0.018000000000000002}. Best is trial 2774 with value: 0.046571421912873.
[I 2025-04-16 01:53:46,660] Trial 3129 finished with value: -0.06936122561945335 and parameters: {'n_estimators': 1649, 'min_samples_split': 17, 'max_features': 0.85, 'min_samples_leaf': 6, 'criterion': 'absolute_error', 'max_depth': None, 'min_weight_fraction_leaf': 0.0, 'max_leaf_nodes': 300, 'bootstrap': False, 'ccp_alpha': 0.005}. Best is trial 2774 with value: 0.046571421912873.
[I 2025-04-16 01:53:48,686] Trial 3130 finished with value: -0.1936417107583833 and parameters: {'n_estimators': 1893, 'min_samples_split': 9, 'max_features': 0.93, 'min_samples_leaf': 9, 'criterion': 'absolute_error', 'max_depth': None, 'min_weight_fraction_leaf': 0.04, 'max_leaf_nodes': 300, 'bootstrap': False, 'ccp_alpha': 0.014}. Best is trial 2774 with value: 0.046571421912873.
[I 2025-04-16 01:53:50,945] Trial 3131 finished with value: -20.714111398761112 and parameters: {'n_estimators': 2117, 'min_samples_split': 13, 'max_features': 0.89, 'min_samples_leaf': 4, 'criterion': 'poisson', 'max_depth': None, 'min_weight_fraction_leaf': 0.0, 'max_leaf_nodes': 300, 'bootstrap': False, 'ccp_alpha': 0.005}. Best is trial 2774 with value: 0.046571421912873.
[I 2025-04-16 01:53:52,613] Trial 3132 finished with value: -0.1936417107583833 and parameters: {'n_estimators': 1531, 'min_samples_split': 9, 'max_features': 0.91, 'min_samples_leaf': 7, 'criterion': 'absolute_error', 'max_depth': None, 'min_weight_fraction_leaf': 0.0, 'max_leaf_nodes': 300, 'bootstrap': False, 'ccp_alpha': 0.009000000000000001}. Best is trial 2774 with value: 0.046571421912873.
[I 2025-04-16 01:53:54,350] Trial 3133 finished with value: -9.363248840071797 and parameters: {'n_estimators': 1720, 'min_samples_split': 13, 'max_features': 0.87, 'min_samples_leaf': 6, 'criterion': 'absolute_error', 'max_depth': None, 'min_weight_fraction_leaf': 0.0, 'max_leaf_nodes': 300, 'bootstrap': False, 'ccp_alpha': 0.0}. Best is trial 2774 with value: 0.046571421912873.
[I 2025-04-16 01:53:55,803] Trial 3134 finished with value: -0.1936417107583833 and parameters: {'n_estimators': 1266, 'min_samples_split': 19, 'max_features': 0.9400000000000001, 'min_samples_leaf': 9, 'criterion': 'absolute_error', 'max_depth': None, 'min_weight_fraction_leaf': 0.0, 'max_leaf_nodes': 300, 'bootstrap': False, 'ccp_alpha': 0.015}. Best is trial 2774 with value: 0.046571421912873.
[I 2025-04-16 01:53:58,184] Trial 3135 finished with value: -0.1936417107583833 and parameters: {'n_estimators': 2300, 'min_samples_split': 9, 'max_features': 0.9, 'min_samples_leaf': 93, 'criterion': 'absolute_error', 'max_depth': None, 'min_weight_fraction_leaf': 0.0, 'max_leaf_nodes': 300, 'bootstrap': False, 'ccp_alpha': 0.005}. Best is trial 2774 with value: 0.046571421912873.
[I 2025-04-16 01:54:00,237] Trial 3136 finished with value: -0.1936417107583833 and parameters: {'n_estimators': 1883, 'min_samples_split': 17, 'max_features': 0.92, 'min_samples_leaf': 4, 'criterion': 'absolute_error', 'max_depth': None, 'min_weight_fraction_leaf': 0.0, 'max_leaf_nodes': 300, 'bootstrap': False, 'ccp_alpha': 0.023}. Best is trial 2774 with value: 0.046571421912873.
[I 2025-04-16 01:54:01,995] Trial 3137 finished with value: -0.1936417107583833 and parameters: {'n_estimators': 1632, 'min_samples_split': 12, 'max_features': 0.88, 'min_samples_leaf': 6, 'criterion': 'absolute_error', 'max_depth': None, 'min_weight_fraction_leaf': 0.0, 'max_leaf_nodes': 300, 'bootstrap': False, 'ccp_alpha': 0.01}. Best is trial 2774 with value: 0.046571421912873.
[I 2025-04-16 01:54:03,299] Trial 3138 finished with value: 0.021633197101010238 and parameters: {'n_estimators': 1072, 'min_samples_split': 9, 'max_features': 0.93, 'min_samples_leaf': 4, 'criterion': 'absolute_error', 'max_depth': None, 'min_weight_fraction_leaf': 0.0, 'max_leaf_nodes': 300, 'bootstrap': False, 'ccp_alpha': 0.005}. Best is trial 2774 with value: 0.046571421912873.
[I 2025-04-16 01:54:04,711] Trial 3139 finished with value: -0.1936417107583833 and parameters: {'n_estimators': 1204, 'min_samples_split': 9, 'max_features': 0.9400000000000001, 'min_samples_leaf': 4, 'criterion': 'absolute_error', 'max_depth': None, 'min_weight_fraction_leaf': 0.0, 'max_leaf_nodes': 300, 'bootstrap': False, 'ccp_alpha': 0.216}. Best is trial 2774 with value: 0.046571421912873.
[I 2025-04-16 01:54:05,816] Trial 3140 finished with value: -14.64275568070102 and parameters: {'n_estimators': 936, 'min_samples_split': 9, 'max_features': 0.9400000000000001, 'min_samples_leaf': 5, 'criterion': 'friedman_mse', 'max_depth': None, 'min_weight_fraction_leaf': 0.07, 'max_leaf_nodes': 300, 'bootstrap': False, 'ccp_alpha': 0.0}. Best is trial 2774 with value: 0.046571421912873.
[I 2025-04-16 01:54:07,623] Trial 3141 finished with value: -0.1936417107583833 and parameters: {'n_estimators': 1516, 'min_samples_split': 8, 'max_features': 0.9400000000000001, 'min_samples_leaf': 4, 'criterion': 'absolute_error', 'max_depth': None, 'min_weight_fraction_leaf': 0.1, 'max_leaf_nodes': 300, 'bootstrap': False, 'ccp_alpha': 0.018000000000000002}. Best is trial 2774 with value: 0.046571421912873.
[I 2025-04-16 01:54:08,830] Trial 3142 finished with value: -0.1936417107583833 and parameters: {'n_estimators': 911, 'min_samples_split': 9, 'max_features': 0.93, 'min_samples_leaf': 4, 'criterion': 'absolute_error', 'max_depth': None, 'min_weight_fraction_leaf': 0.0, 'max_leaf_nodes': 300, 'bootstrap': False, 'ccp_alpha': 0.01}. Best is trial 2774 with value: 0.046571421912873.
[I 2025-04-16 01:54:10,021] Trial 3143 finished with value: -0.1936417107583833 and parameters: {'n_estimators': 1015, 'min_samples_split': 8, 'max_features': 0.91, 'min_samples_leaf': 4, 'criterion': 'absolute_error', 'max_depth': None, 'min_weight_fraction_leaf': 0.0, 'max_leaf_nodes': 300, 'bootstrap': False, 'ccp_alpha': 0.014}. Best is trial 2774 with value: 0.046571421912873.
[I 2025-04-16 01:54:11,326] Trial 3144 finished with value: 0.020508804226534692 and parameters: {'n_estimators': 1028, 'min_samples_split': 8, 'max_features': 0.9400000000000001, 'min_samples_leaf': 4, 'criterion': 'absolute_error', 'max_depth': None, 'min_weight_fraction_leaf': 0.0, 'max_leaf_nodes': 300, 'bootstrap': False, 'ccp_alpha': 0.005}. Best is trial 2774 with value: 0.046571421912873.
[I 2025-04-16 01:54:12,638] Trial 3145 finished with value: -0.1936417107583833 and parameters: {'n_estimators': 1024, 'min_samples_split': 8, 'max_features': 0.9, 'min_samples_leaf': 4, 'criterion': 'absolute_error', 'max_depth': None, 'min_weight_fraction_leaf': 0.0, 'max_leaf_nodes': 300, 'bootstrap': False, 'ccp_alpha': 0.01}. Best is trial 2774 with value: 0.046571421912873.
[I 2025-04-16 01:54:13,739] Trial 3146 finished with value: -0.1936417107583833 and parameters: {'n_estimators': 804, 'min_samples_split': 8, 'max_features': 0.89, 'min_samples_leaf': 6, 'criterion': 'absolute_error', 'max_depth': None, 'min_weight_fraction_leaf': 0.0, 'max_leaf_nodes': 300, 'bootstrap': False, 'ccp_alpha': 0.018000000000000002}. Best is trial 2774 with value: 0.046571421912873.
[I 2025-04-16 01:54:15,024] Trial 3147 finished with value: -10.920230253756902 and parameters: {'n_estimators': 1093, 'min_samples_split': 12, 'max_features': 0.86, 'min_samples_leaf': 4, 'criterion': 'absolute_error', 'max_depth': None, 'min_weight_fraction_leaf': 0.0, 'max_leaf_nodes': 300, 'bootstrap': False, 'ccp_alpha': 0.0}. Best is trial 2774 with value: 0.046571421912873.
[I 2025-04-16 01:54:16,023] Trial 3148 finished with value: 0.02076502021987714 and parameters: {'n_estimators': 746, 'min_samples_split': 9, 'max_features': 0.92, 'min_samples_leaf': 7, 'criterion': 'absolute_error', 'max_depth': None, 'min_weight_fraction_leaf': 0.0, 'max_leaf_nodes': 300, 'bootstrap': False, 'ccp_alpha': 0.005}. Best is trial 2774 with value: 0.046571421912873.
[I 2025-04-16 01:54:17,272] Trial 3149 finished with value: -17.528986382276024 and parameters: {'n_estimators': 1216, 'min_samples_split': 8, 'max_features': 0.9400000000000001, 'min_samples_leaf': 81, 'criterion': 'squared_error', 'max_depth': None, 'min_weight_fraction_leaf': 0.0, 'max_leaf_nodes': 300, 'bootstrap': False, 'ccp_alpha': 0.01}. Best is trial 2774 with value: 0.046571421912873.
[I 2025-04-16 01:54:18,568] Trial 3150 finished with value: -0.1936417107583833 and parameters: {'n_estimators': 1056, 'min_samples_split': 8, 'max_features': 0.9, 'min_samples_leaf': 8, 'criterion': 'absolute_error', 'max_depth': None, 'min_weight_fraction_leaf': 0.0, 'max_leaf_nodes': 300, 'bootstrap': False, 'ccp_alpha': 0.024}. Best is trial 2774 with value: 0.046571421912873.
[I 2025-04-16 01:54:19,837] Trial 3151 finished with value: -0.1936417107583833 and parameters: {'n_estimators': 1018, 'min_samples_split': 13, 'max_features': 0.92, 'min_samples_leaf': 4, 'criterion': 'absolute_error', 'max_depth': None, 'min_weight_fraction_leaf': 0.0, 'max_leaf_nodes': 300, 'bootstrap': False, 'ccp_alpha': 0.013000000000000001}. Best is trial 2774 with value: 0.046571421912873.
[I 2025-04-16 01:54:20,898] Trial 3152 finished with value: -0.1936417107583833 and parameters: {'n_estimators': 955, 'min_samples_split': 12, 'max_features': 0.88, 'min_samples_leaf': 78, 'criterion': 'absolute_error', 'max_depth': None, 'min_weight_fraction_leaf': 0.0, 'max_leaf_nodes': 300, 'bootstrap': False, 'ccp_alpha': 0.0}. Best is trial 2774 with value: 0.046571421912873.
[I 2025-04-16 01:54:22,425] Trial 3153 finished with value: -0.05801458669867528 and parameters: {'n_estimators': 1316, 'min_samples_split': 8, 'max_features': 0.85, 'min_samples_leaf': 6, 'criterion': 'absolute_error', 'max_depth': None, 'min_weight_fraction_leaf': 0.0, 'max_leaf_nodes': 300, 'bootstrap': False, 'ccp_alpha': 0.005}. Best is trial 2774 with value: 0.046571421912873.
[I 2025-04-16 01:54:24,058] Trial 3154 finished with value: -0.1936417107583833 and parameters: {'n_estimators': 1496, 'min_samples_split': 8, 'max_features': 0.91, 'min_samples_leaf': 4, 'criterion': 'absolute_error', 'max_depth': None, 'min_weight_fraction_leaf': 0.0, 'max_leaf_nodes': 300, 'bootstrap': False, 'ccp_alpha': 0.017}. Best is trial 2774 with value: 0.046571421912873.
[I 2025-04-16 01:54:25,192] Trial 3155 finished with value: -24.87037641423809 and parameters: {'n_estimators': 796, 'min_samples_split': 12, 'max_features': 0.87, 'min_samples_leaf': 9, 'criterion': 'poisson', 'max_depth': None, 'min_weight_fraction_leaf': 0.04, 'max_leaf_nodes': 300, 'bootstrap': False, 'ccp_alpha': 0.01}. Best is trial 2774 with value: 0.046571421912873.
[I 2025-04-16 01:54:26,288] Trial 3156 finished with value: -0.1936417107583833 and parameters: {'n_estimators': 795, 'min_samples_split': 12, 'max_features': 0.9400000000000001, 'min_samples_leaf': 7, 'criterion': 'absolute_error', 'max_depth': None, 'min_weight_fraction_leaf': 0.0, 'max_leaf_nodes': 300, 'bootstrap': False, 'ccp_alpha': 0.006}. Best is trial 2774 with value: 0.046571421912873.
[I 2025-04-16 01:54:27,772] Trial 3157 finished with value: -9.390800909733372 and parameters: {'n_estimators': 1274, 'min_samples_split': 12, 'max_features': 0.89, 'min_samples_leaf': 6, 'criterion': 'absolute_error', 'max_depth': None, 'min_weight_fraction_leaf': 0.0, 'max_leaf_nodes': 300, 'bootstrap': False, 'ccp_alpha': 0.0}. Best is trial 2774 with value: 0.046571421912873.
[I 2025-04-16 01:54:29,241] Trial 3158 finished with value: -0.1936417107583833 and parameters: {'n_estimators': 1309, 'min_samples_split': 7, 'max_features': 0.92, 'min_samples_leaf': 4, 'criterion': 'absolute_error', 'max_depth': None, 'min_weight_fraction_leaf': 0.0, 'max_leaf_nodes': 300, 'bootstrap': False, 'ccp_alpha': 0.014}. Best is trial 2774 with value: 0.046571421912873.
[I 2025-04-16 01:54:30,767] Trial 3159 finished with value: -0.1936417107583833 and parameters: {'n_estimators': 1222, 'min_samples_split': 8, 'max_features': 0.9400000000000001, 'min_samples_leaf': 9, 'criterion': 'absolute_error', 'max_depth': None, 'min_weight_fraction_leaf': 0.0, 'max_leaf_nodes': 300, 'bootstrap': False, 'ccp_alpha': 0.028}. Best is trial 2774 with value: 0.046571421912873.
[I 2025-04-16 01:54:32,371] Trial 3160 finished with value: 0.023052024674448956 and parameters: {'n_estimators': 1364, 'min_samples_split': 13, 'max_features': 0.9, 'min_samples_leaf': 4, 'criterion': 'absolute_error', 'max_depth': None, 'min_weight_fraction_leaf': 0.0, 'max_leaf_nodes': 300, 'bootstrap': False, 'ccp_alpha': 0.005}. Best is trial 2774 with value: 0.046571421912873.
[I 2025-04-16 01:54:33,849] Trial 3161 finished with value: -0.1936417107583833 and parameters: {'n_estimators': 1136, 'min_samples_split': 105, 'max_features': 0.86, 'min_samples_leaf': 7, 'criterion': 'absolute_error', 'max_depth': None, 'min_weight_fraction_leaf': 0.0, 'max_leaf_nodes': 300, 'bootstrap': False, 'ccp_alpha': 0.009000000000000001}. Best is trial 2774 with value: 0.046571421912873.
[I 2025-04-16 01:54:35,447] Trial 3162 finished with value: -0.1936417107583833 and parameters: {'n_estimators': 1432, 'min_samples_split': 16, 'max_features': 0.85, 'min_samples_leaf': 6, 'criterion': 'absolute_error', 'max_depth': None, 'min_weight_fraction_leaf': 0.0, 'max_leaf_nodes': 300, 'bootstrap': False, 'ccp_alpha': 0.02}. Best is trial 2774 with value: 0.046571421912873.
[I 2025-04-16 01:54:36,903] Trial 3163 finished with value: -0.1936417107583833 and parameters: {'n_estimators': 1318, 'min_samples_split': 14, 'max_features': 0.87, 'min_samples_leaf': 4, 'criterion': 'absolute_error', 'max_depth': None, 'min_weight_fraction_leaf': 0.0, 'max_leaf_nodes': 300, 'bootstrap': False, 'ccp_alpha': 0.013000000000000001}. Best is trial 2774 with value: 0.046571421912873.
[I 2025-04-16 01:54:38,650] Trial 3164 finished with value: -0.1936417107583833 and parameters: {'n_estimators': 1454, 'min_samples_split': 15, 'max_features': 0.88, 'min_samples_leaf': 8, 'criterion': 'absolute_error', 'max_depth': None, 'min_weight_fraction_leaf': 0.0, 'max_leaf_nodes': 300, 'bootstrap': False, 'ccp_alpha': 0.005}. Best is trial 2774 with value: 0.046571421912873.
[I 2025-04-16 01:54:40,126] Trial 3165 finished with value: -15.812387177248088 and parameters: {'n_estimators': 1504, 'min_samples_split': 16, 'max_features': 0.85, 'min_samples_leaf': 4, 'criterion': 'friedman_mse', 'max_depth': None, 'min_weight_fraction_leaf': 0.0, 'max_leaf_nodes': 300, 'bootstrap': False, 'ccp_alpha': 0.0}. Best is trial 2774 with value: 0.046571421912873.
[I 2025-04-16 01:54:41,687] Trial 3166 finished with value: -0.1936417107583833 and parameters: {'n_estimators': 1363, 'min_samples_split': 19, 'max_features': 0.89, 'min_samples_leaf': 6, 'criterion': 'absolute_error', 'max_depth': None, 'min_weight_fraction_leaf': 0.0, 'max_leaf_nodes': 300, 'bootstrap': False, 'ccp_alpha': 0.01}. Best is trial 2774 with value: 0.046571421912873.
[I 2025-04-16 01:54:43,345] Trial 3167 finished with value: -0.1936417107583833 and parameters: {'n_estimators': 1587, 'min_samples_split': 14, 'max_features': 0.87, 'min_samples_leaf': 9, 'criterion': 'absolute_error', 'max_depth': None, 'min_weight_fraction_leaf': 0.0, 'max_leaf_nodes': 300, 'bootstrap': False, 'ccp_alpha': 0.018000000000000002}. Best is trial 2774 with value: 0.046571421912873.
[I 2025-04-16 01:54:45,324] Trial 3168 finished with value: -0.06513492828489398 and parameters: {'n_estimators': 1664, 'min_samples_split': 13, 'max_features': 0.88, 'min_samples_leaf': 4, 'criterion': 'absolute_error', 'max_depth': None, 'min_weight_fraction_leaf': 0.0, 'max_leaf_nodes': 300, 'bootstrap': False, 'ccp_alpha': 0.005}. Best is trial 2774 with value: 0.046571421912873.
[I 2025-04-16 01:54:46,939] Trial 3169 finished with value: -0.1936417107583833 and parameters: {'n_estimators': 1402, 'min_samples_split': 12, 'max_features': 0.89, 'min_samples_leaf': 7, 'criterion': 'absolute_error', 'max_depth': None, 'min_weight_fraction_leaf': 0.0, 'max_leaf_nodes': 300, 'bootstrap': False, 'ccp_alpha': 0.013000000000000001}. Best is trial 2774 with value: 0.046571421912873.
[I 2025-04-16 01:54:48,490] Trial 3170 finished with value: -0.06550005029703918 and parameters: {'n_estimators': 1337, 'min_samples_split': 19, 'max_features': 0.85, 'min_samples_leaf': 6, 'criterion': 'absolute_error', 'max_depth': None, 'min_weight_fraction_leaf': 0.0, 'max_leaf_nodes': 300, 'bootstrap': False, 'ccp_alpha': 0.005}. Best is trial 2774 with value: 0.046571421912873.
[I 2025-04-16 01:54:50,108] Trial 3171 finished with value: -8.744444049618103 and parameters: {'n_estimators': 1414, 'min_samples_split': 15, 'max_features': 0.9, 'min_samples_leaf': 9, 'criterion': 'absolute_error', 'max_depth': None, 'min_weight_fraction_leaf': 0.0, 'max_leaf_nodes': 300, 'bootstrap': False, 'ccp_alpha': 0.0}. Best is trial 2774 with value: 0.046571421912873.
[I 2025-04-16 01:54:52,465] Trial 3172 finished with value: -0.1936417107583833 and parameters: {'n_estimators': 2489, 'min_samples_split': 13, 'max_features': 0.88, 'min_samples_leaf': 4, 'criterion': 'absolute_error', 'max_depth': None, 'min_weight_fraction_leaf': 0.0, 'max_leaf_nodes': 300, 'bootstrap': False, 'ccp_alpha': 0.01}. Best is trial 2774 with value: 0.046571421912873.
