[I 2025-04-16 02:03:27,221] Trial 3677 finished with value: -0.1936417107583833 and parameters: {'n_estimators': 508, 'min_samples_split': 6, 'max_features': 0.72, 'min_samples_leaf': 1, 'criterion': 'absolute_error', 'max_depth': 15, 'min_weight_fraction_leaf': 0.0, 'max_leaf_nodes': 300, 'bootstrap': False, 'ccp_alpha': 0.023}. Best is trial 3488 with value: 0.05528345733671649.
[I 2025-04-16 02:03:27,903] Trial 3678 finished with value: -0.19846521479745713 and parameters: {'n_estimators': 182, 'min_samples_split': 9, 'max_features': 0.8, 'min_samples_leaf': 4, 'criterion': 'absolute_error', 'max_depth': 15, 'min_weight_fraction_leaf': 0.0, 'max_leaf_nodes': 300, 'bootstrap': False, 'ccp_alpha': 0.005}. Best is trial 3488 with value: 0.05528345733671649.
[I 2025-04-16 02:03:29,089] Trial 3679 finished with value: -0.1936417107583833 and parameters: {'n_estimators': 825, 'min_samples_split': 5, 'max_features': 0.6900000000000001, 'min_samples_leaf': 3, 'criterion': 'absolute_error', 'max_depth': 15, 'min_weight_fraction_leaf': 0.0, 'max_leaf_nodes': 300, 'bootstrap': False, 'ccp_alpha': 0.01}. Best is trial 3488 with value: 0.05528345733671649.
[I 2025-04-16 02:03:29,937] Trial 3680 finished with value: -0.1936417107583833 and parameters: {'n_estimators': 419, 'min_samples_split': 9, 'max_features': 0.74, 'min_samples_leaf': 54, 'criterion': 'absolute_error', 'max_depth': 15, 'min_weight_fraction_leaf': 0.0, 'max_leaf_nodes': 300, 'bootstrap': False, 'ccp_alpha': 0.017}. Best is trial 3488 with value: 0.05528345733671649.
[I 2025-04-16 02:03:31,251] Trial 3681 finished with value: -37.25893078835465 and parameters: {'n_estimators': 1051, 'min_samples_split': 2, 'max_features': 0.76, 'min_samples_leaf': 1, 'criterion': 'absolute_error', 'max_depth': 15, 'min_weight_fraction_leaf': 0.0, 'max_leaf_nodes': 300, 'bootstrap': False, 'ccp_alpha': 0.0}. Best is trial 3488 with value: 0.05528345733671649.
[I 2025-04-16 02:03:31,761] Trial 3682 finished with value: -0.1936417107583833 and parameters: {'n_estimators': 7, 'min_samples_split': 2, 'max_features': 0.7100000000000001, 'min_samples_leaf': 4, 'criterion': 'absolute_error', 'max_depth': 15, 'min_weight_fraction_leaf': 0.0, 'max_leaf_nodes': 300, 'bootstrap': False, 'ccp_alpha': 0.009000000000000001}. Best is trial 3488 with value: 0.05528345733671649.
[I 2025-04-16 02:03:32,801] Trial 3683 finished with value: -0.1936417107583833 and parameters: {'n_estimators': 651, 'min_samples_split': 9, 'max_features': 0.73, 'min_samples_leaf': 1, 'criterion': 'absolute_error', 'max_depth': 15, 'min_weight_fraction_leaf': 0.0, 'max_leaf_nodes': 300, 'bootstrap': False, 'ccp_alpha': 0.03}. Best is trial 3488 with value: 0.05528345733671649.
[I 2025-04-16 02:03:33,600] Trial 3684 finished with value: -17.528986382274873 and parameters: {'n_estimators': 356, 'min_samples_split': 6, 'max_features': 0.78, 'min_samples_leaf': 3, 'criterion': 'squared_error', 'max_depth': 15, 'min_weight_fraction_leaf': 0.0, 'max_leaf_nodes': 300, 'bootstrap': False, 'ccp_alpha': 0.014}. Best is trial 3488 with value: 0.05528345733671649.
[I 2025-04-16 02:03:34,624] Trial 3685 finished with value: 0.0005772826572095991 and parameters: {'n_estimators': 569, 'min_samples_split': 2, 'max_features': 0.81, 'min_samples_leaf': 1, 'criterion': 'absolute_error', 'max_depth': 15, 'min_weight_fraction_leaf': 0.0, 'max_leaf_nodes': 300, 'bootstrap': False, 'ccp_alpha': 0.006}. Best is trial 3488 with value: 0.05528345733671649.
[I 2025-04-16 02:03:35,791] Trial 3686 finished with value: -0.1936417107583833 and parameters: {'n_estimators': 881, 'min_samples_split': 9, 'max_features': 0.75, 'min_samples_leaf': 48, 'criterion': 'absolute_error', 'max_depth': 15, 'min_weight_fraction_leaf': 0.0, 'max_leaf_nodes': 300, 'bootstrap': False, 'ccp_alpha': 0.0}. Best is trial 3488 with value: 0.05528345733671649.
[I 2025-04-16 02:03:36,572] Trial 3687 finished with value: -0.1936417107583833 and parameters: {'n_estimators': 372, 'min_samples_split': 6, 'max_features': 0.67, 'min_samples_leaf': 4, 'criterion': 'absolute_error', 'max_depth': 15, 'min_weight_fraction_leaf': 0.0, 'max_leaf_nodes': 300, 'bootstrap': False, 'ccp_alpha': 0.018000000000000002}. Best is trial 3488 with value: 0.05528345733671649.
[I 2025-04-16 02:03:37,688] Trial 3688 finished with value: -0.1936417107583833 and parameters: {'n_estimators': 686, 'min_samples_split': 2, 'max_features': 0.7000000000000001, 'min_samples_leaf': 3, 'criterion': 'absolute_error', 'max_depth': 15, 'min_weight_fraction_leaf': 0.0, 'max_leaf_nodes': 300, 'bootstrap': False, 'ccp_alpha': 0.266}. Best is trial 3488 with value: 0.05528345733671649.
[I 2025-04-16 02:03:38,338] Trial 3689 finished with value: -0.1936417107583833 and parameters: {'n_estimators': 186, 'min_samples_split': 119, 'max_features': 0.73, 'min_samples_leaf': 1, 'criterion': 'absolute_error', 'max_depth': 15, 'min_weight_fraction_leaf': 0.0, 'max_leaf_nodes': 300, 'bootstrap': False, 'ccp_alpha': 0.009000000000000001}. Best is trial 3488 with value: 0.05528345733671649.
[I 2025-04-16 02:03:39,233] Trial 3690 finished with value: -15.100950330967583 and parameters: {'n_estimators': 496, 'min_samples_split': 9, 'max_features': 0.77, 'min_samples_leaf': 4, 'criterion': 'poisson', 'max_depth': 15, 'min_weight_fraction_leaf': 0.0, 'max_leaf_nodes': 300, 'bootstrap': False, 'ccp_alpha': 0.005}. Best is trial 3488 with value: 0.05528345733671649.
[I 2025-04-16 02:03:40,590] Trial 3691 finished with value: -0.1936417107583833 and parameters: {'n_estimators': 1045, 'min_samples_split': 5, 'max_features': 0.8, 'min_samples_leaf': 1, 'criterion': 'absolute_error', 'max_depth': 15, 'min_weight_fraction_leaf': 0.0, 'max_leaf_nodes': 300, 'bootstrap': False, 'ccp_alpha': 0.013000000000000001}. Best is trial 3488 with value: 0.05528345733671649.
[I 2025-04-16 02:03:41,809] Trial 3692 finished with value: 0.016377959847765355 and parameters: {'n_estimators': 813, 'min_samples_split': 6, 'max_features': 0.75, 'min_samples_leaf': 3, 'criterion': 'absolute_error', 'max_depth': 15, 'min_weight_fraction_leaf': 0.0, 'max_leaf_nodes': 300, 'bootstrap': False, 'ccp_alpha': 0.005}. Best is trial 3488 with value: 0.05528345733671649.
[I 2025-04-16 02:03:42,533] Trial 3693 finished with value: -14.530523509662405 and parameters: {'n_estimators': 309, 'min_samples_split': 2, 'max_features': 0.72, 'min_samples_leaf': 3, 'criterion': 'absolute_error', 'max_depth': 15, 'min_weight_fraction_leaf': 0.0, 'max_leaf_nodes': 300, 'bootstrap': False, 'ccp_alpha': 0.0}. Best is trial 3488 with value: 0.05528345733671649.
[I 2025-04-16 02:03:43,534] Trial 3694 finished with value: -0.1936417107583833 and parameters: {'n_estimators': 600, 'min_samples_split': 6, 'max_features': 0.78, 'min_samples_leaf': 1, 'criterion': 'absolute_error', 'max_depth': 15, 'min_weight_fraction_leaf': 0.0, 'max_leaf_nodes': 300, 'bootstrap': False, 'ccp_alpha': 0.021}. Best is trial 3488 with value: 0.05528345733671649.
[I 2025-04-16 02:03:44,026] Trial 3695 finished with value: -0.1936417107583833 and parameters: {'n_estimators': 5, 'min_samples_split': 9, 'max_features': 0.7000000000000001, 'min_samples_leaf': 4, 'criterion': 'absolute_error', 'max_depth': 15, 'min_weight_fraction_leaf': 0.0, 'max_leaf_nodes': 300, 'bootstrap': False, 'ccp_alpha': 0.012}. Best is trial 3488 with value: 0.05528345733671649.
[I 2025-04-16 02:03:44,700] Trial 3696 finished with value: 0.048490449910460254 and parameters: {'n_estimators': 173, 'min_samples_split': 2, 'max_features': 0.74, 'min_samples_leaf': 1, 'criterion': 'absolute_error', 'max_depth': 15, 'min_weight_fraction_leaf': 0.0, 'max_leaf_nodes': 300, 'bootstrap': False, 'ccp_alpha': 0.005}. Best is trial 3488 with value: 0.05528345733671649.
[I 2025-04-16 02:03:45,371] Trial 3697 finished with value: -0.1936417107583833 and parameters: {'n_estimators': 193, 'min_samples_split': 2, 'max_features': 0.7100000000000001, 'min_samples_leaf': 4, 'criterion': 'absolute_error', 'max_depth': 15, 'min_weight_fraction_leaf': 0.0, 'max_leaf_nodes': 300, 'bootstrap': False, 'ccp_alpha': 0.01}. Best is trial 3488 with value: 0.05528345733671649.
[I 2025-04-16 02:03:46,299] Trial 3698 finished with value: -0.1936417107583833 and parameters: {'n_estimators': 463, 'min_samples_split': 6, 'max_features': 0.73, 'min_samples_leaf': 3, 'criterion': 'absolute_error', 'max_depth': 15, 'min_weight_fraction_leaf': 0.0, 'max_leaf_nodes': 300, 'bootstrap': False, 'ccp_alpha': 0.017}. Best is trial 3488 with value: 0.05528345733671649.
[I 2025-04-16 02:03:46,943] Trial 3699 finished with value: -29.611630167301723 and parameters: {'n_estimators': 151, 'min_samples_split': 2, 'max_features': 0.68, 'min_samples_leaf': 1, 'criterion': 'absolute_error', 'max_depth': 15, 'min_weight_fraction_leaf': 0.0, 'max_leaf_nodes': 300, 'bootstrap': False, 'ccp_alpha': 0.0}. Best is trial 3488 with value: 0.05528345733671649.
[I 2025-04-16 02:03:47,439] Trial 3700 finished with value: -17.528986382275015 and parameters: {'n_estimators': 2, 'min_samples_split': 2, 'max_features': 0.7000000000000001, 'min_samples_leaf': 3, 'criterion': 'friedman_mse', 'max_depth': 15, 'min_weight_fraction_leaf': 0.0, 'max_leaf_nodes': 300, 'bootstrap': False, 'ccp_alpha': 0.026000000000000002}. Best is trial 3488 with value: 0.05528345733671649.
[I 2025-04-16 02:03:48,760] Trial 3701 finished with value: -0.1936417107583833 and parameters: {'n_estimators': 875, 'min_samples_split': 2, 'max_features': 0.73, 'min_samples_leaf': 1, 'criterion': 'absolute_error', 'max_depth': 15, 'min_weight_fraction_leaf': 0.0, 'max_leaf_nodes': 300, 'bootstrap': False, 'ccp_alpha': 0.009000000000000001}. Best is trial 3488 with value: 0.05528345733671649.
[I 2025-04-16 02:03:49,795] Trial 3702 finished with value: -0.1936417107583833 and parameters: {'n_estimators': 668, 'min_samples_split': 2, 'max_features': 0.74, 'min_samples_leaf': 4, 'criterion': 'absolute_error', 'max_depth': 15, 'min_weight_fraction_leaf': 0.0, 'max_leaf_nodes': 300, 'bootstrap': False, 'ccp_alpha': 0.014}. Best is trial 3488 with value: 0.05528345733671649.
[I 2025-04-16 02:03:51,215] Trial 3703 finished with value: 0.04061305342255424 and parameters: {'n_estimators': 1052, 'min_samples_split': 2, 'max_features': 0.72, 'min_samples_leaf': 1, 'criterion': 'absolute_error', 'max_depth': 15, 'min_weight_fraction_leaf': 0.0, 'max_leaf_nodes': 300, 'bootstrap': False, 'ccp_alpha': 0.005}. Best is trial 3488 with value: 0.05528345733671649.
[I 2025-04-16 02:03:52,580] Trial 3704 finished with value: -0.0697190469032098 and parameters: {'n_estimators': 1060, 'min_samples_split': 2, 'max_features': 0.66, 'min_samples_leaf': 4, 'criterion': 'absolute_error', 'max_depth': 15, 'min_weight_fraction_leaf': 0.0, 'max_leaf_nodes': 300, 'bootstrap': False, 'ccp_alpha': 0.005}. Best is trial 3488 with value: 0.05528345733671649.
[I 2025-04-16 02:03:53,422] Trial 3705 finished with value: -0.1936417107583833 and parameters: {'n_estimators': 397, 'min_samples_split': 6, 'max_features': 0.6900000000000001, 'min_samples_leaf': 3, 'criterion': 'absolute_error', 'max_depth': 15, 'min_weight_fraction_leaf': 0.0, 'max_leaf_nodes': 300, 'bootstrap': False, 'ccp_alpha': 0.018000000000000002}. Best is trial 3488 with value: 0.05528345733671649.
[I 2025-04-16 02:03:54,413] Trial 3706 finished with value: -0.1936417107583833 and parameters: {'n_estimators': 522, 'min_samples_split': 5, 'max_features': 0.68, 'min_samples_leaf': 1, 'criterion': 'absolute_error', 'max_depth': 15, 'min_weight_fraction_leaf': 0.0, 'max_leaf_nodes': 300, 'bootstrap': False, 'ccp_alpha': 0.01}. Best is trial 3488 with value: 0.05528345733671649.
[I 2025-04-16 02:03:55,741] Trial 3707 finished with value: -7.488504670983582 and parameters: {'n_estimators': 1074, 'min_samples_split': 2, 'max_features': 0.7100000000000001, 'min_samples_leaf': 3, 'criterion': 'squared_error', 'max_depth': 15, 'min_weight_fraction_leaf': 0.0, 'max_leaf_nodes': 300, 'bootstrap': False, 'ccp_alpha': 0.0}. Best is trial 3488 with value: 0.05528345733671649.
[I 2025-04-16 02:03:56,419] Trial 3708 finished with value: -0.1936417107583833 and parameters: {'n_estimators': 214, 'min_samples_split': 6, 'max_features': 0.7100000000000001, 'min_samples_leaf': 1, 'criterion': 'absolute_error', 'max_depth': 15, 'min_weight_fraction_leaf': 0.0, 'max_leaf_nodes': 300, 'bootstrap': False, 'ccp_alpha': 0.009000000000000001}. Best is trial 3488 with value: 0.05528345733671649.
[I 2025-04-16 02:03:57,549] Trial 3709 finished with value: -0.1936417107583833 and parameters: {'n_estimators': 697, 'min_samples_split': 2, 'max_features': 0.67, 'min_samples_leaf': 4, 'criterion': 'absolute_error', 'max_depth': 15, 'min_weight_fraction_leaf': 0.0, 'max_leaf_nodes': 300, 'bootstrap': False, 'ccp_alpha': 0.023}. Best is trial 3488 with value: 0.05528345733671649.
[I 2025-04-16 02:03:58,350] Trial 3710 finished with value: -0.1936417107583833 and parameters: {'n_estimators': 346, 'min_samples_split': 9, 'max_features': 0.6900000000000001, 'min_samples_leaf': 1, 'criterion': 'absolute_error', 'max_depth': 15, 'min_weight_fraction_leaf': 0.0, 'max_leaf_nodes': 300, 'bootstrap': False, 'ccp_alpha': 0.166}. Best is trial 3488 with value: 0.05528345733671649.
[I 2025-04-16 02:03:59,283] Trial 3711 finished with value: -0.1936417107583833 and parameters: {'n_estimators': 541, 'min_samples_split': 6, 'max_features': 0.72, 'min_samples_leaf': 4, 'criterion': 'absolute_error', 'max_depth': 15, 'min_weight_fraction_leaf': 0.0, 'max_leaf_nodes': 300, 'bootstrap': False, 'ccp_alpha': 0.014}. Best is trial 3488 with value: 0.05528345733671649.
[I 2025-04-16 02:04:00,485] Trial 3712 finished with value: -0.0015799350514965837 and parameters: {'n_estimators': 796, 'min_samples_split': 2, 'max_features': 0.7100000000000001, 'min_samples_leaf': 1, 'criterion': 'absolute_error', 'max_depth': 15, 'min_weight_fraction_leaf': 0.0, 'max_leaf_nodes': 300, 'bootstrap': False, 'ccp_alpha': 0.006}. Best is trial 3488 with value: 0.05528345733671649.
[I 2025-04-16 02:04:01,129] Trial 3713 finished with value: -15.683263891619202 and parameters: {'n_estimators': 154, 'min_samples_split': 6, 'max_features': 0.72, 'min_samples_leaf': 3, 'criterion': 'poisson', 'max_depth': 15, 'min_weight_fraction_leaf': 0.0, 'max_leaf_nodes': 300, 'bootstrap': False, 'ccp_alpha': 0.005}. Best is trial 3488 with value: 0.05528345733671649.
[I 2025-04-16 02:04:01,936] Trial 3714 finished with value: -12.261966541798683 and parameters: {'n_estimators': 368, 'min_samples_split': 9, 'max_features': 0.6900000000000001, 'min_samples_leaf': 3, 'criterion': 'absolute_error', 'max_depth': 15, 'min_weight_fraction_leaf': 0.0, 'max_leaf_nodes': 300, 'bootstrap': False, 'ccp_alpha': 0.0}. Best is trial 3488 with value: 0.05528345733671649.
[I 2025-04-16 02:04:03,135] Trial 3715 finished with value: -0.1936417107583833 and parameters: {'n_estimators': 665, 'min_samples_split': 2, 'max_features': 0.66, 'min_samples_leaf': 1, 'criterion': 'absolute_error', 'max_depth': 15, 'min_weight_fraction_leaf': 0.0, 'max_leaf_nodes': 300, 'bootstrap': False, 'ccp_alpha': 0.203}. Best is trial 3488 with value: 0.05528345733671649.
[I 2025-04-16 02:04:04,482] Trial 3716 finished with value: -0.1936417107583833 and parameters: {'n_estimators': 1060, 'min_samples_split': 6, 'max_features': 0.73, 'min_samples_leaf': 60, 'criterion': 'absolute_error', 'max_depth': 15, 'min_weight_fraction_leaf': 0.0, 'max_leaf_nodes': 300, 'bootstrap': False, 'ccp_alpha': 0.015}. Best is trial 3488 with value: 0.05528345733671649.
[I 2025-04-16 02:04:05,139] Trial 3717 finished with value: -0.1936417107583833 and parameters: {'n_estimators': 163, 'min_samples_split': 9, 'max_features': 0.7000000000000001, 'min_samples_leaf': 4, 'criterion': 'absolute_error', 'max_depth': 15, 'min_weight_fraction_leaf': 0.0, 'max_leaf_nodes': 300, 'bootstrap': False, 'ccp_alpha': 0.01}. Best is trial 3488 with value: 0.05528345733671649.
[I 2025-04-16 02:04:05,654] Trial 3718 finished with value: -0.1936417107583833 and parameters: {'n_estimators': 2, 'min_samples_split': 2, 'max_features': 0.73, 'min_samples_leaf': 3, 'criterion': 'absolute_error', 'max_depth': 15, 'min_weight_fraction_leaf': 0.0, 'max_leaf_nodes': 300, 'bootstrap': False, 'ccp_alpha': 0.005}. Best is trial 3488 with value: 0.05528345733671649.
[I 2025-04-16 02:04:06,536] Trial 3719 finished with value: -0.1936417107583833 and parameters: {'n_estimators': 430, 'min_samples_split': 5, 'max_features': 0.74, 'min_samples_leaf': 1, 'criterion': 'absolute_error', 'max_depth': 15, 'min_weight_fraction_leaf': 0.0, 'max_leaf_nodes': 300, 'bootstrap': False, 'ccp_alpha': 0.019}. Best is trial 3488 with value: 0.05528345733671649.
[I 2025-04-16 02:04:07,707] Trial 3720 finished with value: -10.741996248345668 and parameters: {'n_estimators': 886, 'min_samples_split': 9, 'max_features': 0.7100000000000001, 'min_samples_leaf': 4, 'criterion': 'absolute_error', 'max_depth': 15, 'min_weight_fraction_leaf': 0.0, 'max_leaf_nodes': 300, 'bootstrap': False, 'ccp_alpha': 0.0}. Best is trial 3488 with value: 0.05528345733671649.
[I 2025-04-16 02:04:08,703] Trial 3721 finished with value: -0.1936417107583833 and parameters: {'n_estimators': 583, 'min_samples_split': 6, 'max_features': 0.68, 'min_samples_leaf': 1, 'criterion': 'absolute_error', 'max_depth': 15, 'min_weight_fraction_leaf': 0.0, 'max_leaf_nodes': 300, 'bootstrap': False, 'ccp_alpha': 0.013000000000000001}. Best is trial 3488 with value: 0.05528345733671649.
[I 2025-04-16 02:04:09,481] Trial 3722 finished with value: -17.52898638227488 and parameters: {'n_estimators': 330, 'min_samples_split': 9, 'max_features': 0.72, 'min_samples_leaf': 3, 'criterion': 'friedman_mse', 'max_depth': 15, 'min_weight_fraction_leaf': 0.0, 'max_leaf_nodes': 300, 'bootstrap': False, 'ccp_alpha': 0.006}. Best is trial 3488 with value: 0.05528345733671649.
[I 2025-04-16 02:04:10,627] Trial 3723 finished with value: -0.1936417107583833 and parameters: {'n_estimators': 705, 'min_samples_split': 2, 'max_features': 0.64, 'min_samples_leaf': 4, 'criterion': 'absolute_error', 'max_depth': 15, 'min_weight_fraction_leaf': 0.0, 'max_leaf_nodes': 300, 'bootstrap': False, 'ccp_alpha': 0.025}. Best is trial 3488 with value: 0.05528345733671649.
[I 2025-04-16 02:04:11,575] Trial 3724 finished with value: -0.1936417107583833 and parameters: {'n_estimators': 538, 'min_samples_split': 5, 'max_features': 0.75, 'min_samples_leaf': 1, 'criterion': 'absolute_error', 'max_depth': 15, 'min_weight_fraction_leaf': 0.0, 'max_leaf_nodes': 300, 'bootstrap': False, 'ccp_alpha': 0.01}. Best is trial 3488 with value: 0.05528345733671649.
[I 2025-04-16 02:04:12,762] Trial 3725 finished with value: -14.782547322601905 and parameters: {'n_estimators': 854, 'min_samples_split': 2, 'max_features': 0.7000000000000001, 'min_samples_leaf': 3, 'criterion': 'absolute_error', 'max_depth': 15, 'min_weight_fraction_leaf': 0.0, 'max_leaf_nodes': 300, 'bootstrap': False, 'ccp_alpha': 0.0}. Best is trial 3488 with value: 0.05528345733671649.
[I 2025-04-16 02:04:14,124] Trial 3726 finished with value: -0.1936417107583833 and parameters: {'n_estimators': 1068, 'min_samples_split': 51, 'max_features': 0.74, 'min_samples_leaf': 1, 'criterion': 'absolute_error', 'max_depth': 15, 'min_weight_fraction_leaf': 0.0, 'max_leaf_nodes': 300, 'bootstrap': False, 'ccp_alpha': 0.018000000000000002}. Best is trial 3488 with value: 0.05528345733671649.
[I 2025-04-16 02:04:14,908] Trial 3727 finished with value: -0.1936417107583833 and parameters: {'n_estimators': 314, 'min_samples_split': 9, 'max_features': 0.72, 'min_samples_leaf': 4, 'criterion': 'absolute_error', 'max_depth': 15, 'min_weight_fraction_leaf': 0.0, 'max_leaf_nodes': 300, 'bootstrap': False, 'ccp_alpha': 0.009000000000000001}. Best is trial 3488 with value: 0.05528345733671649.
[I 2025-04-16 02:04:15,553] Trial 3728 finished with value: 0.005838340467318704 and parameters: {'n_estimators': 151, 'min_samples_split': 6, 'max_features': 0.76, 'min_samples_leaf': 1, 'criterion': 'absolute_error', 'max_depth': 15, 'min_weight_fraction_leaf': 0.0, 'max_leaf_nodes': 300, 'bootstrap': False, 'ccp_alpha': 0.006}. Best is trial 3488 with value: 0.05528345733671649.
[I 2025-04-16 02:04:16,470] Trial 3729 finished with value: -0.1936417107583833 and parameters: {'n_estimators': 495, 'min_samples_split': 2, 'max_features': 0.81, 'min_samples_leaf': 3, 'criterion': 'absolute_error', 'max_depth': 15, 'min_weight_fraction_leaf': 0.0, 'max_leaf_nodes': 300, 'bootstrap': False, 'ccp_alpha': 0.014}. Best is trial 3488 with value: 0.05528345733671649.
[I 2025-04-16 02:04:16,989] Trial 3730 finished with value: -0.1936417107583833 and parameters: {'n_estimators': 2, 'min_samples_split': 9, 'max_features': 0.73, 'min_samples_leaf': 4, 'criterion': 'absolute_error', 'max_depth': 15, 'min_weight_fraction_leaf': 0.0, 'max_leaf_nodes': 300, 'bootstrap': False, 'ccp_alpha': 0.005}. Best is trial 3488 with value: 0.05528345733671649.
[I 2025-04-16 02:04:18,057] Trial 3731 finished with value: -25.60410940750656 and parameters: {'n_estimators': 675, 'min_samples_split': 6, 'max_features': 0.6900000000000001, 'min_samples_leaf': 1, 'criterion': 'absolute_error', 'max_depth': 15, 'min_weight_fraction_leaf': 0.0, 'max_leaf_nodes': 300, 'bootstrap': False, 'ccp_alpha': 0.0}. Best is trial 3488 with value: 0.05528345733671649.
[I 2025-04-16 02:04:18,842] Trial 3732 finished with value: -17.52898638227488 and parameters: {'n_estimators': 332, 'min_samples_split': 2, 'max_features': 0.76, 'min_samples_leaf': 5, 'criterion': 'squared_error', 'max_depth': 15, 'min_weight_fraction_leaf': 0.0, 'max_leaf_nodes': 300, 'bootstrap': False, 'ccp_alpha': 0.01}. Best is trial 3488 with value: 0.05528345733671649.
