[I 2025-04-16 02:28:13,075] Trial 4910 finished with value: -17.528986382275235 and parameters: {'n_estimators': 840, 'min_samples_split': 6, 'max_features': 0.79, 'min_samples_leaf': 3, 'criterion': 'squared_error', 'max_depth': 15, 'min_weight_fraction_leaf': 0.0, 'max_leaf_nodes': None, 'bootstrap': False, 'ccp_alpha': 0.022}. Best is trial 4539 with value: 0.19155472534689352.
[I 2025-04-16 02:28:14,205] Trial 4911 finished with value: 0.05108879766098458 and parameters: {'n_estimators': 610, 'min_samples_split': 2, 'max_features': 0.8400000000000001, 'min_samples_leaf': 1, 'criterion': 'absolute_error', 'max_depth': 15, 'min_weight_fraction_leaf': 0.0, 'max_leaf_nodes': 300, 'bootstrap': False, 'ccp_alpha': 0.005}. Best is trial 4539 with value: 0.19155472534689352.
[I 2025-04-16 02:28:15,709] Trial 4912 finished with value: -0.1936417107583833 and parameters: {'n_estimators': 970, 'min_samples_split': 12, 'max_features': 0.8400000000000001, 'min_samples_leaf': 5, 'criterion': 'absolute_error', 'max_depth': 15, 'min_weight_fraction_leaf': 0.0, 'max_leaf_nodes': 300, 'bootstrap': False, 'ccp_alpha': 0.014}. Best is trial 4539 with value: 0.19155472534689352.
[I 2025-04-16 02:28:17,334] Trial 4913 finished with value: -0.0006602975968094116 and parameters: {'n_estimators': 1193, 'min_samples_split': 6, 'max_features': 0.85, 'min_samples_leaf': 3, 'criterion': 'absolute_error', 'max_depth': 15, 'min_weight_fraction_leaf': 0.0, 'max_leaf_nodes': 300, 'bootstrap': False, 'ccp_alpha': 0.006}. Best is trial 4539 with value: 0.19155472534689352.
[I 2025-04-16 02:28:19,003] Trial 4914 finished with value: -0.1936417107583833 and parameters: {'n_estimators': 1058, 'min_samples_split': 2, 'max_features': 0.8300000000000001, 'min_samples_leaf': 1, 'criterion': 'absolute_error', 'max_depth': None, 'min_weight_fraction_leaf': 0.0, 'max_leaf_nodes': 300, 'bootstrap': False, 'ccp_alpha': 0.01}. Best is trial 4539 with value: 0.19155472534689352.
[I 2025-04-16 02:28:20,334] Trial 4915 finished with value: -11.40822967450394 and parameters: {'n_estimators': 880, 'min_samples_split': 9, 'max_features': 0.85, 'min_samples_leaf': 5, 'criterion': 'absolute_error', 'max_depth': 15, 'min_weight_fraction_leaf': 0.0, 'max_leaf_nodes': 10, 'bootstrap': False, 'ccp_alpha': 0.0}. Best is trial 4539 with value: 0.19155472534689352.
[I 2025-04-16 02:28:21,667] Trial 4916 finished with value: -0.1936417107583833 and parameters: {'n_estimators': 769, 'min_samples_split': 5, 'max_features': 0.8400000000000001, 'min_samples_leaf': 3, 'criterion': 'absolute_error', 'max_depth': 15, 'min_weight_fraction_leaf': 0.0, 'max_leaf_nodes': 300, 'bootstrap': False, 'ccp_alpha': 0.026000000000000002}. Best is trial 4539 with value: 0.19155472534689352.
[I 2025-04-16 02:28:23,536] Trial 4917 finished with value: -21.13890136193937 and parameters: {'n_estimators': 1324, 'min_samples_split': 12, 'max_features': 0.85, 'min_samples_leaf': 7, 'criterion': 'poisson', 'max_depth': 15, 'min_weight_fraction_leaf': 0.0, 'max_leaf_nodes': 300, 'bootstrap': False, 'ccp_alpha': 0.005}. Best is trial 4539 with value: 0.19155472534689352.
[I 2025-04-16 02:28:25,200] Trial 4918 finished with value: -0.1936417107583833 and parameters: {'n_estimators': 1032, 'min_samples_split': 2, 'max_features': 0.8400000000000001, 'min_samples_leaf': 1, 'criterion': 'absolute_error', 'max_depth': 15, 'min_weight_fraction_leaf': 0.0, 'max_leaf_nodes': None, 'bootstrap': False, 'ccp_alpha': 0.018000000000000002}. Best is trial 4539 with value: 0.19155472534689352.
[I 2025-04-16 02:28:26,491] Trial 4919 finished with value: -0.1936417107583833 and parameters: {'n_estimators': 742, 'min_samples_split': 6, 'max_features': 0.85, 'min_samples_leaf': 3, 'criterion': 'absolute_error', 'max_depth': 15, 'min_weight_fraction_leaf': 0.0, 'max_leaf_nodes': 300, 'bootstrap': False, 'ccp_alpha': 0.01}. Best is trial 4539 with value: 0.19155472534689352.
[I 2025-04-16 02:28:27,656] Trial 4920 finished with value: -11.15235108087241 and parameters: {'n_estimators': 675, 'min_samples_split': 9, 'max_features': 0.8300000000000001, 'min_samples_leaf': 5, 'criterion': 'absolute_error', 'max_depth': None, 'min_weight_fraction_leaf': 0.0, 'max_leaf_nodes': 300, 'bootstrap': False, 'ccp_alpha': 0.0}. Best is trial 4539 with value: 0.19155472534689352.
[I 2025-04-16 02:28:29,107] Trial 4921 finished with value: -0.1936417107583833 and parameters: {'n_estimators': 967, 'min_samples_split': 2, 'max_features': 0.8300000000000001, 'min_samples_leaf': 1, 'criterion': 'absolute_error', 'max_depth': 15, 'min_weight_fraction_leaf': 0.0, 'max_leaf_nodes': 10, 'bootstrap': False, 'ccp_alpha': 0.014}. Best is trial 4539 with value: 0.19155472534689352.
[I 2025-04-16 02:28:30,288] Trial 4922 finished with value: -0.1936417107583833 and parameters: {'n_estimators': 654, 'min_samples_split': 9, 'max_features': 0.85, 'min_samples_leaf': 3, 'criterion': 'absolute_error', 'max_depth': 15, 'min_weight_fraction_leaf': 0.0, 'max_leaf_nodes': 300, 'bootstrap': False, 'ccp_alpha': 0.006}. Best is trial 4539 with value: 0.19155472534689352.
[I 2025-04-16 02:28:31,708] Trial 4923 finished with value: -0.1936417107583833 and parameters: {'n_estimators': 864, 'min_samples_split': 15, 'max_features': 0.8400000000000001, 'min_samples_leaf': 98, 'criterion': 'absolute_error', 'max_depth': 15, 'min_weight_fraction_leaf': 0.0, 'max_leaf_nodes': 300, 'bootstrap': False, 'ccp_alpha': 0.005}. Best is trial 4539 with value: 0.19155472534689352.
[I 2025-04-16 02:28:33,543] Trial 4924 finished with value: -0.1936417107583833 and parameters: {'n_estimators': 1318, 'min_samples_split': 6, 'max_features': 0.85, 'min_samples_leaf': 1, 'criterion': 'absolute_error', 'max_depth': 15, 'min_weight_fraction_leaf': 0.0, 'max_leaf_nodes': 300, 'bootstrap': False, 'ccp_alpha': 0.014}. Best is trial 4539 with value: 0.19155472534689352.
[I 2025-04-16 02:28:35,078] Trial 4925 finished with value: -11.374147617086544 and parameters: {'n_estimators': 1110, 'min_samples_split': 2, 'max_features': 0.8200000000000001, 'min_samples_leaf': 5, 'criterion': 'absolute_error', 'max_depth': 15, 'min_weight_fraction_leaf': 0.0, 'max_leaf_nodes': 300, 'bootstrap': False, 'ccp_alpha': 0.0}. Best is trial 4539 with value: 0.19155472534689352.
[I 2025-04-16 02:28:36,260] Trial 4926 finished with value: -17.528986382274862 and parameters: {'n_estimators': 686, 'min_samples_split': 6, 'max_features': 0.8300000000000001, 'min_samples_leaf': 3, 'criterion': 'friedman_mse', 'max_depth': 45, 'min_weight_fraction_leaf': 0.03, 'max_leaf_nodes': 10, 'bootstrap': False, 'ccp_alpha': 0.01}. Best is trial 4539 with value: 0.19155472534689352.
[I 2025-04-16 02:28:37,413] Trial 4927 finished with value: -0.1936417107583833 and parameters: {'n_estimators': 560, 'min_samples_split': 15, 'max_features': 0.8200000000000001, 'min_samples_leaf': 1, 'criterion': 'absolute_error', 'max_depth': 20, 'min_weight_fraction_leaf': 0.0, 'max_leaf_nodes': 300, 'bootstrap': False, 'ccp_alpha': 0.02}. Best is trial 4539 with value: 0.19155472534689352.
[I 2025-04-16 02:28:38,800] Trial 4928 finished with value: -0.1936417107583833 and parameters: {'n_estimators': 863, 'min_samples_split': 6, 'max_features': 0.85, 'min_samples_leaf': 7, 'criterion': 'absolute_error', 'max_depth': 15, 'min_weight_fraction_leaf': 0.0, 'max_leaf_nodes': None, 'bootstrap': False, 'ccp_alpha': 0.006}. Best is trial 4539 with value: 0.19155472534689352.
[I 2025-04-16 02:28:39,918] Trial 4929 finished with value: -0.1936417107583833 and parameters: {'n_estimators': 610, 'min_samples_split': 12, 'max_features': 0.85, 'min_samples_leaf': 3, 'criterion': 'absolute_error', 'max_depth': None, 'min_weight_fraction_leaf': 0.0, 'max_leaf_nodes': 300, 'bootstrap': False, 'ccp_alpha': 0.01}. Best is trial 4539 with value: 0.19155472534689352.
[I 2025-04-16 02:28:41,528] Trial 4930 finished with value: -0.1936417107583833 and parameters: {'n_estimators': 1107, 'min_samples_split': 2, 'max_features': 0.85, 'min_samples_leaf': 5, 'criterion': 'absolute_error', 'max_depth': 15, 'min_weight_fraction_leaf': 0.0, 'max_leaf_nodes': 300, 'bootstrap': False, 'ccp_alpha': 0.03}. Best is trial 4539 with value: 0.19155472534689352.
[I 2025-04-16 02:28:42,544] Trial 4931 finished with value: -10.155714737298986 and parameters: {'n_estimators': 464, 'min_samples_split': 9, 'max_features': 0.8300000000000001, 'min_samples_leaf': 1, 'criterion': 'absolute_error', 'max_depth': 15, 'min_weight_fraction_leaf': 0.0, 'max_leaf_nodes': 10, 'bootstrap': False, 'ccp_alpha': 0.0}. Best is trial 4539 with value: 0.19155472534689352.
[I 2025-04-16 02:28:43,853] Trial 4932 finished with value: -0.1936417107583833 and parameters: {'n_estimators': 802, 'min_samples_split': 5, 'max_features': 0.85, 'min_samples_leaf': 3, 'criterion': 'absolute_error', 'max_depth': 15, 'min_weight_fraction_leaf': 0.0, 'max_leaf_nodes': 300, 'bootstrap': False, 'ccp_alpha': 0.017}. Best is trial 4539 with value: 0.19155472534689352.
[I 2025-04-16 02:28:44,716] Trial 4933 finished with value: -0.24255112285293637 and parameters: {'n_estimators': 274, 'min_samples_split': 9, 'max_features': 0.8200000000000001, 'min_samples_leaf': 4, 'criterion': 'absolute_error', 'max_depth': 15, 'min_weight_fraction_leaf': 0.0, 'max_leaf_nodes': 300, 'bootstrap': False, 'ccp_alpha': 0.005}. Best is trial 4539 with value: 0.19155472534689352.
[I 2025-04-16 02:28:45,860] Trial 4934 finished with value: -0.1936417107583833 and parameters: {'n_estimators': 584, 'min_samples_split': 2, 'max_features': 0.8300000000000001, 'min_samples_leaf': 7, 'criterion': 'absolute_error', 'max_depth': 15, 'min_weight_fraction_leaf': 0.0, 'max_leaf_nodes': 300, 'bootstrap': False, 'ccp_alpha': 0.01}. Best is trial 4539 with value: 0.19155472534689352.
[I 2025-04-16 02:28:47,266] Trial 4935 finished with value: -17.528986382275573 and parameters: {'n_estimators': 969, 'min_samples_split': 12, 'max_features': 0.8200000000000001, 'min_samples_leaf': 1, 'criterion': 'squared_error', 'max_depth': 15, 'min_weight_fraction_leaf': 0.0, 'max_leaf_nodes': 300, 'bootstrap': False, 'ccp_alpha': 0.005}. Best is trial 4539 with value: 0.19155472534689352.
[I 2025-04-16 02:28:48,000] Trial 4936 finished with value: -0.1936417107583833 and parameters: {'n_estimators': 158, 'min_samples_split': 6, 'max_features': 0.81, 'min_samples_leaf': 3, 'criterion': 'absolute_error', 'max_depth': None, 'min_weight_fraction_leaf': 0.0, 'max_leaf_nodes': None, 'bootstrap': False, 'ccp_alpha': 0.016}. Best is trial 4539 with value: 0.19155472534689352.
[I 2025-04-16 02:28:49,010] Trial 4937 finished with value: -0.1936417107583833 and parameters: {'n_estimators': 433, 'min_samples_split': 2, 'max_features': 0.81, 'min_samples_leaf': 5, 'criterion': 'absolute_error', 'max_depth': 15, 'min_weight_fraction_leaf': 0.0, 'max_leaf_nodes': 10, 'bootstrap': False, 'ccp_alpha': 0.024}. Best is trial 4539 with value: 0.19155472534689352.
[I 2025-04-16 02:28:50,225] Trial 4938 finished with value: -11.949874622748954 and parameters: {'n_estimators': 735, 'min_samples_split': 9, 'max_features': 0.85, 'min_samples_leaf': 1, 'criterion': 'absolute_error', 'max_depth': 15, 'min_weight_fraction_leaf': 0.0, 'max_leaf_nodes': 300, 'bootstrap': False, 'ccp_alpha': 0.0}. Best is trial 4539 with value: 0.19155472534689352.
[I 2025-04-16 02:28:52,044] Trial 4939 finished with value: -0.1936417107583833 and parameters: {'n_estimators': 1301, 'min_samples_split': 6, 'max_features': 0.81, 'min_samples_leaf': 3, 'criterion': 'absolute_error', 'max_depth': 10, 'min_weight_fraction_leaf': 0.06, 'max_leaf_nodes': 300, 'bootstrap': False, 'ccp_alpha': 0.01}. Best is trial 4539 with value: 0.19155472534689352.
[I 2025-04-16 02:28:53,199] Trial 4940 finished with value: -0.11586497293239073 and parameters: {'n_estimators': 578, 'min_samples_split': 2, 'max_features': 0.85, 'min_samples_leaf': 5, 'criterion': 'absolute_error', 'max_depth': 15, 'min_weight_fraction_leaf': 0.0, 'max_leaf_nodes': 300, 'bootstrap': False, 'ccp_alpha': 0.005}. Best is trial 4539 with value: 0.19155472534689352.
[I 2025-04-16 02:28:54,167] Trial 4941 finished with value: -0.1936417107583833 and parameters: {'n_estimators': 409, 'min_samples_split': 12, 'max_features': 0.81, 'min_samples_leaf': 1, 'criterion': 'absolute_error', 'max_depth': 15, 'min_weight_fraction_leaf': 0.0, 'max_leaf_nodes': 300, 'bootstrap': False, 'ccp_alpha': 0.014}. Best is trial 4539 with value: 0.19155472534689352.
[I 2025-04-16 02:28:55,518] Trial 4942 finished with value: -10.581124128037969 and parameters: {'n_estimators': 784, 'min_samples_split': 6, 'max_features': 0.85, 'min_samples_leaf': 3, 'criterion': 'absolute_error', 'max_depth': 15, 'min_weight_fraction_leaf': 0.0, 'max_leaf_nodes': 300, 'bootstrap': False, 'ccp_alpha': 0.0}. Best is trial 4539 with value: 0.19155472534689352.
[I 2025-04-16 02:28:57,165] Trial 4943 finished with value: -19.68828648879481 and parameters: {'n_estimators': 1034, 'min_samples_split': 9, 'max_features': 0.8300000000000001, 'min_samples_leaf': 7, 'criterion': 'poisson', 'max_depth': None, 'min_weight_fraction_leaf': 0.0, 'max_leaf_nodes': 10, 'bootstrap': False, 'ccp_alpha': 0.01}. Best is trial 4539 with value: 0.19155472534689352.
[I 2025-04-16 02:28:57,907] Trial 4944 finished with value: 0.05521768750527434 and parameters: {'n_estimators': 147, 'min_samples_split': 5, 'max_features': 0.81, 'min_samples_leaf': 1, 'criterion': 'absolute_error', 'max_depth': 15, 'min_weight_fraction_leaf': 0.0, 'max_leaf_nodes': 300, 'bootstrap': False, 'ccp_alpha': 0.005}. Best is trial 4539 with value: 0.19155472534689352.
[I 2025-04-16 02:28:58,569] Trial 4945 finished with value: -0.1936417107583833 and parameters: {'n_estimators': 49, 'min_samples_split': 16, 'max_features': 0.8, 'min_samples_leaf': 3, 'criterion': 'absolute_error', 'max_depth': 15, 'min_weight_fraction_leaf': 0.0, 'max_leaf_nodes': 300, 'bootstrap': False, 'ccp_alpha': 0.022}. Best is trial 4539 with value: 0.19155472534689352.
[I 2025-04-16 02:28:59,396] Trial 4946 finished with value: -0.1936417107583833 and parameters: {'n_estimators': 94, 'min_samples_split': 13, 'max_features': 0.8, 'min_samples_leaf': 5, 'criterion': 'absolute_error', 'max_depth': 15, 'min_weight_fraction_leaf': 0.0, 'max_leaf_nodes': None, 'bootstrap': False, 'ccp_alpha': 0.015}. Best is trial 4539 with value: 0.19155472534689352.
[I 2025-04-16 02:29:00,117] Trial 4947 finished with value: -0.17449824621403326 and parameters: {'n_estimators': 108, 'min_samples_split': 15, 'max_features': 0.79, 'min_samples_leaf': 1, 'criterion': 'absolute_error', 'max_depth': 15, 'min_weight_fraction_leaf': 0.0, 'max_leaf_nodes': 300, 'bootstrap': False, 'ccp_alpha': 0.005}. Best is trial 4539 with value: 0.19155472534689352.
[I 2025-04-16 02:29:00,869] Trial 4948 finished with value: -9.995596468292447 and parameters: {'n_estimators': 153, 'min_samples_split': 14, 'max_features': 0.8, 'min_samples_leaf': 3, 'criterion': 'absolute_error', 'max_depth': 15, 'min_weight_fraction_leaf': 0.0, 'max_leaf_nodes': 10, 'bootstrap': False, 'ccp_alpha': 0.0}. Best is trial 4539 with value: 0.19155472534689352.
[I 2025-04-16 02:29:01,629] Trial 4949 finished with value: -0.1936417107583833 and parameters: {'n_estimators': 161, 'min_samples_split': 12, 'max_features': 0.8, 'min_samples_leaf': 1, 'criterion': 'absolute_error', 'max_depth': 15, 'min_weight_fraction_leaf': 0.0, 'max_leaf_nodes': 300, 'bootstrap': False, 'ccp_alpha': 0.01}. Best is trial 4539 with value: 0.19155472534689352.
[I 2025-04-16 02:29:02,274] Trial 4950 finished with value: -17.52898638227503 and parameters: {'n_estimators': 24, 'min_samples_split': 12, 'max_features': 0.8, 'min_samples_leaf': 5, 'criterion': 'friedman_mse', 'max_depth': None, 'min_weight_fraction_leaf': 0.0, 'max_leaf_nodes': 300, 'bootstrap': False, 'ccp_alpha': 0.019}. Best is trial 4539 with value: 0.19155472534689352.
[I 2025-04-16 02:29:03,026] Trial 4951 finished with value: -0.1936417107583833 and parameters: {'n_estimators': 132, 'min_samples_split': 9, 'max_features': 0.81, 'min_samples_leaf': 3, 'criterion': 'absolute_error', 'max_depth': 15, 'min_weight_fraction_leaf': 0.0, 'max_leaf_nodes': 300, 'bootstrap': False, 'ccp_alpha': 0.01}. Best is trial 4539 with value: 0.19155472534689352.
[I 2025-04-16 02:29:03,796] Trial 4952 finished with value: -0.1936417107583833 and parameters: {'n_estimators': 154, 'min_samples_split': 14, 'max_features': 0.79, 'min_samples_leaf': 7, 'criterion': 'absolute_error', 'max_depth': 20, 'min_weight_fraction_leaf': 0.0, 'max_leaf_nodes': 300, 'bootstrap': False, 'ccp_alpha': 0.006}. Best is trial 4539 with value: 0.19155472534689352.
[I 2025-04-16 02:29:04,421] Trial 4953 finished with value: -0.1936417107583833 and parameters: {'n_estimators': 7, 'min_samples_split': 15, 'max_features': 0.81, 'min_samples_leaf': 1, 'criterion': 'absolute_error', 'max_depth': 45, 'min_weight_fraction_leaf': 0.0, 'max_leaf_nodes': 10, 'bootstrap': False, 'ccp_alpha': 0.013000000000000001}. Best is trial 4539 with value: 0.19155472534689352.
[I 2025-04-16 02:29:05,222] Trial 4954 finished with value: -10.539891725743626 and parameters: {'n_estimators': 222, 'min_samples_split': 9, 'max_features': 0.79, 'min_samples_leaf': 4, 'criterion': 'absolute_error', 'max_depth': 15, 'min_weight_fraction_leaf': 0.0, 'max_leaf_nodes': 300, 'bootstrap': False, 'ccp_alpha': 0.0}. Best is trial 4539 with value: 0.19155472534689352.
[I 2025-04-16 02:29:05,856] Trial 4955 finished with value: -0.06936122561946116 and parameters: {'n_estimators': 17, 'min_samples_split': 9, 'max_features': 0.8200000000000001, 'min_samples_leaf': 3, 'criterion': 'absolute_error', 'max_depth': 15, 'min_weight_fraction_leaf': 0.0, 'max_leaf_nodes': None, 'bootstrap': False, 'ccp_alpha': 0.005}. Best is trial 4539 with value: 0.19155472534689352.
[I 2025-04-16 02:29:06,700] Trial 4956 finished with value: -0.1936417107583833 and parameters: {'n_estimators': 181, 'min_samples_split': 11, 'max_features': 0.81, 'min_samples_leaf': 1, 'criterion': 'absolute_error', 'max_depth': 15, 'min_weight_fraction_leaf': 0.0, 'max_leaf_nodes': 300, 'bootstrap': False, 'ccp_alpha': 0.018000000000000002}. Best is trial 4539 with value: 0.19155472534689352.
[I 2025-04-16 02:29:07,584] Trial 4957 finished with value: -0.1936417107583833 and parameters: {'n_estimators': 266, 'min_samples_split': 15, 'max_features': 0.78, 'min_samples_leaf': 5, 'criterion': 'absolute_error', 'max_depth': 15, 'min_weight_fraction_leaf': 0.0, 'max_leaf_nodes': 300, 'bootstrap': False, 'ccp_alpha': 0.009000000000000001}. Best is trial 4539 with value: 0.19155472534689352.
[I 2025-04-16 02:29:08,259] Trial 4958 finished with value: -17.52898638227503 and parameters: {'n_estimators': 11, 'min_samples_split': 9, 'max_features': 0.79, 'min_samples_leaf': 78, 'criterion': 'squared_error', 'max_depth': None, 'min_weight_fraction_leaf': 0.0, 'max_leaf_nodes': 300, 'bootstrap': False, 'ccp_alpha': 0.005}. Best is trial 4539 with value: 0.19155472534689352.
[I 2025-04-16 02:29:09,135] Trial 4959 finished with value: -10.701872502631273 and parameters: {'n_estimators': 287, 'min_samples_split': 9, 'max_features': 0.8200000000000001, 'min_samples_leaf': 3, 'criterion': 'absolute_error', 'max_depth': 15, 'min_weight_fraction_leaf': 0.05, 'max_leaf_nodes': 10, 'bootstrap': False, 'ccp_alpha': 0.0}. Best is trial 4539 with value: 0.19155472534689352.
[I 2025-04-16 02:29:10,067] Trial 4960 finished with value: -0.1936417107583833 and parameters: {'n_estimators': 216, 'min_samples_split': 6, 'max_features': 0.8, 'min_samples_leaf': 1, 'criterion': 'absolute_error', 'max_depth': 15, 'min_weight_fraction_leaf': 0.0, 'max_leaf_nodes': 300, 'bootstrap': False, 'ccp_alpha': 0.014}. Best is trial 4539 with value: 0.19155472534689352.
[I 2025-04-16 02:29:10,943] Trial 4961 finished with value: -0.1936417107583833 and parameters: {'n_estimators': 299, 'min_samples_split': 6, 'max_features': 0.8200000000000001, 'min_samples_leaf': 7, 'criterion': 'absolute_error', 'max_depth': 10, 'min_weight_fraction_leaf': 0.0, 'max_leaf_nodes': 300, 'bootstrap': False, 'ccp_alpha': 0.033}. Best is trial 4539 with value: 0.19155472534689352.
[I 2025-04-16 02:29:11,694] Trial 4962 finished with value: -0.1936417107583833 and parameters: {'n_estimators': 172, 'min_samples_split': 12, 'max_features': 0.78, 'min_samples_leaf': 3, 'criterion': 'absolute_error', 'max_depth': 15, 'min_weight_fraction_leaf': 0.0, 'max_leaf_nodes': 300, 'bootstrap': False, 'ccp_alpha': 0.148}. Best is trial 4539 with value: 0.19155472534689352.
[I 2025-04-16 02:29:12,529] Trial 4963 finished with value: -0.1936417107583833 and parameters: {'n_estimators': 265, 'min_samples_split': 6, 'max_features': 0.8, 'min_samples_leaf': 5, 'criterion': 'absolute_error', 'max_depth': 15, 'min_weight_fraction_leaf': 0.0, 'max_leaf_nodes': 300, 'bootstrap': False, 'ccp_alpha': 0.01}. Best is trial 4539 with value: 0.19155472534689352.
[I 2025-04-16 02:29:13,178] Trial 4964 finished with value: -0.1936417107583833 and parameters: {'n_estimators': 14, 'min_samples_split': 9, 'max_features': 0.78, 'min_samples_leaf': 1, 'criterion': 'absolute_error', 'max_depth': 15, 'min_weight_fraction_leaf': 0.0, 'max_leaf_nodes': None, 'bootstrap': False, 'ccp_alpha': 0.023}. Best is trial 4539 with value: 0.19155472534689352.
[I 2025-04-16 02:29:13,991] Trial 4965 finished with value: -20.385488672728293 and parameters: {'n_estimators': 218, 'min_samples_split': 6, 'max_features': 0.81, 'min_samples_leaf': 3, 'criterion': 'poisson', 'max_depth': 15, 'min_weight_fraction_leaf': 0.0, 'max_leaf_nodes': 10, 'bootstrap': False, 'ccp_alpha': 0.005}. Best is trial 4539 with value: 0.19155472534689352.
