[I 2025-04-16 01:44:32,544] Trial 2833 finished with value: -0.1936417107583833 and parameters: {'n_estimators': 2833, 'min_samples_split': 2, 'max_features': 0.91, 'min_samples_leaf': 3, 'criterion': 'absolute_error', 'max_depth': 5, 'min_weight_fraction_leaf': 0.0, 'max_leaf_nodes': 20, 'bootstrap': False, 'ccp_alpha': 0.03}. Best is trial 2774 with value: 0.046571421912873.
[I 2025-04-16 01:44:35,529] Trial 2834 finished with value: -0.09405068667705938 and parameters: {'n_estimators': 3223, 'min_samples_split': 8, 'max_features': 0.87, 'min_samples_leaf': 1, 'criterion': 'absolute_error', 'max_depth': 5, 'min_weight_fraction_leaf': 0.0, 'max_leaf_nodes': 20, 'bootstrap': False, 'ccp_alpha': 0.005}. Best is trial 2774 with value: 0.046571421912873.
[I 2025-04-16 01:44:38,614] Trial 2835 finished with value: -17.52898638227594 and parameters: {'n_estimators': 3259, 'min_samples_split': 12, 'max_features': 0.88, 'min_samples_leaf': 5, 'criterion': 'squared_error', 'max_depth': 5, 'min_weight_fraction_leaf': 0.0, 'max_leaf_nodes': 20, 'bootstrap': False, 'ccp_alpha': 0.015}. Best is trial 2774 with value: 0.046571421912873.
[I 2025-04-16 01:44:41,810] Trial 2836 finished with value: -0.1936417107583833 and parameters: {'n_estimators': 3075, 'min_samples_split': 5, 'max_features': 0.91, 'min_samples_leaf': 2, 'criterion': 'absolute_error', 'max_depth': 5, 'min_weight_fraction_leaf': 0.0, 'max_leaf_nodes': 20, 'bootstrap': False, 'ccp_alpha': 0.01}. Best is trial 2774 with value: 0.046571421912873.
[I 2025-04-16 01:44:44,627] Trial 2837 finished with value: -0.1936417107583833 and parameters: {'n_estimators': 2975, 'min_samples_split': 2, 'max_features': 0.89, 'min_samples_leaf': 7, 'criterion': 'absolute_error', 'max_depth': 5, 'min_weight_fraction_leaf': 0.0, 'max_leaf_nodes': 20, 'bootstrap': False, 'ccp_alpha': 0.245}. Best is trial 2774 with value: 0.046571421912873.
[I 2025-04-16 01:44:47,920] Trial 2838 finished with value: -0.08751229648123222 and parameters: {'n_estimators': 3280, 'min_samples_split': 8, 'max_features': 0.85, 'min_samples_leaf': 3, 'criterion': 'absolute_error', 'max_depth': 5, 'min_weight_fraction_leaf': 0.0, 'max_leaf_nodes': 20, 'bootstrap': False, 'ccp_alpha': 0.005}. Best is trial 2774 with value: 0.046571421912873.
[I 2025-04-16 01:44:50,640] Trial 2839 finished with value: -13.242696018768424 and parameters: {'n_estimators': 3271, 'min_samples_split': 12, 'max_features': 0.9, 'min_samples_leaf': 5, 'criterion': 'absolute_error', 'max_depth': 5, 'min_weight_fraction_leaf': 0.0, 'max_leaf_nodes': 20, 'bootstrap': False, 'ccp_alpha': 0.0}. Best is trial 2774 with value: 0.046571421912873.
[I 2025-04-16 01:44:52,879] Trial 2840 finished with value: -0.1936417107583833 and parameters: {'n_estimators': 2639, 'min_samples_split': 6, 'max_features': 0.91, 'min_samples_leaf': 1, 'criterion': 'absolute_error', 'max_depth': 5, 'min_weight_fraction_leaf': 0.0, 'max_leaf_nodes': 20, 'bootstrap': False, 'ccp_alpha': 0.015}. Best is trial 2774 with value: 0.046571421912873.
[I 2025-04-16 01:44:55,335] Trial 2841 finished with value: -0.1936417107583833 and parameters: {'n_estimators': 2437, 'min_samples_split': 5, 'max_features': 0.87, 'min_samples_leaf': 3, 'criterion': 'absolute_error', 'max_depth': 5, 'min_weight_fraction_leaf': 0.0, 'max_leaf_nodes': 20, 'bootstrap': False, 'ccp_alpha': 0.022}. Best is trial 2774 with value: 0.046571421912873.
[I 2025-04-16 01:44:58,000] Trial 2842 finished with value: -20.33878490760796 and parameters: {'n_estimators': 3064, 'min_samples_split': 2, 'max_features': 0.89, 'min_samples_leaf': 7, 'criterion': 'poisson', 'max_depth': 5, 'min_weight_fraction_leaf': 0.0, 'max_leaf_nodes': 20, 'bootstrap': False, 'ccp_alpha': 0.01}. Best is trial 2774 with value: 0.046571421912873.
[I 2025-04-16 01:45:00,330] Trial 2843 finished with value: -0.08115445334162978 and parameters: {'n_estimators': 2797, 'min_samples_split': 9, 'max_features': 0.85, 'min_samples_leaf': 5, 'criterion': 'absolute_error', 'max_depth': 5, 'min_weight_fraction_leaf': 0.0, 'max_leaf_nodes': 20, 'bootstrap': False, 'ccp_alpha': 0.005}. Best is trial 2774 with value: 0.046571421912873.
[I 2025-04-16 01:45:03,289] Trial 2844 finished with value: -0.1936417107583833 and parameters: {'n_estimators': 3266, 'min_samples_split': 12, 'max_features': 0.91, 'min_samples_leaf': 1, 'criterion': 'absolute_error', 'max_depth': 5, 'min_weight_fraction_leaf': 0.0, 'max_leaf_nodes': 20, 'bootstrap': False, 'ccp_alpha': 0.01}. Best is trial 2774 with value: 0.046571421912873.
[I 2025-04-16 01:45:05,939] Trial 2845 finished with value: -11.685001661927803 and parameters: {'n_estimators': 2977, 'min_samples_split': 6, 'max_features': 0.87, 'min_samples_leaf': 4, 'criterion': 'absolute_error', 'max_depth': 5, 'min_weight_fraction_leaf': 0.0, 'max_leaf_nodes': 20, 'bootstrap': False, 'ccp_alpha': 0.0}. Best is trial 2774 with value: 0.046571421912873.
[I 2025-04-16 01:45:08,694] Trial 2846 finished with value: -0.1936417107583833 and parameters: {'n_estimators': 3303, 'min_samples_split': 2, 'max_features': 0.8300000000000001, 'min_samples_leaf': 3, 'criterion': 'absolute_error', 'max_depth': 5, 'min_weight_fraction_leaf': 0.0, 'max_leaf_nodes': 20, 'bootstrap': False, 'ccp_alpha': 0.018000000000000002}. Best is trial 2774 with value: 0.046571421912873.
[I 2025-04-16 01:45:11,839] Trial 2847 finished with value: 0.022818719642073004 and parameters: {'n_estimators': 3268, 'min_samples_split': 9, 'max_features': 0.91, 'min_samples_leaf': 7, 'criterion': 'absolute_error', 'max_depth': 5, 'min_weight_fraction_leaf': 0.0, 'max_leaf_nodes': 20, 'bootstrap': False, 'ccp_alpha': 0.005}. Best is trial 2774 with value: 0.046571421912873.
[I 2025-04-16 01:45:14,440] Trial 2848 finished with value: -0.19364167734351728 and parameters: {'n_estimators': 3010, 'min_samples_split': 12, 'max_features': 0.89, 'min_samples_leaf': 8, 'criterion': 'absolute_error', 'max_depth': 5, 'min_weight_fraction_leaf': 0.0, 'max_leaf_nodes': 20, 'bootstrap': False, 'ccp_alpha': 0.004}. Best is trial 2774 with value: 0.046571421912873.
[I 2025-04-16 01:45:16,797] Trial 2849 finished with value: -0.1936417107583833 and parameters: {'n_estimators': 2807, 'min_samples_split': 13, 'max_features': 0.87, 'min_samples_leaf': 8, 'criterion': 'absolute_error', 'max_depth': 5, 'min_weight_fraction_leaf': 0.0, 'max_leaf_nodes': 20, 'bootstrap': False, 'ccp_alpha': 0.01}. Best is trial 2774 with value: 0.046571421912873.
[I 2025-04-16 01:45:20,108] Trial 2850 finished with value: -15.644746084319298 and parameters: {'n_estimators': 3143, 'min_samples_split': 12, 'max_features': 0.85, 'min_samples_leaf': 7, 'criterion': 'friedman_mse', 'max_depth': 5, 'min_weight_fraction_leaf': 0.0, 'max_leaf_nodes': 20, 'bootstrap': False, 'ccp_alpha': 0.0}. Best is trial 2774 with value: 0.046571421912873.
[I 2025-04-16 01:45:24,182] Trial 2851 finished with value: -0.1936417107583833 and parameters: {'n_estimators': 3318, 'min_samples_split': 12, 'max_features': 0.89, 'min_samples_leaf': 8, 'criterion': 'absolute_error', 'max_depth': 5, 'min_weight_fraction_leaf': 0.0, 'max_leaf_nodes': 20, 'bootstrap': False, 'ccp_alpha': 0.015}. Best is trial 2774 with value: 0.046571421912873.
[I 2025-04-16 01:45:26,762] Trial 2852 finished with value: -9.481180888522319 and parameters: {'n_estimators': 2906, 'min_samples_split': 9, 'max_features': 0.88, 'min_samples_leaf': 6, 'criterion': 'absolute_error', 'max_depth': 5, 'min_weight_fraction_leaf': 0.0, 'max_leaf_nodes': 20, 'bootstrap': False, 'ccp_alpha': 0.0}. Best is trial 2774 with value: 0.046571421912873.
[I 2025-04-16 01:45:29,238] Trial 2853 finished with value: -0.1936417107583833 and parameters: {'n_estimators': 3065, 'min_samples_split': 13, 'max_features': 0.91, 'min_samples_leaf': 6, 'criterion': 'absolute_error', 'max_depth': 5, 'min_weight_fraction_leaf': 0.0, 'max_leaf_nodes': 20, 'bootstrap': False, 'ccp_alpha': 0.01}. Best is trial 2774 with value: 0.046571421912873.
[I 2025-04-16 01:45:31,432] Trial 2854 finished with value: -0.1936417107583833 and parameters: {'n_estimators': 2601, 'min_samples_split': 12, 'max_features': 0.87, 'min_samples_leaf': 8, 'criterion': 'absolute_error', 'max_depth': 5, 'min_weight_fraction_leaf': 0.0, 'max_leaf_nodes': 20, 'bootstrap': False, 'ccp_alpha': 0.005}. Best is trial 2774 with value: 0.046571421912873.
[I 2025-04-16 01:45:34,298] Trial 2855 finished with value: -0.1936417107583833 and parameters: {'n_estimators': 3338, 'min_samples_split': 108, 'max_features': 0.89, 'min_samples_leaf': 7, 'criterion': 'absolute_error', 'max_depth': 5, 'min_weight_fraction_leaf': 0.0, 'max_leaf_nodes': 20, 'bootstrap': False, 'ccp_alpha': 0.015}. Best is trial 2774 with value: 0.046571421912873.
[I 2025-04-16 01:45:36,895] Trial 2856 finished with value: -0.1936417107583833 and parameters: {'n_estimators': 3196, 'min_samples_split': 9, 'max_features': 0.91, 'min_samples_leaf': 5, 'criterion': 'absolute_error', 'max_depth': 5, 'min_weight_fraction_leaf': 0.0, 'max_leaf_nodes': 20, 'bootstrap': False, 'ccp_alpha': 0.01}. Best is trial 2774 with value: 0.046571421912873.
[I 2025-04-16 01:45:39,569] Trial 2857 finished with value: -0.1936417107583833 and parameters: {'n_estimators': 3334, 'min_samples_split': 9, 'max_features': 0.85, 'min_samples_leaf': 7, 'criterion': 'absolute_error', 'max_depth': 5, 'min_weight_fraction_leaf': 0.0, 'max_leaf_nodes': 20, 'bootstrap': False, 'ccp_alpha': 0.024}. Best is trial 2774 with value: 0.046571421912873.
[I 2025-04-16 01:45:42,234] Trial 2858 finished with value: 0.02388797221227499 and parameters: {'n_estimators': 2932, 'min_samples_split': 13, 'max_features': 0.91, 'min_samples_leaf': 5, 'criterion': 'absolute_error', 'max_depth': 5, 'min_weight_fraction_leaf': 0.0, 'max_leaf_nodes': 20, 'bootstrap': False, 'ccp_alpha': 0.005}. Best is trial 2774 with value: 0.046571421912873.
[I 2025-04-16 01:45:44,642] Trial 2859 finished with value: -17.528986382277033 and parameters: {'n_estimators': 2929, 'min_samples_split': 13, 'max_features': 0.87, 'min_samples_leaf': 8, 'criterion': 'squared_error', 'max_depth': None, 'min_weight_fraction_leaf': 0.0, 'max_leaf_nodes': 20, 'bootstrap': False, 'ccp_alpha': 0.005}. Best is trial 2774 with value: 0.046571421912873.
[I 2025-04-16 01:45:47,177] Trial 2860 finished with value: -3.7934484513152533 and parameters: {'n_estimators': 2756, 'min_samples_split': 12, 'max_features': 0.51, 'min_samples_leaf': 8, 'criterion': 'absolute_error', 'max_depth': 5, 'min_weight_fraction_leaf': 0.0, 'max_leaf_nodes': 20, 'bootstrap': False, 'ccp_alpha': 0.0}. Best is trial 2774 with value: 0.046571421912873.
[I 2025-04-16 01:45:49,513] Trial 2861 finished with value: -0.08903910102716642 and parameters: {'n_estimators': 2682, 'min_samples_split': 12, 'max_features': 0.89, 'min_samples_leaf': 7, 'criterion': 'absolute_error', 'max_depth': 5, 'min_weight_fraction_leaf': 0.0, 'max_leaf_nodes': 20, 'bootstrap': False, 'ccp_alpha': 0.005}. Best is trial 2774 with value: 0.046571421912873.
[I 2025-04-16 01:45:51,639] Trial 2862 finished with value: -9.448976808390174 and parameters: {'n_estimators': 2756, 'min_samples_split': 12, 'max_features': 0.88, 'min_samples_leaf': 6, 'criterion': 'absolute_error', 'max_depth': 5, 'min_weight_fraction_leaf': 0.0, 'max_leaf_nodes': 20, 'bootstrap': False, 'ccp_alpha': 0.0}. Best is trial 2774 with value: 0.046571421912873.
[I 2025-04-16 01:45:54,227] Trial 2863 finished with value: -0.1936417107583833 and parameters: {'n_estimators': 2454, 'min_samples_split': 11, 'max_features': 0.86, 'min_samples_leaf': 5, 'criterion': 'absolute_error', 'max_depth': 5, 'min_weight_fraction_leaf': 0.0, 'max_leaf_nodes': 20, 'bootstrap': False, 'ccp_alpha': 0.014}. Best is trial 2774 with value: 0.046571421912873.
[I 2025-04-16 01:45:56,436] Trial 2864 finished with value: -0.1936417107583833 and parameters: {'n_estimators': 2265, 'min_samples_split': 12, 'max_features': 0.89, 'min_samples_leaf': 6, 'criterion': 'absolute_error', 'max_depth': 5, 'min_weight_fraction_leaf': 0.0, 'max_leaf_nodes': 20, 'bootstrap': False, 'ccp_alpha': 0.009000000000000001}. Best is trial 2774 with value: 0.046571421912873.
[I 2025-04-16 01:45:58,332] Trial 2865 finished with value: -17.528986382276933 and parameters: {'n_estimators': 2572, 'min_samples_split': 79, 'max_features': 0.8400000000000001, 'min_samples_leaf': 5, 'criterion': 'poisson', 'max_depth': 5, 'min_weight_fraction_leaf': 0.0, 'max_leaf_nodes': 20, 'bootstrap': False, 'ccp_alpha': 0.0}. Best is trial 2774 with value: 0.046571421912873.
[I 2025-04-16 01:46:00,865] Trial 2866 finished with value: -0.1936417107583833 and parameters: {'n_estimators': 2819, 'min_samples_split': 13, 'max_features': 0.9, 'min_samples_leaf': 8, 'criterion': 'absolute_error', 'max_depth': 5, 'min_weight_fraction_leaf': 0.0, 'max_leaf_nodes': 20, 'bootstrap': False, 'ccp_alpha': 0.02}. Best is trial 2774 with value: 0.046571421912873.
[I 2025-04-16 01:46:03,047] Trial 2867 finished with value: -0.1936417107583833 and parameters: {'n_estimators': 2358, 'min_samples_split': 12, 'max_features': 0.86, 'min_samples_leaf': 5, 'criterion': 'absolute_error', 'max_depth': 5, 'min_weight_fraction_leaf': 0.0, 'max_leaf_nodes': 20, 'bootstrap': False, 'ccp_alpha': 0.009000000000000001}. Best is trial 2774 with value: 0.046571421912873.
[I 2025-04-16 01:46:05,483] Trial 2868 finished with value: -0.1936417107583833 and parameters: {'n_estimators': 2644, 'min_samples_split': 9, 'max_features': 0.8300000000000001, 'min_samples_leaf': 8, 'criterion': 'absolute_error', 'max_depth': 5, 'min_weight_fraction_leaf': 0.0, 'max_leaf_nodes': 20, 'bootstrap': False, 'ccp_alpha': 0.016}. Best is trial 2774 with value: 0.046571421912873.
[I 2025-04-16 01:46:08,044] Trial 2869 finished with value: 0.023464500074871376 and parameters: {'n_estimators': 2851, 'min_samples_split': 12, 'max_features': 0.91, 'min_samples_leaf': 5, 'criterion': 'absolute_error', 'max_depth': 5, 'min_weight_fraction_leaf': 0.0, 'max_leaf_nodes': 20, 'bootstrap': False, 'ccp_alpha': 0.005}. Best is trial 2774 with value: 0.046571421912873.
[I 2025-04-16 01:46:10,466] Trial 2870 finished with value: -0.08821176819728901 and parameters: {'n_estimators': 2768, 'min_samples_split': 13, 'max_features': 0.86, 'min_samples_leaf': 7, 'criterion': 'absolute_error', 'max_depth': 5, 'min_weight_fraction_leaf': 0.0, 'max_leaf_nodes': 20, 'bootstrap': False, 'ccp_alpha': 0.005}. Best is trial 2774 with value: 0.046571421912873.
[I 2025-04-16 01:46:12,445] Trial 2871 finished with value: -7.150067881813817 and parameters: {'n_estimators': 2403, 'min_samples_split': 13, 'max_features': 0.88, 'min_samples_leaf': 8, 'criterion': 'absolute_error', 'max_depth': 5, 'min_weight_fraction_leaf': 0.09, 'max_leaf_nodes': 20, 'bootstrap': False, 'ccp_alpha': 0.0}. Best is trial 2774 with value: 0.046571421912873.
[I 2025-04-16 01:46:14,716] Trial 2872 finished with value: -0.1936417107583833 and parameters: {'n_estimators': 2656, 'min_samples_split': 13, 'max_features': 0.89, 'min_samples_leaf': 8, 'criterion': 'absolute_error', 'max_depth': 5, 'min_weight_fraction_leaf': 0.0, 'max_leaf_nodes': 20, 'bootstrap': False, 'ccp_alpha': 0.011}. Best is trial 2774 with value: 0.046571421912873.
[I 2025-04-16 01:46:17,169] Trial 2873 finished with value: -9.476591762961496 and parameters: {'n_estimators': 2757, 'min_samples_split': 13, 'max_features': 0.87, 'min_samples_leaf': 6, 'criterion': 'absolute_error', 'max_depth': 15, 'min_weight_fraction_leaf': 0.0, 'max_leaf_nodes': 20, 'bootstrap': False, 'ccp_alpha': 0.0}. Best is trial 2774 with value: 0.046571421912873.
[I 2025-04-16 01:46:19,311] Trial 2874 finished with value: -17.528986382276912 and parameters: {'n_estimators': 2496, 'min_samples_split': 14, 'max_features': 0.9, 'min_samples_leaf': 5, 'criterion': 'friedman_mse', 'max_depth': 5, 'min_weight_fraction_leaf': 0.0, 'max_leaf_nodes': 20, 'bootstrap': False, 'ccp_alpha': 0.005}. Best is trial 2774 with value: 0.046571421912873.
[I 2025-04-16 01:46:21,221] Trial 2875 finished with value: -0.1936417107583833 and parameters: {'n_estimators': 2134, 'min_samples_split': 14, 'max_features': 0.88, 'min_samples_leaf': 8, 'criterion': 'absolute_error', 'max_depth': 5, 'min_weight_fraction_leaf': 0.0, 'max_leaf_nodes': 20, 'bootstrap': False, 'ccp_alpha': 0.014}. Best is trial 2774 with value: 0.046571421912873.
[I 2025-04-16 01:46:23,758] Trial 2876 finished with value: -0.1936417107583833 and parameters: {'n_estimators': 2478, 'min_samples_split': 13, 'max_features': 0.91, 'min_samples_leaf': 5, 'criterion': 'absolute_error', 'max_depth': 5, 'min_weight_fraction_leaf': 0.0, 'max_leaf_nodes': 20, 'bootstrap': False, 'ccp_alpha': 0.012}. Best is trial 2774 with value: 0.046571421912873.
[I 2025-04-16 01:46:25,969] Trial 2877 finished with value: -0.08864413616810414 and parameters: {'n_estimators': 2283, 'min_samples_split': 12, 'max_features': 0.86, 'min_samples_leaf': 6, 'criterion': 'absolute_error', 'max_depth': 5, 'min_weight_fraction_leaf': 0.0, 'max_leaf_nodes': 20, 'bootstrap': False, 'ccp_alpha': 0.005}. Best is trial 2774 with value: 0.046571421912873.
[I 2025-04-16 01:46:28,471] Trial 2878 finished with value: -0.1936417107583833 and parameters: {'n_estimators': 2812, 'min_samples_split': 13, 'max_features': 0.9, 'min_samples_leaf': 8, 'criterion': 'absolute_error', 'max_depth': 5, 'min_weight_fraction_leaf': 0.0, 'max_leaf_nodes': 20, 'bootstrap': False, 'ccp_alpha': 0.01}. Best is trial 2774 with value: 0.046571421912873.
[I 2025-04-16 01:46:31,000] Trial 2879 finished with value: -0.1936417107583833 and parameters: {'n_estimators': 2489, 'min_samples_split': 9, 'max_features': 0.8300000000000001, 'min_samples_leaf': 4, 'criterion': 'absolute_error', 'max_depth': None, 'min_weight_fraction_leaf': 0.0, 'max_leaf_nodes': 20, 'bootstrap': False, 'ccp_alpha': 0.02}. Best is trial 2774 with value: 0.046571421912873.
[I 2025-04-16 01:46:32,880] Trial 2880 finished with value: -9.394568645982575 and parameters: {'n_estimators': 2044, 'min_samples_split': 13, 'max_features': 0.88, 'min_samples_leaf': 6, 'criterion': 'absolute_error', 'max_depth': 5, 'min_weight_fraction_leaf': 0.0, 'max_leaf_nodes': 20, 'bootstrap': False, 'ccp_alpha': 0.0}. Best is trial 2774 with value: 0.046571421912873.
[I 2025-04-16 01:46:35,302] Trial 2881 finished with value: 0.023443946708314733 and parameters: {'n_estimators': 2521, 'min_samples_split': 9, 'max_features': 0.91, 'min_samples_leaf': 4, 'criterion': 'absolute_error', 'max_depth': 5, 'min_weight_fraction_leaf': 0.0, 'max_leaf_nodes': 20, 'bootstrap': False, 'ccp_alpha': 0.005}. Best is trial 2774 with value: 0.046571421912873.
[I 2025-04-16 01:46:37,575] Trial 2882 finished with value: -0.1936417107583833 and parameters: {'n_estimators': 2638, 'min_samples_split': 11, 'max_features': 0.88, 'min_samples_leaf': 8, 'criterion': 'absolute_error', 'max_depth': 5, 'min_weight_fraction_leaf': 0.0, 'max_leaf_nodes': 20, 'bootstrap': False, 'ccp_alpha': 0.01}. Best is trial 2774 with value: 0.046571421912873.
[I 2025-04-16 01:46:39,484] Trial 2883 finished with value: -0.1936417107583833 and parameters: {'n_estimators': 2174, 'min_samples_split': 14, 'max_features': 0.86, 'min_samples_leaf': 8, 'criterion': 'absolute_error', 'max_depth': 5, 'min_weight_fraction_leaf': 0.0, 'max_leaf_nodes': 20, 'bootstrap': False, 'ccp_alpha': 0.026000000000000002}. Best is trial 2774 with value: 0.046571421912873.
[I 2025-04-16 01:46:41,556] Trial 2884 finished with value: -0.1936417107583833 and parameters: {'n_estimators': 1937, 'min_samples_split': 14, 'max_features': 0.89, 'min_samples_leaf': 6, 'criterion': 'absolute_error', 'max_depth': 5, 'min_weight_fraction_leaf': 0.0, 'max_leaf_nodes': 20, 'bootstrap': False, 'ccp_alpha': 0.016}. Best is trial 2774 with value: 0.046571421912873.
[I 2025-04-16 01:46:43,625] Trial 2885 finished with value: -17.528986382276862 and parameters: {'n_estimators': 2350, 'min_samples_split': 14, 'max_features': 0.85, 'min_samples_leaf': 5, 'criterion': 'squared_error', 'max_depth': 5, 'min_weight_fraction_leaf': 0.0, 'max_leaf_nodes': 20, 'bootstrap': False, 'ccp_alpha': 0.005}. Best is trial 2774 with value: 0.046571421912873.
[I 2025-04-16 01:46:45,713] Trial 2886 finished with value: -0.1936417107583833 and parameters: {'n_estimators': 2518, 'min_samples_split': 114, 'max_features': 0.9, 'min_samples_leaf': 4, 'criterion': 'absolute_error', 'max_depth': 5, 'min_weight_fraction_leaf': 0.0, 'max_leaf_nodes': 20, 'bootstrap': False, 'ccp_alpha': 0.009000000000000001}. Best is trial 2774 with value: 0.046571421912873.
[I 2025-04-16 01:46:47,526] Trial 2887 finished with value: -7.409074242447998 and parameters: {'n_estimators': 2237, 'min_samples_split': 13, 'max_features': 0.87, 'min_samples_leaf': 7, 'criterion': 'absolute_error', 'max_depth': 5, 'min_weight_fraction_leaf': 0.0, 'max_leaf_nodes': 20, 'bootstrap': False, 'ccp_alpha': 0.0}. Best is trial 2774 with value: 0.046571421912873.
[I 2025-04-16 01:46:49,793] Trial 2888 finished with value: -0.1936417107583833 and parameters: {'n_estimators': 2383, 'min_samples_split': 14, 'max_features': 0.9, 'min_samples_leaf': 4, 'criterion': 'absolute_error', 'max_depth': 5, 'min_weight_fraction_leaf': 0.0, 'max_leaf_nodes': 20, 'bootstrap': False, 'ccp_alpha': 0.018000000000000002}. Best is trial 2774 with value: 0.046571421912873.
[I 2025-04-16 01:46:51,662] Trial 2889 finished with value: -21.26876279440036 and parameters: {'n_estimators': 1992, 'min_samples_split': 10, 'max_features': 0.89, 'min_samples_leaf': 1, 'criterion': 'poisson', 'max_depth': 5, 'min_weight_fraction_leaf': 0.0, 'max_leaf_nodes': 20, 'bootstrap': False, 'ccp_alpha': 0.009000000000000001}. Best is trial 2774 with value: 0.046571421912873.
