[I 2025-04-16 02:11:19,933] Trial 4125 finished with value: -0.1936417107583833 and parameters: {'n_estimators': 601, 'min_samples_split': 6, 'max_features': 0.6900000000000001, 'min_samples_leaf': 5, 'criterion': 'absolute_error', 'max_depth': 15, 'min_weight_fraction_leaf': 0.0, 'max_leaf_nodes': 50, 'bootstrap': False, 'ccp_alpha': 0.01}. Best is trial 4065 with value: 0.057524275121161005.
[I 2025-04-16 02:11:21,288] Trial 4126 finished with value: -0.1936417107583833 and parameters: {'n_estimators': 837, 'min_samples_split': 2, 'max_features': 0.73, 'min_samples_leaf': 1, 'criterion': 'absolute_error', 'max_depth': 20, 'min_weight_fraction_leaf': 0.0, 'max_leaf_nodes': 300, 'bootstrap': False, 'ccp_alpha': 0.009000000000000001}. Best is trial 4065 with value: 0.057524275121161005.
[I 2025-04-16 02:11:22,016] Trial 4127 finished with value: -0.3588517938562279 and parameters: {'n_estimators': 181, 'min_samples_split': 9, 'max_features': 0.77, 'min_samples_leaf': 3, 'criterion': 'absolute_error', 'max_depth': 15, 'min_weight_fraction_leaf': 0.0, 'max_leaf_nodes': 300, 'bootstrap': False, 'ccp_alpha': 0.005}. Best is trial 4065 with value: 0.057524275121161005.
[I 2025-04-16 02:11:23,004] Trial 4128 finished with value: -0.1936417107583833 and parameters: {'n_estimators': 430, 'min_samples_split': 95, 'max_features': 0.75, 'min_samples_leaf': 1, 'criterion': 'absolute_error', 'max_depth': 15, 'min_weight_fraction_leaf': 0.0, 'max_leaf_nodes': 300, 'bootstrap': False, 'ccp_alpha': 0.018000000000000002}. Best is trial 4065 with value: 0.057524275121161005.
[I 2025-04-16 02:11:24,256] Trial 4129 finished with value: -0.1936417107583833 and parameters: {'n_estimators': 926, 'min_samples_split': 6, 'max_features': 0.7100000000000001, 'min_samples_leaf': 58, 'criterion': 'absolute_error', 'max_depth': 15, 'min_weight_fraction_leaf': 0.0, 'max_leaf_nodes': 300, 'bootstrap': False, 'ccp_alpha': 0.015}. Best is trial 4065 with value: 0.057524275121161005.
[I 2025-04-16 02:11:25,209] Trial 4130 finished with value: -9.782941847570164 and parameters: {'n_estimators': 548, 'min_samples_split': 2, 'max_features': 0.79, 'min_samples_leaf': 5, 'criterion': 'absolute_error', 'max_depth': 15, 'min_weight_fraction_leaf': 0.0, 'max_leaf_nodes': 10, 'bootstrap': False, 'ccp_alpha': 0.0}. Best is trial 4065 with value: 0.057524275121161005.
[I 2025-04-16 02:11:26,050] Trial 4131 finished with value: -0.1936417107583833 and parameters: {'n_estimators': 347, 'min_samples_split': 11, 'max_features': 0.8300000000000001, 'min_samples_leaf': 3, 'criterion': 'absolute_error', 'max_depth': 15, 'min_weight_fraction_leaf': 0.0, 'max_leaf_nodes': 300, 'bootstrap': False, 'ccp_alpha': 0.01}. Best is trial 4065 with value: 0.057524275121161005.
[I 2025-04-16 02:11:27,382] Trial 4132 finished with value: -17.528986382274955 and parameters: {'n_estimators': 756, 'min_samples_split': 6, 'max_features': 0.74, 'min_samples_leaf': 1, 'criterion': 'friedman_mse', 'max_depth': 10, 'min_weight_fraction_leaf': 0.0, 'max_leaf_nodes': 300, 'bootstrap': False, 'ccp_alpha': 0.005}. Best is trial 4065 with value: 0.057524275121161005.
[I 2025-04-16 02:11:28,103] Trial 4133 finished with value: -0.1936417107583833 and parameters: {'n_estimators': 193, 'min_samples_split': 2, 'max_features': 0.7000000000000001, 'min_samples_leaf': 5, 'criterion': 'absolute_error', 'max_depth': 15, 'min_weight_fraction_leaf': 0.0, 'max_leaf_nodes': 300, 'bootstrap': False, 'ccp_alpha': 0.013000000000000001}. Best is trial 4065 with value: 0.057524275121161005.
[I 2025-04-16 02:11:29,049] Trial 4134 finished with value: -0.1936417107583833 and parameters: {'n_estimators': 507, 'min_samples_split': 12, 'max_features': 0.77, 'min_samples_leaf': 3, 'criterion': 'absolute_error', 'max_depth': 15, 'min_weight_fraction_leaf': 0.0, 'max_leaf_nodes': 300, 'bootstrap': False, 'ccp_alpha': 0.023}. Best is trial 4065 with value: 0.057524275121161005.
[I 2025-04-16 02:11:30,138] Trial 4135 finished with value: 0.05525895981465552 and parameters: {'n_estimators': 663, 'min_samples_split': 6, 'max_features': 0.81, 'min_samples_leaf': 1, 'criterion': 'absolute_error', 'max_depth': 15, 'min_weight_fraction_leaf': 0.0, 'max_leaf_nodes': 300, 'bootstrap': False, 'ccp_alpha': 0.005}. Best is trial 4065 with value: 0.057524275121161005.
[I 2025-04-16 02:11:30,957] Trial 4136 finished with value: -10.465067374692351 and parameters: {'n_estimators': 336, 'min_samples_split': 12, 'max_features': 0.8300000000000001, 'min_samples_leaf': 3, 'criterion': 'absolute_error', 'max_depth': 15, 'min_weight_fraction_leaf': 0.0, 'max_leaf_nodes': 300, 'bootstrap': False, 'ccp_alpha': 0.0}. Best is trial 4065 with value: 0.057524275121161005.
[I 2025-04-16 02:11:32,032] Trial 4137 finished with value: -0.1936417107583833 and parameters: {'n_estimators': 578, 'min_samples_split': 12, 'max_features': 0.81, 'min_samples_leaf': 5, 'criterion': 'absolute_error', 'max_depth': 15, 'min_weight_fraction_leaf': 0.0, 'max_leaf_nodes': 300, 'bootstrap': False, 'ccp_alpha': 0.01}. Best is trial 4065 with value: 0.057524275121161005.
[I 2025-04-16 02:11:32,735] Trial 4138 finished with value: -0.1936417107583833 and parameters: {'n_estimators': 168, 'min_samples_split': 12, 'max_features': 0.81, 'min_samples_leaf': 1, 'criterion': 'absolute_error', 'max_depth': 15, 'min_weight_fraction_leaf': 0.0, 'max_leaf_nodes': 300, 'bootstrap': False, 'ccp_alpha': 0.017}. Best is trial 4065 with value: 0.057524275121161005.
[I 2025-04-16 02:11:33,314] Trial 4139 finished with value: -0.1936417107583833 and parameters: {'n_estimators': 5, 'min_samples_split': 11, 'max_features': 0.81, 'min_samples_leaf': 3, 'criterion': 'absolute_error', 'max_depth': 15, 'min_weight_fraction_leaf': 0.0, 'max_leaf_nodes': 300, 'bootstrap': False, 'ccp_alpha': 0.006}. Best is trial 4065 with value: 0.057524275121161005.
[I 2025-04-16 02:11:34,247] Trial 4140 finished with value: -17.528986382274873 and parameters: {'n_estimators': 380, 'min_samples_split': 12, 'max_features': 0.8300000000000001, 'min_samples_leaf': 1, 'criterion': 'squared_error', 'max_depth': 15, 'min_weight_fraction_leaf': 0.0, 'max_leaf_nodes': 300, 'bootstrap': False, 'ccp_alpha': 0.01}. Best is trial 4065 with value: 0.057524275121161005.
[I 2025-04-16 02:11:35,381] Trial 4141 finished with value: -0.1936417107583833 and parameters: {'n_estimators': 600, 'min_samples_split': 9, 'max_features': 0.8, 'min_samples_leaf': 82, 'criterion': 'absolute_error', 'max_depth': 15, 'min_weight_fraction_leaf': 0.0, 'max_leaf_nodes': None, 'bootstrap': False, 'ccp_alpha': 0.251}. Best is trial 4065 with value: 0.057524275121161005.
[I 2025-04-16 02:11:36,350] Trial 4142 finished with value: -0.1936417107583833 and parameters: {'n_estimators': 423, 'min_samples_split': 82, 'max_features': 0.8300000000000001, 'min_samples_leaf': 5, 'criterion': 'absolute_error', 'max_depth': 15, 'min_weight_fraction_leaf': 0.0, 'max_leaf_nodes': 300, 'bootstrap': False, 'ccp_alpha': 0.145}. Best is trial 4065 with value: 0.057524275121161005.
[I 2025-04-16 02:11:37,405] Trial 4143 finished with value: -0.10223090218384674 and parameters: {'n_estimators': 655, 'min_samples_split': 9, 'max_features': 0.81, 'min_samples_leaf': 3, 'criterion': 'absolute_error', 'max_depth': 15, 'min_weight_fraction_leaf': 0.0, 'max_leaf_nodes': 300, 'bootstrap': False, 'ccp_alpha': 0.005}. Best is trial 4065 with value: 0.057524275121161005.
[I 2025-04-16 02:11:38,126] Trial 4144 finished with value: -8.69267216785083 and parameters: {'n_estimators': 186, 'min_samples_split': 8, 'max_features': 0.8, 'min_samples_leaf': 1, 'criterion': 'absolute_error', 'max_depth': 15, 'min_weight_fraction_leaf': 0.0, 'max_leaf_nodes': 300, 'bootstrap': False, 'ccp_alpha': 0.0}. Best is trial 4065 with value: 0.057524275121161005.
[I 2025-04-16 02:11:39,026] Trial 4145 finished with value: -0.1936417107583833 and parameters: {'n_estimators': 428, 'min_samples_split': 12, 'max_features': 0.8300000000000001, 'min_samples_leaf': 3, 'criterion': 'absolute_error', 'max_depth': 15, 'min_weight_fraction_leaf': 0.0, 'max_leaf_nodes': 300, 'bootstrap': False, 'ccp_alpha': 0.188}. Best is trial 4065 with value: 0.057524275121161005.
[I 2025-04-16 02:11:39,850] Trial 4146 finished with value: -19.459091198993164 and parameters: {'n_estimators': 315, 'min_samples_split': 9, 'max_features': 0.79, 'min_samples_leaf': 5, 'criterion': 'poisson', 'max_depth': 15, 'min_weight_fraction_leaf': 0.0, 'max_leaf_nodes': 300, 'bootstrap': False, 'ccp_alpha': 0.018000000000000002}. Best is trial 4065 with value: 0.057524275121161005.
[I 2025-04-16 02:11:40,969] Trial 4147 finished with value: -0.1936417107583833 and parameters: {'n_estimators': 710, 'min_samples_split': 8, 'max_features': 0.8300000000000001, 'min_samples_leaf': 1, 'criterion': 'absolute_error', 'max_depth': 20, 'min_weight_fraction_leaf': 0.0, 'max_leaf_nodes': 300, 'bootstrap': False, 'ccp_alpha': 0.012}. Best is trial 4065 with value: 0.057524275121161005.
[I 2025-04-16 02:11:41,652] Trial 4148 finished with value: -0.22633278198873352 and parameters: {'n_estimators': 169, 'min_samples_split': 12, 'max_features': 0.79, 'min_samples_leaf': 3, 'criterion': 'absolute_error', 'max_depth': 15, 'min_weight_fraction_leaf': 0.0, 'max_leaf_nodes': 300, 'bootstrap': False, 'ccp_alpha': 0.005}. Best is trial 4065 with value: 0.057524275121161005.
[I 2025-04-16 02:11:42,655] Trial 4149 finished with value: -0.1936417107583833 and parameters: {'n_estimators': 541, 'min_samples_split': 6, 'max_features': 0.81, 'min_samples_leaf': 5, 'criterion': 'absolute_error', 'max_depth': 15, 'min_weight_fraction_leaf': 0.0, 'max_leaf_nodes': 300, 'bootstrap': False, 'ccp_alpha': 0.025}. Best is trial 4065 with value: 0.057524275121161005.
[I 2025-04-16 02:11:43,472] Trial 4150 finished with value: -0.1936417107583833 and parameters: {'n_estimators': 339, 'min_samples_split': 8, 'max_features': 0.79, 'min_samples_leaf': 1, 'criterion': 'absolute_error', 'max_depth': 15, 'min_weight_fraction_leaf': 0.0, 'max_leaf_nodes': 50, 'bootstrap': False, 'ccp_alpha': 0.014}. Best is trial 4065 with value: 0.057524275121161005.
[I 2025-04-16 02:11:44,554] Trial 4151 finished with value: -0.1936417107583833 and parameters: {'n_estimators': 674, 'min_samples_split': 6, 'max_features': 0.8300000000000001, 'min_samples_leaf': 3, 'criterion': 'absolute_error', 'max_depth': 15, 'min_weight_fraction_leaf': 0.0, 'max_leaf_nodes': 300, 'bootstrap': False, 'ccp_alpha': 0.009000000000000001}. Best is trial 4065 with value: 0.057524275121161005.
[I 2025-04-16 02:11:45,528] Trial 4152 finished with value: -9.793217740172164 and parameters: {'n_estimators': 485, 'min_samples_split': 12, 'max_features': 0.81, 'min_samples_leaf': 3, 'criterion': 'absolute_error', 'max_depth': 15, 'min_weight_fraction_leaf': 0.0, 'max_leaf_nodes': 300, 'bootstrap': False, 'ccp_alpha': 0.0}. Best is trial 4065 with value: 0.057524275121161005.
[I 2025-04-16 02:11:46,087] Trial 4153 finished with value: -0.1936417107583833 and parameters: {'n_estimators': 6, 'min_samples_split': 6, 'max_features': 0.8300000000000001, 'min_samples_leaf': 1, 'criterion': 'absolute_error', 'max_depth': 10, 'min_weight_fraction_leaf': 0.0, 'max_leaf_nodes': 300, 'bootstrap': False, 'ccp_alpha': 0.006}. Best is trial 4065 with value: 0.057524275121161005.
[I 2025-04-16 02:11:47,325] Trial 4154 finished with value: -0.1936417107583833 and parameters: {'n_estimators': 766, 'min_samples_split': 6, 'max_features': 0.78, 'min_samples_leaf': 5, 'criterion': 'absolute_error', 'max_depth': 15, 'min_weight_fraction_leaf': 0.0, 'max_leaf_nodes': 300, 'bootstrap': False, 'ccp_alpha': 0.02}. Best is trial 4065 with value: 0.057524275121161005.
[I 2025-04-16 02:11:48,186] Trial 4155 finished with value: -0.1936417107583833 and parameters: {'n_estimators': 320, 'min_samples_split': 9, 'max_features': 0.49, 'min_samples_leaf': 3, 'criterion': 'absolute_error', 'max_depth': 15, 'min_weight_fraction_leaf': 0.0, 'max_leaf_nodes': 300, 'bootstrap': False, 'ccp_alpha': 0.014}. Best is trial 4065 with value: 0.057524275121161005.
[I 2025-04-16 02:11:49,163] Trial 4156 finished with value: -0.11580169811842309 and parameters: {'n_estimators': 539, 'min_samples_split': 12, 'max_features': 0.81, 'min_samples_leaf': 1, 'criterion': 'absolute_error', 'max_depth': 15, 'min_weight_fraction_leaf': 0.0, 'max_leaf_nodes': 10, 'bootstrap': False, 'ccp_alpha': 0.005}. Best is trial 4065 with value: 0.057524275121161005.
[I 2025-04-16 02:11:49,880] Trial 4157 finished with value: -17.5289863822749 and parameters: {'n_estimators': 175, 'min_samples_split': 6, 'max_features': 0.79, 'min_samples_leaf': 5, 'criterion': 'friedman_mse', 'max_depth': 15, 'min_weight_fraction_leaf': 0.0, 'max_leaf_nodes': 300, 'bootstrap': False, 'ccp_alpha': 0.033}. Best is trial 4065 with value: 0.057524275121161005.
[I 2025-04-16 02:11:51,079] Trial 4158 finished with value: -14.893298436444127 and parameters: {'n_estimators': 793, 'min_samples_split': 5, 'max_features': 0.78, 'min_samples_leaf': 3, 'criterion': 'absolute_error', 'max_depth': 15, 'min_weight_fraction_leaf': 0.0, 'max_leaf_nodes': 300, 'bootstrap': False, 'ccp_alpha': 0.0}. Best is trial 4065 with value: 0.057524275121161005.
[I 2025-04-16 02:11:51,981] Trial 4159 finished with value: -0.1936417107583833 and parameters: {'n_estimators': 433, 'min_samples_split': 9, 'max_features': 0.8300000000000001, 'min_samples_leaf': 47, 'criterion': 'absolute_error', 'max_depth': 15, 'min_weight_fraction_leaf': 0.0, 'max_leaf_nodes': 300, 'bootstrap': False, 'ccp_alpha': 0.01}. Best is trial 4065 with value: 0.057524275121161005.
[I 2025-04-16 02:11:52,672] Trial 4160 finished with value: -0.1936417107583833 and parameters: {'n_estimators': 174, 'min_samples_split': 12, 'max_features': 0.8, 'min_samples_leaf': 1, 'criterion': 'absolute_error', 'max_depth': 15, 'min_weight_fraction_leaf': 0.0, 'max_leaf_nodes': 300, 'bootstrap': False, 'ccp_alpha': 0.018000000000000002}. Best is trial 4065 with value: 0.057524275121161005.
[I 2025-04-16 02:11:53,730] Trial 4161 finished with value: -0.1936417107583833 and parameters: {'n_estimators': 622, 'min_samples_split': 5, 'max_features': 0.8300000000000001, 'min_samples_leaf': 5, 'criterion': 'absolute_error', 'max_depth': 15, 'min_weight_fraction_leaf': 0.0, 'max_leaf_nodes': 300, 'bootstrap': False, 'ccp_alpha': 0.009000000000000001}. Best is trial 4065 with value: 0.057524275121161005.
[I 2025-04-16 02:11:54,576] Trial 4162 finished with value: 0.013285982817142883 and parameters: {'n_estimators': 327, 'min_samples_split': 5, 'max_features': 0.78, 'min_samples_leaf': 3, 'criterion': 'absolute_error', 'max_depth': 15, 'min_weight_fraction_leaf': 0.0, 'max_leaf_nodes': 300, 'bootstrap': False, 'ccp_alpha': 0.005}. Best is trial 4065 with value: 0.057524275121161005.
[I 2025-04-16 02:11:55,711] Trial 4163 finished with value: -0.1936417107583833 and parameters: {'n_estimators': 628, 'min_samples_split': 2, 'max_features': 0.77, 'min_samples_leaf': 1, 'criterion': 'absolute_error', 'max_depth': 15, 'min_weight_fraction_leaf': 0.0, 'max_leaf_nodes': 300, 'bootstrap': False, 'ccp_alpha': 0.014}. Best is trial 4065 with value: 0.057524275121161005.
[I 2025-04-16 02:11:57,008] Trial 4164 finished with value: -17.528986382275253 and parameters: {'n_estimators': 846, 'min_samples_split': 9, 'max_features': 0.81, 'min_samples_leaf': 3, 'criterion': 'squared_error', 'max_depth': 15, 'min_weight_fraction_leaf': 0.0, 'max_leaf_nodes': None, 'bootstrap': False, 'ccp_alpha': 0.026000000000000002}. Best is trial 4065 with value: 0.057524275121161005.
[I 2025-04-16 02:11:57,703] Trial 4165 finished with value: -11.794823632707208 and parameters: {'n_estimators': 163, 'min_samples_split': 12, 'max_features': 0.81, 'min_samples_leaf': 5, 'criterion': 'absolute_error', 'max_depth': 15, 'min_weight_fraction_leaf': 0.0, 'max_leaf_nodes': 300, 'bootstrap': False, 'ccp_alpha': 0.0}. Best is trial 4065 with value: 0.057524275121161005.
[I 2025-04-16 02:11:58,702] Trial 4166 finished with value: -0.1936417107583833 and parameters: {'n_estimators': 435, 'min_samples_split': 6, 'max_features': 0.8300000000000001, 'min_samples_leaf': 1, 'criterion': 'absolute_error', 'max_depth': 15, 'min_weight_fraction_leaf': 0.0, 'max_leaf_nodes': 300, 'bootstrap': False, 'ccp_alpha': 0.009000000000000001}. Best is trial 4065 with value: 0.057524275121161005.
[I 2025-04-16 02:11:59,645] Trial 4167 finished with value: 0.02096226582337841 and parameters: {'n_estimators': 496, 'min_samples_split': 2, 'max_features': 0.78, 'min_samples_leaf': 3, 'criterion': 'absolute_error', 'max_depth': 20, 'min_weight_fraction_leaf': 0.0, 'max_leaf_nodes': 300, 'bootstrap': False, 'ccp_alpha': 0.005}. Best is trial 4065 with value: 0.057524275121161005.
[I 2025-04-16 02:12:00,879] Trial 4168 finished with value: -0.1936417107583833 and parameters: {'n_estimators': 791, 'min_samples_split': 9, 'max_features': 0.79, 'min_samples_leaf': 1, 'criterion': 'absolute_error', 'max_depth': 15, 'min_weight_fraction_leaf': 0.0, 'max_leaf_nodes': 300, 'bootstrap': False, 'ccp_alpha': 0.014}. Best is trial 4065 with value: 0.057524275121161005.
[I 2025-04-16 02:12:01,698] Trial 4169 finished with value: -0.1936417107583833 and parameters: {'n_estimators': 299, 'min_samples_split': 6, 'max_features': 0.76, 'min_samples_leaf': 5, 'criterion': 'absolute_error', 'max_depth': 15, 'min_weight_fraction_leaf': 0.0, 'max_leaf_nodes': 300, 'bootstrap': False, 'ccp_alpha': 0.02}. Best is trial 4065 with value: 0.057524275121161005.
[I 2025-04-16 02:12:02,687] Trial 4170 finished with value: -14.001786303525488 and parameters: {'n_estimators': 623, 'min_samples_split': 2, 'max_features': 0.81, 'min_samples_leaf': 3, 'criterion': 'poisson', 'max_depth': 15, 'min_weight_fraction_leaf': 0.0, 'max_leaf_nodes': 300, 'bootstrap': False, 'ccp_alpha': 0.0}. Best is trial 4065 with value: 0.057524275121161005.
[I 2025-04-16 02:12:03,397] Trial 4171 finished with value: -0.1936417107583833 and parameters: {'n_estimators': 153, 'min_samples_split': 6, 'max_features': 0.77, 'min_samples_leaf': 1, 'criterion': 'absolute_error', 'max_depth': 15, 'min_weight_fraction_leaf': 0.1, 'max_leaf_nodes': 300, 'bootstrap': False, 'ccp_alpha': 0.01}. Best is trial 4065 with value: 0.057524275121161005.
[I 2025-04-16 02:12:03,957] Trial 4172 finished with value: -0.1936417107583833 and parameters: {'n_estimators': 10, 'min_samples_split': 12, 'max_features': 0.8300000000000001, 'min_samples_leaf': 5, 'criterion': 'absolute_error', 'max_depth': 15, 'min_weight_fraction_leaf': 0.0, 'max_leaf_nodes': 300, 'bootstrap': False, 'ccp_alpha': 0.005}. Best is trial 4065 with value: 0.057524275121161005.
[I 2025-04-16 02:12:04,798] Trial 4173 finished with value: -0.1936417107583833 and parameters: {'n_estimators': 367, 'min_samples_split': 8, 'max_features': 0.79, 'min_samples_leaf': 3, 'criterion': 'absolute_error', 'max_depth': 15, 'min_weight_fraction_leaf': 0.0, 'max_leaf_nodes': 300, 'bootstrap': False, 'ccp_alpha': 0.015}. Best is trial 4065 with value: 0.057524275121161005.
[I 2025-04-16 02:12:06,035] Trial 4174 finished with value: -0.1936417107583833 and parameters: {'n_estimators': 817, 'min_samples_split': 2, 'max_features': 0.76, 'min_samples_leaf': 1, 'criterion': 'absolute_error', 'max_depth': 15, 'min_weight_fraction_leaf': 0.0, 'max_leaf_nodes': 300, 'bootstrap': False, 'ccp_alpha': 0.009000000000000001}. Best is trial 4065 with value: 0.057524275121161005.
[I 2025-04-16 02:12:07,046] Trial 4175 finished with value: -9.927595144869434 and parameters: {'n_estimators': 534, 'min_samples_split': 5, 'max_features': 0.81, 'min_samples_leaf': 3, 'criterion': 'absolute_error', 'max_depth': 15, 'min_weight_fraction_leaf': 0.0, 'max_leaf_nodes': 50, 'bootstrap': False, 'ccp_alpha': 0.0}. Best is trial 4065 with value: 0.057524275121161005.
[I 2025-04-16 02:12:07,890] Trial 4176 finished with value: -0.1936417107583833 and parameters: {'n_estimators': 344, 'min_samples_split': 12, 'max_features': 0.8300000000000001, 'min_samples_leaf': 5, 'criterion': 'absolute_error', 'max_depth': 10, 'min_weight_fraction_leaf': 0.0, 'max_leaf_nodes': 300, 'bootstrap': False, 'ccp_alpha': 0.006}. Best is trial 4065 with value: 0.057524275121161005.
[I 2025-04-16 02:12:09,004] Trial 4177 finished with value: -0.1936417107583833 and parameters: {'n_estimators': 671, 'min_samples_split': 9, 'max_features': 0.76, 'min_samples_leaf': 1, 'criterion': 'absolute_error', 'max_depth': 15, 'min_weight_fraction_leaf': 0.0, 'max_leaf_nodes': 300, 'bootstrap': False, 'ccp_alpha': 0.02}. Best is trial 4065 with value: 0.057524275121161005.
[I 2025-04-16 02:12:09,560] Trial 4178 finished with value: -0.1936417107583833 and parameters: {'n_estimators': 9, 'min_samples_split': 2, 'max_features': 0.79, 'min_samples_leaf': 3, 'criterion': 'absolute_error', 'max_depth': 15, 'min_weight_fraction_leaf': 0.0, 'max_leaf_nodes': 300, 'bootstrap': False, 'ccp_alpha': 0.014}. Best is trial 4065 with value: 0.057524275121161005.
[I 2025-04-16 02:12:10,847] Trial 4179 finished with value: 0.008876042150568498 and parameters: {'n_estimators': 930, 'min_samples_split': 6, 'max_features': 0.77, 'min_samples_leaf': 1, 'criterion': 'absolute_error', 'max_depth': 15, 'min_weight_fraction_leaf': 0.0, 'max_leaf_nodes': 300, 'bootstrap': False, 'ccp_alpha': 0.006}. Best is trial 4065 with value: 0.057524275121161005.
[I 2025-04-16 02:12:11,654] Trial 4180 finished with value: -17.52898638227488 and parameters: {'n_estimators': 289, 'min_samples_split': 5, 'max_features': 0.8, 'min_samples_leaf': 5, 'criterion': 'friedman_mse', 'max_depth': 15, 'min_weight_fraction_leaf': 0.0, 'max_leaf_nodes': 10, 'bootstrap': False, 'ccp_alpha': 0.2}. Best is trial 4065 with value: 0.057524275121161005.
