[I 2025-04-16 02:09:19,580] Trial 4013 finished with value: -7.249943794989596 and parameters: {'n_estimators': 482, 'min_samples_split': 10, 'max_features': 0.5700000000000001, 'min_samples_leaf': 1, 'criterion': 'absolute_error', 'max_depth': 15, 'min_weight_fraction_leaf': 0.05, 'max_leaf_nodes': 300, 'bootstrap': False, 'ccp_alpha': 0.0}. Best is trial 3488 with value: 0.05528345733671649.
[I 2025-04-16 02:09:20,996] Trial 4014 finished with value: -0.1936417107583833 and parameters: {'n_estimators': 1061, 'min_samples_split': 2, 'max_features': 0.76, 'min_samples_leaf': 3, 'criterion': 'absolute_error', 'max_depth': 15, 'min_weight_fraction_leaf': 0.0, 'max_leaf_nodes': None, 'bootstrap': False, 'ccp_alpha': 0.021}. Best is trial 3488 with value: 0.05528345733671649.
[I 2025-04-16 02:09:21,545] Trial 4015 finished with value: -0.1936417107583833 and parameters: {'n_estimators': 2, 'min_samples_split': 10, 'max_features': 0.68, 'min_samples_leaf': 1, 'criterion': 'absolute_error', 'max_depth': 15, 'min_weight_fraction_leaf': 0.0, 'max_leaf_nodes': 300, 'bootstrap': False, 'ccp_alpha': 0.01}. Best is trial 3488 with value: 0.05528345733671649.
[I 2025-04-16 02:09:22,294] Trial 4016 finished with value: -0.1936417107583833 and parameters: {'n_estimators': 278, 'min_samples_split': 6, 'max_features': 0.72, 'min_samples_leaf': 5, 'criterion': 'absolute_error', 'max_depth': 15, 'min_weight_fraction_leaf': 0.0, 'max_leaf_nodes': 300, 'bootstrap': False, 'ccp_alpha': 0.014}. Best is trial 3488 with value: 0.05528345733671649.
[I 2025-04-16 02:09:23,324] Trial 4017 finished with value: -0.03569658659893267 and parameters: {'n_estimators': 620, 'min_samples_split': 2, 'max_features': 0.63, 'min_samples_leaf': 3, 'criterion': 'absolute_error', 'max_depth': 20, 'min_weight_fraction_leaf': 0.0, 'max_leaf_nodes': 300, 'bootstrap': False, 'ccp_alpha': 0.005}. Best is trial 3488 with value: 0.05528345733671649.
[I 2025-04-16 02:09:24,493] Trial 4018 finished with value: -19.038795461221937 and parameters: {'n_estimators': 826, 'min_samples_split': 6, 'max_features': 0.74, 'min_samples_leaf': 1, 'criterion': 'absolute_error', 'max_depth': 15, 'min_weight_fraction_leaf': 0.0, 'max_leaf_nodes': 300, 'bootstrap': False, 'ccp_alpha': 0.0}. Best is trial 3488 with value: 0.05528345733671649.
[I 2025-04-16 02:09:25,345] Trial 4019 finished with value: -17.52898638227488 and parameters: {'n_estimators': 318, 'min_samples_split': 9, 'max_features': 0.7000000000000001, 'min_samples_leaf': 5, 'criterion': 'squared_error', 'max_depth': 15, 'min_weight_fraction_leaf': 0.0, 'max_leaf_nodes': 300, 'bootstrap': False, 'ccp_alpha': 0.018000000000000002}. Best is trial 3488 with value: 0.05528345733671649.
[I 2025-04-16 02:09:26,353] Trial 4020 finished with value: -0.1936417107583833 and parameters: {'n_estimators': 510, 'min_samples_split': 2, 'max_features': 0.8, 'min_samples_leaf': 3, 'criterion': 'absolute_error', 'max_depth': 15, 'min_weight_fraction_leaf': 0.0, 'max_leaf_nodes': 300, 'bootstrap': False, 'ccp_alpha': 0.009000000000000001}. Best is trial 3488 with value: 0.05528345733671649.
[I 2025-04-16 02:09:27,881] Trial 4021 finished with value: -0.2531572247553601 and parameters: {'n_estimators': 1123, 'min_samples_split': 10, 'max_features': 0.76, 'min_samples_leaf': 1, 'criterion': 'absolute_error', 'max_depth': 15, 'min_weight_fraction_leaf': 0.0, 'max_leaf_nodes': 300, 'bootstrap': False, 'ccp_alpha': 0.005}. Best is trial 3488 with value: 0.05528345733671649.
[I 2025-04-16 02:09:28,552] Trial 4022 finished with value: -0.1936417107583833 and parameters: {'n_estimators': 184, 'min_samples_split': 6, 'max_features': 0.73, 'min_samples_leaf': 3, 'criterion': 'absolute_error', 'max_depth': 10, 'min_weight_fraction_leaf': 0.0, 'max_leaf_nodes': 300, 'bootstrap': False, 'ccp_alpha': 0.013000000000000001}. Best is trial 3488 with value: 0.05528345733671649.
[I 2025-04-16 02:09:29,645] Trial 4023 finished with value: -0.0910771831105582 and parameters: {'n_estimators': 668, 'min_samples_split': 2, 'max_features': 0.8300000000000001, 'min_samples_leaf': 5, 'criterion': 'absolute_error', 'max_depth': 15, 'min_weight_fraction_leaf': 0.0, 'max_leaf_nodes': 300, 'bootstrap': False, 'ccp_alpha': 0.005}. Best is trial 3488 with value: 0.05528345733671649.
[I 2025-04-16 02:09:30,567] Trial 4024 finished with value: -12.008428859425624 and parameters: {'n_estimators': 462, 'min_samples_split': 10, 'max_features': 0.78, 'min_samples_leaf': 1, 'criterion': 'absolute_error', 'max_depth': 15, 'min_weight_fraction_leaf': 0.0, 'max_leaf_nodes': 300, 'bootstrap': False, 'ccp_alpha': 0.0}. Best is trial 3488 with value: 0.05528345733671649.
[I 2025-04-16 02:09:31,853] Trial 4025 finished with value: -0.1936417107583833 and parameters: {'n_estimators': 957, 'min_samples_split': 6, 'max_features': 0.7100000000000001, 'min_samples_leaf': 3, 'criterion': 'absolute_error', 'max_depth': 15, 'min_weight_fraction_leaf': 0.0, 'max_leaf_nodes': 50, 'bootstrap': False, 'ccp_alpha': 0.009000000000000001}. Best is trial 3488 with value: 0.05528345733671649.
[I 2025-04-16 02:09:32,405] Trial 4026 finished with value: -17.528986382275015 and parameters: {'n_estimators': 2, 'min_samples_split': 6, 'max_features': 0.75, 'min_samples_leaf': 1, 'criterion': 'poisson', 'max_depth': 15, 'min_weight_fraction_leaf': 0.0, 'max_leaf_nodes': 300, 'bootstrap': False, 'ccp_alpha': 0.028}. Best is trial 3488 with value: 0.05528345733671649.
[I 2025-04-16 02:09:33,618] Trial 4027 finished with value: -0.1936417107583833 and parameters: {'n_estimators': 740, 'min_samples_split': 2, 'max_features': 0.66, 'min_samples_leaf': 5, 'criterion': 'absolute_error', 'max_depth': 15, 'min_weight_fraction_leaf': 0.0, 'max_leaf_nodes': 300, 'bootstrap': False, 'ccp_alpha': 0.018000000000000002}. Best is trial 3488 with value: 0.05528345733671649.
[I 2025-04-16 02:09:34,429] Trial 4028 finished with value: -0.1936417107583833 and parameters: {'n_estimators': 296, 'min_samples_split': 6, 'max_features': 0.73, 'min_samples_leaf': 3, 'criterion': 'absolute_error', 'max_depth': 15, 'min_weight_fraction_leaf': 0.0, 'max_leaf_nodes': 300, 'bootstrap': False, 'ccp_alpha': 0.01}. Best is trial 3488 with value: 0.05528345733671649.
[I 2025-04-16 02:09:35,428] Trial 4029 finished with value: -0.1936417107583833 and parameters: {'n_estimators': 568, 'min_samples_split': 10, 'max_features': 0.6900000000000001, 'min_samples_leaf': 1, 'criterion': 'absolute_error', 'max_depth': 15, 'min_weight_fraction_leaf': 0.0, 'max_leaf_nodes': 300, 'bootstrap': False, 'ccp_alpha': 0.014}. Best is trial 3488 with value: 0.05528345733671649.
[I 2025-04-16 02:09:36,089] Trial 4030 finished with value: 0.009427400824598453 and parameters: {'n_estimators': 154, 'min_samples_split': 2, 'max_features': 0.8, 'min_samples_leaf': 3, 'criterion': 'absolute_error', 'max_depth': 15, 'min_weight_fraction_leaf': 0.0, 'max_leaf_nodes': 10, 'bootstrap': False, 'ccp_alpha': 0.006}. Best is trial 3488 with value: 0.05528345733671649.
[I 2025-04-16 02:09:37,370] Trial 4031 finished with value: -10.01128723424853 and parameters: {'n_estimators': 924, 'min_samples_split': 6, 'max_features': 0.77, 'min_samples_leaf': 5, 'criterion': 'absolute_error', 'max_depth': 15, 'min_weight_fraction_leaf': 0.0, 'max_leaf_nodes': 300, 'bootstrap': False, 'ccp_alpha': 0.0}. Best is trial 3488 with value: 0.05528345733671649.
[I 2025-04-16 02:09:38,245] Trial 4032 finished with value: -0.1936417107583833 and parameters: {'n_estimators': 412, 'min_samples_split': 10, 'max_features': 0.7100000000000001, 'min_samples_leaf': 1, 'criterion': 'absolute_error', 'max_depth': 15, 'min_weight_fraction_leaf': 0.0, 'max_leaf_nodes': 300, 'bootstrap': False, 'ccp_alpha': 0.014}. Best is trial 3488 with value: 0.05528345733671649.
[I 2025-04-16 02:09:39,433] Trial 4033 finished with value: -0.1936417107583833 and parameters: {'n_estimators': 722, 'min_samples_split': 2, 'max_features': 0.75, 'min_samples_leaf': 3, 'criterion': 'absolute_error', 'max_depth': 15, 'min_weight_fraction_leaf': 0.0, 'max_leaf_nodes': 300, 'bootstrap': False, 'ccp_alpha': 0.022}. Best is trial 3488 with value: 0.05528345733671649.
[I 2025-04-16 02:09:40,280] Trial 4034 finished with value: -0.17068137334028782 and parameters: {'n_estimators': 340, 'min_samples_split': 6, 'max_features': 0.8300000000000001, 'min_samples_leaf': 5, 'criterion': 'absolute_error', 'max_depth': 15, 'min_weight_fraction_leaf': 0.0, 'max_leaf_nodes': 300, 'bootstrap': False, 'ccp_alpha': 0.005}. Best is trial 3488 with value: 0.05528345733671649.
[I 2025-04-16 02:09:41,210] Trial 4035 finished with value: -17.528986382274873 and parameters: {'n_estimators': 495, 'min_samples_split': 10, 'max_features': 0.78, 'min_samples_leaf': 1, 'criterion': 'friedman_mse', 'max_depth': 15, 'min_weight_fraction_leaf': 0.0, 'max_leaf_nodes': 300, 'bootstrap': False, 'ccp_alpha': 0.01}. Best is trial 3488 with value: 0.05528345733671649.
[I 2025-04-16 02:09:42,748] Trial 4036 finished with value: -0.0026774351728090064 and parameters: {'n_estimators': 1166, 'min_samples_split': 6, 'max_features': 0.73, 'min_samples_leaf': 3, 'criterion': 'absolute_error', 'max_depth': 15, 'min_weight_fraction_leaf': 0.0, 'max_leaf_nodes': 300, 'bootstrap': False, 'ccp_alpha': 0.006}. Best is trial 3488 with value: 0.05528345733671649.
[I 2025-04-16 02:09:43,922] Trial 4037 finished with value: -0.1936417107583833 and parameters: {'n_estimators': 680, 'min_samples_split': 2, 'max_features': 0.81, 'min_samples_leaf': 5, 'criterion': 'absolute_error', 'max_depth': 15, 'min_weight_fraction_leaf': 0.09, 'max_leaf_nodes': 300, 'bootstrap': False, 'ccp_alpha': 0.017}. Best is trial 3488 with value: 0.05528345733671649.
[I 2025-04-16 02:09:44,592] Trial 4038 finished with value: -9.060650017413554 and parameters: {'n_estimators': 184, 'min_samples_split': 10, 'max_features': 0.6900000000000001, 'min_samples_leaf': 3, 'criterion': 'absolute_error', 'max_depth': 15, 'min_weight_fraction_leaf': 0.0, 'max_leaf_nodes': 300, 'bootstrap': False, 'ccp_alpha': 0.0}. Best is trial 3488 with value: 0.05528345733671649.
[I 2025-04-16 02:09:46,016] Trial 4039 finished with value: -0.1936417107583833 and parameters: {'n_estimators': 948, 'min_samples_split': 6, 'max_features': 0.76, 'min_samples_leaf': 1, 'criterion': 'absolute_error', 'max_depth': 15, 'min_weight_fraction_leaf': 0.0, 'max_leaf_nodes': None, 'bootstrap': False, 'ccp_alpha': 0.01}. Best is trial 3488 with value: 0.05528345733671649.
[I 2025-04-16 02:09:47,017] Trial 4040 finished with value: -0.1936417107583833 and parameters: {'n_estimators': 556, 'min_samples_split': 2, 'max_features': 0.72, 'min_samples_leaf': 3, 'criterion': 'absolute_error', 'max_depth': 15, 'min_weight_fraction_leaf': 0.0, 'max_leaf_nodes': 300, 'bootstrap': False, 'ccp_alpha': 0.023}. Best is trial 3488 with value: 0.05528345733671649.
[I 2025-04-16 02:09:47,826] Trial 4041 finished with value: 0.03157055985444881 and parameters: {'n_estimators': 319, 'min_samples_split': 6, 'max_features': 0.74, 'min_samples_leaf': 1, 'criterion': 'absolute_error', 'max_depth': 20, 'min_weight_fraction_leaf': 0.0, 'max_leaf_nodes': 300, 'bootstrap': False, 'ccp_alpha': 0.005}. Best is trial 3488 with value: 0.05528345733671649.
[I 2025-04-16 02:09:48,511] Trial 4042 finished with value: -0.1936417107583833 and parameters: {'n_estimators': 171, 'min_samples_split': 10, 'max_features': 0.79, 'min_samples_leaf': 5, 'criterion': 'absolute_error', 'max_depth': 15, 'min_weight_fraction_leaf': 0.0, 'max_leaf_nodes': 300, 'bootstrap': False, 'ccp_alpha': 0.014}. Best is trial 3488 with value: 0.05528345733671649.
[I 2025-04-16 02:09:49,568] Trial 4043 finished with value: -8.215891662908469 and parameters: {'n_estimators': 710, 'min_samples_split': 2, 'max_features': 0.8200000000000001, 'min_samples_leaf': 3, 'criterion': 'squared_error', 'max_depth': 15, 'min_weight_fraction_leaf': 0.0, 'max_leaf_nodes': 300, 'bootstrap': False, 'ccp_alpha': 0.0}. Best is trial 3488 with value: 0.05528345733671649.
[I 2025-04-16 02:09:50,915] Trial 4044 finished with value: -0.1936417107583833 and parameters: {'n_estimators': 858, 'min_samples_split': 6, 'max_features': 0.67, 'min_samples_leaf': 5, 'criterion': 'absolute_error', 'max_depth': 15, 'min_weight_fraction_leaf': 0.0, 'max_leaf_nodes': 300, 'bootstrap': False, 'ccp_alpha': 0.223}. Best is trial 3488 with value: 0.05528345733671649.
[I 2025-04-16 02:09:51,903] Trial 4045 finished with value: -0.1936417107583833 and parameters: {'n_estimators': 503, 'min_samples_split': 10, 'max_features': 0.7100000000000001, 'min_samples_leaf': 1, 'criterion': 'absolute_error', 'max_depth': 10, 'min_weight_fraction_leaf': 0.0, 'max_leaf_nodes': 300, 'bootstrap': False, 'ccp_alpha': 0.009000000000000001}. Best is trial 3488 with value: 0.05528345733671649.
[I 2025-04-16 02:09:52,703] Trial 4046 finished with value: -0.1936417107583833 and parameters: {'n_estimators': 333, 'min_samples_split': 5, 'max_features': 0.75, 'min_samples_leaf': 85, 'criterion': 'absolute_error', 'max_depth': 15, 'min_weight_fraction_leaf': 0.0, 'max_leaf_nodes': 300, 'bootstrap': False, 'ccp_alpha': 0.018000000000000002}. Best is trial 3488 with value: 0.05528345733671649.
[I 2025-04-16 02:09:53,968] Trial 4047 finished with value: 0.008888894161628724 and parameters: {'n_estimators': 784, 'min_samples_split': 2, 'max_features': 0.77, 'min_samples_leaf': 3, 'criterion': 'absolute_error', 'max_depth': 15, 'min_weight_fraction_leaf': 0.0, 'max_leaf_nodes': 300, 'bootstrap': False, 'ccp_alpha': 0.006}. Best is trial 3488 with value: 0.05528345733671649.
[I 2025-04-16 02:09:54,510] Trial 4048 finished with value: -2.9754374996586392 and parameters: {'n_estimators': 4, 'min_samples_split': 10, 'max_features': 0.7000000000000001, 'min_samples_leaf': 1, 'criterion': 'absolute_error', 'max_depth': 15, 'min_weight_fraction_leaf': 0.0, 'max_leaf_nodes': 300, 'bootstrap': False, 'ccp_alpha': 0.0}. Best is trial 3488 with value: 0.05528345733671649.
[I 2025-04-16 02:09:55,928] Trial 4049 finished with value: -16.08737474279433 and parameters: {'n_estimators': 1113, 'min_samples_split': 6, 'max_features': 0.73, 'min_samples_leaf': 4, 'criterion': 'poisson', 'max_depth': 15, 'min_weight_fraction_leaf': 0.0, 'max_leaf_nodes': 300, 'bootstrap': False, 'ccp_alpha': 0.01}. Best is trial 3488 with value: 0.05528345733671649.
[I 2025-04-16 02:09:56,890] Trial 4050 finished with value: -0.1936417107583833 and parameters: {'n_estimators': 533, 'min_samples_split': 2, 'max_features': 0.8, 'min_samples_leaf': 93, 'criterion': 'absolute_error', 'max_depth': 15, 'min_weight_fraction_leaf': 0.0, 'max_leaf_nodes': 300, 'bootstrap': False, 'ccp_alpha': 0.005}. Best is trial 3488 with value: 0.05528345733671649.
[I 2025-04-16 02:09:57,713] Trial 4051 finished with value: -0.1936417107583833 and parameters: {'n_estimators': 344, 'min_samples_split': 6, 'max_features': 0.78, 'min_samples_leaf': 1, 'criterion': 'absolute_error', 'max_depth': 15, 'min_weight_fraction_leaf': 0.0, 'max_leaf_nodes': 300, 'bootstrap': False, 'ccp_alpha': 0.014}. Best is trial 3488 with value: 0.05528345733671649.
[I 2025-04-16 02:09:58,410] Trial 4052 finished with value: -0.1936417107583833 and parameters: {'n_estimators': 169, 'min_samples_split': 11, 'max_features': 0.75, 'min_samples_leaf': 3, 'criterion': 'absolute_error', 'max_depth': 15, 'min_weight_fraction_leaf': 0.0, 'max_leaf_nodes': 50, 'bootstrap': False, 'ccp_alpha': 0.031}. Best is trial 3488 with value: 0.05528345733671649.
[I 2025-04-16 02:09:59,541] Trial 4053 finished with value: -0.08944405452529043 and parameters: {'n_estimators': 670, 'min_samples_split': 6, 'max_features': 0.68, 'min_samples_leaf': 5, 'criterion': 'absolute_error', 'max_depth': 15, 'min_weight_fraction_leaf': 0.0, 'max_leaf_nodes': 300, 'bootstrap': False, 'ccp_alpha': 0.005}. Best is trial 3488 with value: 0.05528345733671649.
[I 2025-04-16 02:10:01,028] Trial 4054 finished with value: -0.1936417107583833 and parameters: {'n_estimators': 928, 'min_samples_split': 2, 'max_features': 0.72, 'min_samples_leaf': 1, 'criterion': 'absolute_error', 'max_depth': 15, 'min_weight_fraction_leaf': 0.0, 'max_leaf_nodes': 300, 'bootstrap': False, 'ccp_alpha': 0.02}. Best is trial 3488 with value: 0.05528345733671649.
[I 2025-04-16 02:10:01,988] Trial 4055 finished with value: -0.1936417107583833 and parameters: {'n_estimators': 467, 'min_samples_split': 10, 'max_features': 0.8200000000000001, 'min_samples_leaf': 3, 'criterion': 'absolute_error', 'max_depth': 15, 'min_weight_fraction_leaf': 0.0, 'max_leaf_nodes': 10, 'bootstrap': False, 'ccp_alpha': 0.013000000000000001}. Best is trial 3488 with value: 0.05528345733671649.
[I 2025-04-16 02:10:03,417] Trial 4056 finished with value: -9.807704811306849 and parameters: {'n_estimators': 1138, 'min_samples_split': 6, 'max_features': 0.74, 'min_samples_leaf': 5, 'criterion': 'absolute_error', 'max_depth': 15, 'min_weight_fraction_leaf': 0.0, 'max_leaf_nodes': 300, 'bootstrap': False, 'ccp_alpha': 0.0}. Best is trial 3488 with value: 0.05528345733671649.
[I 2025-04-16 02:10:04,584] Trial 4057 finished with value: -0.1936417107583833 and parameters: {'n_estimators': 661, 'min_samples_split': 2, 'max_features': 0.77, 'min_samples_leaf': 1, 'criterion': 'absolute_error', 'max_depth': 15, 'min_weight_fraction_leaf': 0.0, 'max_leaf_nodes': 300, 'bootstrap': False, 'ccp_alpha': 0.011}. Best is trial 3488 with value: 0.05528345733671649.
[I 2025-04-16 02:10:05,302] Trial 4058 finished with value: -0.1936417107583833 and parameters: {'n_estimators': 170, 'min_samples_split': 11, 'max_features': 0.7000000000000001, 'min_samples_leaf': 3, 'criterion': 'absolute_error', 'max_depth': 15, 'min_weight_fraction_leaf': 0.0, 'max_leaf_nodes': 300, 'bootstrap': False, 'ccp_alpha': 0.006}. Best is trial 3488 with value: 0.05528345733671649.
[I 2025-04-16 02:10:13,568] Trial 4059 finished with value: -17.52898638226961 and parameters: {'n_estimators': 9157, 'min_samples_split': 6, 'max_features': 0.72, 'min_samples_leaf': 1, 'criterion': 'friedman_mse', 'max_depth': 15, 'min_weight_fraction_leaf': 0.0, 'max_leaf_nodes': 300, 'bootstrap': False, 'ccp_alpha': 0.018000000000000002}. Best is trial 3488 with value: 0.05528345733671649.
[I 2025-04-16 02:10:14,495] Trial 4060 finished with value: -0.09719651918783327 and parameters: {'n_estimators': 419, 'min_samples_split': 2, 'max_features': 0.79, 'min_samples_leaf': 5, 'criterion': 'absolute_error', 'max_depth': 15, 'min_weight_fraction_leaf': 0.0, 'max_leaf_nodes': 300, 'bootstrap': False, 'ccp_alpha': 0.005}. Best is trial 3488 with value: 0.05528345733671649.
[I 2025-04-16 02:10:15,663] Trial 4061 finished with value: -0.1936417107583833 and parameters: {'n_estimators': 821, 'min_samples_split': 9, 'max_features': 0.8300000000000001, 'min_samples_leaf': 3, 'criterion': 'absolute_error', 'max_depth': 15, 'min_weight_fraction_leaf': 0.0, 'max_leaf_nodes': 300, 'bootstrap': False, 'ccp_alpha': 0.01}. Best is trial 3488 with value: 0.05528345733671649.
[I 2025-04-16 02:10:16,445] Trial 4062 finished with value: -17.469239979482847 and parameters: {'n_estimators': 310, 'min_samples_split': 6, 'max_features': 0.76, 'min_samples_leaf': 1, 'criterion': 'absolute_error', 'max_depth': 20, 'min_weight_fraction_leaf': 0.0, 'max_leaf_nodes': 300, 'bootstrap': False, 'ccp_alpha': 0.0}. Best is trial 3488 with value: 0.05528345733671649.
[I 2025-04-16 02:10:17,474] Trial 4063 finished with value: -0.1936417107583833 and parameters: {'n_estimators': 576, 'min_samples_split': 2, 'max_features': 0.74, 'min_samples_leaf': 3, 'criterion': 'absolute_error', 'max_depth': 15, 'min_weight_fraction_leaf': 0.0, 'max_leaf_nodes': 300, 'bootstrap': False, 'ccp_alpha': 0.014}. Best is trial 3488 with value: 0.05528345733671649.
[I 2025-04-16 02:10:18,854] Trial 4064 finished with value: -0.1936417107583833 and parameters: {'n_estimators': 975, 'min_samples_split': 11, 'max_features': 0.72, 'min_samples_leaf': 5, 'criterion': 'absolute_error', 'max_depth': 15, 'min_weight_fraction_leaf': 0.0, 'max_leaf_nodes': None, 'bootstrap': False, 'ccp_alpha': 0.023}. Best is trial 3488 with value: 0.05528345733671649.
[I 2025-04-16 02:10:19,574] Trial 4065 finished with value: 0.057524275121161005 and parameters: {'n_estimators': 167, 'min_samples_split': 6, 'max_features': 0.81, 'min_samples_leaf': 1, 'criterion': 'absolute_error', 'max_depth': 15, 'min_weight_fraction_leaf': 0.0, 'max_leaf_nodes': 300, 'bootstrap': False, 'ccp_alpha': 0.005}. Best is trial 4065 with value: 0.057524275121161005.
[I 2025-04-16 02:10:20,245] Trial 4066 finished with value: -0.1936417107583833 and parameters: {'n_estimators': 126, 'min_samples_split': 12, 'max_features': 0.8200000000000001, 'min_samples_leaf': 3, 'criterion': 'absolute_error', 'max_depth': 10, 'min_weight_fraction_leaf': 0.0, 'max_leaf_nodes': 300, 'bootstrap': False, 'ccp_alpha': 0.01}. Best is trial 4065 with value: 0.057524275121161005.
[I 2025-04-16 02:10:21,013] Trial 4067 finished with value: -17.5289863822749 and parameters: {'n_estimators': 153, 'min_samples_split': 11, 'max_features': 0.8, 'min_samples_leaf': 5, 'criterion': 'squared_error', 'max_depth': 15, 'min_weight_fraction_leaf': 0.0, 'max_leaf_nodes': 300, 'bootstrap': False, 'ccp_alpha': 0.018000000000000002}. Best is trial 4065 with value: 0.057524275121161005.
[I 2025-04-16 02:10:21,659] Trial 4068 finished with value: -0.1936417107583833 and parameters: {'n_estimators': 34, 'min_samples_split': 11, 'max_features': 0.8200000000000001, 'min_samples_leaf': 61, 'criterion': 'absolute_error', 'max_depth': 15, 'min_weight_fraction_leaf': 0.0, 'max_leaf_nodes': 300, 'bootstrap': False, 'ccp_alpha': 0.0}. Best is trial 4065 with value: 0.057524275121161005.
