[I 2025-04-16 01:29:35,216] Trial 2548 finished with value: -0.1936417107583833 and parameters: {'n_estimators': 3717, 'min_samples_split': 2, 'max_features': 0.89, 'min_samples_leaf': 6, 'criterion': 'absolute_error', 'max_depth': 5, 'min_weight_fraction_leaf': 0.0, 'max_leaf_nodes': 20, 'bootstrap': False, 'ccp_alpha': 0.007}. Best is trial 2251 with value: 0.02361845659970214.
[I 2025-04-16 01:29:38,630] Trial 2549 finished with value: -0.1936417107583833 and parameters: {'n_estimators': 3529, 'min_samples_split': 9, 'max_features': 0.89, 'min_samples_leaf': 1, 'criterion': 'absolute_error', 'max_depth': 5, 'min_weight_fraction_leaf': 0.0, 'max_leaf_nodes': 20, 'bootstrap': False, 'ccp_alpha': 0.006}. Best is trial 2251 with value: 0.02361845659970214.
[I 2025-04-16 01:29:45,058] Trial 2550 finished with value: -0.1936417107583833 and parameters: {'n_estimators': 7166, 'min_samples_split': 6, 'max_features': 0.89, 'min_samples_leaf': 4, 'criterion': 'absolute_error', 'max_depth': 5, 'min_weight_fraction_leaf': 0.0, 'max_leaf_nodes': 20, 'bootstrap': False, 'ccp_alpha': 0.013000000000000001}. Best is trial 2251 with value: 0.02361845659970214.
[I 2025-04-16 01:29:48,501] Trial 2551 finished with value: -0.1936417107583833 and parameters: {'n_estimators': 3739, 'min_samples_split': 2, 'max_features': 0.9, 'min_samples_leaf': 3, 'criterion': 'absolute_error', 'max_depth': 5, 'min_weight_fraction_leaf': 0.0, 'max_leaf_nodes': 20, 'bootstrap': False, 'ccp_alpha': 0.021}. Best is trial 2251 with value: 0.02361845659970214.
[I 2025-04-16 01:29:53,619] Trial 2552 finished with value: -0.1936417107583833 and parameters: {'n_estimators': 5910, 'min_samples_split': 9, 'max_features': 0.86, 'min_samples_leaf': 6, 'criterion': 'absolute_error', 'max_depth': 5, 'min_weight_fraction_leaf': 0.0, 'max_leaf_nodes': 20, 'bootstrap': False, 'ccp_alpha': 0.01}. Best is trial 2251 with value: 0.02361845659970214.
[I 2025-04-16 01:29:56,657] Trial 2553 finished with value: -19.776919023804375 and parameters: {'n_estimators': 3368, 'min_samples_split': 6, 'max_features': 0.89, 'min_samples_leaf': 1, 'criterion': 'poisson', 'max_depth': 5, 'min_weight_fraction_leaf': 0.0, 'max_leaf_nodes': 20, 'bootstrap': False, 'ccp_alpha': 0.006}. Best is trial 2251 with value: 0.02361845659970214.
[I 2025-04-16 01:30:00,259] Trial 2554 finished with value: -0.1936417107583833 and parameters: {'n_estimators': 3574, 'min_samples_split': 2, 'max_features': 0.9, 'min_samples_leaf': 5, 'criterion': 'absolute_error', 'max_depth': 5, 'min_weight_fraction_leaf': 0.0, 'max_leaf_nodes': 20, 'bootstrap': False, 'ccp_alpha': 0.017}. Best is trial 2251 with value: 0.02361845659970214.
[I 2025-04-16 01:30:03,275] Trial 2555 finished with value: -0.1936417107583833 and parameters: {'n_estimators': 3197, 'min_samples_split': 9, 'max_features': 0.87, 'min_samples_leaf': 1, 'criterion': 'absolute_error', 'max_depth': 5, 'min_weight_fraction_leaf': 0.0, 'max_leaf_nodes': 20, 'bootstrap': False, 'ccp_alpha': 0.033}. Best is trial 2251 with value: 0.02361845659970214.
[I 2025-04-16 01:30:06,808] Trial 2556 finished with value: -0.1936417107583833 and parameters: {'n_estimators': 3727, 'min_samples_split': 5, 'max_features': 0.86, 'min_samples_leaf': 3, 'criterion': 'absolute_error', 'max_depth': 5, 'min_weight_fraction_leaf': 0.0, 'max_leaf_nodes': 20, 'bootstrap': False, 'ccp_alpha': 0.01}. Best is trial 2251 with value: 0.02361845659970214.
[I 2025-04-16 01:30:10,740] Trial 2557 finished with value: -0.1936417107583833 and parameters: {'n_estimators': 3579, 'min_samples_split': 9, 'max_features': 0.86, 'min_samples_leaf': 6, 'criterion': 'absolute_error', 'max_depth': 5, 'min_weight_fraction_leaf': 0.0, 'max_leaf_nodes': 20, 'bootstrap': False, 'ccp_alpha': 0.007}. Best is trial 2251 with value: 0.02361845659970214.
[I 2025-04-16 01:30:13,764] Trial 2558 finished with value: -0.1936417107583833 and parameters: {'n_estimators': 3372, 'min_samples_split': 2, 'max_features': 0.9, 'min_samples_leaf': 3, 'criterion': 'absolute_error', 'max_depth': 5, 'min_weight_fraction_leaf': 0.0, 'max_leaf_nodes': 20, 'bootstrap': False, 'ccp_alpha': 0.014}. Best is trial 2251 with value: 0.02361845659970214.
[I 2025-04-16 01:30:17,429] Trial 2559 finished with value: -17.52898638227456 and parameters: {'n_estimators': 3784, 'min_samples_split': 6, 'max_features': 0.9, 'min_samples_leaf': 4, 'criterion': 'friedman_mse', 'max_depth': 5, 'min_weight_fraction_leaf': 0.0, 'max_leaf_nodes': 20, 'bootstrap': False, 'ccp_alpha': 0.026000000000000002}. Best is trial 2251 with value: 0.02361845659970214.
[I 2025-04-16 01:30:20,779] Trial 2560 finished with value: -0.0014687398567637456 and parameters: {'n_estimators': 3527, 'min_samples_split': 5, 'max_features': 0.89, 'min_samples_leaf': 1, 'criterion': 'absolute_error', 'max_depth': 5, 'min_weight_fraction_leaf': 0.0, 'max_leaf_nodes': 20, 'bootstrap': False, 'ccp_alpha': 0.006}. Best is trial 2251 with value: 0.02361845659970214.
[I 2025-04-16 01:30:23,939] Trial 2561 finished with value: -0.1936417107583833 and parameters: {'n_estimators': 3150, 'min_samples_split': 2, 'max_features': 0.86, 'min_samples_leaf': 1, 'criterion': 'absolute_error', 'max_depth': 5, 'min_weight_fraction_leaf': 0.0, 'max_leaf_nodes': 20, 'bootstrap': False, 'ccp_alpha': 0.02}. Best is trial 2251 with value: 0.02361845659970214.
[I 2025-04-16 01:30:26,983] Trial 2562 finished with value: -0.1936417107583833 and parameters: {'n_estimators': 3203, 'min_samples_split': 5, 'max_features': 0.87, 'min_samples_leaf': 1, 'criterion': 'absolute_error', 'max_depth': 5, 'min_weight_fraction_leaf': 0.0, 'max_leaf_nodes': 20, 'bootstrap': False, 'ccp_alpha': 0.024}. Best is trial 2251 with value: 0.02361845659970214.
[I 2025-04-16 01:30:32,684] Trial 2563 finished with value: -0.1936417107583833 and parameters: {'n_estimators': 6352, 'min_samples_split': 64, 'max_features': 0.85, 'min_samples_leaf': 3, 'criterion': 'absolute_error', 'max_depth': 5, 'min_weight_fraction_leaf': 0.0, 'max_leaf_nodes': 20, 'bootstrap': False, 'ccp_alpha': 0.016}. Best is trial 2251 with value: 0.02361845659970214.
[I 2025-04-16 01:30:35,998] Trial 2564 finished with value: -0.1936417107583833 and parameters: {'n_estimators': 3390, 'min_samples_split': 2, 'max_features': 0.87, 'min_samples_leaf': 1, 'criterion': 'absolute_error', 'max_depth': 5, 'min_weight_fraction_leaf': 0.0, 'max_leaf_nodes': 20, 'bootstrap': False, 'ccp_alpha': 0.019}. Best is trial 2251 with value: 0.02361845659970214.
[I 2025-04-16 01:30:39,143] Trial 2565 finished with value: -0.1936417107583833 and parameters: {'n_estimators': 3193, 'min_samples_split': 6, 'max_features': 0.88, 'min_samples_leaf': 3, 'criterion': 'absolute_error', 'max_depth': 5, 'min_weight_fraction_leaf': 0.0, 'max_leaf_nodes': 20, 'bootstrap': False, 'ccp_alpha': 0.014}. Best is trial 2251 with value: 0.02361845659970214.
[I 2025-04-16 01:30:42,619] Trial 2566 finished with value: -0.1936417107583833 and parameters: {'n_estimators': 3376, 'min_samples_split': 6, 'max_features': 0.89, 'min_samples_leaf': 5, 'criterion': 'absolute_error', 'max_depth': 5, 'min_weight_fraction_leaf': 0.0, 'max_leaf_nodes': 20, 'bootstrap': False, 'ccp_alpha': 0.011}. Best is trial 2251 with value: 0.02361845659970214.
[I 2025-04-16 01:30:46,021] Trial 2567 finished with value: -0.1936417107583833 and parameters: {'n_estimators': 3424, 'min_samples_split': 2, 'max_features': 0.89, 'min_samples_leaf': 1, 'criterion': 'absolute_error', 'max_depth': 5, 'min_weight_fraction_leaf': 0.0, 'max_leaf_nodes': 20, 'bootstrap': False, 'ccp_alpha': 0.028}. Best is trial 2251 with value: 0.02361845659970214.
[I 2025-04-16 01:30:49,207] Trial 2568 finished with value: -17.528986382275278 and parameters: {'n_estimators': 3491, 'min_samples_split': 6, 'max_features': 0.86, 'min_samples_leaf': 3, 'criterion': 'squared_error', 'max_depth': 5, 'min_weight_fraction_leaf': 0.0, 'max_leaf_nodes': 20, 'bootstrap': False, 'ccp_alpha': 0.018000000000000002}. Best is trial 2251 with value: 0.02361845659970214.
[I 2025-04-16 01:30:52,251] Trial 2569 finished with value: -0.1936417107583833 and parameters: {'n_estimators': 3142, 'min_samples_split': 9, 'max_features': 0.86, 'min_samples_leaf': 5, 'criterion': 'absolute_error', 'max_depth': 5, 'min_weight_fraction_leaf': 0.0, 'max_leaf_nodes': 20, 'bootstrap': False, 'ccp_alpha': 0.01}. Best is trial 2251 with value: 0.02361845659970214.
[I 2025-04-16 01:30:55,233] Trial 2570 finished with value: -0.1936417107583833 and parameters: {'n_estimators': 3282, 'min_samples_split': 6, 'max_features': 0.89, 'min_samples_leaf': 1, 'criterion': 'absolute_error', 'max_depth': 5, 'min_weight_fraction_leaf': 0.0, 'max_leaf_nodes': 20, 'bootstrap': False, 'ccp_alpha': 0.014}. Best is trial 2251 with value: 0.02361845659970214.
[I 2025-04-16 01:30:58,505] Trial 2571 finished with value: -0.1936417107583833 and parameters: {'n_estimators': 3542, 'min_samples_split': 2, 'max_features': 0.86, 'min_samples_leaf': 3, 'criterion': 'absolute_error', 'max_depth': 5, 'min_weight_fraction_leaf': 0.0, 'max_leaf_nodes': 20, 'bootstrap': False, 'ccp_alpha': 0.023}. Best is trial 2251 with value: 0.02361845659970214.
[I 2025-04-16 01:31:01,945] Trial 2572 finished with value: -0.1936417107583833 and parameters: {'n_estimators': 3538, 'min_samples_split': 9, 'max_features': 0.88, 'min_samples_leaf': 4, 'criterion': 'absolute_error', 'max_depth': 5, 'min_weight_fraction_leaf': 0.0, 'max_leaf_nodes': 20, 'bootstrap': False, 'ccp_alpha': 0.006}. Best is trial 2251 with value: 0.02361845659970214.
[I 2025-04-16 01:31:05,131] Trial 2573 finished with value: -0.1936417107583833 and parameters: {'n_estimators': 3161, 'min_samples_split': 5, 'max_features': 0.89, 'min_samples_leaf': 6, 'criterion': 'absolute_error', 'max_depth': 5, 'min_weight_fraction_leaf': 0.0, 'max_leaf_nodes': 20, 'bootstrap': False, 'ccp_alpha': 0.01}. Best is trial 2251 with value: 0.02361845659970214.
[I 2025-04-16 01:31:08,407] Trial 2574 finished with value: -28.77474904277336 and parameters: {'n_estimators': 3382, 'min_samples_split': 2, 'max_features': 0.9, 'min_samples_leaf': 1, 'criterion': 'poisson', 'max_depth': 5, 'min_weight_fraction_leaf': 0.0, 'max_leaf_nodes': 20, 'bootstrap': False, 'ccp_alpha': 0.006}. Best is trial 2251 with value: 0.02361845659970214.
[I 2025-04-16 01:31:11,832] Trial 2575 finished with value: -0.1936417107583833 and parameters: {'n_estimators': 3572, 'min_samples_split': 9, 'max_features': 0.88, 'min_samples_leaf': 3, 'criterion': 'absolute_error', 'max_depth': 5, 'min_weight_fraction_leaf': 0.0, 'max_leaf_nodes': 20, 'bootstrap': False, 'ccp_alpha': 0.016}. Best is trial 2251 with value: 0.02361845659970214.
[I 2025-04-16 01:31:14,863] Trial 2576 finished with value: -0.1936417107583833 and parameters: {'n_estimators': 3305, 'min_samples_split': 5, 'max_features': 0.9, 'min_samples_leaf': 5, 'criterion': 'absolute_error', 'max_depth': 5, 'min_weight_fraction_leaf': 0.0, 'max_leaf_nodes': 20, 'bootstrap': False, 'ccp_alpha': 0.01}. Best is trial 2251 with value: 0.02361845659970214.
[I 2025-04-16 01:31:18,372] Trial 2577 finished with value: -0.1936417107583833 and parameters: {'n_estimators': 3613, 'min_samples_split': 2, 'max_features': 0.91, 'min_samples_leaf': 1, 'criterion': 'absolute_error', 'max_depth': 5, 'min_weight_fraction_leaf': 0.0, 'max_leaf_nodes': 20, 'bootstrap': False, 'ccp_alpha': 0.014}. Best is trial 2251 with value: 0.02361845659970214.
[I 2025-04-16 01:31:22,038] Trial 2578 finished with value: -0.1936417107583833 and parameters: {'n_estimators': 3702, 'min_samples_split': 9, 'max_features': 0.86, 'min_samples_leaf': 3, 'criterion': 'absolute_error', 'max_depth': 5, 'min_weight_fraction_leaf': 0.0, 'max_leaf_nodes': 20, 'bootstrap': False, 'ccp_alpha': 0.006}. Best is trial 2251 with value: 0.02361845659970214.
[I 2025-04-16 01:31:25,190] Trial 2579 finished with value: -0.1936417107583833 and parameters: {'n_estimators': 3402, 'min_samples_split': 5, 'max_features': 0.9, 'min_samples_leaf': 5, 'criterion': 'absolute_error', 'max_depth': 5, 'min_weight_fraction_leaf': 0.0, 'max_leaf_nodes': 20, 'bootstrap': False, 'ccp_alpha': 0.021}. Best is trial 2251 with value: 0.02361845659970214.
[I 2025-04-16 01:31:28,747] Trial 2580 finished with value: -0.1936417107583833 and parameters: {'n_estimators': 3557, 'min_samples_split': 9, 'max_features': 0.91, 'min_samples_leaf': 3, 'criterion': 'absolute_error', 'max_depth': 5, 'min_weight_fraction_leaf': 0.0, 'max_leaf_nodes': 20, 'bootstrap': False, 'ccp_alpha': 0.011}. Best is trial 2251 with value: 0.02361845659970214.
[I 2025-04-16 01:31:32,004] Trial 2581 finished with value: -0.1936417107583833 and parameters: {'n_estimators': 3169, 'min_samples_split': 2, 'max_features': 0.89, 'min_samples_leaf': 6, 'criterion': 'absolute_error', 'max_depth': 5, 'min_weight_fraction_leaf': 0.0, 'max_leaf_nodes': 20, 'bootstrap': False, 'ccp_alpha': 0.006}. Best is trial 2251 with value: 0.02361845659970214.
[I 2025-04-16 01:31:35,319] Trial 2582 finished with value: -0.1936417107583833 and parameters: {'n_estimators': 3738, 'min_samples_split': 9, 'max_features': 0.86, 'min_samples_leaf': 1, 'criterion': 'absolute_error', 'max_depth': 5, 'min_weight_fraction_leaf': 0.0, 'max_leaf_nodes': 20, 'bootstrap': False, 'ccp_alpha': 0.006}. Best is trial 2251 with value: 0.02361845659970214.
[I 2025-04-16 01:31:38,368] Trial 2583 finished with value: -17.528986382275576 and parameters: {'n_estimators': 3383, 'min_samples_split': 6, 'max_features': 0.88, 'min_samples_leaf': 3, 'criterion': 'friedman_mse', 'max_depth': 5, 'min_weight_fraction_leaf': 0.0, 'max_leaf_nodes': 20, 'bootstrap': False, 'ccp_alpha': 0.268}. Best is trial 2251 with value: 0.02361845659970214.
[I 2025-04-16 01:31:42,077] Trial 2584 finished with value: -0.1936417107583833 and parameters: {'n_estimators': 3691, 'min_samples_split': 2, 'max_features': 0.9, 'min_samples_leaf': 6, 'criterion': 'absolute_error', 'max_depth': 5, 'min_weight_fraction_leaf': 0.0, 'max_leaf_nodes': 20, 'bootstrap': False, 'ccp_alpha': 0.018000000000000002}. Best is trial 2251 with value: 0.02361845659970214.
[I 2025-04-16 01:31:45,316] Trial 2585 finished with value: -0.1936417107583833 and parameters: {'n_estimators': 3534, 'min_samples_split': 6, 'max_features': 0.91, 'min_samples_leaf': 1, 'criterion': 'absolute_error', 'max_depth': 5, 'min_weight_fraction_leaf': 0.0, 'max_leaf_nodes': 20, 'bootstrap': False, 'ccp_alpha': 0.013000000000000001}. Best is trial 2251 with value: 0.02361845659970214.
[I 2025-04-16 01:31:48,184] Trial 2586 finished with value: 0.023797084339743015 and parameters: {'n_estimators': 3201, 'min_samples_split': 6, 'max_features': 0.91, 'min_samples_leaf': 4, 'criterion': 'absolute_error', 'max_depth': 5, 'min_weight_fraction_leaf': 0.0, 'max_leaf_nodes': 20, 'bootstrap': False, 'ccp_alpha': 0.005}. Best is trial 2586 with value: 0.023797084339743015.
[I 2025-04-16 01:31:50,877] Trial 2587 finished with value: -0.1936417107583833 and parameters: {'n_estimators': 3079, 'min_samples_split': 9, 'max_features': 0.88, 'min_samples_leaf': 4, 'criterion': 'absolute_error', 'max_depth': 5, 'min_weight_fraction_leaf': 0.0, 'max_leaf_nodes': 20, 'bootstrap': False, 'ccp_alpha': 0.024}. Best is trial 2586 with value: 0.023797084339743015.
[I 2025-04-16 01:31:53,868] Trial 2588 finished with value: -0.1936417107583833 and parameters: {'n_estimators': 3058, 'min_samples_split': 9, 'max_features': 0.88, 'min_samples_leaf': 5, 'criterion': 'absolute_error', 'max_depth': 5, 'min_weight_fraction_leaf': 0.0, 'max_leaf_nodes': 20, 'bootstrap': False, 'ccp_alpha': 0.029}. Best is trial 2586 with value: 0.023797084339743015.
[I 2025-04-16 01:31:57,274] Trial 2589 finished with value: -0.1936417107583833 and parameters: {'n_estimators': 3425, 'min_samples_split': 5, 'max_features': 0.85, 'min_samples_leaf': 3, 'criterion': 'absolute_error', 'max_depth': 5, 'min_weight_fraction_leaf': 0.0, 'max_leaf_nodes': 20, 'bootstrap': False, 'ccp_alpha': 0.021}. Best is trial 2586 with value: 0.023797084339743015.
[I 2025-04-16 01:32:00,699] Trial 2590 finished with value: -0.1936417107583833 and parameters: {'n_estimators': 3118, 'min_samples_split': 2, 'max_features': 0.9, 'min_samples_leaf': 6, 'criterion': 'absolute_error', 'max_depth': 5, 'min_weight_fraction_leaf': 0.0, 'max_leaf_nodes': 20, 'bootstrap': False, 'ccp_alpha': 0.016}. Best is trial 2586 with value: 0.023797084339743015.
[I 2025-04-16 01:32:04,238] Trial 2591 finished with value: -0.1936417107583833 and parameters: {'n_estimators': 3219, 'min_samples_split': 9, 'max_features': 0.88, 'min_samples_leaf': 3, 'criterion': 'absolute_error', 'max_depth': 5, 'min_weight_fraction_leaf': 0.0, 'max_leaf_nodes': 20, 'bootstrap': False, 'ccp_alpha': 0.014}. Best is trial 2586 with value: 0.023797084339743015.
[I 2025-04-16 01:32:07,237] Trial 2592 finished with value: -17.528986382276123 and parameters: {'n_estimators': 3199, 'min_samples_split': 9, 'max_features': 0.91, 'min_samples_leaf': 4, 'criterion': 'squared_error', 'max_depth': 5, 'min_weight_fraction_leaf': 0.0, 'max_leaf_nodes': 20, 'bootstrap': False, 'ccp_alpha': 0.019}. Best is trial 2586 with value: 0.023797084339743015.
[I 2025-04-16 01:32:10,142] Trial 2593 finished with value: -0.1936417107583833 and parameters: {'n_estimators': 3104, 'min_samples_split': 5, 'max_features': 0.91, 'min_samples_leaf': 1, 'criterion': 'absolute_error', 'max_depth': 5, 'min_weight_fraction_leaf': 0.0, 'max_leaf_nodes': 20, 'bootstrap': False, 'ccp_alpha': 0.011}. Best is trial 2586 with value: 0.023797084339743015.
[I 2025-04-16 01:32:13,147] Trial 2594 finished with value: -0.1936417107583833 and parameters: {'n_estimators': 3314, 'min_samples_split': 6, 'max_features': 0.89, 'min_samples_leaf': 6, 'criterion': 'absolute_error', 'max_depth': 5, 'min_weight_fraction_leaf': 0.0, 'max_leaf_nodes': 20, 'bootstrap': False, 'ccp_alpha': 0.01}. Best is trial 2586 with value: 0.023797084339743015.
[I 2025-04-16 01:32:15,915] Trial 2595 finished with value: -0.1936417107583833 and parameters: {'n_estimators': 3144, 'min_samples_split': 2, 'max_features': 0.87, 'min_samples_leaf': 3, 'criterion': 'absolute_error', 'max_depth': 5, 'min_weight_fraction_leaf': 0.0, 'max_leaf_nodes': 20, 'bootstrap': False, 'ccp_alpha': 0.016}. Best is trial 2586 with value: 0.023797084339743015.
[I 2025-04-16 01:32:19,212] Trial 2596 finished with value: -0.1936417107583833 and parameters: {'n_estimators': 3237, 'min_samples_split': 9, 'max_features': 0.91, 'min_samples_leaf': 1, 'criterion': 'absolute_error', 'max_depth': 5, 'min_weight_fraction_leaf': 0.0, 'max_leaf_nodes': 20, 'bootstrap': False, 'ccp_alpha': 0.006}. Best is trial 2586 with value: 0.023797084339743015.
[I 2025-04-16 01:32:22,429] Trial 2597 finished with value: -0.1936417107583833 and parameters: {'n_estimators': 3278, 'min_samples_split': 2, 'max_features': 0.85, 'min_samples_leaf': 5, 'criterion': 'absolute_error', 'max_depth': 5, 'min_weight_fraction_leaf': 0.0, 'max_leaf_nodes': 20, 'bootstrap': False, 'ccp_alpha': 0.012}. Best is trial 2586 with value: 0.023797084339743015.
[I 2025-04-16 01:32:25,624] Trial 2598 finished with value: -17.528986382275427 and parameters: {'n_estimators': 3437, 'min_samples_split': 6, 'max_features': 0.89, 'min_samples_leaf': 3, 'criterion': 'poisson', 'max_depth': 5, 'min_weight_fraction_leaf': 0.0, 'max_leaf_nodes': 20, 'bootstrap': False, 'ccp_alpha': 0.024}. Best is trial 2586 with value: 0.023797084339743015.
[I 2025-04-16 01:32:28,312] Trial 2599 finished with value: -0.1936417107583833 and parameters: {'n_estimators': 3126, 'min_samples_split': 9, 'max_features': 0.91, 'min_samples_leaf': 6, 'criterion': 'absolute_error', 'max_depth': 5, 'min_weight_fraction_leaf': 0.0, 'max_leaf_nodes': 20, 'bootstrap': False, 'ccp_alpha': 0.033}. Best is trial 2586 with value: 0.023797084339743015.
[I 2025-04-16 01:32:31,848] Trial 2600 finished with value: -0.004486524238474487 and parameters: {'n_estimators': 3446, 'min_samples_split': 6, 'max_features': 0.86, 'min_samples_leaf': 1, 'criterion': 'absolute_error', 'max_depth': 5, 'min_weight_fraction_leaf': 0.0, 'max_leaf_nodes': 20, 'bootstrap': False, 'ccp_alpha': 0.006}. Best is trial 2586 with value: 0.023797084339743015.
[I 2025-04-16 01:32:34,977] Trial 2601 finished with value: -0.1936417107583833 and parameters: {'n_estimators': 3342, 'min_samples_split': 6, 'max_features': 0.85, 'min_samples_leaf': 1, 'criterion': 'absolute_error', 'max_depth': 5, 'min_weight_fraction_leaf': 0.0, 'max_leaf_nodes': 20, 'bootstrap': False, 'ccp_alpha': 0.022}. Best is trial 2586 with value: 0.023797084339743015.
[I 2025-04-16 01:32:38,098] Trial 2602 finished with value: -0.1936417107583833 and parameters: {'n_estimators': 3179, 'min_samples_split': 5, 'max_features': 0.87, 'min_samples_leaf': 1, 'criterion': 'absolute_error', 'max_depth': 5, 'min_weight_fraction_leaf': 0.0, 'max_leaf_nodes': 20, 'bootstrap': False, 'ccp_alpha': 0.019}. Best is trial 2586 with value: 0.023797084339743015.
[I 2025-04-16 01:32:41,032] Trial 2603 finished with value: -0.1936417107583833 and parameters: {'n_estimators': 3112, 'min_samples_split': 2, 'max_features': 0.86, 'min_samples_leaf': 1, 'criterion': 'absolute_error', 'max_depth': 5, 'min_weight_fraction_leaf': 0.0, 'max_leaf_nodes': 20, 'bootstrap': False, 'ccp_alpha': 0.018000000000000002}. Best is trial 2586 with value: 0.023797084339743015.
[I 2025-04-16 01:32:44,118] Trial 2604 finished with value: -0.1936417107583833 and parameters: {'n_estimators': 3367, 'min_samples_split': 6, 'max_features': 0.86, 'min_samples_leaf': 3, 'criterion': 'absolute_error', 'max_depth': 5, 'min_weight_fraction_leaf': 0.0, 'max_leaf_nodes': 20, 'bootstrap': False, 'ccp_alpha': 0.014}. Best is trial 2586 with value: 0.023797084339743015.
