[I 2025-04-16 01:26:26,639] Trial 2491 finished with value: -0.1936417107583833 and parameters: {'n_estimators': 3619, 'min_samples_split': 2, 'max_features': 0.93, 'min_samples_leaf': 3, 'criterion': 'absolute_error', 'max_depth': 5, 'min_weight_fraction_leaf': 0.0, 'max_leaf_nodes': 20, 'bootstrap': False, 'ccp_alpha': 0.01}. Best is trial 2251 with value: 0.02361845659970214.
[I 2025-04-16 01:26:29,675] Trial 2492 finished with value: -0.1936417107583833 and parameters: {'n_estimators': 3221, 'min_samples_split': 6, 'max_features': 0.93, 'min_samples_leaf': 1, 'criterion': 'absolute_error', 'max_depth': 5, 'min_weight_fraction_leaf': 0.0, 'max_leaf_nodes': 20, 'bootstrap': False, 'ccp_alpha': 0.019}. Best is trial 2251 with value: 0.02361845659970214.
[I 2025-04-16 01:26:33,194] Trial 2493 finished with value: -0.1936417107583833 and parameters: {'n_estimators': 3705, 'min_samples_split': 6, 'max_features': 0.89, 'min_samples_leaf': 6, 'criterion': 'absolute_error', 'max_depth': 5, 'min_weight_fraction_leaf': 0.0, 'max_leaf_nodes': 20, 'bootstrap': False, 'ccp_alpha': 0.01}. Best is trial 2251 with value: 0.02361845659970214.
[I 2025-04-16 01:26:36,257] Trial 2494 finished with value: -17.52898638227533 and parameters: {'n_estimators': 3470, 'min_samples_split': 8, 'max_features': 0.92, 'min_samples_leaf': 4, 'criterion': 'squared_error', 'max_depth': 5, 'min_weight_fraction_leaf': 0.0, 'max_leaf_nodes': 20, 'bootstrap': False, 'ccp_alpha': 0.01}. Best is trial 2251 with value: 0.02361845659970214.
[I 2025-04-16 01:26:39,393] Trial 2495 finished with value: -0.1936417107583833 and parameters: {'n_estimators': 3609, 'min_samples_split': 2, 'max_features': 0.91, 'min_samples_leaf': 3, 'criterion': 'absolute_error', 'max_depth': 5, 'min_weight_fraction_leaf': 0.0, 'max_leaf_nodes': 20, 'bootstrap': False, 'ccp_alpha': 0.028}. Best is trial 2251 with value: 0.02361845659970214.
[I 2025-04-16 01:26:42,457] Trial 2496 finished with value: -0.1936417107583833 and parameters: {'n_estimators': 3263, 'min_samples_split': 9, 'max_features': 0.9400000000000001, 'min_samples_leaf': 1, 'criterion': 'absolute_error', 'max_depth': 5, 'min_weight_fraction_leaf': 0.0, 'max_leaf_nodes': 20, 'bootstrap': False, 'ccp_alpha': 0.015}. Best is trial 2251 with value: 0.02361845659970214.
[I 2025-04-16 01:26:46,082] Trial 2497 finished with value: -0.1936417107583833 and parameters: {'n_estimators': 3769, 'min_samples_split': 2, 'max_features': 0.9400000000000001, 'min_samples_leaf': 6, 'criterion': 'absolute_error', 'max_depth': 5, 'min_weight_fraction_leaf': 0.0, 'max_leaf_nodes': 20, 'bootstrap': False, 'ccp_alpha': 0.006}. Best is trial 2251 with value: 0.02361845659970214.
[I 2025-04-16 01:26:49,505] Trial 2498 finished with value: -0.1936417107583833 and parameters: {'n_estimators': 3468, 'min_samples_split': 6, 'max_features': 0.89, 'min_samples_leaf': 5, 'criterion': 'absolute_error', 'max_depth': 5, 'min_weight_fraction_leaf': 0.0, 'max_leaf_nodes': 20, 'bootstrap': False, 'ccp_alpha': 0.015}. Best is trial 2251 with value: 0.02361845659970214.
[I 2025-04-16 01:26:53,107] Trial 2499 finished with value: -0.1936417107583833 and parameters: {'n_estimators': 3774, 'min_samples_split': 9, 'max_features': 0.91, 'min_samples_leaf': 3, 'criterion': 'absolute_error', 'max_depth': 5, 'min_weight_fraction_leaf': 0.0, 'max_leaf_nodes': 20, 'bootstrap': False, 'ccp_alpha': 0.007}. Best is trial 2251 with value: 0.02361845659970214.
[I 2025-04-16 01:26:56,572] Trial 2500 finished with value: -0.03279912722553422 and parameters: {'n_estimators': 3574, 'min_samples_split': 5, 'max_features': 0.93, 'min_samples_leaf': 1, 'criterion': 'absolute_error', 'max_depth': 5, 'min_weight_fraction_leaf': 0.0, 'max_leaf_nodes': 20, 'bootstrap': False, 'ccp_alpha': 0.006}. Best is trial 2251 with value: 0.02361845659970214.
[I 2025-04-16 01:26:59,811] Trial 2501 finished with value: -0.1936417107583833 and parameters: {'n_estimators': 3360, 'min_samples_split': 5, 'max_features': 0.87, 'min_samples_leaf': 1, 'criterion': 'absolute_error', 'max_depth': 5, 'min_weight_fraction_leaf': 0.0, 'max_leaf_nodes': 20, 'bootstrap': False, 'ccp_alpha': 0.23}. Best is trial 2251 with value: 0.02361845659970214.
[I 2025-04-16 01:27:02,638] Trial 2502 finished with value: -17.528986382276024 and parameters: {'n_estimators': 3229, 'min_samples_split': 2, 'max_features': 0.87, 'min_samples_leaf': 1, 'criterion': 'poisson', 'max_depth': 5, 'min_weight_fraction_leaf': 0.0, 'max_leaf_nodes': 20, 'bootstrap': False, 'ccp_alpha': 0.02}. Best is trial 2251 with value: 0.02361845659970214.
[I 2025-04-16 01:27:05,663] Trial 2503 finished with value: -0.1936417107583833 and parameters: {'n_estimators': 3226, 'min_samples_split': 2, 'max_features': 0.89, 'min_samples_leaf': 1, 'criterion': 'absolute_error', 'max_depth': 5, 'min_weight_fraction_leaf': 0.0, 'max_leaf_nodes': 20, 'bootstrap': False, 'ccp_alpha': 0.017}. Best is trial 2251 with value: 0.02361845659970214.
[I 2025-04-16 01:27:09,156] Trial 2504 finished with value: -0.1936417107583833 and parameters: {'n_estimators': 3439, 'min_samples_split': 6, 'max_features': 0.89, 'min_samples_leaf': 3, 'criterion': 'absolute_error', 'max_depth': 5, 'min_weight_fraction_leaf': 0.0, 'max_leaf_nodes': 20, 'bootstrap': False, 'ccp_alpha': 0.025}. Best is trial 2251 with value: 0.02361845659970214.
[I 2025-04-16 01:27:12,324] Trial 2505 finished with value: -0.1936417107583833 and parameters: {'n_estimators': 3362, 'min_samples_split': 6, 'max_features': 0.9, 'min_samples_leaf': 3, 'criterion': 'absolute_error', 'max_depth': 5, 'min_weight_fraction_leaf': 0.0, 'max_leaf_nodes': 20, 'bootstrap': False, 'ccp_alpha': 0.014}. Best is trial 2251 with value: 0.02361845659970214.
[I 2025-04-16 01:27:15,526] Trial 2506 finished with value: -0.1936417107583833 and parameters: {'n_estimators': 3194, 'min_samples_split': 9, 'max_features': 0.91, 'min_samples_leaf': 1, 'criterion': 'absolute_error', 'max_depth': 5, 'min_weight_fraction_leaf': 0.0, 'max_leaf_nodes': 20, 'bootstrap': False, 'ccp_alpha': 0.021}. Best is trial 2251 with value: 0.02361845659970214.
[I 2025-04-16 01:27:18,956] Trial 2507 finished with value: -0.1936417107583833 and parameters: {'n_estimators': 3482, 'min_samples_split': 6, 'max_features': 0.88, 'min_samples_leaf': 4, 'criterion': 'absolute_error', 'max_depth': 5, 'min_weight_fraction_leaf': 0.0, 'max_leaf_nodes': 20, 'bootstrap': False, 'ccp_alpha': 0.011}. Best is trial 2251 with value: 0.02361845659970214.
[I 2025-04-16 01:27:22,231] Trial 2508 finished with value: -0.1936417107583833 and parameters: {'n_estimators': 3544, 'min_samples_split': 2, 'max_features': 0.91, 'min_samples_leaf': 5, 'criterion': 'absolute_error', 'max_depth': 5, 'min_weight_fraction_leaf': 0.0, 'max_leaf_nodes': 20, 'bootstrap': False, 'ccp_alpha': 0.022}. Best is trial 2251 with value: 0.02361845659970214.
[I 2025-04-16 01:27:25,504] Trial 2509 finished with value: -0.1936417107583833 and parameters: {'n_estimators': 3248, 'min_samples_split': 9, 'max_features': 0.92, 'min_samples_leaf': 1, 'criterion': 'absolute_error', 'max_depth': 5, 'min_weight_fraction_leaf': 0.0, 'max_leaf_nodes': 20, 'bootstrap': False, 'ccp_alpha': 0.015}. Best is trial 2251 with value: 0.02361845659970214.
[I 2025-04-16 01:27:28,664] Trial 2510 finished with value: -17.528986382275136 and parameters: {'n_estimators': 3546, 'min_samples_split': 6, 'max_features': 0.88, 'min_samples_leaf': 3, 'criterion': 'friedman_mse', 'max_depth': 5, 'min_weight_fraction_leaf': 0.0, 'max_leaf_nodes': 20, 'bootstrap': False, 'ccp_alpha': 0.01}. Best is trial 2251 with value: 0.02361845659970214.
[I 2025-04-16 01:27:32,071] Trial 2511 finished with value: -0.1936417107583833 and parameters: {'n_estimators': 3453, 'min_samples_split': 2, 'max_features': 0.9, 'min_samples_leaf': 5, 'criterion': 'absolute_error', 'max_depth': 5, 'min_weight_fraction_leaf': 0.0, 'max_leaf_nodes': 20, 'bootstrap': False, 'ccp_alpha': 0.01}. Best is trial 2251 with value: 0.02361845659970214.
[I 2025-04-16 01:27:35,382] Trial 2512 finished with value: -0.1936417107583833 and parameters: {'n_estimators': 3614, 'min_samples_split': 9, 'max_features': 0.92, 'min_samples_leaf': 3, 'criterion': 'absolute_error', 'max_depth': 5, 'min_weight_fraction_leaf': 0.0, 'max_leaf_nodes': 20, 'bootstrap': False, 'ccp_alpha': 0.016}. Best is trial 2251 with value: 0.02361845659970214.
[I 2025-04-16 01:27:38,490] Trial 2513 finished with value: -0.1936417107583833 and parameters: {'n_estimators': 3242, 'min_samples_split': 5, 'max_features': 0.87, 'min_samples_leaf': 1, 'criterion': 'absolute_error', 'max_depth': 5, 'min_weight_fraction_leaf': 0.0, 'max_leaf_nodes': 20, 'bootstrap': False, 'ccp_alpha': 0.034}. Best is trial 2251 with value: 0.02361845659970214.
[I 2025-04-16 01:27:42,059] Trial 2514 finished with value: -0.1936417107583833 and parameters: {'n_estimators': 3629, 'min_samples_split': 6, 'max_features': 0.93, 'min_samples_leaf': 6, 'criterion': 'absolute_error', 'max_depth': 5, 'min_weight_fraction_leaf': 0.0, 'max_leaf_nodes': 20, 'bootstrap': False, 'ccp_alpha': 0.007}. Best is trial 2251 with value: 0.02361845659970214.
[I 2025-04-16 01:27:45,272] Trial 2515 finished with value: -0.1936417107583833 and parameters: {'n_estimators': 3394, 'min_samples_split': 9, 'max_features': 0.9, 'min_samples_leaf': 3, 'criterion': 'absolute_error', 'max_depth': 5, 'min_weight_fraction_leaf': 0.0, 'max_leaf_nodes': 20, 'bootstrap': False, 'ccp_alpha': 0.014}. Best is trial 2251 with value: 0.02361845659970214.
[I 2025-04-16 01:27:48,979] Trial 2516 finished with value: -0.1936417107583833 and parameters: {'n_estimators': 3669, 'min_samples_split': 2, 'max_features': 0.92, 'min_samples_leaf': 1, 'criterion': 'absolute_error', 'max_depth': 5, 'min_weight_fraction_leaf': 0.0, 'max_leaf_nodes': 20, 'bootstrap': False, 'ccp_alpha': 0.027}. Best is trial 2251 with value: 0.02361845659970214.
[I 2025-04-16 01:27:51,991] Trial 2517 finished with value: -0.1936417107583833 and parameters: {'n_estimators': 3411, 'min_samples_split': 9, 'max_features': 0.93, 'min_samples_leaf': 6, 'criterion': 'absolute_error', 'max_depth': 5, 'min_weight_fraction_leaf': 0.0, 'max_leaf_nodes': 20, 'bootstrap': False, 'ccp_alpha': 0.007}. Best is trial 2251 with value: 0.02361845659970214.
[I 2025-04-16 01:27:55,465] Trial 2518 finished with value: -0.1936417107583833 and parameters: {'n_estimators': 3714, 'min_samples_split': 5, 'max_features': 0.9, 'min_samples_leaf': 4, 'criterion': 'absolute_error', 'max_depth': 5, 'min_weight_fraction_leaf': 0.0, 'max_leaf_nodes': 20, 'bootstrap': False, 'ccp_alpha': 0.006}. Best is trial 2251 with value: 0.02361845659970214.
[I 2025-04-16 01:27:58,470] Trial 2519 finished with value: -0.1936417107583833 and parameters: {'n_estimators': 3210, 'min_samples_split': 2, 'max_features': 0.93, 'min_samples_leaf': 3, 'criterion': 'absolute_error', 'max_depth': 5, 'min_weight_fraction_leaf': 0.0, 'max_leaf_nodes': 20, 'bootstrap': False, 'ccp_alpha': 0.019}. Best is trial 2251 with value: 0.02361845659970214.
[I 2025-04-16 01:28:01,597] Trial 2520 finished with value: -17.528986382275246 and parameters: {'n_estimators': 3502, 'min_samples_split': 6, 'max_features': 0.91, 'min_samples_leaf': 6, 'criterion': 'squared_error', 'max_depth': 5, 'min_weight_fraction_leaf': 0.0, 'max_leaf_nodes': 20, 'bootstrap': False, 'ccp_alpha': 0.011}. Best is trial 2251 with value: 0.02361845659970214.
[I 2025-04-16 01:28:05,125] Trial 2521 finished with value: -0.08502283957387416 and parameters: {'n_estimators': 3730, 'min_samples_split': 9, 'max_features': 0.87, 'min_samples_leaf': 1, 'criterion': 'absolute_error', 'max_depth': 5, 'min_weight_fraction_leaf': 0.0, 'max_leaf_nodes': 20, 'bootstrap': False, 'ccp_alpha': 0.005}. Best is trial 2251 with value: 0.02361845659970214.
[I 2025-04-16 01:28:08,148] Trial 2522 finished with value: -0.1936417107583833 and parameters: {'n_estimators': 3197, 'min_samples_split': 6, 'max_features': 0.87, 'min_samples_leaf': 1, 'criterion': 'absolute_error', 'max_depth': 5, 'min_weight_fraction_leaf': 0.0, 'max_leaf_nodes': 20, 'bootstrap': False, 'ccp_alpha': 0.026000000000000002}. Best is trial 2251 with value: 0.02361845659970214.
[I 2025-04-16 01:28:11,446] Trial 2523 finished with value: -0.1936417107583833 and parameters: {'n_estimators': 3509, 'min_samples_split': 9, 'max_features': 0.86, 'min_samples_leaf': 3, 'criterion': 'absolute_error', 'max_depth': 5, 'min_weight_fraction_leaf': 0.0, 'max_leaf_nodes': 20, 'bootstrap': False, 'ccp_alpha': 0.021}. Best is trial 2251 with value: 0.02361845659970214.
[I 2025-04-16 01:28:14,901] Trial 2524 finished with value: -0.1936417107583833 and parameters: {'n_estimators': 3379, 'min_samples_split': 2, 'max_features': 0.88, 'min_samples_leaf': 1, 'criterion': 'absolute_error', 'max_depth': 5, 'min_weight_fraction_leaf': 0.0, 'max_leaf_nodes': 20, 'bootstrap': False, 'ccp_alpha': 0.018000000000000002}. Best is trial 2251 with value: 0.02361845659970214.
[I 2025-04-16 01:28:18,249] Trial 2525 finished with value: -25.10109943778186 and parameters: {'n_estimators': 3609, 'min_samples_split': 9, 'max_features': 0.88, 'min_samples_leaf': 1, 'criterion': 'poisson', 'max_depth': 5, 'min_weight_fraction_leaf': 0.0, 'max_leaf_nodes': 20, 'bootstrap': False, 'ccp_alpha': 0.015}. Best is trial 2251 with value: 0.02361845659970214.
[I 2025-04-16 01:28:21,396] Trial 2526 finished with value: -0.1936417107583833 and parameters: {'n_estimators': 3210, 'min_samples_split': 5, 'max_features': 0.87, 'min_samples_leaf': 3, 'criterion': 'absolute_error', 'max_depth': 5, 'min_weight_fraction_leaf': 0.0, 'max_leaf_nodes': 20, 'bootstrap': False, 'ccp_alpha': 0.013000000000000001}. Best is trial 2251 with value: 0.02361845659970214.
[I 2025-04-16 01:28:25,070] Trial 2527 finished with value: -0.1936417107583833 and parameters: {'n_estimators': 3708, 'min_samples_split': 9, 'max_features': 0.87, 'min_samples_leaf': 4, 'criterion': 'absolute_error', 'max_depth': 5, 'min_weight_fraction_leaf': 0.0, 'max_leaf_nodes': 20, 'bootstrap': False, 'ccp_alpha': 0.022}. Best is trial 2251 with value: 0.02361845659970214.
[I 2025-04-16 01:28:28,459] Trial 2528 finished with value: -0.1936417107583833 and parameters: {'n_estimators': 3437, 'min_samples_split': 2, 'max_features': 0.87, 'min_samples_leaf': 1, 'criterion': 'absolute_error', 'max_depth': 5, 'min_weight_fraction_leaf': 0.0, 'max_leaf_nodes': 20, 'bootstrap': False, 'ccp_alpha': 0.011}. Best is trial 2251 with value: 0.02361845659970214.
[I 2025-04-16 01:28:31,973] Trial 2529 finished with value: -0.1936417107583833 and parameters: {'n_estimators': 3606, 'min_samples_split': 6, 'max_features': 0.87, 'min_samples_leaf': 4, 'criterion': 'absolute_error', 'max_depth': 5, 'min_weight_fraction_leaf': 0.0, 'max_leaf_nodes': 20, 'bootstrap': False, 'ccp_alpha': 0.01}. Best is trial 2251 with value: 0.02361845659970214.
[I 2025-04-16 01:28:34,913] Trial 2530 finished with value: -0.1936417107583833 and parameters: {'n_estimators': 3331, 'min_samples_split': 6, 'max_features': 0.89, 'min_samples_leaf': 3, 'criterion': 'absolute_error', 'max_depth': 5, 'min_weight_fraction_leaf': 0.0, 'max_leaf_nodes': 20, 'bootstrap': False, 'ccp_alpha': 0.017}. Best is trial 2251 with value: 0.02361845659970214.
[I 2025-04-16 01:28:38,170] Trial 2531 finished with value: -0.1936417107583833 and parameters: {'n_estimators': 3752, 'min_samples_split': 9, 'max_features': 0.87, 'min_samples_leaf': 1, 'criterion': 'absolute_error', 'max_depth': 5, 'min_weight_fraction_leaf': 0.0, 'max_leaf_nodes': 20, 'bootstrap': False, 'ccp_alpha': 0.006}. Best is trial 2251 with value: 0.02361845659970214.
[I 2025-04-16 01:28:42,252] Trial 2532 finished with value: -0.1936417107583833 and parameters: {'n_estimators': 3407, 'min_samples_split': 2, 'max_features': 0.9, 'min_samples_leaf': 5, 'criterion': 'absolute_error', 'max_depth': 5, 'min_weight_fraction_leaf': 0.0, 'max_leaf_nodes': 20, 'bootstrap': False, 'ccp_alpha': 0.006}. Best is trial 2251 with value: 0.02361845659970214.
[I 2025-04-16 01:28:45,854] Trial 2533 finished with value: -0.1936417107583833 and parameters: {'n_estimators': 3595, 'min_samples_split': 9, 'max_features': 0.89, 'min_samples_leaf': 3, 'criterion': 'absolute_error', 'max_depth': 5, 'min_weight_fraction_leaf': 0.0, 'max_leaf_nodes': 20, 'bootstrap': False, 'ccp_alpha': 0.013000000000000001}. Best is trial 2251 with value: 0.02361845659970214.
[I 2025-04-16 01:28:49,504] Trial 2534 finished with value: -0.1936417107583833 and parameters: {'n_estimators': 3188, 'min_samples_split': 5, 'max_features': 0.87, 'min_samples_leaf': 5, 'criterion': 'absolute_error', 'max_depth': 5, 'min_weight_fraction_leaf': 0.0, 'max_leaf_nodes': 20, 'bootstrap': False, 'ccp_alpha': 0.178}. Best is trial 2251 with value: 0.02361845659970214.
[I 2025-04-16 01:28:52,631] Trial 2535 finished with value: -0.0009043198230871185 and parameters: {'n_estimators': 3669, 'min_samples_split': 2, 'max_features': 0.88, 'min_samples_leaf': 1, 'criterion': 'absolute_error', 'max_depth': 5, 'min_weight_fraction_leaf': 0.0, 'max_leaf_nodes': 20, 'bootstrap': False, 'ccp_alpha': 0.006}. Best is trial 2251 with value: 0.02361845659970214.
[I 2025-04-16 01:28:55,978] Trial 2536 finished with value: -0.1936417107583833 and parameters: {'n_estimators': 3389, 'min_samples_split': 2, 'max_features': 0.86, 'min_samples_leaf': 1, 'criterion': 'absolute_error', 'max_depth': 5, 'min_weight_fraction_leaf': 0.0, 'max_leaf_nodes': 20, 'bootstrap': False, 'ccp_alpha': 0.026000000000000002}. Best is trial 2251 with value: 0.02361845659970214.
[I 2025-04-16 01:28:58,954] Trial 2537 finished with value: -0.1936417107583833 and parameters: {'n_estimators': 3190, 'min_samples_split': 2, 'max_features': 0.87, 'min_samples_leaf': 1, 'criterion': 'absolute_error', 'max_depth': 5, 'min_weight_fraction_leaf': 0.0, 'max_leaf_nodes': 20, 'bootstrap': False, 'ccp_alpha': 0.021}. Best is trial 2251 with value: 0.02361845659970214.
[I 2025-04-16 01:29:02,087] Trial 2538 finished with value: -17.528986382275534 and parameters: {'n_estimators': 3397, 'min_samples_split': 2, 'max_features': 0.87, 'min_samples_leaf': 3, 'criterion': 'friedman_mse', 'max_depth': 5, 'min_weight_fraction_leaf': 0.0, 'max_leaf_nodes': 20, 'bootstrap': False, 'ccp_alpha': 0.016}. Best is trial 2251 with value: 0.02361845659970214.
[I 2025-04-16 01:29:05,207] Trial 2539 finished with value: -0.1936417107583833 and parameters: {'n_estimators': 3532, 'min_samples_split': 5, 'max_features': 0.87, 'min_samples_leaf': 1, 'criterion': 'absolute_error', 'max_depth': 5, 'min_weight_fraction_leaf': 0.0, 'max_leaf_nodes': 20, 'bootstrap': False, 'ccp_alpha': 0.031}. Best is trial 2251 with value: 0.02361845659970214.
[I 2025-04-16 01:29:08,616] Trial 2540 finished with value: -0.1936417107583833 and parameters: {'n_estimators': 3581, 'min_samples_split': 2, 'max_features': 0.87, 'min_samples_leaf': 3, 'criterion': 'absolute_error', 'max_depth': 5, 'min_weight_fraction_leaf': 0.0, 'max_leaf_nodes': 20, 'bootstrap': False, 'ccp_alpha': 0.02}. Best is trial 2251 with value: 0.02361845659970214.
[I 2025-04-16 01:29:11,646] Trial 2541 finished with value: -0.1936417107583833 and parameters: {'n_estimators': 3224, 'min_samples_split': 5, 'max_features': 0.88, 'min_samples_leaf': 1, 'criterion': 'absolute_error', 'max_depth': 5, 'min_weight_fraction_leaf': 0.0, 'max_leaf_nodes': 20, 'bootstrap': False, 'ccp_alpha': 0.015}. Best is trial 2251 with value: 0.02361845659970214.
[I 2025-04-16 01:29:15,216] Trial 2542 finished with value: -0.1936417107583833 and parameters: {'n_estimators': 3701, 'min_samples_split': 2, 'max_features': 0.88, 'min_samples_leaf': 5, 'criterion': 'absolute_error', 'max_depth': 5, 'min_weight_fraction_leaf': 0.0, 'max_leaf_nodes': 20, 'bootstrap': False, 'ccp_alpha': 0.012}. Best is trial 2251 with value: 0.02361845659970214.
[I 2025-04-16 01:29:18,522] Trial 2543 finished with value: -17.52898638227552 and parameters: {'n_estimators': 3400, 'min_samples_split': 6, 'max_features': 0.88, 'min_samples_leaf': 3, 'criterion': 'squared_error', 'max_depth': 5, 'min_weight_fraction_leaf': 0.0, 'max_leaf_nodes': 20, 'bootstrap': False, 'ccp_alpha': 0.024}. Best is trial 2251 with value: 0.02361845659970214.
[I 2025-04-16 01:29:21,642] Trial 2544 finished with value: -0.1936417107583833 and parameters: {'n_estimators': 3573, 'min_samples_split': 2, 'max_features': 0.86, 'min_samples_leaf': 3, 'criterion': 'absolute_error', 'max_depth': 5, 'min_weight_fraction_leaf': 0.0, 'max_leaf_nodes': 20, 'bootstrap': False, 'ccp_alpha': 0.018000000000000002}. Best is trial 2251 with value: 0.02361845659970214.
[I 2025-04-16 01:29:25,139] Trial 2545 finished with value: -0.1936417107583833 and parameters: {'n_estimators': 3741, 'min_samples_split': 8, 'max_features': 0.89, 'min_samples_leaf': 5, 'criterion': 'absolute_error', 'max_depth': 5, 'min_weight_fraction_leaf': 0.0, 'max_leaf_nodes': 20, 'bootstrap': False, 'ccp_alpha': 0.011}. Best is trial 2251 with value: 0.02361845659970214.
[I 2025-04-16 01:29:28,309] Trial 2546 finished with value: -0.1936417107583833 and parameters: {'n_estimators': 3379, 'min_samples_split': 5, 'max_features': 0.89, 'min_samples_leaf': 3, 'criterion': 'absolute_error', 'max_depth': 5, 'min_weight_fraction_leaf': 0.0, 'max_leaf_nodes': 20, 'bootstrap': False, 'ccp_alpha': 0.01}. Best is trial 2251 with value: 0.02361845659970214.
[I 2025-04-16 01:29:31,532] Trial 2547 finished with value: -0.1936417107583833 and parameters: {'n_estimators': 3184, 'min_samples_split': 6, 'max_features': 0.87, 'min_samples_leaf': 1, 'criterion': 'absolute_error', 'max_depth': 5, 'min_weight_fraction_leaf': 0.0, 'max_leaf_nodes': 20, 'bootstrap': False, 'ccp_alpha': 0.016}. Best is trial 2251 with value: 0.02361845659970214.
