[I 2025-04-16 01:56:34,219] Trial 3229 finished with value: -10.504488726549116 and parameters: {'n_estimators': 789, 'min_samples_split': 6, 'max_features': 0.81, 'min_samples_leaf': 3, 'criterion': 'absolute_error', 'max_depth': None, 'min_weight_fraction_leaf': 0.0, 'max_leaf_nodes': 300, 'bootstrap': False, 'ccp_alpha': 0.0}. Best is trial 3228 with value: 0.052087729354257054.
[I 2025-04-16 01:56:35,425] Trial 3230 finished with value: -0.1936417107583833 and parameters: {'n_estimators': 959, 'min_samples_split': 7, 'max_features': 0.81, 'min_samples_leaf': 2, 'criterion': 'absolute_error', 'max_depth': None, 'min_weight_fraction_leaf': 0.0, 'max_leaf_nodes': 300, 'bootstrap': False, 'ccp_alpha': 0.015}. Best is trial 3228 with value: 0.052087729354257054.
[I 2025-04-16 01:56:36,445] Trial 3231 finished with value: -0.1936417107583833 and parameters: {'n_estimators': 643, 'min_samples_split': 6, 'max_features': 0.79, 'min_samples_leaf': 2, 'criterion': 'absolute_error', 'max_depth': None, 'min_weight_fraction_leaf': 0.0, 'max_leaf_nodes': 300, 'bootstrap': False, 'ccp_alpha': 0.022}. Best is trial 3228 with value: 0.052087729354257054.
[I 2025-04-16 01:56:37,478] Trial 3232 finished with value: -0.1936417107583833 and parameters: {'n_estimators': 667, 'min_samples_split': 7, 'max_features': 0.8, 'min_samples_leaf': 2, 'criterion': 'absolute_error', 'max_depth': None, 'min_weight_fraction_leaf': 0.0, 'max_leaf_nodes': 300, 'bootstrap': False, 'ccp_alpha': 0.01}. Best is trial 3228 with value: 0.052087729354257054.
[I 2025-04-16 01:56:38,636] Trial 3233 finished with value: -10.558826198764066 and parameters: {'n_estimators': 913, 'min_samples_split': 6, 'max_features': 0.8200000000000001, 'min_samples_leaf': 3, 'criterion': 'absolute_error', 'max_depth': None, 'min_weight_fraction_leaf': 0.0, 'max_leaf_nodes': 300, 'bootstrap': False, 'ccp_alpha': 0.0}. Best is trial 3228 with value: 0.052087729354257054.
[I 2025-04-16 01:56:39,881] Trial 3234 finished with value: -0.1936417107583833 and parameters: {'n_estimators': 966, 'min_samples_split': 122, 'max_features': 0.81, 'min_samples_leaf': 3, 'criterion': 'absolute_error', 'max_depth': None, 'min_weight_fraction_leaf': 0.0, 'max_leaf_nodes': 300, 'bootstrap': False, 'ccp_alpha': 0.009000000000000001}. Best is trial 3228 with value: 0.052087729354257054.
[I 2025-04-16 01:56:40,977] Trial 3235 finished with value: -0.1936417107583833 and parameters: {'n_estimators': 804, 'min_samples_split': 6, 'max_features': 0.81, 'min_samples_leaf': 3, 'criterion': 'absolute_error', 'max_depth': None, 'min_weight_fraction_leaf': 0.0, 'max_leaf_nodes': 300, 'bootstrap': False, 'ccp_alpha': 0.015}. Best is trial 3228 with value: 0.052087729354257054.
[I 2025-04-16 01:56:41,926] Trial 3236 finished with value: -0.1936417107583833 and parameters: {'n_estimators': 630, 'min_samples_split': 6, 'max_features': 0.79, 'min_samples_leaf': 2, 'criterion': 'absolute_error', 'max_depth': None, 'min_weight_fraction_leaf': 0.0, 'max_leaf_nodes': 300, 'bootstrap': False, 'ccp_alpha': 0.009000000000000001}. Best is trial 3228 with value: 0.052087729354257054.
[I 2025-04-16 01:56:43,178] Trial 3237 finished with value: -17.528986382275626 and parameters: {'n_estimators': 992, 'min_samples_split': 5, 'max_features': 0.8200000000000001, 'min_samples_leaf': 2, 'criterion': 'friedman_mse', 'max_depth': None, 'min_weight_fraction_leaf': 0.0, 'max_leaf_nodes': 300, 'bootstrap': False, 'ccp_alpha': 0.005}. Best is trial 3228 with value: 0.052087729354257054.
[I 2025-04-16 01:56:44,377] Trial 3238 finished with value: -0.1936417107583833 and parameters: {'n_estimators': 846, 'min_samples_split': 6, 'max_features': 0.8200000000000001, 'min_samples_leaf': 3, 'criterion': 'absolute_error', 'max_depth': None, 'min_weight_fraction_leaf': 0.0, 'max_leaf_nodes': 300, 'bootstrap': False, 'ccp_alpha': 0.019}. Best is trial 3228 with value: 0.052087729354257054.
[I 2025-04-16 01:56:45,678] Trial 3239 finished with value: -14.725380879148352 and parameters: {'n_estimators': 1081, 'min_samples_split': 6, 'max_features': 0.79, 'min_samples_leaf': 3, 'criterion': 'absolute_error', 'max_depth': None, 'min_weight_fraction_leaf': 0.0, 'max_leaf_nodes': 300, 'bootstrap': False, 'ccp_alpha': 0.0}. Best is trial 3228 with value: 0.052087729354257054.
[I 2025-04-16 01:56:46,653] Trial 3240 finished with value: -0.1936417107583833 and parameters: {'n_estimators': 656, 'min_samples_split': 6, 'max_features': 0.8200000000000001, 'min_samples_leaf': 2, 'criterion': 'absolute_error', 'max_depth': None, 'min_weight_fraction_leaf': 0.0, 'max_leaf_nodes': 300, 'bootstrap': False, 'ccp_alpha': 0.014}. Best is trial 3228 with value: 0.052087729354257054.
[I 2025-04-16 01:56:47,993] Trial 3241 finished with value: -0.1936417107583833 and parameters: {'n_estimators': 1059, 'min_samples_split': 6, 'max_features': 0.79, 'min_samples_leaf': 3, 'criterion': 'absolute_error', 'max_depth': None, 'min_weight_fraction_leaf': 0.0, 'max_leaf_nodes': 300, 'bootstrap': False, 'ccp_alpha': 0.03}. Best is trial 3228 with value: 0.052087729354257054.
[I 2025-04-16 01:56:49,048] Trial 3242 finished with value: 0.024566537014549784 and parameters: {'n_estimators': 735, 'min_samples_split': 7, 'max_features': 0.87, 'min_samples_leaf': 3, 'criterion': 'absolute_error', 'max_depth': None, 'min_weight_fraction_leaf': 0.0, 'max_leaf_nodes': 300, 'bootstrap': False, 'ccp_alpha': 0.005}. Best is trial 3228 with value: 0.052087729354257054.
[I 2025-04-16 01:56:50,061] Trial 3243 finished with value: 0.05309858269741676 and parameters: {'n_estimators': 703, 'min_samples_split': 6, 'max_features': 0.8200000000000001, 'min_samples_leaf': 2, 'criterion': 'absolute_error', 'max_depth': None, 'min_weight_fraction_leaf': 0.0, 'max_leaf_nodes': 300, 'bootstrap': False, 'ccp_alpha': 0.005}. Best is trial 3243 with value: 0.05309858269741676.
[I 2025-04-16 01:56:50,989] Trial 3244 finished with value: -0.1936417107583833 and parameters: {'n_estimators': 607, 'min_samples_split': 6, 'max_features': 0.78, 'min_samples_leaf': 2, 'criterion': 'absolute_error', 'max_depth': None, 'min_weight_fraction_leaf': 0.0, 'max_leaf_nodes': 300, 'bootstrap': False, 'ccp_alpha': 0.013000000000000001}. Best is trial 3243 with value: 0.05309858269741676.
[I 2025-04-16 01:56:52,059] Trial 3245 finished with value: -0.1936417107583833 and parameters: {'n_estimators': 764, 'min_samples_split': 6, 'max_features': 0.8200000000000001, 'min_samples_leaf': 2, 'criterion': 'absolute_error', 'max_depth': None, 'min_weight_fraction_leaf': 0.0, 'max_leaf_nodes': 300, 'bootstrap': False, 'ccp_alpha': 0.023}. Best is trial 3243 with value: 0.05309858269741676.
[I 2025-04-16 01:56:52,867] Trial 3246 finished with value: -31.40318075440563 and parameters: {'n_estimators': 515, 'min_samples_split': 5, 'max_features': 0.79, 'min_samples_leaf': 2, 'criterion': 'absolute_error', 'max_depth': 15, 'min_weight_fraction_leaf': 0.0, 'max_leaf_nodes': 300, 'bootstrap': False, 'ccp_alpha': 0.0}. Best is trial 3243 with value: 0.05309858269741676.
[I 2025-04-16 01:56:54,042] Trial 3247 finished with value: -17.528986382275285 and parameters: {'n_estimators': 858, 'min_samples_split': 5, 'max_features': 0.8, 'min_samples_leaf': 2, 'criterion': 'squared_error', 'max_depth': None, 'min_weight_fraction_leaf': 0.0, 'max_leaf_nodes': 300, 'bootstrap': False, 'ccp_alpha': 0.009000000000000001}. Best is trial 3243 with value: 0.05309858269741676.
[I 2025-04-16 01:56:54,893] Trial 3248 finished with value: -0.1936417107583833 and parameters: {'n_estimators': 497, 'min_samples_split': 5, 'max_features': 0.81, 'min_samples_leaf': 2, 'criterion': 'absolute_error', 'max_depth': None, 'min_weight_fraction_leaf': 0.1, 'max_leaf_nodes': 300, 'bootstrap': False, 'ccp_alpha': 0.009000000000000001}. Best is trial 3243 with value: 0.05309858269741676.
[I 2025-04-16 01:56:56,063] Trial 3249 finished with value: -0.1936417107583833 and parameters: {'n_estimators': 882, 'min_samples_split': 6, 'max_features': 0.8200000000000001, 'min_samples_leaf': 2, 'criterion': 'absolute_error', 'max_depth': None, 'min_weight_fraction_leaf': 0.0, 'max_leaf_nodes': 300, 'bootstrap': False, 'ccp_alpha': 0.019}. Best is trial 3243 with value: 0.05309858269741676.
[I 2025-04-16 01:56:57,023] Trial 3250 finished with value: 0.054240927193746624 and parameters: {'n_estimators': 628, 'min_samples_split': 5, 'max_features': 0.8200000000000001, 'min_samples_leaf': 2, 'criterion': 'absolute_error', 'max_depth': None, 'min_weight_fraction_leaf': 0.0, 'max_leaf_nodes': 300, 'bootstrap': False, 'ccp_alpha': 0.005}. Best is trial 3250 with value: 0.054240927193746624.
[I 2025-04-16 01:56:57,982] Trial 3251 finished with value: -0.1936417107583833 and parameters: {'n_estimators': 637, 'min_samples_split': 6, 'max_features': 0.8300000000000001, 'min_samples_leaf': 1, 'criterion': 'absolute_error', 'max_depth': None, 'min_weight_fraction_leaf': 0.0, 'max_leaf_nodes': 300, 'bootstrap': False, 'ccp_alpha': 0.013000000000000001}. Best is trial 3250 with value: 0.054240927193746624.
[I 2025-04-16 01:56:58,925] Trial 3252 finished with value: 0.012143720289497062 and parameters: {'n_estimators': 631, 'min_samples_split': 5, 'max_features': 0.8400000000000001, 'min_samples_leaf': 1, 'criterion': 'absolute_error', 'max_depth': None, 'min_weight_fraction_leaf': 0.04, 'max_leaf_nodes': 300, 'bootstrap': False, 'ccp_alpha': 0.006}. Best is trial 3250 with value: 0.054240927193746624.
[I 2025-04-16 01:56:59,938] Trial 3253 finished with value: -10.154939117207352 and parameters: {'n_estimators': 654, 'min_samples_split': 5, 'max_features': 0.76, 'min_samples_leaf': 2, 'criterion': 'poisson', 'max_depth': None, 'min_weight_fraction_leaf': 0.0, 'max_leaf_nodes': 300, 'bootstrap': False, 'ccp_alpha': 0.0}. Best is trial 3250 with value: 0.054240927193746624.
[I 2025-04-16 01:57:00,952] Trial 3254 finished with value: -0.1936417107583833 and parameters: {'n_estimators': 681, 'min_samples_split': 5, 'max_features': 0.8, 'min_samples_leaf': 2, 'criterion': 'absolute_error', 'max_depth': None, 'min_weight_fraction_leaf': 0.0, 'max_leaf_nodes': 300, 'bootstrap': False, 'ccp_alpha': 0.014}. Best is trial 3250 with value: 0.054240927193746624.
[I 2025-04-16 01:57:01,942] Trial 3255 finished with value: -0.1936417107583833 and parameters: {'n_estimators': 641, 'min_samples_split': 5, 'max_features': 0.8, 'min_samples_leaf': 2, 'criterion': 'absolute_error', 'max_depth': 15, 'min_weight_fraction_leaf': 0.0, 'max_leaf_nodes': 300, 'bootstrap': False, 'ccp_alpha': 0.01}. Best is trial 3250 with value: 0.054240927193746624.
[I 2025-04-16 01:57:03,021] Trial 3256 finished with value: 0.03721290114305964 and parameters: {'n_estimators': 774, 'min_samples_split': 6, 'max_features': 0.78, 'min_samples_leaf': 1, 'criterion': 'absolute_error', 'max_depth': None, 'min_weight_fraction_leaf': 0.0, 'max_leaf_nodes': 300, 'bootstrap': False, 'ccp_alpha': 0.005}. Best is trial 3250 with value: 0.054240927193746624.
[I 2025-04-16 01:57:03,951] Trial 3257 finished with value: -0.1936417107583833 and parameters: {'n_estimators': 557, 'min_samples_split': 5, 'max_features': 0.79, 'min_samples_leaf': 1, 'criterion': 'absolute_error', 'max_depth': None, 'min_weight_fraction_leaf': 0.0, 'max_leaf_nodes': 300, 'bootstrap': False, 'ccp_alpha': 0.019}. Best is trial 3250 with value: 0.054240927193746624.
[I 2025-04-16 01:57:05,004] Trial 3258 finished with value: -16.133415685214395 and parameters: {'n_estimators': 692, 'min_samples_split': 7, 'max_features': 0.79, 'min_samples_leaf': 1, 'criterion': 'absolute_error', 'max_depth': None, 'min_weight_fraction_leaf': 0.0, 'max_leaf_nodes': 300, 'bootstrap': False, 'ccp_alpha': 0.0}. Best is trial 3250 with value: 0.054240927193746624.
[I 2025-04-16 01:57:06,118] Trial 3259 finished with value: -0.1936417107583833 and parameters: {'n_estimators': 619, 'min_samples_split': 6, 'max_features': 0.75, 'min_samples_leaf': 1, 'criterion': 'absolute_error', 'max_depth': None, 'min_weight_fraction_leaf': 0.0, 'max_leaf_nodes': 300, 'bootstrap': False, 'ccp_alpha': 0.013000000000000001}. Best is trial 3250 with value: 0.054240927193746624.
[I 2025-04-16 01:57:07,202] Trial 3260 finished with value: -0.1936417107583833 and parameters: {'n_estimators': 703, 'min_samples_split': 5, 'max_features': 0.77, 'min_samples_leaf': 1, 'criterion': 'absolute_error', 'max_depth': None, 'min_weight_fraction_leaf': 0.0, 'max_leaf_nodes': 300, 'bootstrap': False, 'ccp_alpha': 0.28700000000000003}. Best is trial 3250 with value: 0.054240927193746624.
[I 2025-04-16 01:57:08,180] Trial 3261 finished with value: -17.528986382274873 and parameters: {'n_estimators': 589, 'min_samples_split': 5, 'max_features': 0.77, 'min_samples_leaf': 1, 'criterion': 'friedman_mse', 'max_depth': None, 'min_weight_fraction_leaf': 0.0, 'max_leaf_nodes': 300, 'bootstrap': False, 'ccp_alpha': 0.005}. Best is trial 3250 with value: 0.054240927193746624.
[I 2025-04-16 01:57:09,342] Trial 3262 finished with value: -0.1936417107583833 and parameters: {'n_estimators': 834, 'min_samples_split': 5, 'max_features': 0.81, 'min_samples_leaf': 2, 'criterion': 'absolute_error', 'max_depth': None, 'min_weight_fraction_leaf': 0.0, 'max_leaf_nodes': 300, 'bootstrap': False, 'ccp_alpha': 0.009000000000000001}. Best is trial 3250 with value: 0.054240927193746624.
[I 2025-04-16 01:57:10,458] Trial 3263 finished with value: -0.1936417107583833 and parameters: {'n_estimators': 796, 'min_samples_split': 5, 'max_features': 0.79, 'min_samples_leaf': 1, 'criterion': 'absolute_error', 'max_depth': None, 'min_weight_fraction_leaf': 0.0, 'max_leaf_nodes': 300, 'bootstrap': False, 'ccp_alpha': 0.024}. Best is trial 3250 with value: 0.054240927193746624.
[I 2025-04-16 01:57:11,353] Trial 3264 finished with value: -0.1936417107583833 and parameters: {'n_estimators': 519, 'min_samples_split': 5, 'max_features': 0.8, 'min_samples_leaf': 2, 'criterion': 'absolute_error', 'max_depth': None, 'min_weight_fraction_leaf': 0.0, 'max_leaf_nodes': 300, 'bootstrap': False, 'ccp_alpha': 0.035}. Best is trial 3250 with value: 0.054240927193746624.
[I 2025-04-16 01:57:12,386] Trial 3265 finished with value: -46.800389605136665 and parameters: {'n_estimators': 778, 'min_samples_split': 5, 'max_features': 0.81, 'min_samples_leaf': 2, 'criterion': 'absolute_error', 'max_depth': None, 'min_weight_fraction_leaf': 0.0, 'max_leaf_nodes': 300, 'bootstrap': False, 'ccp_alpha': 0.0}. Best is trial 3250 with value: 0.054240927193746624.
[I 2025-04-16 01:57:13,343] Trial 3266 finished with value: -0.1936417107583833 and parameters: {'n_estimators': 547, 'min_samples_split': 5, 'max_features': 0.8300000000000001, 'min_samples_leaf': 1, 'criterion': 'absolute_error', 'max_depth': 20, 'min_weight_fraction_leaf': 0.0, 'max_leaf_nodes': 300, 'bootstrap': False, 'ccp_alpha': 0.018000000000000002}. Best is trial 3250 with value: 0.054240927193746624.
[I 2025-04-16 01:57:14,443] Trial 3267 finished with value: 0.055170387637108485 and parameters: {'n_estimators': 765, 'min_samples_split': 5, 'max_features': 0.8200000000000001, 'min_samples_leaf': 1, 'criterion': 'absolute_error', 'max_depth': 15, 'min_weight_fraction_leaf': 0.0, 'max_leaf_nodes': 300, 'bootstrap': False, 'ccp_alpha': 0.005}. Best is trial 3267 with value: 0.055170387637108485.
[I 2025-04-16 01:57:15,310] Trial 3268 finished with value: -0.1936417107583833 and parameters: {'n_estimators': 496, 'min_samples_split': 5, 'max_features': 0.81, 'min_samples_leaf': 1, 'criterion': 'absolute_error', 'max_depth': 15, 'min_weight_fraction_leaf': 0.0, 'max_leaf_nodes': 300, 'bootstrap': False, 'ccp_alpha': 0.01}. Best is trial 3267 with value: 0.055170387637108485.
[I 2025-04-16 01:57:16,344] Trial 3269 finished with value: 0.05453235179597569 and parameters: {'n_estimators': 736, 'min_samples_split': 5, 'max_features': 0.8, 'min_samples_leaf': 2, 'criterion': 'absolute_error', 'max_depth': 15, 'min_weight_fraction_leaf': 0.0, 'max_leaf_nodes': 300, 'bootstrap': False, 'ccp_alpha': 0.005}. Best is trial 3267 with value: 0.055170387637108485.
[I 2025-04-16 01:57:17,381] Trial 3270 finished with value: -0.1936417107583833 and parameters: {'n_estimators': 690, 'min_samples_split': 2, 'max_features': 0.77, 'min_samples_leaf': 1, 'criterion': 'absolute_error', 'max_depth': 15, 'min_weight_fraction_leaf': 0.0, 'max_leaf_nodes': 300, 'bootstrap': False, 'ccp_alpha': 0.017}. Best is trial 3267 with value: 0.055170387637108485.
[I 2025-04-16 01:57:18,406] Trial 3271 finished with value: -17.528986382274862 and parameters: {'n_estimators': 730, 'min_samples_split': 5, 'max_features': 0.79, 'min_samples_leaf': 1, 'criterion': 'squared_error', 'max_depth': 15, 'min_weight_fraction_leaf': 0.0, 'max_leaf_nodes': 300, 'bootstrap': False, 'ccp_alpha': 0.294}. Best is trial 3267 with value: 0.055170387637108485.
[I 2025-04-16 01:57:19,329] Trial 3272 finished with value: -0.1936417107583833 and parameters: {'n_estimators': 482, 'min_samples_split': 5, 'max_features': 0.79, 'min_samples_leaf': 1, 'criterion': 'absolute_error', 'max_depth': None, 'min_weight_fraction_leaf': 0.0, 'max_leaf_nodes': 300, 'bootstrap': False, 'ccp_alpha': 0.012}. Best is trial 3267 with value: 0.055170387637108485.
[I 2025-04-16 01:57:20,528] Trial 3273 finished with value: -0.1936417107583833 and parameters: {'n_estimators': 762, 'min_samples_split': 2, 'max_features': 0.77, 'min_samples_leaf': 1, 'criterion': 'absolute_error', 'max_depth': 15, 'min_weight_fraction_leaf': 0.0, 'max_leaf_nodes': 300, 'bootstrap': False, 'ccp_alpha': 0.028}. Best is trial 3267 with value: 0.055170387637108485.
[I 2025-04-16 01:57:21,414] Trial 3274 finished with value: -0.1936417107583833 and parameters: {'n_estimators': 517, 'min_samples_split': 5, 'max_features': 0.77, 'min_samples_leaf': 1, 'criterion': 'absolute_error', 'max_depth': 15, 'min_weight_fraction_leaf': 0.0, 'max_leaf_nodes': 300, 'bootstrap': False, 'ccp_alpha': 0.019}. Best is trial 3267 with value: 0.055170387637108485.
[I 2025-04-16 01:57:22,522] Trial 3275 finished with value: -0.1936417107583833 and parameters: {'n_estimators': 796, 'min_samples_split': 5, 'max_features': 0.8, 'min_samples_leaf': 1, 'criterion': 'absolute_error', 'max_depth': 15, 'min_weight_fraction_leaf': 0.0, 'max_leaf_nodes': 300, 'bootstrap': False, 'ccp_alpha': 0.009000000000000001}. Best is trial 3267 with value: 0.055170387637108485.
[I 2025-04-16 01:57:23,370] Trial 3276 finished with value: -0.1936417107583833 and parameters: {'n_estimators': 486, 'min_samples_split': 5, 'max_features': 0.81, 'min_samples_leaf': 1, 'criterion': 'absolute_error', 'max_depth': 15, 'min_weight_fraction_leaf': 0.0, 'max_leaf_nodes': 300, 'bootstrap': False, 'ccp_alpha': 0.014}. Best is trial 3267 with value: 0.055170387637108485.
[I 2025-04-16 01:57:24,502] Trial 3277 finished with value: 0.0390841194492149 and parameters: {'n_estimators': 735, 'min_samples_split': 2, 'max_features': 0.75, 'min_samples_leaf': 1, 'criterion': 'absolute_error', 'max_depth': 15, 'min_weight_fraction_leaf': 0.0, 'max_leaf_nodes': 300, 'bootstrap': False, 'ccp_alpha': 0.005}. Best is trial 3267 with value: 0.055170387637108485.
[I 2025-04-16 01:57:25,547] Trial 3278 finished with value: -11.04924112541106 and parameters: {'n_estimators': 741, 'min_samples_split': 5, 'max_features': 0.75, 'min_samples_leaf': 1, 'criterion': 'poisson', 'max_depth': 15, 'min_weight_fraction_leaf': 0.0, 'max_leaf_nodes': 300, 'bootstrap': False, 'ccp_alpha': 0.0}. Best is trial 3267 with value: 0.055170387637108485.
[I 2025-04-16 01:57:26,420] Trial 3279 finished with value: -0.1936417107583833 and parameters: {'n_estimators': 513, 'min_samples_split': 5, 'max_features': 0.77, 'min_samples_leaf': 1, 'criterion': 'absolute_error', 'max_depth': 15, 'min_weight_fraction_leaf': 0.0, 'max_leaf_nodes': 300, 'bootstrap': False, 'ccp_alpha': 0.023}. Best is trial 3267 with value: 0.055170387637108485.
[I 2025-04-16 01:57:27,513] Trial 3280 finished with value: -0.1936417107583833 and parameters: {'n_estimators': 699, 'min_samples_split': 2, 'max_features': 0.73, 'min_samples_leaf': 1, 'criterion': 'absolute_error', 'max_depth': 15, 'min_weight_fraction_leaf': 0.0, 'max_leaf_nodes': 300, 'bootstrap': False, 'ccp_alpha': 0.009000000000000001}. Best is trial 3267 with value: 0.055170387637108485.
[I 2025-04-16 01:57:28,711] Trial 3281 finished with value: -0.1936417107583833 and parameters: {'n_estimators': 886, 'min_samples_split': 5, 'max_features': 0.78, 'min_samples_leaf': 1, 'criterion': 'absolute_error', 'max_depth': 15, 'min_weight_fraction_leaf': 0.0, 'max_leaf_nodes': 300, 'bootstrap': False, 'ccp_alpha': 0.014}. Best is trial 3267 with value: 0.055170387637108485.
[I 2025-04-16 01:57:29,671] Trial 3282 finished with value: 0.0033739293536977355 and parameters: {'n_estimators': 601, 'min_samples_split': 5, 'max_features': 0.78, 'min_samples_leaf': 1, 'criterion': 'absolute_error', 'max_depth': 15, 'min_weight_fraction_leaf': 0.0, 'max_leaf_nodes': 300, 'bootstrap': False, 'ccp_alpha': 0.006}. Best is trial 3267 with value: 0.055170387637108485.
[I 2025-04-16 01:57:30,522] Trial 3283 finished with value: 0.03388892033376405 and parameters: {'n_estimators': 476, 'min_samples_split': 5, 'max_features': 0.76, 'min_samples_leaf': 1, 'criterion': 'absolute_error', 'max_depth': 15, 'min_weight_fraction_leaf': 0.0, 'max_leaf_nodes': 300, 'bootstrap': False, 'ccp_alpha': 0.005}. Best is trial 3267 with value: 0.055170387637108485.
[I 2025-04-16 01:57:31,326] Trial 3284 finished with value: -34.77055702036198 and parameters: {'n_estimators': 383, 'min_samples_split': 5, 'max_features': 0.74, 'min_samples_leaf': 1, 'criterion': 'absolute_error', 'max_depth': 15, 'min_weight_fraction_leaf': 0.0, 'max_leaf_nodes': 300, 'bootstrap': False, 'ccp_alpha': 0.0}. Best is trial 3267 with value: 0.055170387637108485.
