[I 2025-04-15 23:20:35,433] Trial 268 finished with value: -0.19325678286829864 and parameters: {'n_estimators': 2695, 'min_samples_split': 170, 'max_features': 0.85, 'min_samples_leaf': 59, 'criterion': 'absolute_error', 'max_depth': 20, 'min_weight_fraction_leaf': 0.02, 'max_leaf_nodes': 100, 'bootstrap': True, 'ccp_alpha': 0.061, 'max_samples': 1.0}. Best is trial 74 with value: -0.18167313469617832.
[I 2025-04-15 23:20:38,924] Trial 269 finished with value: -0.18259175199003058 and parameters: {'n_estimators': 2993, 'min_samples_split': 160, 'max_features': 0.9, 'min_samples_leaf': 68, 'criterion': 'absolute_error', 'max_depth': 60, 'min_weight_fraction_leaf': 0.02, 'max_leaf_nodes': 10, 'bootstrap': True, 'ccp_alpha': 0.095, 'max_samples': 0.5}. Best is trial 74 with value: -0.18167313469617832.
[I 2025-04-15 23:20:42,369] Trial 270 finished with value: -18.01422633078084 and parameters: {'n_estimators': 3216, 'min_samples_split': 154, 'max_features': 0.88, 'min_samples_leaf': 24, 'criterion': 'poisson', 'max_depth': 30, 'min_weight_fraction_leaf': 0.02, 'max_leaf_nodes': 100, 'bootstrap': True, 'ccp_alpha': 0.10200000000000001, 'max_samples': 0.75}. Best is trial 74 with value: -0.18167313469617832.
[I 2025-04-15 23:20:42,801] Trial 271 finished with value: -0.18719893331566673 and parameters: {'n_estimators': 309, 'min_samples_split': 164, 'max_features': 0.8200000000000001, 'min_samples_leaf': 30, 'criterion': 'absolute_error', 'max_depth': 30, 'min_weight_fraction_leaf': 0.02, 'max_leaf_nodes': 100, 'bootstrap': True, 'ccp_alpha': 0.091, 'max_samples': 0.5}. Best is trial 74 with value: -0.18167313469617832.
[I 2025-04-15 23:20:46,060] Trial 272 finished with value: -0.1828611114607336 and parameters: {'n_estimators': 2810, 'min_samples_split': 179, 'max_features': 0.85, 'min_samples_leaf': 20, 'criterion': 'absolute_error', 'max_depth': 5, 'min_weight_fraction_leaf': 0.02, 'max_leaf_nodes': 100, 'bootstrap': True, 'ccp_alpha': 0.108, 'max_samples': 0.5}. Best is trial 74 with value: -0.18167313469617832.
[I 2025-04-15 23:20:49,334] Trial 273 finished with value: -0.1936417107583833 and parameters: {'n_estimators': 3912, 'min_samples_split': 172, 'max_features': 0.9600000000000001, 'min_samples_leaf': 29, 'criterion': 'absolute_error', 'max_depth': 10, 'min_weight_fraction_leaf': 0.01, 'max_leaf_nodes': 100, 'bootstrap': False, 'ccp_alpha': 0.079}. Best is trial 74 with value: -0.18167313469617832.
[I 2025-04-15 23:20:53,052] Trial 274 finished with value: -0.1827069410541121 and parameters: {'n_estimators': 3068, 'min_samples_split': 158, 'max_features': 0.8, 'min_samples_leaf': 78, 'criterion': 'absolute_error', 'max_depth': 30, 'min_weight_fraction_leaf': 0.02, 'max_leaf_nodes': 20, 'bootstrap': True, 'ccp_alpha': 0.098, 'max_samples': 0.5}. Best is trial 74 with value: -0.18167313469617832.
[I 2025-04-15 23:20:57,147] Trial 275 finished with value: -0.1834443041479231 and parameters: {'n_estimators': 3650, 'min_samples_split': 146, 'max_features': 0.77, 'min_samples_leaf': 36, 'criterion': 'absolute_error', 'max_depth': 30, 'min_weight_fraction_leaf': 0.02, 'max_leaf_nodes': 100, 'bootstrap': True, 'ccp_alpha': 0.11900000000000001, 'max_samples': 0.5}. Best is trial 74 with value: -0.18167313469617832.
[I 2025-04-15 23:20:59,630] Trial 276 finished with value: -18.246859566540543 and parameters: {'n_estimators': 2529, 'min_samples_split': 168, 'max_features': 0.87, 'min_samples_leaf': 70, 'criterion': 'friedman_mse', 'max_depth': 30, 'min_weight_fraction_leaf': 0.02, 'max_leaf_nodes': 100, 'bootstrap': True, 'ccp_alpha': 0.085, 'max_samples': 0.5}. Best is trial 74 with value: -0.18167313469617832.
[I 2025-04-15 23:21:03,500] Trial 277 finished with value: -0.18301236514436942 and parameters: {'n_estimators': 3387, 'min_samples_split': 162, 'max_features': 0.92, 'min_samples_leaf': 26, 'criterion': 'absolute_error', 'max_depth': 30, 'min_weight_fraction_leaf': 0.02, 'max_leaf_nodes': 100, 'bootstrap': True, 'ccp_alpha': 0.093, 'max_samples': 0.5}. Best is trial 74 with value: -0.18167313469617832.
[I 2025-04-15 23:21:06,817] Trial 278 finished with value: -0.18296352611493436 and parameters: {'n_estimators': 2866, 'min_samples_split': 115, 'max_features': 0.8300000000000001, 'min_samples_leaf': 55, 'criterion': 'absolute_error', 'max_depth': 30, 'min_weight_fraction_leaf': 0.02, 'max_leaf_nodes': 100, 'bootstrap': True, 'ccp_alpha': 0.11, 'max_samples': 0.5}. Best is trial 74 with value: -0.18167313469617832.
[I 2025-04-15 23:21:10,506] Trial 279 finished with value: -0.1827078965816616 and parameters: {'n_estimators': 3179, 'min_samples_split': 153, 'max_features': 0.9, 'min_samples_leaf': 58, 'criterion': 'absolute_error', 'max_depth': 30, 'min_weight_fraction_leaf': 0.01, 'max_leaf_nodes': 100, 'bootstrap': True, 'ccp_alpha': 0.10200000000000001, 'max_samples': 0.5}. Best is trial 74 with value: -0.18167313469617832.
[I 2025-04-15 23:21:13,914] Trial 280 finished with value: -0.1826096520272506 and parameters: {'n_estimators': 2999, 'min_samples_split': 175, 'max_features': 0.85, 'min_samples_leaf': 22, 'criterion': 'absolute_error', 'max_depth': 20, 'min_weight_fraction_leaf': 0.03, 'max_leaf_nodes': 100, 'bootstrap': True, 'ccp_alpha': 0.08700000000000001, 'max_samples': 0.5}. Best is trial 74 with value: -0.18167313469617832.
[I 2025-04-15 23:21:17,804] Trial 281 finished with value: -0.18328749199880728 and parameters: {'n_estimators': 3499, 'min_samples_split': 165, 'max_features': 0.81, 'min_samples_leaf': 46, 'criterion': 'absolute_error', 'max_depth': 30, 'min_weight_fraction_leaf': 0.02, 'max_leaf_nodes': 100, 'bootstrap': True, 'ccp_alpha': 0.074, 'max_samples': 0.5}. Best is trial 74 with value: -0.18167313469617832.
[I 2025-04-15 23:21:20,851] Trial 282 finished with value: -0.18284800525725847 and parameters: {'n_estimators': 2632, 'min_samples_split': 182, 'max_features': 0.99, 'min_samples_leaf': 32, 'criterion': 'absolute_error', 'max_depth': 30, 'min_weight_fraction_leaf': 0.02, 'max_leaf_nodes': 100, 'bootstrap': True, 'ccp_alpha': 0.097, 'max_samples': 0.5}. Best is trial 74 with value: -0.18167313469617832.
[I 2025-04-15 23:21:24,570] Trial 283 finished with value: -0.18286820391506153 and parameters: {'n_estimators': 3256, 'min_samples_split': 148, 'max_features': 0.88, 'min_samples_leaf': 28, 'criterion': 'absolute_error', 'max_depth': 30, 'min_weight_fraction_leaf': 0.03, 'max_leaf_nodes': 10, 'bootstrap': True, 'ccp_alpha': 0.083, 'max_samples': 0.5}. Best is trial 74 with value: -0.18167313469617832.
[I 2025-04-15 23:21:27,739] Trial 284 finished with value: -0.18293902451357807 and parameters: {'n_estimators': 2858, 'min_samples_split': 170, 'max_features': 0.9500000000000001, 'min_samples_leaf': 24, 'criterion': 'absolute_error', 'max_depth': 30, 'min_weight_fraction_leaf': 0.02, 'max_leaf_nodes': 100, 'bootstrap': True, 'ccp_alpha': 0.115, 'max_samples': 0.5}. Best is trial 74 with value: -0.18167313469617832.
[I 2025-04-15 23:21:28,612] Trial 285 finished with value: -17.490259737706815 and parameters: {'n_estimators': 766, 'min_samples_split': 161, 'max_features': 0.8400000000000001, 'min_samples_leaf': 33, 'criterion': 'squared_error', 'max_depth': 60, 'min_weight_fraction_leaf': 0.02, 'max_leaf_nodes': 100, 'bootstrap': True, 'ccp_alpha': 0.107, 'max_samples': 0.5}. Best is trial 74 with value: -0.18167313469617832.
[I 2025-04-15 23:21:32,375] Trial 286 finished with value: -0.18252301166292662 and parameters: {'n_estimators': 3092, 'min_samples_split': 156, 'max_features': 0.87, 'min_samples_leaf': 30, 'criterion': 'absolute_error', 'max_depth': 30, 'min_weight_fraction_leaf': 0.02, 'max_leaf_nodes': 100, 'bootstrap': True, 'ccp_alpha': 0.091, 'max_samples': 0.5}. Best is trial 74 with value: -0.18167313469617832.
[I 2025-04-15 23:21:35,952] Trial 287 finished with value: -0.18262402539315375 and parameters: {'n_estimators': 3148, 'min_samples_split': 157, 'max_features': 0.9, 'min_samples_leaf': 30, 'criterion': 'absolute_error', 'max_depth': 30, 'min_weight_fraction_leaf': 0.01, 'max_leaf_nodes': 100, 'bootstrap': True, 'ccp_alpha': 0.092, 'max_samples': 0.5}. Best is trial 74 with value: -0.18167313469617832.
[I 2025-04-15 23:21:39,714] Trial 288 finished with value: -0.19330136393090078 and parameters: {'n_estimators': 3505, 'min_samples_split': 187, 'max_features': 0.87, 'min_samples_leaf': 30, 'criterion': 'absolute_error', 'max_depth': 30, 'min_weight_fraction_leaf': 0.02, 'max_leaf_nodes': 100, 'bootstrap': True, 'ccp_alpha': 0.098, 'max_samples': None}. Best is trial 74 with value: -0.18167313469617832.
[I 2025-04-15 23:21:43,555] Trial 289 finished with value: -0.18292747437276363 and parameters: {'n_estimators': 3278, 'min_samples_split': 168, 'max_features': 0.93, 'min_samples_leaf': 35, 'criterion': 'absolute_error', 'max_depth': 30, 'min_weight_fraction_leaf': 0.09, 'max_leaf_nodes': 50, 'bootstrap': True, 'ccp_alpha': 0.105, 'max_samples': 0.5}. Best is trial 74 with value: -0.18167313469617832.
[I 2025-04-15 23:21:47,276] Trial 290 finished with value: -0.18258078593798976 and parameters: {'n_estimators': 3112, 'min_samples_split': 173, 'max_features': 0.89, 'min_samples_leaf': 26, 'criterion': 'absolute_error', 'max_depth': 30, 'min_weight_fraction_leaf': 0.03, 'max_leaf_nodes': 100, 'bootstrap': True, 'ccp_alpha': 0.121, 'max_samples': 0.5}. Best is trial 74 with value: -0.18167313469617832.
[I 2025-04-15 23:21:51,026] Trial 291 finished with value: -0.1834667230272462 and parameters: {'n_estimators': 3689, 'min_samples_split': 177, 'max_features': 0.9, 'min_samples_leaf': 25, 'criterion': 'absolute_error', 'max_depth': 20, 'min_weight_fraction_leaf': 0.03, 'max_leaf_nodes': 100, 'bootstrap': True, 'ccp_alpha': 0.114, 'max_samples': 0.5}. Best is trial 74 with value: -0.18167313469617832.
[I 2025-04-15 23:21:52,915] Trial 292 finished with value: -17.528986382276994 and parameters: {'n_estimators': 2768, 'min_samples_split': 173, 'max_features': 0.92, 'min_samples_leaf': 22, 'criterion': 'poisson', 'max_depth': 30, 'min_weight_fraction_leaf': 0.03, 'max_leaf_nodes': 100, 'bootstrap': False, 'ccp_alpha': 0.111}. Best is trial 74 with value: -0.18167313469617832.
[I 2025-04-15 23:21:56,104] Trial 293 finished with value: -0.18264775302608963 and parameters: {'n_estimators': 3139, 'min_samples_split': 180, 'max_features': 0.88, 'min_samples_leaf': 26, 'criterion': 'absolute_error', 'max_depth': 45, 'min_weight_fraction_leaf': 0.03, 'max_leaf_nodes': 100, 'bootstrap': True, 'ccp_alpha': 0.122, 'max_samples': 0.5}. Best is trial 74 with value: -0.18167313469617832.
[I 2025-04-15 23:21:59,764] Trial 294 finished with value: -0.18303810475415788 and parameters: {'n_estimators': 3397, 'min_samples_split': 174, 'max_features': 0.89, 'min_samples_leaf': 31, 'criterion': 'absolute_error', 'max_depth': 30, 'min_weight_fraction_leaf': 0.03, 'max_leaf_nodes': 100, 'bootstrap': True, 'ccp_alpha': 0.11900000000000001, 'max_samples': 0.5}. Best is trial 74 with value: -0.18167313469617832.
[I 2025-04-15 23:22:02,378] Trial 295 finished with value: -0.18389007435322302 and parameters: {'n_estimators': 2422, 'min_samples_split': 165, 'max_features': 0.87, 'min_samples_leaf': 61, 'criterion': 'absolute_error', 'max_depth': 30, 'min_weight_fraction_leaf': 0.03, 'max_leaf_nodes': 100, 'bootstrap': True, 'ccp_alpha': 0.126, 'max_samples': 0.5}. Best is trial 74 with value: -0.18167313469617832.
[I 2025-04-15 23:22:05,758] Trial 296 finished with value: -0.1932869491646961 and parameters: {'n_estimators': 3019, 'min_samples_split': 171, 'max_features': 0.9400000000000001, 'min_samples_leaf': 28, 'criterion': 'absolute_error', 'max_depth': 30, 'min_weight_fraction_leaf': 0.03, 'max_leaf_nodes': 150, 'bootstrap': True, 'ccp_alpha': 0.101, 'max_samples': 1.0}. Best is trial 74 with value: -0.18167313469617832.
[I 2025-04-15 23:22:08,768] Trial 297 finished with value: -0.19071888181507674 and parameters: {'n_estimators': 2773, 'min_samples_split': 166, 'max_features': 0.9, 'min_samples_leaf': 40, 'criterion': 'absolute_error', 'max_depth': 30, 'min_weight_fraction_leaf': 0.04, 'max_leaf_nodes': 100, 'bootstrap': True, 'ccp_alpha': 0.094, 'max_samples': 0.75}. Best is trial 74 with value: -0.18167313469617832.
[I 2025-04-15 23:22:12,569] Trial 298 finished with value: -0.18298533020635208 and parameters: {'n_estimators': 3330, 'min_samples_split': 151, 'max_features': 0.86, 'min_samples_leaf': 65, 'criterion': 'absolute_error', 'max_depth': 30, 'min_weight_fraction_leaf': 0.03, 'max_leaf_nodes': 100, 'bootstrap': True, 'ccp_alpha': 0.105, 'max_samples': 0.5}. Best is trial 74 with value: -0.18167313469617832.
[I 2025-04-15 23:22:16,010] Trial 299 finished with value: -0.18250556974403098 and parameters: {'n_estimators': 3086, 'min_samples_split': 183, 'max_features': 0.79, 'min_samples_leaf': 23, 'criterion': 'absolute_error', 'max_depth': 5, 'min_weight_fraction_leaf': 0.02, 'max_leaf_nodes': 10, 'bootstrap': True, 'ccp_alpha': 0.1, 'max_samples': 0.5}. Best is trial 74 with value: -0.18167313469617832.
[I 2025-04-15 23:22:19,370] Trial 300 finished with value: -0.1827738479915757 and parameters: {'n_estimators': 2922, 'min_samples_split': 182, 'max_features': 0.78, 'min_samples_leaf': 20, 'criterion': 'absolute_error', 'max_depth': 5, 'min_weight_fraction_leaf': 0.02, 'max_leaf_nodes': 10, 'bootstrap': True, 'ccp_alpha': 0.039, 'max_samples': 0.5}. Best is trial 74 with value: -0.18167313469617832.
[I 2025-04-15 23:22:22,196] Trial 301 finished with value: -0.18281438123987465 and parameters: {'n_estimators': 2622, 'min_samples_split': 185, 'max_features': 0.8, 'min_samples_leaf': 26, 'criterion': 'absolute_error', 'max_depth': 5, 'min_weight_fraction_leaf': 0.02, 'max_leaf_nodes': 10, 'bootstrap': True, 'ccp_alpha': 0.089, 'max_samples': 0.5}. Best is trial 74 with value: -0.18167313469617832.
[I 2025-04-15 23:22:25,698] Trial 302 finished with value: -0.18277181408173515 and parameters: {'n_estimators': 3202, 'min_samples_split': 178, 'max_features': 0.97, 'min_samples_leaf': 18, 'criterion': 'absolute_error', 'max_depth': 5, 'min_weight_fraction_leaf': 0.01, 'max_leaf_nodes': 10, 'bootstrap': True, 'ccp_alpha': 0.14200000000000002, 'max_samples': 0.5}. Best is trial 74 with value: -0.18167313469617832.
[I 2025-04-15 23:22:29,490] Trial 303 finished with value: -0.1833492737871416 and parameters: {'n_estimators': 3553, 'min_samples_split': 140, 'max_features': 0.92, 'min_samples_leaf': 23, 'criterion': 'absolute_error', 'max_depth': 15, 'min_weight_fraction_leaf': 0.02, 'max_leaf_nodes': 10, 'bootstrap': True, 'ccp_alpha': 0.114, 'max_samples': 0.5}. Best is trial 74 with value: -0.18167313469617832.
[I 2025-04-15 23:22:32,756] Trial 304 finished with value: -0.18263640024871738 and parameters: {'n_estimators': 3008, 'min_samples_split': 175, 'max_features': 0.77, 'min_samples_leaf': 24, 'criterion': 'absolute_error', 'max_depth': 10, 'min_weight_fraction_leaf': 0.02, 'max_leaf_nodes': 10, 'bootstrap': True, 'ccp_alpha': 0.107, 'max_samples': 0.5}. Best is trial 74 with value: -0.18167313469617832.
[I 2025-04-15 23:22:35,969] Trial 305 finished with value: -0.18281071294674614 and parameters: {'n_estimators': 2794, 'min_samples_split': 189, 'max_features': 0.44, 'min_samples_leaf': 74, 'criterion': 'absolute_error', 'max_depth': 60, 'min_weight_fraction_leaf': 0.02, 'max_leaf_nodes': 20, 'bootstrap': True, 'ccp_alpha': 0.096, 'max_samples': 0.5}. Best is trial 74 with value: -0.18167313469617832.
[I 2025-04-15 23:22:40,164] Trial 306 finished with value: -0.18310207245473414 and parameters: {'n_estimators': 3809, 'min_samples_split': 162, 'max_features': 0.81, 'min_samples_leaf': 22, 'criterion': 'absolute_error', 'max_depth': 5, 'min_weight_fraction_leaf': 0.02, 'max_leaf_nodes': None, 'bootstrap': True, 'ccp_alpha': 0.101, 'max_samples': 0.5}. Best is trial 74 with value: -0.18167313469617832.
[I 2025-04-15 23:22:43,976] Trial 307 finished with value: -0.18289159750807546 and parameters: {'n_estimators': 3291, 'min_samples_split': 191, 'max_features': 0.79, 'min_samples_leaf': 26, 'criterion': 'absolute_error', 'max_depth': 20, 'min_weight_fraction_leaf': 0.01, 'max_leaf_nodes': 100, 'bootstrap': True, 'ccp_alpha': 0.091, 'max_samples': 0.5}. Best is trial 74 with value: -0.18167313469617832.
[I 2025-04-15 23:22:47,169] Trial 308 finished with value: -18.094240537066923 and parameters: {'n_estimators': 3018, 'min_samples_split': 180, 'max_features': 0.8300000000000001, 'min_samples_leaf': 28, 'criterion': 'friedman_mse', 'max_depth': 5, 'min_weight_fraction_leaf': 0.02, 'max_leaf_nodes': 100, 'bootstrap': True, 'ccp_alpha': 0.012, 'max_samples': 0.5}. Best is trial 74 with value: -0.18167313469617832.
[I 2025-04-15 23:22:49,938] Trial 309 finished with value: -0.18302067585074155 and parameters: {'n_estimators': 2510, 'min_samples_split': 155, 'max_features': 0.88, 'min_samples_leaf': 24, 'criterion': 'absolute_error', 'max_depth': 45, 'min_weight_fraction_leaf': 0.02, 'max_leaf_nodes': 100, 'bootstrap': True, 'ccp_alpha': 0.122, 'max_samples': 0.5}. Best is trial 74 with value: -0.18167313469617832.
[I 2025-04-15 23:22:53,580] Trial 310 finished with value: -0.18264491106544214 and parameters: {'n_estimators': 3138, 'min_samples_split': 147, 'max_features': 0.51, 'min_samples_leaf': 51, 'criterion': 'absolute_error', 'max_depth': 30, 'min_weight_fraction_leaf': 0.02, 'max_leaf_nodes': 100, 'bootstrap': True, 'ccp_alpha': 0.11, 'max_samples': 0.5}. Best is trial 74 with value: -0.18167313469617832.
[I 2025-04-15 23:22:57,483] Trial 311 finished with value: -0.18319254881295718 and parameters: {'n_estimators': 3458, 'min_samples_split': 171, 'max_features': 0.9500000000000001, 'min_samples_leaf': 63, 'criterion': 'absolute_error', 'max_depth': 30, 'min_weight_fraction_leaf': 0.02, 'max_leaf_nodes': 10, 'bootstrap': True, 'ccp_alpha': 0.085, 'max_samples': 0.5}. Best is trial 74 with value: -0.18167313469617832.
[I 2025-04-15 23:23:02,796] Trial 312 finished with value: -0.1836943733647471 and parameters: {'n_estimators': 4870, 'min_samples_split': 158, 'max_features': 0.8200000000000001, 'min_samples_leaf': 28, 'criterion': 'absolute_error', 'max_depth': 30, 'min_weight_fraction_leaf': 0.01, 'max_leaf_nodes': 100, 'bootstrap': True, 'ccp_alpha': 0.076, 'max_samples': 0.5}. Best is trial 74 with value: -0.18167313469617832.
[I 2025-04-15 23:23:04,917] Trial 313 finished with value: -17.52898638227702 and parameters: {'n_estimators': 2851, 'min_samples_split': 163, 'max_features': 0.92, 'min_samples_leaf': 59, 'criterion': 'squared_error', 'max_depth': 20, 'min_weight_fraction_leaf': 0.02, 'max_leaf_nodes': 100, 'bootstrap': False, 'ccp_alpha': 0.096}. Best is trial 74 with value: -0.18167313469617832.
[I 2025-04-15 23:23:07,704] Trial 314 finished with value: -0.1828161536544552 and parameters: {'n_estimators': 2670, 'min_samples_split': 175, 'max_features': 0.86, 'min_samples_leaf': 26, 'criterion': 'absolute_error', 'max_depth': 30, 'min_weight_fraction_leaf': 0.02, 'max_leaf_nodes': 100, 'bootstrap': True, 'ccp_alpha': 0.10300000000000001, 'max_samples': 0.5}. Best is trial 74 with value: -0.18167313469617832.
[I 2025-04-15 23:23:09,648] Trial 315 finished with value: -0.1868559359323943 and parameters: {'n_estimators': 1838, 'min_samples_split': 169, 'max_features': 0.9, 'min_samples_leaf': 24, 'criterion': 'absolute_error', 'max_depth': 30, 'min_weight_fraction_leaf': 0.02, 'max_leaf_nodes': None, 'bootstrap': True, 'ccp_alpha': 0.117, 'max_samples': 0.5}. Best is trial 74 with value: -0.18167313469617832.
[I 2025-04-15 23:23:13,058] Trial 316 finished with value: -17.9156096810518 and parameters: {'n_estimators': 3280, 'min_samples_split': 150, 'max_features': 0.85, 'min_samples_leaf': 30, 'criterion': 'poisson', 'max_depth': 5, 'min_weight_fraction_leaf': 0.04, 'max_leaf_nodes': 100, 'bootstrap': True, 'ccp_alpha': 0.081, 'max_samples': 0.5}. Best is trial 74 with value: -0.18167313469617832.
[I 2025-04-15 23:23:16,357] Trial 317 finished with value: -0.18260281591235042 and parameters: {'n_estimators': 3014, 'min_samples_split': 154, 'max_features': 0.88, 'min_samples_leaf': 20, 'criterion': 'absolute_error', 'max_depth': 30, 'min_weight_fraction_leaf': 0.03, 'max_leaf_nodes': 100, 'bootstrap': True, 'ccp_alpha': 0.09, 'max_samples': 0.5}. Best is trial 74 with value: -0.18167313469617832.
[I 2025-04-15 23:23:22,788] Trial 318 finished with value: -0.1838703303318024 and parameters: {'n_estimators': 5942, 'min_samples_split': 183, 'max_features': 0.81, 'min_samples_leaf': 54, 'criterion': 'absolute_error', 'max_depth': 60, 'min_weight_fraction_leaf': 0.02, 'max_leaf_nodes': 100, 'bootstrap': True, 'ccp_alpha': 0.108, 'max_samples': 0.5}. Best is trial 74 with value: -0.18167313469617832.
[I 2025-04-15 23:23:26,140] Trial 319 finished with value: -0.1932792402756748 and parameters: {'n_estimators': 2864, 'min_samples_split': 98, 'max_features': 0.76, 'min_samples_leaf': 28, 'criterion': 'absolute_error', 'max_depth': 30, 'min_weight_fraction_leaf': 0.03, 'max_leaf_nodes': 50, 'bootstrap': True, 'ccp_alpha': 0.096, 'max_samples': None}. Best is trial 74 with value: -0.18167313469617832.
[I 2025-04-15 23:23:29,643] Trial 320 finished with value: -0.18254909058749744 and parameters: {'n_estimators': 3101, 'min_samples_split': 160, 'max_features': 1.0, 'min_samples_leaf': 22, 'criterion': 'absolute_error', 'max_depth': 30, 'min_weight_fraction_leaf': 0.02, 'max_leaf_nodes': 100, 'bootstrap': True, 'ccp_alpha': 0.069, 'max_samples': 0.5}. Best is trial 74 with value: -0.18167313469617832.
