[I 2025-04-16 00:10:58,724] Trial 1275 finished with value: -0.18773792040845855 and parameters: {'n_estimators': 355, 'min_samples_split': 173, 'max_features': 0.29000000000000004, 'min_samples_leaf': 8, 'criterion': 'absolute_error', 'max_depth': 20, 'min_weight_fraction_leaf': 0.01, 'max_leaf_nodes': 10, 'bootstrap': True, 'ccp_alpha': 0.038, 'max_samples': 0.5}. Best is trial 621 with value: -0.18112741123578058.
[I 2025-04-16 00:11:02,326] Trial 1276 finished with value: -0.18294353330095423 and parameters: {'n_estimators': 3284, 'min_samples_split': 19, 'max_features': 0.89, 'min_samples_leaf': 23, 'criterion': 'absolute_error', 'max_depth': 20, 'min_weight_fraction_leaf': 0.0, 'max_leaf_nodes': 10, 'bootstrap': True, 'ccp_alpha': 0.043000000000000003, 'max_samples': 0.5}. Best is trial 621 with value: -0.18112741123578058.
[I 2025-04-16 00:11:06,747] Trial 1277 finished with value: -0.1933380978910318 and parameters: {'n_estimators': 3935, 'min_samples_split': 41, 'max_features': 0.93, 'min_samples_leaf': 18, 'criterion': 'absolute_error', 'max_depth': 20, 'min_weight_fraction_leaf': 0.07, 'max_leaf_nodes': 50, 'bootstrap': True, 'ccp_alpha': 0.022, 'max_samples': 1.0}. Best is trial 621 with value: -0.18112741123578058.
[I 2025-04-16 00:11:09,700] Trial 1278 finished with value: -0.18383654451538733 and parameters: {'n_estimators': 2405, 'min_samples_split': 189, 'max_features': 0.9, 'min_samples_leaf': 4, 'criterion': 'absolute_error', 'max_depth': 20, 'min_weight_fraction_leaf': 0.02, 'max_leaf_nodes': 10, 'bootstrap': True, 'ccp_alpha': 0.01, 'max_samples': 0.5}. Best is trial 621 with value: -0.18112741123578058.
[I 2025-04-16 00:11:13,172] Trial 1279 finished with value: -0.18259800237028495 and parameters: {'n_estimators': 3118, 'min_samples_split': 181, 'max_features': 0.18000000000000002, 'min_samples_leaf': 16, 'criterion': 'absolute_error', 'max_depth': 60, 'min_weight_fraction_leaf': 0.03, 'max_leaf_nodes': None, 'bootstrap': True, 'ccp_alpha': 0.069, 'max_samples': 0.5}. Best is trial 621 with value: -0.18112741123578058.
[I 2025-04-16 00:11:16,354] Trial 1280 finished with value: -0.19071074909673755 and parameters: {'n_estimators': 2765, 'min_samples_split': 152, 'max_features': 0.87, 'min_samples_leaf': 1, 'criterion': 'absolute_error', 'max_depth': 5, 'min_weight_fraction_leaf': 0.02, 'max_leaf_nodes': 150, 'bootstrap': True, 'ccp_alpha': 0.063, 'max_samples': 0.75}. Best is trial 621 with value: -0.18112741123578058.
[I 2025-04-16 00:11:20,374] Trial 1281 finished with value: -0.18332901927642326 and parameters: {'n_estimators': 3516, 'min_samples_split': 164, 'max_features': 0.86, 'min_samples_leaf': 10, 'criterion': 'absolute_error', 'max_depth': 45, 'min_weight_fraction_leaf': 0.02, 'max_leaf_nodes': 50, 'bootstrap': True, 'ccp_alpha': 0.054, 'max_samples': 0.5}. Best is trial 621 with value: -0.18112741123578058.
[I 2025-04-16 00:11:23,966] Trial 1282 finished with value: -0.18252264530381224 and parameters: {'n_estimators': 2970, 'min_samples_split': 185, 'max_features': 0.89, 'min_samples_leaf': 6, 'criterion': 'absolute_error', 'max_depth': 20, 'min_weight_fraction_leaf': 0.01, 'max_leaf_nodes': 10, 'bootstrap': True, 'ccp_alpha': 0.073, 'max_samples': 0.5}. Best is trial 621 with value: -0.18112741123578058.
[I 2025-04-16 00:11:29,133] Trial 1283 finished with value: -0.1834348651842001 and parameters: {'n_estimators': 4499, 'min_samples_split': 193, 'max_features': 0.9500000000000001, 'min_samples_leaf': 10, 'criterion': 'absolute_error', 'max_depth': 20, 'min_weight_fraction_leaf': 0.01, 'max_leaf_nodes': 10, 'bootstrap': True, 'ccp_alpha': 0.07, 'max_samples': 0.5}. Best is trial 621 with value: -0.18112741123578058.
[I 2025-04-16 00:11:31,978] Trial 1284 finished with value: -18.164150088818744 and parameters: {'n_estimators': 2641, 'min_samples_split': 189, 'max_features': 0.91, 'min_samples_leaf': 6, 'criterion': 'friedman_mse', 'max_depth': 20, 'min_weight_fraction_leaf': 0.01, 'max_leaf_nodes': 10, 'bootstrap': True, 'ccp_alpha': 0.07200000000000001, 'max_samples': 0.5}. Best is trial 621 with value: -0.18112741123578058.
[I 2025-04-16 00:11:35,295] Trial 1285 finished with value: -0.18287851890909468 and parameters: {'n_estimators': 2836, 'min_samples_split': 185, 'max_features': 0.9400000000000001, 'min_samples_leaf': 8, 'criterion': 'absolute_error', 'max_depth': 20, 'min_weight_fraction_leaf': 0.01, 'max_leaf_nodes': 10, 'bootstrap': True, 'ccp_alpha': 0.063, 'max_samples': 0.5}. Best is trial 621 with value: -0.18112741123578058.
[I 2025-04-16 00:11:38,661] Trial 1286 finished with value: -0.18253519712919797 and parameters: {'n_estimators': 2957, 'min_samples_split': 183, 'max_features': 0.91, 'min_samples_leaf': 8, 'criterion': 'absolute_error', 'max_depth': 20, 'min_weight_fraction_leaf': 0.01, 'max_leaf_nodes': 10, 'bootstrap': True, 'ccp_alpha': 0.074, 'max_samples': 0.5}. Best is trial 621 with value: -0.18112741123578058.
[I 2025-04-16 00:11:40,055] Trial 1287 finished with value: -0.1936417107583833 and parameters: {'n_estimators': 1108, 'min_samples_split': 187, 'max_features': 0.89, 'min_samples_leaf': 4, 'criterion': 'absolute_error', 'max_depth': 20, 'min_weight_fraction_leaf': 0.01, 'max_leaf_nodes': 10, 'bootstrap': False, 'ccp_alpha': 0.062}. Best is trial 621 with value: -0.18112741123578058.
[I 2025-04-16 00:11:42,793] Trial 1288 finished with value: -0.1838851228789645 and parameters: {'n_estimators': 2229, 'min_samples_split': 178, 'max_features': 0.9600000000000001, 'min_samples_leaf': 17, 'criterion': 'absolute_error', 'max_depth': 20, 'min_weight_fraction_leaf': 0.01, 'max_leaf_nodes': 10, 'bootstrap': True, 'ccp_alpha': 0.067, 'max_samples': 0.5}. Best is trial 621 with value: -0.18112741123578058.
[I 2025-04-16 00:11:43,008] Trial 1289 finished with value: -17.452353649942246 and parameters: {'n_estimators': 2, 'min_samples_split': 192, 'max_features': 0.93, 'min_samples_leaf': 12, 'criterion': 'squared_error', 'max_depth': 20, 'min_weight_fraction_leaf': 0.01, 'max_leaf_nodes': 10, 'bootstrap': True, 'ccp_alpha': 0.076, 'max_samples': 0.5}. Best is trial 621 with value: -0.18112741123578058.
[I 2025-04-16 00:11:46,040] Trial 1290 finished with value: -0.18297882606083288 and parameters: {'n_estimators': 2573, 'min_samples_split': 187, 'max_features': 0.31, 'min_samples_leaf': 8, 'criterion': 'absolute_error', 'max_depth': 20, 'min_weight_fraction_leaf': 0.01, 'max_leaf_nodes': 10, 'bootstrap': True, 'ccp_alpha': 0.07, 'max_samples': 0.5}. Best is trial 621 with value: -0.18112741123578058.
[I 2025-04-16 00:11:46,424] Trial 1291 finished with value: -0.18392258592476596 and parameters: {'n_estimators': 149, 'min_samples_split': 194, 'max_features': 0.99, 'min_samples_leaf': 8, 'criterion': 'absolute_error', 'max_depth': 20, 'min_weight_fraction_leaf': 0.01, 'max_leaf_nodes': 10, 'bootstrap': True, 'ccp_alpha': 0.058, 'max_samples': 0.5}. Best is trial 621 with value: -0.18112741123578058.
[I 2025-04-16 00:11:50,144] Trial 1292 finished with value: -0.18258692360892073 and parameters: {'n_estimators': 3027, 'min_samples_split': 181, 'max_features': 0.7100000000000001, 'min_samples_leaf': 9, 'criterion': 'absolute_error', 'max_depth': 20, 'min_weight_fraction_leaf': 0.01, 'max_leaf_nodes': 10, 'bootstrap': True, 'ccp_alpha': 0.05, 'max_samples': 0.5}. Best is trial 621 with value: -0.18112741123578058.
[I 2025-04-16 00:11:53,405] Trial 1293 finished with value: -0.18271821107150243 and parameters: {'n_estimators': 2765, 'min_samples_split': 186, 'max_features': 0.9, 'min_samples_leaf': 21, 'criterion': 'absolute_error', 'max_depth': 20, 'min_weight_fraction_leaf': 0.01, 'max_leaf_nodes': 10, 'bootstrap': True, 'ccp_alpha': 0.067, 'max_samples': 0.5}. Best is trial 621 with value: -0.18112741123578058.
[I 2025-04-16 00:11:59,056] Trial 1294 finished with value: -0.18368424926063906 and parameters: {'n_estimators': 4818, 'min_samples_split': 183, 'max_features': 0.92, 'min_samples_leaf': 5, 'criterion': 'absolute_error', 'max_depth': 45, 'min_weight_fraction_leaf': 0.0, 'max_leaf_nodes': 10, 'bootstrap': True, 'ccp_alpha': 0.074, 'max_samples': 0.5}. Best is trial 621 with value: -0.18112741123578058.
[I 2025-04-16 00:12:02,732] Trial 1295 finished with value: -17.9457784480134 and parameters: {'n_estimators': 3233, 'min_samples_split': 178, 'max_features': 0.89, 'min_samples_leaf': 3, 'criterion': 'poisson', 'max_depth': 20, 'min_weight_fraction_leaf': 0.01, 'max_leaf_nodes': 10, 'bootstrap': True, 'ccp_alpha': 0.063, 'max_samples': 0.5}. Best is trial 621 with value: -0.18112741123578058.
[I 2025-04-16 00:12:05,628] Trial 1296 finished with value: -0.18319789852536167 and parameters: {'n_estimators': 2474, 'min_samples_split': 191, 'max_features': 0.23, 'min_samples_leaf': 11, 'criterion': 'absolute_error', 'max_depth': 20, 'min_weight_fraction_leaf': 0.01, 'max_leaf_nodes': 10, 'bootstrap': True, 'ccp_alpha': 0.078, 'max_samples': 0.5}. Best is trial 621 with value: -0.18112741123578058.
[I 2025-04-16 00:12:06,232] Trial 1297 finished with value: -0.18752742344437917 and parameters: {'n_estimators': 338, 'min_samples_split': 185, 'max_features': 0.2, 'min_samples_leaf': 22, 'criterion': 'absolute_error', 'max_depth': 20, 'min_weight_fraction_leaf': 0.01, 'max_leaf_nodes': 10, 'bootstrap': True, 'ccp_alpha': 0.058, 'max_samples': 0.5}. Best is trial 621 with value: -0.18112741123578058.
[I 2025-04-16 00:12:12,764] Trial 1298 finished with value: -0.19329954554542444 and parameters: {'n_estimators': 5763, 'min_samples_split': 181, 'max_features': 0.87, 'min_samples_leaf': 6, 'criterion': 'absolute_error', 'max_depth': 20, 'min_weight_fraction_leaf': 0.01, 'max_leaf_nodes': 10, 'bootstrap': True, 'ccp_alpha': 0.068, 'max_samples': None}. Best is trial 621 with value: -0.18112741123578058.
[I 2025-04-16 00:12:16,041] Trial 1299 finished with value: -0.1831016670202513 and parameters: {'n_estimators': 2913, 'min_samples_split': 188, 'max_features': 0.27, 'min_samples_leaf': 2, 'criterion': 'absolute_error', 'max_depth': 20, 'min_weight_fraction_leaf': 0.0, 'max_leaf_nodes': 10, 'bootstrap': True, 'ccp_alpha': 0.042, 'max_samples': 0.5}. Best is trial 621 with value: -0.18112741123578058.
[I 2025-04-16 00:12:16,885] Trial 1300 finished with value: -0.18723940801133301 and parameters: {'n_estimators': 578, 'min_samples_split': 178, 'max_features': 0.93, 'min_samples_leaf': 6, 'criterion': 'absolute_error', 'max_depth': 20, 'min_weight_fraction_leaf': 0.01, 'max_leaf_nodes': 10, 'bootstrap': True, 'ccp_alpha': 0.052000000000000005, 'max_samples': 0.5}. Best is trial 621 with value: -0.18112741123578058.
[I 2025-04-16 00:12:20,703] Trial 1301 finished with value: -0.1824939193065415 and parameters: {'n_estimators': 3082, 'min_samples_split': 195, 'max_features': 0.89, 'min_samples_leaf': 5, 'criterion': 'absolute_error', 'max_depth': 20, 'min_weight_fraction_leaf': 0.01, 'max_leaf_nodes': 10, 'bootstrap': True, 'ccp_alpha': 0.075, 'max_samples': 0.5}. Best is trial 621 with value: -0.18112741123578058.
[I 2025-04-16 00:12:24,515] Trial 1302 finished with value: -0.18298533020635208 and parameters: {'n_estimators': 3330, 'min_samples_split': 26, 'max_features': 0.33, 'min_samples_leaf': 9, 'criterion': 'absolute_error', 'max_depth': 20, 'min_weight_fraction_leaf': 0.0, 'max_leaf_nodes': 10, 'bootstrap': True, 'ccp_alpha': 0.033, 'max_samples': 0.5}. Best is trial 621 with value: -0.18112741123578058.
[I 2025-04-16 00:12:28,677] Trial 1303 finished with value: -0.19330242453946272 and parameters: {'n_estimators': 3516, 'min_samples_split': 196, 'max_features': 0.37, 'min_samples_leaf': 1, 'criterion': 'absolute_error', 'max_depth': 15, 'min_weight_fraction_leaf': 0.01, 'max_leaf_nodes': 20, 'bootstrap': True, 'ccp_alpha': 0.077, 'max_samples': 1.0}. Best is trial 621 with value: -0.18112741123578058.
[I 2025-04-16 00:12:32,400] Trial 1304 finished with value: -0.18264609666554174 and parameters: {'n_estimators': 3157, 'min_samples_split': 196, 'max_features': 0.88, 'min_samples_leaf': 22, 'criterion': 'absolute_error', 'max_depth': 45, 'min_weight_fraction_leaf': 0.0, 'max_leaf_nodes': 150, 'bootstrap': True, 'ccp_alpha': 0.08, 'max_samples': 0.5}. Best is trial 621 with value: -0.18112741123578058.
[I 2025-04-16 00:12:32,802] Trial 1305 finished with value: -0.1847465438557235 and parameters: {'n_estimators': 165, 'min_samples_split': 172, 'max_features': 0.91, 'min_samples_leaf': 4, 'criterion': 'absolute_error', 'max_depth': 10, 'min_weight_fraction_leaf': 0.01, 'max_leaf_nodes': 50, 'bootstrap': True, 'ccp_alpha': 0.068, 'max_samples': 0.5}. Best is trial 621 with value: -0.18112741123578058.
[I 2025-04-16 00:12:36,119] Trial 1306 finished with value: -17.985795861231953 and parameters: {'n_estimators': 3374, 'min_samples_split': 194, 'max_features': 0.9600000000000001, 'min_samples_leaf': 19, 'criterion': 'friedman_mse', 'max_depth': 20, 'min_weight_fraction_leaf': 0.01, 'max_leaf_nodes': 10, 'bootstrap': True, 'ccp_alpha': 0.062, 'max_samples': 0.75}. Best is trial 621 with value: -0.18112741123578058.
[I 2025-04-16 00:12:41,532] Trial 1307 finished with value: -0.1936417107583833 and parameters: {'n_estimators': 7007, 'min_samples_split': 113, 'max_features': 0.44, 'min_samples_leaf': 5, 'criterion': 'absolute_error', 'max_depth': None, 'min_weight_fraction_leaf': 0.01, 'max_leaf_nodes': None, 'bootstrap': False, 'ccp_alpha': 0.078}. Best is trial 621 with value: -0.18112741123578058.
[I 2025-04-16 00:12:46,082] Trial 1308 finished with value: -0.18350083654733065 and parameters: {'n_estimators': 3713, 'min_samples_split': 34, 'max_features': 0.52, 'min_samples_leaf': 4, 'criterion': 'absolute_error', 'max_depth': 60, 'min_weight_fraction_leaf': 0.0, 'max_leaf_nodes': 50, 'bootstrap': True, 'ccp_alpha': 0.056, 'max_samples': 0.5}. Best is trial 621 with value: -0.18112741123578058.
[I 2025-04-16 00:12:49,807] Trial 1309 finished with value: -0.18254041031959276 and parameters: {'n_estimators': 3098, 'min_samples_split': 197, 'max_features': 0.86, 'min_samples_leaf': 1, 'criterion': 'absolute_error', 'max_depth': 45, 'min_weight_fraction_leaf': 0.08, 'max_leaf_nodes': 150, 'bootstrap': True, 'ccp_alpha': 0.081, 'max_samples': 0.5}. Best is trial 621 with value: -0.18112741123578058.
[I 2025-04-16 00:12:52,919] Trial 1310 finished with value: -0.18271602480503074 and parameters: {'n_estimators': 2745, 'min_samples_split': 196, 'max_features': 0.91, 'min_samples_leaf': 20, 'criterion': 'absolute_error', 'max_depth': 45, 'min_weight_fraction_leaf': 0.04, 'max_leaf_nodes': 300, 'bootstrap': True, 'ccp_alpha': 0.047, 'max_samples': 0.5}. Best is trial 621 with value: -0.18112741123578058.
[I 2025-04-16 00:12:56,666] Trial 1311 finished with value: -0.18261927312875 and parameters: {'n_estimators': 3129, 'min_samples_split': 197, 'max_features': 0.35000000000000003, 'min_samples_leaf': 8, 'criterion': 'absolute_error', 'max_depth': 15, 'min_weight_fraction_leaf': 0.06, 'max_leaf_nodes': 10, 'bootstrap': True, 'ccp_alpha': 0.07, 'max_samples': 0.5}. Best is trial 621 with value: -0.18112741123578058.
[I 2025-04-16 00:12:57,713] Trial 1312 finished with value: -0.18629695344570302 and parameters: {'n_estimators': 757, 'min_samples_split': 191, 'max_features': 0.61, 'min_samples_leaf': 7, 'criterion': 'absolute_error', 'max_depth': 5, 'min_weight_fraction_leaf': 0.01, 'max_leaf_nodes': 150, 'bootstrap': True, 'ccp_alpha': 0.064, 'max_samples': 0.5}. Best is trial 621 with value: -0.18112741123578058.
[I 2025-04-16 00:12:58,422] Trial 1313 finished with value: -18.433708341517942 and parameters: {'n_estimators': 465, 'min_samples_split': 170, 'max_features': 0.9400000000000001, 'min_samples_leaf': 5, 'criterion': 'squared_error', 'max_depth': 20, 'min_weight_fraction_leaf': 0.01, 'max_leaf_nodes': 50, 'bootstrap': True, 'ccp_alpha': 0.075, 'max_samples': 0.5}. Best is trial 621 with value: -0.18112741123578058.
[I 2025-04-16 00:13:02,282] Trial 1314 finished with value: -0.1830063117755069 and parameters: {'n_estimators': 3338, 'min_samples_split': 125, 'max_features': 0.73, 'min_samples_leaf': 4, 'criterion': 'absolute_error', 'max_depth': 45, 'min_weight_fraction_leaf': 0.0, 'max_leaf_nodes': 10, 'bootstrap': True, 'ccp_alpha': 0.052000000000000005, 'max_samples': 0.5}. Best is trial 621 with value: -0.18112741123578058.
[I 2025-04-16 00:13:02,884] Trial 1315 finished with value: -0.18658729949137917 and parameters: {'n_estimators': 280, 'min_samples_split': 197, 'max_features': 0.29000000000000004, 'min_samples_leaf': 3, 'criterion': 'absolute_error', 'max_depth': 45, 'min_weight_fraction_leaf': 0.01, 'max_leaf_nodes': None, 'bootstrap': True, 'ccp_alpha': 0.06, 'max_samples': 0.5}. Best is trial 621 with value: -0.18112741123578058.
[I 2025-04-16 00:13:06,155] Trial 1316 finished with value: -0.18300548617949297 and parameters: {'n_estimators': 2881, 'min_samples_split': 200, 'max_features': 0.25, 'min_samples_leaf': 24, 'criterion': 'absolute_error', 'max_depth': None, 'min_weight_fraction_leaf': 0.06, 'max_leaf_nodes': 10, 'bootstrap': True, 'ccp_alpha': 0.083, 'max_samples': 0.5}. Best is trial 621 with value: -0.18112741123578058.
[I 2025-04-16 00:13:09,890] Trial 1317 finished with value: -0.18280009555566093 and parameters: {'n_estimators': 3231, 'min_samples_split': 174, 'max_features': 0.88, 'min_samples_leaf': 25, 'criterion': 'absolute_error', 'max_depth': 20, 'min_weight_fraction_leaf': 0.01, 'max_leaf_nodes': 150, 'bootstrap': True, 'ccp_alpha': 0.14, 'max_samples': 0.5}. Best is trial 621 with value: -0.18112741123578058.
[I 2025-04-16 00:13:13,635] Trial 1318 finished with value: -0.17780566891532262 and parameters: {'n_estimators': 3014, 'min_samples_split': 16, 'max_features': 0.89, 'min_samples_leaf': 7, 'criterion': 'absolute_error', 'max_depth': 60, 'min_weight_fraction_leaf': 0.01, 'max_leaf_nodes': 50, 'bootstrap': True, 'ccp_alpha': 0.016, 'max_samples': 0.5}. Best is trial 1318 with value: -0.17780566891532262.
[I 2025-04-16 00:13:17,268] Trial 1319 finished with value: -0.1826749852970439 and parameters: {'n_estimators': 3057, 'min_samples_split': 13, 'max_features': 0.93, 'min_samples_leaf': 8, 'criterion': 'absolute_error', 'max_depth': 60, 'min_weight_fraction_leaf': 0.01, 'max_leaf_nodes': 50, 'bootstrap': True, 'ccp_alpha': 0.035, 'max_samples': 0.5}. Best is trial 1318 with value: -0.17780566891532262.
[I 2025-04-16 00:13:21,388] Trial 1320 finished with value: -18.18601708070327 and parameters: {'n_estimators': 3312, 'min_samples_split': 12, 'max_features': 0.9, 'min_samples_leaf': 8, 'criterion': 'poisson', 'max_depth': 60, 'min_weight_fraction_leaf': 0.01, 'max_leaf_nodes': 10, 'bootstrap': True, 'ccp_alpha': 0.037, 'max_samples': 0.5}. Best is trial 1318 with value: -0.17780566891532262.
[I 2025-04-16 00:13:25,670] Trial 1321 finished with value: -0.17515426927922287 and parameters: {'n_estimators': 3616, 'min_samples_split': 9, 'max_features': 0.92, 'min_samples_leaf': 6, 'criterion': 'absolute_error', 'max_depth': 60, 'min_weight_fraction_leaf': 0.01, 'max_leaf_nodes': 150, 'bootstrap': True, 'ccp_alpha': 0.015, 'max_samples': 0.5}. Best is trial 1321 with value: -0.17515426927922287.
[I 2025-04-16 00:13:25,895] Trial 1322 finished with value: -0.1936300657214804 and parameters: {'n_estimators': 2, 'min_samples_split': 11, 'max_features': 0.97, 'min_samples_leaf': 6, 'criterion': 'absolute_error', 'max_depth': 60, 'min_weight_fraction_leaf': 0.01, 'max_leaf_nodes': 150, 'bootstrap': True, 'ccp_alpha': 0.024, 'max_samples': 0.5}. Best is trial 1321 with value: -0.17515426927922287.
[I 2025-04-16 00:13:30,635] Trial 1323 finished with value: -0.17400738352010361 and parameters: {'n_estimators': 3797, 'min_samples_split': 10, 'max_features': 0.9400000000000001, 'min_samples_leaf': 8, 'criterion': 'absolute_error', 'max_depth': 60, 'min_weight_fraction_leaf': 0.01, 'max_leaf_nodes': 150, 'bootstrap': True, 'ccp_alpha': 0.006, 'max_samples': 0.5}. Best is trial 1323 with value: -0.17400738352010361.
[I 2025-04-16 00:13:36,265] Trial 1324 finished with value: -0.17321795553875668 and parameters: {'n_estimators': 4563, 'min_samples_split': 16, 'max_features': 0.99, 'min_samples_leaf': 9, 'criterion': 'absolute_error', 'max_depth': 60, 'min_weight_fraction_leaf': 0.01, 'max_leaf_nodes': 150, 'bootstrap': True, 'ccp_alpha': 0.004, 'max_samples': 0.5}. Best is trial 1324 with value: -0.17321795553875668.
[I 2025-04-16 00:13:40,982] Trial 1325 finished with value: -0.17996657222436108 and parameters: {'n_estimators': 3872, 'min_samples_split': 11, 'max_features': 1.0, 'min_samples_leaf': 7, 'criterion': 'absolute_error', 'max_depth': 60, 'min_weight_fraction_leaf': 0.01, 'max_leaf_nodes': 150, 'bootstrap': True, 'ccp_alpha': 0.023, 'max_samples': 0.5}. Best is trial 1324 with value: -0.17321795553875668.
[I 2025-04-16 00:13:45,985] Trial 1326 finished with value: -0.19339349495110256 and parameters: {'n_estimators': 4244, 'min_samples_split': 4, 'max_features': 1.0, 'min_samples_leaf': 9, 'criterion': 'absolute_error', 'max_depth': 60, 'min_weight_fraction_leaf': 0.01, 'max_leaf_nodes': 150, 'bootstrap': True, 'ccp_alpha': 0.012, 'max_samples': None}. Best is trial 1324 with value: -0.17321795553875668.
[I 2025-04-16 00:13:50,277] Trial 1327 finished with value: -0.351867116034018 and parameters: {'n_estimators': 3594, 'min_samples_split': 5, 'max_features': 0.99, 'min_samples_leaf': 7, 'criterion': 'absolute_error', 'max_depth': 60, 'min_weight_fraction_leaf': 0.01, 'max_leaf_nodes': 150, 'bootstrap': True, 'ccp_alpha': 0.003, 'max_samples': 0.5}. Best is trial 1324 with value: -0.17321795553875668.
