[I 2025-04-16 00:30:11,332] Trial 1545 finished with value: -8.767080633695445 and parameters: {'n_estimators': 4349, 'min_samples_split': 16, 'max_features': 0.93, 'min_samples_leaf': 11, 'criterion': 'absolute_error', 'max_depth': 60, 'min_weight_fraction_leaf': 0.01, 'max_leaf_nodes': 150, 'bootstrap': False, 'ccp_alpha': 0.0}. Best is trial 1439 with value: -0.15896829431478016.
[I 2025-04-16 00:30:14,963] Trial 1546 finished with value: -0.1936417107583833 and parameters: {'n_estimators': 3730, 'min_samples_split': 13, 'max_features': 0.97, 'min_samples_leaf': 14, 'criterion': 'absolute_error', 'max_depth': 60, 'min_weight_fraction_leaf': 0.01, 'max_leaf_nodes': 150, 'bootstrap': False, 'ccp_alpha': 0.005}. Best is trial 1439 with value: -0.15896829431478016.
[I 2025-04-16 00:30:18,193] Trial 1547 finished with value: -0.1936417107583833 and parameters: {'n_estimators': 3938, 'min_samples_split': 11, 'max_features': 0.9600000000000001, 'min_samples_leaf': 11, 'criterion': 'absolute_error', 'max_depth': 60, 'min_weight_fraction_leaf': 0.01, 'max_leaf_nodes': 150, 'bootstrap': False, 'ccp_alpha': 0.012}. Best is trial 1439 with value: -0.15896829431478016.
[I 2025-04-16 00:30:22,679] Trial 1548 finished with value: -17.52898638227375 and parameters: {'n_estimators': 4180, 'min_samples_split': 19, 'max_features': 0.98, 'min_samples_leaf': 15, 'criterion': 'squared_error', 'max_depth': 60, 'min_weight_fraction_leaf': 0.01, 'max_leaf_nodes': 150, 'bootstrap': False, 'ccp_alpha': 0.006}. Best is trial 1439 with value: -0.15896829431478016.
[I 2025-04-16 00:30:25,970] Trial 1549 finished with value: -0.1590315457356529 and parameters: {'n_estimators': 4286, 'min_samples_split': 16, 'max_features': 0.93, 'min_samples_leaf': 13, 'criterion': 'absolute_error', 'max_depth': 60, 'min_weight_fraction_leaf': 0.01, 'max_leaf_nodes': 150, 'bootstrap': False, 'ccp_alpha': 0.0}. Best is trial 1439 with value: -0.15896829431478016.
[I 2025-04-16 00:30:29,361] Trial 1550 finished with value: -0.1936417107583833 and parameters: {'n_estimators': 4357, 'min_samples_split': 22, 'max_features': 0.93, 'min_samples_leaf': 18, 'criterion': 'absolute_error', 'max_depth': 60, 'min_weight_fraction_leaf': 0.01, 'max_leaf_nodes': 150, 'bootstrap': False, 'ccp_alpha': 0.011}. Best is trial 1439 with value: -0.15896829431478016.
[I 2025-04-16 00:30:32,828] Trial 1551 finished with value: -0.1936157491435136 and parameters: {'n_estimators': 4195, 'min_samples_split': 16, 'max_features': 0.93, 'min_samples_leaf': 16, 'criterion': 'absolute_error', 'max_depth': 60, 'min_weight_fraction_leaf': 0.01, 'max_leaf_nodes': 150, 'bootstrap': False, 'ccp_alpha': 0.0}. Best is trial 1439 with value: -0.15896829431478016.
[I 2025-04-16 00:30:36,387] Trial 1552 finished with value: -0.1936417107583833 and parameters: {'n_estimators': 4386, 'min_samples_split': 19, 'max_features': 0.93, 'min_samples_leaf': 13, 'criterion': 'absolute_error', 'max_depth': 60, 'min_weight_fraction_leaf': 0.01, 'max_leaf_nodes': 150, 'bootstrap': False, 'ccp_alpha': 0.006}. Best is trial 1439 with value: -0.15896829431478016.
[I 2025-04-16 00:30:39,723] Trial 1553 finished with value: -0.1936417107583833 and parameters: {'n_estimators': 4001, 'min_samples_split': 22, 'max_features': 0.9500000000000001, 'min_samples_leaf': 14, 'criterion': 'absolute_error', 'max_depth': 60, 'min_weight_fraction_leaf': 0.01, 'max_leaf_nodes': 150, 'bootstrap': False, 'ccp_alpha': 0.006}. Best is trial 1439 with value: -0.15896829431478016.
[I 2025-04-16 00:30:43,203] Trial 1554 finished with value: -38.18522823148067 and parameters: {'n_estimators': 4192, 'min_samples_split': 16, 'max_features': 0.9500000000000001, 'min_samples_leaf': 12, 'criterion': 'poisson', 'max_depth': 60, 'min_weight_fraction_leaf': 0.01, 'max_leaf_nodes': 150, 'bootstrap': False, 'ccp_alpha': 0.012}. Best is trial 1439 with value: -0.15896829431478016.
[I 2025-04-16 00:30:46,301] Trial 1555 finished with value: -0.19361576850503046 and parameters: {'n_estimators': 3763, 'min_samples_split': 15, 'max_features': 0.93, 'min_samples_leaf': 16, 'criterion': 'absolute_error', 'max_depth': 60, 'min_weight_fraction_leaf': 0.01, 'max_leaf_nodes': 150, 'bootstrap': False, 'ccp_alpha': 0.0}. Best is trial 1439 with value: -0.15896829431478016.
[I 2025-04-16 00:30:49,901] Trial 1556 finished with value: -0.1936417107583833 and parameters: {'n_estimators': 3967, 'min_samples_split': 22, 'max_features': 0.9500000000000001, 'min_samples_leaf': 13, 'criterion': 'absolute_error', 'max_depth': 60, 'min_weight_fraction_leaf': 0.01, 'max_leaf_nodes': 150, 'bootstrap': False, 'ccp_alpha': 0.006}. Best is trial 1439 with value: -0.15896829431478016.
[I 2025-04-16 00:30:53,217] Trial 1557 finished with value: -0.19364227232525716 and parameters: {'n_estimators': 4433, 'min_samples_split': 18, 'max_features': 0.93, 'min_samples_leaf': 18, 'criterion': 'absolute_error', 'max_depth': 60, 'min_weight_fraction_leaf': 0.01, 'max_leaf_nodes': 150, 'bootstrap': False, 'ccp_alpha': 0.0}. Best is trial 1439 with value: -0.15896829431478016.
[I 2025-04-16 00:30:56,606] Trial 1558 finished with value: -0.1936417107583833 and parameters: {'n_estimators': 4114, 'min_samples_split': 11, 'max_features': 0.9600000000000001, 'min_samples_leaf': 11, 'criterion': 'absolute_error', 'max_depth': 60, 'min_weight_fraction_leaf': 0.01, 'max_leaf_nodes': 150, 'bootstrap': False, 'ccp_alpha': 0.012}. Best is trial 1439 with value: -0.15896829431478016.
[I 2025-04-16 00:30:59,719] Trial 1559 finished with value: -0.1936417107583833 and parameters: {'n_estimators': 3770, 'min_samples_split': 14, 'max_features': 0.9500000000000001, 'min_samples_leaf': 15, 'criterion': 'absolute_error', 'max_depth': 60, 'min_weight_fraction_leaf': 0.01, 'max_leaf_nodes': 150, 'bootstrap': False, 'ccp_alpha': 0.006}. Best is trial 1439 with value: -0.15896829431478016.
[I 2025-04-16 00:31:03,192] Trial 1560 finished with value: -0.15899277536777603 and parameters: {'n_estimators': 3954, 'min_samples_split': 19, 'max_features': 0.93, 'min_samples_leaf': 13, 'criterion': 'absolute_error', 'max_depth': 60, 'min_weight_fraction_leaf': 0.01, 'max_leaf_nodes': 150, 'bootstrap': False, 'ccp_alpha': 0.0}. Best is trial 1439 with value: -0.15896829431478016.
[I 2025-04-16 00:31:06,380] Trial 1561 finished with value: -0.1936417107583833 and parameters: {'n_estimators': 3879, 'min_samples_split': 23, 'max_features': 0.93, 'min_samples_leaf': 14, 'criterion': 'absolute_error', 'max_depth': 60, 'min_weight_fraction_leaf': 0.01, 'max_leaf_nodes': 150, 'bootstrap': False, 'ccp_alpha': 0.011}. Best is trial 1439 with value: -0.15896829431478016.
[I 2025-04-16 00:31:10,188] Trial 1562 finished with value: -0.1936417107583833 and parameters: {'n_estimators': 4274, 'min_samples_split': 20, 'max_features': 0.93, 'min_samples_leaf': 16, 'criterion': 'absolute_error', 'max_depth': 60, 'min_weight_fraction_leaf': 0.01, 'max_leaf_nodes': 150, 'bootstrap': False, 'ccp_alpha': 0.005}. Best is trial 1439 with value: -0.15896829431478016.
[I 2025-04-16 00:31:13,899] Trial 1563 finished with value: -0.1936417107583833 and parameters: {'n_estimators': 4021, 'min_samples_split': 22, 'max_features': 0.93, 'min_samples_leaf': 13, 'criterion': 'absolute_error', 'max_depth': 60, 'min_weight_fraction_leaf': 0.01, 'max_leaf_nodes': 150, 'bootstrap': False, 'ccp_alpha': 0.006}. Best is trial 1439 with value: -0.15896829431478016.
[I 2025-04-16 00:31:17,134] Trial 1564 finished with value: -17.528986382274656 and parameters: {'n_estimators': 3745, 'min_samples_split': 19, 'max_features': 0.93, 'min_samples_leaf': 17, 'criterion': 'friedman_mse', 'max_depth': 60, 'min_weight_fraction_leaf': 0.01, 'max_leaf_nodes': 150, 'bootstrap': False, 'ccp_alpha': 0.012}. Best is trial 1439 with value: -0.15896829431478016.
[I 2025-04-16 00:31:20,581] Trial 1565 finished with value: -0.1936417107583833 and parameters: {'n_estimators': 4089, 'min_samples_split': 17, 'max_features': 0.9500000000000001, 'min_samples_leaf': 12, 'criterion': 'absolute_error', 'max_depth': 60, 'min_weight_fraction_leaf': 0.01, 'max_leaf_nodes': 150, 'bootstrap': False, 'ccp_alpha': 0.005}. Best is trial 1439 with value: -0.15896829431478016.
[I 2025-04-16 00:31:23,715] Trial 1566 finished with value: -0.1936249159172084 and parameters: {'n_estimators': 3899, 'min_samples_split': 18, 'max_features': 0.92, 'min_samples_leaf': 15, 'criterion': 'absolute_error', 'max_depth': 60, 'min_weight_fraction_leaf': 0.01, 'max_leaf_nodes': 150, 'bootstrap': False, 'ccp_alpha': 0.0}. Best is trial 1439 with value: -0.15896829431478016.
[I 2025-04-16 00:31:27,505] Trial 1567 finished with value: -8.769653148153699 and parameters: {'n_estimators': 4251, 'min_samples_split': 22, 'max_features': 0.9500000000000001, 'min_samples_leaf': 11, 'criterion': 'absolute_error', 'max_depth': 60, 'min_weight_fraction_leaf': 0.01, 'max_leaf_nodes': 150, 'bootstrap': False, 'ccp_alpha': 0.0}. Best is trial 1439 with value: -0.15896829431478016.
[I 2025-04-16 00:31:30,676] Trial 1568 finished with value: -0.1936417107583833 and parameters: {'n_estimators': 3701, 'min_samples_split': 15, 'max_features': 0.9500000000000001, 'min_samples_leaf': 18, 'criterion': 'absolute_error', 'max_depth': 60, 'min_weight_fraction_leaf': 0.01, 'max_leaf_nodes': 150, 'bootstrap': False, 'ccp_alpha': 0.012}. Best is trial 1439 with value: -0.15896829431478016.
[I 2025-04-16 00:31:34,849] Trial 1569 finished with value: -0.1936417107583833 and parameters: {'n_estimators': 4456, 'min_samples_split': 23, 'max_features': 0.92, 'min_samples_leaf': 13, 'criterion': 'absolute_error', 'max_depth': 60, 'min_weight_fraction_leaf': 0.01, 'max_leaf_nodes': 150, 'bootstrap': False, 'ccp_alpha': 0.007}. Best is trial 1439 with value: -0.15896829431478016.
[I 2025-04-16 00:31:38,357] Trial 1570 finished with value: -0.1936249176924132 and parameters: {'n_estimators': 3984, 'min_samples_split': 14, 'max_features': 0.9600000000000001, 'min_samples_leaf': 15, 'criterion': 'absolute_error', 'max_depth': 60, 'min_weight_fraction_leaf': 0.01, 'max_leaf_nodes': 150, 'bootstrap': False, 'ccp_alpha': 0.0}. Best is trial 1439 with value: -0.15896829431478016.
[I 2025-04-16 00:31:41,754] Trial 1571 finished with value: -0.1936417107583833 and parameters: {'n_estimators': 4109, 'min_samples_split': 18, 'max_features': 0.93, 'min_samples_leaf': 11, 'criterion': 'absolute_error', 'max_depth': 60, 'min_weight_fraction_leaf': 0.01, 'max_leaf_nodes': 150, 'bootstrap': False, 'ccp_alpha': 0.011}. Best is trial 1439 with value: -0.15896829431478016.
[I 2025-04-16 00:31:45,938] Trial 1572 finished with value: -0.1936417107583833 and parameters: {'n_estimators': 4294, 'min_samples_split': 13, 'max_features': 0.9600000000000001, 'min_samples_leaf': 13, 'criterion': 'absolute_error', 'max_depth': 60, 'min_weight_fraction_leaf': 0.01, 'max_leaf_nodes': 150, 'bootstrap': False, 'ccp_alpha': 0.006}. Best is trial 1439 with value: -0.15896829431478016.
[I 2025-04-16 00:31:48,775] Trial 1573 finished with value: -21.57404800177305 and parameters: {'n_estimators': 3738, 'min_samples_split': 18, 'max_features': 0.97, 'min_samples_leaf': 17, 'criterion': 'squared_error', 'max_depth': 60, 'min_weight_fraction_leaf': 0.01, 'max_leaf_nodes': 150, 'bootstrap': False, 'ccp_alpha': 0.0}. Best is trial 1439 with value: -0.15896829431478016.
[I 2025-04-16 00:31:52,438] Trial 1574 finished with value: -0.1936417107583833 and parameters: {'n_estimators': 3924, 'min_samples_split': 11, 'max_features': 0.93, 'min_samples_leaf': 15, 'criterion': 'absolute_error', 'max_depth': 60, 'min_weight_fraction_leaf': 0.01, 'max_leaf_nodes': 150, 'bootstrap': False, 'ccp_alpha': 0.006}. Best is trial 1439 with value: -0.15896829431478016.
[I 2025-04-16 00:31:56,469] Trial 1575 finished with value: -0.1936417107583833 and parameters: {'n_estimators': 4153, 'min_samples_split': 23, 'max_features': 0.9500000000000001, 'min_samples_leaf': 11, 'criterion': 'absolute_error', 'max_depth': 60, 'min_weight_fraction_leaf': 0.01, 'max_leaf_nodes': 150, 'bootstrap': False, 'ccp_alpha': 0.012}. Best is trial 1439 with value: -0.15896829431478016.
[I 2025-04-16 00:31:59,509] Trial 1576 finished with value: -0.15906123647126533 and parameters: {'n_estimators': 3740, 'min_samples_split': 14, 'max_features': 0.98, 'min_samples_leaf': 13, 'criterion': 'absolute_error', 'max_depth': 60, 'min_weight_fraction_leaf': 0.01, 'max_leaf_nodes': 150, 'bootstrap': False, 'ccp_alpha': 0.0}. Best is trial 1439 with value: -0.15896829431478016.
[I 2025-04-16 00:32:03,600] Trial 1577 finished with value: -0.1936417107583833 and parameters: {'n_estimators': 4403, 'min_samples_split': 11, 'max_features': 0.98, 'min_samples_leaf': 14, 'criterion': 'absolute_error', 'max_depth': 60, 'min_weight_fraction_leaf': 0.01, 'max_leaf_nodes': 150, 'bootstrap': False, 'ccp_alpha': 0.006}. Best is trial 1439 with value: -0.15896829431478016.
[I 2025-04-16 00:32:07,336] Trial 1578 finished with value: -38.149991967192854 and parameters: {'n_estimators': 4056, 'min_samples_split': 14, 'max_features': 0.98, 'min_samples_leaf': 12, 'criterion': 'poisson', 'max_depth': 60, 'min_weight_fraction_leaf': 0.01, 'max_leaf_nodes': 150, 'bootstrap': False, 'ccp_alpha': 0.012}. Best is trial 1439 with value: -0.15896829431478016.
[I 2025-04-16 00:32:10,436] Trial 1579 finished with value: -0.19364218624354393 and parameters: {'n_estimators': 3902, 'min_samples_split': 19, 'max_features': 0.98, 'min_samples_leaf': 17, 'criterion': 'absolute_error', 'max_depth': 60, 'min_weight_fraction_leaf': 0.01, 'max_leaf_nodes': 150, 'bootstrap': False, 'ccp_alpha': 0.0}. Best is trial 1439 with value: -0.15896829431478016.
[I 2025-04-16 00:32:14,134] Trial 1580 finished with value: -0.1936417107583833 and parameters: {'n_estimators': 3699, 'min_samples_split': 11, 'max_features': 0.9400000000000001, 'min_samples_leaf': 11, 'criterion': 'absolute_error', 'max_depth': 60, 'min_weight_fraction_leaf': 0.01, 'max_leaf_nodes': 150, 'bootstrap': False, 'ccp_alpha': 0.006}. Best is trial 1439 with value: -0.15896829431478016.
[I 2025-04-16 00:32:18,047] Trial 1581 finished with value: -0.1936417107583833 and parameters: {'n_estimators': 4303, 'min_samples_split': 23, 'max_features': 0.97, 'min_samples_leaf': 15, 'criterion': 'absolute_error', 'max_depth': 60, 'min_weight_fraction_leaf': 0.01, 'max_leaf_nodes': 150, 'bootstrap': False, 'ccp_alpha': 0.006}. Best is trial 1439 with value: -0.15896829431478016.
[I 2025-04-16 00:32:21,323] Trial 1582 finished with value: -0.1936417107583833 and parameters: {'n_estimators': 4122, 'min_samples_split': 15, 'max_features': 0.92, 'min_samples_leaf': 13, 'criterion': 'absolute_error', 'max_depth': 60, 'min_weight_fraction_leaf': 0.01, 'max_leaf_nodes': 150, 'bootstrap': False, 'ccp_alpha': 0.014}. Best is trial 1439 with value: -0.15896829431478016.
[I 2025-04-16 00:32:24,652] Trial 1583 finished with value: -8.741034068687107 and parameters: {'n_estimators': 3693, 'min_samples_split': 19, 'max_features': 0.9600000000000001, 'min_samples_leaf': 11, 'criterion': 'absolute_error', 'max_depth': 60, 'min_weight_fraction_leaf': 0.01, 'max_leaf_nodes': 150, 'bootstrap': False, 'ccp_alpha': 0.0}. Best is trial 1439 with value: -0.15896829431478016.
[I 2025-04-16 00:32:28,091] Trial 1584 finished with value: -0.1936417107583833 and parameters: {'n_estimators': 3932, 'min_samples_split': 10, 'max_features': 0.98, 'min_samples_leaf': 18, 'criterion': 'absolute_error', 'max_depth': 60, 'min_weight_fraction_leaf': 0.01, 'max_leaf_nodes': 150, 'bootstrap': False, 'ccp_alpha': 0.006}. Best is trial 1439 with value: -0.15896829431478016.
[I 2025-04-16 00:32:31,854] Trial 1585 finished with value: -0.1936417107583833 and parameters: {'n_estimators': 4423, 'min_samples_split': 14, 'max_features': 0.9400000000000001, 'min_samples_leaf': 15, 'criterion': 'absolute_error', 'max_depth': 60, 'min_weight_fraction_leaf': 0.01, 'max_leaf_nodes': 150, 'bootstrap': False, 'ccp_alpha': 0.012}. Best is trial 1439 with value: -0.15896829431478016.
[I 2025-04-16 00:32:35,427] Trial 1586 finished with value: -0.1936417107583833 and parameters: {'n_estimators': 4197, 'min_samples_split': 20, 'max_features': 0.9500000000000001, 'min_samples_leaf': 13, 'criterion': 'absolute_error', 'max_depth': 60, 'min_weight_fraction_leaf': 0.01, 'max_leaf_nodes': 150, 'bootstrap': False, 'ccp_alpha': 0.006}. Best is trial 1439 with value: -0.15896829431478016.
[I 2025-04-16 00:32:38,690] Trial 1587 finished with value: -31.39510414314003 and parameters: {'n_estimators': 3899, 'min_samples_split': 16, 'max_features': 0.92, 'min_samples_leaf': 16, 'criterion': 'friedman_mse', 'max_depth': 60, 'min_weight_fraction_leaf': 0.01, 'max_leaf_nodes': 150, 'bootstrap': False, 'ccp_alpha': 0.0}. Best is trial 1439 with value: -0.15896829431478016.
[I 2025-04-16 00:32:41,953] Trial 1588 finished with value: -0.1936417107583833 and parameters: {'n_estimators': 3729, 'min_samples_split': 24, 'max_features': 0.98, 'min_samples_leaf': 11, 'criterion': 'absolute_error', 'max_depth': 60, 'min_weight_fraction_leaf': 0.01, 'max_leaf_nodes': 150, 'bootstrap': False, 'ccp_alpha': 0.011}. Best is trial 1439 with value: -0.15896829431478016.
[I 2025-04-16 00:32:45,306] Trial 1589 finished with value: -0.1936212973645462 and parameters: {'n_estimators': 4086, 'min_samples_split': 11, 'max_features': 0.9600000000000001, 'min_samples_leaf': 14, 'criterion': 'absolute_error', 'max_depth': 60, 'min_weight_fraction_leaf': 0.01, 'max_leaf_nodes': 150, 'bootstrap': False, 'ccp_alpha': 0.0}. Best is trial 1439 with value: -0.15896829431478016.
[I 2025-04-16 00:32:49,379] Trial 1590 finished with value: -0.1936417107583833 and parameters: {'n_estimators': 4434, 'min_samples_split': 10, 'max_features': 0.9400000000000001, 'min_samples_leaf': 11, 'criterion': 'absolute_error', 'max_depth': 60, 'min_weight_fraction_leaf': 0.01, 'max_leaf_nodes': 150, 'bootstrap': False, 'ccp_alpha': 0.006}. Best is trial 1439 with value: -0.15896829431478016.
[I 2025-04-16 00:32:52,499] Trial 1591 finished with value: -0.1936417107583833 and parameters: {'n_estimators': 3958, 'min_samples_split': 16, 'max_features': 0.98, 'min_samples_leaf': 13, 'criterion': 'absolute_error', 'max_depth': 60, 'min_weight_fraction_leaf': 0.01, 'max_leaf_nodes': 150, 'bootstrap': False, 'ccp_alpha': 0.013000000000000001}. Best is trial 1439 with value: -0.15896829431478016.
[I 2025-04-16 00:32:56,009] Trial 1592 finished with value: -0.1936157537440455 and parameters: {'n_estimators': 4240, 'min_samples_split': 21, 'max_features': 0.9600000000000001, 'min_samples_leaf': 16, 'criterion': 'absolute_error', 'max_depth': 60, 'min_weight_fraction_leaf': 0.01, 'max_leaf_nodes': 150, 'bootstrap': False, 'ccp_alpha': 0.0}. Best is trial 1439 with value: -0.15896829431478016.
[I 2025-04-16 00:32:59,064] Trial 1593 finished with value: -0.1936417107583833 and parameters: {'n_estimators': 3893, 'min_samples_split': 14, 'max_features': 0.92, 'min_samples_leaf': 18, 'criterion': 'absolute_error', 'max_depth': 60, 'min_weight_fraction_leaf': 0.01, 'max_leaf_nodes': 150, 'bootstrap': False, 'ccp_alpha': 0.006}. Best is trial 1439 with value: -0.15896829431478016.
[I 2025-04-16 00:33:03,434] Trial 1594 finished with value: -0.1936417107583833 and parameters: {'n_estimators': 3712, 'min_samples_split': 19, 'max_features': 0.9400000000000001, 'min_samples_leaf': 14, 'criterion': 'absolute_error', 'max_depth': 60, 'min_weight_fraction_leaf': 0.01, 'max_leaf_nodes': 150, 'bootstrap': False, 'ccp_alpha': 0.01}. Best is trial 1439 with value: -0.15896829431478016.
[I 2025-04-16 00:33:06,868] Trial 1595 finished with value: -0.1936417107583833 and parameters: {'n_estimators': 4158, 'min_samples_split': 10, 'max_features': 0.98, 'min_samples_leaf': 11, 'criterion': 'absolute_error', 'max_depth': 60, 'min_weight_fraction_leaf': 0.01, 'max_leaf_nodes': 150, 'bootstrap': False, 'ccp_alpha': 0.005}. Best is trial 1439 with value: -0.15896829431478016.
[I 2025-04-16 00:33:10,380] Trial 1596 finished with value: -35.9031891977258 and parameters: {'n_estimators': 4294, 'min_samples_split': 24, 'max_features': 0.92, 'min_samples_leaf': 13, 'criterion': 'squared_error', 'max_depth': 60, 'min_weight_fraction_leaf': 0.01, 'max_leaf_nodes': 150, 'bootstrap': False, 'ccp_alpha': 0.0}. Best is trial 1439 with value: -0.15896829431478016.
[I 2025-04-16 00:33:13,408] Trial 1597 finished with value: -0.1936417107583833 and parameters: {'n_estimators': 3949, 'min_samples_split': 14, 'max_features': 0.9600000000000001, 'min_samples_leaf': 16, 'criterion': 'absolute_error', 'max_depth': 60, 'min_weight_fraction_leaf': 0.01, 'max_leaf_nodes': 150, 'bootstrap': False, 'ccp_alpha': 0.015}. Best is trial 1439 with value: -0.15896829431478016.
[I 2025-04-16 00:33:17,032] Trial 1598 finished with value: -0.1936417107583833 and parameters: {'n_estimators': 4467, 'min_samples_split': 18, 'max_features': 0.9400000000000001, 'min_samples_leaf': 11, 'criterion': 'absolute_error', 'max_depth': 60, 'min_weight_fraction_leaf': 0.01, 'max_leaf_nodes': 150, 'bootstrap': False, 'ccp_alpha': 0.005}. Best is trial 1439 with value: -0.15896829431478016.
[I 2025-04-16 00:33:20,388] Trial 1599 finished with value: -0.1936417107583833 and parameters: {'n_estimators': 4090, 'min_samples_split': 10, 'max_features': 0.99, 'min_samples_leaf': 14, 'criterion': 'absolute_error', 'max_depth': 60, 'min_weight_fraction_leaf': 0.01, 'max_leaf_nodes': 150, 'bootstrap': False, 'ccp_alpha': 0.01}. Best is trial 1439 with value: -0.15896829431478016.
