[I 2025-04-16 02:25:42,676] Trial 4798 finished with value: -0.1936417107583833 and parameters: {'n_estimators': 843, 'min_samples_split': 91, 'max_features': 0.74, 'min_samples_leaf': 3, 'criterion': 'absolute_error', 'max_depth': 15, 'min_weight_fraction_leaf': 0.0, 'max_leaf_nodes': 10, 'bootstrap': False, 'ccp_alpha': 0.0}. Best is trial 4539 with value: 0.19155472534689352.
[I 2025-04-16 02:25:43,842] Trial 4799 finished with value: -0.1936417107583833 and parameters: {'n_estimators': 689, 'min_samples_split': 9, 'max_features': 0.8400000000000001, 'min_samples_leaf': 5, 'criterion': 'absolute_error', 'max_depth': 15, 'min_weight_fraction_leaf': 0.0, 'max_leaf_nodes': 300, 'bootstrap': False, 'ccp_alpha': 0.01}. Best is trial 4539 with value: 0.19155472534689352.
[I 2025-04-16 02:25:44,622] Trial 4800 finished with value: -0.1936417107583833 and parameters: {'n_estimators': 188, 'min_samples_split': 2, 'max_features': 0.7000000000000001, 'min_samples_leaf': 1, 'criterion': 'absolute_error', 'max_depth': 15, 'min_weight_fraction_leaf': 0.0, 'max_leaf_nodes': 300, 'bootstrap': False, 'ccp_alpha': 0.027}. Best is trial 4539 with value: 0.19155472534689352.
[I 2025-04-16 02:25:45,567] Trial 4801 finished with value: 0.014946756733223588 and parameters: {'n_estimators': 414, 'min_samples_split': 6, 'max_features': 0.76, 'min_samples_leaf': 3, 'criterion': 'absolute_error', 'max_depth': 15, 'min_weight_fraction_leaf': 0.0, 'max_leaf_nodes': None, 'bootstrap': False, 'ccp_alpha': 0.005}. Best is trial 4539 with value: 0.19155472534689352.
[I 2025-04-16 02:25:46,704] Trial 4802 finished with value: -0.1936417107583833 and parameters: {'n_estimators': 637, 'min_samples_split': 14, 'max_features': 0.47000000000000003, 'min_samples_leaf': 7, 'criterion': 'absolute_error', 'max_depth': 15, 'min_weight_fraction_leaf': 0.0, 'max_leaf_nodes': 300, 'bootstrap': False, 'ccp_alpha': 0.015}. Best is trial 4539 with value: 0.19155472534689352.
[I 2025-04-16 02:25:48,156] Trial 4803 finished with value: -0.1936417107583833 and parameters: {'n_estimators': 962, 'min_samples_split': 6, 'max_features': 0.79, 'min_samples_leaf': 1, 'criterion': 'absolute_error', 'max_depth': None, 'min_weight_fraction_leaf': 0.0, 'max_leaf_nodes': 300, 'bootstrap': False, 'ccp_alpha': 0.246}. Best is trial 4539 with value: 0.19155472534689352.
[I 2025-04-16 02:25:49,020] Trial 4804 finished with value: -0.1936417107583833 and parameters: {'n_estimators': 319, 'min_samples_split': 2, 'max_features': 0.73, 'min_samples_leaf': 80, 'criterion': 'absolute_error', 'max_depth': 15, 'min_weight_fraction_leaf': 0.09, 'max_leaf_nodes': 10, 'bootstrap': False, 'ccp_alpha': 0.0}. Best is trial 4539 with value: 0.19155472534689352.
[I 2025-04-16 02:25:49,775] Trial 4805 finished with value: -0.1936417107583833 and parameters: {'n_estimators': 160, 'min_samples_split': 9, 'max_features': 0.8300000000000001, 'min_samples_leaf': 5, 'criterion': 'absolute_error', 'max_depth': 15, 'min_weight_fraction_leaf': 0.0, 'max_leaf_nodes': 300, 'bootstrap': False, 'ccp_alpha': 0.01}. Best is trial 4539 with value: 0.19155472534689352.
[I 2025-04-16 02:25:50,799] Trial 4806 finished with value: -0.05240699017139501 and parameters: {'n_estimators': 490, 'min_samples_split': 5, 'max_features': 0.68, 'min_samples_leaf': 3, 'criterion': 'absolute_error', 'max_depth': 15, 'min_weight_fraction_leaf': 0.0, 'max_leaf_nodes': 300, 'bootstrap': False, 'ccp_alpha': 0.005}. Best is trial 4539 with value: 0.19155472534689352.
[I 2025-04-16 02:25:52,094] Trial 4807 finished with value: -17.52898638227512 and parameters: {'n_estimators': 803, 'min_samples_split': 11, 'max_features': 0.77, 'min_samples_leaf': 1, 'criterion': 'friedman_mse', 'max_depth': 15, 'min_weight_fraction_leaf': 0.0, 'max_leaf_nodes': 300, 'bootstrap': False, 'ccp_alpha': 0.216}. Best is trial 4539 with value: 0.19155472534689352.
[I 2025-04-16 02:25:53,767] Trial 4808 finished with value: -0.1936417107583833 and parameters: {'n_estimators': 1281, 'min_samples_split': 2, 'max_features': 0.72, 'min_samples_leaf': 3, 'criterion': 'absolute_error', 'max_depth': 15, 'min_weight_fraction_leaf': 0.0, 'max_leaf_nodes': 300, 'bootstrap': False, 'ccp_alpha': 0.018000000000000002}. Best is trial 4539 with value: 0.19155472534689352.
[I 2025-04-16 02:25:54,893] Trial 4809 finished with value: -0.1936417107583833 and parameters: {'n_estimators': 617, 'min_samples_split': 9, 'max_features': 0.75, 'min_samples_leaf': 5, 'criterion': 'absolute_error', 'max_depth': None, 'min_weight_fraction_leaf': 0.0, 'max_leaf_nodes': 10, 'bootstrap': False, 'ccp_alpha': 0.013000000000000001}. Best is trial 4539 with value: 0.19155472534689352.
[I 2025-04-16 02:25:55,748] Trial 4810 finished with value: -11.333758315498809 and parameters: {'n_estimators': 321, 'min_samples_split': 14, 'max_features': 0.8, 'min_samples_leaf': 1, 'criterion': 'absolute_error', 'max_depth': 15, 'min_weight_fraction_leaf': 0.0, 'max_leaf_nodes': None, 'bootstrap': False, 'ccp_alpha': 0.0}. Best is trial 4539 with value: 0.19155472534689352.
[I 2025-04-16 02:25:57,175] Trial 4811 finished with value: -0.05326406777574486 and parameters: {'n_estimators': 878, 'min_samples_split': 6, 'max_features': 0.5700000000000001, 'min_samples_leaf': 3, 'criterion': 'absolute_error', 'max_depth': 15, 'min_weight_fraction_leaf': 0.0, 'max_leaf_nodes': 300, 'bootstrap': False, 'ccp_alpha': 0.006}. Best is trial 4539 with value: 0.19155472534689352.
[I 2025-04-16 02:25:58,215] Trial 4812 finished with value: -0.1936417107583833 and parameters: {'n_estimators': 500, 'min_samples_split': 2, 'max_features': 0.8200000000000001, 'min_samples_leaf': 7, 'criterion': 'absolute_error', 'max_depth': 15, 'min_weight_fraction_leaf': 0.0, 'max_leaf_nodes': 300, 'bootstrap': False, 'ccp_alpha': 0.022}. Best is trial 4539 with value: 0.19155472534689352.
[I 2025-04-16 02:25:58,962] Trial 4813 finished with value: -0.1936417107583833 and parameters: {'n_estimators': 140, 'min_samples_split': 6, 'max_features': 0.7100000000000001, 'min_samples_leaf': 4, 'criterion': 'absolute_error', 'max_depth': 15, 'min_weight_fraction_leaf': 0.07, 'max_leaf_nodes': 300, 'bootstrap': False, 'ccp_alpha': 0.01}. Best is trial 4539 with value: 0.19155472534689352.
[I 2025-04-16 02:26:00,585] Trial 4814 finished with value: -17.528986382275868 and parameters: {'n_estimators': 1118, 'min_samples_split': 9, 'max_features': 0.78, 'min_samples_leaf': 1, 'criterion': 'squared_error', 'max_depth': 15, 'min_weight_fraction_leaf': 0.0, 'max_leaf_nodes': 300, 'bootstrap': False, 'ccp_alpha': 0.006}. Best is trial 4539 with value: 0.19155472534689352.
[I 2025-04-16 02:26:01,742] Trial 4815 finished with value: -13.978037858063828 and parameters: {'n_estimators': 725, 'min_samples_split': 2, 'max_features': 0.75, 'min_samples_leaf': 3, 'criterion': 'absolute_error', 'max_depth': 45, 'min_weight_fraction_leaf': 0.0, 'max_leaf_nodes': 10, 'bootstrap': False, 'ccp_alpha': 0.0}. Best is trial 4539 with value: 0.19155472534689352.
[I 2025-04-16 02:26:06,849] Trial 4816 finished with value: -0.1936417107583833 and parameters: {'n_estimators': 6033, 'min_samples_split': 6, 'max_features': 0.8, 'min_samples_leaf': 94, 'criterion': 'absolute_error', 'max_depth': 15, 'min_weight_fraction_leaf': 0.0, 'max_leaf_nodes': 300, 'bootstrap': False, 'ccp_alpha': 0.018000000000000002}. Best is trial 4539 with value: 0.19155472534689352.
[I 2025-04-16 02:26:07,866] Trial 4817 finished with value: -0.1936417107583833 and parameters: {'n_estimators': 448, 'min_samples_split': 14, 'max_features': 0.74, 'min_samples_leaf': 5, 'criterion': 'absolute_error', 'max_depth': None, 'min_weight_fraction_leaf': 0.0, 'max_leaf_nodes': 300, 'bootstrap': False, 'ccp_alpha': 0.011}. Best is trial 4539 with value: 0.19155472534689352.
[I 2025-04-16 02:26:09,285] Trial 4818 finished with value: -0.17236638998634732 and parameters: {'n_estimators': 956, 'min_samples_split': 9, 'max_features': 0.6900000000000001, 'min_samples_leaf': 1, 'criterion': 'absolute_error', 'max_depth': 20, 'min_weight_fraction_leaf': 0.0, 'max_leaf_nodes': 300, 'bootstrap': False, 'ccp_alpha': 0.005}. Best is trial 4539 with value: 0.19155472534689352.
[I 2025-04-16 02:26:10,167] Trial 4819 finished with value: -0.1936417107583833 and parameters: {'n_estimators': 335, 'min_samples_split': 5, 'max_features': 0.8400000000000001, 'min_samples_leaf': 3, 'criterion': 'absolute_error', 'max_depth': 15, 'min_weight_fraction_leaf': 0.0, 'max_leaf_nodes': None, 'bootstrap': False, 'ccp_alpha': 0.014}. Best is trial 4539 with value: 0.19155472534689352.
[I 2025-04-16 02:26:10,795] Trial 4820 finished with value: -17.528986382275022 and parameters: {'n_estimators': 9, 'min_samples_split': 82, 'max_features': 0.78, 'min_samples_leaf': 1, 'criterion': 'poisson', 'max_depth': 15, 'min_weight_fraction_leaf': 0.0, 'max_leaf_nodes': 300, 'bootstrap': False, 'ccp_alpha': 0.0}. Best is trial 4539 with value: 0.19155472534689352.
[I 2025-04-16 02:26:11,934] Trial 4821 finished with value: -0.1936417107583833 and parameters: {'n_estimators': 644, 'min_samples_split': 2, 'max_features': 0.72, 'min_samples_leaf': 6, 'criterion': 'absolute_error', 'max_depth': 15, 'min_weight_fraction_leaf': 0.0, 'max_leaf_nodes': 10, 'bootstrap': False, 'ccp_alpha': 0.01}. Best is trial 4539 with value: 0.19155472534689352.
[I 2025-04-16 02:26:12,715] Trial 4822 finished with value: -0.11527067911970745 and parameters: {'n_estimators': 172, 'min_samples_split': 12, 'max_features': 0.8200000000000001, 'min_samples_leaf': 3, 'criterion': 'absolute_error', 'max_depth': 15, 'min_weight_fraction_leaf': 0.0, 'max_leaf_nodes': 300, 'bootstrap': False, 'ccp_alpha': 0.005}. Best is trial 4539 with value: 0.19155472534689352.
[I 2025-04-16 02:26:13,327] Trial 4823 finished with value: -0.1936417107583833 and parameters: {'n_estimators': 2, 'min_samples_split': 6, 'max_features': 0.76, 'min_samples_leaf': 1, 'criterion': 'absolute_error', 'max_depth': 15, 'min_weight_fraction_leaf': 0.0, 'max_leaf_nodes': 300, 'bootstrap': False, 'ccp_alpha': 0.016}. Best is trial 4539 with value: 0.19155472534689352.
[I 2025-04-16 02:26:14,616] Trial 4824 finished with value: -0.1936417107583833 and parameters: {'n_estimators': 797, 'min_samples_split': 9, 'max_features': 0.73, 'min_samples_leaf': 5, 'criterion': 'absolute_error', 'max_depth': 10, 'min_weight_fraction_leaf': 0.0, 'max_leaf_nodes': 300, 'bootstrap': False, 'ccp_alpha': 0.006}. Best is trial 4539 with value: 0.19155472534689352.
[I 2025-04-16 02:26:15,631] Trial 4825 finished with value: -0.1936417107583833 and parameters: {'n_estimators': 490, 'min_samples_split': 2, 'max_features': 0.8, 'min_samples_leaf': 3, 'criterion': 'absolute_error', 'max_depth': None, 'min_weight_fraction_leaf': 0.0, 'max_leaf_nodes': 300, 'bootstrap': False, 'ccp_alpha': 0.026000000000000002}. Best is trial 4539 with value: 0.19155472534689352.
[I 2025-04-16 02:26:17,195] Trial 4826 finished with value: -0.1936417107583833 and parameters: {'n_estimators': 1136, 'min_samples_split': 6, 'max_features': 0.63, 'min_samples_leaf': 1, 'criterion': 'absolute_error', 'max_depth': 15, 'min_weight_fraction_leaf': 0.0, 'max_leaf_nodes': 10, 'bootstrap': False, 'ccp_alpha': 0.125}. Best is trial 4539 with value: 0.19155472534689352.
[I 2025-04-16 02:26:18,326] Trial 4827 finished with value: -0.1936417107583833 and parameters: {'n_estimators': 566, 'min_samples_split': 11, 'max_features': 0.77, 'min_samples_leaf': 7, 'criterion': 'absolute_error', 'max_depth': 15, 'min_weight_fraction_leaf': 0.0, 'max_leaf_nodes': 300, 'bootstrap': False, 'ccp_alpha': 0.01}. Best is trial 4539 with value: 0.19155472534689352.
[I 2025-04-16 02:26:19,613] Trial 4828 finished with value: -10.668576118542372 and parameters: {'n_estimators': 921, 'min_samples_split': 2, 'max_features': 0.7000000000000001, 'min_samples_leaf': 4, 'criterion': 'absolute_error', 'max_depth': 15, 'min_weight_fraction_leaf': 0.0, 'max_leaf_nodes': None, 'bootstrap': False, 'ccp_alpha': 0.0}. Best is trial 4539 with value: 0.19155472534689352.
[I 2025-04-16 02:26:20,510] Trial 4829 finished with value: -17.52898638227488 and parameters: {'n_estimators': 334, 'min_samples_split': 15, 'max_features': 0.8400000000000001, 'min_samples_leaf': 3, 'criterion': 'friedman_mse', 'max_depth': 15, 'min_weight_fraction_leaf': 0.0, 'max_leaf_nodes': 300, 'bootstrap': False, 'ccp_alpha': 0.016}. Best is trial 4539 with value: 0.19155472534689352.
[I 2025-04-16 02:26:21,708] Trial 4830 finished with value: -0.04452928913999181 and parameters: {'n_estimators': 706, 'min_samples_split': 6, 'max_features': 0.67, 'min_samples_leaf': 1, 'criterion': 'absolute_error', 'max_depth': 15, 'min_weight_fraction_leaf': 0.0, 'max_leaf_nodes': 300, 'bootstrap': False, 'ccp_alpha': 0.006}. Best is trial 4539 with value: 0.19155472534689352.
[I 2025-04-16 02:26:22,586] Trial 4831 finished with value: -0.1936417107583833 and parameters: {'n_estimators': 302, 'min_samples_split': 6, 'max_features': 0.73, 'min_samples_leaf': 5, 'criterion': 'absolute_error', 'max_depth': 15, 'min_weight_fraction_leaf': 0.0, 'max_leaf_nodes': 300, 'bootstrap': False, 'ccp_alpha': 0.01}. Best is trial 4539 with value: 0.19155472534689352.
[I 2025-04-16 02:26:23,675] Trial 4832 finished with value: -0.1936417107583833 and parameters: {'n_estimators': 599, 'min_samples_split': 9, 'max_features': 0.81, 'min_samples_leaf': 3, 'criterion': 'absolute_error', 'max_depth': 15, 'min_weight_fraction_leaf': 0.0, 'max_leaf_nodes': 10, 'bootstrap': False, 'ccp_alpha': 0.02}. Best is trial 4539 with value: 0.19155472534689352.
[I 2025-04-16 02:26:25,152] Trial 4833 finished with value: 0.040108204083450394 and parameters: {'n_estimators': 983, 'min_samples_split': 2, 'max_features': 0.78, 'min_samples_leaf': 1, 'criterion': 'absolute_error', 'max_depth': None, 'min_weight_fraction_leaf': 0.0, 'max_leaf_nodes': 300, 'bootstrap': False, 'ccp_alpha': 0.005}. Best is trial 4539 with value: 0.19155472534689352.
[I 2025-04-16 02:26:25,895] Trial 4834 finished with value: -0.1936417107583833 and parameters: {'n_estimators': 180, 'min_samples_split': 11, 'max_features': 0.75, 'min_samples_leaf': 7, 'criterion': 'absolute_error', 'max_depth': 15, 'min_weight_fraction_leaf': 0.0, 'max_leaf_nodes': 300, 'bootstrap': False, 'ccp_alpha': 0.013000000000000001}. Best is trial 4539 with value: 0.19155472534689352.
[I 2025-04-16 02:26:27,498] Trial 4835 finished with value: -14.3055133542021 and parameters: {'n_estimators': 1280, 'min_samples_split': 6, 'max_features': 0.7100000000000001, 'min_samples_leaf': 3, 'criterion': 'absolute_error', 'max_depth': 15, 'min_weight_fraction_leaf': 0.0, 'max_leaf_nodes': 300, 'bootstrap': False, 'ccp_alpha': 0.0}. Best is trial 4539 with value: 0.19155472534689352.
[I 2025-04-16 02:26:28,471] Trial 4836 finished with value: -0.1936417107583833 and parameters: {'n_estimators': 445, 'min_samples_split': 2, 'max_features': 0.8200000000000001, 'min_samples_leaf': 5, 'criterion': 'absolute_error', 'max_depth': 15, 'min_weight_fraction_leaf': 0.0, 'max_leaf_nodes': None, 'bootstrap': False, 'ccp_alpha': 0.006}. Best is trial 4539 with value: 0.19155472534689352.
[I 2025-04-16 02:26:29,654] Trial 4837 finished with value: -8.593599559931185 and parameters: {'n_estimators': 794, 'min_samples_split': 15, 'max_features': 0.76, 'min_samples_leaf': 1, 'criterion': 'absolute_error', 'max_depth': 15, 'min_weight_fraction_leaf': 0.0, 'max_leaf_nodes': 300, 'bootstrap': False, 'ccp_alpha': 0.0}. Best is trial 4539 with value: 0.19155472534689352.
[I 2025-04-16 02:26:30,278] Trial 4838 finished with value: -17.528986382275015 and parameters: {'n_estimators': 2, 'min_samples_split': 9, 'max_features': 0.8, 'min_samples_leaf': 3, 'criterion': 'squared_error', 'max_depth': 15, 'min_weight_fraction_leaf': 0.03, 'max_leaf_nodes': 10, 'bootstrap': False, 'ccp_alpha': 0.01}. Best is trial 4539 with value: 0.19155472534689352.
[I 2025-04-16 02:26:31,455] Trial 4839 finished with value: -0.1936417107583833 and parameters: {'n_estimators': 637, 'min_samples_split': 5, 'max_features': 0.6900000000000001, 'min_samples_leaf': 1, 'criterion': 'absolute_error', 'max_depth': None, 'min_weight_fraction_leaf': 0.0, 'max_leaf_nodes': 300, 'bootstrap': False, 'ccp_alpha': 0.022}. Best is trial 4539 with value: 0.19155472534689352.
[I 2025-04-16 02:26:32,430] Trial 4840 finished with value: -0.1936417107583833 and parameters: {'n_estimators': 409, 'min_samples_split': 2, 'max_features': 0.73, 'min_samples_leaf': 5, 'criterion': 'absolute_error', 'max_depth': 15, 'min_weight_fraction_leaf': 0.0, 'max_leaf_nodes': 300, 'bootstrap': False, 'ccp_alpha': 0.013000000000000001}. Best is trial 4539 with value: 0.19155472534689352.
[I 2025-04-16 02:26:33,707] Trial 4841 finished with value: -0.24983478409158497 and parameters: {'n_estimators': 842, 'min_samples_split': 9, 'max_features': 0.79, 'min_samples_leaf': 3, 'criterion': 'absolute_error', 'max_depth': 15, 'min_weight_fraction_leaf': 0.0, 'max_leaf_nodes': 300, 'bootstrap': False, 'ccp_alpha': 0.005}. Best is trial 4539 with value: 0.19155472534689352.
[I 2025-04-16 02:26:34,534] Trial 4842 finished with value: -0.1936417107583833 and parameters: {'n_estimators': 247, 'min_samples_split': 6, 'max_features': 0.8400000000000001, 'min_samples_leaf': 1, 'criterion': 'absolute_error', 'max_depth': 20, 'min_weight_fraction_leaf': 0.0, 'max_leaf_nodes': 300, 'bootstrap': False, 'ccp_alpha': 0.017}. Best is trial 4539 with value: 0.19155472534689352.
[I 2025-04-16 02:26:35,586] Trial 4843 finished with value: -0.02668410865026476 and parameters: {'n_estimators': 512, 'min_samples_split': 2, 'max_features': 0.53, 'min_samples_leaf': 7, 'criterion': 'absolute_error', 'max_depth': 15, 'min_weight_fraction_leaf': 0.0, 'max_leaf_nodes': 10, 'bootstrap': False, 'ccp_alpha': 0.005}. Best is trial 4539 with value: 0.19155472534689352.
[I 2025-04-16 02:26:37,012] Trial 4844 finished with value: -9.248029901853982 and parameters: {'n_estimators': 1054, 'min_samples_split': 12, 'max_features': 0.74, 'min_samples_leaf': 4, 'criterion': 'absolute_error', 'max_depth': 15, 'min_weight_fraction_leaf': 0.0, 'max_leaf_nodes': 300, 'bootstrap': False, 'ccp_alpha': 0.0}. Best is trial 4539 with value: 0.19155472534689352.
[I 2025-04-16 02:26:38,327] Trial 4845 finished with value: -0.1936417107583833 and parameters: {'n_estimators': 748, 'min_samples_split': 6, 'max_features': 0.77, 'min_samples_leaf': 1, 'criterion': 'absolute_error', 'max_depth': 15, 'min_weight_fraction_leaf': 0.0, 'max_leaf_nodes': 300, 'bootstrap': False, 'ccp_alpha': 0.157}. Best is trial 4539 with value: 0.19155472534689352.
[I 2025-04-16 02:26:39,249] Trial 4846 finished with value: -0.1936417107583833 and parameters: {'n_estimators': 310, 'min_samples_split': 9, 'max_features': 0.75, 'min_samples_leaf': 3, 'criterion': 'absolute_error', 'max_depth': None, 'min_weight_fraction_leaf': 0.0, 'max_leaf_nodes': None, 'bootstrap': False, 'ccp_alpha': 0.012}. Best is trial 4539 with value: 0.19155472534689352.
[I 2025-04-16 02:26:40,345] Trial 4847 finished with value: -16.15209839212318 and parameters: {'n_estimators': 555, 'min_samples_split': 2, 'max_features': 0.72, 'min_samples_leaf': 5, 'criterion': 'poisson', 'max_depth': 15, 'min_weight_fraction_leaf': 0.0, 'max_leaf_nodes': 300, 'bootstrap': False, 'ccp_alpha': 0.01}. Best is trial 4539 with value: 0.19155472534689352.
[I 2025-04-16 02:26:41,119] Trial 4848 finished with value: -0.1936417107583833 and parameters: {'n_estimators': 162, 'min_samples_split': 15, 'max_features': 0.8200000000000001, 'min_samples_leaf': 1, 'criterion': 'absolute_error', 'max_depth': 15, 'min_weight_fraction_leaf': 0.0, 'max_leaf_nodes': 10, 'bootstrap': False, 'ccp_alpha': 0.006}. Best is trial 4539 with value: 0.19155472534689352.
[I 2025-04-16 02:26:42,603] Trial 4849 finished with value: -0.1936417107583833 and parameters: {'n_estimators': 958, 'min_samples_split': 6, 'max_features': 0.77, 'min_samples_leaf': 40, 'criterion': 'absolute_error', 'max_depth': 15, 'min_weight_fraction_leaf': 0.0, 'max_leaf_nodes': 300, 'bootstrap': False, 'ccp_alpha': 0.033}. Best is trial 4539 with value: 0.19155472534689352.
[I 2025-04-16 02:26:44,237] Trial 4850 finished with value: -9.558529774564686 and parameters: {'n_estimators': 1307, 'min_samples_split': 11, 'max_features': 0.79, 'min_samples_leaf': 3, 'criterion': 'absolute_error', 'max_depth': 45, 'min_weight_fraction_leaf': 0.0, 'max_leaf_nodes': 300, 'bootstrap': False, 'ccp_alpha': 0.0}. Best is trial 4539 with value: 0.19155472534689352.
[I 2025-04-16 02:26:45,479] Trial 4851 finished with value: -0.1936417107583833 and parameters: {'n_estimators': 696, 'min_samples_split': 5, 'max_features': 0.7100000000000001, 'min_samples_leaf': 5, 'criterion': 'absolute_error', 'max_depth': 15, 'min_weight_fraction_leaf': 0.0, 'max_leaf_nodes': 300, 'bootstrap': False, 'ccp_alpha': 0.017}. Best is trial 4539 with value: 0.19155472534689352.
[I 2025-04-16 02:26:46,411] Trial 4852 finished with value: -0.1936417107583833 and parameters: {'n_estimators': 373, 'min_samples_split': 2, 'max_features': 0.81, 'min_samples_leaf': 3, 'criterion': 'absolute_error', 'max_depth': 10, 'min_weight_fraction_leaf': 0.05, 'max_leaf_nodes': 300, 'bootstrap': False, 'ccp_alpha': 0.023}. Best is trial 4539 with value: 0.19155472534689352.
[I 2025-04-16 02:26:47,443] Trial 4853 finished with value: -0.1936417107583833 and parameters: {'n_estimators': 488, 'min_samples_split': 68, 'max_features': 0.8400000000000001, 'min_samples_leaf': 7, 'criterion': 'absolute_error', 'max_depth': 15, 'min_weight_fraction_leaf': 0.0, 'max_leaf_nodes': 10, 'bootstrap': False, 'ccp_alpha': 0.006}. Best is trial 4539 with value: 0.19155472534689352.
