[I 2025-04-16 02:17:46,937] Trial 4460 finished with value: -0.1936417107583833 and parameters: {'n_estimators': 922, 'min_samples_split': 9, 'max_features': 0.8400000000000001, 'min_samples_leaf': 4, 'criterion': 'absolute_error', 'max_depth': 15, 'min_weight_fraction_leaf': 0.0, 'max_leaf_nodes': None, 'bootstrap': False, 'ccp_alpha': 0.006}. Best is trial 4065 with value: 0.057524275121161005.
[I 2025-04-16 02:17:47,871] Trial 4461 finished with value: -50.38531220562759 and parameters: {'n_estimators': 420, 'min_samples_split': 2, 'max_features': 0.8200000000000001, 'min_samples_leaf': 1, 'criterion': 'absolute_error', 'max_depth': 10, 'min_weight_fraction_leaf': 0.0, 'max_leaf_nodes': None, 'bootstrap': False, 'ccp_alpha': 0.0}. Best is trial 4065 with value: 0.057524275121161005.
[I 2025-04-16 02:17:49,488] Trial 4462 finished with value: -0.1936417107583833 and parameters: {'n_estimators': 1223, 'min_samples_split': 6, 'max_features': 0.79, 'min_samples_leaf': 3, 'criterion': 'absolute_error', 'max_depth': 15, 'min_weight_fraction_leaf': 0.0, 'max_leaf_nodes': None, 'bootstrap': False, 'ccp_alpha': 0.018000000000000002}. Best is trial 4065 with value: 0.057524275121161005.
[I 2025-04-16 02:17:50,600] Trial 4463 finished with value: -0.1936417107583833 and parameters: {'n_estimators': 652, 'min_samples_split': 138, 'max_features': 0.81, 'min_samples_leaf': 6, 'criterion': 'absolute_error', 'max_depth': 15, 'min_weight_fraction_leaf': 0.0, 'max_leaf_nodes': None, 'bootstrap': False, 'ccp_alpha': 0.01}. Best is trial 4065 with value: 0.057524275121161005.
[I 2025-04-16 02:17:51,864] Trial 4464 finished with value: -0.1936417107583833 and parameters: {'n_estimators': 850, 'min_samples_split': 56, 'max_features': 0.8400000000000001, 'min_samples_leaf': 1, 'criterion': 'absolute_error', 'max_depth': 15, 'min_weight_fraction_leaf': 0.0, 'max_leaf_nodes': None, 'bootstrap': False, 'ccp_alpha': 0.29}. Best is trial 4065 with value: 0.057524275121161005.
[I 2025-04-16 02:17:52,745] Trial 4465 finished with value: -7.839618458152083 and parameters: {'n_estimators': 405, 'min_samples_split': 13, 'max_features': 0.8, 'min_samples_leaf': 4, 'criterion': 'absolute_error', 'max_depth': 15, 'min_weight_fraction_leaf': 0.0, 'max_leaf_nodes': None, 'bootstrap': False, 'ccp_alpha': 0.0}. Best is trial 4065 with value: 0.057524275121161005.
[I 2025-04-16 02:17:53,929] Trial 4466 finished with value: -0.1936417107583833 and parameters: {'n_estimators': 628, 'min_samples_split': 5, 'max_features': 0.8200000000000001, 'min_samples_leaf': 3, 'criterion': 'absolute_error', 'max_depth': 15, 'min_weight_fraction_leaf': 0.0, 'max_leaf_nodes': None, 'bootstrap': False, 'ccp_alpha': 0.014}. Best is trial 4065 with value: 0.057524275121161005.
[I 2025-04-16 02:17:55,393] Trial 4467 finished with value: -0.1936417107583833 and parameters: {'n_estimators': 1022, 'min_samples_split': 9, 'max_features': 0.8400000000000001, 'min_samples_leaf': 1, 'criterion': 'absolute_error', 'max_depth': 15, 'min_weight_fraction_leaf': 0.0, 'max_leaf_nodes': 10, 'bootstrap': False, 'ccp_alpha': 0.006}. Best is trial 4065 with value: 0.057524275121161005.
[I 2025-04-16 02:17:56,213] Trial 4468 finished with value: -17.52898638227488 and parameters: {'n_estimators': 338, 'min_samples_split': 74, 'max_features': 0.79, 'min_samples_leaf': 5, 'criterion': 'friedman_mse', 'max_depth': 15, 'min_weight_fraction_leaf': 0.0, 'max_leaf_nodes': None, 'bootstrap': False, 'ccp_alpha': 0.227}. Best is trial 4065 with value: 0.057524275121161005.
[I 2025-04-16 02:17:57,274] Trial 4469 finished with value: -0.1936417107583833 and parameters: {'n_estimators': 570, 'min_samples_split': 2, 'max_features': 0.8, 'min_samples_leaf': 59, 'criterion': 'absolute_error', 'max_depth': 15, 'min_weight_fraction_leaf': 0.0, 'max_leaf_nodes': None, 'bootstrap': False, 'ccp_alpha': 0.023}. Best is trial 4065 with value: 0.057524275121161005.
[I 2025-04-16 02:17:58,497] Trial 4470 finished with value: -0.1936417107583833 and parameters: {'n_estimators': 775, 'min_samples_split': 6, 'max_features': 0.8200000000000001, 'min_samples_leaf': 3, 'criterion': 'absolute_error', 'max_depth': 15, 'min_weight_fraction_leaf': 0.0, 'max_leaf_nodes': None, 'bootstrap': False, 'ccp_alpha': 0.009000000000000001}. Best is trial 4065 with value: 0.057524275121161005.
[I 2025-04-16 02:17:59,362] Trial 4471 finished with value: -13.669739685030843 and parameters: {'n_estimators': 339, 'min_samples_split': 9, 'max_features': 0.79, 'min_samples_leaf': 1, 'criterion': 'absolute_error', 'max_depth': 15, 'min_weight_fraction_leaf': 0.0, 'max_leaf_nodes': None, 'bootstrap': False, 'ccp_alpha': 0.0}. Best is trial 4065 with value: 0.057524275121161005.
[I 2025-04-16 02:18:00,402] Trial 4472 finished with value: -0.1936417107583833 and parameters: {'n_estimators': 535, 'min_samples_split': 2, 'max_features': 0.8200000000000001, 'min_samples_leaf': 6, 'criterion': 'absolute_error', 'max_depth': 15, 'min_weight_fraction_leaf': 0.0, 'max_leaf_nodes': None, 'bootstrap': False, 'ccp_alpha': 0.015}. Best is trial 4065 with value: 0.057524275121161005.
[I 2025-04-16 02:18:01,763] Trial 4473 finished with value: -0.04690592639931614 and parameters: {'n_estimators': 949, 'min_samples_split': 13, 'max_features': 0.8400000000000001, 'min_samples_leaf': 3, 'criterion': 'absolute_error', 'max_depth': 15, 'min_weight_fraction_leaf': 0.0, 'max_leaf_nodes': 50, 'bootstrap': False, 'ccp_alpha': 0.005}. Best is trial 4065 with value: 0.057524275121161005.
[I 2025-04-16 02:18:03,000] Trial 4474 finished with value: -0.1936417107583833 and parameters: {'n_estimators': 727, 'min_samples_split': 6, 'max_features': 0.51, 'min_samples_leaf': 1, 'criterion': 'absolute_error', 'max_depth': 15, 'min_weight_fraction_leaf': 0.05, 'max_leaf_nodes': None, 'bootstrap': False, 'ccp_alpha': 0.01}. Best is trial 4065 with value: 0.057524275121161005.
[I 2025-04-16 02:18:03,878] Trial 4475 finished with value: -0.1936417107583833 and parameters: {'n_estimators': 352, 'min_samples_split': 5, 'max_features': 0.79, 'min_samples_leaf': 5, 'criterion': 'absolute_error', 'max_depth': 15, 'min_weight_fraction_leaf': 0.0, 'max_leaf_nodes': None, 'bootstrap': False, 'ccp_alpha': 0.019}. Best is trial 4065 with value: 0.057524275121161005.
[I 2025-04-16 02:18:05,398] Trial 4476 finished with value: -0.09398608558785448 and parameters: {'n_estimators': 1206, 'min_samples_split': 9, 'max_features': 0.8400000000000001, 'min_samples_leaf': 3, 'criterion': 'absolute_error', 'max_depth': 20, 'min_weight_fraction_leaf': 0.0, 'max_leaf_nodes': None, 'bootstrap': False, 'ccp_alpha': 0.005}. Best is trial 4065 with value: 0.057524275121161005.
[I 2025-04-16 02:18:06,384] Trial 4477 finished with value: -17.528986382274873 and parameters: {'n_estimators': 482, 'min_samples_split': 2, 'max_features': 0.81, 'min_samples_leaf': 1, 'criterion': 'squared_error', 'max_depth': 15, 'min_weight_fraction_leaf': 0.0, 'max_leaf_nodes': None, 'bootstrap': False, 'ccp_alpha': 0.15}. Best is trial 4065 with value: 0.057524275121161005.
[I 2025-04-16 02:18:07,602] Trial 4478 finished with value: -0.1936417107583833 and parameters: {'n_estimators': 767, 'min_samples_split': 64, 'max_features': 0.79, 'min_samples_leaf': 3, 'criterion': 'absolute_error', 'max_depth': 15, 'min_weight_fraction_leaf': 0.0, 'max_leaf_nodes': None, 'bootstrap': False, 'ccp_alpha': 0.013000000000000001}. Best is trial 4065 with value: 0.057524275121161005.
[I 2025-04-16 02:18:08,487] Trial 4479 finished with value: -0.1399232511054178 and parameters: {'n_estimators': 324, 'min_samples_split': 12, 'max_features': 0.78, 'min_samples_leaf': 5, 'criterion': 'absolute_error', 'max_depth': 15, 'min_weight_fraction_leaf': 0.0, 'max_leaf_nodes': None, 'bootstrap': False, 'ccp_alpha': 0.005}. Best is trial 4065 with value: 0.057524275121161005.
[I 2025-04-16 02:18:09,543] Trial 4480 finished with value: -0.1936417107583833 and parameters: {'n_estimators': 537, 'min_samples_split': 5, 'max_features': 0.8, 'min_samples_leaf': 1, 'criterion': 'absolute_error', 'max_depth': 45, 'min_weight_fraction_leaf': 0.0, 'max_leaf_nodes': 50, 'bootstrap': False, 'ccp_alpha': 0.171}. Best is trial 4065 with value: 0.057524275121161005.
[I 2025-04-16 02:18:10,866] Trial 4481 finished with value: -12.436843134902372 and parameters: {'n_estimators': 1027, 'min_samples_split': 9, 'max_features': 0.8200000000000001, 'min_samples_leaf': 3, 'criterion': 'absolute_error', 'max_depth': 15, 'min_weight_fraction_leaf': 0.0, 'max_leaf_nodes': None, 'bootstrap': False, 'ccp_alpha': 0.0}. Best is trial 4065 with value: 0.057524275121161005.
[I 2025-04-16 02:18:11,676] Trial 4482 finished with value: -0.1936417107583833 and parameters: {'n_estimators': 270, 'min_samples_split': 2, 'max_features': 0.8400000000000001, 'min_samples_leaf': 6, 'criterion': 'absolute_error', 'max_depth': 15, 'min_weight_fraction_leaf': 0.0, 'max_leaf_nodes': None, 'bootstrap': False, 'ccp_alpha': 0.01}. Best is trial 4065 with value: 0.057524275121161005.
[I 2025-04-16 02:18:12,777] Trial 4483 finished with value: -22.922551868747362 and parameters: {'n_estimators': 663, 'min_samples_split': 6, 'max_features': 0.8200000000000001, 'min_samples_leaf': 1, 'criterion': 'poisson', 'max_depth': 15, 'min_weight_fraction_leaf': 0.08, 'max_leaf_nodes': None, 'bootstrap': False, 'ccp_alpha': 0.017}. Best is trial 4065 with value: 0.057524275121161005.
[I 2025-04-16 02:18:14,103] Trial 4484 finished with value: -0.1936417107583833 and parameters: {'n_estimators': 870, 'min_samples_split': 45, 'max_features': 0.78, 'min_samples_leaf': 4, 'criterion': 'absolute_error', 'max_depth': 15, 'min_weight_fraction_leaf': 0.0, 'max_leaf_nodes': None, 'bootstrap': False, 'ccp_alpha': 0.029}. Best is trial 4065 with value: 0.057524275121161005.
[I 2025-04-16 02:18:15,138] Trial 4485 finished with value: -16.14421942519524 and parameters: {'n_estimators': 546, 'min_samples_split': 13, 'max_features': 0.81, 'min_samples_leaf': 3, 'criterion': 'absolute_error', 'max_depth': 10, 'min_weight_fraction_leaf': 0.0, 'max_leaf_nodes': None, 'bootstrap': False, 'ccp_alpha': 0.0}. Best is trial 4065 with value: 0.057524275121161005.
[I 2025-04-16 02:18:15,864] Trial 4486 finished with value: -0.1936417107583833 and parameters: {'n_estimators': 194, 'min_samples_split': 2, 'max_features': 0.8400000000000001, 'min_samples_leaf': 1, 'criterion': 'absolute_error', 'max_depth': 15, 'min_weight_fraction_leaf': 0.06, 'max_leaf_nodes': None, 'bootstrap': False, 'ccp_alpha': 0.01}. Best is trial 4065 with value: 0.057524275121161005.
[I 2025-04-16 02:18:16,801] Trial 4487 finished with value: -0.13019336039350227 and parameters: {'n_estimators': 405, 'min_samples_split': 9, 'max_features': 0.8200000000000001, 'min_samples_leaf': 6, 'criterion': 'absolute_error', 'max_depth': 15, 'min_weight_fraction_leaf': 0.0, 'max_leaf_nodes': None, 'bootstrap': False, 'ccp_alpha': 0.005}. Best is trial 4065 with value: 0.057524275121161005.
[I 2025-04-16 02:18:18,017] Trial 4488 finished with value: -0.1936417107583833 and parameters: {'n_estimators': 681, 'min_samples_split': 6, 'max_features': 0.78, 'min_samples_leaf': 3, 'criterion': 'absolute_error', 'max_depth': 15, 'min_weight_fraction_leaf': 0.0, 'max_leaf_nodes': 50, 'bootstrap': False, 'ccp_alpha': 0.022}. Best is trial 4065 with value: 0.057524275121161005.
[I 2025-04-16 02:18:18,865] Trial 4489 finished with value: -0.1936417107583833 and parameters: {'n_estimators': 326, 'min_samples_split': 5, 'max_features': 0.8, 'min_samples_leaf': 1, 'criterion': 'absolute_error', 'max_depth': 15, 'min_weight_fraction_leaf': 0.0, 'max_leaf_nodes': 300, 'bootstrap': False, 'ccp_alpha': 0.014}. Best is trial 4065 with value: 0.057524275121161005.
[I 2025-04-16 02:18:20,222] Trial 4490 finished with value: -0.1936417107583833 and parameters: {'n_estimators': 885, 'min_samples_split': 2, 'max_features': 0.78, 'min_samples_leaf': 4, 'criterion': 'absolute_error', 'max_depth': 15, 'min_weight_fraction_leaf': 0.0, 'max_leaf_nodes': 10, 'bootstrap': False, 'ccp_alpha': 0.009000000000000001}. Best is trial 4065 with value: 0.057524275121161005.
[I 2025-04-16 02:18:21,231] Trial 4491 finished with value: -0.10253941576994405 and parameters: {'n_estimators': 487, 'min_samples_split': 9, 'max_features': 0.8200000000000001, 'min_samples_leaf': 1, 'criterion': 'absolute_error', 'max_depth': 15, 'min_weight_fraction_leaf': 0.0, 'max_leaf_nodes': None, 'bootstrap': False, 'ccp_alpha': 0.005}. Best is trial 4065 with value: 0.057524275121161005.
[I 2025-04-16 02:18:21,809] Trial 4492 finished with value: -0.1936417107583833 and parameters: {'n_estimators': 1, 'min_samples_split': 13, 'max_features': 0.8, 'min_samples_leaf': 5, 'criterion': 'absolute_error', 'max_depth': 15, 'min_weight_fraction_leaf': 0.0, 'max_leaf_nodes': None, 'bootstrap': False, 'ccp_alpha': 0.016}. Best is trial 4065 with value: 0.057524275121161005.
[I 2025-04-16 02:18:23,028] Trial 4493 finished with value: -17.528986382274862 and parameters: {'n_estimators': 671, 'min_samples_split': 6, 'max_features': 0.8400000000000001, 'min_samples_leaf': 3, 'criterion': 'friedman_mse', 'max_depth': 15, 'min_weight_fraction_leaf': 0.0, 'max_leaf_nodes': None, 'bootstrap': False, 'ccp_alpha': 0.01}. Best is trial 4065 with value: 0.057524275121161005.
[I 2025-04-16 02:18:28,464] Trial 4494 finished with value: -0.1936417107583833 and parameters: {'n_estimators': 6687, 'min_samples_split': 2, 'max_features': 0.78, 'min_samples_leaf': 67, 'criterion': 'absolute_error', 'max_depth': 15, 'min_weight_fraction_leaf': 0.0, 'max_leaf_nodes': None, 'bootstrap': False, 'ccp_alpha': 0.0}. Best is trial 4065 with value: 0.057524275121161005.
[I 2025-04-16 02:18:34,572] Trial 4495 finished with value: -0.1936417107583833 and parameters: {'n_estimators': 6353, 'min_samples_split': 9, 'max_features': 0.8, 'min_samples_leaf': 1, 'criterion': 'absolute_error', 'max_depth': 15, 'min_weight_fraction_leaf': 0.0, 'max_leaf_nodes': 50, 'bootstrap': False, 'ccp_alpha': 0.006}. Best is trial 4065 with value: 0.057524275121161005.
[I 2025-04-16 02:18:35,324] Trial 4496 finished with value: -0.1936417107583833 and parameters: {'n_estimators': 180, 'min_samples_split': 6, 'max_features': 0.8400000000000001, 'min_samples_leaf': 6, 'criterion': 'absolute_error', 'max_depth': 15, 'min_weight_fraction_leaf': 0.04, 'max_leaf_nodes': None, 'bootstrap': False, 'ccp_alpha': 0.018000000000000002}. Best is trial 4065 with value: 0.057524275121161005.
[I 2025-04-16 02:18:36,942] Trial 4497 finished with value: -0.1936417107583833 and parameters: {'n_estimators': 1142, 'min_samples_split': 13, 'max_features': 0.77, 'min_samples_leaf': 3, 'criterion': 'absolute_error', 'max_depth': 15, 'min_weight_fraction_leaf': 0.0, 'max_leaf_nodes': None, 'bootstrap': False, 'ccp_alpha': 0.013000000000000001}. Best is trial 4065 with value: 0.057524275121161005.
[I 2025-04-16 02:18:37,927] Trial 4498 finished with value: -0.1936417107583833 and parameters: {'n_estimators': 468, 'min_samples_split': 2, 'max_features': 0.8200000000000001, 'min_samples_leaf': 42, 'criterion': 'absolute_error', 'max_depth': 15, 'min_weight_fraction_leaf': 0.0, 'max_leaf_nodes': 10, 'bootstrap': False, 'ccp_alpha': 0.0}. Best is trial 4065 with value: 0.057524275121161005.
[I 2025-04-16 02:18:39,321] Trial 4499 finished with value: -0.1936417107583833 and parameters: {'n_estimators': 860, 'min_samples_split': 107, 'max_features': 0.78, 'min_samples_leaf': 3, 'criterion': 'absolute_error', 'max_depth': 15, 'min_weight_fraction_leaf': 0.0, 'max_leaf_nodes': None, 'bootstrap': False, 'ccp_alpha': 0.025}. Best is trial 4065 with value: 0.057524275121161005.
[I 2025-04-16 02:18:40,174] Trial 4500 finished with value: -0.09734764803811417 and parameters: {'n_estimators': 290, 'min_samples_split': 9, 'max_features': 0.81, 'min_samples_leaf': 1, 'criterion': 'absolute_error', 'max_depth': 20, 'min_weight_fraction_leaf': 0.0, 'max_leaf_nodes': None, 'bootstrap': False, 'ccp_alpha': 0.005}. Best is trial 4065 with value: 0.057524275121161005.
[I 2025-04-16 02:18:41,337] Trial 4501 finished with value: -0.1936417107583833 and parameters: {'n_estimators': 570, 'min_samples_split': 6, 'max_features': 0.8400000000000001, 'min_samples_leaf': 4, 'criterion': 'absolute_error', 'max_depth': 45, 'min_weight_fraction_leaf': 0.0, 'max_leaf_nodes': None, 'bootstrap': False, 'ccp_alpha': 0.01}. Best is trial 4065 with value: 0.057524275121161005.
[I 2025-04-16 02:18:42,072] Trial 4502 finished with value: -17.5289863822749 and parameters: {'n_estimators': 195, 'min_samples_split': 2, 'max_features': 0.79, 'min_samples_leaf': 6, 'criterion': 'squared_error', 'max_depth': 15, 'min_weight_fraction_leaf': 0.0, 'max_leaf_nodes': None, 'bootstrap': False, 'ccp_alpha': 0.014}. Best is trial 4065 with value: 0.057524275121161005.
[I 2025-04-16 02:18:43,339] Trial 4503 finished with value: -0.06046271340514449 and parameters: {'n_estimators': 728, 'min_samples_split': 9, 'max_features': 0.8400000000000001, 'min_samples_leaf': 1, 'criterion': 'absolute_error', 'max_depth': 15, 'min_weight_fraction_leaf': 0.0, 'max_leaf_nodes': None, 'bootstrap': False, 'ccp_alpha': 0.005}. Best is trial 4065 with value: 0.057524275121161005.
[I 2025-04-16 02:18:44,853] Trial 4504 finished with value: -12.491084451879349 and parameters: {'n_estimators': 1007, 'min_samples_split': 5, 'max_features': 0.78, 'min_samples_leaf': 3, 'criterion': 'absolute_error', 'max_depth': 15, 'min_weight_fraction_leaf': 0.0, 'max_leaf_nodes': None, 'bootstrap': False, 'ccp_alpha': 0.0}. Best is trial 4065 with value: 0.057524275121161005.
[I 2025-04-16 02:18:45,851] Trial 4505 finished with value: -0.1936417107583833 and parameters: {'n_estimators': 400, 'min_samples_split': 12, 'max_features': 0.8200000000000001, 'min_samples_leaf': 5, 'criterion': 'absolute_error', 'max_depth': 15, 'min_weight_fraction_leaf': 0.0, 'max_leaf_nodes': None, 'bootstrap': False, 'ccp_alpha': 0.021}. Best is trial 4065 with value: 0.057524275121161005.
[I 2025-04-16 02:18:46,670] Trial 4506 finished with value: 0.0029179874702902177 and parameters: {'n_estimators': 176, 'min_samples_split': 2, 'max_features': 0.77, 'min_samples_leaf': 1, 'criterion': 'absolute_error', 'max_depth': 15, 'min_weight_fraction_leaf': 0.0, 'max_leaf_nodes': None, 'bootstrap': False, 'ccp_alpha': 0.006}. Best is trial 4065 with value: 0.057524275121161005.
[I 2025-04-16 02:18:47,859] Trial 4507 finished with value: -14.85036433499279 and parameters: {'n_estimators': 621, 'min_samples_split': 6, 'max_features': 0.09, 'min_samples_leaf': 3, 'criterion': 'poisson', 'max_depth': 10, 'min_weight_fraction_leaf': 0.0, 'max_leaf_nodes': None, 'bootstrap': False, 'ccp_alpha': 0.01}. Best is trial 4065 with value: 0.057524275121161005.
[I 2025-04-16 02:18:48,828] Trial 4508 finished with value: -0.1936417107583833 and parameters: {'n_estimators': 409, 'min_samples_split': 9, 'max_features': 0.8, 'min_samples_leaf': 1, 'criterion': 'absolute_error', 'max_depth': 15, 'min_weight_fraction_leaf': 0.0, 'max_leaf_nodes': None, 'bootstrap': False, 'ccp_alpha': 0.016}. Best is trial 4065 with value: 0.057524275121161005.
[I 2025-04-16 02:18:50,435] Trial 4509 finished with value: -0.09414633984944946 and parameters: {'n_estimators': 1199, 'min_samples_split': 13, 'max_features': 0.8400000000000001, 'min_samples_leaf': 5, 'criterion': 'absolute_error', 'max_depth': 15, 'min_weight_fraction_leaf': 0.0, 'max_leaf_nodes': None, 'bootstrap': False, 'ccp_alpha': 0.005}. Best is trial 4065 with value: 0.057524275121161005.
[I 2025-04-16 02:18:51,611] Trial 4510 finished with value: -0.1936417107583833 and parameters: {'n_estimators': 748, 'min_samples_split': 5, 'max_features': 0.77, 'min_samples_leaf': 3, 'criterion': 'absolute_error', 'max_depth': 15, 'min_weight_fraction_leaf': 0.0, 'max_leaf_nodes': None, 'bootstrap': False, 'ccp_alpha': 0.038}. Best is trial 4065 with value: 0.057524275121161005.
[I 2025-04-16 02:18:52,432] Trial 4511 finished with value: -17.599292321153676 and parameters: {'n_estimators': 305, 'min_samples_split': 6, 'max_features': 0.8200000000000001, 'min_samples_leaf': 1, 'criterion': 'absolute_error', 'max_depth': 15, 'min_weight_fraction_leaf': 0.0, 'max_leaf_nodes': None, 'bootstrap': False, 'ccp_alpha': 0.0}. Best is trial 4065 with value: 0.057524275121161005.
[I 2025-04-16 02:18:53,493] Trial 4512 finished with value: -0.1936417107583833 and parameters: {'n_estimators': 545, 'min_samples_split': 2, 'max_features': 0.76, 'min_samples_leaf': 3, 'criterion': 'absolute_error', 'max_depth': 15, 'min_weight_fraction_leaf': 0.0, 'max_leaf_nodes': None, 'bootstrap': False, 'ccp_alpha': 0.011}. Best is trial 4065 with value: 0.057524275121161005.
[I 2025-04-16 02:18:55,012] Trial 4513 finished with value: -0.1936417107583833 and parameters: {'n_estimators': 943, 'min_samples_split': 2, 'max_features': 0.81, 'min_samples_leaf': 6, 'criterion': 'absolute_error', 'max_depth': 15, 'min_weight_fraction_leaf': 0.0, 'max_leaf_nodes': None, 'bootstrap': False, 'ccp_alpha': 0.01}. Best is trial 4065 with value: 0.057524275121161005.
[I 2025-04-16 02:18:55,767] Trial 4514 finished with value: -0.1936417107583833 and parameters: {'n_estimators': 167, 'min_samples_split': 9, 'max_features': 0.79, 'min_samples_leaf': 4, 'criterion': 'absolute_error', 'max_depth': 15, 'min_weight_fraction_leaf': 0.0, 'max_leaf_nodes': None, 'bootstrap': False, 'ccp_alpha': 0.019}. Best is trial 4065 with value: 0.057524275121161005.
[I 2025-04-16 02:18:56,753] Trial 4515 finished with value: -0.12784237508078194 and parameters: {'n_estimators': 454, 'min_samples_split': 13, 'max_features': 0.76, 'min_samples_leaf': 1, 'criterion': 'absolute_error', 'max_depth': 15, 'min_weight_fraction_leaf': 0.0, 'max_leaf_nodes': None, 'bootstrap': False, 'ccp_alpha': 0.005}. Best is trial 4065 with value: 0.057524275121161005.
