[I 2025-04-15 23:39:13,167] Trial 586 finished with value: -0.19328186724328283 and parameters: {'n_estimators': 3283, 'min_samples_split': 183, 'max_features': 0.9, 'min_samples_leaf': 37, 'criterion': 'absolute_error', 'max_depth': None, 'min_weight_fraction_leaf': 0.02, 'max_leaf_nodes': 100, 'bootstrap': True, 'ccp_alpha': 0.07, 'max_samples': 1.0}. Best is trial 74 with value: -0.18167313469617832.
[I 2025-04-15 23:39:16,286] Trial 587 finished with value: -0.1906953860483184 and parameters: {'n_estimators': 2750, 'min_samples_split': 35, 'max_features': 0.88, 'min_samples_leaf': 80, 'criterion': 'absolute_error', 'max_depth': None, 'min_weight_fraction_leaf': 0.03, 'max_leaf_nodes': 100, 'bootstrap': True, 'ccp_alpha': 0.082, 'max_samples': 0.75}. Best is trial 74 with value: -0.18167313469617832.
[I 2025-04-15 23:39:19,289] Trial 588 finished with value: -0.18290988710796294 and parameters: {'n_estimators': 2542, 'min_samples_split': 163, 'max_features': 0.86, 'min_samples_leaf': 33, 'criterion': 'absolute_error', 'max_depth': None, 'min_weight_fraction_leaf': 0.02, 'max_leaf_nodes': 100, 'bootstrap': True, 'ccp_alpha': 0.094, 'max_samples': 0.5}. Best is trial 74 with value: -0.18167313469617832.
[I 2025-04-15 23:39:23,296] Trial 589 finished with value: -0.18319754133734478 and parameters: {'n_estimators': 3460, 'min_samples_split': 179, 'max_features': 0.92, 'min_samples_leaf': 29, 'criterion': 'absolute_error', 'max_depth': None, 'min_weight_fraction_leaf': 0.02, 'max_leaf_nodes': 100, 'bootstrap': True, 'ccp_alpha': 0.079, 'max_samples': 0.5}. Best is trial 74 with value: -0.18167313469617832.
[I 2025-04-15 23:39:26,471] Trial 590 finished with value: -18.055082341401743 and parameters: {'n_estimators': 3052, 'min_samples_split': 134, 'max_features': 0.9600000000000001, 'min_samples_leaf': 49, 'criterion': 'poisson', 'max_depth': None, 'min_weight_fraction_leaf': 0.02, 'max_leaf_nodes': 100, 'bootstrap': True, 'ccp_alpha': 0.106, 'max_samples': 0.5}. Best is trial 74 with value: -0.18167313469617832.
[I 2025-04-15 23:39:30,069] Trial 591 finished with value: -0.18286820391506153 and parameters: {'n_estimators': 3256, 'min_samples_split': 97, 'max_features': 0.87, 'min_samples_leaf': 35, 'criterion': 'absolute_error', 'max_depth': 30, 'min_weight_fraction_leaf': 0.02, 'max_leaf_nodes': 300, 'bootstrap': True, 'ccp_alpha': 0.066, 'max_samples': 0.5}. Best is trial 74 with value: -0.18167313469617832.
[I 2025-04-15 23:39:33,547] Trial 592 finished with value: -0.1830507845452304 and parameters: {'n_estimators': 2896, 'min_samples_split': 138, 'max_features': 0.9, 'min_samples_leaf': 28, 'criterion': 'absolute_error', 'max_depth': 45, 'min_weight_fraction_leaf': 0.02, 'max_leaf_nodes': 100, 'bootstrap': True, 'ccp_alpha': 0.074, 'max_samples': 0.5}. Best is trial 74 with value: -0.18167313469617832.
[I 2025-04-15 23:39:34,049] Trial 593 finished with value: -0.18765896833559498 and parameters: {'n_estimators': 350, 'min_samples_split': 171, 'max_features': 0.86, 'min_samples_leaf': 31, 'criterion': 'absolute_error', 'max_depth': 30, 'min_weight_fraction_leaf': 0.02, 'max_leaf_nodes': 100, 'bootstrap': True, 'ccp_alpha': 0.088, 'max_samples': 0.5}. Best is trial 74 with value: -0.18167313469617832.
[I 2025-04-15 23:39:37,620] Trial 594 finished with value: -0.1827040420506641 and parameters: {'n_estimators': 3067, 'min_samples_split': 159, 'max_features': 0.98, 'min_samples_leaf': 27, 'criterion': 'absolute_error', 'max_depth': 30, 'min_weight_fraction_leaf': 0.03, 'max_leaf_nodes': 50, 'bootstrap': True, 'ccp_alpha': 0.11800000000000001, 'max_samples': 0.5}. Best is trial 74 with value: -0.18167313469617832.
[I 2025-04-15 23:39:41,673] Trial 595 finished with value: -0.18343286413002352 and parameters: {'n_estimators': 3664, 'min_samples_split': 176, 'max_features': 0.88, 'min_samples_leaf': 29, 'criterion': 'absolute_error', 'max_depth': 10, 'min_weight_fraction_leaf': 0.02, 'max_leaf_nodes': 10, 'bootstrap': True, 'ccp_alpha': 0.101, 'max_samples': 0.5}. Best is trial 74 with value: -0.18167313469617832.
[I 2025-04-15 23:39:44,686] Trial 596 finished with value: -0.18279957082143508 and parameters: {'n_estimators': 2665, 'min_samples_split': 112, 'max_features': 0.54, 'min_samples_leaf': 32, 'criterion': 'absolute_error', 'max_depth': None, 'min_weight_fraction_leaf': 0.02, 'max_leaf_nodes': 100, 'bootstrap': True, 'ccp_alpha': 0.266, 'max_samples': 0.5}. Best is trial 74 with value: -0.18167313469617832.
[I 2025-04-15 23:39:45,480] Trial 597 finished with value: -0.18578451222578404 and parameters: {'n_estimators': 617, 'min_samples_split': 153, 'max_features': 0.93, 'min_samples_leaf': 27, 'criterion': 'absolute_error', 'max_depth': 30, 'min_weight_fraction_leaf': 0.03, 'max_leaf_nodes': 100, 'bootstrap': True, 'ccp_alpha': 0.13, 'max_samples': 0.5}. Best is trial 74 with value: -0.18167313469617832.
[I 2025-04-15 23:39:49,300] Trial 598 finished with value: -0.18300720217447486 and parameters: {'n_estimators': 3385, 'min_samples_split': 27, 'max_features': 0.8400000000000001, 'min_samples_leaf': 85, 'criterion': 'absolute_error', 'max_depth': 45, 'min_weight_fraction_leaf': 0.02, 'max_leaf_nodes': 100, 'bootstrap': True, 'ccp_alpha': 0.094, 'max_samples': 0.5}. Best is trial 74 with value: -0.18167313469617832.
[I 2025-04-15 23:39:52,719] Trial 599 finished with value: -0.18276476773020947 and parameters: {'n_estimators': 2919, 'min_samples_split': 168, 'max_features': 0.9, 'min_samples_leaf': 19, 'criterion': 'absolute_error', 'max_depth': 20, 'min_weight_fraction_leaf': 0.02, 'max_leaf_nodes': 10, 'bootstrap': True, 'ccp_alpha': 0.114, 'max_samples': 0.5}. Best is trial 74 with value: -0.18167313469617832.
[I 2025-04-15 23:39:56,162] Trial 600 finished with value: -17.974878800980616 and parameters: {'n_estimators': 3128, 'min_samples_split': 125, 'max_features': 0.85, 'min_samples_leaf': 26, 'criterion': 'friedman_mse', 'max_depth': 30, 'min_weight_fraction_leaf': 0.0, 'max_leaf_nodes': None, 'bootstrap': True, 'ccp_alpha': 0.06, 'max_samples': 0.5}. Best is trial 74 with value: -0.18167313469617832.
[I 2025-04-15 23:39:58,917] Trial 601 finished with value: -0.18319789852536167 and parameters: {'n_estimators': 2474, 'min_samples_split': 40, 'max_features': 0.66, 'min_samples_leaf': 34, 'criterion': 'absolute_error', 'max_depth': 5, 'min_weight_fraction_leaf': 0.03, 'max_leaf_nodes': 100, 'bootstrap': True, 'ccp_alpha': 0.108, 'max_samples': 0.5}. Best is trial 74 with value: -0.18167313469617832.
[I 2025-04-15 23:40:02,060] Trial 602 finished with value: -0.18280754644814126 and parameters: {'n_estimators': 2793, 'min_samples_split': 37, 'max_features': 0.88, 'min_samples_leaf': 30, 'criterion': 'absolute_error', 'max_depth': 60, 'min_weight_fraction_leaf': 0.02, 'max_leaf_nodes': 20, 'bootstrap': True, 'ccp_alpha': 0.081, 'max_samples': 0.5}. Best is trial 74 with value: -0.18167313469617832.
[I 2025-04-15 23:40:05,751] Trial 603 finished with value: -0.18298065135129157 and parameters: {'n_estimators': 3327, 'min_samples_split': 147, 'max_features': 0.4, 'min_samples_leaf': 23, 'criterion': 'absolute_error', 'max_depth': 30, 'min_weight_fraction_leaf': 0.02, 'max_leaf_nodes': 100, 'bootstrap': True, 'ccp_alpha': 0.099, 'max_samples': 0.5}. Best is trial 74 with value: -0.18167313469617832.
[I 2025-04-15 23:40:08,253] Trial 604 finished with value: -0.1936417107583833 and parameters: {'n_estimators': 3017, 'min_samples_split': 75, 'max_features': 0.8300000000000001, 'min_samples_leaf': 79, 'criterion': 'absolute_error', 'max_depth': 30, 'min_weight_fraction_leaf': 0.0, 'max_leaf_nodes': 100, 'bootstrap': False, 'ccp_alpha': 0.07}. Best is trial 74 with value: -0.18167313469617832.
[I 2025-04-15 23:40:12,186] Trial 605 finished with value: -0.1933116182224656 and parameters: {'n_estimators': 3247, 'min_samples_split': 161, 'max_features': 0.92, 'min_samples_leaf': 74, 'criterion': 'absolute_error', 'max_depth': 45, 'min_weight_fraction_leaf': 0.02, 'max_leaf_nodes': 10, 'bootstrap': True, 'ccp_alpha': 0.08700000000000001, 'max_samples': None}. Best is trial 74 with value: -0.18167313469617832.
[I 2025-04-15 23:40:16,131] Trial 606 finished with value: -0.18334686930093752 and parameters: {'n_estimators': 3552, 'min_samples_split': 173, 'max_features': 0.86, 'min_samples_leaf': 92, 'criterion': 'absolute_error', 'max_depth': 30, 'min_weight_fraction_leaf': 0.02, 'max_leaf_nodes': 100, 'bootstrap': True, 'ccp_alpha': 0.075, 'max_samples': 0.5}. Best is trial 74 with value: -0.18167313469617832.
[I 2025-04-15 23:40:19,220] Trial 607 finished with value: -0.18280993448413688 and parameters: {'n_estimators': 2706, 'min_samples_split': 30, 'max_features': 0.89, 'min_samples_leaf': 28, 'criterion': 'absolute_error', 'max_depth': 30, 'min_weight_fraction_leaf': 0.03, 'max_leaf_nodes': 50, 'bootstrap': True, 'ccp_alpha': 0.106, 'max_samples': 0.5}. Best is trial 74 with value: -0.18167313469617832.
[I 2025-04-15 23:40:22,318] Trial 608 finished with value: -18.175212169407434 and parameters: {'n_estimators': 2938, 'min_samples_split': 194, 'max_features': 0.9400000000000001, 'min_samples_leaf': 16, 'criterion': 'squared_error', 'max_depth': 10, 'min_weight_fraction_leaf': 0.05, 'max_leaf_nodes': 100, 'bootstrap': True, 'ccp_alpha': 0.097, 'max_samples': 0.5}. Best is trial 74 with value: -0.18167313469617832.
[I 2025-04-15 23:40:25,826] Trial 609 finished with value: -0.18262402539315375 and parameters: {'n_estimators': 3148, 'min_samples_split': 43, 'max_features': 0.8300000000000001, 'min_samples_leaf': 71, 'criterion': 'absolute_error', 'max_depth': 30, 'min_weight_fraction_leaf': 0.02, 'max_leaf_nodes': 100, 'bootstrap': True, 'ccp_alpha': 0.064, 'max_samples': 0.5}. Best is trial 74 with value: -0.18167313469617832.
[I 2025-04-15 23:40:30,115] Trial 610 finished with value: -0.1830586102901972 and parameters: {'n_estimators': 3405, 'min_samples_split': 179, 'max_features': 0.87, 'min_samples_leaf': 25, 'criterion': 'absolute_error', 'max_depth': 45, 'min_weight_fraction_leaf': 0.02, 'max_leaf_nodes': 10, 'bootstrap': True, 'ccp_alpha': 0.083, 'max_samples': 0.5}. Best is trial 74 with value: -0.18167313469617832.
[I 2025-04-15 23:40:32,477] Trial 611 finished with value: -0.1933166715565809 and parameters: {'n_estimators': 2107, 'min_samples_split': 184, 'max_features': 0.9, 'min_samples_leaf': 31, 'criterion': 'absolute_error', 'max_depth': 20, 'min_weight_fraction_leaf': 0.02, 'max_leaf_nodes': 100, 'bootstrap': True, 'ccp_alpha': 0.089, 'max_samples': 1.0}. Best is trial 74 with value: -0.18167313469617832.
[I 2025-04-15 23:40:39,048] Trial 612 finished with value: -0.1912790874416644 and parameters: {'n_estimators': 6222, 'min_samples_split': 166, 'max_features': 0.8, 'min_samples_leaf': 22, 'criterion': 'absolute_error', 'max_depth': 30, 'min_weight_fraction_leaf': 0.0, 'max_leaf_nodes': None, 'bootstrap': True, 'ccp_alpha': 0.111, 'max_samples': 0.75}. Best is trial 74 with value: -0.18167313469617832.
[I 2025-04-15 23:40:42,498] Trial 613 finished with value: -0.18294208429003955 and parameters: {'n_estimators': 2859, 'min_samples_split': 171, 'max_features': 0.8400000000000001, 'min_samples_leaf': 26, 'criterion': 'absolute_error', 'max_depth': None, 'min_weight_fraction_leaf': 0.01, 'max_leaf_nodes': 100, 'bootstrap': True, 'ccp_alpha': 0.101, 'max_samples': 0.5}. Best is trial 74 with value: -0.18167313469617832.
[I 2025-04-15 23:40:44,121] Trial 614 finished with value: -17.943280532866467 and parameters: {'n_estimators': 1306, 'min_samples_split': 34, 'max_features': 1.0, 'min_samples_leaf': 20, 'criterion': 'poisson', 'max_depth': 60, 'min_weight_fraction_leaf': 0.03, 'max_leaf_nodes': 300, 'bootstrap': True, 'ccp_alpha': 0.001, 'max_samples': 0.5}. Best is trial 74 with value: -0.18167313469617832.
[I 2025-04-15 23:40:47,501] Trial 615 finished with value: -0.18259800237028495 and parameters: {'n_estimators': 3118, 'min_samples_split': 156, 'max_features': 0.86, 'min_samples_leaf': 29, 'criterion': 'absolute_error', 'max_depth': 30, 'min_weight_fraction_leaf': 0.02, 'max_leaf_nodes': 100, 'bootstrap': True, 'ccp_alpha': 0.094, 'max_samples': 0.5}. Best is trial 74 with value: -0.18167313469617832.
[I 2025-04-15 23:40:50,300] Trial 616 finished with value: -0.18302885533632196 and parameters: {'n_estimators': 2589, 'min_samples_split': 176, 'max_features': 0.91, 'min_samples_leaf': 24, 'criterion': 'absolute_error', 'max_depth': 5, 'min_weight_fraction_leaf': 0.0, 'max_leaf_nodes': 10, 'bootstrap': True, 'ccp_alpha': 0.11800000000000001, 'max_samples': 0.5}. Best is trial 74 with value: -0.18167313469617832.
[I 2025-04-15 23:40:58,996] Trial 617 finished with value: -0.18465386901515743 and parameters: {'n_estimators': 8319, 'min_samples_split': 19, 'max_features': 0.9600000000000001, 'min_samples_leaf': 32, 'criterion': 'absolute_error', 'max_depth': 30, 'min_weight_fraction_leaf': 0.02, 'max_leaf_nodes': 100, 'bootstrap': True, 'ccp_alpha': 0.077, 'max_samples': 0.5}. Best is trial 74 with value: -0.18167313469617832.
[I 2025-04-15 23:40:59,210] Trial 618 finished with value: -0.18135805606414995 and parameters: {'n_estimators': 59, 'min_samples_split': 23, 'max_features': 0.88, 'min_samples_leaf': 27, 'criterion': 'absolute_error', 'max_depth': 45, 'min_weight_fraction_leaf': 0.06, 'max_leaf_nodes': 100, 'bootstrap': True, 'ccp_alpha': 0.06, 'max_samples': 0.5}. Best is trial 618 with value: -0.18135805606414995.
[I 2025-04-15 23:41:02,238] Trial 619 finished with value: -0.18266071717541504 and parameters: {'n_estimators': 2728, 'min_samples_split': 18, 'max_features': 0.85, 'min_samples_leaf': 28, 'criterion': 'absolute_error', 'max_depth': 45, 'min_weight_fraction_leaf': 0.06, 'max_leaf_nodes': 100, 'bootstrap': True, 'ccp_alpha': 0.058, 'max_samples': 0.5}. Best is trial 618 with value: -0.18135805606414995.
[I 2025-04-15 23:41:02,505] Trial 620 finished with value: -0.1812180099909185 and parameters: {'n_estimators': 111, 'min_samples_split': 24, 'max_features': 0.34, 'min_samples_leaf': 30, 'criterion': 'absolute_error', 'max_depth': 45, 'min_weight_fraction_leaf': 0.01, 'max_leaf_nodes': 50, 'bootstrap': True, 'ccp_alpha': 0.063, 'max_samples': 0.5}. Best is trial 620 with value: -0.1812180099909185.
[I 2025-04-15 23:41:02,787] Trial 621 finished with value: -0.18112741123578058 and parameters: {'n_estimators': 110, 'min_samples_split': 22, 'max_features': 0.3, 'min_samples_leaf': 35, 'criterion': 'absolute_error', 'max_depth': 45, 'min_weight_fraction_leaf': 0.06, 'max_leaf_nodes': 100, 'bootstrap': True, 'ccp_alpha': 0.055, 'max_samples': 0.5}. Best is trial 621 with value: -0.18112741123578058.
[I 2025-04-15 23:41:03,128] Trial 622 finished with value: -0.184699073187729 and parameters: {'n_estimators': 164, 'min_samples_split': 22, 'max_features': 0.3, 'min_samples_leaf': 38, 'criterion': 'absolute_error', 'max_depth': 45, 'min_weight_fraction_leaf': 0.01, 'max_leaf_nodes': 50, 'bootstrap': True, 'ccp_alpha': 0.055, 'max_samples': 0.5}. Best is trial 621 with value: -0.18112741123578058.
[I 2025-04-15 23:41:03,299] Trial 623 finished with value: -0.1936378239788945 and parameters: {'n_estimators': 13, 'min_samples_split': 19, 'max_features': 0.47000000000000003, 'min_samples_leaf': 35, 'criterion': 'absolute_error', 'max_depth': 45, 'min_weight_fraction_leaf': 0.06, 'max_leaf_nodes': 50, 'bootstrap': True, 'ccp_alpha': 0.059000000000000004, 'max_samples': 0.5}. Best is trial 621 with value: -0.18112741123578058.
[I 2025-04-15 23:41:03,607] Trial 624 finished with value: -0.1936417107583833 and parameters: {'n_estimators': 212, 'min_samples_split': 16, 'max_features': 0.32, 'min_samples_leaf': 36, 'criterion': 'absolute_error', 'max_depth': 45, 'min_weight_fraction_leaf': 0.06, 'max_leaf_nodes': 50, 'bootstrap': False, 'ccp_alpha': 0.049}. Best is trial 621 with value: -0.18112741123578058.
[I 2025-04-15 23:41:03,830] Trial 625 finished with value: -21.989360930729905 and parameters: {'n_estimators': 67, 'min_samples_split': 185, 'max_features': 0.36000000000000004, 'min_samples_leaf': 34, 'criterion': 'friedman_mse', 'max_depth': 45, 'min_weight_fraction_leaf': 0.01, 'max_leaf_nodes': 100, 'bootstrap': True, 'ccp_alpha': 0.061, 'max_samples': 0.5}. Best is trial 621 with value: -0.18112741123578058.
[I 2025-04-15 23:41:04,622] Trial 626 finished with value: -0.18707071899904001 and parameters: {'n_estimators': 562, 'min_samples_split': 19, 'max_features': 0.28, 'min_samples_leaf': 34, 'criterion': 'absolute_error', 'max_depth': 45, 'min_weight_fraction_leaf': 0.06, 'max_leaf_nodes': 50, 'bootstrap': True, 'ccp_alpha': 0.055, 'max_samples': 0.5}. Best is trial 621 with value: -0.18112741123578058.
[I 2025-04-15 23:41:05,333] Trial 627 finished with value: -0.18689030799396042 and parameters: {'n_estimators': 531, 'min_samples_split': 32, 'max_features': 0.28, 'min_samples_leaf': 33, 'criterion': 'absolute_error', 'max_depth': 45, 'min_weight_fraction_leaf': 0.07, 'max_leaf_nodes': 50, 'bootstrap': True, 'ccp_alpha': 0.045, 'max_samples': 0.5}. Best is trial 621 with value: -0.18112741123578058.
[I 2025-04-15 23:41:05,834] Trial 628 finished with value: -0.18776889655115472 and parameters: {'n_estimators': 357, 'min_samples_split': 23, 'max_features': 0.29000000000000004, 'min_samples_leaf': 31, 'criterion': 'absolute_error', 'max_depth': 45, 'min_weight_fraction_leaf': 0.06, 'max_leaf_nodes': 50, 'bootstrap': True, 'ccp_alpha': 0.063, 'max_samples': 0.5}. Best is trial 621 with value: -0.18112741123578058.
[I 2025-04-15 23:41:06,036] Trial 629 finished with value: -0.19363628746903944 and parameters: {'n_estimators': 34, 'min_samples_split': 23, 'max_features': 0.29000000000000004, 'min_samples_leaf': 32, 'criterion': 'absolute_error', 'max_depth': 45, 'min_weight_fraction_leaf': 0.07, 'max_leaf_nodes': 50, 'bootstrap': True, 'ccp_alpha': 0.054, 'max_samples': 0.5}. Best is trial 621 with value: -0.18112741123578058.
[I 2025-04-15 23:41:06,535] Trial 630 finished with value: -0.18776889655115472 and parameters: {'n_estimators': 357, 'min_samples_split': 15, 'max_features': 0.34, 'min_samples_leaf': 37, 'criterion': 'absolute_error', 'max_depth': 45, 'min_weight_fraction_leaf': 0.06, 'max_leaf_nodes': 50, 'bootstrap': True, 'ccp_alpha': 0.049, 'max_samples': 0.5}. Best is trial 621 with value: -0.18112741123578058.
[I 2025-04-15 23:41:06,957] Trial 631 finished with value: -0.1932036872521718 and parameters: {'n_estimators': 277, 'min_samples_split': 31, 'max_features': 0.31, 'min_samples_leaf': 30, 'criterion': 'absolute_error', 'max_depth': 45, 'min_weight_fraction_leaf': 0.06, 'max_leaf_nodes': 100, 'bootstrap': True, 'ccp_alpha': 0.06, 'max_samples': None}. Best is trial 621 with value: -0.18112741123578058.
[I 2025-04-15 23:41:07,279] Trial 632 finished with value: -0.1847465438557235 and parameters: {'n_estimators': 165, 'min_samples_split': 23, 'max_features': 0.31, 'min_samples_leaf': 40, 'criterion': 'absolute_error', 'max_depth': 45, 'min_weight_fraction_leaf': 0.06, 'max_leaf_nodes': 50, 'bootstrap': True, 'ccp_alpha': 0.064, 'max_samples': 0.5}. Best is trial 621 with value: -0.18112741123578058.
[I 2025-04-15 23:41:11,150] Trial 633 finished with value: -0.18291772099439566 and parameters: {'n_estimators': 3847, 'min_samples_split': 21, 'max_features': 0.33, 'min_samples_leaf': 32, 'criterion': 'absolute_error', 'max_depth': 45, 'min_weight_fraction_leaf': 0.06, 'max_leaf_nodes': 50, 'bootstrap': True, 'ccp_alpha': 0.055, 'max_samples': 0.5}. Best is trial 621 with value: -0.18112741123578058.
[I 2025-04-15 23:41:11,503] Trial 634 finished with value: -0.18557638329632478 and parameters: {'n_estimators': 195, 'min_samples_split': 25, 'max_features': 0.25, 'min_samples_leaf': 34, 'criterion': 'absolute_error', 'max_depth': 45, 'min_weight_fraction_leaf': 0.06, 'max_leaf_nodes': 20, 'bootstrap': True, 'ccp_alpha': 0.063, 'max_samples': 0.5}. Best is trial 621 with value: -0.18112741123578058.
[I 2025-04-15 23:41:12,433] Trial 635 finished with value: -17.481284555441814 and parameters: {'n_estimators': 823, 'min_samples_split': 19, 'max_features': 0.27, 'min_samples_leaf': 29, 'criterion': 'squared_error', 'max_depth': 45, 'min_weight_fraction_leaf': 0.05, 'max_leaf_nodes': None, 'bootstrap': True, 'ccp_alpha': 0.044, 'max_samples': 0.5}. Best is trial 621 with value: -0.18112741123578058.
[I 2025-04-15 23:41:12,696] Trial 636 finished with value: -0.1812180099909185 and parameters: {'n_estimators': 111, 'min_samples_split': 25, 'max_features': 0.24000000000000002, 'min_samples_leaf': 31, 'criterion': 'absolute_error', 'max_depth': 45, 'min_weight_fraction_leaf': 0.01, 'max_leaf_nodes': 100, 'bootstrap': True, 'ccp_alpha': 0.056, 'max_samples': 0.5}. Best is trial 621 with value: -0.18112741123578058.
[I 2025-04-15 23:41:12,875] Trial 637 finished with value: -0.19363533202546374 and parameters: {'n_estimators': 29, 'min_samples_split': 28, 'max_features': 0.23, 'min_samples_leaf': 33, 'criterion': 'absolute_error', 'max_depth': 45, 'min_weight_fraction_leaf': 0.06, 'max_leaf_nodes': 50, 'bootstrap': True, 'ccp_alpha': 0.05, 'max_samples': 0.5}. Best is trial 621 with value: -0.18112741123578058.
[I 2025-04-15 23:41:13,025] Trial 638 finished with value: -0.19364191045209433 and parameters: {'n_estimators': 8, 'min_samples_split': 25, 'max_features': 0.38, 'min_samples_leaf': 36, 'criterion': 'absolute_error', 'max_depth': 45, 'min_weight_fraction_leaf': 0.01, 'max_leaf_nodes': 100, 'bootstrap': True, 'ccp_alpha': 0.04, 'max_samples': 1.0}. Best is trial 621 with value: -0.18112741123578058.
