[I 2025-04-15 23:36:04,178] Trial 533 finished with value: -0.18265418173837394 and parameters: {'n_estimators': 2726, 'min_samples_split': 47, 'max_features': 0.9600000000000001, 'min_samples_leaf': 23, 'criterion': 'absolute_error', 'max_depth': 45, 'min_weight_fraction_leaf': 0.02, 'max_leaf_nodes': 150, 'bootstrap': True, 'ccp_alpha': 0.098, 'max_samples': 0.5}. Best is trial 74 with value: -0.18167313469617832.
[I 2025-04-15 23:36:07,551] Trial 534 finished with value: -0.1909134377710801 and parameters: {'n_estimators': 3069, 'min_samples_split': 84, 'max_features': 0.76, 'min_samples_leaf': 17, 'criterion': 'absolute_error', 'max_depth': 30, 'min_weight_fraction_leaf': 0.02, 'max_leaf_nodes': 100, 'bootstrap': True, 'ccp_alpha': 0.106, 'max_samples': 0.75}. Best is trial 74 with value: -0.18167313469617832.
[I 2025-04-15 23:36:11,428] Trial 535 finished with value: -0.19329835822864175 and parameters: {'n_estimators': 3474, 'min_samples_split': 157, 'max_features': 0.03, 'min_samples_leaf': 26, 'criterion': 'absolute_error', 'max_depth': 30, 'min_weight_fraction_leaf': 0.01, 'max_leaf_nodes': 10, 'bootstrap': True, 'ccp_alpha': 0.051000000000000004, 'max_samples': 1.0}. Best is trial 74 with value: -0.18167313469617832.
[I 2025-04-15 23:36:14,016] Trial 536 finished with value: -18.241126914859283 and parameters: {'n_estimators': 2360, 'min_samples_split': 93, 'max_features': 0.79, 'min_samples_leaf': 32, 'criterion': 'squared_error', 'max_depth': 15, 'min_weight_fraction_leaf': 0.02, 'max_leaf_nodes': 100, 'bootstrap': True, 'ccp_alpha': 0.067, 'max_samples': 0.5}. Best is trial 74 with value: -0.18167313469617832.
[I 2025-04-15 23:36:17,129] Trial 537 finished with value: -0.18280319858091248 and parameters: {'n_estimators': 2914, 'min_samples_split': 176, 'max_features': 0.49, 'min_samples_leaf': 24, 'criterion': 'absolute_error', 'max_depth': 30, 'min_weight_fraction_leaf': 0.1, 'max_leaf_nodes': 20, 'bootstrap': True, 'ccp_alpha': 0.111, 'max_samples': 0.5}. Best is trial 74 with value: -0.18167313469617832.
[I 2025-04-15 23:36:20,758] Trial 538 finished with value: -0.18282198226253055 and parameters: {'n_estimators': 3239, 'min_samples_split': 169, 'max_features': 1.0, 'min_samples_leaf': 21, 'criterion': 'absolute_error', 'max_depth': 15, 'min_weight_fraction_leaf': 0.04, 'max_leaf_nodes': 150, 'bootstrap': True, 'ccp_alpha': 0.092, 'max_samples': 0.5}. Best is trial 74 with value: -0.18167313469617832.
[I 2025-04-15 23:36:23,638] Trial 539 finished with value: -0.18297882606083288 and parameters: {'n_estimators': 2573, 'min_samples_split': 42, 'max_features': 0.8400000000000001, 'min_samples_leaf': 30, 'criterion': 'absolute_error', 'max_depth': 30, 'min_weight_fraction_leaf': 0.0, 'max_leaf_nodes': 100, 'bootstrap': True, 'ccp_alpha': 0.077, 'max_samples': 0.5}. Best is trial 74 with value: -0.18167313469617832.
[I 2025-04-15 23:36:26,946] Trial 540 finished with value: -0.18261642115518564 and parameters: {'n_estimators': 3037, 'min_samples_split': 153, 'max_features': 0.9, 'min_samples_leaf': 100, 'criterion': 'absolute_error', 'max_depth': 10, 'min_weight_fraction_leaf': 0.02, 'max_leaf_nodes': 50, 'bootstrap': True, 'ccp_alpha': 0.08600000000000001, 'max_samples': 0.5}. Best is trial 74 with value: -0.18167313469617832.
[I 2025-04-15 23:36:29,764] Trial 541 finished with value: -18.136005604153517 and parameters: {'n_estimators': 2802, 'min_samples_split': 184, 'max_features': 0.87, 'min_samples_leaf': 27, 'criterion': 'poisson', 'max_depth': 45, 'min_weight_fraction_leaf': 0.01, 'max_leaf_nodes': 100, 'bootstrap': True, 'ccp_alpha': 0.106, 'max_samples': 0.5}. Best is trial 74 with value: -0.18167313469617832.
[I 2025-04-15 23:36:33,305] Trial 542 finished with value: -0.18299284306389577 and parameters: {'n_estimators': 3354, 'min_samples_split': 177, 'max_features': 0.81, 'min_samples_leaf': 8, 'criterion': 'absolute_error', 'max_depth': 20, 'min_weight_fraction_leaf': 0.02, 'max_leaf_nodes': 10, 'bootstrap': True, 'ccp_alpha': 0.098, 'max_samples': 0.5}. Best is trial 74 with value: -0.18167313469617832.
[I 2025-04-15 23:36:36,556] Trial 543 finished with value: -0.18262686114904253 and parameters: {'n_estimators': 3149, 'min_samples_split': 163, 'max_features': 0.93, 'min_samples_leaf': 35, 'criterion': 'absolute_error', 'max_depth': 30, 'min_weight_fraction_leaf': 0.06, 'max_leaf_nodes': 150, 'bootstrap': True, 'ccp_alpha': 0.082, 'max_samples': 0.5}. Best is trial 74 with value: -0.18167313469617832.
[I 2025-04-15 23:36:42,295] Trial 544 finished with value: -0.1836841800488173 and parameters: {'n_estimators': 5323, 'min_samples_split': 172, 'max_features': 0.85, 'min_samples_leaf': 25, 'criterion': 'absolute_error', 'max_depth': 15, 'min_weight_fraction_leaf': 0.02, 'max_leaf_nodes': 100, 'bootstrap': True, 'ccp_alpha': 0.059000000000000004, 'max_samples': 0.5}. Best is trial 74 with value: -0.18167313469617832.
[I 2025-04-15 23:36:46,080] Trial 545 finished with value: -0.18331552528880066 and parameters: {'n_estimators': 3539, 'min_samples_split': 39, 'max_features': 0.8200000000000001, 'min_samples_leaf': 29, 'criterion': 'absolute_error', 'max_depth': 60, 'min_weight_fraction_leaf': 0.02, 'max_leaf_nodes': 100, 'bootstrap': True, 'ccp_alpha': 0.115, 'max_samples': 0.5}. Best is trial 74 with value: -0.18167313469617832.
[I 2025-04-15 23:36:49,171] Trial 546 finished with value: -0.18291132437815358 and parameters: {'n_estimators': 2849, 'min_samples_split': 168, 'max_features': 0.77, 'min_samples_leaf': 23, 'criterion': 'absolute_error', 'max_depth': 30, 'min_weight_fraction_leaf': 0.01, 'max_leaf_nodes': None, 'bootstrap': True, 'ccp_alpha': 0.125, 'max_samples': 0.5}. Best is trial 74 with value: -0.18167313469617832.
[I 2025-04-15 23:36:52,060] Trial 547 finished with value: -0.1936417107583833 and parameters: {'n_estimators': 3082, 'min_samples_split': 159, 'max_features': 0.89, 'min_samples_leaf': 77, 'criterion': 'absolute_error', 'max_depth': 5, 'min_weight_fraction_leaf': 0.0, 'max_leaf_nodes': 150, 'bootstrap': False, 'ccp_alpha': 0.075}. Best is trial 74 with value: -0.18167313469617832.
[I 2025-04-15 23:36:58,502] Trial 548 finished with value: -0.18379277473160918 and parameters: {'n_estimators': 5789, 'min_samples_split': 121, 'max_features': 0.87, 'min_samples_leaf': 27, 'criterion': 'absolute_error', 'max_depth': None, 'min_weight_fraction_leaf': 0.01, 'max_leaf_nodes': 100, 'bootstrap': True, 'ccp_alpha': 0.092, 'max_samples': 0.5}. Best is trial 74 with value: -0.18167313469617832.
[I 2025-04-15 23:37:02,159] Trial 549 finished with value: -0.1829701209221422 and parameters: {'n_estimators': 3323, 'min_samples_split': 32, 'max_features': 0.92, 'min_samples_leaf': 32, 'criterion': 'absolute_error', 'max_depth': 30, 'min_weight_fraction_leaf': 0.02, 'max_leaf_nodes': 10, 'bootstrap': True, 'ccp_alpha': 0.10300000000000001, 'max_samples': 0.5}. Best is trial 74 with value: -0.18167313469617832.
[I 2025-04-15 23:37:05,009] Trial 550 finished with value: -0.18283794754335628 and parameters: {'n_estimators': 2629, 'min_samples_split': 53, 'max_features': 0.8, 'min_samples_leaf': 19, 'criterion': 'absolute_error', 'max_depth': 45, 'min_weight_fraction_leaf': 0.02, 'max_leaf_nodes': 100, 'bootstrap': True, 'ccp_alpha': 0.066, 'max_samples': 0.5}. Best is trial 74 with value: -0.18167313469617832.
[I 2025-04-15 23:37:08,051] Trial 551 finished with value: -18.16518751827295 and parameters: {'n_estimators': 2956, 'min_samples_split': 152, 'max_features': 0.98, 'min_samples_leaf': 22, 'criterion': 'friedman_mse', 'max_depth': 15, 'min_weight_fraction_leaf': 0.01, 'max_leaf_nodes': 150, 'bootstrap': True, 'ccp_alpha': 0.055, 'max_samples': 0.5}. Best is trial 74 with value: -0.18167313469617832.
[I 2025-04-15 23:37:12,953] Trial 552 finished with value: -0.1830693736222683 and parameters: {'n_estimators': 4153, 'min_samples_split': 174, 'max_features': 0.8400000000000001, 'min_samples_leaf': 25, 'criterion': 'absolute_error', 'max_depth': 30, 'min_weight_fraction_leaf': 0.05, 'max_leaf_nodes': 100, 'bootstrap': True, 'ccp_alpha': 0.047, 'max_samples': 0.5}. Best is trial 74 with value: -0.18167313469617832.
[I 2025-04-15 23:37:17,003] Trial 553 finished with value: -0.18344602831410425 and parameters: {'n_estimators': 3680, 'min_samples_split': 180, 'max_features': 0.9500000000000001, 'min_samples_leaf': 38, 'criterion': 'absolute_error', 'max_depth': 30, 'min_weight_fraction_leaf': 0.02, 'max_leaf_nodes': 10, 'bootstrap': True, 'ccp_alpha': 0.111, 'max_samples': 0.5}. Best is trial 74 with value: -0.18167313469617832.
[I 2025-04-15 23:37:18,933] Trial 554 finished with value: -0.19320296192703906 and parameters: {'n_estimators': 1556, 'min_samples_split': 161, 'max_features': 0.86, 'min_samples_leaf': 29, 'criterion': 'absolute_error', 'max_depth': 15, 'min_weight_fraction_leaf': 0.01, 'max_leaf_nodes': 100, 'bootstrap': True, 'ccp_alpha': 0.039, 'max_samples': None}. Best is trial 74 with value: -0.18167313469617832.
[I 2025-04-15 23:37:22,419] Trial 555 finished with value: -0.1827357683572064 and parameters: {'n_estimators': 3189, 'min_samples_split': 192, 'max_features': 0.7000000000000001, 'min_samples_leaf': 26, 'criterion': 'absolute_error', 'max_depth': 30, 'min_weight_fraction_leaf': 0.02, 'max_leaf_nodes': 150, 'bootstrap': True, 'ccp_alpha': 0.098, 'max_samples': 0.5}. Best is trial 74 with value: -0.18167313469617832.
[I 2025-04-15 23:37:32,339] Trial 556 finished with value: -0.1848703150591347 and parameters: {'n_estimators': 9273, 'min_samples_split': 49, 'max_features': 0.8200000000000001, 'min_samples_leaf': 33, 'criterion': 'absolute_error', 'max_depth': 10, 'min_weight_fraction_leaf': 0.01, 'max_leaf_nodes': 50, 'bootstrap': True, 'ccp_alpha': 0.07100000000000001, 'max_samples': 0.5}. Best is trial 74 with value: -0.18167313469617832.
[I 2025-04-15 23:37:35,380] Trial 557 finished with value: -0.18281972948249997 and parameters: {'n_estimators': 2709, 'min_samples_split': 165, 'max_features': 0.9, 'min_samples_leaf': 28, 'criterion': 'absolute_error', 'max_depth': 45, 'min_weight_fraction_leaf': 0.0, 'max_leaf_nodes': 100, 'bootstrap': True, 'ccp_alpha': 0.079, 'max_samples': 0.5}. Best is trial 74 with value: -0.18167313469617832.
[I 2025-04-15 23:37:39,208] Trial 558 finished with value: -0.19329368471925865 and parameters: {'n_estimators': 3427, 'min_samples_split': 186, 'max_features': 0.31, 'min_samples_leaf': 24, 'criterion': 'absolute_error', 'max_depth': 30, 'min_weight_fraction_leaf': 0.02, 'max_leaf_nodes': 100, 'bootstrap': True, 'ccp_alpha': 0.08700000000000001, 'max_samples': 1.0}. Best is trial 74 with value: -0.18167313469617832.
[I 2025-04-15 23:37:42,604] Trial 559 finished with value: -0.1826334342392919 and parameters: {'n_estimators': 3007, 'min_samples_split': 43, 'max_features': 0.78, 'min_samples_leaf': 21, 'criterion': 'absolute_error', 'max_depth': 20, 'min_weight_fraction_leaf': 0.02, 'max_leaf_nodes': 10, 'bootstrap': True, 'ccp_alpha': 0.165, 'max_samples': 0.5}. Best is trial 74 with value: -0.18167313469617832.
[I 2025-04-15 23:37:45,228] Trial 560 finished with value: -0.183843397394751 and parameters: {'n_estimators': 2407, 'min_samples_split': 146, 'max_features': 0.64, 'min_samples_leaf': 30, 'criterion': 'absolute_error', 'max_depth': 15, 'min_weight_fraction_leaf': 0.01, 'max_leaf_nodes': 150, 'bootstrap': True, 'ccp_alpha': 0.10400000000000001, 'max_samples': 0.5}. Best is trial 74 with value: -0.18167313469617832.
[I 2025-04-15 23:37:48,470] Trial 561 finished with value: -18.194400244782948 and parameters: {'n_estimators': 2860, 'min_samples_split': 36, 'max_features': 0.74, 'min_samples_leaf': 26, 'criterion': 'squared_error', 'max_depth': 30, 'min_weight_fraction_leaf': 0.04, 'max_leaf_nodes': 100, 'bootstrap': True, 'ccp_alpha': 0.062, 'max_samples': 0.75}. Best is trial 74 with value: -0.18167313469617832.
[I 2025-04-15 23:37:51,986] Trial 562 finished with value: -0.1827828542043124 and parameters: {'n_estimators': 3206, 'min_samples_split': 171, 'max_features': 0.88, 'min_samples_leaf': 13, 'criterion': 'absolute_error', 'max_depth': 60, 'min_weight_fraction_leaf': 0.02, 'max_leaf_nodes': None, 'bootstrap': True, 'ccp_alpha': 0.11800000000000001, 'max_samples': 0.5}. Best is trial 74 with value: -0.18167313469617832.
[I 2025-04-15 23:37:55,586] Trial 563 finished with value: -0.18268953135920246 and parameters: {'n_estimators': 3062, 'min_samples_split': 176, 'max_features': 0.8400000000000001, 'min_samples_leaf': 82, 'criterion': 'absolute_error', 'max_depth': 5, 'min_weight_fraction_leaf': 0.02, 'max_leaf_nodes': 100, 'bootstrap': True, 'ccp_alpha': 0.094, 'max_samples': 0.5}. Best is trial 74 with value: -0.18167313469617832.
[I 2025-04-15 23:37:59,264] Trial 564 finished with value: -0.1830298360705498 and parameters: {'n_estimators': 3347, 'min_samples_split': 61, 'max_features': 0.25, 'min_samples_leaf': 23, 'criterion': 'absolute_error', 'max_depth': 30, 'min_weight_fraction_leaf': 0.01, 'max_leaf_nodes': 150, 'bootstrap': True, 'ccp_alpha': 0.08600000000000001, 'max_samples': 0.5}. Best is trial 74 with value: -0.18167313469617832.
[I 2025-04-15 23:38:02,099] Trial 565 finished with value: -18.158533117643664 and parameters: {'n_estimators': 2740, 'min_samples_split': 182, 'max_features': 0.12, 'min_samples_leaf': 87, 'criterion': 'poisson', 'max_depth': 15, 'min_weight_fraction_leaf': 0.0, 'max_leaf_nodes': 100, 'bootstrap': True, 'ccp_alpha': 0.109, 'max_samples': 0.5}. Best is trial 74 with value: -0.18167313469617832.
[I 2025-04-15 23:38:06,781] Trial 566 finished with value: -0.18296977185661403 and parameters: {'n_estimators': 3930, 'min_samples_split': 167, 'max_features': 0.92, 'min_samples_leaf': 28, 'criterion': 'absolute_error', 'max_depth': 45, 'min_weight_fraction_leaf': 0.01, 'max_leaf_nodes': 20, 'bootstrap': True, 'ccp_alpha': 0.07, 'max_samples': 0.5}. Best is trial 74 with value: -0.18167313469617832.
[I 2025-04-15 23:38:08,851] Trial 567 finished with value: -0.1936417107583833 and parameters: {'n_estimators': 2503, 'min_samples_split': 173, 'max_features': 0.8200000000000001, 'min_samples_leaf': 36, 'criterion': 'absolute_error', 'max_depth': 30, 'min_weight_fraction_leaf': 0.03, 'max_leaf_nodes': 10, 'bootstrap': False, 'ccp_alpha': 0.099}. Best is trial 74 with value: -0.18167313469617832.
[I 2025-04-15 23:38:12,285] Trial 568 finished with value: -0.18256983991597853 and parameters: {'n_estimators': 2934, 'min_samples_split': 157, 'max_features': 0.86, 'min_samples_leaf': 44, 'criterion': 'absolute_error', 'max_depth': 30, 'min_weight_fraction_leaf': 0.02, 'max_leaf_nodes': 100, 'bootstrap': True, 'ccp_alpha': 0.078, 'max_samples': 0.5}. Best is trial 74 with value: -0.18167313469617832.
[I 2025-04-15 23:38:16,111] Trial 569 finished with value: -0.1833420552932104 and parameters: {'n_estimators': 3550, 'min_samples_split': 37, 'max_features': 0.8, 'min_samples_leaf': 66, 'criterion': 'absolute_error', 'max_depth': 15, 'min_weight_fraction_leaf': 0.03, 'max_leaf_nodes': 150, 'bootstrap': True, 'ccp_alpha': 0.093, 'max_samples': 0.5}. Best is trial 74 with value: -0.18167313469617832.
[I 2025-04-15 23:38:19,514] Trial 570 finished with value: -0.182763515787153 and parameters: {'n_estimators': 3199, 'min_samples_split': 27, 'max_features': 0.9400000000000001, 'min_samples_leaf': 31, 'criterion': 'absolute_error', 'max_depth': 30, 'min_weight_fraction_leaf': 0.02, 'max_leaf_nodes': 100, 'bootstrap': True, 'ccp_alpha': 0.054, 'max_samples': 0.5}. Best is trial 74 with value: -0.18167313469617832.
[I 2025-04-15 23:38:21,915] Trial 571 finished with value: -0.1838740739979578 and parameters: {'n_estimators': 2226, 'min_samples_split': 163, 'max_features': 0.89, 'min_samples_leaf': 18, 'criterion': 'absolute_error', 'max_depth': 10, 'min_weight_fraction_leaf': 0.0, 'max_leaf_nodes': 50, 'bootstrap': True, 'ccp_alpha': 0.10400000000000001, 'max_samples': 0.5}. Best is trial 74 with value: -0.18167313469617832.
[I 2025-04-15 23:38:24,949] Trial 572 finished with value: -0.18284541346184763 and parameters: {'n_estimators': 2805, 'min_samples_split': 180, 'max_features': 0.8400000000000001, 'min_samples_leaf': 25, 'criterion': 'absolute_error', 'max_depth': 15, 'min_weight_fraction_leaf': 0.02, 'max_leaf_nodes': 100, 'bootstrap': True, 'ccp_alpha': 0.088, 'max_samples': 0.5}. Best is trial 74 with value: -0.18167313469617832.
[I 2025-04-15 23:38:28,252] Trial 573 finished with value: -0.18272430610054197 and parameters: {'n_estimators': 3074, 'min_samples_split': 45, 'max_features': 0.87, 'min_samples_leaf': 27, 'criterion': 'absolute_error', 'max_depth': 45, 'min_weight_fraction_leaf': 0.01, 'max_leaf_nodes': 10, 'bootstrap': True, 'ccp_alpha': 0.181, 'max_samples': 0.5}. Best is trial 74 with value: -0.18167313469617832.
[I 2025-04-15 23:38:31,948] Trial 574 finished with value: -0.18297093447549825 and parameters: {'n_estimators': 3371, 'min_samples_split': 151, 'max_features': 0.8200000000000001, 'min_samples_leaf': 21, 'criterion': 'absolute_error', 'max_depth': 30, 'min_weight_fraction_leaf': 0.02, 'max_leaf_nodes': 150, 'bootstrap': True, 'ccp_alpha': 0.065, 'max_samples': 0.5}. Best is trial 74 with value: -0.18167313469617832.
[I 2025-04-15 23:38:35,243] Trial 575 finished with value: -18.147438915752605 and parameters: {'n_estimators': 2974, 'min_samples_split': 170, 'max_features': 0.91, 'min_samples_leaf': 68, 'criterion': 'friedman_mse', 'max_depth': 20, 'min_weight_fraction_leaf': 0.01, 'max_leaf_nodes': 100, 'bootstrap': True, 'ccp_alpha': 0.112, 'max_samples': 0.5}. Best is trial 74 with value: -0.18167313469617832.
[I 2025-04-15 23:38:38,087] Trial 576 finished with value: -0.1827941015217524 and parameters: {'n_estimators': 2616, 'min_samples_split': 188, 'max_features': 0.21000000000000002, 'min_samples_leaf': 29, 'criterion': 'absolute_error', 'max_depth': 30, 'min_weight_fraction_leaf': 0.01, 'max_leaf_nodes': 100, 'bootstrap': True, 'ccp_alpha': 0.099, 'max_samples': 0.5}. Best is trial 74 with value: -0.18167313469617832.
[I 2025-04-15 23:38:41,735] Trial 577 finished with value: -0.18284377984445394 and parameters: {'n_estimators': 3247, 'min_samples_split': 32, 'max_features': 0.78, 'min_samples_leaf': 24, 'criterion': 'absolute_error', 'max_depth': 60, 'min_weight_fraction_leaf': 0.02, 'max_leaf_nodes': None, 'bootstrap': True, 'ccp_alpha': 0.139, 'max_samples': 0.5}. Best is trial 74 with value: -0.18167313469617832.
[I 2025-04-15 23:38:45,513] Trial 578 finished with value: -0.18334561014665302 and parameters: {'n_estimators': 3599, 'min_samples_split': 175, 'max_features': 0.85, 'min_samples_leaf': 33, 'criterion': 'absolute_error', 'max_depth': 5, 'min_weight_fraction_leaf': 0.02, 'max_leaf_nodes': 150, 'bootstrap': True, 'ccp_alpha': 0.083, 'max_samples': 0.5}. Best is trial 74 with value: -0.18167313469617832.
[I 2025-04-15 23:38:48,650] Trial 579 finished with value: -0.19327246449009822 and parameters: {'n_estimators': 2811, 'min_samples_split': 166, 'max_features': 0.76, 'min_samples_leaf': 22, 'criterion': 'absolute_error', 'max_depth': 15, 'min_weight_fraction_leaf': 0.04, 'max_leaf_nodes': 10, 'bootstrap': True, 'ccp_alpha': 0.123, 'max_samples': None}. Best is trial 74 with value: -0.18167313469617832.
[I 2025-04-15 23:38:52,067] Trial 580 finished with value: -0.18250556974403098 and parameters: {'n_estimators': 3086, 'min_samples_split': 39, 'max_features': 0.88, 'min_samples_leaf': 31, 'criterion': 'absolute_error', 'max_depth': None, 'min_weight_fraction_leaf': 0.02, 'max_leaf_nodes': 100, 'bootstrap': True, 'ccp_alpha': 0.073, 'max_samples': 0.5}. Best is trial 74 with value: -0.18167313469617832.
[I 2025-04-15 23:38:56,250] Trial 581 finished with value: -0.1831474259084914 and parameters: {'n_estimators': 3440, 'min_samples_split': 30, 'max_features': 0.89, 'min_samples_leaf': 33, 'criterion': 'absolute_error', 'max_depth': None, 'min_weight_fraction_leaf': 0.02, 'max_leaf_nodes': 100, 'bootstrap': True, 'ccp_alpha': 0.075, 'max_samples': 0.5}. Best is trial 74 with value: -0.18167313469617832.
[I 2025-04-15 23:38:59,696] Trial 582 finished with value: -0.1827218451593903 and parameters: {'n_estimators': 3184, 'min_samples_split': 40, 'max_features': 0.88, 'min_samples_leaf': 35, 'criterion': 'absolute_error', 'max_depth': 30, 'min_weight_fraction_leaf': 0.02, 'max_leaf_nodes': 100, 'bootstrap': True, 'ccp_alpha': 0.07, 'max_samples': 0.5}. Best is trial 74 with value: -0.18167313469617832.
[I 2025-04-15 23:39:03,077] Trial 583 finished with value: -0.18259513476335987 and parameters: {'n_estimators': 3117, 'min_samples_split': 34, 'max_features': 0.91, 'min_samples_leaf': 31, 'criterion': 'absolute_error', 'max_depth': None, 'min_weight_fraction_leaf': 0.02, 'max_leaf_nodes': 100, 'bootstrap': True, 'ccp_alpha': 0.081, 'max_samples': 0.5}. Best is trial 74 with value: -0.18167313469617832.
[I 2025-04-15 23:39:06,161] Trial 584 finished with value: -18.15149056785747 and parameters: {'n_estimators': 2893, 'min_samples_split': 39, 'max_features': 0.06999999999999999, 'min_samples_leaf': 31, 'criterion': 'squared_error', 'max_depth': None, 'min_weight_fraction_leaf': 0.03, 'max_leaf_nodes': 100, 'bootstrap': True, 'ccp_alpha': 0.075, 'max_samples': 0.5}. Best is trial 74 with value: -0.18167313469617832.
[I 2025-04-15 23:39:09,416] Trial 585 finished with value: -0.1936417107583833 and parameters: {'n_estimators': 3794, 'min_samples_split': 157, 'max_features': 0.9400000000000001, 'min_samples_leaf': 30, 'criterion': 'absolute_error', 'max_depth': None, 'min_weight_fraction_leaf': 0.02, 'max_leaf_nodes': 100, 'bootstrap': False, 'ccp_alpha': 0.089}. Best is trial 74 with value: -0.18167313469617832.
