[I 2025-04-16 00:49:57,063] Trial 1876 finished with value: -8.758994768006966 and parameters: {'n_estimators': 3769, 'min_samples_split': 7, 'max_features': 0.98, 'min_samples_leaf': 9, 'criterion': 'absolute_error', 'max_depth': 60, 'min_weight_fraction_leaf': 0.01, 'max_leaf_nodes': 300, 'bootstrap': False, 'ccp_alpha': 0.0}. Best is trial 1828 with value: -0.15292978335836716.
[I 2025-04-16 00:50:00,641] Trial 1877 finished with value: -17.528986382273835 and parameters: {'n_estimators': 4137, 'min_samples_split': 16, 'max_features': 0.93, 'min_samples_leaf': 17, 'criterion': 'friedman_mse', 'max_depth': 60, 'min_weight_fraction_leaf': 0.0, 'max_leaf_nodes': 150, 'bootstrap': False, 'ccp_alpha': 0.015}. Best is trial 1828 with value: -0.15292978335836716.
[I 2025-04-16 00:50:04,580] Trial 1878 finished with value: -0.1936417107583833 and parameters: {'n_estimators': 4518, 'min_samples_split': 23, 'max_features': 0.9500000000000001, 'min_samples_leaf': 11, 'criterion': 'absolute_error', 'max_depth': 60, 'min_weight_fraction_leaf': 0.01, 'max_leaf_nodes': 150, 'bootstrap': False, 'ccp_alpha': 0.005}. Best is trial 1828 with value: -0.15292978335836716.
[I 2025-04-16 00:50:08,310] Trial 1879 finished with value: -0.1936417107583833 and parameters: {'n_estimators': 3963, 'min_samples_split': 12, 'max_features': 0.91, 'min_samples_leaf': 19, 'criterion': 'absolute_error', 'max_depth': 60, 'min_weight_fraction_leaf': 0.01, 'max_leaf_nodes': 150, 'bootstrap': False, 'ccp_alpha': 0.005}. Best is trial 1828 with value: -0.15292978335836716.
[I 2025-04-16 00:50:11,729] Trial 1880 finished with value: -0.19362495879091052 and parameters: {'n_estimators': 4307, 'min_samples_split': 17, 'max_features': 0.97, 'min_samples_leaf': 15, 'criterion': 'absolute_error', 'max_depth': 60, 'min_weight_fraction_leaf': 0.01, 'max_leaf_nodes': 150, 'bootstrap': False, 'ccp_alpha': 0.0}. Best is trial 1828 with value: -0.15292978335836716.
[I 2025-04-16 00:50:15,006] Trial 1881 finished with value: -0.1936417107583833 and parameters: {'n_estimators': 3630, 'min_samples_split': 8, 'max_features': 1.0, 'min_samples_leaf': 12, 'criterion': 'absolute_error', 'max_depth': 60, 'min_weight_fraction_leaf': 0.01, 'max_leaf_nodes': 150, 'bootstrap': False, 'ccp_alpha': 0.01}. Best is trial 1828 with value: -0.15292978335836716.
[I 2025-04-16 00:50:18,914] Trial 1882 finished with value: -0.1936417107583833 and parameters: {'n_estimators': 4105, 'min_samples_split': 26, 'max_features': 0.9400000000000001, 'min_samples_leaf': 14, 'criterion': 'absolute_error', 'max_depth': 60, 'min_weight_fraction_leaf': 0.01, 'max_leaf_nodes': 150, 'bootstrap': False, 'ccp_alpha': 0.021}. Best is trial 1828 with value: -0.15292978335836716.
[I 2025-04-16 00:50:22,284] Trial 1883 finished with value: -0.1936417107583833 and parameters: {'n_estimators': 3818, 'min_samples_split': 5, 'max_features': 0.98, 'min_samples_leaf': 13, 'criterion': 'absolute_error', 'max_depth': 60, 'min_weight_fraction_leaf': 0.01, 'max_leaf_nodes': 150, 'bootstrap': False, 'ccp_alpha': 0.014}. Best is trial 1828 with value: -0.15292978335836716.
[I 2025-04-16 00:50:26,343] Trial 1884 finished with value: -0.1936417107583833 and parameters: {'n_estimators': 4654, 'min_samples_split': 21, 'max_features': 0.92, 'min_samples_leaf': 9, 'criterion': 'absolute_error', 'max_depth': 10, 'min_weight_fraction_leaf': 0.0, 'max_leaf_nodes': 150, 'bootstrap': False, 'ccp_alpha': 0.005}. Best is trial 1828 with value: -0.15292978335836716.
[I 2025-04-16 00:50:29,808] Trial 1885 finished with value: -0.19361581630739724 and parameters: {'n_estimators': 4402, 'min_samples_split': 15, 'max_features': 0.9600000000000001, 'min_samples_leaf': 16, 'criterion': 'absolute_error', 'max_depth': 60, 'min_weight_fraction_leaf': 0.01, 'max_leaf_nodes': 150, 'bootstrap': False, 'ccp_alpha': 0.0}. Best is trial 1828 with value: -0.15292978335836716.
[I 2025-04-16 00:50:33,425] Trial 1886 finished with value: -17.528986382273906 and parameters: {'n_estimators': 4097, 'min_samples_split': 2, 'max_features': 0.9500000000000001, 'min_samples_leaf': 11, 'criterion': 'squared_error', 'max_depth': 60, 'min_weight_fraction_leaf': 0.01, 'max_leaf_nodes': 150, 'bootstrap': False, 'ccp_alpha': 0.011}. Best is trial 1828 with value: -0.15292978335836716.
[I 2025-04-16 00:50:37,245] Trial 1887 finished with value: -0.1936417107583833 and parameters: {'n_estimators': 3975, 'min_samples_split': 11, 'max_features': 0.98, 'min_samples_leaf': 18, 'criterion': 'absolute_error', 'max_depth': 60, 'min_weight_fraction_leaf': 0.01, 'max_leaf_nodes': 150, 'bootstrap': False, 'ccp_alpha': 0.005}. Best is trial 1828 with value: -0.15292978335836716.
[I 2025-04-16 00:50:40,821] Trial 1888 finished with value: -0.15902643517620504 and parameters: {'n_estimators': 4267, 'min_samples_split': 19, 'max_features': 0.93, 'min_samples_leaf': 13, 'criterion': 'absolute_error', 'max_depth': 60, 'min_weight_fraction_leaf': 0.01, 'max_leaf_nodes': 150, 'bootstrap': False, 'ccp_alpha': 0.0}. Best is trial 1828 with value: -0.15292978335836716.
[I 2025-04-16 00:50:43,899] Trial 1889 finished with value: -0.1936417107583833 and parameters: {'n_estimators': 3591, 'min_samples_split': 28, 'max_features': 1.0, 'min_samples_leaf': 15, 'criterion': 'absolute_error', 'max_depth': 60, 'min_weight_fraction_leaf': 0.01, 'max_leaf_nodes': 150, 'bootstrap': False, 'ccp_alpha': 0.01}. Best is trial 1828 with value: -0.15292978335836716.
[I 2025-04-16 00:50:47,490] Trial 1890 finished with value: -0.1936417107583833 and parameters: {'n_estimators': 3811, 'min_samples_split': 22, 'max_features': 0.97, 'min_samples_leaf': 11, 'criterion': 'absolute_error', 'max_depth': 60, 'min_weight_fraction_leaf': 0.01, 'max_leaf_nodes': 150, 'bootstrap': False, 'ccp_alpha': 0.017}. Best is trial 1828 with value: -0.15292978335836716.
[I 2025-04-16 00:50:50,949] Trial 1891 finished with value: -0.1936417107583833 and parameters: {'n_estimators': 4158, 'min_samples_split': 25, 'max_features': 0.91, 'min_samples_leaf': 9, 'criterion': 'absolute_error', 'max_depth': 60, 'min_weight_fraction_leaf': 0.01, 'max_leaf_nodes': 150, 'bootstrap': False, 'ccp_alpha': 0.005}. Best is trial 1828 with value: -0.15292978335836716.
[I 2025-04-16 00:50:54,283] Trial 1892 finished with value: -35.86162732503577 and parameters: {'n_estimators': 3977, 'min_samples_split': 19, 'max_features': 0.9500000000000001, 'min_samples_leaf': 13, 'criterion': 'poisson', 'max_depth': 60, 'min_weight_fraction_leaf': 0.0, 'max_leaf_nodes': 20, 'bootstrap': False, 'ccp_alpha': 0.0}. Best is trial 1828 with value: -0.15292978335836716.
[I 2025-04-16 00:50:57,434] Trial 1893 finished with value: -0.1936417107583833 and parameters: {'n_estimators': 3773, 'min_samples_split': 25, 'max_features': 0.93, 'min_samples_leaf': 16, 'criterion': 'absolute_error', 'max_depth': 60, 'min_weight_fraction_leaf': 0.01, 'max_leaf_nodes': 150, 'bootstrap': False, 'ccp_alpha': 0.01}. Best is trial 1828 with value: -0.15292978335836716.
[I 2025-04-16 00:51:01,088] Trial 1894 finished with value: -0.1936417107583833 and parameters: {'n_estimators': 4476, 'min_samples_split': 19, 'max_features': 0.98, 'min_samples_leaf': 11, 'criterion': 'absolute_error', 'max_depth': 60, 'min_weight_fraction_leaf': 0.01, 'max_leaf_nodes': 150, 'bootstrap': False, 'ccp_alpha': 0.005}. Best is trial 1828 with value: -0.15292978335836716.
[I 2025-04-16 00:51:05,699] Trial 1895 finished with value: -0.1936417107583833 and parameters: {'n_estimators': 4269, 'min_samples_split': 21, 'max_features': 0.9600000000000001, 'min_samples_leaf': 14, 'criterion': 'absolute_error', 'max_depth': 60, 'min_weight_fraction_leaf': 0.01, 'max_leaf_nodes': 150, 'bootstrap': False, 'ccp_alpha': 0.014}. Best is trial 1828 with value: -0.15292978335836716.
[I 2025-04-16 00:51:08,469] Trial 1896 finished with value: -0.19364227178695964 and parameters: {'n_estimators': 3618, 'min_samples_split': 14, 'max_features': 0.9400000000000001, 'min_samples_leaf': 19, 'criterion': 'absolute_error', 'max_depth': 60, 'min_weight_fraction_leaf': 0.01, 'max_leaf_nodes': 150, 'bootstrap': False, 'ccp_alpha': 0.0}. Best is trial 1828 with value: -0.15292978335836716.
[I 2025-04-16 00:51:12,029] Trial 1897 finished with value: -0.1936417107583833 and parameters: {'n_estimators': 3971, 'min_samples_split': 28, 'max_features': 1.0, 'min_samples_leaf': 17, 'criterion': 'absolute_error', 'max_depth': 60, 'min_weight_fraction_leaf': 0.0, 'max_leaf_nodes': 150, 'bootstrap': False, 'ccp_alpha': 0.006}. Best is trial 1828 with value: -0.15292978335836716.
[I 2025-04-16 00:51:16,369] Trial 1898 finished with value: -0.1936417107583833 and parameters: {'n_estimators': 4767, 'min_samples_split': 17, 'max_features': 0.97, 'min_samples_leaf': 12, 'criterion': 'absolute_error', 'max_depth': 60, 'min_weight_fraction_leaf': 0.01, 'max_leaf_nodes': 150, 'bootstrap': False, 'ccp_alpha': 0.02}. Best is trial 1828 with value: -0.15292978335836716.
[I 2025-04-16 00:51:20,103] Trial 1899 finished with value: -0.1936417107583833 and parameters: {'n_estimators': 4161, 'min_samples_split': 8, 'max_features': 0.91, 'min_samples_leaf': 9, 'criterion': 'absolute_error', 'max_depth': 60, 'min_weight_fraction_leaf': 0.01, 'max_leaf_nodes': 150, 'bootstrap': False, 'ccp_alpha': 0.01}. Best is trial 1828 with value: -0.15292978335836716.
[I 2025-04-16 00:51:23,484] Trial 1900 finished with value: -0.19362493144513762 and parameters: {'n_estimators': 3853, 'min_samples_split': 23, 'max_features': 0.9500000000000001, 'min_samples_leaf': 15, 'criterion': 'absolute_error', 'max_depth': 60, 'min_weight_fraction_leaf': 0.01, 'max_leaf_nodes': 150, 'bootstrap': False, 'ccp_alpha': 0.0}. Best is trial 1828 with value: -0.15292978335836716.
[I 2025-04-16 00:51:26,766] Trial 1901 finished with value: -0.1936417107583833 and parameters: {'n_estimators': 4388, 'min_samples_split': 12, 'max_features': 0.98, 'min_samples_leaf': 13, 'criterion': 'absolute_error', 'max_depth': 60, 'min_weight_fraction_leaf': 0.01, 'max_leaf_nodes': 150, 'bootstrap': False, 'ccp_alpha': 0.005}. Best is trial 1828 with value: -0.15292978335836716.
[I 2025-04-16 00:51:30,487] Trial 1902 finished with value: -17.528986382273843 and parameters: {'n_estimators': 4133, 'min_samples_split': 19, 'max_features': 0.93, 'min_samples_leaf': 11, 'criterion': 'friedman_mse', 'max_depth': 60, 'min_weight_fraction_leaf': 0.01, 'max_leaf_nodes': 300, 'bootstrap': False, 'ccp_alpha': 0.011}. Best is trial 1828 with value: -0.15292978335836716.
[I 2025-04-16 00:51:34,103] Trial 1903 finished with value: -0.1936417107583833 and parameters: {'n_estimators': 3737, 'min_samples_split': 14, 'max_features': 0.9600000000000001, 'min_samples_leaf': 15, 'criterion': 'absolute_error', 'max_depth': 60, 'min_weight_fraction_leaf': 0.01, 'max_leaf_nodes': 150, 'bootstrap': False, 'ccp_alpha': 0.006}. Best is trial 1828 with value: -0.15292978335836716.
[I 2025-04-16 00:51:36,963] Trial 1904 finished with value: -8.797426699089144 and parameters: {'n_estimators': 3969, 'min_samples_split': 29, 'max_features': 0.98, 'min_samples_leaf': 9, 'criterion': 'absolute_error', 'max_depth': 60, 'min_weight_fraction_leaf': 0.0, 'max_leaf_nodes': 150, 'bootstrap': False, 'ccp_alpha': 0.0}. Best is trial 1828 with value: -0.15292978335836716.
[I 2025-04-16 00:51:40,699] Trial 1905 finished with value: -0.1936417107583833 and parameters: {'n_estimators': 4573, 'min_samples_split': 9, 'max_features': 0.9400000000000001, 'min_samples_leaf': 13, 'criterion': 'absolute_error', 'max_depth': 60, 'min_weight_fraction_leaf': 0.01, 'max_leaf_nodes': 150, 'bootstrap': False, 'ccp_alpha': 0.016}. Best is trial 1828 with value: -0.15292978335836716.
[I 2025-04-16 00:51:44,246] Trial 1906 finished with value: -0.1936417107583833 and parameters: {'n_estimators': 4292, 'min_samples_split': 16, 'max_features': 1.0, 'min_samples_leaf': 17, 'criterion': 'absolute_error', 'max_depth': 60, 'min_weight_fraction_leaf': 0.01, 'max_leaf_nodes': 150, 'bootstrap': False, 'ccp_alpha': 0.006}. Best is trial 1828 with value: -0.15292978335836716.
[I 2025-04-16 00:51:47,235] Trial 1907 finished with value: -8.744340023008801 and parameters: {'n_estimators': 4039, 'min_samples_split': 24, 'max_features': 0.9600000000000001, 'min_samples_leaf': 11, 'criterion': 'absolute_error', 'max_depth': 60, 'min_weight_fraction_leaf': 0.01, 'max_leaf_nodes': 150, 'bootstrap': False, 'ccp_alpha': 0.0}. Best is trial 1828 with value: -0.15292978335836716.
[I 2025-04-16 00:51:50,376] Trial 1908 finished with value: -0.1936417107583833 and parameters: {'n_estimators': 3572, 'min_samples_split': 19, 'max_features': 0.91, 'min_samples_leaf': 14, 'criterion': 'absolute_error', 'max_depth': 60, 'min_weight_fraction_leaf': 0.01, 'max_leaf_nodes': 150, 'bootstrap': False, 'ccp_alpha': 0.011}. Best is trial 1828 with value: -0.15292978335836716.
[I 2025-04-16 00:51:54,166] Trial 1909 finished with value: -0.1936417107583833 and parameters: {'n_estimators': 3800, 'min_samples_split': 11, 'max_features': 0.93, 'min_samples_leaf': 16, 'criterion': 'absolute_error', 'max_depth': 60, 'min_weight_fraction_leaf': 0.0, 'max_leaf_nodes': 150, 'bootstrap': False, 'ccp_alpha': 0.006}. Best is trial 1828 with value: -0.15292978335836716.
[I 2025-04-16 00:51:57,783] Trial 1910 finished with value: -36.5611104421435 and parameters: {'n_estimators': 4272, 'min_samples_split': 5, 'max_features': 0.98, 'min_samples_leaf': 12, 'criterion': 'squared_error', 'max_depth': 60, 'min_weight_fraction_leaf': 0.01, 'max_leaf_nodes': 150, 'bootstrap': False, 'ccp_alpha': 0.0}. Best is trial 1828 with value: -0.15292978335836716.
[I 2025-04-16 00:52:01,217] Trial 1911 finished with value: -0.1936417107583833 and parameters: {'n_estimators': 3976, 'min_samples_split': 15, 'max_features': 0.9500000000000001, 'min_samples_leaf': 9, 'criterion': 'absolute_error', 'max_depth': 60, 'min_weight_fraction_leaf': 0.01, 'max_leaf_nodes': 150, 'bootstrap': False, 'ccp_alpha': 0.016}. Best is trial 1828 with value: -0.15292978335836716.
[I 2025-04-16 00:52:05,190] Trial 1912 finished with value: -0.1936417107583833 and parameters: {'n_estimators': 4531, 'min_samples_split': 22, 'max_features': 0.92, 'min_samples_leaf': 19, 'criterion': 'absolute_error', 'max_depth': 10, 'min_weight_fraction_leaf': 0.01, 'max_leaf_nodes': 150, 'bootstrap': False, 'ccp_alpha': 0.006}. Best is trial 1828 with value: -0.15292978335836716.
[I 2025-04-16 00:52:08,626] Trial 1913 finished with value: -0.1936417107583833 and parameters: {'n_estimators': 4174, 'min_samples_split': 18, 'max_features': 0.9600000000000001, 'min_samples_leaf': 14, 'criterion': 'absolute_error', 'max_depth': 60, 'min_weight_fraction_leaf': 0.01, 'max_leaf_nodes': 150, 'bootstrap': False, 'ccp_alpha': 0.01}. Best is trial 1828 with value: -0.15292978335836716.
[I 2025-04-16 00:52:11,890] Trial 1914 finished with value: -0.1936417107583833 and parameters: {'n_estimators': 3579, 'min_samples_split': 11, 'max_features': 0.99, 'min_samples_leaf': 11, 'criterion': 'absolute_error', 'max_depth': 60, 'min_weight_fraction_leaf': 0.01, 'max_leaf_nodes': 150, 'bootstrap': False, 'ccp_alpha': 0.022}. Best is trial 1828 with value: -0.15292978335836716.
[I 2025-04-16 00:52:15,228] Trial 1915 finished with value: -0.1936417107583833 and parameters: {'n_estimators': 3800, 'min_samples_split': 15, 'max_features': 0.9400000000000001, 'min_samples_leaf': 13, 'criterion': 'absolute_error', 'max_depth': 60, 'min_weight_fraction_leaf': 0.01, 'max_leaf_nodes': 150, 'bootstrap': False, 'ccp_alpha': 0.005}. Best is trial 1828 with value: -0.15292978335836716.
[I 2025-04-16 00:52:18,851] Trial 1916 finished with value: -31.364049029976968 and parameters: {'n_estimators': 4364, 'min_samples_split': 6, 'max_features': 0.97, 'min_samples_leaf': 16, 'criterion': 'poisson', 'max_depth': 60, 'min_weight_fraction_leaf': 0.0, 'max_leaf_nodes': 150, 'bootstrap': False, 'ccp_alpha': 0.0}. Best is trial 1828 with value: -0.15292978335836716.
[I 2025-04-16 00:52:27,694] Trial 1917 finished with value: -0.1936417107583833 and parameters: {'n_estimators': 9997, 'min_samples_split': 25, 'max_features': 1.0, 'min_samples_leaf': 10, 'criterion': 'absolute_error', 'max_depth': 60, 'min_weight_fraction_leaf': 0.01, 'max_leaf_nodes': 150, 'bootstrap': False, 'ccp_alpha': 0.01}. Best is trial 1828 with value: -0.15292978335836716.
[I 2025-04-16 00:52:30,892] Trial 1918 finished with value: -0.1936212813341111 and parameters: {'n_estimators': 4028, 'min_samples_split': 21, 'max_features': 0.91, 'min_samples_leaf': 14, 'criterion': 'absolute_error', 'max_depth': 60, 'min_weight_fraction_leaf': 0.01, 'max_leaf_nodes': 20, 'bootstrap': False, 'ccp_alpha': 0.0}. Best is trial 1828 with value: -0.15292978335836716.
[I 2025-04-16 00:52:34,629] Trial 1919 finished with value: -0.1936417107583833 and parameters: {'n_estimators': 4127, 'min_samples_split': 12, 'max_features': 0.9500000000000001, 'min_samples_leaf': 12, 'criterion': 'absolute_error', 'max_depth': 60, 'min_weight_fraction_leaf': 0.01, 'max_leaf_nodes': 150, 'bootstrap': False, 'ccp_alpha': 0.015}. Best is trial 1828 with value: -0.15292978335836716.
[I 2025-04-16 00:52:38,512] Trial 1920 finished with value: -0.1936417107583833 and parameters: {'n_estimators': 4783, 'min_samples_split': 17, 'max_features': 0.97, 'min_samples_leaf': 18, 'criterion': 'absolute_error', 'max_depth': 60, 'min_weight_fraction_leaf': 0.01, 'max_leaf_nodes': 150, 'bootstrap': False, 'ccp_alpha': 0.006}. Best is trial 1828 with value: -0.15292978335836716.
[I 2025-04-16 00:52:41,369] Trial 1921 finished with value: -0.19362495217460451 and parameters: {'n_estimators': 3775, 'min_samples_split': 9, 'max_features': 0.9400000000000001, 'min_samples_leaf': 15, 'criterion': 'absolute_error', 'max_depth': 60, 'min_weight_fraction_leaf': 0.0, 'max_leaf_nodes': 150, 'bootstrap': False, 'ccp_alpha': 0.0}. Best is trial 1828 with value: -0.15292978335836716.
[I 2025-04-16 00:52:45,543] Trial 1922 finished with value: -0.1936417107583833 and parameters: {'n_estimators': 4421, 'min_samples_split': 20, 'max_features': 0.98, 'min_samples_leaf': 8, 'criterion': 'absolute_error', 'max_depth': 60, 'min_weight_fraction_leaf': 0.01, 'max_leaf_nodes': 150, 'bootstrap': False, 'ccp_alpha': 0.011}. Best is trial 1828 with value: -0.15292978335836716.
[I 2025-04-16 00:52:49,185] Trial 1923 finished with value: -0.1936417107583833 and parameters: {'n_estimators': 3916, 'min_samples_split': 77, 'max_features': 0.93, 'min_samples_leaf': 12, 'criterion': 'absolute_error', 'max_depth': 60, 'min_weight_fraction_leaf': 0.01, 'max_leaf_nodes': 150, 'bootstrap': False, 'ccp_alpha': 0.005}. Best is trial 1828 with value: -0.15292978335836716.
[I 2025-04-16 00:52:53,161] Trial 1924 finished with value: -0.1936417107583833 and parameters: {'n_estimators': 4235, 'min_samples_split': 2, 'max_features': 1.0, 'min_samples_leaf': 17, 'criterion': 'absolute_error', 'max_depth': 60, 'min_weight_fraction_leaf': 0.01, 'max_leaf_nodes': 150, 'bootstrap': False, 'ccp_alpha': 0.006}. Best is trial 1828 with value: -0.15292978335836716.
[I 2025-04-16 00:52:56,160] Trial 1925 finished with value: -0.1936417107583833 and parameters: {'n_estimators': 3588, 'min_samples_split': 29, 'max_features': 0.9600000000000001, 'min_samples_leaf': 10, 'criterion': 'absolute_error', 'max_depth': 60, 'min_weight_fraction_leaf': 0.01, 'max_leaf_nodes': 150, 'bootstrap': False, 'ccp_alpha': 0.018000000000000002}. Best is trial 1828 with value: -0.15292978335836716.
[I 2025-04-16 00:52:59,223] Trial 1926 finished with value: -0.1936417107583833 and parameters: {'n_estimators': 4044, 'min_samples_split': 13, 'max_features': 0.92, 'min_samples_leaf': 89, 'criterion': 'absolute_error', 'max_depth': 60, 'min_weight_fraction_leaf': 0.01, 'max_leaf_nodes': 300, 'bootstrap': False, 'ccp_alpha': 0.0}. Best is trial 1828 with value: -0.15292978335836716.
[I 2025-04-16 00:53:03,047] Trial 1927 finished with value: -0.1936417107583833 and parameters: {'n_estimators': 4574, 'min_samples_split': 24, 'max_features': 0.9500000000000001, 'min_samples_leaf': 14, 'criterion': 'absolute_error', 'max_depth': 60, 'min_weight_fraction_leaf': 0.01, 'max_leaf_nodes': 150, 'bootstrap': False, 'ccp_alpha': 0.013000000000000001}. Best is trial 1828 with value: -0.15292978335836716.
[I 2025-04-16 00:53:06,305] Trial 1928 finished with value: -17.52898638227429 and parameters: {'n_estimators': 3908, 'min_samples_split': 17, 'max_features': 0.98, 'min_samples_leaf': 13, 'criterion': 'friedman_mse', 'max_depth': 60, 'min_weight_fraction_leaf': 0.0, 'max_leaf_nodes': 150, 'bootstrap': False, 'ccp_alpha': 0.006}. Best is trial 1828 with value: -0.15292978335836716.
[I 2025-04-16 00:53:09,514] Trial 1929 finished with value: -0.19361575056358 and parameters: {'n_estimators': 4224, 'min_samples_split': 7, 'max_features': 0.9600000000000001, 'min_samples_leaf': 16, 'criterion': 'absolute_error', 'max_depth': 60, 'min_weight_fraction_leaf': 0.01, 'max_leaf_nodes': 150, 'bootstrap': False, 'ccp_alpha': 0.0}. Best is trial 1828 with value: -0.15292978335836716.
[I 2025-04-16 00:53:13,371] Trial 1930 finished with value: -0.1936417107583833 and parameters: {'n_estimators': 3805, 'min_samples_split': 13, 'max_features': 0.93, 'min_samples_leaf': 10, 'criterion': 'absolute_error', 'max_depth': 60, 'min_weight_fraction_leaf': 0.01, 'max_leaf_nodes': 150, 'bootstrap': False, 'ccp_alpha': 0.01}. Best is trial 1828 with value: -0.15292978335836716.
[I 2025-04-16 00:53:17,730] Trial 1931 finished with value: -0.1936417107583833 and parameters: {'n_estimators': 4392, 'min_samples_split': 20, 'max_features': 0.98, 'min_samples_leaf': 12, 'criterion': 'absolute_error', 'max_depth': 60, 'min_weight_fraction_leaf': 0.01, 'max_leaf_nodes': 150, 'bootstrap': False, 'ccp_alpha': 0.292}. Best is trial 1828 with value: -0.15292978335836716.
