[I 2025-04-16 00:27:02,196] Trial 1490 finished with value: -0.1590706210221415 and parameters: {'n_estimators': 3818, 'min_samples_split': 19, 'max_features': 0.9500000000000001, 'min_samples_leaf': 13, 'criterion': 'absolute_error', 'max_depth': 60, 'min_weight_fraction_leaf': 0.01, 'max_leaf_nodes': 150, 'bootstrap': False, 'ccp_alpha': 0.0}. Best is trial 1439 with value: -0.15896829431478016.
[I 2025-04-16 00:27:05,453] Trial 1491 finished with value: -39.2656463585847 and parameters: {'n_estimators': 4257, 'min_samples_split': 19, 'max_features': 0.9400000000000001, 'min_samples_leaf': 14, 'criterion': 'friedman_mse', 'max_depth': 60, 'min_weight_fraction_leaf': 0.01, 'max_leaf_nodes': 150, 'bootstrap': False, 'ccp_alpha': 0.0}. Best is trial 1439 with value: -0.15896829431478016.
[I 2025-04-16 00:27:09,271] Trial 1492 finished with value: -0.1936213439034553 and parameters: {'n_estimators': 4387, 'min_samples_split': 18, 'max_features': 0.9600000000000001, 'min_samples_leaf': 14, 'criterion': 'absolute_error', 'max_depth': 60, 'min_weight_fraction_leaf': 0.01, 'max_leaf_nodes': 150, 'bootstrap': False, 'ccp_alpha': 0.0}. Best is trial 1439 with value: -0.15896829431478016.
[I 2025-04-16 00:27:12,778] Trial 1493 finished with value: -0.1936417107583833 and parameters: {'n_estimators': 3985, 'min_samples_split': 16, 'max_features': 0.9500000000000001, 'min_samples_leaf': 17, 'criterion': 'absolute_error', 'max_depth': 60, 'min_weight_fraction_leaf': 0.01, 'max_leaf_nodes': 150, 'bootstrap': False, 'ccp_alpha': 0.006}. Best is trial 1439 with value: -0.15896829431478016.
[I 2025-04-16 00:27:16,278] Trial 1494 finished with value: -0.1936417107583833 and parameters: {'n_estimators': 3828, 'min_samples_split': 15, 'max_features': 0.9600000000000001, 'min_samples_leaf': 16, 'criterion': 'absolute_error', 'max_depth': 60, 'min_weight_fraction_leaf': 0.01, 'max_leaf_nodes': 150, 'bootstrap': False, 'ccp_alpha': 0.005}. Best is trial 1439 with value: -0.15896829431478016.
[I 2025-04-16 00:27:19,597] Trial 1495 finished with value: -0.1590232155089148 and parameters: {'n_estimators': 4090, 'min_samples_split': 20, 'max_features': 0.9400000000000001, 'min_samples_leaf': 13, 'criterion': 'absolute_error', 'max_depth': 60, 'min_weight_fraction_leaf': 0.01, 'max_leaf_nodes': 150, 'bootstrap': False, 'ccp_alpha': 0.0}. Best is trial 1439 with value: -0.15896829431478016.
[I 2025-04-16 00:27:22,725] Trial 1496 finished with value: -0.159043710610025 and parameters: {'n_estimators': 3842, 'min_samples_split': 20, 'max_features': 0.9400000000000001, 'min_samples_leaf': 13, 'criterion': 'absolute_error', 'max_depth': 60, 'min_weight_fraction_leaf': 0.01, 'max_leaf_nodes': 150, 'bootstrap': False, 'ccp_alpha': 0.0}. Best is trial 1439 with value: -0.15896829431478016.
[I 2025-04-16 00:27:26,292] Trial 1497 finished with value: -0.1936417107583833 and parameters: {'n_estimators': 3891, 'min_samples_split': 20, 'max_features': 0.9400000000000001, 'min_samples_leaf': 13, 'criterion': 'absolute_error', 'max_depth': 60, 'min_weight_fraction_leaf': 0.01, 'max_leaf_nodes': 150, 'bootstrap': False, 'ccp_alpha': 0.001}. Best is trial 1439 with value: -0.15896829431478016.
[I 2025-04-16 00:27:29,475] Trial 1498 finished with value: -0.1936249321051376 and parameters: {'n_estimators': 3849, 'min_samples_split': 20, 'max_features': 0.9400000000000001, 'min_samples_leaf': 15, 'criterion': 'absolute_error', 'max_depth': 60, 'min_weight_fraction_leaf': 0.01, 'max_leaf_nodes': 150, 'bootstrap': False, 'ccp_alpha': 0.0}. Best is trial 1439 with value: -0.15896829431478016.
[I 2025-04-16 00:27:32,502] Trial 1499 finished with value: -35.89854703502147 and parameters: {'n_estimators': 3810, 'min_samples_split': 19, 'max_features': 0.9400000000000001, 'min_samples_leaf': 13, 'criterion': 'squared_error', 'max_depth': 60, 'min_weight_fraction_leaf': 0.01, 'max_leaf_nodes': 150, 'bootstrap': False, 'ccp_alpha': 0.0}. Best is trial 1439 with value: -0.15896829431478016.
[I 2025-04-16 00:27:35,616] Trial 1500 finished with value: -0.1936421865626111 and parameters: {'n_estimators': 4043, 'min_samples_split': 19, 'max_features': 0.9400000000000001, 'min_samples_leaf': 17, 'criterion': 'absolute_error', 'max_depth': 60, 'min_weight_fraction_leaf': 0.01, 'max_leaf_nodes': 150, 'bootstrap': False, 'ccp_alpha': 0.0}. Best is trial 1439 with value: -0.15896829431478016.
[I 2025-04-16 00:27:39,855] Trial 1501 finished with value: -0.1936417107583833 and parameters: {'n_estimators': 4412, 'min_samples_split': 20, 'max_features': 0.9400000000000001, 'min_samples_leaf': 12, 'criterion': 'absolute_error', 'max_depth': 60, 'min_weight_fraction_leaf': 0.01, 'max_leaf_nodes': 150, 'bootstrap': False, 'ccp_alpha': 0.009000000000000001}. Best is trial 1439 with value: -0.15896829431478016.
[I 2025-04-16 00:27:43,560] Trial 1502 finished with value: -0.1936417107583833 and parameters: {'n_estimators': 3808, 'min_samples_split': 17, 'max_features': 0.9400000000000001, 'min_samples_leaf': 15, 'criterion': 'absolute_error', 'max_depth': 60, 'min_weight_fraction_leaf': 0.01, 'max_leaf_nodes': 150, 'bootstrap': False, 'ccp_alpha': 0.007}. Best is trial 1439 with value: -0.15896829431478016.
[I 2025-04-16 00:27:46,666] Trial 1503 finished with value: -0.15899712942612163 and parameters: {'n_estimators': 4052, 'min_samples_split': 16, 'max_features': 0.9600000000000001, 'min_samples_leaf': 13, 'criterion': 'absolute_error', 'max_depth': 60, 'min_weight_fraction_leaf': 0.01, 'max_leaf_nodes': 150, 'bootstrap': False, 'ccp_alpha': 0.0}. Best is trial 1439 with value: -0.15896829431478016.
[I 2025-04-16 00:27:50,674] Trial 1504 finished with value: -0.1936417107583833 and parameters: {'n_estimators': 3979, 'min_samples_split': 15, 'max_features': 0.9400000000000001, 'min_samples_leaf': 17, 'criterion': 'absolute_error', 'max_depth': 60, 'min_weight_fraction_leaf': 0.01, 'max_leaf_nodes': 150, 'bootstrap': False, 'ccp_alpha': 0.005}. Best is trial 1439 with value: -0.15896829431478016.
[I 2025-04-16 00:27:54,885] Trial 1505 finished with value: -30.82489634570063 and parameters: {'n_estimators': 4069, 'min_samples_split': 20, 'max_features': 0.93, 'min_samples_leaf': 14, 'criterion': 'poisson', 'max_depth': 60, 'min_weight_fraction_leaf': 0.01, 'max_leaf_nodes': 150, 'bootstrap': False, 'ccp_alpha': 0.009000000000000001}. Best is trial 1439 with value: -0.15896829431478016.
[I 2025-04-16 00:27:58,187] Trial 1506 finished with value: -0.15910039425242295 and parameters: {'n_estimators': 3789, 'min_samples_split': 16, 'max_features': 0.9600000000000001, 'min_samples_leaf': 13, 'criterion': 'absolute_error', 'max_depth': 60, 'min_weight_fraction_leaf': 0.01, 'max_leaf_nodes': 150, 'bootstrap': False, 'ccp_alpha': 0.0}. Best is trial 1439 with value: -0.15896829431478016.
[I 2025-04-16 00:28:01,059] Trial 1507 finished with value: -0.19362495224792706 and parameters: {'n_estimators': 3785, 'min_samples_split': 20, 'max_features': 0.9400000000000001, 'min_samples_leaf': 15, 'criterion': 'absolute_error', 'max_depth': 60, 'min_weight_fraction_leaf': 0.01, 'max_leaf_nodes': 150, 'bootstrap': False, 'ccp_alpha': 0.0}. Best is trial 1439 with value: -0.15896829431478016.
[I 2025-04-16 00:28:04,246] Trial 1508 finished with value: -0.1936417107583833 and parameters: {'n_estimators': 3823, 'min_samples_split': 16, 'max_features': 0.9600000000000001, 'min_samples_leaf': 13, 'criterion': 'absolute_error', 'max_depth': 60, 'min_weight_fraction_leaf': 0.01, 'max_leaf_nodes': 150, 'bootstrap': False, 'ccp_alpha': 0.009000000000000001}. Best is trial 1439 with value: -0.15896829431478016.
[I 2025-04-16 00:28:07,831] Trial 1509 finished with value: -0.1936421865184208 and parameters: {'n_estimators': 3990, 'min_samples_split': 14, 'max_features': 0.93, 'min_samples_leaf': 17, 'criterion': 'absolute_error', 'max_depth': 60, 'min_weight_fraction_leaf': 0.01, 'max_leaf_nodes': 150, 'bootstrap': False, 'ccp_alpha': 0.0}. Best is trial 1439 with value: -0.15896829431478016.
[I 2025-04-16 00:28:11,433] Trial 1510 finished with value: -0.1936417107583833 and parameters: {'n_estimators': 3821, 'min_samples_split': 21, 'max_features': 0.9600000000000001, 'min_samples_leaf': 12, 'criterion': 'absolute_error', 'max_depth': 60, 'min_weight_fraction_leaf': 0.01, 'max_leaf_nodes': 150, 'bootstrap': False, 'ccp_alpha': 0.01}. Best is trial 1439 with value: -0.15896829431478016.
[I 2025-04-16 00:28:14,818] Trial 1511 finished with value: -0.1936417107583833 and parameters: {'n_estimators': 4031, 'min_samples_split': 16, 'max_features': 0.9400000000000001, 'min_samples_leaf': 15, 'criterion': 'absolute_error', 'max_depth': 60, 'min_weight_fraction_leaf': 0.01, 'max_leaf_nodes': 150, 'bootstrap': False, 'ccp_alpha': 0.005}. Best is trial 1439 with value: -0.15896829431478016.
[I 2025-04-16 00:28:18,066] Trial 1512 finished with value: -0.15898241881472294 and parameters: {'n_estimators': 4168, 'min_samples_split': 20, 'max_features': 0.9600000000000001, 'min_samples_leaf': 13, 'criterion': 'absolute_error', 'max_depth': 60, 'min_weight_fraction_leaf': 0.01, 'max_leaf_nodes': 150, 'bootstrap': False, 'ccp_alpha': 0.0}. Best is trial 1439 with value: -0.15896829431478016.
[I 2025-04-16 00:28:20,985] Trial 1513 finished with value: -0.19361575046794677 and parameters: {'n_estimators': 4193, 'min_samples_split': 20, 'max_features': 0.9600000000000001, 'min_samples_leaf': 16, 'criterion': 'absolute_error', 'max_depth': 60, 'min_weight_fraction_leaf': 0.01, 'max_leaf_nodes': 150, 'bootstrap': False, 'ccp_alpha': 0.0}. Best is trial 1439 with value: -0.15896829431478016.
[I 2025-04-16 00:28:24,487] Trial 1514 finished with value: -0.1936417107583833 and parameters: {'n_estimators': 4222, 'min_samples_split': 20, 'max_features': 0.93, 'min_samples_leaf': 13, 'criterion': 'absolute_error', 'max_depth': 60, 'min_weight_fraction_leaf': 0.01, 'max_leaf_nodes': 150, 'bootstrap': False, 'ccp_alpha': 0.005}. Best is trial 1439 with value: -0.15896829431478016.
[I 2025-04-16 00:28:27,822] Trial 1515 finished with value: -0.19362130928326424 and parameters: {'n_estimators': 3806, 'min_samples_split': 20, 'max_features': 0.9600000000000001, 'min_samples_leaf': 14, 'criterion': 'absolute_error', 'max_depth': 60, 'min_weight_fraction_leaf': 0.01, 'max_leaf_nodes': 150, 'bootstrap': False, 'ccp_alpha': 0.0}. Best is trial 1439 with value: -0.15896829431478016.
[I 2025-04-16 00:28:30,923] Trial 1516 finished with value: -0.1936417107583833 and parameters: {'n_estimators': 3741, 'min_samples_split': 14, 'max_features': 0.93, 'min_samples_leaf': 17, 'criterion': 'absolute_error', 'max_depth': 60, 'min_weight_fraction_leaf': 0.01, 'max_leaf_nodes': 150, 'bootstrap': False, 'ccp_alpha': 0.01}. Best is trial 1439 with value: -0.15896829431478016.
[I 2025-04-16 00:28:34,295] Trial 1517 finished with value: -0.1936417107583833 and parameters: {'n_estimators': 3966, 'min_samples_split': 16, 'max_features': 0.9600000000000001, 'min_samples_leaf': 12, 'criterion': 'absolute_error', 'max_depth': 60, 'min_weight_fraction_leaf': 0.01, 'max_leaf_nodes': 150, 'bootstrap': False, 'ccp_alpha': 0.005}. Best is trial 1439 with value: -0.15896829431478016.
[I 2025-04-16 00:28:37,662] Trial 1518 finished with value: -39.27570502401873 and parameters: {'n_estimators': 4198, 'min_samples_split': 21, 'max_features': 0.9400000000000001, 'min_samples_leaf': 14, 'criterion': 'friedman_mse', 'max_depth': 60, 'min_weight_fraction_leaf': 0.01, 'max_leaf_nodes': 150, 'bootstrap': False, 'ccp_alpha': 0.0}. Best is trial 1439 with value: -0.15896829431478016.
[I 2025-04-16 00:28:40,835] Trial 1519 finished with value: -0.1936417107583833 and parameters: {'n_estimators': 3769, 'min_samples_split': 17, 'max_features': 0.97, 'min_samples_leaf': 16, 'criterion': 'absolute_error', 'max_depth': 60, 'min_weight_fraction_leaf': 0.01, 'max_leaf_nodes': 150, 'bootstrap': False, 'ccp_alpha': 0.011}. Best is trial 1439 with value: -0.15896829431478016.
[I 2025-04-16 00:28:44,457] Trial 1520 finished with value: -0.1936417107583833 and parameters: {'n_estimators': 4373, 'min_samples_split': 14, 'max_features': 0.9600000000000001, 'min_samples_leaf': 12, 'criterion': 'absolute_error', 'max_depth': 60, 'min_weight_fraction_leaf': 0.01, 'max_leaf_nodes': 150, 'bootstrap': False, 'ccp_alpha': 0.005}. Best is trial 1439 with value: -0.15896829431478016.
[I 2025-04-16 00:28:47,396] Trial 1521 finished with value: -0.19362127420890776 and parameters: {'n_estimators': 4005, 'min_samples_split': 20, 'max_features': 0.9400000000000001, 'min_samples_leaf': 14, 'criterion': 'absolute_error', 'max_depth': 60, 'min_weight_fraction_leaf': 0.01, 'max_leaf_nodes': 150, 'bootstrap': False, 'ccp_alpha': 0.0}. Best is trial 1439 with value: -0.15896829431478016.
[I 2025-04-16 00:28:50,794] Trial 1522 finished with value: -0.1936417107583833 and parameters: {'n_estimators': 4139, 'min_samples_split': 15, 'max_features': 0.97, 'min_samples_leaf': 12, 'criterion': 'absolute_error', 'max_depth': 60, 'min_weight_fraction_leaf': 0.01, 'max_leaf_nodes': 150, 'bootstrap': False, 'ccp_alpha': 0.007}. Best is trial 1439 with value: -0.15896829431478016.
[I 2025-04-16 00:28:54,134] Trial 1523 finished with value: -0.1936417107583833 and parameters: {'n_estimators': 3744, 'min_samples_split': 13, 'max_features': 0.9400000000000001, 'min_samples_leaf': 16, 'criterion': 'absolute_error', 'max_depth': 60, 'min_weight_fraction_leaf': 0.01, 'max_leaf_nodes': 150, 'bootstrap': False, 'ccp_alpha': 0.011}. Best is trial 1439 with value: -0.15896829431478016.
[I 2025-04-16 00:28:58,018] Trial 1524 finished with value: -17.52898638227338 and parameters: {'n_estimators': 4389, 'min_samples_split': 21, 'max_features': 0.93, 'min_samples_leaf': 12, 'criterion': 'squared_error', 'max_depth': 60, 'min_weight_fraction_leaf': 0.01, 'max_leaf_nodes': 150, 'bootstrap': False, 'ccp_alpha': 0.006}. Best is trial 1439 with value: -0.15896829431478016.
[I 2025-04-16 00:29:01,737] Trial 1525 finished with value: -0.1936417107583833 and parameters: {'n_estimators': 4007, 'min_samples_split': 17, 'max_features': 0.9600000000000001, 'min_samples_leaf': 14, 'criterion': 'absolute_error', 'max_depth': 60, 'min_weight_fraction_leaf': 0.01, 'max_leaf_nodes': 150, 'bootstrap': False, 'ccp_alpha': 0.005}. Best is trial 1439 with value: -0.15896829431478016.
[I 2025-04-16 00:29:04,730] Trial 1526 finished with value: -0.1936421859636735 and parameters: {'n_estimators': 3776, 'min_samples_split': 13, 'max_features': 0.97, 'min_samples_leaf': 17, 'criterion': 'absolute_error', 'max_depth': 60, 'min_weight_fraction_leaf': 0.01, 'max_leaf_nodes': 150, 'bootstrap': False, 'ccp_alpha': 0.0}. Best is trial 1439 with value: -0.15896829431478016.
[I 2025-04-16 00:29:08,093] Trial 1527 finished with value: -0.1936417107583833 and parameters: {'n_estimators': 4219, 'min_samples_split': 18, 'max_features': 0.9500000000000001, 'min_samples_leaf': 11, 'criterion': 'absolute_error', 'max_depth': 60, 'min_weight_fraction_leaf': 0.01, 'max_leaf_nodes': 150, 'bootstrap': False, 'ccp_alpha': 0.01}. Best is trial 1439 with value: -0.15896829431478016.
[I 2025-04-16 00:29:11,471] Trial 1528 finished with value: -0.1936249252114528 and parameters: {'n_estimators': 3961, 'min_samples_split': 13, 'max_features': 0.93, 'min_samples_leaf': 15, 'criterion': 'absolute_error', 'max_depth': 60, 'min_weight_fraction_leaf': 0.01, 'max_leaf_nodes': 150, 'bootstrap': False, 'ccp_alpha': 0.0}. Best is trial 1439 with value: -0.15896829431478016.
[I 2025-04-16 00:29:15,338] Trial 1529 finished with value: -0.1936417107583833 and parameters: {'n_estimators': 4357, 'min_samples_split': 20, 'max_features': 0.97, 'min_samples_leaf': 13, 'criterion': 'absolute_error', 'max_depth': 60, 'min_weight_fraction_leaf': 0.01, 'max_leaf_nodes': 150, 'bootstrap': False, 'ccp_alpha': 0.011}. Best is trial 1439 with value: -0.15896829431478016.
[I 2025-04-16 00:29:18,750] Trial 1530 finished with value: -32.34759420662502 and parameters: {'n_estimators': 4080, 'min_samples_split': 13, 'max_features': 0.98, 'min_samples_leaf': 11, 'criterion': 'poisson', 'max_depth': 60, 'min_weight_fraction_leaf': 0.01, 'max_leaf_nodes': 150, 'bootstrap': False, 'ccp_alpha': 0.0}. Best is trial 1439 with value: -0.15896829431478016.
[I 2025-04-16 00:29:22,441] Trial 1531 finished with value: -0.1936417107583833 and parameters: {'n_estimators': 3761, 'min_samples_split': 22, 'max_features': 0.93, 'min_samples_leaf': 14, 'criterion': 'absolute_error', 'max_depth': 60, 'min_weight_fraction_leaf': 0.01, 'max_leaf_nodes': 150, 'bootstrap': False, 'ccp_alpha': 0.005}. Best is trial 1439 with value: -0.15896829431478016.
[I 2025-04-16 00:29:26,251] Trial 1532 finished with value: -0.1936417107583833 and parameters: {'n_estimators': 3945, 'min_samples_split': 17, 'max_features': 0.9600000000000001, 'min_samples_leaf': 17, 'criterion': 'absolute_error', 'max_depth': 60, 'min_weight_fraction_leaf': 0.01, 'max_leaf_nodes': 150, 'bootstrap': False, 'ccp_alpha': 0.011}. Best is trial 1439 with value: -0.15896829431478016.
[I 2025-04-16 00:29:29,820] Trial 1533 finished with value: -0.1936417107583833 and parameters: {'n_estimators': 4212, 'min_samples_split': 17, 'max_features': 0.9500000000000001, 'min_samples_leaf': 11, 'criterion': 'absolute_error', 'max_depth': 60, 'min_weight_fraction_leaf': 0.01, 'max_leaf_nodes': 150, 'bootstrap': False, 'ccp_alpha': 0.005}. Best is trial 1439 with value: -0.15896829431478016.
[I 2025-04-16 00:29:33,006] Trial 1534 finished with value: -0.15908255604510319 and parameters: {'n_estimators': 3797, 'min_samples_split': 12, 'max_features': 0.98, 'min_samples_leaf': 13, 'criterion': 'absolute_error', 'max_depth': 60, 'min_weight_fraction_leaf': 0.01, 'max_leaf_nodes': 150, 'bootstrap': False, 'ccp_alpha': 0.0}. Best is trial 1439 with value: -0.15896829431478016.
[I 2025-04-16 00:29:36,388] Trial 1535 finished with value: -0.19362492221422345 and parameters: {'n_estimators': 3885, 'min_samples_split': 13, 'max_features': 0.93, 'min_samples_leaf': 15, 'criterion': 'absolute_error', 'max_depth': 60, 'min_weight_fraction_leaf': 0.01, 'max_leaf_nodes': 150, 'bootstrap': False, 'ccp_alpha': 0.0}. Best is trial 1439 with value: -0.15896829431478016.
[I 2025-04-16 00:29:39,862] Trial 1536 finished with value: -0.1936417107583833 and parameters: {'n_estimators': 3767, 'min_samples_split': 22, 'max_features': 0.9500000000000001, 'min_samples_leaf': 13, 'criterion': 'absolute_error', 'max_depth': 60, 'min_weight_fraction_leaf': 0.01, 'max_leaf_nodes': 150, 'bootstrap': False, 'ccp_alpha': 0.006}. Best is trial 1439 with value: -0.15896829431478016.
[I 2025-04-16 00:29:43,271] Trial 1537 finished with value: -0.1936417107583833 and parameters: {'n_estimators': 3754, 'min_samples_split': 16, 'max_features': 0.97, 'min_samples_leaf': 17, 'criterion': 'absolute_error', 'max_depth': 60, 'min_weight_fraction_leaf': 0.01, 'max_leaf_nodes': 150, 'bootstrap': False, 'ccp_alpha': 0.011}. Best is trial 1439 with value: -0.15896829431478016.
[I 2025-04-16 00:29:46,526] Trial 1538 finished with value: -8.76878221922307 and parameters: {'n_estimators': 4029, 'min_samples_split': 13, 'max_features': 0.93, 'min_samples_leaf': 12, 'criterion': 'absolute_error', 'max_depth': 60, 'min_weight_fraction_leaf': 0.01, 'max_leaf_nodes': 150, 'bootstrap': False, 'ccp_alpha': 0.0}. Best is trial 1439 with value: -0.15896829431478016.
[I 2025-04-16 00:29:50,064] Trial 1539 finished with value: -17.528986382274216 and parameters: {'n_estimators': 3944, 'min_samples_split': 18, 'max_features': 0.9500000000000001, 'min_samples_leaf': 15, 'criterion': 'friedman_mse', 'max_depth': 60, 'min_weight_fraction_leaf': 0.01, 'max_leaf_nodes': 150, 'bootstrap': False, 'ccp_alpha': 0.005}. Best is trial 1439 with value: -0.15896829431478016.
[I 2025-04-16 00:29:53,675] Trial 1540 finished with value: -0.1936417107583833 and parameters: {'n_estimators': 4143, 'min_samples_split': 12, 'max_features': 0.97, 'min_samples_leaf': 13, 'criterion': 'absolute_error', 'max_depth': 60, 'min_weight_fraction_leaf': 0.01, 'max_leaf_nodes': 150, 'bootstrap': False, 'ccp_alpha': 0.011}. Best is trial 1439 with value: -0.15896829431478016.
[I 2025-04-16 00:29:56,895] Trial 1541 finished with value: -8.744768629579962 and parameters: {'n_estimators': 3793, 'min_samples_split': 22, 'max_features': 0.9400000000000001, 'min_samples_leaf': 11, 'criterion': 'absolute_error', 'max_depth': 60, 'min_weight_fraction_leaf': 0.01, 'max_leaf_nodes': 150, 'bootstrap': False, 'ccp_alpha': 0.0}. Best is trial 1439 with value: -0.15896829431478016.
[I 2025-04-16 00:30:00,340] Trial 1542 finished with value: -0.1936417107583833 and parameters: {'n_estimators': 3719, 'min_samples_split': 18, 'max_features': 0.98, 'min_samples_leaf': 15, 'criterion': 'absolute_error', 'max_depth': 60, 'min_weight_fraction_leaf': 0.01, 'max_leaf_nodes': 150, 'bootstrap': False, 'ccp_alpha': 0.006}. Best is trial 1439 with value: -0.15896829431478016.
[I 2025-04-16 00:30:04,214] Trial 1543 finished with value: -0.1936417107583833 and parameters: {'n_estimators': 4148, 'min_samples_split': 12, 'max_features': 0.9600000000000001, 'min_samples_leaf': 13, 'criterion': 'absolute_error', 'max_depth': 60, 'min_weight_fraction_leaf': 0.01, 'max_leaf_nodes': 150, 'bootstrap': False, 'ccp_alpha': 0.005}. Best is trial 1439 with value: -0.15896829431478016.
[I 2025-04-16 00:30:07,902] Trial 1544 finished with value: -0.1936417107583833 and parameters: {'n_estimators': 3984, 'min_samples_split': 22, 'max_features': 0.9400000000000001, 'min_samples_leaf': 17, 'criterion': 'absolute_error', 'max_depth': 60, 'min_weight_fraction_leaf': 0.01, 'max_leaf_nodes': 150, 'bootstrap': False, 'ccp_alpha': 0.012}. Best is trial 1439 with value: -0.15896829431478016.
