[I 2025-04-16 02:18:57,996] Trial 4516 finished with value: -0.1936417107583833 and parameters: {'n_estimators': 775, 'min_samples_split': 6, 'max_features': 0.8400000000000001, 'min_samples_leaf': 3, 'criterion': 'absolute_error', 'max_depth': 15, 'min_weight_fraction_leaf': 0.0, 'max_leaf_nodes': None, 'bootstrap': False, 'ccp_alpha': 0.014}. Best is trial 4065 with value: 0.057524275121161005.
[I 2025-04-16 02:18:58,825] Trial 4517 finished with value: -11.638778731709765 and parameters: {'n_estimators': 332, 'min_samples_split': 9, 'max_features': 0.8, 'min_samples_leaf': 1, 'criterion': 'friedman_mse', 'max_depth': 15, 'min_weight_fraction_leaf': 0.0, 'max_leaf_nodes': None, 'bootstrap': False, 'ccp_alpha': 0.0}. Best is trial 4065 with value: 0.057524275121161005.
[I 2025-04-16 02:18:59,908] Trial 4518 finished with value: -0.1936417107583833 and parameters: {'n_estimators': 626, 'min_samples_split': 2, 'max_features': 0.8200000000000001, 'min_samples_leaf': 4, 'criterion': 'absolute_error', 'max_depth': 15, 'min_weight_fraction_leaf': 0.0, 'max_leaf_nodes': None, 'bootstrap': False, 'ccp_alpha': 0.009000000000000001}. Best is trial 4065 with value: 0.057524275121161005.
[I 2025-04-16 02:19:00,605] Trial 4519 finished with value: -0.1936417107583833 and parameters: {'n_estimators': 157, 'min_samples_split': 5, 'max_features': 0.78, 'min_samples_leaf': 6, 'criterion': 'absolute_error', 'max_depth': 15, 'min_weight_fraction_leaf': 0.0, 'max_leaf_nodes': None, 'bootstrap': False, 'ccp_alpha': 0.023}. Best is trial 4065 with value: 0.057524275121161005.
[I 2025-04-16 02:19:02,016] Trial 4520 finished with value: -0.2707184660616116 and parameters: {'n_estimators': 1008, 'min_samples_split': 9, 'max_features': 0.76, 'min_samples_leaf': 1, 'criterion': 'absolute_error', 'max_depth': 15, 'min_weight_fraction_leaf': 0.0, 'max_leaf_nodes': 10, 'bootstrap': False, 'ccp_alpha': 0.005}. Best is trial 4065 with value: 0.057524275121161005.
[I 2025-04-16 02:19:03,106] Trial 4521 finished with value: -0.1936417107583833 and parameters: {'n_estimators': 488, 'min_samples_split': 2, 'max_features': 0.8400000000000001, 'min_samples_leaf': 3, 'criterion': 'absolute_error', 'max_depth': 15, 'min_weight_fraction_leaf': 0.0, 'max_leaf_nodes': None, 'bootstrap': False, 'ccp_alpha': 0.015}. Best is trial 4065 with value: 0.057524275121161005.
[I 2025-04-16 02:19:04,242] Trial 4522 finished with value: -0.1936417107583833 and parameters: {'n_estimators': 753, 'min_samples_split': 6, 'max_features': 0.8, 'min_samples_leaf': 54, 'criterion': 'absolute_error', 'max_depth': 45, 'min_weight_fraction_leaf': 0.0, 'max_leaf_nodes': 50, 'bootstrap': False, 'ccp_alpha': 0.0}. Best is trial 4065 with value: 0.057524275121161005.
[I 2025-04-16 02:19:05,075] Trial 4523 finished with value: -0.1936417107583833 and parameters: {'n_estimators': 329, 'min_samples_split': 13, 'max_features': 0.77, 'min_samples_leaf': 5, 'criterion': 'absolute_error', 'max_depth': 15, 'min_weight_fraction_leaf': 0.0, 'max_leaf_nodes': None, 'bootstrap': False, 'ccp_alpha': 0.01}. Best is trial 4065 with value: 0.057524275121161005.
[I 2025-04-16 02:19:05,790] Trial 4524 finished with value: -0.1936417107583833 and parameters: {'n_estimators': 150, 'min_samples_split': 91, 'max_features': 0.8200000000000001, 'min_samples_leaf': 1, 'criterion': 'absolute_error', 'max_depth': 15, 'min_weight_fraction_leaf': 0.07, 'max_leaf_nodes': None, 'bootstrap': False, 'ccp_alpha': 0.006}. Best is trial 4065 with value: 0.057524275121161005.
[I 2025-04-16 02:19:06,956] Trial 4525 finished with value: -0.1936417107583833 and parameters: {'n_estimators': 584, 'min_samples_split': 9, 'max_features': 0.79, 'min_samples_leaf': 3, 'criterion': 'absolute_error', 'max_depth': 20, 'min_weight_fraction_leaf': 0.0, 'max_leaf_nodes': 50, 'bootstrap': False, 'ccp_alpha': 0.018000000000000002}. Best is trial 4065 with value: 0.057524275121161005.
[I 2025-04-16 02:19:08,430] Trial 4526 finished with value: -17.528986382275242 and parameters: {'n_estimators': 841, 'min_samples_split': 2, 'max_features': 0.76, 'min_samples_leaf': 6, 'criterion': 'squared_error', 'max_depth': 15, 'min_weight_fraction_leaf': 0.0, 'max_leaf_nodes': None, 'bootstrap': False, 'ccp_alpha': 0.029}. Best is trial 4065 with value: 0.057524275121161005.
[I 2025-04-16 02:19:09,478] Trial 4527 finished with value: 0.024577339602806482 and parameters: {'n_estimators': 419, 'min_samples_split': 6, 'max_features': 0.8400000000000001, 'min_samples_leaf': 3, 'criterion': 'absolute_error', 'max_depth': 15, 'min_weight_fraction_leaf': 0.0, 'max_leaf_nodes': 50, 'bootstrap': False, 'ccp_alpha': 0.005}. Best is trial 4065 with value: 0.057524275121161005.
[I 2025-04-16 02:19:10,648] Trial 4528 finished with value: -0.1936417107583833 and parameters: {'n_estimators': 638, 'min_samples_split': 12, 'max_features': 0.8200000000000001, 'min_samples_leaf': 1, 'criterion': 'absolute_error', 'max_depth': 15, 'min_weight_fraction_leaf': 0.0, 'max_leaf_nodes': 300, 'bootstrap': False, 'ccp_alpha': 0.013000000000000001}. Best is trial 4065 with value: 0.057524275121161005.
[I 2025-04-16 02:19:11,380] Trial 4529 finished with value: -0.1936417107583833 and parameters: {'n_estimators': 149, 'min_samples_split': 6, 'max_features': 0.8, 'min_samples_leaf': 4, 'criterion': 'absolute_error', 'max_depth': 15, 'min_weight_fraction_leaf': 0.0, 'max_leaf_nodes': 300, 'bootstrap': False, 'ccp_alpha': 0.01}. Best is trial 4065 with value: 0.057524275121161005.
[I 2025-04-16 02:19:12,867] Trial 4530 finished with value: 0.18581264253663518 and parameters: {'n_estimators': 1211, 'min_samples_split': 2, 'max_features': 0.76, 'min_samples_leaf': 1, 'criterion': 'absolute_error', 'max_depth': 15, 'min_weight_fraction_leaf': 0.0, 'max_leaf_nodes': 10, 'bootstrap': False, 'ccp_alpha': 0.0}. Best is trial 4530 with value: 0.18581264253663518.
[I 2025-04-16 02:19:14,198] Trial 4531 finished with value: -16.2962618047545 and parameters: {'n_estimators': 969, 'min_samples_split': 2, 'max_features': 0.76, 'min_samples_leaf': 3, 'criterion': 'poisson', 'max_depth': 15, 'min_weight_fraction_leaf': 0.0, 'max_leaf_nodes': 10, 'bootstrap': False, 'ccp_alpha': 0.005}. Best is trial 4530 with value: 0.18581264253663518.
[I 2025-04-16 02:19:15,709] Trial 4532 finished with value: -7.834865588426948 and parameters: {'n_estimators': 1252, 'min_samples_split': 5, 'max_features': 0.76, 'min_samples_leaf': 6, 'criterion': 'absolute_error', 'max_depth': 15, 'min_weight_fraction_leaf': 0.03, 'max_leaf_nodes': 10, 'bootstrap': False, 'ccp_alpha': 0.0}. Best is trial 4530 with value: 0.18581264253663518.
[I 2025-04-16 02:19:17,124] Trial 4533 finished with value: -0.1936417107583833 and parameters: {'n_estimators': 1108, 'min_samples_split': 85, 'max_features': 0.75, 'min_samples_leaf': 1, 'criterion': 'absolute_error', 'max_depth': 15, 'min_weight_fraction_leaf': 0.0, 'max_leaf_nodes': 10, 'bootstrap': False, 'ccp_alpha': 0.0}. Best is trial 4530 with value: 0.18581264253663518.
[I 2025-04-16 02:19:18,715] Trial 4534 finished with value: -0.0022176201785233827 and parameters: {'n_estimators': 1099, 'min_samples_split': 2, 'max_features': 0.76, 'min_samples_leaf': 3, 'criterion': 'absolute_error', 'max_depth': 15, 'min_weight_fraction_leaf': 0.0, 'max_leaf_nodes': 10, 'bootstrap': False, 'ccp_alpha': 0.006}. Best is trial 4530 with value: 0.18581264253663518.
[I 2025-04-16 02:19:20,178] Trial 4535 finished with value: 0.0023100261344424665 and parameters: {'n_estimators': 1098, 'min_samples_split': 5, 'max_features': 0.75, 'min_samples_leaf': 1, 'criterion': 'absolute_error', 'max_depth': 15, 'min_weight_fraction_leaf': 0.0, 'max_leaf_nodes': 10, 'bootstrap': False, 'ccp_alpha': 0.006}. Best is trial 4530 with value: 0.18581264253663518.
[I 2025-04-16 02:19:21,608] Trial 4536 finished with value: -5.136685637690276 and parameters: {'n_estimators': 1184, 'min_samples_split': 2, 'max_features': 0.48000000000000004, 'min_samples_leaf': 5, 'criterion': 'absolute_error', 'max_depth': 15, 'min_weight_fraction_leaf': 0.0, 'max_leaf_nodes': 10, 'bootstrap': False, 'ccp_alpha': 0.0}. Best is trial 4530 with value: 0.18581264253663518.
[I 2025-04-16 02:19:22,987] Trial 4537 finished with value: -14.47978539536295 and parameters: {'n_estimators': 1000, 'min_samples_split': 2, 'max_features': 0.77, 'min_samples_leaf': 3, 'criterion': 'absolute_error', 'max_depth': 15, 'min_weight_fraction_leaf': 0.0, 'max_leaf_nodes': 10, 'bootstrap': False, 'ccp_alpha': 0.0}. Best is trial 4530 with value: 0.18581264253663518.
[I 2025-04-16 02:19:24,534] Trial 4538 finished with value: -6.407997655879733 and parameters: {'n_estimators': 1146, 'min_samples_split': 5, 'max_features': 0.75, 'min_samples_leaf': 7, 'criterion': 'absolute_error', 'max_depth': 15, 'min_weight_fraction_leaf': 0.0, 'max_leaf_nodes': 300, 'bootstrap': False, 'ccp_alpha': 0.0}. Best is trial 4530 with value: 0.18581264253663518.
[I 2025-04-16 02:19:25,943] Trial 4539 finished with value: 0.19155472534689352 and parameters: {'n_estimators': 836, 'min_samples_split': 2, 'max_features': 0.78, 'min_samples_leaf': 1, 'criterion': 'absolute_error', 'max_depth': 15, 'min_weight_fraction_leaf': 0.0, 'max_leaf_nodes': 10, 'bootstrap': False, 'ccp_alpha': 0.0}. Best is trial 4539 with value: 0.19155472534689352.
[I 2025-04-16 02:19:33,748] Trial 4540 finished with value: -9.748026680207849 and parameters: {'n_estimators': 8873, 'min_samples_split': 2, 'max_features': 0.78, 'min_samples_leaf': 5, 'criterion': 'absolute_error', 'max_depth': 15, 'min_weight_fraction_leaf': 0.0, 'max_leaf_nodes': 10, 'bootstrap': False, 'ccp_alpha': 0.0}. Best is trial 4539 with value: 0.19155472534689352.
[I 2025-04-16 02:19:35,249] Trial 4541 finished with value: -14.218611455537962 and parameters: {'n_estimators': 1261, 'min_samples_split': 2, 'max_features': 0.79, 'min_samples_leaf': 3, 'criterion': 'absolute_error', 'max_depth': 15, 'min_weight_fraction_leaf': 0.0, 'max_leaf_nodes': 10, 'bootstrap': False, 'ccp_alpha': 0.0}. Best is trial 4539 with value: 0.19155472534689352.
[I 2025-04-16 02:19:36,652] Trial 4542 finished with value: -5.3825260303759626 and parameters: {'n_estimators': 1154, 'min_samples_split': 5, 'max_features': 0.78, 'min_samples_leaf': 1, 'criterion': 'absolute_error', 'max_depth': 15, 'min_weight_fraction_leaf': 0.0, 'max_leaf_nodes': 10, 'bootstrap': False, 'ccp_alpha': 0.0}. Best is trial 4539 with value: 0.19155472534689352.
[I 2025-04-16 02:19:38,231] Trial 4543 finished with value: -17.52898638227578 and parameters: {'n_estimators': 1067, 'min_samples_split': 2, 'max_features': 0.78, 'min_samples_leaf': 3, 'criterion': 'friedman_mse', 'max_depth': 15, 'min_weight_fraction_leaf': 0.0, 'max_leaf_nodes': 10, 'bootstrap': False, 'ccp_alpha': 0.005}. Best is trial 4539 with value: 0.19155472534689352.
[I 2025-04-16 02:19:39,544] Trial 4544 finished with value: -0.15662513297763242 and parameters: {'n_estimators': 956, 'min_samples_split': 2, 'max_features': 0.77, 'min_samples_leaf': 5, 'criterion': 'absolute_error', 'max_depth': 15, 'min_weight_fraction_leaf': 0.0, 'max_leaf_nodes': None, 'bootstrap': False, 'ccp_alpha': 0.004}. Best is trial 4539 with value: 0.19155472534689352.
[I 2025-04-16 02:19:40,837] Trial 4545 finished with value: 0.17468756956137407 and parameters: {'n_estimators': 948, 'min_samples_split': 2, 'max_features': 0.78, 'min_samples_leaf': 1, 'criterion': 'absolute_error', 'max_depth': 15, 'min_weight_fraction_leaf': 0.0, 'max_leaf_nodes': 10, 'bootstrap': False, 'ccp_alpha': 0.0}. Best is trial 4539 with value: 0.19155472534689352.
[I 2025-04-16 02:19:42,338] Trial 4546 finished with value: -0.1936417107583833 and parameters: {'n_estimators': 1257, 'min_samples_split': 5, 'max_features': 0.77, 'min_samples_leaf': 73, 'criterion': 'absolute_error', 'max_depth': 15, 'min_weight_fraction_leaf': 0.0, 'max_leaf_nodes': 10, 'bootstrap': False, 'ccp_alpha': 0.0}. Best is trial 4539 with value: 0.19155472534689352.
[I 2025-04-16 02:19:43,901] Trial 4547 finished with value: -0.13180091117783715 and parameters: {'n_estimators': 1235, 'min_samples_split': 6, 'max_features': 0.77, 'min_samples_leaf': 7, 'criterion': 'absolute_error', 'max_depth': 15, 'min_weight_fraction_leaf': 0.06, 'max_leaf_nodes': 10, 'bootstrap': False, 'ccp_alpha': 0.005}. Best is trial 4539 with value: 0.19155472534689352.
[I 2025-04-16 02:19:45,159] Trial 4548 finished with value: -14.33687976858442 and parameters: {'n_estimators': 943, 'min_samples_split': 2, 'max_features': 0.77, 'min_samples_leaf': 3, 'criterion': 'absolute_error', 'max_depth': 15, 'min_weight_fraction_leaf': 0.0, 'max_leaf_nodes': 10, 'bootstrap': False, 'ccp_alpha': 0.0}. Best is trial 4539 with value: 0.19155472534689352.
[I 2025-04-16 02:19:46,566] Trial 4549 finished with value: -17.528986382275583 and parameters: {'n_estimators': 972, 'min_samples_split': 6, 'max_features': 0.78, 'min_samples_leaf': 1, 'criterion': 'squared_error', 'max_depth': 15, 'min_weight_fraction_leaf': 0.0, 'max_leaf_nodes': 10, 'bootstrap': False, 'ccp_alpha': 0.005}. Best is trial 4539 with value: 0.19155472534689352.
[I 2025-04-16 02:19:47,889] Trial 4550 finished with value: -10.771772440699692 and parameters: {'n_estimators': 915, 'min_samples_split': 2, 'max_features': 0.76, 'min_samples_leaf': 4, 'criterion': 'absolute_error', 'max_depth': 15, 'min_weight_fraction_leaf': 0.0, 'max_leaf_nodes': 10, 'bootstrap': False, 'ccp_alpha': 0.0}. Best is trial 4539 with value: 0.19155472534689352.
[I 2025-04-16 02:19:49,452] Trial 4551 finished with value: -15.398955834816098 and parameters: {'n_estimators': 1205, 'min_samples_split': 9, 'max_features': 0.78, 'min_samples_leaf': 1, 'criterion': 'absolute_error', 'max_depth': 15, 'min_weight_fraction_leaf': 0.0, 'max_leaf_nodes': 10, 'bootstrap': False, 'ccp_alpha': 0.0}. Best is trial 4539 with value: 0.19155472534689352.
[I 2025-04-16 02:19:50,692] Trial 4552 finished with value: -10.07841553400448 and parameters: {'n_estimators': 901, 'min_samples_split': 6, 'max_features': 0.78, 'min_samples_leaf': 5, 'criterion': 'absolute_error', 'max_depth': 15, 'min_weight_fraction_leaf': 0.0, 'max_leaf_nodes': 10, 'bootstrap': False, 'ccp_alpha': 0.0}. Best is trial 4539 with value: 0.19155472534689352.
[I 2025-04-16 02:19:52,109] Trial 4553 finished with value: -0.0008277105259551388 and parameters: {'n_estimators': 1033, 'min_samples_split': 2, 'max_features': 0.78, 'min_samples_leaf': 3, 'criterion': 'absolute_error', 'max_depth': 15, 'min_weight_fraction_leaf': 0.0, 'max_leaf_nodes': 10, 'bootstrap': False, 'ccp_alpha': 0.006}. Best is trial 4539 with value: 0.19155472534689352.
[I 2025-04-16 02:19:53,733] Trial 4554 finished with value: -4.479093976197902 and parameters: {'n_estimators': 1214, 'min_samples_split': 8, 'max_features': 0.77, 'min_samples_leaf': 1, 'criterion': 'absolute_error', 'max_depth': 15, 'min_weight_fraction_leaf': 0.0, 'max_leaf_nodes': 10, 'bootstrap': False, 'ccp_alpha': 0.004}. Best is trial 4539 with value: 0.19155472534689352.
[I 2025-04-16 02:19:54,979] Trial 4555 finished with value: -6.569655505112775 and parameters: {'n_estimators': 839, 'min_samples_split': 9, 'max_features': 0.76, 'min_samples_leaf': 7, 'criterion': 'absolute_error', 'max_depth': 15, 'min_weight_fraction_leaf': 0.0, 'max_leaf_nodes': 10, 'bootstrap': False, 'ccp_alpha': 0.0}. Best is trial 4539 with value: 0.19155472534689352.
[I 2025-04-16 02:19:56,243] Trial 4556 finished with value: -16.369253287509263 and parameters: {'n_estimators': 848, 'min_samples_split': 2, 'max_features': 0.79, 'min_samples_leaf': 3, 'criterion': 'poisson', 'max_depth': 15, 'min_weight_fraction_leaf': 0.0, 'max_leaf_nodes': 10, 'bootstrap': False, 'ccp_alpha': 0.005}. Best is trial 4539 with value: 0.19155472534689352.
[I 2025-04-16 02:19:57,666] Trial 4557 finished with value: -9.855093245007005 and parameters: {'n_estimators': 1022, 'min_samples_split': 6, 'max_features': 0.76, 'min_samples_leaf': 5, 'criterion': 'absolute_error', 'max_depth': 15, 'min_weight_fraction_leaf': 0.0, 'max_leaf_nodes': 10, 'bootstrap': False, 'ccp_alpha': 0.0}. Best is trial 4539 with value: 0.19155472534689352.
[I 2025-04-16 02:19:59,069] Trial 4558 finished with value: 0.017828102471203144 and parameters: {'n_estimators': 823, 'min_samples_split': 6, 'max_features': 0.79, 'min_samples_leaf': 3, 'criterion': 'absolute_error', 'max_depth': 15, 'min_weight_fraction_leaf': 0.0, 'max_leaf_nodes': 10, 'bootstrap': False, 'ccp_alpha': 0.005}. Best is trial 4539 with value: 0.19155472534689352.
[I 2025-04-16 02:20:00,454] Trial 4559 finished with value: -16.005095462773724 and parameters: {'n_estimators': 875, 'min_samples_split': 9, 'max_features': 0.76, 'min_samples_leaf': 1, 'criterion': 'absolute_error', 'max_depth': 15, 'min_weight_fraction_leaf': 0.0, 'max_leaf_nodes': 10, 'bootstrap': False, 'ccp_alpha': 0.0}. Best is trial 4539 with value: 0.19155472534689352.
[I 2025-04-16 02:20:02,059] Trial 4560 finished with value: -14.39397620401491 and parameters: {'n_estimators': 1080, 'min_samples_split': 2, 'max_features': 0.78, 'min_samples_leaf': 3, 'criterion': 'absolute_error', 'max_depth': 15, 'min_weight_fraction_leaf': 0.0, 'max_leaf_nodes': 10, 'bootstrap': False, 'ccp_alpha': 0.0}. Best is trial 4539 with value: 0.19155472534689352.
[I 2025-04-16 02:20:03,259] Trial 4561 finished with value: -8.040959309180788 and parameters: {'n_estimators': 824, 'min_samples_split': 6, 'max_features': 0.75, 'min_samples_leaf': 1, 'criterion': 'absolute_error', 'max_depth': 15, 'min_weight_fraction_leaf': 0.0, 'max_leaf_nodes': 10, 'bootstrap': False, 'ccp_alpha': 0.0}. Best is trial 4539 with value: 0.19155472534689352.
[I 2025-04-16 02:20:04,917] Trial 4562 finished with value: -0.1936417107583833 and parameters: {'n_estimators': 1282, 'min_samples_split': 9, 'max_features': 0.79, 'min_samples_leaf': 5, 'criterion': 'absolute_error', 'max_depth': 15, 'min_weight_fraction_leaf': 0.0, 'max_leaf_nodes': 10, 'bootstrap': False, 'ccp_alpha': 0.006}. Best is trial 4539 with value: 0.19155472534689352.
[I 2025-04-16 02:20:06,139] Trial 4563 finished with value: 0.01889273734061734 and parameters: {'n_estimators': 793, 'min_samples_split': 2, 'max_features': 0.75, 'min_samples_leaf': 3, 'criterion': 'absolute_error', 'max_depth': 15, 'min_weight_fraction_leaf': 0.0, 'max_leaf_nodes': 10, 'bootstrap': False, 'ccp_alpha': 0.005}. Best is trial 4539 with value: 0.19155472534689352.
[I 2025-04-16 02:20:07,670] Trial 4564 finished with value: -6.445822903967153 and parameters: {'n_estimators': 1069, 'min_samples_split': 6, 'max_features': 0.77, 'min_samples_leaf': 7, 'criterion': 'absolute_error', 'max_depth': 15, 'min_weight_fraction_leaf': 0.0, 'max_leaf_nodes': 10, 'bootstrap': False, 'ccp_alpha': 0.0}. Best is trial 4539 with value: 0.19155472534689352.
[I 2025-04-16 02:20:08,879] Trial 4565 finished with value: -4.680905320252878 and parameters: {'n_estimators': 788, 'min_samples_split': 2, 'max_features': 0.79, 'min_samples_leaf': 1, 'criterion': 'friedman_mse', 'max_depth': 15, 'min_weight_fraction_leaf': 0.0, 'max_leaf_nodes': 10, 'bootstrap': False, 'ccp_alpha': 0.0}. Best is trial 4539 with value: 0.19155472534689352.
[I 2025-04-16 02:20:10,459] Trial 4566 finished with value: -0.1936417107583833 and parameters: {'n_estimators': 1243, 'min_samples_split': 9, 'max_features': 0.77, 'min_samples_leaf': 5, 'criterion': 'absolute_error', 'max_depth': 15, 'min_weight_fraction_leaf': 0.0, 'max_leaf_nodes': 10, 'bootstrap': False, 'ccp_alpha': 0.006}. Best is trial 4539 with value: 0.19155472534689352.
[I 2025-04-16 02:20:11,748] Trial 4567 finished with value: 0.016581981325609996 and parameters: {'n_estimators': 797, 'min_samples_split': 6, 'max_features': 0.78, 'min_samples_leaf': 3, 'criterion': 'absolute_error', 'max_depth': 15, 'min_weight_fraction_leaf': 0.0, 'max_leaf_nodes': 10, 'bootstrap': False, 'ccp_alpha': 0.005}. Best is trial 4539 with value: 0.19155472534689352.
[I 2025-04-16 02:20:12,905] Trial 4568 finished with value: -15.789479391560894 and parameters: {'n_estimators': 770, 'min_samples_split': 9, 'max_features': 0.75, 'min_samples_leaf': 1, 'criterion': 'absolute_error', 'max_depth': 15, 'min_weight_fraction_leaf': 0.0, 'max_leaf_nodes': 10, 'bootstrap': False, 'ccp_alpha': 0.0}. Best is trial 4539 with value: 0.19155472534689352.
[I 2025-04-16 02:20:14,248] Trial 4569 finished with value: -10.671865010465956 and parameters: {'n_estimators': 951, 'min_samples_split': 2, 'max_features': 0.75, 'min_samples_leaf': 4, 'criterion': 'absolute_error', 'max_depth': 15, 'min_weight_fraction_leaf': 0.0, 'max_leaf_nodes': 10, 'bootstrap': False, 'ccp_alpha': 0.0}. Best is trial 4539 with value: 0.19155472534689352.
[I 2025-04-16 02:20:15,816] Trial 4570 finished with value: -0.1936417107583833 and parameters: {'n_estimators': 1063, 'min_samples_split': 6, 'max_features': 0.76, 'min_samples_leaf': 1, 'criterion': 'absolute_error', 'max_depth': 15, 'min_weight_fraction_leaf': 0.0, 'max_leaf_nodes': 10, 'bootstrap': False, 'ccp_alpha': 0.009000000000000001}. Best is trial 4539 with value: 0.19155472534689352.
[I 2025-04-16 02:20:17,043] Trial 4571 finished with value: -0.08374545758328504 and parameters: {'n_estimators': 735, 'min_samples_split': 12, 'max_features': 0.8, 'min_samples_leaf': 3, 'criterion': 'absolute_error', 'max_depth': 15, 'min_weight_fraction_leaf': 0.0, 'max_leaf_nodes': 10, 'bootstrap': False, 'ccp_alpha': 0.005}. Best is trial 4539 with value: 0.19155472534689352.
[I 2025-04-16 02:20:18,161] Trial 4572 finished with value: -7.768635152822599 and parameters: {'n_estimators': 718, 'min_samples_split': 2, 'max_features': 0.79, 'min_samples_leaf': 6, 'criterion': 'absolute_error', 'max_depth': 15, 'min_weight_fraction_leaf': 0.0, 'max_leaf_nodes': 10, 'bootstrap': False, 'ccp_alpha': 0.0}. Best is trial 4539 with value: 0.19155472534689352.
