[I 2025-04-15 23:08:47,126] Trial 55 finished with value: -0.19090207631976855 and parameters: {'n_estimators': 3017, 'min_samples_split': 79, 'max_features': 0.05, 'min_samples_leaf': 50, 'criterion': 'absolute_error', 'max_depth': 15, 'min_weight_fraction_leaf': 0.01, 'max_leaf_nodes': 150, 'bootstrap': True, 'ccp_alpha': 0.277, 'max_samples': 0.75}. Best is trial 55 with value: -0.19090207631976855.
[I 2025-04-15 23:08:50,107] Trial 56 finished with value: -18.047279631378778 and parameters: {'n_estimators': 3053, 'min_samples_split': 80, 'max_features': 0.05, 'min_samples_leaf': 51, 'criterion': 'squared_error', 'max_depth': 15, 'min_weight_fraction_leaf': 0.0, 'max_leaf_nodes': 150, 'bootstrap': True, 'ccp_alpha': 0.27, 'max_samples': 0.75}. Best is trial 55 with value: -0.19090207631976855.
[I 2025-04-15 23:08:53,742] Trial 57 finished with value: -0.19090119995780824 and parameters: {'n_estimators': 3016, 'min_samples_split': 73, 'max_features': 0.17, 'min_samples_leaf': 39, 'criterion': 'absolute_error', 'max_depth': 15, 'min_weight_fraction_leaf': 0.01, 'max_leaf_nodes': 10, 'bootstrap': True, 'ccp_alpha': 0.254, 'max_samples': 0.75}. Best is trial 57 with value: -0.19090119995780824.
[I 2025-04-15 23:08:57,176] Trial 58 finished with value: -18.118680264854824 and parameters: {'n_estimators': 2988, 'min_samples_split': 66, 'max_features': 0.27, 'min_samples_leaf': 36, 'criterion': 'poisson', 'max_depth': 15, 'min_weight_fraction_leaf': 0.0, 'max_leaf_nodes': 10, 'bootstrap': True, 'ccp_alpha': 0.255, 'max_samples': 0.75}. Best is trial 57 with value: -0.19090119995780824.
[I 2025-04-15 23:08:58,317] Trial 59 finished with value: -0.19146901267244626 and parameters: {'n_estimators': 935, 'min_samples_split': 74, 'max_features': 0.16, 'min_samples_leaf': 44, 'criterion': 'absolute_error', 'max_depth': 15, 'min_weight_fraction_leaf': 0.01, 'max_leaf_nodes': 10, 'bootstrap': True, 'ccp_alpha': 0.219, 'max_samples': 0.75}. Best is trial 57 with value: -0.19090119995780824.
[I 2025-04-15 23:09:03,341] Trial 60 finished with value: -0.19334641443346653 and parameters: {'n_estimators': 4047, 'min_samples_split': 88, 'max_features': 0.09999999999999999, 'min_samples_leaf': 56, 'criterion': 'absolute_error', 'max_depth': 15, 'min_weight_fraction_leaf': 0.0, 'max_leaf_nodes': 10, 'bootstrap': True, 'ccp_alpha': 0.20700000000000002, 'max_samples': None}. Best is trial 57 with value: -0.19090119995780824.
[I 2025-04-15 23:09:07,147] Trial 61 finished with value: -0.19116049987463293 and parameters: {'n_estimators': 3486, 'min_samples_split': 59, 'max_features': 0.04, 'min_samples_leaf': 48, 'criterion': 'absolute_error', 'max_depth': 15, 'min_weight_fraction_leaf': 0.01, 'max_leaf_nodes': 100, 'bootstrap': True, 'ccp_alpha': 0.279, 'max_samples': 0.75}. Best is trial 57 with value: -0.19090119995780824.
[I 2025-04-15 23:09:11,175] Trial 62 finished with value: -0.19116530895471873 and parameters: {'n_estimators': 3493, 'min_samples_split': 73, 'max_features': 0.15000000000000002, 'min_samples_leaf': 37, 'criterion': 'absolute_error', 'max_depth': 15, 'min_weight_fraction_leaf': 0.01, 'max_leaf_nodes': 100, 'bootstrap': True, 'ccp_alpha': 0.278, 'max_samples': 0.75}. Best is trial 57 with value: -0.19090119995780824.
[I 2025-04-15 23:09:15,082] Trial 63 finished with value: -0.191202452765273 and parameters: {'n_estimators': 3548, 'min_samples_split': 61, 'max_features': 0.23, 'min_samples_leaf': 36, 'criterion': 'absolute_error', 'max_depth': 15, 'min_weight_fraction_leaf': 0.01, 'max_leaf_nodes': 100, 'bootstrap': True, 'ccp_alpha': 0.279, 'max_samples': 0.75}. Best is trial 57 with value: -0.19090119995780824.
[I 2025-04-15 23:09:18,747] Trial 64 finished with value: -0.1932778696038516 and parameters: {'n_estimators': 2943, 'min_samples_split': 72, 'max_features': 0.05, 'min_samples_leaf': 49, 'criterion': 'absolute_error', 'max_depth': 15, 'min_weight_fraction_leaf': 0.01, 'max_leaf_nodes': 100, 'bootstrap': True, 'ccp_alpha': 0.261, 'max_samples': 1.0}. Best is trial 57 with value: -0.19090119995780824.
[I 2025-04-15 23:09:21,417] Trial 65 finished with value: -0.1908235868760812 and parameters: {'n_estimators': 2383, 'min_samples_split': 53, 'max_features': 0.16, 'min_samples_leaf': 29, 'criterion': 'absolute_error', 'max_depth': 15, 'min_weight_fraction_leaf': 0.01, 'max_leaf_nodes': 100, 'bootstrap': True, 'ccp_alpha': 0.274, 'max_samples': 0.75}. Best is trial 65 with value: -0.1908235868760812.
[I 2025-04-15 23:09:24,662] Trial 66 finished with value: -0.1829481015140925 and parameters: {'n_estimators': 2564, 'min_samples_split': 57, 'max_features': 0.04, 'min_samples_leaf': 25, 'criterion': 'absolute_error', 'max_depth': 15, 'min_weight_fraction_leaf': 0.0, 'max_leaf_nodes': 100, 'bootstrap': True, 'ccp_alpha': 0.25, 'max_samples': 0.5}. Best is trial 66 with value: -0.1829481015140925.
[I 2025-04-15 23:09:27,412] Trial 67 finished with value: -18.181008742661017 and parameters: {'n_estimators': 2581, 'min_samples_split': 82, 'max_features': 0.17, 'min_samples_leaf': 28, 'criterion': 'friedman_mse', 'max_depth': 15, 'min_weight_fraction_leaf': 0.0, 'max_leaf_nodes': 100, 'bootstrap': True, 'ccp_alpha': 0.248, 'max_samples': 0.5}. Best is trial 66 with value: -0.1829481015140925.
[I 2025-04-15 23:09:29,057] Trial 68 finished with value: -0.18681541259948675 and parameters: {'n_estimators': 1564, 'min_samples_split': 51, 'max_features': 0.09, 'min_samples_leaf': 23, 'criterion': 'absolute_error', 'max_depth': 15, 'min_weight_fraction_leaf': 0.0, 'max_leaf_nodes': None, 'bootstrap': True, 'ccp_alpha': 0.262, 'max_samples': 0.5}. Best is trial 66 with value: -0.1829481015140925.
[I 2025-04-15 23:09:30,189] Trial 69 finished with value: -0.1864025547869168 and parameters: {'n_estimators': 1035, 'min_samples_split': 54, 'max_features': 0.09999999999999999, 'min_samples_leaf': 9, 'criterion': 'absolute_error', 'max_depth': 45, 'min_weight_fraction_leaf': 0.0, 'max_leaf_nodes': None, 'bootstrap': True, 'ccp_alpha': 0.227, 'max_samples': 0.5}. Best is trial 66 with value: -0.1829481015140925.
[I 2025-04-15 23:09:31,351] Trial 70 finished with value: -0.18643157506628252 and parameters: {'n_estimators': 997, 'min_samples_split': 52, 'max_features': 0.09999999999999999, 'min_samples_leaf': 11, 'criterion': 'absolute_error', 'max_depth': 45, 'min_weight_fraction_leaf': 0.0, 'max_leaf_nodes': None, 'bootstrap': True, 'ccp_alpha': 0.226, 'max_samples': 0.5}. Best is trial 66 with value: -0.1829481015140925.
[I 2025-04-15 23:09:32,536] Trial 71 finished with value: -0.18657923156800044 and parameters: {'n_estimators': 1020, 'min_samples_split': 52, 'max_features': 0.21000000000000002, 'min_samples_leaf': 12, 'criterion': 'absolute_error', 'max_depth': 45, 'min_weight_fraction_leaf': 0.0, 'max_leaf_nodes': None, 'bootstrap': True, 'ccp_alpha': 0.225, 'max_samples': 0.5}. Best is trial 66 with value: -0.1829481015140925.
[I 2025-04-15 23:09:33,227] Trial 72 finished with value: -0.18729039589343371 and parameters: {'n_estimators': 583, 'min_samples_split': 36, 'max_features': 0.21000000000000002, 'min_samples_leaf': 10, 'criterion': 'absolute_error', 'max_depth': 45, 'min_weight_fraction_leaf': 0.0, 'max_leaf_nodes': None, 'bootstrap': True, 'ccp_alpha': 0.179, 'max_samples': 0.5}. Best is trial 66 with value: -0.1829481015140925.
[I 2025-04-15 23:09:33,816] Trial 73 finished with value: -0.18709467027980634 and parameters: {'n_estimators': 472, 'min_samples_split': 39, 'max_features': 0.22, 'min_samples_leaf': 8, 'criterion': 'absolute_error', 'max_depth': 45, 'min_weight_fraction_leaf': 0.0, 'max_leaf_nodes': None, 'bootstrap': True, 'ccp_alpha': 0.18, 'max_samples': 0.5}. Best is trial 66 with value: -0.1829481015140925.
[I 2025-04-15 23:09:33,963] Trial 74 finished with value: -0.18167313469617832 and parameters: {'n_estimators': 66, 'min_samples_split': 37, 'max_features': 0.3, 'min_samples_leaf': 6, 'criterion': 'absolute_error', 'max_depth': 45, 'min_weight_fraction_leaf': 0.0, 'max_leaf_nodes': None, 'bootstrap': True, 'ccp_alpha': 0.189, 'max_samples': 0.5}. Best is trial 74 with value: -0.18167313469617832.
[I 2025-04-15 23:09:34,100] Trial 75 finished with value: -0.1936367648582054 and parameters: {'n_estimators': 37, 'min_samples_split': 37, 'max_features': 0.3, 'min_samples_leaf': 6, 'criterion': 'absolute_error', 'max_depth': 45, 'min_weight_fraction_leaf': 0.0, 'max_leaf_nodes': None, 'bootstrap': True, 'ccp_alpha': 0.186, 'max_samples': 0.5}. Best is trial 74 with value: -0.18167313469617832.
[I 2025-04-15 23:09:34,870] Trial 76 finished with value: -0.18740951120284727 and parameters: {'n_estimators': 595, 'min_samples_split': 44, 'max_features': 0.23, 'min_samples_leaf': 13, 'criterion': 'absolute_error', 'max_depth': 45, 'min_weight_fraction_leaf': 0.0, 'max_leaf_nodes': None, 'bootstrap': True, 'ccp_alpha': 0.185, 'max_samples': 0.5}. Best is trial 74 with value: -0.18167313469617832.
[I 2025-04-15 23:09:35,411] Trial 77 finished with value: -18.80346851458876 and parameters: {'n_estimators': 426, 'min_samples_split': 34, 'max_features': 0.35000000000000003, 'min_samples_leaf': 2, 'criterion': 'squared_error', 'max_depth': 45, 'min_weight_fraction_leaf': 0.0, 'max_leaf_nodes': None, 'bootstrap': True, 'ccp_alpha': 0.211, 'max_samples': 0.5}. Best is trial 74 with value: -0.18167313469617832.
[I 2025-04-15 23:09:36,927] Trial 78 finished with value: -0.1864444953644738 and parameters: {'n_estimators': 1407, 'min_samples_split': 50, 'max_features': 0.21000000000000002, 'min_samples_leaf': 18, 'criterion': 'absolute_error', 'max_depth': 45, 'min_weight_fraction_leaf': 0.0, 'max_leaf_nodes': None, 'bootstrap': True, 'ccp_alpha': 0.184, 'max_samples': 0.5}. Best is trial 74 with value: -0.18167313469617832.
[I 2025-04-15 23:09:38,334] Trial 79 finished with value: -17.988079386831185 and parameters: {'n_estimators': 1333, 'min_samples_split': 50, 'max_features': 0.32, 'min_samples_leaf': 19, 'criterion': 'poisson', 'max_depth': 45, 'min_weight_fraction_leaf': 0.0, 'max_leaf_nodes': None, 'bootstrap': True, 'ccp_alpha': 0.196, 'max_samples': 0.5}. Best is trial 74 with value: -0.18167313469617832.
[I 2025-04-15 23:09:39,941] Trial 80 finished with value: -0.18651759059031064 and parameters: {'n_estimators': 1478, 'min_samples_split': 26, 'max_features': 0.27, 'min_samples_leaf': 17, 'criterion': 'absolute_error', 'max_depth': 45, 'min_weight_fraction_leaf': 0.0, 'max_leaf_nodes': None, 'bootstrap': True, 'ccp_alpha': 0.166, 'max_samples': 0.5}. Best is trial 74 with value: -0.18167313469617832.
[I 2025-04-15 23:09:41,679] Trial 81 finished with value: -0.18624198801106728 and parameters: {'n_estimators': 1351, 'min_samples_split': 26, 'max_features': 0.41000000000000003, 'min_samples_leaf': 17, 'criterion': 'absolute_error', 'max_depth': 45, 'min_weight_fraction_leaf': 0.0, 'max_leaf_nodes': None, 'bootstrap': True, 'ccp_alpha': 0.227, 'max_samples': 0.5}. Best is trial 74 with value: -0.18167313469617832.
[I 2025-04-15 23:09:43,217] Trial 82 finished with value: -0.18638406185308085 and parameters: {'n_estimators': 1394, 'min_samples_split': 25, 'max_features': 0.37, 'min_samples_leaf': 17, 'criterion': 'absolute_error', 'max_depth': 45, 'min_weight_fraction_leaf': 0.0, 'max_leaf_nodes': None, 'bootstrap': True, 'ccp_alpha': 0.227, 'max_samples': 0.5}. Best is trial 74 with value: -0.18167313469617832.
[I 2025-04-15 23:09:44,361] Trial 83 finished with value: -0.18647716426604863 and parameters: {'n_estimators': 1004, 'min_samples_split': 28, 'max_features': 0.37, 'min_samples_leaf': 16, 'criterion': 'absolute_error', 'max_depth': 45, 'min_weight_fraction_leaf': 0.0, 'max_leaf_nodes': None, 'bootstrap': True, 'ccp_alpha': 0.219, 'max_samples': 0.5}. Best is trial 74 with value: -0.18167313469617832.
[I 2025-04-15 23:09:45,346] Trial 84 finished with value: -0.18695924598426017 and parameters: {'n_estimators': 858, 'min_samples_split': 26, 'max_features': 0.43, 'min_samples_leaf': 16, 'criterion': 'absolute_error', 'max_depth': 45, 'min_weight_fraction_leaf': 0.0, 'max_leaf_nodes': None, 'bootstrap': True, 'ccp_alpha': 0.164, 'max_samples': 0.5}. Best is trial 74 with value: -0.18167313469617832.
[I 2025-04-15 23:09:46,813] Trial 85 finished with value: -0.18682714383353596 and parameters: {'n_estimators': 1324, 'min_samples_split': 22, 'max_features': 0.39, 'min_samples_leaf': 19, 'criterion': 'absolute_error', 'max_depth': 45, 'min_weight_fraction_leaf': 0.1, 'max_leaf_nodes': None, 'bootstrap': True, 'ccp_alpha': 0.20400000000000001, 'max_samples': 0.5}. Best is trial 74 with value: -0.18167313469617832.
[I 2025-04-15 23:09:48,651] Trial 86 finished with value: -0.18737645170165074 and parameters: {'n_estimators': 1724, 'min_samples_split': 14, 'max_features': 0.37, 'min_samples_leaf': 15, 'criterion': 'absolute_error', 'max_depth': 45, 'min_weight_fraction_leaf': 0.0, 'max_leaf_nodes': None, 'bootstrap': True, 'ccp_alpha': 0.229, 'max_samples': 0.5}. Best is trial 74 with value: -0.18167313469617832.
[I 2025-04-15 23:09:48,921] Trial 87 finished with value: -18.70019959029146 and parameters: {'n_estimators': 192, 'min_samples_split': 8, 'max_features': 0.45, 'min_samples_leaf': 20, 'criterion': 'friedman_mse', 'max_depth': 45, 'min_weight_fraction_leaf': 0.0, 'max_leaf_nodes': None, 'bootstrap': True, 'ccp_alpha': 0.213, 'max_samples': 0.5}. Best is trial 74 with value: -0.18167313469617832.
[I 2025-04-15 23:09:50,196] Trial 88 finished with value: -0.1866403142325898 and parameters: {'n_estimators': 1172, 'min_samples_split': 30, 'max_features': 0.34, 'min_samples_leaf': 4, 'criterion': 'absolute_error', 'max_depth': 45, 'min_weight_fraction_leaf': 0.0, 'max_leaf_nodes': None, 'bootstrap': True, 'ccp_alpha': 0.149, 'max_samples': 0.5}. Best is trial 74 with value: -0.18167313469617832.
[I 2025-04-15 23:09:52,034] Trial 89 finished with value: -0.18669464048286297 and parameters: {'n_estimators': 1534, 'min_samples_split': 24, 'max_features': 0.28, 'min_samples_leaf': 22, 'criterion': 'absolute_error', 'max_depth': 45, 'min_weight_fraction_leaf': 0.0, 'max_leaf_nodes': None, 'bootstrap': True, 'ccp_alpha': 0.14, 'max_samples': 0.5}. Best is trial 74 with value: -0.18167313469617832.
[I 2025-04-15 23:09:53,089] Trial 90 finished with value: -0.18711972569924926 and parameters: {'n_estimators': 881, 'min_samples_split': 44, 'max_features': 0.37, 'min_samples_leaf': 12, 'criterion': 'absolute_error', 'max_depth': 30, 'min_weight_fraction_leaf': 0.0, 'max_leaf_nodes': None, 'bootstrap': True, 'ccp_alpha': 0.197, 'max_samples': 0.5}. Best is trial 74 with value: -0.18167313469617832.
[I 2025-04-15 23:09:54,204] Trial 91 finished with value: -0.1865157838620211 and parameters: {'n_estimators': 1010, 'min_samples_split': 32, 'max_features': 0.54, 'min_samples_leaf': 13, 'criterion': 'absolute_error', 'max_depth': 45, 'min_weight_fraction_leaf': 0.0, 'max_leaf_nodes': None, 'bootstrap': True, 'ccp_alpha': 0.222, 'max_samples': 0.5}. Best is trial 74 with value: -0.18167313469617832.
[I 2025-04-15 23:09:56,627] Trial 92 finished with value: -0.1857164594978526 and parameters: {'n_estimators': 1950, 'min_samples_split': 32, 'max_features': 0.5700000000000001, 'min_samples_leaf': 8, 'criterion': 'absolute_error', 'max_depth': 45, 'min_weight_fraction_leaf': 0.0, 'max_leaf_nodes': None, 'bootstrap': True, 'ccp_alpha': 0.219, 'max_samples': 0.5}. Best is trial 74 with value: -0.18167313469617832.
[I 2025-04-15 23:09:59,019] Trial 93 finished with value: -0.18500622463780428 and parameters: {'n_estimators': 2057, 'min_samples_split': 31, 'max_features': 0.56, 'min_samples_leaf': 8, 'criterion': 'absolute_error', 'max_depth': 45, 'min_weight_fraction_leaf': 0.0, 'max_leaf_nodes': None, 'bootstrap': True, 'ccp_alpha': 0.219, 'max_samples': 0.5}. Best is trial 74 with value: -0.18167313469617832.
[I 2025-04-15 23:10:01,363] Trial 94 finished with value: -0.1849953002699615 and parameters: {'n_estimators': 2054, 'min_samples_split': 18, 'max_features': 0.54, 'min_samples_leaf': 7, 'criterion': 'absolute_error', 'max_depth': None, 'min_weight_fraction_leaf': 0.01, 'max_leaf_nodes': 300, 'bootstrap': True, 'ccp_alpha': 0.231, 'max_samples': 0.5}. Best is trial 74 with value: -0.18167313469617832.
[I 2025-04-15 23:10:04,038] Trial 95 finished with value: -0.18386664008425613 and parameters: {'n_estimators': 2193, 'min_samples_split': 19, 'max_features': 0.62, 'min_samples_leaf': 7, 'criterion': 'absolute_error', 'max_depth': None, 'min_weight_fraction_leaf': 0.01, 'max_leaf_nodes': 300, 'bootstrap': True, 'ccp_alpha': 0.233, 'max_samples': 0.5}. Best is trial 74 with value: -0.18167313469617832.
[I 2025-04-15 23:10:06,601] Trial 96 finished with value: -18.109190321339597 and parameters: {'n_estimators': 2155, 'min_samples_split': 13, 'max_features': 0.66, 'min_samples_leaf': 1, 'criterion': 'squared_error', 'max_depth': None, 'min_weight_fraction_leaf': 0.01, 'max_leaf_nodes': 300, 'bootstrap': True, 'ccp_alpha': 0.232, 'max_samples': None}. Best is trial 74 with value: -0.18167313469617832.
[I 2025-04-15 23:10:08,953] Trial 97 finished with value: -0.18686595297481184 and parameters: {'n_estimators': 1841, 'min_samples_split': 41, 'max_features': 0.53, 'min_samples_leaf': 7, 'criterion': 'absolute_error', 'max_depth': None, 'min_weight_fraction_leaf': 0.01, 'max_leaf_nodes': 300, 'bootstrap': True, 'ccp_alpha': 0.241, 'max_samples': 0.5}. Best is trial 74 with value: -0.18167313469617832.
[I 2025-04-15 23:10:11,950] Trial 98 finished with value: -18.092630822551904 and parameters: {'n_estimators': 2511, 'min_samples_split': 18, 'max_features': 0.5800000000000001, 'min_samples_leaf': 4, 'criterion': 'poisson', 'max_depth': None, 'min_weight_fraction_leaf': 0.09, 'max_leaf_nodes': 300, 'bootstrap': True, 'ccp_alpha': 0.234, 'max_samples': 1.0}. Best is trial 74 with value: -0.18167313469617832.
[I 2025-04-15 23:10:14,358] Trial 99 finished with value: -0.18532389292705292 and parameters: {'n_estimators': 2033, 'min_samples_split': 21, 'max_features': 0.63, 'min_samples_leaf': 10, 'criterion': 'absolute_error', 'max_depth': None, 'min_weight_fraction_leaf': 0.01, 'max_leaf_nodes': 300, 'bootstrap': True, 'ccp_alpha': 0.213, 'max_samples': 0.5}. Best is trial 74 with value: -0.18167313469617832.
[I 2025-04-15 23:10:17,064] Trial 100 finished with value: -0.1835835379042869 and parameters: {'n_estimators': 2247, 'min_samples_split': 8, 'max_features': 0.64, 'min_samples_leaf': 6, 'criterion': 'absolute_error', 'max_depth': None, 'min_weight_fraction_leaf': 0.01, 'max_leaf_nodes': 300, 'bootstrap': True, 'ccp_alpha': 0.214, 'max_samples': 0.5}. Best is trial 74 with value: -0.18167313469617832.
[I 2025-04-15 23:10:20,293] Trial 101 finished with value: -0.18385237239903027 and parameters: {'n_estimators': 2380, 'min_samples_split': 7, 'max_features': 0.61, 'min_samples_leaf': 9, 'criterion': 'absolute_error', 'max_depth': None, 'min_weight_fraction_leaf': 0.01, 'max_leaf_nodes': 300, 'bootstrap': True, 'ccp_alpha': 0.214, 'max_samples': 0.5}. Best is trial 74 with value: -0.18167313469617832.
[I 2025-04-15 23:10:24,056] Trial 102 finished with value: -0.18375982663489224 and parameters: {'n_estimators': 2295, 'min_samples_split': 3, 'max_features': 0.62, 'min_samples_leaf': 6, 'criterion': 'absolute_error', 'max_depth': None, 'min_weight_fraction_leaf': 0.01, 'max_leaf_nodes': 300, 'bootstrap': True, 'ccp_alpha': 0.214, 'max_samples': 0.5}. Best is trial 74 with value: -0.18167313469617832.
[I 2025-04-15 23:10:27,336] Trial 103 finished with value: -0.18378398586205996 and parameters: {'n_estimators': 2303, 'min_samples_split': 4, 'max_features': 0.62, 'min_samples_leaf': 6, 'criterion': 'absolute_error', 'max_depth': None, 'min_weight_fraction_leaf': 0.02, 'max_leaf_nodes': 300, 'bootstrap': True, 'ccp_alpha': 0.203, 'max_samples': 0.5}. Best is trial 74 with value: -0.18167313469617832.
[I 2025-04-15 23:10:29,831] Trial 104 finished with value: -0.18386669283137916 and parameters: {'n_estimators': 2224, 'min_samples_split': 5, 'max_features': 0.63, 'min_samples_leaf': 6, 'criterion': 'absolute_error', 'max_depth': None, 'min_weight_fraction_leaf': 0.02, 'max_leaf_nodes': 300, 'bootstrap': True, 'ccp_alpha': 0.191, 'max_samples': 0.5}. Best is trial 74 with value: -0.18167313469617832.
[I 2025-04-15 23:10:32,477] Trial 105 finished with value: -0.18382689967037052 and parameters: {'n_estimators': 2315, 'min_samples_split': 2, 'max_features': 0.62, 'min_samples_leaf': 6, 'criterion': 'absolute_error', 'max_depth': None, 'min_weight_fraction_leaf': 0.02, 'max_leaf_nodes': 300, 'bootstrap': True, 'ccp_alpha': 0.191, 'max_samples': 0.5}. Best is trial 74 with value: -0.18167313469617832.
[I 2025-04-15 23:10:35,577] Trial 106 finished with value: -0.18271499299391988 and parameters: {'n_estimators': 2764, 'min_samples_split': 2, 'max_features': 0.62, 'min_samples_leaf': 5, 'criterion': 'absolute_error', 'max_depth': None, 'min_weight_fraction_leaf': 0.02, 'max_leaf_nodes': 300, 'bootstrap': True, 'ccp_alpha': 0.19, 'max_samples': 0.5}. Best is trial 74 with value: -0.18167313469617832.
[I 2025-04-15 23:10:38,273] Trial 107 finished with value: -0.19329473674696454 and parameters: {'n_estimators': 2323, 'min_samples_split': 2, 'max_features': 0.68, 'min_samples_leaf': 5, 'criterion': 'absolute_error', 'max_depth': None, 'min_weight_fraction_leaf': 0.02, 'max_leaf_nodes': 300, 'bootstrap': True, 'ccp_alpha': 0.192, 'max_samples': None}. Best is trial 74 with value: -0.18167313469617832.
[I 2025-04-15 23:10:41,342] Trial 108 finished with value: -0.1829013939300685 and parameters: {'n_estimators': 2648, 'min_samples_split': 8, 'max_features': 0.62, 'min_samples_leaf': 2, 'criterion': 'absolute_error', 'max_depth': None, 'min_weight_fraction_leaf': 0.02, 'max_leaf_nodes': 300, 'bootstrap': True, 'ccp_alpha': 0.171, 'max_samples': 0.5}. Best is trial 74 with value: -0.18167313469617832.
