[I 2025-04-16 00:05:32,060] Trial 1169 finished with value: -17.89356904182984 and parameters: {'n_estimators': 3329, 'min_samples_split': 146, 'max_features': 0.91, 'min_samples_leaf': 31, 'criterion': 'squared_error', 'max_depth': 20, 'min_weight_fraction_leaf': 0.02, 'max_leaf_nodes': 100, 'bootstrap': True, 'ccp_alpha': 0.074, 'max_samples': 0.5}. Best is trial 621 with value: -0.18112741123578058.
[I 2025-04-16 00:05:35,204] Trial 1170 finished with value: -0.18268272414507775 and parameters: {'n_estimators': 2754, 'min_samples_split': 34, 'max_features': 0.86, 'min_samples_leaf': 39, 'criterion': 'absolute_error', 'max_depth': 30, 'min_weight_fraction_leaf': 0.02, 'max_leaf_nodes': 100, 'bootstrap': True, 'ccp_alpha': 0.124, 'max_samples': 0.5}. Best is trial 621 with value: -0.18112741123578058.
[I 2025-04-16 00:05:39,130] Trial 1171 finished with value: -0.18258100278644412 and parameters: {'n_estimators': 3025, 'min_samples_split': 182, 'max_features': 0.29000000000000004, 'min_samples_leaf': 54, 'criterion': 'absolute_error', 'max_depth': 45, 'min_weight_fraction_leaf': 0.01, 'max_leaf_nodes': 100, 'bootstrap': True, 'ccp_alpha': 0.056, 'max_samples': 0.5}. Best is trial 621 with value: -0.18112741123578058.
[I 2025-04-16 00:05:39,552] Trial 1172 finished with value: -0.1860665594711329 and parameters: {'n_estimators': 209, 'min_samples_split': 168, 'max_features': 0.88, 'min_samples_leaf': 24, 'criterion': 'absolute_error', 'max_depth': None, 'min_weight_fraction_leaf': 0.02, 'max_leaf_nodes': 300, 'bootstrap': True, 'ccp_alpha': 0.105, 'max_samples': 0.5}. Best is trial 621 with value: -0.18112741123578058.
[I 2025-04-16 00:05:39,755] Trial 1173 finished with value: -0.19363423500438395 and parameters: {'n_estimators': 3, 'min_samples_split': 175, 'max_features': 0.34, 'min_samples_leaf': 35, 'criterion': 'absolute_error', 'max_depth': 60, 'min_weight_fraction_leaf': 0.05, 'max_leaf_nodes': 100, 'bootstrap': True, 'ccp_alpha': 0.081, 'max_samples': 0.5}. Best is trial 621 with value: -0.18112741123578058.
[I 2025-04-16 00:05:40,437] Trial 1174 finished with value: -17.528986382274873 and parameters: {'n_estimators': 498, 'min_samples_split': 155, 'max_features': 0.81, 'min_samples_leaf': 32, 'criterion': 'poisson', 'max_depth': 30, 'min_weight_fraction_leaf': 0.01, 'max_leaf_nodes': 50, 'bootstrap': False, 'ccp_alpha': 0.063}. Best is trial 621 with value: -0.18112741123578058.
[I 2025-04-16 00:05:44,159] Trial 1175 finished with value: -0.18315497532767716 and parameters: {'n_estimators': 3443, 'min_samples_split': 189, 'max_features': 0.9, 'min_samples_leaf': 29, 'criterion': 'absolute_error', 'max_depth': 5, 'min_weight_fraction_leaf': 0.03, 'max_leaf_nodes': None, 'bootstrap': True, 'ccp_alpha': 0.069, 'max_samples': 0.5}. Best is trial 621 with value: -0.18112741123578058.
[I 2025-04-16 00:05:47,676] Trial 1176 finished with value: -0.18276628310504722 and parameters: {'n_estimators': 3200, 'min_samples_split': 27, 'max_features': 0.45, 'min_samples_leaf': 26, 'criterion': 'absolute_error', 'max_depth': 30, 'min_weight_fraction_leaf': 0.02, 'max_leaf_nodes': 100, 'bootstrap': True, 'ccp_alpha': 0.099, 'max_samples': 0.5}. Best is trial 621 with value: -0.18112741123578058.
[I 2025-04-16 00:05:50,972] Trial 1177 finished with value: -0.19328248473841186 and parameters: {'n_estimators': 2890, 'min_samples_split': 160, 'max_features': 0.97, 'min_samples_leaf': 33, 'criterion': 'absolute_error', 'max_depth': 45, 'min_weight_fraction_leaf': 0.02, 'max_leaf_nodes': 100, 'bootstrap': True, 'ccp_alpha': 0.09, 'max_samples': 1.0}. Best is trial 621 with value: -0.18112741123578058.
[I 2025-04-16 00:05:53,713] Trial 1178 finished with value: -0.1908109070991027 and parameters: {'n_estimators': 2517, 'min_samples_split': 167, 'max_features': 0.8400000000000001, 'min_samples_leaf': 28, 'criterion': 'absolute_error', 'max_depth': 30, 'min_weight_fraction_leaf': 0.01, 'max_leaf_nodes': 10, 'bootstrap': True, 'ccp_alpha': 0.11, 'max_samples': 0.75}. Best is trial 621 with value: -0.18112741123578058.
[I 2025-04-16 00:06:01,440] Trial 1179 finished with value: -0.1842827469415187 and parameters: {'n_estimators': 7373, 'min_samples_split': 178, 'max_features': 0.77, 'min_samples_leaf': 37, 'criterion': 'absolute_error', 'max_depth': 45, 'min_weight_fraction_leaf': 0.02, 'max_leaf_nodes': 100, 'bootstrap': True, 'ccp_alpha': 0.058, 'max_samples': 0.5}. Best is trial 621 with value: -0.18112741123578058.
[I 2025-04-16 00:06:07,461] Trial 1180 finished with value: -0.18372944236739283 and parameters: {'n_estimators': 5621, 'min_samples_split': 172, 'max_features': 0.93, 'min_samples_leaf': 22, 'criterion': 'absolute_error', 'max_depth': 30, 'min_weight_fraction_leaf': 0.06, 'max_leaf_nodes': 100, 'bootstrap': True, 'ccp_alpha': 0.177, 'max_samples': 0.5}. Best is trial 621 with value: -0.18112741123578058.
[I 2025-04-16 00:06:11,220] Trial 1181 finished with value: -0.18348734491701385 and parameters: {'n_estimators': 3698, 'min_samples_split': 74, 'max_features': 0.53, 'min_samples_leaf': 46, 'criterion': 'absolute_error', 'max_depth': 30, 'min_weight_fraction_leaf': 0.03, 'max_leaf_nodes': 50, 'bootstrap': True, 'ccp_alpha': 0.075, 'max_samples': 0.5}. Best is trial 621 with value: -0.18112741123578058.
[I 2025-04-16 00:06:14,955] Trial 1182 finished with value: -0.18262686114904253 and parameters: {'n_estimators': 3149, 'min_samples_split': 151, 'max_features': 0.87, 'min_samples_leaf': 31, 'criterion': 'absolute_error', 'max_depth': 45, 'min_weight_fraction_leaf': 0.01, 'max_leaf_nodes': 100, 'bootstrap': True, 'ccp_alpha': 0.04, 'max_samples': 0.5}. Best is trial 621 with value: -0.18112741123578058.
[I 2025-04-16 00:06:18,053] Trial 1183 finished with value: -18.153252491097568 and parameters: {'n_estimators': 2783, 'min_samples_split': 163, 'max_features': 0.8, 'min_samples_leaf': 25, 'criterion': 'friedman_mse', 'max_depth': 20, 'min_weight_fraction_leaf': 0.02, 'max_leaf_nodes': 100, 'bootstrap': True, 'ccp_alpha': 0.083, 'max_samples': 0.5}. Best is trial 621 with value: -0.18112741123578058.
[I 2025-04-16 00:06:21,393] Trial 1184 finished with value: -0.18259985062572456 and parameters: {'n_estimators': 3013, 'min_samples_split': 184, 'max_features': 0.37, 'min_samples_leaf': 29, 'criterion': 'absolute_error', 'max_depth': 30, 'min_weight_fraction_leaf': 0.02, 'max_leaf_nodes': 20, 'bootstrap': True, 'ccp_alpha': 0.098, 'max_samples': 0.5}. Best is trial 621 with value: -0.18112741123578058.
[I 2025-04-16 00:06:25,037] Trial 1185 finished with value: -0.18297802247176378 and parameters: {'n_estimators': 3326, 'min_samples_split': 194, 'max_features': 0.21000000000000002, 'min_samples_leaf': 34, 'criterion': 'absolute_error', 'max_depth': None, 'min_weight_fraction_leaf': 0.02, 'max_leaf_nodes': 100, 'bootstrap': True, 'ccp_alpha': 0.116, 'max_samples': 0.5}. Best is trial 621 with value: -0.18112741123578058.
[I 2025-04-16 00:06:27,698] Trial 1186 finished with value: -0.1837090107489881 and parameters: {'n_estimators': 2281, 'min_samples_split': 138, 'max_features': 0.56, 'min_samples_leaf': 27, 'criterion': 'absolute_error', 'max_depth': 10, 'min_weight_fraction_leaf': 0.02, 'max_leaf_nodes': 10, 'bootstrap': True, 'ccp_alpha': 0.065, 'max_samples': 0.5}. Best is trial 621 with value: -0.18112741123578058.
[I 2025-04-16 00:06:28,232] Trial 1187 finished with value: -0.1871208783699958 and parameters: {'n_estimators': 305, 'min_samples_split': 32, 'max_features': 0.85, 'min_samples_leaf': 20, 'criterion': 'absolute_error', 'max_depth': 60, 'min_weight_fraction_leaf': 0.07, 'max_leaf_nodes': 100, 'bootstrap': True, 'ccp_alpha': 0.05, 'max_samples': 0.5}. Best is trial 621 with value: -0.18112741123578058.
[I 2025-04-16 00:06:33,786] Trial 1188 finished with value: -0.18345286353660328 and parameters: {'n_estimators': 5016, 'min_samples_split': 22, 'max_features': 0.89, 'min_samples_leaf': 23, 'criterion': 'absolute_error', 'max_depth': 30, 'min_weight_fraction_leaf': 0.01, 'max_leaf_nodes': None, 'bootstrap': True, 'ccp_alpha': 0.092, 'max_samples': 0.5}. Best is trial 621 with value: -0.18112741123578058.
[I 2025-04-16 00:06:37,122] Trial 1189 finished with value: -0.18261547459939606 and parameters: {'n_estimators': 2949, 'min_samples_split': 157, 'max_features': 0.8200000000000001, 'min_samples_leaf': 30, 'criterion': 'absolute_error', 'max_depth': 45, 'min_weight_fraction_leaf': 0.03, 'max_leaf_nodes': 50, 'bootstrap': True, 'ccp_alpha': 0.192, 'max_samples': 0.5}. Best is trial 621 with value: -0.18112741123578058.
[I 2025-04-16 00:06:41,119] Trial 1190 finished with value: -0.1833444633916815 and parameters: {'n_estimators': 3551, 'min_samples_split': 17, 'max_features': 0.78, 'min_samples_leaf': 27, 'criterion': 'absolute_error', 'max_depth': 30, 'min_weight_fraction_leaf': 0.01, 'max_leaf_nodes': 100, 'bootstrap': True, 'ccp_alpha': 0.079, 'max_samples': 0.5}. Best is trial 621 with value: -0.18112741123578058.
[I 2025-04-16 00:06:43,950] Trial 1191 finished with value: -18.17835593007472 and parameters: {'n_estimators': 2663, 'min_samples_split': 180, 'max_features': 0.92, 'min_samples_leaf': 32, 'criterion': 'squared_error', 'max_depth': 45, 'min_weight_fraction_leaf': 0.02, 'max_leaf_nodes': 100, 'bootstrap': True, 'ccp_alpha': 0.06, 'max_samples': 0.5}. Best is trial 621 with value: -0.18112741123578058.
[I 2025-04-16 00:06:46,925] Trial 1192 finished with value: -0.1936417107583833 and parameters: {'n_estimators': 3217, 'min_samples_split': 171, 'max_features': 0.9500000000000001, 'min_samples_leaf': 25, 'criterion': 'absolute_error', 'max_depth': 5, 'min_weight_fraction_leaf': 0.01, 'max_leaf_nodes': 100, 'bootstrap': False, 'ccp_alpha': 0.253}. Best is trial 621 with value: -0.18112741123578058.
[I 2025-04-16 00:06:47,138] Trial 1193 finished with value: -0.1936179286822098 and parameters: {'n_estimators': 1, 'min_samples_split': 164, 'max_features': 0.86, 'min_samples_leaf': 30, 'criterion': 'absolute_error', 'max_depth': 30, 'min_weight_fraction_leaf': 0.02, 'max_leaf_nodes': 100, 'bootstrap': True, 'ccp_alpha': 0.128, 'max_samples': 0.5}. Best is trial 621 with value: -0.18112741123578058.
[I 2025-04-16 00:06:47,941] Trial 1194 finished with value: -0.1867412507215372 and parameters: {'n_estimators': 533, 'min_samples_split': 148, 'max_features': 0.25, 'min_samples_leaf': 51, 'criterion': 'absolute_error', 'max_depth': 30, 'min_weight_fraction_leaf': 0.02, 'max_leaf_nodes': 50, 'bootstrap': True, 'ccp_alpha': 0.105, 'max_samples': 0.5}. Best is trial 621 with value: -0.18112741123578058.
[I 2025-04-16 00:06:51,410] Trial 1195 finished with value: -0.19327657567785467 and parameters: {'n_estimators': 2843, 'min_samples_split': 7, 'max_features': 0.19, 'min_samples_leaf': 35, 'criterion': 'absolute_error', 'max_depth': 45, 'min_weight_fraction_leaf': 0.03, 'max_leaf_nodes': 100, 'bootstrap': True, 'ccp_alpha': 0.07100000000000001, 'max_samples': None}. Best is trial 621 with value: -0.18112741123578058.
[I 2025-04-16 00:06:54,886] Trial 1196 finished with value: -0.18256352201228915 and parameters: {'n_estimators': 3106, 'min_samples_split': 27, 'max_features': 0.8300000000000001, 'min_samples_leaf': 28, 'criterion': 'absolute_error', 'max_depth': 30, 'min_weight_fraction_leaf': 0.02, 'max_leaf_nodes': 10, 'bootstrap': True, 'ccp_alpha': 0.08700000000000001, 'max_samples': 0.5}. Best is trial 621 with value: -0.18112741123578058.
[I 2025-04-16 00:06:58,680] Trial 1197 finished with value: -0.1829890963106926 and parameters: {'n_estimators': 3378, 'min_samples_split': 94, 'max_features': 0.9, 'min_samples_leaf': 33, 'criterion': 'absolute_error', 'max_depth': 45, 'min_weight_fraction_leaf': 0.04, 'max_leaf_nodes': 100, 'bootstrap': True, 'ccp_alpha': 0.228, 'max_samples': 0.5}. Best is trial 621 with value: -0.18112741123578058.
[I 2025-04-16 00:07:01,659] Trial 1198 finished with value: -18.246859566540543 and parameters: {'n_estimators': 2529, 'min_samples_split': 119, 'max_features': 0.88, 'min_samples_leaf': 15, 'criterion': 'poisson', 'max_depth': 20, 'min_weight_fraction_leaf': 0.05, 'max_leaf_nodes': 300, 'bootstrap': True, 'ccp_alpha': 0.1, 'max_samples': 0.5}. Best is trial 621 with value: -0.18112741123578058.
[I 2025-04-16 00:07:02,156] Trial 1199 finished with value: -0.18579406080266958 and parameters: {'n_estimators': 201, 'min_samples_split': 35, 'max_features': 0.85, 'min_samples_leaf': 63, 'criterion': 'absolute_error', 'max_depth': 30, 'min_weight_fraction_leaf': 0.02, 'max_leaf_nodes': 100, 'bootstrap': True, 'ccp_alpha': 0.055, 'max_samples': 0.5}. Best is trial 621 with value: -0.18112741123578058.
[I 2025-04-16 00:07:05,771] Trial 1200 finished with value: -0.19328461196488383 and parameters: {'n_estimators': 2999, 'min_samples_split': 175, 'max_features': 0.31, 'min_samples_leaf': 60, 'criterion': 'absolute_error', 'max_depth': None, 'min_weight_fraction_leaf': 0.01, 'max_leaf_nodes': 100, 'bootstrap': True, 'ccp_alpha': 0.074, 'max_samples': 1.0}. Best is trial 621 with value: -0.18112741123578058.
[I 2025-04-16 00:07:09,483] Trial 1201 finished with value: -0.18281925028331547 and parameters: {'n_estimators': 3238, 'min_samples_split': 154, 'max_features': 0.8, 'min_samples_leaf': 23, 'criterion': 'absolute_error', 'max_depth': 30, 'min_weight_fraction_leaf': 0.01, 'max_leaf_nodes': None, 'bootstrap': True, 'ccp_alpha': 0.094, 'max_samples': 0.5}. Best is trial 621 with value: -0.18112741123578058.
[I 2025-04-16 00:07:19,645] Trial 1202 finished with value: -0.1847400242914329 and parameters: {'n_estimators': 8802, 'min_samples_split': 167, 'max_features': 0.42000000000000004, 'min_samples_leaf': 26, 'criterion': 'absolute_error', 'max_depth': 60, 'min_weight_fraction_leaf': 0.02, 'max_leaf_nodes': 100, 'bootstrap': True, 'ccp_alpha': 0.065, 'max_samples': 0.5}. Best is trial 621 with value: -0.18112741123578058.
[I 2025-04-16 00:07:22,672] Trial 1203 finished with value: -0.1827021072750023 and parameters: {'n_estimators': 2760, 'min_samples_split': 159, 'max_features': 0.76, 'min_samples_leaf': 69, 'criterion': 'absolute_error', 'max_depth': 45, 'min_weight_fraction_leaf': 0.06, 'max_leaf_nodes': 50, 'bootstrap': True, 'ccp_alpha': 0.047, 'max_samples': 0.5}. Best is trial 621 with value: -0.18112741123578058.
[I 2025-04-16 00:07:26,699] Trial 1204 finished with value: -0.1828765673876708 and parameters: {'n_estimators': 3829, 'min_samples_split': 143, 'max_features': 0.14, 'min_samples_leaf': 30, 'criterion': 'absolute_error', 'max_depth': 5, 'min_weight_fraction_leaf': 0.02, 'max_leaf_nodes': 100, 'bootstrap': True, 'ccp_alpha': 0.109, 'max_samples': 0.5}. Best is trial 621 with value: -0.18112741123578058.
[I 2025-04-16 00:07:27,273] Trial 1205 finished with value: -0.19103448310629806 and parameters: {'n_estimators': 335, 'min_samples_split': 22, 'max_features': 0.27, 'min_samples_leaf': 4, 'criterion': 'absolute_error', 'max_depth': 30, 'min_weight_fraction_leaf': 0.02, 'max_leaf_nodes': 10, 'bootstrap': True, 'ccp_alpha': 0.083, 'max_samples': 0.75}. Best is trial 621 with value: -0.18112741123578058.
[I 2025-04-16 00:07:30,828] Trial 1206 finished with value: -0.18326693982518996 and parameters: {'n_estimators': 3488, 'min_samples_split': 186, 'max_features': 0.8300000000000001, 'min_samples_leaf': 36, 'criterion': 'absolute_error', 'max_depth': 30, 'min_weight_fraction_leaf': 0.01, 'max_leaf_nodes': 100, 'bootstrap': True, 'ccp_alpha': 0.068, 'max_samples': 0.5}. Best is trial 621 with value: -0.18112741123578058.
[I 2025-04-16 00:07:34,043] Trial 1207 finished with value: -0.18255279843360217 and parameters: {'n_estimators': 2980, 'min_samples_split': 180, 'max_features': 0.91, 'min_samples_leaf': 32, 'criterion': 'absolute_error', 'max_depth': 45, 'min_weight_fraction_leaf': 0.03, 'max_leaf_nodes': 100, 'bootstrap': True, 'ccp_alpha': 0.078, 'max_samples': 0.5}. Best is trial 621 with value: -0.18112741123578058.
[I 2025-04-16 00:07:37,457] Trial 1208 finished with value: -17.948488034290957 and parameters: {'n_estimators': 3154, 'min_samples_split': 30, 'max_features': 0.87, 'min_samples_leaf': 28, 'criterion': 'friedman_mse', 'max_depth': 30, 'min_weight_fraction_leaf': 0.01, 'max_leaf_nodes': 150, 'bootstrap': True, 'ccp_alpha': 0.11900000000000001, 'max_samples': 0.5}. Best is trial 621 with value: -0.18112741123578058.
[I 2025-04-16 00:07:37,862] Trial 1209 finished with value: -0.18519449229645488 and parameters: {'n_estimators': 181, 'min_samples_split': 173, 'max_features': 0.9400000000000001, 'min_samples_leaf': 39, 'criterion': 'absolute_error', 'max_depth': 45, 'min_weight_fraction_leaf': 0.02, 'max_leaf_nodes': 100, 'bootstrap': True, 'ccp_alpha': 0.061, 'max_samples': 0.5}. Best is trial 621 with value: -0.18112741123578058.
[I 2025-04-16 00:07:40,157] Trial 1210 finished with value: -0.1936417107583833 and parameters: {'n_estimators': 2858, 'min_samples_split': 161, 'max_features': 0.89, 'min_samples_leaf': 74, 'criterion': 'absolute_error', 'max_depth': 30, 'min_weight_fraction_leaf': 0.02, 'max_leaf_nodes': 50, 'bootstrap': False, 'ccp_alpha': 0.101}. Best is trial 621 with value: -0.18112741123578058.
[I 2025-04-16 00:07:43,783] Trial 1211 finished with value: -0.1829422667403624 and parameters: {'n_estimators': 3360, 'min_samples_split': 152, 'max_features': 0.81, 'min_samples_leaf': 18, 'criterion': 'absolute_error', 'max_depth': 30, 'min_weight_fraction_leaf': 0.02, 'max_leaf_nodes': 20, 'bootstrap': True, 'ccp_alpha': 0.089, 'max_samples': 0.5}. Best is trial 621 with value: -0.18112741123578058.
[I 2025-04-16 00:07:46,580] Trial 1212 finished with value: -0.18302030901315341 and parameters: {'n_estimators': 2599, 'min_samples_split': 13, 'max_features': 0.85, 'min_samples_leaf': 26, 'criterion': 'absolute_error', 'max_depth': 20, 'min_weight_fraction_leaf': 0.02, 'max_leaf_nodes': 100, 'bootstrap': True, 'ccp_alpha': 0.096, 'max_samples': 0.5}. Best is trial 621 with value: -0.18112741123578058.
[I 2025-04-16 00:07:50,069] Trial 1213 finished with value: -0.18254041031959276 and parameters: {'n_estimators': 3098, 'min_samples_split': 169, 'max_features': 0.92, 'min_samples_leaf': 30, 'criterion': 'absolute_error', 'max_depth': 45, 'min_weight_fraction_leaf': 0.01, 'max_leaf_nodes': 100, 'bootstrap': True, 'ccp_alpha': 0.07200000000000001, 'max_samples': 0.5}. Best is trial 621 with value: -0.18112741123578058.
[I 2025-04-16 00:07:53,198] Trial 1214 finished with value: -0.1826988802057629 and parameters: {'n_estimators': 2759, 'min_samples_split': 177, 'max_features': 0.32, 'min_samples_leaf': 24, 'criterion': 'absolute_error', 'max_depth': 10, 'min_weight_fraction_leaf': 0.01, 'max_leaf_nodes': 10, 'bootstrap': True, 'ccp_alpha': 0.082, 'max_samples': 0.5}. Best is trial 621 with value: -0.18112741123578058.
[I 2025-04-16 00:07:57,002] Trial 1215 finished with value: -17.802126594439592 and parameters: {'n_estimators': 3672, 'min_samples_split': 35, 'max_features': 0.78, 'min_samples_leaf': 21, 'criterion': 'squared_error', 'max_depth': None, 'min_weight_fraction_leaf': 0.02, 'max_leaf_nodes': 100, 'bootstrap': True, 'ccp_alpha': 0.054, 'max_samples': 0.5}. Best is trial 621 with value: -0.18112741123578058.
[I 2025-04-16 00:08:06,859] Trial 1216 finished with value: -0.18473551256737913 and parameters: {'n_estimators': 9506, 'min_samples_split': 25, 'max_features': 0.8400000000000001, 'min_samples_leaf': 34, 'criterion': 'absolute_error', 'max_depth': 30, 'min_weight_fraction_leaf': 0.02, 'max_leaf_nodes': None, 'bootstrap': True, 'ccp_alpha': 0.106, 'max_samples': 0.5}. Best is trial 621 with value: -0.18112741123578058.
[I 2025-04-16 00:08:07,824] Trial 1217 finished with value: -0.18632433570215964 and parameters: {'n_estimators': 730, 'min_samples_split': 165, 'max_features': 0.87, 'min_samples_leaf': 28, 'criterion': 'absolute_error', 'max_depth': 60, 'min_weight_fraction_leaf': 0.01, 'max_leaf_nodes': 150, 'bootstrap': True, 'ccp_alpha': 0.061, 'max_samples': 0.5}. Best is trial 621 with value: -0.18112741123578058.
[I 2025-04-16 00:08:11,521] Trial 1218 finished with value: -0.182876324454587 and parameters: {'n_estimators': 3259, 'min_samples_split': 158, 'max_features': 0.98, 'min_samples_leaf': 32, 'criterion': 'absolute_error', 'max_depth': 5, 'min_weight_fraction_leaf': 0.04, 'max_leaf_nodes': 100, 'bootstrap': True, 'ccp_alpha': 0.092, 'max_samples': 0.5}. Best is trial 621 with value: -0.18112741123578058.
[I 2025-04-16 00:08:14,853] Trial 1219 finished with value: -0.18255279843360217 and parameters: {'n_estimators': 2980, 'min_samples_split': 181, 'max_features': 0.9, 'min_samples_leaf': 25, 'criterion': 'absolute_error', 'max_depth': 45, 'min_weight_fraction_leaf': 0.03, 'max_leaf_nodes': 50, 'bootstrap': True, 'ccp_alpha': 0.112, 'max_samples': 0.5}. Best is trial 621 with value: -0.18112741123578058.
[I 2025-04-16 00:08:15,707] Trial 1220 finished with value: -0.18739626452531133 and parameters: {'n_estimators': 502, 'min_samples_split': 18, 'max_features': 0.8200000000000001, 'min_samples_leaf': 30, 'criterion': 'absolute_error', 'max_depth': 30, 'min_weight_fraction_leaf': 0.01, 'max_leaf_nodes': 100, 'bootstrap': True, 'ccp_alpha': 0.218, 'max_samples': 0.5}. Best is trial 621 with value: -0.18112741123578058.
[I 2025-04-16 00:08:18,403] Trial 1221 finished with value: -18.103746200150105 and parameters: {'n_estimators': 2313, 'min_samples_split': 171, 'max_features': 0.24000000000000002, 'min_samples_leaf': 37, 'criterion': 'poisson', 'max_depth': 30, 'min_weight_fraction_leaf': 0.02, 'max_leaf_nodes': 100, 'bootstrap': True, 'ccp_alpha': 0.076, 'max_samples': None}. Best is trial 621 with value: -0.18112741123578058.
