[I 2025-04-16 02:13:13,426] Trial 4237 finished with value: -17.528986382275015 and parameters: {'n_estimators': 1, 'min_samples_split': 9, 'max_features': 0.7100000000000001, 'min_samples_leaf': 3, 'criterion': 'squared_error', 'max_depth': 15, 'min_weight_fraction_leaf': 0.0, 'max_leaf_nodes': 50, 'bootstrap': False, 'ccp_alpha': 0.005}. Best is trial 4065 with value: 0.057524275121161005.
[I 2025-04-16 02:13:13,982] Trial 4238 finished with value: -0.1936417107583833 and parameters: {'n_estimators': 9, 'min_samples_split': 5, 'max_features': 0.67, 'min_samples_leaf': 3, 'criterion': 'absolute_error', 'max_depth': 15, 'min_weight_fraction_leaf': 0.0, 'max_leaf_nodes': 50, 'bootstrap': False, 'ccp_alpha': 0.167}. Best is trial 4065 with value: 0.057524275121161005.
[I 2025-04-16 02:13:14,941] Trial 4239 finished with value: -0.1936417107583833 and parameters: {'n_estimators': 446, 'min_samples_split': 12, 'max_features': 0.7100000000000001, 'min_samples_leaf': 1, 'criterion': 'absolute_error', 'max_depth': 15, 'min_weight_fraction_leaf': 0.0, 'max_leaf_nodes': 50, 'bootstrap': False, 'ccp_alpha': 0.032}. Best is trial 4065 with value: 0.057524275121161005.
[I 2025-04-16 02:13:15,771] Trial 4240 finished with value: -0.11076864870152583 and parameters: {'n_estimators': 315, 'min_samples_split': 2, 'max_features': 0.7100000000000001, 'min_samples_leaf': 5, 'criterion': 'absolute_error', 'max_depth': 15, 'min_weight_fraction_leaf': 0.0, 'max_leaf_nodes': 10, 'bootstrap': False, 'ccp_alpha': 0.005}. Best is trial 4065 with value: 0.057524275121161005.
[I 2025-04-16 02:13:16,495] Trial 4241 finished with value: -12.033437099057092 and parameters: {'n_estimators': 182, 'min_samples_split': 9, 'max_features': 0.6900000000000001, 'min_samples_leaf': 3, 'criterion': 'absolute_error', 'max_depth': 15, 'min_weight_fraction_leaf': 0.0, 'max_leaf_nodes': None, 'bootstrap': False, 'ccp_alpha': 0.0}. Best is trial 4065 with value: 0.057524275121161005.
[I 2025-04-16 02:13:17,512] Trial 4242 finished with value: -17.528986382274873 and parameters: {'n_estimators': 515, 'min_samples_split': 6, 'max_features': 0.7000000000000001, 'min_samples_leaf': 1, 'criterion': 'poisson', 'max_depth': 10, 'min_weight_fraction_leaf': 0.0, 'max_leaf_nodes': 50, 'bootstrap': False, 'ccp_alpha': 0.019}. Best is trial 4065 with value: 0.057524275121161005.
[I 2025-04-16 02:13:18,404] Trial 4243 finished with value: -0.1936417107583833 and parameters: {'n_estimators': 376, 'min_samples_split': 2, 'max_features': 0.8300000000000001, 'min_samples_leaf': 5, 'criterion': 'absolute_error', 'max_depth': 15, 'min_weight_fraction_leaf': 0.0, 'max_leaf_nodes': 50, 'bootstrap': False, 'ccp_alpha': 0.01}. Best is trial 4065 with value: 0.057524275121161005.
[I 2025-04-16 02:13:19,103] Trial 4244 finished with value: -0.1936417107583833 and parameters: {'n_estimators': 156, 'min_samples_split': 9, 'max_features': 0.72, 'min_samples_leaf': 3, 'criterion': 'absolute_error', 'max_depth': 15, 'min_weight_fraction_leaf': 0.0, 'max_leaf_nodes': 50, 'bootstrap': False, 'ccp_alpha': 0.013000000000000001}. Best is trial 4065 with value: 0.057524275121161005.
[I 2025-04-16 02:13:20,123] Trial 4245 finished with value: -22.39967444305529 and parameters: {'n_estimators': 503, 'min_samples_split': 6, 'max_features': 0.67, 'min_samples_leaf': 1, 'criterion': 'absolute_error', 'max_depth': 15, 'min_weight_fraction_leaf': 0.0, 'max_leaf_nodes': None, 'bootstrap': False, 'ccp_alpha': 0.0}. Best is trial 4065 with value: 0.057524275121161005.
[I 2025-04-16 02:13:20,941] Trial 4246 finished with value: -0.1936417107583833 and parameters: {'n_estimators': 313, 'min_samples_split': 12, 'max_features': 0.6900000000000001, 'min_samples_leaf': 5, 'criterion': 'absolute_error', 'max_depth': 15, 'min_weight_fraction_leaf': 0.0, 'max_leaf_nodes': 300, 'bootstrap': False, 'ccp_alpha': 0.01}. Best is trial 4065 with value: 0.057524275121161005.
[I 2025-04-16 02:13:21,896] Trial 4247 finished with value: -0.1936417107583833 and parameters: {'n_estimators': 532, 'min_samples_split': 88, 'max_features': 0.8300000000000001, 'min_samples_leaf': 3, 'criterion': 'absolute_error', 'max_depth': 15, 'min_weight_fraction_leaf': 0.0, 'max_leaf_nodes': 300, 'bootstrap': False, 'ccp_alpha': 0.005}. Best is trial 4065 with value: 0.057524275121161005.
[I 2025-04-16 02:13:22,616] Trial 4248 finished with value: -0.1936417107583833 and parameters: {'n_estimators': 176, 'min_samples_split': 2, 'max_features': 0.72, 'min_samples_leaf': 1, 'criterion': 'absolute_error', 'max_depth': 15, 'min_weight_fraction_leaf': 0.0, 'max_leaf_nodes': 50, 'bootstrap': False, 'ccp_alpha': 0.025}. Best is trial 4065 with value: 0.057524275121161005.
[I 2025-04-16 02:13:23,663] Trial 4249 finished with value: -0.1936417107583833 and parameters: {'n_estimators': 564, 'min_samples_split': 6, 'max_features': 0.72, 'min_samples_leaf': 3, 'criterion': 'absolute_error', 'max_depth': 15, 'min_weight_fraction_leaf': 0.0, 'max_leaf_nodes': 50, 'bootstrap': False, 'ccp_alpha': 0.018000000000000002}. Best is trial 4065 with value: 0.057524275121161005.
[I 2025-04-16 02:13:24,455] Trial 4250 finished with value: -0.1936417107583833 and parameters: {'n_estimators': 311, 'min_samples_split': 49, 'max_features': 0.81, 'min_samples_leaf': 1, 'criterion': 'absolute_error', 'max_depth': 15, 'min_weight_fraction_leaf': 0.0, 'max_leaf_nodes': 50, 'bootstrap': False, 'ccp_alpha': 0.011}. Best is trial 4065 with value: 0.057524275121161005.
[I 2025-04-16 02:13:25,387] Trial 4251 finished with value: -9.669588956924638 and parameters: {'n_estimators': 439, 'min_samples_split': 9, 'max_features': 0.7000000000000001, 'min_samples_leaf': 5, 'criterion': 'absolute_error', 'max_depth': 15, 'min_weight_fraction_leaf': 0.0, 'max_leaf_nodes': 50, 'bootstrap': False, 'ccp_alpha': 0.0}. Best is trial 4065 with value: 0.057524275121161005.
[I 2025-04-16 02:13:25,942] Trial 4252 finished with value: -17.528986382275015 and parameters: {'n_estimators': 6, 'min_samples_split': 5, 'max_features': 0.73, 'min_samples_leaf': 3, 'criterion': 'friedman_mse', 'max_depth': 15, 'min_weight_fraction_leaf': 0.0, 'max_leaf_nodes': 50, 'bootstrap': False, 'ccp_alpha': 0.006}. Best is trial 4065 with value: 0.057524275121161005.
[I 2025-04-16 02:13:27,027] Trial 4253 finished with value: -0.1936417107583833 and parameters: {'n_estimators': 619, 'min_samples_split': 2, 'max_features': 0.63, 'min_samples_leaf': 1, 'criterion': 'absolute_error', 'max_depth': 15, 'min_weight_fraction_leaf': 0.0, 'max_leaf_nodes': 50, 'bootstrap': False, 'ccp_alpha': 0.017}. Best is trial 4065 with value: 0.057524275121161005.
[I 2025-04-16 02:13:27,732] Trial 4254 finished with value: -0.10133869823411515 and parameters: {'n_estimators': 192, 'min_samples_split': 12, 'max_features': 0.8400000000000001, 'min_samples_leaf': 5, 'criterion': 'absolute_error', 'max_depth': 20, 'min_weight_fraction_leaf': 0.0, 'max_leaf_nodes': 50, 'bootstrap': False, 'ccp_alpha': 0.005}. Best is trial 4065 with value: 0.057524275121161005.
[I 2025-04-16 02:13:28,570] Trial 4255 finished with value: -0.1936417107583833 and parameters: {'n_estimators': 337, 'min_samples_split': 6, 'max_features': 0.8, 'min_samples_leaf': 3, 'criterion': 'absolute_error', 'max_depth': 15, 'min_weight_fraction_leaf': 0.0, 'max_leaf_nodes': 300, 'bootstrap': False, 'ccp_alpha': 0.01}. Best is trial 4065 with value: 0.057524275121161005.
[I 2025-04-16 02:13:29,573] Trial 4256 finished with value: -0.1936417107583833 and parameters: {'n_estimators': 544, 'min_samples_split': 9, 'max_features': 0.7000000000000001, 'min_samples_leaf': 1, 'criterion': 'absolute_error', 'max_depth': 15, 'min_weight_fraction_leaf': 0.0, 'max_leaf_nodes': 50, 'bootstrap': False, 'ccp_alpha': 0.015}. Best is trial 4065 with value: 0.057524275121161005.
[I 2025-04-16 02:13:30,287] Trial 4257 finished with value: -9.21103829896401 and parameters: {'n_estimators': 194, 'min_samples_split': 5, 'max_features': 0.67, 'min_samples_leaf': 4, 'criterion': 'absolute_error', 'max_depth': 15, 'min_weight_fraction_leaf': 0.0, 'max_leaf_nodes': 50, 'bootstrap': False, 'ccp_alpha': 0.0}. Best is trial 4065 with value: 0.057524275121161005.
[I 2025-04-16 02:13:31,431] Trial 4258 finished with value: -0.1936417107583833 and parameters: {'n_estimators': 625, 'min_samples_split': 2, 'max_features': 0.73, 'min_samples_leaf': 1, 'criterion': 'absolute_error', 'max_depth': 15, 'min_weight_fraction_leaf': 0.0, 'max_leaf_nodes': 300, 'bootstrap': False, 'ccp_alpha': 0.009000000000000001}. Best is trial 4065 with value: 0.057524275121161005.
[I 2025-04-16 02:13:39,265] Trial 4259 finished with value: -0.17448217187605364 and parameters: {'n_estimators': 8670, 'min_samples_split': 8, 'max_features': 0.79, 'min_samples_leaf': 3, 'criterion': 'absolute_error', 'max_depth': 15, 'min_weight_fraction_leaf': 0.0, 'max_leaf_nodes': 50, 'bootstrap': False, 'ccp_alpha': 0.005}. Best is trial 4065 with value: 0.057524275121161005.
[I 2025-04-16 02:13:40,180] Trial 4260 finished with value: -17.528986382274876 and parameters: {'n_estimators': 393, 'min_samples_split': 12, 'max_features': 0.8300000000000001, 'min_samples_leaf': 5, 'criterion': 'squared_error', 'max_depth': 15, 'min_weight_fraction_leaf': 0.0, 'max_leaf_nodes': 50, 'bootstrap': False, 'ccp_alpha': 0.024}. Best is trial 4065 with value: 0.057524275121161005.
[I 2025-04-16 02:13:41,039] Trial 4261 finished with value: -0.1936417107583833 and parameters: {'n_estimators': 341, 'min_samples_split': 2, 'max_features': 0.74, 'min_samples_leaf': 76, 'criterion': 'absolute_error', 'max_depth': 10, 'min_weight_fraction_leaf': 0.04, 'max_leaf_nodes': 50, 'bootstrap': False, 'ccp_alpha': 0.014}. Best is trial 4065 with value: 0.057524275121161005.
[I 2025-04-16 02:13:41,599] Trial 4262 finished with value: -0.1936417107583833 and parameters: {'n_estimators': 4, 'min_samples_split': 6, 'max_features': 0.77, 'min_samples_leaf': 1, 'criterion': 'absolute_error', 'max_depth': 15, 'min_weight_fraction_leaf': 0.0, 'max_leaf_nodes': 50, 'bootstrap': False, 'ccp_alpha': 0.005}. Best is trial 4065 with value: 0.057524275121161005.
[I 2025-04-16 02:13:42,661] Trial 4263 finished with value: -0.1936417107583833 and parameters: {'n_estimators': 616, 'min_samples_split': 9, 'max_features': 0.7100000000000001, 'min_samples_leaf': 3, 'criterion': 'absolute_error', 'max_depth': 15, 'min_weight_fraction_leaf': 0.0, 'max_leaf_nodes': 50, 'bootstrap': False, 'ccp_alpha': 0.019}. Best is trial 4065 with value: 0.057524275121161005.
[I 2025-04-16 02:13:43,572] Trial 4264 finished with value: -0.1936417107583833 and parameters: {'n_estimators': 435, 'min_samples_split': 2, 'max_features': 0.6900000000000001, 'min_samples_leaf': 5, 'criterion': 'absolute_error', 'max_depth': 15, 'min_weight_fraction_leaf': 0.0, 'max_leaf_nodes': 50, 'bootstrap': False, 'ccp_alpha': 0.009000000000000001}. Best is trial 4065 with value: 0.057524275121161005.
[I 2025-04-16 02:13:44,320] Trial 4265 finished with value: -13.471285419425081 and parameters: {'n_estimators': 261, 'min_samples_split': 12, 'max_features': 0.8, 'min_samples_leaf': 1, 'criterion': 'absolute_error', 'max_depth': 15, 'min_weight_fraction_leaf': 0.0, 'max_leaf_nodes': 50, 'bootstrap': False, 'ccp_alpha': 0.0}. Best is trial 4065 with value: 0.057524275121161005.
[I 2025-04-16 02:13:44,885] Trial 4266 finished with value: -19.789312953695003 and parameters: {'n_estimators': 7, 'min_samples_split': 6, 'max_features': 0.72, 'min_samples_leaf': 3, 'criterion': 'poisson', 'max_depth': 15, 'min_weight_fraction_leaf': 0.08, 'max_leaf_nodes': 50, 'bootstrap': False, 'ccp_alpha': 0.013000000000000001}. Best is trial 4065 with value: 0.057524275121161005.
[I 2025-04-16 02:13:45,982] Trial 4267 finished with value: -0.1936417107583833 and parameters: {'n_estimators': 657, 'min_samples_split': 6, 'max_features': 0.75, 'min_samples_leaf': 3, 'criterion': 'absolute_error', 'max_depth': 15, 'min_weight_fraction_leaf': 0.0, 'max_leaf_nodes': 50, 'bootstrap': False, 'ccp_alpha': 0.009000000000000001}. Best is trial 4065 with value: 0.057524275121161005.
[I 2025-04-16 02:13:46,722] Trial 4268 finished with value: -0.06464075267591263 and parameters: {'n_estimators': 172, 'min_samples_split': 2, 'max_features': 0.65, 'min_samples_leaf': 1, 'criterion': 'absolute_error', 'max_depth': 15, 'min_weight_fraction_leaf': 0.0, 'max_leaf_nodes': 50, 'bootstrap': False, 'ccp_alpha': 0.005}. Best is trial 4065 with value: 0.057524275121161005.
[I 2025-04-16 02:13:47,661] Trial 4269 finished with value: -11.044960116996183 and parameters: {'n_estimators': 476, 'min_samples_split': 9, 'max_features': 0.81, 'min_samples_leaf': 5, 'criterion': 'absolute_error', 'max_depth': 15, 'min_weight_fraction_leaf': 0.0, 'max_leaf_nodes': 50, 'bootstrap': False, 'ccp_alpha': 0.0}. Best is trial 4065 with value: 0.057524275121161005.
[I 2025-04-16 02:13:48,774] Trial 4270 finished with value: -0.1936417107583833 and parameters: {'n_estimators': 671, 'min_samples_split': 6, 'max_features': 0.78, 'min_samples_leaf': 3, 'criterion': 'absolute_error', 'max_depth': 15, 'min_weight_fraction_leaf': 0.0, 'max_leaf_nodes': 300, 'bootstrap': False, 'ccp_alpha': 0.021}. Best is trial 4065 with value: 0.057524275121161005.
[I 2025-04-16 02:13:49,623] Trial 4271 finished with value: -0.1936417107583833 and parameters: {'n_estimators': 307, 'min_samples_split': 2, 'max_features': 0.73, 'min_samples_leaf': 1, 'criterion': 'absolute_error', 'max_depth': 15, 'min_weight_fraction_leaf': 0.0, 'max_leaf_nodes': 50, 'bootstrap': False, 'ccp_alpha': 0.216}. Best is trial 4065 with value: 0.057524275121161005.
[I 2025-04-16 02:13:50,688] Trial 4272 finished with value: -0.1936417107583833 and parameters: {'n_estimators': 499, 'min_samples_split': 12, 'max_features': 0.8300000000000001, 'min_samples_leaf': 5, 'criterion': 'absolute_error', 'max_depth': 15, 'min_weight_fraction_leaf': 0.0, 'max_leaf_nodes': 50, 'bootstrap': False, 'ccp_alpha': 0.014}. Best is trial 4065 with value: 0.057524275121161005.
[I 2025-04-16 02:13:51,369] Trial 4273 finished with value: -0.1936417107583833 and parameters: {'n_estimators': 151, 'min_samples_split': 9, 'max_features': 0.76, 'min_samples_leaf': 3, 'criterion': 'absolute_error', 'max_depth': 15, 'min_weight_fraction_leaf': 0.0, 'max_leaf_nodes': 300, 'bootstrap': False, 'ccp_alpha': 0.006}. Best is trial 4065 with value: 0.057524275121161005.
[I 2025-04-16 02:13:51,935] Trial 4274 finished with value: -0.1936417107583833 and parameters: {'n_estimators': 5, 'min_samples_split': 5, 'max_features': 0.6900000000000001, 'min_samples_leaf': 1, 'criterion': 'absolute_error', 'max_depth': 15, 'min_weight_fraction_leaf': 0.0, 'max_leaf_nodes': 50, 'bootstrap': False, 'ccp_alpha': 0.011}. Best is trial 4065 with value: 0.057524275121161005.
[I 2025-04-16 02:13:58,718] Trial 4275 finished with value: -0.13097634697966717 and parameters: {'n_estimators': 7564, 'min_samples_split': 6, 'max_features': 0.7100000000000001, 'min_samples_leaf': 5, 'criterion': 'absolute_error', 'max_depth': 15, 'min_weight_fraction_leaf': 0.0, 'max_leaf_nodes': 50, 'bootstrap': False, 'ccp_alpha': 0.005}. Best is trial 4065 with value: 0.057524275121161005.
[I 2025-04-16 02:13:59,903] Trial 4276 finished with value: -17.528986382274862 and parameters: {'n_estimators': 720, 'min_samples_split': 2, 'max_features': 0.78, 'min_samples_leaf': 3, 'criterion': 'friedman_mse', 'max_depth': 20, 'min_weight_fraction_leaf': 0.0, 'max_leaf_nodes': 50, 'bootstrap': False, 'ccp_alpha': 0.016}. Best is trial 4065 with value: 0.057524275121161005.
[I 2025-04-16 02:14:00,864] Trial 4277 finished with value: -11.168928192401738 and parameters: {'n_estimators': 486, 'min_samples_split': 12, 'max_features': 0.74, 'min_samples_leaf': 1, 'criterion': 'absolute_error', 'max_depth': 15, 'min_weight_fraction_leaf': 0.0, 'max_leaf_nodes': 50, 'bootstrap': False, 'ccp_alpha': 0.0}. Best is trial 4065 with value: 0.057524275121161005.
[I 2025-04-16 02:14:01,729] Trial 4278 finished with value: -0.1936417107583833 and parameters: {'n_estimators': 310, 'min_samples_split': 8, 'max_features': 0.8200000000000001, 'min_samples_leaf': 3, 'criterion': 'absolute_error', 'max_depth': 15, 'min_weight_fraction_leaf': 0.0, 'max_leaf_nodes': 300, 'bootstrap': False, 'ccp_alpha': 0.009000000000000001}. Best is trial 4065 with value: 0.057524275121161005.
[I 2025-04-16 02:14:03,023] Trial 4279 finished with value: -0.1936417107583833 and parameters: {'n_estimators': 732, 'min_samples_split': 2, 'max_features': 0.8400000000000001, 'min_samples_leaf': 1, 'criterion': 'absolute_error', 'max_depth': 15, 'min_weight_fraction_leaf': 0.0, 'max_leaf_nodes': 300, 'bootstrap': False, 'ccp_alpha': 0.025}. Best is trial 4065 with value: 0.057524275121161005.
[I 2025-04-16 02:14:03,861] Trial 4280 finished with value: -0.1936417107583833 and parameters: {'n_estimators': 326, 'min_samples_split': 12, 'max_features': 0.8, 'min_samples_leaf': 5, 'criterion': 'absolute_error', 'max_depth': 15, 'min_weight_fraction_leaf': 0.0, 'max_leaf_nodes': 300, 'bootstrap': False, 'ccp_alpha': 0.154}. Best is trial 4065 with value: 0.057524275121161005.
[I 2025-04-16 02:14:04,950] Trial 4281 finished with value: 0.01983089196486141 and parameters: {'n_estimators': 576, 'min_samples_split': 6, 'max_features': 0.56, 'min_samples_leaf': 3, 'criterion': 'absolute_error', 'max_depth': 15, 'min_weight_fraction_leaf': 0.0, 'max_leaf_nodes': 300, 'bootstrap': False, 'ccp_alpha': 0.005}. Best is trial 4065 with value: 0.057524275121161005.
[I 2025-04-16 02:14:05,703] Trial 4282 finished with value: -0.1936417107583833 and parameters: {'n_estimators': 187, 'min_samples_split': 2, 'max_features': 0.67, 'min_samples_leaf': 1, 'criterion': 'absolute_error', 'max_depth': 15, 'min_weight_fraction_leaf': 0.0, 'max_leaf_nodes': 300, 'bootstrap': False, 'ccp_alpha': 0.018000000000000002}. Best is trial 4065 with value: 0.057524275121161005.
[I 2025-04-16 02:14:06,587] Trial 4283 finished with value: -0.1936417107583833 and parameters: {'n_estimators': 400, 'min_samples_split': 9, 'max_features': 0.72, 'min_samples_leaf': 4, 'criterion': 'absolute_error', 'max_depth': 10, 'min_weight_fraction_leaf': 0.0, 'max_leaf_nodes': 300, 'bootstrap': False, 'ccp_alpha': 0.01}. Best is trial 4065 with value: 0.057524275121161005.
[I 2025-04-16 02:14:07,643] Trial 4284 finished with value: -10.506176161015272 and parameters: {'n_estimators': 666, 'min_samples_split': 6, 'max_features': 0.75, 'min_samples_leaf': 5, 'criterion': 'squared_error', 'max_depth': 15, 'min_weight_fraction_leaf': 0.0, 'max_leaf_nodes': 300, 'bootstrap': False, 'ccp_alpha': 0.0}. Best is trial 4065 with value: 0.057524275121161005.
[I 2025-04-16 02:14:08,346] Trial 4285 finished with value: -0.1936417107583833 and parameters: {'n_estimators': 163, 'min_samples_split': 12, 'max_features': 0.77, 'min_samples_leaf': 1, 'criterion': 'absolute_error', 'max_depth': 15, 'min_weight_fraction_leaf': 0.0, 'max_leaf_nodes': 50, 'bootstrap': False, 'ccp_alpha': 0.012}. Best is trial 4065 with value: 0.057524275121161005.
[I 2025-04-16 02:14:09,280] Trial 4286 finished with value: 0.01724304695834804 and parameters: {'n_estimators': 436, 'min_samples_split': 5, 'max_features': 0.7000000000000001, 'min_samples_leaf': 3, 'criterion': 'absolute_error', 'max_depth': 15, 'min_weight_fraction_leaf': 0.0, 'max_leaf_nodes': 10, 'bootstrap': False, 'ccp_alpha': 0.005}. Best is trial 4065 with value: 0.057524275121161005.
[I 2025-04-16 02:14:10,496] Trial 4287 finished with value: -0.1936417107583833 and parameters: {'n_estimators': 704, 'min_samples_split': 2, 'max_features': 0.73, 'min_samples_leaf': 1, 'criterion': 'absolute_error', 'max_depth': 15, 'min_weight_fraction_leaf': 0.0, 'max_leaf_nodes': 300, 'bootstrap': False, 'ccp_alpha': 0.014}. Best is trial 4065 with value: 0.057524275121161005.
[I 2025-04-16 02:14:11,498] Trial 4288 finished with value: -0.1410361703828577 and parameters: {'n_estimators': 489, 'min_samples_split': 8, 'max_features': 0.81, 'min_samples_leaf': 6, 'criterion': 'absolute_error', 'max_depth': 15, 'min_weight_fraction_leaf': 0.0, 'max_leaf_nodes': 300, 'bootstrap': False, 'ccp_alpha': 0.005}. Best is trial 4065 with value: 0.057524275121161005.
[I 2025-04-16 02:14:12,210] Trial 4289 finished with value: -0.1936417107583833 and parameters: {'n_estimators': 158, 'min_samples_split': 9, 'max_features': 0.78, 'min_samples_leaf': 3, 'criterion': 'absolute_error', 'max_depth': 15, 'min_weight_fraction_leaf': 0.0, 'max_leaf_nodes': 300, 'bootstrap': False, 'ccp_alpha': 0.021}. Best is trial 4065 with value: 0.057524275121161005.
[I 2025-04-16 02:14:13,084] Trial 4290 finished with value: -17.290563852376145 and parameters: {'n_estimators': 335, 'min_samples_split': 2, 'max_features': 0.75, 'min_samples_leaf': 3, 'criterion': 'poisson', 'max_depth': 15, 'min_weight_fraction_leaf': 0.0, 'max_leaf_nodes': None, 'bootstrap': False, 'ccp_alpha': 0.009000000000000001}. Best is trial 4065 with value: 0.057524275121161005.
[I 2025-04-16 02:14:14,262] Trial 4291 finished with value: -0.1936417107583833 and parameters: {'n_estimators': 752, 'min_samples_split': 6, 'max_features': 0.7100000000000001, 'min_samples_leaf': 1, 'criterion': 'absolute_error', 'max_depth': 15, 'min_weight_fraction_leaf': 0.0, 'max_leaf_nodes': 300, 'bootstrap': False, 'ccp_alpha': 0.032}. Best is trial 4065 with value: 0.057524275121161005.
[I 2025-04-16 02:14:15,242] Trial 4292 finished with value: -0.11674092342011884 and parameters: {'n_estimators': 546, 'min_samples_split': 5, 'max_features': 0.8400000000000001, 'min_samples_leaf': 5, 'criterion': 'absolute_error', 'max_depth': 15, 'min_weight_fraction_leaf': 0.0, 'max_leaf_nodes': 300, 'bootstrap': False, 'ccp_alpha': 0.005}. Best is trial 4065 with value: 0.057524275121161005.
