[I 2025-04-16 00:56:40,303] Trial 1987 finished with value: -0.1936417107583833 and parameters: {'n_estimators': 4581, 'min_samples_split': 5, 'max_features': 1.0, 'min_samples_leaf': 11, 'criterion': 'absolute_error', 'max_depth': 60, 'min_weight_fraction_leaf': 0.0, 'max_leaf_nodes': 150, 'bootstrap': False, 'ccp_alpha': 0.009000000000000001}. Best is trial 1828 with value: -0.15292978335836716.
[I 2025-04-16 00:56:43,219] Trial 1988 finished with value: -0.1936157416131831 and parameters: {'n_estimators': 3726, 'min_samples_split': 19, 'max_features': 0.97, 'min_samples_leaf': 16, 'criterion': 'absolute_error', 'max_depth': 60, 'min_weight_fraction_leaf': 0.01, 'max_leaf_nodes': 150, 'bootstrap': False, 'ccp_alpha': 0.0}. Best is trial 1828 with value: -0.15292978335836716.
[I 2025-04-16 00:56:47,336] Trial 1989 finished with value: -17.52898638227339 and parameters: {'n_estimators': 4387, 'min_samples_split': 25, 'max_features': 0.91, 'min_samples_leaf': 9, 'criterion': 'poisson', 'max_depth': 60, 'min_weight_fraction_leaf': 0.01, 'max_leaf_nodes': 150, 'bootstrap': False, 'ccp_alpha': 0.019}. Best is trial 1828 with value: -0.15292978335836716.
[I 2025-04-16 00:56:51,353] Trial 1990 finished with value: -0.1936417107583833 and parameters: {'n_estimators': 3930, 'min_samples_split': 11, 'max_features': 0.9400000000000001, 'min_samples_leaf': 13, 'criterion': 'absolute_error', 'max_depth': 60, 'min_weight_fraction_leaf': 0.01, 'max_leaf_nodes': 150, 'bootstrap': False, 'ccp_alpha': 0.012}. Best is trial 1828 with value: -0.15292978335836716.
[I 2025-04-16 00:56:54,895] Trial 1991 finished with value: -0.1936417107583833 and parameters: {'n_estimators': 3570, 'min_samples_split': 16, 'max_features': 0.98, 'min_samples_leaf': 19, 'criterion': 'absolute_error', 'max_depth': 60, 'min_weight_fraction_leaf': 0.0, 'max_leaf_nodes': 150, 'bootstrap': False, 'ccp_alpha': 0.005}. Best is trial 1828 with value: -0.15292978335836716.
[I 2025-04-16 00:56:58,094] Trial 1992 finished with value: -0.19362493950192405 and parameters: {'n_estimators': 4181, 'min_samples_split': 20, 'max_features': 0.9600000000000001, 'min_samples_leaf': 15, 'criterion': 'absolute_error', 'max_depth': 60, 'min_weight_fraction_leaf': 0.09, 'max_leaf_nodes': 20, 'bootstrap': False, 'ccp_alpha': 0.0}. Best is trial 1828 with value: -0.15292978335836716.
[I 2025-04-16 00:57:01,712] Trial 1993 finished with value: -0.1936417107583833 and parameters: {'n_estimators': 4022, 'min_samples_split': 10, 'max_features': 0.93, 'min_samples_leaf': 11, 'criterion': 'absolute_error', 'max_depth': 60, 'min_weight_fraction_leaf': 0.01, 'max_leaf_nodes': 150, 'bootstrap': False, 'ccp_alpha': 0.01}. Best is trial 1828 with value: -0.15292978335836716.
[I 2025-04-16 00:57:05,590] Trial 1994 finished with value: -0.1936417107583833 and parameters: {'n_estimators': 4407, 'min_samples_split': 14, 'max_features': 1.0, 'min_samples_leaf': 13, 'criterion': 'absolute_error', 'max_depth': 60, 'min_weight_fraction_leaf': 0.01, 'max_leaf_nodes': 150, 'bootstrap': False, 'ccp_alpha': 0.006}. Best is trial 1828 with value: -0.15292978335836716.
[I 2025-04-16 00:57:08,878] Trial 1995 finished with value: -0.1936417107583833 and parameters: {'n_estimators': 3791, 'min_samples_split': 67, 'max_features': 0.9500000000000001, 'min_samples_leaf': 10, 'criterion': 'absolute_error', 'max_depth': 60, 'min_weight_fraction_leaf': 0.01, 'max_leaf_nodes': 150, 'bootstrap': False, 'ccp_alpha': 0.024}. Best is trial 1828 with value: -0.15292978335836716.
[I 2025-04-16 00:57:12,335] Trial 1996 finished with value: -0.19362493786731508 and parameters: {'n_estimators': 4160, 'min_samples_split': 29, 'max_features': 0.91, 'min_samples_leaf': 15, 'criterion': 'absolute_error', 'max_depth': 60, 'min_weight_fraction_leaf': 0.01, 'max_leaf_nodes': 150, 'bootstrap': False, 'ccp_alpha': 0.0}. Best is trial 1828 with value: -0.15292978335836716.
[I 2025-04-16 00:57:16,436] Trial 1997 finished with value: -0.1936417107583833 and parameters: {'n_estimators': 4652, 'min_samples_split': 22, 'max_features': 0.98, 'min_samples_leaf': 17, 'criterion': 'absolute_error', 'max_depth': 60, 'min_weight_fraction_leaf': 0.01, 'max_leaf_nodes': 150, 'bootstrap': False, 'ccp_alpha': 0.015}. Best is trial 1828 with value: -0.15292978335836716.
[I 2025-04-16 00:57:19,691] Trial 1998 finished with value: -17.528986382274244 and parameters: {'n_estimators': 3929, 'min_samples_split': 9, 'max_features': 0.9600000000000001, 'min_samples_leaf': 8, 'criterion': 'friedman_mse', 'max_depth': 60, 'min_weight_fraction_leaf': 0.01, 'max_leaf_nodes': 150, 'bootstrap': False, 'ccp_alpha': 0.006}. Best is trial 1828 with value: -0.15292978335836716.
[I 2025-04-16 00:57:23,505] Trial 1999 finished with value: -0.1936417107583833 and parameters: {'n_estimators': 4265, 'min_samples_split': 5, 'max_features': 0.93, 'min_samples_leaf': 12, 'criterion': 'absolute_error', 'max_depth': 60, 'min_weight_fraction_leaf': 0.1, 'max_leaf_nodes': 150, 'bootstrap': False, 'ccp_alpha': 0.01}. Best is trial 1828 with value: -0.15292978335836716.
[I 2025-04-16 00:57:26,967] Trial 2000 finished with value: -0.1936212800538731 and parameters: {'n_estimators': 4069, 'min_samples_split': 18, 'max_features': 0.98, 'min_samples_leaf': 14, 'criterion': 'absolute_error', 'max_depth': 60, 'min_weight_fraction_leaf': 0.01, 'max_leaf_nodes': 150, 'bootstrap': False, 'ccp_alpha': 0.0}. Best is trial 1828 with value: -0.15292978335836716.
[I 2025-04-16 00:57:30,295] Trial 2001 finished with value: -0.1936417107583833 and parameters: {'n_estimators': 3758, 'min_samples_split': 105, 'max_features': 0.9500000000000001, 'min_samples_leaf': 19, 'criterion': 'absolute_error', 'max_depth': 60, 'min_weight_fraction_leaf': 0.0, 'max_leaf_nodes': 300, 'bootstrap': False, 'ccp_alpha': 0.005}. Best is trial 1828 with value: -0.15292978335836716.
[I 2025-04-16 00:57:33,856] Trial 2002 finished with value: -0.1936417107583833 and parameters: {'n_estimators': 3560, 'min_samples_split': 26, 'max_features': 1.0, 'min_samples_leaf': 11, 'criterion': 'absolute_error', 'max_depth': 60, 'min_weight_fraction_leaf': 0.01, 'max_leaf_nodes': 150, 'bootstrap': False, 'ccp_alpha': 0.014}. Best is trial 1828 with value: -0.15292978335836716.
[I 2025-04-16 00:57:37,987] Trial 2003 finished with value: -0.1936417107583833 and parameters: {'n_estimators': 4415, 'min_samples_split': 14, 'max_features': 0.92, 'min_samples_leaf': 16, 'criterion': 'absolute_error', 'max_depth': 60, 'min_weight_fraction_leaf': 0.01, 'max_leaf_nodes': 150, 'bootstrap': False, 'ccp_alpha': 0.005}. Best is trial 1828 with value: -0.15292978335836716.
[I 2025-04-16 00:57:41,103] Trial 2004 finished with value: -0.1590220228674534 and parameters: {'n_estimators': 3876, 'min_samples_split': 17, 'max_features': 0.97, 'min_samples_leaf': 13, 'criterion': 'absolute_error', 'max_depth': 60, 'min_weight_fraction_leaf': 0.01, 'max_leaf_nodes': 150, 'bootstrap': False, 'ccp_alpha': 0.0}. Best is trial 1828 with value: -0.15292978335836716.
[I 2025-04-16 00:57:44,348] Trial 2005 finished with value: -0.1936417107583833 and parameters: {'n_estimators': 3622, 'min_samples_split': 7, 'max_features': 0.99, 'min_samples_leaf': 10, 'criterion': 'absolute_error', 'max_depth': 60, 'min_weight_fraction_leaf': 0.0, 'max_leaf_nodes': 150, 'bootstrap': False, 'ccp_alpha': 0.01}. Best is trial 1828 with value: -0.15292978335836716.
[I 2025-04-16 00:57:47,746] Trial 2006 finished with value: -17.528986382274667 and parameters: {'n_estimators': 3738, 'min_samples_split': 14, 'max_features': 1.0, 'min_samples_leaf': 14, 'criterion': 'squared_error', 'max_depth': 10, 'min_weight_fraction_leaf': 0.01, 'max_leaf_nodes': 150, 'bootstrap': False, 'ccp_alpha': 0.006}. Best is trial 1828 with value: -0.15292978335836716.
[I 2025-04-16 00:57:50,953] Trial 2007 finished with value: -0.1936417107583833 and parameters: {'n_estimators': 3550, 'min_samples_split': 11, 'max_features': 0.98, 'min_samples_leaf': 17, 'criterion': 'absolute_error', 'max_depth': 60, 'min_weight_fraction_leaf': 0.01, 'max_leaf_nodes': 150, 'bootstrap': False, 'ccp_alpha': 0.019}. Best is trial 1828 with value: -0.15292978335836716.
[I 2025-04-16 00:57:53,891] Trial 2008 finished with value: -0.1936417107583833 and parameters: {'n_estimators': 3840, 'min_samples_split': 60, 'max_features': 0.97, 'min_samples_leaf': 11, 'criterion': 'absolute_error', 'max_depth': 60, 'min_weight_fraction_leaf': 0.01, 'max_leaf_nodes': 150, 'bootstrap': False, 'ccp_alpha': 0.0}. Best is trial 1828 with value: -0.15292978335836716.
[I 2025-04-16 00:57:57,409] Trial 2009 finished with value: -0.1936417107583833 and parameters: {'n_estimators': 3542, 'min_samples_split': 5, 'max_features': 0.98, 'min_samples_leaf': 8, 'criterion': 'absolute_error', 'max_depth': 60, 'min_weight_fraction_leaf': 0.01, 'max_leaf_nodes': 150, 'bootstrap': False, 'ccp_alpha': 0.01}. Best is trial 1828 with value: -0.15292978335836716.
[I 2025-04-16 00:58:00,503] Trial 2010 finished with value: -0.1936417107583833 and parameters: {'n_estimators': 3802, 'min_samples_split': 16, 'max_features': 0.97, 'min_samples_leaf': 15, 'criterion': 'absolute_error', 'max_depth': 60, 'min_weight_fraction_leaf': 0.01, 'max_leaf_nodes': 150, 'bootstrap': False, 'ccp_alpha': 0.005}. Best is trial 1828 with value: -0.15292978335836716.
[I 2025-04-16 00:58:03,535] Trial 2011 finished with value: -10.73735994535816 and parameters: {'n_estimators': 3920, 'min_samples_split': 11, 'max_features': 1.0, 'min_samples_leaf': 12, 'criterion': 'absolute_error', 'max_depth': 60, 'min_weight_fraction_leaf': 0.01, 'max_leaf_nodes': 150, 'bootstrap': False, 'ccp_alpha': 0.0}. Best is trial 1828 with value: -0.15292978335836716.
[I 2025-04-16 00:58:06,677] Trial 2012 finished with value: -0.1936417107583833 and parameters: {'n_estimators': 3723, 'min_samples_split': 8, 'max_features': 0.9600000000000001, 'min_samples_leaf': 13, 'criterion': 'absolute_error', 'max_depth': 60, 'min_weight_fraction_leaf': 0.01, 'max_leaf_nodes': 150, 'bootstrap': False, 'ccp_alpha': 0.015}. Best is trial 1828 with value: -0.15292978335836716.
[I 2025-04-16 00:58:10,573] Trial 2013 finished with value: -17.52898638227413 and parameters: {'n_estimators': 3985, 'min_samples_split': 14, 'max_features': 0.98, 'min_samples_leaf': 18, 'criterion': 'poisson', 'max_depth': 60, 'min_weight_fraction_leaf': 0.0, 'max_leaf_nodes': 150, 'bootstrap': False, 'ccp_alpha': 0.006}. Best is trial 1828 with value: -0.15292978335836716.
[I 2025-04-16 00:58:13,541] Trial 2014 finished with value: -0.1936417107583833 and parameters: {'n_estimators': 3518, 'min_samples_split': 2, 'max_features': 1.0, 'min_samples_leaf': 15, 'criterion': 'absolute_error', 'max_depth': 60, 'min_weight_fraction_leaf': 0.01, 'max_leaf_nodes': 150, 'bootstrap': False, 'ccp_alpha': 0.011}. Best is trial 1828 with value: -0.15292978335836716.
[I 2025-04-16 00:58:16,881] Trial 2015 finished with value: -8.76523352092556 and parameters: {'n_estimators': 3958, 'min_samples_split': 21, 'max_features': 0.9600000000000001, 'min_samples_leaf': 9, 'criterion': 'absolute_error', 'max_depth': 60, 'min_weight_fraction_leaf': 0.01, 'max_leaf_nodes': 150, 'bootstrap': False, 'ccp_alpha': 0.0}. Best is trial 1828 with value: -0.15292978335836716.
[I 2025-04-16 00:58:20,000] Trial 2016 finished with value: -0.1936417107583833 and parameters: {'n_estimators': 3707, 'min_samples_split': 18, 'max_features': 0.97, 'min_samples_leaf': 12, 'criterion': 'absolute_error', 'max_depth': 60, 'min_weight_fraction_leaf': 0.01, 'max_leaf_nodes': 150, 'bootstrap': False, 'ccp_alpha': 0.006}. Best is trial 1828 with value: -0.15292978335836716.
[I 2025-04-16 00:58:23,400] Trial 2017 finished with value: -0.1936417107583833 and parameters: {'n_estimators': 4075, 'min_samples_split': 12, 'max_features': 0.9500000000000001, 'min_samples_leaf': 14, 'criterion': 'absolute_error', 'max_depth': 60, 'min_weight_fraction_leaf': 0.01, 'max_leaf_nodes': 150, 'bootstrap': False, 'ccp_alpha': 0.018000000000000002}. Best is trial 1828 with value: -0.15292978335836716.
[I 2025-04-16 00:58:26,024] Trial 2018 finished with value: -8.749920294776857 and parameters: {'n_estimators': 3548, 'min_samples_split': 16, 'max_features': 0.99, 'min_samples_leaf': 10, 'criterion': 'absolute_error', 'max_depth': 60, 'min_weight_fraction_leaf': 0.0, 'max_leaf_nodes': 20, 'bootstrap': False, 'ccp_alpha': 0.0}. Best is trial 1828 with value: -0.15292978335836716.
[I 2025-04-16 00:58:29,304] Trial 2019 finished with value: -0.1936417107583833 and parameters: {'n_estimators': 3849, 'min_samples_split': 23, 'max_features': 0.9600000000000001, 'min_samples_leaf': 17, 'criterion': 'absolute_error', 'max_depth': 60, 'min_weight_fraction_leaf': 0.01, 'max_leaf_nodes': 150, 'bootstrap': False, 'ccp_alpha': 0.01}. Best is trial 1828 with value: -0.15292978335836716.
[I 2025-04-16 00:58:32,944] Trial 2020 finished with value: -0.1936417107583833 and parameters: {'n_estimators': 4051, 'min_samples_split': 8, 'max_features': 0.98, 'min_samples_leaf': 12, 'criterion': 'absolute_error', 'max_depth': 60, 'min_weight_fraction_leaf': 0.01, 'max_leaf_nodes': 150, 'bootstrap': False, 'ccp_alpha': 0.005}. Best is trial 1828 with value: -0.15292978335836716.
[I 2025-04-16 00:58:36,542] Trial 2021 finished with value: -0.1936417107583833 and parameters: {'n_estimators': 3734, 'min_samples_split': 18, 'max_features': 0.9500000000000001, 'min_samples_leaf': 15, 'criterion': 'absolute_error', 'max_depth': 60, 'min_weight_fraction_leaf': 0.01, 'max_leaf_nodes': 150, 'bootstrap': False, 'ccp_alpha': 0.014}. Best is trial 1828 with value: -0.15292978335836716.
[I 2025-04-16 00:58:40,009] Trial 2022 finished with value: -17.528986382274276 and parameters: {'n_estimators': 3914, 'min_samples_split': 13, 'max_features': 1.0, 'min_samples_leaf': 8, 'criterion': 'friedman_mse', 'max_depth': 60, 'min_weight_fraction_leaf': 0.01, 'max_leaf_nodes': 150, 'bootstrap': False, 'ccp_alpha': 0.005}. Best is trial 1828 with value: -0.15292978335836716.
[I 2025-04-16 00:58:43,216] Trial 2023 finished with value: -0.1590001090921838 and parameters: {'n_estimators': 4146, 'min_samples_split': 10, 'max_features': 0.97, 'min_samples_leaf': 13, 'criterion': 'absolute_error', 'max_depth': 60, 'min_weight_fraction_leaf': 0.01, 'max_leaf_nodes': 150, 'bootstrap': False, 'ccp_alpha': 0.0}. Best is trial 1828 with value: -0.15292978335836716.
[I 2025-04-16 00:58:47,008] Trial 2024 finished with value: -0.1936417107583833 and parameters: {'n_estimators': 4186, 'min_samples_split': 2, 'max_features': 1.0, 'min_samples_leaf': 10, 'criterion': 'absolute_error', 'max_depth': 60, 'min_weight_fraction_leaf': 0.0, 'max_leaf_nodes': 150, 'bootstrap': False, 'ccp_alpha': 0.01}. Best is trial 1828 with value: -0.15292978335836716.
[I 2025-04-16 00:58:50,551] Trial 2025 finished with value: -0.1936417107583833 and parameters: {'n_estimators': 3911, 'min_samples_split': 7, 'max_features': 0.98, 'min_samples_leaf': 16, 'criterion': 'absolute_error', 'max_depth': 60, 'min_weight_fraction_leaf': 0.01, 'max_leaf_nodes': 150, 'bootstrap': False, 'ccp_alpha': 0.022}. Best is trial 1828 with value: -0.15292978335836716.
[I 2025-04-16 00:58:53,843] Trial 2026 finished with value: -0.1936417107583833 and parameters: {'n_estimators': 4200, 'min_samples_split': 11, 'max_features': 0.98, 'min_samples_leaf': 99, 'criterion': 'absolute_error', 'max_depth': 60, 'min_weight_fraction_leaf': 0.01, 'max_leaf_nodes': 300, 'bootstrap': False, 'ccp_alpha': 0.0}. Best is trial 1828 with value: -0.15292978335836716.
[I 2025-04-16 00:58:57,140] Trial 2027 finished with value: -0.1936417107583833 and parameters: {'n_estimators': 3533, 'min_samples_split': 5, 'max_features': 0.97, 'min_samples_leaf': 13, 'criterion': 'absolute_error', 'max_depth': 60, 'min_weight_fraction_leaf': 0.01, 'max_leaf_nodes': 150, 'bootstrap': False, 'ccp_alpha': 0.005}. Best is trial 1828 with value: -0.15292978335836716.
[I 2025-04-16 00:59:00,525] Trial 2028 finished with value: -0.1936417107583833 and parameters: {'n_estimators': 4063, 'min_samples_split': 8, 'max_features': 1.0, 'min_samples_leaf': 19, 'criterion': 'absolute_error', 'max_depth': 60, 'min_weight_fraction_leaf': 0.01, 'max_leaf_nodes': 150, 'bootstrap': False, 'ccp_alpha': 0.013000000000000001}. Best is trial 1828 with value: -0.15292978335836716.
[I 2025-04-16 00:59:03,895] Trial 2029 finished with value: -0.1936417107583833 and parameters: {'n_estimators': 3703, 'min_samples_split': 5, 'max_features': 0.98, 'min_samples_leaf': 11, 'criterion': 'absolute_error', 'max_depth': 60, 'min_weight_fraction_leaf': 0.01, 'max_leaf_nodes': 150, 'bootstrap': False, 'ccp_alpha': 0.006}. Best is trial 1828 with value: -0.15292978335836716.
[I 2025-04-16 00:59:07,423] Trial 2030 finished with value: -0.1936212831617063 and parameters: {'n_estimators': 3885, 'min_samples_split': 10, 'max_features': 0.97, 'min_samples_leaf': 14, 'criterion': 'absolute_error', 'max_depth': 60, 'min_weight_fraction_leaf': 0.01, 'max_leaf_nodes': 150, 'bootstrap': False, 'ccp_alpha': 0.0}. Best is trial 1828 with value: -0.15292978335836716.
[I 2025-04-16 00:59:11,188] Trial 2031 finished with value: -0.1936417107583833 and parameters: {'n_estimators': 4257, 'min_samples_split': 2, 'max_features': 0.9600000000000001, 'min_samples_leaf': 16, 'criterion': 'absolute_error', 'max_depth': 10, 'min_weight_fraction_leaf': 0.0, 'max_leaf_nodes': 150, 'bootstrap': False, 'ccp_alpha': 0.01}. Best is trial 1828 with value: -0.15292978335836716.
[I 2025-04-16 00:59:15,038] Trial 2032 finished with value: -0.1936417107583833 and parameters: {'n_estimators': 4108, 'min_samples_split': 8, 'max_features': 1.0, 'min_samples_leaf': 12, 'criterion': 'absolute_error', 'max_depth': 60, 'min_weight_fraction_leaf': 0.01, 'max_leaf_nodes': 150, 'bootstrap': False, 'ccp_alpha': 0.006}. Best is trial 1828 with value: -0.15292978335836716.
[I 2025-04-16 00:59:18,816] Trial 2033 finished with value: -17.52898638227332 and parameters: {'n_estimators': 4429, 'min_samples_split': 12, 'max_features': 0.98, 'min_samples_leaf': 9, 'criterion': 'squared_error', 'max_depth': 60, 'min_weight_fraction_leaf': 0.01, 'max_leaf_nodes': 150, 'bootstrap': False, 'ccp_alpha': 0.017}. Best is trial 1828 with value: -0.15292978335836716.
[I 2025-04-16 00:59:22,157] Trial 2034 finished with value: -0.1936212923739542 and parameters: {'n_estimators': 3874, 'min_samples_split': 6, 'max_features': 0.9500000000000001, 'min_samples_leaf': 14, 'criterion': 'absolute_error', 'max_depth': 60, 'min_weight_fraction_leaf': 0.01, 'max_leaf_nodes': 150, 'bootstrap': False, 'ccp_alpha': 0.0}. Best is trial 1828 with value: -0.15292978335836716.
[I 2025-04-16 00:59:25,345] Trial 2035 finished with value: -0.1936417107583833 and parameters: {'n_estimators': 3742, 'min_samples_split': 10, 'max_features': 0.9600000000000001, 'min_samples_leaf': 17, 'criterion': 'absolute_error', 'max_depth': 60, 'min_weight_fraction_leaf': 0.01, 'max_leaf_nodes': 150, 'bootstrap': False, 'ccp_alpha': 0.011}. Best is trial 1828 with value: -0.15292978335836716.
[I 2025-04-16 00:59:28,756] Trial 2036 finished with value: -0.1936417107583833 and parameters: {'n_estimators': 4071, 'min_samples_split': 14, 'max_features': 0.98, 'min_samples_leaf': 11, 'criterion': 'absolute_error', 'max_depth': 60, 'min_weight_fraction_leaf': 0.01, 'max_leaf_nodes': 150, 'bootstrap': False, 'ccp_alpha': 0.005}. Best is trial 1828 with value: -0.15292978335836716.
[I 2025-04-16 00:59:31,519] Trial 2037 finished with value: -0.19362132128179077 and parameters: {'n_estimators': 3551, 'min_samples_split': 9, 'max_features': 0.9400000000000001, 'min_samples_leaf': 14, 'criterion': 'absolute_error', 'max_depth': 60, 'min_weight_fraction_leaf': 0.01, 'max_leaf_nodes': 150, 'bootstrap': False, 'ccp_alpha': 0.0}. Best is trial 1828 with value: -0.15292978335836716.
[I 2025-04-16 00:59:35,106] Trial 2038 finished with value: -0.1936417107583833 and parameters: {'n_estimators': 4337, 'min_samples_split': 14, 'max_features': 1.0, 'min_samples_leaf': 8, 'criterion': 'absolute_error', 'max_depth': 60, 'min_weight_fraction_leaf': 0.0, 'max_leaf_nodes': 150, 'bootstrap': False, 'ccp_alpha': 0.01}. Best is trial 1828 with value: -0.15292978335836716.
[I 2025-04-16 00:59:38,329] Trial 2039 finished with value: -31.27233431933596 and parameters: {'n_estimators': 3932, 'min_samples_split': 5, 'max_features': 0.9600000000000001, 'min_samples_leaf': 13, 'criterion': 'poisson', 'max_depth': 60, 'min_weight_fraction_leaf': 0.01, 'max_leaf_nodes': 150, 'bootstrap': False, 'ccp_alpha': 0.005}. Best is trial 1828 with value: -0.15292978335836716.
[I 2025-04-16 00:59:42,942] Trial 2040 finished with value: -0.1936417107583833 and parameters: {'n_estimators': 4232, 'min_samples_split': 18, 'max_features': 0.98, 'min_samples_leaf': 11, 'criterion': 'absolute_error', 'max_depth': 60, 'min_weight_fraction_leaf': 0.01, 'max_leaf_nodes': 150, 'bootstrap': False, 'ccp_alpha': 0.024}. Best is trial 1828 with value: -0.15292978335836716.
[I 2025-04-16 00:59:46,215] Trial 2041 finished with value: -0.1936417107583833 and parameters: {'n_estimators': 4070, 'min_samples_split': 11, 'max_features': 0.9400000000000001, 'min_samples_leaf': 16, 'criterion': 'absolute_error', 'max_depth': 60, 'min_weight_fraction_leaf': 0.01, 'max_leaf_nodes': 150, 'bootstrap': False, 'ccp_alpha': 0.017}. Best is trial 1828 with value: -0.15292978335836716.
[I 2025-04-16 00:59:49,072] Trial 2042 finished with value: -0.1936249446837021 and parameters: {'n_estimators': 3752, 'min_samples_split': 21, 'max_features': 0.97, 'min_samples_leaf': 15, 'criterion': 'absolute_error', 'max_depth': 60, 'min_weight_fraction_leaf': 0.01, 'max_leaf_nodes': 150, 'bootstrap': False, 'ccp_alpha': 0.0}. Best is trial 1828 with value: -0.15292978335836716.
