[I 2025-04-15 23:29:45,109] Trial 427 finished with value: -0.1825661808617863 and parameters: {'n_estimators': 3020, 'min_samples_split': 48, 'max_features': 0.81, 'min_samples_leaf': 25, 'criterion': 'absolute_error', 'max_depth': 15, 'min_weight_fraction_leaf': 0.01, 'max_leaf_nodes': 150, 'bootstrap': True, 'ccp_alpha': 0.05, 'max_samples': 0.5}. Best is trial 74 with value: -0.18167313469617832.
[I 2025-04-15 23:29:48,438] Trial 428 finished with value: -0.1825113842604346 and parameters: {'n_estimators': 3088, 'min_samples_split': 39, 'max_features': 0.79, 'min_samples_leaf': 25, 'criterion': 'absolute_error', 'max_depth': 15, 'min_weight_fraction_leaf': 0.01, 'max_leaf_nodes': 150, 'bootstrap': True, 'ccp_alpha': 0.059000000000000004, 'max_samples': 0.5}. Best is trial 74 with value: -0.18167313469617832.
[I 2025-04-15 23:29:52,426] Trial 429 finished with value: -0.1933135743920808 and parameters: {'n_estimators': 3637, 'min_samples_split': 47, 'max_features': 0.73, 'min_samples_leaf': 25, 'criterion': 'absolute_error', 'max_depth': 15, 'min_weight_fraction_leaf': 0.01, 'max_leaf_nodes': 150, 'bootstrap': True, 'ccp_alpha': 0.054, 'max_samples': 1.0}. Best is trial 74 with value: -0.18167313469617832.
[I 2025-04-15 23:29:54,790] Trial 430 finished with value: -17.528986382275892 and parameters: {'n_estimators': 3275, 'min_samples_split': 52, 'max_features': 0.78, 'min_samples_leaf': 25, 'criterion': 'friedman_mse', 'max_depth': 15, 'min_weight_fraction_leaf': 0.0, 'max_leaf_nodes': 150, 'bootstrap': False, 'ccp_alpha': 0.043000000000000003}. Best is trial 74 with value: -0.18167313469617832.
[I 2025-04-15 23:29:58,113] Trial 431 finished with value: -0.18266583513294302 and parameters: {'n_estimators': 3164, 'min_samples_split': 32, 'max_features': 0.8, 'min_samples_leaf': 23, 'criterion': 'absolute_error', 'max_depth': 15, 'min_weight_fraction_leaf': 0.01, 'max_leaf_nodes': 150, 'bootstrap': True, 'ccp_alpha': 0.051000000000000004, 'max_samples': 0.5}. Best is trial 74 with value: -0.18167313469617832.
[I 2025-04-15 23:30:01,396] Trial 432 finished with value: -0.19069332672296596 and parameters: {'n_estimators': 2748, 'min_samples_split': 37, 'max_features': 0.75, 'min_samples_leaf': 26, 'criterion': 'absolute_error', 'max_depth': 15, 'min_weight_fraction_leaf': 0.01, 'max_leaf_nodes': 150, 'bootstrap': True, 'ccp_alpha': 0.057, 'max_samples': 0.75}. Best is trial 74 with value: -0.18167313469617832.
[I 2025-04-15 23:30:05,433] Trial 433 finished with value: -0.18319254881295718 and parameters: {'n_estimators': 3458, 'min_samples_split': 48, 'max_features': 0.78, 'min_samples_leaf': 27, 'criterion': 'absolute_error', 'max_depth': 15, 'min_weight_fraction_leaf': 0.0, 'max_leaf_nodes': 150, 'bootstrap': True, 'ccp_alpha': 0.058, 'max_samples': 0.5}. Best is trial 74 with value: -0.18167313469617832.
[I 2025-04-15 23:30:08,722] Trial 434 finished with value: -0.18262230648659367 and parameters: {'n_estimators': 3039, 'min_samples_split': 44, 'max_features': 0.76, 'min_samples_leaf': 24, 'criterion': 'absolute_error', 'max_depth': 15, 'min_weight_fraction_leaf': 0.01, 'max_leaf_nodes': 150, 'bootstrap': True, 'ccp_alpha': 0.064, 'max_samples': 0.5}. Best is trial 74 with value: -0.18167313469617832.
[I 2025-04-15 23:30:16,066] Trial 435 finished with value: -0.1840572710214688 and parameters: {'n_estimators': 6663, 'min_samples_split': 41, 'max_features': 0.81, 'min_samples_leaf': 31, 'criterion': 'absolute_error', 'max_depth': 15, 'min_weight_fraction_leaf': 0.01, 'max_leaf_nodes': 150, 'bootstrap': True, 'ccp_alpha': 0.064, 'max_samples': 0.5}. Best is trial 74 with value: -0.18167313469617832.
[I 2025-04-15 23:30:18,555] Trial 436 finished with value: -18.235423326531112 and parameters: {'n_estimators': 2484, 'min_samples_split': 50, 'max_features': 0.79, 'min_samples_leaf': 19, 'criterion': 'squared_error', 'max_depth': 15, 'min_weight_fraction_leaf': 0.08, 'max_leaf_nodes': 150, 'bootstrap': True, 'ccp_alpha': 0.051000000000000004, 'max_samples': 0.5}. Best is trial 74 with value: -0.18167313469617832.
[I 2025-04-15 23:30:22,261] Trial 437 finished with value: -0.18290120683700845 and parameters: {'n_estimators': 3297, 'min_samples_split': 47, 'max_features': 0.76, 'min_samples_leaf': 27, 'criterion': 'absolute_error', 'max_depth': 15, 'min_weight_fraction_leaf': 0.01, 'max_leaf_nodes': 150, 'bootstrap': True, 'ccp_alpha': 0.047, 'max_samples': 0.5}. Best is trial 74 with value: -0.18167313469617832.
[I 2025-04-15 23:30:25,332] Trial 438 finished with value: -0.18296658285167222 and parameters: {'n_estimators': 2867, 'min_samples_split': 37, 'max_features': 0.8, 'min_samples_leaf': 22, 'criterion': 'absolute_error', 'max_depth': 20, 'min_weight_fraction_leaf': 0.01, 'max_leaf_nodes': 150, 'bootstrap': True, 'ccp_alpha': 0.044, 'max_samples': 0.5}. Best is trial 74 with value: -0.18167313469617832.
[I 2025-04-15 23:30:29,007] Trial 439 finished with value: -0.18254041031959276 and parameters: {'n_estimators': 3098, 'min_samples_split': 39, 'max_features': 0.8200000000000001, 'min_samples_leaf': 25, 'criterion': 'absolute_error', 'max_depth': 15, 'min_weight_fraction_leaf': 0.01, 'max_leaf_nodes': 150, 'bootstrap': True, 'ccp_alpha': 0.054, 'max_samples': 0.5}. Best is trial 74 with value: -0.18167313469617832.
[I 2025-04-15 23:30:29,388] Trial 440 finished with value: -0.18665470792879693 and parameters: {'n_estimators': 237, 'min_samples_split': 40, 'max_features': 0.8200000000000001, 'min_samples_leaf': 37, 'criterion': 'absolute_error', 'max_depth': 15, 'min_weight_fraction_leaf': 0.01, 'max_leaf_nodes': 150, 'bootstrap': True, 'ccp_alpha': 0.053, 'max_samples': 0.5}. Best is trial 74 with value: -0.18167313469617832.
[I 2025-04-15 23:30:33,423] Trial 441 finished with value: -0.1834512703152095 and parameters: {'n_estimators': 3653, 'min_samples_split': 53, 'max_features': 0.8300000000000001, 'min_samples_leaf': 24, 'criterion': 'absolute_error', 'max_depth': 15, 'min_weight_fraction_leaf': 0.01, 'max_leaf_nodes': 150, 'bootstrap': True, 'ccp_alpha': 0.043000000000000003, 'max_samples': 0.5}. Best is trial 74 with value: -0.18167313469617832.
[I 2025-04-15 23:30:36,781] Trial 442 finished with value: -0.18268269917119717 and parameters: {'n_estimators': 3170, 'min_samples_split': 39, 'max_features': 0.7100000000000001, 'min_samples_leaf': 29, 'criterion': 'absolute_error', 'max_depth': 15, 'min_weight_fraction_leaf': 0.0, 'max_leaf_nodes': 150, 'bootstrap': True, 'ccp_alpha': 0.037, 'max_samples': 0.5}. Best is trial 74 with value: -0.18167313469617832.
[I 2025-04-15 23:30:40,247] Trial 443 finished with value: -17.838295614809677 and parameters: {'n_estimators': 3452, 'min_samples_split': 43, 'max_features': 0.77, 'min_samples_leaf': 18, 'criterion': 'poisson', 'max_depth': 15, 'min_weight_fraction_leaf': 0.01, 'max_leaf_nodes': 150, 'bootstrap': True, 'ccp_alpha': 0.056, 'max_samples': 0.5}. Best is trial 74 with value: -0.18167313469617832.
[I 2025-04-15 23:30:43,099] Trial 444 finished with value: -0.18284578804159923 and parameters: {'n_estimators': 2717, 'min_samples_split': 35, 'max_features': 0.8200000000000001, 'min_samples_leaf': 33, 'criterion': 'absolute_error', 'max_depth': 15, 'min_weight_fraction_leaf': 0.01, 'max_leaf_nodes': 150, 'bootstrap': True, 'ccp_alpha': 0.061, 'max_samples': 0.5}. Best is trial 74 with value: -0.18167313469617832.
[I 2025-04-15 23:30:46,431] Trial 445 finished with value: -0.18252881699891826 and parameters: {'n_estimators': 3094, 'min_samples_split': 42, 'max_features': 0.79, 'min_samples_leaf': 21, 'criterion': 'absolute_error', 'max_depth': 15, 'min_weight_fraction_leaf': 0.0, 'max_leaf_nodes': 150, 'bootstrap': True, 'ccp_alpha': 0.067, 'max_samples': 0.5}. Best is trial 74 with value: -0.18167313469617832.
[I 2025-04-15 23:30:50,187] Trial 446 finished with value: -0.18292249171721728 and parameters: {'n_estimators': 3305, 'min_samples_split': 43, 'max_features': 0.74, 'min_samples_leaf': 21, 'criterion': 'absolute_error', 'max_depth': 15, 'min_weight_fraction_leaf': 0.0, 'max_leaf_nodes': 150, 'bootstrap': True, 'ccp_alpha': 0.063, 'max_samples': 0.5}. Best is trial 74 with value: -0.18167313469617832.
[I 2025-04-15 23:30:54,991] Trial 447 finished with value: -0.1828948993380896 and parameters: {'n_estimators': 3837, 'min_samples_split': 35, 'max_features': 0.29000000000000004, 'min_samples_leaf': 21, 'criterion': 'absolute_error', 'max_depth': 15, 'min_weight_fraction_leaf': 0.0, 'max_leaf_nodes': 150, 'bootstrap': True, 'ccp_alpha': 0.051000000000000004, 'max_samples': 0.5}. Best is trial 74 with value: -0.18167313469617832.
[I 2025-04-15 23:30:58,525] Trial 448 finished with value: -0.1933013310045392 and parameters: {'n_estimators': 3148, 'min_samples_split': 42, 'max_features': 0.79, 'min_samples_leaf': 23, 'criterion': 'absolute_error', 'max_depth': 15, 'min_weight_fraction_leaf': 0.0, 'max_leaf_nodes': 150, 'bootstrap': True, 'ccp_alpha': 0.057, 'max_samples': None}. Best is trial 74 with value: -0.18167313469617832.
[I 2025-04-15 23:31:02,343] Trial 449 finished with value: -0.1832801286329667 and parameters: {'n_estimators': 3496, 'min_samples_split': 41, 'max_features': 0.42000000000000004, 'min_samples_leaf': 25, 'criterion': 'absolute_error', 'max_depth': 15, 'min_weight_fraction_leaf': 0.07, 'max_leaf_nodes': 150, 'bootstrap': True, 'ccp_alpha': 0.069, 'max_samples': 0.5}. Best is trial 74 with value: -0.18167313469617832.
[I 2025-04-15 23:31:05,201] Trial 450 finished with value: -0.1936417107583833 and parameters: {'n_estimators': 3058, 'min_samples_split': 30, 'max_features': 0.78, 'min_samples_leaf': 19, 'criterion': 'absolute_error', 'max_depth': 15, 'min_weight_fraction_leaf': 0.0, 'max_leaf_nodes': 150, 'bootstrap': False, 'ccp_alpha': 0.06}. Best is trial 74 with value: -0.18167313469617832.
[I 2025-04-15 23:31:11,302] Trial 451 finished with value: -0.18367794393355683 and parameters: {'n_estimators': 5480, 'min_samples_split': 47, 'max_features': 0.23, 'min_samples_leaf': 23, 'criterion': 'absolute_error', 'max_depth': 15, 'min_weight_fraction_leaf': 0.0, 'max_leaf_nodes': 10, 'bootstrap': True, 'ccp_alpha': 0.068, 'max_samples': 0.5}. Best is trial 74 with value: -0.18167313469617832.
[I 2025-04-15 23:31:14,871] Trial 452 finished with value: -0.18295165708393762 and parameters: {'n_estimators': 3316, 'min_samples_split': 39, 'max_features': 0.75, 'min_samples_leaf': 26, 'criterion': 'absolute_error', 'max_depth': 15, 'min_weight_fraction_leaf': 0.0, 'max_leaf_nodes': 150, 'bootstrap': True, 'ccp_alpha': 0.051000000000000004, 'max_samples': 0.5}. Best is trial 74 with value: -0.18167313469617832.
[I 2025-04-15 23:31:17,874] Trial 453 finished with value: -18.148704978463865 and parameters: {'n_estimators': 2826, 'min_samples_split': 45, 'max_features': 0.87, 'min_samples_leaf': 25, 'criterion': 'friedman_mse', 'max_depth': 15, 'min_weight_fraction_leaf': 0.0, 'max_leaf_nodes': 150, 'bootstrap': True, 'ccp_alpha': 0.03, 'max_samples': 0.5}. Best is trial 74 with value: -0.18167313469617832.
[I 2025-04-15 23:31:21,017] Trial 454 finished with value: -0.1932964301157626 and parameters: {'n_estimators': 3103, 'min_samples_split': 60, 'max_features': 0.8, 'min_samples_leaf': 27, 'criterion': 'absolute_error', 'max_depth': 15, 'min_weight_fraction_leaf': 0.0, 'max_leaf_nodes': None, 'bootstrap': True, 'ccp_alpha': 0.06, 'max_samples': 1.0}. Best is trial 74 with value: -0.18167313469617832.
[I 2025-04-15 23:31:23,669] Trial 455 finished with value: -0.1829890312737056 and parameters: {'n_estimators': 2576, 'min_samples_split': 39, 'max_features': 0.46, 'min_samples_leaf': 22, 'criterion': 'absolute_error', 'max_depth': 15, 'min_weight_fraction_leaf': 0.01, 'max_leaf_nodes': 10, 'bootstrap': True, 'ccp_alpha': 0.07, 'max_samples': 0.5}. Best is trial 74 with value: -0.18167313469617832.
[I 2025-04-15 23:31:26,883] Trial 456 finished with value: -0.18280319858091248 and parameters: {'n_estimators': 2914, 'min_samples_split': 36, 'max_features': 0.8400000000000001, 'min_samples_leaf': 28, 'criterion': 'absolute_error', 'max_depth': 15, 'min_weight_fraction_leaf': 0.01, 'max_leaf_nodes': 20, 'bootstrap': True, 'ccp_alpha': 0.057, 'max_samples': 0.5}. Best is trial 74 with value: -0.18167313469617832.
[I 2025-04-15 23:31:30,951] Trial 457 finished with value: -0.18330511101001662 and parameters: {'n_estimators': 3582, 'min_samples_split': 36, 'max_features': 0.85, 'min_samples_leaf': 17, 'criterion': 'absolute_error', 'max_depth': 15, 'min_weight_fraction_leaf': 0.01, 'max_leaf_nodes': 150, 'bootstrap': True, 'ccp_alpha': 0.048, 'max_samples': 0.5}. Best is trial 74 with value: -0.18167313469617832.
[I 2025-04-15 23:31:34,635] Trial 458 finished with value: -0.19097637647194277 and parameters: {'n_estimators': 3237, 'min_samples_split': 43, 'max_features': 0.8, 'min_samples_leaf': 24, 'criterion': 'absolute_error', 'max_depth': 15, 'min_weight_fraction_leaf': 0.0, 'max_leaf_nodes': 50, 'bootstrap': True, 'ccp_alpha': 0.046, 'max_samples': 0.75}. Best is trial 74 with value: -0.18167313469617832.
[I 2025-04-15 23:31:37,848] Trial 459 finished with value: -0.18263112237903498 and parameters: {'n_estimators': 3042, 'min_samples_split': 47, 'max_features': 0.88, 'min_samples_leaf': 20, 'criterion': 'absolute_error', 'max_depth': 15, 'min_weight_fraction_leaf': 0.04, 'max_leaf_nodes': 150, 'bootstrap': True, 'ccp_alpha': 0.07100000000000001, 'max_samples': 0.5}. Best is trial 74 with value: -0.18167313469617832.
[I 2025-04-15 23:31:40,982] Trial 460 finished with value: -0.18267378429332992 and parameters: {'n_estimators': 2732, 'min_samples_split': 56, 'max_features': 0.76, 'min_samples_leaf': 46, 'criterion': 'absolute_error', 'max_depth': 15, 'min_weight_fraction_leaf': 0.09, 'max_leaf_nodes': None, 'bootstrap': True, 'ccp_alpha': 0.076, 'max_samples': 0.5}. Best is trial 74 with value: -0.18167313469617832.
[I 2025-04-15 23:31:44,596] Trial 461 finished with value: -17.84373056447861 and parameters: {'n_estimators': 3432, 'min_samples_split': 40, 'max_features': 0.8400000000000001, 'min_samples_leaf': 26, 'criterion': 'squared_error', 'max_depth': 10, 'min_weight_fraction_leaf': 0.01, 'max_leaf_nodes': 150, 'bootstrap': True, 'ccp_alpha': 0.064, 'max_samples': 0.5}. Best is trial 74 with value: -0.18167313469617832.
[I 2025-04-15 23:31:52,346] Trial 462 finished with value: -0.18425340075900398 and parameters: {'n_estimators': 7045, 'min_samples_split': 44, 'max_features': 0.87, 'min_samples_leaf': 15, 'criterion': 'absolute_error', 'max_depth': 60, 'min_weight_fraction_leaf': 0.01, 'max_leaf_nodes': 10, 'bootstrap': True, 'ccp_alpha': 0.038, 'max_samples': 0.5}. Best is trial 74 with value: -0.18167313469617832.
[I 2025-04-15 23:31:55,904] Trial 463 finished with value: -0.18271626709821404 and parameters: {'n_estimators': 3182, 'min_samples_split': 35, 'max_features': 0.78, 'min_samples_leaf': 29, 'criterion': 'absolute_error', 'max_depth': 5, 'min_weight_fraction_leaf': 0.01, 'max_leaf_nodes': 150, 'bootstrap': True, 'ccp_alpha': 0.066, 'max_samples': 0.5}. Best is trial 74 with value: -0.18167313469617832.
[I 2025-04-15 23:31:57,741] Trial 464 finished with value: -0.1865085082741394 and parameters: {'n_estimators': 1421, 'min_samples_split': 49, 'max_features': 0.81, 'min_samples_leaf': 22, 'criterion': 'absolute_error', 'max_depth': 15, 'min_weight_fraction_leaf': 0.01, 'max_leaf_nodes': 50, 'bootstrap': True, 'ccp_alpha': 0.08, 'max_samples': 0.5}. Best is trial 74 with value: -0.18167313469617832.
[I 2025-04-15 23:32:00,124] Trial 465 finished with value: -0.18466934824609912 and parameters: {'n_estimators': 2163, 'min_samples_split': 38, 'max_features': 0.8300000000000001, 'min_samples_leaf': 73, 'criterion': 'absolute_error', 'max_depth': 15, 'min_weight_fraction_leaf': 0.0, 'max_leaf_nodes': 10, 'bootstrap': True, 'ccp_alpha': 0.07200000000000001, 'max_samples': 0.5}. Best is trial 74 with value: -0.18167313469617832.
[I 2025-04-15 23:32:03,531] Trial 466 finished with value: -0.18278897100967387 and parameters: {'n_estimators': 2927, 'min_samples_split': 56, 'max_features': 0.88, 'min_samples_leaf': 25, 'criterion': 'absolute_error', 'max_depth': 15, 'min_weight_fraction_leaf': 0.01, 'max_leaf_nodes': 20, 'bootstrap': True, 'ccp_alpha': 0.057, 'max_samples': 0.5}. Best is trial 74 with value: -0.18167313469617832.
[I 2025-04-15 23:32:07,069] Trial 467 finished with value: -17.869343875018206 and parameters: {'n_estimators': 3380, 'min_samples_split': 32, 'max_features': 0.85, 'min_samples_leaf': 27, 'criterion': 'poisson', 'max_depth': 20, 'min_weight_fraction_leaf': 0.07, 'max_leaf_nodes': 150, 'bootstrap': True, 'ccp_alpha': 0.081, 'max_samples': 0.5}. Best is trial 74 with value: -0.18167313469617832.
[I 2025-04-15 23:32:10,235] Trial 468 finished with value: -0.18285245593332994 and parameters: {'n_estimators': 2681, 'min_samples_split': 155, 'max_features': 0.48000000000000004, 'min_samples_leaf': 24, 'criterion': 'absolute_error', 'max_depth': 60, 'min_weight_fraction_leaf': 0.01, 'max_leaf_nodes': None, 'bootstrap': True, 'ccp_alpha': 0.049, 'max_samples': 0.5}. Best is trial 74 with value: -0.18167313469617832.
[I 2025-04-15 23:32:12,899] Trial 469 finished with value: -0.1936417107583833 and parameters: {'n_estimators': 3052, 'min_samples_split': 29, 'max_features': 0.9, 'min_samples_leaf': 30, 'criterion': 'absolute_error', 'max_depth': 5, 'min_weight_fraction_leaf': 0.0, 'max_leaf_nodes': 150, 'bootstrap': False, 'ccp_alpha': 0.294}. Best is trial 74 with value: -0.18167313469617832.
[I 2025-04-15 23:32:20,125] Trial 470 finished with value: -0.18384446412811067 and parameters: {'n_estimators': 6111, 'min_samples_split': 149, 'max_features': 0.77, 'min_samples_leaf': 28, 'criterion': 'absolute_error', 'max_depth': 15, 'min_weight_fraction_leaf': 0.01, 'max_leaf_nodes': 150, 'bootstrap': True, 'ccp_alpha': 0.065, 'max_samples': 0.5}. Best is trial 74 with value: -0.18167313469617832.
[I 2025-04-15 23:32:23,228] Trial 471 finished with value: -0.18392597104557792 and parameters: {'n_estimators': 2448, 'min_samples_split': 45, 'max_features': 0.86, 'min_samples_leaf': 20, 'criterion': 'absolute_error', 'max_depth': 10, 'min_weight_fraction_leaf': 0.01, 'max_leaf_nodes': 10, 'bootstrap': True, 'ccp_alpha': 0.055, 'max_samples': 0.5}. Best is trial 74 with value: -0.18167313469617832.
[I 2025-04-15 23:32:27,519] Trial 472 finished with value: -0.183516585425402 and parameters: {'n_estimators': 3743, 'min_samples_split': 42, 'max_features': 0.81, 'min_samples_leaf': 23, 'criterion': 'absolute_error', 'max_depth': 15, 'min_weight_fraction_leaf': 0.01, 'max_leaf_nodes': 50, 'bootstrap': True, 'ccp_alpha': 0.074, 'max_samples': 0.5}. Best is trial 74 with value: -0.18167313469617832.
[I 2025-04-15 23:32:30,714] Trial 473 finished with value: -0.18302970562360557 and parameters: {'n_estimators': 2889, 'min_samples_split': 25, 'max_features': 0.79, 'min_samples_leaf': 27, 'criterion': 'absolute_error', 'max_depth': 15, 'min_weight_fraction_leaf': 0.04, 'max_leaf_nodes': 150, 'bootstrap': True, 'ccp_alpha': 0.084, 'max_samples': 0.5}. Best is trial 74 with value: -0.18167313469617832.
[I 2025-04-15 23:32:34,713] Trial 474 finished with value: -0.1827828542043124 and parameters: {'n_estimators': 3206, 'min_samples_split': 157, 'max_features': 0.8300000000000001, 'min_samples_leaf': 31, 'criterion': 'absolute_error', 'max_depth': 20, 'min_weight_fraction_leaf': 0.0, 'max_leaf_nodes': 150, 'bootstrap': True, 'ccp_alpha': 0.20600000000000002, 'max_samples': 0.5}. Best is trial 74 with value: -0.18167313469617832.
[I 2025-04-15 23:32:38,765] Trial 475 finished with value: -0.19328361969371044 and parameters: {'n_estimators': 3330, 'min_samples_split': 171, 'max_features': 0.88, 'min_samples_leaf': 25, 'criterion': 'absolute_error', 'max_depth': 60, 'min_weight_fraction_leaf': 0.01, 'max_leaf_nodes': None, 'bootstrap': True, 'ccp_alpha': 0.061, 'max_samples': None}. Best is trial 74 with value: -0.18167313469617832.
[I 2025-04-15 23:32:41,793] Trial 476 finished with value: -0.18266725253948932 and parameters: {'n_estimators': 2730, 'min_samples_split': 163, 'max_features': 0.91, 'min_samples_leaf': 29, 'criterion': 'absolute_error', 'max_depth': 5, 'min_weight_fraction_leaf': 0.03, 'max_leaf_nodes': 150, 'bootstrap': True, 'ccp_alpha': 0.044, 'max_samples': 0.5}. Best is trial 74 with value: -0.18167313469617832.
[I 2025-04-15 23:32:45,223] Trial 477 finished with value: -0.18254978946211192 and parameters: {'n_estimators': 2979, 'min_samples_split': 34, 'max_features': 0.85, 'min_samples_leaf': 82, 'criterion': 'absolute_error', 'max_depth': 15, 'min_weight_fraction_leaf': 0.05, 'max_leaf_nodes': 10, 'bootstrap': True, 'ccp_alpha': 0.076, 'max_samples': 0.5}. Best is trial 74 with value: -0.18167313469617832.
[I 2025-04-15 23:32:48,472] Trial 478 finished with value: -0.1827950130199294 and parameters: {'n_estimators': 2929, 'min_samples_split': 30, 'max_features': 0.81, 'min_samples_leaf': 83, 'criterion': 'absolute_error', 'max_depth': 15, 'min_weight_fraction_leaf': 0.06, 'max_leaf_nodes': 10, 'bootstrap': True, 'ccp_alpha': 0.067, 'max_samples': 0.5}. Best is trial 74 with value: -0.18167313469617832.
[I 2025-04-15 23:32:51,468] Trial 479 finished with value: -0.18299580606238403 and parameters: {'n_estimators': 2578, 'min_samples_split': 77, 'max_features': 1.0, 'min_samples_leaf': 78, 'criterion': 'absolute_error', 'max_depth': 15, 'min_weight_fraction_leaf': 0.05, 'max_leaf_nodes': 10, 'bootstrap': True, 'ccp_alpha': 0.073, 'max_samples': 0.5}. Best is trial 74 with value: -0.18167313469617832.
