[I 2025-04-16 01:36:20,090] Trial 2662 finished with value: -0.07804067624646685 and parameters: {'n_estimators': 3073, 'min_samples_split': 10, 'max_features': 0.85, 'min_samples_leaf': 7, 'criterion': 'absolute_error', 'max_depth': 5, 'min_weight_fraction_leaf': 0.0, 'max_leaf_nodes': 20, 'bootstrap': False, 'ccp_alpha': 0.005}. Best is trial 2586 with value: 0.023797084339743015.
[I 2025-04-16 01:36:23,132] Trial 2663 finished with value: -0.07964420086361265 and parameters: {'n_estimators': 3338, 'min_samples_split': 10, 'max_features': 0.87, 'min_samples_leaf': 6, 'criterion': 'absolute_error', 'max_depth': 5, 'min_weight_fraction_leaf': 0.0, 'max_leaf_nodes': 20, 'bootstrap': False, 'ccp_alpha': 0.005}. Best is trial 2586 with value: 0.023797084339743015.
[I 2025-04-16 01:36:26,294] Trial 2664 finished with value: -0.1936417107583833 and parameters: {'n_estimators': 3261, 'min_samples_split': 9, 'max_features': 0.85, 'min_samples_leaf': 7, 'criterion': 'absolute_error', 'max_depth': 5, 'min_weight_fraction_leaf': 0.0, 'max_leaf_nodes': 20, 'bootstrap': False, 'ccp_alpha': 0.011}. Best is trial 2586 with value: 0.023797084339743015.
[I 2025-04-16 01:36:29,556] Trial 2665 finished with value: -0.1936417107583833 and parameters: {'n_estimators': 3604, 'min_samples_split': 10, 'max_features': 0.88, 'min_samples_leaf': 5, 'criterion': 'absolute_error', 'max_depth': 5, 'min_weight_fraction_leaf': 0.0, 'max_leaf_nodes': 20, 'bootstrap': False, 'ccp_alpha': 0.016}. Best is trial 2586 with value: 0.023797084339743015.
[I 2025-04-16 01:36:32,483] Trial 2666 finished with value: -17.528986382275466 and parameters: {'n_estimators': 3422, 'min_samples_split': 10, 'max_features': 0.87, 'min_samples_leaf': 7, 'criterion': 'squared_error', 'max_depth': 5, 'min_weight_fraction_leaf': 0.0, 'max_leaf_nodes': 20, 'bootstrap': False, 'ccp_alpha': 0.005}. Best is trial 2586 with value: 0.023797084339743015.
[I 2025-04-16 01:36:35,387] Trial 2667 finished with value: -0.1936417107583833 and parameters: {'n_estimators': 3064, 'min_samples_split': 10, 'max_features': 0.88, 'min_samples_leaf': 7, 'criterion': 'absolute_error', 'max_depth': 5, 'min_weight_fraction_leaf': 0.0, 'max_leaf_nodes': 20, 'bootstrap': False, 'ccp_alpha': 0.01}. Best is trial 2586 with value: 0.023797084339743015.
[I 2025-04-16 01:36:38,614] Trial 2668 finished with value: -0.07853993689389271 and parameters: {'n_estimators': 3412, 'min_samples_split': 10, 'max_features': 0.89, 'min_samples_leaf': 4, 'criterion': 'absolute_error', 'max_depth': 5, 'min_weight_fraction_leaf': 0.0, 'max_leaf_nodes': 20, 'bootstrap': False, 'ccp_alpha': 0.005}. Best is trial 2586 with value: 0.023797084339743015.
[I 2025-04-16 01:36:41,428] Trial 2669 finished with value: -0.1936417107583833 and parameters: {'n_estimators': 3214, 'min_samples_split': 10, 'max_features': 0.86, 'min_samples_leaf': 7, 'criterion': 'absolute_error', 'max_depth': 5, 'min_weight_fraction_leaf': 0.0, 'max_leaf_nodes': 20, 'bootstrap': False, 'ccp_alpha': 0.018000000000000002}. Best is trial 2586 with value: 0.023797084339743015.
[I 2025-04-16 01:36:44,619] Trial 2670 finished with value: -0.1936417107583833 and parameters: {'n_estimators': 3630, 'min_samples_split': 6, 'max_features': 0.9, 'min_samples_leaf': 5, 'criterion': 'absolute_error', 'max_depth': 5, 'min_weight_fraction_leaf': 0.0, 'max_leaf_nodes': 20, 'bootstrap': False, 'ccp_alpha': 0.011}. Best is trial 2586 with value: 0.023797084339743015.
[I 2025-04-16 01:36:47,829] Trial 2671 finished with value: -21.497967653777415 and parameters: {'n_estimators': 3501, 'min_samples_split': 6, 'max_features': 0.89, 'min_samples_leaf': 3, 'criterion': 'poisson', 'max_depth': 5, 'min_weight_fraction_leaf': 0.0, 'max_leaf_nodes': 20, 'bootstrap': False, 'ccp_alpha': 0.005}. Best is trial 2586 with value: 0.023797084339743015.
[I 2025-04-16 01:36:50,817] Trial 2672 finished with value: -0.1936417107583833 and parameters: {'n_estimators': 3296, 'min_samples_split': 6, 'max_features': 0.9, 'min_samples_leaf': 5, 'criterion': 'absolute_error', 'max_depth': 5, 'min_weight_fraction_leaf': 0.0, 'max_leaf_nodes': 20, 'bootstrap': False, 'ccp_alpha': 0.023}. Best is trial 2586 with value: 0.023797084339743015.
[I 2025-04-16 01:36:54,325] Trial 2673 finished with value: -0.1936417107583833 and parameters: {'n_estimators': 3632, 'min_samples_split': 10, 'max_features': 0.85, 'min_samples_leaf': 3, 'criterion': 'absolute_error', 'max_depth': 5, 'min_weight_fraction_leaf': 0.0, 'max_leaf_nodes': 20, 'bootstrap': False, 'ccp_alpha': 0.014}. Best is trial 2586 with value: 0.023797084339743015.
[I 2025-04-16 01:36:57,078] Trial 2674 finished with value: -0.07864665614782977 and parameters: {'n_estimators': 3086, 'min_samples_split': 6, 'max_features': 0.88, 'min_samples_leaf': 7, 'criterion': 'absolute_error', 'max_depth': 5, 'min_weight_fraction_leaf': 0.0, 'max_leaf_nodes': 20, 'bootstrap': False, 'ccp_alpha': 0.005}. Best is trial 2586 with value: 0.023797084339743015.
[I 2025-04-16 01:37:00,174] Trial 2675 finished with value: -0.1936417107583833 and parameters: {'n_estimators': 3430, 'min_samples_split': 6, 'max_features': 0.89, 'min_samples_leaf': 3, 'criterion': 'absolute_error', 'max_depth': 5, 'min_weight_fraction_leaf': 0.0, 'max_leaf_nodes': 20, 'bootstrap': False, 'ccp_alpha': 0.011}. Best is trial 2586 with value: 0.023797084339743015.
[I 2025-04-16 01:37:03,437] Trial 2676 finished with value: 0.020384428051913095 and parameters: {'n_estimators': 3610, 'min_samples_split': 10, 'max_features': 0.9, 'min_samples_leaf': 1, 'criterion': 'absolute_error', 'max_depth': 5, 'min_weight_fraction_leaf': 0.0, 'max_leaf_nodes': 20, 'bootstrap': False, 'ccp_alpha': 0.005}. Best is trial 2586 with value: 0.023797084339743015.
[I 2025-04-16 01:37:06,534] Trial 2677 finished with value: -0.1936417107583833 and parameters: {'n_estimators': 3206, 'min_samples_split': 11, 'max_features': 0.85, 'min_samples_leaf': 5, 'criterion': 'absolute_error', 'max_depth': 5, 'min_weight_fraction_leaf': 0.0, 'max_leaf_nodes': 20, 'bootstrap': False, 'ccp_alpha': 0.29}. Best is trial 2586 with value: 0.023797084339743015.
[I 2025-04-16 01:37:09,458] Trial 2678 finished with value: -0.08071884188947791 and parameters: {'n_estimators': 3331, 'min_samples_split': 10, 'max_features': 0.87, 'min_samples_leaf': 7, 'criterion': 'absolute_error', 'max_depth': 5, 'min_weight_fraction_leaf': 0.0, 'max_leaf_nodes': 20, 'bootstrap': False, 'ccp_alpha': 0.005}. Best is trial 2586 with value: 0.023797084339743015.
[I 2025-04-16 01:37:12,565] Trial 2679 finished with value: -0.1936417107583833 and parameters: {'n_estimators': 3471, 'min_samples_split': 11, 'max_features': 0.86, 'min_samples_leaf': 3, 'criterion': 'absolute_error', 'max_depth': 5, 'min_weight_fraction_leaf': 0.0, 'max_leaf_nodes': 20, 'bootstrap': False, 'ccp_alpha': 0.017}. Best is trial 2586 with value: 0.023797084339743015.
[I 2025-04-16 01:37:15,271] Trial 2680 finished with value: -0.1936417107583833 and parameters: {'n_estimators': 3010, 'min_samples_split': 10, 'max_features': 0.87, 'min_samples_leaf': 5, 'criterion': 'absolute_error', 'max_depth': 5, 'min_weight_fraction_leaf': 0.0, 'max_leaf_nodes': 20, 'bootstrap': False, 'ccp_alpha': 0.01}. Best is trial 2586 with value: 0.023797084339743015.
[I 2025-04-16 01:37:18,277] Trial 2681 finished with value: 0.02445864841594616 and parameters: {'n_estimators': 3221, 'min_samples_split': 6, 'max_features': 0.88, 'min_samples_leaf': 3, 'criterion': 'absolute_error', 'max_depth': 5, 'min_weight_fraction_leaf': 0.0, 'max_leaf_nodes': 20, 'bootstrap': False, 'ccp_alpha': 0.005}. Best is trial 2681 with value: 0.02445864841594616.
[I 2025-04-16 01:37:21,101] Trial 2682 finished with value: -17.528986382276337 and parameters: {'n_estimators': 3133, 'min_samples_split': 10, 'max_features': 0.8400000000000001, 'min_samples_leaf': 7, 'criterion': 'friedman_mse', 'max_depth': 5, 'min_weight_fraction_leaf': 0.0, 'max_leaf_nodes': 20, 'bootstrap': False, 'ccp_alpha': 0.011}. Best is trial 2681 with value: 0.02445864841594616.
[I 2025-04-16 01:37:23,722] Trial 2683 finished with value: -0.08399206449467211 and parameters: {'n_estimators': 3178, 'min_samples_split': 6, 'max_features': 0.86, 'min_samples_leaf': 7, 'criterion': 'absolute_error', 'max_depth': 5, 'min_weight_fraction_leaf': 0.0, 'max_leaf_nodes': 20, 'bootstrap': False, 'ccp_alpha': 0.005}. Best is trial 2681 with value: 0.02445864841594616.
[I 2025-04-16 01:37:26,557] Trial 2684 finished with value: -0.0761638197917635 and parameters: {'n_estimators': 3051, 'min_samples_split': 2, 'max_features': 0.85, 'min_samples_leaf': 5, 'criterion': 'absolute_error', 'max_depth': 5, 'min_weight_fraction_leaf': 0.0, 'max_leaf_nodes': 20, 'bootstrap': False, 'ccp_alpha': 0.005}. Best is trial 2681 with value: 0.02445864841594616.
[I 2025-04-16 01:37:29,439] Trial 2685 finished with value: -0.1936417107583833 and parameters: {'n_estimators': 3068, 'min_samples_split': 10, 'max_features': 0.8400000000000001, 'min_samples_leaf': 4, 'criterion': 'absolute_error', 'max_depth': 5, 'min_weight_fraction_leaf': 0.0, 'max_leaf_nodes': 20, 'bootstrap': False, 'ccp_alpha': 0.017}. Best is trial 2681 with value: 0.02445864841594616.
[I 2025-04-16 01:37:32,382] Trial 2686 finished with value: -0.1936417107583833 and parameters: {'n_estimators': 2990, 'min_samples_split': 6, 'max_features': 0.86, 'min_samples_leaf': 7, 'criterion': 'absolute_error', 'max_depth': 5, 'min_weight_fraction_leaf': 0.0, 'max_leaf_nodes': 20, 'bootstrap': False, 'ccp_alpha': 0.029}. Best is trial 2681 with value: 0.02445864841594616.
[I 2025-04-16 01:37:35,305] Trial 2687 finished with value: -0.1936417107583833 and parameters: {'n_estimators': 3207, 'min_samples_split': 2, 'max_features': 0.86, 'min_samples_leaf': 5, 'criterion': 'absolute_error', 'max_depth': 5, 'min_weight_fraction_leaf': 0.0, 'max_leaf_nodes': 20, 'bootstrap': False, 'ccp_alpha': 0.011}. Best is trial 2681 with value: 0.02445864841594616.
[I 2025-04-16 01:37:38,082] Trial 2688 finished with value: -0.08241851959788245 and parameters: {'n_estimators': 3022, 'min_samples_split': 10, 'max_features': 0.88, 'min_samples_leaf': 3, 'criterion': 'absolute_error', 'max_depth': 5, 'min_weight_fraction_leaf': 0.0, 'max_leaf_nodes': 20, 'bootstrap': False, 'ccp_alpha': 0.005}. Best is trial 2681 with value: 0.02445864841594616.
[I 2025-04-16 01:37:40,924] Trial 2689 finished with value: -17.52898638227591 and parameters: {'n_estimators': 3269, 'min_samples_split': 6, 'max_features': 0.8400000000000001, 'min_samples_leaf': 3, 'criterion': 'squared_error', 'max_depth': 5, 'min_weight_fraction_leaf': 0.0, 'max_leaf_nodes': 20, 'bootstrap': False, 'ccp_alpha': 0.153}. Best is trial 2681 with value: 0.02445864841594616.
[I 2025-04-16 01:37:43,954] Trial 2690 finished with value: -0.1936417107583833 and parameters: {'n_estimators': 3234, 'min_samples_split': 11, 'max_features': 0.87, 'min_samples_leaf': 7, 'criterion': 'absolute_error', 'max_depth': 5, 'min_weight_fraction_leaf': 0.0, 'max_leaf_nodes': 20, 'bootstrap': False, 'ccp_alpha': 0.015}. Best is trial 2681 with value: 0.02445864841594616.
[I 2025-04-16 01:37:46,710] Trial 2691 finished with value: -0.07515781169295466 and parameters: {'n_estimators': 2990, 'min_samples_split': 6, 'max_features': 0.87, 'min_samples_leaf': 5, 'criterion': 'absolute_error', 'max_depth': 5, 'min_weight_fraction_leaf': 0.0, 'max_leaf_nodes': 20, 'bootstrap': False, 'ccp_alpha': 0.005}. Best is trial 2681 with value: 0.02445864841594616.
[I 2025-04-16 01:37:49,716] Trial 2692 finished with value: -0.1936417107583833 and parameters: {'n_estimators': 3261, 'min_samples_split': 2, 'max_features': 0.8400000000000001, 'min_samples_leaf': 3, 'criterion': 'absolute_error', 'max_depth': 5, 'min_weight_fraction_leaf': 0.0, 'max_leaf_nodes': 20, 'bootstrap': False, 'ccp_alpha': 0.022}. Best is trial 2681 with value: 0.02445864841594616.
[I 2025-04-16 01:37:52,423] Trial 2693 finished with value: -0.07307088787589092 and parameters: {'n_estimators': 2969, 'min_samples_split': 10, 'max_features': 0.88, 'min_samples_leaf': 4, 'criterion': 'absolute_error', 'max_depth': 5, 'min_weight_fraction_leaf': 0.0, 'max_leaf_nodes': 20, 'bootstrap': False, 'ccp_alpha': 0.005}. Best is trial 2681 with value: 0.02445864841594616.
[I 2025-04-16 01:37:55,424] Trial 2694 finished with value: -0.1936417107583833 and parameters: {'n_estimators': 3234, 'min_samples_split': 6, 'max_features': 0.88, 'min_samples_leaf': 1, 'criterion': 'absolute_error', 'max_depth': 5, 'min_weight_fraction_leaf': 0.0, 'max_leaf_nodes': 20, 'bootstrap': False, 'ccp_alpha': 0.01}. Best is trial 2681 with value: 0.02445864841594616.
[I 2025-04-16 01:37:58,576] Trial 2695 finished with value: -0.1936417107583833 and parameters: {'n_estimators': 3380, 'min_samples_split': 6, 'max_features': 0.85, 'min_samples_leaf': 7, 'criterion': 'absolute_error', 'max_depth': 5, 'min_weight_fraction_leaf': 0.0, 'max_leaf_nodes': 20, 'bootstrap': False, 'ccp_alpha': 0.015}. Best is trial 2681 with value: 0.02445864841594616.
[I 2025-04-16 01:38:01,600] Trial 2696 finished with value: -17.52898638227559 and parameters: {'n_estimators': 3377, 'min_samples_split': 11, 'max_features': 0.89, 'min_samples_leaf': 5, 'criterion': 'poisson', 'max_depth': 5, 'min_weight_fraction_leaf': 0.0, 'max_leaf_nodes': 20, 'bootstrap': False, 'ccp_alpha': 0.14}. Best is trial 2681 with value: 0.02445864841594616.
[I 2025-04-16 01:38:04,653] Trial 2697 finished with value: 0.024400891232512056 and parameters: {'n_estimators': 3392, 'min_samples_split': 2, 'max_features': 0.88, 'min_samples_leaf': 3, 'criterion': 'absolute_error', 'max_depth': 5, 'min_weight_fraction_leaf': 0.0, 'max_leaf_nodes': 20, 'bootstrap': False, 'ccp_alpha': 0.005}. Best is trial 2681 with value: 0.02445864841594616.
[I 2025-04-16 01:38:07,486] Trial 2698 finished with value: -2.500728776477934 and parameters: {'n_estimators': 3120, 'min_samples_split': 2, 'max_features': 0.86, 'min_samples_leaf': 1, 'criterion': 'absolute_error', 'max_depth': 5, 'min_weight_fraction_leaf': 0.0, 'max_leaf_nodes': 20, 'bootstrap': False, 'ccp_alpha': 0.004}. Best is trial 2681 with value: 0.02445864841594616.
[I 2025-04-16 01:38:10,402] Trial 2699 finished with value: -0.1936417107583833 and parameters: {'n_estimators': 2934, 'min_samples_split': 6, 'max_features': 0.85, 'min_samples_leaf': 5, 'criterion': 'absolute_error', 'max_depth': 5, 'min_weight_fraction_leaf': 0.0, 'max_leaf_nodes': 20, 'bootstrap': False, 'ccp_alpha': 0.011}. Best is trial 2681 with value: 0.02445864841594616.
[I 2025-04-16 01:38:13,177] Trial 2700 finished with value: -0.08245816915840314 and parameters: {'n_estimators': 3088, 'min_samples_split': 10, 'max_features': 0.8400000000000001, 'min_samples_leaf': 3, 'criterion': 'absolute_error', 'max_depth': 5, 'min_weight_fraction_leaf': 0.0, 'max_leaf_nodes': 20, 'bootstrap': False, 'ccp_alpha': 0.005}. Best is trial 2681 with value: 0.02445864841594616.
[I 2025-04-16 01:38:15,994] Trial 2701 finished with value: -0.0793687164805194 and parameters: {'n_estimators': 2990, 'min_samples_split': 6, 'max_features': 0.87, 'min_samples_leaf': 7, 'criterion': 'absolute_error', 'max_depth': 5, 'min_weight_fraction_leaf': 0.0, 'max_leaf_nodes': 20, 'bootstrap': False, 'ccp_alpha': 0.005}. Best is trial 2681 with value: 0.02445864841594616.
[I 2025-04-16 01:38:18,967] Trial 2702 finished with value: -0.1936417107583833 and parameters: {'n_estimators': 3249, 'min_samples_split': 11, 'max_features': 0.8400000000000001, 'min_samples_leaf': 3, 'criterion': 'absolute_error', 'max_depth': 5, 'min_weight_fraction_leaf': 0.0, 'max_leaf_nodes': 20, 'bootstrap': False, 'ccp_alpha': 0.011}. Best is trial 2681 with value: 0.02445864841594616.
[I 2025-04-16 01:38:22,031] Trial 2703 finished with value: -0.1936417107583833 and parameters: {'n_estimators': 3263, 'min_samples_split': 2, 'max_features': 0.87, 'min_samples_leaf': 1, 'criterion': 'absolute_error', 'max_depth': 5, 'min_weight_fraction_leaf': 0.0, 'max_leaf_nodes': 20, 'bootstrap': False, 'ccp_alpha': 0.018000000000000002}. Best is trial 2681 with value: 0.02445864841594616.
[I 2025-04-16 01:38:24,756] Trial 2704 finished with value: -0.1936417107583833 and parameters: {'n_estimators': 3064, 'min_samples_split': 6, 'max_features': 0.86, 'min_samples_leaf': 5, 'criterion': 'absolute_error', 'max_depth': 5, 'min_weight_fraction_leaf': 0.0, 'max_leaf_nodes': 20, 'bootstrap': False, 'ccp_alpha': 0.279}. Best is trial 2681 with value: 0.02445864841594616.
[I 2025-04-16 01:38:27,548] Trial 2705 finished with value: -17.52898638227568 and parameters: {'n_estimators': 3344, 'min_samples_split': 11, 'max_features': 0.87, 'min_samples_leaf': 7, 'criterion': 'friedman_mse', 'max_depth': 5, 'min_weight_fraction_leaf': 0.0, 'max_leaf_nodes': 20, 'bootstrap': False, 'ccp_alpha': 0.005}. Best is trial 2681 with value: 0.02445864841594616.
[I 2025-04-16 01:38:30,490] Trial 2706 finished with value: -0.1936417107583833 and parameters: {'n_estimators': 3411, 'min_samples_split': 2, 'max_features': 0.88, 'min_samples_leaf': 3, 'criterion': 'absolute_error', 'max_depth': 5, 'min_weight_fraction_leaf': 0.0, 'max_leaf_nodes': 20, 'bootstrap': False, 'ccp_alpha': 0.011}. Best is trial 2681 with value: 0.02445864841594616.
[I 2025-04-16 01:38:33,320] Trial 2707 finished with value: -0.1936417107583833 and parameters: {'n_estimators': 3174, 'min_samples_split': 6, 'max_features': 0.88, 'min_samples_leaf': 5, 'criterion': 'absolute_error', 'max_depth': 5, 'min_weight_fraction_leaf': 0.0, 'max_leaf_nodes': 20, 'bootstrap': False, 'ccp_alpha': 0.023}. Best is trial 2681 with value: 0.02445864841594616.
[I 2025-04-16 01:38:36,470] Trial 2708 finished with value: -0.1936417107583833 and parameters: {'n_estimators': 3416, 'min_samples_split': 10, 'max_features': 0.8400000000000001, 'min_samples_leaf': 1, 'criterion': 'absolute_error', 'max_depth': 5, 'min_weight_fraction_leaf': 0.0, 'max_leaf_nodes': 20, 'bootstrap': False, 'ccp_alpha': 0.015}. Best is trial 2681 with value: 0.02445864841594616.
[I 2025-04-16 01:38:39,198] Trial 2709 finished with value: -0.10687759895229347 and parameters: {'n_estimators': 3194, 'min_samples_split': 6, 'max_features': 0.86, 'min_samples_leaf': 4, 'criterion': 'absolute_error', 'max_depth': 5, 'min_weight_fraction_leaf': 0.0, 'max_leaf_nodes': 20, 'bootstrap': False, 'ccp_alpha': 0.005}. Best is trial 2681 with value: 0.02445864841594616.
[I 2025-04-16 01:38:42,605] Trial 2710 finished with value: -0.1936417107583833 and parameters: {'n_estimators': 3416, 'min_samples_split': 2, 'max_features': 0.88, 'min_samples_leaf': 7, 'criterion': 'absolute_error', 'max_depth': 5, 'min_weight_fraction_leaf': 0.0, 'max_leaf_nodes': 20, 'bootstrap': False, 'ccp_alpha': 0.011}. Best is trial 2681 with value: 0.02445864841594616.
[I 2025-04-16 01:38:45,387] Trial 2711 finished with value: -0.08145030531295767 and parameters: {'n_estimators': 2953, 'min_samples_split': 9, 'max_features': 0.89, 'min_samples_leaf': 3, 'criterion': 'absolute_error', 'max_depth': 5, 'min_weight_fraction_leaf': 0.0, 'max_leaf_nodes': 20, 'bootstrap': False, 'ccp_alpha': 0.005}. Best is trial 2681 with value: 0.02445864841594616.
[I 2025-04-16 01:38:48,649] Trial 2712 finished with value: -0.1936417107583833 and parameters: {'n_estimators': 3395, 'min_samples_split': 6, 'max_features': 0.85, 'min_samples_leaf': 1, 'criterion': 'absolute_error', 'max_depth': 5, 'min_weight_fraction_leaf': 0.0, 'max_leaf_nodes': 20, 'bootstrap': False, 'ccp_alpha': 0.02}. Best is trial 2681 with value: 0.02445864841594616.
[I 2025-04-16 01:38:51,326] Trial 2713 finished with value: -0.07571981662070353 and parameters: {'n_estimators': 2995, 'min_samples_split': 11, 'max_features': 0.88, 'min_samples_leaf': 5, 'criterion': 'absolute_error', 'max_depth': 5, 'min_weight_fraction_leaf': 0.0, 'max_leaf_nodes': 20, 'bootstrap': False, 'ccp_alpha': 0.005}. Best is trial 2681 with value: 0.02445864841594616.
[I 2025-04-16 01:38:54,147] Trial 2714 finished with value: -17.528986382276067 and parameters: {'n_estimators': 3217, 'min_samples_split': 6, 'max_features': 0.89, 'min_samples_leaf': 3, 'criterion': 'squared_error', 'max_depth': 5, 'min_weight_fraction_leaf': 0.0, 'max_leaf_nodes': 20, 'bootstrap': False, 'ccp_alpha': 0.011}. Best is trial 2681 with value: 0.02445864841594616.
[I 2025-04-16 01:38:57,613] Trial 2715 finished with value: -0.1936417107583833 and parameters: {'n_estimators': 3543, 'min_samples_split': 2, 'max_features': 0.86, 'min_samples_leaf': 1, 'criterion': 'absolute_error', 'max_depth': 5, 'min_weight_fraction_leaf': 0.0, 'max_leaf_nodes': 20, 'bootstrap': False, 'ccp_alpha': 0.014}. Best is trial 2681 with value: 0.02445864841594616.
[I 2025-04-16 01:39:00,797] Trial 2716 finished with value: -0.07799187624081957 and parameters: {'n_estimators': 3399, 'min_samples_split': 11, 'max_features': 0.89, 'min_samples_leaf': 7, 'criterion': 'absolute_error', 'max_depth': 5, 'min_weight_fraction_leaf': 0.0, 'max_leaf_nodes': 20, 'bootstrap': False, 'ccp_alpha': 0.005}. Best is trial 2681 with value: 0.02445864841594616.
[I 2025-04-16 01:39:03,799] Trial 2717 finished with value: -0.1936417107583833 and parameters: {'n_estimators': 3465, 'min_samples_split': 6, 'max_features': 0.89, 'min_samples_leaf': 5, 'criterion': 'absolute_error', 'max_depth': 5, 'min_weight_fraction_leaf': 0.0, 'max_leaf_nodes': 20, 'bootstrap': False, 'ccp_alpha': 0.017}. Best is trial 2681 with value: 0.02445864841594616.
[I 2025-04-16 01:39:06,573] Trial 2718 finished with value: -0.1936417107583833 and parameters: {'n_estimators': 3205, 'min_samples_split': 2, 'max_features': 0.88, 'min_samples_leaf': 3, 'criterion': 'absolute_error', 'max_depth': 5, 'min_weight_fraction_leaf': 0.0, 'max_leaf_nodes': 20, 'bootstrap': False, 'ccp_alpha': 0.01}. Best is trial 2681 with value: 0.02445864841594616.
