[I 2025-04-16 02:10:22,315] Trial 4069 finished with value: -0.1936417107583833 and parameters: {'n_estimators': 147, 'min_samples_split': 106, 'max_features': 0.8300000000000001, 'min_samples_leaf': 1, 'criterion': 'absolute_error', 'max_depth': 15, 'min_weight_fraction_leaf': 0.0, 'max_leaf_nodes': 300, 'bootstrap': False, 'ccp_alpha': 0.006}. Best is trial 4065 with value: 0.057524275121161005.
[I 2025-04-16 02:10:23,011] Trial 4070 finished with value: -0.1936417107583833 and parameters: {'n_estimators': 149, 'min_samples_split': 11, 'max_features': 0.8300000000000001, 'min_samples_leaf': 3, 'criterion': 'absolute_error', 'max_depth': 15, 'min_weight_fraction_leaf': 0.0, 'max_leaf_nodes': 300, 'bootstrap': False, 'ccp_alpha': 0.013000000000000001}. Best is trial 4065 with value: 0.057524275121161005.
[I 2025-04-16 02:10:23,598] Trial 4071 finished with value: -0.1936417107583833 and parameters: {'n_estimators': 25, 'min_samples_split': 9, 'max_features': 0.8300000000000001, 'min_samples_leaf': 3, 'criterion': 'absolute_error', 'max_depth': 15, 'min_weight_fraction_leaf': 0.0, 'max_leaf_nodes': 300, 'bootstrap': False, 'ccp_alpha': 0.01}. Best is trial 4065 with value: 0.057524275121161005.
[I 2025-04-16 02:10:24,308] Trial 4072 finished with value: -0.1936417107583833 and parameters: {'n_estimators': 179, 'min_samples_split': 11, 'max_features': 0.8300000000000001, 'min_samples_leaf': 1, 'criterion': 'absolute_error', 'max_depth': 15, 'min_weight_fraction_leaf': 0.0, 'max_leaf_nodes': 300, 'bootstrap': False, 'ccp_alpha': 0.027}. Best is trial 4065 with value: 0.057524275121161005.
[I 2025-04-16 02:10:25,087] Trial 4073 finished with value: -0.18614274721876364 and parameters: {'n_estimators': 284, 'min_samples_split': 9, 'max_features': 0.81, 'min_samples_leaf': 5, 'criterion': 'absolute_error', 'max_depth': 15, 'min_weight_fraction_leaf': 0.0, 'max_leaf_nodes': 300, 'bootstrap': False, 'ccp_alpha': 0.005}. Best is trial 4065 with value: 0.057524275121161005.
[I 2025-04-16 02:10:25,790] Trial 4074 finished with value: -21.14132181954931 and parameters: {'n_estimators': 193, 'min_samples_split': 9, 'max_features': 0.8200000000000001, 'min_samples_leaf': 3, 'criterion': 'poisson', 'max_depth': 15, 'min_weight_fraction_leaf': 0.0, 'max_leaf_nodes': 300, 'bootstrap': False, 'ccp_alpha': 0.0}. Best is trial 4065 with value: 0.057524275121161005.
[I 2025-04-16 02:10:26,345] Trial 4075 finished with value: -0.1936417107583833 and parameters: {'n_estimators': 13, 'min_samples_split': 6, 'max_features': 0.8, 'min_samples_leaf': 1, 'criterion': 'absolute_error', 'max_depth': 15, 'min_weight_fraction_leaf': 0.0, 'max_leaf_nodes': 300, 'bootstrap': False, 'ccp_alpha': 0.016}. Best is trial 4065 with value: 0.057524275121161005.
[I 2025-04-16 02:10:26,899] Trial 4076 finished with value: -0.1936417107583833 and parameters: {'n_estimators': 15, 'min_samples_split': 11, 'max_features': 0.8, 'min_samples_leaf': 5, 'criterion': 'absolute_error', 'max_depth': 15, 'min_weight_fraction_leaf': 0.0, 'max_leaf_nodes': 50, 'bootstrap': False, 'ccp_alpha': 0.009000000000000001}. Best is trial 4065 with value: 0.057524275121161005.
[I 2025-04-16 02:10:27,740] Trial 4077 finished with value: -0.1936417107583833 and parameters: {'n_estimators': 364, 'min_samples_split': 6, 'max_features': 0.81, 'min_samples_leaf': 3, 'criterion': 'absolute_error', 'max_depth': 15, 'min_weight_fraction_leaf': 0.0, 'max_leaf_nodes': 300, 'bootstrap': False, 'ccp_alpha': 0.136}. Best is trial 4065 with value: 0.057524275121161005.
[I 2025-04-16 02:10:28,568] Trial 4078 finished with value: 0.0245415747255743 and parameters: {'n_estimators': 300, 'min_samples_split': 6, 'max_features': 0.8200000000000001, 'min_samples_leaf': 3, 'criterion': 'absolute_error', 'max_depth': 15, 'min_weight_fraction_leaf': 0.0, 'max_leaf_nodes': 300, 'bootstrap': False, 'ccp_alpha': 0.005}. Best is trial 4065 with value: 0.057524275121161005.
[I 2025-04-16 02:10:29,285] Trial 4079 finished with value: -0.1936417107583833 and parameters: {'n_estimators': 212, 'min_samples_split': 11, 'max_features': 0.79, 'min_samples_leaf': 1, 'criterion': 'absolute_error', 'max_depth': 15, 'min_weight_fraction_leaf': 0.0, 'max_leaf_nodes': 300, 'bootstrap': False, 'ccp_alpha': 0.023}. Best is trial 4065 with value: 0.057524275121161005.
[I 2025-04-16 02:10:30,140] Trial 4080 finished with value: -0.1936417107583833 and parameters: {'n_estimators': 341, 'min_samples_split': 6, 'max_features': 0.8300000000000001, 'min_samples_leaf': 5, 'criterion': 'absolute_error', 'max_depth': 15, 'min_weight_fraction_leaf': 0.0, 'max_leaf_nodes': 300, 'bootstrap': False, 'ccp_alpha': 0.014}. Best is trial 4065 with value: 0.057524275121161005.
[I 2025-04-16 02:10:30,958] Trial 4081 finished with value: -12.23081056081282 and parameters: {'n_estimators': 351, 'min_samples_split': 6, 'max_features': 0.66, 'min_samples_leaf': 1, 'criterion': 'absolute_error', 'max_depth': 20, 'min_weight_fraction_leaf': 0.0, 'max_leaf_nodes': 10, 'bootstrap': False, 'ccp_alpha': 0.0}. Best is trial 4065 with value: 0.057524275121161005.
[I 2025-04-16 02:10:31,635] Trial 4082 finished with value: -0.1936417107583833 and parameters: {'n_estimators': 167, 'min_samples_split': 9, 'max_features': 0.81, 'min_samples_leaf': 3, 'criterion': 'absolute_error', 'max_depth': 15, 'min_weight_fraction_leaf': 0.0, 'max_leaf_nodes': 300, 'bootstrap': False, 'ccp_alpha': 0.01}. Best is trial 4065 with value: 0.057524275121161005.
[I 2025-04-16 02:10:32,537] Trial 4083 finished with value: -17.528986382274876 and parameters: {'n_estimators': 426, 'min_samples_split': 6, 'max_features': 0.68, 'min_samples_leaf': 1, 'criterion': 'friedman_mse', 'max_depth': 15, 'min_weight_fraction_leaf': 0.0, 'max_leaf_nodes': 300, 'bootstrap': False, 'ccp_alpha': 0.005}. Best is trial 4065 with value: 0.057524275121161005.
[I 2025-04-16 02:10:33,104] Trial 4084 finished with value: -0.1936417107583833 and parameters: {'n_estimators': 10, 'min_samples_split': 9, 'max_features': 0.8300000000000001, 'min_samples_leaf': 5, 'criterion': 'absolute_error', 'max_depth': 15, 'min_weight_fraction_leaf': 0.0, 'max_leaf_nodes': 300, 'bootstrap': False, 'ccp_alpha': 0.019}. Best is trial 4065 with value: 0.057524275121161005.
[I 2025-04-16 02:10:34,000] Trial 4085 finished with value: -0.1936417107583833 and parameters: {'n_estimators': 398, 'min_samples_split': 11, 'max_features': 0.8, 'min_samples_leaf': 3, 'criterion': 'absolute_error', 'max_depth': 15, 'min_weight_fraction_leaf': 0.0, 'max_leaf_nodes': 300, 'bootstrap': False, 'ccp_alpha': 0.01}. Best is trial 4065 with value: 0.057524275121161005.
[I 2025-04-16 02:10:34,751] Trial 4086 finished with value: -0.1936417107583833 and parameters: {'n_estimators': 223, 'min_samples_split': 6, 'max_features': 0.6900000000000001, 'min_samples_leaf': 67, 'criterion': 'absolute_error', 'max_depth': 15, 'min_weight_fraction_leaf': 0.0, 'max_leaf_nodes': 300, 'bootstrap': False, 'ccp_alpha': 0.005}. Best is trial 4065 with value: 0.057524275121161005.
[I 2025-04-16 02:10:35,298] Trial 4087 finished with value: -0.1936417107583833 and parameters: {'n_estimators': 3, 'min_samples_split': 6, 'max_features': 0.79, 'min_samples_leaf': 1, 'criterion': 'absolute_error', 'max_depth': 10, 'min_weight_fraction_leaf': 0.08, 'max_leaf_nodes': 300, 'bootstrap': False, 'ccp_alpha': 0.015}. Best is trial 4065 with value: 0.057524275121161005.
[I 2025-04-16 02:10:36,202] Trial 4088 finished with value: -9.716603015915085 and parameters: {'n_estimators': 415, 'min_samples_split': 5, 'max_features': 0.78, 'min_samples_leaf': 5, 'criterion': 'absolute_error', 'max_depth': 15, 'min_weight_fraction_leaf': 0.0, 'max_leaf_nodes': 300, 'bootstrap': False, 'ccp_alpha': 0.0}. Best is trial 4065 with value: 0.057524275121161005.
[I 2025-04-16 02:10:37,198] Trial 4089 finished with value: -0.1936417107583833 and parameters: {'n_estimators': 470, 'min_samples_split': 11, 'max_features': 0.64, 'min_samples_leaf': 3, 'criterion': 'absolute_error', 'max_depth': 15, 'min_weight_fraction_leaf': 0.0, 'max_leaf_nodes': None, 'bootstrap': False, 'ccp_alpha': 0.009000000000000001}. Best is trial 4065 with value: 0.057524275121161005.
[I 2025-04-16 02:10:37,985] Trial 4090 finished with value: -0.1936417107583833 and parameters: {'n_estimators': 285, 'min_samples_split': 2, 'max_features': 0.7000000000000001, 'min_samples_leaf': 1, 'criterion': 'absolute_error', 'max_depth': 15, 'min_weight_fraction_leaf': 0.0, 'max_leaf_nodes': 300, 'bootstrap': False, 'ccp_alpha': 0.019}. Best is trial 4065 with value: 0.057524275121161005.
[I 2025-04-16 02:10:38,524] Trial 4091 finished with value: -17.528986382275015 and parameters: {'n_estimators': 1, 'min_samples_split': 64, 'max_features': 0.81, 'min_samples_leaf': 3, 'criterion': 'squared_error', 'max_depth': 15, 'min_weight_fraction_leaf': 0.0, 'max_leaf_nodes': 300, 'bootstrap': False, 'ccp_alpha': 0.005}. Best is trial 4065 with value: 0.057524275121161005.
[I 2025-04-16 02:10:39,450] Trial 4092 finished with value: -9.65412970672969 and parameters: {'n_estimators': 496, 'min_samples_split': 6, 'max_features': 0.7100000000000001, 'min_samples_leaf': 5, 'criterion': 'absolute_error', 'max_depth': 15, 'min_weight_fraction_leaf': 0.06, 'max_leaf_nodes': 300, 'bootstrap': False, 'ccp_alpha': 0.0}. Best is trial 4065 with value: 0.057524275121161005.
[I 2025-04-16 02:10:40,256] Trial 4093 finished with value: -0.1936417107583833 and parameters: {'n_estimators': 257, 'min_samples_split': 11, 'max_features': 0.8300000000000001, 'min_samples_leaf': 1, 'criterion': 'absolute_error', 'max_depth': 15, 'min_weight_fraction_leaf': 0.0, 'max_leaf_nodes': 300, 'bootstrap': False, 'ccp_alpha': 0.013000000000000001}. Best is trial 4065 with value: 0.057524275121161005.
[I 2025-04-16 02:10:41,319] Trial 4094 finished with value: -0.1936417107583833 and parameters: {'n_estimators': 574, 'min_samples_split': 2, 'max_features': 0.78, 'min_samples_leaf': 3, 'criterion': 'absolute_error', 'max_depth': 15, 'min_weight_fraction_leaf': 0.0, 'max_leaf_nodes': 300, 'bootstrap': False, 'ccp_alpha': 0.009000000000000001}. Best is trial 4065 with value: 0.057524275121161005.
[I 2025-04-16 02:10:42,052] Trial 4095 finished with value: -0.1936417107583833 and parameters: {'n_estimators': 226, 'min_samples_split': 6, 'max_features': 0.6900000000000001, 'min_samples_leaf': 5, 'criterion': 'absolute_error', 'max_depth': 15, 'min_weight_fraction_leaf': 0.0, 'max_leaf_nodes': 300, 'bootstrap': False, 'ccp_alpha': 0.006}. Best is trial 4065 with value: 0.057524275121161005.
[I 2025-04-16 02:10:42,989] Trial 4096 finished with value: -0.1936417107583833 and parameters: {'n_estimators': 490, 'min_samples_split': 9, 'max_features': 0.81, 'min_samples_leaf': 1, 'criterion': 'absolute_error', 'max_depth': 15, 'min_weight_fraction_leaf': 0.0, 'max_leaf_nodes': 300, 'bootstrap': False, 'ccp_alpha': 0.025}. Best is trial 4065 with value: 0.057524275121161005.
[I 2025-04-16 02:10:43,687] Trial 4097 finished with value: -0.1936417107583833 and parameters: {'n_estimators': 204, 'min_samples_split': 5, 'max_features': 0.73, 'min_samples_leaf': 3, 'criterion': 'absolute_error', 'max_depth': 15, 'min_weight_fraction_leaf': 0.0, 'max_leaf_nodes': 300, 'bootstrap': False, 'ccp_alpha': 0.015}. Best is trial 4065 with value: 0.057524275121161005.
[I 2025-04-16 02:10:44,658] Trial 4098 finished with value: -8.263051168797611 and parameters: {'n_estimators': 545, 'min_samples_split': 2, 'max_features': 0.66, 'min_samples_leaf': 1, 'criterion': 'poisson', 'max_depth': 15, 'min_weight_fraction_leaf': 0.0, 'max_leaf_nodes': 300, 'bootstrap': False, 'ccp_alpha': 0.0}. Best is trial 4065 with value: 0.057524275121161005.
[I 2025-04-16 02:10:45,481] Trial 4099 finished with value: -0.1936417107583833 and parameters: {'n_estimators': 353, 'min_samples_split': 130, 'max_features': 0.7100000000000001, 'min_samples_leaf': 5, 'criterion': 'absolute_error', 'max_depth': 15, 'min_weight_fraction_leaf': 0.0, 'max_leaf_nodes': 300, 'bootstrap': False, 'ccp_alpha': 0.01}. Best is trial 4065 with value: 0.057524275121161005.
[I 2025-04-16 02:10:46,583] Trial 4100 finished with value: -0.11694679638841954 and parameters: {'n_estimators': 616, 'min_samples_split': 11, 'max_features': 0.8300000000000001, 'min_samples_leaf': 3, 'criterion': 'absolute_error', 'max_depth': 15, 'min_weight_fraction_leaf': 0.0, 'max_leaf_nodes': 300, 'bootstrap': False, 'ccp_alpha': 0.005}. Best is trial 4065 with value: 0.057524275121161005.
[I 2025-04-16 02:10:47,285] Trial 4101 finished with value: -0.1936417107583833 and parameters: {'n_estimators': 163, 'min_samples_split': 6, 'max_features': 0.79, 'min_samples_leaf': 1, 'criterion': 'absolute_error', 'max_depth': 15, 'min_weight_fraction_leaf': 0.0, 'max_leaf_nodes': 50, 'bootstrap': False, 'ccp_alpha': 0.017}. Best is trial 4065 with value: 0.057524275121161005.
[I 2025-04-16 02:10:48,172] Trial 4102 finished with value: -0.1936417107583833 and parameters: {'n_estimators': 370, 'min_samples_split': 2, 'max_features': 0.77, 'min_samples_leaf': 3, 'criterion': 'absolute_error', 'max_depth': 20, 'min_weight_fraction_leaf': 0.0, 'max_leaf_nodes': 300, 'bootstrap': False, 'ccp_alpha': 0.039}. Best is trial 4065 with value: 0.057524275121161005.
[I 2025-04-16 02:10:48,732] Trial 4103 finished with value: -0.011692892753495521 and parameters: {'n_estimators': 10, 'min_samples_split': 9, 'max_features': 0.73, 'min_samples_leaf': 5, 'criterion': 'absolute_error', 'max_depth': 15, 'min_weight_fraction_leaf': 0.0, 'max_leaf_nodes': 300, 'bootstrap': False, 'ccp_alpha': 0.005}. Best is trial 4065 with value: 0.057524275121161005.
[I 2025-04-16 02:10:49,832] Trial 4104 finished with value: -0.1936417107583833 and parameters: {'n_estimators': 726, 'min_samples_split': 122, 'max_features': 0.75, 'min_samples_leaf': 1, 'criterion': 'absolute_error', 'max_depth': 15, 'min_weight_fraction_leaf': 0.0, 'max_leaf_nodes': 300, 'bootstrap': False, 'ccp_alpha': 0.26}. Best is trial 4065 with value: 0.057524275121161005.
[I 2025-04-16 02:10:50,769] Trial 4105 finished with value: -0.1936417107583833 and parameters: {'n_estimators': 448, 'min_samples_split': 6, 'max_features': 0.7000000000000001, 'min_samples_leaf': 3, 'criterion': 'absolute_error', 'max_depth': 15, 'min_weight_fraction_leaf': 0.05, 'max_leaf_nodes': 10, 'bootstrap': False, 'ccp_alpha': 0.012}. Best is trial 4065 with value: 0.057524275121161005.
[I 2025-04-16 02:10:51,321] Trial 4106 finished with value: -0.1936417107583833 and parameters: {'n_estimators': 2, 'min_samples_split': 11, 'max_features': 0.81, 'min_samples_leaf': 50, 'criterion': 'absolute_error', 'max_depth': 15, 'min_weight_fraction_leaf': 0.0, 'max_leaf_nodes': 300, 'bootstrap': False, 'ccp_alpha': 0.0}. Best is trial 4065 with value: 0.057524275121161005.
[I 2025-04-16 02:10:52,151] Trial 4107 finished with value: -0.1936417107583833 and parameters: {'n_estimators': 315, 'min_samples_split': 2, 'max_features': 0.68, 'min_samples_leaf': 1, 'criterion': 'absolute_error', 'max_depth': 15, 'min_weight_fraction_leaf': 0.0, 'max_leaf_nodes': 300, 'bootstrap': False, 'ccp_alpha': 0.02}. Best is trial 4065 with value: 0.057524275121161005.
[I 2025-04-16 02:10:53,110] Trial 4108 finished with value: -17.528986382274873 and parameters: {'n_estimators': 596, 'min_samples_split': 73, 'max_features': 0.72, 'min_samples_leaf': 5, 'criterion': 'friedman_mse', 'max_depth': 15, 'min_weight_fraction_leaf': 0.0, 'max_leaf_nodes': 300, 'bootstrap': False, 'ccp_alpha': 0.009000000000000001}. Best is trial 4065 with value: 0.057524275121161005.
[I 2025-04-16 02:10:54,261] Trial 4109 finished with value: 0.017136073849122413 and parameters: {'n_estimators': 764, 'min_samples_split': 6, 'max_features': 0.78, 'min_samples_leaf': 3, 'criterion': 'absolute_error', 'max_depth': 15, 'min_weight_fraction_leaf': 0.0, 'max_leaf_nodes': 300, 'bootstrap': False, 'ccp_alpha': 0.005}. Best is trial 4065 with value: 0.057524275121161005.
[I 2025-04-16 02:10:55,030] Trial 4110 finished with value: -0.1936417107583833 and parameters: {'n_estimators': 287, 'min_samples_split': 9, 'max_features': 0.74, 'min_samples_leaf': 1, 'criterion': 'absolute_error', 'max_depth': 10, 'min_weight_fraction_leaf': 0.07, 'max_leaf_nodes': 300, 'bootstrap': False, 'ccp_alpha': 0.014}. Best is trial 4065 with value: 0.057524275121161005.
[I 2025-04-16 02:10:55,994] Trial 4111 finished with value: -11.449445628041794 and parameters: {'n_estimators': 510, 'min_samples_split': 2, 'max_features': 0.8300000000000001, 'min_samples_leaf': 4, 'criterion': 'absolute_error', 'max_depth': 15, 'min_weight_fraction_leaf': 0.04, 'max_leaf_nodes': 300, 'bootstrap': False, 'ccp_alpha': 0.0}. Best is trial 4065 with value: 0.057524275121161005.
[I 2025-04-16 02:10:56,705] Trial 4112 finished with value: -0.1936417107583833 and parameters: {'n_estimators': 180, 'min_samples_split': 5, 'max_features': 0.76, 'min_samples_leaf': 3, 'criterion': 'absolute_error', 'max_depth': 15, 'min_weight_fraction_leaf': 0.0, 'max_leaf_nodes': 300, 'bootstrap': False, 'ccp_alpha': 0.01}. Best is trial 4065 with value: 0.057524275121161005.
[I 2025-04-16 02:10:57,940] Trial 4113 finished with value: -0.1936417107583833 and parameters: {'n_estimators': 770, 'min_samples_split': 11, 'max_features': 0.8, 'min_samples_leaf': 5, 'criterion': 'absolute_error', 'max_depth': 15, 'min_weight_fraction_leaf': 0.0, 'max_leaf_nodes': 300, 'bootstrap': False, 'ccp_alpha': 0.021}. Best is trial 4065 with value: 0.057524275121161005.
[I 2025-04-16 02:10:58,476] Trial 4114 finished with value: -0.1936417107583833 and parameters: {'n_estimators': 1, 'min_samples_split': 6, 'max_features': 0.7000000000000001, 'min_samples_leaf': 1, 'criterion': 'absolute_error', 'max_depth': 15, 'min_weight_fraction_leaf': 0.0, 'max_leaf_nodes': None, 'bootstrap': False, 'ccp_alpha': 0.005}. Best is trial 4065 with value: 0.057524275121161005.
[I 2025-04-16 02:10:59,373] Trial 4115 finished with value: -17.528986382274876 and parameters: {'n_estimators': 437, 'min_samples_split': 2, 'max_features': 0.72, 'min_samples_leaf': 3, 'criterion': 'squared_error', 'max_depth': 15, 'min_weight_fraction_leaf': 0.0, 'max_leaf_nodes': 300, 'bootstrap': False, 'ccp_alpha': 0.015}. Best is trial 4065 with value: 0.057524275121161005.
[I 2025-04-16 02:11:00,432] Trial 4116 finished with value: -0.1936417107583833 and parameters: {'n_estimators': 598, 'min_samples_split': 9, 'max_features': 0.74, 'min_samples_leaf': 1, 'criterion': 'absolute_error', 'max_depth': 15, 'min_weight_fraction_leaf': 0.0, 'max_leaf_nodes': 300, 'bootstrap': False, 'ccp_alpha': 0.009000000000000001}. Best is trial 4065 with value: 0.057524275121161005.
[I 2025-04-16 02:11:01,756] Trial 4117 finished with value: -0.1936417107583833 and parameters: {'n_estimators': 969, 'min_samples_split': 6, 'max_features': 0.79, 'min_samples_leaf': 5, 'criterion': 'absolute_error', 'max_depth': 15, 'min_weight_fraction_leaf': 0.0, 'max_leaf_nodes': 300, 'bootstrap': False, 'ccp_alpha': 0.03}. Best is trial 4065 with value: 0.057524275121161005.
[I 2025-04-16 02:11:07,227] Trial 4118 finished with value: -0.03293851564444568 and parameters: {'n_estimators': 5880, 'min_samples_split': 2, 'max_features': 0.67, 'min_samples_leaf': 3, 'criterion': 'absolute_error', 'max_depth': 15, 'min_weight_fraction_leaf': 0.0, 'max_leaf_nodes': 300, 'bootstrap': False, 'ccp_alpha': 0.005}. Best is trial 4065 with value: 0.057524275121161005.
[I 2025-04-16 02:11:08,019] Trial 4119 finished with value: -17.063488368060376 and parameters: {'n_estimators': 289, 'min_samples_split': 9, 'max_features': 0.59, 'min_samples_leaf': 1, 'criterion': 'absolute_error', 'max_depth': 15, 'min_weight_fraction_leaf': 0.0, 'max_leaf_nodes': 300, 'bootstrap': False, 'ccp_alpha': 0.0}. Best is trial 4065 with value: 0.057524275121161005.
[I 2025-04-16 02:11:09,202] Trial 4120 finished with value: -0.1936417107583833 and parameters: {'n_estimators': 723, 'min_samples_split': 5, 'max_features': 0.8300000000000001, 'min_samples_leaf': 5, 'criterion': 'absolute_error', 'max_depth': 15, 'min_weight_fraction_leaf': 0.0, 'max_leaf_nodes': 300, 'bootstrap': False, 'ccp_alpha': 0.012}. Best is trial 4065 with value: 0.057524275121161005.
[I 2025-04-16 02:11:10,137] Trial 4121 finished with value: -0.1936417107583833 and parameters: {'n_estimators': 462, 'min_samples_split': 11, 'max_features': 0.77, 'min_samples_leaf': 3, 'criterion': 'absolute_error', 'max_depth': 15, 'min_weight_fraction_leaf': 0.0, 'max_leaf_nodes': 300, 'bootstrap': False, 'ccp_alpha': 0.016}. Best is trial 4065 with value: 0.057524275121161005.
[I 2025-04-16 02:11:11,700] Trial 4122 finished with value: -13.173268130080766 and parameters: {'n_estimators': 1121, 'min_samples_split': 2, 'max_features': 0.72, 'min_samples_leaf': 1, 'criterion': 'poisson', 'max_depth': 15, 'min_weight_fraction_leaf': 0.0, 'max_leaf_nodes': 300, 'bootstrap': False, 'ccp_alpha': 0.005}. Best is trial 4065 with value: 0.057524275121161005.
[I 2025-04-16 02:11:12,434] Trial 4123 finished with value: -0.1936417107583833 and parameters: {'n_estimators': 236, 'min_samples_split': 6, 'max_features': 0.75, 'min_samples_leaf': 3, 'criterion': 'absolute_error', 'max_depth': 15, 'min_weight_fraction_leaf': 0.0, 'max_leaf_nodes': 300, 'bootstrap': False, 'ccp_alpha': 0.023}. Best is trial 4065 with value: 0.057524275121161005.
[I 2025-04-16 02:11:18,919] Trial 4124 finished with value: -0.1936417107583833 and parameters: {'n_estimators': 8453, 'min_samples_split': 11, 'max_features': 0.81, 'min_samples_leaf': 42, 'criterion': 'absolute_error', 'max_depth': 15, 'min_weight_fraction_leaf': 0.0, 'max_leaf_nodes': 300, 'bootstrap': False, 'ccp_alpha': 0.0}. Best is trial 4065 with value: 0.057524275121161005.
