[I 2025-04-16 00:46:41,985] Trial 1821 finished with value: -10.682827093963041 and parameters: {'n_estimators': 4146, 'min_samples_split': 18, 'max_features': 1.0, 'min_samples_leaf': 9, 'criterion': 'absolute_error', 'max_depth': 60, 'min_weight_fraction_leaf': 0.01, 'max_leaf_nodes': 150, 'bootstrap': False, 'ccp_alpha': 0.0}. Best is trial 1791 with value: -0.15292978335836843.
[I 2025-04-16 00:46:45,274] Trial 1822 finished with value: -0.1936417107583833 and parameters: {'n_estimators': 3906, 'min_samples_split': 13, 'max_features': 0.9400000000000001, 'min_samples_leaf': 15, 'criterion': 'absolute_error', 'max_depth': 60, 'min_weight_fraction_leaf': 0.01, 'max_leaf_nodes': 150, 'bootstrap': False, 'ccp_alpha': 0.011}. Best is trial 1791 with value: -0.15292978335836843.
[I 2025-04-16 00:46:49,041] Trial 1823 finished with value: -0.1936417107583833 and parameters: {'n_estimators': 4370, 'min_samples_split': 9, 'max_features': 0.9600000000000001, 'min_samples_leaf': 13, 'criterion': 'absolute_error', 'max_depth': 60, 'min_weight_fraction_leaf': 0.01, 'max_leaf_nodes': 150, 'bootstrap': False, 'ccp_alpha': 0.006}. Best is trial 1791 with value: -0.15292978335836843.
[I 2025-04-16 00:46:52,633] Trial 1824 finished with value: -0.19364227140485007 and parameters: {'n_estimators': 4119, 'min_samples_split': 20, 'max_features': 0.9400000000000001, 'min_samples_leaf': 18, 'criterion': 'absolute_error', 'max_depth': 60, 'min_weight_fraction_leaf': 0.01, 'max_leaf_nodes': 150, 'bootstrap': False, 'ccp_alpha': 0.0}. Best is trial 1791 with value: -0.15292978335836843.
[I 2025-04-16 00:46:56,153] Trial 1825 finished with value: -0.1936417107583833 and parameters: {'n_estimators': 3782, 'min_samples_split': 27, 'max_features': 0.98, 'min_samples_leaf': 12, 'criterion': 'absolute_error', 'max_depth': 60, 'min_weight_fraction_leaf': 0.0, 'max_leaf_nodes': 150, 'bootstrap': False, 'ccp_alpha': 0.014}. Best is trial 1791 with value: -0.15292978335836843.
[I 2025-04-16 00:47:00,365] Trial 1826 finished with value: -0.1936417107583833 and parameters: {'n_estimators': 4515, 'min_samples_split': 14, 'max_features': 0.9600000000000001, 'min_samples_leaf': 16, 'criterion': 'absolute_error', 'max_depth': 60, 'min_weight_fraction_leaf': 0.01, 'max_leaf_nodes': 150, 'bootstrap': False, 'ccp_alpha': 0.005}. Best is trial 1791 with value: -0.15292978335836843.
[I 2025-04-16 00:47:03,858] Trial 1827 finished with value: -0.1936417107583833 and parameters: {'n_estimators': 4237, 'min_samples_split': 5, 'max_features': 0.93, 'min_samples_leaf': 9, 'criterion': 'absolute_error', 'max_depth': 60, 'min_weight_fraction_leaf': 0.08, 'max_leaf_nodes': 150, 'bootstrap': False, 'ccp_alpha': 0.01}. Best is trial 1791 with value: -0.15292978335836843.
[I 2025-04-16 00:47:07,099] Trial 1828 finished with value: -0.15292978335836716 and parameters: {'n_estimators': 3965, 'min_samples_split': 23, 'max_features': 1.0, 'min_samples_leaf': 13, 'criterion': 'absolute_error', 'max_depth': 60, 'min_weight_fraction_leaf': 0.01, 'max_leaf_nodes': 150, 'bootstrap': False, 'ccp_alpha': 0.0}. Best is trial 1828 with value: -0.15292978335836716.
[I 2025-04-16 00:47:10,401] Trial 1829 finished with value: -0.1936417107583833 and parameters: {'n_estimators': 4029, 'min_samples_split': 24, 'max_features': 1.0, 'min_samples_leaf': 11, 'criterion': 'absolute_error', 'max_depth': 60, 'min_weight_fraction_leaf': 0.01, 'max_leaf_nodes': 300, 'bootstrap': False, 'ccp_alpha': 0.021}. Best is trial 1828 with value: -0.15292978335836716.
[I 2025-04-16 00:47:14,301] Trial 1830 finished with value: -17.52898638227338 and parameters: {'n_estimators': 4393, 'min_samples_split': 29, 'max_features': 1.0, 'min_samples_leaf': 15, 'criterion': 'friedman_mse', 'max_depth': 60, 'min_weight_fraction_leaf': 0.01, 'max_leaf_nodes': 150, 'bootstrap': False, 'ccp_alpha': 0.005}. Best is trial 1828 with value: -0.15292978335836716.
[I 2025-04-16 00:47:18,179] Trial 1831 finished with value: -0.1936417107583833 and parameters: {'n_estimators': 4761, 'min_samples_split': 27, 'max_features': 1.0, 'min_samples_leaf': 17, 'criterion': 'absolute_error', 'max_depth': 60, 'min_weight_fraction_leaf': 0.01, 'max_leaf_nodes': 150, 'bootstrap': False, 'ccp_alpha': 0.015}. Best is trial 1828 with value: -0.15292978335836716.
[I 2025-04-16 00:47:21,890] Trial 1832 finished with value: -0.1936417107583833 and parameters: {'n_estimators': 4200, 'min_samples_split': 24, 'max_features': 0.98, 'min_samples_leaf': 13, 'criterion': 'absolute_error', 'max_depth': 60, 'min_weight_fraction_leaf': 0.01, 'max_leaf_nodes': 150, 'bootstrap': False, 'ccp_alpha': 0.009000000000000001}. Best is trial 1828 with value: -0.15292978335836716.
[I 2025-04-16 00:47:25,273] Trial 1833 finished with value: -0.1936417107583833 and parameters: {'n_estimators': 3986, 'min_samples_split': 24, 'max_features': 1.0, 'min_samples_leaf': 11, 'criterion': 'absolute_error', 'max_depth': 60, 'min_weight_fraction_leaf': 0.01, 'max_leaf_nodes': 150, 'bootstrap': False, 'ccp_alpha': 0.005}. Best is trial 1828 with value: -0.15292978335836716.
[I 2025-04-16 00:47:28,815] Trial 1834 finished with value: -0.1936250029440146 and parameters: {'n_estimators': 4492, 'min_samples_split': 28, 'max_features': 0.98, 'min_samples_leaf': 15, 'criterion': 'absolute_error', 'max_depth': 60, 'min_weight_fraction_leaf': 0.01, 'max_leaf_nodes': 150, 'bootstrap': False, 'ccp_alpha': 0.0}. Best is trial 1828 with value: -0.15292978335836716.
[I 2025-04-16 00:47:32,526] Trial 1835 finished with value: -0.1936417107583833 and parameters: {'n_estimators': 4247, 'min_samples_split': 21, 'max_features': 0.9600000000000001, 'min_samples_leaf': 9, 'criterion': 'absolute_error', 'max_depth': 60, 'min_weight_fraction_leaf': 0.01, 'max_leaf_nodes': 150, 'bootstrap': False, 'ccp_alpha': 0.01}. Best is trial 1828 with value: -0.15292978335836716.
[I 2025-04-16 00:47:36,040] Trial 1836 finished with value: -0.15900281148199427 and parameters: {'n_estimators': 4065, 'min_samples_split': 21, 'max_features': 0.9500000000000001, 'min_samples_leaf': 13, 'criterion': 'absolute_error', 'max_depth': 60, 'min_weight_fraction_leaf': 0.0, 'max_leaf_nodes': 150, 'bootstrap': False, 'ccp_alpha': 0.0}. Best is trial 1828 with value: -0.15292978335836716.
[I 2025-04-16 00:47:39,290] Trial 1837 finished with value: -0.1936417107583833 and parameters: {'n_estimators': 3919, 'min_samples_split': 28, 'max_features': 0.92, 'min_samples_leaf': 11, 'criterion': 'absolute_error', 'max_depth': 10, 'min_weight_fraction_leaf': 0.0, 'max_leaf_nodes': 150, 'bootstrap': False, 'ccp_alpha': 0.006}. Best is trial 1828 with value: -0.15292978335836716.
[I 2025-04-16 00:47:42,427] Trial 1838 finished with value: -17.528986382274397 and parameters: {'n_estimators': 3861, 'min_samples_split': 25, 'max_features': 0.98, 'min_samples_leaf': 19, 'criterion': 'squared_error', 'max_depth': 60, 'min_weight_fraction_leaf': 0.0, 'max_leaf_nodes': 150, 'bootstrap': False, 'ccp_alpha': 0.016}. Best is trial 1828 with value: -0.15292978335836716.
[I 2025-04-16 00:47:46,050] Trial 1839 finished with value: -0.1936417107583833 and parameters: {'n_estimators': 4031, 'min_samples_split': 22, 'max_features': 1.0, 'min_samples_leaf': 15, 'criterion': 'absolute_error', 'max_depth': 60, 'min_weight_fraction_leaf': 0.0, 'max_leaf_nodes': 150, 'bootstrap': False, 'ccp_alpha': 0.005}. Best is trial 1828 with value: -0.15292978335836716.
[I 2025-04-16 00:47:48,903] Trial 1840 finished with value: -0.1591304866239711 and parameters: {'n_estimators': 3643, 'min_samples_split': 19, 'max_features': 0.9400000000000001, 'min_samples_leaf': 13, 'criterion': 'absolute_error', 'max_depth': 60, 'min_weight_fraction_leaf': 0.0, 'max_leaf_nodes': 150, 'bootstrap': False, 'ccp_alpha': 0.0}. Best is trial 1828 with value: -0.15292978335836716.
[I 2025-04-16 00:47:52,354] Trial 1841 finished with value: -0.1936417107583833 and parameters: {'n_estimators': 4042, 'min_samples_split': 18, 'max_features': 0.97, 'min_samples_leaf': 17, 'criterion': 'absolute_error', 'max_depth': 60, 'min_weight_fraction_leaf': 0.0, 'max_leaf_nodes': 150, 'bootstrap': False, 'ccp_alpha': 0.01}. Best is trial 1828 with value: -0.15292978335836716.
[I 2025-04-16 00:47:55,499] Trial 1842 finished with value: -8.786798951154841 and parameters: {'n_estimators': 3802, 'min_samples_split': 28, 'max_features': 0.9600000000000001, 'min_samples_leaf': 9, 'criterion': 'absolute_error', 'max_depth': 60, 'min_weight_fraction_leaf': 0.0, 'max_leaf_nodes': 20, 'bootstrap': False, 'ccp_alpha': 0.0}. Best is trial 1828 with value: -0.15292978335836716.
[I 2025-04-16 00:47:59,390] Trial 1843 finished with value: -0.1936417107583833 and parameters: {'n_estimators': 4113, 'min_samples_split': 23, 'max_features': 0.93, 'min_samples_leaf': 14, 'criterion': 'absolute_error', 'max_depth': 60, 'min_weight_fraction_leaf': 0.0, 'max_leaf_nodes': 150, 'bootstrap': False, 'ccp_alpha': 0.02}. Best is trial 1828 with value: -0.15292978335836716.
[I 2025-04-16 00:48:02,857] Trial 1844 finished with value: -32.85486168027537 and parameters: {'n_estimators': 3860, 'min_samples_split': 18, 'max_features': 0.98, 'min_samples_leaf': 11, 'criterion': 'poisson', 'max_depth': 60, 'min_weight_fraction_leaf': 0.0, 'max_leaf_nodes': 150, 'bootstrap': False, 'ccp_alpha': 0.01}. Best is trial 1828 with value: -0.15292978335836716.
[I 2025-04-16 00:48:06,072] Trial 1845 finished with value: -0.1936417107583833 and parameters: {'n_estimators': 3610, 'min_samples_split': 22, 'max_features': 0.91, 'min_samples_leaf': 16, 'criterion': 'absolute_error', 'max_depth': 60, 'min_weight_fraction_leaf': 0.0, 'max_leaf_nodes': 150, 'bootstrap': False, 'ccp_alpha': 0.006}. Best is trial 1828 with value: -0.15292978335836716.
[I 2025-04-16 00:48:10,138] Trial 1846 finished with value: -0.1936417107583833 and parameters: {'n_estimators': 4155, 'min_samples_split': 16, 'max_features': 0.9500000000000001, 'min_samples_leaf': 12, 'criterion': 'absolute_error', 'max_depth': 60, 'min_weight_fraction_leaf': 0.0, 'max_leaf_nodes': 150, 'bootstrap': False, 'ccp_alpha': 0.014}. Best is trial 1828 with value: -0.15292978335836716.
[I 2025-04-16 00:48:13,264] Trial 1847 finished with value: -0.19361993307670033 and parameters: {'n_estimators': 3908, 'min_samples_split': 10, 'max_features': 1.0, 'min_samples_leaf': 14, 'criterion': 'absolute_error', 'max_depth': 60, 'min_weight_fraction_leaf': 0.0, 'max_leaf_nodes': 150, 'bootstrap': False, 'ccp_alpha': 0.0}. Best is trial 1828 with value: -0.15292978335836716.
[I 2025-04-16 00:48:17,217] Trial 1848 finished with value: -0.1936417107583833 and parameters: {'n_estimators': 4028, 'min_samples_split': 17, 'max_features': 0.9600000000000001, 'min_samples_leaf': 9, 'criterion': 'absolute_error', 'max_depth': 60, 'min_weight_fraction_leaf': 0.0, 'max_leaf_nodes': 150, 'bootstrap': False, 'ccp_alpha': 0.006}. Best is trial 1828 with value: -0.15292978335836716.
[I 2025-04-16 00:48:20,531] Trial 1849 finished with value: -0.1936417107583833 and parameters: {'n_estimators': 3758, 'min_samples_split': 25, 'max_features': 0.93, 'min_samples_leaf': 18, 'criterion': 'absolute_error', 'max_depth': 60, 'min_weight_fraction_leaf': 0.0, 'max_leaf_nodes': 150, 'bootstrap': False, 'ccp_alpha': 0.005}. Best is trial 1828 with value: -0.15292978335836716.
[I 2025-04-16 00:48:24,617] Trial 1850 finished with value: -0.1936417107583833 and parameters: {'n_estimators': 4239, 'min_samples_split': 12, 'max_features': 0.98, 'min_samples_leaf': 12, 'criterion': 'absolute_error', 'max_depth': 60, 'min_weight_fraction_leaf': 0.0, 'max_leaf_nodes': 150, 'bootstrap': False, 'ccp_alpha': 0.014}. Best is trial 1828 with value: -0.15292978335836716.
[I 2025-04-16 00:48:27,627] Trial 1851 finished with value: -0.19362491869806786 and parameters: {'n_estimators': 3933, 'min_samples_split': 20, 'max_features': 0.9500000000000001, 'min_samples_leaf': 15, 'criterion': 'absolute_error', 'max_depth': 60, 'min_weight_fraction_leaf': 0.0, 'max_leaf_nodes': 300, 'bootstrap': False, 'ccp_alpha': 0.0}. Best is trial 1828 with value: -0.15292978335836716.
[I 2025-04-16 00:48:31,268] Trial 1852 finished with value: -0.1936417107583833 and parameters: {'n_estimators': 3638, 'min_samples_split': 15, 'max_features': 0.91, 'min_samples_leaf': 10, 'criterion': 'absolute_error', 'max_depth': 60, 'min_weight_fraction_leaf': 0.0, 'max_leaf_nodes': 150, 'bootstrap': False, 'ccp_alpha': 0.01}. Best is trial 1828 with value: -0.15292978335836716.
[I 2025-04-16 00:48:34,822] Trial 1853 finished with value: -17.528986382273448 and parameters: {'n_estimators': 4353, 'min_samples_split': 5, 'max_features': 0.9400000000000001, 'min_samples_leaf': 14, 'criterion': 'friedman_mse', 'max_depth': 60, 'min_weight_fraction_leaf': 0.0, 'max_leaf_nodes': 150, 'bootstrap': False, 'ccp_alpha': 0.005}. Best is trial 1828 with value: -0.15292978335836716.
[I 2025-04-16 00:48:38,670] Trial 1854 finished with value: -0.1936417107583833 and parameters: {'n_estimators': 4116, 'min_samples_split': 22, 'max_features': 0.97, 'min_samples_leaf': 12, 'criterion': 'absolute_error', 'max_depth': 60, 'min_weight_fraction_leaf': 0.0, 'max_leaf_nodes': 150, 'bootstrap': False, 'ccp_alpha': 0.02}. Best is trial 1828 with value: -0.15292978335836716.
[I 2025-04-16 00:48:41,778] Trial 1855 finished with value: -0.1936422348689461 and parameters: {'n_estimators': 3793, 'min_samples_split': 10, 'max_features': 1.0, 'min_samples_leaf': 17, 'criterion': 'absolute_error', 'max_depth': 60, 'min_weight_fraction_leaf': 0.0, 'max_leaf_nodes': 150, 'bootstrap': False, 'ccp_alpha': 0.0}. Best is trial 1828 with value: -0.15292978335836716.
[I 2025-04-16 00:48:45,855] Trial 1856 finished with value: -0.1936417107583833 and parameters: {'n_estimators': 4492, 'min_samples_split': 28, 'max_features': 0.93, 'min_samples_leaf': 13, 'criterion': 'absolute_error', 'max_depth': 60, 'min_weight_fraction_leaf': 0.0, 'max_leaf_nodes': 150, 'bootstrap': False, 'ccp_alpha': 0.009000000000000001}. Best is trial 1828 with value: -0.15292978335836716.
[I 2025-04-16 00:48:49,517] Trial 1857 finished with value: -0.1936417107583833 and parameters: {'n_estimators': 4032, 'min_samples_split': 18, 'max_features': 0.9600000000000001, 'min_samples_leaf': 10, 'criterion': 'absolute_error', 'max_depth': 60, 'min_weight_fraction_leaf': 0.0, 'max_leaf_nodes': 150, 'bootstrap': False, 'ccp_alpha': 0.006}. Best is trial 1828 with value: -0.15292978335836716.
[I 2025-04-16 00:48:53,132] Trial 1858 finished with value: -0.1936417107583833 and parameters: {'n_estimators': 4219, 'min_samples_split': 14, 'max_features': 0.98, 'min_samples_leaf': 16, 'criterion': 'absolute_error', 'max_depth': 60, 'min_weight_fraction_leaf': 0.0, 'max_leaf_nodes': 150, 'bootstrap': False, 'ccp_alpha': 0.015}. Best is trial 1828 with value: -0.15292978335836716.
[I 2025-04-16 00:48:56,231] Trial 1859 finished with value: -8.730335121498877 and parameters: {'n_estimators': 3570, 'min_samples_split': 8, 'max_features': 0.91, 'min_samples_leaf': 11, 'criterion': 'absolute_error', 'max_depth': 60, 'min_weight_fraction_leaf': 0.01, 'max_leaf_nodes': 150, 'bootstrap': False, 'ccp_alpha': 0.0}. Best is trial 1828 with value: -0.15292978335836716.
[I 2025-04-16 00:48:59,899] Trial 1860 finished with value: -0.1936417107583833 and parameters: {'n_estimators': 3864, 'min_samples_split': 2, 'max_features': 0.9500000000000001, 'min_samples_leaf': 19, 'criterion': 'absolute_error', 'max_depth': 60, 'min_weight_fraction_leaf': 0.01, 'max_leaf_nodes': 150, 'bootstrap': False, 'ccp_alpha': 0.01}. Best is trial 1828 with value: -0.15292978335836716.
[I 2025-04-16 00:49:03,474] Trial 1861 finished with value: -0.1936417107583833 and parameters: {'n_estimators': 4324, 'min_samples_split': 23, 'max_features': 0.98, 'min_samples_leaf': 14, 'criterion': 'absolute_error', 'max_depth': 10, 'min_weight_fraction_leaf': 0.01, 'max_leaf_nodes': 150, 'bootstrap': False, 'ccp_alpha': 0.005}. Best is trial 1828 with value: -0.15292978335836716.
[I 2025-04-16 00:49:06,578] Trial 1862 finished with value: -0.1589875934149326 and parameters: {'n_estimators': 4033, 'min_samples_split': 17, 'max_features': 0.9400000000000001, 'min_samples_leaf': 13, 'criterion': 'absolute_error', 'max_depth': 60, 'min_weight_fraction_leaf': 0.01, 'max_leaf_nodes': 150, 'bootstrap': False, 'ccp_alpha': 0.0}. Best is trial 1828 with value: -0.15292978335836716.
[I 2025-04-16 00:49:11,482] Trial 1863 finished with value: -17.528986382273022 and parameters: {'n_estimators': 4620, 'min_samples_split': 12, 'max_features': 0.9600000000000001, 'min_samples_leaf': 9, 'criterion': 'squared_error', 'max_depth': 60, 'min_weight_fraction_leaf': 0.01, 'max_leaf_nodes': 150, 'bootstrap': False, 'ccp_alpha': 0.015}. Best is trial 1828 with value: -0.15292978335836716.
[I 2025-04-16 00:49:14,890] Trial 1864 finished with value: -0.1936417107583833 and parameters: {'n_estimators': 4180, 'min_samples_split': 12, 'max_features': 1.0, 'min_samples_leaf': 16, 'criterion': 'absolute_error', 'max_depth': 60, 'min_weight_fraction_leaf': 0.0, 'max_leaf_nodes': 150, 'bootstrap': False, 'ccp_alpha': 0.006}. Best is trial 1828 with value: -0.15292978335836716.
[I 2025-04-16 00:49:18,219] Trial 1865 finished with value: -8.786297402372448 and parameters: {'n_estimators': 4419, 'min_samples_split': 16, 'max_features': 0.92, 'min_samples_leaf': 12, 'criterion': 'absolute_error', 'max_depth': 60, 'min_weight_fraction_leaf': 0.01, 'max_leaf_nodes': 150, 'bootstrap': False, 'ccp_alpha': 0.0}. Best is trial 1828 with value: -0.15292978335836716.
[I 2025-04-16 00:49:21,606] Trial 1866 finished with value: -0.1936417107583833 and parameters: {'n_estimators': 4061, 'min_samples_split': 8, 'max_features': 0.98, 'min_samples_leaf': 15, 'criterion': 'absolute_error', 'max_depth': 60, 'min_weight_fraction_leaf': 0.01, 'max_leaf_nodes': 150, 'bootstrap': False, 'ccp_alpha': 0.009000000000000001}. Best is trial 1828 with value: -0.15292978335836716.
[I 2025-04-16 00:49:25,191] Trial 1867 finished with value: -0.1936417107583833 and parameters: {'n_estimators': 4305, 'min_samples_split': 15, 'max_features': 0.9400000000000001, 'min_samples_leaf': 11, 'criterion': 'absolute_error', 'max_depth': 60, 'min_weight_fraction_leaf': 0.01, 'max_leaf_nodes': 20, 'bootstrap': False, 'ccp_alpha': 0.005}. Best is trial 1828 with value: -0.15292978335836716.
[I 2025-04-16 00:49:28,387] Trial 1868 finished with value: -0.1936417107583833 and parameters: {'n_estimators': 4032, 'min_samples_split': 5, 'max_features': 0.9600000000000001, 'min_samples_leaf': 13, 'criterion': 'absolute_error', 'max_depth': 60, 'min_weight_fraction_leaf': 0.01, 'max_leaf_nodes': 150, 'bootstrap': False, 'ccp_alpha': 0.014}. Best is trial 1828 with value: -0.15292978335836716.
[I 2025-04-16 00:49:31,955] Trial 1869 finished with value: -37.833600777586184 and parameters: {'n_estimators': 4713, 'min_samples_split': 11, 'max_features': 0.93, 'min_samples_leaf': 9, 'criterion': 'poisson', 'max_depth': 60, 'min_weight_fraction_leaf': 0.01, 'max_leaf_nodes': 150, 'bootstrap': False, 'ccp_alpha': 0.0}. Best is trial 1828 with value: -0.15292978335836716.
[I 2025-04-16 00:49:35,643] Trial 1870 finished with value: -0.1936417107583833 and parameters: {'n_estimators': 4502, 'min_samples_split': 17, 'max_features': 0.98, 'min_samples_leaf': 17, 'criterion': 'absolute_error', 'max_depth': 60, 'min_weight_fraction_leaf': 0.01, 'max_leaf_nodes': 150, 'bootstrap': False, 'ccp_alpha': 0.02}. Best is trial 1828 with value: -0.15292978335836716.
[I 2025-04-16 00:49:39,087] Trial 1871 finished with value: -0.1936417107583833 and parameters: {'n_estimators': 4177, 'min_samples_split': 9, 'max_features': 0.91, 'min_samples_leaf': 93, 'criterion': 'absolute_error', 'max_depth': 60, 'min_weight_fraction_leaf': 0.0, 'max_leaf_nodes': 150, 'bootstrap': False, 'ccp_alpha': 0.01}. Best is trial 1828 with value: -0.15292978335836716.
[I 2025-04-16 00:49:42,683] Trial 1872 finished with value: -0.1936417107583833 and parameters: {'n_estimators': 3984, 'min_samples_split': 19, 'max_features': 0.9600000000000001, 'min_samples_leaf': 15, 'criterion': 'absolute_error', 'max_depth': 60, 'min_weight_fraction_leaf': 0.01, 'max_leaf_nodes': 150, 'bootstrap': False, 'ccp_alpha': 0.006}. Best is trial 1828 with value: -0.15292978335836716.
[I 2025-04-16 00:49:46,757] Trial 1873 finished with value: -10.69855545231934 and parameters: {'n_estimators': 4362, 'min_samples_split': 14, 'max_features': 1.0, 'min_samples_leaf': 11, 'criterion': 'absolute_error', 'max_depth': 60, 'min_weight_fraction_leaf': 0.01, 'max_leaf_nodes': 150, 'bootstrap': False, 'ccp_alpha': 0.0}. Best is trial 1828 with value: -0.15292978335836716.
[I 2025-04-16 00:49:50,455] Trial 1874 finished with value: -0.1936417107583833 and parameters: {'n_estimators': 4210, 'min_samples_split': 12, 'max_features': 0.9400000000000001, 'min_samples_leaf': 13, 'criterion': 'absolute_error', 'max_depth': 60, 'min_weight_fraction_leaf': 0.01, 'max_leaf_nodes': 150, 'bootstrap': False, 'ccp_alpha': 0.006}. Best is trial 1828 with value: -0.15292978335836716.
[I 2025-04-16 00:49:53,998] Trial 1875 finished with value: -0.1936417107583833 and parameters: {'n_estimators': 3918, 'min_samples_split': 20, 'max_features': 0.9600000000000001, 'min_samples_leaf': 14, 'criterion': 'absolute_error', 'max_depth': 60, 'min_weight_fraction_leaf': 0.01, 'max_leaf_nodes': 150, 'bootstrap': False, 'ccp_alpha': 0.01}. Best is trial 1828 with value: -0.15292978335836716.
