[I 2025-04-15 23:26:46,002] Trial 374 finished with value: -0.18258988185673486 and parameters: {'n_estimators': 3028, 'min_samples_split': 168, 'max_features': 0.87, 'min_samples_leaf': 42, 'criterion': 'absolute_error', 'max_depth': 45, 'min_weight_fraction_leaf': 0.02, 'max_leaf_nodes': 10, 'bootstrap': True, 'ccp_alpha': 0.114, 'max_samples': 0.5}. Best is trial 74 with value: -0.18167313469617832.
[I 2025-04-15 23:26:49,470] Trial 375 finished with value: -0.19330958332295461 and parameters: {'n_estimators': 3227, 'min_samples_split': 173, 'max_features': 0.89, 'min_samples_leaf': 57, 'criterion': 'absolute_error', 'max_depth': 45, 'min_weight_fraction_leaf': 0.01, 'max_leaf_nodes': 100, 'bootstrap': True, 'ccp_alpha': 0.101, 'max_samples': 1.0}. Best is trial 74 with value: -0.18167313469617832.
[I 2025-04-15 23:26:53,933] Trial 376 finished with value: -0.18325707584347026 and parameters: {'n_estimators': 3484, 'min_samples_split': 127, 'max_features': 0.9500000000000001, 'min_samples_leaf': 24, 'criterion': 'absolute_error', 'max_depth': 15, 'min_weight_fraction_leaf': 0.0, 'max_leaf_nodes': 100, 'bootstrap': True, 'ccp_alpha': 0.113, 'max_samples': 0.5}. Best is trial 74 with value: -0.18167313469617832.
[I 2025-04-15 23:26:56,879] Trial 377 finished with value: -18.166427479696242 and parameters: {'n_estimators': 2900, 'min_samples_split': 169, 'max_features': 0.19, 'min_samples_leaf': 28, 'criterion': 'friedman_mse', 'max_depth': 60, 'min_weight_fraction_leaf': 0.1, 'max_leaf_nodes': None, 'bootstrap': True, 'ccp_alpha': 0.106, 'max_samples': 0.75}. Best is trial 74 with value: -0.18167313469617832.
[I 2025-04-15 23:27:00,204] Trial 378 finished with value: -0.18266193504587788 and parameters: {'n_estimators': 3144, 'min_samples_split': 176, 'max_features': 0.85, 'min_samples_leaf': 30, 'criterion': 'absolute_error', 'max_depth': 10, 'min_weight_fraction_leaf': 0.02, 'max_leaf_nodes': 100, 'bootstrap': True, 'ccp_alpha': 0.092, 'max_samples': 0.5}. Best is trial 74 with value: -0.18167313469617832.
[I 2025-04-15 23:27:03,078] Trial 379 finished with value: -0.18278851456431428 and parameters: {'n_estimators': 2787, 'min_samples_split': 181, 'max_features': 0.66, 'min_samples_leaf': 22, 'criterion': 'absolute_error', 'max_depth': 45, 'min_weight_fraction_leaf': 0.02, 'max_leaf_nodes': 100, 'bootstrap': True, 'ccp_alpha': 0.099, 'max_samples': 0.5}. Best is trial 74 with value: -0.18167313469617832.
[I 2025-04-15 23:27:05,380] Trial 380 finished with value: -0.1851663177121655 and parameters: {'n_estimators': 2125, 'min_samples_split': 166, 'max_features': 1.0, 'min_samples_leaf': 63, 'criterion': 'absolute_error', 'max_depth': 5, 'min_weight_fraction_leaf': 0.02, 'max_leaf_nodes': 150, 'bootstrap': True, 'ccp_alpha': 0.116, 'max_samples': 0.5}. Best is trial 74 with value: -0.18167313469617832.
[I 2025-04-15 23:27:09,381] Trial 381 finished with value: -0.18287492475144967 and parameters: {'n_estimators': 3864, 'min_samples_split': 107, 'max_features': 0.92, 'min_samples_leaf': 27, 'criterion': 'absolute_error', 'max_depth': 45, 'min_weight_fraction_leaf': 0.01, 'max_leaf_nodes': 100, 'bootstrap': True, 'ccp_alpha': 0.13, 'max_samples': 0.5}. Best is trial 74 with value: -0.18167313469617832.
[I 2025-04-15 23:27:13,050] Trial 382 finished with value: -0.18303810475415788 and parameters: {'n_estimators': 3397, 'min_samples_split': 162, 'max_features': 0.87, 'min_samples_leaf': 49, 'criterion': 'absolute_error', 'max_depth': 45, 'min_weight_fraction_leaf': 0.02, 'max_leaf_nodes': 100, 'bootstrap': True, 'ccp_alpha': 0.109, 'max_samples': 0.5}. Best is trial 74 with value: -0.18167313469617832.
[I 2025-04-15 23:27:16,830] Trial 383 finished with value: -0.18258988185673486 and parameters: {'n_estimators': 3028, 'min_samples_split': 189, 'max_features': 0.9, 'min_samples_leaf': 32, 'criterion': 'absolute_error', 'max_depth': 60, 'min_weight_fraction_leaf': 0.02, 'max_leaf_nodes': 100, 'bootstrap': True, 'ccp_alpha': 0.10400000000000001, 'max_samples': 0.5}. Best is trial 74 with value: -0.18167313469617832.
[I 2025-04-15 23:27:19,764] Trial 384 finished with value: -0.18285245593332994 and parameters: {'n_estimators': 2681, 'min_samples_split': 172, 'max_features': 0.85, 'min_samples_leaf': 24, 'criterion': 'absolute_error', 'max_depth': 5, 'min_weight_fraction_leaf': 0.02, 'max_leaf_nodes': 50, 'bootstrap': True, 'ccp_alpha': 0.121, 'max_samples': 0.5}. Best is trial 74 with value: -0.18167313469617832.
[I 2025-04-15 23:27:23,160] Trial 385 finished with value: -0.18266193504587788 and parameters: {'n_estimators': 3144, 'min_samples_split': 184, 'max_features': 0.97, 'min_samples_leaf': 29, 'criterion': 'absolute_error', 'max_depth': 30, 'min_weight_fraction_leaf': 0.02, 'max_leaf_nodes': 10, 'bootstrap': True, 'ccp_alpha': 0.089, 'max_samples': 0.5}. Best is trial 74 with value: -0.18167313469617832.
[I 2025-04-15 23:27:30,733] Trial 386 finished with value: -17.554950807426128 and parameters: {'n_estimators': 7511, 'min_samples_split': 84, 'max_features': 0.6900000000000001, 'min_samples_leaf': 85, 'criterion': 'squared_error', 'max_depth': 30, 'min_weight_fraction_leaf': 0.02, 'max_leaf_nodes': 100, 'bootstrap': True, 'ccp_alpha': 0.096, 'max_samples': 0.5}. Best is trial 74 with value: -0.18167313469617832.
[I 2025-04-15 23:27:34,121] Trial 387 finished with value: -0.1830507845452304 and parameters: {'n_estimators': 2896, 'min_samples_split': 178, 'max_features': 0.88, 'min_samples_leaf': 26, 'criterion': 'absolute_error', 'max_depth': 30, 'min_weight_fraction_leaf': 0.01, 'max_leaf_nodes': 100, 'bootstrap': True, 'ccp_alpha': 0.08, 'max_samples': 0.5}. Best is trial 74 with value: -0.18167313469617832.
[I 2025-04-15 23:27:36,705] Trial 388 finished with value: -0.18389007435322302 and parameters: {'n_estimators': 2422, 'min_samples_split': 169, 'max_features': 0.9400000000000001, 'min_samples_leaf': 65, 'criterion': 'absolute_error', 'max_depth': 30, 'min_weight_fraction_leaf': 0.02, 'max_leaf_nodes': 100, 'bootstrap': True, 'ccp_alpha': 0.112, 'max_samples': 0.5}. Best is trial 74 with value: -0.18167313469617832.
[I 2025-04-15 23:27:40,427] Trial 389 finished with value: -0.1829006135530317 and parameters: {'n_estimators': 3268, 'min_samples_split': 70, 'max_features': 0.91, 'min_samples_leaf': 25, 'criterion': 'absolute_error', 'max_depth': 45, 'min_weight_fraction_leaf': 0.02, 'max_leaf_nodes': 100, 'bootstrap': True, 'ccp_alpha': 0.10200000000000001, 'max_samples': 0.5}. Best is trial 74 with value: -0.18167313469617832.
[I 2025-04-15 23:27:43,356] Trial 390 finished with value: -0.1936417107583833 and parameters: {'n_estimators': 3566, 'min_samples_split': 163, 'max_features': 0.86, 'min_samples_leaf': 19, 'criterion': 'absolute_error', 'max_depth': 30, 'min_weight_fraction_leaf': 0.02, 'max_leaf_nodes': 20, 'bootstrap': False, 'ccp_alpha': 0.091}. Best is trial 74 with value: -0.18167313469617832.
[I 2025-04-15 23:27:46,444] Trial 391 finished with value: -18.07467837567417 and parameters: {'n_estimators': 3035, 'min_samples_split': 176, 'max_features': 0.8200000000000001, 'min_samples_leaf': 30, 'criterion': 'poisson', 'max_depth': 10, 'min_weight_fraction_leaf': 0.0, 'max_leaf_nodes': 100, 'bootstrap': True, 'ccp_alpha': 0.076, 'max_samples': 0.5}. Best is trial 74 with value: -0.18167313469617832.
[I 2025-04-15 23:27:49,238] Trial 392 finished with value: -0.18288668551810328 and parameters: {'n_estimators': 2610, 'min_samples_split': 166, 'max_features': 0.89, 'min_samples_leaf': 22, 'criterion': 'absolute_error', 'max_depth': 30, 'min_weight_fraction_leaf': 0.01, 'max_leaf_nodes': None, 'bootstrap': True, 'ccp_alpha': 0.098, 'max_samples': 0.5}. Best is trial 74 with value: -0.18167313469617832.
[I 2025-04-15 23:27:52,516] Trial 393 finished with value: -0.18292673184234473 and parameters: {'n_estimators': 2854, 'min_samples_split': 174, 'max_features': 0.8400000000000001, 'min_samples_leaf': 28, 'criterion': 'absolute_error', 'max_depth': 15, 'min_weight_fraction_leaf': 0.02, 'max_leaf_nodes': 100, 'bootstrap': True, 'ccp_alpha': 0.108, 'max_samples': 0.5}. Best is trial 74 with value: -0.18167313469617832.
[I 2025-04-15 23:27:56,407] Trial 394 finished with value: -0.1829542121466095 and parameters: {'n_estimators': 3288, 'min_samples_split': 160, 'max_features': 0.92, 'min_samples_leaf': 69, 'criterion': 'absolute_error', 'max_depth': 30, 'min_weight_fraction_leaf': 0.02, 'max_leaf_nodes': 100, 'bootstrap': True, 'ccp_alpha': 0.084, 'max_samples': 0.5}. Best is trial 74 with value: -0.18167313469617832.
[I 2025-04-15 23:27:59,734] Trial 395 finished with value: -0.1933009050239773 and parameters: {'n_estimators': 3144, 'min_samples_split': 171, 'max_features': 0.88, 'min_samples_leaf': 35, 'criterion': 'absolute_error', 'max_depth': 30, 'min_weight_fraction_leaf': 0.02, 'max_leaf_nodes': 10, 'bootstrap': True, 'ccp_alpha': 0.115, 'max_samples': None}. Best is trial 74 with value: -0.18167313469617832.
[I 2025-04-15 23:28:03,525] Trial 396 finished with value: -0.18309683521107276 and parameters: {'n_estimators': 3420, 'min_samples_split': 182, 'max_features': 0.74, 'min_samples_leaf': 55, 'criterion': 'absolute_error', 'max_depth': 20, 'min_weight_fraction_leaf': 0.01, 'max_leaf_nodes': 100, 'bootstrap': True, 'ccp_alpha': 0.123, 'max_samples': 0.5}. Best is trial 74 with value: -0.18167313469617832.
[I 2025-04-15 23:28:06,864] Trial 397 finished with value: -0.18303574451247254 and parameters: {'n_estimators': 2891, 'min_samples_split': 166, 'max_features': 0.86, 'min_samples_leaf': 32, 'criterion': 'absolute_error', 'max_depth': 45, 'min_weight_fraction_leaf': 0.02, 'max_leaf_nodes': 100, 'bootstrap': True, 'ccp_alpha': 0.10400000000000001, 'max_samples': 0.5}. Best is trial 74 with value: -0.18167313469617832.
[I 2025-04-15 23:28:09,396] Trial 398 finished with value: -0.18374897661620732 and parameters: {'n_estimators': 2292, 'min_samples_split': 178, 'max_features': 0.32, 'min_samples_leaf': 27, 'criterion': 'absolute_error', 'max_depth': 30, 'min_weight_fraction_leaf': 0.04, 'max_leaf_nodes': 100, 'bootstrap': True, 'ccp_alpha': 0.08700000000000001, 'max_samples': 0.5}. Best is trial 74 with value: -0.18167313469617832.
[I 2025-04-15 23:28:12,868] Trial 399 finished with value: -0.18270114158971013 and parameters: {'n_estimators': 3066, 'min_samples_split': 159, 'max_features': 0.9500000000000001, 'min_samples_leaf': 38, 'criterion': 'absolute_error', 'max_depth': 30, 'min_weight_fraction_leaf': 0.03, 'max_leaf_nodes': 50, 'bootstrap': True, 'ccp_alpha': 0.065, 'max_samples': 0.5}. Best is trial 74 with value: -0.18167313469617832.
[I 2025-04-15 23:28:15,936] Trial 400 finished with value: -0.19325719643678899 and parameters: {'n_estimators': 2698, 'min_samples_split': 170, 'max_features': 0.9, 'min_samples_leaf': 61, 'criterion': 'absolute_error', 'max_depth': 5, 'min_weight_fraction_leaf': 0.03, 'max_leaf_nodes': 100, 'bootstrap': True, 'ccp_alpha': 0.096, 'max_samples': 1.0}. Best is trial 74 with value: -0.18167313469617832.
[I 2025-04-15 23:28:20,019] Trial 401 finished with value: -17.811113667353883 and parameters: {'n_estimators': 3776, 'min_samples_split': 163, 'max_features': 0.81, 'min_samples_leaf': 24, 'criterion': 'friedman_mse', 'max_depth': 60, 'min_weight_fraction_leaf': 0.02, 'max_leaf_nodes': 100, 'bootstrap': True, 'ccp_alpha': 0.117, 'max_samples': 0.5}. Best is trial 74 with value: -0.18167313469617832.
[I 2025-04-15 23:28:23,849] Trial 402 finished with value: -0.18291674203529107 and parameters: {'n_estimators': 3274, 'min_samples_split': 175, 'max_features': 0.98, 'min_samples_leaf': 30, 'criterion': 'absolute_error', 'max_depth': 30, 'min_weight_fraction_leaf': 0.02, 'max_leaf_nodes': 100, 'bootstrap': True, 'ccp_alpha': 0.092, 'max_samples': 0.5}. Best is trial 74 with value: -0.18167313469617832.
[I 2025-04-15 23:28:27,230] Trial 403 finished with value: -0.19085851856862718 and parameters: {'n_estimators': 2968, 'min_samples_split': 186, 'max_features': 0.8400000000000001, 'min_samples_leaf': 23, 'criterion': 'absolute_error', 'max_depth': 30, 'min_weight_fraction_leaf': 0.02, 'max_leaf_nodes': 100, 'bootstrap': True, 'ccp_alpha': 0.109, 'max_samples': 0.75}. Best is trial 74 with value: -0.18167313469617832.
[I 2025-04-15 23:28:30,559] Trial 404 finished with value: -0.18301872485415008 and parameters: {'n_estimators': 2586, 'min_samples_split': 167, 'max_features': 0.87, 'min_samples_leaf': 26, 'criterion': 'absolute_error', 'max_depth': 45, 'min_weight_fraction_leaf': 0.03, 'max_leaf_nodes': 10, 'bootstrap': True, 'ccp_alpha': 0.07100000000000001, 'max_samples': 0.5}. Best is trial 74 with value: -0.18167313469617832.
[I 2025-04-15 23:28:34,342] Trial 405 finished with value: -0.18328641056204614 and parameters: {'n_estimators': 3527, 'min_samples_split': 182, 'max_features': 0.56, 'min_samples_leaf': 21, 'criterion': 'absolute_error', 'max_depth': 30, 'min_weight_fraction_leaf': 0.02, 'max_leaf_nodes': 100, 'bootstrap': True, 'ccp_alpha': 0.101, 'max_samples': 0.5}. Best is trial 74 with value: -0.18167313469617832.
[I 2025-04-15 23:28:37,509] Trial 406 finished with value: -0.18276074694383246 and parameters: {'n_estimators': 3198, 'min_samples_split': 118, 'max_features': 0.93, 'min_samples_leaf': 28, 'criterion': 'absolute_error', 'max_depth': 30, 'min_weight_fraction_leaf': 0.01, 'max_leaf_nodes': None, 'bootstrap': True, 'ccp_alpha': 0.084, 'max_samples': 0.5}. Best is trial 74 with value: -0.18167313469617832.
[I 2025-04-15 23:28:40,858] Trial 407 finished with value: -0.1828359709810529 and parameters: {'n_estimators': 2802, 'min_samples_split': 132, 'max_features': 0.9, 'min_samples_leaf': 53, 'criterion': 'absolute_error', 'max_depth': 30, 'min_weight_fraction_leaf': 0.03, 'max_leaf_nodes': 100, 'bootstrap': True, 'ccp_alpha': 0.096, 'max_samples': 0.5}. Best is trial 74 with value: -0.18167313469617832.
[I 2025-04-15 23:28:44,931] Trial 408 finished with value: -0.18257211015013838 and parameters: {'n_estimators': 3022, 'min_samples_split': 173, 'max_features': 0.85, 'min_samples_leaf': 58, 'criterion': 'absolute_error', 'max_depth': 30, 'min_weight_fraction_leaf': 0.01, 'max_leaf_nodes': 100, 'bootstrap': True, 'ccp_alpha': 0.10400000000000001, 'max_samples': 0.5}. Best is trial 74 with value: -0.18167313469617832.
[I 2025-04-15 23:28:48,129] Trial 409 finished with value: -0.1824953795917304 and parameters: {'n_estimators': 2961, 'min_samples_split': 180, 'max_features': 0.48000000000000004, 'min_samples_leaf': 32, 'criterion': 'absolute_error', 'max_depth': 30, 'min_weight_fraction_leaf': 0.01, 'max_leaf_nodes': 150, 'bootstrap': True, 'ccp_alpha': 0.077, 'max_samples': 0.5}. Best is trial 74 with value: -0.18167313469617832.
[I 2025-04-15 23:28:50,252] Trial 410 finished with value: -0.1936417107583833 and parameters: {'n_estimators': 2510, 'min_samples_split': 188, 'max_features': 0.85, 'min_samples_leaf': 32, 'criterion': 'absolute_error', 'max_depth': 45, 'min_weight_fraction_leaf': 0.01, 'max_leaf_nodes': 150, 'bootstrap': False, 'ccp_alpha': 0.074}. Best is trial 74 with value: -0.18167313469617832.
[I 2025-04-15 23:28:53,014] Trial 411 finished with value: -18.156254503438642 and parameters: {'n_estimators': 2795, 'min_samples_split': 180, 'max_features': 0.46, 'min_samples_leaf': 34, 'criterion': 'squared_error', 'max_depth': 30, 'min_weight_fraction_leaf': 0.01, 'max_leaf_nodes': 150, 'bootstrap': True, 'ccp_alpha': 0.077, 'max_samples': 0.5}. Best is trial 74 with value: -0.18167313469617832.
[I 2025-04-15 23:28:56,174] Trial 412 finished with value: -0.18256983991597853 and parameters: {'n_estimators': 2934, 'min_samples_split': 180, 'max_features': 0.8200000000000001, 'min_samples_leaf': 33, 'criterion': 'absolute_error', 'max_depth': 30, 'min_weight_fraction_leaf': 0.01, 'max_leaf_nodes': 150, 'bootstrap': True, 'ccp_alpha': 0.154, 'max_samples': 0.5}. Best is trial 74 with value: -0.18167313469617832.
[I 2025-04-15 23:28:56,790] Trial 413 finished with value: -0.18704284294648588 and parameters: {'n_estimators': 468, 'min_samples_split': 184, 'max_features': 0.35000000000000003, 'min_samples_leaf': 34, 'criterion': 'absolute_error', 'max_depth': 20, 'min_weight_fraction_leaf': 0.01, 'max_leaf_nodes': 150, 'bootstrap': True, 'ccp_alpha': 0.146, 'max_samples': 0.5}. Best is trial 74 with value: -0.18167313469617832.
[I 2025-04-15 23:29:00,001] Trial 414 finished with value: -0.18309271422285525 and parameters: {'n_estimators': 2910, 'min_samples_split': 180, 'max_features': 0.39, 'min_samples_leaf': 36, 'criterion': 'absolute_error', 'max_depth': 30, 'min_weight_fraction_leaf': 0.01, 'max_leaf_nodes': 150, 'bootstrap': True, 'ccp_alpha': 0.14100000000000001, 'max_samples': 0.5}. Best is trial 74 with value: -0.18167313469617832.
[I 2025-04-15 23:29:02,896] Trial 415 finished with value: -0.18283157288208546 and parameters: {'n_estimators': 2695, 'min_samples_split': 192, 'max_features': 0.59, 'min_samples_leaf': 30, 'criterion': 'absolute_error', 'max_depth': 60, 'min_weight_fraction_leaf': 0.01, 'max_leaf_nodes': 150, 'bootstrap': True, 'ccp_alpha': 0.162, 'max_samples': 0.5}. Best is trial 74 with value: -0.18167313469617832.
[I 2025-04-15 23:29:05,673] Trial 416 finished with value: -0.18390710062599233 and parameters: {'n_estimators': 2339, 'min_samples_split': 177, 'max_features': 0.8, 'min_samples_leaf': 33, 'criterion': 'absolute_error', 'max_depth': 30, 'min_weight_fraction_leaf': 0.01, 'max_leaf_nodes': 50, 'bootstrap': True, 'ccp_alpha': 0.197, 'max_samples': 0.5}. Best is trial 74 with value: -0.18167313469617832.
[I 2025-04-15 23:29:08,754] Trial 417 finished with value: -18.147964273918763 and parameters: {'n_estimators': 2975, 'min_samples_split': 186, 'max_features': 0.8200000000000001, 'min_samples_leaf': 29, 'criterion': 'poisson', 'max_depth': 45, 'min_weight_fraction_leaf': 0.01, 'max_leaf_nodes': 150, 'bootstrap': True, 'ccp_alpha': 0.151, 'max_samples': 0.5}. Best is trial 74 with value: -0.18167313469617832.
[I 2025-04-15 23:29:11,603] Trial 418 finished with value: -0.18278393330239456 and parameters: {'n_estimators': 2613, 'min_samples_split': 180, 'max_features': 0.53, 'min_samples_leaf': 25, 'criterion': 'absolute_error', 'max_depth': 5, 'min_weight_fraction_leaf': 0.01, 'max_leaf_nodes': 150, 'bootstrap': True, 'ccp_alpha': 0.186, 'max_samples': 0.5}. Best is trial 74 with value: -0.18167313469617832.
[I 2025-04-15 23:29:15,276] Trial 419 finished with value: -0.18293180577847803 and parameters: {'n_estimators': 3356, 'min_samples_split': 174, 'max_features': 0.5, 'min_samples_leaf': 31, 'criterion': 'absolute_error', 'max_depth': 30, 'min_weight_fraction_leaf': 0.01, 'max_leaf_nodes': 150, 'bootstrap': True, 'ccp_alpha': 0.067, 'max_samples': 0.5}. Best is trial 74 with value: -0.18167313469617832.
[I 2025-04-15 23:29:18,275] Trial 420 finished with value: -0.18288038018222216 and parameters: {'n_estimators': 2839, 'min_samples_split': 182, 'max_features': 0.77, 'min_samples_leaf': 27, 'criterion': 'absolute_error', 'max_depth': 30, 'min_weight_fraction_leaf': 0.0, 'max_leaf_nodes': 150, 'bootstrap': True, 'ccp_alpha': 0.088, 'max_samples': 0.5}. Best is trial 74 with value: -0.18167313469617832.
[I 2025-04-15 23:29:22,703] Trial 421 finished with value: -0.18309740804110392 and parameters: {'n_estimators': 4112, 'min_samples_split': 177, 'max_features': 0.14, 'min_samples_leaf': 29, 'criterion': 'absolute_error', 'max_depth': 30, 'min_weight_fraction_leaf': 0.01, 'max_leaf_nodes': 150, 'bootstrap': True, 'ccp_alpha': 0.076, 'max_samples': 0.5}. Best is trial 74 with value: -0.18167313469617832.
[I 2025-04-15 23:29:24,938] Trial 422 finished with value: -0.19329187119580787 and parameters: {'n_estimators': 1956, 'min_samples_split': 188, 'max_features': 0.8300000000000001, 'min_samples_leaf': 20, 'criterion': 'absolute_error', 'max_depth': 30, 'min_weight_fraction_leaf': 0.01, 'max_leaf_nodes': 150, 'bootstrap': True, 'ccp_alpha': 0.155, 'max_samples': None}. Best is trial 74 with value: -0.18167313469617832.
[I 2025-04-15 23:29:30,280] Trial 423 finished with value: -0.18354554536264764 and parameters: {'n_estimators': 5110, 'min_samples_split': 174, 'max_features': 0.86, 'min_samples_leaf': 16, 'criterion': 'absolute_error', 'max_depth': 45, 'min_weight_fraction_leaf': 0.01, 'max_leaf_nodes': 150, 'bootstrap': True, 'ccp_alpha': 0.079, 'max_samples': 0.5}. Best is trial 74 with value: -0.18167313469617832.
[I 2025-04-15 23:29:33,604] Trial 424 finished with value: -0.18251429344476314 and parameters: {'n_estimators': 3089, 'min_samples_split': 46, 'max_features': 0.8, 'min_samples_leaf': 24, 'criterion': 'absolute_error', 'max_depth': 15, 'min_weight_fraction_leaf': 0.01, 'max_leaf_nodes': 150, 'bootstrap': True, 'ccp_alpha': 0.061, 'max_samples': 0.5}. Best is trial 74 with value: -0.18167313469617832.
[I 2025-04-15 23:29:37,146] Trial 425 finished with value: -0.18280283646840828 and parameters: {'n_estimators': 3232, 'min_samples_split': 33, 'max_features': 0.78, 'min_samples_leaf': 23, 'criterion': 'absolute_error', 'max_depth': 30, 'min_weight_fraction_leaf': 0.01, 'max_leaf_nodes': 150, 'bootstrap': True, 'ccp_alpha': 0.07, 'max_samples': 0.5}. Best is trial 74 with value: -0.18167313469617832.
[I 2025-04-15 23:29:41,022] Trial 426 finished with value: -0.18315246009922376 and parameters: {'n_estimators': 3442, 'min_samples_split': 28, 'max_features': 0.8, 'min_samples_leaf': 21, 'criterion': 'absolute_error', 'max_depth': 15, 'min_weight_fraction_leaf': 0.01, 'max_leaf_nodes': 150, 'bootstrap': True, 'ccp_alpha': 0.062, 'max_samples': 0.5}. Best is trial 74 with value: -0.18167313469617832.
