[I 2025-04-16 01:51:47,710] Trial 3061 finished with value: -0.1936417107583833 and parameters: {'n_estimators': 2097, 'min_samples_split': 15, 'max_features': 0.91, 'min_samples_leaf': 9, 'criterion': 'absolute_error', 'max_depth': None, 'min_weight_fraction_leaf': 0.0, 'max_leaf_nodes': 20, 'bootstrap': False, 'ccp_alpha': 0.005}. Best is trial 2774 with value: 0.046571421912873.
[I 2025-04-16 01:51:49,547] Trial 3062 finished with value: -0.1936417107583833 and parameters: {'n_estimators': 1760, 'min_samples_split': 20, 'max_features': 0.89, 'min_samples_leaf': 7, 'criterion': 'absolute_error', 'max_depth': None, 'min_weight_fraction_leaf': 0.0, 'max_leaf_nodes': 20, 'bootstrap': False, 'ccp_alpha': 0.019}. Best is trial 2774 with value: 0.046571421912873.
[I 2025-04-16 01:51:51,357] Trial 3063 finished with value: -0.1936417107583833 and parameters: {'n_estimators': 1637, 'min_samples_split': 21, 'max_features': 0.93, 'min_samples_leaf': 9, 'criterion': 'absolute_error', 'max_depth': None, 'min_weight_fraction_leaf': 0.0, 'max_leaf_nodes': 20, 'bootstrap': False, 'ccp_alpha': 0.03}. Best is trial 2774 with value: 0.046571421912873.
[I 2025-04-16 01:51:53,068] Trial 3064 finished with value: -0.1936417107583833 and parameters: {'n_estimators': 1471, 'min_samples_split': 15, 'max_features': 0.88, 'min_samples_leaf': 7, 'criterion': 'absolute_error', 'max_depth': None, 'min_weight_fraction_leaf': 0.0, 'max_leaf_nodes': 20, 'bootstrap': False, 'ccp_alpha': 0.009000000000000001}. Best is trial 2774 with value: 0.046571421912873.
[I 2025-04-16 01:51:55,298] Trial 3065 finished with value: -8.617758397708538 and parameters: {'n_estimators': 2289, 'min_samples_split': 14, 'max_features': 0.91, 'min_samples_leaf': 7, 'criterion': 'absolute_error', 'max_depth': None, 'min_weight_fraction_leaf': 0.0, 'max_leaf_nodes': 20, 'bootstrap': False, 'ccp_alpha': 0.0}. Best is trial 2774 with value: 0.046571421912873.
[I 2025-04-16 01:51:57,386] Trial 3066 finished with value: -0.1936417107583833 and parameters: {'n_estimators': 2080, 'min_samples_split': 17, 'max_features': 0.87, 'min_samples_leaf': 7, 'criterion': 'absolute_error', 'max_depth': None, 'min_weight_fraction_leaf': 0.0, 'max_leaf_nodes': 20, 'bootstrap': False, 'ccp_alpha': 0.014}. Best is trial 2774 with value: 0.046571421912873.
[I 2025-04-16 01:51:59,450] Trial 3067 finished with value: -0.1936417107583833 and parameters: {'n_estimators': 1489, 'min_samples_split': 13, 'max_features': 0.9, 'min_samples_leaf': 9, 'criterion': 'absolute_error', 'max_depth': None, 'min_weight_fraction_leaf': 0.0, 'max_leaf_nodes': 20, 'bootstrap': False, 'ccp_alpha': 0.005}. Best is trial 2774 with value: 0.046571421912873.
[I 2025-04-16 01:52:01,386] Trial 3068 finished with value: -17.52898638227664 and parameters: {'n_estimators': 1880, 'min_samples_split': 125, 'max_features': 0.93, 'min_samples_leaf': 9, 'criterion': 'friedman_mse', 'max_depth': None, 'min_weight_fraction_leaf': 0.0, 'max_leaf_nodes': 20, 'bootstrap': False, 'ccp_alpha': 0.01}. Best is trial 2774 with value: 0.046571421912873.
[I 2025-04-16 01:52:02,730] Trial 3069 finished with value: -0.1936417107583833 and parameters: {'n_estimators': 1217, 'min_samples_split': 21, 'max_features': 0.89, 'min_samples_leaf': 6, 'criterion': 'absolute_error', 'max_depth': None, 'min_weight_fraction_leaf': 0.0, 'max_leaf_nodes': None, 'bootstrap': False, 'ccp_alpha': 0.021}. Best is trial 2774 with value: 0.046571421912873.
[I 2025-04-16 01:52:04,442] Trial 3070 finished with value: 0.02210752062885517 and parameters: {'n_estimators': 1654, 'min_samples_split': 13, 'max_features': 0.92, 'min_samples_leaf': 5, 'criterion': 'absolute_error', 'max_depth': None, 'min_weight_fraction_leaf': 0.0, 'max_leaf_nodes': 300, 'bootstrap': False, 'ccp_alpha': 0.005}. Best is trial 2774 with value: 0.046571421912873.
[I 2025-04-16 01:52:06,036] Trial 3071 finished with value: -13.235206588077698 and parameters: {'n_estimators': 1447, 'min_samples_split': 11, 'max_features': 0.93, 'min_samples_leaf': 5, 'criterion': 'absolute_error', 'max_depth': None, 'min_weight_fraction_leaf': 0.0, 'max_leaf_nodes': 20, 'bootstrap': False, 'ccp_alpha': 0.0}. Best is trial 2774 with value: 0.046571421912873.
[I 2025-04-16 01:52:07,991] Trial 3072 finished with value: -0.1936417107583833 and parameters: {'n_estimators': 1614, 'min_samples_split': 12, 'max_features': 0.93, 'min_samples_leaf': 5, 'criterion': 'absolute_error', 'max_depth': None, 'min_weight_fraction_leaf': 0.0, 'max_leaf_nodes': 300, 'bootstrap': False, 'ccp_alpha': 0.014}. Best is trial 2774 with value: 0.046571421912873.
[I 2025-04-16 01:52:09,554] Trial 3073 finished with value: -0.1936417107583833 and parameters: {'n_estimators': 1348, 'min_samples_split': 11, 'max_features': 0.93, 'min_samples_leaf': 5, 'criterion': 'absolute_error', 'max_depth': None, 'min_weight_fraction_leaf': 0.0, 'max_leaf_nodes': 300, 'bootstrap': False, 'ccp_alpha': 0.009000000000000001}. Best is trial 2774 with value: 0.046571421912873.
[I 2025-04-16 01:52:11,278] Trial 3074 finished with value: 0.021873389097314334 and parameters: {'n_estimators': 1710, 'min_samples_split': 12, 'max_features': 0.91, 'min_samples_leaf': 5, 'criterion': 'absolute_error', 'max_depth': None, 'min_weight_fraction_leaf': 0.0, 'max_leaf_nodes': 300, 'bootstrap': False, 'ccp_alpha': 0.005}. Best is trial 2774 with value: 0.046571421912873.
[I 2025-04-16 01:52:12,661] Trial 3075 finished with value: -0.1936417107583833 and parameters: {'n_estimators': 1225, 'min_samples_split': 10, 'max_features': 0.93, 'min_samples_leaf': 5, 'criterion': 'absolute_error', 'max_depth': None, 'min_weight_fraction_leaf': 0.0, 'max_leaf_nodes': 300, 'bootstrap': False, 'ccp_alpha': 0.014}. Best is trial 2774 with value: 0.046571421912873.
[I 2025-04-16 01:52:14,133] Trial 3076 finished with value: -0.1936417107583833 and parameters: {'n_estimators': 1398, 'min_samples_split': 10, 'max_features': 0.93, 'min_samples_leaf': 5, 'criterion': 'absolute_error', 'max_depth': None, 'min_weight_fraction_leaf': 0.0, 'max_leaf_nodes': 300, 'bootstrap': False, 'ccp_alpha': 0.024}. Best is trial 2774 with value: 0.046571421912873.
[I 2025-04-16 01:52:15,681] Trial 3077 finished with value: -14.698289886525501 and parameters: {'n_estimators': 1623, 'min_samples_split': 10, 'max_features': 0.92, 'min_samples_leaf': 5, 'criterion': 'squared_error', 'max_depth': None, 'min_weight_fraction_leaf': 0.0, 'max_leaf_nodes': None, 'bootstrap': False, 'ccp_alpha': 0.0}. Best is trial 2774 with value: 0.046571421912873.
[I 2025-04-16 01:52:17,419] Trial 3078 finished with value: -0.1936417107583833 and parameters: {'n_estimators': 1482, 'min_samples_split': 10, 'max_features': 0.06999999999999999, 'min_samples_leaf': 7, 'criterion': 'absolute_error', 'max_depth': None, 'min_weight_fraction_leaf': 0.0, 'max_leaf_nodes': 300, 'bootstrap': False, 'ccp_alpha': 0.009000000000000001}. Best is trial 2774 with value: 0.046571421912873.
[I 2025-04-16 01:52:19,312] Trial 3079 finished with value: -0.1936417107583833 and parameters: {'n_estimators': 1568, 'min_samples_split': 13, 'max_features': 0.93, 'min_samples_leaf': 5, 'criterion': 'absolute_error', 'max_depth': None, 'min_weight_fraction_leaf': 0.0, 'max_leaf_nodes': 300, 'bootstrap': False, 'ccp_alpha': 0.017}. Best is trial 2774 with value: 0.046571421912873.
[I 2025-04-16 01:52:20,724] Trial 3080 finished with value: 0.0226979840844324 and parameters: {'n_estimators': 1301, 'min_samples_split': 10, 'max_features': 0.91, 'min_samples_leaf': 5, 'criterion': 'absolute_error', 'max_depth': None, 'min_weight_fraction_leaf': 0.05, 'max_leaf_nodes': 300, 'bootstrap': False, 'ccp_alpha': 0.005}. Best is trial 2774 with value: 0.046571421912873.
[I 2025-04-16 01:52:22,566] Trial 3081 finished with value: -0.1936417107583833 and parameters: {'n_estimators': 1716, 'min_samples_split': 10, 'max_features': 0.91, 'min_samples_leaf': 4, 'criterion': 'absolute_error', 'max_depth': None, 'min_weight_fraction_leaf': 0.08, 'max_leaf_nodes': 300, 'bootstrap': False, 'ccp_alpha': 0.01}. Best is trial 2774 with value: 0.046571421912873.
[I 2025-04-16 01:52:23,953] Trial 3082 finished with value: -13.113248005029394 and parameters: {'n_estimators': 1181, 'min_samples_split': 9, 'max_features': 0.93, 'min_samples_leaf': 5, 'criterion': 'absolute_error', 'max_depth': None, 'min_weight_fraction_leaf': 0.08, 'max_leaf_nodes': 300, 'bootstrap': False, 'ccp_alpha': 0.0}. Best is trial 2774 with value: 0.046571421912873.
[I 2025-04-16 01:52:25,883] Trial 3083 finished with value: -19.736531998569777 and parameters: {'n_estimators': 1671, 'min_samples_split': 10, 'max_features': 0.42000000000000004, 'min_samples_leaf': 4, 'criterion': 'poisson', 'max_depth': None, 'min_weight_fraction_leaf': 0.05, 'max_leaf_nodes': None, 'bootstrap': False, 'ccp_alpha': 0.014}. Best is trial 2774 with value: 0.046571421912873.
[I 2025-04-16 01:52:27,339] Trial 3084 finished with value: -0.1936417107583833 and parameters: {'n_estimators': 1349, 'min_samples_split': 9, 'max_features': 0.91, 'min_samples_leaf': 5, 'criterion': 'absolute_error', 'max_depth': None, 'min_weight_fraction_leaf': 0.07, 'max_leaf_nodes': 300, 'bootstrap': False, 'ccp_alpha': 0.009000000000000001}. Best is trial 2774 with value: 0.046571421912873.
[I 2025-04-16 01:52:29,015] Trial 3085 finished with value: -0.1936417107583833 and parameters: {'n_estimators': 1553, 'min_samples_split': 9, 'max_features': 0.93, 'min_samples_leaf': 46, 'criterion': 'absolute_error', 'max_depth': None, 'min_weight_fraction_leaf': 0.0, 'max_leaf_nodes': 300, 'bootstrap': False, 'ccp_alpha': 0.005}. Best is trial 2774 with value: 0.046571421912873.
[I 2025-04-16 01:52:30,534] Trial 3086 finished with value: -0.1936417107583833 and parameters: {'n_estimators': 1499, 'min_samples_split': 68, 'max_features': 0.9, 'min_samples_leaf': 7, 'criterion': 'absolute_error', 'max_depth': None, 'min_weight_fraction_leaf': 0.04, 'max_leaf_nodes': None, 'bootstrap': False, 'ccp_alpha': 0.02}. Best is trial 2774 with value: 0.046571421912873.
[I 2025-04-16 01:52:31,736] Trial 3087 finished with value: -0.1936417107583833 and parameters: {'n_estimators': 1193, 'min_samples_split': 9, 'max_features': 0.89, 'min_samples_leaf': 55, 'criterion': 'absolute_error', 'max_depth': None, 'min_weight_fraction_leaf': 0.05, 'max_leaf_nodes': 20, 'bootstrap': False, 'ccp_alpha': 0.0}. Best is trial 2774 with value: 0.046571421912873.
[I 2025-04-16 01:52:33,596] Trial 3088 finished with value: -0.1936417107583833 and parameters: {'n_estimators': 1770, 'min_samples_split': 85, 'max_features': 0.93, 'min_samples_leaf': 4, 'criterion': 'absolute_error', 'max_depth': None, 'min_weight_fraction_leaf': 0.05, 'max_leaf_nodes': 300, 'bootstrap': False, 'ccp_alpha': 0.01}. Best is trial 2774 with value: 0.046571421912873.
[I 2025-04-16 01:52:35,241] Trial 3089 finished with value: -0.1936417107583833 and parameters: {'n_estimators': 1621, 'min_samples_split': 12, 'max_features': 0.91, 'min_samples_leaf': 5, 'criterion': 'absolute_error', 'max_depth': None, 'min_weight_fraction_leaf': 0.1, 'max_leaf_nodes': None, 'bootstrap': False, 'ccp_alpha': 0.017}. Best is trial 2774 with value: 0.046571421912873.
[I 2025-04-16 01:52:37,426] Trial 3090 finished with value: -0.1936417107583833 and parameters: {'n_estimators': 1794, 'min_samples_split': 10, 'max_features': 0.88, 'min_samples_leaf': 7, 'criterion': 'absolute_error', 'max_depth': None, 'min_weight_fraction_leaf': 0.1, 'max_leaf_nodes': 300, 'bootstrap': False, 'ccp_alpha': 0.036000000000000004}. Best is trial 2774 with value: 0.046571421912873.
[I 2025-04-16 01:52:38,954] Trial 3091 finished with value: 0.020770324749587354 and parameters: {'n_estimators': 1231, 'min_samples_split': 9, 'max_features': 0.93, 'min_samples_leaf': 4, 'criterion': 'absolute_error', 'max_depth': None, 'min_weight_fraction_leaf': 0.0, 'max_leaf_nodes': 300, 'bootstrap': False, 'ccp_alpha': 0.005}. Best is trial 2774 with value: 0.046571421912873.
[I 2025-04-16 01:52:40,402] Trial 3092 finished with value: -17.528986382276287 and parameters: {'n_estimators': 1424, 'min_samples_split': 13, 'max_features': 0.91, 'min_samples_leaf': 7, 'criterion': 'friedman_mse', 'max_depth': None, 'min_weight_fraction_leaf': 0.0, 'max_leaf_nodes': 300, 'bootstrap': False, 'ccp_alpha': 0.01}. Best is trial 2774 with value: 0.046571421912873.
[I 2025-04-16 01:52:42,196] Trial 3093 finished with value: -0.1936417107583833 and parameters: {'n_estimators': 1774, 'min_samples_split': 13, 'max_features': 0.86, 'min_samples_leaf': 4, 'criterion': 'absolute_error', 'max_depth': None, 'min_weight_fraction_leaf': 0.09, 'max_leaf_nodes': 300, 'bootstrap': False, 'ccp_alpha': 0.027}. Best is trial 2774 with value: 0.046571421912873.
[I 2025-04-16 01:52:43,517] Trial 3094 finished with value: -0.1936417107583833 and parameters: {'n_estimators': 1121, 'min_samples_split': 9, 'max_features': 0.88, 'min_samples_leaf': 9, 'criterion': 'absolute_error', 'max_depth': None, 'min_weight_fraction_leaf': 0.09, 'max_leaf_nodes': 300, 'bootstrap': False, 'ccp_alpha': 0.005}. Best is trial 2774 with value: 0.046571421912873.
[I 2025-04-16 01:52:45,294] Trial 3095 finished with value: -0.1936417107583833 and parameters: {'n_estimators': 1651, 'min_samples_split': 13, 'max_features': 0.9, 'min_samples_leaf': 7, 'criterion': 'absolute_error', 'max_depth': None, 'min_weight_fraction_leaf': 0.07, 'max_leaf_nodes': 300, 'bootstrap': False, 'ccp_alpha': 0.014}. Best is trial 2774 with value: 0.046571421912873.
[I 2025-04-16 01:52:46,988] Trial 3096 finished with value: -0.1936417107583833 and parameters: {'n_estimators': 1483, 'min_samples_split': 9, 'max_features': 0.93, 'min_samples_leaf': 4, 'criterion': 'absolute_error', 'max_depth': None, 'min_weight_fraction_leaf': 0.04, 'max_leaf_nodes': 300, 'bootstrap': False, 'ccp_alpha': 0.02}. Best is trial 2774 with value: 0.046571421912873.
[I 2025-04-16 01:52:48,373] Trial 3097 finished with value: -11.359306291224373 and parameters: {'n_estimators': 1334, 'min_samples_split': 9, 'max_features': 0.89, 'min_samples_leaf': 5, 'criterion': 'absolute_error', 'max_depth': None, 'min_weight_fraction_leaf': 0.0, 'max_leaf_nodes': 20, 'bootstrap': False, 'ccp_alpha': 0.0}. Best is trial 2774 with value: 0.046571421912873.
[I 2025-04-16 01:52:50,518] Trial 3098 finished with value: -0.1936417107583833 and parameters: {'n_estimators': 1920, 'min_samples_split': 13, 'max_features': 0.91, 'min_samples_leaf': 8, 'criterion': 'absolute_error', 'max_depth': None, 'min_weight_fraction_leaf': 0.08, 'max_leaf_nodes': 300, 'bootstrap': False, 'ccp_alpha': 0.009000000000000001}. Best is trial 2774 with value: 0.046571421912873.
[I 2025-04-16 01:52:52,372] Trial 3099 finished with value: 0.01915920677158045 and parameters: {'n_estimators': 1666, 'min_samples_split': 14, 'max_features': 0.93, 'min_samples_leaf': 5, 'criterion': 'absolute_error', 'max_depth': None, 'min_weight_fraction_leaf': 0.0, 'max_leaf_nodes': 300, 'bootstrap': False, 'ccp_alpha': 0.005}. Best is trial 2774 with value: 0.046571421912873.
[I 2025-04-16 01:52:53,630] Trial 3100 finished with value: -0.1936417107583833 and parameters: {'n_estimators': 1097, 'min_samples_split': 9, 'max_features': 0.87, 'min_samples_leaf': 7, 'criterion': 'absolute_error', 'max_depth': None, 'min_weight_fraction_leaf': 0.04, 'max_leaf_nodes': 300, 'bootstrap': False, 'ccp_alpha': 0.014}. Best is trial 2774 with value: 0.046571421912873.
[I 2025-04-16 01:52:55,240] Trial 3101 finished with value: -17.528986382276567 and parameters: {'n_estimators': 1770, 'min_samples_split': 112, 'max_features': 0.91, 'min_samples_leaf': 9, 'criterion': 'squared_error', 'max_depth': None, 'min_weight_fraction_leaf': 0.04, 'max_leaf_nodes': 300, 'bootstrap': False, 'ccp_alpha': 0.189}. Best is trial 2774 with value: 0.046571421912873.
[I 2025-04-16 01:52:56,618] Trial 3102 finished with value: -11.550580699082516 and parameters: {'n_estimators': 1319, 'min_samples_split': 9, 'max_features': 0.89, 'min_samples_leaf': 4, 'criterion': 'absolute_error', 'max_depth': None, 'min_weight_fraction_leaf': 0.0, 'max_leaf_nodes': 300, 'bootstrap': False, 'ccp_alpha': 0.0}. Best is trial 2774 with value: 0.046571421912873.
[I 2025-04-16 01:52:58,284] Trial 3103 finished with value: -0.1936417107583833 and parameters: {'n_estimators': 1486, 'min_samples_split': 13, 'max_features': 0.93, 'min_samples_leaf': 7, 'criterion': 'absolute_error', 'max_depth': None, 'min_weight_fraction_leaf': 0.0, 'max_leaf_nodes': 300, 'bootstrap': False, 'ccp_alpha': 0.009000000000000001}. Best is trial 2774 with value: 0.046571421912873.
[I 2025-04-16 01:53:00,549] Trial 3104 finished with value: -0.1936417107583833 and parameters: {'n_estimators': 2059, 'min_samples_split': 16, 'max_features': 0.91, 'min_samples_leaf': 5, 'criterion': 'absolute_error', 'max_depth': None, 'min_weight_fraction_leaf': 0.0, 'max_leaf_nodes': 300, 'bootstrap': False, 'ccp_alpha': 0.20500000000000002}. Best is trial 2774 with value: 0.046571421912873.
[I 2025-04-16 01:53:02,534] Trial 3105 finished with value: -0.1936417107583833 and parameters: {'n_estimators': 1778, 'min_samples_split': 9, 'max_features': 0.86, 'min_samples_leaf': 9, 'criterion': 'absolute_error', 'max_depth': None, 'min_weight_fraction_leaf': 0.05, 'max_leaf_nodes': 20, 'bootstrap': False, 'ccp_alpha': 0.005}. Best is trial 2774 with value: 0.046571421912873.
[I 2025-04-16 01:53:04,215] Trial 3106 finished with value: -0.1936417107583833 and parameters: {'n_estimators': 1477, 'min_samples_split': 13, 'max_features': 0.89, 'min_samples_leaf': 4, 'criterion': 'absolute_error', 'max_depth': None, 'min_weight_fraction_leaf': 0.0, 'max_leaf_nodes': 300, 'bootstrap': False, 'ccp_alpha': 0.015}. Best is trial 2774 with value: 0.046571421912873.
[I 2025-04-16 01:53:06,279] Trial 3107 finished with value: -17.528986382276848 and parameters: {'n_estimators': 2309, 'min_samples_split': 74, 'max_features': 0.93, 'min_samples_leaf': 7, 'criterion': 'poisson', 'max_depth': None, 'min_weight_fraction_leaf': 0.0, 'max_leaf_nodes': 300, 'bootstrap': False, 'ccp_alpha': 0.022}. Best is trial 2774 with value: 0.046571421912873.
[I 2025-04-16 01:53:08,359] Trial 3108 finished with value: -0.11092861574932256 and parameters: {'n_estimators': 1921, 'min_samples_split': 9, 'max_features': 0.88, 'min_samples_leaf': 4, 'criterion': 'absolute_error', 'max_depth': None, 'min_weight_fraction_leaf': 0.0, 'max_leaf_nodes': 300, 'bootstrap': False, 'ccp_alpha': 0.005}. Best is trial 2774 with value: 0.046571421912873.
[I 2025-04-16 01:53:09,673] Trial 3109 finished with value: -0.1936417107583833 and parameters: {'n_estimators': 1181, 'min_samples_split': 93, 'max_features': 0.91, 'min_samples_leaf': 6, 'criterion': 'absolute_error', 'max_depth': None, 'min_weight_fraction_leaf': 0.09, 'max_leaf_nodes': 300, 'bootstrap': False, 'ccp_alpha': 0.0}. Best is trial 2774 with value: 0.046571421912873.
[I 2025-04-16 01:53:11,390] Trial 3110 finished with value: -0.1936417107583833 and parameters: {'n_estimators': 1539, 'min_samples_split': 9, 'max_features': 0.72, 'min_samples_leaf': 9, 'criterion': 'absolute_error', 'max_depth': None, 'min_weight_fraction_leaf': 0.0, 'max_leaf_nodes': 300, 'bootstrap': False, 'ccp_alpha': 0.013000000000000001}. Best is trial 2774 with value: 0.046571421912873.
[I 2025-04-16 01:53:13,983] Trial 3111 finished with value: -0.1936417107583833 and parameters: {'n_estimators': 2267, 'min_samples_split': 16, 'max_features': 0.93, 'min_samples_leaf': 4, 'criterion': 'absolute_error', 'max_depth': None, 'min_weight_fraction_leaf': 0.09, 'max_leaf_nodes': 300, 'bootstrap': False, 'ccp_alpha': 0.009000000000000001}. Best is trial 2774 with value: 0.046571421912873.
[I 2025-04-16 01:53:15,853] Trial 3112 finished with value: -0.07448270463391911 and parameters: {'n_estimators': 1783, 'min_samples_split': 13, 'max_features': 0.86, 'min_samples_leaf': 7, 'criterion': 'absolute_error', 'max_depth': None, 'min_weight_fraction_leaf': 0.07, 'max_leaf_nodes': 300, 'bootstrap': False, 'ccp_alpha': 0.005}. Best is trial 2774 with value: 0.046571421912873.
[I 2025-04-16 01:53:17,361] Trial 3113 finished with value: -0.1936417107583833 and parameters: {'n_estimators': 1327, 'min_samples_split': 9, 'max_features': 0.89, 'min_samples_leaf': 5, 'criterion': 'absolute_error', 'max_depth': None, 'min_weight_fraction_leaf': 0.07, 'max_leaf_nodes': 300, 'bootstrap': False, 'ccp_alpha': 0.016}. Best is trial 2774 with value: 0.046571421912873.
[I 2025-04-16 01:53:18,674] Trial 3114 finished with value: -8.644684928472714 and parameters: {'n_estimators': 1040, 'min_samples_split': 16, 'max_features': 0.91, 'min_samples_leaf': 9, 'criterion': 'absolute_error', 'max_depth': None, 'min_weight_fraction_leaf': 0.05, 'max_leaf_nodes': 300, 'bootstrap': False, 'ccp_alpha': 0.0}. Best is trial 2774 with value: 0.046571421912873.
[I 2025-04-16 01:53:20,689] Trial 3115 finished with value: -0.1936417107583833 and parameters: {'n_estimators': 1986, 'min_samples_split': 12, 'max_features': 0.93, 'min_samples_leaf': 7, 'criterion': 'absolute_error', 'max_depth': None, 'min_weight_fraction_leaf': 0.08, 'max_leaf_nodes': 300, 'bootstrap': False, 'ccp_alpha': 0.01}. Best is trial 2774 with value: 0.046571421912873.
[I 2025-04-16 01:53:22,303] Trial 3116 finished with value: -17.528986382276475 and parameters: {'n_estimators': 1636, 'min_samples_split': 9, 'max_features': 0.88, 'min_samples_leaf': 4, 'criterion': 'friedman_mse', 'max_depth': None, 'min_weight_fraction_leaf': 0.0, 'max_leaf_nodes': 300, 'bootstrap': False, 'ccp_alpha': 0.02}. Best is trial 2774 with value: 0.046571421912873.
