[I 2025-04-16 01:03:24,403] Trial 2098 finished with value: -0.1936417107583833 and parameters: {'n_estimators': 3939, 'min_samples_split': 14, 'max_features': 0.98, 'min_samples_leaf': 15, 'criterion': 'absolute_error', 'max_depth': None, 'min_weight_fraction_leaf': 0.01, 'max_leaf_nodes': 150, 'bootstrap': False, 'ccp_alpha': 0.005}. Best is trial 1828 with value: -0.15292978335836716.
[I 2025-04-16 01:03:28,640] Trial 2099 finished with value: -0.1936417107583833 and parameters: {'n_estimators': 4668, 'min_samples_split': 26, 'max_features': 0.9600000000000001, 'min_samples_leaf': 8, 'criterion': 'absolute_error', 'max_depth': 60, 'min_weight_fraction_leaf': 0.01, 'max_leaf_nodes': 150, 'bootstrap': False, 'ccp_alpha': 0.018000000000000002}. Best is trial 1828 with value: -0.15292978335836716.
[I 2025-04-16 01:03:32,373] Trial 2100 finished with value: -0.1936417107583833 and parameters: {'n_estimators': 4140, 'min_samples_split': 9, 'max_features': 0.92, 'min_samples_leaf': 12, 'criterion': 'absolute_error', 'max_depth': 60, 'min_weight_fraction_leaf': 0.01, 'max_leaf_nodes': 150, 'bootstrap': False, 'ccp_alpha': 0.01}. Best is trial 1828 with value: -0.15292978335836716.
[I 2025-04-16 01:03:35,434] Trial 2101 finished with value: -0.1936213216271195 and parameters: {'n_estimators': 3786, 'min_samples_split': 17, 'max_features': 0.9400000000000001, 'min_samples_leaf': 14, 'criterion': 'absolute_error', 'max_depth': 60, 'min_weight_fraction_leaf': 0.0, 'max_leaf_nodes': 150, 'bootstrap': False, 'ccp_alpha': 0.0}. Best is trial 1828 with value: -0.15292978335836716.
[I 2025-04-16 01:03:39,480] Trial 2102 finished with value: -0.1936417107583833 and parameters: {'n_estimators': 4456, 'min_samples_split': 5, 'max_features': 0.98, 'min_samples_leaf': 19, 'criterion': 'absolute_error', 'max_depth': 60, 'min_weight_fraction_leaf': 0.01, 'max_leaf_nodes': 150, 'bootstrap': False, 'ccp_alpha': 0.005}. Best is trial 1828 with value: -0.15292978335836716.
[I 2025-04-16 01:03:42,860] Trial 2103 finished with value: -0.1936417107583833 and parameters: {'n_estimators': 3541, 'min_samples_split': 22, 'max_features': 0.9, 'min_samples_leaf': 10, 'criterion': 'absolute_error', 'max_depth': 60, 'min_weight_fraction_leaf': 0.01, 'max_leaf_nodes': 300, 'bootstrap': False, 'ccp_alpha': 0.014}. Best is trial 1828 with value: -0.15292978335836716.
[I 2025-04-16 01:03:46,355] Trial 2104 finished with value: -17.528986382274123 and parameters: {'n_estimators': 3988, 'min_samples_split': 12, 'max_features': 0.9600000000000001, 'min_samples_leaf': 16, 'criterion': 'squared_error', 'max_depth': 60, 'min_weight_fraction_leaf': 0.01, 'max_leaf_nodes': 150, 'bootstrap': False, 'ccp_alpha': 0.006}. Best is trial 1828 with value: -0.15292978335836716.
[I 2025-04-16 01:03:49,771] Trial 2105 finished with value: -0.1936417107583833 and parameters: {'n_estimators': 4248, 'min_samples_split': 96, 'max_features': 1.0, 'min_samples_leaf': 12, 'criterion': 'absolute_error', 'max_depth': 60, 'min_weight_fraction_leaf': 0.01, 'max_leaf_nodes': 150, 'bootstrap': False, 'ccp_alpha': 0.0}. Best is trial 1828 with value: -0.15292978335836716.
[I 2025-04-16 01:03:53,179] Trial 2106 finished with value: -0.1936417107583833 and parameters: {'n_estimators': 3736, 'min_samples_split': 30, 'max_features': 0.9500000000000001, 'min_samples_leaf': 14, 'criterion': 'absolute_error', 'max_depth': 60, 'min_weight_fraction_leaf': 0.0, 'max_leaf_nodes': 150, 'bootstrap': False, 'ccp_alpha': 0.01}. Best is trial 1828 with value: -0.15292978335836716.
[I 2025-04-16 01:03:56,953] Trial 2107 finished with value: -0.1936417107583833 and parameters: {'n_estimators': 4070, 'min_samples_split': 16, 'max_features': 0.98, 'min_samples_leaf': 17, 'criterion': 'absolute_error', 'max_depth': 60, 'min_weight_fraction_leaf': 0.01, 'max_leaf_nodes': 150, 'bootstrap': False, 'ccp_alpha': 0.023}. Best is trial 1828 with value: -0.15292978335836716.
[I 2025-04-16 01:04:00,724] Trial 2108 finished with value: -0.1936417107583833 and parameters: {'n_estimators': 3921, 'min_samples_split': 2, 'max_features': 0.92, 'min_samples_leaf': 10, 'criterion': 'absolute_error', 'max_depth': 60, 'min_weight_fraction_leaf': 0.01, 'max_leaf_nodes': 150, 'bootstrap': False, 'ccp_alpha': 0.005}. Best is trial 1828 with value: -0.15292978335836716.
[I 2025-04-16 01:04:04,555] Trial 2109 finished with value: -38.14115123244096 and parameters: {'n_estimators': 4243, 'min_samples_split': 21, 'max_features': 0.9400000000000001, 'min_samples_leaf': 12, 'criterion': 'poisson', 'max_depth': 10, 'min_weight_fraction_leaf': 0.01, 'max_leaf_nodes': 150, 'bootstrap': False, 'ccp_alpha': 0.015}. Best is trial 1828 with value: -0.15292978335836716.
[I 2025-04-16 01:04:08,466] Trial 2110 finished with value: -0.1936417107583833 and parameters: {'n_estimators': 4895, 'min_samples_split': 87, 'max_features': 0.97, 'min_samples_leaf': 8, 'criterion': 'absolute_error', 'max_depth': 5, 'min_weight_fraction_leaf': 0.01, 'max_leaf_nodes': 150, 'bootstrap': False, 'ccp_alpha': 0.0}. Best is trial 1828 with value: -0.15292978335836716.
[I 2025-04-16 01:04:12,767] Trial 2111 finished with value: -0.1936417107583833 and parameters: {'n_estimators': 4505, 'min_samples_split': 12, 'max_features': 1.0, 'min_samples_leaf': 14, 'criterion': 'absolute_error', 'max_depth': 60, 'min_weight_fraction_leaf': 0.01, 'max_leaf_nodes': 150, 'bootstrap': False, 'ccp_alpha': 0.006}. Best is trial 1828 with value: -0.15292978335836716.
[I 2025-04-16 01:04:16,376] Trial 2112 finished with value: -0.1936417107583833 and parameters: {'n_estimators': 3861, 'min_samples_split': 7, 'max_features': 0.9600000000000001, 'min_samples_leaf': 16, 'criterion': 'absolute_error', 'max_depth': 60, 'min_weight_fraction_leaf': 0.01, 'max_leaf_nodes': 150, 'bootstrap': False, 'ccp_alpha': 0.011}. Best is trial 1828 with value: -0.15292978335836716.
[I 2025-04-16 01:04:19,375] Trial 2113 finished with value: -8.7584744100436 and parameters: {'n_estimators': 3548, 'min_samples_split': 25, 'max_features': 0.9400000000000001, 'min_samples_leaf': 12, 'criterion': 'absolute_error', 'max_depth': 60, 'min_weight_fraction_leaf': 0.01, 'max_leaf_nodes': 150, 'bootstrap': False, 'ccp_alpha': 0.0}. Best is trial 1828 with value: -0.15292978335836716.
[I 2025-04-16 01:04:23,100] Trial 2114 finished with value: -0.1936417107583833 and parameters: {'n_estimators': 4142, 'min_samples_split': 18, 'max_features': 0.97, 'min_samples_leaf': 10, 'criterion': 'absolute_error', 'max_depth': 60, 'min_weight_fraction_leaf': 0.0, 'max_leaf_nodes': 150, 'bootstrap': False, 'ccp_alpha': 0.006}. Best is trial 1828 with value: -0.15292978335836716.
[I 2025-04-16 01:04:27,240] Trial 2115 finished with value: -0.1936417107583833 and parameters: {'n_estimators': 4379, 'min_samples_split': 14, 'max_features': 0.92, 'min_samples_leaf': 19, 'criterion': 'absolute_error', 'max_depth': 60, 'min_weight_fraction_leaf': 0.01, 'max_leaf_nodes': 150, 'bootstrap': False, 'ccp_alpha': 0.015}. Best is trial 1828 with value: -0.15292978335836716.
[I 2025-04-16 01:04:30,547] Trial 2116 finished with value: -0.1936212938524784 and parameters: {'n_estimators': 3726, 'min_samples_split': 9, 'max_features': 0.99, 'min_samples_leaf': 14, 'criterion': 'absolute_error', 'max_depth': 60, 'min_weight_fraction_leaf': 0.01, 'max_leaf_nodes': 150, 'bootstrap': False, 'ccp_alpha': 0.0}. Best is trial 1828 with value: -0.15292978335836716.
[I 2025-04-16 01:04:34,239] Trial 2117 finished with value: -0.1936417107583833 and parameters: {'n_estimators': 3991, 'min_samples_split': 20, 'max_features': 0.9500000000000001, 'min_samples_leaf': 16, 'criterion': 'absolute_error', 'max_depth': 60, 'min_weight_fraction_leaf': 0.01, 'max_leaf_nodes': 150, 'bootstrap': False, 'ccp_alpha': 0.01}. Best is trial 1828 with value: -0.15292978335836716.
[I 2025-04-16 01:04:38,327] Trial 2118 finished with value: -0.1936417107583833 and parameters: {'n_estimators': 4680, 'min_samples_split': 15, 'max_features': 0.97, 'min_samples_leaf': 12, 'criterion': 'absolute_error', 'max_depth': 60, 'min_weight_fraction_leaf': 0.01, 'max_leaf_nodes': 150, 'bootstrap': False, 'ccp_alpha': 0.005}. Best is trial 1828 with value: -0.15292978335836716.
[I 2025-04-16 01:04:42,018] Trial 2119 finished with value: -17.528986382273835 and parameters: {'n_estimators': 4138, 'min_samples_split': 25, 'max_features': 0.9, 'min_samples_leaf': 14, 'criterion': 'friedman_mse', 'max_depth': 60, 'min_weight_fraction_leaf': 0.0, 'max_leaf_nodes': 20, 'bootstrap': False, 'ccp_alpha': 0.026000000000000002}. Best is trial 1828 with value: -0.15292978335836716.
[I 2025-04-16 01:04:45,556] Trial 2120 finished with value: -0.1936417107583833 and parameters: {'n_estimators': 3830, 'min_samples_split': 12, 'max_features': 0.93, 'min_samples_leaf': 8, 'criterion': 'absolute_error', 'max_depth': 60, 'min_weight_fraction_leaf': 0.01, 'max_leaf_nodes': 150, 'bootstrap': False, 'ccp_alpha': 0.005}. Best is trial 1828 with value: -0.15292978335836716.
[I 2025-04-16 01:04:49,245] Trial 2121 finished with value: -0.1936422719907093 and parameters: {'n_estimators': 4346, 'min_samples_split': 18, 'max_features': 0.98, 'min_samples_leaf': 18, 'criterion': 'absolute_error', 'max_depth': 60, 'min_weight_fraction_leaf': 0.01, 'max_leaf_nodes': 150, 'bootstrap': False, 'ccp_alpha': 0.0}. Best is trial 1828 with value: -0.15292978335836716.
[I 2025-04-16 01:04:52,796] Trial 2122 finished with value: -0.1936417107583833 and parameters: {'n_estimators': 3969, 'min_samples_split': 7, 'max_features': 0.9500000000000001, 'min_samples_leaf': 10, 'criterion': 'absolute_error', 'max_depth': 60, 'min_weight_fraction_leaf': 0.01, 'max_leaf_nodes': 150, 'bootstrap': False, 'ccp_alpha': 0.019}. Best is trial 1828 with value: -0.15292978335836716.
[I 2025-04-16 01:04:56,918] Trial 2123 finished with value: -0.1936417107583833 and parameters: {'n_estimators': 4210, 'min_samples_split': 21, 'max_features': 1.0, 'min_samples_leaf': 13, 'criterion': 'absolute_error', 'max_depth': 60, 'min_weight_fraction_leaf': 0.01, 'max_leaf_nodes': None, 'bootstrap': False, 'ccp_alpha': 0.011}. Best is trial 1828 with value: -0.15292978335836716.
[I 2025-04-16 01:05:00,173] Trial 2124 finished with value: -0.1936417107583833 and parameters: {'n_estimators': 3666, 'min_samples_split': 11, 'max_features': 0.9600000000000001, 'min_samples_leaf': 16, 'criterion': 'absolute_error', 'max_depth': 60, 'min_weight_fraction_leaf': 0.01, 'max_leaf_nodes': 150, 'bootstrap': False, 'ccp_alpha': 0.006}. Best is trial 1828 with value: -0.15292978335836716.
[I 2025-04-16 01:05:04,064] Trial 2125 finished with value: -8.762080561091114 and parameters: {'n_estimators': 4472, 'min_samples_split': 16, 'max_features': 0.93, 'min_samples_leaf': 11, 'criterion': 'absolute_error', 'max_depth': None, 'min_weight_fraction_leaf': 0.01, 'max_leaf_nodes': 150, 'bootstrap': False, 'ccp_alpha': 0.0}. Best is trial 1828 with value: -0.15292978335836716.
[I 2025-04-16 01:05:07,739] Trial 2126 finished with value: -0.1936417107583833 and parameters: {'n_estimators': 4031, 'min_samples_split': 28, 'max_features': 0.98, 'min_samples_leaf': 14, 'criterion': 'absolute_error', 'max_depth': 60, 'min_weight_fraction_leaf': 0.01, 'max_leaf_nodes': 150, 'bootstrap': False, 'ccp_alpha': 0.014}. Best is trial 1828 with value: -0.15292978335836716.
[I 2025-04-16 01:05:11,167] Trial 2127 finished with value: -17.5289863822745 and parameters: {'n_estimators': 3813, 'min_samples_split': 23, 'max_features': 0.9, 'min_samples_leaf': 12, 'criterion': 'squared_error', 'max_depth': 60, 'min_weight_fraction_leaf': 0.0, 'max_leaf_nodes': 150, 'bootstrap': False, 'ccp_alpha': 0.006}. Best is trial 1828 with value: -0.15292978335836716.
[I 2025-04-16 01:05:15,045] Trial 2128 finished with value: -0.1936417107583833 and parameters: {'n_estimators': 4197, 'min_samples_split': 5, 'max_features': 0.9500000000000001, 'min_samples_leaf': 15, 'criterion': 'absolute_error', 'max_depth': 60, 'min_weight_fraction_leaf': 0.01, 'max_leaf_nodes': 150, 'bootstrap': False, 'ccp_alpha': 0.01}. Best is trial 1828 with value: -0.15292978335836716.
[I 2025-04-16 01:05:18,722] Trial 2129 finished with value: -8.781875821232822 and parameters: {'n_estimators': 3994, 'min_samples_split': 14, 'max_features': 0.98, 'min_samples_leaf': 10, 'criterion': 'absolute_error', 'max_depth': 60, 'min_weight_fraction_leaf': 0.01, 'max_leaf_nodes': 300, 'bootstrap': False, 'ccp_alpha': 0.0}. Best is trial 1828 with value: -0.15292978335836716.
[I 2025-04-16 01:05:21,956] Trial 2130 finished with value: -0.1936417107583833 and parameters: {'n_estimators': 3497, 'min_samples_split': 9, 'max_features': 0.92, 'min_samples_leaf': 17, 'criterion': 'absolute_error', 'max_depth': 60, 'min_weight_fraction_leaf': 0.01, 'max_leaf_nodes': 150, 'bootstrap': False, 'ccp_alpha': 0.005}. Best is trial 1828 with value: -0.15292978335836716.
[I 2025-04-16 01:05:25,975] Trial 2131 finished with value: -0.1936417107583833 and parameters: {'n_estimators': 4353, 'min_samples_split': 19, 'max_features': 1.0, 'min_samples_leaf': 8, 'criterion': 'absolute_error', 'max_depth': 60, 'min_weight_fraction_leaf': 0.01, 'max_leaf_nodes': 150, 'bootstrap': False, 'ccp_alpha': 0.015}. Best is trial 1828 with value: -0.15292978335836716.
[I 2025-04-16 01:05:29,479] Trial 2132 finished with value: -0.15907290281095157 and parameters: {'n_estimators': 3717, 'min_samples_split': 16, 'max_features': 0.9400000000000001, 'min_samples_leaf': 13, 'criterion': 'absolute_error', 'max_depth': 60, 'min_weight_fraction_leaf': 0.0, 'max_leaf_nodes': 150, 'bootstrap': False, 'ccp_alpha': 0.0}. Best is trial 1828 with value: -0.15292978335836716.
[I 2025-04-16 01:05:33,813] Trial 2133 finished with value: -0.1936417107583833 and parameters: {'n_estimators': 4587, 'min_samples_split': 2, 'max_features': 0.9600000000000001, 'min_samples_leaf': 11, 'criterion': 'absolute_error', 'max_depth': 10, 'min_weight_fraction_leaf': 0.01, 'max_leaf_nodes': 150, 'bootstrap': False, 'ccp_alpha': 0.009000000000000001}. Best is trial 1828 with value: -0.15292978335836716.
[I 2025-04-16 01:05:37,332] Trial 2134 finished with value: -0.1936417107583833 and parameters: {'n_estimators': 4123, 'min_samples_split': 12, 'max_features': 0.97, 'min_samples_leaf': 15, 'criterion': 'absolute_error', 'max_depth': 60, 'min_weight_fraction_leaf': 0.01, 'max_leaf_nodes': 150, 'bootstrap': False, 'ccp_alpha': 0.005}. Best is trial 1828 with value: -0.15292978335836716.
[I 2025-04-16 01:05:40,966] Trial 2135 finished with value: -30.723739008874798 and parameters: {'n_estimators': 3917, 'min_samples_split': 24, 'max_features': 0.9400000000000001, 'min_samples_leaf': 13, 'criterion': 'poisson', 'max_depth': 60, 'min_weight_fraction_leaf': 0.01, 'max_leaf_nodes': 150, 'bootstrap': False, 'ccp_alpha': 0.01}. Best is trial 1828 with value: -0.15292978335836716.
[I 2025-04-16 01:05:44,888] Trial 2136 finished with value: -0.1936417107583833 and parameters: {'n_estimators': 4289, 'min_samples_split': 20, 'max_features': 0.99, 'min_samples_leaf': 19, 'criterion': 'absolute_error', 'max_depth': 60, 'min_weight_fraction_leaf': 0.01, 'max_leaf_nodes': 150, 'bootstrap': False, 'ccp_alpha': 0.021}. Best is trial 1828 with value: -0.15292978335836716.
[I 2025-04-16 01:05:47,947] Trial 2137 finished with value: -8.779393775806781 and parameters: {'n_estimators': 3715, 'min_samples_split': 30, 'max_features': 0.91, 'min_samples_leaf': 9, 'criterion': 'absolute_error', 'max_depth': 60, 'min_weight_fraction_leaf': 0.01, 'max_leaf_nodes': 150, 'bootstrap': False, 'ccp_alpha': 0.0}. Best is trial 1828 with value: -0.15292978335836716.
[I 2025-04-16 01:05:51,213] Trial 2138 finished with value: -0.1936417107583833 and parameters: {'n_estimators': 3521, 'min_samples_split': 8, 'max_features': 0.9600000000000001, 'min_samples_leaf': 16, 'criterion': 'absolute_error', 'max_depth': 60, 'min_weight_fraction_leaf': 0.01, 'max_leaf_nodes': 150, 'bootstrap': False, 'ccp_alpha': 0.006}. Best is trial 1828 with value: -0.15292978335836716.
[I 2025-04-16 01:05:54,922] Trial 2139 finished with value: -0.1936417107583833 and parameters: {'n_estimators': 3957, 'min_samples_split': 15, 'max_features': 0.93, 'min_samples_leaf': 12, 'criterion': 'absolute_error', 'max_depth': 60, 'min_weight_fraction_leaf': 0.01, 'max_leaf_nodes': 150, 'bootstrap': False, 'ccp_alpha': 0.015}. Best is trial 1828 with value: -0.15292978335836716.
[I 2025-04-16 01:05:58,426] Trial 2140 finished with value: -0.1936417107583833 and parameters: {'n_estimators': 4116, 'min_samples_split': 101, 'max_features': 0.98, 'min_samples_leaf': 14, 'criterion': 'absolute_error', 'max_depth': 5, 'min_weight_fraction_leaf': 0.0, 'max_leaf_nodes': 150, 'bootstrap': False, 'ccp_alpha': 0.0}. Best is trial 1828 with value: -0.15292978335836716.
[I 2025-04-16 01:06:02,457] Trial 2141 finished with value: -0.1936417107583833 and parameters: {'n_estimators': 4476, 'min_samples_split': 11, 'max_features': 0.9600000000000001, 'min_samples_leaf': 10, 'criterion': 'absolute_error', 'max_depth': 60, 'min_weight_fraction_leaf': 0.01, 'max_leaf_nodes': 150, 'bootstrap': False, 'ccp_alpha': 0.01}. Best is trial 1828 with value: -0.15292978335836716.
[I 2025-04-16 01:06:06,209] Trial 2142 finished with value: -0.1936417107583833 and parameters: {'n_estimators': 3836, 'min_samples_split': 18, 'max_features': 1.0, 'min_samples_leaf': 17, 'criterion': 'absolute_error', 'max_depth': 60, 'min_weight_fraction_leaf': 0.01, 'max_leaf_nodes': 150, 'bootstrap': False, 'ccp_alpha': 0.005}. Best is trial 1828 with value: -0.15292978335836716.
[I 2025-04-16 01:06:09,696] Trial 2143 finished with value: -36.54701710335608 and parameters: {'n_estimators': 4211, 'min_samples_split': 22, 'max_features': 0.9400000000000001, 'min_samples_leaf': 12, 'criterion': 'friedman_mse', 'max_depth': 60, 'min_weight_fraction_leaf': 0.01, 'max_leaf_nodes': 150, 'bootstrap': False, 'ccp_alpha': 0.0}. Best is trial 1828 with value: -0.15292978335836716.
[I 2025-04-16 01:06:13,946] Trial 2144 finished with value: -0.1936417107583833 and parameters: {'n_estimators': 4730, 'min_samples_split': 5, 'max_features': 0.98, 'min_samples_leaf': 15, 'criterion': 'absolute_error', 'max_depth': 60, 'min_weight_fraction_leaf': 0.0, 'max_leaf_nodes': 150, 'bootstrap': False, 'ccp_alpha': 0.011}. Best is trial 1828 with value: -0.15292978335836716.
[I 2025-04-16 01:06:18,159] Trial 2145 finished with value: -0.1936417107583833 and parameters: {'n_estimators': 4061, 'min_samples_split': 13, 'max_features': 0.91, 'min_samples_leaf': 8, 'criterion': 'absolute_error', 'max_depth': 60, 'min_weight_fraction_leaf': 0.01, 'max_leaf_nodes': 150, 'bootstrap': False, 'ccp_alpha': 0.005}. Best is trial 1828 with value: -0.15292978335836716.
[I 2025-04-16 01:06:22,262] Trial 2146 finished with value: -0.1936417107583833 and parameters: {'n_estimators': 4368, 'min_samples_split': 17, 'max_features': 0.9600000000000001, 'min_samples_leaf': 13, 'criterion': 'absolute_error', 'max_depth': 60, 'min_weight_fraction_leaf': 0.01, 'max_leaf_nodes': 150, 'bootstrap': False, 'ccp_alpha': 0.018000000000000002}. Best is trial 1828 with value: -0.15292978335836716.
[I 2025-04-16 01:06:25,721] Trial 2147 finished with value: -0.1936417107583833 and parameters: {'n_estimators': 3739, 'min_samples_split': 9, 'max_features': 0.9400000000000001, 'min_samples_leaf': 11, 'criterion': 'absolute_error', 'max_depth': 60, 'min_weight_fraction_leaf': 0.01, 'max_leaf_nodes': 150, 'bootstrap': False, 'ccp_alpha': 0.006}. Best is trial 1828 with value: -0.15292978335836716.
[I 2025-04-16 01:06:28,634] Trial 2148 finished with value: -0.1936422721912651 and parameters: {'n_estimators': 3550, 'min_samples_split': 23, 'max_features': 0.98, 'min_samples_leaf': 20, 'criterion': 'absolute_error', 'max_depth': 60, 'min_weight_fraction_leaf': 0.01, 'max_leaf_nodes': 20, 'bootstrap': False, 'ccp_alpha': 0.0}. Best is trial 1828 with value: -0.15292978335836716.
[I 2025-04-16 01:06:31,973] Trial 2149 finished with value: -0.1936417107583833 and parameters: {'n_estimators': 3885, 'min_samples_split': 15, 'max_features': 0.92, 'min_samples_leaf': 15, 'criterion': 'absolute_error', 'max_depth': 60, 'min_weight_fraction_leaf': 0.01, 'max_leaf_nodes': 150, 'bootstrap': False, 'ccp_alpha': 0.013000000000000001}. Best is trial 1828 with value: -0.15292978335836716.
[I 2025-04-16 01:06:35,705] Trial 2150 finished with value: -0.1936417107583833 and parameters: {'n_estimators': 4184, 'min_samples_split': 26, 'max_features': 0.9600000000000001, 'min_samples_leaf': 17, 'criterion': 'absolute_error', 'max_depth': 60, 'min_weight_fraction_leaf': 0.01, 'max_leaf_nodes': 150, 'bootstrap': False, 'ccp_alpha': 0.006}. Best is trial 1828 with value: -0.15292978335836716.
[I 2025-04-16 01:06:39,140] Trial 2151 finished with value: -38.41078970595608 and parameters: {'n_estimators': 4000, 'min_samples_split': 11, 'max_features': 1.0, 'min_samples_leaf': 13, 'criterion': 'squared_error', 'max_depth': 60, 'min_weight_fraction_leaf': 0.0, 'max_leaf_nodes': None, 'bootstrap': False, 'ccp_alpha': 0.0}. Best is trial 1828 with value: -0.15292978335836716.
[I 2025-04-16 01:06:43,188] Trial 2152 finished with value: -0.1936417107583833 and parameters: {'n_estimators': 4472, 'min_samples_split': 19, 'max_features': 0.9400000000000001, 'min_samples_leaf': 10, 'criterion': 'absolute_error', 'max_depth': 60, 'min_weight_fraction_leaf': 0.01, 'max_leaf_nodes': 150, 'bootstrap': False, 'ccp_alpha': 0.011}. Best is trial 1828 with value: -0.15292978335836716.
