[I 2025-04-15 23:14:14,004] Trial 162 finished with value: -0.18259800237028495 and parameters: {'n_estimators': 3118, 'min_samples_split': 165, 'max_features': 0.8400000000000001, 'min_samples_leaf': 34, 'criterion': 'absolute_error', 'max_depth': 30, 'min_weight_fraction_leaf': 0.03, 'max_leaf_nodes': 100, 'bootstrap': True, 'ccp_alpha': 0.093, 'max_samples': 0.5}. Best is trial 74 with value: -0.18167313469617832.
[I 2025-04-15 23:14:17,404] Trial 163 finished with value: -0.18257790940289764 and parameters: {'n_estimators': 3111, 'min_samples_split': 167, 'max_features': 0.8400000000000001, 'min_samples_leaf': 32, 'criterion': 'absolute_error', 'max_depth': 30, 'min_weight_fraction_leaf': 0.03, 'max_leaf_nodes': 100, 'bootstrap': True, 'ccp_alpha': 0.092, 'max_samples': 0.5}. Best is trial 74 with value: -0.18167313469617832.
[I 2025-04-15 23:14:21,093] Trial 164 finished with value: -0.18332034661499463 and parameters: {'n_estimators': 3541, 'min_samples_split': 164, 'max_features': 0.85, 'min_samples_leaf': 34, 'criterion': 'absolute_error', 'max_depth': 30, 'min_weight_fraction_leaf': 0.03, 'max_leaf_nodes': 100, 'bootstrap': True, 'ccp_alpha': 0.076, 'max_samples': 0.5}. Best is trial 74 with value: -0.18167313469617832.
[I 2025-04-15 23:14:23,949] Trial 165 finished with value: -0.1829133471408093 and parameters: {'n_estimators': 2543, 'min_samples_split': 180, 'max_features': 0.81, 'min_samples_leaf': 24, 'criterion': 'absolute_error', 'max_depth': 30, 'min_weight_fraction_leaf': 0.03, 'max_leaf_nodes': 100, 'bootstrap': True, 'ccp_alpha': 0.094, 'max_samples': 0.5}. Best is trial 74 with value: -0.18167313469617832.
[I 2025-04-15 23:14:26,795] Trial 166 finished with value: -0.1828278585214253 and parameters: {'n_estimators': 2626, 'min_samples_split': 163, 'max_features': 0.85, 'min_samples_leaf': 32, 'criterion': 'absolute_error', 'max_depth': 30, 'min_weight_fraction_leaf': 0.03, 'max_leaf_nodes': 100, 'bootstrap': True, 'ccp_alpha': 0.101, 'max_samples': 0.5}. Best is trial 74 with value: -0.18167313469617832.
[I 2025-04-15 23:14:30,181] Trial 167 finished with value: -0.18256640512953376 and parameters: {'n_estimators': 3107, 'min_samples_split': 168, 'max_features': 0.87, 'min_samples_leaf': 26, 'criterion': 'absolute_error', 'max_depth': 30, 'min_weight_fraction_leaf': 0.03, 'max_leaf_nodes': 100, 'bootstrap': True, 'ccp_alpha': 0.089, 'max_samples': 0.5}. Best is trial 74 with value: -0.18167313469617832.
[I 2025-04-15 23:14:33,387] Trial 168 finished with value: -18.02978335540275 and parameters: {'n_estimators': 3081, 'min_samples_split': 157, 'max_features': 0.8400000000000001, 'min_samples_leaf': 26, 'criterion': 'friedman_mse', 'max_depth': 30, 'min_weight_fraction_leaf': 0.03, 'max_leaf_nodes': 100, 'bootstrap': True, 'ccp_alpha': 0.088, 'max_samples': 0.5}. Best is trial 74 with value: -0.18167313469617832.
[I 2025-04-15 23:14:40,296] Trial 169 finished with value: -0.1837500409771557 and parameters: {'n_estimators': 6318, 'min_samples_split': 182, 'max_features': 0.87, 'min_samples_leaf': 34, 'criterion': 'absolute_error', 'max_depth': 30, 'min_weight_fraction_leaf': 0.02, 'max_leaf_nodes': 100, 'bootstrap': True, 'ccp_alpha': 0.08, 'max_samples': 0.5}. Best is trial 74 with value: -0.18167313469617832.
[I 2025-04-15 23:14:44,561] Trial 170 finished with value: -0.18319098251270166 and parameters: {'n_estimators': 3745, 'min_samples_split': 183, 'max_features': 0.81, 'min_samples_leaf': 28, 'criterion': 'absolute_error', 'max_depth': 30, 'min_weight_fraction_leaf': 0.04, 'max_leaf_nodes': 100, 'bootstrap': True, 'ccp_alpha': 0.099, 'max_samples': 0.5}. Best is trial 74 with value: -0.18167313469617832.
[I 2025-04-15 23:14:47,940] Trial 171 finished with value: -0.1825519813328284 and parameters: {'n_estimators': 3102, 'min_samples_split': 170, 'max_features': 0.89, 'min_samples_leaf': 25, 'criterion': 'absolute_error', 'max_depth': 30, 'min_weight_fraction_leaf': 0.03, 'max_leaf_nodes': 100, 'bootstrap': True, 'ccp_alpha': 0.108, 'max_samples': 0.5}. Best is trial 74 with value: -0.18167313469617832.
[I 2025-04-15 23:14:51,694] Trial 172 finished with value: -0.18327432559086163 and parameters: {'n_estimators': 3491, 'min_samples_split': 168, 'max_features': 0.9, 'min_samples_leaf': 39, 'criterion': 'absolute_error', 'max_depth': 30, 'min_weight_fraction_leaf': 0.03, 'max_leaf_nodes': 100, 'bootstrap': True, 'ccp_alpha': 0.095, 'max_samples': 0.5}. Best is trial 74 with value: -0.18167313469617832.
[I 2025-04-15 23:14:55,443] Trial 173 finished with value: -0.18268662898945082 and parameters: {'n_estimators': 3061, 'min_samples_split': 160, 'max_features': 0.86, 'min_samples_leaf': 25, 'criterion': 'absolute_error', 'max_depth': 30, 'min_weight_fraction_leaf': 0.03, 'max_leaf_nodes': 100, 'bootstrap': True, 'ccp_alpha': 0.089, 'max_samples': 0.5}. Best is trial 74 with value: -0.18167313469617832.
[I 2025-04-15 23:14:58,680] Trial 174 finished with value: -0.18263405848804365 and parameters: {'n_estimators': 3043, 'min_samples_split': 159, 'max_features': 0.86, 'min_samples_leaf': 30, 'criterion': 'absolute_error', 'max_depth': 30, 'min_weight_fraction_leaf': 0.03, 'max_leaf_nodes': 100, 'bootstrap': True, 'ccp_alpha': 0.084, 'max_samples': 0.5}. Best is trial 74 with value: -0.18167313469617832.
[I 2025-04-15 23:15:02,370] Trial 175 finished with value: -0.18259094497564132 and parameters: {'n_estimators': 3010, 'min_samples_split': 159, 'max_features': 0.85, 'min_samples_leaf': 29, 'criterion': 'absolute_error', 'max_depth': 30, 'min_weight_fraction_leaf': 0.02, 'max_leaf_nodes': 100, 'bootstrap': True, 'ccp_alpha': 0.08700000000000001, 'max_samples': 0.5}. Best is trial 74 with value: -0.18167313469617832.
[I 2025-04-15 23:15:05,659] Trial 176 finished with value: -0.18273296899495142 and parameters: {'n_estimators': 3077, 'min_samples_split': 144, 'max_features': 0.85, 'min_samples_leaf': 29, 'criterion': 'absolute_error', 'max_depth': 30, 'min_weight_fraction_leaf': 0.02, 'max_leaf_nodes': 100, 'bootstrap': True, 'ccp_alpha': 0.063, 'max_samples': 0.5}. Best is trial 74 with value: -0.18167313469617832.
[I 2025-04-15 23:15:09,006] Trial 177 finished with value: -0.18257081359779423 and parameters: {'n_estimators': 2986, 'min_samples_split': 159, 'max_features': 0.8200000000000001, 'min_samples_leaf': 26, 'criterion': 'absolute_error', 'max_depth': 30, 'min_weight_fraction_leaf': 0.02, 'max_leaf_nodes': 100, 'bootstrap': True, 'ccp_alpha': 0.089, 'max_samples': 0.5}. Best is trial 74 with value: -0.18167313469617832.
[I 2025-04-15 23:15:12,436] Trial 178 finished with value: -0.18258798141927776 and parameters: {'n_estimators': 3009, 'min_samples_split': 159, 'max_features': 0.79, 'min_samples_leaf': 26, 'criterion': 'absolute_error', 'max_depth': 30, 'min_weight_fraction_leaf': 0.02, 'max_leaf_nodes': 100, 'bootstrap': True, 'ccp_alpha': 0.08700000000000001, 'max_samples': 0.5}. Best is trial 74 with value: -0.18167313469617832.
[I 2025-04-15 23:15:16,307] Trial 179 finished with value: -0.18330098527427946 and parameters: {'n_estimators': 3533, 'min_samples_split': 170, 'max_features': 0.79, 'min_samples_leaf': 33, 'criterion': 'absolute_error', 'max_depth': 30, 'min_weight_fraction_leaf': 0.02, 'max_leaf_nodes': 100, 'bootstrap': True, 'ccp_alpha': 0.075, 'max_samples': 0.5}. Best is trial 74 with value: -0.18167313469617832.
[I 2025-04-15 23:15:19,836] Trial 180 finished with value: -0.18258578277076487 and parameters: {'n_estimators': 2991, 'min_samples_split': 151, 'max_features': 0.8300000000000001, 'min_samples_leaf': 31, 'criterion': 'absolute_error', 'max_depth': 30, 'min_weight_fraction_leaf': 0.02, 'max_leaf_nodes': 100, 'bootstrap': True, 'ccp_alpha': 0.084, 'max_samples': 0.5}. Best is trial 74 with value: -0.18167313469617832.
[I 2025-04-15 23:15:23,328] Trial 181 finished with value: -0.18261858256351204 and parameters: {'n_estimators': 3002, 'min_samples_split': 152, 'max_features': 0.8200000000000001, 'min_samples_leaf': 27, 'criterion': 'absolute_error', 'max_depth': 30, 'min_weight_fraction_leaf': 0.02, 'max_leaf_nodes': 100, 'bootstrap': True, 'ccp_alpha': 0.084, 'max_samples': 0.5}. Best is trial 74 with value: -0.18167313469617832.
[I 2025-04-15 23:15:26,404] Trial 182 finished with value: -0.18259117965226895 and parameters: {'n_estimators': 2941, 'min_samples_split': 155, 'max_features': 0.8300000000000001, 'min_samples_leaf': 27, 'criterion': 'absolute_error', 'max_depth': 30, 'min_weight_fraction_leaf': 0.02, 'max_leaf_nodes': 100, 'bootstrap': True, 'ccp_alpha': 0.081, 'max_samples': 0.5}. Best is trial 74 with value: -0.18167313469617832.
[I 2025-04-15 23:15:29,864] Trial 183 finished with value: -0.18259117965226895 and parameters: {'n_estimators': 2941, 'min_samples_split': 151, 'max_features': 0.8300000000000001, 'min_samples_leaf': 27, 'criterion': 'absolute_error', 'max_depth': 30, 'min_weight_fraction_leaf': 0.02, 'max_leaf_nodes': 100, 'bootstrap': True, 'ccp_alpha': 0.084, 'max_samples': 0.5}. Best is trial 74 with value: -0.18167313469617832.
[I 2025-04-15 23:15:33,310] Trial 184 finished with value: -0.1825014497441027 and parameters: {'n_estimators': 2963, 'min_samples_split': 152, 'max_features': 0.8200000000000001, 'min_samples_leaf': 26, 'criterion': 'absolute_error', 'max_depth': 30, 'min_weight_fraction_leaf': 0.02, 'max_leaf_nodes': 100, 'bootstrap': True, 'ccp_alpha': 0.083, 'max_samples': 0.5}. Best is trial 74 with value: -0.18167313469617832.
[I 2025-04-15 23:15:36,087] Trial 185 finished with value: -0.183035957763044 and parameters: {'n_estimators': 2523, 'min_samples_split': 149, 'max_features': 0.8300000000000001, 'min_samples_leaf': 26, 'criterion': 'absolute_error', 'max_depth': 30, 'min_weight_fraction_leaf': 0.02, 'max_leaf_nodes': 100, 'bootstrap': True, 'ccp_alpha': 0.084, 'max_samples': 0.5}. Best is trial 74 with value: -0.18167313469617832.
[I 2025-04-15 23:15:38,168] Trial 186 finished with value: -17.528986382277026 and parameters: {'n_estimators': 2895, 'min_samples_split': 153, 'max_features': 0.8200000000000001, 'min_samples_leaf': 27, 'criterion': 'squared_error', 'max_depth': 20, 'min_weight_fraction_leaf': 0.02, 'max_leaf_nodes': 100, 'bootstrap': False, 'ccp_alpha': 0.063}. Best is trial 74 with value: -0.18167313469617832.
[I 2025-04-15 23:15:41,980] Trial 187 finished with value: -0.18313986738471474 and parameters: {'n_estimators': 3437, 'min_samples_split': 141, 'max_features': 0.81, 'min_samples_leaf': 24, 'criterion': 'absolute_error', 'max_depth': 30, 'min_weight_fraction_leaf': 0.02, 'max_leaf_nodes': 100, 'bootstrap': True, 'ccp_alpha': 0.078, 'max_samples': 0.5}. Best is trial 74 with value: -0.18167313469617832.
[I 2025-04-15 23:15:45,167] Trial 188 finished with value: -0.1828326969537608 and parameters: {'n_estimators': 2675, 'min_samples_split': 153, 'max_features': 0.79, 'min_samples_leaf': 26, 'criterion': 'absolute_error', 'max_depth': 30, 'min_weight_fraction_leaf': 0.02, 'max_leaf_nodes': 100, 'bootstrap': True, 'ccp_alpha': 0.09, 'max_samples': 0.5}. Best is trial 74 with value: -0.18167313469617832.
[I 2025-04-15 23:15:49,389] Trial 189 finished with value: -0.19331969165005886 and parameters: {'n_estimators': 3707, 'min_samples_split': 157, 'max_features': 0.8200000000000001, 'min_samples_leaf': 36, 'criterion': 'absolute_error', 'max_depth': 30, 'min_weight_fraction_leaf': 0.02, 'max_leaf_nodes': 100, 'bootstrap': True, 'ccp_alpha': 0.073, 'max_samples': None}. Best is trial 74 with value: -0.18167313469617832.
[I 2025-04-15 23:15:52,368] Trial 190 finished with value: -18.167312210772977 and parameters: {'n_estimators': 2948, 'min_samples_split': 166, 'max_features': 0.8400000000000001, 'min_samples_leaf': 29, 'criterion': 'poisson', 'max_depth': 30, 'min_weight_fraction_leaf': 0.02, 'max_leaf_nodes': 100, 'bootstrap': True, 'ccp_alpha': 0.094, 'max_samples': 0.5}. Best is trial 74 with value: -0.18167313469617832.
[I 2025-04-15 23:15:55,868] Trial 191 finished with value: -0.1826306072874273 and parameters: {'n_estimators': 2954, 'min_samples_split': 160, 'max_features': 0.8400000000000001, 'min_samples_leaf': 29, 'criterion': 'absolute_error', 'max_depth': 30, 'min_weight_fraction_leaf': 0.02, 'max_leaf_nodes': 100, 'bootstrap': True, 'ccp_alpha': 0.083, 'max_samples': 0.5}. Best is trial 74 with value: -0.18167313469617832.
[I 2025-04-15 23:15:59,047] Trial 192 finished with value: -0.1830176086004469 and parameters: {'n_estimators': 2885, 'min_samples_split': 150, 'max_features': 0.8300000000000001, 'min_samples_leaf': 24, 'criterion': 'absolute_error', 'max_depth': 30, 'min_weight_fraction_leaf': 0.02, 'max_leaf_nodes': 100, 'bootstrap': True, 'ccp_alpha': 0.084, 'max_samples': 0.5}. Best is trial 74 with value: -0.18167313469617832.
[I 2025-04-15 23:16:02,138] Trial 193 finished with value: -0.1830553611209807 and parameters: {'n_estimators': 2520, 'min_samples_split': 162, 'max_features': 0.81, 'min_samples_leaf': 28, 'criterion': 'absolute_error', 'max_depth': 30, 'min_weight_fraction_leaf': 0.02, 'max_leaf_nodes': 100, 'bootstrap': True, 'ccp_alpha': 0.068, 'max_samples': 0.5}. Best is trial 74 with value: -0.18167313469617832.
[I 2025-04-15 23:16:05,941] Trial 194 finished with value: -0.18305349013958067 and parameters: {'n_estimators': 3403, 'min_samples_split': 170, 'max_features': 0.8400000000000001, 'min_samples_leaf': 34, 'criterion': 'absolute_error', 'max_depth': 30, 'min_weight_fraction_leaf': 0.02, 'max_leaf_nodes': 100, 'bootstrap': True, 'ccp_alpha': 0.095, 'max_samples': 0.5}. Best is trial 74 with value: -0.18167313469617832.
[I 2025-04-15 23:16:09,028] Trial 195 finished with value: -0.1827374764020627 and parameters: {'n_estimators': 2771, 'min_samples_split': 156, 'max_features': 0.79, 'min_samples_leaf': 26, 'criterion': 'absolute_error', 'max_depth': 30, 'min_weight_fraction_leaf': 0.02, 'max_leaf_nodes': 100, 'bootstrap': True, 'ccp_alpha': 0.081, 'max_samples': 0.5}. Best is trial 74 with value: -0.18167313469617832.
[I 2025-04-15 23:16:12,852] Trial 196 finished with value: -0.18309174964042305 and parameters: {'n_estimators': 3418, 'min_samples_split': 166, 'max_features': 0.88, 'min_samples_leaf': 30, 'criterion': 'absolute_error', 'max_depth': 30, 'min_weight_fraction_leaf': 0.02, 'max_leaf_nodes': 100, 'bootstrap': True, 'ccp_alpha': 0.089, 'max_samples': 0.5}. Best is trial 74 with value: -0.18167313469617832.
[I 2025-04-15 23:16:16,062] Trial 197 finished with value: -0.18257289137834937 and parameters: {'n_estimators': 2935, 'min_samples_split': 179, 'max_features': 0.8200000000000001, 'min_samples_leaf': 23, 'criterion': 'absolute_error', 'max_depth': 30, 'min_weight_fraction_leaf': 0.02, 'max_leaf_nodes': 100, 'bootstrap': True, 'ccp_alpha': 0.098, 'max_samples': 0.5}. Best is trial 74 with value: -0.18167313469617832.
[I 2025-04-15 23:16:20,338] Trial 198 finished with value: -0.18269671200532372 and parameters: {'n_estimators': 3175, 'min_samples_split': 180, 'max_features': 0.8, 'min_samples_leaf': 24, 'criterion': 'absolute_error', 'max_depth': 30, 'min_weight_fraction_leaf': 0.05, 'max_leaf_nodes': 100, 'bootstrap': True, 'ccp_alpha': 0.099, 'max_samples': 0.5}. Best is trial 74 with value: -0.18167313469617832.
[I 2025-04-15 23:16:23,568] Trial 199 finished with value: -0.19328260803996078 and parameters: {'n_estimators': 2891, 'min_samples_split': 145, 'max_features': 0.8200000000000001, 'min_samples_leaf': 27, 'criterion': 'absolute_error', 'max_depth': 30, 'min_weight_fraction_leaf': 0.02, 'max_leaf_nodes': 50, 'bootstrap': True, 'ccp_alpha': 0.10200000000000001, 'max_samples': 1.0}. Best is trial 74 with value: -0.18167313469617832.
[I 2025-04-15 23:16:26,960] Trial 200 finished with value: -0.18269391259575746 and parameters: {'n_estimators': 3174, 'min_samples_split': 171, 'max_features': 0.88, 'min_samples_leaf': 32, 'criterion': 'absolute_error', 'max_depth': 30, 'min_weight_fraction_leaf': 0.02, 'max_leaf_nodes': 100, 'bootstrap': True, 'ccp_alpha': 0.093, 'max_samples': 0.5}. Best is trial 74 with value: -0.18167313469617832.
[I 2025-04-15 23:16:29,746] Trial 201 finished with value: -0.18283157288208546 and parameters: {'n_estimators': 2695, 'min_samples_split': 162, 'max_features': 0.8400000000000001, 'min_samples_leaf': 23, 'criterion': 'absolute_error', 'max_depth': 30, 'min_weight_fraction_leaf': 0.02, 'max_leaf_nodes': 100, 'bootstrap': True, 'ccp_alpha': 0.084, 'max_samples': 0.5}. Best is trial 74 with value: -0.18167313469617832.
[I 2025-04-15 23:16:32,844] Trial 202 finished with value: -0.1827738479915757 and parameters: {'n_estimators': 2922, 'min_samples_split': 184, 'max_features': 0.8400000000000001, 'min_samples_leaf': 29, 'criterion': 'absolute_error', 'max_depth': 30, 'min_weight_fraction_leaf': 0.02, 'max_leaf_nodes': 100, 'bootstrap': True, 'ccp_alpha': 0.075, 'max_samples': 0.5}. Best is trial 74 with value: -0.18167313469617832.
[I 2025-04-15 23:16:36,697] Trial 203 finished with value: -0.18250556974403098 and parameters: {'n_estimators': 3086, 'min_samples_split': 155, 'max_features': 0.78, 'min_samples_leaf': 26, 'criterion': 'absolute_error', 'max_depth': 30, 'min_weight_fraction_leaf': 0.02, 'max_leaf_nodes': 10, 'bootstrap': True, 'ccp_alpha': 0.08700000000000001, 'max_samples': 0.5}. Best is trial 74 with value: -0.18167313469617832.
[I 2025-04-15 23:16:40,318] Trial 204 finished with value: -0.18324719447557247 and parameters: {'n_estimators': 3480, 'min_samples_split': 187, 'max_features': 0.79, 'min_samples_leaf': 25, 'criterion': 'absolute_error', 'max_depth': 30, 'min_weight_fraction_leaf': 0.02, 'max_leaf_nodes': 10, 'bootstrap': True, 'ccp_alpha': 0.098, 'max_samples': 0.5}. Best is trial 74 with value: -0.18167313469617832.
[I 2025-04-15 23:16:48,244] Trial 205 finished with value: -0.1842220764007627 and parameters: {'n_estimators': 7280, 'min_samples_split': 178, 'max_features': 0.81, 'min_samples_leaf': 26, 'criterion': 'absolute_error', 'max_depth': 30, 'min_weight_fraction_leaf': 0.02, 'max_leaf_nodes': 10, 'bootstrap': True, 'ccp_alpha': 0.09, 'max_samples': 0.5}. Best is trial 74 with value: -0.18167313469617832.
[I 2025-04-15 23:16:51,655] Trial 206 finished with value: -0.18263535677019402 and parameters: {'n_estimators': 3152, 'min_samples_split': 147, 'max_features': 0.78, 'min_samples_leaf': 23, 'criterion': 'absolute_error', 'max_depth': 30, 'min_weight_fraction_leaf': 0.02, 'max_leaf_nodes': 10, 'bootstrap': True, 'ccp_alpha': 0.112, 'max_samples': 0.5}. Best is trial 74 with value: -0.18167313469617832.
[I 2025-04-15 23:16:54,464] Trial 207 finished with value: -0.18286809047350197 and parameters: {'n_estimators': 2638, 'min_samples_split': 155, 'max_features': 0.87, 'min_samples_leaf': 19, 'criterion': 'absolute_error', 'max_depth': 10, 'min_weight_fraction_leaf': 0.02, 'max_leaf_nodes': 100, 'bootstrap': True, 'ccp_alpha': 0.10200000000000001, 'max_samples': 0.5}. Best is trial 74 with value: -0.18167313469617832.
[I 2025-04-15 23:16:58,330] Trial 208 finished with value: -0.18296052591620554 and parameters: {'n_estimators': 3367, 'min_samples_split': 166, 'max_features': 0.8300000000000001, 'min_samples_leaf': 31, 'criterion': 'absolute_error', 'max_depth': 30, 'min_weight_fraction_leaf': 0.02, 'max_leaf_nodes': 100, 'bootstrap': True, 'ccp_alpha': 0.08700000000000001, 'max_samples': 0.5}. Best is trial 74 with value: -0.18167313469617832.
[I 2025-04-15 23:17:01,079] Trial 209 finished with value: -18.202289040816346 and parameters: {'n_estimators': 2448, 'min_samples_split': 171, 'max_features': 0.89, 'min_samples_leaf': 38, 'criterion': 'friedman_mse', 'max_depth': 30, 'min_weight_fraction_leaf': 0.02, 'max_leaf_nodes': 100, 'bootstrap': True, 'ccp_alpha': 0.07, 'max_samples': 0.5}. Best is trial 74 with value: -0.18167313469617832.
[I 2025-04-15 23:17:05,907] Trial 210 finished with value: -0.18341634383246297 and parameters: {'n_estimators': 3638, 'min_samples_split': 152, 'max_features': 0.87, 'min_samples_leaf': 42, 'criterion': 'absolute_error', 'max_depth': 30, 'min_weight_fraction_leaf': 0.02, 'max_leaf_nodes': 20, 'bootstrap': True, 'ccp_alpha': 0.078, 'max_samples': 0.5}. Best is trial 74 with value: -0.18167313469617832.
[I 2025-04-15 23:17:09,449] Trial 211 finished with value: -0.18262455805792208 and parameters: {'n_estimators': 2952, 'min_samples_split': 160, 'max_features': 0.85, 'min_samples_leaf': 29, 'criterion': 'absolute_error', 'max_depth': 30, 'min_weight_fraction_leaf': 0.02, 'max_leaf_nodes': 100, 'bootstrap': True, 'ccp_alpha': 0.096, 'max_samples': 0.5}. Best is trial 74 with value: -0.18167313469617832.
[I 2025-04-15 23:17:12,791] Trial 212 finished with value: -0.18272430610054197 and parameters: {'n_estimators': 3074, 'min_samples_split': 138, 'max_features': 0.8200000000000001, 'min_samples_leaf': 27, 'criterion': 'absolute_error', 'max_depth': 30, 'min_weight_fraction_leaf': 0.02, 'max_leaf_nodes': 100, 'bootstrap': True, 'ccp_alpha': 0.095, 'max_samples': 0.5}. Best is trial 74 with value: -0.18167313469617832.
[I 2025-04-15 23:17:15,971] Trial 213 finished with value: -0.18302970562360557 and parameters: {'n_estimators': 2889, 'min_samples_split': 163, 'max_features': 0.85, 'min_samples_leaf': 28, 'criterion': 'absolute_error', 'max_depth': 30, 'min_weight_fraction_leaf': 0.06, 'max_leaf_nodes': 100, 'bootstrap': True, 'ccp_alpha': 0.105, 'max_samples': 0.5}. Best is trial 74 with value: -0.18167313469617832.
[I 2025-04-15 23:17:19,483] Trial 214 finished with value: -0.18278009653253574 and parameters: {'n_estimators': 3205, 'min_samples_split': 158, 'max_features': 0.81, 'min_samples_leaf': 22, 'criterion': 'absolute_error', 'max_depth': 30, 'min_weight_fraction_leaf': 0.02, 'max_leaf_nodes': 100, 'bootstrap': True, 'ccp_alpha': 0.093, 'max_samples': 0.5}. Best is trial 74 with value: -0.18167313469617832.
