[I 2025-04-16 00:08:22,420] Trial 1222 finished with value: -0.18323730956657083 and parameters: {'n_estimators': 3476, 'min_samples_split': 147, 'max_features': 0.86, 'min_samples_leaf': 27, 'criterion': 'absolute_error', 'max_depth': 45, 'min_weight_fraction_leaf': 0.01, 'max_leaf_nodes': 100, 'bootstrap': True, 'ccp_alpha': 0.069, 'max_samples': 0.5}. Best is trial 621 with value: -0.18112741123578058.
[I 2025-04-16 00:08:25,795] Trial 1223 finished with value: -0.18280926392912877 and parameters: {'n_estimators': 2916, 'min_samples_split': 31, 'max_features': 0.29000000000000004, 'min_samples_leaf': 23, 'criterion': 'absolute_error', 'max_depth': 30, 'min_weight_fraction_leaf': 0.02, 'max_leaf_nodes': 100, 'bootstrap': True, 'ccp_alpha': 0.10300000000000001, 'max_samples': 0.5}. Best is trial 621 with value: -0.18112741123578058.
[I 2025-04-16 00:08:29,593] Trial 1224 finished with value: -0.1827023078690489 and parameters: {'n_estimators': 3177, 'min_samples_split': 163, 'max_features': 0.79, 'min_samples_leaf': 29, 'criterion': 'absolute_error', 'max_depth': 30, 'min_weight_fraction_leaf': 0.07, 'max_leaf_nodes': 150, 'bootstrap': True, 'ccp_alpha': 0.085, 'max_samples': 0.5}. Best is trial 621 with value: -0.18112741123578058.
[I 2025-04-16 00:08:32,731] Trial 1225 finished with value: -0.18285573638715857 and parameters: {'n_estimators': 2682, 'min_samples_split': 176, 'max_features': 0.35000000000000003, 'min_samples_leaf': 32, 'criterion': 'absolute_error', 'max_depth': 45, 'min_weight_fraction_leaf': 0.02, 'max_leaf_nodes': 300, 'bootstrap': True, 'ccp_alpha': 0.166, 'max_samples': 0.5}. Best is trial 621 with value: -0.18112741123578058.
[I 2025-04-16 00:08:33,283] Trial 1226 finished with value: -0.18725624129739868 and parameters: {'n_estimators': 312, 'min_samples_split': 154, 'max_features': 0.39, 'min_samples_leaf': 34, 'criterion': 'absolute_error', 'max_depth': 30, 'min_weight_fraction_leaf': 0.06, 'max_leaf_nodes': 100, 'bootstrap': True, 'ccp_alpha': 0.056, 'max_samples': 0.5}. Best is trial 621 with value: -0.18112741123578058.
[I 2025-04-16 00:08:33,677] Trial 1227 finished with value: -0.19300366959195334 and parameters: {'n_estimators': 172, 'min_samples_split': 188, 'max_features': 0.9600000000000001, 'min_samples_leaf': 27, 'criterion': 'absolute_error', 'max_depth': 20, 'min_weight_fraction_leaf': 0.03, 'max_leaf_nodes': 10, 'bootstrap': True, 'ccp_alpha': 0.045, 'max_samples': 1.0}. Best is trial 621 with value: -0.18112741123578058.
[I 2025-04-16 00:08:37,064] Trial 1228 finished with value: -0.18272719528766204 and parameters: {'n_estimators': 3075, 'min_samples_split': 27, 'max_features': 0.89, 'min_samples_leaf': 25, 'criterion': 'absolute_error', 'max_depth': 45, 'min_weight_fraction_leaf': 0.02, 'max_leaf_nodes': 50, 'bootstrap': True, 'ccp_alpha': 0.094, 'max_samples': 0.5}. Best is trial 621 with value: -0.18112741123578058.
[I 2025-04-16 00:08:39,875] Trial 1229 finished with value: -0.1936417107583833 and parameters: {'n_estimators': 3293, 'min_samples_split': 183, 'max_features': 0.8300000000000001, 'min_samples_leaf': 31, 'criterion': 'absolute_error', 'max_depth': 30, 'min_weight_fraction_leaf': 0.02, 'max_leaf_nodes': 100, 'bootstrap': False, 'ccp_alpha': 0.065}. Best is trial 621 with value: -0.18112741123578058.
[I 2025-04-16 00:08:43,007] Trial 1230 finished with value: -0.18287851890909468 and parameters: {'n_estimators': 2836, 'min_samples_split': 21, 'max_features': 0.06999999999999999, 'min_samples_leaf': 41, 'criterion': 'absolute_error', 'max_depth': None, 'min_weight_fraction_leaf': 0.01, 'max_leaf_nodes': 100, 'bootstrap': True, 'ccp_alpha': 0.079, 'max_samples': 0.5}. Best is trial 621 with value: -0.18112741123578058.
[I 2025-04-16 00:08:49,390] Trial 1231 finished with value: -17.61008438339719 and parameters: {'n_estimators': 6262, 'min_samples_split': 170, 'max_features': 0.6900000000000001, 'min_samples_leaf': 71, 'criterion': 'friedman_mse', 'max_depth': 60, 'min_weight_fraction_leaf': 0.02, 'max_leaf_nodes': None, 'bootstrap': True, 'ccp_alpha': 0.115, 'max_samples': 0.75}. Best is trial 621 with value: -0.18112741123578058.
[I 2025-04-16 00:08:52,548] Trial 1232 finished with value: -0.183165523133593 and parameters: {'n_estimators': 2492, 'min_samples_split': 192, 'max_features': 0.87, 'min_samples_leaf': 29, 'criterion': 'absolute_error', 'max_depth': 30, 'min_weight_fraction_leaf': 0.01, 'max_leaf_nodes': 100, 'bootstrap': True, 'ccp_alpha': 0.08700000000000001, 'max_samples': 0.5}. Best is trial 621 with value: -0.18112741123578058.
[I 2025-04-16 00:08:56,011] Trial 1233 finished with value: -0.18257803998275884 and parameters: {'n_estimators': 3024, 'min_samples_split': 156, 'max_features': 0.12, 'min_samples_leaf': 20, 'criterion': 'absolute_error', 'max_depth': 45, 'min_weight_fraction_leaf': 0.02, 'max_leaf_nodes': 150, 'bootstrap': True, 'ccp_alpha': 0.098, 'max_samples': 0.5}. Best is trial 621 with value: -0.18112741123578058.
[I 2025-04-16 00:09:00,069] Trial 1234 finished with value: -0.18335086542160833 and parameters: {'n_estimators': 3525, 'min_samples_split': 38, 'max_features': 0.93, 'min_samples_leaf': 27, 'criterion': 'absolute_error', 'max_depth': 30, 'min_weight_fraction_leaf': 0.06, 'max_leaf_nodes': 50, 'bootstrap': True, 'ccp_alpha': 0.108, 'max_samples': 0.5}. Best is trial 621 with value: -0.18112741123578058.
[I 2025-04-16 00:09:00,791] Trial 1235 finished with value: -0.18844363527620073 and parameters: {'n_estimators': 422, 'min_samples_split': 166, 'max_features': 0.74, 'min_samples_leaf': 23, 'criterion': 'absolute_error', 'max_depth': 30, 'min_weight_fraction_leaf': 0.02, 'max_leaf_nodes': 100, 'bootstrap': True, 'ccp_alpha': 0.052000000000000005, 'max_samples': 0.5}. Best is trial 621 with value: -0.18112741123578058.
[I 2025-04-16 00:09:05,569] Trial 1236 finished with value: -0.18320832802216097 and parameters: {'n_estimators': 4256, 'min_samples_split': 175, 'max_features': 0.8, 'min_samples_leaf': 35, 'criterion': 'absolute_error', 'max_depth': 5, 'min_weight_fraction_leaf': 0.01, 'max_leaf_nodes': 10, 'bootstrap': True, 'ccp_alpha': 0.067, 'max_samples': 0.5}. Best is trial 621 with value: -0.18112741123578058.
[I 2025-04-16 00:09:09,453] Trial 1237 finished with value: -0.18294620294189748 and parameters: {'n_estimators': 3285, 'min_samples_split': 179, 'max_features': 0.91, 'min_samples_leaf': 31, 'criterion': 'absolute_error', 'max_depth': 45, 'min_weight_fraction_leaf': 0.03, 'max_leaf_nodes': 100, 'bootstrap': True, 'ccp_alpha': 0.073, 'max_samples': 0.5}. Best is trial 621 with value: -0.18112741123578058.
[I 2025-04-16 00:09:17,113] Trial 1238 finished with value: -0.18414645640494925 and parameters: {'n_estimators': 6753, 'min_samples_split': 134, 'max_features': 0.85, 'min_samples_leaf': 29, 'criterion': 'absolute_error', 'max_depth': 30, 'min_weight_fraction_leaf': 0.02, 'max_leaf_nodes': 100, 'bootstrap': True, 'ccp_alpha': 0.122, 'max_samples': 0.5}. Best is trial 621 with value: -0.18112741123578058.
[I 2025-04-16 00:09:17,315] Trial 1239 finished with value: -15.852671328079097 and parameters: {'n_estimators': 4, 'min_samples_split': 160, 'max_features': 0.88, 'min_samples_leaf': 25, 'criterion': 'squared_error', 'max_depth': 45, 'min_weight_fraction_leaf': 0.02, 'max_leaf_nodes': 100, 'bootstrap': True, 'ccp_alpha': 0.281, 'max_samples': 0.5}. Best is trial 621 with value: -0.18112741123578058.
[I 2025-04-16 00:09:20,540] Trial 1240 finished with value: -0.18263450738346484 and parameters: {'n_estimators': 2720, 'min_samples_split': 36, 'max_features': 0.22, 'min_samples_leaf': 33, 'criterion': 'absolute_error', 'max_depth': 30, 'min_weight_fraction_leaf': 0.01, 'max_leaf_nodes': 20, 'bootstrap': True, 'ccp_alpha': 0.06, 'max_samples': 0.5}. Best is trial 621 with value: -0.18112741123578058.
[I 2025-04-16 00:09:24,061] Trial 1241 finished with value: -0.1830897358903661 and parameters: {'n_estimators': 2909, 'min_samples_split': 24, 'max_features': 0.81, 'min_samples_leaf': 28, 'criterion': 'absolute_error', 'max_depth': 10, 'min_weight_fraction_leaf': 0.02, 'max_leaf_nodes': 50, 'bootstrap': True, 'ccp_alpha': 0.101, 'max_samples': 0.5}. Best is trial 621 with value: -0.18112741123578058.
[I 2025-04-16 00:09:26,051] Trial 1242 finished with value: -0.18730578270971782 and parameters: {'n_estimators': 1703, 'min_samples_split': 29, 'max_features': 0.8400000000000001, 'min_samples_leaf': 26, 'criterion': 'absolute_error', 'max_depth': 20, 'min_weight_fraction_leaf': 0.02, 'max_leaf_nodes': 150, 'bootstrap': True, 'ccp_alpha': 0.088, 'max_samples': 0.5}. Best is trial 621 with value: -0.18112741123578058.
[I 2025-04-16 00:09:27,291] Trial 1243 finished with value: -0.18660690276837033 and parameters: {'n_estimators': 946, 'min_samples_split': 167, 'max_features': 0.89, 'min_samples_leaf': 57, 'criterion': 'absolute_error', 'max_depth': 30, 'min_weight_fraction_leaf': 0.01, 'max_leaf_nodes': 100, 'bootstrap': True, 'ccp_alpha': 0.133, 'max_samples': 0.5}. Best is trial 621 with value: -0.18112741123578058.
[I 2025-04-16 00:09:29,197] Trial 1244 finished with value: -0.18642137654671678 and parameters: {'n_estimators': 1402, 'min_samples_split': 151, 'max_features': 0.47000000000000003, 'min_samples_leaf': 37, 'criterion': 'absolute_error', 'max_depth': 45, 'min_weight_fraction_leaf': 0.01, 'max_leaf_nodes': 100, 'bootstrap': True, 'ccp_alpha': 0.075, 'max_samples': 0.5}. Best is trial 621 with value: -0.18112741123578058.
[I 2025-04-16 00:09:32,732] Trial 1245 finished with value: -0.18259640233345592 and parameters: {'n_estimators': 3121, 'min_samples_split': 171, 'max_features': 0.76, 'min_samples_leaf': 31, 'criterion': 'absolute_error', 'max_depth': None, 'min_weight_fraction_leaf': 0.03, 'max_leaf_nodes': 100, 'bootstrap': True, 'ccp_alpha': 0.095, 'max_samples': 0.5}. Best is trial 621 with value: -0.18112741123578058.
[I 2025-04-16 00:09:33,170] Trial 1246 finished with value: -0.19302843207842738 and parameters: {'n_estimators': 179, 'min_samples_split': 185, 'max_features': 0.9400000000000001, 'min_samples_leaf': 48, 'criterion': 'absolute_error', 'max_depth': 60, 'min_weight_fraction_leaf': 0.04, 'max_leaf_nodes': 10, 'bootstrap': True, 'ccp_alpha': 0.082, 'max_samples': None}. Best is trial 621 with value: -0.18112741123578058.
[I 2025-04-16 00:09:36,844] Trial 1247 finished with value: -17.871649291438896 and parameters: {'n_estimators': 3374, 'min_samples_split': 15, 'max_features': 0.86, 'min_samples_leaf': 66, 'criterion': 'poisson', 'max_depth': 30, 'min_weight_fraction_leaf': 0.05, 'max_leaf_nodes': None, 'bootstrap': True, 'ccp_alpha': 0.063, 'max_samples': 0.5}. Best is trial 621 with value: -0.18112741123578058.
[I 2025-04-16 00:09:37,588] Trial 1248 finished with value: -0.1936417107583833 and parameters: {'n_estimators': 663, 'min_samples_split': 162, 'max_features': 0.16, 'min_samples_leaf': 21, 'criterion': 'absolute_error', 'max_depth': 5, 'min_weight_fraction_leaf': 0.02, 'max_leaf_nodes': 100, 'bootstrap': False, 'ccp_alpha': 0.107}. Best is trial 621 with value: -0.18112741123578058.
[I 2025-04-16 00:09:40,087] Trial 1249 finished with value: -0.18498067631909051 and parameters: {'n_estimators': 2050, 'min_samples_split': 200, 'max_features': 0.26, 'min_samples_leaf': 24, 'criterion': 'absolute_error', 'max_depth': 45, 'min_weight_fraction_leaf': 0.06, 'max_leaf_nodes': 150, 'bootstrap': True, 'ccp_alpha': 0.23700000000000002, 'max_samples': 0.5}. Best is trial 621 with value: -0.18112741123578058.
[I 2025-04-16 00:09:43,135] Trial 1250 finished with value: -0.18298962657247703 and parameters: {'n_estimators': 2530, 'min_samples_split': 157, 'max_features': 0.33, 'min_samples_leaf': 78, 'criterion': 'absolute_error', 'max_depth': 30, 'min_weight_fraction_leaf': 0.02, 'max_leaf_nodes': 50, 'bootstrap': True, 'ccp_alpha': 0.057, 'max_samples': 0.5}. Best is trial 621 with value: -0.18112741123578058.
[I 2025-04-16 00:09:46,528] Trial 1251 finished with value: -0.19328236052199407 and parameters: {'n_estimators': 2889, 'min_samples_split': 33, 'max_features': 0.91, 'min_samples_leaf': 30, 'criterion': 'absolute_error', 'max_depth': 30, 'min_weight_fraction_leaf': 0.03, 'max_leaf_nodes': 100, 'bootstrap': True, 'ccp_alpha': 0.05, 'max_samples': 1.0}. Best is trial 621 with value: -0.18112741123578058.
[I 2025-04-16 00:09:50,745] Trial 1252 finished with value: -0.1834605463528954 and parameters: {'n_estimators': 3657, 'min_samples_split': 20, 'max_features': 0.8400000000000001, 'min_samples_leaf': 33, 'criterion': 'absolute_error', 'max_depth': 45, 'min_weight_fraction_leaf': 0.0, 'max_leaf_nodes': 100, 'bootstrap': True, 'ccp_alpha': 0.07, 'max_samples': 0.5}. Best is trial 621 with value: -0.18112741123578058.
[I 2025-04-16 00:09:54,220] Trial 1253 finished with value: -0.18265456305490463 and parameters: {'n_estimators': 3160, 'min_samples_split': 173, 'max_features': 0.87, 'min_samples_leaf': 28, 'criterion': 'absolute_error', 'max_depth': 30, 'min_weight_fraction_leaf': 0.02, 'max_leaf_nodes': 100, 'bootstrap': True, 'ccp_alpha': 0.078, 'max_samples': 0.5}. Best is trial 621 with value: -0.18112741123578058.
[I 2025-04-16 00:09:57,463] Trial 1254 finished with value: -0.1827935701560423 and parameters: {'n_estimators': 2701, 'min_samples_split': 147, 'max_features': 0.8200000000000001, 'min_samples_leaf': 17, 'criterion': 'absolute_error', 'max_depth': 30, 'min_weight_fraction_leaf': 0.02, 'max_leaf_nodes': 100, 'bootstrap': True, 'ccp_alpha': 0.113, 'max_samples': 0.5}. Best is trial 621 with value: -0.18112741123578058.
[I 2025-04-16 00:10:00,753] Trial 1255 finished with value: -18.042276202669534 and parameters: {'n_estimators': 3103, 'min_samples_split': 176, 'max_features': 0.77, 'min_samples_leaf': 35, 'criterion': 'friedman_mse', 'max_depth': 45, 'min_weight_fraction_leaf': 0.01, 'max_leaf_nodes': 300, 'bootstrap': True, 'ccp_alpha': 0.089, 'max_samples': 0.75}. Best is trial 621 with value: -0.18112741123578058.
[I 2025-04-16 00:10:04,890] Trial 1256 finished with value: -0.18299427571169705 and parameters: {'n_estimators': 3380, 'min_samples_split': 182, 'max_features': 0.65, 'min_samples_leaf': 26, 'criterion': 'absolute_error', 'max_depth': 30, 'min_weight_fraction_leaf': 0.01, 'max_leaf_nodes': 150, 'bootstrap': True, 'ccp_alpha': 0.10200000000000001, 'max_samples': 0.5}. Best is trial 621 with value: -0.18112741123578058.
[I 2025-04-16 00:10:08,504] Trial 1257 finished with value: -0.1824953795917304 and parameters: {'n_estimators': 2961, 'min_samples_split': 141, 'max_features': 0.89, 'min_samples_leaf': 13, 'criterion': 'absolute_error', 'max_depth': 20, 'min_weight_fraction_leaf': 0.02, 'max_leaf_nodes': 10, 'bootstrap': True, 'ccp_alpha': 0.04, 'max_samples': 0.5}. Best is trial 621 with value: -0.18112741123578058.
[I 2025-04-16 00:10:11,451] Trial 1258 finished with value: -0.18286809047350197 and parameters: {'n_estimators': 2638, 'min_samples_split': 140, 'max_features': 0.92, 'min_samples_leaf': 10, 'criterion': 'absolute_error', 'max_depth': 20, 'min_weight_fraction_leaf': 0.02, 'max_leaf_nodes': 10, 'bootstrap': True, 'ccp_alpha': 0.056, 'max_samples': 0.5}. Best is trial 621 with value: -0.18112741123578058.
[I 2025-04-16 00:10:14,226] Trial 1259 finished with value: -0.1837199306740452 and parameters: {'n_estimators': 2284, 'min_samples_split': 143, 'max_features': 0.9, 'min_samples_leaf': 13, 'criterion': 'absolute_error', 'max_depth': 20, 'min_weight_fraction_leaf': 0.0, 'max_leaf_nodes': 10, 'bootstrap': True, 'ccp_alpha': 0.045, 'max_samples': 0.5}. Best is trial 621 with value: -0.18112741123578058.
[I 2025-04-16 00:10:17,401] Trial 1260 finished with value: -0.18292038380772163 and parameters: {'n_estimators': 2829, 'min_samples_split': 142, 'max_features': 0.91, 'min_samples_leaf': 8, 'criterion': 'absolute_error', 'max_depth': 20, 'min_weight_fraction_leaf': 0.02, 'max_leaf_nodes': 10, 'bootstrap': True, 'ccp_alpha': 0.036000000000000004, 'max_samples': 0.5}. Best is trial 621 with value: -0.18112741123578058.
[I 2025-04-16 00:10:20,734] Trial 1261 finished with value: -0.18344257870486264 and parameters: {'n_estimators': 2457, 'min_samples_split': 136, 'max_features': 0.93, 'min_samples_leaf': 6, 'criterion': 'absolute_error', 'max_depth': None, 'min_weight_fraction_leaf': 0.02, 'max_leaf_nodes': 10, 'bootstrap': True, 'ccp_alpha': 0.027, 'max_samples': 0.5}. Best is trial 621 with value: -0.18112741123578058.
[I 2025-04-16 00:10:30,252] Trial 1262 finished with value: -0.184654949085337 and parameters: {'n_estimators': 8226, 'min_samples_split': 129, 'max_features': 0.9, 'min_samples_leaf': 3, 'criterion': 'absolute_error', 'max_depth': 45, 'min_weight_fraction_leaf': 0.02, 'max_leaf_nodes': 10, 'bootstrap': True, 'ccp_alpha': 0.043000000000000003, 'max_samples': 0.5}. Best is trial 621 with value: -0.18112741123578058.
[I 2025-04-16 00:10:30,919] Trial 1263 finished with value: -0.18776889655115472 and parameters: {'n_estimators': 357, 'min_samples_split': 147, 'max_features': 0.9500000000000001, 'min_samples_leaf': 11, 'criterion': 'absolute_error', 'max_depth': 20, 'min_weight_fraction_leaf': 0.0, 'max_leaf_nodes': 10, 'bootstrap': True, 'ccp_alpha': 0.026000000000000002, 'max_samples': 0.5}. Best is trial 621 with value: -0.18112741123578058.
[I 2025-04-16 00:10:34,201] Trial 1264 finished with value: -18.13093420532213 and parameters: {'n_estimators': 2985, 'min_samples_split': 144, 'max_features': 0.89, 'min_samples_leaf': 11, 'criterion': 'squared_error', 'max_depth': 20, 'min_weight_fraction_leaf': 0.01, 'max_leaf_nodes': 10, 'bootstrap': True, 'ccp_alpha': 0.037, 'max_samples': 0.5}. Best is trial 621 with value: -0.18112741123578058.
[I 2025-04-16 00:10:34,599] Trial 1265 finished with value: -0.18456994199389842 and parameters: {'n_estimators': 167, 'min_samples_split': 140, 'max_features': 0.89, 'min_samples_leaf': 6, 'criterion': 'absolute_error', 'max_depth': 20, 'min_weight_fraction_leaf': 0.02, 'max_leaf_nodes': 10, 'bootstrap': True, 'ccp_alpha': 0.038, 'max_samples': 0.5}. Best is trial 621 with value: -0.18112741123578058.
[I 2025-04-16 00:10:37,717] Trial 1266 finished with value: -0.18286424833172737 and parameters: {'n_estimators': 2811, 'min_samples_split': 27, 'max_features': 0.92, 'min_samples_leaf': 5, 'criterion': 'absolute_error', 'max_depth': 20, 'min_weight_fraction_leaf': 0.01, 'max_leaf_nodes': 10, 'bootstrap': True, 'ccp_alpha': 0.04, 'max_samples': 0.5}. Best is trial 621 with value: -0.18112741123578058.
[I 2025-04-16 00:10:41,231] Trial 1267 finished with value: -0.18262749703525297 and parameters: {'n_estimators': 3005, 'min_samples_split': 24, 'max_features': 0.88, 'min_samples_leaf': 2, 'criterion': 'absolute_error', 'max_depth': 20, 'min_weight_fraction_leaf': 0.05, 'max_leaf_nodes': 10, 'bootstrap': True, 'ccp_alpha': 0.049, 'max_samples': 0.5}. Best is trial 621 with value: -0.18112741123578058.
[I 2025-04-16 00:10:43,615] Trial 1268 finished with value: -0.1936417107583833 and parameters: {'n_estimators': 2675, 'min_samples_split': 177, 'max_features': 0.9400000000000001, 'min_samples_leaf': 11, 'criterion': 'absolute_error', 'max_depth': 20, 'min_weight_fraction_leaf': 0.02, 'max_leaf_nodes': 10, 'bootstrap': False, 'ccp_alpha': 0.016}. Best is trial 621 with value: -0.18112741123578058.
[I 2025-04-16 00:10:43,824] Trial 1269 finished with value: -0.1936300657214804 and parameters: {'n_estimators': 2, 'min_samples_split': 149, 'max_features': 0.97, 'min_samples_leaf': 3, 'criterion': 'absolute_error', 'max_depth': 20, 'min_weight_fraction_leaf': 0.03, 'max_leaf_nodes': 10, 'bootstrap': True, 'ccp_alpha': 0.026000000000000002, 'max_samples': 0.5}. Best is trial 621 with value: -0.18112741123578058.
[I 2025-04-16 00:10:44,600] Trial 1270 finished with value: -0.1869718388938924 and parameters: {'n_estimators': 553, 'min_samples_split': 90, 'max_features': 0.88, 'min_samples_leaf': 15, 'criterion': 'absolute_error', 'max_depth': 20, 'min_weight_fraction_leaf': 0.02, 'max_leaf_nodes': 10, 'bootstrap': True, 'ccp_alpha': 0.032, 'max_samples': 0.5}. Best is trial 621 with value: -0.18112741123578058.
[I 2025-04-16 00:10:48,323] Trial 1271 finished with value: -0.18276904947146563 and parameters: {'n_estimators': 3201, 'min_samples_split': 10, 'max_features': 0.5800000000000001, 'min_samples_leaf': 14, 'criterion': 'absolute_error', 'max_depth': 20, 'min_weight_fraction_leaf': 0.01, 'max_leaf_nodes': 10, 'bootstrap': True, 'ccp_alpha': 0.032, 'max_samples': 0.5}. Best is trial 621 with value: -0.18112741123578058.
[I 2025-04-16 00:10:51,471] Trial 1272 finished with value: -18.054290437260754 and parameters: {'n_estimators': 2966, 'min_samples_split': 37, 'max_features': 0.92, 'min_samples_leaf': 13, 'criterion': 'poisson', 'max_depth': 20, 'min_weight_fraction_leaf': 0.01, 'max_leaf_nodes': 10, 'bootstrap': True, 'ccp_alpha': 0.185, 'max_samples': None}. Best is trial 621 with value: -0.18112741123578058.
[I 2025-04-16 00:10:54,711] Trial 1273 finished with value: -0.1829924102448152 and parameters: {'n_estimators': 2577, 'min_samples_split': 168, 'max_features': 0.91, 'min_samples_leaf': 21, 'criterion': 'absolute_error', 'max_depth': 20, 'min_weight_fraction_leaf': 0.06, 'max_leaf_nodes': 10, 'bootstrap': True, 'ccp_alpha': 0.031, 'max_samples': 0.5}. Best is trial 621 with value: -0.18112741123578058.
[I 2025-04-16 00:10:58,119] Trial 1274 finished with value: -0.18296658285167222 and parameters: {'n_estimators': 2867, 'min_samples_split': 31, 'max_features': 0.87, 'min_samples_leaf': 14, 'criterion': 'absolute_error', 'max_depth': 20, 'min_weight_fraction_leaf': 0.02, 'max_leaf_nodes': 10, 'bootstrap': True, 'ccp_alpha': 0.046, 'max_samples': 0.5}. Best is trial 621 with value: -0.18112741123578058.
