[I 2025-04-16 01:39:09,907] Trial 2719 finished with value: -0.08665648758134117 and parameters: {'n_estimators': 3507, 'min_samples_split': 9, 'max_features': 0.86, 'min_samples_leaf': 3, 'criterion': 'absolute_error', 'max_depth': 5, 'min_weight_fraction_leaf': 0.0, 'max_leaf_nodes': 20, 'bootstrap': False, 'ccp_alpha': 0.005}. Best is trial 2681 with value: 0.02445864841594616.
[I 2025-04-16 01:39:12,609] Trial 2720 finished with value: -17.528986382276777 and parameters: {'n_estimators': 3004, 'min_samples_split': 6, 'max_features': 0.8400000000000001, 'min_samples_leaf': 7, 'criterion': 'poisson', 'max_depth': 5, 'min_weight_fraction_leaf': 0.0, 'max_leaf_nodes': 20, 'bootstrap': False, 'ccp_alpha': 0.025}. Best is trial 2681 with value: 0.02445864841594616.
[I 2025-04-16 01:39:15,690] Trial 2721 finished with value: -0.95363369406364 and parameters: {'n_estimators': 3333, 'min_samples_split': 2, 'max_features': 0.9, 'min_samples_leaf': 1, 'criterion': 'absolute_error', 'max_depth': 5, 'min_weight_fraction_leaf': 0.0, 'max_leaf_nodes': 20, 'bootstrap': False, 'ccp_alpha': 0.004}. Best is trial 2681 with value: 0.02445864841594616.
[I 2025-04-16 01:39:18,741] Trial 2722 finished with value: -0.1936417107583833 and parameters: {'n_estimators': 3231, 'min_samples_split': 8, 'max_features': 0.5800000000000001, 'min_samples_leaf': 5, 'criterion': 'absolute_error', 'max_depth': 5, 'min_weight_fraction_leaf': 0.0, 'max_leaf_nodes': 20, 'bootstrap': False, 'ccp_alpha': 0.01}. Best is trial 2681 with value: 0.02445864841594616.
[I 2025-04-16 01:39:21,928] Trial 2723 finished with value: -0.1936417107583833 and parameters: {'n_estimators': 3522, 'min_samples_split': 11, 'max_features': 0.87, 'min_samples_leaf': 3, 'criterion': 'absolute_error', 'max_depth': 5, 'min_weight_fraction_leaf': 0.0, 'max_leaf_nodes': 20, 'bootstrap': False, 'ccp_alpha': 0.016}. Best is trial 2681 with value: 0.02445864841594616.
[I 2025-04-16 01:39:25,102] Trial 2724 finished with value: -3.4475605259696183 and parameters: {'n_estimators': 3550, 'min_samples_split': 5, 'max_features': 0.89, 'min_samples_leaf': 1, 'criterion': 'absolute_error', 'max_depth': 5, 'min_weight_fraction_leaf': 0.0, 'max_leaf_nodes': 20, 'bootstrap': False, 'ccp_alpha': 0.004}. Best is trial 2681 with value: 0.02445864841594616.
[I 2025-04-16 01:39:28,065] Trial 2725 finished with value: -0.1936417107583833 and parameters: {'n_estimators': 3186, 'min_samples_split': 11, 'max_features': 0.89, 'min_samples_leaf': 5, 'criterion': 'absolute_error', 'max_depth': 5, 'min_weight_fraction_leaf': 0.0, 'max_leaf_nodes': 20, 'bootstrap': False, 'ccp_alpha': 0.011}. Best is trial 2681 with value: 0.02445864841594616.
[I 2025-04-16 01:39:31,221] Trial 2726 finished with value: -0.1936417107583833 and parameters: {'n_estimators': 3565, 'min_samples_split': 2, 'max_features': 0.9, 'min_samples_leaf': 7, 'criterion': 'absolute_error', 'max_depth': 5, 'min_weight_fraction_leaf': 0.0, 'max_leaf_nodes': 20, 'bootstrap': False, 'ccp_alpha': 0.02}. Best is trial 2681 with value: 0.02445864841594616.
[I 2025-04-16 01:39:34,317] Trial 2727 finished with value: -3.2799836460479077 and parameters: {'n_estimators': 3364, 'min_samples_split': 6, 'max_features': 0.87, 'min_samples_leaf': 3, 'criterion': 'absolute_error', 'max_depth': 5, 'min_weight_fraction_leaf': 0.0, 'max_leaf_nodes': 20, 'bootstrap': False, 'ccp_alpha': 0.004}. Best is trial 2681 with value: 0.02445864841594616.
[I 2025-04-16 01:39:37,209] Trial 2728 finished with value: -0.1936417107583833 and parameters: {'n_estimators': 3044, 'min_samples_split': 11, 'max_features': 0.85, 'min_samples_leaf': 5, 'criterion': 'absolute_error', 'max_depth': 5, 'min_weight_fraction_leaf': 0.0, 'max_leaf_nodes': 20, 'bootstrap': False, 'ccp_alpha': 0.165}. Best is trial 2681 with value: 0.02445864841594616.
[I 2025-04-16 01:39:40,353] Trial 2729 finished with value: -17.528986382275086 and parameters: {'n_estimators': 3564, 'min_samples_split': 6, 'max_features': 0.9, 'min_samples_leaf': 1, 'criterion': 'friedman_mse', 'max_depth': 5, 'min_weight_fraction_leaf': 0.0, 'max_leaf_nodes': 20, 'bootstrap': False, 'ccp_alpha': 0.209}. Best is trial 2681 with value: 0.02445864841594616.
[I 2025-04-16 01:39:43,382] Trial 2730 finished with value: -0.1936417107583833 and parameters: {'n_estimators': 3349, 'min_samples_split': 2, 'max_features': 0.9, 'min_samples_leaf': 3, 'criterion': 'absolute_error', 'max_depth': 5, 'min_weight_fraction_leaf': 0.0, 'max_leaf_nodes': 20, 'bootstrap': False, 'ccp_alpha': 0.015}. Best is trial 2681 with value: 0.02445864841594616.
[I 2025-04-16 01:39:46,502] Trial 2731 finished with value: -0.1936417107583833 and parameters: {'n_estimators': 3584, 'min_samples_split': 8, 'max_features': 0.87, 'min_samples_leaf': 7, 'criterion': 'absolute_error', 'max_depth': 5, 'min_weight_fraction_leaf': 0.0, 'max_leaf_nodes': 20, 'bootstrap': False, 'ccp_alpha': 0.01}. Best is trial 2681 with value: 0.02445864841594616.
[I 2025-04-16 01:39:49,605] Trial 2732 finished with value: -0.07887152690729712 and parameters: {'n_estimators': 3168, 'min_samples_split': 11, 'max_features': 0.89, 'min_samples_leaf': 5, 'criterion': 'absolute_error', 'max_depth': 5, 'min_weight_fraction_leaf': 0.0, 'max_leaf_nodes': 20, 'bootstrap': False, 'ccp_alpha': 0.004}. Best is trial 2681 with value: 0.02445864841594616.
[I 2025-04-16 01:39:52,382] Trial 2733 finished with value: -0.1936417107583833 and parameters: {'n_estimators': 2953, 'min_samples_split': 6, 'max_features': 0.9, 'min_samples_leaf': 1, 'criterion': 'absolute_error', 'max_depth': 5, 'min_weight_fraction_leaf': 0.0, 'max_leaf_nodes': 20, 'bootstrap': False, 'ccp_alpha': 0.01}. Best is trial 2681 with value: 0.02445864841594616.
[I 2025-04-16 01:39:55,437] Trial 2734 finished with value: -0.1936417107583833 and parameters: {'n_estimators': 3396, 'min_samples_split': 6, 'max_features': 0.8400000000000001, 'min_samples_leaf': 3, 'criterion': 'absolute_error', 'max_depth': 5, 'min_weight_fraction_leaf': 0.0, 'max_leaf_nodes': 20, 'bootstrap': False, 'ccp_alpha': 0.253}. Best is trial 2681 with value: 0.02445864841594616.
[I 2025-04-16 01:39:58,649] Trial 2735 finished with value: -0.1936417107583833 and parameters: {'n_estimators': 3552, 'min_samples_split': 2, 'max_features': 0.88, 'min_samples_leaf': 5, 'criterion': 'absolute_error', 'max_depth': 5, 'min_weight_fraction_leaf': 0.0, 'max_leaf_nodes': 20, 'bootstrap': False, 'ccp_alpha': 0.021}. Best is trial 2681 with value: 0.02445864841594616.
[I 2025-04-16 01:40:01,659] Trial 2736 finished with value: 0.022883373385265294 and parameters: {'n_estimators': 3273, 'min_samples_split': 9, 'max_features': 0.9, 'min_samples_leaf': 7, 'criterion': 'absolute_error', 'max_depth': 5, 'min_weight_fraction_leaf': 0.0, 'max_leaf_nodes': 20, 'bootstrap': False, 'ccp_alpha': 0.004}. Best is trial 2681 with value: 0.02445864841594616.
[I 2025-04-16 01:40:04,414] Trial 2737 finished with value: -0.08139857085439288 and parameters: {'n_estimators': 2945, 'min_samples_split': 12, 'max_features': 0.86, 'min_samples_leaf': 7, 'criterion': 'absolute_error', 'max_depth': 5, 'min_weight_fraction_leaf': 0.0, 'max_leaf_nodes': 20, 'bootstrap': False, 'ccp_alpha': 0.004}. Best is trial 2681 with value: 0.02445864841594616.
[I 2025-04-16 01:40:07,148] Trial 2738 finished with value: -0.07679998714521888 and parameters: {'n_estimators': 3022, 'min_samples_split': 11, 'max_features': 0.86, 'min_samples_leaf': 6, 'criterion': 'absolute_error', 'max_depth': 5, 'min_weight_fraction_leaf': 0.0, 'max_leaf_nodes': 20, 'bootstrap': False, 'ccp_alpha': 0.004}. Best is trial 2681 with value: 0.02445864841594616.
[I 2025-04-16 01:40:09,633] Trial 2739 finished with value: -15.67376557685697 and parameters: {'n_estimators': 2933, 'min_samples_split': 11, 'max_features': 0.87, 'min_samples_leaf': 7, 'criterion': 'squared_error', 'max_depth': 5, 'min_weight_fraction_leaf': 0.0, 'max_leaf_nodes': 20, 'bootstrap': False, 'ccp_alpha': 0.0}. Best is trial 2681 with value: 0.02445864841594616.
[I 2025-04-16 01:40:12,492] Trial 2740 finished with value: -0.1936417107583833 and parameters: {'n_estimators': 3086, 'min_samples_split': 11, 'max_features': 0.88, 'min_samples_leaf': 7, 'criterion': 'absolute_error', 'max_depth': 5, 'min_weight_fraction_leaf': 0.0, 'max_leaf_nodes': 20, 'bootstrap': False, 'ccp_alpha': 0.01}. Best is trial 2681 with value: 0.02445864841594616.
[I 2025-04-16 01:40:15,322] Trial 2741 finished with value: -0.1936417107583833 and parameters: {'n_estimators': 3276, 'min_samples_split': 11, 'max_features': 0.85, 'min_samples_leaf': 7, 'criterion': 'absolute_error', 'max_depth': 5, 'min_weight_fraction_leaf': 0.0, 'max_leaf_nodes': 20, 'bootstrap': False, 'ccp_alpha': 0.014}. Best is trial 2681 with value: 0.02445864841594616.
[I 2025-04-16 01:40:18,003] Trial 2742 finished with value: -0.07881090696329718 and parameters: {'n_estimators': 3085, 'min_samples_split': 11, 'max_features': 0.8400000000000001, 'min_samples_leaf': 7, 'criterion': 'absolute_error', 'max_depth': 5, 'min_weight_fraction_leaf': 0.0, 'max_leaf_nodes': 20, 'bootstrap': False, 'ccp_alpha': 0.004}. Best is trial 2681 with value: 0.02445864841594616.
[I 2025-04-16 01:40:20,725] Trial 2743 finished with value: -0.1936417107583833 and parameters: {'n_estimators': 3183, 'min_samples_split': 11, 'max_features': 0.88, 'min_samples_leaf': 5, 'criterion': 'absolute_error', 'max_depth': 5, 'min_weight_fraction_leaf': 0.0, 'max_leaf_nodes': 20, 'bootstrap': False, 'ccp_alpha': 0.183}. Best is trial 2681 with value: 0.02445864841594616.
[I 2025-04-16 01:40:23,137] Trial 2744 finished with value: -27.213611446155415 and parameters: {'n_estimators': 2915, 'min_samples_split': 8, 'max_features': 0.9, 'min_samples_leaf': 5, 'criterion': 'poisson', 'max_depth': 5, 'min_weight_fraction_leaf': 0.0, 'max_leaf_nodes': 20, 'bootstrap': False, 'ccp_alpha': 0.01}. Best is trial 2681 with value: 0.02445864841594616.
[I 2025-04-16 01:40:25,962] Trial 2745 finished with value: -11.708257362056994 and parameters: {'n_estimators': 3233, 'min_samples_split': 8, 'max_features': 0.88, 'min_samples_leaf': 3, 'criterion': 'absolute_error', 'max_depth': 5, 'min_weight_fraction_leaf': 0.0, 'max_leaf_nodes': 20, 'bootstrap': False, 'ccp_alpha': 0.0}. Best is trial 2681 with value: 0.02445864841594616.
[I 2025-04-16 01:40:29,113] Trial 2746 finished with value: -0.1936417107583833 and parameters: {'n_estimators': 3227, 'min_samples_split': 8, 'max_features': 0.9, 'min_samples_leaf': 7, 'criterion': 'absolute_error', 'max_depth': 5, 'min_weight_fraction_leaf': 0.0, 'max_leaf_nodes': 20, 'bootstrap': False, 'ccp_alpha': 0.017}. Best is trial 2681 with value: 0.02445864841594616.
[I 2025-04-16 01:40:31,750] Trial 2747 finished with value: -3.2998073400619816 and parameters: {'n_estimators': 3063, 'min_samples_split': 11, 'max_features': 0.7100000000000001, 'min_samples_leaf': 1, 'criterion': 'absolute_error', 'max_depth': 5, 'min_weight_fraction_leaf': 0.0, 'max_leaf_nodes': 20, 'bootstrap': False, 'ccp_alpha': 0.004}. Best is trial 2681 with value: 0.02445864841594616.
[I 2025-04-16 01:40:34,580] Trial 2748 finished with value: -0.1936417107583833 and parameters: {'n_estimators': 3316, 'min_samples_split': 6, 'max_features': 0.87, 'min_samples_leaf': 4, 'criterion': 'absolute_error', 'max_depth': 5, 'min_weight_fraction_leaf': 0.0, 'max_leaf_nodes': 20, 'bootstrap': False, 'ccp_alpha': 0.01}. Best is trial 2681 with value: 0.02445864841594616.
[I 2025-04-16 01:40:37,527] Trial 2749 finished with value: -0.1936417107583833 and parameters: {'n_estimators': 3335, 'min_samples_split': 6, 'max_features': 0.9, 'min_samples_leaf': 5, 'criterion': 'absolute_error', 'max_depth': 5, 'min_weight_fraction_leaf': 0.0, 'max_leaf_nodes': 20, 'bootstrap': False, 'ccp_alpha': 0.028}. Best is trial 2681 with value: 0.02445864841594616.
[I 2025-04-16 01:40:40,452] Trial 2750 finished with value: -0.2069570037063145 and parameters: {'n_estimators': 3091, 'min_samples_split': 11, 'max_features': 0.67, 'min_samples_leaf': 1, 'criterion': 'absolute_error', 'max_depth': 5, 'min_weight_fraction_leaf': 0.0, 'max_leaf_nodes': 20, 'bootstrap': False, 'ccp_alpha': 0.005}. Best is trial 2681 with value: 0.02445864841594616.
[I 2025-04-16 01:40:43,111] Trial 2751 finished with value: -0.1936417107583833 and parameters: {'n_estimators': 2903, 'min_samples_split': 8, 'max_features': 0.86, 'min_samples_leaf': 7, 'criterion': 'absolute_error', 'max_depth': 5, 'min_weight_fraction_leaf': 0.0, 'max_leaf_nodes': 20, 'bootstrap': False, 'ccp_alpha': 0.015}. Best is trial 2681 with value: 0.02445864841594616.
[I 2025-04-16 01:40:46,005] Trial 2752 finished with value: -0.1936417107583833 and parameters: {'n_estimators': 3332, 'min_samples_split': 6, 'max_features': 0.9, 'min_samples_leaf': 3, 'criterion': 'absolute_error', 'max_depth': 5, 'min_weight_fraction_leaf': 0.0, 'max_leaf_nodes': 20, 'bootstrap': False, 'ccp_alpha': 0.01}. Best is trial 2681 with value: 0.02445864841594616.
[I 2025-04-16 01:40:48,794] Trial 2753 finished with value: -11.66395912447063 and parameters: {'n_estimators': 3416, 'min_samples_split': 9, 'max_features': 0.88, 'min_samples_leaf': 3, 'criterion': 'absolute_error', 'max_depth': 5, 'min_weight_fraction_leaf': 0.0, 'max_leaf_nodes': 20, 'bootstrap': False, 'ccp_alpha': 0.0}. Best is trial 2681 with value: 0.02445864841594616.
[I 2025-04-16 01:40:51,644] Trial 2754 finished with value: -17.528986382276223 and parameters: {'n_estimators': 3168, 'min_samples_split': 11, 'max_features': 0.8400000000000001, 'min_samples_leaf': 5, 'criterion': 'friedman_mse', 'max_depth': 5, 'min_weight_fraction_leaf': 0.0, 'max_leaf_nodes': 20, 'bootstrap': False, 'ccp_alpha': 0.005}. Best is trial 2681 with value: 0.02445864841594616.
[I 2025-04-16 01:40:54,653] Trial 2755 finished with value: -0.1936417107583833 and parameters: {'n_estimators': 3444, 'min_samples_split': 60, 'max_features': 0.9, 'min_samples_leaf': 1, 'criterion': 'absolute_error', 'max_depth': 5, 'min_weight_fraction_leaf': 0.0, 'max_leaf_nodes': 20, 'bootstrap': False, 'ccp_alpha': 0.021}. Best is trial 2681 with value: 0.02445864841594616.
[I 2025-04-16 01:40:57,452] Trial 2756 finished with value: -0.1936417107583833 and parameters: {'n_estimators': 3158, 'min_samples_split': 5, 'max_features': 0.88, 'min_samples_leaf': 7, 'criterion': 'absolute_error', 'max_depth': 5, 'min_weight_fraction_leaf': 0.0, 'max_leaf_nodes': 20, 'bootstrap': False, 'ccp_alpha': 0.01}. Best is trial 2681 with value: 0.02445864841594616.
[I 2025-04-16 01:41:00,604] Trial 2757 finished with value: -0.1936417107583833 and parameters: {'n_estimators': 3471, 'min_samples_split': 6, 'max_features': 0.9, 'min_samples_leaf': 3, 'criterion': 'absolute_error', 'max_depth': 5, 'min_weight_fraction_leaf': 0.0, 'max_leaf_nodes': 20, 'bootstrap': False, 'ccp_alpha': 0.016}. Best is trial 2681 with value: 0.02445864841594616.
[I 2025-04-16 01:41:03,703] Trial 2758 finished with value: -0.1936417107583833 and parameters: {'n_estimators': 3302, 'min_samples_split': 2, 'max_features': 0.9, 'min_samples_leaf': 5, 'criterion': 'absolute_error', 'max_depth': 5, 'min_weight_fraction_leaf': 0.0, 'max_leaf_nodes': 20, 'bootstrap': False, 'ccp_alpha': 0.197}. Best is trial 2681 with value: 0.02445864841594616.
[I 2025-04-16 01:41:06,259] Trial 2759 finished with value: -0.1936417107583833 and parameters: {'n_estimators': 2992, 'min_samples_split': 131, 'max_features': 0.86, 'min_samples_leaf': 1, 'criterion': 'absolute_error', 'max_depth': 5, 'min_weight_fraction_leaf': 0.0, 'max_leaf_nodes': 20, 'bootstrap': False, 'ccp_alpha': 0.005}. Best is trial 2681 with value: 0.02445864841594616.
[I 2025-04-16 01:41:09,314] Trial 2760 finished with value: -0.1936417107583833 and parameters: {'n_estimators': 3469, 'min_samples_split': 11, 'max_features': 0.87, 'min_samples_leaf': 3, 'criterion': 'absolute_error', 'max_depth': 5, 'min_weight_fraction_leaf': 0.0, 'max_leaf_nodes': 20, 'bootstrap': False, 'ccp_alpha': 0.01}. Best is trial 2681 with value: 0.02445864841594616.
[I 2025-04-16 01:41:11,965] Trial 2761 finished with value: -8.688783702552868 and parameters: {'n_estimators': 3261, 'min_samples_split': 6, 'max_features': 0.9, 'min_samples_leaf': 7, 'criterion': 'absolute_error', 'max_depth': 5, 'min_weight_fraction_leaf': 0.0, 'max_leaf_nodes': 20, 'bootstrap': False, 'ccp_alpha': 0.0}. Best is trial 2681 with value: 0.02445864841594616.
[I 2025-04-16 01:41:15,022] Trial 2762 finished with value: -17.528986382275217 and parameters: {'n_estimators': 3514, 'min_samples_split': 12, 'max_features': 0.89, 'min_samples_leaf': 5, 'criterion': 'squared_error', 'max_depth': 5, 'min_weight_fraction_leaf': 0.0, 'max_leaf_nodes': 20, 'bootstrap': False, 'ccp_alpha': 0.015}. Best is trial 2681 with value: 0.02445864841594616.
[I 2025-04-16 01:41:17,699] Trial 2763 finished with value: 0.020919967208057555 and parameters: {'n_estimators': 2879, 'min_samples_split': 8, 'max_features': 0.91, 'min_samples_leaf': 3, 'criterion': 'absolute_error', 'max_depth': 5, 'min_weight_fraction_leaf': 0.0, 'max_leaf_nodes': 20, 'bootstrap': False, 'ccp_alpha': 0.005}. Best is trial 2681 with value: 0.02445864841594616.
[I 2025-04-16 01:41:20,364] Trial 2764 finished with value: -11.37149169082126 and parameters: {'n_estimators': 3008, 'min_samples_split': 12, 'max_features': 0.8400000000000001, 'min_samples_leaf': 1, 'criterion': 'absolute_error', 'max_depth': 5, 'min_weight_fraction_leaf': 0.0, 'max_leaf_nodes': 20, 'bootstrap': False, 'ccp_alpha': 0.0}. Best is trial 2681 with value: 0.02445864841594616.
[I 2025-04-16 01:41:22,977] Trial 2765 finished with value: -0.07342312938378778 and parameters: {'n_estimators': 2950, 'min_samples_split': 11, 'max_features': 0.88, 'min_samples_leaf': 5, 'criterion': 'absolute_error', 'max_depth': 5, 'min_weight_fraction_leaf': 0.0, 'max_leaf_nodes': 20, 'bootstrap': False, 'ccp_alpha': 0.005}. Best is trial 2681 with value: 0.02445864841594616.
[I 2025-04-16 01:41:25,578] Trial 2766 finished with value: -0.1936417107583833 and parameters: {'n_estimators': 2870, 'min_samples_split': 11, 'max_features': 0.86, 'min_samples_leaf': 7, 'criterion': 'absolute_error', 'max_depth': 5, 'min_weight_fraction_leaf': 0.0, 'max_leaf_nodes': 20, 'bootstrap': False, 'ccp_alpha': 0.01}. Best is trial 2681 with value: 0.02445864841594616.
[I 2025-04-16 01:41:28,066] Trial 2767 finished with value: -4.15559399402906 and parameters: {'n_estimators': 2778, 'min_samples_split': 11, 'max_features': 0.88, 'min_samples_leaf': 3, 'criterion': 'absolute_error', 'max_depth': 5, 'min_weight_fraction_leaf': 0.0, 'max_leaf_nodes': 20, 'bootstrap': False, 'ccp_alpha': 0.004}. Best is trial 2681 with value: 0.02445864841594616.
[I 2025-04-16 01:41:30,657] Trial 2768 finished with value: -30.566587841831183 and parameters: {'n_estimators': 2900, 'min_samples_split': 9, 'max_features': 0.9, 'min_samples_leaf': 1, 'criterion': 'poisson', 'max_depth': 5, 'min_weight_fraction_leaf': 0.0, 'max_leaf_nodes': 20, 'bootstrap': False, 'ccp_alpha': 0.015}. Best is trial 2681 with value: 0.02445864841594616.
[I 2025-04-16 01:41:33,077] Trial 2769 finished with value: -11.278595160115938 and parameters: {'n_estimators': 2760, 'min_samples_split': 12, 'max_features': 0.86, 'min_samples_leaf': 5, 'criterion': 'absolute_error', 'max_depth': 5, 'min_weight_fraction_leaf': 0.0, 'max_leaf_nodes': 20, 'bootstrap': False, 'ccp_alpha': 0.0}. Best is trial 2681 with value: 0.02445864841594616.
[I 2025-04-16 01:41:35,813] Trial 2770 finished with value: -0.1936417107583833 and parameters: {'n_estimators': 2836, 'min_samples_split': 9, 'max_features': 0.88, 'min_samples_leaf': 3, 'criterion': 'absolute_error', 'max_depth': 5, 'min_weight_fraction_leaf': 0.0, 'max_leaf_nodes': 20, 'bootstrap': False, 'ccp_alpha': 0.022}. Best is trial 2681 with value: 0.02445864841594616.
[I 2025-04-16 01:41:38,436] Trial 2771 finished with value: -0.1936417107583833 and parameters: {'n_estimators': 2812, 'min_samples_split': 12, 'max_features': 0.9, 'min_samples_leaf': 5, 'criterion': 'absolute_error', 'max_depth': 5, 'min_weight_fraction_leaf': 0.0, 'max_leaf_nodes': 20, 'bootstrap': False, 'ccp_alpha': 0.01}. Best is trial 2681 with value: 0.02445864841594616.
[I 2025-04-16 01:41:41,133] Trial 2772 finished with value: -0.1936417107583833 and parameters: {'n_estimators': 2799, 'min_samples_split': 8, 'max_features': 0.91, 'min_samples_leaf': 7, 'criterion': 'absolute_error', 'max_depth': 5, 'min_weight_fraction_leaf': 0.0, 'max_leaf_nodes': 20, 'bootstrap': False, 'ccp_alpha': 0.23600000000000002}. Best is trial 2681 with value: 0.02445864841594616.
[I 2025-04-16 01:41:44,319] Trial 2773 finished with value: -0.1936417107583833 and parameters: {'n_estimators': 2925, 'min_samples_split': 8, 'max_features': 0.88, 'min_samples_leaf': 3, 'criterion': 'absolute_error', 'max_depth': 5, 'min_weight_fraction_leaf': 0.0, 'max_leaf_nodes': 20, 'bootstrap': False, 'ccp_alpha': 0.01}. Best is trial 2681 with value: 0.02445864841594616.
[I 2025-04-16 01:41:47,353] Trial 2774 finished with value: 0.046571421912873 and parameters: {'n_estimators': 3109, 'min_samples_split': 6, 'max_features': 0.8400000000000001, 'min_samples_leaf': 1, 'criterion': 'absolute_error', 'max_depth': 5, 'min_weight_fraction_leaf': 0.0, 'max_leaf_nodes': 20, 'bootstrap': False, 'ccp_alpha': 0.005}. Best is trial 2774 with value: 0.046571421912873.
[I 2025-04-16 01:41:49,868] Trial 2775 finished with value: -0.11138074158216196 and parameters: {'n_estimators': 2823, 'min_samples_split': 6, 'max_features': 0.8300000000000001, 'min_samples_leaf': 4, 'criterion': 'absolute_error', 'max_depth': 5, 'min_weight_fraction_leaf': 0.0, 'max_leaf_nodes': 20, 'bootstrap': False, 'ccp_alpha': 0.004}. Best is trial 2774 with value: 0.046571421912873.
