[I 2025-04-16 02:29:14,893] Trial 4966 finished with value: -11.017958252451995 and parameters: {'n_estimators': 353, 'min_samples_split': 12, 'max_features': 0.8200000000000001, 'min_samples_leaf': 1, 'criterion': 'absolute_error', 'max_depth': None, 'min_weight_fraction_leaf': 0.09, 'max_leaf_nodes': 300, 'bootstrap': False, 'ccp_alpha': 0.0}. Best is trial 4539 with value: 0.19155472534689352.
[I 2025-04-16 02:29:15,520] Trial 4967 finished with value: -0.1936417107583833 and parameters: {'n_estimators': 1, 'min_samples_split': 6, 'max_features': 0.79, 'min_samples_leaf': 5, 'criterion': 'absolute_error', 'max_depth': 15, 'min_weight_fraction_leaf': 0.0, 'max_leaf_nodes': 300, 'bootstrap': False, 'ccp_alpha': 0.014}. Best is trial 4539 with value: 0.19155472534689352.
[I 2025-04-16 02:29:16,460] Trial 4968 finished with value: -0.1936417107583833 and parameters: {'n_estimators': 397, 'min_samples_split': 15, 'max_features': 0.78, 'min_samples_leaf': 3, 'criterion': 'absolute_error', 'max_depth': 15, 'min_weight_fraction_leaf': 0.0, 'max_leaf_nodes': 300, 'bootstrap': False, 'ccp_alpha': 0.229}. Best is trial 4539 with value: 0.19155472534689352.
[I 2025-04-16 02:29:17,331] Trial 4969 finished with value: -0.1936417107583833 and parameters: {'n_estimators': 301, 'min_samples_split': 9, 'max_features': 0.01, 'min_samples_leaf': 7, 'criterion': 'absolute_error', 'max_depth': 15, 'min_weight_fraction_leaf': 0.0, 'max_leaf_nodes': 300, 'bootstrap': False, 'ccp_alpha': 0.006}. Best is trial 4539 with value: 0.19155472534689352.
[I 2025-04-16 02:29:18,217] Trial 4970 finished with value: -0.1936417107583833 and parameters: {'n_estimators': 320, 'min_samples_split': 5, 'max_features': 0.8200000000000001, 'min_samples_leaf': 1, 'criterion': 'absolute_error', 'max_depth': 15, 'min_weight_fraction_leaf': 0.0, 'max_leaf_nodes': 10, 'bootstrap': False, 'ccp_alpha': 0.019}. Best is trial 4539 with value: 0.19155472534689352.
[I 2025-04-16 02:29:18,848] Trial 4971 finished with value: -0.1936417107583833 and parameters: {'n_estimators': 7, 'min_samples_split': 5, 'max_features': 0.8, 'min_samples_leaf': 3, 'criterion': 'absolute_error', 'max_depth': 15, 'min_weight_fraction_leaf': 0.0, 'max_leaf_nodes': 300, 'bootstrap': False, 'ccp_alpha': 0.011}. Best is trial 4539 with value: 0.19155472534689352.
[I 2025-04-16 02:29:19,478] Trial 4972 finished with value: -0.1936417107583833 and parameters: {'n_estimators': 14, 'min_samples_split': 57, 'max_features': 0.78, 'min_samples_leaf': 5, 'criterion': 'absolute_error', 'max_depth': 15, 'min_weight_fraction_leaf': 0.0, 'max_leaf_nodes': 300, 'bootstrap': False, 'ccp_alpha': 0.0}. Best is trial 4539 with value: 0.19155472534689352.
[I 2025-04-16 02:29:20,407] Trial 4973 finished with value: -0.1936417107583833 and parameters: {'n_estimators': 373, 'min_samples_split': 12, 'max_features': 0.8200000000000001, 'min_samples_leaf': 1, 'criterion': 'absolute_error', 'max_depth': None, 'min_weight_fraction_leaf': 0.0, 'max_leaf_nodes': None, 'bootstrap': False, 'ccp_alpha': 0.006}. Best is trial 4539 with value: 0.19155472534689352.
[I 2025-04-16 02:29:21,350] Trial 4974 finished with value: -17.528986382274873 and parameters: {'n_estimators': 379, 'min_samples_split': 9, 'max_features': 0.77, 'min_samples_leaf': 3, 'criterion': 'friedman_mse', 'max_depth': 15, 'min_weight_fraction_leaf': 0.0, 'max_leaf_nodes': 300, 'bootstrap': False, 'ccp_alpha': 0.01}. Best is trial 4539 with value: 0.19155472534689352.
[I 2025-04-16 02:29:21,988] Trial 4975 finished with value: -0.1936417107583833 and parameters: {'n_estimators': 7, 'min_samples_split': 5, 'max_features': 0.8, 'min_samples_leaf': 5, 'criterion': 'absolute_error', 'max_depth': 15, 'min_weight_fraction_leaf': 0.0, 'max_leaf_nodes': 300, 'bootstrap': False, 'ccp_alpha': 0.015}. Best is trial 4539 with value: 0.19155472534689352.
[I 2025-04-16 02:29:22,793] Trial 4976 finished with value: 0.07162869770646885 and parameters: {'n_estimators': 225, 'min_samples_split': 2, 'max_features': 0.8300000000000001, 'min_samples_leaf': 1, 'criterion': 'absolute_error', 'max_depth': 30, 'min_weight_fraction_leaf': 0.0, 'max_leaf_nodes': 10, 'bootstrap': False, 'ccp_alpha': 0.0}. Best is trial 4539 with value: 0.19155472534689352.
[I 2025-04-16 02:29:23,782] Trial 4977 finished with value: -0.1936417107583833 and parameters: {'n_estimators': 424, 'min_samples_split': 9, 'max_features': 0.8400000000000001, 'min_samples_leaf': 71, 'criterion': 'absolute_error', 'max_depth': 30, 'min_weight_fraction_leaf': 0.0, 'max_leaf_nodes': 10, 'bootstrap': False, 'ccp_alpha': 0.005}. Best is trial 4539 with value: 0.19155472534689352.
[I 2025-04-16 02:29:24,787] Trial 4978 finished with value: -10.238228349550631 and parameters: {'n_estimators': 461, 'min_samples_split': 15, 'max_features': 0.85, 'min_samples_leaf': 3, 'criterion': 'absolute_error', 'max_depth': 30, 'min_weight_fraction_leaf': 0.0, 'max_leaf_nodes': 10, 'bootstrap': False, 'ccp_alpha': 0.0}. Best is trial 4539 with value: 0.19155472534689352.
[I 2025-04-16 02:29:25,624] Trial 4979 finished with value: 0.014334462106290524 and parameters: {'n_estimators': 247, 'min_samples_split': 5, 'max_features': 0.8400000000000001, 'min_samples_leaf': 1, 'criterion': 'absolute_error', 'max_depth': 30, 'min_weight_fraction_leaf': 0.0, 'max_leaf_nodes': 10, 'bootstrap': False, 'ccp_alpha': 0.006}. Best is trial 4539 with value: 0.19155472534689352.
[I 2025-04-16 02:29:26,700] Trial 4980 finished with value: -7.523155879682041 and parameters: {'n_estimators': 481, 'min_samples_split': 2, 'max_features': 0.8400000000000001, 'min_samples_leaf': 7, 'criterion': 'absolute_error', 'max_depth': 30, 'min_weight_fraction_leaf': 0.0, 'max_leaf_nodes': 10, 'bootstrap': False, 'ccp_alpha': 0.0}. Best is trial 4539 with value: 0.19155472534689352.
[I 2025-04-16 02:29:27,582] Trial 4981 finished with value: -11.749066937435847 and parameters: {'n_estimators': 288, 'min_samples_split': 6, 'max_features': 0.8300000000000001, 'min_samples_leaf': 4, 'criterion': 'absolute_error', 'max_depth': 30, 'min_weight_fraction_leaf': 0.0, 'max_leaf_nodes': None, 'bootstrap': False, 'ccp_alpha': 0.0}. Best is trial 4539 with value: 0.19155472534689352.
[I 2025-04-16 02:29:28,540] Trial 4982 finished with value: -0.16756855897905504 and parameters: {'n_estimators': 443, 'min_samples_split': 11, 'max_features': 0.8300000000000001, 'min_samples_leaf': 1, 'criterion': 'absolute_error', 'max_depth': 20, 'min_weight_fraction_leaf': 0.0, 'max_leaf_nodes': 10, 'bootstrap': False, 'ccp_alpha': 0.005}. Best is trial 4539 with value: 0.19155472534689352.
[I 2025-04-16 02:29:29,334] Trial 4983 finished with value: -17.5289863822749 and parameters: {'n_estimators': 201, 'min_samples_split': 9, 'max_features': 0.8300000000000001, 'min_samples_leaf': 3, 'criterion': 'squared_error', 'max_depth': 30, 'min_weight_fraction_leaf': 0.0, 'max_leaf_nodes': 10, 'bootstrap': False, 'ccp_alpha': 0.005}. Best is trial 4539 with value: 0.19155472534689352.
[I 2025-04-16 02:29:30,291] Trial 4984 finished with value: -0.1936417107583833 and parameters: {'n_estimators': 428, 'min_samples_split': 5, 'max_features': 0.8300000000000001, 'min_samples_leaf': 6, 'criterion': 'absolute_error', 'max_depth': 30, 'min_weight_fraction_leaf': 0.0, 'max_leaf_nodes': 10, 'bootstrap': False, 'ccp_alpha': 0.006}. Best is trial 4539 with value: 0.19155472534689352.
[I 2025-04-16 02:29:31,176] Trial 4985 finished with value: -0.1936417107583833 and parameters: {'n_estimators': 189, 'min_samples_split': 105, 'max_features': 0.81, 'min_samples_leaf': 55, 'criterion': 'absolute_error', 'max_depth': None, 'min_weight_fraction_leaf': 0.03, 'max_leaf_nodes': 10, 'bootstrap': False, 'ccp_alpha': 0.005}. Best is trial 4539 with value: 0.19155472534689352.
[I 2025-04-16 02:29:32,332] Trial 4986 finished with value: 0.023782358145403016 and parameters: {'n_estimators': 553, 'min_samples_split': 2, 'max_features': 0.85, 'min_samples_leaf': 3, 'criterion': 'absolute_error', 'max_depth': 30, 'min_weight_fraction_leaf': 0.0, 'max_leaf_nodes': 10, 'bootstrap': False, 'ccp_alpha': 0.005}. Best is trial 4539 with value: 0.19155472534689352.
[I 2025-04-16 02:29:33,309] Trial 4987 finished with value: -4.2061163667914165 and parameters: {'n_estimators': 353, 'min_samples_split': 6, 'max_features': 0.8300000000000001, 'min_samples_leaf': 1, 'criterion': 'absolute_error', 'max_depth': 30, 'min_weight_fraction_leaf': 0.0, 'max_leaf_nodes': 10, 'bootstrap': False, 'ccp_alpha': 0.0}. Best is trial 4539 with value: 0.19155472534689352.
[I 2025-04-16 02:29:34,337] Trial 4988 finished with value: -0.11580169811842296 and parameters: {'n_estimators': 539, 'min_samples_split': 12, 'max_features': 0.8300000000000001, 'min_samples_leaf': 5, 'criterion': 'absolute_error', 'max_depth': 45, 'min_weight_fraction_leaf': 0.0, 'max_leaf_nodes': 10, 'bootstrap': False, 'ccp_alpha': 0.005}. Best is trial 4539 with value: 0.19155472534689352.
[I 2025-04-16 02:29:35,119] Trial 4989 finished with value: -18.143958793521758 and parameters: {'n_estimators': 147, 'min_samples_split': 15, 'max_features': 0.8200000000000001, 'min_samples_leaf': 3, 'criterion': 'poisson', 'max_depth': 30, 'min_weight_fraction_leaf': 0.0, 'max_leaf_nodes': 10, 'bootstrap': False, 'ccp_alpha': 0.0}. Best is trial 4539 with value: 0.19155472534689352.
[I 2025-04-16 02:29:36,147] Trial 4990 finished with value: -0.1936417107583833 and parameters: {'n_estimators': 587, 'min_samples_split': 141, 'max_features': 0.85, 'min_samples_leaf': 1, 'criterion': 'absolute_error', 'max_depth': 30, 'min_weight_fraction_leaf': 0.1, 'max_leaf_nodes': 10, 'bootstrap': False, 'ccp_alpha': 0.0}. Best is trial 4539 with value: 0.19155472534689352.
[I 2025-04-16 02:29:37,047] Trial 4991 finished with value: -10.908653624794871 and parameters: {'n_estimators': 328, 'min_samples_split': 2, 'max_features': 0.81, 'min_samples_leaf': 5, 'criterion': 'absolute_error', 'max_depth': 30, 'min_weight_fraction_leaf': 0.0, 'max_leaf_nodes': 10, 'bootstrap': False, 'ccp_alpha': 0.0}. Best is trial 4539 with value: 0.19155472534689352.
[I 2025-04-16 02:29:38,168] Trial 4992 finished with value: -10.533751994248146 and parameters: {'n_estimators': 581, 'min_samples_split': 9, 'max_features': 0.8200000000000001, 'min_samples_leaf': 3, 'criterion': 'absolute_error', 'max_depth': 10, 'min_weight_fraction_leaf': 0.0, 'max_leaf_nodes': 10, 'bootstrap': False, 'ccp_alpha': 0.0}. Best is trial 4539 with value: 0.19155472534689352.
[I 2025-04-16 02:29:38,799] Trial 4993 finished with value: -0.1936417107583833 and parameters: {'n_estimators': 9, 'min_samples_split': 6, 'max_features': 0.81, 'min_samples_leaf': 1, 'criterion': 'absolute_error', 'max_depth': 30, 'min_weight_fraction_leaf': 0.0, 'max_leaf_nodes': 10, 'bootstrap': False, 'ccp_alpha': 0.01}. Best is trial 4539 with value: 0.19155472534689352.
[I 2025-04-16 02:29:39,626] Trial 4994 finished with value: -0.1936417107583833 and parameters: {'n_estimators': 239, 'min_samples_split': 9, 'max_features': 0.85, 'min_samples_leaf': 47, 'criterion': 'absolute_error', 'max_depth': 30, 'min_weight_fraction_leaf': 0.0, 'max_leaf_nodes': 10, 'bootstrap': False, 'ccp_alpha': 0.0}. Best is trial 4539 with value: 0.19155472534689352.
[I 2025-04-16 02:29:40,263] Trial 4995 finished with value: -10.679463981940058 and parameters: {'n_estimators': 8, 'min_samples_split': 2, 'max_features': 0.81, 'min_samples_leaf': 7, 'criterion': 'absolute_error', 'max_depth': 30, 'min_weight_fraction_leaf': 0.07, 'max_leaf_nodes': 10, 'bootstrap': False, 'ccp_alpha': 0.0}. Best is trial 4539 with value: 0.19155472534689352.
[I 2025-04-16 02:29:41,347] Trial 4996 finished with value: -10.08616632356377 and parameters: {'n_estimators': 644, 'min_samples_split': 6, 'max_features': 0.85, 'min_samples_leaf': 3, 'criterion': 'absolute_error', 'max_depth': None, 'min_weight_fraction_leaf': 0.0, 'max_leaf_nodes': 10, 'bootstrap': False, 'ccp_alpha': 0.0}. Best is trial 4539 with value: 0.19155472534689352.
[I 2025-04-16 02:29:42,355] Trial 4997 finished with value: -0.1936417107583833 and parameters: {'n_estimators': 381, 'min_samples_split': 5, 'max_features': 0.8200000000000001, 'min_samples_leaf': 1, 'criterion': 'absolute_error', 'max_depth': 30, 'min_weight_fraction_leaf': 0.0, 'max_leaf_nodes': 10, 'bootstrap': False, 'ccp_alpha': 0.008}. Best is trial 4539 with value: 0.19155472534689352.
[I 2025-04-16 02:29:43,445] Trial 4998 finished with value: -0.1936417107583833 and parameters: {'n_estimators': 486, 'min_samples_split': 15, 'max_features': 0.8300000000000001, 'min_samples_leaf': 5, 'criterion': 'absolute_error', 'max_depth': 30, 'min_weight_fraction_leaf': 0.0, 'max_leaf_nodes': 10, 'bootstrap': False, 'ccp_alpha': 0.009000000000000001}. Best is trial 4539 with value: 0.19155472534689352.
[I 2025-04-16 02:29:44,624] Trial 4999 finished with value: -17.528986382274983 and parameters: {'n_estimators': 765, 'min_samples_split': 2, 'max_features': 0.8, 'min_samples_leaf': 3, 'criterion': 'friedman_mse', 'max_depth': None, 'min_weight_fraction_leaf': 0.0, 'max_leaf_nodes': 10, 'bootstrap': False, 'ccp_alpha': 0.01}. Best is trial 4539 with value: 0.19155472534689352.
[I 2025-04-16 02:29:52,131] Trial 5000 finished with value: -12.986103048018752 and parameters: {'n_estimators': 9288, 'min_samples_split': 9, 'max_features': 0.8, 'min_samples_leaf': 1, 'criterion': 'absolute_error', 'max_depth': 30, 'min_weight_fraction_leaf': 0.0, 'max_leaf_nodes': 10, 'bootstrap': False, 'ccp_alpha': 0.0}. Best is trial 4539 with value: 0.19155472534689352.
[I 2025-04-16 02:29:53,078] Trial 5001 finished with value: -0.1936417107583833 and parameters: {'n_estimators': 321, 'min_samples_split': 9, 'max_features': 0.8300000000000001, 'min_samples_leaf': 5, 'criterion': 'absolute_error', 'max_depth': None, 'min_weight_fraction_leaf': 0.0, 'max_leaf_nodes': 10, 'bootstrap': False, 'ccp_alpha': 0.006}. Best is trial 4539 with value: 0.19155472534689352.
[I 2025-04-16 02:29:54,180] Trial 5002 finished with value: -10.086166323563763 and parameters: {'n_estimators': 644, 'min_samples_split': 2, 'max_features': 0.85, 'min_samples_leaf': 3, 'criterion': 'absolute_error', 'max_depth': 20, 'min_weight_fraction_leaf': 0.0, 'max_leaf_nodes': 10, 'bootstrap': False, 'ccp_alpha': 0.0}. Best is trial 4539 with value: 0.19155472534689352.
[I 2025-04-16 02:29:55,148] Trial 5003 finished with value: -0.1936417107583833 and parameters: {'n_estimators': 435, 'min_samples_split': 12, 'max_features': 0.8, 'min_samples_leaf': 1, 'criterion': 'absolute_error', 'max_depth': 30, 'min_weight_fraction_leaf': 0.0, 'max_leaf_nodes': 10, 'bootstrap': False, 'ccp_alpha': 0.013000000000000001}. Best is trial 4539 with value: 0.19155472534689352.
[I 2025-04-16 02:29:55,937] Trial 5004 finished with value: -0.1936417107583833 and parameters: {'n_estimators': 178, 'min_samples_split': 6, 'max_features': 0.8200000000000001, 'min_samples_leaf': 7, 'criterion': 'absolute_error', 'max_depth': 30, 'min_weight_fraction_leaf': 0.0, 'max_leaf_nodes': 10, 'bootstrap': False, 'ccp_alpha': 0.006}. Best is trial 4539 with value: 0.19155472534689352.
[I 2025-04-16 02:29:57,233] Trial 5005 finished with value: -0.1936417107583833 and parameters: {'n_estimators': 850, 'min_samples_split': 5, 'max_features': 0.8, 'min_samples_leaf': 4, 'criterion': 'absolute_error', 'max_depth': 30, 'min_weight_fraction_leaf': 0.0, 'max_leaf_nodes': 10, 'bootstrap': False, 'ccp_alpha': 0.01}. Best is trial 4539 with value: 0.19155472534689352.
[I 2025-04-16 02:29:58,284] Trial 5006 finished with value: -0.13576315168508035 and parameters: {'n_estimators': 523, 'min_samples_split': 9, 'max_features': 0.8300000000000001, 'min_samples_leaf': 1, 'criterion': 'absolute_error', 'max_depth': 30, 'min_weight_fraction_leaf': 0.0, 'max_leaf_nodes': 10, 'bootstrap': False, 'ccp_alpha': 0.005}. Best is trial 4539 with value: 0.19155472534689352.
[I 2025-04-16 02:29:59,171] Trial 5007 finished with value: -17.52898638227488 and parameters: {'n_estimators': 290, 'min_samples_split': 2, 'max_features': 0.85, 'min_samples_leaf': 3, 'criterion': 'squared_error', 'max_depth': 45, 'min_weight_fraction_leaf': 0.0, 'max_leaf_nodes': 10, 'bootstrap': False, 'ccp_alpha': 0.014}. Best is trial 4539 with value: 0.19155472534689352.
[I 2025-04-16 02:29:59,807] Trial 5008 finished with value: -0.1936417107583833 and parameters: {'n_estimators': 5, 'min_samples_split': 15, 'max_features': 0.79, 'min_samples_leaf': 5, 'criterion': 'absolute_error', 'max_depth': 30, 'min_weight_fraction_leaf': 0.0, 'max_leaf_nodes': 10, 'bootstrap': False, 'ccp_alpha': 0.005}. Best is trial 4539 with value: 0.19155472534689352.
[I 2025-04-16 02:30:01,017] Trial 5009 finished with value: -0.1936417107583833 and parameters: {'n_estimators': 700, 'min_samples_split': 6, 'max_features': 0.81, 'min_samples_leaf': 1, 'criterion': 'absolute_error', 'max_depth': 30, 'min_weight_fraction_leaf': 0.0, 'max_leaf_nodes': 10, 'bootstrap': False, 'ccp_alpha': 0.011}. Best is trial 4539 with value: 0.19155472534689352.
[I 2025-04-16 02:30:02,546] Trial 5010 finished with value: -10.01914714995504 and parameters: {'n_estimators': 1152, 'min_samples_split': 12, 'max_features': 0.79, 'min_samples_leaf': 3, 'criterion': 'absolute_error', 'max_depth': 30, 'min_weight_fraction_leaf': 0.0, 'max_leaf_nodes': 10, 'bootstrap': False, 'ccp_alpha': 0.0}. Best is trial 4539 with value: 0.19155472534689352.
[I 2025-04-16 02:30:03,537] Trial 5011 finished with value: -9.4180787116583 and parameters: {'n_estimators': 453, 'min_samples_split': 2, 'max_features': 0.8300000000000001, 'min_samples_leaf': 6, 'criterion': 'absolute_error', 'max_depth': 30, 'min_weight_fraction_leaf': 0.0, 'max_leaf_nodes': 10, 'bootstrap': False, 'ccp_alpha': 0.0}. Best is trial 4539 with value: 0.19155472534689352.
[I 2025-04-16 02:30:04,990] Trial 5012 finished with value: -0.1936417107583833 and parameters: {'n_estimators': 915, 'min_samples_split': 6, 'max_features': 0.85, 'min_samples_leaf': 3, 'criterion': 'absolute_error', 'max_depth': 30, 'min_weight_fraction_leaf': 0.0, 'max_leaf_nodes': 10, 'bootstrap': False, 'ccp_alpha': 0.01}. Best is trial 4539 with value: 0.19155472534689352.
[I 2025-04-16 02:30:05,811] Trial 5013 finished with value: -23.84765581600549 and parameters: {'n_estimators': 226, 'min_samples_split': 9, 'max_features': 0.81, 'min_samples_leaf': 1, 'criterion': 'poisson', 'max_depth': 30, 'min_weight_fraction_leaf': 0.0, 'max_leaf_nodes': 10, 'bootstrap': False, 'ccp_alpha': 0.016}. Best is trial 4539 with value: 0.19155472534689352.
[I 2025-04-16 02:30:07,046] Trial 5014 finished with value: -0.13313446626987516 and parameters: {'n_estimators': 652, 'min_samples_split': 2, 'max_features': 0.79, 'min_samples_leaf': 4, 'criterion': 'absolute_error', 'max_depth': 30, 'min_weight_fraction_leaf': 0.0, 'max_leaf_nodes': 10, 'bootstrap': False, 'ccp_alpha': 0.005}. Best is trial 4539 with value: 0.19155472534689352.
[I 2025-04-16 02:30:08,101] Trial 5015 finished with value: -0.1936417107583833 and parameters: {'n_estimators': 433, 'min_samples_split': 6, 'max_features': 0.8200000000000001, 'min_samples_leaf': 1, 'criterion': 'absolute_error', 'max_depth': 30, 'min_weight_fraction_leaf': 0.0, 'max_leaf_nodes': 10, 'bootstrap': False, 'ccp_alpha': 0.01}. Best is trial 4539 with value: 0.19155472534689352.
[I 2025-04-16 02:30:09,655] Trial 5016 finished with value: -0.1936417107583833 and parameters: {'n_estimators': 1313, 'min_samples_split': 49, 'max_features': 0.78, 'min_samples_leaf': 7, 'criterion': 'absolute_error', 'max_depth': 30, 'min_weight_fraction_leaf': 0.0, 'max_leaf_nodes': 10, 'bootstrap': False, 'ccp_alpha': 0.0}. Best is trial 4539 with value: 0.19155472534689352.
[I 2025-04-16 02:30:11,015] Trial 5017 finished with value: -0.1936417107583833 and parameters: {'n_estimators': 836, 'min_samples_split': 9, 'max_features': 0.8300000000000001, 'min_samples_leaf': 3, 'criterion': 'absolute_error', 'max_depth': 30, 'min_weight_fraction_leaf': 0.0, 'max_leaf_nodes': 10, 'bootstrap': False, 'ccp_alpha': 0.017}. Best is trial 4539 with value: 0.19155472534689352.
[I 2025-04-16 02:30:11,806] Trial 5018 finished with value: -0.1791830778135605 and parameters: {'n_estimators': 198, 'min_samples_split': 2, 'max_features': 0.8, 'min_samples_leaf': 1, 'criterion': 'absolute_error', 'max_depth': None, 'min_weight_fraction_leaf': 0.0, 'max_leaf_nodes': 10, 'bootstrap': False, 'ccp_alpha': 0.006}. Best is trial 4539 with value: 0.19155472534689352.
[I 2025-04-16 02:30:13,147] Trial 5019 finished with value: -0.1936417107583833 and parameters: {'n_estimators': 715, 'min_samples_split': 12, 'max_features': 0.78, 'min_samples_leaf': 4, 'criterion': 'absolute_error', 'max_depth': 30, 'min_weight_fraction_leaf': 0.0, 'max_leaf_nodes': 10, 'bootstrap': False, 'ccp_alpha': 0.006}. Best is trial 4539 with value: 0.19155472534689352.
[I 2025-04-16 02:30:13,782] Trial 5020 finished with value: -0.1936417107583833 and parameters: {'n_estimators': 4, 'min_samples_split': 6, 'max_features': 0.85, 'min_samples_leaf': 5, 'criterion': 'absolute_error', 'max_depth': 30, 'min_weight_fraction_leaf': 0.0, 'max_leaf_nodes': 10, 'bootstrap': False, 'ccp_alpha': 0.013000000000000001}. Best is trial 4539 with value: 0.19155472534689352.
[I 2025-04-16 02:30:14,825] Trial 5021 finished with value: -0.1936417107583833 and parameters: {'n_estimators': 548, 'min_samples_split': 15, 'max_features': 0.45, 'min_samples_leaf': 3, 'criterion': 'absolute_error', 'max_depth': 30, 'min_weight_fraction_leaf': 0.0, 'max_leaf_nodes': 10, 'bootstrap': False, 'ccp_alpha': 0.006}. Best is trial 4539 with value: 0.19155472534689352.
