[I 2025-04-16 01:10:17,318] Trial 2209 finished with value: -0.1936158637764882 and parameters: {'n_estimators': 4951, 'min_samples_split': 19, 'max_features': 0.92, 'min_samples_leaf': 16, 'criterion': 'absolute_error', 'max_depth': 60, 'min_weight_fraction_leaf': 0.0, 'max_leaf_nodes': 150, 'bootstrap': False, 'ccp_alpha': 0.0}. Best is trial 1828 with value: -0.15292978335836716.
[I 2025-04-16 01:10:21,125] Trial 2210 finished with value: -0.1936417107583833 and parameters: {'n_estimators': 3928, 'min_samples_split': 10, 'max_features': 0.98, 'min_samples_leaf': 14, 'criterion': 'absolute_error', 'max_depth': 60, 'min_weight_fraction_leaf': 0.01, 'max_leaf_nodes': 150, 'bootstrap': False, 'ccp_alpha': 0.02}. Best is trial 1828 with value: -0.15292978335836716.
[I 2025-04-16 01:10:24,696] Trial 2211 finished with value: -0.1936417107583833 and parameters: {'n_estimators': 4098, 'min_samples_split': 15, 'max_features': 0.9, 'min_samples_leaf': 8, 'criterion': 'absolute_error', 'max_depth': 60, 'min_weight_fraction_leaf': 0.01, 'max_leaf_nodes': 150, 'bootstrap': False, 'ccp_alpha': 0.009000000000000001}. Best is trial 1828 with value: -0.15292978335836716.
[I 2025-04-16 01:10:28,492] Trial 2212 finished with value: -0.1936417107583833 and parameters: {'n_estimators': 4413, 'min_samples_split': 109, 'max_features': 0.9500000000000001, 'min_samples_leaf': 11, 'criterion': 'absolute_error', 'max_depth': 10, 'min_weight_fraction_leaf': 0.01, 'max_leaf_nodes': 150, 'bootstrap': False, 'ccp_alpha': 0.015}. Best is trial 1828 with value: -0.15292978335836716.
[I 2025-04-16 01:10:31,966] Trial 2213 finished with value: -0.1936417107583833 and parameters: {'n_estimators': 3790, 'min_samples_split': 5, 'max_features': 0.97, 'min_samples_leaf': 20, 'criterion': 'absolute_error', 'max_depth': 60, 'min_weight_fraction_leaf': 0.01, 'max_leaf_nodes': 150, 'bootstrap': False, 'ccp_alpha': 0.005}. Best is trial 1828 with value: -0.15292978335836716.
[I 2025-04-16 01:10:35,259] Trial 2214 finished with value: -8.799135522678704 and parameters: {'n_estimators': 4252, 'min_samples_split': 23, 'max_features': 0.93, 'min_samples_leaf': 12, 'criterion': 'absolute_error', 'max_depth': 5, 'min_weight_fraction_leaf': 0.01, 'max_leaf_nodes': 150, 'bootstrap': False, 'ccp_alpha': 0.0}. Best is trial 1828 with value: -0.15292978335836716.
[I 2025-04-16 01:10:38,788] Trial 2215 finished with value: -17.5289863822729 and parameters: {'n_estimators': 4702, 'min_samples_split': 80, 'max_features': 0.99, 'min_samples_leaf': 17, 'criterion': 'friedman_mse', 'max_depth': 60, 'min_weight_fraction_leaf': 0.01, 'max_leaf_nodes': 150, 'bootstrap': False, 'ccp_alpha': 0.01}. Best is trial 1828 with value: -0.15292978335836716.
[I 2025-04-16 01:10:42,152] Trial 2216 finished with value: -0.1936417107583833 and parameters: {'n_estimators': 3681, 'min_samples_split': 18, 'max_features': 0.9500000000000001, 'min_samples_leaf': 14, 'criterion': 'absolute_error', 'max_depth': 60, 'min_weight_fraction_leaf': 0.01, 'max_leaf_nodes': 150, 'bootstrap': False, 'ccp_alpha': 0.005}. Best is trial 1828 with value: -0.15292978335836716.
[I 2025-04-16 01:10:45,670] Trial 2217 finished with value: -0.1936417107583833 and parameters: {'n_estimators': 3960, 'min_samples_split': 10, 'max_features': 0.97, 'min_samples_leaf': 10, 'criterion': 'absolute_error', 'max_depth': 60, 'min_weight_fraction_leaf': 0.0, 'max_leaf_nodes': 150, 'bootstrap': False, 'ccp_alpha': 0.01}. Best is trial 1828 with value: -0.15292978335836716.
[I 2025-04-16 01:10:49,998] Trial 2218 finished with value: -0.1936417107583833 and parameters: {'n_estimators': 4424, 'min_samples_split': 13, 'max_features': 0.9400000000000001, 'min_samples_leaf': 15, 'criterion': 'absolute_error', 'max_depth': 60, 'min_weight_fraction_leaf': 0.01, 'max_leaf_nodes': 150, 'bootstrap': False, 'ccp_alpha': 0.005}. Best is trial 1828 with value: -0.15292978335836716.
[I 2025-04-16 01:10:53,485] Trial 2219 finished with value: -10.737359945358584 and parameters: {'n_estimators': 4123, 'min_samples_split': 20, 'max_features': 1.0, 'min_samples_leaf': 12, 'criterion': 'absolute_error', 'max_depth': 60, 'min_weight_fraction_leaf': 0.01, 'max_leaf_nodes': 150, 'bootstrap': False, 'ccp_alpha': 0.0}. Best is trial 1828 with value: -0.15292978335836716.
[I 2025-04-16 01:10:56,889] Trial 2220 finished with value: -0.1936417107583833 and parameters: {'n_estimators': 3517, 'min_samples_split': 16, 'max_features': 0.91, 'min_samples_leaf': 9, 'criterion': 'absolute_error', 'max_depth': 60, 'min_weight_fraction_leaf': 0.01, 'max_leaf_nodes': 150, 'bootstrap': False, 'ccp_alpha': 0.015}. Best is trial 1828 with value: -0.15292978335836716.
[I 2025-04-16 01:11:00,613] Trial 2221 finished with value: -0.1936417107583833 and parameters: {'n_estimators': 3878, 'min_samples_split': 2, 'max_features': 0.04, 'min_samples_leaf': 7, 'criterion': 'absolute_error', 'max_depth': 60, 'min_weight_fraction_leaf': 0.0, 'max_leaf_nodes': 150, 'bootstrap': False, 'ccp_alpha': 0.006}. Best is trial 1828 with value: -0.15292978335836716.
[I 2025-04-16 01:11:04,026] Trial 2222 finished with value: -0.19364227164245812 and parameters: {'n_estimators': 4094, 'min_samples_split': 28, 'max_features': 0.9600000000000001, 'min_samples_leaf': 18, 'criterion': 'absolute_error', 'max_depth': 60, 'min_weight_fraction_leaf': 0.01, 'max_leaf_nodes': 150, 'bootstrap': False, 'ccp_alpha': 0.0}. Best is trial 1828 with value: -0.15292978335836716.
[I 2025-04-16 01:11:08,065] Trial 2223 finished with value: -0.1936417107583833 and parameters: {'n_estimators': 4281, 'min_samples_split': 8, 'max_features': 0.98, 'min_samples_leaf': 13, 'criterion': 'absolute_error', 'max_depth': 60, 'min_weight_fraction_leaf': 0.01, 'max_leaf_nodes': 150, 'bootstrap': False, 'ccp_alpha': 0.011}. Best is trial 1828 with value: -0.15292978335836716.
[I 2025-04-16 01:11:11,239] Trial 2224 finished with value: -0.19361576161447366 and parameters: {'n_estimators': 3679, 'min_samples_split': 23, 'max_features': 0.93, 'min_samples_leaf': 16, 'criterion': 'absolute_error', 'max_depth': 60, 'min_weight_fraction_leaf': 0.01, 'max_leaf_nodes': 150, 'bootstrap': False, 'ccp_alpha': 0.0}. Best is trial 1828 with value: -0.15292978335836716.
[I 2025-04-16 01:11:15,388] Trial 2225 finished with value: -17.52898638227309 and parameters: {'n_estimators': 4574, 'min_samples_split': 14, 'max_features': 0.9600000000000001, 'min_samples_leaf': 11, 'criterion': 'squared_error', 'max_depth': 60, 'min_weight_fraction_leaf': 0.01, 'max_leaf_nodes': 150, 'bootstrap': False, 'ccp_alpha': 0.021}. Best is trial 1828 with value: -0.15292978335836716.
[I 2025-04-16 01:11:19,156] Trial 2226 finished with value: -0.1936417107583833 and parameters: {'n_estimators': 3922, 'min_samples_split': 18, 'max_features': 0.9400000000000001, 'min_samples_leaf': 14, 'criterion': 'absolute_error', 'max_depth': 60, 'min_weight_fraction_leaf': 0.01, 'max_leaf_nodes': 150, 'bootstrap': False, 'ccp_alpha': 0.006}. Best is trial 1828 with value: -0.15292978335836716.
[I 2025-04-16 01:11:23,134] Trial 2227 finished with value: -0.1936417107583833 and parameters: {'n_estimators': 4376, 'min_samples_split': 10, 'max_features': 0.99, 'min_samples_leaf': 11, 'criterion': 'absolute_error', 'max_depth': 60, 'min_weight_fraction_leaf': 0.01, 'max_leaf_nodes': 20, 'bootstrap': False, 'ccp_alpha': 0.257}. Best is trial 1828 with value: -0.15292978335836716.
[I 2025-04-16 01:11:26,928] Trial 2228 finished with value: -0.1936417107583833 and parameters: {'n_estimators': 4071, 'min_samples_split': 5, 'max_features': 0.97, 'min_samples_leaf': 16, 'criterion': 'absolute_error', 'max_depth': 60, 'min_weight_fraction_leaf': 0.0, 'max_leaf_nodes': None, 'bootstrap': False, 'ccp_alpha': 0.015}. Best is trial 1828 with value: -0.15292978335836716.
[I 2025-04-16 01:11:30,554] Trial 2229 finished with value: -0.1936417107583833 and parameters: {'n_estimators': 3814, 'min_samples_split': 21, 'max_features': 0.9, 'min_samples_leaf': 13, 'criterion': 'absolute_error', 'max_depth': 60, 'min_weight_fraction_leaf': 0.01, 'max_leaf_nodes': 150, 'bootstrap': False, 'ccp_alpha': 0.01}. Best is trial 1828 with value: -0.15292978335836716.
[I 2025-04-16 01:11:33,807] Trial 2230 finished with value: -4.586103352932396 and parameters: {'n_estimators': 3496, 'min_samples_split': 14, 'max_features': 0.66, 'min_samples_leaf': 9, 'criterion': 'absolute_error', 'max_depth': None, 'min_weight_fraction_leaf': 0.01, 'max_leaf_nodes': 150, 'bootstrap': False, 'ccp_alpha': 0.0}. Best is trial 1828 with value: -0.15292978335836716.
[I 2025-04-16 01:11:37,523] Trial 2231 finished with value: -30.83159065241414 and parameters: {'n_estimators': 4216, 'min_samples_split': 26, 'max_features': 0.92, 'min_samples_leaf': 15, 'criterion': 'poisson', 'max_depth': 60, 'min_weight_fraction_leaf': 0.08, 'max_leaf_nodes': 150, 'bootstrap': False, 'ccp_alpha': 0.006}. Best is trial 1828 with value: -0.15292978335836716.
[I 2025-04-16 01:11:41,143] Trial 2232 finished with value: -0.1936417107583833 and parameters: {'n_estimators': 4011, 'min_samples_split': 17, 'max_features': 0.9500000000000001, 'min_samples_leaf': 18, 'criterion': 'absolute_error', 'max_depth': 60, 'min_weight_fraction_leaf': 0.01, 'max_leaf_nodes': 150, 'bootstrap': False, 'ccp_alpha': 0.005}. Best is trial 1828 with value: -0.15292978335836716.
[I 2025-04-16 01:11:44,657] Trial 2233 finished with value: -0.1936417107583833 and parameters: {'n_estimators': 3685, 'min_samples_split': 11, 'max_features': 0.98, 'min_samples_leaf': 12, 'criterion': 'absolute_error', 'max_depth': 60, 'min_weight_fraction_leaf': 0.01, 'max_leaf_nodes': 300, 'bootstrap': False, 'ccp_alpha': 0.014}. Best is trial 1828 with value: -0.15292978335836716.
[I 2025-04-16 01:11:48,705] Trial 2234 finished with value: -0.19361993307670033 and parameters: {'n_estimators': 4479, 'min_samples_split': 8, 'max_features': 1.0, 'min_samples_leaf': 14, 'criterion': 'absolute_error', 'max_depth': 60, 'min_weight_fraction_leaf': 0.01, 'max_leaf_nodes': 150, 'bootstrap': False, 'ccp_alpha': 0.0}. Best is trial 1828 with value: -0.15292978335836716.
[I 2025-04-16 01:11:52,574] Trial 2235 finished with value: -0.1936417107583833 and parameters: {'n_estimators': 4237, 'min_samples_split': 20, 'max_features': 0.9600000000000001, 'min_samples_leaf': 10, 'criterion': 'absolute_error', 'max_depth': 60, 'min_weight_fraction_leaf': 0.01, 'max_leaf_nodes': 150, 'bootstrap': False, 'ccp_alpha': 0.009000000000000001}. Best is trial 1828 with value: -0.15292978335836716.
[I 2025-04-16 01:11:56,210] Trial 2236 finished with value: 0.023550606879512225 and parameters: {'n_estimators': 3886, 'min_samples_split': 14, 'max_features': 0.93, 'min_samples_leaf': 7, 'criterion': 'absolute_error', 'max_depth': 60, 'min_weight_fraction_leaf': 0.0, 'max_leaf_nodes': 150, 'bootstrap': False, 'ccp_alpha': 0.005}. Best is trial 2236 with value: 0.023550606879512225.
[I 2025-04-16 01:11:59,623] Trial 2237 finished with value: -0.1936417107583833 and parameters: {'n_estimators': 3665, 'min_samples_split': 5, 'max_features': 0.9, 'min_samples_leaf': 7, 'criterion': 'absolute_error', 'max_depth': 60, 'min_weight_fraction_leaf': 0.0, 'max_leaf_nodes': 150, 'bootstrap': False, 'ccp_alpha': 0.006}. Best is trial 2236 with value: 0.023550606879512225.
[I 2025-04-16 01:12:02,889] Trial 2238 finished with value: -0.1936417107583833 and parameters: {'n_estimators': 3522, 'min_samples_split': 9, 'max_features': 0.92, 'min_samples_leaf': 7, 'criterion': 'absolute_error', 'max_depth': 60, 'min_weight_fraction_leaf': 0.0, 'max_leaf_nodes': 150, 'bootstrap': False, 'ccp_alpha': 0.019}. Best is trial 2236 with value: 0.023550606879512225.
[I 2025-04-16 01:12:06,447] Trial 2239 finished with value: -17.528986382274418 and parameters: {'n_estimators': 3849, 'min_samples_split': 11, 'max_features': 0.92, 'min_samples_leaf': 6, 'criterion': 'friedman_mse', 'max_depth': 60, 'min_weight_fraction_leaf': 0.0, 'max_leaf_nodes': 150, 'bootstrap': False, 'ccp_alpha': 0.011}. Best is trial 2236 with value: 0.023550606879512225.
[I 2025-04-16 01:12:10,017] Trial 2240 finished with value: 0.023091560254884347 and parameters: {'n_estimators': 3654, 'min_samples_split': 6, 'max_features': 0.9400000000000001, 'min_samples_leaf': 7, 'criterion': 'absolute_error', 'max_depth': 60, 'min_weight_fraction_leaf': 0.0, 'max_leaf_nodes': 150, 'bootstrap': False, 'ccp_alpha': 0.005}. Best is trial 2236 with value: 0.023550606879512225.
[I 2025-04-16 01:12:13,378] Trial 2241 finished with value: -0.1936417107583833 and parameters: {'n_estimators': 3466, 'min_samples_split': 2, 'max_features': 0.9, 'min_samples_leaf': 5, 'criterion': 'absolute_error', 'max_depth': 60, 'min_weight_fraction_leaf': 0.0, 'max_leaf_nodes': 150, 'bootstrap': False, 'ccp_alpha': 0.02}. Best is trial 2236 with value: 0.023550606879512225.
[I 2025-04-16 01:12:16,717] Trial 2242 finished with value: -0.1936417107583833 and parameters: {'n_estimators': 3574, 'min_samples_split': 4, 'max_features': 0.91, 'min_samples_leaf': 6, 'criterion': 'absolute_error', 'max_depth': 60, 'min_weight_fraction_leaf': 0.0, 'max_leaf_nodes': 150, 'bootstrap': False, 'ccp_alpha': 0.014}. Best is trial 2236 with value: 0.023550606879512225.
[I 2025-04-16 01:12:19,984] Trial 2243 finished with value: -0.1936417107583833 and parameters: {'n_estimators': 3441, 'min_samples_split': 5, 'max_features': 0.92, 'min_samples_leaf': 6, 'criterion': 'absolute_error', 'max_depth': 60, 'min_weight_fraction_leaf': 0.0, 'max_leaf_nodes': 150, 'bootstrap': False, 'ccp_alpha': 0.026000000000000002}. Best is trial 2236 with value: 0.023550606879512225.
[I 2025-04-16 01:12:23,447] Trial 2244 finished with value: -0.1936417107583833 and parameters: {'n_estimators': 3641, 'min_samples_split': 5, 'max_features': 0.91, 'min_samples_leaf': 7, 'criterion': 'absolute_error', 'max_depth': 10, 'min_weight_fraction_leaf': 0.0, 'max_leaf_nodes': 150, 'bootstrap': False, 'ccp_alpha': 0.017}. Best is trial 2236 with value: 0.023550606879512225.
[I 2025-04-16 01:12:26,935] Trial 2245 finished with value: -0.1936417107583833 and parameters: {'n_estimators': 3660, 'min_samples_split': 2, 'max_features': 0.9, 'min_samples_leaf': 6, 'criterion': 'absolute_error', 'max_depth': 60, 'min_weight_fraction_leaf': 0.0, 'max_leaf_nodes': 150, 'bootstrap': False, 'ccp_alpha': 0.01}. Best is trial 2236 with value: 0.023550606879512225.
[I 2025-04-16 01:12:30,263] Trial 2246 finished with value: -0.1936417107583833 and parameters: {'n_estimators': 3501, 'min_samples_split': 2, 'max_features': 0.9400000000000001, 'min_samples_leaf': 1, 'criterion': 'absolute_error', 'max_depth': 5, 'min_weight_fraction_leaf': 0.0, 'max_leaf_nodes': 150, 'bootstrap': False, 'ccp_alpha': 0.026000000000000002}. Best is trial 2236 with value: 0.023550606879512225.
[I 2025-04-16 01:12:33,979] Trial 2247 finished with value: -0.1936417107583833 and parameters: {'n_estimators': 3774, 'min_samples_split': 6, 'max_features': 0.93, 'min_samples_leaf': 4, 'criterion': 'absolute_error', 'max_depth': 60, 'min_weight_fraction_leaf': 0.0, 'max_leaf_nodes': 150, 'bootstrap': False, 'ccp_alpha': 0.01}. Best is trial 2236 with value: 0.023550606879512225.
[I 2025-04-16 01:12:37,333] Trial 2248 finished with value: -17.528986382274727 and parameters: {'n_estimators': 3712, 'min_samples_split': 8, 'max_features': 0.9, 'min_samples_leaf': 7, 'criterion': 'squared_error', 'max_depth': 60, 'min_weight_fraction_leaf': 0.0, 'max_leaf_nodes': 150, 'bootstrap': False, 'ccp_alpha': 0.006}. Best is trial 2236 with value: 0.023550606879512225.
[I 2025-04-16 01:12:40,380] Trial 2249 finished with value: -0.1936417107583833 and parameters: {'n_estimators': 3458, 'min_samples_split': 7, 'max_features': 0.92, 'min_samples_leaf': 3, 'criterion': 'absolute_error', 'max_depth': 60, 'min_weight_fraction_leaf': 0.0, 'max_leaf_nodes': 150, 'bootstrap': False, 'ccp_alpha': 0.015}. Best is trial 2236 with value: 0.023550606879512225.
[I 2025-04-16 01:12:43,873] Trial 2250 finished with value: -0.1936417107583833 and parameters: {'n_estimators': 3857, 'min_samples_split': 5, 'max_features': 0.9400000000000001, 'min_samples_leaf': 7, 'criterion': 'absolute_error', 'max_depth': 60, 'min_weight_fraction_leaf': 0.0, 'max_leaf_nodes': 20, 'bootstrap': False, 'ccp_alpha': 0.006}. Best is trial 2236 with value: 0.023550606879512225.
[I 2025-04-16 01:12:47,453] Trial 2251 finished with value: 0.02361845659970214 and parameters: {'n_estimators': 3934, 'min_samples_split': 7, 'max_features': 0.93, 'min_samples_leaf': 6, 'criterion': 'absolute_error', 'max_depth': 60, 'min_weight_fraction_leaf': 0.0, 'max_leaf_nodes': 150, 'bootstrap': False, 'ccp_alpha': 0.005}. Best is trial 2251 with value: 0.02361845659970214.
[I 2025-04-16 01:12:50,942] Trial 2252 finished with value: -0.1936417107583833 and parameters: {'n_estimators': 3530, 'min_samples_split': 2, 'max_features': 0.9, 'min_samples_leaf': 1, 'criterion': 'absolute_error', 'max_depth': 60, 'min_weight_fraction_leaf': 0.0, 'max_leaf_nodes': 150, 'bootstrap': False, 'ccp_alpha': 0.02}. Best is trial 2251 with value: 0.02361845659970214.
[I 2025-04-16 01:12:54,424] Trial 2253 finished with value: -0.1936417107583833 and parameters: {'n_estimators': 3598, 'min_samples_split': 6, 'max_features': 0.92, 'min_samples_leaf': 2, 'criterion': 'absolute_error', 'max_depth': 60, 'min_weight_fraction_leaf': 0.0, 'max_leaf_nodes': None, 'bootstrap': False, 'ccp_alpha': 0.021}. Best is trial 2251 with value: 0.02361845659970214.
[I 2025-04-16 01:12:57,849] Trial 2254 finished with value: -30.78182279642225 and parameters: {'n_estimators': 3823, 'min_samples_split': 7, 'max_features': 0.9, 'min_samples_leaf': 4, 'criterion': 'poisson', 'max_depth': 60, 'min_weight_fraction_leaf': 0.0, 'max_leaf_nodes': 150, 'bootstrap': False, 'ccp_alpha': 0.014}. Best is trial 2251 with value: 0.02361845659970214.
[I 2025-04-16 01:13:01,301] Trial 2255 finished with value: -0.1936417107583833 and parameters: {'n_estimators': 3713, 'min_samples_split': 8, 'max_features': 0.91, 'min_samples_leaf': 4, 'criterion': 'absolute_error', 'max_depth': 60, 'min_weight_fraction_leaf': 0.0, 'max_leaf_nodes': 150, 'bootstrap': False, 'ccp_alpha': 0.015}. Best is trial 2251 with value: 0.02361845659970214.
[I 2025-04-16 01:13:04,707] Trial 2256 finished with value: -0.1936417107583833 and parameters: {'n_estimators': 3503, 'min_samples_split': 7, 'max_features': 0.92, 'min_samples_leaf': 4, 'criterion': 'absolute_error', 'max_depth': 60, 'min_weight_fraction_leaf': 0.0, 'max_leaf_nodes': 150, 'bootstrap': False, 'ccp_alpha': 0.01}. Best is trial 2251 with value: 0.02361845659970214.
[I 2025-04-16 01:13:08,386] Trial 2257 finished with value: -0.1936417107583833 and parameters: {'n_estimators': 3868, 'min_samples_split': 4, 'max_features': 0.93, 'min_samples_leaf': 7, 'criterion': 'absolute_error', 'max_depth': None, 'min_weight_fraction_leaf': 0.0, 'max_leaf_nodes': 150, 'bootstrap': False, 'ccp_alpha': 0.01}. Best is trial 2251 with value: 0.02361845659970214.
[I 2025-04-16 01:13:11,968] Trial 2258 finished with value: -0.1936417107583833 and parameters: {'n_estimators': 3789, 'min_samples_split': 3, 'max_features': 0.9, 'min_samples_leaf': 5, 'criterion': 'absolute_error', 'max_depth': 60, 'min_weight_fraction_leaf': 0.0, 'max_leaf_nodes': 150, 'bootstrap': False, 'ccp_alpha': 0.006}. Best is trial 2251 with value: 0.02361845659970214.
[I 2025-04-16 01:13:15,195] Trial 2259 finished with value: -0.1936417107583833 and parameters: {'n_estimators': 3493, 'min_samples_split': 5, 'max_features': 0.93, 'min_samples_leaf': 4, 'criterion': 'absolute_error', 'max_depth': 60, 'min_weight_fraction_leaf': 0.0, 'max_leaf_nodes': 300, 'bootstrap': False, 'ccp_alpha': 0.028}. Best is trial 2251 with value: 0.02361845659970214.
[I 2025-04-16 01:13:18,774] Trial 2260 finished with value: -0.1936417107583833 and parameters: {'n_estimators': 3930, 'min_samples_split': 5, 'max_features': 0.93, 'min_samples_leaf': 6, 'criterion': 'absolute_error', 'max_depth': 60, 'min_weight_fraction_leaf': 0.0, 'max_leaf_nodes': 150, 'bootstrap': False, 'ccp_alpha': 0.015}. Best is trial 2251 with value: 0.02361845659970214.
[I 2025-04-16 01:13:22,332] Trial 2261 finished with value: -0.1936417107583833 and parameters: {'n_estimators': 3709, 'min_samples_split': 8, 'max_features': 0.9, 'min_samples_leaf': 6, 'criterion': 'absolute_error', 'max_depth': 60, 'min_weight_fraction_leaf': 0.0, 'max_leaf_nodes': 150, 'bootstrap': False, 'ccp_alpha': 0.006}. Best is trial 2251 with value: 0.02361845659970214.
[I 2025-04-16 01:13:28,898] Trial 2262 finished with value: -0.1936417107583833 and parameters: {'n_estimators': 7937, 'min_samples_split': 2, 'max_features': 0.9, 'min_samples_leaf': 9, 'criterion': 'absolute_error', 'max_depth': 60, 'min_weight_fraction_leaf': 0.0, 'max_leaf_nodes': 150, 'bootstrap': False, 'ccp_alpha': 0.011}. Best is trial 2251 with value: 0.02361845659970214.
[I 2025-04-16 01:13:32,812] Trial 2263 finished with value: -0.1936417107583833 and parameters: {'n_estimators': 3954, 'min_samples_split': 9, 'max_features': 0.92, 'min_samples_leaf': 2, 'criterion': 'absolute_error', 'max_depth': 60, 'min_weight_fraction_leaf': 0.0, 'max_leaf_nodes': 150, 'bootstrap': False, 'ccp_alpha': 0.02}. Best is trial 2251 with value: 0.02361845659970214.
[I 2025-04-16 01:13:36,089] Trial 2264 finished with value: 0.023112818435621896 and parameters: {'n_estimators': 3656, 'min_samples_split': 10, 'max_features': 0.93, 'min_samples_leaf': 5, 'criterion': 'absolute_error', 'max_depth': 60, 'min_weight_fraction_leaf': 0.0, 'max_leaf_nodes': 150, 'bootstrap': False, 'ccp_alpha': 0.005}. Best is trial 2251 with value: 0.02361845659970214.
