[I 2025-04-16 02:01:40,221] Trial 3565 finished with value: -0.1936417107583833 and parameters: {'n_estimators': 956, 'min_samples_split': 2, 'max_features': 0.76, 'min_samples_leaf': 1, 'criterion': 'absolute_error', 'max_depth': 15, 'min_weight_fraction_leaf': 0.0, 'max_leaf_nodes': 300, 'bootstrap': False, 'ccp_alpha': 0.014}. Best is trial 3488 with value: 0.05528345733671649.
[I 2025-04-16 02:01:41,123] Trial 3566 finished with value: -14.8567858453579 and parameters: {'n_estimators': 529, 'min_samples_split': 2, 'max_features': 0.79, 'min_samples_leaf': 3, 'criterion': 'absolute_error', 'max_depth': 15, 'min_weight_fraction_leaf': 0.0, 'max_leaf_nodes': 300, 'bootstrap': False, 'ccp_alpha': 0.0}. Best is trial 3488 with value: 0.05528345733671649.
[I 2025-04-16 02:01:42,238] Trial 3567 finished with value: 0.019161568598191847 and parameters: {'n_estimators': 795, 'min_samples_split': 2, 'max_features': 0.75, 'min_samples_leaf': 3, 'criterion': 'absolute_error', 'max_depth': 15, 'min_weight_fraction_leaf': 0.0, 'max_leaf_nodes': 300, 'bootstrap': False, 'ccp_alpha': 0.005}. Best is trial 3488 with value: 0.05528345733671649.
[I 2025-04-16 02:01:43,242] Trial 3568 finished with value: -17.528986382274873 and parameters: {'n_estimators': 591, 'min_samples_split': 5, 'max_features': 0.79, 'min_samples_leaf': 1, 'criterion': 'poisson', 'max_depth': 15, 'min_weight_fraction_leaf': 0.0, 'max_leaf_nodes': 300, 'bootstrap': False, 'ccp_alpha': 0.146}. Best is trial 3488 with value: 0.05528345733671649.
[I 2025-04-16 02:01:44,112] Trial 3569 finished with value: -0.1936417107583833 and parameters: {'n_estimators': 405, 'min_samples_split': 2, 'max_features': 0.74, 'min_samples_leaf': 3, 'criterion': 'absolute_error', 'max_depth': 15, 'min_weight_fraction_leaf': 0.0, 'max_leaf_nodes': 300, 'bootstrap': False, 'ccp_alpha': 0.009000000000000001}. Best is trial 3488 with value: 0.05528345733671649.
[I 2025-04-16 02:01:45,329] Trial 3570 finished with value: -0.1936417107583833 and parameters: {'n_estimators': 799, 'min_samples_split': 2, 'max_features': 0.77, 'min_samples_leaf': 1, 'criterion': 'absolute_error', 'max_depth': 15, 'min_weight_fraction_leaf': 0.0, 'max_leaf_nodes': 300, 'bootstrap': False, 'ccp_alpha': 0.018000000000000002}. Best is trial 3488 with value: 0.05528345733671649.
[I 2025-04-16 02:01:46,833] Trial 3571 finished with value: 0.01744245793428867 and parameters: {'n_estimators': 1001, 'min_samples_split': 5, 'max_features': 0.75, 'min_samples_leaf': 3, 'criterion': 'absolute_error', 'max_depth': 15, 'min_weight_fraction_leaf': 0.0, 'max_leaf_nodes': 300, 'bootstrap': False, 'ccp_alpha': 0.005}. Best is trial 3488 with value: 0.05528345733671649.
[I 2025-04-16 02:01:47,708] Trial 3572 finished with value: -0.1936417107583833 and parameters: {'n_estimators': 430, 'min_samples_split': 6, 'max_features': 0.78, 'min_samples_leaf': 1, 'criterion': 'absolute_error', 'max_depth': 15, 'min_weight_fraction_leaf': 0.0, 'max_leaf_nodes': 300, 'bootstrap': False, 'ccp_alpha': 0.221}. Best is trial 3488 with value: 0.05528345733671649.
[I 2025-04-16 02:01:48,790] Trial 3573 finished with value: -0.1936417107583833 and parameters: {'n_estimators': 650, 'min_samples_split': 2, 'max_features': 0.74, 'min_samples_leaf': 3, 'criterion': 'absolute_error', 'max_depth': 15, 'min_weight_fraction_leaf': 0.0, 'max_leaf_nodes': 300, 'bootstrap': False, 'ccp_alpha': 0.025}. Best is trial 3488 with value: 0.05528345733671649.
[I 2025-04-16 02:01:49,619] Trial 3574 finished with value: -0.1936417107583833 and parameters: {'n_estimators': 330, 'min_samples_split': 2, 'max_features': 0.8, 'min_samples_leaf': 1, 'criterion': 'absolute_error', 'max_depth': 15, 'min_weight_fraction_leaf': 0.0, 'max_leaf_nodes': 300, 'bootstrap': False, 'ccp_alpha': 0.014}. Best is trial 3488 with value: 0.05528345733671649.
[I 2025-04-16 02:01:50,548] Trial 3575 finished with value: -14.75527677097531 and parameters: {'n_estimators': 602, 'min_samples_split': 6, 'max_features': 0.73, 'min_samples_leaf': 3, 'criterion': 'absolute_error', 'max_depth': 15, 'min_weight_fraction_leaf': 0.0, 'max_leaf_nodes': 300, 'bootstrap': False, 'ccp_alpha': 0.0}. Best is trial 3488 with value: 0.05528345733671649.
[I 2025-04-16 02:01:51,920] Trial 3576 finished with value: -0.1936417107583833 and parameters: {'n_estimators': 961, 'min_samples_split': 6, 'max_features': 0.76, 'min_samples_leaf': 1, 'criterion': 'absolute_error', 'max_depth': 15, 'min_weight_fraction_leaf': 0.0, 'max_leaf_nodes': 300, 'bootstrap': False, 'ccp_alpha': 0.009000000000000001}. Best is trial 3488 with value: 0.05528345733671649.
[I 2025-04-16 02:01:52,731] Trial 3577 finished with value: -17.528986382274873 and parameters: {'n_estimators': 342, 'min_samples_split': 2, 'max_features': 0.72, 'min_samples_leaf': 3, 'criterion': 'friedman_mse', 'max_depth': 15, 'min_weight_fraction_leaf': 0.0, 'max_leaf_nodes': 300, 'bootstrap': False, 'ccp_alpha': 0.005}. Best is trial 3488 with value: 0.05528345733671649.
[I 2025-04-16 02:01:53,861] Trial 3578 finished with value: -0.1936417107583833 and parameters: {'n_estimators': 780, 'min_samples_split': 6, 'max_features': 0.78, 'min_samples_leaf': 3, 'criterion': 'absolute_error', 'max_depth': 15, 'min_weight_fraction_leaf': 0.0, 'max_leaf_nodes': 300, 'bootstrap': False, 'ccp_alpha': 0.014}. Best is trial 3488 with value: 0.05528345733671649.
[I 2025-04-16 02:01:54,721] Trial 3579 finished with value: -34.377506996661296 and parameters: {'n_estimators': 520, 'min_samples_split': 2, 'max_features': 0.75, 'min_samples_leaf': 1, 'criterion': 'absolute_error', 'max_depth': 15, 'min_weight_fraction_leaf': 0.0, 'max_leaf_nodes': 300, 'bootstrap': False, 'ccp_alpha': 0.0}. Best is trial 3488 with value: 0.05528345733671649.
[I 2025-04-16 02:01:55,433] Trial 3580 finished with value: -0.1936417107583833 and parameters: {'n_estimators': 241, 'min_samples_split': 8, 'max_features': 0.77, 'min_samples_leaf': 3, 'criterion': 'absolute_error', 'max_depth': 15, 'min_weight_fraction_leaf': 0.0, 'max_leaf_nodes': 300, 'bootstrap': False, 'ccp_alpha': 0.021}. Best is trial 3488 with value: 0.05528345733671649.
[I 2025-04-16 02:01:56,355] Trial 3581 finished with value: -0.1936417107583833 and parameters: {'n_estimators': 500, 'min_samples_split': 6, 'max_features': 0.7100000000000001, 'min_samples_leaf': 1, 'criterion': 'absolute_error', 'max_depth': 15, 'min_weight_fraction_leaf': 0.0, 'max_leaf_nodes': 300, 'bootstrap': False, 'ccp_alpha': 0.009000000000000001}. Best is trial 3488 with value: 0.05528345733671649.
[I 2025-04-16 02:01:57,432] Trial 3582 finished with value: 0.016067865219784983 and parameters: {'n_estimators': 741, 'min_samples_split': 2, 'max_features': 0.74, 'min_samples_leaf': 3, 'criterion': 'absolute_error', 'max_depth': 15, 'min_weight_fraction_leaf': 0.0, 'max_leaf_nodes': 300, 'bootstrap': False, 'ccp_alpha': 0.005}. Best is trial 3488 with value: 0.05528345733671649.
[I 2025-04-16 02:01:58,101] Trial 3583 finished with value: -0.1936417107583833 and parameters: {'n_estimators': 211, 'min_samples_split': 6, 'max_features': 0.8, 'min_samples_leaf': 1, 'criterion': 'absolute_error', 'max_depth': 15, 'min_weight_fraction_leaf': 0.0, 'max_leaf_nodes': 300, 'bootstrap': False, 'ccp_alpha': 0.014}. Best is trial 3488 with value: 0.05528345733671649.
[I 2025-04-16 02:01:59,074] Trial 3584 finished with value: -0.1936417107583833 and parameters: {'n_estimators': 569, 'min_samples_split': 8, 'max_features': 0.73, 'min_samples_leaf': 3, 'criterion': 'absolute_error', 'max_depth': 15, 'min_weight_fraction_leaf': 0.0, 'max_leaf_nodes': 300, 'bootstrap': False, 'ccp_alpha': 0.009000000000000001}. Best is trial 3488 with value: 0.05528345733671649.
[I 2025-04-16 02:02:00,360] Trial 3585 finished with value: -37.33795280764514 and parameters: {'n_estimators': 1012, 'min_samples_split': 2, 'max_features': 0.76, 'min_samples_leaf': 1, 'criterion': 'absolute_error', 'max_depth': 15, 'min_weight_fraction_leaf': 0.0, 'max_leaf_nodes': 300, 'bootstrap': False, 'ccp_alpha': 0.0}. Best is trial 3488 with value: 0.05528345733671649.
[I 2025-04-16 02:02:01,150] Trial 3586 finished with value: -17.528986382274873 and parameters: {'n_estimators': 379, 'min_samples_split': 6, 'max_features': 0.79, 'min_samples_leaf': 3, 'criterion': 'squared_error', 'max_depth': 15, 'min_weight_fraction_leaf': 0.0, 'max_leaf_nodes': 300, 'bootstrap': False, 'ccp_alpha': 0.019}. Best is trial 3488 with value: 0.05528345733671649.
[I 2025-04-16 02:02:01,652] Trial 3587 finished with value: -0.1936417107583833 and parameters: {'n_estimators': 10, 'min_samples_split': 2, 'max_features': 0.6900000000000001, 'min_samples_leaf': 3, 'criterion': 'absolute_error', 'max_depth': 15, 'min_weight_fraction_leaf': 0.0, 'max_leaf_nodes': 300, 'bootstrap': False, 'ccp_alpha': 0.03}. Best is trial 3488 with value: 0.05528345733671649.
[I 2025-04-16 02:02:02,862] Trial 3588 finished with value: 0.03616977569942832 and parameters: {'n_estimators': 849, 'min_samples_split': 6, 'max_features': 0.7100000000000001, 'min_samples_leaf': 1, 'criterion': 'absolute_error', 'max_depth': 15, 'min_weight_fraction_leaf': 0.0, 'max_leaf_nodes': 300, 'bootstrap': False, 'ccp_alpha': 0.005}. Best is trial 3488 with value: 0.05528345733671649.
[I 2025-04-16 02:02:03,984] Trial 3589 finished with value: -0.1936417107583833 and parameters: {'n_estimators': 651, 'min_samples_split': 8, 'max_features': 0.75, 'min_samples_leaf': 3, 'criterion': 'absolute_error', 'max_depth': 15, 'min_weight_fraction_leaf': 0.0, 'max_leaf_nodes': 300, 'bootstrap': False, 'ccp_alpha': 0.013000000000000001}. Best is trial 3488 with value: 0.05528345733671649.
[I 2025-04-16 02:02:04,873] Trial 3590 finished with value: -0.1936417107583833 and parameters: {'n_estimators': 408, 'min_samples_split': 2, 'max_features': 0.77, 'min_samples_leaf': 1, 'criterion': 'absolute_error', 'max_depth': 15, 'min_weight_fraction_leaf': 0.0, 'max_leaf_nodes': 300, 'bootstrap': False, 'ccp_alpha': 0.009000000000000001}. Best is trial 3488 with value: 0.05528345733671649.
[I 2025-04-16 02:02:05,557] Trial 3591 finished with value: -0.1936417107583833 and parameters: {'n_estimators': 223, 'min_samples_split': 8, 'max_features': 0.72, 'min_samples_leaf': 4, 'criterion': 'absolute_error', 'max_depth': 15, 'min_weight_fraction_leaf': 0.0, 'max_leaf_nodes': 300, 'bootstrap': False, 'ccp_alpha': 0.016}. Best is trial 3488 with value: 0.05528345733671649.
[I 2025-04-16 02:02:06,799] Trial 3592 finished with value: -38.58365518898701 and parameters: {'n_estimators': 999, 'min_samples_split': 5, 'max_features': 0.73, 'min_samples_leaf': 1, 'criterion': 'absolute_error', 'max_depth': 15, 'min_weight_fraction_leaf': 0.0, 'max_leaf_nodes': 300, 'bootstrap': False, 'ccp_alpha': 0.0}. Best is trial 3488 with value: 0.05528345733671649.
[I 2025-04-16 02:02:07,816] Trial 3593 finished with value: -17.528986382274862 and parameters: {'n_estimators': 707, 'min_samples_split': 2, 'max_features': 0.8, 'min_samples_leaf': 50, 'criterion': 'poisson', 'max_depth': 15, 'min_weight_fraction_leaf': 0.0, 'max_leaf_nodes': 300, 'bootstrap': False, 'ccp_alpha': 0.005}. Best is trial 3488 with value: 0.05528345733671649.
[I 2025-04-16 02:02:08,779] Trial 3594 finished with value: -0.1936417107583833 and parameters: {'n_estimators': 501, 'min_samples_split': 8, 'max_features': 0.75, 'min_samples_leaf': 3, 'criterion': 'absolute_error', 'max_depth': 15, 'min_weight_fraction_leaf': 0.0, 'max_leaf_nodes': 300, 'bootstrap': False, 'ccp_alpha': 0.01}. Best is trial 3488 with value: 0.05528345733671649.
[I 2025-04-16 02:02:09,490] Trial 3595 finished with value: -0.1936417107583833 and parameters: {'n_estimators': 236, 'min_samples_split': 8, 'max_features': 0.67, 'min_samples_leaf': 1, 'criterion': 'absolute_error', 'max_depth': 15, 'min_weight_fraction_leaf': 0.0, 'max_leaf_nodes': 300, 'bootstrap': False, 'ccp_alpha': 0.021}. Best is trial 3488 with value: 0.05528345733671649.
[I 2025-04-16 02:02:10,372] Trial 3596 finished with value: -0.10482957833972231 and parameters: {'n_estimators': 444, 'min_samples_split': 5, 'max_features': 0.77, 'min_samples_leaf': 4, 'criterion': 'absolute_error', 'max_depth': 15, 'min_weight_fraction_leaf': 0.0, 'max_leaf_nodes': 300, 'bootstrap': False, 'ccp_alpha': 0.005}. Best is trial 3488 with value: 0.05528345733671649.
[I 2025-04-16 02:02:11,622] Trial 3597 finished with value: -0.1936417107583833 and parameters: {'n_estimators': 809, 'min_samples_split': 2, 'max_features': 0.7000000000000001, 'min_samples_leaf': 3, 'criterion': 'absolute_error', 'max_depth': 15, 'min_weight_fraction_leaf': 0.0, 'max_leaf_nodes': 300, 'bootstrap': False, 'ccp_alpha': 0.013000000000000001}. Best is trial 3488 with value: 0.05528345733671649.
[I 2025-04-16 02:02:12,126] Trial 3598 finished with value: -5.4934549686439755 and parameters: {'n_estimators': 5, 'min_samples_split': 8, 'max_features': 0.74, 'min_samples_leaf': 1, 'criterion': 'absolute_error', 'max_depth': 15, 'min_weight_fraction_leaf': 0.0, 'max_leaf_nodes': 300, 'bootstrap': False, 'ccp_alpha': 0.0}. Best is trial 3488 with value: 0.05528345733671649.
[I 2025-04-16 02:02:13,158] Trial 3599 finished with value: -0.1936417107583833 and parameters: {'n_estimators': 640, 'min_samples_split': 2, 'max_features': 0.79, 'min_samples_leaf': 4, 'criterion': 'absolute_error', 'max_depth': 15, 'min_weight_fraction_leaf': 0.0, 'max_leaf_nodes': 300, 'bootstrap': False, 'ccp_alpha': 0.009000000000000001}. Best is trial 3488 with value: 0.05528345733671649.
[I 2025-04-16 02:02:13,960] Trial 3600 finished with value: -0.1936417107583833 and parameters: {'n_estimators': 316, 'min_samples_split': 6, 'max_features': 0.72, 'min_samples_leaf': 1, 'criterion': 'absolute_error', 'max_depth': 15, 'min_weight_fraction_leaf': 0.0, 'max_leaf_nodes': 300, 'bootstrap': False, 'ccp_alpha': 0.017}. Best is trial 3488 with value: 0.05528345733671649.
[I 2025-04-16 02:02:15,120] Trial 3601 finished with value: -17.528986382275626 and parameters: {'n_estimators': 991, 'min_samples_split': 8, 'max_features': 0.75, 'min_samples_leaf': 58, 'criterion': 'friedman_mse', 'max_depth': 15, 'min_weight_fraction_leaf': 0.0, 'max_leaf_nodes': 300, 'bootstrap': False, 'ccp_alpha': 0.005}. Best is trial 3488 with value: 0.05528345733671649.
[I 2025-04-16 02:02:16,079] Trial 3602 finished with value: -0.1936417107583833 and parameters: {'n_estimators': 556, 'min_samples_split': 2, 'max_features': 0.7000000000000001, 'min_samples_leaf': 3, 'criterion': 'absolute_error', 'max_depth': 15, 'min_weight_fraction_leaf': 0.0, 'max_leaf_nodes': 300, 'bootstrap': False, 'ccp_alpha': 0.024}. Best is trial 3488 with value: 0.05528345733671649.
[I 2025-04-16 02:02:16,731] Trial 3603 finished with value: -0.1936417107583833 and parameters: {'n_estimators': 204, 'min_samples_split': 5, 'max_features': 0.78, 'min_samples_leaf': 3, 'criterion': 'absolute_error', 'max_depth': 15, 'min_weight_fraction_leaf': 0.0, 'max_leaf_nodes': 300, 'bootstrap': False, 'ccp_alpha': 0.009000000000000001}. Best is trial 3488 with value: 0.05528345733671649.
[I 2025-04-16 02:02:17,886] Trial 3604 finished with value: -17.514629986397406 and parameters: {'n_estimators': 822, 'min_samples_split': 8, 'max_features': 0.73, 'min_samples_leaf': 1, 'criterion': 'absolute_error', 'max_depth': 15, 'min_weight_fraction_leaf': 0.0, 'max_leaf_nodes': 300, 'bootstrap': False, 'ccp_alpha': 0.0}. Best is trial 3488 with value: 0.05528345733671649.
[I 2025-04-16 02:02:18,698] Trial 3605 finished with value: -0.1936417107583833 and parameters: {'n_estimators': 396, 'min_samples_split': 5, 'max_features': 0.76, 'min_samples_leaf': 4, 'criterion': 'absolute_error', 'max_depth': 15, 'min_weight_fraction_leaf': 0.0, 'max_leaf_nodes': 300, 'bootstrap': False, 'ccp_alpha': 0.014}. Best is trial 3488 with value: 0.05528345733671649.
[I 2025-04-16 02:02:19,384] Trial 3606 finished with value: -0.09315739625487114 and parameters: {'n_estimators': 164, 'min_samples_split': 2, 'max_features': 0.68, 'min_samples_leaf': 1, 'criterion': 'absolute_error', 'max_depth': 15, 'min_weight_fraction_leaf': 0.0, 'max_leaf_nodes': 300, 'bootstrap': False, 'ccp_alpha': 0.005}. Best is trial 3488 with value: 0.05528345733671649.
[I 2025-04-16 02:02:20,425] Trial 3607 finished with value: -0.1936417107583833 and parameters: {'n_estimators': 639, 'min_samples_split': 8, 'max_features': 0.74, 'min_samples_leaf': 96, 'criterion': 'absolute_error', 'max_depth': 15, 'min_weight_fraction_leaf': 0.0, 'max_leaf_nodes': 300, 'bootstrap': False, 'ccp_alpha': 0.01}. Best is trial 3488 with value: 0.05528345733671649.
[I 2025-04-16 02:02:21,577] Trial 3608 finished with value: -0.1936417107583833 and parameters: {'n_estimators': 859, 'min_samples_split': 2, 'max_features': 0.8, 'min_samples_leaf': 44, 'criterion': 'absolute_error', 'max_depth': 15, 'min_weight_fraction_leaf': 0.0, 'max_leaf_nodes': 300, 'bootstrap': False, 'ccp_alpha': 0.019}. Best is trial 3488 with value: 0.05528345733671649.
[I 2025-04-16 02:02:22,479] Trial 3609 finished with value: -0.10352682214440187 and parameters: {'n_estimators': 437, 'min_samples_split': 6, 'max_features': 0.7100000000000001, 'min_samples_leaf': 4, 'criterion': 'absolute_error', 'max_depth': 15, 'min_weight_fraction_leaf': 0.0, 'max_leaf_nodes': 300, 'bootstrap': False, 'ccp_alpha': 0.005}. Best is trial 3488 with value: 0.05528345733671649.
[I 2025-04-16 02:02:23,429] Trial 3610 finished with value: -12.045873028072313 and parameters: {'n_estimators': 602, 'min_samples_split': 8, 'max_features': 0.77, 'min_samples_leaf': 3, 'criterion': 'absolute_error', 'max_depth': 15, 'min_weight_fraction_leaf': 0.0, 'max_leaf_nodes': 300, 'bootstrap': False, 'ccp_alpha': 0.0}. Best is trial 3488 with value: 0.05528345733671649.
[I 2025-04-16 02:02:24,224] Trial 3611 finished with value: -17.528986382274873 and parameters: {'n_estimators': 349, 'min_samples_split': 5, 'max_features': 0.74, 'min_samples_leaf': 1, 'criterion': 'squared_error', 'max_depth': 15, 'min_weight_fraction_leaf': 0.0, 'max_leaf_nodes': 300, 'bootstrap': False, 'ccp_alpha': 0.013000000000000001}. Best is trial 3488 with value: 0.05528345733671649.
[I 2025-04-16 02:02:25,791] Trial 3612 finished with value: -0.1936417107583833 and parameters: {'n_estimators': 1007, 'min_samples_split': 2, 'max_features': 0.7000000000000001, 'min_samples_leaf': 3, 'criterion': 'absolute_error', 'max_depth': 15, 'min_weight_fraction_leaf': 0.0, 'max_leaf_nodes': 300, 'bootstrap': False, 'ccp_alpha': 0.009000000000000001}. Best is trial 3488 with value: 0.05528345733671649.
[I 2025-04-16 02:02:26,462] Trial 3613 finished with value: -0.10441147075105262 and parameters: {'n_estimators': 191, 'min_samples_split': 8, 'max_features': 0.8, 'min_samples_leaf': 1, 'criterion': 'absolute_error', 'max_depth': 15, 'min_weight_fraction_leaf': 0.0, 'max_leaf_nodes': 300, 'bootstrap': False, 'ccp_alpha': 0.005}. Best is trial 3488 with value: 0.05528345733671649.
[I 2025-04-16 02:02:27,584] Trial 3614 finished with value: -0.1936417107583833 and parameters: {'n_estimators': 776, 'min_samples_split': 5, 'max_features': 0.72, 'min_samples_leaf': 4, 'criterion': 'absolute_error', 'max_depth': 15, 'min_weight_fraction_leaf': 0.0, 'max_leaf_nodes': 300, 'bootstrap': False, 'ccp_alpha': 0.017}. Best is trial 3488 with value: 0.05528345733671649.
[I 2025-04-16 02:02:28,546] Trial 3615 finished with value: -0.1936417107583833 and parameters: {'n_estimators': 500, 'min_samples_split': 2, 'max_features': 0.76, 'min_samples_leaf': 1, 'criterion': 'absolute_error', 'max_depth': 15, 'min_weight_fraction_leaf': 0.0, 'max_leaf_nodes': 300, 'bootstrap': False, 'ccp_alpha': 0.027}. Best is trial 3488 with value: 0.05528345733671649.
[I 2025-04-16 02:02:29,607] Trial 3616 finished with value: -14.604000085853503 and parameters: {'n_estimators': 683, 'min_samples_split': 8, 'max_features': 0.78, 'min_samples_leaf': 4, 'criterion': 'poisson', 'max_depth': 15, 'min_weight_fraction_leaf': 0.0, 'max_leaf_nodes': 300, 'bootstrap': False, 'ccp_alpha': 0.005}. Best is trial 3488 with value: 0.05528345733671649.
[I 2025-04-16 02:02:30,116] Trial 3617 finished with value: -0.1936417107583833 and parameters: {'n_estimators': 9, 'min_samples_split': 8, 'max_features': 0.65, 'min_samples_leaf': 3, 'criterion': 'absolute_error', 'max_depth': 15, 'min_weight_fraction_leaf': 0.0, 'max_leaf_nodes': 300, 'bootstrap': False, 'ccp_alpha': 0.011}. Best is trial 3488 with value: 0.05528345733671649.
[I 2025-04-16 02:02:30,872] Trial 3618 finished with value: -34.36036818498587 and parameters: {'n_estimators': 332, 'min_samples_split': 2, 'max_features': 0.73, 'min_samples_leaf': 1, 'criterion': 'absolute_error', 'max_depth': 15, 'min_weight_fraction_leaf': 0.0, 'max_leaf_nodes': 300, 'bootstrap': False, 'ccp_alpha': 0.0}. Best is trial 3488 with value: 0.05528345733671649.
[I 2025-04-16 02:02:32,076] Trial 3619 finished with value: -0.1936417107583833 and parameters: {'n_estimators': 860, 'min_samples_split': 5, 'max_features': 0.75, 'min_samples_leaf': 3, 'criterion': 'absolute_error', 'max_depth': 15, 'min_weight_fraction_leaf': 0.0, 'max_leaf_nodes': 300, 'bootstrap': False, 'ccp_alpha': 0.186}. Best is trial 3488 with value: 0.05528345733671649.
[I 2025-04-16 02:02:32,994] Trial 3620 finished with value: -0.1936417107583833 and parameters: {'n_estimators': 494, 'min_samples_split': 8, 'max_features': 0.7000000000000001, 'min_samples_leaf': 1, 'criterion': 'absolute_error', 'max_depth': 15, 'min_weight_fraction_leaf': 0.0, 'max_leaf_nodes': 300, 'bootstrap': False, 'ccp_alpha': 0.014}. Best is trial 3488 with value: 0.05528345733671649.
