[I 2025-04-15 23:17:22,503] Trial 215 finished with value: -0.18268354937253214 and parameters: {'n_estimators': 2735, 'min_samples_split': 178, 'max_features': 0.85, 'min_samples_leaf': 33, 'criterion': 'absolute_error', 'max_depth': 30, 'min_weight_fraction_leaf': 0.03, 'max_leaf_nodes': 100, 'bootstrap': True, 'ccp_alpha': 0.115, 'max_samples': 0.5}. Best is trial 74 with value: -0.18167313469617832.
[I 2025-04-15 23:17:25,814] Trial 216 finished with value: -0.18251357041223631 and parameters: {'n_estimators': 2967, 'min_samples_split': 167, 'max_features': 0.88, 'min_samples_leaf': 30, 'criterion': 'absolute_error', 'max_depth': 20, 'min_weight_fraction_leaf': 0.02, 'max_leaf_nodes': 100, 'bootstrap': True, 'ccp_alpha': 0.11, 'max_samples': 0.5}. Best is trial 74 with value: -0.18167313469617832.
[I 2025-04-15 23:17:29,346] Trial 217 finished with value: -0.182876324454587 and parameters: {'n_estimators': 3259, 'min_samples_split': 168, 'max_features': 0.89, 'min_samples_leaf': 25, 'criterion': 'absolute_error', 'max_depth': 20, 'min_weight_fraction_leaf': 0.01, 'max_leaf_nodes': 10, 'bootstrap': True, 'ccp_alpha': 0.111, 'max_samples': 0.5}. Best is trial 74 with value: -0.18167313469617832.
[I 2025-04-15 23:17:33,269] Trial 218 finished with value: -0.18304836506173916 and parameters: {'n_estimators': 3401, 'min_samples_split': 165, 'max_features': 0.87, 'min_samples_leaf': 31, 'criterion': 'absolute_error', 'max_depth': 20, 'min_weight_fraction_leaf': 0.03, 'max_leaf_nodes': 100, 'bootstrap': True, 'ccp_alpha': 0.08600000000000001, 'max_samples': 0.5}. Best is trial 74 with value: -0.18167313469617832.
[I 2025-04-15 23:17:35,896] Trial 219 finished with value: -0.1936417107583833 and parameters: {'n_estimators': 3104, 'min_samples_split': 172, 'max_features': 0.78, 'min_samples_leaf': 27, 'criterion': 'absolute_error', 'max_depth': 20, 'min_weight_fraction_leaf': 0.02, 'max_leaf_nodes': 100, 'bootstrap': False, 'ccp_alpha': 0.10300000000000001}. Best is trial 74 with value: -0.18167313469617832.
[I 2025-04-15 23:17:38,917] Trial 220 finished with value: -0.18294366906969534 and parameters: {'n_estimators': 2662, 'min_samples_split': 149, 'max_features': 0.91, 'min_samples_leaf': 34, 'criterion': 'absolute_error', 'max_depth': 60, 'min_weight_fraction_leaf': 0.03, 'max_leaf_nodes': 100, 'bootstrap': True, 'ccp_alpha': 0.079, 'max_samples': 0.5}. Best is trial 74 with value: -0.18167313469617832.
[I 2025-04-15 23:17:42,420] Trial 221 finished with value: -0.18258100278644412 and parameters: {'n_estimators': 3025, 'min_samples_split': 154, 'max_features': 0.8300000000000001, 'min_samples_leaf': 30, 'criterion': 'absolute_error', 'max_depth': 30, 'min_weight_fraction_leaf': 0.02, 'max_leaf_nodes': 100, 'bootstrap': True, 'ccp_alpha': 0.097, 'max_samples': 0.5}. Best is trial 74 with value: -0.18167313469617832.
[I 2025-04-15 23:17:45,772] Trial 222 finished with value: -0.1830176086004469 and parameters: {'n_estimators': 2885, 'min_samples_split': 156, 'max_features': 0.8200000000000001, 'min_samples_leaf': 25, 'criterion': 'absolute_error', 'max_depth': 30, 'min_weight_fraction_leaf': 0.02, 'max_leaf_nodes': 100, 'bootstrap': True, 'ccp_alpha': 0.091, 'max_samples': 0.5}. Best is trial 74 with value: -0.18167313469617832.
[I 2025-04-15 23:17:49,274] Trial 223 finished with value: -0.18252591516296005 and parameters: {'n_estimators': 3093, 'min_samples_split': 153, 'max_features': 0.8300000000000001, 'min_samples_leaf': 30, 'criterion': 'absolute_error', 'max_depth': 30, 'min_weight_fraction_leaf': 0.02, 'max_leaf_nodes': 100, 'bootstrap': True, 'ccp_alpha': 0.099, 'max_samples': 0.5}. Best is trial 74 with value: -0.18167313469617832.
[I 2025-04-15 23:17:57,344] Trial 224 finished with value: -0.1841484318660534 and parameters: {'n_estimators': 6800, 'min_samples_split': 154, 'max_features': 0.8, 'min_samples_leaf': 31, 'criterion': 'absolute_error', 'max_depth': 30, 'min_weight_fraction_leaf': 0.02, 'max_leaf_nodes': 100, 'bootstrap': True, 'ccp_alpha': 0.097, 'max_samples': 0.5}. Best is trial 74 with value: -0.18167313469617832.
[I 2025-04-15 23:18:01,079] Trial 225 finished with value: -0.1829038758121459 and parameters: {'n_estimators': 3298, 'min_samples_split': 142, 'max_features': 0.8400000000000001, 'min_samples_leaf': 35, 'criterion': 'absolute_error', 'max_depth': 20, 'min_weight_fraction_leaf': 0.02, 'max_leaf_nodes': 100, 'bootstrap': True, 'ccp_alpha': 0.088, 'max_samples': 0.5}. Best is trial 74 with value: -0.18167313469617832.
[I 2025-04-15 23:18:04,462] Trial 226 finished with value: -0.1827098387847145 and parameters: {'n_estimators': 3069, 'min_samples_split': 147, 'max_features': 0.8300000000000001, 'min_samples_leaf': 29, 'criterion': 'absolute_error', 'max_depth': 30, 'min_weight_fraction_leaf': 0.01, 'max_leaf_nodes': 100, 'bootstrap': True, 'ccp_alpha': 0.11800000000000001, 'max_samples': 0.5}. Best is trial 74 with value: -0.18167313469617832.
[I 2025-04-15 23:18:07,200] Trial 227 finished with value: -18.14637579348779 and parameters: {'n_estimators': 2772, 'min_samples_split': 151, 'max_features': 0.8, 'min_samples_leaf': 32, 'criterion': 'squared_error', 'max_depth': 30, 'min_weight_fraction_leaf': 0.02, 'max_leaf_nodes': 100, 'bootstrap': True, 'ccp_alpha': 0.083, 'max_samples': 0.5}. Best is trial 74 with value: -0.18167313469617832.
[I 2025-04-15 23:18:11,188] Trial 228 finished with value: -0.19328793693234791 and parameters: {'n_estimators': 3371, 'min_samples_split': 162, 'max_features': 0.87, 'min_samples_leaf': 30, 'criterion': 'absolute_error', 'max_depth': 30, 'min_weight_fraction_leaf': 0.02, 'max_leaf_nodes': 100, 'bootstrap': True, 'ccp_alpha': 0.099, 'max_samples': None}. Best is trial 74 with value: -0.18167313469617832.
[I 2025-04-15 23:18:13,907] Trial 229 finished with value: -0.18297924393310178 and parameters: {'n_estimators': 2527, 'min_samples_split': 131, 'max_features': 0.8200000000000001, 'min_samples_leaf': 23, 'criterion': 'absolute_error', 'max_depth': 30, 'min_weight_fraction_leaf': 0.02, 'max_leaf_nodes': 100, 'bootstrap': True, 'ccp_alpha': 0.108, 'max_samples': 0.5}. Best is trial 74 with value: -0.18167313469617832.
[I 2025-04-15 23:18:17,057] Trial 230 finished with value: -0.18277990612142045 and parameters: {'n_estimators': 2924, 'min_samples_split': 178, 'max_features': 0.9, 'min_samples_leaf': 27, 'criterion': 'absolute_error', 'max_depth': 30, 'min_weight_fraction_leaf': 0.01, 'max_leaf_nodes': 50, 'bootstrap': True, 'ccp_alpha': 0.092, 'max_samples': 0.5}. Best is trial 74 with value: -0.18167313469617832.
[I 2025-04-15 23:18:20,590] Trial 231 finished with value: -0.18260499444619996 and parameters: {'n_estimators': 3124, 'min_samples_split': 168, 'max_features': 0.86, 'min_samples_leaf': 27, 'criterion': 'absolute_error', 'max_depth': 30, 'min_weight_fraction_leaf': 0.03, 'max_leaf_nodes': 100, 'bootstrap': True, 'ccp_alpha': 0.10400000000000001, 'max_samples': 0.5}. Best is trial 74 with value: -0.18167313469617832.
[I 2025-04-15 23:18:24,033] Trial 232 finished with value: -0.1827218451593903 and parameters: {'n_estimators': 3184, 'min_samples_split': 169, 'max_features': 0.85, 'min_samples_leaf': 25, 'criterion': 'absolute_error', 'max_depth': 30, 'min_weight_fraction_leaf': 0.03, 'max_leaf_nodes': 100, 'bootstrap': True, 'ccp_alpha': 0.098, 'max_samples': 0.5}. Best is trial 74 with value: -0.18167313469617832.
[I 2025-04-15 23:18:27,687] Trial 233 finished with value: -0.18249100181383518 and parameters: {'n_estimators': 3081, 'min_samples_split': 166, 'max_features': 0.88, 'min_samples_leaf': 28, 'criterion': 'absolute_error', 'max_depth': 30, 'min_weight_fraction_leaf': 0.02, 'max_leaf_nodes': 100, 'bootstrap': True, 'ccp_alpha': 0.109, 'max_samples': 0.5}. Best is trial 74 with value: -0.18167313469617832.
[I 2025-04-15 23:18:31,613] Trial 234 finished with value: -0.1833387392456834 and parameters: {'n_estimators': 3520, 'min_samples_split': 166, 'max_features': 0.88, 'min_samples_leaf': 30, 'criterion': 'absolute_error', 'max_depth': 30, 'min_weight_fraction_leaf': 0.03, 'max_leaf_nodes': 100, 'bootstrap': True, 'ccp_alpha': 0.111, 'max_samples': 0.5}. Best is trial 74 with value: -0.18167313469617832.
[I 2025-04-15 23:18:35,098] Trial 235 finished with value: -0.18269671200532372 and parameters: {'n_estimators': 3175, 'min_samples_split': 159, 'max_features': 0.87, 'min_samples_leaf': 28, 'criterion': 'absolute_error', 'max_depth': 30, 'min_weight_fraction_leaf': 0.02, 'max_leaf_nodes': 100, 'bootstrap': True, 'ccp_alpha': 0.105, 'max_samples': 0.5}. Best is trial 74 with value: -0.18167313469617832.
[I 2025-04-15 23:18:37,979] Trial 236 finished with value: -18.15909592021793 and parameters: {'n_estimators': 2766, 'min_samples_split': 165, 'max_features': 0.8400000000000001, 'min_samples_leaf': 25, 'criterion': 'poisson', 'max_depth': 30, 'min_weight_fraction_leaf': 0.03, 'max_leaf_nodes': 100, 'bootstrap': True, 'ccp_alpha': 0.115, 'max_samples': 0.5}. Best is trial 74 with value: -0.18167313469617832.
[I 2025-04-15 23:18:41,182] Trial 237 finished with value: -0.18260941036997608 and parameters: {'n_estimators': 2947, 'min_samples_split': 172, 'max_features': 0.89, 'min_samples_leaf': 22, 'criterion': 'absolute_error', 'max_depth': 30, 'min_weight_fraction_leaf': 0.02, 'max_leaf_nodes': 100, 'bootstrap': True, 'ccp_alpha': 0.101, 'max_samples': 0.5}. Best is trial 74 with value: -0.18167313469617832.
[I 2025-04-15 23:18:46,266] Trial 238 finished with value: -0.19328762247037862 and parameters: {'n_estimators': 3368, 'min_samples_split': 177, 'max_features': 0.86, 'min_samples_leaf': 32, 'criterion': 'absolute_error', 'max_depth': 30, 'min_weight_fraction_leaf': 0.03, 'max_leaf_nodes': 100, 'bootstrap': True, 'ccp_alpha': 0.093, 'max_samples': 1.0}. Best is trial 74 with value: -0.18167313469617832.
[I 2025-04-15 23:18:49,729] Trial 239 finished with value: -0.18258078593798976 and parameters: {'n_estimators': 3112, 'min_samples_split': 168, 'max_features': 0.93, 'min_samples_leaf': 59, 'criterion': 'absolute_error', 'max_depth': 30, 'min_weight_fraction_leaf': 0.02, 'max_leaf_nodes': 100, 'bootstrap': True, 'ccp_alpha': 0.11, 'max_samples': 0.5}. Best is trial 74 with value: -0.18167313469617832.
[I 2025-04-15 23:18:53,604] Trial 240 finished with value: -0.18351220047833466 and parameters: {'n_estimators': 3718, 'min_samples_split': 122, 'max_features': 0.92, 'min_samples_leaf': 57, 'criterion': 'absolute_error', 'max_depth': 30, 'min_weight_fraction_leaf': 0.02, 'max_leaf_nodes': 10, 'bootstrap': True, 'ccp_alpha': 0.11, 'max_samples': 0.5}. Best is trial 74 with value: -0.18167313469617832.
[I 2025-04-15 23:18:57,270] Trial 241 finished with value: -0.18257790940289764 and parameters: {'n_estimators': 3111, 'min_samples_split': 168, 'max_features': 0.9400000000000001, 'min_samples_leaf': 60, 'criterion': 'absolute_error', 'max_depth': 30, 'min_weight_fraction_leaf': 0.02, 'max_leaf_nodes': 100, 'bootstrap': True, 'ccp_alpha': 0.11900000000000001, 'max_samples': 0.5}. Best is trial 74 with value: -0.18167313469617832.
[I 2025-04-15 23:19:00,704] Trial 242 finished with value: -0.18290485173774407 and parameters: {'n_estimators': 2824, 'min_samples_split': 162, 'max_features': 0.9600000000000001, 'min_samples_leaf': 65, 'criterion': 'absolute_error', 'max_depth': 30, 'min_weight_fraction_leaf': 0.02, 'max_leaf_nodes': 100, 'bootstrap': True, 'ccp_alpha': 0.11800000000000001, 'max_samples': 0.5}. Best is trial 74 with value: -0.18167313469617832.
[I 2025-04-15 23:19:04,409] Trial 243 finished with value: -0.18264609666554174 and parameters: {'n_estimators': 3157, 'min_samples_split': 157, 'max_features': 0.93, 'min_samples_leaf': 30, 'criterion': 'absolute_error', 'max_depth': 30, 'min_weight_fraction_leaf': 0.02, 'max_leaf_nodes': 100, 'bootstrap': True, 'ccp_alpha': 0.109, 'max_samples': 0.5}. Best is trial 74 with value: -0.18167313469617832.
[I 2025-04-15 23:19:08,124] Trial 244 finished with value: -0.18251054132886027 and parameters: {'n_estimators': 2966, 'min_samples_split': 172, 'max_features': 0.9500000000000001, 'min_samples_leaf': 61, 'criterion': 'absolute_error', 'max_depth': 30, 'min_weight_fraction_leaf': 0.02, 'max_leaf_nodes': 100, 'bootstrap': True, 'ccp_alpha': 0.099, 'max_samples': 0.5}. Best is trial 74 with value: -0.18167313469617832.
[I 2025-04-15 23:19:10,955] Trial 245 finished with value: -0.1828623069570776 and parameters: {'n_estimators': 2684, 'min_samples_split': 172, 'max_features': 0.98, 'min_samples_leaf': 60, 'criterion': 'absolute_error', 'max_depth': 30, 'min_weight_fraction_leaf': 0.07, 'max_leaf_nodes': 100, 'bootstrap': True, 'ccp_alpha': 0.098, 'max_samples': 0.5}. Best is trial 74 with value: -0.18167313469617832.
[I 2025-04-15 23:19:15,058] Trial 246 finished with value: -0.19083300013020105 and parameters: {'n_estimators': 2940, 'min_samples_split': 184, 'max_features': 0.91, 'min_samples_leaf': 62, 'criterion': 'absolute_error', 'max_depth': 10, 'min_weight_fraction_leaf': 0.02, 'max_leaf_nodes': 100, 'bootstrap': True, 'ccp_alpha': 0.11900000000000001, 'max_samples': 0.75}. Best is trial 74 with value: -0.18167313469617832.
[I 2025-04-15 23:19:18,815] Trial 247 finished with value: -0.18297539024594367 and parameters: {'n_estimators': 3325, 'min_samples_split': 171, 'max_features': 0.93, 'min_samples_leaf': 61, 'criterion': 'absolute_error', 'max_depth': 30, 'min_weight_fraction_leaf': 0.02, 'max_leaf_nodes': 20, 'bootstrap': True, 'ccp_alpha': 0.077, 'max_samples': 0.5}. Best is trial 74 with value: -0.18167313469617832.
[I 2025-04-15 23:19:24,603] Trial 248 finished with value: -0.1836121520092701 and parameters: {'n_estimators': 5275, 'min_samples_split': 176, 'max_features': 0.9400000000000001, 'min_samples_leaf': 54, 'criterion': 'absolute_error', 'max_depth': 30, 'min_weight_fraction_leaf': 0.02, 'max_leaf_nodes': 100, 'bootstrap': True, 'ccp_alpha': 0.10300000000000001, 'max_samples': 0.5}. Best is trial 74 with value: -0.18167313469617832.
[I 2025-04-15 23:19:27,836] Trial 249 finished with value: -0.18258876355092202 and parameters: {'n_estimators': 2992, 'min_samples_split': 155, 'max_features': 0.9, 'min_samples_leaf': 60, 'criterion': 'absolute_error', 'max_depth': 20, 'min_weight_fraction_leaf': 0.02, 'max_leaf_nodes': 100, 'bootstrap': True, 'ccp_alpha': 0.08700000000000001, 'max_samples': 0.5}. Best is trial 74 with value: -0.18167313469617832.
[I 2025-04-15 23:19:30,507] Trial 250 finished with value: -0.1830553611209807 and parameters: {'n_estimators': 2520, 'min_samples_split': 154, 'max_features': 0.9500000000000001, 'min_samples_leaf': 29, 'criterion': 'absolute_error', 'max_depth': 20, 'min_weight_fraction_leaf': 0.02, 'max_leaf_nodes': 100, 'bootstrap': True, 'ccp_alpha': 0.08700000000000001, 'max_samples': 0.5}. Best is trial 74 with value: -0.18167313469617832.
[I 2025-04-15 23:19:33,570] Trial 251 finished with value: -18.151893779501197 and parameters: {'n_estimators': 2829, 'min_samples_split': 160, 'max_features': 0.98, 'min_samples_leaf': 64, 'criterion': 'friedman_mse', 'max_depth': 20, 'min_weight_fraction_leaf': 0.02, 'max_leaf_nodes': 100, 'bootstrap': True, 'ccp_alpha': 0.081, 'max_samples': 0.5}. Best is trial 74 with value: -0.18167313469617832.
[I 2025-04-15 23:19:36,868] Trial 252 finished with value: -0.18261263034319172 and parameters: {'n_estimators': 3000, 'min_samples_split': 158, 'max_features': 0.89, 'min_samples_leaf': 26, 'criterion': 'absolute_error', 'max_depth': 20, 'min_weight_fraction_leaf': 0.02, 'max_leaf_nodes': 100, 'bootstrap': True, 'ccp_alpha': 0.089, 'max_samples': 0.5}. Best is trial 74 with value: -0.18167313469617832.
[I 2025-04-15 23:19:39,055] Trial 253 finished with value: -0.1936417107583833 and parameters: {'n_estimators': 2703, 'min_samples_split': 150, 'max_features': 0.9500000000000001, 'min_samples_leaf': 28, 'criterion': 'absolute_error', 'max_depth': 20, 'min_weight_fraction_leaf': 0.02, 'max_leaf_nodes': 100, 'bootstrap': False, 'ccp_alpha': 0.07100000000000001}. Best is trial 74 with value: -0.18167313469617832.
[I 2025-04-15 23:19:42,813] Trial 254 finished with value: -0.18295165708393762 and parameters: {'n_estimators': 3316, 'min_samples_split': 167, 'max_features': 0.91, 'min_samples_leaf': 60, 'criterion': 'absolute_error', 'max_depth': 30, 'min_weight_fraction_leaf': 0.02, 'max_leaf_nodes': 100, 'bootstrap': True, 'ccp_alpha': 0.098, 'max_samples': 0.5}. Best is trial 74 with value: -0.18167313469617832.
[I 2025-04-15 23:19:46,330] Trial 255 finished with value: -0.18251054132886027 and parameters: {'n_estimators': 2966, 'min_samples_split': 163, 'max_features': 0.9, 'min_samples_leaf': 68, 'criterion': 'absolute_error', 'max_depth': 60, 'min_weight_fraction_leaf': 0.01, 'max_leaf_nodes': 100, 'bootstrap': True, 'ccp_alpha': 0.088, 'max_samples': 0.5}. Best is trial 74 with value: -0.18167313469617832.
[I 2025-04-15 23:19:50,459] Trial 256 finished with value: -0.18321248586711553 and parameters: {'n_estimators': 3466, 'min_samples_split': 161, 'max_features': 0.93, 'min_samples_leaf': 69, 'criterion': 'absolute_error', 'max_depth': 60, 'min_weight_fraction_leaf': 0.01, 'max_leaf_nodes': 10, 'bootstrap': True, 'ccp_alpha': 0.092, 'max_samples': 0.5}. Best is trial 74 with value: -0.18167313469617832.
[I 2025-04-15 23:19:53,844] Trial 257 finished with value: -0.18271348402865736 and parameters: {'n_estimators': 3181, 'min_samples_split': 164, 'max_features': 0.91, 'min_samples_leaf': 32, 'criterion': 'absolute_error', 'max_depth': 60, 'min_weight_fraction_leaf': 0.01, 'max_leaf_nodes': 100, 'bootstrap': True, 'ccp_alpha': 0.099, 'max_samples': 0.5}. Best is trial 74 with value: -0.18167313469617832.
[I 2025-04-15 23:20:02,239] Trial 258 finished with value: -0.1845805828643936 and parameters: {'n_estimators': 7781, 'min_samples_split': 168, 'max_features': 0.89, 'min_samples_leaf': 56, 'criterion': 'absolute_error', 'max_depth': 60, 'min_weight_fraction_leaf': 0.01, 'max_leaf_nodes': 100, 'bootstrap': True, 'ccp_alpha': 0.079, 'max_samples': 0.5}. Best is trial 74 with value: -0.18167313469617832.
[I 2025-04-15 23:20:05,434] Trial 259 finished with value: -0.18276476773020947 and parameters: {'n_estimators': 2919, 'min_samples_split': 155, 'max_features': 0.88, 'min_samples_leaf': 66, 'criterion': 'absolute_error', 'max_depth': 60, 'min_weight_fraction_leaf': 0.02, 'max_leaf_nodes': 100, 'bootstrap': True, 'ccp_alpha': 0.112, 'max_samples': 0.5}. Best is trial 74 with value: -0.18167313469617832.
[I 2025-04-15 23:20:08,329] Trial 260 finished with value: -0.18280424872084092 and parameters: {'n_estimators': 2619, 'min_samples_split': 180, 'max_features': 0.9, 'min_samples_leaf': 59, 'criterion': 'absolute_error', 'max_depth': 20, 'min_weight_fraction_leaf': 0.02, 'max_leaf_nodes': 100, 'bootstrap': True, 'ccp_alpha': 0.088, 'max_samples': 0.5}. Best is trial 74 with value: -0.18167313469617832.
[I 2025-04-15 23:20:11,399] Trial 261 finished with value: -18.020604486164395 and parameters: {'n_estimators': 3105, 'min_samples_split': 162, 'max_features': 0.9400000000000001, 'min_samples_leaf': 67, 'criterion': 'squared_error', 'max_depth': 30, 'min_weight_fraction_leaf': 0.02, 'max_leaf_nodes': 100, 'bootstrap': True, 'ccp_alpha': 0.106, 'max_samples': 0.5}. Best is trial 74 with value: -0.18167313469617832.
[I 2025-04-15 23:20:15,468] Trial 262 finished with value: -0.18330272329358072 and parameters: {'n_estimators': 3581, 'min_samples_split': 174, 'max_features': 0.78, 'min_samples_leaf': 52, 'criterion': 'absolute_error', 'max_depth': 30, 'min_weight_fraction_leaf': 0.01, 'max_leaf_nodes': 100, 'bootstrap': True, 'ccp_alpha': 0.095, 'max_samples': 0.5}. Best is trial 74 with value: -0.18167313469617832.
[I 2025-04-15 23:20:19,055] Trial 263 finished with value: -0.18294353330095423 and parameters: {'n_estimators': 3284, 'min_samples_split': 157, 'max_features': 0.92, 'min_samples_leaf': 63, 'criterion': 'absolute_error', 'max_depth': 30, 'min_weight_fraction_leaf': 0.02, 'max_leaf_nodes': 50, 'bootstrap': True, 'ccp_alpha': 0.10300000000000001, 'max_samples': 0.5}. Best is trial 74 with value: -0.18167313469617832.
[I 2025-04-15 23:20:22,240] Trial 264 finished with value: -0.19327037845194575 and parameters: {'n_estimators': 2795, 'min_samples_split': 168, 'max_features': 0.48000000000000004, 'min_samples_leaf': 62, 'criterion': 'absolute_error', 'max_depth': 30, 'min_weight_fraction_leaf': 0.02, 'max_leaf_nodes': 100, 'bootstrap': True, 'ccp_alpha': 0.089, 'max_samples': None}. Best is trial 74 with value: -0.18167313469617832.
[I 2025-04-15 23:20:25,614] Trial 265 finished with value: -0.18260874155208656 and parameters: {'n_estimators': 3016, 'min_samples_split': 187, 'max_features': 0.8, 'min_samples_leaf': 48, 'criterion': 'absolute_error', 'max_depth': 30, 'min_weight_fraction_leaf': 0.02, 'max_leaf_nodes': 100, 'bootstrap': True, 'ccp_alpha': 0.073, 'max_samples': 0.5}. Best is trial 74 with value: -0.18167313469617832.
[I 2025-04-15 23:20:28,329] Trial 266 finished with value: -0.18386965411386497 and parameters: {'n_estimators': 2385, 'min_samples_split': 165, 'max_features': 0.87, 'min_samples_leaf': 57, 'criterion': 'absolute_error', 'max_depth': 30, 'min_weight_fraction_leaf': 0.02, 'max_leaf_nodes': 100, 'bootstrap': True, 'ccp_alpha': 0.083, 'max_samples': 0.5}. Best is trial 74 with value: -0.18167313469617832.
[I 2025-04-15 23:20:32,006] Trial 267 finished with value: -0.18296052591620554 and parameters: {'n_estimators': 3367, 'min_samples_split': 176, 'max_features': 0.8300000000000001, 'min_samples_leaf': 73, 'criterion': 'absolute_error', 'max_depth': 30, 'min_weight_fraction_leaf': 0.01, 'max_leaf_nodes': 100, 'bootstrap': True, 'ccp_alpha': 0.115, 'max_samples': 0.5}. Best is trial 74 with value: -0.18167313469617832.
