[I 2025-04-16 02:05:15,275] Trial 3789 finished with value: 0.052512349471963815 and parameters: {'n_estimators': 548, 'min_samples_split': 2, 'max_features': 0.7100000000000001, 'min_samples_leaf': 1, 'criterion': 'absolute_error', 'max_depth': 15, 'min_weight_fraction_leaf': 0.0, 'max_leaf_nodes': 300, 'bootstrap': False, 'ccp_alpha': 0.005}. Best is trial 3488 with value: 0.05528345733671649.
[I 2025-04-16 02:05:15,991] Trial 3790 finished with value: -11.814078127682498 and parameters: {'n_estimators': 219, 'min_samples_split': 9, 'max_features': 0.66, 'min_samples_leaf': 3, 'criterion': 'absolute_error', 'max_depth': 15, 'min_weight_fraction_leaf': 0.0, 'max_leaf_nodes': 300, 'bootstrap': False, 'ccp_alpha': 0.0}. Best is trial 3488 with value: 0.05528345733671649.
[I 2025-04-16 02:05:16,905] Trial 3791 finished with value: -0.1936417107583833 and parameters: {'n_estimators': 466, 'min_samples_split': 6, 'max_features': 0.67, 'min_samples_leaf': 5, 'criterion': 'absolute_error', 'max_depth': 15, 'min_weight_fraction_leaf': 0.0, 'max_leaf_nodes': 300, 'bootstrap': False, 'ccp_alpha': 0.009000000000000001}. Best is trial 3488 with value: 0.05528345733671649.
[I 2025-04-16 02:05:17,717] Trial 3792 finished with value: -0.1936417107583833 and parameters: {'n_estimators': 324, 'min_samples_split': 5, 'max_features': 0.6900000000000001, 'min_samples_leaf': 1, 'criterion': 'absolute_error', 'max_depth': 15, 'min_weight_fraction_leaf': 0.0, 'max_leaf_nodes': 300, 'bootstrap': False, 'ccp_alpha': 0.017}. Best is trial 3488 with value: 0.05528345733671649.
[I 2025-04-16 02:05:18,391] Trial 3793 finished with value: -0.1936417107583833 and parameters: {'n_estimators': 183, 'min_samples_split': 2, 'max_features': 0.68, 'min_samples_leaf': 3, 'criterion': 'absolute_error', 'max_depth': 15, 'min_weight_fraction_leaf': 0.0, 'max_leaf_nodes': 300, 'bootstrap': False, 'ccp_alpha': 0.01}. Best is trial 3488 with value: 0.05528345733671649.
[I 2025-04-16 02:05:19,379] Trial 3794 finished with value: -9.303290034595632 and parameters: {'n_estimators': 533, 'min_samples_split': 9, 'max_features': 0.7000000000000001, 'min_samples_leaf': 1, 'criterion': 'friedman_mse', 'max_depth': 15, 'min_weight_fraction_leaf': 0.0, 'max_leaf_nodes': 300, 'bootstrap': False, 'ccp_alpha': 0.0}. Best is trial 3488 with value: 0.05528345733671649.
[I 2025-04-16 02:05:20,022] Trial 3795 finished with value: -0.1936417107583833 and parameters: {'n_estimators': 154, 'min_samples_split': 66, 'max_features': 0.7100000000000001, 'min_samples_leaf': 5, 'criterion': 'absolute_error', 'max_depth': 15, 'min_weight_fraction_leaf': 0.0, 'max_leaf_nodes': 300, 'bootstrap': False, 'ccp_alpha': 0.027}. Best is trial 3488 with value: 0.05528345733671649.
[I 2025-04-16 02:05:21,022] Trial 3796 finished with value: -0.16096752163597924 and parameters: {'n_estimators': 475, 'min_samples_split': 9, 'max_features': 0.7000000000000001, 'min_samples_leaf': 3, 'criterion': 'absolute_error', 'max_depth': 15, 'min_weight_fraction_leaf': 0.0, 'max_leaf_nodes': 300, 'bootstrap': False, 'ccp_alpha': 0.005}. Best is trial 3488 with value: 0.05528345733671649.
[I 2025-04-16 02:05:22,074] Trial 3797 finished with value: -0.1936417107583833 and parameters: {'n_estimators': 693, 'min_samples_split': 2, 'max_features': 0.7100000000000001, 'min_samples_leaf': 87, 'criterion': 'absolute_error', 'max_depth': 15, 'min_weight_fraction_leaf': 0.0, 'max_leaf_nodes': 300, 'bootstrap': False, 'ccp_alpha': 0.017}. Best is trial 3488 with value: 0.05528345733671649.
[I 2025-04-16 02:05:22,930] Trial 3798 finished with value: -0.1936417107583833 and parameters: {'n_estimators': 360, 'min_samples_split': 6, 'max_features': 0.64, 'min_samples_leaf': 52, 'criterion': 'absolute_error', 'max_depth': 15, 'min_weight_fraction_leaf': 0.0, 'max_leaf_nodes': 300, 'bootstrap': False, 'ccp_alpha': 0.01}. Best is trial 3488 with value: 0.05528345733671649.
[I 2025-04-16 02:05:23,899] Trial 3799 finished with value: -0.1936417107583833 and parameters: {'n_estimators': 567, 'min_samples_split': 2, 'max_features': 0.6900000000000001, 'min_samples_leaf': 80, 'criterion': 'absolute_error', 'max_depth': 15, 'min_weight_fraction_leaf': 0.0, 'max_leaf_nodes': 300, 'bootstrap': False, 'ccp_alpha': 0.036000000000000004}. Best is trial 3488 with value: 0.05528345733671649.
[I 2025-04-16 02:05:25,236] Trial 3800 finished with value: -0.024471011801221132 and parameters: {'n_estimators': 911, 'min_samples_split': 5, 'max_features': 0.67, 'min_samples_leaf': 1, 'criterion': 'absolute_error', 'max_depth': 15, 'min_weight_fraction_leaf': 0.0, 'max_leaf_nodes': 300, 'bootstrap': False, 'ccp_alpha': 0.005}. Best is trial 3488 with value: 0.05528345733671649.
[I 2025-04-16 02:05:25,788] Trial 3801 finished with value: -0.1936417107583833 and parameters: {'n_estimators': 16, 'min_samples_split': 9, 'max_features': 0.72, 'min_samples_leaf': 3, 'criterion': 'absolute_error', 'max_depth': 15, 'min_weight_fraction_leaf': 0.0, 'max_leaf_nodes': 300, 'bootstrap': False, 'ccp_alpha': 0.014}. Best is trial 3488 with value: 0.05528345733671649.
[I 2025-04-16 02:05:26,506] Trial 3802 finished with value: -11.024652746415176 and parameters: {'n_estimators': 285, 'min_samples_split': 6, 'max_features': 0.81, 'min_samples_leaf': 5, 'criterion': 'absolute_error', 'max_depth': 15, 'min_weight_fraction_leaf': 0.0, 'max_leaf_nodes': 300, 'bootstrap': False, 'ccp_alpha': 0.0}. Best is trial 3488 with value: 0.05528345733671649.
[I 2025-04-16 02:05:27,762] Trial 3803 finished with value: -17.528986382274862 and parameters: {'n_estimators': 698, 'min_samples_split': 9, 'max_features': 0.72, 'min_samples_leaf': 1, 'criterion': 'squared_error', 'max_depth': 15, 'min_weight_fraction_leaf': 0.0, 'max_leaf_nodes': 300, 'bootstrap': False, 'ccp_alpha': 0.023}. Best is trial 3488 with value: 0.05528345733671649.
[I 2025-04-16 02:05:28,653] Trial 3804 finished with value: -0.1936417107583833 and parameters: {'n_estimators': 470, 'min_samples_split': 2, 'max_features': 0.6900000000000001, 'min_samples_leaf': 3, 'criterion': 'absolute_error', 'max_depth': 15, 'min_weight_fraction_leaf': 0.0, 'max_leaf_nodes': 300, 'bootstrap': False, 'ccp_alpha': 0.009000000000000001}. Best is trial 3488 with value: 0.05528345733671649.
[I 2025-04-16 02:05:29,326] Trial 3805 finished with value: -0.1936417107583833 and parameters: {'n_estimators': 152, 'min_samples_split': 6, 'max_features': 0.72, 'min_samples_leaf': 5, 'criterion': 'absolute_error', 'max_depth': 15, 'min_weight_fraction_leaf': 0.0, 'max_leaf_nodes': 300, 'bootstrap': False, 'ccp_alpha': 0.014}. Best is trial 3488 with value: 0.05528345733671649.
[I 2025-04-16 02:05:29,850] Trial 3806 finished with value: -0.1936417107583833 and parameters: {'n_estimators': 6, 'min_samples_split': 2, 'max_features': 0.66, 'min_samples_leaf': 72, 'criterion': 'absolute_error', 'max_depth': 15, 'min_weight_fraction_leaf': 0.0, 'max_leaf_nodes': 300, 'bootstrap': False, 'ccp_alpha': 0.005}. Best is trial 3488 with value: 0.05528345733671649.
[I 2025-04-16 02:05:31,071] Trial 3807 finished with value: -0.07484155349732294 and parameters: {'n_estimators': 790, 'min_samples_split': 9, 'max_features': 0.81, 'min_samples_leaf': 3, 'criterion': 'absolute_error', 'max_depth': 15, 'min_weight_fraction_leaf': 0.0, 'max_leaf_nodes': 300, 'bootstrap': False, 'ccp_alpha': 0.005}. Best is trial 3488 with value: 0.05528345733671649.
[I 2025-04-16 02:05:31,789] Trial 3808 finished with value: -17.68742561661363 and parameters: {'n_estimators': 307, 'min_samples_split': 6, 'max_features': 0.73, 'min_samples_leaf': 1, 'criterion': 'absolute_error', 'max_depth': 15, 'min_weight_fraction_leaf': 0.0, 'max_leaf_nodes': 300, 'bootstrap': False, 'ccp_alpha': 0.0}. Best is trial 3488 with value: 0.05528345733671649.
[I 2025-04-16 02:05:32,831] Trial 3809 finished with value: -0.1936417107583833 and parameters: {'n_estimators': 541, 'min_samples_split': 2, 'max_features': 0.7100000000000001, 'min_samples_leaf': 1, 'criterion': 'absolute_error', 'max_depth': 15, 'min_weight_fraction_leaf': 0.0, 'max_leaf_nodes': 300, 'bootstrap': False, 'ccp_alpha': 0.012}. Best is trial 3488 with value: 0.05528345733671649.
[I 2025-04-16 02:05:34,285] Trial 3810 finished with value: -17.5289863822758 and parameters: {'n_estimators': 1079, 'min_samples_split': 9, 'max_features': 0.75, 'min_samples_leaf': 3, 'criterion': 'poisson', 'max_depth': 15, 'min_weight_fraction_leaf': 0.0, 'max_leaf_nodes': 300, 'bootstrap': False, 'ccp_alpha': 0.021}. Best is trial 3488 with value: 0.05528345733671649.
[I 2025-04-16 02:05:35,121] Trial 3811 finished with value: -0.1936417107583833 and parameters: {'n_estimators': 369, 'min_samples_split': 6, 'max_features': 0.78, 'min_samples_leaf': 56, 'criterion': 'absolute_error', 'max_depth': 15, 'min_weight_fraction_leaf': 0.0, 'max_leaf_nodes': 300, 'bootstrap': False, 'ccp_alpha': 0.009000000000000001}. Best is trial 3488 with value: 0.05528345733671649.
[I 2025-04-16 02:05:36,312] Trial 3812 finished with value: -0.1936417107583833 and parameters: {'n_estimators': 750, 'min_samples_split': 2, 'max_features': 0.68, 'min_samples_leaf': 5, 'criterion': 'absolute_error', 'max_depth': 15, 'min_weight_fraction_leaf': 0.0, 'max_leaf_nodes': 300, 'bootstrap': False, 'ccp_alpha': 0.015}. Best is trial 3488 with value: 0.05528345733671649.
[I 2025-04-16 02:05:37,294] Trial 3813 finished with value: -0.20800875843992536 and parameters: {'n_estimators': 574, 'min_samples_split': 9, 'max_features': 0.7000000000000001, 'min_samples_leaf': 3, 'criterion': 'absolute_error', 'max_depth': 15, 'min_weight_fraction_leaf': 0.0, 'max_leaf_nodes': 300, 'bootstrap': False, 'ccp_alpha': 0.005}. Best is trial 3488 with value: 0.05528345733671649.
[I 2025-04-16 02:05:37,811] Trial 3814 finished with value: -0.1936417107583833 and parameters: {'n_estimators': 2, 'min_samples_split': 5, 'max_features': 0.73, 'min_samples_leaf': 1, 'criterion': 'absolute_error', 'max_depth': 15, 'min_weight_fraction_leaf': 0.0, 'max_leaf_nodes': 300, 'bootstrap': False, 'ccp_alpha': 0.009000000000000001}. Best is trial 3488 with value: 0.05528345733671649.
[I 2025-04-16 02:05:39,007] Trial 3815 finished with value: -9.968506867670827 and parameters: {'n_estimators': 949, 'min_samples_split': 6, 'max_features': 0.76, 'min_samples_leaf': 5, 'criterion': 'absolute_error', 'max_depth': 15, 'min_weight_fraction_leaf': 0.0, 'max_leaf_nodes': 300, 'bootstrap': False, 'ccp_alpha': 0.0}. Best is trial 3488 with value: 0.05528345733671649.
[I 2025-04-16 02:05:39,797] Trial 3816 finished with value: -0.1936417107583833 and parameters: {'n_estimators': 274, 'min_samples_split': 2, 'max_features': 0.79, 'min_samples_leaf': 3, 'criterion': 'absolute_error', 'max_depth': 15, 'min_weight_fraction_leaf': 0.0, 'max_leaf_nodes': 300, 'bootstrap': False, 'ccp_alpha': 0.017}. Best is trial 3488 with value: 0.05528345733671649.
[I 2025-04-16 02:05:40,721] Trial 3817 finished with value: -0.14679763575018823 and parameters: {'n_estimators': 484, 'min_samples_split': 9, 'max_features': 0.74, 'min_samples_leaf': 1, 'criterion': 'absolute_error', 'max_depth': 15, 'min_weight_fraction_leaf': 0.0, 'max_leaf_nodes': 300, 'bootstrap': False, 'ccp_alpha': 0.005}. Best is trial 3488 with value: 0.05528345733671649.
[I 2025-04-16 02:05:41,795] Trial 3818 finished with value: -17.528986382274862 and parameters: {'n_estimators': 683, 'min_samples_split': 5, 'max_features': 0.81, 'min_samples_leaf': 3, 'criterion': 'friedman_mse', 'max_depth': 15, 'min_weight_fraction_leaf': 0.0, 'max_leaf_nodes': 300, 'bootstrap': False, 'ccp_alpha': 0.013000000000000001}. Best is trial 3488 with value: 0.05528345733671649.
[I 2025-04-16 02:05:42,506] Trial 3819 finished with value: -35.54728590804387 and parameters: {'n_estimators': 222, 'min_samples_split': 2, 'max_features': 0.7000000000000001, 'min_samples_leaf': 1, 'criterion': 'absolute_error', 'max_depth': 15, 'min_weight_fraction_leaf': 0.0, 'max_leaf_nodes': 300, 'bootstrap': False, 'ccp_alpha': 0.0}. Best is trial 3488 with value: 0.05528345733671649.
[I 2025-04-16 02:05:43,678] Trial 3820 finished with value: -0.1936417107583833 and parameters: {'n_estimators': 834, 'min_samples_split': 10, 'max_features': 0.77, 'min_samples_leaf': 5, 'criterion': 'absolute_error', 'max_depth': 15, 'min_weight_fraction_leaf': 0.0, 'max_leaf_nodes': 300, 'bootstrap': False, 'ccp_alpha': 0.022}. Best is trial 3488 with value: 0.05528345733671649.
[I 2025-04-16 02:05:44,521] Trial 3821 finished with value: 0.00449067655380393 and parameters: {'n_estimators': 431, 'min_samples_split': 6, 'max_features': 0.72, 'min_samples_leaf': 3, 'criterion': 'absolute_error', 'max_depth': 15, 'min_weight_fraction_leaf': 0.0, 'max_leaf_nodes': 300, 'bootstrap': False, 'ccp_alpha': 0.006}. Best is trial 3488 with value: 0.05528345733671649.
[I 2025-04-16 02:05:45,580] Trial 3822 finished with value: -0.1936417107583833 and parameters: {'n_estimators': 622, 'min_samples_split': 10, 'max_features': 0.75, 'min_samples_leaf': 1, 'criterion': 'absolute_error', 'max_depth': 15, 'min_weight_fraction_leaf': 0.0, 'max_leaf_nodes': 300, 'bootstrap': False, 'ccp_alpha': 0.01}. Best is trial 3488 with value: 0.05528345733671649.
[I 2025-04-16 02:05:46,845] Trial 3823 finished with value: -0.1936417107583833 and parameters: {'n_estimators': 1004, 'min_samples_split': 2, 'max_features': 0.68, 'min_samples_leaf': 43, 'criterion': 'absolute_error', 'max_depth': 15, 'min_weight_fraction_leaf': 0.0, 'max_leaf_nodes': 300, 'bootstrap': False, 'ccp_alpha': 0.03}. Best is trial 3488 with value: 0.05528345733671649.
[I 2025-04-16 02:05:47,503] Trial 3824 finished with value: -0.1936417107583833 and parameters: {'n_estimators': 158, 'min_samples_split': 5, 'max_features': 0.73, 'min_samples_leaf': 46, 'criterion': 'absolute_error', 'max_depth': 15, 'min_weight_fraction_leaf': 0.0, 'max_leaf_nodes': None, 'bootstrap': False, 'ccp_alpha': 0.017}. Best is trial 3488 with value: 0.05528345733671649.
[I 2025-04-16 02:05:48,330] Trial 3825 finished with value: -0.0889762272181398 and parameters: {'n_estimators': 368, 'min_samples_split': 9, 'max_features': 0.7100000000000001, 'min_samples_leaf': 5, 'criterion': 'absolute_error', 'max_depth': 15, 'min_weight_fraction_leaf': 0.0, 'max_leaf_nodes': 300, 'bootstrap': False, 'ccp_alpha': 0.005}. Best is trial 3488 with value: 0.05528345733671649.
[I 2025-04-16 02:05:49,705] Trial 3826 finished with value: -0.1936417107583833 and parameters: {'n_estimators': 1084, 'min_samples_split': 2, 'max_features': 0.76, 'min_samples_leaf': 3, 'criterion': 'absolute_error', 'max_depth': 15, 'min_weight_fraction_leaf': 0.0, 'max_leaf_nodes': 300, 'bootstrap': False, 'ccp_alpha': 0.01}. Best is trial 3488 with value: 0.05528345733671649.
[I 2025-04-16 02:05:50,836] Trial 3827 finished with value: -37.704392094553604 and parameters: {'n_estimators': 755, 'min_samples_split': 5, 'max_features': 0.79, 'min_samples_leaf': 1, 'criterion': 'absolute_error', 'max_depth': 15, 'min_weight_fraction_leaf': 0.0, 'max_leaf_nodes': 300, 'bootstrap': False, 'ccp_alpha': 0.0}. Best is trial 3488 with value: 0.05528345733671649.
[I 2025-04-16 02:05:51,773] Trial 3828 finished with value: -17.528986382274873 and parameters: {'n_estimators': 549, 'min_samples_split': 10, 'max_features': 0.8200000000000001, 'min_samples_leaf': 5, 'criterion': 'squared_error', 'max_depth': 15, 'min_weight_fraction_leaf': 0.0, 'max_leaf_nodes': 300, 'bootstrap': False, 'ccp_alpha': 0.015}. Best is trial 3488 with value: 0.05528345733671649.
[I 2025-04-16 02:05:52,454] Trial 3829 finished with value: -0.1936417107583833 and parameters: {'n_estimators': 186, 'min_samples_split': 5, 'max_features': 0.74, 'min_samples_leaf': 3, 'criterion': 'absolute_error', 'max_depth': 15, 'min_weight_fraction_leaf': 0.0, 'max_leaf_nodes': 300, 'bootstrap': False, 'ccp_alpha': 0.009000000000000001}. Best is trial 3488 with value: 0.05528345733671649.
[I 2025-04-16 02:05:53,301] Trial 3830 finished with value: 0.05387270665656565 and parameters: {'n_estimators': 362, 'min_samples_split': 2, 'max_features': 0.72, 'min_samples_leaf': 1, 'criterion': 'absolute_error', 'max_depth': 15, 'min_weight_fraction_leaf': 0.0, 'max_leaf_nodes': 300, 'bootstrap': False, 'ccp_alpha': 0.005}. Best is trial 3488 with value: 0.05528345733671649.
[I 2025-04-16 02:05:54,046] Trial 3831 finished with value: -0.1936417107583833 and parameters: {'n_estimators': 215, 'min_samples_split': 9, 'max_features': 0.77, 'min_samples_leaf': 3, 'criterion': 'absolute_error', 'max_depth': 15, 'min_weight_fraction_leaf': 0.0, 'max_leaf_nodes': 50, 'bootstrap': False, 'ccp_alpha': 0.021}. Best is trial 3488 with value: 0.05528345733671649.
[I 2025-04-16 02:05:54,574] Trial 3832 finished with value: -9.177223306671404 and parameters: {'n_estimators': 15, 'min_samples_split': 6, 'max_features': 0.75, 'min_samples_leaf': 5, 'criterion': 'absolute_error', 'max_depth': 15, 'min_weight_fraction_leaf': 0.0, 'max_leaf_nodes': 300, 'bootstrap': False, 'ccp_alpha': 0.0}. Best is trial 3488 with value: 0.05528345733671649.
[I 2025-04-16 02:05:55,098] Trial 3833 finished with value: -14.961413274458678 and parameters: {'n_estimators': 4, 'min_samples_split': 2, 'max_features': 0.73, 'min_samples_leaf': 1, 'criterion': 'poisson', 'max_depth': 15, 'min_weight_fraction_leaf': 0.0, 'max_leaf_nodes': 300, 'bootstrap': False, 'ccp_alpha': 0.013000000000000001}. Best is trial 3488 with value: 0.05528345733671649.
[I 2025-04-16 02:05:55,851] Trial 3834 finished with value: -0.1936417107583833 and parameters: {'n_estimators': 295, 'min_samples_split': 9, 'max_features': 0.77, 'min_samples_leaf': 3, 'criterion': 'absolute_error', 'max_depth': 15, 'min_weight_fraction_leaf': 0.0, 'max_leaf_nodes': 300, 'bootstrap': False, 'ccp_alpha': 0.006}. Best is trial 3488 with value: 0.05528345733671649.
[I 2025-04-16 02:05:56,678] Trial 3835 finished with value: -0.1936417107583833 and parameters: {'n_estimators': 368, 'min_samples_split': 6, 'max_features': 0.75, 'min_samples_leaf': 1, 'criterion': 'absolute_error', 'max_depth': 15, 'min_weight_fraction_leaf': 0.0, 'max_leaf_nodes': 300, 'bootstrap': False, 'ccp_alpha': 0.009000000000000001}. Best is trial 3488 with value: 0.05528345733671649.
[I 2025-04-16 02:05:57,431] Trial 3836 finished with value: -0.1936417107583833 and parameters: {'n_estimators': 295, 'min_samples_split': 2, 'max_features': 0.72, 'min_samples_leaf': 5, 'criterion': 'absolute_error', 'max_depth': 15, 'min_weight_fraction_leaf': 0.0, 'max_leaf_nodes': 300, 'bootstrap': False, 'ccp_alpha': 0.018000000000000002}. Best is trial 3488 with value: 0.05528345733671649.
[I 2025-04-16 02:05:58,161] Trial 3837 finished with value: -10.419302911555059 and parameters: {'n_estimators': 236, 'min_samples_split': 10, 'max_features': 0.8, 'min_samples_leaf': 3, 'criterion': 'absolute_error', 'max_depth': 15, 'min_weight_fraction_leaf': 0.0, 'max_leaf_nodes': 300, 'bootstrap': False, 'ccp_alpha': 0.0}. Best is trial 3488 with value: 0.05528345733671649.
[I 2025-04-16 02:05:59,043] Trial 3838 finished with value: -0.1936417107583833 and parameters: {'n_estimators': 426, 'min_samples_split': 6, 'max_features': 0.74, 'min_samples_leaf': 1, 'criterion': 'absolute_error', 'max_depth': 15, 'min_weight_fraction_leaf': 0.0, 'max_leaf_nodes': 300, 'bootstrap': False, 'ccp_alpha': 0.013000000000000001}. Best is trial 3488 with value: 0.05528345733671649.
[I 2025-04-16 02:05:59,737] Trial 3839 finished with value: -0.21421028325218688 and parameters: {'n_estimators': 172, 'min_samples_split': 6, 'max_features': 0.77, 'min_samples_leaf': 5, 'criterion': 'absolute_error', 'max_depth': 15, 'min_weight_fraction_leaf': 0.0, 'max_leaf_nodes': 300, 'bootstrap': False, 'ccp_alpha': 0.005}. Best is trial 3488 with value: 0.05528345733671649.
[I 2025-04-16 02:06:00,617] Trial 3840 finished with value: 0.0189504035131856 and parameters: {'n_estimators': 455, 'min_samples_split': 2, 'max_features': 0.73, 'min_samples_leaf': 3, 'criterion': 'absolute_error', 'max_depth': 15, 'min_weight_fraction_leaf': 0.0, 'max_leaf_nodes': 300, 'bootstrap': False, 'ccp_alpha': 0.005}. Best is trial 3488 with value: 0.05528345733671649.
[I 2025-04-16 02:06:01,278] Trial 3841 finished with value: -0.1936417107583833 and parameters: {'n_estimators': 153, 'min_samples_split': 9, 'max_features': 0.78, 'min_samples_leaf': 1, 'criterion': 'absolute_error', 'max_depth': 15, 'min_weight_fraction_leaf': 0.0, 'max_leaf_nodes': 300, 'bootstrap': False, 'ccp_alpha': 0.025}. Best is trial 3488 with value: 0.05528345733671649.
[I 2025-04-16 02:06:02,253] Trial 3842 finished with value: -17.528986382274873 and parameters: {'n_estimators': 457, 'min_samples_split': 6, 'max_features': 0.75, 'min_samples_leaf': 3, 'criterion': 'friedman_mse', 'max_depth': 15, 'min_weight_fraction_leaf': 0.0, 'max_leaf_nodes': 300, 'bootstrap': False, 'ccp_alpha': 0.012}. Best is trial 3488 with value: 0.05528345733671649.
[I 2025-04-16 02:06:03,034] Trial 3843 finished with value: -11.408722504974762 and parameters: {'n_estimators': 332, 'min_samples_split': 10, 'max_features': 0.81, 'min_samples_leaf': 5, 'criterion': 'absolute_error', 'max_depth': 15, 'min_weight_fraction_leaf': 0.0, 'max_leaf_nodes': None, 'bootstrap': False, 'ccp_alpha': 0.0}. Best is trial 3488 with value: 0.05528345733671649.
[I 2025-04-16 02:06:03,677] Trial 3844 finished with value: -0.1936417107583833 and parameters: {'n_estimators': 146, 'min_samples_split': 5, 'max_features': 0.7100000000000001, 'min_samples_leaf': 1, 'criterion': 'absolute_error', 'max_depth': 15, 'min_weight_fraction_leaf': 0.0, 'max_leaf_nodes': 300, 'bootstrap': False, 'ccp_alpha': 0.009000000000000001}. Best is trial 3488 with value: 0.05528345733671649.
