[I 2025-04-16 02:00:05,556] Trial 3453 finished with value: -0.021083464684043207 and parameters: {'n_estimators': 351, 'min_samples_split': 6, 'max_features': 0.68, 'min_samples_leaf': 1, 'criterion': 'absolute_error', 'max_depth': 15, 'min_weight_fraction_leaf': 0.0, 'max_leaf_nodes': 300, 'bootstrap': False, 'ccp_alpha': 0.005}. Best is trial 3267 with value: 0.055170387637108485.
[I 2025-04-16 02:00:06,655] Trial 3454 finished with value: -0.1936417107583833 and parameters: {'n_estimators': 668, 'min_samples_split': 6, 'max_features': 0.7100000000000001, 'min_samples_leaf': 1, 'criterion': 'absolute_error', 'max_depth': 15, 'min_weight_fraction_leaf': 0.0, 'max_leaf_nodes': 300, 'bootstrap': False, 'ccp_alpha': 0.02}. Best is trial 3267 with value: 0.055170387637108485.
[I 2025-04-16 02:00:07,287] Trial 3455 finished with value: -0.1936417107583833 and parameters: {'n_estimators': 132, 'min_samples_split': 2, 'max_features': 0.76, 'min_samples_leaf': 3, 'criterion': 'absolute_error', 'max_depth': 15, 'min_weight_fraction_leaf': 0.0, 'max_leaf_nodes': 300, 'bootstrap': False, 'ccp_alpha': 0.013000000000000001}. Best is trial 3267 with value: 0.055170387637108485.
[I 2025-04-16 02:00:08,181] Trial 3456 finished with value: -0.1936417107583833 and parameters: {'n_estimators': 498, 'min_samples_split': 6, 'max_features': 0.73, 'min_samples_leaf': 3, 'criterion': 'absolute_error', 'max_depth': 15, 'min_weight_fraction_leaf': 0.0, 'max_leaf_nodes': 300, 'bootstrap': False, 'ccp_alpha': 0.037}. Best is trial 3267 with value: 0.055170387637108485.
[I 2025-04-16 02:00:09,266] Trial 3457 finished with value: -7.368709097341705 and parameters: {'n_estimators': 761, 'min_samples_split': 5, 'max_features': 0.6900000000000001, 'min_samples_leaf': 3, 'criterion': 'friedman_mse', 'max_depth': 15, 'min_weight_fraction_leaf': 0.0, 'max_leaf_nodes': 300, 'bootstrap': False, 'ccp_alpha': 0.0}. Best is trial 3267 with value: 0.055170387637108485.
[I 2025-04-16 02:00:10,091] Trial 3458 finished with value: -0.1936417107583833 and parameters: {'n_estimators': 346, 'min_samples_split': 2, 'max_features': 0.74, 'min_samples_leaf': 1, 'criterion': 'absolute_error', 'max_depth': 15, 'min_weight_fraction_leaf': 0.0, 'max_leaf_nodes': 300, 'bootstrap': False, 'ccp_alpha': 0.009000000000000001}. Best is trial 3267 with value: 0.055170387637108485.
[I 2025-04-16 02:00:11,082] Trial 3459 finished with value: -0.1936417107583833 and parameters: {'n_estimators': 566, 'min_samples_split': 6, 'max_features': 0.76, 'min_samples_leaf': 3, 'criterion': 'absolute_error', 'max_depth': 15, 'min_weight_fraction_leaf': 0.0, 'max_leaf_nodes': 300, 'bootstrap': False, 'ccp_alpha': 0.009000000000000001}. Best is trial 3267 with value: 0.055170387637108485.
[I 2025-04-16 02:00:11,727] Trial 3460 finished with value: 0.038806489605574715 and parameters: {'n_estimators': 185, 'min_samples_split': 7, 'max_features': 0.72, 'min_samples_leaf': 1, 'criterion': 'absolute_error', 'max_depth': 15, 'min_weight_fraction_leaf': 0.0, 'max_leaf_nodes': 300, 'bootstrap': False, 'ccp_alpha': 0.005}. Best is trial 3267 with value: 0.055170387637108485.
[I 2025-04-16 02:00:12,317] Trial 3461 finished with value: -0.1936417107583833 and parameters: {'n_estimators': 110, 'min_samples_split': 6, 'max_features': 0.78, 'min_samples_leaf': 3, 'criterion': 'absolute_error', 'max_depth': 15, 'min_weight_fraction_leaf': 0.0, 'max_leaf_nodes': 300, 'bootstrap': False, 'ccp_alpha': 0.017}. Best is trial 3267 with value: 0.055170387637108485.
[I 2025-04-16 02:00:12,998] Trial 3462 finished with value: -19.90490592992507 and parameters: {'n_estimators': 227, 'min_samples_split': 6, 'max_features': 0.7000000000000001, 'min_samples_leaf': 1, 'criterion': 'absolute_error', 'max_depth': 15, 'min_weight_fraction_leaf': 0.0, 'max_leaf_nodes': 300, 'bootstrap': False, 'ccp_alpha': 0.0}. Best is trial 3267 with value: 0.055170387637108485.
[I 2025-04-16 02:00:13,593] Trial 3463 finished with value: -0.1936417107583833 and parameters: {'n_estimators': 130, 'min_samples_split': 6, 'max_features': 0.74, 'min_samples_leaf': 3, 'criterion': 'absolute_error', 'max_depth': 15, 'min_weight_fraction_leaf': 0.0, 'max_leaf_nodes': 300, 'bootstrap': False, 'ccp_alpha': 0.013000000000000001}. Best is trial 3267 with value: 0.055170387637108485.
[I 2025-04-16 02:00:14,295] Trial 3464 finished with value: 0.03888177592320998 and parameters: {'n_estimators': 251, 'min_samples_split': 6, 'max_features': 0.76, 'min_samples_leaf': 1, 'criterion': 'absolute_error', 'max_depth': 15, 'min_weight_fraction_leaf': 0.0, 'max_leaf_nodes': 300, 'bootstrap': False, 'ccp_alpha': 0.005}. Best is trial 3267 with value: 0.055170387637108485.
[I 2025-04-16 02:00:14,825] Trial 3465 finished with value: -0.1936417107583833 and parameters: {'n_estimators': 39, 'min_samples_split': 7, 'max_features': 0.77, 'min_samples_leaf': 3, 'criterion': 'absolute_error', 'max_depth': 15, 'min_weight_fraction_leaf': 0.0, 'max_leaf_nodes': 300, 'bootstrap': False, 'ccp_alpha': 0.022}. Best is trial 3267 with value: 0.055170387637108485.
[I 2025-04-16 02:00:15,432] Trial 3466 finished with value: -17.52898638227491 and parameters: {'n_estimators': 141, 'min_samples_split': 6, 'max_features': 0.78, 'min_samples_leaf': 3, 'criterion': 'squared_error', 'max_depth': 15, 'min_weight_fraction_leaf': 0.0, 'max_leaf_nodes': 300, 'bootstrap': False, 'ccp_alpha': 0.009000000000000001}. Best is trial 3267 with value: 0.055170387637108485.
[I 2025-04-16 02:00:16,119] Trial 3467 finished with value: -0.1936417107583833 and parameters: {'n_estimators': 242, 'min_samples_split': 6, 'max_features': 0.76, 'min_samples_leaf': 1, 'criterion': 'absolute_error', 'max_depth': 15, 'min_weight_fraction_leaf': 0.0, 'max_leaf_nodes': 300, 'bootstrap': False, 'ccp_alpha': 0.014}. Best is trial 3267 with value: 0.055170387637108485.
[I 2025-04-16 02:00:16,615] Trial 3468 finished with value: -0.1936417107583833 and parameters: {'n_estimators': 12, 'min_samples_split': 6, 'max_features': 0.78, 'min_samples_leaf': 3, 'criterion': 'absolute_error', 'max_depth': 15, 'min_weight_fraction_leaf': 0.0, 'max_leaf_nodes': 300, 'bootstrap': False, 'ccp_alpha': 0.155}. Best is trial 3267 with value: 0.055170387637108485.
[I 2025-04-16 02:00:17,116] Trial 3469 finished with value: -0.044862237906272105 and parameters: {'n_estimators': 9, 'min_samples_split': 6, 'max_features': 0.75, 'min_samples_leaf': 1, 'criterion': 'absolute_error', 'max_depth': 15, 'min_weight_fraction_leaf': 0.0, 'max_leaf_nodes': 300, 'bootstrap': False, 'ccp_alpha': 0.005}. Best is trial 3267 with value: 0.055170387637108485.
[I 2025-04-16 02:00:17,814] Trial 3470 finished with value: -0.1936417107583833 and parameters: {'n_estimators': 250, 'min_samples_split': 6, 'max_features': 0.78, 'min_samples_leaf': 3, 'criterion': 'absolute_error', 'max_depth': 15, 'min_weight_fraction_leaf': 0.0, 'max_leaf_nodes': 300, 'bootstrap': False, 'ccp_alpha': 0.018000000000000002}. Best is trial 3267 with value: 0.055170387637108485.
[I 2025-04-16 02:00:18,570] Trial 3471 finished with value: -16.222292979449442 and parameters: {'n_estimators': 342, 'min_samples_split': 6, 'max_features': 0.76, 'min_samples_leaf': 1, 'criterion': 'absolute_error', 'max_depth': 15, 'min_weight_fraction_leaf': 0.0, 'max_leaf_nodes': 300, 'bootstrap': False, 'ccp_alpha': 0.0}. Best is trial 3267 with value: 0.055170387637108485.
[I 2025-04-16 02:00:19,372] Trial 3472 finished with value: -15.875074800315508 and parameters: {'n_estimators': 349, 'min_samples_split': 6, 'max_features': 0.7100000000000001, 'min_samples_leaf': 3, 'criterion': 'poisson', 'max_depth': 15, 'min_weight_fraction_leaf': 0.0, 'max_leaf_nodes': 300, 'bootstrap': False, 'ccp_alpha': 0.01}. Best is trial 3267 with value: 0.055170387637108485.
[I 2025-04-16 02:00:20,198] Trial 3473 finished with value: 0.039175557304338283 and parameters: {'n_estimators': 403, 'min_samples_split': 6, 'max_features': 0.74, 'min_samples_leaf': 1, 'criterion': 'absolute_error', 'max_depth': 15, 'min_weight_fraction_leaf': 0.0, 'max_leaf_nodes': 300, 'bootstrap': False, 'ccp_alpha': 0.005}. Best is trial 3267 with value: 0.055170387637108485.
[I 2025-04-16 02:00:20,693] Trial 3474 finished with value: -0.1936417107583833 and parameters: {'n_estimators': 3, 'min_samples_split': 6, 'max_features': 0.68, 'min_samples_leaf': 3, 'criterion': 'absolute_error', 'max_depth': 15, 'min_weight_fraction_leaf': 0.0, 'max_leaf_nodes': 300, 'bootstrap': False, 'ccp_alpha': 0.013000000000000001}. Best is trial 3267 with value: 0.055170387637108485.
[I 2025-04-16 02:00:21,391] Trial 3475 finished with value: -0.1936417107583833 and parameters: {'n_estimators': 255, 'min_samples_split': 6, 'max_features': 0.73, 'min_samples_leaf': 1, 'criterion': 'absolute_error', 'max_depth': 15, 'min_weight_fraction_leaf': 0.0, 'max_leaf_nodes': 300, 'bootstrap': False, 'ccp_alpha': 0.027}. Best is trial 3267 with value: 0.055170387637108485.
[I 2025-04-16 02:00:22,211] Trial 3476 finished with value: -14.296411340497334 and parameters: {'n_estimators': 401, 'min_samples_split': 6, 'max_features': 0.7000000000000001, 'min_samples_leaf': 3, 'criterion': 'absolute_error', 'max_depth': 15, 'min_weight_fraction_leaf': 0.0, 'max_leaf_nodes': 300, 'bootstrap': False, 'ccp_alpha': 0.0}. Best is trial 3267 with value: 0.055170387637108485.
[I 2025-04-16 02:00:22,918] Trial 3477 finished with value: -0.1936417107583833 and parameters: {'n_estimators': 244, 'min_samples_split': 6, 'max_features': 0.72, 'min_samples_leaf': 1, 'criterion': 'absolute_error', 'max_depth': 15, 'min_weight_fraction_leaf': 0.0, 'max_leaf_nodes': 300, 'bootstrap': False, 'ccp_alpha': 0.009000000000000001}. Best is trial 3267 with value: 0.055170387637108485.
[I 2025-04-16 02:00:23,780] Trial 3478 finished with value: 0.01533487498886934 and parameters: {'n_estimators': 417, 'min_samples_split': 6, 'max_features': 0.74, 'min_samples_leaf': 3, 'criterion': 'absolute_error', 'max_depth': 15, 'min_weight_fraction_leaf': 0.0, 'max_leaf_nodes': 300, 'bootstrap': False, 'ccp_alpha': 0.005}. Best is trial 3267 with value: 0.055170387637108485.
[I 2025-04-16 02:00:24,269] Trial 3479 finished with value: -0.1936417107583833 and parameters: {'n_estimators': 3, 'min_samples_split': 6, 'max_features': 0.72, 'min_samples_leaf': 3, 'criterion': 'absolute_error', 'max_depth': 15, 'min_weight_fraction_leaf': 0.0, 'max_leaf_nodes': 300, 'bootstrap': False, 'ccp_alpha': 0.02}. Best is trial 3267 with value: 0.055170387637108485.
[I 2025-04-16 02:00:24,971] Trial 3480 finished with value: -0.1936417107583833 and parameters: {'n_estimators': 283, 'min_samples_split': 6, 'max_features': 0.66, 'min_samples_leaf': 1, 'criterion': 'absolute_error', 'max_depth': 15, 'min_weight_fraction_leaf': 0.0, 'max_leaf_nodes': 300, 'bootstrap': False, 'ccp_alpha': 0.014}. Best is trial 3267 with value: 0.055170387637108485.
[I 2025-04-16 02:00:25,613] Trial 3481 finished with value: 0.017304942043807215 and parameters: {'n_estimators': 183, 'min_samples_split': 6, 'max_features': 0.75, 'min_samples_leaf': 3, 'criterion': 'absolute_error', 'max_depth': 15, 'min_weight_fraction_leaf': 0.0, 'max_leaf_nodes': 300, 'bootstrap': False, 'ccp_alpha': 0.005}. Best is trial 3267 with value: 0.055170387637108485.
[I 2025-04-16 02:00:26,456] Trial 3482 finished with value: -17.528986382274876 and parameters: {'n_estimators': 425, 'min_samples_split': 6, 'max_features': 0.6900000000000001, 'min_samples_leaf': 1, 'criterion': 'friedman_mse', 'max_depth': 15, 'min_weight_fraction_leaf': 0.0, 'max_leaf_nodes': 300, 'bootstrap': False, 'ccp_alpha': 0.009000000000000001}. Best is trial 3267 with value: 0.055170387637108485.
[I 2025-04-16 02:00:26,959] Trial 3483 finished with value: -0.1936417107583833 and parameters: {'n_estimators': 4, 'min_samples_split': 6, 'max_features': 0.7100000000000001, 'min_samples_leaf': 3, 'criterion': 'absolute_error', 'max_depth': 15, 'min_weight_fraction_leaf': 0.0, 'max_leaf_nodes': 300, 'bootstrap': False, 'ccp_alpha': 0.018000000000000002}. Best is trial 3267 with value: 0.055170387637108485.
[I 2025-04-16 02:00:27,800] Trial 3484 finished with value: -16.53491923874571 and parameters: {'n_estimators': 449, 'min_samples_split': 6, 'max_features': 0.74, 'min_samples_leaf': 1, 'criterion': 'absolute_error', 'max_depth': 15, 'min_weight_fraction_leaf': 0.0, 'max_leaf_nodes': 300, 'bootstrap': False, 'ccp_alpha': 0.0}. Best is trial 3267 with value: 0.055170387637108485.
[I 2025-04-16 02:00:28,445] Trial 3485 finished with value: -0.1936417107583833 and parameters: {'n_estimators': 185, 'min_samples_split': 2, 'max_features': 0.77, 'min_samples_leaf': 3, 'criterion': 'absolute_error', 'max_depth': 15, 'min_weight_fraction_leaf': 0.0, 'max_leaf_nodes': 300, 'bootstrap': False, 'ccp_alpha': 0.01}. Best is trial 3267 with value: 0.055170387637108485.
[I 2025-04-16 02:00:29,283] Trial 3486 finished with value: -15.999537764671288 and parameters: {'n_estimators': 478, 'min_samples_split': 6, 'max_features': 0.78, 'min_samples_leaf': 1, 'criterion': 'absolute_error', 'max_depth': 15, 'min_weight_fraction_leaf': 0.0, 'max_leaf_nodes': 300, 'bootstrap': False, 'ccp_alpha': 0.0}. Best is trial 3267 with value: 0.055170387637108485.
[I 2025-04-16 02:00:30,025] Trial 3487 finished with value: -0.1936417107583833 and parameters: {'n_estimators': 291, 'min_samples_split': 7, 'max_features': 0.74, 'min_samples_leaf': 3, 'criterion': 'absolute_error', 'max_depth': 15, 'min_weight_fraction_leaf': 0.0, 'max_leaf_nodes': 300, 'bootstrap': False, 'ccp_alpha': 0.014}. Best is trial 3267 with value: 0.055170387637108485.
[I 2025-04-16 02:00:30,883] Trial 3488 finished with value: 0.05528345733671649 and parameters: {'n_estimators': 484, 'min_samples_split': 2, 'max_features': 0.72, 'min_samples_leaf': 1, 'criterion': 'absolute_error', 'max_depth': 15, 'min_weight_fraction_leaf': 0.0, 'max_leaf_nodes': 300, 'bootstrap': False, 'ccp_alpha': 0.005}. Best is trial 3488 with value: 0.05528345733671649.
[I 2025-04-16 02:00:31,595] Trial 3489 finished with value: -0.09550888920532656 and parameters: {'n_estimators': 263, 'min_samples_split': 2, 'max_features': 0.65, 'min_samples_leaf': 3, 'criterion': 'absolute_error', 'max_depth': 15, 'min_weight_fraction_leaf': 0.0, 'max_leaf_nodes': 300, 'bootstrap': False, 'ccp_alpha': 0.005}. Best is trial 3488 with value: 0.05528345733671649.
[I 2025-04-16 02:00:32,473] Trial 3490 finished with value: -17.528986382274873 and parameters: {'n_estimators': 460, 'min_samples_split': 2, 'max_features': 0.6900000000000001, 'min_samples_leaf': 3, 'criterion': 'squared_error', 'max_depth': 15, 'min_weight_fraction_leaf': 0.0, 'max_leaf_nodes': 300, 'bootstrap': False, 'ccp_alpha': 0.01}. Best is trial 3488 with value: 0.05528345733671649.
[I 2025-04-16 02:00:33,155] Trial 3491 finished with value: -0.1936417107583833 and parameters: {'n_estimators': 183, 'min_samples_split': 2, 'max_features': 0.67, 'min_samples_leaf': 1, 'criterion': 'absolute_error', 'max_depth': 15, 'min_weight_fraction_leaf': 0.0, 'max_leaf_nodes': 300, 'bootstrap': False, 'ccp_alpha': 0.023}. Best is trial 3488 with value: 0.05528345733671649.
[I 2025-04-16 02:00:34,074] Trial 3492 finished with value: -0.1936417107583833 and parameters: {'n_estimators': 464, 'min_samples_split': 2, 'max_features': 0.7100000000000001, 'min_samples_leaf': 3, 'criterion': 'absolute_error', 'max_depth': 15, 'min_weight_fraction_leaf': 0.0, 'max_leaf_nodes': 300, 'bootstrap': False, 'ccp_alpha': 0.015}. Best is trial 3488 with value: 0.05528345733671649.
[I 2025-04-16 02:00:35,035] Trial 3493 finished with value: -0.1936417107583833 and parameters: {'n_estimators': 511, 'min_samples_split': 2, 'max_features': 0.7100000000000001, 'min_samples_leaf': 1, 'criterion': 'absolute_error', 'max_depth': 15, 'min_weight_fraction_leaf': 0.0, 'max_leaf_nodes': 300, 'bootstrap': False, 'ccp_alpha': 0.03}. Best is trial 3488 with value: 0.05528345733671649.
[I 2025-04-16 02:00:35,722] Trial 3494 finished with value: 0.02590285808497219 and parameters: {'n_estimators': 216, 'min_samples_split': 2, 'max_features': 0.72, 'min_samples_leaf': 3, 'criterion': 'absolute_error', 'max_depth': 15, 'min_weight_fraction_leaf': 0.0, 'max_leaf_nodes': 300, 'bootstrap': False, 'ccp_alpha': 0.005}. Best is trial 3488 with value: 0.05528345733671649.
[I 2025-04-16 02:00:36,508] Trial 3495 finished with value: -0.1936417107583833 and parameters: {'n_estimators': 372, 'min_samples_split': 6, 'max_features': 0.68, 'min_samples_leaf': 1, 'criterion': 'absolute_error', 'max_depth': 15, 'min_weight_fraction_leaf': 0.0, 'max_leaf_nodes': 300, 'bootstrap': False, 'ccp_alpha': 0.01}. Best is trial 3488 with value: 0.05528345733671649.
[I 2025-04-16 02:00:37,019] Trial 3496 finished with value: -17.833123249082753 and parameters: {'n_estimators': 16, 'min_samples_split': 6, 'max_features': 0.7000000000000001, 'min_samples_leaf': 3, 'criterion': 'absolute_error', 'max_depth': 15, 'min_weight_fraction_leaf': 0.0, 'max_leaf_nodes': 300, 'bootstrap': False, 'ccp_alpha': 0.0}. Best is trial 3488 with value: 0.05528345733671649.
[I 2025-04-16 02:00:37,978] Trial 3497 finished with value: -22.09734399823872 and parameters: {'n_estimators': 585, 'min_samples_split': 2, 'max_features': 0.76, 'min_samples_leaf': 1, 'criterion': 'poisson', 'max_depth': 15, 'min_weight_fraction_leaf': 0.0, 'max_leaf_nodes': 300, 'bootstrap': False, 'ccp_alpha': 0.016}. Best is trial 3488 with value: 0.05528345733671649.
[I 2025-04-16 02:00:38,747] Trial 3498 finished with value: 0.008044194914768089 and parameters: {'n_estimators': 313, 'min_samples_split': 6, 'max_features': 0.73, 'min_samples_leaf': 3, 'criterion': 'absolute_error', 'max_depth': 15, 'min_weight_fraction_leaf': 0.0, 'max_leaf_nodes': 300, 'bootstrap': False, 'ccp_alpha': 0.006}. Best is trial 3488 with value: 0.05528345733671649.
[I 2025-04-16 02:00:39,387] Trial 3499 finished with value: -0.1936417107583833 and parameters: {'n_estimators': 205, 'min_samples_split': 6, 'max_features': 0.78, 'min_samples_leaf': 1, 'criterion': 'absolute_error', 'max_depth': 15, 'min_weight_fraction_leaf': 0.0, 'max_leaf_nodes': 300, 'bootstrap': False, 'ccp_alpha': 0.01}. Best is trial 3488 with value: 0.05528345733671649.
[I 2025-04-16 02:00:40,281] Trial 3500 finished with value: -0.1936417107583833 and parameters: {'n_estimators': 512, 'min_samples_split': 2, 'max_features': 0.75, 'min_samples_leaf': 3, 'criterion': 'absolute_error', 'max_depth': 15, 'min_weight_fraction_leaf': 0.0, 'max_leaf_nodes': 300, 'bootstrap': False, 'ccp_alpha': 0.019}. Best is trial 3488 with value: 0.05528345733671649.
[I 2025-04-16 02:00:41,270] Trial 3501 finished with value: 0.017097463418782467 and parameters: {'n_estimators': 556, 'min_samples_split': 6, 'max_features': 0.72, 'min_samples_leaf': 3, 'criterion': 'absolute_error', 'max_depth': 15, 'min_weight_fraction_leaf': 0.0, 'max_leaf_nodes': 300, 'bootstrap': False, 'ccp_alpha': 0.005}. Best is trial 3488 with value: 0.05528345733671649.
[I 2025-04-16 02:00:41,894] Trial 3502 finished with value: -19.592761463665845 and parameters: {'n_estimators': 162, 'min_samples_split': 7, 'max_features': 0.6900000000000001, 'min_samples_leaf': 1, 'criterion': 'absolute_error', 'max_depth': 15, 'min_weight_fraction_leaf': 0.0, 'max_leaf_nodes': 300, 'bootstrap': False, 'ccp_alpha': 0.0}. Best is trial 3488 with value: 0.05528345733671649.
[I 2025-04-16 02:00:42,690] Trial 3503 finished with value: -0.1936417107583833 and parameters: {'n_estimators': 376, 'min_samples_split': 6, 'max_features': 0.73, 'min_samples_leaf': 3, 'criterion': 'absolute_error', 'max_depth': 15, 'min_weight_fraction_leaf': 0.0, 'max_leaf_nodes': 300, 'bootstrap': False, 'ccp_alpha': 0.013000000000000001}. Best is trial 3488 with value: 0.05528345733671649.
[I 2025-04-16 02:00:43,687] Trial 3504 finished with value: -0.1936417107583833 and parameters: {'n_estimators': 550, 'min_samples_split': 7, 'max_features': 0.76, 'min_samples_leaf': 1, 'criterion': 'absolute_error', 'max_depth': 15, 'min_weight_fraction_leaf': 0.0, 'max_leaf_nodes': 300, 'bootstrap': False, 'ccp_alpha': 0.139}. Best is trial 3488 with value: 0.05528345733671649.
[I 2025-04-16 02:00:44,193] Trial 3505 finished with value: -0.1936417107583833 and parameters: {'n_estimators': 2, 'min_samples_split': 2, 'max_features': 0.7000000000000001, 'min_samples_leaf': 3, 'criterion': 'absolute_error', 'max_depth': 15, 'min_weight_fraction_leaf': 0.0, 'max_leaf_nodes': 300, 'bootstrap': False, 'ccp_alpha': 0.005}. Best is trial 3488 with value: 0.05528345733671649.
[I 2025-04-16 02:00:45,013] Trial 3506 finished with value: -0.1936417107583833 and parameters: {'n_estimators': 351, 'min_samples_split': 2, 'max_features': 0.79, 'min_samples_leaf': 1, 'criterion': 'absolute_error', 'max_depth': 15, 'min_weight_fraction_leaf': 0.0, 'max_leaf_nodes': 300, 'bootstrap': False, 'ccp_alpha': 0.024}. Best is trial 3488 with value: 0.05528345733671649.
[I 2025-04-16 02:00:46,120] Trial 3507 finished with value: -17.528986382274862 and parameters: {'n_estimators': 668, 'min_samples_split': 2, 'max_features': 0.74, 'min_samples_leaf': 3, 'criterion': 'friedman_mse', 'max_depth': 15, 'min_weight_fraction_leaf': 0.0, 'max_leaf_nodes': 300, 'bootstrap': False, 'ccp_alpha': 0.013000000000000001}. Best is trial 3488 with value: 0.05528345733671649.
[I 2025-04-16 02:00:46,907] Trial 3508 finished with value: -0.1936417107583833 and parameters: {'n_estimators': 349, 'min_samples_split': 7, 'max_features': 0.78, 'min_samples_leaf': 1, 'criterion': 'absolute_error', 'max_depth': 15, 'min_weight_fraction_leaf': 0.0, 'max_leaf_nodes': 300, 'bootstrap': False, 'ccp_alpha': 0.009000000000000001}. Best is trial 3488 with value: 0.05528345733671649.
