[I 2025-04-16 01:57:32,323] Trial 3285 finished with value: -0.1936417107583833 and parameters: {'n_estimators': 616, 'min_samples_split': 2, 'max_features': 0.77, 'min_samples_leaf': 1, 'criterion': 'absolute_error', 'max_depth': 15, 'min_weight_fraction_leaf': 0.0, 'max_leaf_nodes': 300, 'bootstrap': False, 'ccp_alpha': 0.015}. Best is trial 3267 with value: 0.055170387637108485.
[I 2025-04-16 01:57:33,194] Trial 3286 finished with value: -17.528986382274873 and parameters: {'n_estimators': 503, 'min_samples_split': 2, 'max_features': 0.73, 'min_samples_leaf': 1, 'criterion': 'friedman_mse', 'max_depth': 15, 'min_weight_fraction_leaf': 0.0, 'max_leaf_nodes': 300, 'bootstrap': False, 'ccp_alpha': 0.01}. Best is trial 3267 with value: 0.055170387637108485.
[I 2025-04-16 01:57:34,028] Trial 3287 finished with value: -0.1936417107583833 and parameters: {'n_estimators': 414, 'min_samples_split': 2, 'max_features': 0.73, 'min_samples_leaf': 1, 'criterion': 'absolute_error', 'max_depth': 15, 'min_weight_fraction_leaf': 0.0, 'max_leaf_nodes': 300, 'bootstrap': False, 'ccp_alpha': 0.019}. Best is trial 3267 with value: 0.055170387637108485.
[I 2025-04-16 01:57:35,281] Trial 3288 finished with value: 0.03897522586043552 and parameters: {'n_estimators': 871, 'min_samples_split': 2, 'max_features': 0.75, 'min_samples_leaf': 1, 'criterion': 'absolute_error', 'max_depth': 15, 'min_weight_fraction_leaf': 0.0, 'max_leaf_nodes': 300, 'bootstrap': False, 'ccp_alpha': 0.005}. Best is trial 3267 with value: 0.055170387637108485.
[I 2025-04-16 01:57:36,412] Trial 3289 finished with value: -0.1936417107583833 and parameters: {'n_estimators': 766, 'min_samples_split': 4, 'max_features': 0.74, 'min_samples_leaf': 1, 'criterion': 'absolute_error', 'max_depth': 15, 'min_weight_fraction_leaf': 0.0, 'max_leaf_nodes': 300, 'bootstrap': False, 'ccp_alpha': 0.009000000000000001}. Best is trial 3267 with value: 0.055170387637108485.
[I 2025-04-16 01:57:37,248] Trial 3290 finished with value: -44.31526435561171 and parameters: {'n_estimators': 500, 'min_samples_split': 4, 'max_features': 0.75, 'min_samples_leaf': 1, 'criterion': 'absolute_error', 'max_depth': 15, 'min_weight_fraction_leaf': 0.0, 'max_leaf_nodes': 300, 'bootstrap': False, 'ccp_alpha': 0.0}. Best is trial 3267 with value: 0.055170387637108485.
[I 2025-04-16 01:57:38,421] Trial 3291 finished with value: -0.1936417107583833 and parameters: {'n_estimators': 789, 'min_samples_split': 5, 'max_features': 0.77, 'min_samples_leaf': 1, 'criterion': 'absolute_error', 'max_depth': 15, 'min_weight_fraction_leaf': 0.0, 'max_leaf_nodes': 300, 'bootstrap': False, 'ccp_alpha': 0.013000000000000001}. Best is trial 3267 with value: 0.055170387637108485.
[I 2025-04-16 01:57:39,306] Trial 3292 finished with value: 0.05107705941716043 and parameters: {'n_estimators': 470, 'min_samples_split': 2, 'max_features': 0.74, 'min_samples_leaf': 1, 'criterion': 'absolute_error', 'max_depth': 15, 'min_weight_fraction_leaf': 0.0, 'max_leaf_nodes': 300, 'bootstrap': False, 'ccp_alpha': 0.005}. Best is trial 3267 with value: 0.055170387637108485.
[I 2025-04-16 01:57:40,249] Trial 3293 finished with value: -0.1936417107583833 and parameters: {'n_estimators': 471, 'min_samples_split': 2, 'max_features': 0.75, 'min_samples_leaf': 1, 'criterion': 'absolute_error', 'max_depth': 15, 'min_weight_fraction_leaf': 0.0, 'max_leaf_nodes': 300, 'bootstrap': False, 'ccp_alpha': 0.025}. Best is trial 3267 with value: 0.055170387637108485.
[I 2025-04-16 01:57:41,298] Trial 3294 finished with value: -0.1936417107583833 and parameters: {'n_estimators': 612, 'min_samples_split': 2, 'max_features': 0.72, 'min_samples_leaf': 1, 'criterion': 'absolute_error', 'max_depth': 15, 'min_weight_fraction_leaf': 0.0, 'max_leaf_nodes': 300, 'bootstrap': False, 'ccp_alpha': 0.131}. Best is trial 3267 with value: 0.055170387637108485.
[I 2025-04-16 01:57:42,333] Trial 3295 finished with value: -0.1936417107583833 and parameters: {'n_estimators': 651, 'min_samples_split': 2, 'max_features': 0.72, 'min_samples_leaf': 1, 'criterion': 'absolute_error', 'max_depth': 15, 'min_weight_fraction_leaf': 0.0, 'max_leaf_nodes': 300, 'bootstrap': False, 'ccp_alpha': 0.009000000000000001}. Best is trial 3267 with value: 0.055170387637108485.
[I 2025-04-16 01:57:43,099] Trial 3296 finished with value: -0.1936417107583833 and parameters: {'n_estimators': 373, 'min_samples_split': 2, 'max_features': 0.75, 'min_samples_leaf': 1, 'criterion': 'absolute_error', 'max_depth': 15, 'min_weight_fraction_leaf': 0.0, 'max_leaf_nodes': 300, 'bootstrap': False, 'ccp_alpha': 0.017}. Best is trial 3267 with value: 0.055170387637108485.
[I 2025-04-16 01:57:44,274] Trial 3297 finished with value: 0.035957417225338385 and parameters: {'n_estimators': 800, 'min_samples_split': 2, 'max_features': 0.74, 'min_samples_leaf': 1, 'criterion': 'absolute_error', 'max_depth': 15, 'min_weight_fraction_leaf': 0.0, 'max_leaf_nodes': 300, 'bootstrap': False, 'ccp_alpha': 0.005}. Best is trial 3267 with value: 0.055170387637108485.
[I 2025-04-16 01:57:45,430] Trial 3298 finished with value: -3.590754028742443 and parameters: {'n_estimators': 838, 'min_samples_split': 4, 'max_features': 0.74, 'min_samples_leaf': 1, 'criterion': 'squared_error', 'max_depth': 15, 'min_weight_fraction_leaf': 0.0, 'max_leaf_nodes': 300, 'bootstrap': False, 'ccp_alpha': 0.0}. Best is trial 3267 with value: 0.055170387637108485.
[I 2025-04-16 01:57:46,241] Trial 3299 finished with value: -0.1936417107583833 and parameters: {'n_estimators': 452, 'min_samples_split': 2, 'max_features': 0.75, 'min_samples_leaf': 1, 'criterion': 'absolute_error', 'max_depth': 15, 'min_weight_fraction_leaf': 0.0, 'max_leaf_nodes': 300, 'bootstrap': False, 'ccp_alpha': 0.014}. Best is trial 3267 with value: 0.055170387637108485.
[I 2025-04-16 01:57:47,019] Trial 3300 finished with value: 0.05205163284260763 and parameters: {'n_estimators': 384, 'min_samples_split': 2, 'max_features': 0.72, 'min_samples_leaf': 1, 'criterion': 'absolute_error', 'max_depth': 15, 'min_weight_fraction_leaf': 0.0, 'max_leaf_nodes': 300, 'bootstrap': False, 'ccp_alpha': 0.005}. Best is trial 3267 with value: 0.055170387637108485.
[I 2025-04-16 01:57:47,826] Trial 3301 finished with value: -0.1936417107583833 and parameters: {'n_estimators': 391, 'min_samples_split': 2, 'max_features': 0.72, 'min_samples_leaf': 1, 'criterion': 'absolute_error', 'max_depth': 15, 'min_weight_fraction_leaf': 0.0, 'max_leaf_nodes': 300, 'bootstrap': False, 'ccp_alpha': 0.01}. Best is trial 3267 with value: 0.055170387637108485.
[I 2025-04-16 01:57:48,572] Trial 3302 finished with value: -17.52898638227488 and parameters: {'n_estimators': 321, 'min_samples_split': 2, 'max_features': 0.74, 'min_samples_leaf': 1, 'criterion': 'poisson', 'max_depth': 15, 'min_weight_fraction_leaf': 0.0, 'max_leaf_nodes': 300, 'bootstrap': False, 'ccp_alpha': 0.162}. Best is trial 3267 with value: 0.055170387637108485.
[I 2025-04-16 01:57:49,438] Trial 3303 finished with value: -0.1936417107583833 and parameters: {'n_estimators': 461, 'min_samples_split': 2, 'max_features': 0.7100000000000001, 'min_samples_leaf': 1, 'criterion': 'absolute_error', 'max_depth': 15, 'min_weight_fraction_leaf': 0.0, 'max_leaf_nodes': 300, 'bootstrap': False, 'ccp_alpha': 0.02}. Best is trial 3267 with value: 0.055170387637108485.
[I 2025-04-16 01:57:50,525] Trial 3304 finished with value: 0.03899806412117317 and parameters: {'n_estimators': 680, 'min_samples_split': 2, 'max_features': 0.74, 'min_samples_leaf': 1, 'criterion': 'absolute_error', 'max_depth': 15, 'min_weight_fraction_leaf': 0.0, 'max_leaf_nodes': 300, 'bootstrap': False, 'ccp_alpha': 0.005}. Best is trial 3267 with value: 0.055170387637108485.
[I 2025-04-16 01:57:51,259] Trial 3305 finished with value: -34.637618980277054 and parameters: {'n_estimators': 366, 'min_samples_split': 2, 'max_features': 0.73, 'min_samples_leaf': 1, 'criterion': 'absolute_error', 'max_depth': 15, 'min_weight_fraction_leaf': 0.0, 'max_leaf_nodes': 300, 'bootstrap': False, 'ccp_alpha': 0.0}. Best is trial 3267 with value: 0.055170387637108485.
[I 2025-04-16 01:57:52,301] Trial 3306 finished with value: -0.1936417107583833 and parameters: {'n_estimators': 660, 'min_samples_split': 2, 'max_features': 0.6900000000000001, 'min_samples_leaf': 1, 'criterion': 'absolute_error', 'max_depth': 15, 'min_weight_fraction_leaf': 0.0, 'max_leaf_nodes': 300, 'bootstrap': False, 'ccp_alpha': 0.01}. Best is trial 3267 with value: 0.055170387637108485.
[I 2025-04-16 01:57:53,324] Trial 3307 finished with value: -0.1936417107583833 and parameters: {'n_estimators': 626, 'min_samples_split': 3, 'max_features': 0.7100000000000001, 'min_samples_leaf': 1, 'criterion': 'absolute_error', 'max_depth': 15, 'min_weight_fraction_leaf': 0.0, 'max_leaf_nodes': 300, 'bootstrap': False, 'ccp_alpha': 0.015}. Best is trial 3267 with value: 0.055170387637108485.
[I 2025-04-16 01:57:54,202] Trial 3308 finished with value: 0.05361328882327363 and parameters: {'n_estimators': 360, 'min_samples_split': 2, 'max_features': 0.74, 'min_samples_leaf': 1, 'criterion': 'absolute_error', 'max_depth': 15, 'min_weight_fraction_leaf': 0.0, 'max_leaf_nodes': 300, 'bootstrap': False, 'ccp_alpha': 0.005}. Best is trial 3267 with value: 0.055170387637108485.
[I 2025-04-16 01:57:55,028] Trial 3309 finished with value: -0.1936417107583833 and parameters: {'n_estimators': 307, 'min_samples_split': 2, 'max_features': 0.7100000000000001, 'min_samples_leaf': 1, 'criterion': 'absolute_error', 'max_depth': 15, 'min_weight_fraction_leaf': 0.0, 'max_leaf_nodes': 300, 'bootstrap': False, 'ccp_alpha': 0.009000000000000001}. Best is trial 3267 with value: 0.055170387637108485.
[I 2025-04-16 01:57:55,947] Trial 3310 finished with value: -34.59759593613348 and parameters: {'n_estimators': 536, 'min_samples_split': 2, 'max_features': 0.74, 'min_samples_leaf': 1, 'criterion': 'absolute_error', 'max_depth': 15, 'min_weight_fraction_leaf': 0.0, 'max_leaf_nodes': 300, 'bootstrap': False, 'ccp_alpha': 0.0}. Best is trial 3267 with value: 0.055170387637108485.
[I 2025-04-16 01:57:56,822] Trial 3311 finished with value: -0.1936417107583833 and parameters: {'n_estimators': 410, 'min_samples_split': 2, 'max_features': 0.75, 'min_samples_leaf': 1, 'criterion': 'absolute_error', 'max_depth': 15, 'min_weight_fraction_leaf': 0.0, 'max_leaf_nodes': 300, 'bootstrap': False, 'ccp_alpha': 0.023}. Best is trial 3267 with value: 0.055170387637108485.
[I 2025-04-16 01:57:57,661] Trial 3312 finished with value: -17.528986382274876 and parameters: {'n_estimators': 388, 'min_samples_split': 2, 'max_features': 0.73, 'min_samples_leaf': 1, 'criterion': 'friedman_mse', 'max_depth': 15, 'min_weight_fraction_leaf': 0.0, 'max_leaf_nodes': 300, 'bootstrap': False, 'ccp_alpha': 0.016}. Best is trial 3267 with value: 0.055170387637108485.
[I 2025-04-16 01:57:58,746] Trial 3313 finished with value: 0.0390841194492149 and parameters: {'n_estimators': 735, 'min_samples_split': 2, 'max_features': 0.7000000000000001, 'min_samples_leaf': 1, 'criterion': 'absolute_error', 'max_depth': 15, 'min_weight_fraction_leaf': 0.0, 'max_leaf_nodes': 300, 'bootstrap': False, 'ccp_alpha': 0.005}. Best is trial 3267 with value: 0.055170387637108485.
[I 2025-04-16 01:57:59,801] Trial 3314 finished with value: -0.1936417107583833 and parameters: {'n_estimators': 717, 'min_samples_split': 2, 'max_features': 0.7100000000000001, 'min_samples_leaf': 1, 'criterion': 'absolute_error', 'max_depth': 15, 'min_weight_fraction_leaf': 0.0, 'max_leaf_nodes': 300, 'bootstrap': False, 'ccp_alpha': 0.011}. Best is trial 3267 with value: 0.055170387637108485.
[I 2025-04-16 01:58:00,909] Trial 3315 finished with value: -32.06112509486552 and parameters: {'n_estimators': 857, 'min_samples_split': 3, 'max_features': 0.7100000000000001, 'min_samples_leaf': 1, 'criterion': 'absolute_error', 'max_depth': 15, 'min_weight_fraction_leaf': 0.0, 'max_leaf_nodes': 300, 'bootstrap': False, 'ccp_alpha': 0.0}. Best is trial 3267 with value: 0.055170387637108485.
[I 2025-04-16 01:58:01,847] Trial 3316 finished with value: -0.1936417107583833 and parameters: {'n_estimators': 567, 'min_samples_split': 2, 'max_features': 0.75, 'min_samples_leaf': 1, 'criterion': 'absolute_error', 'max_depth': 15, 'min_weight_fraction_leaf': 0.0, 'max_leaf_nodes': 300, 'bootstrap': False, 'ccp_alpha': 0.182}. Best is trial 3267 with value: 0.055170387637108485.
[I 2025-04-16 01:58:02,593] Trial 3317 finished with value: 0.011160341315738554 and parameters: {'n_estimators': 346, 'min_samples_split': 2, 'max_features': 0.73, 'min_samples_leaf': 1, 'criterion': 'absolute_error', 'max_depth': 15, 'min_weight_fraction_leaf': 0.0, 'max_leaf_nodes': 300, 'bootstrap': False, 'ccp_alpha': 0.006}. Best is trial 3267 with value: 0.055170387637108485.
[I 2025-04-16 01:58:03,830] Trial 3318 finished with value: -0.1936417107583833 and parameters: {'n_estimators': 838, 'min_samples_split': 2, 'max_features': 0.7000000000000001, 'min_samples_leaf': 1, 'criterion': 'absolute_error', 'max_depth': 15, 'min_weight_fraction_leaf': 0.0, 'max_leaf_nodes': 300, 'bootstrap': False, 'ccp_alpha': 0.014}. Best is trial 3267 with value: 0.055170387637108485.
[I 2025-04-16 01:58:04,882] Trial 3319 finished with value: -0.1936417107583833 and parameters: {'n_estimators': 639, 'min_samples_split': 2, 'max_features': 0.76, 'min_samples_leaf': 1, 'criterion': 'absolute_error', 'max_depth': 15, 'min_weight_fraction_leaf': 0.0, 'max_leaf_nodes': 300, 'bootstrap': False, 'ccp_alpha': 0.029}. Best is trial 3267 with value: 0.055170387637108485.
[I 2025-04-16 01:58:05,691] Trial 3320 finished with value: -17.528986382274873 and parameters: {'n_estimators': 366, 'min_samples_split': 2, 'max_features': 0.73, 'min_samples_leaf': 1, 'criterion': 'squared_error', 'max_depth': 15, 'min_weight_fraction_leaf': 0.0, 'max_leaf_nodes': 300, 'bootstrap': False, 'ccp_alpha': 0.005}. Best is trial 3267 with value: 0.055170387637108485.
[I 2025-04-16 01:58:06,950] Trial 3321 finished with value: -0.1936417107583833 and parameters: {'n_estimators': 873, 'min_samples_split': 2, 'max_features': 0.76, 'min_samples_leaf': 1, 'criterion': 'absolute_error', 'max_depth': 15, 'min_weight_fraction_leaf': 0.0, 'max_leaf_nodes': 300, 'bootstrap': False, 'ccp_alpha': 0.019}. Best is trial 3267 with value: 0.055170387637108485.
[I 2025-04-16 01:58:07,965] Trial 3322 finished with value: -0.1936417107583833 and parameters: {'n_estimators': 640, 'min_samples_split': 2, 'max_features': 0.7000000000000001, 'min_samples_leaf': 1, 'criterion': 'absolute_error', 'max_depth': 15, 'min_weight_fraction_leaf': 0.0, 'max_leaf_nodes': 300, 'bootstrap': False, 'ccp_alpha': 0.01}. Best is trial 3267 with value: 0.055170387637108485.
[I 2025-04-16 01:58:08,969] Trial 3323 finished with value: -36.745026834948426 and parameters: {'n_estimators': 708, 'min_samples_split': 2, 'max_features': 0.75, 'min_samples_leaf': 1, 'criterion': 'absolute_error', 'max_depth': 15, 'min_weight_fraction_leaf': 0.0, 'max_leaf_nodes': 300, 'bootstrap': False, 'ccp_alpha': 0.0}. Best is trial 3267 with value: 0.055170387637108485.
[I 2025-04-16 01:58:09,888] Trial 3324 finished with value: -0.1936417107583833 and parameters: {'n_estimators': 494, 'min_samples_split': 2, 'max_features': 0.68, 'min_samples_leaf': 1, 'criterion': 'absolute_error', 'max_depth': 15, 'min_weight_fraction_leaf': 0.0, 'max_leaf_nodes': 300, 'bootstrap': False, 'ccp_alpha': 0.009000000000000001}. Best is trial 3267 with value: 0.055170387637108485.
[I 2025-04-16 01:58:11,217] Trial 3325 finished with value: 0.041076747372657076 and parameters: {'n_estimators': 924, 'min_samples_split': 2, 'max_features': 0.74, 'min_samples_leaf': 1, 'criterion': 'absolute_error', 'max_depth': 15, 'min_weight_fraction_leaf': 0.0, 'max_leaf_nodes': 300, 'bootstrap': False, 'ccp_alpha': 0.005}. Best is trial 3267 with value: 0.055170387637108485.
[I 2025-04-16 01:58:12,490] Trial 3326 finished with value: -21.916680669876587 and parameters: {'n_estimators': 870, 'min_samples_split': 2, 'max_features': 0.73, 'min_samples_leaf': 1, 'criterion': 'poisson', 'max_depth': 15, 'min_weight_fraction_leaf': 0.0, 'max_leaf_nodes': 300, 'bootstrap': False, 'ccp_alpha': 0.014}. Best is trial 3267 with value: 0.055170387637108485.
[I 2025-04-16 01:58:13,725] Trial 3327 finished with value: -0.1936417107583833 and parameters: {'n_estimators': 894, 'min_samples_split': 2, 'max_features': 0.72, 'min_samples_leaf': 1, 'criterion': 'absolute_error', 'max_depth': 15, 'min_weight_fraction_leaf': 0.0, 'max_leaf_nodes': 300, 'bootstrap': False, 'ccp_alpha': 0.019}. Best is trial 3267 with value: 0.055170387637108485.
[I 2025-04-16 01:58:14,748] Trial 3328 finished with value: 0.0381687927431422 and parameters: {'n_estimators': 668, 'min_samples_split': 2, 'max_features': 0.76, 'min_samples_leaf': 1, 'criterion': 'absolute_error', 'max_depth': 15, 'min_weight_fraction_leaf': 0.0, 'max_leaf_nodes': 300, 'bootstrap': False, 'ccp_alpha': 0.005}. Best is trial 3267 with value: 0.055170387637108485.
[I 2025-04-16 01:58:15,893] Trial 3329 finished with value: -0.1936417107583833 and parameters: {'n_estimators': 697, 'min_samples_split': 2, 'max_features': 0.76, 'min_samples_leaf': 1, 'criterion': 'absolute_error', 'max_depth': 15, 'min_weight_fraction_leaf': 0.0, 'max_leaf_nodes': 300, 'bootstrap': False, 'ccp_alpha': 0.01}. Best is trial 3267 with value: 0.055170387637108485.
[I 2025-04-16 01:58:16,663] Trial 3330 finished with value: -42.84211549208862 and parameters: {'n_estimators': 341, 'min_samples_split': 4, 'max_features': 0.74, 'min_samples_leaf': 1, 'criterion': 'absolute_error', 'max_depth': 15, 'min_weight_fraction_leaf': 0.0, 'max_leaf_nodes': 300, 'bootstrap': False, 'ccp_alpha': 0.0}. Best is trial 3267 with value: 0.055170387637108485.
[I 2025-04-16 01:58:17,944] Trial 3331 finished with value: 0.02349656119519956 and parameters: {'n_estimators': 877, 'min_samples_split': 5, 'max_features': 0.7000000000000001, 'min_samples_leaf': 1, 'criterion': 'absolute_error', 'max_depth': 15, 'min_weight_fraction_leaf': 0.0, 'max_leaf_nodes': 300, 'bootstrap': False, 'ccp_alpha': 0.005}. Best is trial 3267 with value: 0.055170387637108485.
[I 2025-04-16 01:58:18,877] Trial 3332 finished with value: -0.1936417107583833 and parameters: {'n_estimators': 552, 'min_samples_split': 2, 'max_features': 0.75, 'min_samples_leaf': 1, 'criterion': 'absolute_error', 'max_depth': 15, 'min_weight_fraction_leaf': 0.0, 'max_leaf_nodes': 300, 'bootstrap': False, 'ccp_alpha': 0.012}. Best is trial 3267 with value: 0.055170387637108485.
[I 2025-04-16 01:58:20,201] Trial 3333 finished with value: -0.1936417107583833 and parameters: {'n_estimators': 898, 'min_samples_split': 2, 'max_features': 0.76, 'min_samples_leaf': 1, 'criterion': 'absolute_error', 'max_depth': 15, 'min_weight_fraction_leaf': 0.0, 'max_leaf_nodes': 300, 'bootstrap': False, 'ccp_alpha': 0.021}. Best is trial 3267 with value: 0.055170387637108485.
[I 2025-04-16 01:58:20,977] Trial 3334 finished with value: -0.1936417107583833 and parameters: {'n_estimators': 317, 'min_samples_split': 2, 'max_features': 0.73, 'min_samples_leaf': 1, 'criterion': 'absolute_error', 'max_depth': 15, 'min_weight_fraction_leaf': 0.0, 'max_leaf_nodes': 300, 'bootstrap': False, 'ccp_alpha': 0.009000000000000001}. Best is trial 3267 with value: 0.055170387637108485.
[I 2025-04-16 01:58:21,978] Trial 3335 finished with value: -0.1936417107583833 and parameters: {'n_estimators': 552, 'min_samples_split': 2, 'max_features': 0.76, 'min_samples_leaf': 1, 'criterion': 'absolute_error', 'max_depth': 15, 'min_weight_fraction_leaf': 0.0, 'max_leaf_nodes': 300, 'bootstrap': False, 'ccp_alpha': 0.015}. Best is trial 3267 with value: 0.055170387637108485.
[I 2025-04-16 01:58:23,093] Trial 3336 finished with value: 0.03776737514509913 and parameters: {'n_estimators': 666, 'min_samples_split': 2, 'max_features': 0.73, 'min_samples_leaf': 1, 'criterion': 'absolute_error', 'max_depth': 15, 'min_weight_fraction_leaf': 0.0, 'max_leaf_nodes': 300, 'bootstrap': False, 'ccp_alpha': 0.005}. Best is trial 3267 with value: 0.055170387637108485.
[I 2025-04-16 01:58:24,158] Trial 3337 finished with value: -0.014396638776486137 and parameters: {'n_estimators': 678, 'min_samples_split': 2, 'max_features': 0.68, 'min_samples_leaf': 1, 'criterion': 'absolute_error', 'max_depth': 15, 'min_weight_fraction_leaf': 0.0, 'max_leaf_nodes': 300, 'bootstrap': False, 'ccp_alpha': 0.006}. Best is trial 3267 with value: 0.055170387637108485.
[I 2025-04-16 01:58:25,182] Trial 3338 finished with value: -8.718299099642696 and parameters: {'n_estimators': 745, 'min_samples_split': 2, 'max_features': 0.73, 'min_samples_leaf': 1, 'criterion': 'friedman_mse', 'max_depth': 15, 'min_weight_fraction_leaf': 0.0, 'max_leaf_nodes': 300, 'bootstrap': False, 'ccp_alpha': 0.0}. Best is trial 3267 with value: 0.055170387637108485.
[I 2025-04-16 01:58:26,038] Trial 3339 finished with value: -0.1936417107583833 and parameters: {'n_estimators': 469, 'min_samples_split': 2, 'max_features': 0.7100000000000001, 'min_samples_leaf': 1, 'criterion': 'absolute_error', 'max_depth': 15, 'min_weight_fraction_leaf': 0.0, 'max_leaf_nodes': 300, 'bootstrap': False, 'ccp_alpha': 0.024}. Best is trial 3267 with value: 0.055170387637108485.
[I 2025-04-16 01:58:27,273] Trial 3340 finished with value: -0.1936417107583833 and parameters: {'n_estimators': 865, 'min_samples_split': 2, 'max_features': 0.72, 'min_samples_leaf': 1, 'criterion': 'absolute_error', 'max_depth': 15, 'min_weight_fraction_leaf': 0.0, 'max_leaf_nodes': 300, 'bootstrap': False, 'ccp_alpha': 0.015}. Best is trial 3267 with value: 0.055170387637108485.
