[I 2025-04-16 00:33:23,458] Trial 1600 finished with value: -0.19364227165053408 and parameters: {'n_estimators': 3682, 'min_samples_split': 15, 'max_features': 0.9600000000000001, 'min_samples_leaf': 18, 'criterion': 'absolute_error', 'max_depth': 60, 'min_weight_fraction_leaf': 0.01, 'max_leaf_nodes': 150, 'bootstrap': False, 'ccp_alpha': 0.0}. Best is trial 1439 with value: -0.15896829431478016.
[I 2025-04-16 00:33:26,724] Trial 1601 finished with value: -0.1936417107583833 and parameters: {'n_estimators': 3705, 'min_samples_split': 21, 'max_features': 0.92, 'min_samples_leaf': 15, 'criterion': 'absolute_error', 'max_depth': 60, 'min_weight_fraction_leaf': 0.01, 'max_leaf_nodes': 150, 'bootstrap': False, 'ccp_alpha': 0.006}. Best is trial 1439 with value: -0.15896829431478016.
[I 2025-04-16 00:33:30,738] Trial 1602 finished with value: -34.45214250313194 and parameters: {'n_estimators': 3975, 'min_samples_split': 9, 'max_features': 0.98, 'min_samples_leaf': 11, 'criterion': 'poisson', 'max_depth': 60, 'min_weight_fraction_leaf': 0.01, 'max_leaf_nodes': 150, 'bootstrap': False, 'ccp_alpha': 0.014}. Best is trial 1439 with value: -0.15896829431478016.
[I 2025-04-16 00:33:34,351] Trial 1603 finished with value: -0.1590635385984082 and parameters: {'n_estimators': 4306, 'min_samples_split': 18, 'max_features': 0.9400000000000001, 'min_samples_leaf': 13, 'criterion': 'absolute_error', 'max_depth': 60, 'min_weight_fraction_leaf': 0.01, 'max_leaf_nodes': 150, 'bootstrap': False, 'ccp_alpha': 0.0}. Best is trial 1439 with value: -0.15896829431478016.
[I 2025-04-16 00:33:37,612] Trial 1604 finished with value: -0.1936417107583833 and parameters: {'n_estimators': 4329, 'min_samples_split': 24, 'max_features': 0.93, 'min_samples_leaf': 10, 'criterion': 'absolute_error', 'max_depth': 60, 'min_weight_fraction_leaf': 0.01, 'max_leaf_nodes': 150, 'bootstrap': False, 'ccp_alpha': 0.006}. Best is trial 1439 with value: -0.15896829431478016.
[I 2025-04-16 00:33:41,206] Trial 1605 finished with value: -0.1936417107583833 and parameters: {'n_estimators': 4136, 'min_samples_split': 18, 'max_features': 0.92, 'min_samples_leaf': 16, 'criterion': 'absolute_error', 'max_depth': 60, 'min_weight_fraction_leaf': 0.01, 'max_leaf_nodes': 150, 'bootstrap': False, 'ccp_alpha': 0.009000000000000001}. Best is trial 1439 with value: -0.15896829431478016.
[I 2025-04-16 00:33:45,310] Trial 1606 finished with value: -0.1936417107583833 and parameters: {'n_estimators': 4424, 'min_samples_split': 24, 'max_features': 0.9500000000000001, 'min_samples_leaf': 13, 'criterion': 'absolute_error', 'max_depth': 60, 'min_weight_fraction_leaf': 0.0, 'max_leaf_nodes': 150, 'bootstrap': False, 'ccp_alpha': 0.005}. Best is trial 1439 with value: -0.15896829431478016.
[I 2025-04-16 00:33:48,328] Trial 1607 finished with value: -8.790654843525644 and parameters: {'n_estimators': 3828, 'min_samples_split': 20, 'max_features': 0.97, 'min_samples_leaf': 12, 'criterion': 'absolute_error', 'max_depth': 60, 'min_weight_fraction_leaf': 0.01, 'max_leaf_nodes': 150, 'bootstrap': False, 'ccp_alpha': 0.0}. Best is trial 1439 with value: -0.15896829431478016.
[I 2025-04-16 00:33:52,039] Trial 1608 finished with value: -0.1936417107583833 and parameters: {'n_estimators': 4198, 'min_samples_split': 12, 'max_features': 0.99, 'min_samples_leaf': 15, 'criterion': 'absolute_error', 'max_depth': 60, 'min_weight_fraction_leaf': 0.01, 'max_leaf_nodes': 150, 'bootstrap': False, 'ccp_alpha': 0.014}. Best is trial 1439 with value: -0.15896829431478016.
[I 2025-04-16 00:33:55,171] Trial 1609 finished with value: -0.19364227121573863 and parameters: {'n_estimators': 4014, 'min_samples_split': 19, 'max_features': 0.93, 'min_samples_leaf': 18, 'criterion': 'absolute_error', 'max_depth': 60, 'min_weight_fraction_leaf': 0.0, 'max_leaf_nodes': 150, 'bootstrap': False, 'ccp_alpha': 0.0}. Best is trial 1439 with value: -0.15896829431478016.
[I 2025-04-16 00:33:58,612] Trial 1610 finished with value: -0.1936417107583833 and parameters: {'n_estimators': 3889, 'min_samples_split': 14, 'max_features': 0.9500000000000001, 'min_samples_leaf': 10, 'criterion': 'absolute_error', 'max_depth': 60, 'min_weight_fraction_leaf': 0.01, 'max_leaf_nodes': 150, 'bootstrap': False, 'ccp_alpha': 0.01}. Best is trial 1439 with value: -0.15896829431478016.
[I 2025-04-16 00:34:02,089] Trial 1611 finished with value: -0.1936417107583833 and parameters: {'n_estimators': 4232, 'min_samples_split': 24, 'max_features': 0.9600000000000001, 'min_samples_leaf': 14, 'criterion': 'absolute_error', 'max_depth': 60, 'min_weight_fraction_leaf': 0.01, 'max_leaf_nodes': 150, 'bootstrap': False, 'ccp_alpha': 0.007}. Best is trial 1439 with value: -0.15896829431478016.
[I 2025-04-16 00:34:05,386] Trial 1612 finished with value: -36.522060368131044 and parameters: {'n_estimators': 4478, 'min_samples_split': 17, 'max_features': 0.9400000000000001, 'min_samples_leaf': 12, 'criterion': 'friedman_mse', 'max_depth': 60, 'min_weight_fraction_leaf': 0.01, 'max_leaf_nodes': 150, 'bootstrap': False, 'ccp_alpha': 0.0}. Best is trial 1439 with value: -0.15896829431478016.
[I 2025-04-16 00:34:08,670] Trial 1613 finished with value: -0.1936417107583833 and parameters: {'n_estimators': 3671, 'min_samples_split': 9, 'max_features': 0.98, 'min_samples_leaf': 16, 'criterion': 'absolute_error', 'max_depth': 60, 'min_weight_fraction_leaf': 0.01, 'max_leaf_nodes': 150, 'bootstrap': False, 'ccp_alpha': 0.014}. Best is trial 1439 with value: -0.15896829431478016.
[I 2025-04-16 00:34:12,693] Trial 1614 finished with value: -0.1936417107583833 and parameters: {'n_estimators': 4048, 'min_samples_split': 13, 'max_features': 0.92, 'min_samples_leaf': 10, 'criterion': 'absolute_error', 'max_depth': 60, 'min_weight_fraction_leaf': 0.01, 'max_leaf_nodes': 150, 'bootstrap': False, 'ccp_alpha': 0.006}. Best is trial 1439 with value: -0.15896829431478016.
[I 2025-04-16 00:34:16,940] Trial 1615 finished with value: -0.1936417107583833 and parameters: {'n_estimators': 4292, 'min_samples_split': 20, 'max_features': 0.97, 'min_samples_leaf': 13, 'criterion': 'absolute_error', 'max_depth': 60, 'min_weight_fraction_leaf': 0.01, 'max_leaf_nodes': 150, 'bootstrap': False, 'ccp_alpha': 0.005}. Best is trial 1439 with value: -0.15896829431478016.
[I 2025-04-16 00:34:19,941] Trial 1616 finished with value: -0.19364218656903334 and parameters: {'n_estimators': 3688, 'min_samples_split': 16, 'max_features': 0.9400000000000001, 'min_samples_leaf': 17, 'criterion': 'absolute_error', 'max_depth': 60, 'min_weight_fraction_leaf': 0.01, 'max_leaf_nodes': 150, 'bootstrap': False, 'ccp_alpha': 0.0}. Best is trial 1439 with value: -0.15896829431478016.
[I 2025-04-16 00:34:23,354] Trial 1617 finished with value: -0.1936417107583833 and parameters: {'n_estimators': 3872, 'min_samples_split': 9, 'max_features': 0.99, 'min_samples_leaf': 14, 'criterion': 'absolute_error', 'max_depth': 60, 'min_weight_fraction_leaf': 0.01, 'max_leaf_nodes': 150, 'bootstrap': False, 'ccp_alpha': 0.01}. Best is trial 1439 with value: -0.15896829431478016.
[I 2025-04-16 00:34:27,223] Trial 1618 finished with value: -0.1936417107583833 and parameters: {'n_estimators': 4133, 'min_samples_split': 22, 'max_features': 0.9600000000000001, 'min_samples_leaf': 11, 'criterion': 'absolute_error', 'max_depth': 60, 'min_weight_fraction_leaf': 0.0, 'max_leaf_nodes': 150, 'bootstrap': False, 'ccp_alpha': 0.015}. Best is trial 1439 with value: -0.15896829431478016.
[I 2025-04-16 00:34:30,809] Trial 1619 finished with value: -0.1936417107583833 and parameters: {'n_estimators': 3935, 'min_samples_split': 12, 'max_features': 0.9400000000000001, 'min_samples_leaf': 15, 'criterion': 'absolute_error', 'max_depth': 60, 'min_weight_fraction_leaf': 0.01, 'max_leaf_nodes': 150, 'bootstrap': False, 'ccp_alpha': 0.005}. Best is trial 1439 with value: -0.15896829431478016.
[I 2025-04-16 00:34:34,770] Trial 1620 finished with value: -36.54336314040981 and parameters: {'n_estimators': 4509, 'min_samples_split': 17, 'max_features': 0.92, 'min_samples_leaf': 12, 'criterion': 'squared_error', 'max_depth': 60, 'min_weight_fraction_leaf': 0.01, 'max_leaf_nodes': 150, 'bootstrap': False, 'ccp_alpha': 0.0}. Best is trial 1439 with value: -0.15896829431478016.
[I 2025-04-16 00:34:38,479] Trial 1621 finished with value: -0.1936417107583833 and parameters: {'n_estimators': 4084, 'min_samples_split': 24, 'max_features': 0.97, 'min_samples_leaf': 10, 'criterion': 'absolute_error', 'max_depth': 60, 'min_weight_fraction_leaf': 0.01, 'max_leaf_nodes': 150, 'bootstrap': False, 'ccp_alpha': 0.009000000000000001}. Best is trial 1439 with value: -0.15896829431478016.
[I 2025-04-16 00:34:41,796] Trial 1622 finished with value: -0.1936417107583833 and parameters: {'n_estimators': 3678, 'min_samples_split': 14, 'max_features': 1.0, 'min_samples_leaf': 18, 'criterion': 'absolute_error', 'max_depth': 60, 'min_weight_fraction_leaf': 0.09, 'max_leaf_nodes': 150, 'bootstrap': False, 'ccp_alpha': 0.006}. Best is trial 1439 with value: -0.15896829431478016.
[I 2025-04-16 00:34:45,777] Trial 1623 finished with value: -0.1936417107583833 and parameters: {'n_estimators': 4294, 'min_samples_split': 9, 'max_features': 0.9600000000000001, 'min_samples_leaf': 13, 'criterion': 'absolute_error', 'max_depth': 60, 'min_weight_fraction_leaf': 0.01, 'max_leaf_nodes': 150, 'bootstrap': False, 'ccp_alpha': 0.014}. Best is trial 1439 with value: -0.15896829431478016.
[I 2025-04-16 00:34:49,155] Trial 1624 finished with value: -0.1936249304723495 and parameters: {'n_estimators': 3859, 'min_samples_split': 17, 'max_features': 0.92, 'min_samples_leaf': 15, 'criterion': 'absolute_error', 'max_depth': 60, 'min_weight_fraction_leaf': 0.01, 'max_leaf_nodes': 150, 'bootstrap': False, 'ccp_alpha': 0.0}. Best is trial 1439 with value: -0.15896829431478016.
[I 2025-04-16 00:34:52,760] Trial 1625 finished with value: -0.1936417107583833 and parameters: {'n_estimators': 4094, 'min_samples_split': 20, 'max_features': 0.9400000000000001, 'min_samples_leaf': 12, 'criterion': 'absolute_error', 'max_depth': 60, 'min_weight_fraction_leaf': 0.01, 'max_leaf_nodes': 150, 'bootstrap': False, 'ccp_alpha': 0.006}. Best is trial 1439 with value: -0.15896829431478016.
[I 2025-04-16 00:34:56,023] Trial 1626 finished with value: -30.844419094821983 and parameters: {'n_estimators': 3670, 'min_samples_split': 14, 'max_features': 0.98, 'min_samples_leaf': 16, 'criterion': 'poisson', 'max_depth': 60, 'min_weight_fraction_leaf': 0.0, 'max_leaf_nodes': 150, 'bootstrap': False, 'ccp_alpha': 0.011}. Best is trial 1439 with value: -0.15896829431478016.
[I 2025-04-16 00:34:59,757] Trial 1627 finished with value: -8.7755367480645 and parameters: {'n_estimators': 4311, 'min_samples_split': 9, 'max_features': 0.9500000000000001, 'min_samples_leaf': 10, 'criterion': 'absolute_error', 'max_depth': 60, 'min_weight_fraction_leaf': 0.1, 'max_leaf_nodes': 150, 'bootstrap': False, 'ccp_alpha': 0.0}. Best is trial 1439 with value: -0.15896829431478016.
[I 2025-04-16 00:35:03,395] Trial 1628 finished with value: -0.1936417107583833 and parameters: {'n_estimators': 3917, 'min_samples_split': 21, 'max_features': 0.97, 'min_samples_leaf': 14, 'criterion': 'absolute_error', 'max_depth': 60, 'min_weight_fraction_leaf': 0.01, 'max_leaf_nodes': 150, 'bootstrap': False, 'ccp_alpha': 0.005}. Best is trial 1439 with value: -0.15896829431478016.
[I 2025-04-16 00:35:07,073] Trial 1629 finished with value: -0.1936417107583833 and parameters: {'n_estimators': 4169, 'min_samples_split': 12, 'max_features': 0.92, 'min_samples_leaf': 12, 'criterion': 'absolute_error', 'max_depth': 60, 'min_weight_fraction_leaf': 0.01, 'max_leaf_nodes': 150, 'bootstrap': False, 'ccp_alpha': 0.01}. Best is trial 1439 with value: -0.15896829431478016.
[I 2025-04-16 00:35:10,384] Trial 1630 finished with value: -0.19364218596298977 and parameters: {'n_estimators': 3843, 'min_samples_split': 17, 'max_features': 0.99, 'min_samples_leaf': 17, 'criterion': 'absolute_error', 'max_depth': 60, 'min_weight_fraction_leaf': 0.01, 'max_leaf_nodes': 150, 'bootstrap': False, 'ccp_alpha': 0.0}. Best is trial 1439 with value: -0.15896829431478016.
[I 2025-04-16 00:35:14,481] Trial 1631 finished with value: -0.1936417107583833 and parameters: {'n_estimators': 4455, 'min_samples_split': 23, 'max_features': 0.9400000000000001, 'min_samples_leaf': 14, 'criterion': 'absolute_error', 'max_depth': 60, 'min_weight_fraction_leaf': 0.01, 'max_leaf_nodes': 150, 'bootstrap': False, 'ccp_alpha': 0.006}. Best is trial 1439 with value: -0.15896829431478016.
[I 2025-04-16 00:35:17,987] Trial 1632 finished with value: -0.1936417107583833 and parameters: {'n_estimators': 4042, 'min_samples_split': 8, 'max_features': 0.97, 'min_samples_leaf': 11, 'criterion': 'absolute_error', 'max_depth': 60, 'min_weight_fraction_leaf': 0.01, 'max_leaf_nodes': 150, 'bootstrap': False, 'ccp_alpha': 0.015}. Best is trial 1439 with value: -0.15896829431478016.
[I 2025-04-16 00:35:21,300] Trial 1633 finished with value: -0.1936417107583833 and parameters: {'n_estimators': 3686, 'min_samples_split': 17, 'max_features': 1.0, 'min_samples_leaf': 15, 'criterion': 'absolute_error', 'max_depth': 60, 'min_weight_fraction_leaf': 0.0, 'max_leaf_nodes': 150, 'bootstrap': False, 'ccp_alpha': 0.005}. Best is trial 1439 with value: -0.15896829431478016.
[I 2025-04-16 00:35:24,585] Trial 1634 finished with value: -0.1590563873162377 and parameters: {'n_estimators': 4299, 'min_samples_split': 20, 'max_features': 0.9500000000000001, 'min_samples_leaf': 13, 'criterion': 'absolute_error', 'max_depth': 60, 'min_weight_fraction_leaf': 0.01, 'max_leaf_nodes': 150, 'bootstrap': False, 'ccp_alpha': 0.0}. Best is trial 1439 with value: -0.15896829431478016.
[I 2025-04-16 00:35:28,755] Trial 1635 finished with value: -0.1936417107583833 and parameters: {'n_estimators': 4459, 'min_samples_split': 22, 'max_features': 0.92, 'min_samples_leaf': 10, 'criterion': 'absolute_error', 'max_depth': 60, 'min_weight_fraction_leaf': 0.01, 'max_leaf_nodes': 150, 'bootstrap': False, 'ccp_alpha': 0.011}. Best is trial 1439 with value: -0.15896829431478016.
[I 2025-04-16 00:35:32,885] Trial 1636 finished with value: -0.1936417107583833 and parameters: {'n_estimators': 4507, 'min_samples_split': 26, 'max_features': 0.9400000000000001, 'min_samples_leaf': 17, 'criterion': 'absolute_error', 'max_depth': 60, 'min_weight_fraction_leaf': 0.01, 'max_leaf_nodes': 150, 'bootstrap': False, 'ccp_alpha': 0.005}. Best is trial 1439 with value: -0.15896829431478016.
[I 2025-04-16 00:35:36,738] Trial 1637 finished with value: -0.1936417107583833 and parameters: {'n_estimators': 4240, 'min_samples_split': 25, 'max_features': 0.92, 'min_samples_leaf': 13, 'criterion': 'absolute_error', 'max_depth': 60, 'min_weight_fraction_leaf': 0.01, 'max_leaf_nodes': 150, 'bootstrap': False, 'ccp_alpha': 0.015}. Best is trial 1439 with value: -0.15896829431478016.
[I 2025-04-16 00:35:41,364] Trial 1638 finished with value: -17.528986382273462 and parameters: {'n_estimators': 4347, 'min_samples_split': 20, 'max_features': 0.9500000000000001, 'min_samples_leaf': 15, 'criterion': 'friedman_mse', 'max_depth': 60, 'min_weight_fraction_leaf': 0.01, 'max_leaf_nodes': 150, 'bootstrap': False, 'ccp_alpha': 0.005}. Best is trial 1439 with value: -0.15896829431478016.
[I 2025-04-16 00:35:46,039] Trial 1639 finished with value: -0.1936417107583833 and parameters: {'n_estimators': 4247, 'min_samples_split': 25, 'max_features': 0.93, 'min_samples_leaf': 10, 'criterion': 'absolute_error', 'max_depth': 60, 'min_weight_fraction_leaf': 0.01, 'max_leaf_nodes': 150, 'bootstrap': False, 'ccp_alpha': 0.01}. Best is trial 1439 with value: -0.15896829431478016.
[I 2025-04-16 00:35:49,459] Trial 1640 finished with value: -8.785602093241465 and parameters: {'n_estimators': 4531, 'min_samples_split': 19, 'max_features': 0.9500000000000001, 'min_samples_leaf': 12, 'criterion': 'absolute_error', 'max_depth': 60, 'min_weight_fraction_leaf': 0.0, 'max_leaf_nodes': 150, 'bootstrap': False, 'ccp_alpha': 0.0}. Best is trial 1439 with value: -0.15896829431478016.
[I 2025-04-16 00:35:53,596] Trial 1641 finished with value: -0.1936417107583833 and parameters: {'n_estimators': 4083, 'min_samples_split': 17, 'max_features': 0.92, 'min_samples_leaf': 18, 'criterion': 'absolute_error', 'max_depth': 60, 'min_weight_fraction_leaf': 0.01, 'max_leaf_nodes': 150, 'bootstrap': False, 'ccp_alpha': 0.015}. Best is trial 1439 with value: -0.15896829431478016.
[I 2025-04-16 00:35:56,702] Trial 1642 finished with value: -0.19362127500451787 and parameters: {'n_estimators': 4040, 'min_samples_split': 22, 'max_features': 0.9500000000000001, 'min_samples_leaf': 14, 'criterion': 'absolute_error', 'max_depth': 60, 'min_weight_fraction_leaf': 0.01, 'max_leaf_nodes': 150, 'bootstrap': False, 'ccp_alpha': 0.0}. Best is trial 1439 with value: -0.15896829431478016.
[I 2025-04-16 00:36:00,426] Trial 1643 finished with value: -0.1936417107583833 and parameters: {'n_estimators': 4326, 'min_samples_split': 14, 'max_features': 0.92, 'min_samples_leaf': 10, 'criterion': 'absolute_error', 'max_depth': 60, 'min_weight_fraction_leaf': 0.01, 'max_leaf_nodes': 150, 'bootstrap': False, 'ccp_alpha': 0.006}. Best is trial 1439 with value: -0.15896829431478016.
[I 2025-04-16 00:36:04,142] Trial 1644 finished with value: -17.528986382274 and parameters: {'n_estimators': 4051, 'min_samples_split': 20, 'max_features': 0.9600000000000001, 'min_samples_leaf': 16, 'criterion': 'squared_error', 'max_depth': 60, 'min_weight_fraction_leaf': 0.01, 'max_leaf_nodes': 150, 'bootstrap': False, 'ccp_alpha': 0.01}. Best is trial 1439 with value: -0.15896829431478016.
[I 2025-04-16 00:36:07,702] Trial 1645 finished with value: -8.805261619297886 and parameters: {'n_estimators': 4214, 'min_samples_split': 24, 'max_features': 0.9400000000000001, 'min_samples_leaf': 12, 'criterion': 'absolute_error', 'max_depth': 60, 'min_weight_fraction_leaf': 0.01, 'max_leaf_nodes': 150, 'bootstrap': False, 'ccp_alpha': 0.0}. Best is trial 1439 with value: -0.15896829431478016.
[I 2025-04-16 00:36:11,203] Trial 1646 finished with value: -0.1936417107583833 and parameters: {'n_estimators': 3891, 'min_samples_split': 16, 'max_features': 0.9600000000000001, 'min_samples_leaf': 14, 'criterion': 'absolute_error', 'max_depth': 60, 'min_weight_fraction_leaf': 0.01, 'max_leaf_nodes': 150, 'bootstrap': False, 'ccp_alpha': 0.009000000000000001}. Best is trial 1439 with value: -0.15896829431478016.
[I 2025-04-16 00:36:15,454] Trial 1647 finished with value: -0.1936417107583833 and parameters: {'n_estimators': 4448, 'min_samples_split': 13, 'max_features': 0.9400000000000001, 'min_samples_leaf': 10, 'criterion': 'absolute_error', 'max_depth': 60, 'min_weight_fraction_leaf': 0.01, 'max_leaf_nodes': 150, 'bootstrap': False, 'ccp_alpha': 0.005}. Best is trial 1439 with value: -0.15896829431478016.
[I 2025-04-16 00:36:18,925] Trial 1648 finished with value: -0.19361575441160328 and parameters: {'n_estimators': 4239, 'min_samples_split': 19, 'max_features': 0.92, 'min_samples_leaf': 16, 'criterion': 'absolute_error', 'max_depth': 60, 'min_weight_fraction_leaf': 0.0, 'max_leaf_nodes': 150, 'bootstrap': False, 'ccp_alpha': 0.0}. Best is trial 1439 with value: -0.15896829431478016.
[I 2025-04-16 00:36:22,522] Trial 1649 finished with value: -0.1936417107583833 and parameters: {'n_estimators': 3991, 'min_samples_split': 16, 'max_features': 0.97, 'min_samples_leaf': 12, 'criterion': 'absolute_error', 'max_depth': 60, 'min_weight_fraction_leaf': 0.01, 'max_leaf_nodes': 150, 'bootstrap': False, 'ccp_alpha': 0.015}. Best is trial 1439 with value: -0.15896829431478016.
[I 2025-04-16 00:36:25,858] Trial 1650 finished with value: -0.1936417107583833 and parameters: {'n_estimators': 3868, 'min_samples_split': 25, 'max_features': 0.9400000000000001, 'min_samples_leaf': 18, 'criterion': 'absolute_error', 'max_depth': 60, 'min_weight_fraction_leaf': 0.01, 'max_leaf_nodes': 150, 'bootstrap': False, 'ccp_alpha': 0.006}. Best is trial 1439 with value: -0.15896829431478016.
[I 2025-04-16 00:36:29,306] Trial 1651 finished with value: -35.76586963080411 and parameters: {'n_estimators': 4491, 'min_samples_split': 13, 'max_features': 0.9600000000000001, 'min_samples_leaf': 13, 'criterion': 'poisson', 'max_depth': 60, 'min_weight_fraction_leaf': 0.01, 'max_leaf_nodes': 150, 'bootstrap': False, 'ccp_alpha': 0.0}. Best is trial 1439 with value: -0.15896829431478016.
[I 2025-04-16 00:36:33,048] Trial 1652 finished with value: -0.1936417107583833 and parameters: {'n_estimators': 4115, 'min_samples_split': 21, 'max_features': 0.92, 'min_samples_leaf': 15, 'criterion': 'absolute_error', 'max_depth': 60, 'min_weight_fraction_leaf': 0.01, 'max_leaf_nodes': 150, 'bootstrap': False, 'ccp_alpha': 0.01}. Best is trial 1439 with value: -0.15896829431478016.
[I 2025-04-16 00:36:36,406] Trial 1653 finished with value: -0.1936417107583833 and parameters: {'n_estimators': 3700, 'min_samples_split': 8, 'max_features': 0.98, 'min_samples_leaf': 10, 'criterion': 'absolute_error', 'max_depth': 60, 'min_weight_fraction_leaf': 0.01, 'max_leaf_nodes': 150, 'bootstrap': False, 'ccp_alpha': 0.005}. Best is trial 1439 with value: -0.15896829431478016.
[I 2025-04-16 00:36:40,494] Trial 1654 finished with value: -0.1936417107583833 and parameters: {'n_estimators': 4309, 'min_samples_split': 18, 'max_features': 0.9400000000000001, 'min_samples_leaf': 12, 'criterion': 'absolute_error', 'max_depth': 60, 'min_weight_fraction_leaf': 0.01, 'max_leaf_nodes': 150, 'bootstrap': False, 'ccp_alpha': 0.016}. Best is trial 1439 with value: -0.15896829431478016.
