[I 2025-04-16 01:16:53,180] Trial 2321 finished with value: -0.1936417107583833 and parameters: {'n_estimators': 3632, 'min_samples_split': 6, 'max_features': 0.9400000000000001, 'min_samples_leaf': 5, 'criterion': 'absolute_error', 'max_depth': 5, 'min_weight_fraction_leaf': 0.0, 'max_leaf_nodes': 150, 'bootstrap': False, 'ccp_alpha': 0.007}. Best is trial 2251 with value: 0.02361845659970214.
[I 2025-04-16 01:16:56,853] Trial 2322 finished with value: -0.042520960828378015 and parameters: {'n_estimators': 3834, 'min_samples_split': 2, 'max_features': 0.92, 'min_samples_leaf': 1, 'criterion': 'absolute_error', 'max_depth': 5, 'min_weight_fraction_leaf': 0.0, 'max_leaf_nodes': 150, 'bootstrap': False, 'ccp_alpha': 0.006}. Best is trial 2251 with value: 0.02361845659970214.
[I 2025-04-16 01:17:00,272] Trial 2323 finished with value: -0.1936417107583833 and parameters: {'n_estimators': 3694, 'min_samples_split': 2, 'max_features': 0.9, 'min_samples_leaf': 3, 'criterion': 'absolute_error', 'max_depth': 5, 'min_weight_fraction_leaf': 0.0, 'max_leaf_nodes': 150, 'bootstrap': False, 'ccp_alpha': 0.019}. Best is trial 2251 with value: 0.02361845659970214.
[I 2025-04-16 01:17:03,348] Trial 2324 finished with value: -17.528986382275452 and parameters: {'n_estimators': 3426, 'min_samples_split': 5, 'max_features': 0.89, 'min_samples_leaf': 4, 'criterion': 'squared_error', 'max_depth': 5, 'min_weight_fraction_leaf': 0.0, 'max_leaf_nodes': 150, 'bootstrap': False, 'ccp_alpha': 0.248}. Best is trial 2251 with value: 0.02361845659970214.
[I 2025-04-16 01:17:06,522] Trial 2325 finished with value: -0.1936417107583833 and parameters: {'n_estimators': 3406, 'min_samples_split': 4, 'max_features': 0.91, 'min_samples_leaf': 3, 'criterion': 'absolute_error', 'max_depth': 5, 'min_weight_fraction_leaf': 0.0, 'max_leaf_nodes': 150, 'bootstrap': False, 'ccp_alpha': 0.02}. Best is trial 2251 with value: 0.02361845659970214.
[I 2025-04-16 01:17:09,735] Trial 2326 finished with value: -0.1936417107583833 and parameters: {'n_estimators': 3581, 'min_samples_split': 6, 'max_features': 0.89, 'min_samples_leaf': 1, 'criterion': 'absolute_error', 'max_depth': 5, 'min_weight_fraction_leaf': 0.0, 'max_leaf_nodes': 150, 'bootstrap': False, 'ccp_alpha': 0.022}. Best is trial 2251 with value: 0.02361845659970214.
[I 2025-04-16 01:17:13,362] Trial 2327 finished with value: -0.1936417107583833 and parameters: {'n_estimators': 3820, 'min_samples_split': 2, 'max_features': 0.91, 'min_samples_leaf': 1, 'criterion': 'absolute_error', 'max_depth': 5, 'min_weight_fraction_leaf': 0.0, 'max_leaf_nodes': 150, 'bootstrap': False, 'ccp_alpha': 0.014}. Best is trial 2251 with value: 0.02361845659970214.
[I 2025-04-16 01:17:16,880] Trial 2328 finished with value: -0.1936417107583833 and parameters: {'n_estimators': 3783, 'min_samples_split': 2, 'max_features': 0.91, 'min_samples_leaf': 1, 'criterion': 'absolute_error', 'max_depth': 5, 'min_weight_fraction_leaf': 0.0, 'max_leaf_nodes': 20, 'bootstrap': False, 'ccp_alpha': 0.012}. Best is trial 2251 with value: 0.02361845659970214.
[I 2025-04-16 01:17:20,124] Trial 2329 finished with value: -17.52898638227502 and parameters: {'n_estimators': 3592, 'min_samples_split': 7, 'max_features': 0.92, 'min_samples_leaf': 1, 'criterion': 'poisson', 'max_depth': 5, 'min_weight_fraction_leaf': 0.0, 'max_leaf_nodes': 150, 'bootstrap': False, 'ccp_alpha': 0.026000000000000002}. Best is trial 2251 with value: 0.02361845659970214.
[I 2025-04-16 01:17:23,821] Trial 2330 finished with value: -0.1936417107583833 and parameters: {'n_estimators': 3821, 'min_samples_split': 7, 'max_features': 0.89, 'min_samples_leaf': 4, 'criterion': 'absolute_error', 'max_depth': 5, 'min_weight_fraction_leaf': 0.0, 'max_leaf_nodes': 150, 'bootstrap': False, 'ccp_alpha': 0.014}. Best is trial 2251 with value: 0.02361845659970214.
[I 2025-04-16 01:17:27,010] Trial 2331 finished with value: -0.1936417107583833 and parameters: {'n_estimators': 3379, 'min_samples_split': 7, 'max_features': 0.93, 'min_samples_leaf': 1, 'criterion': 'absolute_error', 'max_depth': 5, 'min_weight_fraction_leaf': 0.0, 'max_leaf_nodes': 150, 'bootstrap': False, 'ccp_alpha': 0.01}. Best is trial 2251 with value: 0.02361845659970214.
[I 2025-04-16 01:17:30,204] Trial 2332 finished with value: -0.1936417107583833 and parameters: {'n_estimators': 3646, 'min_samples_split': 2, 'max_features': 0.9400000000000001, 'min_samples_leaf': 4, 'criterion': 'absolute_error', 'max_depth': 5, 'min_weight_fraction_leaf': 0.0, 'max_leaf_nodes': 150, 'bootstrap': False, 'ccp_alpha': 0.009000000000000001}. Best is trial 2251 with value: 0.02361845659970214.
[I 2025-04-16 01:17:33,882] Trial 2333 finished with value: -0.1936417107583833 and parameters: {'n_estimators': 3866, 'min_samples_split': 2, 'max_features': 0.91, 'min_samples_leaf': 1, 'criterion': 'absolute_error', 'max_depth': 5, 'min_weight_fraction_leaf': 0.0, 'max_leaf_nodes': None, 'bootstrap': False, 'ccp_alpha': 0.017}. Best is trial 2251 with value: 0.02361845659970214.
[I 2025-04-16 01:17:37,545] Trial 2334 finished with value: -0.1936417107583833 and parameters: {'n_estimators': 3872, 'min_samples_split': 6, 'max_features': 0.9400000000000001, 'min_samples_leaf': 5, 'criterion': 'absolute_error', 'max_depth': 5, 'min_weight_fraction_leaf': 0.0, 'max_leaf_nodes': 150, 'bootstrap': False, 'ccp_alpha': 0.007}. Best is trial 2251 with value: 0.02361845659970214.
[I 2025-04-16 01:17:40,905] Trial 2335 finished with value: -0.1936417107583833 and parameters: {'n_estimators': 3603, 'min_samples_split': 2, 'max_features': 0.91, 'min_samples_leaf': 3, 'criterion': 'absolute_error', 'max_depth': 5, 'min_weight_fraction_leaf': 0.0, 'max_leaf_nodes': 150, 'bootstrap': False, 'ccp_alpha': 0.024}. Best is trial 2251 with value: 0.02361845659970214.
[I 2025-04-16 01:17:44,221] Trial 2336 finished with value: -0.1936417107583833 and parameters: {'n_estimators': 3407, 'min_samples_split': 2, 'max_features': 0.93, 'min_samples_leaf': 5, 'criterion': 'absolute_error', 'max_depth': 5, 'min_weight_fraction_leaf': 0.0, 'max_leaf_nodes': 150, 'bootstrap': False, 'ccp_alpha': 0.006}. Best is trial 2251 with value: 0.02361845659970214.
[I 2025-04-16 01:17:47,621] Trial 2337 finished with value: -0.1936417107583833 and parameters: {'n_estimators': 3901, 'min_samples_split': 6, 'max_features': 0.92, 'min_samples_leaf': 1, 'criterion': 'absolute_error', 'max_depth': 5, 'min_weight_fraction_leaf': 0.0, 'max_leaf_nodes': 150, 'bootstrap': False, 'ccp_alpha': 0.014}. Best is trial 2251 with value: 0.02361845659970214.
[I 2025-04-16 01:17:51,251] Trial 2338 finished with value: -17.528986382274383 and parameters: {'n_estimators': 3866, 'min_samples_split': 7, 'max_features': 0.89, 'min_samples_leaf': 5, 'criterion': 'friedman_mse', 'max_depth': 5, 'min_weight_fraction_leaf': 0.0, 'max_leaf_nodes': 300, 'bootstrap': False, 'ccp_alpha': 0.006}. Best is trial 2251 with value: 0.02361845659970214.
[I 2025-04-16 01:17:54,515] Trial 2339 finished with value: -0.1936417107583833 and parameters: {'n_estimators': 3626, 'min_samples_split': 6, 'max_features': 0.9400000000000001, 'min_samples_leaf': 4, 'criterion': 'absolute_error', 'max_depth': 5, 'min_weight_fraction_leaf': 0.0, 'max_leaf_nodes': 150, 'bootstrap': False, 'ccp_alpha': 0.01}. Best is trial 2251 with value: 0.02361845659970214.
[I 2025-04-16 01:17:58,053] Trial 2340 finished with value: -0.034674465576312576 and parameters: {'n_estimators': 3845, 'min_samples_split': 2, 'max_features': 0.9400000000000001, 'min_samples_leaf': 3, 'criterion': 'absolute_error', 'max_depth': 5, 'min_weight_fraction_leaf': 0.0, 'max_leaf_nodes': 150, 'bootstrap': False, 'ccp_alpha': 0.006}. Best is trial 2251 with value: 0.02361845659970214.
[I 2025-04-16 01:18:01,207] Trial 2341 finished with value: -0.1936417107583833 and parameters: {'n_estimators': 3457, 'min_samples_split': 2, 'max_features': 0.9400000000000001, 'min_samples_leaf': 3, 'criterion': 'absolute_error', 'max_depth': 5, 'min_weight_fraction_leaf': 0.0, 'max_leaf_nodes': 150, 'bootstrap': False, 'ccp_alpha': 0.03}. Best is trial 2251 with value: 0.02361845659970214.
[I 2025-04-16 01:18:04,424] Trial 2342 finished with value: -0.1936417107583833 and parameters: {'n_estimators': 3419, 'min_samples_split': 2, 'max_features': 0.92, 'min_samples_leaf': 3, 'criterion': 'absolute_error', 'max_depth': 5, 'min_weight_fraction_leaf': 0.0, 'max_leaf_nodes': 150, 'bootstrap': False, 'ccp_alpha': 0.019}. Best is trial 2251 with value: 0.02361845659970214.
[I 2025-04-16 01:18:07,898] Trial 2343 finished with value: -0.1936417107583833 and parameters: {'n_estimators': 3686, 'min_samples_split': 6, 'max_features': 0.89, 'min_samples_leaf': 5, 'criterion': 'absolute_error', 'max_depth': 5, 'min_weight_fraction_leaf': 0.0, 'max_leaf_nodes': 150, 'bootstrap': False, 'ccp_alpha': 0.02}. Best is trial 2251 with value: 0.02361845659970214.
[I 2025-04-16 01:18:11,383] Trial 2344 finished with value: -0.1936417107583833 and parameters: {'n_estimators': 3631, 'min_samples_split': 5, 'max_features': 0.9400000000000001, 'min_samples_leaf': 3, 'criterion': 'absolute_error', 'max_depth': 5, 'min_weight_fraction_leaf': 0.0, 'max_leaf_nodes': 150, 'bootstrap': False, 'ccp_alpha': 0.015}. Best is trial 2251 with value: 0.02361845659970214.
[I 2025-04-16 01:18:14,540] Trial 2345 finished with value: -0.1936417107583833 and parameters: {'n_estimators': 3399, 'min_samples_split': 2, 'max_features': 0.91, 'min_samples_leaf': 5, 'criterion': 'absolute_error', 'max_depth': 5, 'min_weight_fraction_leaf': 0.0, 'max_leaf_nodes': 150, 'bootstrap': False, 'ccp_alpha': 0.022}. Best is trial 2251 with value: 0.02361845659970214.
[I 2025-04-16 01:18:18,262] Trial 2346 finished with value: -0.1936417107583833 and parameters: {'n_estimators': 3788, 'min_samples_split': 2, 'max_features': 0.9400000000000001, 'min_samples_leaf': 5, 'criterion': 'absolute_error', 'max_depth': 5, 'min_weight_fraction_leaf': 0.0, 'max_leaf_nodes': 150, 'bootstrap': False, 'ccp_alpha': 0.014}. Best is trial 2251 with value: 0.02361845659970214.
[I 2025-04-16 01:18:21,551] Trial 2347 finished with value: -17.528986382274546 and parameters: {'n_estimators': 3789, 'min_samples_split': 2, 'max_features': 0.91, 'min_samples_leaf': 1, 'criterion': 'squared_error', 'max_depth': 5, 'min_weight_fraction_leaf': 0.0, 'max_leaf_nodes': 150, 'bootstrap': False, 'ccp_alpha': 0.013000000000000001}. Best is trial 2251 with value: 0.02361845659970214.
[I 2025-04-16 01:18:25,420] Trial 2348 finished with value: -0.1936417107583833 and parameters: {'n_estimators': 3900, 'min_samples_split': 2, 'max_features': 0.9400000000000001, 'min_samples_leaf': 1, 'criterion': 'absolute_error', 'max_depth': 5, 'min_weight_fraction_leaf': 0.0, 'max_leaf_nodes': 150, 'bootstrap': False, 'ccp_alpha': 0.009000000000000001}. Best is trial 2251 with value: 0.02361845659970214.
[I 2025-04-16 01:18:28,825] Trial 2349 finished with value: -0.1936417107583833 and parameters: {'n_estimators': 3601, 'min_samples_split': 7, 'max_features': 0.92, 'min_samples_leaf': 3, 'criterion': 'absolute_error', 'max_depth': 5, 'min_weight_fraction_leaf': 0.0, 'max_leaf_nodes': 150, 'bootstrap': False, 'ccp_alpha': 0.009000000000000001}. Best is trial 2251 with value: 0.02361845659970214.
[I 2025-04-16 01:18:32,154] Trial 2350 finished with value: -0.1936417107583833 and parameters: {'n_estimators': 3581, 'min_samples_split': 6, 'max_features': 0.9400000000000001, 'min_samples_leaf': 1, 'criterion': 'absolute_error', 'max_depth': 5, 'min_weight_fraction_leaf': 0.0, 'max_leaf_nodes': 150, 'bootstrap': False, 'ccp_alpha': 0.213}. Best is trial 2251 with value: 0.02361845659970214.
[I 2025-04-16 01:18:35,777] Trial 2351 finished with value: -0.1936417107583833 and parameters: {'n_estimators': 3847, 'min_samples_split': 7, 'max_features': 0.92, 'min_samples_leaf': 3, 'criterion': 'absolute_error', 'max_depth': 5, 'min_weight_fraction_leaf': 0.0, 'max_leaf_nodes': 150, 'bootstrap': False, 'ccp_alpha': 0.024}. Best is trial 2251 with value: 0.02361845659970214.
[I 2025-04-16 01:18:38,947] Trial 2352 finished with value: -0.1936417107583833 and parameters: {'n_estimators': 3441, 'min_samples_split': 2, 'max_features': 0.89, 'min_samples_leaf': 1, 'criterion': 'absolute_error', 'max_depth': 5, 'min_weight_fraction_leaf': 0.0, 'max_leaf_nodes': 150, 'bootstrap': False, 'ccp_alpha': 0.016}. Best is trial 2251 with value: 0.02361845659970214.
[I 2025-04-16 01:18:42,277] Trial 2353 finished with value: -23.608760198924703 and parameters: {'n_estimators': 3721, 'min_samples_split': 6, 'max_features': 0.9500000000000001, 'min_samples_leaf': 5, 'criterion': 'poisson', 'max_depth': 5, 'min_weight_fraction_leaf': 0.0, 'max_leaf_nodes': 150, 'bootstrap': False, 'ccp_alpha': 0.006}. Best is trial 2251 with value: 0.02361845659970214.
[I 2025-04-16 01:18:45,934] Trial 2354 finished with value: -0.1936417107583833 and parameters: {'n_estimators': 3888, 'min_samples_split': 7, 'max_features': 0.9500000000000001, 'min_samples_leaf': 5, 'criterion': 'absolute_error', 'max_depth': 5, 'min_weight_fraction_leaf': 0.0, 'max_leaf_nodes': 150, 'bootstrap': False, 'ccp_alpha': 0.006}. Best is trial 2251 with value: 0.02361845659970214.
[I 2025-04-16 01:18:49,334] Trial 2355 finished with value: -0.1936417107583833 and parameters: {'n_estimators': 3653, 'min_samples_split': 8, 'max_features': 0.92, 'min_samples_leaf': 4, 'criterion': 'absolute_error', 'max_depth': 5, 'min_weight_fraction_leaf': 0.0, 'max_leaf_nodes': 150, 'bootstrap': False, 'ccp_alpha': 0.013000000000000001}. Best is trial 2251 with value: 0.02361845659970214.
[I 2025-04-16 01:18:52,886] Trial 2356 finished with value: -0.1936417107583833 and parameters: {'n_estimators': 3899, 'min_samples_split': 6, 'max_features': 0.9500000000000001, 'min_samples_leaf': 3, 'criterion': 'absolute_error', 'max_depth': 5, 'min_weight_fraction_leaf': 0.0, 'max_leaf_nodes': 20, 'bootstrap': False, 'ccp_alpha': 0.007}. Best is trial 2251 with value: 0.02361845659970214.
[I 2025-04-16 01:18:56,088] Trial 2357 finished with value: -0.1936417107583833 and parameters: {'n_estimators': 3426, 'min_samples_split': 2, 'max_features': 0.93, 'min_samples_leaf': 1, 'criterion': 'absolute_error', 'max_depth': 5, 'min_weight_fraction_leaf': 0.0, 'max_leaf_nodes': 150, 'bootstrap': False, 'ccp_alpha': 0.018000000000000002}. Best is trial 2251 with value: 0.02361845659970214.
[I 2025-04-16 01:18:59,689] Trial 2358 finished with value: -0.1936417107583833 and parameters: {'n_estimators': 3746, 'min_samples_split': 7, 'max_features': 0.89, 'min_samples_leaf': 5, 'criterion': 'absolute_error', 'max_depth': 5, 'min_weight_fraction_leaf': 0.0, 'max_leaf_nodes': 150, 'bootstrap': False, 'ccp_alpha': 0.006}. Best is trial 2251 with value: 0.02361845659970214.
[I 2025-04-16 01:19:03,497] Trial 2359 finished with value: -0.1936417107583833 and parameters: {'n_estimators': 3946, 'min_samples_split': 8, 'max_features': 0.9400000000000001, 'min_samples_leaf': 3, 'criterion': 'absolute_error', 'max_depth': 5, 'min_weight_fraction_leaf': 0.0, 'max_leaf_nodes': None, 'bootstrap': False, 'ccp_alpha': 0.011}. Best is trial 2251 with value: 0.02361845659970214.
[I 2025-04-16 01:19:06,931] Trial 2360 finished with value: -0.1936417107583833 and parameters: {'n_estimators': 3550, 'min_samples_split': 8, 'max_features': 0.91, 'min_samples_leaf': 5, 'criterion': 'absolute_error', 'max_depth': 5, 'min_weight_fraction_leaf': 0.0, 'max_leaf_nodes': 150, 'bootstrap': False, 'ccp_alpha': 0.006}. Best is trial 2251 with value: 0.02361845659970214.
[I 2025-04-16 01:19:10,662] Trial 2361 finished with value: -0.1936417107583833 and parameters: {'n_estimators': 3917, 'min_samples_split': 2, 'max_features': 0.9500000000000001, 'min_samples_leaf': 1, 'criterion': 'absolute_error', 'max_depth': 5, 'min_weight_fraction_leaf': 0.0, 'max_leaf_nodes': 150, 'bootstrap': False, 'ccp_alpha': 0.014}. Best is trial 2251 with value: 0.02361845659970214.
[I 2025-04-16 01:19:13,772] Trial 2362 finished with value: -0.1936417107583833 and parameters: {'n_estimators': 3637, 'min_samples_split': 8, 'max_features': 0.92, 'min_samples_leaf': 3, 'criterion': 'absolute_error', 'max_depth': 5, 'min_weight_fraction_leaf': 0.0, 'max_leaf_nodes': 150, 'bootstrap': False, 'ccp_alpha': 0.024}. Best is trial 2251 with value: 0.02361845659970214.
[I 2025-04-16 01:19:17,263] Trial 2363 finished with value: -17.528986382274567 and parameters: {'n_estimators': 3779, 'min_samples_split': 2, 'max_features': 0.9500000000000001, 'min_samples_leaf': 6, 'criterion': 'friedman_mse', 'max_depth': 10, 'min_weight_fraction_leaf': 0.0, 'max_leaf_nodes': 150, 'bootstrap': False, 'ccp_alpha': 0.01}. Best is trial 2251 with value: 0.02361845659970214.
[I 2025-04-16 01:19:21,348] Trial 2364 finished with value: -0.1936417107583833 and parameters: {'n_estimators': 3894, 'min_samples_split': 2, 'max_features': 0.93, 'min_samples_leaf': 1, 'criterion': 'absolute_error', 'max_depth': 5, 'min_weight_fraction_leaf': 0.0, 'max_leaf_nodes': 300, 'bootstrap': False, 'ccp_alpha': 0.019}. Best is trial 2251 with value: 0.02361845659970214.
[I 2025-04-16 01:19:24,843] Trial 2365 finished with value: -0.1936417091235944 and parameters: {'n_estimators': 3418, 'min_samples_split': 8, 'max_features': 0.89, 'min_samples_leaf': 3, 'criterion': 'absolute_error', 'max_depth': 5, 'min_weight_fraction_leaf': 0.0, 'max_leaf_nodes': 150, 'bootstrap': False, 'ccp_alpha': 0.006}. Best is trial 2251 with value: 0.02361845659970214.
[I 2025-04-16 01:19:28,926] Trial 2366 finished with value: -0.1936417107583833 and parameters: {'n_estimators': 3937, 'min_samples_split': 6, 'max_features': 0.9500000000000001, 'min_samples_leaf': 5, 'criterion': 'absolute_error', 'max_depth': 5, 'min_weight_fraction_leaf': 0.0, 'max_leaf_nodes': 150, 'bootstrap': False, 'ccp_alpha': 0.28300000000000003}. Best is trial 2251 with value: 0.02361845659970214.
[I 2025-04-16 01:19:32,025] Trial 2367 finished with value: -0.1936417107583833 and parameters: {'n_estimators': 3720, 'min_samples_split': 9, 'max_features': 0.91, 'min_samples_leaf': 3, 'criterion': 'absolute_error', 'max_depth': 5, 'min_weight_fraction_leaf': 0.0, 'max_leaf_nodes': 150, 'bootstrap': False, 'ccp_alpha': 0.006}. Best is trial 2251 with value: 0.02361845659970214.
[I 2025-04-16 01:19:35,254] Trial 2368 finished with value: -0.1936417107583833 and parameters: {'n_estimators': 3572, 'min_samples_split': 2, 'max_features': 0.93, 'min_samples_leaf': 5, 'criterion': 'absolute_error', 'max_depth': 5, 'min_weight_fraction_leaf': 0.0, 'max_leaf_nodes': 150, 'bootstrap': False, 'ccp_alpha': 0.013000000000000001}. Best is trial 2251 with value: 0.02361845659970214.
[I 2025-04-16 01:19:38,527] Trial 2369 finished with value: 0.0202378815198341 and parameters: {'n_estimators': 3368, 'min_samples_split': 8, 'max_features': 0.9500000000000001, 'min_samples_leaf': 3, 'criterion': 'absolute_error', 'max_depth': 5, 'min_weight_fraction_leaf': 0.0, 'max_leaf_nodes': 150, 'bootstrap': False, 'ccp_alpha': 0.005}. Best is trial 2251 with value: 0.02361845659970214.
[I 2025-04-16 01:19:41,773] Trial 2370 finished with value: -0.1936417107583833 and parameters: {'n_estimators': 3331, 'min_samples_split': 6, 'max_features': 0.91, 'min_samples_leaf': 1, 'criterion': 'absolute_error', 'max_depth': 5, 'min_weight_fraction_leaf': 0.0, 'max_leaf_nodes': 150, 'bootstrap': False, 'ccp_alpha': 0.029}. Best is trial 2251 with value: 0.02361845659970214.
[I 2025-04-16 01:19:44,720] Trial 2371 finished with value: -17.528986382275384 and parameters: {'n_estimators': 3452, 'min_samples_split': 5, 'max_features': 0.89, 'min_samples_leaf': 3, 'criterion': 'squared_error', 'max_depth': 5, 'min_weight_fraction_leaf': 0.0, 'max_leaf_nodes': 150, 'bootstrap': False, 'ccp_alpha': 0.017}. Best is trial 2251 with value: 0.02361845659970214.
[I 2025-04-16 01:19:48,140] Trial 2372 finished with value: -0.1936417107583833 and parameters: {'n_estimators': 3576, 'min_samples_split': 5, 'max_features': 0.92, 'min_samples_leaf': 3, 'criterion': 'absolute_error', 'max_depth': 5, 'min_weight_fraction_leaf': 0.0, 'max_leaf_nodes': 150, 'bootstrap': False, 'ccp_alpha': 0.019}. Best is trial 2251 with value: 0.02361845659970214.
[I 2025-04-16 01:19:51,557] Trial 2373 finished with value: -0.1936417107583833 and parameters: {'n_estimators': 3351, 'min_samples_split': 9, 'max_features': 0.93, 'min_samples_leaf': 5, 'criterion': 'absolute_error', 'max_depth': 5, 'min_weight_fraction_leaf': 0.0, 'max_leaf_nodes': 150, 'bootstrap': False, 'ccp_alpha': 0.012}. Best is trial 2251 with value: 0.02361845659970214.
[I 2025-04-16 01:19:55,321] Trial 2374 finished with value: -0.1936417107583833 and parameters: {'n_estimators': 3360, 'min_samples_split': 2, 'max_features': 0.9400000000000001, 'min_samples_leaf': 1, 'criterion': 'absolute_error', 'max_depth': 5, 'min_weight_fraction_leaf': 0.0, 'max_leaf_nodes': 150, 'bootstrap': False, 'ccp_alpha': 0.023}. Best is trial 2251 with value: 0.02361845659970214.
[I 2025-04-16 01:19:58,696] Trial 2375 finished with value: -0.1936417107583833 and parameters: {'n_estimators': 3476, 'min_samples_split': 8, 'max_features': 0.6, 'min_samples_leaf': 5, 'criterion': 'absolute_error', 'max_depth': 5, 'min_weight_fraction_leaf': 0.0, 'max_leaf_nodes': 150, 'bootstrap': False, 'ccp_alpha': 0.012}. Best is trial 2251 with value: 0.02361845659970214.
[I 2025-04-16 01:20:01,961] Trial 2376 finished with value: -0.03289601978240986 and parameters: {'n_estimators': 3632, 'min_samples_split': 2, 'max_features': 0.91, 'min_samples_leaf': 3, 'criterion': 'absolute_error', 'max_depth': 5, 'min_weight_fraction_leaf': 0.0, 'max_leaf_nodes': 150, 'bootstrap': False, 'ccp_alpha': 0.006}. Best is trial 2251 with value: 0.02361845659970214.
