[I 2025-04-16 01:13:39,297] Trial 2265 finished with value: -17.52898638227491 and parameters: {'n_estimators': 3635, 'min_samples_split': 5, 'max_features': 0.91, 'min_samples_leaf': 3, 'criterion': 'friedman_mse', 'max_depth': 10, 'min_weight_fraction_leaf': 0.0, 'max_leaf_nodes': 150, 'bootstrap': False, 'ccp_alpha': 0.025}. Best is trial 2251 with value: 0.02361845659970214.
[I 2025-04-16 01:13:42,578] Trial 2266 finished with value: -0.1936417107583833 and parameters: {'n_estimators': 3477, 'min_samples_split': 2, 'max_features': 0.9, 'min_samples_leaf': 3, 'criterion': 'absolute_error', 'max_depth': 60, 'min_weight_fraction_leaf': 0.0, 'max_leaf_nodes': 150, 'bootstrap': False, 'ccp_alpha': 0.018000000000000002}. Best is trial 2251 with value: 0.02361845659970214.
[I 2025-04-16 01:13:45,739] Trial 2267 finished with value: -0.1936417107583833 and parameters: {'n_estimators': 3480, 'min_samples_split': 7, 'max_features': 0.9, 'min_samples_leaf': 1, 'criterion': 'absolute_error', 'max_depth': 60, 'min_weight_fraction_leaf': 0.0, 'max_leaf_nodes': 150, 'bootstrap': False, 'ccp_alpha': 0.015}. Best is trial 2251 with value: 0.02361845659970214.
[I 2025-04-16 01:13:49,202] Trial 2268 finished with value: -0.1936417107583833 and parameters: {'n_estimators': 3521, 'min_samples_split': 2, 'max_features': 0.93, 'min_samples_leaf': 5, 'criterion': 'absolute_error', 'max_depth': 5, 'min_weight_fraction_leaf': 0.0, 'max_leaf_nodes': 150, 'bootstrap': False, 'ccp_alpha': 0.01}. Best is trial 2251 with value: 0.02361845659970214.
[I 2025-04-16 01:13:52,337] Trial 2269 finished with value: -0.1936417107583833 and parameters: {'n_estimators': 3482, 'min_samples_split': 2, 'max_features': 0.9, 'min_samples_leaf': 4, 'criterion': 'absolute_error', 'max_depth': 60, 'min_weight_fraction_leaf': 0.0, 'max_leaf_nodes': 150, 'bootstrap': False, 'ccp_alpha': 0.023}. Best is trial 2251 with value: 0.02361845659970214.
[I 2025-04-16 01:13:55,741] Trial 2270 finished with value: -0.1936417107583833 and parameters: {'n_estimators': 3426, 'min_samples_split': 10, 'max_features': 0.92, 'min_samples_leaf': 3, 'criterion': 'absolute_error', 'max_depth': 60, 'min_weight_fraction_leaf': 0.0, 'max_leaf_nodes': 150, 'bootstrap': False, 'ccp_alpha': 0.014}. Best is trial 2251 with value: 0.02361845659970214.
[I 2025-04-16 01:13:59,034] Trial 2271 finished with value: -0.1936417107583833 and parameters: {'n_estimators': 3585, 'min_samples_split': 8, 'max_features': 0.93, 'min_samples_leaf': 5, 'criterion': 'absolute_error', 'max_depth': 60, 'min_weight_fraction_leaf': 0.0, 'max_leaf_nodes': 150, 'bootstrap': False, 'ccp_alpha': 0.006}. Best is trial 2251 with value: 0.02361845659970214.
[I 2025-04-16 01:14:02,550] Trial 2272 finished with value: -0.1936417107583833 and parameters: {'n_estimators': 3718, 'min_samples_split': 7, 'max_features': 0.9400000000000001, 'min_samples_leaf': 5, 'criterion': 'absolute_error', 'max_depth': 60, 'min_weight_fraction_leaf': 0.0, 'max_leaf_nodes': 150, 'bootstrap': False, 'ccp_alpha': 0.011}. Best is trial 2251 with value: 0.02361845659970214.
[I 2025-04-16 01:14:06,125] Trial 2273 finished with value: -0.1936417107583833 and parameters: {'n_estimators': 3702, 'min_samples_split': 10, 'max_features': 0.92, 'min_samples_leaf': 1, 'criterion': 'absolute_error', 'max_depth': 60, 'min_weight_fraction_leaf': 0.0, 'max_leaf_nodes': 150, 'bootstrap': False, 'ccp_alpha': 0.006}. Best is trial 2251 with value: 0.02361845659970214.
[I 2025-04-16 01:14:09,357] Trial 2274 finished with value: -17.52898638227544 and parameters: {'n_estimators': 3430, 'min_samples_split': 9, 'max_features': 0.9, 'min_samples_leaf': 5, 'criterion': 'squared_error', 'max_depth': 60, 'min_weight_fraction_leaf': 0.0, 'max_leaf_nodes': 150, 'bootstrap': False, 'ccp_alpha': 0.017}. Best is trial 2251 with value: 0.02361845659970214.
[I 2025-04-16 01:14:12,937] Trial 2275 finished with value: -0.0094308793481104 and parameters: {'n_estimators': 3755, 'min_samples_split': 2, 'max_features': 0.9400000000000001, 'min_samples_leaf': 3, 'criterion': 'absolute_error', 'max_depth': 60, 'min_weight_fraction_leaf': 0.0, 'max_leaf_nodes': 150, 'bootstrap': False, 'ccp_alpha': 0.005}. Best is trial 2251 with value: 0.02361845659970214.
[I 2025-04-16 01:14:16,147] Trial 2276 finished with value: -0.1936417107583833 and parameters: {'n_estimators': 3528, 'min_samples_split': 3, 'max_features': 0.89, 'min_samples_leaf': 6, 'criterion': 'absolute_error', 'max_depth': 60, 'min_weight_fraction_leaf': 0.0, 'max_leaf_nodes': 20, 'bootstrap': False, 'ccp_alpha': 0.021}. Best is trial 2251 with value: 0.02361845659970214.
[I 2025-04-16 01:14:19,269] Trial 2277 finished with value: -0.1936417107583833 and parameters: {'n_estimators': 3447, 'min_samples_split': 3, 'max_features': 0.92, 'min_samples_leaf': 2, 'criterion': 'absolute_error', 'max_depth': 60, 'min_weight_fraction_leaf': 0.0, 'max_leaf_nodes': 150, 'bootstrap': False, 'ccp_alpha': 0.015}. Best is trial 2251 with value: 0.02361845659970214.
[I 2025-04-16 01:14:22,609] Trial 2278 finished with value: -0.1936417107583833 and parameters: {'n_estimators': 3464, 'min_samples_split': 2, 'max_features': 0.9, 'min_samples_leaf': 1, 'criterion': 'absolute_error', 'max_depth': 60, 'min_weight_fraction_leaf': 0.0, 'max_leaf_nodes': 150, 'bootstrap': False, 'ccp_alpha': 0.011}. Best is trial 2251 with value: 0.02361845659970214.
[I 2025-04-16 01:14:26,052] Trial 2279 finished with value: -0.1936417107583833 and parameters: {'n_estimators': 3655, 'min_samples_split': 6, 'max_features': 0.92, 'min_samples_leaf': 5, 'criterion': 'absolute_error', 'max_depth': 60, 'min_weight_fraction_leaf': 0.0, 'max_leaf_nodes': None, 'bootstrap': False, 'ccp_alpha': 0.022}. Best is trial 2251 with value: 0.02361845659970214.
[I 2025-04-16 01:14:29,404] Trial 2280 finished with value: -27.490074568627676 and parameters: {'n_estimators': 3675, 'min_samples_split': 5, 'max_features': 0.93, 'min_samples_leaf': 1, 'criterion': 'poisson', 'max_depth': 60, 'min_weight_fraction_leaf': 0.0, 'max_leaf_nodes': 150, 'bootstrap': False, 'ccp_alpha': 0.01}. Best is trial 2251 with value: 0.02361845659970214.
[I 2025-04-16 01:14:32,629] Trial 2281 finished with value: -0.1936417107583833 and parameters: {'n_estimators': 3427, 'min_samples_split': 2, 'max_features': 0.9, 'min_samples_leaf': 3, 'criterion': 'absolute_error', 'max_depth': 60, 'min_weight_fraction_leaf': 0.0, 'max_leaf_nodes': 150, 'bootstrap': False, 'ccp_alpha': 0.015}. Best is trial 2251 with value: 0.02361845659970214.
[I 2025-04-16 01:14:36,033] Trial 2282 finished with value: -0.03440453103851175 and parameters: {'n_estimators': 3766, 'min_samples_split': 2, 'max_features': 0.93, 'min_samples_leaf': 3, 'criterion': 'absolute_error', 'max_depth': 60, 'min_weight_fraction_leaf': 0.0, 'max_leaf_nodes': 150, 'bootstrap': False, 'ccp_alpha': 0.006}. Best is trial 2251 with value: 0.02361845659970214.
[I 2025-04-16 01:14:39,178] Trial 2283 finished with value: -0.1936417107583833 and parameters: {'n_estimators': 3425, 'min_samples_split': 3, 'max_features': 0.9, 'min_samples_leaf': 4, 'criterion': 'absolute_error', 'max_depth': None, 'min_weight_fraction_leaf': 0.0, 'max_leaf_nodes': 150, 'bootstrap': False, 'ccp_alpha': 0.031}. Best is trial 2251 with value: 0.02361845659970214.
[I 2025-04-16 01:14:42,709] Trial 2284 finished with value: -0.1936417107583833 and parameters: {'n_estimators': 3445, 'min_samples_split': 2, 'max_features': 0.64, 'min_samples_leaf': 4, 'criterion': 'absolute_error', 'max_depth': 60, 'min_weight_fraction_leaf': 0.0, 'max_leaf_nodes': 150, 'bootstrap': False, 'ccp_alpha': 0.023}. Best is trial 2251 with value: 0.02361845659970214.
[I 2025-04-16 01:14:46,232] Trial 2285 finished with value: -0.1936417107583833 and parameters: {'n_estimators': 3673, 'min_samples_split': 2, 'max_features': 0.9, 'min_samples_leaf': 2, 'criterion': 'absolute_error', 'max_depth': 60, 'min_weight_fraction_leaf': 0.0, 'max_leaf_nodes': 300, 'bootstrap': False, 'ccp_alpha': 0.018000000000000002}. Best is trial 2251 with value: 0.02361845659970214.
[I 2025-04-16 01:14:49,789] Trial 2286 finished with value: -0.1936417107583833 and parameters: {'n_estimators': 3691, 'min_samples_split': 2, 'max_features': 0.89, 'min_samples_leaf': 2, 'criterion': 'absolute_error', 'max_depth': 60, 'min_weight_fraction_leaf': 0.0, 'max_leaf_nodes': 150, 'bootstrap': False, 'ccp_alpha': 0.015}. Best is trial 2251 with value: 0.02361845659970214.
[I 2025-04-16 01:14:53,361] Trial 2287 finished with value: -0.1936417107583833 and parameters: {'n_estimators': 3660, 'min_samples_split': 5, 'max_features': 0.92, 'min_samples_leaf': 3, 'criterion': 'absolute_error', 'max_depth': 60, 'min_weight_fraction_leaf': 0.0, 'max_leaf_nodes': 150, 'bootstrap': False, 'ccp_alpha': 0.031}. Best is trial 2251 with value: 0.02361845659970214.
[I 2025-04-16 01:14:56,543] Trial 2288 finished with value: -0.1936417107583833 and parameters: {'n_estimators': 3460, 'min_samples_split': 2, 'max_features': 0.92, 'min_samples_leaf': 2, 'criterion': 'absolute_error', 'max_depth': 60, 'min_weight_fraction_leaf': 0.0, 'max_leaf_nodes': 150, 'bootstrap': False, 'ccp_alpha': 0.011}. Best is trial 2251 with value: 0.02361845659970214.
[I 2025-04-16 01:14:59,838] Trial 2289 finished with value: -17.528986382274738 and parameters: {'n_estimators': 3707, 'min_samples_split': 2, 'max_features': 0.89, 'min_samples_leaf': 3, 'criterion': 'friedman_mse', 'max_depth': 60, 'min_weight_fraction_leaf': 0.0, 'max_leaf_nodes': 150, 'bootstrap': False, 'ccp_alpha': 0.24}. Best is trial 2251 with value: 0.02361845659970214.
[I 2025-04-16 01:15:03,417] Trial 2290 finished with value: -0.1936417107583833 and parameters: {'n_estimators': 3758, 'min_samples_split': 5, 'max_features': 0.92, 'min_samples_leaf': 1, 'criterion': 'absolute_error', 'max_depth': 60, 'min_weight_fraction_leaf': 0.0, 'max_leaf_nodes': 150, 'bootstrap': False, 'ccp_alpha': 0.01}. Best is trial 2251 with value: 0.02361845659970214.
[I 2025-04-16 01:15:07,041] Trial 2291 finished with value: -0.1936417107583833 and parameters: {'n_estimators': 3613, 'min_samples_split': 5, 'max_features': 0.93, 'min_samples_leaf': 1, 'criterion': 'absolute_error', 'max_depth': 60, 'min_weight_fraction_leaf': 0.0, 'max_leaf_nodes': 150, 'bootstrap': False, 'ccp_alpha': 0.018000000000000002}. Best is trial 2251 with value: 0.02361845659970214.
[I 2025-04-16 01:15:10,614] Trial 2292 finished with value: -0.03477987761139352 and parameters: {'n_estimators': 3779, 'min_samples_split': 2, 'max_features': 0.9400000000000001, 'min_samples_leaf': 3, 'criterion': 'absolute_error', 'max_depth': 10, 'min_weight_fraction_leaf': 0.0, 'max_leaf_nodes': 150, 'bootstrap': False, 'ccp_alpha': 0.006}. Best is trial 2251 with value: 0.02361845659970214.
[I 2025-04-16 01:15:13,898] Trial 2293 finished with value: -0.1936417107583833 and parameters: {'n_estimators': 3548, 'min_samples_split': 2, 'max_features': 0.89, 'min_samples_leaf': 3, 'criterion': 'absolute_error', 'max_depth': 10, 'min_weight_fraction_leaf': 0.0, 'max_leaf_nodes': 150, 'bootstrap': False, 'ccp_alpha': 0.02}. Best is trial 2251 with value: 0.02361845659970214.
[I 2025-04-16 01:15:17,581] Trial 2294 finished with value: -0.1936417107583833 and parameters: {'n_estimators': 3489, 'min_samples_split': 2, 'max_features': 0.9, 'min_samples_leaf': 1, 'criterion': 'absolute_error', 'max_depth': 5, 'min_weight_fraction_leaf': 0.0, 'max_leaf_nodes': 150, 'bootstrap': False, 'ccp_alpha': 0.023}. Best is trial 2251 with value: 0.02361845659970214.
[I 2025-04-16 01:15:20,990] Trial 2295 finished with value: -0.1936417107583833 and parameters: {'n_estimators': 3415, 'min_samples_split': 2, 'max_features': 0.91, 'min_samples_leaf': 3, 'criterion': 'absolute_error', 'max_depth': 10, 'min_weight_fraction_leaf': 0.0, 'max_leaf_nodes': 150, 'bootstrap': False, 'ccp_alpha': 0.028}. Best is trial 2251 with value: 0.02361845659970214.
[I 2025-04-16 01:15:24,525] Trial 2296 finished with value: -0.1936417107583833 and parameters: {'n_estimators': 3773, 'min_samples_split': 2, 'max_features': 0.92, 'min_samples_leaf': 4, 'criterion': 'absolute_error', 'max_depth': 10, 'min_weight_fraction_leaf': 0.0, 'max_leaf_nodes': 150, 'bootstrap': False, 'ccp_alpha': 0.016}. Best is trial 2251 with value: 0.02361845659970214.
[I 2025-04-16 01:15:28,120] Trial 2297 finished with value: -0.1936417107583833 and parameters: {'n_estimators': 3784, 'min_samples_split': 2, 'max_features': 0.91, 'min_samples_leaf': 4, 'criterion': 'absolute_error', 'max_depth': 10, 'min_weight_fraction_leaf': 0.0, 'max_leaf_nodes': 150, 'bootstrap': False, 'ccp_alpha': 0.013000000000000001}. Best is trial 2251 with value: 0.02361845659970214.
[I 2025-04-16 01:15:31,360] Trial 2298 finished with value: -17.528986382274855 and parameters: {'n_estimators': 3659, 'min_samples_split': 5, 'max_features': 0.93, 'min_samples_leaf': 2, 'criterion': 'squared_error', 'max_depth': 10, 'min_weight_fraction_leaf': 0.0, 'max_leaf_nodes': 150, 'bootstrap': False, 'ccp_alpha': 0.01}. Best is trial 2251 with value: 0.02361845659970214.
[I 2025-04-16 01:15:37,622] Trial 2299 finished with value: -0.1936417107583833 and parameters: {'n_estimators': 7516, 'min_samples_split': 5, 'max_features': 0.93, 'min_samples_leaf': 2, 'criterion': 'absolute_error', 'max_depth': 10, 'min_weight_fraction_leaf': 0.0, 'max_leaf_nodes': 150, 'bootstrap': False, 'ccp_alpha': 0.016}. Best is trial 2251 with value: 0.02361845659970214.
[I 2025-04-16 01:15:40,906] Trial 2300 finished with value: -0.1936417107583833 and parameters: {'n_estimators': 3408, 'min_samples_split': 5, 'max_features': 0.91, 'min_samples_leaf': 4, 'criterion': 'absolute_error', 'max_depth': None, 'min_weight_fraction_leaf': 0.0, 'max_leaf_nodes': 150, 'bootstrap': False, 'ccp_alpha': 0.009000000000000001}. Best is trial 2251 with value: 0.02361845659970214.
[I 2025-04-16 01:15:44,151] Trial 2301 finished with value: -0.03469338309392254 and parameters: {'n_estimators': 3776, 'min_samples_split': 6, 'max_features': 0.9400000000000001, 'min_samples_leaf': 1, 'criterion': 'absolute_error', 'max_depth': 5, 'min_weight_fraction_leaf': 0.0, 'max_leaf_nodes': 150, 'bootstrap': False, 'ccp_alpha': 0.006}. Best is trial 2251 with value: 0.02361845659970214.
[I 2025-04-16 01:15:47,548] Trial 2302 finished with value: -0.1936417107583833 and parameters: {'n_estimators': 3444, 'min_samples_split': 2, 'max_features': 0.9, 'min_samples_leaf': 1, 'criterion': 'absolute_error', 'max_depth': 5, 'min_weight_fraction_leaf': 0.0, 'max_leaf_nodes': 20, 'bootstrap': False, 'ccp_alpha': 0.019}. Best is trial 2251 with value: 0.02361845659970214.
[I 2025-04-16 01:15:50,828] Trial 2303 finished with value: -0.1936417107583833 and parameters: {'n_estimators': 3422, 'min_samples_split': 7, 'max_features': 0.93, 'min_samples_leaf': 2, 'criterion': 'absolute_error', 'max_depth': 10, 'min_weight_fraction_leaf': 0.0, 'max_leaf_nodes': 150, 'bootstrap': False, 'ccp_alpha': 0.023}. Best is trial 2251 with value: 0.02361845659970214.
[I 2025-04-16 01:15:54,246] Trial 2304 finished with value: -0.1936417107583833 and parameters: {'n_estimators': 3645, 'min_samples_split': 2, 'max_features': 0.9, 'min_samples_leaf': 1, 'criterion': 'absolute_error', 'max_depth': 5, 'min_weight_fraction_leaf': 0.0, 'max_leaf_nodes': 150, 'bootstrap': False, 'ccp_alpha': 0.027}. Best is trial 2251 with value: 0.02361845659970214.
[I 2025-04-16 01:15:57,904] Trial 2305 finished with value: -29.720549612511995 and parameters: {'n_estimators': 3633, 'min_samples_split': 2, 'max_features': 0.92, 'min_samples_leaf': 4, 'criterion': 'poisson', 'max_depth': 10, 'min_weight_fraction_leaf': 0.0, 'max_leaf_nodes': 150, 'bootstrap': False, 'ccp_alpha': 0.017}. Best is trial 2251 with value: 0.02361845659970214.
[I 2025-04-16 01:16:01,683] Trial 2306 finished with value: -0.1936417107583833 and parameters: {'n_estimators': 3789, 'min_samples_split': 2, 'max_features': 0.89, 'min_samples_leaf': 1, 'criterion': 'absolute_error', 'max_depth': 5, 'min_weight_fraction_leaf': 0.0, 'max_leaf_nodes': None, 'bootstrap': False, 'ccp_alpha': 0.014}. Best is trial 2251 with value: 0.02361845659970214.
[I 2025-04-16 01:16:04,965] Trial 2307 finished with value: -0.1936417107583833 and parameters: {'n_estimators': 3429, 'min_samples_split': 6, 'max_features': 0.9400000000000001, 'min_samples_leaf': 3, 'criterion': 'absolute_error', 'max_depth': 10, 'min_weight_fraction_leaf': 0.0, 'max_leaf_nodes': 150, 'bootstrap': False, 'ccp_alpha': 0.01}. Best is trial 2251 with value: 0.02361845659970214.
[I 2025-04-16 01:16:08,738] Trial 2308 finished with value: -0.1936417107583833 and parameters: {'n_estimators': 3663, 'min_samples_split': 2, 'max_features': 0.92, 'min_samples_leaf': 1, 'criterion': 'absolute_error', 'max_depth': 10, 'min_weight_fraction_leaf': 0.0, 'max_leaf_nodes': 150, 'bootstrap': False, 'ccp_alpha': 0.014}. Best is trial 2251 with value: 0.02361845659970214.
[I 2025-04-16 01:16:11,850] Trial 2309 finished with value: -0.1936417107583833 and parameters: {'n_estimators': 3413, 'min_samples_split': 6, 'max_features': 0.89, 'min_samples_leaf': 3, 'criterion': 'absolute_error', 'max_depth': 10, 'min_weight_fraction_leaf': 0.0, 'max_leaf_nodes': 150, 'bootstrap': False, 'ccp_alpha': 0.022}. Best is trial 2251 with value: 0.02361845659970214.
[I 2025-04-16 01:16:15,622] Trial 2310 finished with value: -0.1936417107583833 and parameters: {'n_estimators': 3837, 'min_samples_split': 6, 'max_features': 0.9400000000000001, 'min_samples_leaf': 3, 'criterion': 'absolute_error', 'max_depth': 10, 'min_weight_fraction_leaf': 0.0, 'max_leaf_nodes': 150, 'bootstrap': False, 'ccp_alpha': 0.01}. Best is trial 2251 with value: 0.02361845659970214.
[I 2025-04-16 01:16:19,006] Trial 2311 finished with value: -0.0347258140447841 and parameters: {'n_estimators': 3805, 'min_samples_split': 6, 'max_features': 0.9400000000000001, 'min_samples_leaf': 1, 'criterion': 'absolute_error', 'max_depth': 5, 'min_weight_fraction_leaf': 0.0, 'max_leaf_nodes': 150, 'bootstrap': False, 'ccp_alpha': 0.006}. Best is trial 2251 with value: 0.02361845659970214.
[I 2025-04-16 01:16:22,285] Trial 2312 finished with value: -0.1936417107583833 and parameters: {'n_estimators': 3461, 'min_samples_split': 6, 'max_features': 0.89, 'min_samples_leaf': 2, 'criterion': 'absolute_error', 'max_depth': 5, 'min_weight_fraction_leaf': 0.0, 'max_leaf_nodes': 150, 'bootstrap': False, 'ccp_alpha': 0.027}. Best is trial 2251 with value: 0.02361845659970214.
[I 2025-04-16 01:16:25,531] Trial 2313 finished with value: -0.1936417107583833 and parameters: {'n_estimators': 3596, 'min_samples_split': 6, 'max_features': 0.91, 'min_samples_leaf': 3, 'criterion': 'absolute_error', 'max_depth': 5, 'min_weight_fraction_leaf': 0.0, 'max_leaf_nodes': 300, 'bootstrap': False, 'ccp_alpha': 0.017}. Best is trial 2251 with value: 0.02361845659970214.
[I 2025-04-16 01:16:28,894] Trial 2314 finished with value: -0.1936417107583833 and parameters: {'n_estimators': 3627, 'min_samples_split': 2, 'max_features': 0.92, 'min_samples_leaf': 3, 'criterion': 'absolute_error', 'max_depth': 5, 'min_weight_fraction_leaf': 0.0, 'max_leaf_nodes': 150, 'bootstrap': False, 'ccp_alpha': 0.021}. Best is trial 2251 with value: 0.02361845659970214.
[I 2025-04-16 01:16:32,233] Trial 2315 finished with value: -17.5289863822754 and parameters: {'n_estimators': 3445, 'min_samples_split': 6, 'max_features': 0.93, 'min_samples_leaf': 2, 'criterion': 'friedman_mse', 'max_depth': 10, 'min_weight_fraction_leaf': 0.0, 'max_leaf_nodes': 150, 'bootstrap': False, 'ccp_alpha': 0.014}. Best is trial 2251 with value: 0.02361845659970214.
[I 2025-04-16 01:16:36,117] Trial 2316 finished with value: -0.1936417107583833 and parameters: {'n_estimators': 3747, 'min_samples_split': 5, 'max_features': 0.91, 'min_samples_leaf': 2, 'criterion': 'absolute_error', 'max_depth': 10, 'min_weight_fraction_leaf': 0.0, 'max_leaf_nodes': 150, 'bootstrap': False, 'ccp_alpha': 0.018000000000000002}. Best is trial 2251 with value: 0.02361845659970214.
[I 2025-04-16 01:16:39,282] Trial 2317 finished with value: -0.1936417107583833 and parameters: {'n_estimators': 3401, 'min_samples_split': 2, 'max_features': 0.93, 'min_samples_leaf': 1, 'criterion': 'absolute_error', 'max_depth': 5, 'min_weight_fraction_leaf': 0.0, 'max_leaf_nodes': 150, 'bootstrap': False, 'ccp_alpha': 0.01}. Best is trial 2251 with value: 0.02361845659970214.
[I 2025-04-16 01:16:42,856] Trial 2318 finished with value: -0.1936417107583833 and parameters: {'n_estimators': 3793, 'min_samples_split': 6, 'max_features': 0.93, 'min_samples_leaf': 1, 'criterion': 'absolute_error', 'max_depth': 5, 'min_weight_fraction_leaf': 0.0, 'max_leaf_nodes': 150, 'bootstrap': False, 'ccp_alpha': 0.031}. Best is trial 2251 with value: 0.02361845659970214.
[I 2025-04-16 01:16:46,213] Trial 2319 finished with value: -0.1936417107583833 and parameters: {'n_estimators': 3621, 'min_samples_split': 2, 'max_features': 0.9400000000000001, 'min_samples_leaf': 1, 'criterion': 'absolute_error', 'max_depth': 5, 'min_weight_fraction_leaf': 0.0, 'max_leaf_nodes': 150, 'bootstrap': False, 'ccp_alpha': 0.01}. Best is trial 2251 with value: 0.02361845659970214.
[I 2025-04-16 01:16:49,709] Trial 2320 finished with value: -0.1936417107583833 and parameters: {'n_estimators': 3822, 'min_samples_split': 6, 'max_features': 0.89, 'min_samples_leaf': 4, 'criterion': 'absolute_error', 'max_depth': 5, 'min_weight_fraction_leaf': 0.0, 'max_leaf_nodes': 150, 'bootstrap': False, 'ccp_alpha': 0.015}. Best is trial 2251 with value: 0.02361845659970214.
