[I 2025-04-15 23:44:37,251] Trial 745 finished with value: -0.18308796024513763 and parameters: {'n_estimators': 3996, 'min_samples_split': 180, 'max_features': 0.87, 'min_samples_leaf': 29, 'criterion': 'absolute_error', 'max_depth': None, 'min_weight_fraction_leaf': 0.02, 'max_leaf_nodes': 100, 'bootstrap': True, 'ccp_alpha': 0.073, 'max_samples': 0.5}. Best is trial 621 with value: -0.18112741123578058.
[I 2025-04-15 23:44:40,986] Trial 746 finished with value: -0.18255580569768703 and parameters: {'n_estimators': 2981, 'min_samples_split': 153, 'max_features': 0.32, 'min_samples_leaf': 26, 'criterion': 'absolute_error', 'max_depth': 30, 'min_weight_fraction_leaf': 0.01, 'max_leaf_nodes': 100, 'bootstrap': True, 'ccp_alpha': 0.067, 'max_samples': 0.5}. Best is trial 621 with value: -0.18112741123578058.
[I 2025-04-15 23:44:43,547] Trial 747 finished with value: -18.167354678106044 and parameters: {'n_estimators': 2628, 'min_samples_split': 38, 'max_features': 0.85, 'min_samples_leaf': 39, 'criterion': 'friedman_mse', 'max_depth': 60, 'min_weight_fraction_leaf': 0.07, 'max_leaf_nodes': 100, 'bootstrap': True, 'ccp_alpha': 0.098, 'max_samples': 0.5}. Best is trial 621 with value: -0.18112741123578058.
[I 2025-04-15 23:44:46,970] Trial 748 finished with value: -0.18283833602507554 and parameters: {'n_estimators': 3245, 'min_samples_split': 28, 'max_features': 0.8200000000000001, 'min_samples_leaf': 23, 'criterion': 'absolute_error', 'max_depth': 15, 'min_weight_fraction_leaf': 0.02, 'max_leaf_nodes': 150, 'bootstrap': True, 'ccp_alpha': 0.058, 'max_samples': 0.5}. Best is trial 621 with value: -0.18112741123578058.
[I 2025-04-15 23:44:50,023] Trial 749 finished with value: -0.18289550823006978 and parameters: {'n_estimators': 2821, 'min_samples_split': 22, 'max_features': 0.23, 'min_samples_leaf': 70, 'criterion': 'absolute_error', 'max_depth': 5, 'min_weight_fraction_leaf': 0.09, 'max_leaf_nodes': 50, 'bootstrap': True, 'ccp_alpha': 0.084, 'max_samples': 0.5}. Best is trial 621 with value: -0.18112741123578058.
[I 2025-04-15 23:44:53,979] Trial 750 finished with value: -0.1830937292101241 and parameters: {'n_estimators': 3787, 'min_samples_split': 174, 'max_features': 0.16, 'min_samples_leaf': 32, 'criterion': 'absolute_error', 'max_depth': 45, 'min_weight_fraction_leaf': 0.05, 'max_leaf_nodes': 20, 'bootstrap': True, 'ccp_alpha': 0.093, 'max_samples': 0.5}. Best is trial 621 with value: -0.18112741123578058.
[I 2025-04-15 23:44:57,696] Trial 751 finished with value: -0.18320750762441063 and parameters: {'n_estimators': 3464, 'min_samples_split': 163, 'max_features': 0.29000000000000004, 'min_samples_leaf': 28, 'criterion': 'absolute_error', 'max_depth': 30, 'min_weight_fraction_leaf': 0.0, 'max_leaf_nodes': 100, 'bootstrap': True, 'ccp_alpha': 0.05, 'max_samples': 0.5}. Best is trial 621 with value: -0.18112741123578058.
[I 2025-04-15 23:45:00,456] Trial 752 finished with value: -0.18321883069251368 and parameters: {'n_estimators': 2480, 'min_samples_split': 185, 'max_features': 0.92, 'min_samples_leaf': 24, 'criterion': 'absolute_error', 'max_depth': 30, 'min_weight_fraction_leaf': 0.01, 'max_leaf_nodes': 100, 'bootstrap': True, 'ccp_alpha': 0.157, 'max_samples': 0.5}. Best is trial 621 with value: -0.18112741123578058.
[I 2025-04-15 23:45:06,454] Trial 753 finished with value: -0.18386615675069398 and parameters: {'n_estimators': 5939, 'min_samples_split': 167, 'max_features': 0.89, 'min_samples_leaf': 30, 'criterion': 'absolute_error', 'max_depth': 45, 'min_weight_fraction_leaf': 0.01, 'max_leaf_nodes': 150, 'bootstrap': True, 'ccp_alpha': 0.10300000000000001, 'max_samples': 0.5}. Best is trial 621 with value: -0.18112741123578058.
[I 2025-04-15 23:45:09,698] Trial 754 finished with value: -0.18261927312875 and parameters: {'n_estimators': 3129, 'min_samples_split': 158, 'max_features': 0.79, 'min_samples_leaf': 27, 'criterion': 'absolute_error', 'max_depth': 15, 'min_weight_fraction_leaf': 0.02, 'max_leaf_nodes': 100, 'bootstrap': True, 'ccp_alpha': 0.064, 'max_samples': 0.5}. Best is trial 621 with value: -0.18112741123578058.
[I 2025-04-15 23:45:09,861] Trial 755 finished with value: -0.19363616285847823 and parameters: {'n_estimators': 4, 'min_samples_split': 171, 'max_features': 0.87, 'min_samples_leaf': 67, 'criterion': 'absolute_error', 'max_depth': 30, 'min_weight_fraction_leaf': 0.02, 'max_leaf_nodes': None, 'bootstrap': True, 'ccp_alpha': 0.023, 'max_samples': 0.5}. Best is trial 621 with value: -0.18112741123578058.
[I 2025-04-15 23:45:10,388] Trial 756 finished with value: -19.11464365181653 and parameters: {'n_estimators': 341, 'min_samples_split': 41, 'max_features': 0.8400000000000001, 'min_samples_leaf': 33, 'criterion': 'squared_error', 'max_depth': 45, 'min_weight_fraction_leaf': 0.02, 'max_leaf_nodes': 100, 'bootstrap': True, 'ccp_alpha': 0.076, 'max_samples': 0.5}. Best is trial 621 with value: -0.18112741123578058.
[I 2025-04-15 23:45:13,006] Trial 757 finished with value: -0.1936417107583833 and parameters: {'n_estimators': 2968, 'min_samples_split': 35, 'max_features': 0.2, 'min_samples_leaf': 37, 'criterion': 'absolute_error', 'max_depth': 30, 'min_weight_fraction_leaf': 0.01, 'max_leaf_nodes': 50, 'bootstrap': False, 'ccp_alpha': 0.09}. Best is trial 621 with value: -0.18112741123578058.
[I 2025-04-15 23:45:15,955] Trial 758 finished with value: -0.18281646316523265 and parameters: {'n_estimators': 2708, 'min_samples_split': 72, 'max_features': 0.77, 'min_samples_leaf': 42, 'criterion': 'absolute_error', 'max_depth': 20, 'min_weight_fraction_leaf': 0.02, 'max_leaf_nodes': 150, 'bootstrap': True, 'ccp_alpha': 0.013000000000000001, 'max_samples': 0.5}. Best is trial 621 with value: -0.18112741123578058.
[I 2025-04-15 23:45:19,680] Trial 759 finished with value: -0.18280009555566093 and parameters: {'n_estimators': 3231, 'min_samples_split': 180, 'max_features': 0.81, 'min_samples_leaf': 29, 'criterion': 'absolute_error', 'max_depth': 15, 'min_weight_fraction_leaf': 0.0, 'max_leaf_nodes': 100, 'bootstrap': True, 'ccp_alpha': 0.111, 'max_samples': 0.5}. Best is trial 621 with value: -0.18112741123578058.
[I 2025-04-15 23:45:20,055] Trial 760 finished with value: -0.19302560815676412 and parameters: {'n_estimators': 196, 'min_samples_split': 23, 'max_features': 0.87, 'min_samples_leaf': 25, 'criterion': 'absolute_error', 'max_depth': 45, 'min_weight_fraction_leaf': 0.06, 'max_leaf_nodes': 100, 'bootstrap': True, 'ccp_alpha': 0.07, 'max_samples': None}. Best is trial 621 with value: -0.18112741123578058.
[I 2025-04-15 23:45:23,796] Trial 761 finished with value: -17.793276696790738 and parameters: {'n_estimators': 3505, 'min_samples_split': 188, 'max_features': 0.8300000000000001, 'min_samples_leaf': 14, 'criterion': 'poisson', 'max_depth': 30, 'min_weight_fraction_leaf': 0.01, 'max_leaf_nodes': 100, 'bootstrap': True, 'ccp_alpha': 0.056, 'max_samples': 0.5}. Best is trial 621 with value: -0.18112741123578058.
[I 2025-04-15 23:45:27,141] Trial 762 finished with value: -0.18254978946211192 and parameters: {'n_estimators': 2979, 'min_samples_split': 17, 'max_features': 0.43, 'min_samples_leaf': 34, 'criterion': 'absolute_error', 'max_depth': None, 'min_weight_fraction_leaf': 0.02, 'max_leaf_nodes': 300, 'bootstrap': True, 'ccp_alpha': 0.08600000000000001, 'max_samples': 0.5}. Best is trial 621 with value: -0.18112741123578058.
[I 2025-04-15 23:45:30,513] Trial 763 finished with value: -0.18260373200261473 and parameters: {'n_estimators': 3120, 'min_samples_split': 31, 'max_features': 0.39, 'min_samples_leaf': 31, 'criterion': 'absolute_error', 'max_depth': 60, 'min_weight_fraction_leaf': 0.02, 'max_leaf_nodes': 150, 'bootstrap': True, 'ccp_alpha': 0.101, 'max_samples': 0.5}. Best is trial 621 with value: -0.18112741123578058.
[I 2025-04-15 23:45:34,450] Trial 764 finished with value: -0.18303504979547217 and parameters: {'n_estimators': 3349, 'min_samples_split': 176, 'max_features': 0.86, 'min_samples_leaf': 21, 'criterion': 'absolute_error', 'max_depth': 5, 'min_weight_fraction_leaf': 0.0, 'max_leaf_nodes': 100, 'bootstrap': True, 'ccp_alpha': 0.078, 'max_samples': 0.5}. Best is trial 621 with value: -0.18112741123578058.
[I 2025-04-15 23:45:35,177] Trial 765 finished with value: -0.18748772050153137 and parameters: {'n_estimators': 510, 'min_samples_split': 45, 'max_features': 0.9, 'min_samples_leaf': 26, 'criterion': 'absolute_error', 'max_depth': 30, 'min_weight_fraction_leaf': 0.02, 'max_leaf_nodes': 50, 'bootstrap': True, 'ccp_alpha': 0.06, 'max_samples': 0.5}. Best is trial 621 with value: -0.18112741123578058.
[I 2025-04-15 23:45:38,701] Trial 766 finished with value: -0.19327129573029184 and parameters: {'n_estimators': 2802, 'min_samples_split': 145, 'max_features': 0.34, 'min_samples_leaf': 29, 'criterion': 'absolute_error', 'max_depth': 45, 'min_weight_fraction_leaf': 0.03, 'max_leaf_nodes': 100, 'bootstrap': True, 'ccp_alpha': 0.044, 'max_samples': 1.0}. Best is trial 621 with value: -0.18112741123578058.
[I 2025-04-15 23:45:41,386] Trial 767 finished with value: -0.18390919823419574 and parameters: {'n_estimators': 2443, 'min_samples_split': 152, 'max_features': 0.93, 'min_samples_leaf': 47, 'criterion': 'absolute_error', 'max_depth': 30, 'min_weight_fraction_leaf': 0.01, 'max_leaf_nodes': 150, 'bootstrap': True, 'ccp_alpha': 0.096, 'max_samples': 0.5}. Best is trial 621 with value: -0.18112741123578058.
[I 2025-04-15 23:45:45,302] Trial 768 finished with value: -0.19090552244632947 and parameters: {'n_estimators': 3142, 'min_samples_split': 52, 'max_features': 0.79, 'min_samples_leaf': 61, 'criterion': 'absolute_error', 'max_depth': 15, 'min_weight_fraction_leaf': 0.02, 'max_leaf_nodes': 100, 'bootstrap': True, 'ccp_alpha': 0.115, 'max_samples': 0.75}. Best is trial 621 with value: -0.18112741123578058.
[I 2025-04-15 23:45:49,361] Trial 769 finished with value: -0.1834605463528954 and parameters: {'n_estimators': 3657, 'min_samples_split': 172, 'max_features': 0.8200000000000001, 'min_samples_leaf': 27, 'criterion': 'absolute_error', 'max_depth': 45, 'min_weight_fraction_leaf': 0.0, 'max_leaf_nodes': None, 'bootstrap': True, 'ccp_alpha': 0.052000000000000005, 'max_samples': 0.5}. Best is trial 621 with value: -0.18112741123578058.
[I 2025-04-15 23:45:52,512] Trial 770 finished with value: -0.18301155061259725 and parameters: {'n_estimators': 2883, 'min_samples_split': 27, 'max_features': 0.89, 'min_samples_leaf': 23, 'criterion': 'absolute_error', 'max_depth': 30, 'min_weight_fraction_leaf': 0.01, 'max_leaf_nodes': 100, 'bootstrap': True, 'ccp_alpha': 0.108, 'max_samples': 0.5}. Best is trial 621 with value: -0.18112741123578058.
[I 2025-04-15 23:45:52,850] Trial 771 finished with value: -18.798177778532917 and parameters: {'n_estimators': 186, 'min_samples_split': 168, 'max_features': 0.76, 'min_samples_leaf': 32, 'criterion': 'friedman_mse', 'max_depth': 15, 'min_weight_fraction_leaf': 0.01, 'max_leaf_nodes': 50, 'bootstrap': True, 'ccp_alpha': 0.065, 'max_samples': 0.5}. Best is trial 621 with value: -0.18112741123578058.
[I 2025-04-15 23:45:56,589] Trial 772 finished with value: -0.1829292028755169 and parameters: {'n_estimators': 3355, 'min_samples_split': 159, 'max_features': 0.27, 'min_samples_leaf': 72, 'criterion': 'absolute_error', 'max_depth': 30, 'min_weight_fraction_leaf': 0.01, 'max_leaf_nodes': 100, 'bootstrap': True, 'ccp_alpha': 0.082, 'max_samples': 0.5}. Best is trial 621 with value: -0.18112741123578058.
[I 2025-04-15 23:46:01,680] Trial 773 finished with value: -0.18336571977738444 and parameters: {'n_estimators': 4421, 'min_samples_split': 111, 'max_features': 0.85, 'min_samples_leaf': 28, 'criterion': 'absolute_error', 'max_depth': 45, 'min_weight_fraction_leaf': 0.02, 'max_leaf_nodes': 150, 'bootstrap': True, 'ccp_alpha': 0.08700000000000001, 'max_samples': 0.5}. Best is trial 621 with value: -0.18112741123578058.
[I 2025-04-15 23:46:04,279] Trial 774 finished with value: -0.18366138268450852 and parameters: {'n_estimators': 2268, 'min_samples_split': 39, 'max_features': 0.8, 'min_samples_leaf': 36, 'criterion': 'absolute_error', 'max_depth': 20, 'min_weight_fraction_leaf': 0.02, 'max_leaf_nodes': 100, 'bootstrap': True, 'ccp_alpha': 0.07100000000000001, 'max_samples': 0.5}. Best is trial 621 with value: -0.18112741123578058.
[I 2025-04-15 23:46:07,471] Trial 775 finished with value: -0.18279684938756668 and parameters: {'n_estimators': 2702, 'min_samples_split': 200, 'max_features': 0.88, 'min_samples_leaf': 31, 'criterion': 'absolute_error', 'max_depth': 30, 'min_weight_fraction_leaf': 0.05, 'max_leaf_nodes': 20, 'bootstrap': True, 'ccp_alpha': 0.101, 'max_samples': 0.5}. Best is trial 621 with value: -0.18112741123578058.
[I 2025-04-15 23:46:07,638] Trial 776 finished with value: -0.1936417107583833 and parameters: {'n_estimators': 7, 'min_samples_split': 182, 'max_features': 0.91, 'min_samples_leaf': 24, 'criterion': 'absolute_error', 'max_depth': None, 'min_weight_fraction_leaf': 0.03, 'max_leaf_nodes': 100, 'bootstrap': False, 'ccp_alpha': 0.122}. Best is trial 621 with value: -0.18112741123578058.
[I 2025-04-15 23:46:11,105] Trial 777 finished with value: -0.18258692360892073 and parameters: {'n_estimators': 3027, 'min_samples_split': 164, 'max_features': 0.8400000000000001, 'min_samples_leaf': 50, 'criterion': 'absolute_error', 'max_depth': 45, 'min_weight_fraction_leaf': 0.01, 'max_leaf_nodes': 150, 'bootstrap': True, 'ccp_alpha': 0.061, 'max_samples': 0.5}. Best is trial 621 with value: -0.18112741123578058.
[I 2025-04-15 23:46:14,721] Trial 778 finished with value: -0.18269951176974245 and parameters: {'n_estimators': 3176, 'min_samples_split': 20, 'max_features': 0.86, 'min_samples_leaf': 34, 'criterion': 'absolute_error', 'max_depth': 60, 'min_weight_fraction_leaf': 0.06, 'max_leaf_nodes': 100, 'bootstrap': True, 'ccp_alpha': 0.094, 'max_samples': 0.5}. Best is trial 621 with value: -0.18112741123578058.
[I 2025-04-15 23:46:15,279] Trial 779 finished with value: -0.1881303580337607 and parameters: {'n_estimators': 382, 'min_samples_split': 124, 'max_features': 0.9500000000000001, 'min_samples_leaf': 26, 'criterion': 'absolute_error', 'max_depth': 30, 'min_weight_fraction_leaf': 0.03, 'max_leaf_nodes': 50, 'bootstrap': True, 'ccp_alpha': 0.077, 'max_samples': 0.5}. Best is trial 621 with value: -0.18112741123578058.
[I 2025-04-15 23:46:18,373] Trial 780 finished with value: -18.167601809001887 and parameters: {'n_estimators': 2876, 'min_samples_split': 149, 'max_features': 0.53, 'min_samples_leaf': 29, 'criterion': 'squared_error', 'max_depth': 5, 'min_weight_fraction_leaf': 0.04, 'max_leaf_nodes': 100, 'bootstrap': True, 'ccp_alpha': 0.108, 'max_samples': 0.5}. Best is trial 621 with value: -0.18112741123578058.
[I 2025-04-15 23:46:23,862] Trial 781 finished with value: -0.18370143540108472 and parameters: {'n_estimators': 4759, 'min_samples_split': 34, 'max_features': 0.8200000000000001, 'min_samples_leaf': 31, 'criterion': 'absolute_error', 'max_depth': 15, 'min_weight_fraction_leaf': 0.02, 'max_leaf_nodes': 100, 'bootstrap': True, 'ccp_alpha': 0.035, 'max_samples': 0.5}. Best is trial 621 with value: -0.18112741123578058.
[I 2025-04-15 23:46:26,828] Trial 782 finished with value: -0.1830355987142352 and parameters: {'n_estimators': 2591, 'min_samples_split': 25, 'max_features': 0.89, 'min_samples_leaf': 22, 'criterion': 'absolute_error', 'max_depth': 45, 'min_weight_fraction_leaf': 0.0, 'max_leaf_nodes': 150, 'bootstrap': True, 'ccp_alpha': 0.07100000000000001, 'max_samples': 0.5}. Best is trial 621 with value: -0.18112741123578058.
[I 2025-04-15 23:46:27,809] Trial 783 finished with value: -0.1861949545626828 and parameters: {'n_estimators': 744, 'min_samples_split': 176, 'max_features': 0.78, 'min_samples_leaf': 26, 'criterion': 'absolute_error', 'max_depth': 30, 'min_weight_fraction_leaf': 0.01, 'max_leaf_nodes': None, 'bootstrap': True, 'ccp_alpha': 0.179, 'max_samples': 0.5}. Best is trial 621 with value: -0.18112741123578058.
[I 2025-04-15 23:46:31,519] Trial 784 finished with value: -0.18311206104160002 and parameters: {'n_estimators': 3426, 'min_samples_split': 105, 'max_features': 0.92, 'min_samples_leaf': 28, 'criterion': 'absolute_error', 'max_depth': 30, 'min_weight_fraction_leaf': 0.02, 'max_leaf_nodes': 100, 'bootstrap': True, 'ccp_alpha': 0.053, 'max_samples': 0.5}. Best is trial 621 with value: -0.18112741123578058.
[I 2025-04-15 23:46:34,764] Trial 785 finished with value: -0.1932864849925136 and parameters: {'n_estimators': 3015, 'min_samples_split': 156, 'max_features': 0.8400000000000001, 'min_samples_leaf': 33, 'criterion': 'absolute_error', 'max_depth': 45, 'min_weight_fraction_leaf': 0.02, 'max_leaf_nodes': 100, 'bootstrap': True, 'ccp_alpha': 0.045, 'max_samples': None}. Best is trial 621 with value: -0.18112741123578058.
[I 2025-04-15 23:46:38,951] Trial 786 finished with value: -0.18288173159037285 and parameters: {'n_estimators': 3261, 'min_samples_split': 31, 'max_features': 0.87, 'min_samples_leaf': 40, 'criterion': 'absolute_error', 'max_depth': 15, 'min_weight_fraction_leaf': 0.01, 'max_leaf_nodes': 50, 'bootstrap': True, 'ccp_alpha': 0.08700000000000001, 'max_samples': 0.5}. Best is trial 621 with value: -0.18112741123578058.
[I 2025-04-15 23:46:41,958] Trial 787 finished with value: -18.154646079031085 and parameters: {'n_estimators': 2788, 'min_samples_split': 168, 'max_features': 0.32, 'min_samples_leaf': 25, 'criterion': 'poisson', 'max_depth': 30, 'min_weight_fraction_leaf': 0.0, 'max_leaf_nodes': 150, 'bootstrap': True, 'ccp_alpha': 0.064, 'max_samples': 0.5}. Best is trial 621 with value: -0.18112741123578058.
[I 2025-04-15 23:46:45,734] Trial 788 finished with value: -0.1833975763161675 and parameters: {'n_estimators': 3621, 'min_samples_split': 181, 'max_features': 0.25, 'min_samples_leaf': 30, 'criterion': 'absolute_error', 'max_depth': 45, 'min_weight_fraction_leaf': 0.02, 'max_leaf_nodes': 100, 'bootstrap': True, 'ccp_alpha': 0.08, 'max_samples': 0.5}. Best is trial 621 with value: -0.18112741123578058.
[I 2025-04-15 23:46:46,123] Trial 789 finished with value: -0.1862085274187944 and parameters: {'n_estimators': 220, 'min_samples_split': 41, 'max_features': 0.81, 'min_samples_leaf': 37, 'criterion': 'absolute_error', 'max_depth': 30, 'min_weight_fraction_leaf': 0.01, 'max_leaf_nodes': 300, 'bootstrap': True, 'ccp_alpha': 0.094, 'max_samples': 0.5}. Best is trial 621 with value: -0.18112741123578058.
[I 2025-04-15 23:46:49,886] Trial 790 finished with value: -0.18272719528766204 and parameters: {'n_estimators': 3075, 'min_samples_split': 11, 'max_features': 0.3, 'min_samples_leaf': 35, 'criterion': 'absolute_error', 'max_depth': 15, 'min_weight_fraction_leaf': 0.02, 'max_leaf_nodes': 100, 'bootstrap': True, 'ccp_alpha': 0.10400000000000001, 'max_samples': 0.5}. Best is trial 621 with value: -0.18112741123578058.
[I 2025-04-15 23:46:53,533] Trial 791 finished with value: -0.18299320998805196 and parameters: {'n_estimators': 3333, 'min_samples_split': 192, 'max_features': 0.85, 'min_samples_leaf': 28, 'criterion': 'absolute_error', 'max_depth': 20, 'min_weight_fraction_leaf': 0.02, 'max_leaf_nodes': 100, 'bootstrap': True, 'ccp_alpha': 0.056, 'max_samples': 0.5}. Best is trial 621 with value: -0.18112741123578058.
[I 2025-04-15 23:46:54,347] Trial 792 finished with value: -0.1934247568263368 and parameters: {'n_estimators': 563, 'min_samples_split': 161, 'max_features': 0.19, 'min_samples_leaf': 32, 'criterion': 'absolute_error', 'max_depth': None, 'min_weight_fraction_leaf': 0.01, 'max_leaf_nodes': 150, 'bootstrap': True, 'ccp_alpha': 0.068, 'max_samples': 1.0}. Best is trial 621 with value: -0.18112741123578058.
[I 2025-04-15 23:46:57,565] Trial 793 finished with value: -0.19078604664350313 and parameters: {'n_estimators': 2878, 'min_samples_split': 173, 'max_features': 0.8, 'min_samples_leaf': 4, 'criterion': 'absolute_error', 'max_depth': 45, 'min_weight_fraction_leaf': 0.01, 'max_leaf_nodes': 50, 'bootstrap': True, 'ccp_alpha': 0.20700000000000002, 'max_samples': 0.75}. Best is trial 621 with value: -0.18112741123578058.
[I 2025-04-15 23:46:57,715] Trial 794 finished with value: -0.1936179286822098 and parameters: {'n_estimators': 1, 'min_samples_split': 59, 'max_features': 0.9, 'min_samples_leaf': 64, 'criterion': 'absolute_error', 'max_depth': 60, 'min_weight_fraction_leaf': 0.03, 'max_leaf_nodes': 100, 'bootstrap': True, 'ccp_alpha': 0.116, 'max_samples': 0.5}. Best is trial 621 with value: -0.18112741123578058.
[I 2025-04-15 23:46:59,608] Trial 795 finished with value: -17.528986382276933 and parameters: {'n_estimators': 2570, 'min_samples_split': 186, 'max_features': 0.75, 'min_samples_leaf': 20, 'criterion': 'friedman_mse', 'max_depth': 30, 'min_weight_fraction_leaf': 0.0, 'max_leaf_nodes': 100, 'bootstrap': False, 'ccp_alpha': 0.074}. Best is trial 621 with value: -0.18112741123578058.
[I 2025-04-15 23:47:03,035] Trial 796 finished with value: -0.18264609666554174 and parameters: {'n_estimators': 3157, 'min_samples_split': 47, 'max_features': 0.64, 'min_samples_leaf': 25, 'criterion': 'absolute_error', 'max_depth': 5, 'min_weight_fraction_leaf': 0.06, 'max_leaf_nodes': 150, 'bootstrap': True, 'ccp_alpha': 0.099, 'max_samples': 0.5}. Best is trial 621 with value: -0.18112741123578058.
[I 2025-04-15 23:47:03,579] Trial 797 finished with value: -0.18799108754725985 and parameters: {'n_estimators': 372, 'min_samples_split': 36, 'max_features': 0.09, 'min_samples_leaf': 23, 'criterion': 'absolute_error', 'max_depth': 30, 'min_weight_fraction_leaf': 0.02, 'max_leaf_nodes': None, 'bootstrap': True, 'ccp_alpha': 0.196, 'max_samples': 0.5}. Best is trial 621 with value: -0.18112741123578058.
