[I 2025-04-16 01:50:19,991] Trial 3004 finished with value: -0.1936417107583833 and parameters: {'n_estimators': 1112, 'min_samples_split': 18, 'max_features': 0.88, 'min_samples_leaf': 7, 'criterion': 'absolute_error', 'max_depth': None, 'min_weight_fraction_leaf': 0.0, 'max_leaf_nodes': 20, 'bootstrap': False, 'ccp_alpha': 0.01}. Best is trial 2774 with value: 0.046571421912873.
[I 2025-04-16 01:50:21,168] Trial 3005 finished with value: -17.528986382275725 and parameters: {'n_estimators': 1040, 'min_samples_split': 17, 'max_features': 0.9, 'min_samples_leaf': 9, 'criterion': 'squared_error', 'max_depth': None, 'min_weight_fraction_leaf': 0.0, 'max_leaf_nodes': 20, 'bootstrap': False, 'ccp_alpha': 0.024}. Best is trial 2774 with value: 0.046571421912873.
[I 2025-04-16 01:50:22,663] Trial 3006 finished with value: 0.022461671792523074 and parameters: {'n_estimators': 1384, 'min_samples_split': 17, 'max_features': 0.9, 'min_samples_leaf': 7, 'criterion': 'absolute_error', 'max_depth': None, 'min_weight_fraction_leaf': 0.0, 'max_leaf_nodes': 20, 'bootstrap': False, 'ccp_alpha': 0.005}. Best is trial 2774 with value: 0.046571421912873.
[I 2025-04-16 01:50:24,479] Trial 3007 finished with value: -0.1936417107583833 and parameters: {'n_estimators': 1302, 'min_samples_split': 96, 'max_features': 0.88, 'min_samples_leaf': 9, 'criterion': 'absolute_error', 'max_depth': None, 'min_weight_fraction_leaf': 0.0, 'max_leaf_nodes': 20, 'bootstrap': False, 'ccp_alpha': 0.01}. Best is trial 2774 with value: 0.046571421912873.
[I 2025-04-16 01:50:25,907] Trial 3008 finished with value: -0.1936417107583833 and parameters: {'n_estimators': 1178, 'min_samples_split': 19, 'max_features': 0.46, 'min_samples_leaf': 9, 'criterion': 'absolute_error', 'max_depth': None, 'min_weight_fraction_leaf': 0.0, 'max_leaf_nodes': 20, 'bootstrap': False, 'ccp_alpha': 0.019}. Best is trial 2774 with value: 0.046571421912873.
[I 2025-04-16 01:50:27,150] Trial 3009 finished with value: -8.628696377218272 and parameters: {'n_estimators': 1176, 'min_samples_split': 18, 'max_features': 0.91, 'min_samples_leaf': 9, 'criterion': 'absolute_error', 'max_depth': None, 'min_weight_fraction_leaf': 0.0, 'max_leaf_nodes': 20, 'bootstrap': False, 'ccp_alpha': 0.0}. Best is trial 2774 with value: 0.046571421912873.
[I 2025-04-16 01:50:29,007] Trial 3010 finished with value: -0.1936417107583833 and parameters: {'n_estimators': 1484, 'min_samples_split': 18, 'max_features': 0.87, 'min_samples_leaf': 7, 'criterion': 'absolute_error', 'max_depth': None, 'min_weight_fraction_leaf': 0.0, 'max_leaf_nodes': 20, 'bootstrap': False, 'ccp_alpha': 0.014}. Best is trial 2774 with value: 0.046571421912873.
[I 2025-04-16 01:50:30,380] Trial 3011 finished with value: -0.1936417107583833 and parameters: {'n_estimators': 1133, 'min_samples_split': 19, 'max_features': 0.91, 'min_samples_leaf': 9, 'criterion': 'absolute_error', 'max_depth': None, 'min_weight_fraction_leaf': 0.0, 'max_leaf_nodes': 20, 'bootstrap': False, 'ccp_alpha': 0.005}. Best is trial 2774 with value: 0.046571421912873.
[I 2025-04-16 01:50:31,603] Trial 3012 finished with value: -20.847437014605774 and parameters: {'n_estimators': 901, 'min_samples_split': 16, 'max_features': 0.88, 'min_samples_leaf': 7, 'criterion': 'poisson', 'max_depth': None, 'min_weight_fraction_leaf': 0.0, 'max_leaf_nodes': 20, 'bootstrap': False, 'ccp_alpha': 0.009000000000000001}. Best is trial 2774 with value: 0.046571421912873.
[I 2025-04-16 01:50:32,928] Trial 3013 finished with value: -8.66481660808118 and parameters: {'n_estimators': 1332, 'min_samples_split': 19, 'max_features': 0.9, 'min_samples_leaf': 7, 'criterion': 'absolute_error', 'max_depth': None, 'min_weight_fraction_leaf': 0.0, 'max_leaf_nodes': 20, 'bootstrap': False, 'ccp_alpha': 0.0}. Best is trial 2774 with value: 0.046571421912873.
[I 2025-04-16 01:50:34,344] Trial 3014 finished with value: -0.1936417107583833 and parameters: {'n_estimators': 1322, 'min_samples_split': 16, 'max_features': 0.91, 'min_samples_leaf': 9, 'criterion': 'absolute_error', 'max_depth': None, 'min_weight_fraction_leaf': 0.0, 'max_leaf_nodes': 20, 'bootstrap': False, 'ccp_alpha': 0.019}. Best is trial 2774 with value: 0.046571421912873.
[I 2025-04-16 01:50:35,829] Trial 3015 finished with value: -0.1936417107583833 and parameters: {'n_estimators': 1438, 'min_samples_split': 57, 'max_features': 0.88, 'min_samples_leaf': 49, 'criterion': 'absolute_error', 'max_depth': None, 'min_weight_fraction_leaf': 0.0, 'max_leaf_nodes': 20, 'bootstrap': False, 'ccp_alpha': 0.01}. Best is trial 2774 with value: 0.046571421912873.
[I 2025-04-16 01:50:37,267] Trial 3016 finished with value: -0.1936417107583833 and parameters: {'n_estimators': 1312, 'min_samples_split': 18, 'max_features': 0.92, 'min_samples_leaf': 7, 'criterion': 'absolute_error', 'max_depth': None, 'min_weight_fraction_leaf': 0.0, 'max_leaf_nodes': 20, 'bootstrap': False, 'ccp_alpha': 0.014}. Best is trial 2774 with value: 0.046571421912873.
[I 2025-04-16 01:50:39,040] Trial 3017 finished with value: -0.1936417107583833 and parameters: {'n_estimators': 1606, 'min_samples_split': 15, 'max_features': 0.59, 'min_samples_leaf': 9, 'criterion': 'absolute_error', 'max_depth': None, 'min_weight_fraction_leaf': 0.0, 'max_leaf_nodes': 20, 'bootstrap': False, 'ccp_alpha': 0.006}. Best is trial 2774 with value: 0.046571421912873.
[I 2025-04-16 01:50:40,146] Trial 3018 finished with value: 0.02086920476280909 and parameters: {'n_estimators': 934, 'min_samples_split': 18, 'max_features': 0.9, 'min_samples_leaf': 7, 'criterion': 'absolute_error', 'max_depth': None, 'min_weight_fraction_leaf': 0.0, 'max_leaf_nodes': 20, 'bootstrap': False, 'ccp_alpha': 0.005}. Best is trial 2774 with value: 0.046571421912873.
[I 2025-04-16 01:50:41,579] Trial 3019 finished with value: -7.570567416925428 and parameters: {'n_estimators': 1421, 'min_samples_split': 19, 'max_features': 0.87, 'min_samples_leaf': 7, 'criterion': 'absolute_error', 'max_depth': None, 'min_weight_fraction_leaf': 0.0, 'max_leaf_nodes': 20, 'bootstrap': False, 'ccp_alpha': 0.0}. Best is trial 2774 with value: 0.046571421912873.
[I 2025-04-16 01:50:42,647] Trial 3020 finished with value: -17.528986382275395 and parameters: {'n_estimators': 896, 'min_samples_split': 18, 'max_features': 0.87, 'min_samples_leaf': 9, 'criterion': 'friedman_mse', 'max_depth': None, 'min_weight_fraction_leaf': 0.0, 'max_leaf_nodes': 20, 'bootstrap': False, 'ccp_alpha': 0.028}. Best is trial 2774 with value: 0.046571421912873.
[I 2025-04-16 01:50:43,999] Trial 3021 finished with value: -0.1936417107583833 and parameters: {'n_estimators': 919, 'min_samples_split': 18, 'max_features': 0.89, 'min_samples_leaf': 6, 'criterion': 'absolute_error', 'max_depth': None, 'min_weight_fraction_leaf': 0.0, 'max_leaf_nodes': 20, 'bootstrap': False, 'ccp_alpha': 0.014}. Best is trial 2774 with value: 0.046571421912873.
[I 2025-04-16 01:50:45,213] Trial 3022 finished with value: -0.1936417107583833 and parameters: {'n_estimators': 1073, 'min_samples_split': 19, 'max_features': 0.87, 'min_samples_leaf': 6, 'criterion': 'absolute_error', 'max_depth': None, 'min_weight_fraction_leaf': 0.0, 'max_leaf_nodes': 20, 'bootstrap': False, 'ccp_alpha': 0.01}. Best is trial 2774 with value: 0.046571421912873.
[I 2025-04-16 01:50:46,483] Trial 3023 finished with value: -0.1936417107583833 and parameters: {'n_estimators': 1041, 'min_samples_split': 18, 'max_features': 0.89, 'min_samples_leaf': 9, 'criterion': 'absolute_error', 'max_depth': None, 'min_weight_fraction_leaf': 0.0, 'max_leaf_nodes': 20, 'bootstrap': False, 'ccp_alpha': 0.021}. Best is trial 2774 with value: 0.046571421912873.
[I 2025-04-16 01:50:47,654] Trial 3024 finished with value: 0.020786872070157725 and parameters: {'n_estimators': 995, 'min_samples_split': 17, 'max_features': 0.9, 'min_samples_leaf': 6, 'criterion': 'absolute_error', 'max_depth': None, 'min_weight_fraction_leaf': 0.0, 'max_leaf_nodes': 20, 'bootstrap': False, 'ccp_alpha': 0.005}. Best is trial 2774 with value: 0.046571421912873.
[I 2025-04-16 01:50:49,076] Trial 3025 finished with value: -0.1936417107583833 and parameters: {'n_estimators': 1327, 'min_samples_split': 20, 'max_features': 0.87, 'min_samples_leaf': 8, 'criterion': 'absolute_error', 'max_depth': None, 'min_weight_fraction_leaf': 0.0, 'max_leaf_nodes': 20, 'bootstrap': False, 'ccp_alpha': 0.005}. Best is trial 2774 with value: 0.046571421912873.
[I 2025-04-16 01:50:51,042] Trial 3026 finished with value: -0.1936417107583833 and parameters: {'n_estimators': 1841, 'min_samples_split': 15, 'max_features': 0.9, 'min_samples_leaf': 6, 'criterion': 'absolute_error', 'max_depth': None, 'min_weight_fraction_leaf': 0.0, 'max_leaf_nodes': 20, 'bootstrap': False, 'ccp_alpha': 0.015}. Best is trial 2774 with value: 0.046571421912873.
[I 2025-04-16 01:50:52,045] Trial 3027 finished with value: -8.725647310076996 and parameters: {'n_estimators': 842, 'min_samples_split': 15, 'max_features': 0.92, 'min_samples_leaf': 9, 'criterion': 'absolute_error', 'max_depth': None, 'min_weight_fraction_leaf': 0.0, 'max_leaf_nodes': 20, 'bootstrap': False, 'ccp_alpha': 0.0}. Best is trial 2774 with value: 0.046571421912873.
[I 2025-04-16 01:50:53,373] Trial 3028 finished with value: -0.1936417107583833 and parameters: {'n_estimators': 1191, 'min_samples_split': 20, 'max_features': 0.89, 'min_samples_leaf': 100, 'criterion': 'absolute_error', 'max_depth': None, 'min_weight_fraction_leaf': 0.0, 'max_leaf_nodes': 20, 'bootstrap': False, 'ccp_alpha': 0.01}. Best is trial 2774 with value: 0.046571421912873.
[I 2025-04-16 01:50:54,722] Trial 3029 finished with value: -17.528986382275775 and parameters: {'n_estimators': 1065, 'min_samples_split': 15, 'max_features': 0.55, 'min_samples_leaf': 7, 'criterion': 'squared_error', 'max_depth': None, 'min_weight_fraction_leaf': 0.0, 'max_leaf_nodes': 20, 'bootstrap': False, 'ccp_alpha': 0.009000000000000001}. Best is trial 2774 with value: 0.046571421912873.
[I 2025-04-16 01:50:56,344] Trial 3030 finished with value: -0.1936417107583833 and parameters: {'n_estimators': 1194, 'min_samples_split': 19, 'max_features': 0.87, 'min_samples_leaf': 6, 'criterion': 'absolute_error', 'max_depth': None, 'min_weight_fraction_leaf': 0.0, 'max_leaf_nodes': 20, 'bootstrap': False, 'ccp_alpha': 0.019}. Best is trial 2774 with value: 0.046571421912873.
[I 2025-04-16 01:50:57,397] Trial 3031 finished with value: -8.61788567225177 and parameters: {'n_estimators': 767, 'min_samples_split': 14, 'max_features': 0.92, 'min_samples_leaf': 9, 'criterion': 'absolute_error', 'max_depth': None, 'min_weight_fraction_leaf': 0.0, 'max_leaf_nodes': 20, 'bootstrap': False, 'ccp_alpha': 0.0}. Best is trial 2774 with value: 0.046571421912873.
[I 2025-04-16 01:50:58,719] Trial 3032 finished with value: -0.1936417107583833 and parameters: {'n_estimators': 939, 'min_samples_split': 15, 'max_features': 0.66, 'min_samples_leaf': 6, 'criterion': 'absolute_error', 'max_depth': None, 'min_weight_fraction_leaf': 0.08, 'max_leaf_nodes': 20, 'bootstrap': False, 'ccp_alpha': 0.158}. Best is trial 2774 with value: 0.046571421912873.
[I 2025-04-16 01:51:00,255] Trial 3033 finished with value: -0.1936417107583833 and parameters: {'n_estimators': 1490, 'min_samples_split': 19, 'max_features': 0.9, 'min_samples_leaf': 8, 'criterion': 'absolute_error', 'max_depth': None, 'min_weight_fraction_leaf': 0.0, 'max_leaf_nodes': 20, 'bootstrap': False, 'ccp_alpha': 0.005}. Best is trial 2774 with value: 0.046571421912873.
[I 2025-04-16 01:51:02,107] Trial 3034 finished with value: -0.1936417107583833 and parameters: {'n_estimators': 1787, 'min_samples_split': 14, 'max_features': 0.02, 'min_samples_leaf': 5, 'criterion': 'absolute_error', 'max_depth': None, 'min_weight_fraction_leaf': 0.0, 'max_leaf_nodes': 20, 'bootstrap': False, 'ccp_alpha': 0.014}. Best is trial 2774 with value: 0.046571421912873.
[I 2025-04-16 01:51:03,276] Trial 3035 finished with value: -0.1936417107583833 and parameters: {'n_estimators': 1030, 'min_samples_split': 14, 'max_features': 0.92, 'min_samples_leaf': 88, 'criterion': 'absolute_error', 'max_depth': None, 'min_weight_fraction_leaf': 0.0, 'max_leaf_nodes': 20, 'bootstrap': False, 'ccp_alpha': 0.01}. Best is trial 2774 with value: 0.046571421912873.
[I 2025-04-16 01:51:04,894] Trial 3036 finished with value: -15.00134376128266 and parameters: {'n_estimators': 1332, 'min_samples_split': 14, 'max_features': 0.89, 'min_samples_leaf': 5, 'criterion': 'poisson', 'max_depth': None, 'min_weight_fraction_leaf': 0.0, 'max_leaf_nodes': 20, 'bootstrap': False, 'ccp_alpha': 0.005}. Best is trial 2774 with value: 0.046571421912873.
[I 2025-04-16 01:51:06,177] Trial 3037 finished with value: -0.1936417107583833 and parameters: {'n_estimators': 955, 'min_samples_split': 19, 'max_features': 0.87, 'min_samples_leaf': 8, 'criterion': 'absolute_error', 'max_depth': None, 'min_weight_fraction_leaf': 0.0, 'max_leaf_nodes': 20, 'bootstrap': False, 'ccp_alpha': 0.025}. Best is trial 2774 with value: 0.046571421912873.
[I 2025-04-16 01:51:07,586] Trial 3038 finished with value: -0.1936417107583833 and parameters: {'n_estimators': 1231, 'min_samples_split': 19, 'max_features': 0.91, 'min_samples_leaf': 7, 'criterion': 'absolute_error', 'max_depth': None, 'min_weight_fraction_leaf': 0.0, 'max_leaf_nodes': 20, 'bootstrap': False, 'ccp_alpha': 0.016}. Best is trial 2774 with value: 0.046571421912873.
[I 2025-04-16 01:51:08,974] Trial 3039 finished with value: -7.796561224374733 and parameters: {'n_estimators': 1384, 'min_samples_split': 15, 'max_features': 0.89, 'min_samples_leaf': 5, 'criterion': 'absolute_error', 'max_depth': None, 'min_weight_fraction_leaf': 0.0, 'max_leaf_nodes': 20, 'bootstrap': False, 'ccp_alpha': 0.0}. Best is trial 2774 with value: 0.046571421912873.
[I 2025-04-16 01:51:10,623] Trial 3040 finished with value: -0.1936417107583833 and parameters: {'n_estimators': 1539, 'min_samples_split': 13, 'max_features': 0.92, 'min_samples_leaf': 9, 'criterion': 'absolute_error', 'max_depth': None, 'min_weight_fraction_leaf': 0.0, 'max_leaf_nodes': 20, 'bootstrap': False, 'ccp_alpha': 0.274}. Best is trial 2774 with value: 0.046571421912873.
[I 2025-04-16 01:51:11,733] Trial 3041 finished with value: -0.1936417107583833 and parameters: {'n_estimators': 865, 'min_samples_split': 13, 'max_features': 0.87, 'min_samples_leaf': 5, 'criterion': 'absolute_error', 'max_depth': None, 'min_weight_fraction_leaf': 0.07, 'max_leaf_nodes': 20, 'bootstrap': False, 'ccp_alpha': 0.01}. Best is trial 2774 with value: 0.046571421912873.
[I 2025-04-16 01:51:13,429] Trial 3042 finished with value: -0.1936417107583833 and parameters: {'n_estimators': 1549, 'min_samples_split': 17, 'max_features': 0.9, 'min_samples_leaf': 7, 'criterion': 'absolute_error', 'max_depth': None, 'min_weight_fraction_leaf': 0.0, 'max_leaf_nodes': 20, 'bootstrap': False, 'ccp_alpha': 0.02}. Best is trial 2774 with value: 0.046571421912873.
[I 2025-04-16 01:51:15,163] Trial 3043 finished with value: -0.1936417107583833 and parameters: {'n_estimators': 1684, 'min_samples_split': 13, 'max_features': 0.93, 'min_samples_leaf': 9, 'criterion': 'absolute_error', 'max_depth': None, 'min_weight_fraction_leaf': 0.0, 'max_leaf_nodes': 20, 'bootstrap': False, 'ccp_alpha': 0.005}. Best is trial 2774 with value: 0.046571421912873.
[I 2025-04-16 01:51:16,764] Trial 3044 finished with value: 0.02264138679732408 and parameters: {'n_estimators': 1428, 'min_samples_split': 13, 'max_features': 0.9, 'min_samples_leaf': 5, 'criterion': 'absolute_error', 'max_depth': None, 'min_weight_fraction_leaf': 0.0, 'max_leaf_nodes': 20, 'bootstrap': False, 'ccp_alpha': 0.005}. Best is trial 2774 with value: 0.046571421912873.
[I 2025-04-16 01:51:18,515] Trial 3045 finished with value: -17.528986382276464 and parameters: {'n_estimators': 1619, 'min_samples_split': 12, 'max_features': 0.88, 'min_samples_leaf': 5, 'criterion': 'friedman_mse', 'max_depth': None, 'min_weight_fraction_leaf': 0.0, 'max_leaf_nodes': 20, 'bootstrap': False, 'ccp_alpha': 0.014}. Best is trial 2774 with value: 0.046571421912873.
[I 2025-04-16 01:51:20,245] Trial 3046 finished with value: -0.1936417107583833 and parameters: {'n_estimators': 1571, 'min_samples_split': 11, 'max_features': 0.92, 'min_samples_leaf': 5, 'criterion': 'absolute_error', 'max_depth': None, 'min_weight_fraction_leaf': 0.0, 'max_leaf_nodes': 20, 'bootstrap': False, 'ccp_alpha': 0.01}. Best is trial 2774 with value: 0.046571421912873.
[I 2025-04-16 01:51:21,595] Trial 3047 finished with value: 0.019109812576713115 and parameters: {'n_estimators': 1191, 'min_samples_split': 12, 'max_features': 0.91, 'min_samples_leaf': 5, 'criterion': 'absolute_error', 'max_depth': None, 'min_weight_fraction_leaf': 0.0, 'max_leaf_nodes': None, 'bootstrap': False, 'ccp_alpha': 0.005}. Best is trial 2774 with value: 0.046571421912873.
[I 2025-04-16 01:51:23,058] Trial 3048 finished with value: -11.40347377768787 and parameters: {'n_estimators': 1384, 'min_samples_split': 12, 'max_features': 0.87, 'min_samples_leaf': 5, 'criterion': 'absolute_error', 'max_depth': None, 'min_weight_fraction_leaf': 0.0, 'max_leaf_nodes': 20, 'bootstrap': False, 'ccp_alpha': 0.0}. Best is trial 2774 with value: 0.046571421912873.
[I 2025-04-16 01:51:25,115] Trial 3049 finished with value: -0.1936417107583833 and parameters: {'n_estimators': 1672, 'min_samples_split': 62, 'max_features': 0.93, 'min_samples_leaf': 5, 'criterion': 'absolute_error', 'max_depth': None, 'min_weight_fraction_leaf': 0.0, 'max_leaf_nodes': 20, 'bootstrap': False, 'ccp_alpha': 0.009000000000000001}. Best is trial 2774 with value: 0.046571421912873.
[I 2025-04-16 01:51:27,105] Trial 3050 finished with value: -0.1936417107583833 and parameters: {'n_estimators': 1558, 'min_samples_split': 11, 'max_features': 0.9, 'min_samples_leaf': 5, 'criterion': 'absolute_error', 'max_depth': None, 'min_weight_fraction_leaf': 0.0, 'max_leaf_nodes': 20, 'bootstrap': False, 'ccp_alpha': 0.019}. Best is trial 2774 with value: 0.046571421912873.
[I 2025-04-16 01:51:28,589] Trial 3051 finished with value: -0.1936417107583833 and parameters: {'n_estimators': 1358, 'min_samples_split': 13, 'max_features': 0.89, 'min_samples_leaf': 6, 'criterion': 'absolute_error', 'max_depth': None, 'min_weight_fraction_leaf': 0.0, 'max_leaf_nodes': 20, 'bootstrap': False, 'ccp_alpha': 0.014}. Best is trial 2774 with value: 0.046571421912873.
[I 2025-04-16 01:51:30,282] Trial 3052 finished with value: -0.1936417107583833 and parameters: {'n_estimators': 1808, 'min_samples_split': 117, 'max_features': 0.93, 'min_samples_leaf': 7, 'criterion': 'absolute_error', 'max_depth': None, 'min_weight_fraction_leaf': 0.0, 'max_leaf_nodes': 20, 'bootstrap': False, 'ccp_alpha': 0.0}. Best is trial 2774 with value: 0.046571421912873.
[I 2025-04-16 01:51:32,099] Trial 3053 finished with value: -0.1936417107583833 and parameters: {'n_estimators': 1831, 'min_samples_split': 10, 'max_features': 0.86, 'min_samples_leaf': 5, 'criterion': 'absolute_error', 'max_depth': None, 'min_weight_fraction_leaf': 0.1, 'max_leaf_nodes': 20, 'bootstrap': False, 'ccp_alpha': 0.009000000000000001}. Best is trial 2774 with value: 0.046571421912873.
[I 2025-04-16 01:51:34,225] Trial 3054 finished with value: 0.02116788813189565 and parameters: {'n_estimators': 1977, 'min_samples_split': 15, 'max_features': 0.91, 'min_samples_leaf': 7, 'criterion': 'absolute_error', 'max_depth': None, 'min_weight_fraction_leaf': 0.0, 'max_leaf_nodes': 20, 'bootstrap': False, 'ccp_alpha': 0.005}. Best is trial 2774 with value: 0.046571421912873.
[I 2025-04-16 01:51:36,265] Trial 3055 finished with value: -0.1936417107583833 and parameters: {'n_estimators': 2002, 'min_samples_split': 20, 'max_features': 0.88, 'min_samples_leaf': 52, 'criterion': 'absolute_error', 'max_depth': None, 'min_weight_fraction_leaf': 0.0, 'max_leaf_nodes': 20, 'bootstrap': False, 'ccp_alpha': 0.024}. Best is trial 2774 with value: 0.046571421912873.
[I 2025-04-16 01:51:38,466] Trial 3056 finished with value: -17.528986382276745 and parameters: {'n_estimators': 2087, 'min_samples_split': 19, 'max_features': 0.93, 'min_samples_leaf': 8, 'criterion': 'squared_error', 'max_depth': None, 'min_weight_fraction_leaf': 0.0, 'max_leaf_nodes': 20, 'bootstrap': False, 'ccp_alpha': 0.016}. Best is trial 2774 with value: 0.046571421912873.
[I 2025-04-16 01:51:40,305] Trial 3057 finished with value: -8.677591295591009 and parameters: {'n_estimators': 1760, 'min_samples_split': 18, 'max_features': 0.91, 'min_samples_leaf': 9, 'criterion': 'absolute_error', 'max_depth': None, 'min_weight_fraction_leaf': 0.0, 'max_leaf_nodes': 20, 'bootstrap': False, 'ccp_alpha': 0.0}. Best is trial 2774 with value: 0.046571421912873.
[I 2025-04-16 01:51:42,012] Trial 3058 finished with value: -0.1936417107583833 and parameters: {'n_estimators': 1593, 'min_samples_split': 17, 'max_features': 0.89, 'min_samples_leaf': 9, 'criterion': 'absolute_error', 'max_depth': None, 'min_weight_fraction_leaf': 0.0, 'max_leaf_nodes': 20, 'bootstrap': False, 'ccp_alpha': 0.01}. Best is trial 2774 with value: 0.046571421912873.
[I 2025-04-16 01:51:44,082] Trial 3059 finished with value: -31.894644039628453 and parameters: {'n_estimators': 1871, 'min_samples_split': 16, 'max_features': 0.93, 'min_samples_leaf': 9, 'criterion': 'poisson', 'max_depth': None, 'min_weight_fraction_leaf': 0.0, 'max_leaf_nodes': 20, 'bootstrap': False, 'ccp_alpha': 0.005}. Best is trial 2774 with value: 0.046571421912873.
[I 2025-04-16 01:51:45,578] Trial 3060 finished with value: -0.1936417107583833 and parameters: {'n_estimators': 1305, 'min_samples_split': 16, 'max_features': 0.86, 'min_samples_leaf': 7, 'criterion': 'absolute_error', 'max_depth': None, 'min_weight_fraction_leaf': 0.0, 'max_leaf_nodes': 20, 'bootstrap': False, 'ccp_alpha': 0.013000000000000001}. Best is trial 2774 with value: 0.046571421912873.
