[I 2025-04-16 02:30:15,724] Trial 5022 finished with value: -0.1936417107583833 and parameters: {'n_estimators': 333, 'min_samples_split': 76, 'max_features': 0.81, 'min_samples_leaf': 1, 'criterion': 'absolute_error', 'max_depth': 10, 'min_weight_fraction_leaf': 0.0, 'max_leaf_nodes': 10, 'bootstrap': False, 'ccp_alpha': 0.0}. Best is trial 4539 with value: 0.19155472534689352.
[I 2025-04-16 02:30:17,163] Trial 5023 finished with value: -0.1936417107583833 and parameters: {'n_estimators': 1019, 'min_samples_split': 5, 'max_features': 0.79, 'min_samples_leaf': 7, 'criterion': 'absolute_error', 'max_depth': None, 'min_weight_fraction_leaf': 0.0, 'max_leaf_nodes': 10, 'bootstrap': False, 'ccp_alpha': 0.012}. Best is trial 4539 with value: 0.19155472534689352.
[I 2025-04-16 02:30:23,647] Trial 5024 finished with value: -0.1936417107583833 and parameters: {'n_estimators': 6580, 'min_samples_split': 11, 'max_features': 0.8300000000000001, 'min_samples_leaf': 3, 'criterion': 'absolute_error', 'max_depth': 30, 'min_weight_fraction_leaf': 0.0, 'max_leaf_nodes': 10, 'bootstrap': False, 'ccp_alpha': 0.02}. Best is trial 4539 with value: 0.19155472534689352.
[I 2025-04-16 02:30:24,782] Trial 5025 finished with value: -17.528986382274873 and parameters: {'n_estimators': 570, 'min_samples_split': 2, 'max_features': 0.81, 'min_samples_leaf': 1, 'criterion': 'friedman_mse', 'max_depth': 30, 'min_weight_fraction_leaf': 0.0, 'max_leaf_nodes': 10, 'bootstrap': False, 'ccp_alpha': 0.006}. Best is trial 4539 with value: 0.19155472534689352.
[I 2025-04-16 02:30:25,472] Trial 5026 finished with value: -0.1936417107583833 and parameters: {'n_estimators': 1, 'min_samples_split': 9, 'max_features': 0.85, 'min_samples_leaf': 5, 'criterion': 'absolute_error', 'max_depth': 30, 'min_weight_fraction_leaf': 0.0, 'max_leaf_nodes': 10, 'bootstrap': False, 'ccp_alpha': 0.01}. Best is trial 4539 with value: 0.19155472534689352.
[I 2025-04-16 02:30:26,749] Trial 5027 finished with value: -14.32861227906358 and parameters: {'n_estimators': 831, 'min_samples_split': 6, 'max_features': 0.78, 'min_samples_leaf': 3, 'criterion': 'absolute_error', 'max_depth': 30, 'min_weight_fraction_leaf': 0.04, 'max_leaf_nodes': 10, 'bootstrap': False, 'ccp_alpha': 0.0}. Best is trial 4539 with value: 0.19155472534689352.
[I 2025-04-16 02:30:33,126] Trial 5028 finished with value: -0.1936417107583833 and parameters: {'n_estimators': 6814, 'min_samples_split': 5, 'max_features': 0.8300000000000001, 'min_samples_leaf': 1, 'criterion': 'absolute_error', 'max_depth': 30, 'min_weight_fraction_leaf': 0.0, 'max_leaf_nodes': 10, 'bootstrap': False, 'ccp_alpha': 0.015}. Best is trial 4539 with value: 0.19155472534689352.
[I 2025-04-16 02:30:34,029] Trial 5029 finished with value: -0.1936417107583833 and parameters: {'n_estimators': 306, 'min_samples_split': 2, 'max_features': 0.78, 'min_samples_leaf': 3, 'criterion': 'absolute_error', 'max_depth': 30, 'min_weight_fraction_leaf': 0.0, 'max_leaf_nodes': 10, 'bootstrap': False, 'ccp_alpha': 0.027}. Best is trial 4539 with value: 0.19155472534689352.
[I 2025-04-16 02:30:35,271] Trial 5030 finished with value: -0.1936417107583833 and parameters: {'n_estimators': 657, 'min_samples_split': 9, 'max_features': 0.8, 'min_samples_leaf': 5, 'criterion': 'absolute_error', 'max_depth': 30, 'min_weight_fraction_leaf': 0.0, 'max_leaf_nodes': 10, 'bootstrap': False, 'ccp_alpha': 0.006}. Best is trial 4539 with value: 0.19155472534689352.
[I 2025-04-16 02:30:36,186] Trial 5031 finished with value: -0.1936417107583833 and parameters: {'n_estimators': 378, 'min_samples_split': 97, 'max_features': 0.8200000000000001, 'min_samples_leaf': 1, 'criterion': 'absolute_error', 'max_depth': 30, 'min_weight_fraction_leaf': 0.0, 'max_leaf_nodes': 10, 'bootstrap': False, 'ccp_alpha': 0.0}. Best is trial 4539 with value: 0.19155472534689352.
[I 2025-04-16 02:30:37,749] Trial 5032 finished with value: -17.528986382275775 and parameters: {'n_estimators': 1064, 'min_samples_split': 12, 'max_features': 0.77, 'min_samples_leaf': 7, 'criterion': 'squared_error', 'max_depth': 30, 'min_weight_fraction_leaf': 0.0, 'max_leaf_nodes': 10, 'bootstrap': False, 'ccp_alpha': 0.01}. Best is trial 4539 with value: 0.19155472534689352.
[I 2025-04-16 02:30:39,090] Trial 5033 finished with value: -0.1936417107583833 and parameters: {'n_estimators': 801, 'min_samples_split': 2, 'max_features': 0.79, 'min_samples_leaf': 3, 'criterion': 'absolute_error', 'max_depth': None, 'min_weight_fraction_leaf': 0.0, 'max_leaf_nodes': 10, 'bootstrap': False, 'ccp_alpha': 0.022}. Best is trial 4539 with value: 0.19155472534689352.
[I 2025-04-16 02:30:39,862] Trial 5034 finished with value: -0.1936417107583833 and parameters: {'n_estimators': 175, 'min_samples_split': 6, 'max_features': 0.85, 'min_samples_leaf': 5, 'criterion': 'absolute_error', 'max_depth': 30, 'min_weight_fraction_leaf': 0.0, 'max_leaf_nodes': 10, 'bootstrap': False, 'ccp_alpha': 0.017}. Best is trial 4539 with value: 0.19155472534689352.
[I 2025-04-16 02:30:40,958] Trial 5035 finished with value: -0.1936417107583833 and parameters: {'n_estimators': 497, 'min_samples_split': 15, 'max_features': 0.81, 'min_samples_leaf': 1, 'criterion': 'absolute_error', 'max_depth': 30, 'min_weight_fraction_leaf': 0.0, 'max_leaf_nodes': None, 'bootstrap': False, 'ccp_alpha': 0.006}. Best is trial 4539 with value: 0.19155472534689352.
[I 2025-04-16 02:30:42,086] Trial 5036 finished with value: -0.1936417107583833 and parameters: {'n_estimators': 592, 'min_samples_split': 9, 'max_features': 0.77, 'min_samples_leaf': 3, 'criterion': 'absolute_error', 'max_depth': 30, 'min_weight_fraction_leaf': 0.0, 'max_leaf_nodes': 10, 'bootstrap': False, 'ccp_alpha': 0.013000000000000001}. Best is trial 4539 with value: 0.19155472534689352.
[I 2025-04-16 02:30:43,695] Trial 5037 finished with value: -4.630290330669917 and parameters: {'n_estimators': 1320, 'min_samples_split': 6, 'max_features': 0.8, 'min_samples_leaf': 1, 'criterion': 'absolute_error', 'max_depth': 30, 'min_weight_fraction_leaf': 0.0, 'max_leaf_nodes': 10, 'bootstrap': False, 'ccp_alpha': 0.0}. Best is trial 4539 with value: 0.19155472534689352.
[I 2025-04-16 02:30:44,600] Trial 5038 finished with value: -15.266322162973694 and parameters: {'n_estimators': 316, 'min_samples_split': 2, 'max_features': 0.8300000000000001, 'min_samples_leaf': 5, 'criterion': 'poisson', 'max_depth': 30, 'min_weight_fraction_leaf': 0.0, 'max_leaf_nodes': None, 'bootstrap': False, 'ccp_alpha': 0.006}. Best is trial 4539 with value: 0.19155472534689352.
[I 2025-04-16 02:30:45,979] Trial 5039 finished with value: -0.1936417107583833 and parameters: {'n_estimators': 883, 'min_samples_split': 6, 'max_features': 0.78, 'min_samples_leaf': 3, 'criterion': 'absolute_error', 'max_depth': None, 'min_weight_fraction_leaf': 0.0, 'max_leaf_nodes': 10, 'bootstrap': False, 'ccp_alpha': 0.01}. Best is trial 4539 with value: 0.19155472534689352.
[I 2025-04-16 02:30:47,042] Trial 5040 finished with value: -0.1786224171728476 and parameters: {'n_estimators': 437, 'min_samples_split': 11, 'max_features': 0.85, 'min_samples_leaf': 1, 'criterion': 'absolute_error', 'max_depth': 30, 'min_weight_fraction_leaf': 0.0, 'max_leaf_nodes': 10, 'bootstrap': False, 'ccp_alpha': 0.005}. Best is trial 4539 with value: 0.19155472534689352.
[I 2025-04-16 02:30:47,855] Trial 5041 finished with value: -0.1936417107583833 and parameters: {'n_estimators': 170, 'min_samples_split': 2, 'max_features': 0.81, 'min_samples_leaf': 7, 'criterion': 'absolute_error', 'max_depth': 30, 'min_weight_fraction_leaf': 0.0, 'max_leaf_nodes': None, 'bootstrap': False, 'ccp_alpha': 0.016}. Best is trial 4539 with value: 0.19155472534689352.
[I 2025-04-16 02:30:49,026] Trial 5042 finished with value: -0.1936417107583833 and parameters: {'n_estimators': 678, 'min_samples_split': 87, 'max_features': 0.8300000000000001, 'min_samples_leaf': 3, 'criterion': 'absolute_error', 'max_depth': 30, 'min_weight_fraction_leaf': 0.0, 'max_leaf_nodes': 10, 'bootstrap': False, 'ccp_alpha': 0.0}. Best is trial 4539 with value: 0.19155472534689352.
[I 2025-04-16 02:30:50,668] Trial 5043 finished with value: -0.1936417107583833 and parameters: {'n_estimators': 1150, 'min_samples_split': 6, 'max_features': 0.77, 'min_samples_leaf': 5, 'criterion': 'absolute_error', 'max_depth': 30, 'min_weight_fraction_leaf': 0.0, 'max_leaf_nodes': 10, 'bootstrap': False, 'ccp_alpha': 0.011}. Best is trial 4539 with value: 0.19155472534689352.
[I 2025-04-16 02:30:52,092] Trial 5044 finished with value: -0.17124840312538506 and parameters: {'n_estimators': 923, 'min_samples_split': 15, 'max_features': 0.79, 'min_samples_leaf': 1, 'criterion': 'absolute_error', 'max_depth': 30, 'min_weight_fraction_leaf': 0.0, 'max_leaf_nodes': 10, 'bootstrap': False, 'ccp_alpha': 0.005}. Best is trial 4539 with value: 0.19155472534689352.
[I 2025-04-16 02:30:53,122] Trial 5045 finished with value: -0.1936417107583833 and parameters: {'n_estimators': 441, 'min_samples_split': 9, 'max_features': 0.8200000000000001, 'min_samples_leaf': 3, 'criterion': 'absolute_error', 'max_depth': 30, 'min_weight_fraction_leaf': 0.0, 'max_leaf_nodes': None, 'bootstrap': False, 'ccp_alpha': 0.021}. Best is trial 4539 with value: 0.19155472534689352.
[I 2025-04-16 02:30:53,984] Trial 5046 finished with value: -0.1936417107583833 and parameters: {'n_estimators': 183, 'min_samples_split': 2, 'max_features': 0.85, 'min_samples_leaf': 5, 'criterion': 'absolute_error', 'max_depth': 20, 'min_weight_fraction_leaf': 0.0, 'max_leaf_nodes': 10, 'bootstrap': False, 'ccp_alpha': 0.01}. Best is trial 4539 with value: 0.19155472534689352.
[I 2025-04-16 02:30:55,271] Trial 5047 finished with value: -17.528986382274862 and parameters: {'n_estimators': 719, 'min_samples_split': 6, 'max_features': 0.77, 'min_samples_leaf': 1, 'criterion': 'friedman_mse', 'max_depth': 45, 'min_weight_fraction_leaf': 0.0, 'max_leaf_nodes': None, 'bootstrap': False, 'ccp_alpha': 0.19}. Best is trial 4539 with value: 0.19155472534689352.
[I 2025-04-16 02:30:56,373] Trial 5048 finished with value: -0.1936417107583833 and parameters: {'n_estimators': 550, 'min_samples_split': 122, 'max_features': 0.8, 'min_samples_leaf': 3, 'criterion': 'absolute_error', 'max_depth': 30, 'min_weight_fraction_leaf': 0.0, 'max_leaf_nodes': 10, 'bootstrap': False, 'ccp_alpha': 0.14}. Best is trial 4539 with value: 0.19155472534689352.
[I 2025-04-16 02:30:57,278] Trial 5049 finished with value: -0.1936417107583833 and parameters: {'n_estimators': 319, 'min_samples_split': 12, 'max_features': 0.79, 'min_samples_leaf': 7, 'criterion': 'absolute_error', 'max_depth': 30, 'min_weight_fraction_leaf': 0.0, 'max_leaf_nodes': 10, 'bootstrap': False, 'ccp_alpha': 0.21}. Best is trial 4539 with value: 0.19155472534689352.
[I 2025-04-16 02:30:58,739] Trial 5050 finished with value: -15.479212253155088 and parameters: {'n_estimators': 1045, 'min_samples_split': 6, 'max_features': 0.8200000000000001, 'min_samples_leaf': 1, 'criterion': 'absolute_error', 'max_depth': 30, 'min_weight_fraction_leaf': 0.0, 'max_leaf_nodes': None, 'bootstrap': False, 'ccp_alpha': 0.0}. Best is trial 4539 with value: 0.19155472534689352.
[I 2025-04-16 02:31:00,005] Trial 5051 finished with value: -0.1936417107583833 and parameters: {'n_estimators': 756, 'min_samples_split': 2, 'max_features': 0.8400000000000001, 'min_samples_leaf': 4, 'criterion': 'absolute_error', 'max_depth': 30, 'min_weight_fraction_leaf': 0.0, 'max_leaf_nodes': 10, 'bootstrap': False, 'ccp_alpha': 0.016}. Best is trial 4539 with value: 0.19155472534689352.
[I 2025-04-16 02:31:01,084] Trial 5052 finished with value: -0.1936417107583833 and parameters: {'n_estimators': 487, 'min_samples_split': 9, 'max_features': 0.77, 'min_samples_leaf': 3, 'criterion': 'absolute_error', 'max_depth': 30, 'min_weight_fraction_leaf': 0.0, 'max_leaf_nodes': 10, 'bootstrap': False, 'ccp_alpha': 0.006}. Best is trial 4539 with value: 0.19155472534689352.
[I 2025-04-16 02:31:01,934] Trial 5053 finished with value: -0.1936417107583833 and parameters: {'n_estimators': 213, 'min_samples_split': 5, 'max_features': 0.81, 'min_samples_leaf': 1, 'criterion': 'absolute_error', 'max_depth': None, 'min_weight_fraction_leaf': 0.0, 'max_leaf_nodes': None, 'bootstrap': False, 'ccp_alpha': 0.01}. Best is trial 4539 with value: 0.19155472534689352.
[I 2025-04-16 02:31:03,062] Trial 5054 finished with value: -9.718902459918121 and parameters: {'n_estimators': 601, 'min_samples_split': 9, 'max_features': 0.77, 'min_samples_leaf': 5, 'criterion': 'absolute_error', 'max_depth': 10, 'min_weight_fraction_leaf': 0.0, 'max_leaf_nodes': 10, 'bootstrap': False, 'ccp_alpha': 0.0}. Best is trial 4539 with value: 0.19155472534689352.
[I 2025-04-16 02:31:04,560] Trial 5055 finished with value: -0.009564911634329376 and parameters: {'n_estimators': 872, 'min_samples_split': 2, 'max_features': 0.8, 'min_samples_leaf': 3, 'criterion': 'absolute_error', 'max_depth': 30, 'min_weight_fraction_leaf': 0.0, 'max_leaf_nodes': None, 'bootstrap': False, 'ccp_alpha': 0.006}. Best is trial 4539 with value: 0.19155472534689352.
[I 2025-04-16 02:31:05,205] Trial 5056 finished with value: -0.1936417107583833 and parameters: {'n_estimators': 7, 'min_samples_split': 15, 'max_features': 0.85, 'min_samples_leaf': 1, 'criterion': 'absolute_error', 'max_depth': None, 'min_weight_fraction_leaf': 0.0, 'max_leaf_nodes': 10, 'bootstrap': False, 'ccp_alpha': 0.015}. Best is trial 4539 with value: 0.19155472534689352.
[I 2025-04-16 02:31:06,117] Trial 5057 finished with value: -17.528986382274873 and parameters: {'n_estimators': 353, 'min_samples_split': 6, 'max_features': 0.8300000000000001, 'min_samples_leaf': 6, 'criterion': 'squared_error', 'max_depth': 15, 'min_weight_fraction_leaf': 0.0, 'max_leaf_nodes': 300, 'bootstrap': False, 'ccp_alpha': 0.027}. Best is trial 4539 with value: 0.19155472534689352.
