[I 2025-04-16 00:36:43,915] Trial 1655 finished with value: -0.1936417107583833 and parameters: {'n_estimators': 4014, 'min_samples_split': 12, 'max_features': 0.9600000000000001, 'min_samples_leaf': 15, 'criterion': 'absolute_error', 'max_depth': 60, 'min_weight_fraction_leaf': 0.01, 'max_leaf_nodes': 150, 'bootstrap': False, 'ccp_alpha': 0.01}. Best is trial 1439 with value: -0.15896829431478016.
[I 2025-04-16 00:36:47,935] Trial 1656 finished with value: -0.15914209720821287 and parameters: {'n_estimators': 4571, 'min_samples_split': 25, 'max_features': 0.92, 'min_samples_leaf': 13, 'criterion': 'absolute_error', 'max_depth': 60, 'min_weight_fraction_leaf': 0.0, 'max_leaf_nodes': 150, 'bootstrap': False, 'ccp_alpha': 0.0}. Best is trial 1439 with value: -0.15896829431478016.
[I 2025-04-16 00:36:51,144] Trial 1657 finished with value: -0.1936417107583833 and parameters: {'n_estimators': 3678, 'min_samples_split': 16, 'max_features': 0.97, 'min_samples_leaf': 10, 'criterion': 'absolute_error', 'max_depth': 60, 'min_weight_fraction_leaf': 0.01, 'max_leaf_nodes': 150, 'bootstrap': False, 'ccp_alpha': 0.006}. Best is trial 1439 with value: -0.15896829431478016.
[I 2025-04-16 00:36:54,674] Trial 1658 finished with value: -0.19364227138125156 and parameters: {'n_estimators': 4179, 'min_samples_split': 21, 'max_features': 0.9400000000000001, 'min_samples_leaf': 18, 'criterion': 'absolute_error', 'max_depth': 60, 'min_weight_fraction_leaf': 0.01, 'max_leaf_nodes': 150, 'bootstrap': False, 'ccp_alpha': 0.0}. Best is trial 1439 with value: -0.15896829431478016.
[I 2025-04-16 00:36:58,102] Trial 1659 finished with value: -0.1936417107583833 and parameters: {'n_estimators': 3885, 'min_samples_split': 9, 'max_features': 0.99, 'min_samples_leaf': 14, 'criterion': 'absolute_error', 'max_depth': 60, 'min_weight_fraction_leaf': 0.01, 'max_leaf_nodes': 150, 'bootstrap': False, 'ccp_alpha': 0.016}. Best is trial 1439 with value: -0.15896829431478016.
[I 2025-04-16 00:37:01,797] Trial 1660 finished with value: -17.528986382273413 and parameters: {'n_estimators': 4373, 'min_samples_split': 13, 'max_features': 0.9600000000000001, 'min_samples_leaf': 16, 'criterion': 'friedman_mse', 'max_depth': 60, 'min_weight_fraction_leaf': 0.01, 'max_leaf_nodes': 150, 'bootstrap': False, 'ccp_alpha': 0.006}. Best is trial 1439 with value: -0.15896829431478016.
[I 2025-04-16 00:37:05,695] Trial 1661 finished with value: -0.1936417107583833 and parameters: {'n_estimators': 4076, 'min_samples_split': 17, 'max_features': 0.92, 'min_samples_leaf': 12, 'criterion': 'absolute_error', 'max_depth': 60, 'min_weight_fraction_leaf': 0.01, 'max_leaf_nodes': 150, 'bootstrap': False, 'ccp_alpha': 0.01}. Best is trial 1439 with value: -0.15896829431478016.
[I 2025-04-16 00:37:08,842] Trial 1662 finished with value: -8.76805394151316 and parameters: {'n_estimators': 3902, 'min_samples_split': 9, 'max_features': 0.98, 'min_samples_leaf': 10, 'criterion': 'absolute_error', 'max_depth': 60, 'min_weight_fraction_leaf': 0.01, 'max_leaf_nodes': 150, 'bootstrap': False, 'ccp_alpha': 0.0}. Best is trial 1439 with value: -0.15896829431478016.
[I 2025-04-16 00:37:12,155] Trial 1663 finished with value: -0.1936417107583833 and parameters: {'n_estimators': 3677, 'min_samples_split': 21, 'max_features': 0.9400000000000001, 'min_samples_leaf': 13, 'criterion': 'absolute_error', 'max_depth': 60, 'min_weight_fraction_leaf': 0.01, 'max_leaf_nodes': 150, 'bootstrap': False, 'ccp_alpha': 0.005}. Best is trial 1439 with value: -0.15896829431478016.
[I 2025-04-16 00:37:16,051] Trial 1664 finished with value: -0.1936417107583833 and parameters: {'n_estimators': 4263, 'min_samples_split': 13, 'max_features': 0.9600000000000001, 'min_samples_leaf': 16, 'criterion': 'absolute_error', 'max_depth': 60, 'min_weight_fraction_leaf': 0.01, 'max_leaf_nodes': 150, 'bootstrap': False, 'ccp_alpha': 0.01}. Best is trial 1439 with value: -0.15896829431478016.
[I 2025-04-16 00:37:19,781] Trial 1665 finished with value: -0.1936417107583833 and parameters: {'n_estimators': 4082, 'min_samples_split': 18, 'max_features': 1.0, 'min_samples_leaf': 11, 'criterion': 'absolute_error', 'max_depth': 60, 'min_weight_fraction_leaf': 0.0, 'max_leaf_nodes': 150, 'bootstrap': False, 'ccp_alpha': 0.005}. Best is trial 1439 with value: -0.15896829431478016.
[I 2025-04-16 00:37:23,857] Trial 1666 finished with value: -0.1936417107583833 and parameters: {'n_estimators': 4551, 'min_samples_split': 25, 'max_features': 0.9400000000000001, 'min_samples_leaf': 14, 'criterion': 'absolute_error', 'max_depth': 60, 'min_weight_fraction_leaf': 0.01, 'max_leaf_nodes': 150, 'bootstrap': False, 'ccp_alpha': 0.015}. Best is trial 1439 with value: -0.15896829431478016.
[I 2025-04-16 00:37:26,852] Trial 1667 finished with value: -0.19364227077154178 and parameters: {'n_estimators': 3873, 'min_samples_split': 15, 'max_features': 0.97, 'min_samples_leaf': 18, 'criterion': 'absolute_error', 'max_depth': 60, 'min_weight_fraction_leaf': 0.01, 'max_leaf_nodes': 150, 'bootstrap': False, 'ccp_alpha': 0.0}. Best is trial 1439 with value: -0.15896829431478016.
[I 2025-04-16 00:37:30,431] Trial 1668 finished with value: -0.1936417107583833 and parameters: {'n_estimators': 4322, 'min_samples_split': 9, 'max_features': 0.9500000000000001, 'min_samples_leaf': 12, 'criterion': 'absolute_error', 'max_depth': 60, 'min_weight_fraction_leaf': 0.01, 'max_leaf_nodes': 150, 'bootstrap': False, 'ccp_alpha': 0.006}. Best is trial 1439 with value: -0.15896829431478016.
[I 2025-04-16 00:37:34,016] Trial 1669 finished with value: -17.528986382273942 and parameters: {'n_estimators': 4079, 'min_samples_split': 21, 'max_features': 0.92, 'min_samples_leaf': 15, 'criterion': 'squared_error', 'max_depth': 60, 'min_weight_fraction_leaf': 0.01, 'max_leaf_nodes': 150, 'bootstrap': False, 'ccp_alpha': 0.01}. Best is trial 1439 with value: -0.15896829431478016.
[I 2025-04-16 00:37:37,063] Trial 1670 finished with value: -8.762336348130253 and parameters: {'n_estimators': 3654, 'min_samples_split': 12, 'max_features': 0.98, 'min_samples_leaf': 10, 'criterion': 'absolute_error', 'max_depth': 60, 'min_weight_fraction_leaf': 0.01, 'max_leaf_nodes': 150, 'bootstrap': False, 'ccp_alpha': 0.0}. Best is trial 1439 with value: -0.15896829431478016.
[I 2025-04-16 00:37:40,633] Trial 1671 finished with value: -0.1936417107583833 and parameters: {'n_estimators': 3855, 'min_samples_split': 17, 'max_features': 0.9500000000000001, 'min_samples_leaf': 14, 'criterion': 'absolute_error', 'max_depth': 60, 'min_weight_fraction_leaf': 0.01, 'max_leaf_nodes': 150, 'bootstrap': False, 'ccp_alpha': 0.015}. Best is trial 1439 with value: -0.15896829431478016.
[I 2025-04-16 00:37:44,547] Trial 1672 finished with value: -0.1936417107583833 and parameters: {'n_estimators': 4204, 'min_samples_split': 26, 'max_features': 0.92, 'min_samples_leaf': 12, 'criterion': 'absolute_error', 'max_depth': 60, 'min_weight_fraction_leaf': 0.01, 'max_leaf_nodes': 150, 'bootstrap': False, 'ccp_alpha': 0.005}. Best is trial 1439 with value: -0.15896829431478016.
[I 2025-04-16 00:37:47,965] Trial 1673 finished with value: -0.1936157213207966 and parameters: {'n_estimators': 3974, 'min_samples_split': 19, 'max_features': 0.97, 'min_samples_leaf': 16, 'criterion': 'absolute_error', 'max_depth': 60, 'min_weight_fraction_leaf': 0.0, 'max_leaf_nodes': 150, 'bootstrap': False, 'ccp_alpha': 0.0}. Best is trial 1439 with value: -0.15896829431478016.
[I 2025-04-16 00:37:52,146] Trial 1674 finished with value: -0.1936417107583833 and parameters: {'n_estimators': 4533, 'min_samples_split': 13, 'max_features': 0.99, 'min_samples_leaf': 10, 'criterion': 'absolute_error', 'max_depth': 60, 'min_weight_fraction_leaf': 0.01, 'max_leaf_nodes': 150, 'bootstrap': False, 'ccp_alpha': 0.01}. Best is trial 1439 with value: -0.15896829431478016.
[I 2025-04-16 00:37:55,630] Trial 1675 finished with value: -31.249946054119487 and parameters: {'n_estimators': 3689, 'min_samples_split': 8, 'max_features': 0.9400000000000001, 'min_samples_leaf': 13, 'criterion': 'poisson', 'max_depth': 60, 'min_weight_fraction_leaf': 0.01, 'max_leaf_nodes': 150, 'bootstrap': False, 'ccp_alpha': 0.005}. Best is trial 1439 with value: -0.15896829431478016.
[I 2025-04-16 00:37:59,244] Trial 1676 finished with value: -0.1936417107583833 and parameters: {'n_estimators': 4271, 'min_samples_split': 23, 'max_features': 0.9600000000000001, 'min_samples_leaf': 18, 'criterion': 'absolute_error', 'max_depth': 60, 'min_weight_fraction_leaf': 0.01, 'max_leaf_nodes': 150, 'bootstrap': False, 'ccp_alpha': 0.017}. Best is trial 1439 with value: -0.15896829431478016.
[I 2025-04-16 00:38:02,905] Trial 1677 finished with value: -0.1936417107583833 and parameters: {'n_estimators': 3998, 'min_samples_split': 14, 'max_features': 0.93, 'min_samples_leaf': 14, 'criterion': 'absolute_error', 'max_depth': 60, 'min_weight_fraction_leaf': 0.01, 'max_leaf_nodes': 150, 'bootstrap': False, 'ccp_alpha': 0.01}. Best is trial 1439 with value: -0.15896829431478016.
[I 2025-04-16 00:38:06,015] Trial 1678 finished with value: -10.698555452318455 and parameters: {'n_estimators': 3856, 'min_samples_split': 17, 'max_features': 1.0, 'min_samples_leaf': 11, 'criterion': 'absolute_error', 'max_depth': 60, 'min_weight_fraction_leaf': 0.01, 'max_leaf_nodes': 150, 'bootstrap': False, 'ccp_alpha': 0.0}. Best is trial 1439 with value: -0.15896829431478016.
[I 2025-04-16 00:38:10,098] Trial 1679 finished with value: -0.1936417107583833 and parameters: {'n_estimators': 4409, 'min_samples_split': 8, 'max_features': 0.9600000000000001, 'min_samples_leaf': 17, 'criterion': 'absolute_error', 'max_depth': 60, 'min_weight_fraction_leaf': 0.01, 'max_leaf_nodes': 150, 'bootstrap': False, 'ccp_alpha': 0.007}. Best is trial 1439 with value: -0.15896829431478016.
[I 2025-04-16 00:38:13,044] Trial 1680 finished with value: -8.784186870313212 and parameters: {'n_estimators': 4104, 'min_samples_split': 21, 'max_features': 0.93, 'min_samples_leaf': 12, 'criterion': 'absolute_error', 'max_depth': 60, 'min_weight_fraction_leaf': 0.01, 'max_leaf_nodes': 150, 'bootstrap': False, 'ccp_alpha': 0.0}. Best is trial 1439 with value: -0.15896829431478016.
[I 2025-04-16 00:38:16,240] Trial 1681 finished with value: -0.1936417107583833 and parameters: {'n_estimators': 3793, 'min_samples_split': 11, 'max_features': 0.98, 'min_samples_leaf': 15, 'criterion': 'absolute_error', 'max_depth': 60, 'min_weight_fraction_leaf': 0.0, 'max_leaf_nodes': 150, 'bootstrap': False, 'ccp_alpha': 0.011}. Best is trial 1439 with value: -0.15896829431478016.
[I 2025-04-16 00:38:20,153] Trial 1682 finished with value: -0.1936417107583833 and parameters: {'n_estimators': 3650, 'min_samples_split': 16, 'max_features': 0.9500000000000001, 'min_samples_leaf': 13, 'criterion': 'absolute_error', 'max_depth': 60, 'min_weight_fraction_leaf': 0.01, 'max_leaf_nodes': 150, 'bootstrap': False, 'ccp_alpha': 0.005}. Best is trial 1439 with value: -0.15896829431478016.
[I 2025-04-16 00:38:24,339] Trial 1683 finished with value: -0.1936417107583833 and parameters: {'n_estimators': 4184, 'min_samples_split': 26, 'max_features': 0.92, 'min_samples_leaf': 10, 'criterion': 'absolute_error', 'max_depth': 60, 'min_weight_fraction_leaf': 0.01, 'max_leaf_nodes': 150, 'bootstrap': False, 'ccp_alpha': 0.005}. Best is trial 1439 with value: -0.15896829431478016.
[I 2025-04-16 00:38:27,887] Trial 1684 finished with value: -0.1936417107583833 and parameters: {'n_estimators': 4351, 'min_samples_split': 19, 'max_features': 0.97, 'min_samples_leaf': 16, 'criterion': 'absolute_error', 'max_depth': 60, 'min_weight_fraction_leaf': 0.01, 'max_leaf_nodes': 150, 'bootstrap': False, 'ccp_alpha': 0.016}. Best is trial 1439 with value: -0.15896829431478016.
[I 2025-04-16 00:38:31,063] Trial 1685 finished with value: -0.1936417107583833 and parameters: {'n_estimators': 3986, 'min_samples_split': 12, 'max_features': 0.9400000000000001, 'min_samples_leaf': 14, 'criterion': 'absolute_error', 'max_depth': 60, 'min_weight_fraction_leaf': 0.01, 'max_leaf_nodes': 150, 'bootstrap': False, 'ccp_alpha': 0.005}. Best is trial 1439 with value: -0.15896829431478016.
[I 2025-04-16 00:38:34,467] Trial 1686 finished with value: -8.773074090242272 and parameters: {'n_estimators': 4140, 'min_samples_split': 8, 'max_features': 0.98, 'min_samples_leaf': 10, 'criterion': 'absolute_error', 'max_depth': 60, 'min_weight_fraction_leaf': 0.01, 'max_leaf_nodes': 150, 'bootstrap': False, 'ccp_alpha': 0.0}. Best is trial 1439 with value: -0.15896829431478016.
[I 2025-04-16 00:38:37,954] Trial 1687 finished with value: -17.52898638227436 and parameters: {'n_estimators': 3875, 'min_samples_split': 22, 'max_features': 0.9500000000000001, 'min_samples_leaf': 12, 'criterion': 'friedman_mse', 'max_depth': 60, 'min_weight_fraction_leaf': 0.01, 'max_leaf_nodes': 150, 'bootstrap': False, 'ccp_alpha': 0.011}. Best is trial 1439 with value: -0.15896829431478016.
[I 2025-04-16 00:38:42,107] Trial 1688 finished with value: -0.19361583921811473 and parameters: {'n_estimators': 4569, 'min_samples_split': 16, 'max_features': 0.92, 'min_samples_leaf': 16, 'criterion': 'absolute_error', 'max_depth': 60, 'min_weight_fraction_leaf': 0.0, 'max_leaf_nodes': 150, 'bootstrap': False, 'ccp_alpha': 0.0}. Best is trial 1439 with value: -0.15896829431478016.
[I 2025-04-16 00:38:45,406] Trial 1689 finished with value: -0.1936417107583833 and parameters: {'n_estimators': 3662, 'min_samples_split': 14, 'max_features': 1.0, 'min_samples_leaf': 14, 'criterion': 'absolute_error', 'max_depth': 60, 'min_weight_fraction_leaf': 0.01, 'max_leaf_nodes': 150, 'bootstrap': False, 'ccp_alpha': 0.01}. Best is trial 1439 with value: -0.15896829431478016.
[I 2025-04-16 00:38:49,420] Trial 1690 finished with value: -0.1936417107583833 and parameters: {'n_estimators': 4338, 'min_samples_split': 19, 'max_features': 0.9600000000000001, 'min_samples_leaf': 18, 'criterion': 'absolute_error', 'max_depth': 60, 'min_weight_fraction_leaf': 0.01, 'max_leaf_nodes': 150, 'bootstrap': False, 'ccp_alpha': 0.016}. Best is trial 1439 with value: -0.15896829431478016.
[I 2025-04-16 00:38:52,882] Trial 1691 finished with value: -0.1936417107583833 and parameters: {'n_estimators': 4042, 'min_samples_split': 10, 'max_features': 0.9400000000000001, 'min_samples_leaf': 12, 'criterion': 'absolute_error', 'max_depth': 60, 'min_weight_fraction_leaf': 0.01, 'max_leaf_nodes': 150, 'bootstrap': False, 'ccp_alpha': 0.005}. Best is trial 1439 with value: -0.15896829431478016.
[I 2025-04-16 00:38:55,961] Trial 1692 finished with value: -8.770807687702732 and parameters: {'n_estimators': 3846, 'min_samples_split': 16, 'max_features': 0.97, 'min_samples_leaf': 10, 'criterion': 'absolute_error', 'max_depth': 60, 'min_weight_fraction_leaf': 0.01, 'max_leaf_nodes': 150, 'bootstrap': False, 'ccp_alpha': 0.0}. Best is trial 1439 with value: -0.15896829431478016.
[I 2025-04-16 00:38:59,312] Trial 1693 finished with value: -17.52898638227374 and parameters: {'n_estimators': 4186, 'min_samples_split': 25, 'max_features': 0.92, 'min_samples_leaf': 15, 'criterion': 'squared_error', 'max_depth': 60, 'min_weight_fraction_leaf': 0.01, 'max_leaf_nodes': 150, 'bootstrap': False, 'ccp_alpha': 0.006}. Best is trial 1439 with value: -0.15896829431478016.
[I 2025-04-16 00:39:03,681] Trial 1694 finished with value: -0.1936417107583833 and parameters: {'n_estimators': 4479, 'min_samples_split': 12, 'max_features': 0.98, 'min_samples_leaf': 12, 'criterion': 'absolute_error', 'max_depth': 60, 'min_weight_fraction_leaf': 0.0, 'max_leaf_nodes': 150, 'bootstrap': False, 'ccp_alpha': 0.011}. Best is trial 1439 with value: -0.15896829431478016.
[I 2025-04-16 00:39:06,799] Trial 1695 finished with value: -0.19362130356435397 and parameters: {'n_estimators': 3660, 'min_samples_split': 7, 'max_features': 0.9500000000000001, 'min_samples_leaf': 14, 'criterion': 'absolute_error', 'max_depth': 60, 'min_weight_fraction_leaf': 0.01, 'max_leaf_nodes': 150, 'bootstrap': False, 'ccp_alpha': 0.0}. Best is trial 1439 with value: -0.15896829431478016.
[I 2025-04-16 00:39:10,265] Trial 1696 finished with value: -0.1936417107583833 and parameters: {'n_estimators': 4003, 'min_samples_split': 22, 'max_features': 0.9600000000000001, 'min_samples_leaf': 10, 'criterion': 'absolute_error', 'max_depth': 60, 'min_weight_fraction_leaf': 0.01, 'max_leaf_nodes': 150, 'bootstrap': False, 'ccp_alpha': 0.006}. Best is trial 1439 with value: -0.15896829431478016.
[I 2025-04-16 00:39:13,834] Trial 1697 finished with value: -0.1936417107583833 and parameters: {'n_estimators': 4233, 'min_samples_split': 19, 'max_features': 0.92, 'min_samples_leaf': 16, 'criterion': 'absolute_error', 'max_depth': 60, 'min_weight_fraction_leaf': 0.01, 'max_leaf_nodes': 150, 'bootstrap': False, 'ccp_alpha': 0.016}. Best is trial 1439 with value: -0.15896829431478016.
[I 2025-04-16 00:39:17,005] Trial 1698 finished with value: -0.1936417107583833 and parameters: {'n_estimators': 3829, 'min_samples_split': 15, 'max_features': 0.99, 'min_samples_leaf': 13, 'criterion': 'absolute_error', 'max_depth': 60, 'min_weight_fraction_leaf': 0.09, 'max_leaf_nodes': 150, 'bootstrap': False, 'ccp_alpha': 0.01}. Best is trial 1439 with value: -0.15896829431478016.
[I 2025-04-16 00:39:19,919] Trial 1699 finished with value: -21.59258210526653 and parameters: {'n_estimators': 3641, 'min_samples_split': 11, 'max_features': 0.9400000000000001, 'min_samples_leaf': 19, 'criterion': 'poisson', 'max_depth': 60, 'min_weight_fraction_leaf': 0.01, 'max_leaf_nodes': 150, 'bootstrap': False, 'ccp_alpha': 0.0}. Best is trial 1439 with value: -0.15896829431478016.
[I 2025-04-16 00:39:23,731] Trial 1700 finished with value: -0.1936417107583833 and parameters: {'n_estimators': 4029, 'min_samples_split': 22, 'max_features': 0.97, 'min_samples_leaf': 11, 'criterion': 'absolute_error', 'max_depth': 60, 'min_weight_fraction_leaf': 0.01, 'max_leaf_nodes': 150, 'bootstrap': False, 'ccp_alpha': 0.005}. Best is trial 1439 with value: -0.15896829431478016.
[I 2025-04-16 00:39:27,459] Trial 1701 finished with value: -0.1936417107583833 and parameters: {'n_estimators': 4285, 'min_samples_split': 7, 'max_features': 0.91, 'min_samples_leaf': 17, 'criterion': 'absolute_error', 'max_depth': 60, 'min_weight_fraction_leaf': 0.01, 'max_leaf_nodes': 150, 'bootstrap': False, 'ccp_alpha': 0.011}. Best is trial 1439 with value: -0.15896829431478016.
[I 2025-04-16 00:39:31,281] Trial 1702 finished with value: -0.1936417107583833 and parameters: {'n_estimators': 4542, 'min_samples_split': 17, 'max_features': 0.9400000000000001, 'min_samples_leaf': 14, 'criterion': 'absolute_error', 'max_depth': 60, 'min_weight_fraction_leaf': 0.0, 'max_leaf_nodes': 150, 'bootstrap': False, 'ccp_alpha': 0.005}. Best is trial 1439 with value: -0.15896829431478016.
[I 2025-04-16 00:39:34,639] Trial 1703 finished with value: -0.1936417107583833 and parameters: {'n_estimators': 3907, 'min_samples_split': 13, 'max_features': 1.0, 'min_samples_leaf': 12, 'criterion': 'absolute_error', 'max_depth': 60, 'min_weight_fraction_leaf': 0.01, 'max_leaf_nodes': 150, 'bootstrap': False, 'ccp_alpha': 0.018000000000000002}. Best is trial 1439 with value: -0.15896829431478016.
[I 2025-04-16 00:39:37,953] Trial 1704 finished with value: -8.805758211002203 and parameters: {'n_estimators': 4121, 'min_samples_split': 27, 'max_features': 0.9600000000000001, 'min_samples_leaf': 10, 'criterion': 'absolute_error', 'max_depth': 60, 'min_weight_fraction_leaf': 0.01, 'max_leaf_nodes': 150, 'bootstrap': False, 'ccp_alpha': 0.0}. Best is trial 1439 with value: -0.15896829431478016.
[I 2025-04-16 00:39:41,905] Trial 1705 finished with value: -0.1936417107583833 and parameters: {'n_estimators': 4399, 'min_samples_split': 19, 'max_features': 0.98, 'min_samples_leaf': 15, 'criterion': 'absolute_error', 'max_depth': 60, 'min_weight_fraction_leaf': 0.01, 'max_leaf_nodes': 150, 'bootstrap': False, 'ccp_alpha': 0.006}. Best is trial 1439 with value: -0.15896829431478016.
[I 2025-04-16 00:39:45,483] Trial 1706 finished with value: -0.1936417107583833 and parameters: {'n_estimators': 3851, 'min_samples_split': 11, 'max_features': 0.93, 'min_samples_leaf': 13, 'criterion': 'absolute_error', 'max_depth': 60, 'min_weight_fraction_leaf': 0.01, 'max_leaf_nodes': 150, 'bootstrap': False, 'ccp_alpha': 0.011}. Best is trial 1439 with value: -0.15896829431478016.
[I 2025-04-16 00:39:48,856] Trial 1707 finished with value: -0.1936421867356163 and parameters: {'n_estimators': 4140, 'min_samples_split': 15, 'max_features': 0.9500000000000001, 'min_samples_leaf': 17, 'criterion': 'absolute_error', 'max_depth': 60, 'min_weight_fraction_leaf': 0.01, 'max_leaf_nodes': 150, 'bootstrap': False, 'ccp_alpha': 0.0}. Best is trial 1439 with value: -0.15896829431478016.
[I 2025-04-16 00:39:52,649] Trial 1708 finished with value: -17.528986382274482 and parameters: {'n_estimators': 3820, 'min_samples_split': 24, 'max_features': 0.92, 'min_samples_leaf': 10, 'criterion': 'friedman_mse', 'max_depth': 60, 'min_weight_fraction_leaf': 0.01, 'max_leaf_nodes': 150, 'bootstrap': False, 'ccp_alpha': 0.006}. Best is trial 1439 with value: -0.15896829431478016.
[I 2025-04-16 00:39:56,625] Trial 1709 finished with value: -0.1936417107583833 and parameters: {'n_estimators': 4617, 'min_samples_split': 20, 'max_features': 0.98, 'min_samples_leaf': 12, 'criterion': 'absolute_error', 'max_depth': 60, 'min_weight_fraction_leaf': 0.01, 'max_leaf_nodes': 150, 'bootstrap': False, 'ccp_alpha': 0.016}. Best is trial 1439 with value: -0.15896829431478016.
