[I 2025-04-16 00:53:20,775] Trial 1932 finished with value: -0.1936417107583833 and parameters: {'n_estimators': 3581, 'min_samples_split': 9, 'max_features': 0.9500000000000001, 'min_samples_leaf': 15, 'criterion': 'absolute_error', 'max_depth': 60, 'min_weight_fraction_leaf': 0.01, 'max_leaf_nodes': 150, 'bootstrap': False, 'ccp_alpha': 0.005}. Best is trial 1828 with value: -0.15292978335836716.
[I 2025-04-16 00:53:24,160] Trial 1933 finished with value: -0.1936417107583833 and parameters: {'n_estimators': 4070, 'min_samples_split': 16, 'max_features': 0.91, 'min_samples_leaf': 8, 'criterion': 'absolute_error', 'max_depth': 10, 'min_weight_fraction_leaf': 0.01, 'max_leaf_nodes': 150, 'bootstrap': False, 'ccp_alpha': 0.01}. Best is trial 1828 with value: -0.15292978335836716.
[I 2025-04-16 00:53:27,858] Trial 1934 finished with value: -0.1936417107583833 and parameters: {'n_estimators': 4181, 'min_samples_split': 25, 'max_features': 1.0, 'min_samples_leaf': 19, 'criterion': 'absolute_error', 'max_depth': 60, 'min_weight_fraction_leaf': 0.01, 'max_leaf_nodes': 150, 'bootstrap': False, 'ccp_alpha': 0.02}. Best is trial 1828 with value: -0.15292978335836716.
[I 2025-04-16 00:53:30,935] Trial 1935 finished with value: -35.91042164600324 and parameters: {'n_estimators': 3728, 'min_samples_split': 13, 'max_features': 0.97, 'min_samples_leaf': 13, 'criterion': 'squared_error', 'max_depth': 60, 'min_weight_fraction_leaf': 0.0, 'max_leaf_nodes': 150, 'bootstrap': False, 'ccp_alpha': 0.0}. Best is trial 1828 with value: -0.15292978335836716.
[I 2025-04-16 00:53:34,360] Trial 1936 finished with value: -0.1936417107583833 and parameters: {'n_estimators': 3959, 'min_samples_split': 20, 'max_features': 0.93, 'min_samples_leaf': 11, 'criterion': 'absolute_error', 'max_depth': 60, 'min_weight_fraction_leaf': 0.01, 'max_leaf_nodes': 150, 'bootstrap': False, 'ccp_alpha': 0.005}. Best is trial 1828 with value: -0.15292978335836716.
[I 2025-04-16 00:53:38,597] Trial 1937 finished with value: -0.1936417107583833 and parameters: {'n_estimators': 4351, 'min_samples_split': 5, 'max_features': 0.9500000000000001, 'min_samples_leaf': 15, 'criterion': 'absolute_error', 'max_depth': 60, 'min_weight_fraction_leaf': 0.01, 'max_leaf_nodes': 150, 'bootstrap': False, 'ccp_alpha': 0.013000000000000001}. Best is trial 1828 with value: -0.15292978335836716.
[I 2025-04-16 00:53:42,751] Trial 1938 finished with value: -8.786524700869878 and parameters: {'n_estimators': 4875, 'min_samples_split': 10, 'max_features': 0.91, 'min_samples_leaf': 9, 'criterion': 'absolute_error', 'max_depth': 60, 'min_weight_fraction_leaf': 0.01, 'max_leaf_nodes': 150, 'bootstrap': False, 'ccp_alpha': 0.0}. Best is trial 1828 with value: -0.15292978335836716.
[I 2025-04-16 00:53:47,089] Trial 1939 finished with value: -0.1936417107583833 and parameters: {'n_estimators': 4592, 'min_samples_split': 16, 'max_features': 0.98, 'min_samples_leaf': 17, 'criterion': 'absolute_error', 'max_depth': 60, 'min_weight_fraction_leaf': 0.01, 'max_leaf_nodes': 150, 'bootstrap': False, 'ccp_alpha': 0.006}. Best is trial 1828 with value: -0.15292978335836716.
[I 2025-04-16 00:53:50,854] Trial 1940 finished with value: -30.778752455512215 and parameters: {'n_estimators': 3969, 'min_samples_split': 23, 'max_features': 0.9400000000000001, 'min_samples_leaf': 13, 'criterion': 'poisson', 'max_depth': 60, 'min_weight_fraction_leaf': 0.0, 'max_leaf_nodes': 150, 'bootstrap': False, 'ccp_alpha': 0.014}. Best is trial 1828 with value: -0.15292978335836716.
[I 2025-04-16 00:53:54,699] Trial 1941 finished with value: -0.1936417107583833 and parameters: {'n_estimators': 4165, 'min_samples_split': 14, 'max_features': 1.0, 'min_samples_leaf': 11, 'criterion': 'absolute_error', 'max_depth': 60, 'min_weight_fraction_leaf': 0.01, 'max_leaf_nodes': 150, 'bootstrap': False, 'ccp_alpha': 0.005}. Best is trial 1828 with value: -0.15292978335836716.
[I 2025-04-16 00:53:57,894] Trial 1942 finished with value: -0.1936249274727843 and parameters: {'n_estimators': 3729, 'min_samples_split': 18, 'max_features': 0.9600000000000001, 'min_samples_leaf': 15, 'criterion': 'absolute_error', 'max_depth': 60, 'min_weight_fraction_leaf': 0.01, 'max_leaf_nodes': 20, 'bootstrap': False, 'ccp_alpha': 0.0}. Best is trial 1828 with value: -0.15292978335836716.
[I 2025-04-16 00:54:01,729] Trial 1943 finished with value: -0.1936417107583833 and parameters: {'n_estimators': 4273, 'min_samples_split': 29, 'max_features': 0.97, 'min_samples_leaf': 13, 'criterion': 'absolute_error', 'max_depth': 60, 'min_weight_fraction_leaf': 0.01, 'max_leaf_nodes': 150, 'bootstrap': False, 'ccp_alpha': 0.01}. Best is trial 1828 with value: -0.15292978335836716.
[I 2025-04-16 00:54:05,392] Trial 1944 finished with value: -0.1936417107583833 and parameters: {'n_estimators': 3940, 'min_samples_split': 10, 'max_features': 0.93, 'min_samples_leaf': 17, 'criterion': 'absolute_error', 'max_depth': 60, 'min_weight_fraction_leaf': 0.01, 'max_leaf_nodes': 150, 'bootstrap': False, 'ccp_alpha': 0.006}. Best is trial 1828 with value: -0.15292978335836716.
[I 2025-04-16 00:54:09,405] Trial 1945 finished with value: -0.1936417107583833 and parameters: {'n_estimators': 4444, 'min_samples_split': 21, 'max_features': 0.91, 'min_samples_leaf': 10, 'criterion': 'absolute_error', 'max_depth': 60, 'min_weight_fraction_leaf': 0.01, 'max_leaf_nodes': 150, 'bootstrap': False, 'ccp_alpha': 0.023}. Best is trial 1828 with value: -0.15292978335836716.
[I 2025-04-16 00:54:12,740] Trial 1946 finished with value: -0.19362127939210766 and parameters: {'n_estimators': 4071, 'min_samples_split': 14, 'max_features': 0.98, 'min_samples_leaf': 14, 'criterion': 'absolute_error', 'max_depth': 60, 'min_weight_fraction_leaf': 0.01, 'max_leaf_nodes': 150, 'bootstrap': False, 'ccp_alpha': 0.0}. Best is trial 1828 with value: -0.15292978335836716.
[I 2025-04-16 00:54:16,256] Trial 1947 finished with value: -0.1936417107583833 and parameters: {'n_estimators': 3818, 'min_samples_split': 6, 'max_features': 0.9500000000000001, 'min_samples_leaf': 12, 'criterion': 'absolute_error', 'max_depth': 60, 'min_weight_fraction_leaf': 0.0, 'max_leaf_nodes': 150, 'bootstrap': False, 'ccp_alpha': 0.016}. Best is trial 1828 with value: -0.15292978335836716.
[I 2025-04-16 00:54:19,294] Trial 1948 finished with value: -0.1936417107583833 and parameters: {'n_estimators': 3577, 'min_samples_split': 18, 'max_features': 0.9600000000000001, 'min_samples_leaf': 15, 'criterion': 'absolute_error', 'max_depth': 60, 'min_weight_fraction_leaf': 0.01, 'max_leaf_nodes': 150, 'bootstrap': False, 'ccp_alpha': 0.009000000000000001}. Best is trial 1828 with value: -0.15292978335836716.
[I 2025-04-16 00:54:22,630] Trial 1949 finished with value: -0.1936417107583833 and parameters: {'n_estimators': 4086, 'min_samples_split': 24, 'max_features': 1.0, 'min_samples_leaf': 11, 'criterion': 'absolute_error', 'max_depth': 60, 'min_weight_fraction_leaf': 0.01, 'max_leaf_nodes': 150, 'bootstrap': False, 'ccp_alpha': 0.006}. Best is trial 1828 with value: -0.15292978335836716.
[I 2025-04-16 00:54:26,570] Trial 1950 finished with value: -8.76822771859663 and parameters: {'n_estimators': 4668, 'min_samples_split': 10, 'max_features': 0.93, 'min_samples_leaf': 8, 'criterion': 'absolute_error', 'max_depth': 60, 'min_weight_fraction_leaf': 0.01, 'max_leaf_nodes': 150, 'bootstrap': False, 'ccp_alpha': 0.0}. Best is trial 1828 with value: -0.15292978335836716.
[I 2025-04-16 00:54:30,154] Trial 1951 finished with value: -0.1936417107583833 and parameters: {'n_estimators': 4263, 'min_samples_split': 16, 'max_features': 0.98, 'min_samples_leaf': 17, 'criterion': 'absolute_error', 'max_depth': 60, 'min_weight_fraction_leaf': 0.01, 'max_leaf_nodes': 150, 'bootstrap': False, 'ccp_alpha': 0.01}. Best is trial 1828 with value: -0.15292978335836716.
[I 2025-04-16 00:54:33,676] Trial 1952 finished with value: -17.52898638227453 and parameters: {'n_estimators': 3797, 'min_samples_split': 21, 'max_features': 0.9400000000000001, 'min_samples_leaf': 13, 'criterion': 'friedman_mse', 'max_depth': 60, 'min_weight_fraction_leaf': 0.01, 'max_leaf_nodes': 300, 'bootstrap': False, 'ccp_alpha': 0.005}. Best is trial 1828 with value: -0.15292978335836716.
[I 2025-04-16 00:54:37,875] Trial 1953 finished with value: -0.1936417107583833 and parameters: {'n_estimators': 4481, 'min_samples_split': 12, 'max_features': 0.91, 'min_samples_leaf': 19, 'criterion': 'absolute_error', 'max_depth': 60, 'min_weight_fraction_leaf': 0.01, 'max_leaf_nodes': 150, 'bootstrap': False, 'ccp_alpha': 0.015}. Best is trial 1828 with value: -0.15292978335836716.
[I 2025-04-16 00:54:41,413] Trial 1954 finished with value: -8.812915279831845 and parameters: {'n_estimators': 3992, 'min_samples_split': 28, 'max_features': 0.9600000000000001, 'min_samples_leaf': 10, 'criterion': 'absolute_error', 'max_depth': 60, 'min_weight_fraction_leaf': 0.0, 'max_leaf_nodes': 150, 'bootstrap': False, 'ccp_alpha': 0.0}. Best is trial 1828 with value: -0.15292978335836716.
[I 2025-04-16 00:54:44,880] Trial 1955 finished with value: -0.1936417107583833 and parameters: {'n_estimators': 4197, 'min_samples_split': 6, 'max_features': 0.98, 'min_samples_leaf': 15, 'criterion': 'absolute_error', 'max_depth': 60, 'min_weight_fraction_leaf': 0.01, 'max_leaf_nodes': 150, 'bootstrap': False, 'ccp_alpha': 0.01}. Best is trial 1828 with value: -0.15292978335836716.
[I 2025-04-16 00:54:48,088] Trial 1956 finished with value: -0.1936417107583833 and parameters: {'n_estimators': 3563, 'min_samples_split': 2, 'max_features': 0.9400000000000001, 'min_samples_leaf': 12, 'criterion': 'absolute_error', 'max_depth': 60, 'min_weight_fraction_leaf': 0.01, 'max_leaf_nodes': 150, 'bootstrap': False, 'ccp_alpha': 0.005}. Best is trial 1828 with value: -0.15292978335836716.
[I 2025-04-16 00:54:51,409] Trial 1957 finished with value: -0.1936417107583833 and parameters: {'n_estimators': 3925, 'min_samples_split': 18, 'max_features': 1.0, 'min_samples_leaf': 8, 'criterion': 'absolute_error', 'max_depth': 60, 'min_weight_fraction_leaf': 0.01, 'max_leaf_nodes': 150, 'bootstrap': False, 'ccp_alpha': 0.017}. Best is trial 1828 with value: -0.15292978335836716.
[I 2025-04-16 00:54:55,573] Trial 1958 finished with value: -0.1936417107583833 and parameters: {'n_estimators': 4363, 'min_samples_split': 14, 'max_features': 0.9600000000000001, 'min_samples_leaf': 14, 'criterion': 'absolute_error', 'max_depth': 60, 'min_weight_fraction_leaf': 0.01, 'max_leaf_nodes': 150, 'bootstrap': False, 'ccp_alpha': 0.005}. Best is trial 1828 with value: -0.15292978335836716.
[I 2025-04-16 00:54:58,744] Trial 1959 finished with value: -8.745932160324848 and parameters: {'n_estimators': 3713, 'min_samples_split': 9, 'max_features': 0.93, 'min_samples_leaf': 11, 'criterion': 'absolute_error', 'max_depth': 10, 'min_weight_fraction_leaf': 0.0, 'max_leaf_nodes': 150, 'bootstrap': False, 'ccp_alpha': 0.0}. Best is trial 1828 with value: -0.15292978335836716.
[I 2025-04-16 00:55:02,134] Trial 1960 finished with value: -17.528986382273875 and parameters: {'n_estimators': 4113, 'min_samples_split': 24, 'max_features': 0.97, 'min_samples_leaf': 16, 'criterion': 'squared_error', 'max_depth': 60, 'min_weight_fraction_leaf': 0.01, 'max_leaf_nodes': 150, 'bootstrap': False, 'ccp_alpha': 0.01}. Best is trial 1828 with value: -0.15292978335836716.
[I 2025-04-16 00:55:05,705] Trial 1961 finished with value: -0.1936417107583833 and parameters: {'n_estimators': 3890, 'min_samples_split': 19, 'max_features': 0.91, 'min_samples_leaf': 13, 'criterion': 'absolute_error', 'max_depth': 60, 'min_weight_fraction_leaf': 0.01, 'max_leaf_nodes': 150, 'bootstrap': False, 'ccp_alpha': 0.01}. Best is trial 1828 with value: -0.15292978335836716.
[I 2025-04-16 00:55:09,365] Trial 1962 finished with value: -8.761553452770208 and parameters: {'n_estimators': 4312, 'min_samples_split': 13, 'max_features': 0.9500000000000001, 'min_samples_leaf': 9, 'criterion': 'absolute_error', 'max_depth': 60, 'min_weight_fraction_leaf': 0.01, 'max_leaf_nodes': 150, 'bootstrap': False, 'ccp_alpha': 0.0}. Best is trial 1828 with value: -0.15292978335836716.
[I 2025-04-16 00:55:13,726] Trial 1963 finished with value: -0.1936417107583833 and parameters: {'n_estimators': 4720, 'min_samples_split': 16, 'max_features': 0.99, 'min_samples_leaf': 17, 'criterion': 'absolute_error', 'max_depth': 60, 'min_weight_fraction_leaf': 0.01, 'max_leaf_nodes': 150, 'bootstrap': False, 'ccp_alpha': 0.006}. Best is trial 1828 with value: -0.15292978335836716.
[I 2025-04-16 00:55:16,944] Trial 1964 finished with value: -17.528986382273875 and parameters: {'n_estimators': 4115, 'min_samples_split': 83, 'max_features': 0.97, 'min_samples_leaf': 14, 'criterion': 'poisson', 'max_depth': 60, 'min_weight_fraction_leaf': 0.01, 'max_leaf_nodes': 150, 'bootstrap': False, 'ccp_alpha': 0.022}. Best is trial 1828 with value: -0.15292978335836716.
[I 2025-04-16 00:55:20,031] Trial 1965 finished with value: -8.762512571000906 and parameters: {'n_estimators': 3566, 'min_samples_split': 8, 'max_features': 0.93, 'min_samples_leaf': 12, 'criterion': 'absolute_error', 'max_depth': 60, 'min_weight_fraction_leaf': 0.01, 'max_leaf_nodes': 150, 'bootstrap': False, 'ccp_alpha': 0.0}. Best is trial 1828 with value: -0.15292978335836716.
[I 2025-04-16 00:55:23,392] Trial 1966 finished with value: -0.1936417107583833 and parameters: {'n_estimators': 3773, 'min_samples_split': 21, 'max_features': 0.9500000000000001, 'min_samples_leaf': 15, 'criterion': 'absolute_error', 'max_depth': 60, 'min_weight_fraction_leaf': 0.01, 'max_leaf_nodes': 150, 'bootstrap': False, 'ccp_alpha': 0.016}. Best is trial 1828 with value: -0.15292978335836716.
[I 2025-04-16 00:55:27,215] Trial 1967 finished with value: -0.1936417107583833 and parameters: {'n_estimators': 4536, 'min_samples_split': 27, 'max_features': 0.98, 'min_samples_leaf': 19, 'criterion': 'absolute_error', 'max_depth': 60, 'min_weight_fraction_leaf': 0.0, 'max_leaf_nodes': 20, 'bootstrap': False, 'ccp_alpha': 0.009000000000000001}. Best is trial 1828 with value: -0.15292978335836716.
[I 2025-04-16 00:55:30,867] Trial 1968 finished with value: -0.1936417107583833 and parameters: {'n_estimators': 3999, 'min_samples_split': 12, 'max_features': 0.91, 'min_samples_leaf': 10, 'criterion': 'absolute_error', 'max_depth': 60, 'min_weight_fraction_leaf': 0.01, 'max_leaf_nodes': 150, 'bootstrap': False, 'ccp_alpha': 0.005}. Best is trial 1828 with value: -0.15292978335836716.
[I 2025-04-16 00:55:34,619] Trial 1969 finished with value: -0.1936417107583833 and parameters: {'n_estimators': 4262, 'min_samples_split': 17, 'max_features': 1.0, 'min_samples_leaf': 12, 'criterion': 'absolute_error', 'max_depth': 60, 'min_weight_fraction_leaf': 0.01, 'max_leaf_nodes': 150, 'bootstrap': False, 'ccp_alpha': 0.014}. Best is trial 1828 with value: -0.15292978335836716.
[I 2025-04-16 00:55:37,977] Trial 1970 finished with value: -0.1936417107583833 and parameters: {'n_estimators': 3944, 'min_samples_split': 23, 'max_features': 0.9500000000000001, 'min_samples_leaf': 16, 'criterion': 'absolute_error', 'max_depth': 60, 'min_weight_fraction_leaf': 0.01, 'max_leaf_nodes': 150, 'bootstrap': False, 'ccp_alpha': 0.005}. Best is trial 1828 with value: -0.15292978335836716.
[I 2025-04-16 00:55:41,629] Trial 1971 finished with value: -0.1936385644498933 and parameters: {'n_estimators': 4463, 'min_samples_split': 6, 'max_features': 0.01, 'min_samples_leaf': 14, 'criterion': 'absolute_error', 'max_depth': 60, 'min_weight_fraction_leaf': 0.0, 'max_leaf_nodes': 150, 'bootstrap': False, 'ccp_alpha': 0.0}. Best is trial 1828 with value: -0.15292978335836716.
[I 2025-04-16 00:55:45,682] Trial 1972 finished with value: -0.1936417107583833 and parameters: {'n_estimators': 4140, 'min_samples_split': 12, 'max_features': 0.97, 'min_samples_leaf': 8, 'criterion': 'absolute_error', 'max_depth': 60, 'min_weight_fraction_leaf': 0.01, 'max_leaf_nodes': 150, 'bootstrap': False, 'ccp_alpha': 0.006}. Best is trial 1828 with value: -0.15292978335836716.
[I 2025-04-16 00:55:48,828] Trial 1973 finished with value: -8.754169230066983 and parameters: {'n_estimators': 3771, 'min_samples_split': 19, 'max_features': 0.93, 'min_samples_leaf': 11, 'criterion': 'absolute_error', 'max_depth': 60, 'min_weight_fraction_leaf': 0.01, 'max_leaf_nodes': 150, 'bootstrap': False, 'ccp_alpha': 0.0}. Best is trial 1828 with value: -0.15292978335836716.
[I 2025-04-16 00:55:52,187] Trial 1974 finished with value: -0.1936417107583833 and parameters: {'n_estimators': 3579, 'min_samples_split': 15, 'max_features': 0.9600000000000001, 'min_samples_leaf': 13, 'criterion': 'absolute_error', 'max_depth': 60, 'min_weight_fraction_leaf': 0.01, 'max_leaf_nodes': 150, 'bootstrap': False, 'ccp_alpha': 0.011}. Best is trial 1828 with value: -0.15292978335836716.
[I 2025-04-16 00:55:56,346] Trial 1975 finished with value: -0.1936417107583833 and parameters: {'n_estimators': 4335, 'min_samples_split': 9, 'max_features': 0.98, 'min_samples_leaf': 17, 'criterion': 'absolute_error', 'max_depth': 60, 'min_weight_fraction_leaf': 0.01, 'max_leaf_nodes': 150, 'bootstrap': False, 'ccp_alpha': 0.005}. Best is trial 1828 with value: -0.15292978335836716.
[I 2025-04-16 00:56:00,012] Trial 1976 finished with value: -17.52898638227392 and parameters: {'n_estimators': 4094, 'min_samples_split': 2, 'max_features': 0.92, 'min_samples_leaf': 10, 'criterion': 'friedman_mse', 'max_depth': 60, 'min_weight_fraction_leaf': 0.01, 'max_leaf_nodes': 150, 'bootstrap': False, 'ccp_alpha': 0.014}. Best is trial 1828 with value: -0.15292978335836716.
[I 2025-04-16 00:56:03,392] Trial 1977 finished with value: -0.1936249151858383 and parameters: {'n_estimators': 3926, 'min_samples_split': 30, 'max_features': 0.9400000000000001, 'min_samples_leaf': 15, 'criterion': 'absolute_error', 'max_depth': 60, 'min_weight_fraction_leaf': 0.08, 'max_leaf_nodes': 300, 'bootstrap': False, 'ccp_alpha': 0.0}. Best is trial 1828 with value: -0.15292978335836716.
[I 2025-04-16 00:56:07,761] Trial 1978 finished with value: -0.1936417107583833 and parameters: {'n_estimators': 4825, 'min_samples_split': 21, 'max_features': 1.0, 'min_samples_leaf': 12, 'criterion': 'absolute_error', 'max_depth': 60, 'min_weight_fraction_leaf': 0.01, 'max_leaf_nodes': 150, 'bootstrap': False, 'ccp_alpha': 0.02}. Best is trial 1828 with value: -0.15292978335836716.
[I 2025-04-16 00:56:11,084] Trial 1979 finished with value: -0.1936417107583833 and parameters: {'n_estimators': 3781, 'min_samples_split': 15, 'max_features': 0.9600000000000001, 'min_samples_leaf': 14, 'criterion': 'absolute_error', 'max_depth': 60, 'min_weight_fraction_leaf': 0.01, 'max_leaf_nodes': 150, 'bootstrap': False, 'ccp_alpha': 0.009000000000000001}. Best is trial 1828 with value: -0.15292978335836716.
[I 2025-04-16 00:56:14,573] Trial 1980 finished with value: -0.1936417107583833 and parameters: {'n_estimators': 4231, 'min_samples_split': 25, 'max_features': 0.98, 'min_samples_leaf': 18, 'criterion': 'absolute_error', 'max_depth': 60, 'min_weight_fraction_leaf': 0.0, 'max_leaf_nodes': 150, 'bootstrap': False, 'ccp_alpha': 0.005}. Best is trial 1828 with value: -0.15292978335836716.
[I 2025-04-16 00:56:19,203] Trial 1981 finished with value: -0.1936417107583833 and parameters: {'n_estimators': 4514, 'min_samples_split': 11, 'max_features': 0.9500000000000001, 'min_samples_leaf': 10, 'criterion': 'absolute_error', 'max_depth': 10, 'min_weight_fraction_leaf': 0.01, 'max_leaf_nodes': 150, 'bootstrap': False, 'ccp_alpha': 0.011}. Best is trial 1828 with value: -0.15292978335836716.
[I 2025-04-16 00:56:22,706] Trial 1982 finished with value: -36.51211522252275 and parameters: {'n_estimators': 4035, 'min_samples_split': 18, 'max_features': 0.91, 'min_samples_leaf': 12, 'criterion': 'squared_error', 'max_depth': 60, 'min_weight_fraction_leaf': 0.01, 'max_leaf_nodes': 150, 'bootstrap': False, 'ccp_alpha': 0.0}. Best is trial 1828 with value: -0.15292978335836716.
[I 2025-04-16 00:56:25,756] Trial 1983 finished with value: -0.1936417107583833 and parameters: {'n_estimators': 3672, 'min_samples_split': 8, 'max_features': 0.93, 'min_samples_leaf': 16, 'criterion': 'absolute_error', 'max_depth': 60, 'min_weight_fraction_leaf': 0.01, 'max_leaf_nodes': 150, 'bootstrap': False, 'ccp_alpha': 0.005}. Best is trial 1828 with value: -0.15292978335836716.
[I 2025-04-16 00:56:29,087] Trial 1984 finished with value: -8.768816998255314 and parameters: {'n_estimators': 4297, 'min_samples_split': 22, 'max_features': 0.98, 'min_samples_leaf': 8, 'criterion': 'absolute_error', 'max_depth': 60, 'min_weight_fraction_leaf': 0.01, 'max_leaf_nodes': 150, 'bootstrap': False, 'ccp_alpha': 0.0}. Best is trial 1828 with value: -0.15292978335836716.
[I 2025-04-16 00:56:32,647] Trial 1985 finished with value: -0.1936417107583833 and parameters: {'n_estimators': 3909, 'min_samples_split': 13, 'max_features': 0.9600000000000001, 'min_samples_leaf': 14, 'criterion': 'absolute_error', 'max_depth': 60, 'min_weight_fraction_leaf': 0.01, 'max_leaf_nodes': 150, 'bootstrap': False, 'ccp_alpha': 0.015}. Best is trial 1828 with value: -0.15292978335836716.
[I 2025-04-16 00:56:36,039] Trial 1986 finished with value: -0.1936417107583833 and parameters: {'n_estimators': 4134, 'min_samples_split': 16, 'max_features': 0.9400000000000001, 'min_samples_leaf': 13, 'criterion': 'absolute_error', 'max_depth': 60, 'min_weight_fraction_leaf': 0.01, 'max_leaf_nodes': 150, 'bootstrap': False, 'ccp_alpha': 0.006}. Best is trial 1828 with value: -0.15292978335836716.
