[I 2025-04-16 01:58:28,068] Trial 3341 finished with value: 0.053691082651116814 and parameters: {'n_estimators': 342, 'min_samples_split': 2, 'max_features': 0.74, 'min_samples_leaf': 1, 'criterion': 'absolute_error', 'max_depth': 15, 'min_weight_fraction_leaf': 0.0, 'max_leaf_nodes': 300, 'bootstrap': False, 'ccp_alpha': 0.005}. Best is trial 3267 with value: 0.055170387637108485.
[I 2025-04-16 01:58:28,789] Trial 3342 finished with value: -0.1936417107583833 and parameters: {'n_estimators': 273, 'min_samples_split': 2, 'max_features': 0.74, 'min_samples_leaf': 1, 'criterion': 'absolute_error', 'max_depth': 15, 'min_weight_fraction_leaf': 0.0, 'max_leaf_nodes': 300, 'bootstrap': False, 'ccp_alpha': 0.011}. Best is trial 3267 with value: 0.055170387637108485.
[I 2025-04-16 01:58:29,517] Trial 3343 finished with value: 0.014212473928091884 and parameters: {'n_estimators': 273, 'min_samples_split': 2, 'max_features': 0.7000000000000001, 'min_samples_leaf': 1, 'criterion': 'absolute_error', 'max_depth': 15, 'min_weight_fraction_leaf': 0.0, 'max_leaf_nodes': 300, 'bootstrap': False, 'ccp_alpha': 0.006}. Best is trial 3267 with value: 0.055170387637108485.
[I 2025-04-16 01:58:30,182] Trial 3344 finished with value: -33.14607280836644 and parameters: {'n_estimators': 269, 'min_samples_split': 2, 'max_features': 0.75, 'min_samples_leaf': 1, 'criterion': 'absolute_error', 'max_depth': 15, 'min_weight_fraction_leaf': 0.0, 'max_leaf_nodes': 300, 'bootstrap': False, 'ccp_alpha': 0.0}. Best is trial 3267 with value: 0.055170387637108485.
[I 2025-04-16 01:58:31,137] Trial 3345 finished with value: -17.528986382274873 and parameters: {'n_estimators': 488, 'min_samples_split': 2, 'max_features': 0.72, 'min_samples_leaf': 1, 'criterion': 'squared_error', 'max_depth': 15, 'min_weight_fraction_leaf': 0.0, 'max_leaf_nodes': 300, 'bootstrap': False, 'ccp_alpha': 0.018000000000000002}. Best is trial 3267 with value: 0.055170387637108485.
[I 2025-04-16 01:58:31,995] Trial 3346 finished with value: -0.1936417107583833 and parameters: {'n_estimators': 468, 'min_samples_split': 2, 'max_features': 0.76, 'min_samples_leaf': 1, 'criterion': 'absolute_error', 'max_depth': 15, 'min_weight_fraction_leaf': 0.0, 'max_leaf_nodes': 300, 'bootstrap': False, 'ccp_alpha': 0.013000000000000001}. Best is trial 3267 with value: 0.055170387637108485.
[I 2025-04-16 01:58:33,053] Trial 3347 finished with value: -0.1936417107583833 and parameters: {'n_estimators': 602, 'min_samples_split': 2, 'max_features': 0.74, 'min_samples_leaf': 1, 'criterion': 'absolute_error', 'max_depth': 15, 'min_weight_fraction_leaf': 0.0, 'max_leaf_nodes': 300, 'bootstrap': False, 'ccp_alpha': 0.009000000000000001}. Best is trial 3267 with value: 0.055170387637108485.
[I 2025-04-16 01:58:33,745] Trial 3348 finished with value: -36.8314585147656 and parameters: {'n_estimators': 293, 'min_samples_split': 2, 'max_features': 0.76, 'min_samples_leaf': 2, 'criterion': 'absolute_error', 'max_depth': 15, 'min_weight_fraction_leaf': 0.0, 'max_leaf_nodes': 300, 'bootstrap': False, 'ccp_alpha': 0.0}. Best is trial 3267 with value: 0.055170387637108485.
[I 2025-04-16 01:58:34,803] Trial 3349 finished with value: 0.03749888543646411 and parameters: {'n_estimators': 671, 'min_samples_split': 2, 'max_features': 0.72, 'min_samples_leaf': 1, 'criterion': 'absolute_error', 'max_depth': 15, 'min_weight_fraction_leaf': 0.0, 'max_leaf_nodes': 300, 'bootstrap': False, 'ccp_alpha': 0.005}. Best is trial 3267 with value: 0.055170387637108485.
[I 2025-04-16 01:58:35,903] Trial 3350 finished with value: -0.1936417107583833 and parameters: {'n_estimators': 665, 'min_samples_split': 2, 'max_features': 0.6900000000000001, 'min_samples_leaf': 1, 'criterion': 'absolute_error', 'max_depth': 15, 'min_weight_fraction_leaf': 0.0, 'max_leaf_nodes': 300, 'bootstrap': False, 'ccp_alpha': 0.014}. Best is trial 3267 with value: 0.055170387637108485.
[I 2025-04-16 01:58:36,833] Trial 3351 finished with value: -0.1936417107583833 and parameters: {'n_estimators': 423, 'min_samples_split': 2, 'max_features': 0.72, 'min_samples_leaf': 1, 'criterion': 'absolute_error', 'max_depth': 15, 'min_weight_fraction_leaf': 0.0, 'max_leaf_nodes': 300, 'bootstrap': False, 'ccp_alpha': 0.021}. Best is trial 3267 with value: 0.055170387637108485.
[I 2025-04-16 01:58:37,900] Trial 3352 finished with value: -15.951908938209073 and parameters: {'n_estimators': 636, 'min_samples_split': 2, 'max_features': 0.68, 'min_samples_leaf': 1, 'criterion': 'poisson', 'max_depth': 15, 'min_weight_fraction_leaf': 0.0, 'max_leaf_nodes': 300, 'bootstrap': False, 'ccp_alpha': 0.009000000000000001}. Best is trial 3267 with value: 0.055170387637108485.
[I 2025-04-16 01:58:38,655] Trial 3353 finished with value: -0.1936417107583833 and parameters: {'n_estimators': 328, 'min_samples_split': 2, 'max_features': 0.7100000000000001, 'min_samples_leaf': 1, 'criterion': 'absolute_error', 'max_depth': 15, 'min_weight_fraction_leaf': 0.0, 'max_leaf_nodes': 300, 'bootstrap': False, 'ccp_alpha': 0.198}. Best is trial 3267 with value: 0.055170387637108485.
[I 2025-04-16 01:58:39,753] Trial 3354 finished with value: 0.027969778212025842 and parameters: {'n_estimators': 743, 'min_samples_split': 5, 'max_features': 0.74, 'min_samples_leaf': 1, 'criterion': 'absolute_error', 'max_depth': 15, 'min_weight_fraction_leaf': 0.0, 'max_leaf_nodes': 300, 'bootstrap': False, 'ccp_alpha': 0.005}. Best is trial 3267 with value: 0.055170387637108485.
[I 2025-04-16 01:58:40,907] Trial 3355 finished with value: -0.1936417107583833 and parameters: {'n_estimators': 729, 'min_samples_split': 2, 'max_features': 0.74, 'min_samples_leaf': 1, 'criterion': 'absolute_error', 'max_depth': 15, 'min_weight_fraction_leaf': 0.0, 'max_leaf_nodes': 300, 'bootstrap': False, 'ccp_alpha': 0.031}. Best is trial 3267 with value: 0.055170387637108485.
[I 2025-04-16 01:58:41,766] Trial 3356 finished with value: -34.59680200069297 and parameters: {'n_estimators': 534, 'min_samples_split': 2, 'max_features': 0.73, 'min_samples_leaf': 1, 'criterion': 'absolute_error', 'max_depth': 15, 'min_weight_fraction_leaf': 0.0, 'max_leaf_nodes': 300, 'bootstrap': False, 'ccp_alpha': 0.0}. Best is trial 3267 with value: 0.055170387637108485.
[I 2025-04-16 01:58:43,108] Trial 3357 finished with value: -0.1936417107583833 and parameters: {'n_estimators': 924, 'min_samples_split': 2, 'max_features': 0.7100000000000001, 'min_samples_leaf': 1, 'criterion': 'absolute_error', 'max_depth': 15, 'min_weight_fraction_leaf': 0.0, 'max_leaf_nodes': 300, 'bootstrap': False, 'ccp_alpha': 0.01}. Best is trial 3267 with value: 0.055170387637108485.
[I 2025-04-16 01:58:44,299] Trial 3358 finished with value: -0.1936417107583833 and parameters: {'n_estimators': 763, 'min_samples_split': 2, 'max_features': 0.77, 'min_samples_leaf': 1, 'criterion': 'absolute_error', 'max_depth': 15, 'min_weight_fraction_leaf': 0.0, 'max_leaf_nodes': 300, 'bootstrap': False, 'ccp_alpha': 0.018000000000000002}. Best is trial 3267 with value: 0.055170387637108485.
[I 2025-04-16 01:58:45,009] Trial 3359 finished with value: -0.1936417107583833 and parameters: {'n_estimators': 260, 'min_samples_split': 2, 'max_features': 0.74, 'min_samples_leaf': 3, 'criterion': 'absolute_error', 'max_depth': 15, 'min_weight_fraction_leaf': 0.0, 'max_leaf_nodes': 300, 'bootstrap': False, 'ccp_alpha': 0.01}. Best is trial 3267 with value: 0.055170387637108485.
[I 2025-04-16 01:58:46,002] Trial 3360 finished with value: -0.015577503832116025 and parameters: {'n_estimators': 501, 'min_samples_split': 2, 'max_features': 0.6900000000000001, 'min_samples_leaf': 1, 'criterion': 'absolute_error', 'max_depth': 15, 'min_weight_fraction_leaf': 0.0, 'max_leaf_nodes': 300, 'bootstrap': False, 'ccp_alpha': 0.005}. Best is trial 3267 with value: 0.055170387637108485.
[I 2025-04-16 01:58:47,257] Trial 3361 finished with value: -0.1936417107583833 and parameters: {'n_estimators': 938, 'min_samples_split': 2, 'max_features': 0.72, 'min_samples_leaf': 3, 'criterion': 'absolute_error', 'max_depth': 15, 'min_weight_fraction_leaf': 0.0, 'max_leaf_nodes': 300, 'bootstrap': False, 'ccp_alpha': 0.026000000000000002}. Best is trial 3267 with value: 0.055170387637108485.
[I 2025-04-16 01:58:48,347] Trial 3362 finished with value: -0.1936417107583833 and parameters: {'n_estimators': 712, 'min_samples_split': 5, 'max_features': 0.76, 'min_samples_leaf': 1, 'criterion': 'absolute_error', 'max_depth': 15, 'min_weight_fraction_leaf': 0.0, 'max_leaf_nodes': 300, 'bootstrap': False, 'ccp_alpha': 0.015}. Best is trial 3267 with value: 0.055170387637108485.
[I 2025-04-16 01:58:49,237] Trial 3363 finished with value: -7.689384348958581 and parameters: {'n_estimators': 454, 'min_samples_split': 2, 'max_features': 0.77, 'min_samples_leaf': 3, 'criterion': 'friedman_mse', 'max_depth': 15, 'min_weight_fraction_leaf': 0.0, 'max_leaf_nodes': 300, 'bootstrap': False, 'ccp_alpha': 0.0}. Best is trial 3267 with value: 0.055170387637108485.
[I 2025-04-16 01:58:50,329] Trial 3364 finished with value: 0.008911014120312344 and parameters: {'n_estimators': 720, 'min_samples_split': 5, 'max_features': 0.73, 'min_samples_leaf': 3, 'criterion': 'absolute_error', 'max_depth': 15, 'min_weight_fraction_leaf': 0.0, 'max_leaf_nodes': 300, 'bootstrap': False, 'ccp_alpha': 0.006}. Best is trial 3267 with value: 0.055170387637108485.
[I 2025-04-16 01:58:51,084] Trial 3365 finished with value: -0.1936417107583833 and parameters: {'n_estimators': 281, 'min_samples_split': 2, 'max_features': 0.7000000000000001, 'min_samples_leaf': 1, 'criterion': 'absolute_error', 'max_depth': 15, 'min_weight_fraction_leaf': 0.0, 'max_leaf_nodes': 300, 'bootstrap': False, 'ccp_alpha': 0.014}. Best is trial 3267 with value: 0.055170387637108485.
[I 2025-04-16 01:58:52,085] Trial 3366 finished with value: 0.017650461102849558 and parameters: {'n_estimators': 559, 'min_samples_split': 5, 'max_features': 0.75, 'min_samples_leaf': 3, 'criterion': 'absolute_error', 'max_depth': 15, 'min_weight_fraction_leaf': 0.0, 'max_leaf_nodes': 300, 'bootstrap': False, 'ccp_alpha': 0.005}. Best is trial 3267 with value: 0.055170387637108485.
[I 2025-04-16 01:58:53,303] Trial 3367 finished with value: -0.1936417107583833 and parameters: {'n_estimators': 929, 'min_samples_split': 5, 'max_features': 0.74, 'min_samples_leaf': 1, 'criterion': 'absolute_error', 'max_depth': 15, 'min_weight_fraction_leaf': 0.0, 'max_leaf_nodes': 300, 'bootstrap': False, 'ccp_alpha': 0.009000000000000001}. Best is trial 3267 with value: 0.055170387637108485.
[I 2025-04-16 01:58:54,330] Trial 3368 finished with value: -14.765792229653925 and parameters: {'n_estimators': 758, 'min_samples_split': 5, 'max_features': 0.77, 'min_samples_leaf': 3, 'criterion': 'absolute_error', 'max_depth': 15, 'min_weight_fraction_leaf': 0.0, 'max_leaf_nodes': 300, 'bootstrap': False, 'ccp_alpha': 0.0}. Best is trial 3267 with value: 0.055170387637108485.
[I 2025-04-16 01:58:55,197] Trial 3369 finished with value: -0.1936417107583833 and parameters: {'n_estimators': 452, 'min_samples_split': 2, 'max_features': 0.72, 'min_samples_leaf': 1, 'criterion': 'absolute_error', 'max_depth': 15, 'min_weight_fraction_leaf': 0.0, 'max_leaf_nodes': 300, 'bootstrap': False, 'ccp_alpha': 0.021}. Best is trial 3267 with value: 0.055170387637108485.
[I 2025-04-16 01:58:56,440] Trial 3370 finished with value: -17.528986382275512 and parameters: {'n_estimators': 941, 'min_samples_split': 5, 'max_features': 0.75, 'min_samples_leaf': 3, 'criterion': 'squared_error', 'max_depth': 15, 'min_weight_fraction_leaf': 0.0, 'max_leaf_nodes': 300, 'bootstrap': False, 'ccp_alpha': 0.014}. Best is trial 3267 with value: 0.055170387637108485.
[I 2025-04-16 01:58:57,513] Trial 3371 finished with value: -0.1936417107583833 and parameters: {'n_estimators': 621, 'min_samples_split': 2, 'max_features': 0.77, 'min_samples_leaf': 1, 'criterion': 'absolute_error', 'max_depth': 15, 'min_weight_fraction_leaf': 0.0, 'max_leaf_nodes': 300, 'bootstrap': False, 'ccp_alpha': 0.009000000000000001}. Best is trial 3267 with value: 0.055170387637108485.
[I 2025-04-16 01:58:58,184] Trial 3372 finished with value: -14.23613807428921 and parameters: {'n_estimators': 271, 'min_samples_split': 2, 'max_features': 0.7100000000000001, 'min_samples_leaf': 3, 'criterion': 'absolute_error', 'max_depth': 15, 'min_weight_fraction_leaf': 0.0, 'max_leaf_nodes': 300, 'bootstrap': False, 'ccp_alpha': 0.0}. Best is trial 3267 with value: 0.055170387637108485.
[I 2025-04-16 01:58:59,454] Trial 3373 finished with value: -0.04754093342464638 and parameters: {'n_estimators': 933, 'min_samples_split': 5, 'max_features': 0.6900000000000001, 'min_samples_leaf': 3, 'criterion': 'absolute_error', 'max_depth': 15, 'min_weight_fraction_leaf': 0.0, 'max_leaf_nodes': 300, 'bootstrap': False, 'ccp_alpha': 0.005}. Best is trial 3267 with value: 0.055170387637108485.
[I 2025-04-16 01:59:00,601] Trial 3374 finished with value: -0.1936417107583833 and parameters: {'n_estimators': 758, 'min_samples_split': 5, 'max_features': 0.74, 'min_samples_leaf': 1, 'criterion': 'absolute_error', 'max_depth': 15, 'min_weight_fraction_leaf': 0.0, 'max_leaf_nodes': 300, 'bootstrap': False, 'ccp_alpha': 0.018000000000000002}. Best is trial 3267 with value: 0.055170387637108485.
[I 2025-04-16 01:59:01,238] Trial 3375 finished with value: -14.908887680283877 and parameters: {'n_estimators': 203, 'min_samples_split': 5, 'max_features': 0.66, 'min_samples_leaf': 3, 'criterion': 'poisson', 'max_depth': 15, 'min_weight_fraction_leaf': 0.0, 'max_leaf_nodes': 300, 'bootstrap': False, 'ccp_alpha': 0.01}. Best is trial 3267 with value: 0.055170387637108485.
[I 2025-04-16 01:59:02,177] Trial 3376 finished with value: 0.053508355717325526 and parameters: {'n_estimators': 519, 'min_samples_split': 2, 'max_features': 0.76, 'min_samples_leaf': 1, 'criterion': 'absolute_error', 'max_depth': 15, 'min_weight_fraction_leaf': 0.0, 'max_leaf_nodes': 300, 'bootstrap': False, 'ccp_alpha': 0.005}. Best is trial 3267 with value: 0.055170387637108485.
[I 2025-04-16 01:59:03,113] Trial 3377 finished with value: -0.1936417107583833 and parameters: {'n_estimators': 487, 'min_samples_split': 2, 'max_features': 0.76, 'min_samples_leaf': 1, 'criterion': 'absolute_error', 'max_depth': 15, 'min_weight_fraction_leaf': 0.0, 'max_leaf_nodes': 300, 'bootstrap': False, 'ccp_alpha': 0.014}. Best is trial 3267 with value: 0.055170387637108485.
[I 2025-04-16 01:59:03,909] Trial 3378 finished with value: 0.053332607894599614 and parameters: {'n_estimators': 358, 'min_samples_split': 2, 'max_features': 0.73, 'min_samples_leaf': 1, 'criterion': 'absolute_error', 'max_depth': 15, 'min_weight_fraction_leaf': 0.0, 'max_leaf_nodes': 300, 'bootstrap': False, 'ccp_alpha': 0.005}. Best is trial 3267 with value: 0.055170387637108485.
[I 2025-04-16 01:59:04,609] Trial 3379 finished with value: -0.1936417107583833 and parameters: {'n_estimators': 257, 'min_samples_split': 2, 'max_features': 0.73, 'min_samples_leaf': 1, 'criterion': 'absolute_error', 'max_depth': 15, 'min_weight_fraction_leaf': 0.0, 'max_leaf_nodes': 300, 'bootstrap': False, 'ccp_alpha': 0.025}. Best is trial 3267 with value: 0.055170387637108485.
[I 2025-04-16 01:59:05,273] Trial 3380 finished with value: -34.248628629583855 and parameters: {'n_estimators': 259, 'min_samples_split': 2, 'max_features': 0.7100000000000001, 'min_samples_leaf': 1, 'criterion': 'absolute_error', 'max_depth': 15, 'min_weight_fraction_leaf': 0.0, 'max_leaf_nodes': 300, 'bootstrap': False, 'ccp_alpha': 0.0}. Best is trial 3267 with value: 0.055170387637108485.
[I 2025-04-16 01:59:06,170] Trial 3381 finished with value: -0.1936417107583833 and parameters: {'n_estimators': 425, 'min_samples_split': 2, 'max_features': 0.75, 'min_samples_leaf': 1, 'criterion': 'absolute_error', 'max_depth': 15, 'min_weight_fraction_leaf': 0.0, 'max_leaf_nodes': 300, 'bootstrap': False, 'ccp_alpha': 0.01}. Best is trial 3267 with value: 0.055170387637108485.
[I 2025-04-16 01:59:07,071] Trial 3382 finished with value: -0.1936417107583833 and parameters: {'n_estimators': 469, 'min_samples_split': 2, 'max_features': 0.77, 'min_samples_leaf': 1, 'criterion': 'absolute_error', 'max_depth': 15, 'min_weight_fraction_leaf': 0.0, 'max_leaf_nodes': 300, 'bootstrap': False, 'ccp_alpha': 0.018000000000000002}. Best is trial 3267 with value: 0.055170387637108485.
[I 2025-04-16 01:59:07,667] Trial 3383 finished with value: -0.1936417107583833 and parameters: {'n_estimators': 142, 'min_samples_split': 2, 'max_features': 0.67, 'min_samples_leaf': 1, 'criterion': 'absolute_error', 'max_depth': 15, 'min_weight_fraction_leaf': 0.0, 'max_leaf_nodes': 300, 'bootstrap': False, 'ccp_alpha': 0.009000000000000001}. Best is trial 3267 with value: 0.055170387637108485.
[I 2025-04-16 01:59:08,282] Trial 3384 finished with value: 0.04533357968301843 and parameters: {'n_estimators': 161, 'min_samples_split': 2, 'max_features': 0.73, 'min_samples_leaf': 1, 'criterion': 'absolute_error', 'max_depth': 15, 'min_weight_fraction_leaf': 0.0, 'max_leaf_nodes': 300, 'bootstrap': False, 'ccp_alpha': 0.005}. Best is trial 3267 with value: 0.055170387637108485.
[I 2025-04-16 01:59:08,952] Trial 3385 finished with value: -7.988271472337951 and parameters: {'n_estimators': 246, 'min_samples_split': 2, 'max_features': 0.72, 'min_samples_leaf': 1, 'criterion': 'friedman_mse', 'max_depth': 15, 'min_weight_fraction_leaf': 0.0, 'max_leaf_nodes': 300, 'bootstrap': False, 'ccp_alpha': 0.0}. Best is trial 3267 with value: 0.055170387637108485.
[I 2025-04-16 01:59:09,526] Trial 3386 finished with value: -0.1936417107583833 and parameters: {'n_estimators': 123, 'min_samples_split': 2, 'max_features': 0.74, 'min_samples_leaf': 1, 'criterion': 'absolute_error', 'max_depth': 15, 'min_weight_fraction_leaf': 0.0, 'max_leaf_nodes': 300, 'bootstrap': False, 'ccp_alpha': 0.014}. Best is trial 3267 with value: 0.055170387637108485.
[I 2025-04-16 01:59:10,187] Trial 3387 finished with value: 0.05190581992049825 and parameters: {'n_estimators': 200, 'min_samples_split': 2, 'max_features': 0.7000000000000001, 'min_samples_leaf': 1, 'criterion': 'absolute_error', 'max_depth': 15, 'min_weight_fraction_leaf': 0.0, 'max_leaf_nodes': 300, 'bootstrap': False, 'ccp_alpha': 0.005}. Best is trial 3267 with value: 0.055170387637108485.
[I 2025-04-16 01:59:10,786] Trial 3388 finished with value: -0.1936417107583833 and parameters: {'n_estimators': 150, 'min_samples_split': 2, 'max_features': 0.6900000000000001, 'min_samples_leaf': 1, 'criterion': 'absolute_error', 'max_depth': 15, 'min_weight_fraction_leaf': 0.0, 'max_leaf_nodes': 300, 'bootstrap': False, 'ccp_alpha': 0.17}. Best is trial 3267 with value: 0.055170387637108485.
[I 2025-04-16 01:59:12,030] Trial 3389 finished with value: -0.1936417107583833 and parameters: {'n_estimators': 194, 'min_samples_split': 2, 'max_features': 0.7000000000000001, 'min_samples_leaf': 1, 'criterion': 'absolute_error', 'max_depth': 15, 'min_weight_fraction_leaf': 0.0, 'max_leaf_nodes': 300, 'bootstrap': False, 'ccp_alpha': 0.019}. Best is trial 3267 with value: 0.055170387637108485.
[I 2025-04-16 01:59:12,654] Trial 3390 finished with value: -0.1936417107583833 and parameters: {'n_estimators': 153, 'min_samples_split': 2, 'max_features': 0.7100000000000001, 'min_samples_leaf': 3, 'criterion': 'absolute_error', 'max_depth': 15, 'min_weight_fraction_leaf': 0.0, 'max_leaf_nodes': 300, 'bootstrap': False, 'ccp_alpha': 0.01}. Best is trial 3267 with value: 0.055170387637108485.
[I 2025-04-16 01:59:13,263] Trial 3391 finished with value: -0.1936417107583833 and parameters: {'n_estimators': 144, 'min_samples_split': 2, 'max_features': 0.68, 'min_samples_leaf': 1, 'criterion': 'absolute_error', 'max_depth': 15, 'min_weight_fraction_leaf': 0.0, 'max_leaf_nodes': 300, 'bootstrap': False, 'ccp_alpha': 0.014}. Best is trial 3267 with value: 0.055170387637108485.
[I 2025-04-16 01:59:14,072] Trial 3392 finished with value: -14.47342737246905 and parameters: {'n_estimators': 375, 'min_samples_split': 2, 'max_features': 0.72, 'min_samples_leaf': 3, 'criterion': 'absolute_error', 'max_depth': 15, 'min_weight_fraction_leaf': 0.0, 'max_leaf_nodes': 300, 'bootstrap': False, 'ccp_alpha': 0.0}. Best is trial 3267 with value: 0.055170387637108485.
[I 2025-04-16 01:59:14,822] Trial 3393 finished with value: -0.0733002394722301 and parameters: {'n_estimators': 327, 'min_samples_split': 2, 'max_features': 0.68, 'min_samples_leaf': 3, 'criterion': 'absolute_error', 'max_depth': 15, 'min_weight_fraction_leaf': 0.0, 'max_leaf_nodes': 300, 'bootstrap': False, 'ccp_alpha': 0.005}. Best is trial 3267 with value: 0.055170387637108485.
[I 2025-04-16 01:59:15,298] Trial 3394 finished with value: -17.528986382275022 and parameters: {'n_estimators': 7, 'min_samples_split': 5, 'max_features': 0.73, 'min_samples_leaf': 1, 'criterion': 'squared_error', 'max_depth': 15, 'min_weight_fraction_leaf': 0.0, 'max_leaf_nodes': 300, 'bootstrap': False, 'ccp_alpha': 0.024}. Best is trial 3267 with value: 0.055170387637108485.
[I 2025-04-16 01:59:16,140] Trial 3395 finished with value: -0.1936417107583833 and parameters: {'n_estimators': 451, 'min_samples_split': 2, 'max_features': 0.7000000000000001, 'min_samples_leaf': 3, 'criterion': 'absolute_error', 'max_depth': 15, 'min_weight_fraction_leaf': 0.0, 'max_leaf_nodes': 300, 'bootstrap': False, 'ccp_alpha': 0.01}. Best is trial 3267 with value: 0.055170387637108485.
[I 2025-04-16 01:59:16,796] Trial 3396 finished with value: -0.1936417107583833 and parameters: {'n_estimators': 188, 'min_samples_split': 2, 'max_features': 0.75, 'min_samples_leaf': 1, 'criterion': 'absolute_error', 'max_depth': 15, 'min_weight_fraction_leaf': 0.0, 'max_leaf_nodes': 300, 'bootstrap': False, 'ccp_alpha': 0.014}. Best is trial 3267 with value: 0.055170387637108485.
