[I 2025-04-16 01:46:54,008] Trial 2890 finished with value: -0.1936417107583833 and parameters: {'n_estimators': 2211, 'min_samples_split': 14, 'max_features': 0.91, 'min_samples_leaf': 8, 'criterion': 'absolute_error', 'max_depth': 5, 'min_weight_fraction_leaf': 0.0, 'max_leaf_nodes': 20, 'bootstrap': False, 'ccp_alpha': 0.005}. Best is trial 2774 with value: 0.046571421912873.
[I 2025-04-16 01:46:56,101] Trial 2891 finished with value: -0.1936417107583833 and parameters: {'n_estimators': 2387, 'min_samples_split': 66, 'max_features': 0.88, 'min_samples_leaf': 5, 'criterion': 'absolute_error', 'max_depth': 5, 'min_weight_fraction_leaf': 0.0, 'max_leaf_nodes': 20, 'bootstrap': False, 'ccp_alpha': 0.014}. Best is trial 2774 with value: 0.046571421912873.
[I 2025-04-16 01:46:58,081] Trial 2892 finished with value: -14.448253078168722 and parameters: {'n_estimators': 2469, 'min_samples_split': 13, 'max_features': 0.85, 'min_samples_leaf': 3, 'criterion': 'absolute_error', 'max_depth': 5, 'min_weight_fraction_leaf': 0.0, 'max_leaf_nodes': 20, 'bootstrap': False, 'ccp_alpha': 0.0}. Best is trial 2774 with value: 0.046571421912873.
[I 2025-04-16 01:46:59,962] Trial 2893 finished with value: -0.1936417107583833 and parameters: {'n_estimators': 2188, 'min_samples_split': 9, 'max_features': 0.91, 'min_samples_leaf': 6, 'criterion': 'absolute_error', 'max_depth': 5, 'min_weight_fraction_leaf': 0.0, 'max_leaf_nodes': 20, 'bootstrap': False, 'ccp_alpha': 0.01}. Best is trial 2774 with value: 0.046571421912873.
[I 2025-04-16 01:47:03,010] Trial 2894 finished with value: -0.07528799837372246 and parameters: {'n_estimators': 2519, 'min_samples_split': 13, 'max_features': 0.8200000000000001, 'min_samples_leaf': 3, 'criterion': 'absolute_error', 'max_depth': 5, 'min_weight_fraction_leaf': 0.0, 'max_leaf_nodes': 20, 'bootstrap': False, 'ccp_alpha': 0.005}. Best is trial 2774 with value: 0.046571421912873.
[I 2025-04-16 01:47:06,037] Trial 2895 finished with value: -0.1936417107583833 and parameters: {'n_estimators': 2534, 'min_samples_split': 9, 'max_features': 0.87, 'min_samples_leaf': 1, 'criterion': 'absolute_error', 'max_depth': 5, 'min_weight_fraction_leaf': 0.0, 'max_leaf_nodes': 20, 'bootstrap': False, 'ccp_alpha': 0.02}. Best is trial 2774 with value: 0.046571421912873.
[I 2025-04-16 01:47:08,187] Trial 2896 finished with value: -0.1936417107583833 and parameters: {'n_estimators': 2592, 'min_samples_split': 10, 'max_features': 0.89, 'min_samples_leaf': 8, 'criterion': 'absolute_error', 'max_depth': 5, 'min_weight_fraction_leaf': 0.0, 'max_leaf_nodes': 20, 'bootstrap': False, 'ccp_alpha': 0.014}. Best is trial 2774 with value: 0.046571421912873.
[I 2025-04-16 01:47:10,348] Trial 2897 finished with value: 0.02343543710224698 and parameters: {'n_estimators': 2586, 'min_samples_split': 9, 'max_features': 0.91, 'min_samples_leaf': 5, 'criterion': 'absolute_error', 'max_depth': 5, 'min_weight_fraction_leaf': 0.0, 'max_leaf_nodes': 20, 'bootstrap': False, 'ccp_alpha': 0.005}. Best is trial 2774 with value: 0.046571421912873.
[I 2025-04-16 01:47:12,349] Trial 2898 finished with value: -7.183439575663679 and parameters: {'n_estimators': 2528, 'min_samples_split': 14, 'max_features': 0.87, 'min_samples_leaf': 8, 'criterion': 'absolute_error', 'max_depth': 5, 'min_weight_fraction_leaf': 0.0, 'max_leaf_nodes': 20, 'bootstrap': False, 'ccp_alpha': 0.0}. Best is trial 2774 with value: 0.046571421912873.
[I 2025-04-16 01:47:14,639] Trial 2899 finished with value: -17.528986382276887 and parameters: {'n_estimators': 2424, 'min_samples_split': 14, 'max_features': 0.91, 'min_samples_leaf': 6, 'criterion': 'friedman_mse', 'max_depth': 5, 'min_weight_fraction_leaf': 0.0, 'max_leaf_nodes': 20, 'bootstrap': False, 'ccp_alpha': 0.01}. Best is trial 2774 with value: 0.046571421912873.
[I 2025-04-16 01:47:16,430] Trial 2900 finished with value: -0.1936417107583833 and parameters: {'n_estimators': 1735, 'min_samples_split': 14, 'max_features': 0.85, 'min_samples_leaf': 8, 'criterion': 'absolute_error', 'max_depth': 5, 'min_weight_fraction_leaf': 0.0, 'max_leaf_nodes': 20, 'bootstrap': False, 'ccp_alpha': 0.029}. Best is trial 2774 with value: 0.046571421912873.
[I 2025-04-16 01:47:18,414] Trial 2901 finished with value: -0.1936417107583833 and parameters: {'n_estimators': 2174, 'min_samples_split': 13, 'max_features': 0.89, 'min_samples_leaf': 6, 'criterion': 'absolute_error', 'max_depth': 5, 'min_weight_fraction_leaf': 0.0, 'max_leaf_nodes': 20, 'bootstrap': False, 'ccp_alpha': 0.014}. Best is trial 2774 with value: 0.046571421912873.
[I 2025-04-16 01:47:20,782] Trial 2902 finished with value: -0.1936417107583833 and parameters: {'n_estimators': 2855, 'min_samples_split': 13, 'max_features': 0.91, 'min_samples_leaf': 8, 'criterion': 'absolute_error', 'max_depth': 5, 'min_weight_fraction_leaf': 0.0, 'max_leaf_nodes': 20, 'bootstrap': False, 'ccp_alpha': 0.022}. Best is trial 2774 with value: 0.046571421912873.
[I 2025-04-16 01:47:23,430] Trial 2903 finished with value: -0.08955147000911834 and parameters: {'n_estimators': 2222, 'min_samples_split': 13, 'max_features': 0.88, 'min_samples_leaf': 5, 'criterion': 'absolute_error', 'max_depth': 5, 'min_weight_fraction_leaf': 0.0, 'max_leaf_nodes': 20, 'bootstrap': False, 'ccp_alpha': 0.005}. Best is trial 2774 with value: 0.046571421912873.
[I 2025-04-16 01:47:25,476] Trial 2904 finished with value: 0.02171270688539506 and parameters: {'n_estimators': 2046, 'min_samples_split': 9, 'max_features': 0.9, 'min_samples_leaf': 6, 'criterion': 'absolute_error', 'max_depth': 5, 'min_weight_fraction_leaf': 0.0, 'max_leaf_nodes': 20, 'bootstrap': False, 'ccp_alpha': 0.005}. Best is trial 2774 with value: 0.046571421912873.
[I 2025-04-16 01:47:27,361] Trial 2905 finished with value: -8.706339432392966 and parameters: {'n_estimators': 2358, 'min_samples_split': 14, 'max_features': 0.91, 'min_samples_leaf': 8, 'criterion': 'absolute_error', 'max_depth': 5, 'min_weight_fraction_leaf': 0.0, 'max_leaf_nodes': 20, 'bootstrap': False, 'ccp_alpha': 0.0}. Best is trial 2774 with value: 0.046571421912873.
[I 2025-04-16 01:47:28,702] Trial 2906 finished with value: -0.1936417107583833 and parameters: {'n_estimators': 1393, 'min_samples_split': 14, 'max_features': 0.91, 'min_samples_leaf': 8, 'criterion': 'absolute_error', 'max_depth': 5, 'min_weight_fraction_leaf': 0.0, 'max_leaf_nodes': 20, 'bootstrap': False, 'ccp_alpha': 0.01}. Best is trial 2774 with value: 0.046571421912873.
[I 2025-04-16 01:47:30,569] Trial 2907 finished with value: 0.02039151267327981 and parameters: {'n_estimators': 1731, 'min_samples_split': 10, 'max_features': 0.91, 'min_samples_leaf': 7, 'criterion': 'absolute_error', 'max_depth': 5, 'min_weight_fraction_leaf': 0.0, 'max_leaf_nodes': 20, 'bootstrap': False, 'ccp_alpha': 0.005}. Best is trial 2774 with value: 0.046571421912873.
[I 2025-04-16 01:47:32,003] Trial 2908 finished with value: -16.90532589049534 and parameters: {'n_estimators': 1692, 'min_samples_split': 14, 'max_features': 0.91, 'min_samples_leaf': 8, 'criterion': 'squared_error', 'max_depth': 5, 'min_weight_fraction_leaf': 0.0, 'max_leaf_nodes': 20, 'bootstrap': False, 'ccp_alpha': 0.0}. Best is trial 2774 with value: 0.046571421912873.
[I 2025-04-16 01:47:33,604] Trial 2909 finished with value: -8.620632323151334 and parameters: {'n_estimators': 1911, 'min_samples_split': 14, 'max_features': 0.91, 'min_samples_leaf': 7, 'criterion': 'absolute_error', 'max_depth': 5, 'min_weight_fraction_leaf': 0.0, 'max_leaf_nodes': 20, 'bootstrap': False, 'ccp_alpha': 0.0}. Best is trial 2774 with value: 0.046571421912873.
[I 2025-04-16 01:47:35,199] Trial 2910 finished with value: -0.1936417107583833 and parameters: {'n_estimators': 1803, 'min_samples_split': 14, 'max_features': 0.92, 'min_samples_leaf': 8, 'criterion': 'absolute_error', 'max_depth': 5, 'min_weight_fraction_leaf': 0.0, 'max_leaf_nodes': 20, 'bootstrap': False, 'ccp_alpha': 0.01}. Best is trial 2774 with value: 0.046571421912873.
[I 2025-04-16 01:47:36,830] Trial 2911 finished with value: -0.1936417107583833 and parameters: {'n_estimators': 1843, 'min_samples_split': 14, 'max_features': 0.91, 'min_samples_leaf': 8, 'criterion': 'absolute_error', 'max_depth': 5, 'min_weight_fraction_leaf': 0.0, 'max_leaf_nodes': 20, 'bootstrap': False, 'ccp_alpha': 0.015}. Best is trial 2774 with value: 0.046571421912873.
[I 2025-04-16 01:47:38,581] Trial 2912 finished with value: -0.1936417107583833 and parameters: {'n_estimators': 1795, 'min_samples_split': 10, 'max_features': 0.92, 'min_samples_leaf': 8, 'criterion': 'absolute_error', 'max_depth': 5, 'min_weight_fraction_leaf': 0.0, 'max_leaf_nodes': 20, 'bootstrap': False, 'ccp_alpha': 0.005}. Best is trial 2774 with value: 0.046571421912873.
[I 2025-04-16 01:47:39,883] Trial 2913 finished with value: -0.1936417107583833 and parameters: {'n_estimators': 1301, 'min_samples_split': 14, 'max_features': 0.91, 'min_samples_leaf': 8, 'criterion': 'absolute_error', 'max_depth': 5, 'min_weight_fraction_leaf': 0.0, 'max_leaf_nodes': 20, 'bootstrap': False, 'ccp_alpha': 0.005}. Best is trial 2774 with value: 0.046571421912873.
[I 2025-04-16 01:47:41,497] Trial 2914 finished with value: -29.67503763914946 and parameters: {'n_estimators': 1552, 'min_samples_split': 10, 'max_features': 0.91, 'min_samples_leaf': 8, 'criterion': 'poisson', 'max_depth': 5, 'min_weight_fraction_leaf': 0.0, 'max_leaf_nodes': 20, 'bootstrap': False, 'ccp_alpha': 0.01}. Best is trial 2774 with value: 0.046571421912873.
[I 2025-04-16 01:47:42,977] Trial 2915 finished with value: -8.648459249281503 and parameters: {'n_estimators': 1512, 'min_samples_split': 10, 'max_features': 0.92, 'min_samples_leaf': 7, 'criterion': 'absolute_error', 'max_depth': 5, 'min_weight_fraction_leaf': 0.0, 'max_leaf_nodes': 20, 'bootstrap': False, 'ccp_alpha': 0.0}. Best is trial 2774 with value: 0.046571421912873.
[I 2025-04-16 01:47:44,627] Trial 2916 finished with value: -0.1936417107583833 and parameters: {'n_estimators': 1679, 'min_samples_split': 14, 'max_features': 0.9, 'min_samples_leaf': 8, 'criterion': 'absolute_error', 'max_depth': 5, 'min_weight_fraction_leaf': 0.0, 'max_leaf_nodes': 20, 'bootstrap': False, 'ccp_alpha': 0.018000000000000002}. Best is trial 2774 with value: 0.046571421912873.
[I 2025-04-16 01:47:46,086] Trial 2917 finished with value: -0.1936417107583833 and parameters: {'n_estimators': 1560, 'min_samples_split': 10, 'max_features': 0.92, 'min_samples_leaf': 6, 'criterion': 'absolute_error', 'max_depth': 5, 'min_weight_fraction_leaf': 0.0, 'max_leaf_nodes': 20, 'bootstrap': False, 'ccp_alpha': 0.01}. Best is trial 2774 with value: 0.046571421912873.
[I 2025-04-16 01:47:47,814] Trial 2918 finished with value: 0.021461669098130364 and parameters: {'n_estimators': 1949, 'min_samples_split': 14, 'max_features': 0.9, 'min_samples_leaf': 6, 'criterion': 'absolute_error', 'max_depth': 5, 'min_weight_fraction_leaf': 0.0, 'max_leaf_nodes': 20, 'bootstrap': False, 'ccp_alpha': 0.005}. Best is trial 2774 with value: 0.046571421912873.
[I 2025-04-16 01:47:49,514] Trial 2919 finished with value: -8.643780168156272 and parameters: {'n_estimators': 2010, 'min_samples_split': 15, 'max_features': 0.92, 'min_samples_leaf': 8, 'criterion': 'absolute_error', 'max_depth': 5, 'min_weight_fraction_leaf': 0.0, 'max_leaf_nodes': 20, 'bootstrap': False, 'ccp_alpha': 0.0}. Best is trial 2774 with value: 0.046571421912873.
[I 2025-04-16 01:47:51,288] Trial 2920 finished with value: -0.1936417107583833 and parameters: {'n_estimators': 1802, 'min_samples_split': 15, 'max_features': 0.92, 'min_samples_leaf': 8, 'criterion': 'absolute_error', 'max_depth': 5, 'min_weight_fraction_leaf': 0.0, 'max_leaf_nodes': 20, 'bootstrap': False, 'ccp_alpha': 0.005}. Best is trial 2774 with value: 0.046571421912873.
[I 2025-04-16 01:47:52,932] Trial 2921 finished with value: -0.1936417107583833 and parameters: {'n_estimators': 1758, 'min_samples_split': 14, 'max_features': 0.91, 'min_samples_leaf': 8, 'criterion': 'absolute_error', 'max_depth': 15, 'min_weight_fraction_leaf': 0.0, 'max_leaf_nodes': 20, 'bootstrap': False, 'ccp_alpha': 0.014}. Best is trial 2774 with value: 0.046571421912873.
[I 2025-04-16 01:47:54,718] Trial 2922 finished with value: -0.1936417107583833 and parameters: {'n_estimators': 1952, 'min_samples_split': 15, 'max_features': 0.9, 'min_samples_leaf': 8, 'criterion': 'absolute_error', 'max_depth': 5, 'min_weight_fraction_leaf': 0.0, 'max_leaf_nodes': 20, 'bootstrap': False, 'ccp_alpha': 0.01}. Best is trial 2774 with value: 0.046571421912873.
[I 2025-04-16 01:47:56,111] Trial 2923 finished with value: -17.019244862488513 and parameters: {'n_estimators': 1539, 'min_samples_split': 14, 'max_features': 0.92, 'min_samples_leaf': 6, 'criterion': 'friedman_mse', 'max_depth': 5, 'min_weight_fraction_leaf': 0.08, 'max_leaf_nodes': 20, 'bootstrap': False, 'ccp_alpha': 0.0}. Best is trial 2774 with value: 0.046571421912873.
[I 2025-04-16 01:47:57,983] Trial 2924 finished with value: -0.1936417107583833 and parameters: {'n_estimators': 1923, 'min_samples_split': 14, 'max_features': 0.9, 'min_samples_leaf': 6, 'criterion': 'absolute_error', 'max_depth': 5, 'min_weight_fraction_leaf': 0.0, 'max_leaf_nodes': 20, 'bootstrap': False, 'ccp_alpha': 0.009000000000000001}. Best is trial 2774 with value: 0.046571421912873.
[I 2025-04-16 01:47:59,763] Trial 2925 finished with value: -0.1936417107583833 and parameters: {'n_estimators': 1850, 'min_samples_split': 15, 'max_features': 0.9, 'min_samples_leaf': 8, 'criterion': 'absolute_error', 'max_depth': 5, 'min_weight_fraction_leaf': 0.0, 'max_leaf_nodes': 20, 'bootstrap': False, 'ccp_alpha': 0.005}. Best is trial 2774 with value: 0.046571421912873.
[I 2025-04-16 01:48:01,585] Trial 2926 finished with value: -0.1936417107583833 and parameters: {'n_estimators': 2015, 'min_samples_split': 13, 'max_features': 0.92, 'min_samples_leaf': 6, 'criterion': 'absolute_error', 'max_depth': 5, 'min_weight_fraction_leaf': 0.0, 'max_leaf_nodes': 20, 'bootstrap': False, 'ccp_alpha': 0.015}. Best is trial 2774 with value: 0.046571421912873.
[I 2025-04-16 01:48:03,694] Trial 2927 finished with value: -0.1936417107583833 and parameters: {'n_estimators': 2135, 'min_samples_split': 14, 'max_features': 0.92, 'min_samples_leaf': 8, 'criterion': 'absolute_error', 'max_depth': None, 'min_weight_fraction_leaf': 0.0, 'max_leaf_nodes': 20, 'bootstrap': False, 'ccp_alpha': 0.005}. Best is trial 2774 with value: 0.046571421912873.
[I 2025-04-16 01:48:05,045] Trial 2928 finished with value: -9.407778229478255 and parameters: {'n_estimators': 1327, 'min_samples_split': 12, 'max_features': 0.89, 'min_samples_leaf': 6, 'criterion': 'absolute_error', 'max_depth': 5, 'min_weight_fraction_leaf': 0.0, 'max_leaf_nodes': 20, 'bootstrap': False, 'ccp_alpha': 0.0}. Best is trial 2774 with value: 0.046571421912873.
[I 2025-04-16 01:48:06,836] Trial 2929 finished with value: -0.1936417107583833 and parameters: {'n_estimators': 1683, 'min_samples_split': 103, 'max_features': 0.92, 'min_samples_leaf': 6, 'criterion': 'absolute_error', 'max_depth': 5, 'min_weight_fraction_leaf': 0.0, 'max_leaf_nodes': 20, 'bootstrap': False, 'ccp_alpha': 0.02}. Best is trial 2774 with value: 0.046571421912873.
[I 2025-04-16 01:48:08,573] Trial 2930 finished with value: -0.1936417107583833 and parameters: {'n_estimators': 1627, 'min_samples_split': 10, 'max_features': 0.89, 'min_samples_leaf': 6, 'criterion': 'absolute_error', 'max_depth': 5, 'min_weight_fraction_leaf': 0.0, 'max_leaf_nodes': 20, 'bootstrap': False, 'ccp_alpha': 0.014}. Best is trial 2774 with value: 0.046571421912873.
[I 2025-04-16 01:48:10,472] Trial 2931 finished with value: -0.1936417107583833 and parameters: {'n_estimators': 2138, 'min_samples_split': 11, 'max_features': 0.92, 'min_samples_leaf': 8, 'criterion': 'absolute_error', 'max_depth': 5, 'min_weight_fraction_leaf': 0.0, 'max_leaf_nodes': 20, 'bootstrap': False, 'ccp_alpha': 0.005}. Best is trial 2774 with value: 0.046571421912873.
[I 2025-04-16 01:48:11,852] Trial 2932 finished with value: -17.528986382276322 and parameters: {'n_estimators': 1471, 'min_samples_split': 11, 'max_features': 0.91, 'min_samples_leaf': 6, 'criterion': 'squared_error', 'max_depth': 5, 'min_weight_fraction_leaf': 0.0, 'max_leaf_nodes': 20, 'bootstrap': False, 'ccp_alpha': 0.01}. Best is trial 2774 with value: 0.046571421912873.
[I 2025-04-16 01:48:13,637] Trial 2933 finished with value: -7.124500574145483 and parameters: {'n_estimators': 1945, 'min_samples_split': 13, 'max_features': 0.89, 'min_samples_leaf': 8, 'criterion': 'absolute_error', 'max_depth': 5, 'min_weight_fraction_leaf': 0.0, 'max_leaf_nodes': 20, 'bootstrap': False, 'ccp_alpha': 0.0}. Best is trial 2774 with value: 0.046571421912873.
[I 2025-04-16 01:48:15,262] Trial 2934 finished with value: -0.1936417107583833 and parameters: {'n_estimators': 1785, 'min_samples_split': 14, 'max_features': 0.9, 'min_samples_leaf': 8, 'criterion': 'absolute_error', 'max_depth': 5, 'min_weight_fraction_leaf': 0.0, 'max_leaf_nodes': 20, 'bootstrap': False, 'ccp_alpha': 0.025}. Best is trial 2774 with value: 0.046571421912873.
[I 2025-04-16 01:48:17,339] Trial 2935 finished with value: -0.1936417107583833 and parameters: {'n_estimators': 2094, 'min_samples_split': 10, 'max_features': 0.92, 'min_samples_leaf': 6, 'criterion': 'absolute_error', 'max_depth': 5, 'min_weight_fraction_leaf': 0.0, 'max_leaf_nodes': 20, 'bootstrap': False, 'ccp_alpha': 0.015}. Best is trial 2774 with value: 0.046571421912873.
[I 2025-04-16 01:48:19,011] Trial 2936 finished with value: -0.07172357926212158 and parameters: {'n_estimators': 1717, 'min_samples_split': 9, 'max_features': 0.89, 'min_samples_leaf': 6, 'criterion': 'absolute_error', 'max_depth': 5, 'min_weight_fraction_leaf': 0.0, 'max_leaf_nodes': 20, 'bootstrap': False, 'ccp_alpha': 0.005}. Best is trial 2774 with value: 0.046571421912873.
[I 2025-04-16 01:48:20,946] Trial 2937 finished with value: -0.1936417107583833 and parameters: {'n_estimators': 1954, 'min_samples_split': 15, 'max_features': 0.92, 'min_samples_leaf': 8, 'criterion': 'absolute_error', 'max_depth': 5, 'min_weight_fraction_leaf': 0.0, 'max_leaf_nodes': 20, 'bootstrap': False, 'ccp_alpha': 0.009000000000000001}. Best is trial 2774 with value: 0.046571421912873.
[I 2025-04-16 01:48:22,731] Trial 2938 finished with value: -17.528986382276738 and parameters: {'n_estimators': 2068, 'min_samples_split': 10, 'max_features': 0.9, 'min_samples_leaf': 6, 'criterion': 'poisson', 'max_depth': 5, 'min_weight_fraction_leaf': 0.0, 'max_leaf_nodes': 20, 'bootstrap': False, 'ccp_alpha': 0.019}. Best is trial 2774 with value: 0.046571421912873.
[I 2025-04-16 01:48:24,343] Trial 2939 finished with value: -0.1936417107583833 and parameters: {'n_estimators': 1562, 'min_samples_split': 15, 'max_features': 0.92, 'min_samples_leaf': 6, 'criterion': 'absolute_error', 'max_depth': 5, 'min_weight_fraction_leaf': 0.0, 'max_leaf_nodes': 20, 'bootstrap': False, 'ccp_alpha': 0.149}. Best is trial 2774 with value: 0.046571421912873.
[I 2025-04-16 01:48:26,283] Trial 2940 finished with value: -0.1936417107583833 and parameters: {'n_estimators': 1910, 'min_samples_split': 10, 'max_features': 0.89, 'min_samples_leaf': 8, 'criterion': 'absolute_error', 'max_depth': 5, 'min_weight_fraction_leaf': 0.0, 'max_leaf_nodes': 20, 'bootstrap': False, 'ccp_alpha': 0.005}. Best is trial 2774 with value: 0.046571421912873.
[I 2025-04-16 01:48:27,525] Trial 2941 finished with value: -0.1936417107583833 and parameters: {'n_estimators': 1224, 'min_samples_split': 15, 'max_features': 0.92, 'min_samples_leaf': 6, 'criterion': 'absolute_error', 'max_depth': 15, 'min_weight_fraction_leaf': 0.0, 'max_leaf_nodes': 20, 'bootstrap': False, 'ccp_alpha': 0.01}. Best is trial 2774 with value: 0.046571421912873.
[I 2025-04-16 01:48:29,833] Trial 2942 finished with value: -11.270921035233922 and parameters: {'n_estimators': 2451, 'min_samples_split': 10, 'max_features': 0.89, 'min_samples_leaf': 5, 'criterion': 'absolute_error', 'max_depth': 5, 'min_weight_fraction_leaf': 0.0, 'max_leaf_nodes': 20, 'bootstrap': False, 'ccp_alpha': 0.0}. Best is trial 2774 with value: 0.046571421912873.
[I 2025-04-16 01:48:31,624] Trial 2943 finished with value: -0.1936417107583833 and parameters: {'n_estimators': 2012, 'min_samples_split': 10, 'max_features': 0.9, 'min_samples_leaf': 8, 'criterion': 'absolute_error', 'max_depth': 5, 'min_weight_fraction_leaf': 0.0, 'max_leaf_nodes': 20, 'bootstrap': False, 'ccp_alpha': 0.014}. Best is trial 2774 with value: 0.046571421912873.
[I 2025-04-16 01:48:33,922] Trial 2944 finished with value: -0.1936417107583833 and parameters: {'n_estimators': 2471, 'min_samples_split': 53, 'max_features': 0.92, 'min_samples_leaf': 5, 'criterion': 'absolute_error', 'max_depth': 5, 'min_weight_fraction_leaf': 0.0, 'max_leaf_nodes': 20, 'bootstrap': False, 'ccp_alpha': 0.01}. Best is trial 2774 with value: 0.046571421912873.
[I 2025-04-16 01:48:36,103] Trial 2945 finished with value: -0.1936417107583833 and parameters: {'n_estimators': 2117, 'min_samples_split': 15, 'max_features': 0.88, 'min_samples_leaf': 8, 'criterion': 'absolute_error', 'max_depth': 5, 'min_weight_fraction_leaf': 0.0, 'max_leaf_nodes': 20, 'bootstrap': False, 'ccp_alpha': 0.005}. Best is trial 2774 with value: 0.046571421912873.
[I 2025-04-16 01:48:37,675] Trial 2946 finished with value: -0.1936417107583833 and parameters: {'n_estimators': 1468, 'min_samples_split': 10, 'max_features': 0.92, 'min_samples_leaf': 6, 'criterion': 'absolute_error', 'max_depth': 5, 'min_weight_fraction_leaf': 0.0, 'max_leaf_nodes': 20, 'bootstrap': False, 'ccp_alpha': 0.018000000000000002}. Best is trial 2774 with value: 0.046571421912873.
