[I 2025-04-16 02:21:36,913] Trial 4630 finished with value: -0.1936417107583833 and parameters: {'n_estimators': 850, 'min_samples_split': 9, 'max_features': 0.75, 'min_samples_leaf': 3, 'criterion': 'absolute_error', 'max_depth': 15, 'min_weight_fraction_leaf': 0.0, 'max_leaf_nodes': 10, 'bootstrap': False, 'ccp_alpha': 0.01}. Best is trial 4539 with value: 0.19155472534689352.
[I 2025-04-16 02:21:38,042] Trial 4631 finished with value: -0.10406662691096336 and parameters: {'n_estimators': 645, 'min_samples_split': 6, 'max_features': 0.81, 'min_samples_leaf': 5, 'criterion': 'absolute_error', 'max_depth': 15, 'min_weight_fraction_leaf': 0.0, 'max_leaf_nodes': 10, 'bootstrap': False, 'ccp_alpha': 0.005}. Best is trial 4539 with value: 0.19155472534689352.
[I 2025-04-16 02:21:39,599] Trial 4632 finished with value: -0.1936417107583833 and parameters: {'n_estimators': 1079, 'min_samples_split': 13, 'max_features': 0.43, 'min_samples_leaf': 65, 'criterion': 'absolute_error', 'max_depth': 15, 'min_weight_fraction_leaf': 0.0, 'max_leaf_nodes': 10, 'bootstrap': False, 'ccp_alpha': 0.018000000000000002}. Best is trial 4539 with value: 0.19155472534689352.
[I 2025-04-16 02:21:40,501] Trial 4633 finished with value: -6.494105896725509 and parameters: {'n_estimators': 393, 'min_samples_split': 2, 'max_features': 0.78, 'min_samples_leaf': 7, 'criterion': 'absolute_error', 'max_depth': 15, 'min_weight_fraction_leaf': 0.0, 'max_leaf_nodes': 10, 'bootstrap': False, 'ccp_alpha': 0.0}. Best is trial 4539 with value: 0.19155472534689352.
[I 2025-04-16 02:21:41,576] Trial 4634 finished with value: -0.1936417107583833 and parameters: {'n_estimators': 561, 'min_samples_split': 6, 'max_features': 0.73, 'min_samples_leaf': 3, 'criterion': 'absolute_error', 'max_depth': 15, 'min_weight_fraction_leaf': 0.0, 'max_leaf_nodes': 10, 'bootstrap': False, 'ccp_alpha': 0.01}. Best is trial 4539 with value: 0.19155472534689352.
[I 2025-04-16 02:21:42,781] Trial 4635 finished with value: -0.17423100998006585 and parameters: {'n_estimators': 733, 'min_samples_split': 2, 'max_features': 0.76, 'min_samples_leaf': 1, 'criterion': 'absolute_error', 'max_depth': 15, 'min_weight_fraction_leaf': 0.0, 'max_leaf_nodes': 10, 'bootstrap': False, 'ccp_alpha': 0.006}. Best is trial 4539 with value: 0.19155472534689352.
[I 2025-04-16 02:21:43,737] Trial 4636 finished with value: -0.1936417107583833 and parameters: {'n_estimators': 425, 'min_samples_split': 9, 'max_features': 0.8, 'min_samples_leaf': 4, 'criterion': 'absolute_error', 'max_depth': 15, 'min_weight_fraction_leaf': 0.0, 'max_leaf_nodes': 10, 'bootstrap': False, 'ccp_alpha': 0.013000000000000001}. Best is trial 4539 with value: 0.19155472534689352.
[I 2025-04-16 02:21:45,335] Trial 4637 finished with value: -2.272919119127801 and parameters: {'n_estimators': 1227, 'min_samples_split': 5, 'max_features': 0.72, 'min_samples_leaf': 1, 'criterion': 'friedman_mse', 'max_depth': 15, 'min_weight_fraction_leaf': 0.0, 'max_leaf_nodes': 10, 'bootstrap': False, 'ccp_alpha': 0.0}. Best is trial 4539 with value: 0.19155472534689352.
[I 2025-04-16 02:21:46,672] Trial 4638 finished with value: -0.1936417107583833 and parameters: {'n_estimators': 907, 'min_samples_split': 13, 'max_features': 0.78, 'min_samples_leaf': 3, 'criterion': 'absolute_error', 'max_depth': 15, 'min_weight_fraction_leaf': 0.03, 'max_leaf_nodes': 10, 'bootstrap': False, 'ccp_alpha': 0.006}. Best is trial 4539 with value: 0.19155472534689352.
[I 2025-04-16 02:21:47,597] Trial 4639 finished with value: -0.1936417107583833 and parameters: {'n_estimators': 375, 'min_samples_split': 9, 'max_features': 0.74, 'min_samples_leaf': 5, 'criterion': 'absolute_error', 'max_depth': 15, 'min_weight_fraction_leaf': 0.0, 'max_leaf_nodes': 10, 'bootstrap': False, 'ccp_alpha': 0.015}. Best is trial 4539 with value: 0.19155472534689352.
[I 2025-04-16 02:21:48,741] Trial 4640 finished with value: -0.1936417107583833 and parameters: {'n_estimators': 612, 'min_samples_split': 6, 'max_features': 0.81, 'min_samples_leaf': 1, 'criterion': 'absolute_error', 'max_depth': 20, 'min_weight_fraction_leaf': 0.0, 'max_leaf_nodes': 10, 'bootstrap': False, 'ccp_alpha': 0.01}. Best is trial 4539 with value: 0.19155472534689352.
[I 2025-04-16 02:21:50,129] Trial 4641 finished with value: -0.1936417107583833 and parameters: {'n_estimators': 859, 'min_samples_split': 2, 'max_features': 0.76, 'min_samples_leaf': 7, 'criterion': 'absolute_error', 'max_depth': 15, 'min_weight_fraction_leaf': 0.0, 'max_leaf_nodes': 10, 'bootstrap': False, 'ccp_alpha': 0.23900000000000002}. Best is trial 4539 with value: 0.19155472534689352.
[I 2025-04-16 02:21:51,063] Trial 4642 finished with value: -0.1936417107583833 and parameters: {'n_estimators': 359, 'min_samples_split': 9, 'max_features': 0.72, 'min_samples_leaf': 3, 'criterion': 'absolute_error', 'max_depth': 45, 'min_weight_fraction_leaf': 0.0, 'max_leaf_nodes': 10, 'bootstrap': False, 'ccp_alpha': 0.017}. Best is trial 4539 with value: 0.19155472534689352.
[I 2025-04-16 02:21:52,159] Trial 4643 finished with value: -0.1402139073135433 and parameters: {'n_estimators': 624, 'min_samples_split': 5, 'max_features': 0.78, 'min_samples_leaf': 1, 'criterion': 'absolute_error', 'max_depth': 15, 'min_weight_fraction_leaf': 0.07, 'max_leaf_nodes': 10, 'bootstrap': False, 'ccp_alpha': 0.005}. Best is trial 4539 with value: 0.19155472534689352.
[I 2025-04-16 02:21:52,992] Trial 4644 finished with value: -9.608844800475113 and parameters: {'n_estimators': 329, 'min_samples_split': 2, 'max_features': 0.75, 'min_samples_leaf': 5, 'criterion': 'absolute_error', 'max_depth': 15, 'min_weight_fraction_leaf': 0.0, 'max_leaf_nodes': 10, 'bootstrap': False, 'ccp_alpha': 0.0}. Best is trial 4539 with value: 0.19155472534689352.
[I 2025-04-16 02:21:54,560] Trial 4645 finished with value: -0.1936417107583833 and parameters: {'n_estimators': 1050, 'min_samples_split': 13, 'max_features': 0.81, 'min_samples_leaf': 3, 'criterion': 'absolute_error', 'max_depth': 15, 'min_weight_fraction_leaf': 0.0, 'max_leaf_nodes': 10, 'bootstrap': False, 'ccp_alpha': 0.011}. Best is trial 4539 with value: 0.19155472534689352.
[I 2025-04-16 02:21:56,064] Trial 4646 finished with value: -17.528986382275015 and parameters: {'n_estimators': 774, 'min_samples_split': 6, 'max_features': 0.73, 'min_samples_leaf': 1, 'criterion': 'squared_error', 'max_depth': 15, 'min_weight_fraction_leaf': 0.0, 'max_leaf_nodes': 10, 'bootstrap': False, 'ccp_alpha': 0.14300000000000002}. Best is trial 4539 with value: 0.19155472534689352.
[I 2025-04-16 02:21:57,053] Trial 4647 finished with value: -0.1936417107583833 and parameters: {'n_estimators': 518, 'min_samples_split': 9, 'max_features': 0.79, 'min_samples_leaf': 3, 'criterion': 'absolute_error', 'max_depth': 15, 'min_weight_fraction_leaf': 0.0, 'max_leaf_nodes': 10, 'bootstrap': False, 'ccp_alpha': 0.02}. Best is trial 4539 with value: 0.19155472534689352.
[I 2025-04-16 02:21:57,916] Trial 4648 finished with value: -0.1936417107583833 and parameters: {'n_estimators': 330, 'min_samples_split': 2, 'max_features': 0.76, 'min_samples_leaf': 6, 'criterion': 'absolute_error', 'max_depth': 15, 'min_weight_fraction_leaf': 0.0, 'max_leaf_nodes': 10, 'bootstrap': False, 'ccp_alpha': 0.006}. Best is trial 4539 with value: 0.19155472534689352.
[I 2025-04-16 02:22:04,170] Trial 4649 finished with value: 0.04374282884486909 and parameters: {'n_estimators': 7379, 'min_samples_split': 6, 'max_features': 0.72, 'min_samples_leaf': 1, 'criterion': 'absolute_error', 'max_depth': 10, 'min_weight_fraction_leaf': 0.0, 'max_leaf_nodes': 10, 'bootstrap': False, 'ccp_alpha': 0.005}. Best is trial 4539 with value: 0.19155472534689352.
[I 2025-04-16 02:22:11,652] Trial 4650 finished with value: -0.1936417107583833 and parameters: {'n_estimators': 7724, 'min_samples_split': 13, 'max_features': 0.74, 'min_samples_leaf': 89, 'criterion': 'absolute_error', 'max_depth': 15, 'min_weight_fraction_leaf': 0.0, 'max_leaf_nodes': 10, 'bootstrap': False, 'ccp_alpha': 0.013000000000000001}. Best is trial 4539 with value: 0.19155472534689352.
[I 2025-04-16 02:22:12,735] Trial 4651 finished with value: -0.1396011613504449 and parameters: {'n_estimators': 617, 'min_samples_split': 2, 'max_features': 0.77, 'min_samples_leaf': 4, 'criterion': 'absolute_error', 'max_depth': 15, 'min_weight_fraction_leaf': 0.0, 'max_leaf_nodes': 10, 'bootstrap': False, 'ccp_alpha': 0.005}. Best is trial 4539 with value: 0.19155472534689352.
[I 2025-04-16 02:22:14,108] Trial 4652 finished with value: -17.162587798720892 and parameters: {'n_estimators': 890, 'min_samples_split': 9, 'max_features': 0.79, 'min_samples_leaf': 3, 'criterion': 'poisson', 'max_depth': 15, 'min_weight_fraction_leaf': 0.05, 'max_leaf_nodes': 10, 'bootstrap': False, 'ccp_alpha': 0.011}. Best is trial 4539 with value: 0.19155472534689352.
[I 2025-04-16 02:22:15,609] Trial 4653 finished with value: -5.471883622871931 and parameters: {'n_estimators': 1204, 'min_samples_split': 5, 'max_features': 0.74, 'min_samples_leaf': 1, 'criterion': 'absolute_error', 'max_depth': 15, 'min_weight_fraction_leaf': 0.0, 'max_leaf_nodes': 10, 'bootstrap': False, 'ccp_alpha': 0.0}. Best is trial 4539 with value: 0.19155472534689352.
[I 2025-04-16 02:22:16,627] Trial 4654 finished with value: -0.1936417107583833 and parameters: {'n_estimators': 484, 'min_samples_split': 9, 'max_features': 0.8, 'min_samples_leaf': 5, 'criterion': 'absolute_error', 'max_depth': 15, 'min_weight_fraction_leaf': 0.0, 'max_leaf_nodes': 10, 'bootstrap': False, 'ccp_alpha': 0.019}. Best is trial 4539 with value: 0.19155472534689352.
[I 2025-04-16 02:22:17,885] Trial 4655 finished with value: -0.1936417107583833 and parameters: {'n_estimators': 731, 'min_samples_split': 125, 'max_features': 0.81, 'min_samples_leaf': 7, 'criterion': 'absolute_error', 'max_depth': 15, 'min_weight_fraction_leaf': 0.0, 'max_leaf_nodes': 10, 'bootstrap': False, 'ccp_alpha': 0.01}. Best is trial 4539 with value: 0.19155472534689352.
[I 2025-04-16 02:22:18,688] Trial 4656 finished with value: -13.720966698788871 and parameters: {'n_estimators': 277, 'min_samples_split': 2, 'max_features': 0.77, 'min_samples_leaf': 3, 'criterion': 'absolute_error', 'max_depth': 15, 'min_weight_fraction_leaf': 0.0, 'max_leaf_nodes': 10, 'bootstrap': False, 'ccp_alpha': 0.0}. Best is trial 4539 with value: 0.19155472534689352.
[I 2025-04-16 02:22:20,133] Trial 4657 finished with value: 0.023797218250426154 and parameters: {'n_estimators': 1058, 'min_samples_split': 5, 'max_features': 0.72, 'min_samples_leaf': 1, 'criterion': 'absolute_error', 'max_depth': 15, 'min_weight_fraction_leaf': 0.0, 'max_leaf_nodes': 10, 'bootstrap': False, 'ccp_alpha': 0.005}. Best is trial 4539 with value: 0.19155472534689352.
[I 2025-04-16 02:22:21,289] Trial 4658 finished with value: -0.1936417107583833 and parameters: {'n_estimators': 527, 'min_samples_split': 13, 'max_features': 0.75, 'min_samples_leaf': 5, 'criterion': 'absolute_error', 'max_depth': 15, 'min_weight_fraction_leaf': 0.09, 'max_leaf_nodes': 10, 'bootstrap': False, 'ccp_alpha': 0.014}. Best is trial 4539 with value: 0.19155472534689352.
[I 2025-04-16 02:22:22,584] Trial 4659 finished with value: -0.1936417107583833 and parameters: {'n_estimators': 853, 'min_samples_split': 102, 'max_features': 0.7100000000000001, 'min_samples_leaf': 3, 'criterion': 'absolute_error', 'max_depth': 15, 'min_weight_fraction_leaf': 0.0, 'max_leaf_nodes': 10, 'bootstrap': False, 'ccp_alpha': 0.009000000000000001}. Best is trial 4539 with value: 0.19155472534689352.
[I 2025-04-16 02:22:23,441] Trial 4660 finished with value: -17.62433432515747 and parameters: {'n_estimators': 358, 'min_samples_split': 6, 'max_features': 0.81, 'min_samples_leaf': 1, 'criterion': 'absolute_error', 'max_depth': 15, 'min_weight_fraction_leaf': 0.0, 'max_leaf_nodes': None, 'bootstrap': False, 'ccp_alpha': 0.0}. Best is trial 4539 with value: 0.19155472534689352.
[I 2025-04-16 02:22:24,547] Trial 4661 finished with value: -17.528986382274862 and parameters: {'n_estimators': 706, 'min_samples_split': 9, 'max_features': 0.77, 'min_samples_leaf': 3, 'criterion': 'friedman_mse', 'max_depth': 15, 'min_weight_fraction_leaf': 0.0, 'max_leaf_nodes': 10, 'bootstrap': False, 'ccp_alpha': 0.018000000000000002}. Best is trial 4539 with value: 0.19155472534689352.
[I 2025-04-16 02:22:25,389] Trial 4662 finished with value: -0.1936417107583833 and parameters: {'n_estimators': 306, 'min_samples_split': 2, 'max_features': 0.79, 'min_samples_leaf': 5, 'criterion': 'absolute_error', 'max_depth': 15, 'min_weight_fraction_leaf': 0.0, 'max_leaf_nodes': 10, 'bootstrap': False, 'ccp_alpha': 0.006}. Best is trial 4539 with value: 0.19155472534689352.
[I 2025-04-16 02:22:26,442] Trial 4663 finished with value: -0.1936417107583833 and parameters: {'n_estimators': 529, 'min_samples_split': 6, 'max_features': 0.74, 'min_samples_leaf': 1, 'criterion': 'absolute_error', 'max_depth': 20, 'min_weight_fraction_leaf': 0.0, 'max_leaf_nodes': 10, 'bootstrap': False, 'ccp_alpha': 0.014}. Best is trial 4539 with value: 0.19155472534689352.
[I 2025-04-16 02:22:28,132] Trial 4664 finished with value: -0.07470007033913757 and parameters: {'n_estimators': 1261, 'min_samples_split': 12, 'max_features': 0.8200000000000001, 'min_samples_leaf': 7, 'criterion': 'absolute_error', 'max_depth': 45, 'min_weight_fraction_leaf': 0.0, 'max_leaf_nodes': 10, 'bootstrap': False, 'ccp_alpha': 0.005}. Best is trial 4539 with value: 0.19155472534689352.
[I 2025-04-16 02:22:29,642] Trial 4665 finished with value: -0.1936417107583833 and parameters: {'n_estimators': 960, 'min_samples_split': 2, 'max_features': 0.78, 'min_samples_leaf': 3, 'criterion': 'absolute_error', 'max_depth': 15, 'min_weight_fraction_leaf': 0.0, 'max_leaf_nodes': 10, 'bootstrap': False, 'ccp_alpha': 0.009000000000000001}. Best is trial 4539 with value: 0.19155472534689352.
[I 2025-04-16 02:22:30,799] Trial 4666 finished with value: -0.1936417107583833 and parameters: {'n_estimators': 682, 'min_samples_split': 9, 'max_features': 0.7100000000000001, 'min_samples_leaf': 1, 'criterion': 'absolute_error', 'max_depth': 15, 'min_weight_fraction_leaf': 0.0, 'max_leaf_nodes': 10, 'bootstrap': False, 'ccp_alpha': 0.023}. Best is trial 4539 with value: 0.19155472534689352.
[I 2025-04-16 02:22:31,739] Trial 4667 finished with value: -0.07423387865974702 and parameters: {'n_estimators': 345, 'min_samples_split': 6, 'max_features': 0.76, 'min_samples_leaf': 5, 'criterion': 'absolute_error', 'max_depth': 15, 'min_weight_fraction_leaf': 0.0, 'max_leaf_nodes': 10, 'bootstrap': False, 'ccp_alpha': 0.005}. Best is trial 4539 with value: 0.19155472534689352.
[I 2025-04-16 02:22:32,794] Trial 4668 finished with value: -0.1936417107583833 and parameters: {'n_estimators': 549, 'min_samples_split': 14, 'max_features': 0.73, 'min_samples_leaf': 41, 'criterion': 'absolute_error', 'max_depth': 15, 'min_weight_fraction_leaf': 0.0, 'max_leaf_nodes': 10, 'bootstrap': False, 'ccp_alpha': 0.0}. Best is trial 4539 with value: 0.19155472534689352.
[I 2025-04-16 02:22:34,170] Trial 4669 finished with value: -0.1936417107583833 and parameters: {'n_estimators': 827, 'min_samples_split': 2, 'max_features': 0.8200000000000001, 'min_samples_leaf': 3, 'criterion': 'absolute_error', 'max_depth': 15, 'min_weight_fraction_leaf': 0.0, 'max_leaf_nodes': 10, 'bootstrap': False, 'ccp_alpha': 0.013000000000000001}. Best is trial 4539 with value: 0.19155472534689352.
[I 2025-04-16 02:22:34,979] Trial 4670 finished with value: -17.52898638227488 and parameters: {'n_estimators': 293, 'min_samples_split': 9, 'max_features': 0.75, 'min_samples_leaf': 1, 'criterion': 'squared_error', 'max_depth': 15, 'min_weight_fraction_leaf': 0.0, 'max_leaf_nodes': 50, 'bootstrap': False, 'ccp_alpha': 0.018000000000000002}. Best is trial 4539 with value: 0.19155472534689352.
[I 2025-04-16 02:22:36,486] Trial 4671 finished with value: -0.1936417107583833 and parameters: {'n_estimators': 1058, 'min_samples_split': 5, 'max_features': 0.79, 'min_samples_leaf': 3, 'criterion': 'absolute_error', 'max_depth': 10, 'min_weight_fraction_leaf': 0.0, 'max_leaf_nodes': 10, 'bootstrap': False, 'ccp_alpha': 0.01}. Best is trial 4539 with value: 0.19155472534689352.
[I 2025-04-16 02:22:37,519] Trial 4672 finished with value: -0.1936417107583833 and parameters: {'n_estimators': 499, 'min_samples_split': 6, 'max_features': 0.72, 'min_samples_leaf': 5, 'criterion': 'absolute_error', 'max_depth': 15, 'min_weight_fraction_leaf': 0.0, 'max_leaf_nodes': 10, 'bootstrap': False, 'ccp_alpha': 0.132}. Best is trial 4539 with value: 0.19155472534689352.
[I 2025-04-16 02:22:38,730] Trial 4673 finished with value: -0.04328599353156017 and parameters: {'n_estimators': 736, 'min_samples_split': 2, 'max_features': 0.55, 'min_samples_leaf': 1, 'criterion': 'absolute_error', 'max_depth': 15, 'min_weight_fraction_leaf': 0.0, 'max_leaf_nodes': 10, 'bootstrap': False, 'ccp_alpha': 0.0}. Best is trial 4539 with value: 0.19155472534689352.
[I 2025-04-16 02:22:39,488] Trial 4674 finished with value: -0.1936417107583833 and parameters: {'n_estimators': 190, 'min_samples_split': 9, 'max_features': 0.77, 'min_samples_leaf': 83, 'criterion': 'absolute_error', 'max_depth': 15, 'min_weight_fraction_leaf': 0.0, 'max_leaf_nodes': 10, 'bootstrap': False, 'ccp_alpha': 0.006}. Best is trial 4539 with value: 0.19155472534689352.
[I 2025-04-16 02:22:40,512] Trial 4675 finished with value: -0.1936417107583833 and parameters: {'n_estimators': 473, 'min_samples_split': 14, 'max_features': 0.81, 'min_samples_leaf': 7, 'criterion': 'absolute_error', 'max_depth': 15, 'min_weight_fraction_leaf': 0.0, 'max_leaf_nodes': 10, 'bootstrap': False, 'ccp_alpha': 0.013000000000000001}. Best is trial 4539 with value: 0.19155472534689352.
[I 2025-04-16 02:22:41,861] Trial 4676 finished with value: 0.004877042307749213 and parameters: {'n_estimators': 887, 'min_samples_split': 5, 'max_features': 0.74, 'min_samples_leaf': 3, 'criterion': 'absolute_error', 'max_depth': 15, 'min_weight_fraction_leaf': 0.04, 'max_leaf_nodes': 10, 'bootstrap': False, 'ccp_alpha': 0.006}. Best is trial 4539 with value: 0.19155472534689352.
[I 2025-04-16 02:22:42,686] Trial 4677 finished with value: -19.282383077489015 and parameters: {'n_estimators': 288, 'min_samples_split': 2, 'max_features': 0.7100000000000001, 'min_samples_leaf': 1, 'criterion': 'poisson', 'max_depth': 15, 'min_weight_fraction_leaf': 0.0, 'max_leaf_nodes': 10, 'bootstrap': False, 'ccp_alpha': 0.017}. Best is trial 4539 with value: 0.19155472534689352.
[I 2025-04-16 02:22:50,347] Trial 4678 finished with value: -0.1936417107583833 and parameters: {'n_estimators': 9719, 'min_samples_split': 71, 'max_features': 0.76, 'min_samples_leaf': 4, 'criterion': 'absolute_error', 'max_depth': 15, 'min_weight_fraction_leaf': 0.0, 'max_leaf_nodes': None, 'bootstrap': False, 'ccp_alpha': 0.0}. Best is trial 4539 with value: 0.19155472534689352.
[I 2025-04-16 02:22:51,488] Trial 4679 finished with value: -0.1936417107583833 and parameters: {'n_estimators': 622, 'min_samples_split': 9, 'max_features': 0.79, 'min_samples_leaf': 3, 'criterion': 'absolute_error', 'max_depth': 15, 'min_weight_fraction_leaf': 0.0, 'max_leaf_nodes': 10, 'bootstrap': False, 'ccp_alpha': 0.01}. Best is trial 4539 with value: 0.19155472534689352.
[I 2025-04-16 02:22:52,603] Trial 4680 finished with value: -0.1936417107583833 and parameters: {'n_estimators': 656, 'min_samples_split': 6, 'max_features': 0.73, 'min_samples_leaf': 5, 'criterion': 'absolute_error', 'max_depth': 15, 'min_weight_fraction_leaf': 0.0, 'max_leaf_nodes': 50, 'bootstrap': False, 'ccp_alpha': 0.006}. Best is trial 4539 with value: 0.19155472534689352.
[I 2025-04-16 02:22:53,402] Trial 4681 finished with value: -0.1936417107583833 and parameters: {'n_estimators': 201, 'min_samples_split': 2, 'max_features': 0.8200000000000001, 'min_samples_leaf': 1, 'criterion': 'absolute_error', 'max_depth': 15, 'min_weight_fraction_leaf': 0.0, 'max_leaf_nodes': None, 'bootstrap': False, 'ccp_alpha': 0.024}. Best is trial 4539 with value: 0.19155472534689352.
[I 2025-04-16 02:22:54,971] Trial 4682 finished with value: -0.1936417107583833 and parameters: {'n_estimators': 1051, 'min_samples_split': 12, 'max_features': 0.75, 'min_samples_leaf': 3, 'criterion': 'absolute_error', 'max_depth': 15, 'min_weight_fraction_leaf': 0.0, 'max_leaf_nodes': 10, 'bootstrap': False, 'ccp_alpha': 0.013000000000000001}. Best is trial 4539 with value: 0.19155472534689352.
[I 2025-04-16 02:22:55,972] Trial 4683 finished with value: -6.49261591004481 and parameters: {'n_estimators': 526, 'min_samples_split': 9, 'max_features': 0.78, 'min_samples_leaf': 7, 'criterion': 'absolute_error', 'max_depth': 15, 'min_weight_fraction_leaf': 0.0, 'max_leaf_nodes': 10, 'bootstrap': False, 'ccp_alpha': 0.0}. Best is trial 4539 with value: 0.19155472534689352.
[I 2025-04-16 02:22:57,229] Trial 4684 finished with value: -0.007558665197998193 and parameters: {'n_estimators': 812, 'min_samples_split': 6, 'max_features': 0.8, 'min_samples_leaf': 1, 'criterion': 'absolute_error', 'max_depth': 15, 'min_weight_fraction_leaf': 0.0, 'max_leaf_nodes': None, 'bootstrap': False, 'ccp_alpha': 0.006}. Best is trial 4539 with value: 0.19155472534689352.
[I 2025-04-16 02:23:03,635] Trial 4685 finished with value: -17.52898638227068 and parameters: {'n_estimators': 6983, 'min_samples_split': 2, 'max_features': 0.7000000000000001, 'min_samples_leaf': 5, 'criterion': 'friedman_mse', 'max_depth': 15, 'min_weight_fraction_leaf': 0.0, 'max_leaf_nodes': 50, 'bootstrap': False, 'ccp_alpha': 0.018000000000000002}. Best is trial 4539 with value: 0.19155472534689352.
