[I 2025-04-16 02:20:19,763] Trial 4573 finished with value: -8.196553341291256 and parameters: {'n_estimators': 1254, 'min_samples_split': 6, 'max_features': 0.75, 'min_samples_leaf': 1, 'criterion': 'absolute_error', 'max_depth': 15, 'min_weight_fraction_leaf': 0.0, 'max_leaf_nodes': 10, 'bootstrap': False, 'ccp_alpha': 0.0}. Best is trial 4539 with value: 0.19155472534689352.
[I 2025-04-16 02:20:21,163] Trial 4574 finished with value: -17.528986382275573 and parameters: {'n_estimators': 968, 'min_samples_split': 9, 'max_features': 0.79, 'min_samples_leaf': 3, 'criterion': 'squared_error', 'max_depth': 15, 'min_weight_fraction_leaf': 0.04, 'max_leaf_nodes': 10, 'bootstrap': False, 'ccp_alpha': 0.20600000000000002}. Best is trial 4539 with value: 0.19155472534689352.
[I 2025-04-16 02:20:22,442] Trial 4575 finished with value: -9.968065342460182 and parameters: {'n_estimators': 773, 'min_samples_split': 2, 'max_features': 0.75, 'min_samples_leaf': 5, 'criterion': 'absolute_error', 'max_depth': 15, 'min_weight_fraction_leaf': 0.0, 'max_leaf_nodes': 10, 'bootstrap': False, 'ccp_alpha': 0.0}. Best is trial 4539 with value: 0.19155472534689352.
[I 2025-04-16 02:20:23,598] Trial 4576 finished with value: -14.88756515563826 and parameters: {'n_estimators': 662, 'min_samples_split': 13, 'max_features': 0.78, 'min_samples_leaf': 1, 'criterion': 'absolute_error', 'max_depth': 15, 'min_weight_fraction_leaf': 0.0, 'max_leaf_nodes': 10, 'bootstrap': False, 'ccp_alpha': 0.0}. Best is trial 4539 with value: 0.19155472534689352.
[I 2025-04-16 02:20:25,101] Trial 4577 finished with value: -0.1936417107583833 and parameters: {'n_estimators': 990, 'min_samples_split': 6, 'max_features': 0.77, 'min_samples_leaf': 7, 'criterion': 'absolute_error', 'max_depth': 15, 'min_weight_fraction_leaf': 0.0, 'max_leaf_nodes': 10, 'bootstrap': False, 'ccp_alpha': 0.009000000000000001}. Best is trial 4539 with value: 0.19155472534689352.
[I 2025-04-16 02:20:26,271] Trial 4578 finished with value: -11.910757472832609 and parameters: {'n_estimators': 676, 'min_samples_split': 9, 'max_features': 0.74, 'min_samples_leaf': 3, 'criterion': 'absolute_error', 'max_depth': 15, 'min_weight_fraction_leaf': 0.0, 'max_leaf_nodes': 10, 'bootstrap': False, 'ccp_alpha': 0.0}. Best is trial 4539 with value: 0.19155472534689352.
[I 2025-04-16 02:20:27,556] Trial 4579 finished with value: -0.1936417107583833 and parameters: {'n_estimators': 862, 'min_samples_split': 6, 'max_features': 0.8, 'min_samples_leaf': 4, 'criterion': 'absolute_error', 'max_depth': 10, 'min_weight_fraction_leaf': 0.0, 'max_leaf_nodes': 10, 'bootstrap': False, 'ccp_alpha': 0.009000000000000001}. Best is trial 4539 with value: 0.19155472534689352.
[I 2025-04-16 02:20:28,825] Trial 4580 finished with value: -17.04066718130419 and parameters: {'n_estimators': 701, 'min_samples_split': 2, 'max_features': 0.77, 'min_samples_leaf': 1, 'criterion': 'poisson', 'max_depth': 15, 'min_weight_fraction_leaf': 0.0, 'max_leaf_nodes': 10, 'bootstrap': False, 'ccp_alpha': 0.009000000000000001}. Best is trial 4539 with value: 0.19155472534689352.
[I 2025-04-16 02:20:30,422] Trial 4581 finished with value: -14.295264968795227 and parameters: {'n_estimators': 1145, 'min_samples_split': 6, 'max_features': 0.75, 'min_samples_leaf': 3, 'criterion': 'absolute_error', 'max_depth': 15, 'min_weight_fraction_leaf': 0.0, 'max_leaf_nodes': 10, 'bootstrap': False, 'ccp_alpha': 0.0}. Best is trial 4539 with value: 0.19155472534689352.
[I 2025-04-16 02:20:31,729] Trial 4582 finished with value: -0.1936417107583833 and parameters: {'n_estimators': 877, 'min_samples_split': 12, 'max_features': 0.74, 'min_samples_leaf': 5, 'criterion': 'absolute_error', 'max_depth': 15, 'min_weight_fraction_leaf': 0.0, 'max_leaf_nodes': 10, 'bootstrap': False, 'ccp_alpha': 0.009000000000000001}. Best is trial 4539 with value: 0.19155472534689352.
[I 2025-04-16 02:20:32,896] Trial 4583 finished with value: -0.1936417107583833 and parameters: {'n_estimators': 657, 'min_samples_split': 2, 'max_features': 0.8, 'min_samples_leaf': 1, 'criterion': 'absolute_error', 'max_depth': 15, 'min_weight_fraction_leaf': 0.0, 'max_leaf_nodes': 10, 'bootstrap': False, 'ccp_alpha': 0.009000000000000001}. Best is trial 4539 with value: 0.19155472534689352.
[I 2025-04-16 02:20:34,013] Trial 4584 finished with value: -11.783642704049225 and parameters: {'n_estimators': 670, 'min_samples_split': 9, 'max_features': 0.77, 'min_samples_leaf': 3, 'criterion': 'absolute_error', 'max_depth': 15, 'min_weight_fraction_leaf': 0.0, 'max_leaf_nodes': 10, 'bootstrap': False, 'ccp_alpha': 0.0}. Best is trial 4539 with value: 0.19155472534689352.
[I 2025-04-16 02:20:35,587] Trial 4585 finished with value: -0.1936417107583833 and parameters: {'n_estimators': 1029, 'min_samples_split': 6, 'max_features': 0.79, 'min_samples_leaf': 7, 'criterion': 'absolute_error', 'max_depth': 15, 'min_weight_fraction_leaf': 0.0, 'max_leaf_nodes': 10, 'bootstrap': False, 'ccp_alpha': 0.006}. Best is trial 4539 with value: 0.19155472534689352.
[I 2025-04-16 02:20:37,055] Trial 4586 finished with value: -0.1936417107583833 and parameters: {'n_estimators': 1219, 'min_samples_split': 2, 'max_features': 0.75, 'min_samples_leaf': 44, 'criterion': 'absolute_error', 'max_depth': 15, 'min_weight_fraction_leaf': 0.0, 'max_leaf_nodes': 10, 'bootstrap': False, 'ccp_alpha': 0.0}. Best is trial 4539 with value: 0.19155472534689352.
[I 2025-04-16 02:20:38,493] Trial 4587 finished with value: -0.1936417107583833 and parameters: {'n_estimators': 854, 'min_samples_split': 12, 'max_features': 0.74, 'min_samples_leaf': 1, 'criterion': 'absolute_error', 'max_depth': 15, 'min_weight_fraction_leaf': 0.0, 'max_leaf_nodes': 10, 'bootstrap': False, 'ccp_alpha': 0.006}. Best is trial 4539 with value: 0.19155472534689352.
[I 2025-04-16 02:20:39,664] Trial 4588 finished with value: -0.1936417107583833 and parameters: {'n_estimators': 650, 'min_samples_split': 6, 'max_features': 0.79, 'min_samples_leaf': 5, 'criterion': 'absolute_error', 'max_depth': 15, 'min_weight_fraction_leaf': 0.0, 'max_leaf_nodes': 10, 'bootstrap': False, 'ccp_alpha': 0.296}. Best is trial 4539 with value: 0.19155472534689352.
[I 2025-04-16 02:20:40,779] Trial 4589 finished with value: -0.1936417107583833 and parameters: {'n_estimators': 600, 'min_samples_split': 9, 'max_features': 0.77, 'min_samples_leaf': 3, 'criterion': 'absolute_error', 'max_depth': 15, 'min_weight_fraction_leaf': 0.0, 'max_leaf_nodes': 10, 'bootstrap': False, 'ccp_alpha': 0.009000000000000001}. Best is trial 4539 with value: 0.19155472534689352.
[I 2025-04-16 02:20:42,109] Trial 4590 finished with value: -17.528986382275306 and parameters: {'n_estimators': 865, 'min_samples_split': 2, 'max_features': 0.8, 'min_samples_leaf': 1, 'criterion': 'friedman_mse', 'max_depth': 15, 'min_weight_fraction_leaf': 0.0, 'max_leaf_nodes': 10, 'bootstrap': False, 'ccp_alpha': 0.009000000000000001}. Best is trial 4539 with value: 0.19155472534689352.
[I 2025-04-16 02:20:43,165] Trial 4591 finished with value: -14.301327355702579 and parameters: {'n_estimators': 602, 'min_samples_split': 6, 'max_features': 0.76, 'min_samples_leaf': 3, 'criterion': 'absolute_error', 'max_depth': 15, 'min_weight_fraction_leaf': 0.05, 'max_leaf_nodes': 10, 'bootstrap': False, 'ccp_alpha': 0.0}. Best is trial 4539 with value: 0.19155472534689352.
[I 2025-04-16 02:20:44,632] Trial 4592 finished with value: -0.1936417107583833 and parameters: {'n_estimators': 1038, 'min_samples_split': 12, 'max_features': 0.74, 'min_samples_leaf': 5, 'criterion': 'absolute_error', 'max_depth': 20, 'min_weight_fraction_leaf': 0.0, 'max_leaf_nodes': 10, 'bootstrap': False, 'ccp_alpha': 0.006}. Best is trial 4539 with value: 0.19155472534689352.
[I 2025-04-16 02:20:45,714] Trial 4593 finished with value: -0.1936417107583833 and parameters: {'n_estimators': 606, 'min_samples_split': 6, 'max_features': 0.5800000000000001, 'min_samples_leaf': 1, 'criterion': 'absolute_error', 'max_depth': 15, 'min_weight_fraction_leaf': 0.0, 'max_leaf_nodes': 10, 'bootstrap': False, 'ccp_alpha': 0.011}. Best is trial 4539 with value: 0.19155472534689352.
[I 2025-04-16 02:20:46,981] Trial 4594 finished with value: -0.1936417107583833 and parameters: {'n_estimators': 835, 'min_samples_split': 2, 'max_features': 0.78, 'min_samples_leaf': 86, 'criterion': 'absolute_error', 'max_depth': 45, 'min_weight_fraction_leaf': 0.0, 'max_leaf_nodes': 10, 'bootstrap': False, 'ccp_alpha': 0.006}. Best is trial 4539 with value: 0.19155472534689352.
[I 2025-04-16 02:20:48,030] Trial 4595 finished with value: -0.1936417107583833 and parameters: {'n_estimators': 577, 'min_samples_split': 6, 'max_features': 0.74, 'min_samples_leaf': 3, 'criterion': 'absolute_error', 'max_depth': 15, 'min_weight_fraction_leaf': 0.0, 'max_leaf_nodes': 10, 'bootstrap': False, 'ccp_alpha': 0.01}. Best is trial 4539 with value: 0.19155472534689352.
[I 2025-04-16 02:20:49,371] Trial 4596 finished with value: -7.582302548821173 and parameters: {'n_estimators': 1024, 'min_samples_split': 9, 'max_features': 0.8, 'min_samples_leaf': 7, 'criterion': 'absolute_error', 'max_depth': 15, 'min_weight_fraction_leaf': 0.0, 'max_leaf_nodes': 10, 'bootstrap': False, 'ccp_alpha': 0.0}. Best is trial 4539 with value: 0.19155472534689352.
[I 2025-04-16 02:20:50,627] Trial 4597 finished with value: -0.1936417107583833 and parameters: {'n_estimators': 778, 'min_samples_split': 2, 'max_features': 0.77, 'min_samples_leaf': 5, 'criterion': 'absolute_error', 'max_depth': 15, 'min_weight_fraction_leaf': 0.0, 'max_leaf_nodes': 10, 'bootstrap': False, 'ccp_alpha': 0.163}. Best is trial 4539 with value: 0.19155472534689352.
[I 2025-04-16 02:20:51,764] Trial 4598 finished with value: -17.528986382274873 and parameters: {'n_estimators': 575, 'min_samples_split': 13, 'max_features': 0.74, 'min_samples_leaf': 1, 'criterion': 'squared_error', 'max_depth': 15, 'min_weight_fraction_leaf': 0.0, 'max_leaf_nodes': 10, 'bootstrap': False, 'ccp_alpha': 0.006}. Best is trial 4539 with value: 0.19155472534689352.
[I 2025-04-16 02:20:52,825] Trial 4599 finished with value: -0.1936417107583833 and parameters: {'n_estimators': 536, 'min_samples_split': 9, 'max_features': 0.8, 'min_samples_leaf': 3, 'criterion': 'absolute_error', 'max_depth': 15, 'min_weight_fraction_leaf': 0.0, 'max_leaf_nodes': 10, 'bootstrap': False, 'ccp_alpha': 0.013000000000000001}. Best is trial 4539 with value: 0.19155472534689352.
[I 2025-04-16 02:20:54,038] Trial 4600 finished with value: -5.023683715143386 and parameters: {'n_estimators': 801, 'min_samples_split': 5, 'max_features': 0.76, 'min_samples_leaf': 1, 'criterion': 'absolute_error', 'max_depth': 15, 'min_weight_fraction_leaf': 0.0, 'max_leaf_nodes': 10, 'bootstrap': False, 'ccp_alpha': 0.0}. Best is trial 4539 with value: 0.19155472534689352.
[I 2025-04-16 02:20:55,724] Trial 4601 finished with value: -0.1936417107583833 and parameters: {'n_estimators': 1252, 'min_samples_split': 2, 'max_features': 0.78, 'min_samples_leaf': 5, 'criterion': 'absolute_error', 'max_depth': 15, 'min_weight_fraction_leaf': 0.0, 'max_leaf_nodes': 10, 'bootstrap': False, 'ccp_alpha': 0.006}. Best is trial 4539 with value: 0.19155472534689352.
[I 2025-04-16 02:20:56,842] Trial 4602 finished with value: -0.1936417107583833 and parameters: {'n_estimators': 531, 'min_samples_split': 6, 'max_features': 0.73, 'min_samples_leaf': 3, 'criterion': 'absolute_error', 'max_depth': 10, 'min_weight_fraction_leaf': 0.0, 'max_leaf_nodes': 10, 'bootstrap': False, 'ccp_alpha': 0.012}. Best is trial 4539 with value: 0.19155472534689352.
[I 2025-04-16 02:20:58,359] Trial 4603 finished with value: -0.1936417107583833 and parameters: {'n_estimators': 999, 'min_samples_split': 96, 'max_features': 0.76, 'min_samples_leaf': 1, 'criterion': 'absolute_error', 'max_depth': 15, 'min_weight_fraction_leaf': 0.0, 'max_leaf_nodes': 10, 'bootstrap': False, 'ccp_alpha': 0.006}. Best is trial 4539 with value: 0.19155472534689352.
[I 2025-04-16 02:20:59,561] Trial 4604 finished with value: -11.412227696467218 and parameters: {'n_estimators': 741, 'min_samples_split': 13, 'max_features': 0.74, 'min_samples_leaf': 3, 'criterion': 'poisson', 'max_depth': 15, 'min_weight_fraction_leaf': 0.1, 'max_leaf_nodes': 10, 'bootstrap': False, 'ccp_alpha': 0.006}. Best is trial 4539 with value: 0.19155472534689352.
[I 2025-04-16 02:21:00,581] Trial 4605 finished with value: -0.1936417107583833 and parameters: {'n_estimators': 505, 'min_samples_split': 9, 'max_features': 0.79, 'min_samples_leaf': 7, 'criterion': 'absolute_error', 'max_depth': 15, 'min_weight_fraction_leaf': 0.0, 'max_leaf_nodes': 10, 'bootstrap': False, 'ccp_alpha': 0.013000000000000001}. Best is trial 4539 with value: 0.19155472534689352.
[I 2025-04-16 02:21:01,961] Trial 4606 finished with value: -11.422660523192805 and parameters: {'n_estimators': 915, 'min_samples_split': 5, 'max_features': 0.8, 'min_samples_leaf': 5, 'criterion': 'absolute_error', 'max_depth': 15, 'min_weight_fraction_leaf': 0.0, 'max_leaf_nodes': 10, 'bootstrap': False, 'ccp_alpha': 0.0}. Best is trial 4539 with value: 0.19155472534689352.
[I 2025-04-16 02:21:03,252] Trial 4607 finished with value: -0.1936417107583833 and parameters: {'n_estimators': 729, 'min_samples_split': 2, 'max_features': 0.77, 'min_samples_leaf': 1, 'criterion': 'absolute_error', 'max_depth': 15, 'min_weight_fraction_leaf': 0.0, 'max_leaf_nodes': 10, 'bootstrap': False, 'ccp_alpha': 0.012}. Best is trial 4539 with value: 0.19155472534689352.
[I 2025-04-16 02:21:04,918] Trial 4608 finished with value: -0.1936417107583833 and parameters: {'n_estimators': 1250, 'min_samples_split': 9, 'max_features': 0.74, 'min_samples_leaf': 3, 'criterion': 'absolute_error', 'max_depth': 15, 'min_weight_fraction_leaf': 0.0, 'max_leaf_nodes': 10, 'bootstrap': False, 'ccp_alpha': 0.006}. Best is trial 4539 with value: 0.19155472534689352.
[I 2025-04-16 02:21:05,984] Trial 4609 finished with value: -11.45316745972097 and parameters: {'n_estimators': 583, 'min_samples_split': 6, 'max_features': 0.8, 'min_samples_leaf': 4, 'criterion': 'absolute_error', 'max_depth': 15, 'min_weight_fraction_leaf': 0.0, 'max_leaf_nodes': 10, 'bootstrap': False, 'ccp_alpha': 0.0}. Best is trial 4539 with value: 0.19155472534689352.
[I 2025-04-16 02:21:07,003] Trial 4610 finished with value: -0.1936417107583833 and parameters: {'n_estimators': 525, 'min_samples_split': 2, 'max_features': 0.76, 'min_samples_leaf': 1, 'criterion': 'absolute_error', 'max_depth': 15, 'min_weight_fraction_leaf': 0.0, 'max_leaf_nodes': 10, 'bootstrap': False, 'ccp_alpha': 0.013000000000000001}. Best is trial 4539 with value: 0.19155472534689352.
[I 2025-04-16 02:21:08,419] Trial 4611 finished with value: -0.11262353047227983 and parameters: {'n_estimators': 1034, 'min_samples_split': 12, 'max_features': 0.73, 'min_samples_leaf': 3, 'criterion': 'absolute_error', 'max_depth': 15, 'min_weight_fraction_leaf': 0.0, 'max_leaf_nodes': 10, 'bootstrap': False, 'ccp_alpha': 0.005}. Best is trial 4539 with value: 0.19155472534689352.
[I 2025-04-16 02:21:09,646] Trial 4612 finished with value: -0.1936417107583833 and parameters: {'n_estimators': 764, 'min_samples_split': 9, 'max_features': 0.78, 'min_samples_leaf': 7, 'criterion': 'absolute_error', 'max_depth': 15, 'min_weight_fraction_leaf': 0.0, 'max_leaf_nodes': 10, 'bootstrap': False, 'ccp_alpha': 0.009000000000000001}. Best is trial 4539 with value: 0.19155472534689352.
[I 2025-04-16 02:21:10,649] Trial 4613 finished with value: -17.528986382274873 and parameters: {'n_estimators': 477, 'min_samples_split': 6, 'max_features': 0.75, 'min_samples_leaf': 5, 'criterion': 'friedman_mse', 'max_depth': 15, 'min_weight_fraction_leaf': 0.0, 'max_leaf_nodes': 10, 'bootstrap': False, 'ccp_alpha': 0.005}. Best is trial 4539 with value: 0.19155472534689352.
[I 2025-04-16 02:21:11,818] Trial 4614 finished with value: -0.1936417107583833 and parameters: {'n_estimators': 679, 'min_samples_split': 2, 'max_features': 0.8, 'min_samples_leaf': 1, 'criterion': 'absolute_error', 'max_depth': 15, 'min_weight_fraction_leaf': 0.0, 'max_leaf_nodes': 10, 'bootstrap': False, 'ccp_alpha': 0.014}. Best is trial 4539 with value: 0.19155472534689352.
[I 2025-04-16 02:21:12,849] Trial 4615 finished with value: -0.1936417107583833 and parameters: {'n_estimators': 465, 'min_samples_split': 13, 'max_features': 0.73, 'min_samples_leaf': 3, 'criterion': 'absolute_error', 'max_depth': 15, 'min_weight_fraction_leaf': 0.0, 'max_leaf_nodes': 10, 'bootstrap': False, 'ccp_alpha': 0.271}. Best is trial 4539 with value: 0.19155472534689352.
[I 2025-04-16 02:21:14,203] Trial 4616 finished with value: 0.010067062059708887 and parameters: {'n_estimators': 917, 'min_samples_split': 6, 'max_features': 0.75, 'min_samples_leaf': 1, 'criterion': 'absolute_error', 'max_depth': 20, 'min_weight_fraction_leaf': 0.0, 'max_leaf_nodes': 10, 'bootstrap': False, 'ccp_alpha': 0.006}. Best is trial 4539 with value: 0.19155472534689352.
[I 2025-04-16 02:21:15,323] Trial 4617 finished with value: -9.713250952023667 and parameters: {'n_estimators': 662, 'min_samples_split': 2, 'max_features': 0.77, 'min_samples_leaf': 5, 'criterion': 'absolute_error', 'max_depth': 15, 'min_weight_fraction_leaf': 0.0, 'max_leaf_nodes': 10, 'bootstrap': False, 'ccp_alpha': 0.0}. Best is trial 4539 with value: 0.19155472534689352.
[I 2025-04-16 02:21:16,959] Trial 4618 finished with value: -0.1936417107583833 and parameters: {'n_estimators': 1209, 'min_samples_split': 9, 'max_features': 0.81, 'min_samples_leaf': 3, 'criterion': 'absolute_error', 'max_depth': 15, 'min_weight_fraction_leaf': 0.0, 'max_leaf_nodes': 10, 'bootstrap': False, 'ccp_alpha': 0.01}. Best is trial 4539 with value: 0.19155472534689352.
[I 2025-04-16 02:21:17,971] Trial 4619 finished with value: -7.312434605017399 and parameters: {'n_estimators': 506, 'min_samples_split': 6, 'max_features': 0.73, 'min_samples_leaf': 1, 'criterion': 'absolute_error', 'max_depth': 45, 'min_weight_fraction_leaf': 0.0, 'max_leaf_nodes': 10, 'bootstrap': False, 'ccp_alpha': 0.0}. Best is trial 4539 with value: 0.19155472534689352.
[I 2025-04-16 02:21:19,421] Trial 4620 finished with value: -0.1936417107583833 and parameters: {'n_estimators': 905, 'min_samples_split': 5, 'max_features': 0.78, 'min_samples_leaf': 3, 'criterion': 'absolute_error', 'max_depth': 15, 'min_weight_fraction_leaf': 0.0, 'max_leaf_nodes': 10, 'bootstrap': False, 'ccp_alpha': 0.015}. Best is trial 4539 with value: 0.19155472534689352.
[I 2025-04-16 02:21:20,313] Trial 4621 finished with value: -0.1936417107583833 and parameters: {'n_estimators': 366, 'min_samples_split': 13, 'max_features': 0.8, 'min_samples_leaf': 69, 'criterion': 'absolute_error', 'max_depth': 15, 'min_weight_fraction_leaf': 0.0, 'max_leaf_nodes': 50, 'bootstrap': False, 'ccp_alpha': 0.01}. Best is trial 4539 with value: 0.19155472534689352.
[I 2025-04-16 02:21:21,464] Trial 4622 finished with value: -0.15522393766775983 and parameters: {'n_estimators': 701, 'min_samples_split': 2, 'max_features': 0.76, 'min_samples_leaf': 7, 'criterion': 'absolute_error', 'max_depth': 15, 'min_weight_fraction_leaf': 0.0, 'max_leaf_nodes': 10, 'bootstrap': False, 'ccp_alpha': 0.005}. Best is trial 4539 with value: 0.19155472534689352.
[I 2025-04-16 02:21:22,463] Trial 4623 finished with value: -0.1936417107583833 and parameters: {'n_estimators': 443, 'min_samples_split': 9, 'max_features': 0.72, 'min_samples_leaf': 5, 'criterion': 'absolute_error', 'max_depth': 15, 'min_weight_fraction_leaf': 0.0, 'max_leaf_nodes': 10, 'bootstrap': False, 'ccp_alpha': 0.01}. Best is trial 4539 with value: 0.19155472534689352.
[I 2025-04-16 02:21:23,828] Trial 4624 finished with value: -2.7118379397118773 and parameters: {'n_estimators': 1058, 'min_samples_split': 6, 'max_features': 0.78, 'min_samples_leaf': 1, 'criterion': 'squared_error', 'max_depth': 15, 'min_weight_fraction_leaf': 0.0, 'max_leaf_nodes': 10, 'bootstrap': False, 'ccp_alpha': 0.0}. Best is trial 4539 with value: 0.19155472534689352.
[I 2025-04-16 02:21:25,119] Trial 4625 finished with value: 0.0058927761181252645 and parameters: {'n_estimators': 830, 'min_samples_split': 2, 'max_features': 0.74, 'min_samples_leaf': 3, 'criterion': 'absolute_error', 'max_depth': 10, 'min_weight_fraction_leaf': 0.0, 'max_leaf_nodes': 10, 'bootstrap': False, 'ccp_alpha': 0.006}. Best is trial 4539 with value: 0.19155472534689352.
[I 2025-04-16 02:21:32,335] Trial 4626 finished with value: -0.1936417107583833 and parameters: {'n_estimators': 8299, 'min_samples_split': 12, 'max_features': 0.81, 'min_samples_leaf': 1, 'criterion': 'absolute_error', 'max_depth': 15, 'min_weight_fraction_leaf': 0.0, 'max_leaf_nodes': 10, 'bootstrap': False, 'ccp_alpha': 0.016}. Best is trial 4539 with value: 0.19155472534689352.
[I 2025-04-16 02:21:33,306] Trial 4627 finished with value: -0.1936417107583833 and parameters: {'n_estimators': 435, 'min_samples_split': 6, 'max_features': 0.76, 'min_samples_leaf': 5, 'criterion': 'absolute_error', 'max_depth': 15, 'min_weight_fraction_leaf': 0.0, 'max_leaf_nodes': 10, 'bootstrap': False, 'ccp_alpha': 0.006}. Best is trial 4539 with value: 0.19155472534689352.
[I 2025-04-16 02:21:34,420] Trial 4628 finished with value: -17.27526039927673 and parameters: {'n_estimators': 663, 'min_samples_split': 9, 'max_features': 0.72, 'min_samples_leaf': 3, 'criterion': 'poisson', 'max_depth': 15, 'min_weight_fraction_leaf': 0.0, 'max_leaf_nodes': 10, 'bootstrap': False, 'ccp_alpha': 0.0}. Best is trial 4539 with value: 0.19155472534689352.
[I 2025-04-16 02:21:35,504] Trial 4629 finished with value: -0.1936417107583833 and parameters: {'n_estimators': 431, 'min_samples_split': 2, 'max_features': 0.79, 'min_samples_leaf': 1, 'criterion': 'absolute_error', 'max_depth': 15, 'min_weight_fraction_leaf': 0.0, 'max_leaf_nodes': None, 'bootstrap': False, 'ccp_alpha': 0.014}. Best is trial 4539 with value: 0.19155472534689352.
