[I 2025-04-16 02:23:04,508] Trial 4686 finished with value: -0.1936417107583833 and parameters: {'n_estimators': 329, 'min_samples_split': 11, 'max_features': 0.77, 'min_samples_leaf': 3, 'criterion': 'absolute_error', 'max_depth': 15, 'min_weight_fraction_leaf': 0.0, 'max_leaf_nodes': 10, 'bootstrap': False, 'ccp_alpha': 0.009000000000000001}. Best is trial 4539 with value: 0.19155472534689352.
[I 2025-04-16 02:23:06,105] Trial 4687 finished with value: 0.023079011697694485 and parameters: {'n_estimators': 1237, 'min_samples_split': 6, 'max_features': 0.62, 'min_samples_leaf': 1, 'criterion': 'absolute_error', 'max_depth': 15, 'min_weight_fraction_leaf': 0.0, 'max_leaf_nodes': None, 'bootstrap': False, 'ccp_alpha': 0.005}. Best is trial 4539 with value: 0.19155472534689352.
[I 2025-04-16 02:23:07,045] Trial 4688 finished with value: -0.1936417107583833 and parameters: {'n_estimators': 408, 'min_samples_split': 6, 'max_features': 0.73, 'min_samples_leaf': 3, 'criterion': 'absolute_error', 'max_depth': 45, 'min_weight_fraction_leaf': 0.0, 'max_leaf_nodes': 10, 'bootstrap': False, 'ccp_alpha': 0.013000000000000001}. Best is trial 4539 with value: 0.19155472534689352.
[I 2025-04-16 02:23:07,797] Trial 4689 finished with value: -0.1936417107583833 and parameters: {'n_estimators': 183, 'min_samples_split': 14, 'max_features': 0.8200000000000001, 'min_samples_leaf': 5, 'criterion': 'absolute_error', 'max_depth': 20, 'min_weight_fraction_leaf': 0.0, 'max_leaf_nodes': None, 'bootstrap': False, 'ccp_alpha': 0.006}. Best is trial 4539 with value: 0.19155472534689352.
[I 2025-04-16 02:23:08,981] Trial 4690 finished with value: 0.18319610467890607 and parameters: {'n_estimators': 774, 'min_samples_split': 2, 'max_features': 0.7100000000000001, 'min_samples_leaf': 1, 'criterion': 'absolute_error', 'max_depth': 15, 'min_weight_fraction_leaf': 0.0, 'max_leaf_nodes': 10, 'bootstrap': False, 'ccp_alpha': 0.0}. Best is trial 4539 with value: 0.19155472534689352.
[I 2025-04-16 02:23:10,406] Trial 4691 finished with value: -6.440095886896307 and parameters: {'n_estimators': 1053, 'min_samples_split': 9, 'max_features': 0.76, 'min_samples_leaf': 7, 'criterion': 'absolute_error', 'max_depth': 15, 'min_weight_fraction_leaf': 0.0, 'max_leaf_nodes': 10, 'bootstrap': False, 'ccp_alpha': 0.0}. Best is trial 4539 with value: 0.19155472534689352.
[I 2025-04-16 02:23:11,813] Trial 4692 finished with value: -0.1936417107583833 and parameters: {'n_estimators': 1011, 'min_samples_split': 111, 'max_features': 0.8, 'min_samples_leaf': 3, 'criterion': 'absolute_error', 'max_depth': 15, 'min_weight_fraction_leaf': 0.0, 'max_leaf_nodes': 10, 'bootstrap': False, 'ccp_alpha': 0.005}. Best is trial 4539 with value: 0.19155472534689352.
[I 2025-04-16 02:23:13,470] Trial 4693 finished with value: -5.1242709262819615 and parameters: {'n_estimators': 1295, 'min_samples_split': 5, 'max_features': 0.74, 'min_samples_leaf': 1, 'criterion': 'absolute_error', 'max_depth': 15, 'min_weight_fraction_leaf': 0.0, 'max_leaf_nodes': 10, 'bootstrap': False, 'ccp_alpha': 0.0}. Best is trial 4539 with value: 0.19155472534689352.
[I 2025-04-16 02:23:15,160] Trial 4694 finished with value: -17.52898638227609 and parameters: {'n_estimators': 1266, 'min_samples_split': 2, 'max_features': 0.78, 'min_samples_leaf': 5, 'criterion': 'squared_error', 'max_depth': 15, 'min_weight_fraction_leaf': 0.0, 'max_leaf_nodes': 10, 'bootstrap': False, 'ccp_alpha': 0.005}. Best is trial 4539 with value: 0.19155472534689352.
[I 2025-04-16 02:23:16,684] Trial 4695 finished with value: -0.07721010724078607 and parameters: {'n_estimators': 1079, 'min_samples_split': 9, 'max_features': 0.8200000000000001, 'min_samples_leaf': 3, 'criterion': 'absolute_error', 'max_depth': 10, 'min_weight_fraction_leaf': 0.0, 'max_leaf_nodes': 10, 'bootstrap': False, 'ccp_alpha': 0.005}. Best is trial 4539 with value: 0.19155472534689352.
[I 2025-04-16 02:23:17,963] Trial 4696 finished with value: -9.410282774396276 and parameters: {'n_estimators': 926, 'min_samples_split': 14, 'max_features': 0.7100000000000001, 'min_samples_leaf': 1, 'criterion': 'absolute_error', 'max_depth': 15, 'min_weight_fraction_leaf': 0.0, 'max_leaf_nodes': 10, 'bootstrap': False, 'ccp_alpha': 0.0}. Best is trial 4539 with value: 0.19155472534689352.
[I 2025-04-16 02:23:19,645] Trial 4697 finished with value: -0.1936417107583833 and parameters: {'n_estimators': 1249, 'min_samples_split': 6, 'max_features': 0.75, 'min_samples_leaf': 4, 'criterion': 'absolute_error', 'max_depth': 15, 'min_weight_fraction_leaf': 0.0, 'max_leaf_nodes': 10, 'bootstrap': False, 'ccp_alpha': 0.007}. Best is trial 4539 with value: 0.19155472534689352.
[I 2025-04-16 02:23:21,021] Trial 4698 finished with value: -14.588102240740763 and parameters: {'n_estimators': 928, 'min_samples_split': 2, 'max_features': 0.79, 'min_samples_leaf': 3, 'criterion': 'absolute_error', 'max_depth': 15, 'min_weight_fraction_leaf': 0.0, 'max_leaf_nodes': 10, 'bootstrap': False, 'ccp_alpha': 0.0}. Best is trial 4539 with value: 0.19155472534689352.
[I 2025-04-16 02:23:22,601] Trial 4699 finished with value: -0.09500971859974623 and parameters: {'n_estimators': 1092, 'min_samples_split': 9, 'max_features': 0.73, 'min_samples_leaf': 6, 'criterion': 'absolute_error', 'max_depth': 15, 'min_weight_fraction_leaf': 0.0, 'max_leaf_nodes': 10, 'bootstrap': False, 'ccp_alpha': 0.005}. Best is trial 4539 with value: 0.19155472534689352.
[I 2025-04-16 02:23:23,922] Trial 4700 finished with value: -18.580183319995506 and parameters: {'n_estimators': 924, 'min_samples_split': 6, 'max_features': 0.77, 'min_samples_leaf': 1, 'criterion': 'absolute_error', 'max_depth': 15, 'min_weight_fraction_leaf': 0.0, 'max_leaf_nodes': None, 'bootstrap': False, 'ccp_alpha': 0.0}. Best is trial 4539 with value: 0.19155472534689352.
[I 2025-04-16 02:23:25,286] Trial 4701 finished with value: -13.859520325701556 and parameters: {'n_estimators': 813, 'min_samples_split': 12, 'max_features': 0.6900000000000001, 'min_samples_leaf': 3, 'criterion': 'poisson', 'max_depth': 15, 'min_weight_fraction_leaf': 0.0, 'max_leaf_nodes': 10, 'bootstrap': False, 'ccp_alpha': 0.005}. Best is trial 4539 with value: 0.19155472534689352.
[I 2025-04-16 02:23:26,785] Trial 4702 finished with value: 0.011580191813775587 and parameters: {'n_estimators': 1122, 'min_samples_split': 2, 'max_features': 0.81, 'min_samples_leaf': 1, 'criterion': 'absolute_error', 'max_depth': 15, 'min_weight_fraction_leaf': 0.0, 'max_leaf_nodes': 10, 'bootstrap': False, 'ccp_alpha': 0.0}. Best is trial 4539 with value: 0.19155472534689352.
[I 2025-04-16 02:23:28,085] Trial 4703 finished with value: -0.1936417107583833 and parameters: {'n_estimators': 862, 'min_samples_split': 6, 'max_features': 0.75, 'min_samples_leaf': 5, 'criterion': 'absolute_error', 'max_depth': 15, 'min_weight_fraction_leaf': 0.0, 'max_leaf_nodes': 10, 'bootstrap': False, 'ccp_alpha': 0.185}. Best is trial 4539 with value: 0.19155472534689352.
[I 2025-04-16 02:23:29,399] Trial 4704 finished with value: -0.1936417107583833 and parameters: {'n_estimators': 803, 'min_samples_split': 9, 'max_features': 0.73, 'min_samples_leaf': 7, 'criterion': 'absolute_error', 'max_depth': 15, 'min_weight_fraction_leaf': 0.0, 'max_leaf_nodes': 10, 'bootstrap': False, 'ccp_alpha': 0.01}. Best is trial 4539 with value: 0.19155472534689352.
[I 2025-04-16 02:23:30,808] Trial 4705 finished with value: -14.357903941207733 and parameters: {'n_estimators': 1074, 'min_samples_split': 2, 'max_features': 0.7100000000000001, 'min_samples_leaf': 3, 'criterion': 'absolute_error', 'max_depth': 15, 'min_weight_fraction_leaf': 0.0, 'max_leaf_nodes': 10, 'bootstrap': False, 'ccp_alpha': 0.0}. Best is trial 4539 with value: 0.19155472534689352.
[I 2025-04-16 02:23:32,398] Trial 4706 finished with value: -4.7538884215245645 and parameters: {'n_estimators': 1260, 'min_samples_split': 6, 'max_features': 0.8200000000000001, 'min_samples_leaf': 1, 'criterion': 'absolute_error', 'max_depth': 15, 'min_weight_fraction_leaf': 0.0, 'max_leaf_nodes': 10, 'bootstrap': False, 'ccp_alpha': 0.0}. Best is trial 4539 with value: 0.19155472534689352.
[I 2025-04-16 02:23:33,630] Trial 4707 finished with value: -6.917970300650057 and parameters: {'n_estimators': 782, 'min_samples_split': 14, 'max_features': 0.77, 'min_samples_leaf': 4, 'criterion': 'absolute_error', 'max_depth': 15, 'min_weight_fraction_leaf': 0.0, 'max_leaf_nodes': 10, 'bootstrap': False, 'ccp_alpha': 0.0}. Best is trial 4539 with value: 0.19155472534689352.
[I 2025-04-16 02:23:35,014] Trial 4708 finished with value: -17.17462985179943 and parameters: {'n_estimators': 977, 'min_samples_split': 11, 'max_features': 0.79, 'min_samples_leaf': 1, 'criterion': 'absolute_error', 'max_depth': 15, 'min_weight_fraction_leaf': 0.0, 'max_leaf_nodes': 10, 'bootstrap': False, 'ccp_alpha': 0.0}. Best is trial 4539 with value: 0.19155472534689352.
[I 2025-04-16 02:23:36,238] Trial 4709 finished with value: -7.516367570664173 and parameters: {'n_estimators': 821, 'min_samples_split': 5, 'max_features': 0.75, 'min_samples_leaf': 3, 'criterion': 'friedman_mse', 'max_depth': 15, 'min_weight_fraction_leaf': 0.0, 'max_leaf_nodes': 10, 'bootstrap': False, 'ccp_alpha': 0.0}. Best is trial 4539 with value: 0.19155472534689352.
[I 2025-04-16 02:23:37,509] Trial 4710 finished with value: -0.1936417107583833 and parameters: {'n_estimators': 759, 'min_samples_split': 2, 'max_features': 0.6900000000000001, 'min_samples_leaf': 5, 'criterion': 'absolute_error', 'max_depth': 20, 'min_weight_fraction_leaf': 0.0, 'max_leaf_nodes': 10, 'bootstrap': False, 'ccp_alpha': 0.01}. Best is trial 4539 with value: 0.19155472534689352.
[I 2025-04-16 02:23:38,687] Trial 4711 finished with value: -0.1936417107583833 and parameters: {'n_estimators': 704, 'min_samples_split': 9, 'max_features': 0.8, 'min_samples_leaf': 1, 'criterion': 'absolute_error', 'max_depth': 15, 'min_weight_fraction_leaf': 0.0, 'max_leaf_nodes': 10, 'bootstrap': False, 'ccp_alpha': 0.01}. Best is trial 4539 with value: 0.19155472534689352.
[I 2025-04-16 02:23:39,994] Trial 4712 finished with value: -0.1936417107583833 and parameters: {'n_estimators': 1008, 'min_samples_split': 6, 'max_features': 0.72, 'min_samples_leaf': 62, 'criterion': 'absolute_error', 'max_depth': 15, 'min_weight_fraction_leaf': 0.0, 'max_leaf_nodes': 10, 'bootstrap': False, 'ccp_alpha': 0.0}. Best is trial 4539 with value: 0.19155472534689352.
[I 2025-04-16 02:23:41,194] Trial 4713 finished with value: -0.1936417107583833 and parameters: {'n_estimators': 689, 'min_samples_split': 2, 'max_features': 0.8200000000000001, 'min_samples_leaf': 7, 'criterion': 'absolute_error', 'max_depth': 15, 'min_weight_fraction_leaf': 0.0, 'max_leaf_nodes': 10, 'bootstrap': False, 'ccp_alpha': 0.009000000000000001}. Best is trial 4539 with value: 0.19155472534689352.
[I 2025-04-16 02:23:42,841] Trial 4714 finished with value: -0.1936417107583833 and parameters: {'n_estimators': 1258, 'min_samples_split': 11, 'max_features': 0.76, 'min_samples_leaf': 3, 'criterion': 'absolute_error', 'max_depth': 15, 'min_weight_fraction_leaf': 0.0, 'max_leaf_nodes': 10, 'bootstrap': False, 'ccp_alpha': 0.006}. Best is trial 4539 with value: 0.19155472534689352.
[I 2025-04-16 02:23:44,220] Trial 4715 finished with value: -0.1936417107583833 and parameters: {'n_estimators': 903, 'min_samples_split': 5, 'max_features': 0.74, 'min_samples_leaf': 5, 'criterion': 'absolute_error', 'max_depth': 15, 'min_weight_fraction_leaf': 0.0, 'max_leaf_nodes': 10, 'bootstrap': False, 'ccp_alpha': 0.006}. Best is trial 4539 with value: 0.19155472534689352.
[I 2025-04-16 02:23:45,337] Trial 4716 finished with value: -0.1936417107583833 and parameters: {'n_estimators': 671, 'min_samples_split': 9, 'max_features': 0.79, 'min_samples_leaf': 1, 'criterion': 'absolute_error', 'max_depth': 45, 'min_weight_fraction_leaf': 0.0, 'max_leaf_nodes': 10, 'bootstrap': False, 'ccp_alpha': 0.013000000000000001}. Best is trial 4539 with value: 0.19155472534689352.
[I 2025-04-16 02:23:46,853] Trial 4717 finished with value: -14.439057991327832 and parameters: {'n_estimators': 1064, 'min_samples_split': 2, 'max_features': 0.77, 'min_samples_leaf': 3, 'criterion': 'absolute_error', 'max_depth': 15, 'min_weight_fraction_leaf': 0.0, 'max_leaf_nodes': 10, 'bootstrap': False, 'ccp_alpha': 0.0}. Best is trial 4539 with value: 0.19155472534689352.
[I 2025-04-16 02:23:48,013] Trial 4718 finished with value: -17.528986382274862 and parameters: {'n_estimators': 672, 'min_samples_split': 6, 'max_features': 0.72, 'min_samples_leaf': 3, 'criterion': 'squared_error', 'max_depth': 15, 'min_weight_fraction_leaf': 0.0, 'max_leaf_nodes': 10, 'bootstrap': False, 'ccp_alpha': 0.255}. Best is trial 4539 with value: 0.19155472534689352.
[I 2025-04-16 02:23:49,406] Trial 4719 finished with value: -0.1936417107583833 and parameters: {'n_estimators': 908, 'min_samples_split': 6, 'max_features': 0.7000000000000001, 'min_samples_leaf': 1, 'criterion': 'absolute_error', 'max_depth': 15, 'min_weight_fraction_leaf': 0.0, 'max_leaf_nodes': 10, 'bootstrap': False, 'ccp_alpha': 0.01}. Best is trial 4539 with value: 0.19155472534689352.
[I 2025-04-16 02:23:50,545] Trial 4720 finished with value: -0.1936417107583833 and parameters: {'n_estimators': 630, 'min_samples_split': 13, 'max_features': 0.8200000000000001, 'min_samples_leaf': 5, 'criterion': 'absolute_error', 'max_depth': 15, 'min_weight_fraction_leaf': 0.0, 'max_leaf_nodes': 10, 'bootstrap': False, 'ccp_alpha': 0.006}. Best is trial 4539 with value: 0.19155472534689352.
[I 2025-04-16 02:23:51,838] Trial 4721 finished with value: -0.1936417107583833 and parameters: {'n_estimators': 803, 'min_samples_split': 2, 'max_features': 0.74, 'min_samples_leaf': 3, 'criterion': 'absolute_error', 'max_depth': 10, 'min_weight_fraction_leaf': 0.0, 'max_leaf_nodes': 10, 'bootstrap': False, 'ccp_alpha': 0.015}. Best is trial 4539 with value: 0.19155472534689352.
[I 2025-04-16 02:23:53,284] Trial 4722 finished with value: -7.580475255862913 and parameters: {'n_estimators': 1107, 'min_samples_split': 9, 'max_features': 0.8, 'min_samples_leaf': 7, 'criterion': 'absolute_error', 'max_depth': 15, 'min_weight_fraction_leaf': 0.0, 'max_leaf_nodes': 10, 'bootstrap': False, 'ccp_alpha': 0.0}. Best is trial 4539 with value: 0.19155472534689352.
[I 2025-04-16 02:23:54,408] Trial 4723 finished with value: -0.19195580783641986 and parameters: {'n_estimators': 625, 'min_samples_split': 14, 'max_features': 0.77, 'min_samples_leaf': 1, 'criterion': 'absolute_error', 'max_depth': 15, 'min_weight_fraction_leaf': 0.0, 'max_leaf_nodes': 10, 'bootstrap': False, 'ccp_alpha': 0.006}. Best is trial 4539 with value: 0.19155472534689352.
[I 2025-04-16 02:23:56,164] Trial 4724 finished with value: -20.97819611013673 and parameters: {'n_estimators': 1279, 'min_samples_split': 6, 'max_features': 0.8300000000000001, 'min_samples_leaf': 5, 'criterion': 'poisson', 'max_depth': 15, 'min_weight_fraction_leaf': 0.0, 'max_leaf_nodes': 10, 'bootstrap': False, 'ccp_alpha': 0.011}. Best is trial 4539 with value: 0.19155472534689352.
[I 2025-04-16 02:23:57,528] Trial 4725 finished with value: 0.01651240545146484 and parameters: {'n_estimators': 843, 'min_samples_split': 2, 'max_features': 0.72, 'min_samples_leaf': 3, 'criterion': 'absolute_error', 'max_depth': 15, 'min_weight_fraction_leaf': 0.0, 'max_leaf_nodes': 10, 'bootstrap': False, 'ccp_alpha': 0.005}. Best is trial 4539 with value: 0.19155472534689352.
[I 2025-04-16 02:23:58,649] Trial 4726 finished with value: -0.1936417107583833 and parameters: {'n_estimators': 613, 'min_samples_split': 9, 'max_features': 0.78, 'min_samples_leaf': 1, 'criterion': 'absolute_error', 'max_depth': 15, 'min_weight_fraction_leaf': 0.0, 'max_leaf_nodes': 10, 'bootstrap': False, 'ccp_alpha': 0.018000000000000002}. Best is trial 4539 with value: 0.19155472534689352.
[I 2025-04-16 02:23:59,938] Trial 4727 finished with value: -0.1936417107583833 and parameters: {'n_estimators': 953, 'min_samples_split': 61, 'max_features': 0.75, 'min_samples_leaf': 3, 'criterion': 'absolute_error', 'max_depth': 15, 'min_weight_fraction_leaf': 0.0, 'max_leaf_nodes': 10, 'bootstrap': False, 'ccp_alpha': 0.0}. Best is trial 4539 with value: 0.19155472534689352.
[I 2025-04-16 02:24:01,026] Trial 4728 finished with value: -0.1936417107583833 and parameters: {'n_estimators': 557, 'min_samples_split': 5, 'max_features': 0.6900000000000001, 'min_samples_leaf': 1, 'criterion': 'absolute_error', 'max_depth': 15, 'min_weight_fraction_leaf': 0.0, 'max_leaf_nodes': 10, 'bootstrap': False, 'ccp_alpha': 0.011}. Best is trial 4539 with value: 0.19155472534689352.
[I 2025-04-16 02:24:02,300] Trial 4729 finished with value: -0.0741698933857684 and parameters: {'n_estimators': 749, 'min_samples_split': 2, 'max_features': 0.81, 'min_samples_leaf': 5, 'criterion': 'absolute_error', 'max_depth': 15, 'min_weight_fraction_leaf': 0.0, 'max_leaf_nodes': 10, 'bootstrap': False, 'ccp_alpha': 0.005}. Best is trial 4539 with value: 0.19155472534689352.
[I 2025-04-16 02:24:03,406] Trial 4730 finished with value: -0.1936417107583833 and parameters: {'n_estimators': 534, 'min_samples_split': 11, 'max_features': 0.73, 'min_samples_leaf': 3, 'criterion': 'absolute_error', 'max_depth': 15, 'min_weight_fraction_leaf': 0.0, 'max_leaf_nodes': 10, 'bootstrap': False, 'ccp_alpha': 0.014}. Best is trial 4539 with value: 0.19155472534689352.
[I 2025-04-16 02:24:04,791] Trial 4731 finished with value: -2.3415830057393268 and parameters: {'n_estimators': 950, 'min_samples_split': 6, 'max_features': 0.38, 'min_samples_leaf': 7, 'criterion': 'absolute_error', 'max_depth': 15, 'min_weight_fraction_leaf': 0.0, 'max_leaf_nodes': 10, 'bootstrap': False, 'ccp_alpha': 0.0}. Best is trial 4539 with value: 0.19155472534689352.
[I 2025-04-16 02:24:06,054] Trial 4732 finished with value: -0.1936417107583833 and parameters: {'n_estimators': 703, 'min_samples_split': 9, 'max_features': 0.76, 'min_samples_leaf': 1, 'criterion': 'absolute_error', 'max_depth': 15, 'min_weight_fraction_leaf': 0.0, 'max_leaf_nodes': 10, 'bootstrap': False, 'ccp_alpha': 0.01}. Best is trial 4539 with value: 0.19155472534689352.
[I 2025-04-16 02:24:07,066] Trial 4733 finished with value: -17.528986382274873 and parameters: {'n_estimators': 515, 'min_samples_split': 14, 'max_features': 0.79, 'min_samples_leaf': 5, 'criterion': 'friedman_mse', 'max_depth': 15, 'min_weight_fraction_leaf': 0.0, 'max_leaf_nodes': 10, 'bootstrap': False, 'ccp_alpha': 0.005}. Best is trial 4539 with value: 0.19155472534689352.
[I 2025-04-16 02:24:08,591] Trial 4734 finished with value: -0.1936417107583833 and parameters: {'n_estimators': 1066, 'min_samples_split': 2, 'max_features': 0.7100000000000001, 'min_samples_leaf': 3, 'criterion': 'absolute_error', 'max_depth': 20, 'min_weight_fraction_leaf': 0.0, 'max_leaf_nodes': 10, 'bootstrap': False, 'ccp_alpha': 0.022}. Best is trial 4539 with value: 0.19155472534689352.
[I 2025-04-16 02:24:10,261] Trial 4735 finished with value: -0.1936417107583833 and parameters: {'n_estimators': 1283, 'min_samples_split': 6, 'max_features': 0.8300000000000001, 'min_samples_leaf': 1, 'criterion': 'absolute_error', 'max_depth': 45, 'min_weight_fraction_leaf': 0.0, 'max_leaf_nodes': 10, 'bootstrap': False, 'ccp_alpha': 0.015}. Best is trial 4539 with value: 0.19155472534689352.
[I 2025-04-16 02:24:11,536] Trial 4736 finished with value: -0.1936417107583833 and parameters: {'n_estimators': 779, 'min_samples_split': 6, 'max_features': 0.74, 'min_samples_leaf': 3, 'criterion': 'absolute_error', 'max_depth': 15, 'min_weight_fraction_leaf': 0.0, 'max_leaf_nodes': 10, 'bootstrap': False, 'ccp_alpha': 0.009000000000000001}. Best is trial 4539 with value: 0.19155472534689352.
[I 2025-04-16 02:24:12,552] Trial 4737 finished with value: -11.21658366620704 and parameters: {'n_estimators': 531, 'min_samples_split': 2, 'max_features': 0.8, 'min_samples_leaf': 5, 'criterion': 'absolute_error', 'max_depth': 15, 'min_weight_fraction_leaf': 0.0, 'max_leaf_nodes': 10, 'bootstrap': False, 'ccp_alpha': 0.0}. Best is trial 4539 with value: 0.19155472534689352.
[I 2025-04-16 02:24:14,254] Trial 4738 finished with value: -0.1936417107583833 and parameters: {'n_estimators': 496, 'min_samples_split': 11, 'max_features': 0.77, 'min_samples_leaf': 1, 'criterion': 'absolute_error', 'max_depth': 15, 'min_weight_fraction_leaf': 0.0, 'max_leaf_nodes': 10, 'bootstrap': False, 'ccp_alpha': 0.006}. Best is trial 4539 with value: 0.19155472534689352.
[I 2025-04-16 02:24:15,664] Trial 4739 finished with value: -0.1936417107583833 and parameters: {'n_estimators': 853, 'min_samples_split': 9, 'max_features': 0.7000000000000001, 'min_samples_leaf': 3, 'criterion': 'absolute_error', 'max_depth': 15, 'min_weight_fraction_leaf': 0.0, 'max_leaf_nodes': 10, 'bootstrap': False, 'ccp_alpha': 0.016}. Best is trial 4539 with value: 0.19155472534689352.
[I 2025-04-16 02:24:16,836] Trial 4740 finished with value: 0.01040387582388531 and parameters: {'n_estimators': 674, 'min_samples_split': 5, 'max_features': 0.75, 'min_samples_leaf': 1, 'criterion': 'absolute_error', 'max_depth': 15, 'min_weight_fraction_leaf': 0.06, 'max_leaf_nodes': 10, 'bootstrap': False, 'ccp_alpha': 0.005}. Best is trial 4539 with value: 0.19155472534689352.
[I 2025-04-16 02:24:17,862] Trial 4741 finished with value: -0.1936417107583833 and parameters: {'n_estimators': 486, 'min_samples_split': 2, 'max_features': 0.78, 'min_samples_leaf': 7, 'criterion': 'absolute_error', 'max_depth': 15, 'min_weight_fraction_leaf': 0.0, 'max_leaf_nodes': 10, 'bootstrap': False, 'ccp_alpha': 0.011}. Best is trial 4539 with value: 0.19155472534689352.
