[I 2025-04-16 00:13:55,291] Trial 1328 finished with value: -0.4631321459367859 and parameters: {'n_estimators': 4045, 'min_samples_split': 12, 'max_features': 0.9500000000000001, 'min_samples_leaf': 7, 'criterion': 'absolute_error', 'max_depth': 60, 'min_weight_fraction_leaf': 0.01, 'max_leaf_nodes': 150, 'bootstrap': True, 'ccp_alpha': 0.001, 'max_samples': 0.5}. Best is trial 1324 with value: -0.17321795553875668.
[I 2025-04-16 00:13:59,061] Trial 1329 finished with value: -0.1936417107583833 and parameters: {'n_estimators': 4155, 'min_samples_split': 9, 'max_features': 0.99, 'min_samples_leaf': 10, 'criterion': 'absolute_error', 'max_depth': 60, 'min_weight_fraction_leaf': 0.01, 'max_leaf_nodes': 150, 'bootstrap': False, 'ccp_alpha': 0.004}. Best is trial 1324 with value: -0.17321795553875668.
[I 2025-04-16 00:14:04,091] Trial 1330 finished with value: -0.17613712684008406 and parameters: {'n_estimators': 4421, 'min_samples_split': 9, 'max_features': 1.0, 'min_samples_leaf': 7, 'criterion': 'absolute_error', 'max_depth': 60, 'min_weight_fraction_leaf': 0.01, 'max_leaf_nodes': 150, 'bootstrap': True, 'ccp_alpha': 0.019, 'max_samples': 0.5}. Best is trial 1324 with value: -0.17321795553875668.
[I 2025-04-16 00:14:10,141] Trial 1331 finished with value: -0.19533219194889634 and parameters: {'n_estimators': 4926, 'min_samples_split': 11, 'max_features': 1.0, 'min_samples_leaf': 7, 'criterion': 'absolute_error', 'max_depth': 60, 'min_weight_fraction_leaf': 0.01, 'max_leaf_nodes': 150, 'bootstrap': True, 'ccp_alpha': 0.009000000000000001, 'max_samples': 0.5}. Best is trial 1324 with value: -0.17321795553875668.
[I 2025-04-16 00:14:15,615] Trial 1332 finished with value: -0.2199536025689635 and parameters: {'n_estimators': 4538, 'min_samples_split': 2, 'max_features': 1.0, 'min_samples_leaf': 5, 'criterion': 'absolute_error', 'max_depth': 60, 'min_weight_fraction_leaf': 0.01, 'max_leaf_nodes': 150, 'bootstrap': True, 'ccp_alpha': 0.015, 'max_samples': 0.5}. Best is trial 1324 with value: -0.17321795553875668.
[I 2025-04-16 00:14:21,108] Trial 1333 finished with value: -17.67224707371867 and parameters: {'n_estimators': 4702, 'min_samples_split': 12, 'max_features': 0.98, 'min_samples_leaf': 9, 'criterion': 'friedman_mse', 'max_depth': 60, 'min_weight_fraction_leaf': 0.01, 'max_leaf_nodes': 150, 'bootstrap': True, 'ccp_alpha': 0.021, 'max_samples': 0.5}. Best is trial 1324 with value: -0.17321795553875668.
[I 2025-04-16 00:14:26,173] Trial 1334 finished with value: -0.1750493751457654 and parameters: {'n_estimators': 4072, 'min_samples_split': 6, 'max_features': 1.0, 'min_samples_leaf': 6, 'criterion': 'absolute_error', 'max_depth': 60, 'min_weight_fraction_leaf': 0.01, 'max_leaf_nodes': 150, 'bootstrap': True, 'ccp_alpha': 0.021, 'max_samples': 0.5}. Best is trial 1324 with value: -0.17321795553875668.
[I 2025-04-16 00:14:31,680] Trial 1335 finished with value: -0.19252064582116096 and parameters: {'n_estimators': 4347, 'min_samples_split': 6, 'max_features': 0.97, 'min_samples_leaf': 9, 'criterion': 'absolute_error', 'max_depth': 60, 'min_weight_fraction_leaf': 0.01, 'max_leaf_nodes': 150, 'bootstrap': True, 'ccp_alpha': 0.017, 'max_samples': 1.0}. Best is trial 1324 with value: -0.17321795553875668.
[I 2025-04-16 00:14:37,141] Trial 1336 finished with value: -0.18520743326092798 and parameters: {'n_estimators': 4200, 'min_samples_split': 5, 'max_features': 1.0, 'min_samples_leaf': 7, 'criterion': 'absolute_error', 'max_depth': 60, 'min_weight_fraction_leaf': 0.01, 'max_leaf_nodes': 150, 'bootstrap': True, 'ccp_alpha': 0.011, 'max_samples': 0.5}. Best is trial 1324 with value: -0.17321795553875668.
[I 2025-04-16 00:14:41,830] Trial 1337 finished with value: -0.18852553861158544 and parameters: {'n_estimators': 4015, 'min_samples_split': 7, 'max_features': 0.98, 'min_samples_leaf': 6, 'criterion': 'absolute_error', 'max_depth': 60, 'min_weight_fraction_leaf': 0.01, 'max_leaf_nodes': 150, 'bootstrap': True, 'ccp_alpha': 0.018000000000000002, 'max_samples': 0.75}. Best is trial 1324 with value: -0.17321795553875668.
[I 2025-04-16 00:14:47,486] Trial 1338 finished with value: -0.7645291878177704 and parameters: {'n_estimators': 4503, 'min_samples_split': 8, 'max_features': 1.0, 'min_samples_leaf': 5, 'criterion': 'absolute_error', 'max_depth': 60, 'min_weight_fraction_leaf': 0.01, 'max_leaf_nodes': 150, 'bootstrap': True, 'ccp_alpha': 0.008, 'max_samples': 0.5}. Best is trial 1324 with value: -0.17321795553875668.
[I 2025-04-16 00:14:52,329] Trial 1339 finished with value: -0.18325927716394474 and parameters: {'n_estimators': 4354, 'min_samples_split': 2, 'max_features': 0.98, 'min_samples_leaf': 11, 'criterion': 'absolute_error', 'max_depth': 60, 'min_weight_fraction_leaf': 0.01, 'max_leaf_nodes': 150, 'bootstrap': True, 'ccp_alpha': 0.02, 'max_samples': 0.5}. Best is trial 1324 with value: -0.17321795553875668.
[I 2025-04-16 00:14:57,365] Trial 1340 finished with value: -0.1774498287869018 and parameters: {'n_estimators': 4214, 'min_samples_split': 7, 'max_features': 0.98, 'min_samples_leaf': 7, 'criterion': 'absolute_error', 'max_depth': 60, 'min_weight_fraction_leaf': 0.01, 'max_leaf_nodes': 150, 'bootstrap': True, 'ccp_alpha': 0.014, 'max_samples': 0.5}. Best is trial 1324 with value: -0.17321795553875668.
[I 2025-04-16 00:15:02,861] Trial 1341 finished with value: -0.5454613538217137 and parameters: {'n_estimators': 4502, 'min_samples_split': 4, 'max_features': 1.0, 'min_samples_leaf': 4, 'criterion': 'absolute_error', 'max_depth': 60, 'min_weight_fraction_leaf': 0.01, 'max_leaf_nodes': 150, 'bootstrap': True, 'ccp_alpha': 0.014, 'max_samples': 0.5}. Best is trial 1324 with value: -0.17321795553875668.
[I 2025-04-16 00:15:07,904] Trial 1342 finished with value: -0.17433173272112876 and parameters: {'n_estimators': 4147, 'min_samples_split': 5, 'max_features': 0.99, 'min_samples_leaf': 6, 'criterion': 'absolute_error', 'max_depth': 60, 'min_weight_fraction_leaf': 0.01, 'max_leaf_nodes': 150, 'bootstrap': True, 'ccp_alpha': 0.017, 'max_samples': 0.5}. Best is trial 1324 with value: -0.17321795553875668.
[I 2025-04-16 00:15:13,053] Trial 1343 finished with value: -0.20071738108985526 and parameters: {'n_estimators': 4309, 'min_samples_split': 7, 'max_features': 1.0, 'min_samples_leaf': 7, 'criterion': 'absolute_error', 'max_depth': 60, 'min_weight_fraction_leaf': 0.01, 'max_leaf_nodes': 150, 'bootstrap': True, 'ccp_alpha': 0.009000000000000001, 'max_samples': 0.5}. Best is trial 1324 with value: -0.17321795553875668.
[I 2025-04-16 00:15:17,947] Trial 1344 finished with value: -17.81993715132566 and parameters: {'n_estimators': 4064, 'min_samples_split': 7, 'max_features': 1.0, 'min_samples_leaf': 9, 'criterion': 'squared_error', 'max_depth': 60, 'min_weight_fraction_leaf': 0.01, 'max_leaf_nodes': 150, 'bootstrap': True, 'ccp_alpha': 0.018000000000000002, 'max_samples': 0.5}. Best is trial 1324 with value: -0.17321795553875668.
[I 2025-04-16 00:15:23,124] Trial 1345 finished with value: -0.7079840846062122 and parameters: {'n_estimators': 4077, 'min_samples_split': 2, 'max_features': 0.98, 'min_samples_leaf': 6, 'criterion': 'absolute_error', 'max_depth': 60, 'min_weight_fraction_leaf': 0.01, 'max_leaf_nodes': 150, 'bootstrap': True, 'ccp_alpha': 0.004, 'max_samples': 0.5}. Best is trial 1324 with value: -0.17321795553875668.
[I 2025-04-16 00:15:27,787] Trial 1346 finished with value: -5.792138609050652 and parameters: {'n_estimators': 4002, 'min_samples_split': 6, 'max_features': 0.99, 'min_samples_leaf': 4, 'criterion': 'absolute_error', 'max_depth': 60, 'min_weight_fraction_leaf': 0.01, 'max_leaf_nodes': 150, 'bootstrap': True, 'ccp_alpha': 0.0, 'max_samples': 0.5}. Best is trial 1324 with value: -0.17321795553875668.
[I 2025-04-16 00:15:33,752] Trial 1347 finished with value: -0.17750742266220185 and parameters: {'n_estimators': 4627, 'min_samples_split': 8, 'max_features': 0.97, 'min_samples_leaf': 7, 'criterion': 'absolute_error', 'max_depth': 60, 'min_weight_fraction_leaf': 0.01, 'max_leaf_nodes': 150, 'bootstrap': True, 'ccp_alpha': 0.012, 'max_samples': 0.5}. Best is trial 1324 with value: -0.17321795553875668.
[I 2025-04-16 00:15:38,807] Trial 1348 finished with value: -0.18229115963954162 and parameters: {'n_estimators': 4198, 'min_samples_split': 9, 'max_features': 0.99, 'min_samples_leaf': 9, 'criterion': 'absolute_error', 'max_depth': 60, 'min_weight_fraction_leaf': 0.01, 'max_leaf_nodes': 150, 'bootstrap': True, 'ccp_alpha': 0.017, 'max_samples': 0.5}. Best is trial 1324 with value: -0.17321795553875668.
[I 2025-04-16 00:15:43,825] Trial 1349 finished with value: -0.18262608097926797 and parameters: {'n_estimators': 4527, 'min_samples_split': 9, 'max_features': 1.0, 'min_samples_leaf': 10, 'criterion': 'absolute_error', 'max_depth': 60, 'min_weight_fraction_leaf': 0.01, 'max_leaf_nodes': 150, 'bootstrap': True, 'ccp_alpha': 0.013000000000000001, 'max_samples': 0.5}. Best is trial 1324 with value: -0.17321795553875668.
[I 2025-04-16 00:15:49,186] Trial 1350 finished with value: -0.18363471605907522 and parameters: {'n_estimators': 4712, 'min_samples_split': 8, 'max_features': 0.98, 'min_samples_leaf': 11, 'criterion': 'absolute_error', 'max_depth': 60, 'min_weight_fraction_leaf': 0.01, 'max_leaf_nodes': 150, 'bootstrap': True, 'ccp_alpha': 0.019, 'max_samples': 0.5}. Best is trial 1324 with value: -0.17321795553875668.
[I 2025-04-16 00:15:54,693] Trial 1351 finished with value: -21.26075051532822 and parameters: {'n_estimators': 4346, 'min_samples_split': 2, 'max_features': 0.98, 'min_samples_leaf': 7, 'criterion': 'poisson', 'max_depth': 60, 'min_weight_fraction_leaf': 0.01, 'max_leaf_nodes': 150, 'bootstrap': True, 'ccp_alpha': 0.008, 'max_samples': 0.5}. Best is trial 1324 with value: -0.17321795553875668.
[I 2025-04-16 00:15:58,655] Trial 1352 finished with value: -0.1936417107583833 and parameters: {'n_estimators': 4353, 'min_samples_split': 9, 'max_features': 0.99, 'min_samples_leaf': 9, 'criterion': 'absolute_error', 'max_depth': 60, 'min_weight_fraction_leaf': 0.01, 'max_leaf_nodes': 150, 'bootstrap': False, 'ccp_alpha': 0.014}. Best is trial 1324 with value: -0.17321795553875668.
[I 2025-04-16 00:16:04,029] Trial 1353 finished with value: -0.1790890013691348 and parameters: {'n_estimators': 4215, 'min_samples_split': 5, 'max_features': 1.0, 'min_samples_leaf': 7, 'criterion': 'absolute_error', 'max_depth': 60, 'min_weight_fraction_leaf': 0.01, 'max_leaf_nodes': 150, 'bootstrap': True, 'ccp_alpha': 0.024, 'max_samples': 0.5}. Best is trial 1324 with value: -0.17321795553875668.
[I 2025-04-16 00:16:09,401] Trial 1354 finished with value: -0.1739658980860031 and parameters: {'n_estimators': 4128, 'min_samples_split': 7, 'max_features': 0.99, 'min_samples_leaf': 6, 'criterion': 'absolute_error', 'max_depth': 60, 'min_weight_fraction_leaf': 0.01, 'max_leaf_nodes': 150, 'bootstrap': True, 'ccp_alpha': 0.021, 'max_samples': 0.5}. Best is trial 1324 with value: -0.17321795553875668.
[I 2025-04-16 00:16:14,542] Trial 1355 finished with value: -0.191035469175463 and parameters: {'n_estimators': 4193, 'min_samples_split': 5, 'max_features': 0.97, 'min_samples_leaf': 3, 'criterion': 'absolute_error', 'max_depth': 60, 'min_weight_fraction_leaf': 0.01, 'max_leaf_nodes': 150, 'bootstrap': True, 'ccp_alpha': 0.024, 'max_samples': 0.5}. Best is trial 1324 with value: -0.17321795553875668.
[I 2025-04-16 00:16:19,693] Trial 1356 finished with value: -0.17918862619794934 and parameters: {'n_estimators': 4666, 'min_samples_split': 8, 'max_features': 1.0, 'min_samples_leaf': 6, 'criterion': 'absolute_error', 'max_depth': 60, 'min_weight_fraction_leaf': 0.01, 'max_leaf_nodes': 150, 'bootstrap': True, 'ccp_alpha': 0.023, 'max_samples': 0.5}. Best is trial 1324 with value: -0.17321795553875668.
[I 2025-04-16 00:16:25,038] Trial 1357 finished with value: -0.1799662586084735 and parameters: {'n_estimators': 4787, 'min_samples_split': 8, 'max_features': 1.0, 'min_samples_leaf': 7, 'criterion': 'absolute_error', 'max_depth': 60, 'min_weight_fraction_leaf': 0.01, 'max_leaf_nodes': 150, 'bootstrap': True, 'ccp_alpha': 0.023, 'max_samples': 0.5}. Best is trial 1324 with value: -0.17321795553875668.
[I 2025-04-16 00:16:30,951] Trial 1358 finished with value: -0.1801025422291614 and parameters: {'n_estimators': 4723, 'min_samples_split': 8, 'max_features': 1.0, 'min_samples_leaf': 7, 'criterion': 'absolute_error', 'max_depth': 60, 'min_weight_fraction_leaf': 0.01, 'max_leaf_nodes': 150, 'bootstrap': True, 'ccp_alpha': 0.022, 'max_samples': 0.5}. Best is trial 1324 with value: -0.17321795553875668.
[I 2025-04-16 00:16:36,554] Trial 1359 finished with value: -0.17085383187140404 and parameters: {'n_estimators': 4660, 'min_samples_split': 2, 'max_features': 1.0, 'min_samples_leaf': 5, 'criterion': 'absolute_error', 'max_depth': 60, 'min_weight_fraction_leaf': 0.01, 'max_leaf_nodes': 150, 'bootstrap': True, 'ccp_alpha': 0.025, 'max_samples': 0.5}. Best is trial 1359 with value: -0.17085383187140404.
[I 2025-04-16 00:16:42,389] Trial 1360 finished with value: -0.19201493107629983 and parameters: {'n_estimators': 4785, 'min_samples_split': 2, 'max_features': 1.0, 'min_samples_leaf': 6, 'criterion': 'absolute_error', 'max_depth': 60, 'min_weight_fraction_leaf': 0.01, 'max_leaf_nodes': 150, 'bootstrap': True, 'ccp_alpha': 0.021, 'max_samples': None}. Best is trial 1359 with value: -0.17085383187140404.
[I 2025-04-16 00:16:48,142] Trial 1361 finished with value: -0.1904993103105254 and parameters: {'n_estimators': 4672, 'min_samples_split': 7, 'max_features': 1.0, 'min_samples_leaf': 3, 'criterion': 'absolute_error', 'max_depth': 60, 'min_weight_fraction_leaf': 0.01, 'max_leaf_nodes': 150, 'bootstrap': True, 'ccp_alpha': 0.025, 'max_samples': 0.5}. Best is trial 1359 with value: -0.17085383187140404.
[I 2025-04-16 00:16:53,992] Trial 1362 finished with value: -0.22583171415561248 and parameters: {'n_estimators': 5011, 'min_samples_split': 6, 'max_features': 1.0, 'min_samples_leaf': 5, 'criterion': 'absolute_error', 'max_depth': 60, 'min_weight_fraction_leaf': 0.01, 'max_leaf_nodes': 150, 'bootstrap': True, 'ccp_alpha': 0.015, 'max_samples': 0.5}. Best is trial 1359 with value: -0.17085383187140404.
[I 2025-04-16 00:16:59,394] Trial 1363 finished with value: -0.18022601415962516 and parameters: {'n_estimators': 4600, 'min_samples_split': 9, 'max_features': 0.98, 'min_samples_leaf': 7, 'criterion': 'absolute_error', 'max_depth': 60, 'min_weight_fraction_leaf': 0.01, 'max_leaf_nodes': 150, 'bootstrap': True, 'ccp_alpha': 0.027, 'max_samples': 0.5}. Best is trial 1359 with value: -0.17085383187140404.
[I 2025-04-16 00:17:05,466] Trial 1364 finished with value: -17.66540722508085 and parameters: {'n_estimators': 4842, 'min_samples_split': 9, 'max_features': 0.98, 'min_samples_leaf': 7, 'criterion': 'friedman_mse', 'max_depth': 60, 'min_weight_fraction_leaf': 0.01, 'max_leaf_nodes': 150, 'bootstrap': True, 'ccp_alpha': 0.027, 'max_samples': 0.5}. Best is trial 1359 with value: -0.17085383187140404.
[I 2025-04-16 00:17:10,731] Trial 1365 finished with value: -0.17757421358664396 and parameters: {'n_estimators': 4583, 'min_samples_split': 5, 'max_features': 1.0, 'min_samples_leaf': 7, 'criterion': 'absolute_error', 'max_depth': 60, 'min_weight_fraction_leaf': 0.01, 'max_leaf_nodes': 150, 'bootstrap': True, 'ccp_alpha': 0.02, 'max_samples': 0.5}. Best is trial 1359 with value: -0.17085383187140404.
[I 2025-04-16 00:17:16,624] Trial 1366 finished with value: -0.17849769682230615 and parameters: {'n_estimators': 4640, 'min_samples_split': 5, 'max_features': 1.0, 'min_samples_leaf': 8, 'criterion': 'absolute_error', 'max_depth': 60, 'min_weight_fraction_leaf': 0.01, 'max_leaf_nodes': 150, 'bootstrap': True, 'ccp_alpha': 0.02, 'max_samples': 0.5}. Best is trial 1359 with value: -0.17085383187140404.
[I 2025-04-16 00:17:22,620] Trial 1367 finished with value: -0.19162028940884474 and parameters: {'n_estimators': 4620, 'min_samples_split': 2, 'max_features': 0.99, 'min_samples_leaf': 8, 'criterion': 'absolute_error', 'max_depth': 60, 'min_weight_fraction_leaf': 0.01, 'max_leaf_nodes': 150, 'bootstrap': True, 'ccp_alpha': 0.019, 'max_samples': 1.0}. Best is trial 1359 with value: -0.17085383187140404.
[I 2025-04-16 00:17:28,242] Trial 1368 finished with value: -0.1825583240103627 and parameters: {'n_estimators': 4473, 'min_samples_split': 9, 'max_features': 1.0, 'min_samples_leaf': 9, 'criterion': 'absolute_error', 'max_depth': 60, 'min_weight_fraction_leaf': 0.01, 'max_leaf_nodes': 150, 'bootstrap': True, 'ccp_alpha': 0.022, 'max_samples': 0.5}. Best is trial 1359 with value: -0.17085383187140404.
[I 2025-04-16 00:17:34,533] Trial 1369 finished with value: -0.1887748407907352 and parameters: {'n_estimators': 5150, 'min_samples_split': 5, 'max_features': 0.98, 'min_samples_leaf': 7, 'criterion': 'absolute_error', 'max_depth': 60, 'min_weight_fraction_leaf': 0.01, 'max_leaf_nodes': 150, 'bootstrap': True, 'ccp_alpha': 0.009000000000000001, 'max_samples': 0.5}. Best is trial 1359 with value: -0.17085383187140404.
[I 2025-04-16 00:17:40,192] Trial 1370 finished with value: -0.19148206921470426 and parameters: {'n_estimators': 4685, 'min_samples_split': 10, 'max_features': 1.0, 'min_samples_leaf': 10, 'criterion': 'absolute_error', 'max_depth': 60, 'min_weight_fraction_leaf': 0.01, 'max_leaf_nodes': 150, 'bootstrap': True, 'ccp_alpha': 0.028, 'max_samples': 0.75}. Best is trial 1359 with value: -0.17085383187140404.
[I 2025-04-16 00:17:46,312] Trial 1371 finished with value: -0.20393338775260622 and parameters: {'n_estimators': 4842, 'min_samples_split': 5, 'max_features': 0.98, 'min_samples_leaf': 5, 'criterion': 'absolute_error', 'max_depth': 60, 'min_weight_fraction_leaf': 0.01, 'max_leaf_nodes': 150, 'bootstrap': True, 'ccp_alpha': 0.016, 'max_samples': 0.5}. Best is trial 1359 with value: -0.17085383187140404.
[I 2025-04-16 00:17:51,675] Trial 1372 finished with value: -0.25912460866928416 and parameters: {'n_estimators': 4457, 'min_samples_split': 10, 'max_features': 1.0, 'min_samples_leaf': 3, 'criterion': 'absolute_error', 'max_depth': 60, 'min_weight_fraction_leaf': 0.01, 'max_leaf_nodes': 150, 'bootstrap': True, 'ccp_alpha': 0.021, 'max_samples': 0.5}. Best is trial 1359 with value: -0.17085383187140404.
[I 2025-04-16 00:17:57,365] Trial 1373 finished with value: -0.1767803628894995 and parameters: {'n_estimators': 4582, 'min_samples_split': 6, 'max_features': 0.98, 'min_samples_leaf': 7, 'criterion': 'absolute_error', 'max_depth': 60, 'min_weight_fraction_leaf': 0.01, 'max_leaf_nodes': 150, 'bootstrap': True, 'ccp_alpha': 0.014, 'max_samples': 0.5}. Best is trial 1359 with value: -0.17085383187140404.
[I 2025-04-16 00:18:03,443] Trial 1374 finished with value: -17.403845755616736 and parameters: {'n_estimators': 4950, 'min_samples_split': 2, 'max_features': 0.97, 'min_samples_leaf': 6, 'criterion': 'squared_error', 'max_depth': 60, 'min_weight_fraction_leaf': 0.01, 'max_leaf_nodes': 150, 'bootstrap': True, 'ccp_alpha': 0.007, 'max_samples': 0.5}. Best is trial 1359 with value: -0.17085383187140404.
[I 2025-04-16 00:18:07,622] Trial 1375 finished with value: -0.1936417107583833 and parameters: {'n_estimators': 4632, 'min_samples_split': 6, 'max_features': 1.0, 'min_samples_leaf': 7, 'criterion': 'absolute_error', 'max_depth': 60, 'min_weight_fraction_leaf': 0.01, 'max_leaf_nodes': 150, 'bootstrap': False, 'ccp_alpha': 0.025}. Best is trial 1359 with value: -0.17085383187140404.
[I 2025-04-16 00:18:12,974] Trial 1376 finished with value: -1.0731211901598088 and parameters: {'n_estimators': 4591, 'min_samples_split': 12, 'max_features': 0.98, 'min_samples_leaf': 3, 'criterion': 'absolute_error', 'max_depth': 60, 'min_weight_fraction_leaf': 0.01, 'max_leaf_nodes': 150, 'bootstrap': True, 'ccp_alpha': 0.013000000000000001, 'max_samples': 0.5}. Best is trial 1359 with value: -0.17085383187140404.
[I 2025-04-16 00:18:18,752] Trial 1377 finished with value: -1.2811736121613186 and parameters: {'n_estimators': 4397, 'min_samples_split': 2, 'max_features': 0.97, 'min_samples_leaf': 5, 'criterion': 'absolute_error', 'max_depth': 60, 'min_weight_fraction_leaf': 0.01, 'max_leaf_nodes': 150, 'bootstrap': True, 'ccp_alpha': 0.006, 'max_samples': 0.5}. Best is trial 1359 with value: -0.17085383187140404.
[I 2025-04-16 00:18:23,905] Trial 1378 finished with value: -0.5489130876856949 and parameters: {'n_estimators': 4599, 'min_samples_split': 6, 'max_features': 0.98, 'min_samples_leaf': 7, 'criterion': 'absolute_error', 'max_depth': 60, 'min_weight_fraction_leaf': 0.01, 'max_leaf_nodes': 150, 'bootstrap': True, 'ccp_alpha': 0.0, 'max_samples': 0.5}. Best is trial 1359 with value: -0.17085383187140404.
[I 2025-04-16 00:18:29,741] Trial 1379 finished with value: -0.18163367355114554 and parameters: {'n_estimators': 4883, 'min_samples_split': 12, 'max_features': 1.0, 'min_samples_leaf': 8, 'criterion': 'absolute_error', 'max_depth': 60, 'min_weight_fraction_leaf': 0.01, 'max_leaf_nodes': 150, 'bootstrap': True, 'ccp_alpha': 0.028, 'max_samples': 0.5}. Best is trial 1359 with value: -0.17085383187140404.
[I 2025-04-16 00:18:35,306] Trial 1380 finished with value: -0.1836754230052542 and parameters: {'n_estimators': 4859, 'min_samples_split': 11, 'max_features': 1.0, 'min_samples_leaf': 12, 'criterion': 'absolute_error', 'max_depth': 60, 'min_weight_fraction_leaf': 0.01, 'max_leaf_nodes': 150, 'bootstrap': True, 'ccp_alpha': 0.029, 'max_samples': 0.5}. Best is trial 1359 with value: -0.17085383187140404.
[I 2025-04-16 00:18:41,094] Trial 1381 finished with value: -18.014136574451147 and parameters: {'n_estimators': 5078, 'min_samples_split': 7, 'max_features': 0.98, 'min_samples_leaf': 10, 'criterion': 'poisson', 'max_depth': 60, 'min_weight_fraction_leaf': 0.01, 'max_leaf_nodes': 150, 'bootstrap': True, 'ccp_alpha': 0.021, 'max_samples': 0.5}. Best is trial 1359 with value: -0.17085383187140404.
