[I 2025-04-16 01:48:39,483] Trial 2947 finished with value: -8.68124703060339 and parameters: {'n_estimators': 2231, 'min_samples_split': 15, 'max_features': 0.9, 'min_samples_leaf': 5, 'criterion': 'absolute_error', 'max_depth': 5, 'min_weight_fraction_leaf': 0.0, 'max_leaf_nodes': 20, 'bootstrap': False, 'ccp_alpha': 0.0}. Best is trial 2774 with value: 0.046571421912873.
[I 2025-04-16 01:48:41,394] Trial 2948 finished with value: -17.528986382276692 and parameters: {'n_estimators': 1986, 'min_samples_split': 10, 'max_features': 0.88, 'min_samples_leaf': 8, 'criterion': 'friedman_mse', 'max_depth': 5, 'min_weight_fraction_leaf': 0.0, 'max_leaf_nodes': 20, 'bootstrap': False, 'ccp_alpha': 0.009000000000000001}. Best is trial 2774 with value: 0.046571421912873.
[I 2025-04-16 01:48:43,358] Trial 2949 finished with value: 0.019145355068781077 and parameters: {'n_estimators': 2225, 'min_samples_split': 14, 'max_features': 0.92, 'min_samples_leaf': 5, 'criterion': 'absolute_error', 'max_depth': 5, 'min_weight_fraction_leaf': 0.0, 'max_leaf_nodes': 20, 'bootstrap': False, 'ccp_alpha': 0.005}. Best is trial 2774 with value: 0.046571421912873.
[I 2025-04-16 01:48:45,733] Trial 2950 finished with value: -0.1936417107583833 and parameters: {'n_estimators': 2033, 'min_samples_split': 15, 'max_features': 0.92, 'min_samples_leaf': 7, 'criterion': 'absolute_error', 'max_depth': None, 'min_weight_fraction_leaf': 0.0, 'max_leaf_nodes': 20, 'bootstrap': False, 'ccp_alpha': 0.014}. Best is trial 2774 with value: 0.046571421912873.
[I 2025-04-16 01:48:47,508] Trial 2951 finished with value: -8.643268756911606 and parameters: {'n_estimators': 2223, 'min_samples_split': 15, 'max_features': 0.91, 'min_samples_leaf': 8, 'criterion': 'absolute_error', 'max_depth': 5, 'min_weight_fraction_leaf': 0.0, 'max_leaf_nodes': 20, 'bootstrap': False, 'ccp_alpha': 0.0}. Best is trial 2774 with value: 0.046571421912873.
[I 2025-04-16 01:48:49,597] Trial 2952 finished with value: -0.1936417107583833 and parameters: {'n_estimators': 2427, 'min_samples_split': 15, 'max_features': 0.92, 'min_samples_leaf': 8, 'criterion': 'absolute_error', 'max_depth': 5, 'min_weight_fraction_leaf': 0.0, 'max_leaf_nodes': 20, 'bootstrap': False, 'ccp_alpha': 0.005}. Best is trial 2774 with value: 0.046571421912873.
[I 2025-04-16 01:48:51,457] Trial 2953 finished with value: -0.1936417107583833 and parameters: {'n_estimators': 2172, 'min_samples_split': 15, 'max_features': 0.92, 'min_samples_leaf': 6, 'criterion': 'absolute_error', 'max_depth': 5, 'min_weight_fraction_leaf': 0.0, 'max_leaf_nodes': 20, 'bootstrap': False, 'ccp_alpha': 0.261}. Best is trial 2774 with value: 0.046571421912873.
[I 2025-04-16 01:48:53,627] Trial 2954 finished with value: -0.1936417107583833 and parameters: {'n_estimators': 2161, 'min_samples_split': 15, 'max_features': 0.91, 'min_samples_leaf': 6, 'criterion': 'absolute_error', 'max_depth': 5, 'min_weight_fraction_leaf': 0.0, 'max_leaf_nodes': 20, 'bootstrap': False, 'ccp_alpha': 0.01}. Best is trial 2774 with value: 0.046571421912873.
[I 2025-04-16 01:48:55,807] Trial 2955 finished with value: -0.1936417107583833 and parameters: {'n_estimators': 1870, 'min_samples_split': 15, 'max_features': 0.93, 'min_samples_leaf': 8, 'criterion': 'absolute_error', 'max_depth': 5, 'min_weight_fraction_leaf': 0.0, 'max_leaf_nodes': 20, 'bootstrap': False, 'ccp_alpha': 0.014}. Best is trial 2774 with value: 0.046571421912873.
[I 2025-04-16 01:48:57,318] Trial 2956 finished with value: -17.528986382276493 and parameters: {'n_estimators': 1666, 'min_samples_split': 15, 'max_features': 0.92, 'min_samples_leaf': 6, 'criterion': 'squared_error', 'max_depth': 5, 'min_weight_fraction_leaf': 0.0, 'max_leaf_nodes': 20, 'bootstrap': False, 'ccp_alpha': 0.005}. Best is trial 2774 with value: 0.046571421912873.
[I 2025-04-16 01:48:58,697] Trial 2957 finished with value: -8.70373799356642 and parameters: {'n_estimators': 1573, 'min_samples_split': 13, 'max_features': 0.92, 'min_samples_leaf': 8, 'criterion': 'absolute_error', 'max_depth': 5, 'min_weight_fraction_leaf': 0.0, 'max_leaf_nodes': 20, 'bootstrap': False, 'ccp_alpha': 0.0}. Best is trial 2774 with value: 0.046571421912873.
[I 2025-04-16 01:49:00,635] Trial 2958 finished with value: -0.1936417107583833 and parameters: {'n_estimators': 2266, 'min_samples_split': 15, 'max_features': 0.91, 'min_samples_leaf': 5, 'criterion': 'absolute_error', 'max_depth': 5, 'min_weight_fraction_leaf': 0.0, 'max_leaf_nodes': 20, 'bootstrap': False, 'ccp_alpha': 0.023}. Best is trial 2774 with value: 0.046571421912873.
[I 2025-04-16 01:49:02,625] Trial 2959 finished with value: -0.1936417107583833 and parameters: {'n_estimators': 2168, 'min_samples_split': 12, 'max_features': 0.92, 'min_samples_leaf': 8, 'criterion': 'absolute_error', 'max_depth': 5, 'min_weight_fraction_leaf': 0.0, 'max_leaf_nodes': 20, 'bootstrap': False, 'ccp_alpha': 0.009000000000000001}. Best is trial 2774 with value: 0.046571421912873.
[I 2025-04-16 01:49:04,340] Trial 2960 finished with value: 0.02158011778221385 and parameters: {'n_estimators': 1953, 'min_samples_split': 16, 'max_features': 0.92, 'min_samples_leaf': 6, 'criterion': 'absolute_error', 'max_depth': 5, 'min_weight_fraction_leaf': 0.0, 'max_leaf_nodes': 20, 'bootstrap': False, 'ccp_alpha': 0.005}. Best is trial 2774 with value: 0.046571421912873.
[I 2025-04-16 01:49:05,982] Trial 2961 finished with value: -0.1936417107583833 and parameters: {'n_estimators': 1839, 'min_samples_split': 16, 'max_features': 0.93, 'min_samples_leaf': 8, 'criterion': 'absolute_error', 'max_depth': 5, 'min_weight_fraction_leaf': 0.0, 'max_leaf_nodes': 20, 'bootstrap': False, 'ccp_alpha': 0.018000000000000002}. Best is trial 2774 with value: 0.046571421912873.
[I 2025-04-16 01:49:07,719] Trial 2962 finished with value: -17.528986382276706 and parameters: {'n_estimators': 2013, 'min_samples_split': 16, 'max_features': 0.91, 'min_samples_leaf': 8, 'criterion': 'poisson', 'max_depth': 5, 'min_weight_fraction_leaf': 0.0, 'max_leaf_nodes': 20, 'bootstrap': False, 'ccp_alpha': 0.035}. Best is trial 2774 with value: 0.046571421912873.
[I 2025-04-16 01:49:09,273] Trial 2963 finished with value: -0.1936417107583833 and parameters: {'n_estimators': 1676, 'min_samples_split': 17, 'max_features': 0.93, 'min_samples_leaf': 9, 'criterion': 'absolute_error', 'max_depth': 15, 'min_weight_fraction_leaf': 0.0, 'max_leaf_nodes': 20, 'bootstrap': False, 'ccp_alpha': 0.01}. Best is trial 2774 with value: 0.046571421912873.
[I 2025-04-16 01:49:10,904] Trial 2964 finished with value: -4.64249818999409 and parameters: {'n_estimators': 1917, 'min_samples_split': 15, 'max_features': 0.62, 'min_samples_leaf': 8, 'criterion': 'absolute_error', 'max_depth': 5, 'min_weight_fraction_leaf': 0.0, 'max_leaf_nodes': 20, 'bootstrap': False, 'ccp_alpha': 0.0}. Best is trial 2774 with value: 0.046571421912873.
[I 2025-04-16 01:49:12,506] Trial 2965 finished with value: -0.1936417107583833 and parameters: {'n_estimators': 1750, 'min_samples_split': 15, 'max_features': 0.93, 'min_samples_leaf': 6, 'criterion': 'absolute_error', 'max_depth': 5, 'min_weight_fraction_leaf': 0.0, 'max_leaf_nodes': 20, 'bootstrap': False, 'ccp_alpha': 0.015}. Best is trial 2774 with value: 0.046571421912873.
[I 2025-04-16 01:49:14,645] Trial 2966 finished with value: -10.407105807554178 and parameters: {'n_estimators': 2165, 'min_samples_split': 14, 'max_features': 0.93, 'min_samples_leaf': 6, 'criterion': 'absolute_error', 'max_depth': 5, 'min_weight_fraction_leaf': 0.0, 'max_leaf_nodes': 20, 'bootstrap': False, 'ccp_alpha': 0.0}. Best is trial 2774 with value: 0.046571421912873.
[I 2025-04-16 01:49:16,545] Trial 2967 finished with value: -0.1936417107583833 and parameters: {'n_estimators': 2032, 'min_samples_split': 16, 'max_features': 0.93, 'min_samples_leaf': 8, 'criterion': 'absolute_error', 'max_depth': 5, 'min_weight_fraction_leaf': 0.0, 'max_leaf_nodes': 20, 'bootstrap': False, 'ccp_alpha': 0.005}. Best is trial 2774 with value: 0.046571421912873.
[I 2025-04-16 01:49:18,378] Trial 2968 finished with value: -0.1936417107583833 and parameters: {'n_estimators': 1621, 'min_samples_split': 16, 'max_features': 0.92, 'min_samples_leaf': 6, 'criterion': 'absolute_error', 'max_depth': 5, 'min_weight_fraction_leaf': 0.0, 'max_leaf_nodes': 20, 'bootstrap': False, 'ccp_alpha': 0.024}. Best is trial 2774 with value: 0.046571421912873.
[I 2025-04-16 01:49:20,066] Trial 2969 finished with value: -0.1936417107583833 and parameters: {'n_estimators': 1845, 'min_samples_split': 12, 'max_features': 0.92, 'min_samples_leaf': 9, 'criterion': 'absolute_error', 'max_depth': 5, 'min_weight_fraction_leaf': 0.0, 'max_leaf_nodes': 20, 'bootstrap': False, 'ccp_alpha': 0.005}. Best is trial 2774 with value: 0.046571421912873.
[I 2025-04-16 01:49:21,973] Trial 2970 finished with value: -0.1936417107583833 and parameters: {'n_estimators': 2248, 'min_samples_split': 17, 'max_features': 0.93, 'min_samples_leaf': 6, 'criterion': 'absolute_error', 'max_depth': 5, 'min_weight_fraction_leaf': 0.0, 'max_leaf_nodes': 20, 'bootstrap': False, 'ccp_alpha': 0.01}. Best is trial 2774 with value: 0.046571421912873.
[I 2025-04-16 01:49:23,911] Trial 2971 finished with value: -0.1936417107583833 and parameters: {'n_estimators': 2241, 'min_samples_split': 12, 'max_features': 0.92, 'min_samples_leaf': 8, 'criterion': 'absolute_error', 'max_depth': 5, 'min_weight_fraction_leaf': 0.0, 'max_leaf_nodes': 20, 'bootstrap': False, 'ccp_alpha': 0.014}. Best is trial 2774 with value: 0.046571421912873.
[I 2025-04-16 01:49:26,045] Trial 2972 finished with value: 0.021873389097314334 and parameters: {'n_estimators': 2052, 'min_samples_split': 12, 'max_features': 0.9, 'min_samples_leaf': 6, 'criterion': 'absolute_error', 'max_depth': None, 'min_weight_fraction_leaf': 0.0, 'max_leaf_nodes': 20, 'bootstrap': False, 'ccp_alpha': 0.005}. Best is trial 2774 with value: 0.046571421912873.
[I 2025-04-16 01:49:27,786] Trial 2973 finished with value: -17.528986382276692 and parameters: {'n_estimators': 1982, 'min_samples_split': 17, 'max_features': 0.9, 'min_samples_leaf': 9, 'criterion': 'friedman_mse', 'max_depth': None, 'min_weight_fraction_leaf': 0.0, 'max_leaf_nodes': 20, 'bootstrap': False, 'ccp_alpha': 0.018000000000000002}. Best is trial 2774 with value: 0.046571421912873.
[I 2025-04-16 01:49:29,726] Trial 2974 finished with value: -0.1936417107583833 and parameters: {'n_estimators': 1948, 'min_samples_split': 17, 'max_features': 0.9, 'min_samples_leaf': 9, 'criterion': 'absolute_error', 'max_depth': None, 'min_weight_fraction_leaf': 0.0, 'max_leaf_nodes': 20, 'bootstrap': False, 'ccp_alpha': 0.01}. Best is trial 2774 with value: 0.046571421912873.
[I 2025-04-16 01:49:31,317] Trial 2975 finished with value: -8.650890929421301 and parameters: {'n_estimators': 1842, 'min_samples_split': 16, 'max_features': 0.93, 'min_samples_leaf': 8, 'criterion': 'absolute_error', 'max_depth': None, 'min_weight_fraction_leaf': 0.0, 'max_leaf_nodes': 20, 'bootstrap': False, 'ccp_alpha': 0.0}. Best is trial 2774 with value: 0.046571421912873.
[I 2025-04-16 01:49:33,208] Trial 2976 finished with value: 0.0193105470950377 and parameters: {'n_estimators': 2120, 'min_samples_split': 16, 'max_features': 0.9, 'min_samples_leaf': 7, 'criterion': 'absolute_error', 'max_depth': None, 'min_weight_fraction_leaf': 0.0, 'max_leaf_nodes': 20, 'bootstrap': False, 'ccp_alpha': 0.005}. Best is trial 2774 with value: 0.046571421912873.
[I 2025-04-16 01:49:34,606] Trial 2977 finished with value: -0.1936417107583833 and parameters: {'n_estimators': 1371, 'min_samples_split': 15, 'max_features': 0.9, 'min_samples_leaf': 9, 'criterion': 'absolute_error', 'max_depth': None, 'min_weight_fraction_leaf': 0.0, 'max_leaf_nodes': 20, 'bootstrap': False, 'ccp_alpha': 0.014}. Best is trial 2774 with value: 0.046571421912873.
[I 2025-04-16 01:49:36,327] Trial 2978 finished with value: -0.1936417107583833 and parameters: {'n_estimators': 1697, 'min_samples_split': 17, 'max_features': 0.9, 'min_samples_leaf': 9, 'criterion': 'absolute_error', 'max_depth': None, 'min_weight_fraction_leaf': 0.0, 'max_leaf_nodes': 20, 'bootstrap': False, 'ccp_alpha': 0.01}. Best is trial 2774 with value: 0.046571421912873.
[I 2025-04-16 01:49:38,305] Trial 2979 finished with value: -0.1936417107583833 and parameters: {'n_estimators': 2068, 'min_samples_split': 16, 'max_features': 0.9, 'min_samples_leaf': 9, 'criterion': 'absolute_error', 'max_depth': None, 'min_weight_fraction_leaf': 0.0, 'max_leaf_nodes': 20, 'bootstrap': False, 'ccp_alpha': 0.02}. Best is trial 2774 with value: 0.046571421912873.
[I 2025-04-16 01:49:39,946] Trial 2980 finished with value: -17.528986382276482 and parameters: {'n_estimators': 1652, 'min_samples_split': 17, 'max_features': 0.9, 'min_samples_leaf': 7, 'criterion': 'squared_error', 'max_depth': None, 'min_weight_fraction_leaf': 0.0, 'max_leaf_nodes': 20, 'bootstrap': False, 'ccp_alpha': 0.005}. Best is trial 2774 with value: 0.046571421912873.
[I 2025-04-16 01:49:41,732] Trial 2981 finished with value: -7.437578960011814 and parameters: {'n_estimators': 2001, 'min_samples_split': 12, 'max_features': 0.89, 'min_samples_leaf': 7, 'criterion': 'absolute_error', 'max_depth': None, 'min_weight_fraction_leaf': 0.0, 'max_leaf_nodes': 20, 'bootstrap': False, 'ccp_alpha': 0.0}. Best is trial 2774 with value: 0.046571421912873.
[I 2025-04-16 01:49:43,753] Trial 2982 finished with value: -0.1936417107583833 and parameters: {'n_estimators': 1951, 'min_samples_split': 17, 'max_features': 0.9, 'min_samples_leaf': 9, 'criterion': 'absolute_error', 'max_depth': None, 'min_weight_fraction_leaf': 0.0, 'max_leaf_nodes': 20, 'bootstrap': False, 'ccp_alpha': 0.009000000000000001}. Best is trial 2774 with value: 0.046571421912873.
[I 2025-04-16 01:49:45,446] Trial 2983 finished with value: -0.1936417107583833 and parameters: {'n_estimators': 1746, 'min_samples_split': 13, 'max_features': 0.89, 'min_samples_leaf': 7, 'criterion': 'absolute_error', 'max_depth': None, 'min_weight_fraction_leaf': 0.0, 'max_leaf_nodes': 20, 'bootstrap': False, 'ccp_alpha': 0.025}. Best is trial 2774 with value: 0.046571421912873.
[I 2025-04-16 01:49:47,797] Trial 2984 finished with value: -0.1936417107583833 and parameters: {'n_estimators': 2302, 'min_samples_split': 13, 'max_features': 0.92, 'min_samples_leaf': 9, 'criterion': 'absolute_error', 'max_depth': None, 'min_weight_fraction_leaf': 0.0, 'max_leaf_nodes': 20, 'bootstrap': False, 'ccp_alpha': 0.014}. Best is trial 2774 with value: 0.046571421912873.
[I 2025-04-16 01:49:49,503] Trial 2985 finished with value: 0.022523923872388642 and parameters: {'n_estimators': 1450, 'min_samples_split': 17, 'max_features': 0.9, 'min_samples_leaf': 7, 'criterion': 'absolute_error', 'max_depth': None, 'min_weight_fraction_leaf': 0.0, 'max_leaf_nodes': 20, 'bootstrap': False, 'ccp_alpha': 0.005}. Best is trial 2774 with value: 0.046571421912873.
[I 2025-04-16 01:49:51,299] Trial 2986 finished with value: -0.1936417107583833 and parameters: {'n_estimators': 1943, 'min_samples_split': 12, 'max_features': 0.92, 'min_samples_leaf': 7, 'criterion': 'absolute_error', 'max_depth': 15, 'min_weight_fraction_leaf': 0.0, 'max_leaf_nodes': 20, 'bootstrap': False, 'ccp_alpha': 0.019}. Best is trial 2774 with value: 0.046571421912873.
[I 2025-04-16 01:49:52,884] Trial 2987 finished with value: -37.662026690578486 and parameters: {'n_estimators': 1756, 'min_samples_split': 16, 'max_features': 0.9, 'min_samples_leaf': 9, 'criterion': 'poisson', 'max_depth': None, 'min_weight_fraction_leaf': 0.0, 'max_leaf_nodes': 20, 'bootstrap': False, 'ccp_alpha': 0.0}. Best is trial 2774 with value: 0.046571421912873.
[I 2025-04-16 01:49:54,395] Trial 2988 finished with value: -0.1936417107583833 and parameters: {'n_estimators': 1470, 'min_samples_split': 12, 'max_features': 0.88, 'min_samples_leaf': 7, 'criterion': 'absolute_error', 'max_depth': None, 'min_weight_fraction_leaf': 0.0, 'max_leaf_nodes': 20, 'bootstrap': False, 'ccp_alpha': 0.009000000000000001}. Best is trial 2774 with value: 0.046571421912873.
[I 2025-04-16 01:49:55,956] Trial 2989 finished with value: -0.1936417107583833 and parameters: {'n_estimators': 1371, 'min_samples_split': 12, 'max_features': 0.92, 'min_samples_leaf': 6, 'criterion': 'absolute_error', 'max_depth': 15, 'min_weight_fraction_leaf': 0.0, 'max_leaf_nodes': 20, 'bootstrap': False, 'ccp_alpha': 0.014}. Best is trial 2774 with value: 0.046571421912873.
[I 2025-04-16 01:49:57,276] Trial 2990 finished with value: 0.016918154513078654 and parameters: {'n_estimators': 1150, 'min_samples_split': 16, 'max_features': 0.9, 'min_samples_leaf': 6, 'criterion': 'absolute_error', 'max_depth': None, 'min_weight_fraction_leaf': 0.0, 'max_leaf_nodes': 20, 'bootstrap': False, 'ccp_alpha': 0.005}. Best is trial 2774 with value: 0.046571421912873.
[I 2025-04-16 01:49:58,710] Trial 2991 finished with value: -0.1936417107583833 and parameters: {'n_estimators': 1462, 'min_samples_split': 12, 'max_features': 0.88, 'min_samples_leaf': 83, 'criterion': 'absolute_error', 'max_depth': None, 'min_weight_fraction_leaf': 0.0, 'max_leaf_nodes': 20, 'bootstrap': False, 'ccp_alpha': 0.0}. Best is trial 2774 with value: 0.046571421912873.
[I 2025-04-16 01:50:00,364] Trial 2992 finished with value: -0.1936417107583833 and parameters: {'n_estimators': 1424, 'min_samples_split': 12, 'max_features': 0.7000000000000001, 'min_samples_leaf': 9, 'criterion': 'absolute_error', 'max_depth': None, 'min_weight_fraction_leaf': 0.0, 'max_leaf_nodes': 20, 'bootstrap': False, 'ccp_alpha': 0.03}. Best is trial 2774 with value: 0.046571421912873.
[I 2025-04-16 01:50:01,926] Trial 2993 finished with value: -0.1936417107583833 and parameters: {'n_estimators': 1443, 'min_samples_split': 12, 'max_features': 0.93, 'min_samples_leaf': 6, 'criterion': 'absolute_error', 'max_depth': None, 'min_weight_fraction_leaf': 0.0, 'max_leaf_nodes': 20, 'bootstrap': False, 'ccp_alpha': 0.17400000000000002}. Best is trial 2774 with value: 0.046571421912873.
[I 2025-04-16 01:50:03,392] Trial 2994 finished with value: -0.1936417107583833 and parameters: {'n_estimators': 1250, 'min_samples_split': 17, 'max_features': 0.9, 'min_samples_leaf': 9, 'criterion': 'absolute_error', 'max_depth': None, 'min_weight_fraction_leaf': 0.0, 'max_leaf_nodes': 20, 'bootstrap': False, 'ccp_alpha': 0.01}. Best is trial 2774 with value: 0.046571421912873.
[I 2025-04-16 01:50:05,356] Trial 2995 finished with value: -0.1936417107583833 and parameters: {'n_estimators': 1866, 'min_samples_split': 17, 'max_features': 0.93, 'min_samples_leaf': 98, 'criterion': 'absolute_error', 'max_depth': None, 'min_weight_fraction_leaf': 0.0, 'max_leaf_nodes': 20, 'bootstrap': False, 'ccp_alpha': 0.005}. Best is trial 2774 with value: 0.046571421912873.
[I 2025-04-16 01:50:06,948] Trial 2996 finished with value: -17.528986382276436 and parameters: {'n_estimators': 1585, 'min_samples_split': 11, 'max_features': 0.88, 'min_samples_leaf': 7, 'criterion': 'friedman_mse', 'max_depth': None, 'min_weight_fraction_leaf': 0.0, 'max_leaf_nodes': 20, 'bootstrap': False, 'ccp_alpha': 0.019}. Best is trial 2774 with value: 0.046571421912873.
[I 2025-04-16 01:50:09,130] Trial 2997 finished with value: -0.1936417107583833 and parameters: {'n_estimators': 2400, 'min_samples_split': 17, 'max_features': 0.91, 'min_samples_leaf': 6, 'criterion': 'absolute_error', 'max_depth': None, 'min_weight_fraction_leaf': 0.0, 'max_leaf_nodes': 20, 'bootstrap': False, 'ccp_alpha': 0.01}. Best is trial 2774 with value: 0.046571421912873.
[I 2025-04-16 01:50:10,851] Trial 2998 finished with value: -0.1936417107583833 and parameters: {'n_estimators': 1579, 'min_samples_split': 11, 'max_features': 0.89, 'min_samples_leaf': 5, 'criterion': 'absolute_error', 'max_depth': None, 'min_weight_fraction_leaf': 0.0, 'max_leaf_nodes': 20, 'bootstrap': False, 'ccp_alpha': 0.014}. Best is trial 2774 with value: 0.046571421912873.
[I 2025-04-16 01:50:12,101] Trial 2999 finished with value: -0.1936417107583833 and parameters: {'n_estimators': 1071, 'min_samples_split': 11, 'max_features': 0.93, 'min_samples_leaf': 9, 'criterion': 'absolute_error', 'max_depth': None, 'min_weight_fraction_leaf': 0.0, 'max_leaf_nodes': 20, 'bootstrap': False, 'ccp_alpha': 0.005}. Best is trial 2774 with value: 0.046571421912873.
[I 2025-04-16 01:50:13,553] Trial 3000 finished with value: 0.02155437507240663 and parameters: {'n_estimators': 1335, 'min_samples_split': 16, 'max_features': 0.91, 'min_samples_leaf': 6, 'criterion': 'absolute_error', 'max_depth': None, 'min_weight_fraction_leaf': 0.0, 'max_leaf_nodes': 20, 'bootstrap': False, 'ccp_alpha': 0.005}. Best is trial 2774 with value: 0.046571421912873.
[I 2025-04-16 01:50:14,879] Trial 3001 finished with value: -7.222113229435851 and parameters: {'n_estimators': 1257, 'min_samples_split': 17, 'max_features': 0.89, 'min_samples_leaf': 9, 'criterion': 'absolute_error', 'max_depth': None, 'min_weight_fraction_leaf': 0.0, 'max_leaf_nodes': 20, 'bootstrap': False, 'ccp_alpha': 0.0}. Best is trial 2774 with value: 0.046571421912873.
[I 2025-04-16 01:50:17,192] Trial 3002 finished with value: -0.1936417107583833 and parameters: {'n_estimators': 2222, 'min_samples_split': 17, 'max_features': 0.89, 'min_samples_leaf': 9, 'criterion': 'absolute_error', 'max_depth': None, 'min_weight_fraction_leaf': 0.0, 'max_leaf_nodes': 20, 'bootstrap': False, 'ccp_alpha': 0.135}. Best is trial 2774 with value: 0.046571421912873.
[I 2025-04-16 01:50:18,619] Trial 3003 finished with value: -0.1936417107583833 and parameters: {'n_estimators': 1121, 'min_samples_split': 18, 'max_features': 0.88, 'min_samples_leaf': 8, 'criterion': 'absolute_error', 'max_depth': None, 'min_weight_fraction_leaf': 0.0, 'max_leaf_nodes': 20, 'bootstrap': False, 'ccp_alpha': 0.015}. Best is trial 2774 with value: 0.046571421912873.
