[I 2025-04-16 02:15:34,556] Trial 4349 finished with value: -0.1936417107583833 and parameters: {'n_estimators': 523, 'min_samples_split': 68, 'max_features': 0.68, 'min_samples_leaf': 1, 'criterion': 'absolute_error', 'max_depth': 15, 'min_weight_fraction_leaf': 0.0, 'max_leaf_nodes': 300, 'bootstrap': False, 'ccp_alpha': 0.018000000000000002}. Best is trial 4065 with value: 0.057524275121161005.
[I 2025-04-16 02:15:35,747] Trial 4350 finished with value: -0.1936417107583833 and parameters: {'n_estimators': 721, 'min_samples_split': 6, 'max_features': 0.8400000000000001, 'min_samples_leaf': 6, 'criterion': 'absolute_error', 'max_depth': 15, 'min_weight_fraction_leaf': 0.0, 'max_leaf_nodes': 300, 'bootstrap': False, 'ccp_alpha': 0.013000000000000001}. Best is trial 4065 with value: 0.057524275121161005.
[I 2025-04-16 02:15:36,585] Trial 4351 finished with value: -8.092079612561356 and parameters: {'n_estimators': 335, 'min_samples_split': 12, 'max_features': 0.74, 'min_samples_leaf': 3, 'criterion': 'absolute_error', 'max_depth': 15, 'min_weight_fraction_leaf': 0.0, 'max_leaf_nodes': 300, 'bootstrap': False, 'ccp_alpha': 0.0}. Best is trial 4065 with value: 0.057524275121161005.
[I 2025-04-16 02:15:37,296] Trial 4352 finished with value: -0.1936417107583833 and parameters: {'n_estimators': 154, 'min_samples_split': 6, 'max_features': 0.8200000000000001, 'min_samples_leaf': 1, 'criterion': 'absolute_error', 'max_depth': 15, 'min_weight_fraction_leaf': 0.0, 'max_leaf_nodes': 50, 'bootstrap': False, 'ccp_alpha': 0.009000000000000001}. Best is trial 4065 with value: 0.057524275121161005.
[I 2025-04-16 02:15:38,275] Trial 4353 finished with value: -0.06392781809702341 and parameters: {'n_estimators': 516, 'min_samples_split': 2, 'max_features': 0.7100000000000001, 'min_samples_leaf': 5, 'criterion': 'absolute_error', 'max_depth': 15, 'min_weight_fraction_leaf': 0.0, 'max_leaf_nodes': 300, 'bootstrap': False, 'ccp_alpha': 0.005}. Best is trial 4065 with value: 0.057524275121161005.
[I 2025-04-16 02:15:39,741] Trial 4354 finished with value: -0.1936417107583833 and parameters: {'n_estimators': 973, 'min_samples_split': 9, 'max_features': 0.79, 'min_samples_leaf': 3, 'criterion': 'absolute_error', 'max_depth': 15, 'min_weight_fraction_leaf': 0.0, 'max_leaf_nodes': 300, 'bootstrap': False, 'ccp_alpha': 0.126}. Best is trial 4065 with value: 0.057524275121161005.
[I 2025-04-16 02:15:40,960] Trial 4355 finished with value: -0.1936417107583833 and parameters: {'n_estimators': 714, 'min_samples_split': 5, 'max_features': 0.75, 'min_samples_leaf': 1, 'criterion': 'absolute_error', 'max_depth': 15, 'min_weight_fraction_leaf': 0.0, 'max_leaf_nodes': 300, 'bootstrap': False, 'ccp_alpha': 0.014}. Best is trial 4065 with value: 0.057524275121161005.
[I 2025-04-16 02:15:41,818] Trial 4356 finished with value: -0.06371487338027368 and parameters: {'n_estimators': 351, 'min_samples_split': 13, 'max_features': 0.73, 'min_samples_leaf': 3, 'criterion': 'absolute_error', 'max_depth': 15, 'min_weight_fraction_leaf': 0.0, 'max_leaf_nodes': 10, 'bootstrap': False, 'ccp_alpha': 0.005}. Best is trial 4065 with value: 0.057524275121161005.
[I 2025-04-16 02:15:42,867] Trial 4357 finished with value: -0.1936417107583833 and parameters: {'n_estimators': 557, 'min_samples_split': 9, 'max_features': 0.64, 'min_samples_leaf': 6, 'criterion': 'absolute_error', 'max_depth': 15, 'min_weight_fraction_leaf': 0.06, 'max_leaf_nodes': 300, 'bootstrap': False, 'ccp_alpha': 0.009000000000000001}. Best is trial 4065 with value: 0.057524275121161005.
[I 2025-04-16 02:15:43,622] Trial 4358 finished with value: -17.5289863822749 and parameters: {'n_estimators': 172, 'min_samples_split': 2, 'max_features': 0.6900000000000001, 'min_samples_leaf': 1, 'criterion': 'squared_error', 'max_depth': 15, 'min_weight_fraction_leaf': 0.0, 'max_leaf_nodes': 300, 'bootstrap': False, 'ccp_alpha': 0.023}. Best is trial 4065 with value: 0.057524275121161005.
[I 2025-04-16 02:15:45,043] Trial 4359 finished with value: -10.974998957474687 and parameters: {'n_estimators': 1109, 'min_samples_split': 6, 'max_features': 0.81, 'min_samples_leaf': 3, 'criterion': 'absolute_error', 'max_depth': 15, 'min_weight_fraction_leaf': 0.0, 'max_leaf_nodes': 300, 'bootstrap': False, 'ccp_alpha': 0.0}. Best is trial 4065 with value: 0.057524275121161005.
[I 2025-04-16 02:15:45,960] Trial 4360 finished with value: -0.1936417107583833 and parameters: {'n_estimators': 437, 'min_samples_split': 9, 'max_features': 0.77, 'min_samples_leaf': 5, 'criterion': 'absolute_error', 'max_depth': 15, 'min_weight_fraction_leaf': 0.0, 'max_leaf_nodes': 300, 'bootstrap': False, 'ccp_alpha': 0.017}. Best is trial 4065 with value: 0.057524275121161005.
[I 2025-04-16 02:15:47,243] Trial 4361 finished with value: -0.1936417107583833 and parameters: {'n_estimators': 781, 'min_samples_split': 2, 'max_features': 0.8300000000000001, 'min_samples_leaf': 1, 'criterion': 'absolute_error', 'max_depth': 15, 'min_weight_fraction_leaf': 0.0, 'max_leaf_nodes': 300, 'bootstrap': False, 'ccp_alpha': 0.01}. Best is trial 4065 with value: 0.057524275121161005.
[I 2025-04-16 02:15:47,827] Trial 4362 finished with value: -23.83352176288286 and parameters: {'n_estimators': 5, 'min_samples_split': 13, 'max_features': 0.66, 'min_samples_leaf': 3, 'criterion': 'poisson', 'max_depth': 15, 'min_weight_fraction_leaf': 0.0, 'max_leaf_nodes': 300, 'bootstrap': False, 'ccp_alpha': 0.005}. Best is trial 4065 with value: 0.057524275121161005.
[I 2025-04-16 02:15:48,385] Trial 4363 finished with value: -16.560216952635944 and parameters: {'n_estimators': 1, 'min_samples_split': 5, 'max_features': 0.72, 'min_samples_leaf': 5, 'criterion': 'absolute_error', 'max_depth': 20, 'min_weight_fraction_leaf': 0.0, 'max_leaf_nodes': 300, 'bootstrap': False, 'ccp_alpha': 0.0}. Best is trial 4065 with value: 0.057524275121161005.
[I 2025-04-16 02:15:49,258] Trial 4364 finished with value: -0.1936417107583833 and parameters: {'n_estimators': 323, 'min_samples_split': 6, 'max_features': 0.75, 'min_samples_leaf': 1, 'criterion': 'absolute_error', 'max_depth': 15, 'min_weight_fraction_leaf': 0.0, 'max_leaf_nodes': 300, 'bootstrap': False, 'ccp_alpha': 0.014}. Best is trial 4065 with value: 0.057524275121161005.
[I 2025-04-16 02:15:50,316] Trial 4365 finished with value: -0.1936417107583833 and parameters: {'n_estimators': 616, 'min_samples_split': 2, 'max_features': 0.78, 'min_samples_leaf': 3, 'criterion': 'absolute_error', 'max_depth': 15, 'min_weight_fraction_leaf': 0.0, 'max_leaf_nodes': 50, 'bootstrap': False, 'ccp_alpha': 0.009000000000000001}. Best is trial 4065 with value: 0.057524275121161005.
[I 2025-04-16 02:15:51,614] Trial 4366 finished with value: -0.1936417107583833 and parameters: {'n_estimators': 845, 'min_samples_split': 12, 'max_features': 0.7100000000000001, 'min_samples_leaf': 6, 'criterion': 'absolute_error', 'max_depth': 45, 'min_weight_fraction_leaf': 0.0, 'max_leaf_nodes': 300, 'bootstrap': False, 'ccp_alpha': 0.019}. Best is trial 4065 with value: 0.057524275121161005.
[I 2025-04-16 02:15:52,626] Trial 4367 finished with value: -0.1936417107583833 and parameters: {'n_estimators': 518, 'min_samples_split': 79, 'max_features': 0.8, 'min_samples_leaf': 1, 'criterion': 'absolute_error', 'max_depth': 15, 'min_weight_fraction_leaf': 0.0, 'max_leaf_nodes': None, 'bootstrap': False, 'ccp_alpha': 0.005}. Best is trial 4065 with value: 0.057524275121161005.
[I 2025-04-16 02:15:53,391] Trial 4368 finished with value: -10.982814130265128 and parameters: {'n_estimators': 203, 'min_samples_split': 9, 'max_features': 0.76, 'min_samples_leaf': 3, 'criterion': 'absolute_error', 'max_depth': 15, 'min_weight_fraction_leaf': 0.0, 'max_leaf_nodes': 300, 'bootstrap': False, 'ccp_alpha': 0.0}. Best is trial 4065 with value: 0.057524275121161005.
[I 2025-04-16 02:15:54,220] Trial 4369 finished with value: -0.1936417107583833 and parameters: {'n_estimators': 324, 'min_samples_split': 5, 'max_features': 0.73, 'min_samples_leaf': 4, 'criterion': 'absolute_error', 'max_depth': 15, 'min_weight_fraction_leaf': 0.0, 'max_leaf_nodes': 300, 'bootstrap': False, 'ccp_alpha': 0.013000000000000001}. Best is trial 4065 with value: 0.057524275121161005.
[I 2025-04-16 02:15:55,610] Trial 4370 finished with value: -0.1936417107583833 and parameters: {'n_estimators': 997, 'min_samples_split': 2, 'max_features': 0.8400000000000001, 'min_samples_leaf': 1, 'criterion': 'absolute_error', 'max_depth': 15, 'min_weight_fraction_leaf': 0.0, 'max_leaf_nodes': 300, 'bootstrap': False, 'ccp_alpha': 0.028}. Best is trial 4065 with value: 0.057524275121161005.
[I 2025-04-16 02:15:56,169] Trial 4371 finished with value: -0.1936417107583833 and parameters: {'n_estimators': 1, 'min_samples_split': 9, 'max_features': 0.6900000000000001, 'min_samples_leaf': 3, 'criterion': 'absolute_error', 'max_depth': 10, 'min_weight_fraction_leaf': 0.0, 'max_leaf_nodes': 300, 'bootstrap': False, 'ccp_alpha': 0.006}. Best is trial 4065 with value: 0.057524275121161005.
[I 2025-04-16 02:15:57,277] Trial 4372 finished with value: -17.528986382274866 and parameters: {'n_estimators': 626, 'min_samples_split': 6, 'max_features': 0.74, 'min_samples_leaf': 6, 'criterion': 'friedman_mse', 'max_depth': 15, 'min_weight_fraction_leaf': 0.0, 'max_leaf_nodes': 300, 'bootstrap': False, 'ccp_alpha': 0.014}. Best is trial 4065 with value: 0.057524275121161005.
[I 2025-04-16 02:15:58,230] Trial 4373 finished with value: -0.1936417107583833 and parameters: {'n_estimators': 459, 'min_samples_split': 13, 'max_features': 0.78, 'min_samples_leaf': 1, 'criterion': 'absolute_error', 'max_depth': 15, 'min_weight_fraction_leaf': 0.04, 'max_leaf_nodes': 300, 'bootstrap': False, 'ccp_alpha': 0.009000000000000001}. Best is trial 4065 with value: 0.057524275121161005.
[I 2025-04-16 02:15:59,504] Trial 4374 finished with value: -0.1936417107583833 and parameters: {'n_estimators': 772, 'min_samples_split': 100, 'max_features': 0.8200000000000001, 'min_samples_leaf': 4, 'criterion': 'absolute_error', 'max_depth': 15, 'min_weight_fraction_leaf': 0.0, 'max_leaf_nodes': 300, 'bootstrap': False, 'ccp_alpha': 0.021}. Best is trial 4065 with value: 0.057524275121161005.
[I 2025-04-16 02:16:00,332] Trial 4375 finished with value: 0.013923453840526756 and parameters: {'n_estimators': 274, 'min_samples_split': 2, 'max_features': 0.7100000000000001, 'min_samples_leaf': 3, 'criterion': 'absolute_error', 'max_depth': 15, 'min_weight_fraction_leaf': 0.0, 'max_leaf_nodes': 300, 'bootstrap': False, 'ccp_alpha': 0.005}. Best is trial 4065 with value: 0.057524275121161005.
[I 2025-04-16 02:16:01,294] Trial 4376 finished with value: -0.1936417107583833 and parameters: {'n_estimators': 482, 'min_samples_split': 9, 'max_features': 0.75, 'min_samples_leaf': 1, 'criterion': 'absolute_error', 'max_depth': 15, 'min_weight_fraction_leaf': 0.0, 'max_leaf_nodes': 300, 'bootstrap': False, 'ccp_alpha': 0.014}. Best is trial 4065 with value: 0.057524275121161005.
[I 2025-04-16 02:16:02,476] Trial 4377 finished with value: -6.3605396517355635 and parameters: {'n_estimators': 719, 'min_samples_split': 6, 'max_features': 0.54, 'min_samples_leaf': 5, 'criterion': 'absolute_error', 'max_depth': 15, 'min_weight_fraction_leaf': 0.09, 'max_leaf_nodes': 300, 'bootstrap': False, 'ccp_alpha': 0.0}. Best is trial 4065 with value: 0.057524275121161005.
[I 2025-04-16 02:16:04,069] Trial 4378 finished with value: -0.1936417107583833 and parameters: {'n_estimators': 1158, 'min_samples_split': 6, 'max_features': 0.8, 'min_samples_leaf': 3, 'criterion': 'absolute_error', 'max_depth': 15, 'min_weight_fraction_leaf': 0.08, 'max_leaf_nodes': 50, 'bootstrap': False, 'ccp_alpha': 0.009000000000000001}. Best is trial 4065 with value: 0.057524275121161005.
[I 2025-04-16 02:16:04,927] Trial 4379 finished with value: -13.487384591908341 and parameters: {'n_estimators': 314, 'min_samples_split': 2, 'max_features': 0.73, 'min_samples_leaf': 1, 'criterion': 'absolute_error', 'max_depth': 15, 'min_weight_fraction_leaf': 0.05, 'max_leaf_nodes': 300, 'bootstrap': False, 'ccp_alpha': 0.0}. Best is trial 4065 with value: 0.057524275121161005.
[I 2025-04-16 02:16:11,430] Trial 4380 finished with value: -17.528986382270553 and parameters: {'n_estimators': 7191, 'min_samples_split': 9, 'max_features': 0.68, 'min_samples_leaf': 6, 'criterion': 'squared_error', 'max_depth': 15, 'min_weight_fraction_leaf': 0.1, 'max_leaf_nodes': 300, 'bootstrap': False, 'ccp_alpha': 0.005}. Best is trial 4065 with value: 0.057524275121161005.
[I 2025-04-16 02:16:12,803] Trial 4381 finished with value: -0.1936417107583833 and parameters: {'n_estimators': 915, 'min_samples_split': 13, 'max_features': 0.77, 'min_samples_leaf': 3, 'criterion': 'absolute_error', 'max_depth': 15, 'min_weight_fraction_leaf': 0.07, 'max_leaf_nodes': 10, 'bootstrap': False, 'ccp_alpha': 0.018000000000000002}. Best is trial 4065 with value: 0.057524275121161005.
[I 2025-04-16 02:16:13,545] Trial 4382 finished with value: -0.1936417107583833 and parameters: {'n_estimators': 172, 'min_samples_split': 2, 'max_features': 0.8400000000000001, 'min_samples_leaf': 1, 'criterion': 'absolute_error', 'max_depth': 15, 'min_weight_fraction_leaf': 0.0, 'max_leaf_nodes': 300, 'bootstrap': False, 'ccp_alpha': 0.01}. Best is trial 4065 with value: 0.057524275121161005.
[I 2025-04-16 02:16:14,615] Trial 4383 finished with value: -0.1936417107583833 and parameters: {'n_estimators': 597, 'min_samples_split': 6, 'max_features': 0.4, 'min_samples_leaf': 5, 'criterion': 'absolute_error', 'max_depth': 15, 'min_weight_fraction_leaf': 0.0, 'max_leaf_nodes': 300, 'bootstrap': False, 'ccp_alpha': 0.014}. Best is trial 4065 with value: 0.057524275121161005.
[I 2025-04-16 02:16:15,556] Trial 4384 finished with value: -0.15054672292138813 and parameters: {'n_estimators': 437, 'min_samples_split': 9, 'max_features': 0.7000000000000001, 'min_samples_leaf': 3, 'criterion': 'absolute_error', 'max_depth': 15, 'min_weight_fraction_leaf': 0.0, 'max_leaf_nodes': 300, 'bootstrap': False, 'ccp_alpha': 0.005}. Best is trial 4065 with value: 0.057524275121161005.
[I 2025-04-16 02:16:16,272] Trial 4385 finished with value: -0.1936417107583833 and parameters: {'n_estimators': 158, 'min_samples_split': 5, 'max_features': 0.8, 'min_samples_leaf': 1, 'criterion': 'absolute_error', 'max_depth': 15, 'min_weight_fraction_leaf': 0.0, 'max_leaf_nodes': 300, 'bootstrap': False, 'ccp_alpha': 0.024}. Best is trial 4065 with value: 0.057524275121161005.
[I 2025-04-16 02:16:17,360] Trial 4386 finished with value: -0.13222947887369904 and parameters: {'n_estimators': 630, 'min_samples_split': 2, 'max_features': 0.76, 'min_samples_leaf': 4, 'criterion': 'absolute_error', 'max_depth': 20, 'min_weight_fraction_leaf': 0.0, 'max_leaf_nodes': 300, 'bootstrap': False, 'ccp_alpha': 0.005}. Best is trial 4065 with value: 0.057524275121161005.
[I 2025-04-16 02:16:18,629] Trial 4387 finished with value: -0.1936417107583833 and parameters: {'n_estimators': 834, 'min_samples_split': 9, 'max_features': 0.72, 'min_samples_leaf': 1, 'criterion': 'absolute_error', 'max_depth': 45, 'min_weight_fraction_leaf': 0.0, 'max_leaf_nodes': 300, 'bootstrap': False, 'ccp_alpha': 0.01}. Best is trial 4065 with value: 0.057524275121161005.
[I 2025-04-16 02:16:19,487] Trial 4388 finished with value: -9.561401622374234 and parameters: {'n_estimators': 374, 'min_samples_split': 13, 'max_features': 0.8200000000000001, 'min_samples_leaf': 6, 'criterion': 'absolute_error', 'max_depth': 15, 'min_weight_fraction_leaf': 0.0, 'max_leaf_nodes': 300, 'bootstrap': False, 'ccp_alpha': 0.0}. Best is trial 4065 with value: 0.057524275121161005.
[I 2025-04-16 02:16:20,235] Trial 4389 finished with value: -19.175570310413228 and parameters: {'n_estimators': 209, 'min_samples_split': 6, 'max_features': 0.74, 'min_samples_leaf': 3, 'criterion': 'poisson', 'max_depth': 15, 'min_weight_fraction_leaf': 0.0, 'max_leaf_nodes': None, 'bootstrap': False, 'ccp_alpha': 0.018000000000000002}. Best is trial 4065 with value: 0.057524275121161005.
[I 2025-04-16 02:16:21,224] Trial 4390 finished with value: -0.1936417107583833 and parameters: {'n_estimators': 488, 'min_samples_split': 5, 'max_features': 0.7000000000000001, 'min_samples_leaf': 3, 'criterion': 'absolute_error', 'max_depth': 15, 'min_weight_fraction_leaf': 0.0, 'max_leaf_nodes': 300, 'bootstrap': False, 'ccp_alpha': 0.01}. Best is trial 4065 with value: 0.057524275121161005.
[I 2025-04-16 02:16:22,707] Trial 4391 finished with value: 0.040297955035767205 and parameters: {'n_estimators': 978, 'min_samples_split': 2, 'max_features': 0.78, 'min_samples_leaf': 1, 'criterion': 'absolute_error', 'max_depth': 15, 'min_weight_fraction_leaf': 0.0, 'max_leaf_nodes': 300, 'bootstrap': False, 'ccp_alpha': 0.005}. Best is trial 4065 with value: 0.057524275121161005.
[I 2025-04-16 02:16:23,815] Trial 4392 finished with value: -0.1936417107583833 and parameters: {'n_estimators': 657, 'min_samples_split': 9, 'max_features': 0.8400000000000001, 'min_samples_leaf': 5, 'criterion': 'absolute_error', 'max_depth': 15, 'min_weight_fraction_leaf': 0.0, 'max_leaf_nodes': 300, 'bootstrap': False, 'ccp_alpha': 0.015}. Best is trial 4065 with value: 0.057524275121161005.
[I 2025-04-16 02:16:24,515] Trial 4393 finished with value: -0.1936417107583833 and parameters: {'n_estimators': 170, 'min_samples_split': 52, 'max_features': 0.76, 'min_samples_leaf': 3, 'criterion': 'absolute_error', 'max_depth': 15, 'min_weight_fraction_leaf': 0.0, 'max_leaf_nodes': 50, 'bootstrap': False, 'ccp_alpha': 0.0}. Best is trial 4065 with value: 0.057524275121161005.
[I 2025-04-16 02:16:25,458] Trial 4394 finished with value: -0.1936417107583833 and parameters: {'n_estimators': 424, 'min_samples_split': 13, 'max_features': 0.67, 'min_samples_leaf': 91, 'criterion': 'absolute_error', 'max_depth': 10, 'min_weight_fraction_leaf': 0.0, 'max_leaf_nodes': 300, 'bootstrap': False, 'ccp_alpha': 0.009000000000000001}. Best is trial 4065 with value: 0.057524275121161005.
[I 2025-04-16 02:16:26,785] Trial 4395 finished with value: -0.1936417107583833 and parameters: {'n_estimators': 790, 'min_samples_split': 2, 'max_features': 0.81, 'min_samples_leaf': 1, 'criterion': 'absolute_error', 'max_depth': 15, 'min_weight_fraction_leaf': 0.0, 'max_leaf_nodes': 300, 'bootstrap': False, 'ccp_alpha': 0.021}. Best is trial 4065 with value: 0.057524275121161005.
[I 2025-04-16 02:16:28,384] Trial 4396 finished with value: -17.52898638227591 and parameters: {'n_estimators': 1144, 'min_samples_split': 6, 'max_features': 0.73, 'min_samples_leaf': 6, 'criterion': 'friedman_mse', 'max_depth': 15, 'min_weight_fraction_leaf': 0.0, 'max_leaf_nodes': 300, 'bootstrap': False, 'ccp_alpha': 0.013000000000000001}. Best is trial 4065 with value: 0.057524275121161005.
[I 2025-04-16 02:16:29,237] Trial 4397 finished with value: 0.017306517439686565 and parameters: {'n_estimators': 338, 'min_samples_split': 6, 'max_features': 0.7100000000000001, 'min_samples_leaf': 3, 'criterion': 'absolute_error', 'max_depth': 15, 'min_weight_fraction_leaf': 0.0, 'max_leaf_nodes': 300, 'bootstrap': False, 'ccp_alpha': 0.005}. Best is trial 4065 with value: 0.057524275121161005.
[I 2025-04-16 02:16:30,266] Trial 4398 finished with value: -12.201257013230444 and parameters: {'n_estimators': 598, 'min_samples_split': 12, 'max_features': 0.79, 'min_samples_leaf': 1, 'criterion': 'absolute_error', 'max_depth': 15, 'min_weight_fraction_leaf': 0.0, 'max_leaf_nodes': 300, 'bootstrap': False, 'ccp_alpha': 0.0}. Best is trial 4065 with value: 0.057524275121161005.
[I 2025-04-16 02:16:30,994] Trial 4399 finished with value: -0.1936417107583833 and parameters: {'n_estimators': 173, 'min_samples_split': 9, 'max_features': 0.74, 'min_samples_leaf': 5, 'criterion': 'absolute_error', 'max_depth': 15, 'min_weight_fraction_leaf': 0.0, 'max_leaf_nodes': 300, 'bootstrap': False, 'ccp_alpha': 0.01}. Best is trial 4065 with value: 0.057524275121161005.
[I 2025-04-16 02:16:32,006] Trial 4400 finished with value: -0.1936417107583833 and parameters: {'n_estimators': 489, 'min_samples_split': 2, 'max_features': 0.77, 'min_samples_leaf': 3, 'criterion': 'absolute_error', 'max_depth': 15, 'min_weight_fraction_leaf': 0.0, 'max_leaf_nodes': 300, 'bootstrap': False, 'ccp_alpha': 0.016}. Best is trial 4065 with value: 0.057524275121161005.
[I 2025-04-16 02:16:33,280] Trial 4401 finished with value: -0.002471661511235479 and parameters: {'n_estimators': 762, 'min_samples_split': 6, 'max_features': 0.8200000000000001, 'min_samples_leaf': 1, 'criterion': 'absolute_error', 'max_depth': 15, 'min_weight_fraction_leaf': 0.0, 'max_leaf_nodes': 300, 'bootstrap': False, 'ccp_alpha': 0.006}. Best is trial 4065 with value: 0.057524275121161005.
[I 2025-04-16 02:16:33,848] Trial 4402 finished with value: -0.1936417107583833 and parameters: {'n_estimators': 3, 'min_samples_split': 2, 'max_features': 0.72, 'min_samples_leaf': 4, 'criterion': 'absolute_error', 'max_depth': 15, 'min_weight_fraction_leaf': 0.0, 'max_leaf_nodes': 300, 'bootstrap': False, 'ccp_alpha': 0.024}. Best is trial 4065 with value: 0.057524275121161005.
[I 2025-04-16 02:16:34,681] Trial 4403 finished with value: -0.32028866099197517 and parameters: {'n_estimators': 314, 'min_samples_split': 9, 'max_features': 0.6900000000000001, 'min_samples_leaf': 1, 'criterion': 'absolute_error', 'max_depth': 15, 'min_weight_fraction_leaf': 0.0, 'max_leaf_nodes': 300, 'bootstrap': False, 'ccp_alpha': 0.005}. Best is trial 4065 with value: 0.057524275121161005.
[I 2025-04-16 02:16:36,161] Trial 4404 finished with value: -0.1936417107583833 and parameters: {'n_estimators': 1025, 'min_samples_split': 13, 'max_features': 0.79, 'min_samples_leaf': 3, 'criterion': 'absolute_error', 'max_depth': 15, 'min_weight_fraction_leaf': 0.0, 'max_leaf_nodes': 300, 'bootstrap': False, 'ccp_alpha': 0.138}. Best is trial 4065 with value: 0.057524275121161005.
