[I 2025-04-16 02:12:12,643] Trial 4181 finished with value: -0.1936417107583833 and parameters: {'n_estimators': 491, 'min_samples_split': 12, 'max_features': 0.75, 'min_samples_leaf': 3, 'criterion': 'absolute_error', 'max_depth': 15, 'min_weight_fraction_leaf': 0.0, 'max_leaf_nodes': 300, 'bootstrap': False, 'ccp_alpha': 0.01}. Best is trial 4065 with value: 0.057524275121161005.
[I 2025-04-16 02:12:13,370] Trial 4182 finished with value: -47.31563381262019 and parameters: {'n_estimators': 223, 'min_samples_split': 2, 'max_features': 0.8300000000000001, 'min_samples_leaf': 1, 'criterion': 'absolute_error', 'max_depth': 15, 'min_weight_fraction_leaf': 0.0, 'max_leaf_nodes': 300, 'bootstrap': False, 'ccp_alpha': 0.0}. Best is trial 4065 with value: 0.057524275121161005.
[I 2025-04-16 02:12:14,520] Trial 4183 finished with value: -0.1936417107583833 and parameters: {'n_estimators': 683, 'min_samples_split': 9, 'max_features': 0.81, 'min_samples_leaf': 4, 'criterion': 'absolute_error', 'max_depth': 15, 'min_weight_fraction_leaf': 0.0, 'max_leaf_nodes': 300, 'bootstrap': False, 'ccp_alpha': 0.277}. Best is trial 4065 with value: 0.057524275121161005.
[I 2025-04-16 02:12:15,476] Trial 4184 finished with value: -0.1936417107583833 and parameters: {'n_estimators': 492, 'min_samples_split': 6, 'max_features': 0.78, 'min_samples_leaf': 3, 'criterion': 'absolute_error', 'max_depth': 15, 'min_weight_fraction_leaf': 0.0, 'max_leaf_nodes': 300, 'bootstrap': False, 'ccp_alpha': 0.014}. Best is trial 4065 with value: 0.057524275121161005.
[I 2025-04-16 02:12:16,895] Trial 4185 finished with value: -0.26029985766145397 and parameters: {'n_estimators': 906, 'min_samples_split': 9, 'max_features': 0.74, 'min_samples_leaf': 1, 'criterion': 'absolute_error', 'max_depth': 15, 'min_weight_fraction_leaf': 0.0, 'max_leaf_nodes': 300, 'bootstrap': False, 'ccp_alpha': 0.005}. Best is trial 4065 with value: 0.057524275121161005.
[I 2025-04-16 02:12:17,590] Trial 4186 finished with value: -0.1936417107583833 and parameters: {'n_estimators': 174, 'min_samples_split': 2, 'max_features': 0.76, 'min_samples_leaf': 5, 'criterion': 'absolute_error', 'max_depth': 15, 'min_weight_fraction_leaf': 0.0, 'max_leaf_nodes': 300, 'bootstrap': False, 'ccp_alpha': 0.027}. Best is trial 4065 with value: 0.057524275121161005.
[I 2025-04-16 02:12:18,663] Trial 4187 finished with value: -0.1936417107583833 and parameters: {'n_estimators': 656, 'min_samples_split': 5, 'max_features': 0.79, 'min_samples_leaf': 100, 'criterion': 'absolute_error', 'max_depth': 15, 'min_weight_fraction_leaf': 0.0, 'max_leaf_nodes': 300, 'bootstrap': False, 'ccp_alpha': 0.01}. Best is trial 4065 with value: 0.057524275121161005.
[I 2025-04-16 02:12:19,566] Trial 4188 finished with value: -17.528986382274876 and parameters: {'n_estimators': 399, 'min_samples_split': 12, 'max_features': 0.8300000000000001, 'min_samples_leaf': 3, 'criterion': 'squared_error', 'max_depth': 15, 'min_weight_fraction_leaf': 0.0, 'max_leaf_nodes': 300, 'bootstrap': False, 'ccp_alpha': 0.28500000000000003}. Best is trial 4065 with value: 0.057524275121161005.
[I 2025-04-16 02:12:20,756] Trial 4189 finished with value: -0.1936417107583833 and parameters: {'n_estimators': 776, 'min_samples_split': 6, 'max_features': 0.75, 'min_samples_leaf': 1, 'criterion': 'absolute_error', 'max_depth': 20, 'min_weight_fraction_leaf': 0.0, 'max_leaf_nodes': 300, 'bootstrap': False, 'ccp_alpha': 0.018000000000000002}. Best is trial 4065 with value: 0.057524275121161005.
[I 2025-04-16 02:12:21,485] Trial 4190 finished with value: -0.18252896825888504 and parameters: {'n_estimators': 164, 'min_samples_split': 2, 'max_features': 0.77, 'min_samples_leaf': 5, 'criterion': 'absolute_error', 'max_depth': 15, 'min_weight_fraction_leaf': 0.0, 'max_leaf_nodes': None, 'bootstrap': False, 'ccp_alpha': 0.005}. Best is trial 4065 with value: 0.057524275121161005.
[I 2025-04-16 02:12:22,429] Trial 4191 finished with value: -10.536124556046687 and parameters: {'n_estimators': 499, 'min_samples_split': 8, 'max_features': 0.81, 'min_samples_leaf': 3, 'criterion': 'absolute_error', 'max_depth': 15, 'min_weight_fraction_leaf': 0.0, 'max_leaf_nodes': 300, 'bootstrap': False, 'ccp_alpha': 0.0}. Best is trial 4065 with value: 0.057524275121161005.
[I 2025-04-16 02:12:22,977] Trial 4192 finished with value: -0.1936417107583833 and parameters: {'n_estimators': 9, 'min_samples_split': 134, 'max_features': 0.61, 'min_samples_leaf': 1, 'criterion': 'absolute_error', 'max_depth': 15, 'min_weight_fraction_leaf': 0.0, 'max_leaf_nodes': 300, 'bootstrap': False, 'ccp_alpha': 0.011}. Best is trial 4065 with value: 0.057524275121161005.
[I 2025-04-16 02:12:23,861] Trial 4193 finished with value: -0.1936417107583833 and parameters: {'n_estimators': 331, 'min_samples_split': 12, 'max_features': 0.74, 'min_samples_leaf': 5, 'criterion': 'absolute_error', 'max_depth': 15, 'min_weight_fraction_leaf': 0.0, 'max_leaf_nodes': 300, 'bootstrap': False, 'ccp_alpha': 0.006}. Best is trial 4065 with value: 0.057524275121161005.
[I 2025-04-16 02:12:25,114] Trial 4194 finished with value: -17.528986382275537 and parameters: {'n_estimators': 953, 'min_samples_split': 5, 'max_features': 0.8, 'min_samples_leaf': 53, 'criterion': 'poisson', 'max_depth': 15, 'min_weight_fraction_leaf': 0.0, 'max_leaf_nodes': 300, 'bootstrap': False, 'ccp_alpha': 0.02}. Best is trial 4065 with value: 0.057524275121161005.
[I 2025-04-16 02:12:26,127] Trial 4195 finished with value: -0.1936417107583833 and parameters: {'n_estimators': 578, 'min_samples_split': 2, 'max_features': 0.73, 'min_samples_leaf': 71, 'criterion': 'absolute_error', 'max_depth': 15, 'min_weight_fraction_leaf': 0.0, 'max_leaf_nodes': 300, 'bootstrap': False, 'ccp_alpha': 0.014}. Best is trial 4065 with value: 0.057524275121161005.
[I 2025-04-16 02:12:27,268] Trial 4196 finished with value: -8.828413432412653 and parameters: {'n_estimators': 751, 'min_samples_split': 9, 'max_features': 0.52, 'min_samples_leaf': 3, 'criterion': 'absolute_error', 'max_depth': 15, 'min_weight_fraction_leaf': 0.0, 'max_leaf_nodes': 300, 'bootstrap': False, 'ccp_alpha': 0.0}. Best is trial 4065 with value: 0.057524275121161005.
[I 2025-04-16 02:12:28,151] Trial 4197 finished with value: -0.1936417107583833 and parameters: {'n_estimators': 347, 'min_samples_split': 59, 'max_features': 0.78, 'min_samples_leaf': 1, 'criterion': 'absolute_error', 'max_depth': 15, 'min_weight_fraction_leaf': 0.0, 'max_leaf_nodes': 300, 'bootstrap': False, 'ccp_alpha': 0.009000000000000001}. Best is trial 4065 with value: 0.057524275121161005.
[I 2025-04-16 02:12:28,884] Trial 4198 finished with value: 0.019717673439543316 and parameters: {'n_estimators': 187, 'min_samples_split': 5, 'max_features': 0.76, 'min_samples_leaf': 3, 'criterion': 'absolute_error', 'max_depth': 10, 'min_weight_fraction_leaf': 0.0, 'max_leaf_nodes': 300, 'bootstrap': False, 'ccp_alpha': 0.005}. Best is trial 4065 with value: 0.057524275121161005.
[I 2025-04-16 02:12:29,901] Trial 4199 finished with value: -0.1936417107583833 and parameters: {'n_estimators': 567, 'min_samples_split': 8, 'max_features': 0.8300000000000001, 'min_samples_leaf': 1, 'criterion': 'absolute_error', 'max_depth': 15, 'min_weight_fraction_leaf': 0.06, 'max_leaf_nodes': 300, 'bootstrap': False, 'ccp_alpha': 0.023}. Best is trial 4065 with value: 0.057524275121161005.
[I 2025-04-16 02:12:31,191] Trial 4200 finished with value: -0.1936417107583833 and parameters: {'n_estimators': 875, 'min_samples_split': 2, 'max_features': 0.73, 'min_samples_leaf': 5, 'criterion': 'absolute_error', 'max_depth': 15, 'min_weight_fraction_leaf': 0.0, 'max_leaf_nodes': 50, 'bootstrap': False, 'ccp_alpha': 0.013000000000000001}. Best is trial 4065 with value: 0.057524275121161005.
[I 2025-04-16 02:12:31,761] Trial 4201 finished with value: -0.1936417107583833 and parameters: {'n_estimators': 7, 'min_samples_split': 12, 'max_features': 0.76, 'min_samples_leaf': 95, 'criterion': 'absolute_error', 'max_depth': 15, 'min_weight_fraction_leaf': 0.0, 'max_leaf_nodes': 300, 'bootstrap': False, 'ccp_alpha': 0.005}. Best is trial 4065 with value: 0.057524275121161005.
[I 2025-04-16 02:12:32,672] Trial 4202 finished with value: -0.1936417107583833 and parameters: {'n_estimators': 421, 'min_samples_split': 6, 'max_features': 0.79, 'min_samples_leaf': 3, 'criterion': 'absolute_error', 'max_depth': 15, 'min_weight_fraction_leaf': 0.0, 'max_leaf_nodes': 300, 'bootstrap': False, 'ccp_alpha': 0.016}. Best is trial 4065 with value: 0.057524275121161005.
[I 2025-04-16 02:12:33,837] Trial 4203 finished with value: -17.528986382274862 and parameters: {'n_estimators': 687, 'min_samples_split': 2, 'max_features': 0.74, 'min_samples_leaf': 1, 'criterion': 'friedman_mse', 'max_depth': 15, 'min_weight_fraction_leaf': 0.0, 'max_leaf_nodes': 300, 'bootstrap': False, 'ccp_alpha': 0.005}. Best is trial 4065 with value: 0.057524275121161005.
[I 2025-04-16 02:12:43,019] Trial 4204 finished with value: -0.1936417107583833 and parameters: {'n_estimators': 9860, 'min_samples_split': 9, 'max_features': 0.81, 'min_samples_leaf': 5, 'criterion': 'absolute_error', 'max_depth': 15, 'min_weight_fraction_leaf': 0.0, 'max_leaf_nodes': 300, 'bootstrap': False, 'ccp_alpha': 0.01}. Best is trial 4065 with value: 0.057524275121161005.
[I 2025-04-16 02:12:43,779] Trial 4205 finished with value: -13.843037083341775 and parameters: {'n_estimators': 275, 'min_samples_split': 6, 'max_features': 0.7100000000000001, 'min_samples_leaf': 3, 'criterion': 'absolute_error', 'max_depth': 15, 'min_weight_fraction_leaf': 0.0, 'max_leaf_nodes': 10, 'bootstrap': False, 'ccp_alpha': 0.0}. Best is trial 4065 with value: 0.057524275121161005.
[I 2025-04-16 02:12:45,396] Trial 4206 finished with value: -0.1936417107583833 and parameters: {'n_estimators': 1137, 'min_samples_split': 12, 'max_features': 0.77, 'min_samples_leaf': 1, 'criterion': 'absolute_error', 'max_depth': 15, 'min_weight_fraction_leaf': 0.0, 'max_leaf_nodes': 300, 'bootstrap': False, 'ccp_alpha': 0.01}. Best is trial 4065 with value: 0.057524275121161005.
[I 2025-04-16 02:12:46,376] Trial 4207 finished with value: -0.1936417107583833 and parameters: {'n_estimators': 466, 'min_samples_split': 2, 'max_features': 0.68, 'min_samples_leaf': 3, 'criterion': 'absolute_error', 'max_depth': 15, 'min_weight_fraction_leaf': 0.0, 'max_leaf_nodes': 300, 'bootstrap': False, 'ccp_alpha': 0.021}. Best is trial 4065 with value: 0.057524275121161005.
[I 2025-04-16 02:12:47,494] Trial 4208 finished with value: -5.316183094392613 and parameters: {'n_estimators': 667, 'min_samples_split': 8, 'max_features': 0.44, 'min_samples_leaf': 5, 'criterion': 'absolute_error', 'max_depth': 15, 'min_weight_fraction_leaf': 0.0, 'max_leaf_nodes': 300, 'bootstrap': False, 'ccp_alpha': 0.0}. Best is trial 4065 with value: 0.057524275121161005.
[I 2025-04-16 02:12:48,910] Trial 4209 finished with value: -0.1936417107583833 and parameters: {'n_estimators': 956, 'min_samples_split': 5, 'max_features': 0.65, 'min_samples_leaf': 45, 'criterion': 'absolute_error', 'max_depth': 15, 'min_weight_fraction_leaf': 0.0, 'max_leaf_nodes': 300, 'bootstrap': False, 'ccp_alpha': 0.015}. Best is trial 4065 with value: 0.057524275121161005.
[I 2025-04-16 02:12:49,627] Trial 4210 finished with value: -0.003825543813598009 and parameters: {'n_estimators': 167, 'min_samples_split': 2, 'max_features': 0.8300000000000001, 'min_samples_leaf': 1, 'criterion': 'absolute_error', 'max_depth': 15, 'min_weight_fraction_leaf': 0.0, 'max_leaf_nodes': 300, 'bootstrap': False, 'ccp_alpha': 0.006}. Best is trial 4065 with value: 0.057524275121161005.
[I 2025-04-16 02:12:50,179] Trial 4211 finished with value: -0.1936417107583833 and parameters: {'n_estimators': 1, 'min_samples_split': 12, 'max_features': 0.72, 'min_samples_leaf': 3, 'criterion': 'absolute_error', 'max_depth': 20, 'min_weight_fraction_leaf': 0.0, 'max_leaf_nodes': 300, 'bootstrap': False, 'ccp_alpha': 0.01}. Best is trial 4065 with value: 0.057524275121161005.
[I 2025-04-16 02:12:51,082] Trial 4212 finished with value: -17.528986382274873 and parameters: {'n_estimators': 385, 'min_samples_split': 9, 'max_features': 0.74, 'min_samples_leaf': 5, 'criterion': 'squared_error', 'max_depth': 15, 'min_weight_fraction_leaf': 0.0, 'max_leaf_nodes': 300, 'bootstrap': False, 'ccp_alpha': 0.005}. Best is trial 4065 with value: 0.057524275121161005.
[I 2025-04-16 02:12:52,352] Trial 4213 finished with value: -0.1936417107583833 and parameters: {'n_estimators': 820, 'min_samples_split': 6, 'max_features': 0.79, 'min_samples_leaf': 1, 'criterion': 'absolute_error', 'max_depth': 15, 'min_weight_fraction_leaf': 0.0, 'max_leaf_nodes': 300, 'bootstrap': False, 'ccp_alpha': 0.017}. Best is trial 4065 with value: 0.057524275121161005.
[I 2025-04-16 02:12:53,314] Trial 4214 finished with value: -11.72855017293963 and parameters: {'n_estimators': 558, 'min_samples_split': 2, 'max_features': 0.75, 'min_samples_leaf': 3, 'criterion': 'absolute_error', 'max_depth': 15, 'min_weight_fraction_leaf': 0.0, 'max_leaf_nodes': None, 'bootstrap': False, 'ccp_alpha': 0.0}. Best is trial 4065 with value: 0.057524275121161005.
[I 2025-04-16 02:12:54,153] Trial 4215 finished with value: -0.1936417107583833 and parameters: {'n_estimators': 313, 'min_samples_split': 6, 'max_features': 0.81, 'min_samples_leaf': 1, 'criterion': 'absolute_error', 'max_depth': 15, 'min_weight_fraction_leaf': 0.0, 'max_leaf_nodes': 300, 'bootstrap': False, 'ccp_alpha': 0.028}. Best is trial 4065 with value: 0.057524275121161005.
[I 2025-04-16 02:12:55,326] Trial 4216 finished with value: -0.1936417107583833 and parameters: {'n_estimators': 647, 'min_samples_split': 12, 'max_features': 0.72, 'min_samples_leaf': 5, 'criterion': 'absolute_error', 'max_depth': 15, 'min_weight_fraction_leaf': 0.0, 'max_leaf_nodes': 300, 'bootstrap': False, 'ccp_alpha': 0.009000000000000001}. Best is trial 4065 with value: 0.057524275121161005.
[I 2025-04-16 02:12:56,070] Trial 4217 finished with value: -0.1936417107583833 and parameters: {'n_estimators': 198, 'min_samples_split': 6, 'max_features': 0.7000000000000001, 'min_samples_leaf': 3, 'criterion': 'absolute_error', 'max_depth': 15, 'min_weight_fraction_leaf': 0.0, 'max_leaf_nodes': 300, 'bootstrap': False, 'ccp_alpha': 0.014}. Best is trial 4065 with value: 0.057524275121161005.
[I 2025-04-16 02:12:57,432] Trial 4218 finished with value: -13.051070140231001 and parameters: {'n_estimators': 986, 'min_samples_split': 2, 'max_features': 0.78, 'min_samples_leaf': 1, 'criterion': 'poisson', 'max_depth': 10, 'min_weight_fraction_leaf': 0.0, 'max_leaf_nodes': 300, 'bootstrap': False, 'ccp_alpha': 0.005}. Best is trial 4065 with value: 0.057524275121161005.
[I 2025-04-16 02:12:58,370] Trial 4219 finished with value: -0.1936417107583833 and parameters: {'n_estimators': 473, 'min_samples_split': 9, 'max_features': 0.8300000000000001, 'min_samples_leaf': 3, 'criterion': 'absolute_error', 'max_depth': 15, 'min_weight_fraction_leaf': 0.0, 'max_leaf_nodes': 300, 'bootstrap': False, 'ccp_alpha': 0.021}. Best is trial 4065 with value: 0.057524275121161005.
[I 2025-04-16 02:12:59,489] Trial 4220 finished with value: -9.950805380287813 and parameters: {'n_estimators': 749, 'min_samples_split': 6, 'max_features': 0.76, 'min_samples_leaf': 5, 'criterion': 'absolute_error', 'max_depth': 15, 'min_weight_fraction_leaf': 0.0, 'max_leaf_nodes': 300, 'bootstrap': False, 'ccp_alpha': 0.0}. Best is trial 4065 with value: 0.057524275121161005.
[I 2025-04-16 02:13:00,389] Trial 4221 finished with value: -0.1936417107583833 and parameters: {'n_estimators': 339, 'min_samples_split': 2, 'max_features': 0.73, 'min_samples_leaf': 1, 'criterion': 'absolute_error', 'max_depth': 15, 'min_weight_fraction_leaf': 0.0, 'max_leaf_nodes': 300, 'bootstrap': False, 'ccp_alpha': 0.01}. Best is trial 4065 with value: 0.057524275121161005.
[I 2025-04-16 02:13:01,496] Trial 4222 finished with value: -0.18650062920218075 and parameters: {'n_estimators': 527, 'min_samples_split': 12, 'max_features': 0.68, 'min_samples_leaf': 3, 'criterion': 'absolute_error', 'max_depth': 15, 'min_weight_fraction_leaf': 0.0, 'max_leaf_nodes': 300, 'bootstrap': False, 'ccp_alpha': 0.005}. Best is trial 4065 with value: 0.057524275121161005.
[I 2025-04-16 02:13:02,175] Trial 4223 finished with value: -0.1936417107583833 and parameters: {'n_estimators': 154, 'min_samples_split': 9, 'max_features': 0.81, 'min_samples_leaf': 79, 'criterion': 'absolute_error', 'max_depth': 15, 'min_weight_fraction_leaf': 0.0, 'max_leaf_nodes': 300, 'bootstrap': False, 'ccp_alpha': 0.014}. Best is trial 4065 with value: 0.057524275121161005.
[I 2025-04-16 02:13:03,472] Trial 4224 finished with value: -0.1936417107583833 and parameters: {'n_estimators': 850, 'min_samples_split': 5, 'max_features': 0.75, 'min_samples_leaf': 5, 'criterion': 'absolute_error', 'max_depth': 15, 'min_weight_fraction_leaf': 0.0, 'max_leaf_nodes': 300, 'bootstrap': False, 'ccp_alpha': 0.01}. Best is trial 4065 with value: 0.057524275121161005.
[I 2025-04-16 02:13:04,297] Trial 4225 finished with value: 0.05025509548456133 and parameters: {'n_estimators': 319, 'min_samples_split': 2, 'max_features': 0.7100000000000001, 'min_samples_leaf': 1, 'criterion': 'absolute_error', 'max_depth': 15, 'min_weight_fraction_leaf': 0.0, 'max_leaf_nodes': 50, 'bootstrap': False, 'ccp_alpha': 0.005}. Best is trial 4065 with value: 0.057524275121161005.
[I 2025-04-16 02:13:05,000] Trial 4226 finished with value: -0.1936417107583833 and parameters: {'n_estimators': 170, 'min_samples_split': 9, 'max_features': 0.6900000000000001, 'min_samples_leaf': 3, 'criterion': 'absolute_error', 'max_depth': 15, 'min_weight_fraction_leaf': 0.0, 'max_leaf_nodes': 50, 'bootstrap': False, 'ccp_alpha': 0.016}. Best is trial 4065 with value: 0.057524275121161005.
[I 2025-04-16 02:13:05,557] Trial 4227 finished with value: -4.797996614398628 and parameters: {'n_estimators': 6, 'min_samples_split': 6, 'max_features': 0.66, 'min_samples_leaf': 1, 'criterion': 'friedman_mse', 'max_depth': 15, 'min_weight_fraction_leaf': 0.0, 'max_leaf_nodes': 50, 'bootstrap': False, 'ccp_alpha': 0.0}. Best is trial 4065 with value: 0.057524275121161005.
[I 2025-04-16 02:13:06,289] Trial 4228 finished with value: -0.1936417107583833 and parameters: {'n_estimators': 218, 'min_samples_split': 2, 'max_features': 0.65, 'min_samples_leaf': 5, 'criterion': 'absolute_error', 'max_depth': 15, 'min_weight_fraction_leaf': 0.0, 'max_leaf_nodes': 50, 'bootstrap': False, 'ccp_alpha': 0.024}. Best is trial 4065 with value: 0.057524275121161005.
[I 2025-04-16 02:13:07,098] Trial 4229 finished with value: -0.1936417107583833 and parameters: {'n_estimators': 286, 'min_samples_split': 12, 'max_features': 0.63, 'min_samples_leaf': 3, 'criterion': 'absolute_error', 'max_depth': 15, 'min_weight_fraction_leaf': 0.0, 'max_leaf_nodes': 50, 'bootstrap': False, 'ccp_alpha': 0.01}. Best is trial 4065 with value: 0.057524275121161005.
[I 2025-04-16 02:13:07,826] Trial 4230 finished with value: -0.2780613689172184 and parameters: {'n_estimators': 181, 'min_samples_split': 6, 'max_features': 0.68, 'min_samples_leaf': 1, 'criterion': 'absolute_error', 'max_depth': 15, 'min_weight_fraction_leaf': 0.09, 'max_leaf_nodes': 50, 'bootstrap': False, 'ccp_alpha': 0.005}. Best is trial 4065 with value: 0.057524275121161005.
[I 2025-04-16 02:13:08,657] Trial 4231 finished with value: -0.1936417107583833 and parameters: {'n_estimators': 338, 'min_samples_split': 9, 'max_features': 0.68, 'min_samples_leaf': 3, 'criterion': 'absolute_error', 'max_depth': 15, 'min_weight_fraction_leaf': 0.07, 'max_leaf_nodes': 50, 'bootstrap': False, 'ccp_alpha': 0.015}. Best is trial 4065 with value: 0.057524275121161005.
[I 2025-04-16 02:13:09,350] Trial 4232 finished with value: -7.400610226685659 and parameters: {'n_estimators': 180, 'min_samples_split': 2, 'max_features': 0.66, 'min_samples_leaf': 5, 'criterion': 'absolute_error', 'max_depth': 15, 'min_weight_fraction_leaf': 0.0, 'max_leaf_nodes': 10, 'bootstrap': False, 'ccp_alpha': 0.0}. Best is trial 4065 with value: 0.057524275121161005.
[I 2025-04-16 02:13:10,296] Trial 4233 finished with value: -0.1936417107583833 and parameters: {'n_estimators': 404, 'min_samples_split': 6, 'max_features': 0.7000000000000001, 'min_samples_leaf': 1, 'criterion': 'absolute_error', 'max_depth': 15, 'min_weight_fraction_leaf': 0.0, 'max_leaf_nodes': 50, 'bootstrap': False, 'ccp_alpha': 0.009000000000000001}. Best is trial 4065 with value: 0.057524275121161005.
[I 2025-04-16 02:13:11,173] Trial 4234 finished with value: -0.1936417107583833 and parameters: {'n_estimators': 330, 'min_samples_split': 12, 'max_features': 0.7000000000000001, 'min_samples_leaf': 3, 'criterion': 'absolute_error', 'max_depth': 20, 'min_weight_fraction_leaf': 0.0, 'max_leaf_nodes': 50, 'bootstrap': False, 'ccp_alpha': 0.006}. Best is trial 4065 with value: 0.057524275121161005.
[I 2025-04-16 02:13:11,886] Trial 4235 finished with value: -0.1936417107583833 and parameters: {'n_estimators': 180, 'min_samples_split': 5, 'max_features': 0.68, 'min_samples_leaf': 5, 'criterion': 'absolute_error', 'max_depth': 15, 'min_weight_fraction_leaf': 0.0, 'max_leaf_nodes': 50, 'bootstrap': False, 'ccp_alpha': 0.019}. Best is trial 4065 with value: 0.057524275121161005.
[I 2025-04-16 02:13:12,871] Trial 4236 finished with value: -0.1936417107583833 and parameters: {'n_estimators': 426, 'min_samples_split': 2, 'max_features': 0.05, 'min_samples_leaf': 1, 'criterion': 'absolute_error', 'max_depth': 15, 'min_weight_fraction_leaf': 0.0, 'max_leaf_nodes': 50, 'bootstrap': False, 'ccp_alpha': 0.013000000000000001}. Best is trial 4065 with value: 0.057524275121161005.
