[I 2025-04-16 00:23:54,615] Trial 1435 finished with value: -0.15909459068849685 and parameters: {'n_estimators': 4883, 'min_samples_split': 15, 'max_features': 0.9500000000000001, 'min_samples_leaf': 13, 'criterion': 'absolute_error', 'max_depth': 60, 'min_weight_fraction_leaf': 0.01, 'max_leaf_nodes': 150, 'bootstrap': False, 'ccp_alpha': 0.0}. Best is trial 1435 with value: -0.15909459068849685.
[I 2025-04-16 00:23:57,803] Trial 1436 finished with value: -0.1589758825997823 and parameters: {'n_estimators': 4038, 'min_samples_split': 15, 'max_features': 0.9500000000000001, 'min_samples_leaf': 13, 'criterion': 'absolute_error', 'max_depth': 60, 'min_weight_fraction_leaf': 0.01, 'max_leaf_nodes': 150, 'bootstrap': False, 'ccp_alpha': 0.0}. Best is trial 1436 with value: -0.1589758825997823.
[I 2025-04-16 00:24:01,219] Trial 1437 finished with value: -0.1936417107583833 and parameters: {'n_estimators': 4065, 'min_samples_split': 8, 'max_features': 0.9600000000000001, 'min_samples_leaf': 14, 'criterion': 'absolute_error', 'max_depth': 60, 'min_weight_fraction_leaf': 0.01, 'max_leaf_nodes': 150, 'bootstrap': False, 'ccp_alpha': 0.001}. Best is trial 1436 with value: -0.1589758825997823.
[I 2025-04-16 00:24:04,758] Trial 1438 finished with value: -0.15901685987644695 and parameters: {'n_estimators': 4127, 'min_samples_split': 16, 'max_features': 0.9500000000000001, 'min_samples_leaf': 13, 'criterion': 'absolute_error', 'max_depth': 60, 'min_weight_fraction_leaf': 0.01, 'max_leaf_nodes': 150, 'bootstrap': False, 'ccp_alpha': 0.0}. Best is trial 1436 with value: -0.1589758825997823.
[I 2025-04-16 00:24:08,332] Trial 1439 finished with value: -0.15896829431478016 and parameters: {'n_estimators': 3994, 'min_samples_split': 16, 'max_features': 0.9500000000000001, 'min_samples_leaf': 13, 'criterion': 'absolute_error', 'max_depth': 60, 'min_weight_fraction_leaf': 0.01, 'max_leaf_nodes': 150, 'bootstrap': False, 'ccp_alpha': 0.0}. Best is trial 1439 with value: -0.15896829431478016.
[I 2025-04-16 00:24:11,604] Trial 1440 finished with value: -8.768901008056547 and parameters: {'n_estimators': 4019, 'min_samples_split': 16, 'max_features': 0.9500000000000001, 'min_samples_leaf': 12, 'criterion': 'absolute_error', 'max_depth': 60, 'min_weight_fraction_leaf': 0.01, 'max_leaf_nodes': 150, 'bootstrap': False, 'ccp_alpha': 0.0}. Best is trial 1439 with value: -0.15896829431478016.
[I 2025-04-16 00:24:14,863] Trial 1441 finished with value: -39.29948195391188 and parameters: {'n_estimators': 4130, 'min_samples_split': 14, 'max_features': 0.9500000000000001, 'min_samples_leaf': 14, 'criterion': 'friedman_mse', 'max_depth': 60, 'min_weight_fraction_leaf': 0.01, 'max_leaf_nodes': 150, 'bootstrap': False, 'ccp_alpha': 0.0}. Best is trial 1439 with value: -0.15896829431478016.
[I 2025-04-16 00:24:18,215] Trial 1442 finished with value: -0.15900320948169622 and parameters: {'n_estimators': 4060, 'min_samples_split': 16, 'max_features': 0.9500000000000001, 'min_samples_leaf': 13, 'criterion': 'absolute_error', 'max_depth': 60, 'min_weight_fraction_leaf': 0.01, 'max_leaf_nodes': 150, 'bootstrap': False, 'ccp_alpha': 0.0}. Best is trial 1439 with value: -0.15896829431478016.
[I 2025-04-16 00:24:21,826] Trial 1443 finished with value: -0.1936417107583833 and parameters: {'n_estimators': 4055, 'min_samples_split': 16, 'max_features': 0.9500000000000001, 'min_samples_leaf': 15, 'criterion': 'absolute_error', 'max_depth': 60, 'min_weight_fraction_leaf': 0.01, 'max_leaf_nodes': 150, 'bootstrap': False, 'ccp_alpha': 0.005}. Best is trial 1439 with value: -0.15896829431478016.
[I 2025-04-16 00:24:25,039] Trial 1444 finished with value: -0.15897166013995995 and parameters: {'n_estimators': 3986, 'min_samples_split': 11, 'max_features': 0.9500000000000001, 'min_samples_leaf': 13, 'criterion': 'absolute_error', 'max_depth': 60, 'min_weight_fraction_leaf': 0.01, 'max_leaf_nodes': 150, 'bootstrap': False, 'ccp_alpha': 0.0}. Best is trial 1439 with value: -0.15896829431478016.
[I 2025-04-16 00:24:28,369] Trial 1445 finished with value: -0.1589982734007617 and parameters: {'n_estimators': 3940, 'min_samples_split': 10, 'max_features': 0.9500000000000001, 'min_samples_leaf': 13, 'criterion': 'absolute_error', 'max_depth': 60, 'min_weight_fraction_leaf': 0.01, 'max_leaf_nodes': 150, 'bootstrap': False, 'ccp_alpha': 0.0}. Best is trial 1439 with value: -0.15896829431478016.
[I 2025-04-16 00:24:31,830] Trial 1446 finished with value: -0.19362127540793525 and parameters: {'n_estimators': 3921, 'min_samples_split': 16, 'max_features': 0.9500000000000001, 'min_samples_leaf': 14, 'criterion': 'absolute_error', 'max_depth': 60, 'min_weight_fraction_leaf': 0.01, 'max_leaf_nodes': 150, 'bootstrap': False, 'ccp_alpha': 0.0}. Best is trial 1439 with value: -0.15896829431478016.
[I 2025-04-16 00:24:35,110] Trial 1447 finished with value: -0.15900264031070388 and parameters: {'n_estimators': 3948, 'min_samples_split': 11, 'max_features': 0.9500000000000001, 'min_samples_leaf': 13, 'criterion': 'absolute_error', 'max_depth': 60, 'min_weight_fraction_leaf': 0.01, 'max_leaf_nodes': 150, 'bootstrap': False, 'ccp_alpha': 0.0}. Best is trial 1439 with value: -0.15896829431478016.
[I 2025-04-16 00:24:38,251] Trial 1448 finished with value: -0.15900902718701965 and parameters: {'n_estimators': 4022, 'min_samples_split': 11, 'max_features': 0.9500000000000001, 'min_samples_leaf': 13, 'criterion': 'absolute_error', 'max_depth': 60, 'min_weight_fraction_leaf': 0.01, 'max_leaf_nodes': 150, 'bootstrap': False, 'ccp_alpha': 0.0}. Best is trial 1439 with value: -0.15896829431478016.
[I 2025-04-16 00:24:41,615] Trial 1449 finished with value: -0.19362128494122527 and parameters: {'n_estimators': 3959, 'min_samples_split': 16, 'max_features': 0.9500000000000001, 'min_samples_leaf': 14, 'criterion': 'absolute_error', 'max_depth': 60, 'min_weight_fraction_leaf': 0.01, 'max_leaf_nodes': 150, 'bootstrap': False, 'ccp_alpha': 0.0}. Best is trial 1439 with value: -0.15896829431478016.
[I 2025-04-16 00:24:45,011] Trial 1450 finished with value: -17.52898638227427 and parameters: {'n_estimators': 3919, 'min_samples_split': 11, 'max_features': 0.9500000000000001, 'min_samples_leaf': 12, 'criterion': 'squared_error', 'max_depth': 60, 'min_weight_fraction_leaf': 0.01, 'max_leaf_nodes': 150, 'bootstrap': False, 'ccp_alpha': 0.005}. Best is trial 1439 with value: -0.15896829431478016.
[I 2025-04-16 00:24:48,057] Trial 1451 finished with value: -0.1936212797246159 and parameters: {'n_estimators': 4012, 'min_samples_split': 11, 'max_features': 0.9500000000000001, 'min_samples_leaf': 14, 'criterion': 'absolute_error', 'max_depth': 60, 'min_weight_fraction_leaf': 0.01, 'max_leaf_nodes': 150, 'bootstrap': False, 'ccp_alpha': 0.0}. Best is trial 1439 with value: -0.15896829431478016.
[I 2025-04-16 00:24:51,307] Trial 1452 finished with value: -0.15902640731432585 and parameters: {'n_estimators': 4088, 'min_samples_split': 16, 'max_features': 0.9500000000000001, 'min_samples_leaf': 13, 'criterion': 'absolute_error', 'max_depth': 60, 'min_weight_fraction_leaf': 0.01, 'max_leaf_nodes': 150, 'bootstrap': False, 'ccp_alpha': 0.0}. Best is trial 1439 with value: -0.15896829431478016.
[I 2025-04-16 00:24:54,790] Trial 1453 finished with value: -0.1936417107583833 and parameters: {'n_estimators': 3938, 'min_samples_split': 16, 'max_features': 0.9500000000000001, 'min_samples_leaf': 13, 'criterion': 'absolute_error', 'max_depth': 60, 'min_weight_fraction_leaf': 0.01, 'max_leaf_nodes': 150, 'bootstrap': False, 'ccp_alpha': 0.005}. Best is trial 1439 with value: -0.15896829431478016.
[I 2025-04-16 00:24:58,327] Trial 1454 finished with value: -0.19362129893073785 and parameters: {'n_estimators': 4105, 'min_samples_split': 16, 'max_features': 0.9500000000000001, 'min_samples_leaf': 14, 'criterion': 'absolute_error', 'max_depth': 60, 'min_weight_fraction_leaf': 0.01, 'max_leaf_nodes': 150, 'bootstrap': False, 'ccp_alpha': 0.0}. Best is trial 1439 with value: -0.15896829431478016.
[I 2025-04-16 00:25:01,609] Trial 1455 finished with value: -0.19362491578123545 and parameters: {'n_estimators': 3911, 'min_samples_split': 16, 'max_features': 0.9400000000000001, 'min_samples_leaf': 15, 'criterion': 'absolute_error', 'max_depth': 60, 'min_weight_fraction_leaf': 0.01, 'max_leaf_nodes': 150, 'bootstrap': False, 'ccp_alpha': 0.0}. Best is trial 1439 with value: -0.15896829431478016.
[I 2025-04-16 00:25:05,351] Trial 1456 finished with value: -0.1936417107583833 and parameters: {'n_estimators': 4128, 'min_samples_split': 12, 'max_features': 0.9500000000000001, 'min_samples_leaf': 13, 'criterion': 'absolute_error', 'max_depth': 60, 'min_weight_fraction_leaf': 0.01, 'max_leaf_nodes': 150, 'bootstrap': False, 'ccp_alpha': 0.006}. Best is trial 1439 with value: -0.15896829431478016.
[I 2025-04-16 00:25:09,000] Trial 1457 finished with value: -31.249309985706752 and parameters: {'n_estimators': 4250, 'min_samples_split': 12, 'max_features': 0.9500000000000001, 'min_samples_leaf': 13, 'criterion': 'poisson', 'max_depth': 60, 'min_weight_fraction_leaf': 0.01, 'max_leaf_nodes': 150, 'bootstrap': False, 'ccp_alpha': 0.006}. Best is trial 1439 with value: -0.15896829431478016.
[I 2025-04-16 00:25:12,094] Trial 1458 finished with value: -0.19362491652255534 and parameters: {'n_estimators': 3895, 'min_samples_split': 16, 'max_features': 0.9400000000000001, 'min_samples_leaf': 15, 'criterion': 'absolute_error', 'max_depth': 60, 'min_weight_fraction_leaf': 0.01, 'max_leaf_nodes': 150, 'bootstrap': False, 'ccp_alpha': 0.0}. Best is trial 1439 with value: -0.15896829431478016.
[I 2025-04-16 00:25:15,624] Trial 1459 finished with value: -0.1936417107583833 and parameters: {'n_estimators': 4166, 'min_samples_split': 10, 'max_features': 0.97, 'min_samples_leaf': 16, 'criterion': 'absolute_error', 'max_depth': 60, 'min_weight_fraction_leaf': 0.01, 'max_leaf_nodes': 150, 'bootstrap': False, 'ccp_alpha': 0.005}. Best is trial 1439 with value: -0.15896829431478016.
[I 2025-04-16 00:25:18,824] Trial 1460 finished with value: -0.1589878339488961 and parameters: {'n_estimators': 3925, 'min_samples_split': 16, 'max_features': 0.98, 'min_samples_leaf': 13, 'criterion': 'absolute_error', 'max_depth': 60, 'min_weight_fraction_leaf': 0.01, 'max_leaf_nodes': 150, 'bootstrap': False, 'ccp_alpha': 0.0}. Best is trial 1439 with value: -0.15896829431478016.
[I 2025-04-16 00:25:22,062] Trial 1461 finished with value: -0.1590083522713245 and parameters: {'n_estimators': 3883, 'min_samples_split': 16, 'max_features': 0.98, 'min_samples_leaf': 13, 'criterion': 'absolute_error', 'max_depth': 60, 'min_weight_fraction_leaf': 0.01, 'max_leaf_nodes': 150, 'bootstrap': False, 'ccp_alpha': 0.0}. Best is trial 1439 with value: -0.15896829431478016.
[I 2025-04-16 00:25:25,202] Trial 1462 finished with value: -0.1589896446183185 and parameters: {'n_estimators': 3918, 'min_samples_split': 17, 'max_features': 0.98, 'min_samples_leaf': 13, 'criterion': 'absolute_error', 'max_depth': 60, 'min_weight_fraction_leaf': 0.01, 'max_leaf_nodes': 150, 'bootstrap': False, 'ccp_alpha': 0.0}. Best is trial 1439 with value: -0.15896829431478016.
[I 2025-04-16 00:25:28,231] Trial 1463 finished with value: -0.19362491843760835 and parameters: {'n_estimators': 3979, 'min_samples_split': 17, 'max_features': 0.98, 'min_samples_leaf': 15, 'criterion': 'absolute_error', 'max_depth': 60, 'min_weight_fraction_leaf': 0.01, 'max_leaf_nodes': 150, 'bootstrap': False, 'ccp_alpha': 0.0}. Best is trial 1439 with value: -0.15896829431478016.
[I 2025-04-16 00:25:31,856] Trial 1464 finished with value: -0.1936417107583833 and parameters: {'n_estimators': 3885, 'min_samples_split': 16, 'max_features': 0.98, 'min_samples_leaf': 13, 'criterion': 'absolute_error', 'max_depth': 60, 'min_weight_fraction_leaf': 0.01, 'max_leaf_nodes': 150, 'bootstrap': False, 'ccp_alpha': 0.006}. Best is trial 1439 with value: -0.15896829431478016.
[I 2025-04-16 00:25:35,317] Trial 1465 finished with value: -0.1936417107583833 and parameters: {'n_estimators': 4047, 'min_samples_split': 17, 'max_features': 0.98, 'min_samples_leaf': 16, 'criterion': 'absolute_error', 'max_depth': 60, 'min_weight_fraction_leaf': 0.01, 'max_leaf_nodes': 150, 'bootstrap': False, 'ccp_alpha': 0.006}. Best is trial 1439 with value: -0.15896829431478016.
[I 2025-04-16 00:25:38,504] Trial 1466 finished with value: -35.927656480268276 and parameters: {'n_estimators': 3888, 'min_samples_split': 17, 'max_features': 0.9500000000000001, 'min_samples_leaf': 13, 'criterion': 'friedman_mse', 'max_depth': 60, 'min_weight_fraction_leaf': 0.01, 'max_leaf_nodes': 150, 'bootstrap': False, 'ccp_alpha': 0.0}. Best is trial 1439 with value: -0.15896829431478016.
[I 2025-04-16 00:25:41,704] Trial 1467 finished with value: -0.1590209353432414 and parameters: {'n_estimators': 4194, 'min_samples_split': 13, 'max_features': 0.97, 'min_samples_leaf': 13, 'criterion': 'absolute_error', 'max_depth': 60, 'min_weight_fraction_leaf': 0.01, 'max_leaf_nodes': 150, 'bootstrap': False, 'ccp_alpha': 0.0}. Best is trial 1439 with value: -0.15896829431478016.
[I 2025-04-16 00:25:45,006] Trial 1468 finished with value: -0.1936249500753286 and parameters: {'n_estimators': 4228, 'min_samples_split': 18, 'max_features': 0.9500000000000001, 'min_samples_leaf': 15, 'criterion': 'absolute_error', 'max_depth': 60, 'min_weight_fraction_leaf': 0.01, 'max_leaf_nodes': 150, 'bootstrap': False, 'ccp_alpha': 0.0}. Best is trial 1439 with value: -0.15896829431478016.
[I 2025-04-16 00:25:48,503] Trial 1469 finished with value: -0.1936417107583833 and parameters: {'n_estimators': 3858, 'min_samples_split': 13, 'max_features': 0.97, 'min_samples_leaf': 13, 'criterion': 'absolute_error', 'max_depth': 60, 'min_weight_fraction_leaf': 0.01, 'max_leaf_nodes': 150, 'bootstrap': False, 'ccp_alpha': 0.006}. Best is trial 1439 with value: -0.15896829431478016.
[I 2025-04-16 00:25:52,210] Trial 1470 finished with value: -0.1936417107583833 and parameters: {'n_estimators': 4283, 'min_samples_split': 14, 'max_features': 0.9400000000000001, 'min_samples_leaf': 13, 'criterion': 'absolute_error', 'max_depth': 60, 'min_weight_fraction_leaf': 0.01, 'max_leaf_nodes': 150, 'bootstrap': False, 'ccp_alpha': 0.006}. Best is trial 1439 with value: -0.15896829431478016.
[I 2025-04-16 00:25:55,503] Trial 1471 finished with value: -0.1936249349252981 and parameters: {'n_estimators': 4140, 'min_samples_split': 18, 'max_features': 0.97, 'min_samples_leaf': 15, 'criterion': 'absolute_error', 'max_depth': 60, 'min_weight_fraction_leaf': 0.01, 'max_leaf_nodes': 150, 'bootstrap': False, 'ccp_alpha': 0.0}. Best is trial 1439 with value: -0.15896829431478016.
[I 2025-04-16 00:25:59,366] Trial 1472 finished with value: -0.1936417107583833 and parameters: {'n_estimators': 4322, 'min_samples_split': 13, 'max_features': 0.9500000000000001, 'min_samples_leaf': 12, 'criterion': 'absolute_error', 'max_depth': 60, 'min_weight_fraction_leaf': 0.01, 'max_leaf_nodes': 150, 'bootstrap': False, 'ccp_alpha': 0.006}. Best is trial 1439 with value: -0.15896829431478016.
[I 2025-04-16 00:26:02,582] Trial 1473 finished with value: -8.783924445839135 and parameters: {'n_estimators': 3876, 'min_samples_split': 18, 'max_features': 0.97, 'min_samples_leaf': 12, 'criterion': 'absolute_error', 'max_depth': 60, 'min_weight_fraction_leaf': 0.01, 'max_leaf_nodes': 150, 'bootstrap': False, 'ccp_alpha': 0.0}. Best is trial 1439 with value: -0.15896829431478016.
[I 2025-04-16 00:26:06,206] Trial 1474 finished with value: -0.1936417107583833 and parameters: {'n_estimators': 4100, 'min_samples_split': 13, 'max_features': 0.9400000000000001, 'min_samples_leaf': 15, 'criterion': 'absolute_error', 'max_depth': 60, 'min_weight_fraction_leaf': 0.01, 'max_leaf_nodes': 150, 'bootstrap': False, 'ccp_alpha': 0.007}. Best is trial 1439 with value: -0.15896829431478016.
[I 2025-04-16 00:26:09,774] Trial 1475 finished with value: -17.528986382274404 and parameters: {'n_estimators': 3856, 'min_samples_split': 17, 'max_features': 0.97, 'min_samples_leaf': 16, 'criterion': 'squared_error', 'max_depth': 60, 'min_weight_fraction_leaf': 0.01, 'max_leaf_nodes': 150, 'bootstrap': False, 'ccp_alpha': 0.007}. Best is trial 1439 with value: -0.15896829431478016.
[I 2025-04-16 00:26:13,392] Trial 1476 finished with value: -8.79168052812538 and parameters: {'n_estimators': 4297, 'min_samples_split': 12, 'max_features': 0.9500000000000001, 'min_samples_leaf': 12, 'criterion': 'absolute_error', 'max_depth': 60, 'min_weight_fraction_leaf': 0.01, 'max_leaf_nodes': 150, 'bootstrap': False, 'ccp_alpha': 0.0}. Best is trial 1439 with value: -0.15896829431478016.
[I 2025-04-16 00:26:16,948] Trial 1477 finished with value: -0.1936417107583833 and parameters: {'n_estimators': 4041, 'min_samples_split': 14, 'max_features': 0.98, 'min_samples_leaf': 13, 'criterion': 'absolute_error', 'max_depth': 60, 'min_weight_fraction_leaf': 0.01, 'max_leaf_nodes': 150, 'bootstrap': False, 'ccp_alpha': 0.006}. Best is trial 1439 with value: -0.15896829431478016.
[I 2025-04-16 00:26:20,314] Trial 1478 finished with value: -0.19361573672943438 and parameters: {'n_estimators': 3858, 'min_samples_split': 18, 'max_features': 0.98, 'min_samples_leaf': 16, 'criterion': 'absolute_error', 'max_depth': 60, 'min_weight_fraction_leaf': 0.01, 'max_leaf_nodes': 150, 'bootstrap': False, 'ccp_alpha': 0.0}. Best is trial 1439 with value: -0.15896829431478016.
[I 2025-04-16 00:26:24,073] Trial 1479 finished with value: -0.1936417107583833 and parameters: {'n_estimators': 4096, 'min_samples_split': 11, 'max_features': 0.9400000000000001, 'min_samples_leaf': 11, 'criterion': 'absolute_error', 'max_depth': 60, 'min_weight_fraction_leaf': 0.01, 'max_leaf_nodes': 150, 'bootstrap': False, 'ccp_alpha': 0.008}. Best is trial 1439 with value: -0.15896829431478016.
[I 2025-04-16 00:26:27,784] Trial 1480 finished with value: -0.1936417107583833 and parameters: {'n_estimators': 4319, 'min_samples_split': 11, 'max_features': 0.9600000000000001, 'min_samples_leaf': 14, 'criterion': 'absolute_error', 'max_depth': 60, 'min_weight_fraction_leaf': 0.01, 'max_leaf_nodes': 150, 'bootstrap': False, 'ccp_alpha': 0.005}. Best is trial 1439 with value: -0.15896829431478016.
[I 2025-04-16 00:26:31,024] Trial 1481 finished with value: -32.36011826156377 and parameters: {'n_estimators': 4049, 'min_samples_split': 15, 'max_features': 0.98, 'min_samples_leaf': 11, 'criterion': 'poisson', 'max_depth': 60, 'min_weight_fraction_leaf': 0.01, 'max_leaf_nodes': 150, 'bootstrap': False, 'ccp_alpha': 0.0}. Best is trial 1439 with value: -0.15896829431478016.
[I 2025-04-16 00:26:34,433] Trial 1482 finished with value: -0.1936417107583833 and parameters: {'n_estimators': 3848, 'min_samples_split': 18, 'max_features': 0.9500000000000001, 'min_samples_leaf': 13, 'criterion': 'absolute_error', 'max_depth': 60, 'min_weight_fraction_leaf': 0.01, 'max_leaf_nodes': 150, 'bootstrap': False, 'ccp_alpha': 0.008}. Best is trial 1439 with value: -0.15896829431478016.
[I 2025-04-16 00:26:38,360] Trial 1483 finished with value: -0.1936417107583833 and parameters: {'n_estimators': 4383, 'min_samples_split': 10, 'max_features': 0.98, 'min_samples_leaf': 16, 'criterion': 'absolute_error', 'max_depth': 60, 'min_weight_fraction_leaf': 0.01, 'max_leaf_nodes': 150, 'bootstrap': False, 'ccp_alpha': 0.008}. Best is trial 1439 with value: -0.15896829431478016.
[I 2025-04-16 00:26:41,872] Trial 1484 finished with value: -8.767662481387458 and parameters: {'n_estimators': 4184, 'min_samples_split': 15, 'max_features': 0.9600000000000001, 'min_samples_leaf': 11, 'criterion': 'absolute_error', 'max_depth': 60, 'min_weight_fraction_leaf': 0.01, 'max_leaf_nodes': 150, 'bootstrap': False, 'ccp_alpha': 0.0}. Best is trial 1439 with value: -0.15896829431478016.
[I 2025-04-16 00:26:45,178] Trial 1485 finished with value: -0.1936417107583833 and parameters: {'n_estimators': 3915, 'min_samples_split': 10, 'max_features': 0.9400000000000001, 'min_samples_leaf': 14, 'criterion': 'absolute_error', 'max_depth': 60, 'min_weight_fraction_leaf': 0.01, 'max_leaf_nodes': 150, 'bootstrap': False, 'ccp_alpha': 0.009000000000000001}. Best is trial 1439 with value: -0.15896829431478016.
[I 2025-04-16 00:26:48,822] Trial 1486 finished with value: -0.1936417107583833 and parameters: {'n_estimators': 4272, 'min_samples_split': 19, 'max_features': 0.98, 'min_samples_leaf': 11, 'criterion': 'absolute_error', 'max_depth': 60, 'min_weight_fraction_leaf': 0.01, 'max_leaf_nodes': 150, 'bootstrap': False, 'ccp_alpha': 0.005}. Best is trial 1439 with value: -0.15896829431478016.
[I 2025-04-16 00:26:51,948] Trial 1487 finished with value: -0.15900121263839218 and parameters: {'n_estimators': 4066, 'min_samples_split': 13, 'max_features': 0.9400000000000001, 'min_samples_leaf': 13, 'criterion': 'absolute_error', 'max_depth': 60, 'min_weight_fraction_leaf': 0.01, 'max_leaf_nodes': 150, 'bootstrap': False, 'ccp_alpha': 0.0}. Best is trial 1439 with value: -0.15896829431478016.
[I 2025-04-16 00:26:55,635] Trial 1488 finished with value: -0.1936417107583833 and parameters: {'n_estimators': 4041, 'min_samples_split': 10, 'max_features': 0.9400000000000001, 'min_samples_leaf': 16, 'criterion': 'absolute_error', 'max_depth': 60, 'min_weight_fraction_leaf': 0.01, 'max_leaf_nodes': 150, 'bootstrap': False, 'ccp_alpha': 0.01}. Best is trial 1439 with value: -0.15896829431478016.
[I 2025-04-16 00:26:59,067] Trial 1489 finished with value: -0.15899384668148062 and parameters: {'n_estimators': 4150, 'min_samples_split': 15, 'max_features': 0.9400000000000001, 'min_samples_leaf': 13, 'criterion': 'absolute_error', 'max_depth': 60, 'min_weight_fraction_leaf': 0.01, 'max_leaf_nodes': 150, 'bootstrap': False, 'ccp_alpha': 0.0}. Best is trial 1439 with value: -0.15896829431478016.
