[I 2025-04-15 23:52:24,978] Trial 904 finished with value: -0.18298420654451247 and parameters: {'n_estimators': 2874, 'min_samples_split': 170, 'max_features': 0.91, 'min_samples_leaf': 21, 'criterion': 'absolute_error', 'max_depth': None, 'min_weight_fraction_leaf': 0.01, 'max_leaf_nodes': 150, 'bootstrap': True, 'ccp_alpha': 0.124, 'max_samples': 0.5}. Best is trial 621 with value: -0.18112741123578058.
[I 2025-04-15 23:52:28,600] Trial 905 finished with value: -0.18269534176391175 and parameters: {'n_estimators': 3064, 'min_samples_split': 141, 'max_features': 0.81, 'min_samples_leaf': 27, 'criterion': 'absolute_error', 'max_depth': 45, 'min_weight_fraction_leaf': 0.02, 'max_leaf_nodes': 50, 'bootstrap': True, 'ccp_alpha': 0.06, 'max_samples': 0.5}. Best is trial 621 with value: -0.18112741123578058.
[I 2025-04-15 23:52:32,339] Trial 906 finished with value: -0.1830097842607227 and parameters: {'n_estimators': 3386, 'min_samples_split': 30, 'max_features': 0.76, 'min_samples_leaf': 72, 'criterion': 'absolute_error', 'max_depth': 30, 'min_weight_fraction_leaf': 0.01, 'max_leaf_nodes': None, 'bootstrap': True, 'ccp_alpha': 0.088, 'max_samples': 0.5}. Best is trial 621 with value: -0.18112741123578058.
[I 2025-04-15 23:52:32,731] Trial 907 finished with value: -18.56579606106395 and parameters: {'n_estimators': 206, 'min_samples_split': 22, 'max_features': 0.87, 'min_samples_leaf': 40, 'criterion': 'poisson', 'max_depth': 5, 'min_weight_fraction_leaf': 0.03, 'max_leaf_nodes': 100, 'bootstrap': True, 'ccp_alpha': 0.068, 'max_samples': 0.5}. Best is trial 621 with value: -0.18112741123578058.
[I 2025-04-15 23:52:36,162] Trial 908 finished with value: -0.18283928356313348 and parameters: {'n_estimators': 2715, 'min_samples_split': 40, 'max_features': 0.78, 'min_samples_leaf': 32, 'criterion': 'absolute_error', 'max_depth': 30, 'min_weight_fraction_leaf': 0.07, 'max_leaf_nodes': 10, 'bootstrap': True, 'ccp_alpha': 0.159, 'max_samples': 0.5}. Best is trial 621 with value: -0.18112741123578058.
[I 2025-04-15 23:52:38,778] Trial 909 finished with value: -0.1936417107583833 and parameters: {'n_estimators': 3130, 'min_samples_split': 195, 'max_features': 0.8300000000000001, 'min_samples_leaf': 30, 'criterion': 'absolute_error', 'max_depth': 45, 'min_weight_fraction_leaf': 0.0, 'max_leaf_nodes': 100, 'bootstrap': False, 'ccp_alpha': 0.14300000000000002}. Best is trial 621 with value: -0.18112741123578058.
[I 2025-04-15 23:52:42,177] Trial 910 finished with value: -0.18296046739774213 and parameters: {'n_estimators': 2865, 'min_samples_split': 177, 'max_features': 0.89, 'min_samples_leaf': 18, 'criterion': 'absolute_error', 'max_depth': 15, 'min_weight_fraction_leaf': 0.02, 'max_leaf_nodes': 150, 'bootstrap': True, 'ccp_alpha': 0.105, 'max_samples': 0.5}. Best is trial 621 with value: -0.18112741123578058.
[I 2025-04-15 23:52:45,593] Trial 911 finished with value: -0.1827040420506641 and parameters: {'n_estimators': 3067, 'min_samples_split': 96, 'max_features': 0.85, 'min_samples_leaf': 25, 'criterion': 'absolute_error', 'max_depth': 30, 'min_weight_fraction_leaf': 0.02, 'max_leaf_nodes': 100, 'bootstrap': True, 'ccp_alpha': 0.093, 'max_samples': 0.5}. Best is trial 621 with value: -0.18112741123578058.
[I 2025-04-15 23:52:49,483] Trial 912 finished with value: -0.18298533020635208 and parameters: {'n_estimators': 3330, 'min_samples_split': 146, 'max_features': 0.17, 'min_samples_leaf': 28, 'criterion': 'absolute_error', 'max_depth': 45, 'min_weight_fraction_leaf': 0.01, 'max_leaf_nodes': 50, 'bootstrap': True, 'ccp_alpha': 0.05, 'max_samples': 0.5}. Best is trial 621 with value: -0.18112741123578058.
[I 2025-04-15 23:52:58,584] Trial 913 finished with value: -0.18423850038444808 and parameters: {'n_estimators': 7316, 'min_samples_split': 164, 'max_features': 0.32, 'min_samples_leaf': 34, 'criterion': 'absolute_error', 'max_depth': 30, 'min_weight_fraction_leaf': 0.02, 'max_leaf_nodes': 100, 'bootstrap': True, 'ccp_alpha': 0.077, 'max_samples': 0.5}. Best is trial 621 with value: -0.18112741123578058.
[I 2025-04-15 23:53:01,347] Trial 914 finished with value: -0.18299385651103406 and parameters: {'n_estimators': 2541, 'min_samples_split': 182, 'max_features': 0.8, 'min_samples_leaf': 36, 'criterion': 'absolute_error', 'max_depth': 15, 'min_weight_fraction_leaf': 0.0, 'max_leaf_nodes': 150, 'bootstrap': True, 'ccp_alpha': 0.063, 'max_samples': 0.5}. Best is trial 621 with value: -0.18112741123578058.
[I 2025-04-15 23:53:06,812] Trial 915 finished with value: -0.19339925088462379 and parameters: {'n_estimators': 4985, 'min_samples_split': 35, 'max_features': 0.87, 'min_samples_leaf': 23, 'criterion': 'absolute_error', 'max_depth': 20, 'min_weight_fraction_leaf': 0.01, 'max_leaf_nodes': 100, 'bootstrap': True, 'ccp_alpha': 0.056, 'max_samples': None}. Best is trial 621 with value: -0.18112741123578058.
[I 2025-04-15 23:53:07,033] Trial 916 finished with value: -0.19363726232224235 and parameters: {'n_estimators': 26, 'min_samples_split': 153, 'max_features': 0.2, 'min_samples_leaf': 65, 'criterion': 'absolute_error', 'max_depth': 45, 'min_weight_fraction_leaf': 0.02, 'max_leaf_nodes': 100, 'bootstrap': True, 'ccp_alpha': 0.1, 'max_samples': 0.5}. Best is trial 621 with value: -0.18112741123578058.
[I 2025-04-15 23:53:11,175] Trial 917 finished with value: -17.805089437994834 and parameters: {'n_estimators': 3618, 'min_samples_split': 27, 'max_features': 0.11, 'min_samples_leaf': 5, 'criterion': 'friedman_mse', 'max_depth': 30, 'min_weight_fraction_leaf': 0.03, 'max_leaf_nodes': 20, 'bootstrap': True, 'ccp_alpha': 0.042, 'max_samples': 0.5}. Best is trial 621 with value: -0.18112741123578058.
[I 2025-04-15 23:53:14,312] Trial 918 finished with value: -0.18277687794499037 and parameters: {'n_estimators': 2923, 'min_samples_split': 77, 'max_features': 0.26, 'min_samples_leaf': 26, 'criterion': 'absolute_error', 'max_depth': None, 'min_weight_fraction_leaf': 0.06, 'max_leaf_nodes': 10, 'bootstrap': True, 'ccp_alpha': 0.079, 'max_samples': 0.5}. Best is trial 621 with value: -0.18112741123578058.
[I 2025-04-15 23:53:17,830] Trial 919 finished with value: -0.19330240486239822 and parameters: {'n_estimators': 3158, 'min_samples_split': 53, 'max_features': 0.8200000000000001, 'min_samples_leaf': 30, 'criterion': 'absolute_error', 'max_depth': 30, 'min_weight_fraction_leaf': 0.02, 'max_leaf_nodes': 100, 'bootstrap': True, 'ccp_alpha': 0.07200000000000001, 'max_samples': 1.0}. Best is trial 621 with value: -0.18112741123578058.
[I 2025-04-15 23:53:18,022] Trial 920 finished with value: -0.1936378239788945 and parameters: {'n_estimators': 13, 'min_samples_split': 172, 'max_features': 0.91, 'min_samples_leaf': 32, 'criterion': 'absolute_error', 'max_depth': 60, 'min_weight_fraction_leaf': 0.01, 'max_leaf_nodes': 50, 'bootstrap': True, 'ccp_alpha': 0.116, 'max_samples': 0.5}. Best is trial 621 with value: -0.18112741123578058.
[I 2025-04-15 23:53:20,631] Trial 921 finished with value: -0.1838800671012491 and parameters: {'n_estimators': 2330, 'min_samples_split': 157, 'max_features': 0.060000000000000005, 'min_samples_leaf': 28, 'criterion': 'absolute_error', 'max_depth': 45, 'min_weight_fraction_leaf': 0.04, 'max_leaf_nodes': 150, 'bootstrap': True, 'ccp_alpha': 0.09, 'max_samples': 0.5}. Best is trial 621 with value: -0.18112741123578058.
[I 2025-04-15 23:53:21,164] Trial 922 finished with value: -0.19112184766316073 and parameters: {'n_estimators': 347, 'min_samples_split': 166, 'max_features': 0.85, 'min_samples_leaf': 24, 'criterion': 'absolute_error', 'max_depth': 5, 'min_weight_fraction_leaf': 0.02, 'max_leaf_nodes': None, 'bootstrap': True, 'ccp_alpha': 0.084, 'max_samples': 0.75}. Best is trial 621 with value: -0.18112741123578058.
[I 2025-04-15 23:53:24,146] Trial 923 finished with value: -0.18267378429332992 and parameters: {'n_estimators': 2732, 'min_samples_split': 31, 'max_features': 0.9500000000000001, 'min_samples_leaf': 38, 'criterion': 'absolute_error', 'max_depth': 15, 'min_weight_fraction_leaf': 0.01, 'max_leaf_nodes': 100, 'bootstrap': True, 'ccp_alpha': 0.107, 'max_samples': 0.5}. Best is trial 621 with value: -0.18112741123578058.
[I 2025-04-15 23:53:27,771] Trial 924 finished with value: -0.18311965747074838 and parameters: {'n_estimators': 3429, 'min_samples_split': 42, 'max_features': 0.9, 'min_samples_leaf': 27, 'criterion': 'absolute_error', 'max_depth': 30, 'min_weight_fraction_leaf': 0.0, 'max_leaf_nodes': 100, 'bootstrap': True, 'ccp_alpha': 0.065, 'max_samples': 0.5}. Best is trial 621 with value: -0.18112741123578058.
[I 2025-04-15 23:53:30,759] Trial 925 finished with value: -18.171210030667616 and parameters: {'n_estimators': 2953, 'min_samples_split': 20, 'max_features': 0.73, 'min_samples_leaf': 31, 'criterion': 'squared_error', 'max_depth': 45, 'min_weight_fraction_leaf': 0.02, 'max_leaf_nodes': 150, 'bootstrap': True, 'ccp_alpha': 0.054, 'max_samples': 0.5}. Best is trial 621 with value: -0.18112741123578058.
[I 2025-04-15 23:53:34,520] Trial 926 finished with value: -0.18277899877248222 and parameters: {'n_estimators': 3207, 'min_samples_split': 188, 'max_features': 0.43, 'min_samples_leaf': 20, 'criterion': 'absolute_error', 'max_depth': 30, 'min_weight_fraction_leaf': 0.02, 'max_leaf_nodes': 100, 'bootstrap': True, 'ccp_alpha': 0.098, 'max_samples': 0.5}. Best is trial 621 with value: -0.18112741123578058.
[I 2025-04-15 23:53:35,278] Trial 927 finished with value: -0.18700511869938535 and parameters: {'n_estimators': 556, 'min_samples_split': 38, 'max_features': 0.4, 'min_samples_leaf': 34, 'criterion': 'absolute_error', 'max_depth': 30, 'min_weight_fraction_leaf': 0.0, 'max_leaf_nodes': 50, 'bootstrap': True, 'ccp_alpha': 0.188, 'max_samples': 0.5}. Best is trial 621 with value: -0.18112741123578058.
[I 2025-04-15 23:53:39,169] Trial 928 finished with value: -0.1936417107583833 and parameters: {'n_estimators': 3801, 'min_samples_split': 162, 'max_features': 0.36000000000000004, 'min_samples_leaf': 30, 'criterion': 'absolute_error', 'max_depth': 15, 'min_weight_fraction_leaf': 0.01, 'max_leaf_nodes': 100, 'bootstrap': False, 'ccp_alpha': 0.07200000000000001}. Best is trial 621 with value: -0.18112741123578058.
[I 2025-04-15 23:53:39,567] Trial 929 finished with value: -0.1858983767969386 and parameters: {'n_estimators': 204, 'min_samples_split': 177, 'max_features': 0.55, 'min_samples_leaf': 22, 'criterion': 'absolute_error', 'max_depth': 45, 'min_weight_fraction_leaf': 0.01, 'max_leaf_nodes': 10, 'bootstrap': True, 'ccp_alpha': 0.059000000000000004, 'max_samples': 0.5}. Best is trial 621 with value: -0.18112741123578058.
[I 2025-04-15 23:53:42,945] Trial 930 finished with value: -0.18261263034319172 and parameters: {'n_estimators': 3000, 'min_samples_split': 8, 'max_features': 0.78, 'min_samples_leaf': 55, 'criterion': 'absolute_error', 'max_depth': 30, 'min_weight_fraction_leaf': 0.03, 'max_leaf_nodes': 100, 'bootstrap': True, 'ccp_alpha': 0.047, 'max_samples': 0.5}. Best is trial 621 with value: -0.18112741123578058.
[I 2025-04-15 23:53:45,695] Trial 931 finished with value: -18.171037338498053 and parameters: {'n_estimators': 2734, 'min_samples_split': 170, 'max_features': 0.87, 'min_samples_leaf': 26, 'criterion': 'poisson', 'max_depth': 20, 'min_weight_fraction_leaf': 0.05, 'max_leaf_nodes': 150, 'bootstrap': True, 'ccp_alpha': 0.111, 'max_samples': 0.5}. Best is trial 621 with value: -0.18112741123578058.
[I 2025-04-15 23:53:49,328] Trial 932 finished with value: -0.1829410691870546 and parameters: {'n_estimators': 3312, 'min_samples_split': 181, 'max_features': 0.29000000000000004, 'min_samples_leaf': 29, 'criterion': 'absolute_error', 'max_depth': 10, 'min_weight_fraction_leaf': 0.05, 'max_leaf_nodes': 100, 'bootstrap': True, 'ccp_alpha': 0.093, 'max_samples': 0.5}. Best is trial 621 with value: -0.18112741123578058.
[I 2025-04-15 23:53:52,589] Trial 933 finished with value: -0.18276173125836856 and parameters: {'n_estimators': 2918, 'min_samples_split': 26, 'max_features': 0.93, 'min_samples_leaf': 33, 'criterion': 'absolute_error', 'max_depth': 45, 'min_weight_fraction_leaf': 0.02, 'max_leaf_nodes': 300, 'bootstrap': True, 'ccp_alpha': 0.083, 'max_samples': 0.5}. Best is trial 621 with value: -0.18112741123578058.
[I 2025-04-15 23:53:56,103] Trial 934 finished with value: -0.18278800934900769 and parameters: {'n_estimators': 3223, 'min_samples_split': 173, 'max_features': 0.8400000000000001, 'min_samples_leaf': 24, 'criterion': 'absolute_error', 'max_depth': 30, 'min_weight_fraction_leaf': 0.02, 'max_leaf_nodes': 100, 'bootstrap': True, 'ccp_alpha': 0.10400000000000001, 'max_samples': 0.5}. Best is trial 621 with value: -0.18112741123578058.
[I 2025-04-15 23:54:00,921] Trial 935 finished with value: -0.18337345597878457 and parameters: {'n_estimators': 4425, 'min_samples_split': 155, 'max_features': 0.81, 'min_samples_leaf': 27, 'criterion': 'absolute_error', 'max_depth': 60, 'min_weight_fraction_leaf': 0.01, 'max_leaf_nodes': None, 'bootstrap': True, 'ccp_alpha': 0.064, 'max_samples': 0.5}. Best is trial 621 with value: -0.18112741123578058.
[I 2025-04-15 23:54:05,253] Trial 936 finished with value: -0.18330583589161967 and parameters: {'n_estimators': 3535, 'min_samples_split': 167, 'max_features': 0.88, 'min_samples_leaf': 12, 'criterion': 'absolute_error', 'max_depth': None, 'min_weight_fraction_leaf': 0.0, 'max_leaf_nodes': 50, 'bootstrap': True, 'ccp_alpha': 0.079, 'max_samples': 0.5}. Best is trial 621 with value: -0.18112741123578058.
[I 2025-04-15 23:54:08,332] Trial 937 finished with value: -0.18285901905422794 and parameters: {'n_estimators': 2683, 'min_samples_split': 14, 'max_features': 0.23, 'min_samples_leaf': 36, 'criterion': 'absolute_error', 'max_depth': 15, 'min_weight_fraction_leaf': 0.01, 'max_leaf_nodes': 150, 'bootstrap': True, 'ccp_alpha': 0.08700000000000001, 'max_samples': 0.5}. Best is trial 621 with value: -0.18112741123578058.
[I 2025-04-15 23:54:12,037] Trial 938 finished with value: -0.19328834449086404 and parameters: {'n_estimators': 3031, 'min_samples_split': 45, 'max_features': 0.76, 'min_samples_leaf': 68, 'criterion': 'absolute_error', 'max_depth': 5, 'min_weight_fraction_leaf': 0.02, 'max_leaf_nodes': 100, 'bootstrap': True, 'ccp_alpha': 0.07, 'max_samples': None}. Best is trial 621 with value: -0.18112741123578058.
[I 2025-04-15 23:54:14,770] Trial 939 finished with value: -0.18315857090237636 and parameters: {'n_estimators': 2490, 'min_samples_split': 160, 'max_features': 0.85, 'min_samples_leaf': 28, 'criterion': 'absolute_error', 'max_depth': 45, 'min_weight_fraction_leaf': 0.02, 'max_leaf_nodes': 10, 'bootstrap': True, 'ccp_alpha': 0.095, 'max_samples': 0.5}. Best is trial 621 with value: -0.18112741123578058.
[I 2025-04-15 23:54:15,312] Trial 940 finished with value: -19.147189158237985 and parameters: {'n_estimators': 342, 'min_samples_split': 149, 'max_features': 0.8200000000000001, 'min_samples_leaf': 16, 'criterion': 'friedman_mse', 'max_depth': 30, 'min_weight_fraction_leaf': 0.02, 'max_leaf_nodes': 100, 'bootstrap': True, 'ccp_alpha': 0.056, 'max_samples': 0.5}. Best is trial 621 with value: -0.18112741123578058.
[I 2025-04-15 23:54:16,332] Trial 941 finished with value: -0.18662684929760123 and parameters: {'n_estimators': 812, 'min_samples_split': 185, 'max_features': 0.89, 'min_samples_leaf': 32, 'criterion': 'absolute_error', 'max_depth': 30, 'min_weight_fraction_leaf': 0.03, 'max_leaf_nodes': 100, 'bootstrap': True, 'ccp_alpha': 0.075, 'max_samples': 0.5}. Best is trial 621 with value: -0.18112741123578058.
[I 2025-04-15 23:54:20,150] Trial 942 finished with value: -0.18294749030326912 and parameters: {'n_estimators': 3362, 'min_samples_split': 38, 'max_features': 0.97, 'min_samples_leaf': 76, 'criterion': 'absolute_error', 'max_depth': 45, 'min_weight_fraction_leaf': 0.01, 'max_leaf_nodes': 150, 'bootstrap': True, 'ccp_alpha': 0.101, 'max_samples': 0.5}. Best is trial 621 with value: -0.18112741123578058.
[I 2025-04-15 23:54:24,913] Trial 943 finished with value: -0.1831221049923931 and parameters: {'n_estimators': 4013, 'min_samples_split': 32, 'max_features': 0.79, 'min_samples_leaf': 25, 'criterion': 'absolute_error', 'max_depth': 15, 'min_weight_fraction_leaf': 0.0, 'max_leaf_nodes': 100, 'bootstrap': True, 'ccp_alpha': 0.11800000000000001, 'max_samples': 0.5}. Best is trial 621 with value: -0.18112741123578058.
[I 2025-04-15 23:54:25,111] Trial 944 finished with value: -0.19364068201949847 and parameters: {'n_estimators': 14, 'min_samples_split': 179, 'max_features': 0.92, 'min_samples_leaf': 29, 'criterion': 'absolute_error', 'max_depth': 30, 'min_weight_fraction_leaf': 0.02, 'max_leaf_nodes': 50, 'bootstrap': True, 'ccp_alpha': 0.132, 'max_samples': 1.0}. Best is trial 621 with value: -0.18112741123578058.
[I 2025-04-15 23:54:28,710] Trial 945 finished with value: -0.18259513476335987 and parameters: {'n_estimators': 3117, 'min_samples_split': 23, 'max_features': 0.8300000000000001, 'min_samples_leaf': 22, 'criterion': 'absolute_error', 'max_depth': 45, 'min_weight_fraction_leaf': 0.01, 'max_leaf_nodes': 100, 'bootstrap': True, 'ccp_alpha': 0.064, 'max_samples': 0.5}. Best is trial 621 with value: -0.18112741123578058.
[I 2025-04-15 23:54:31,108] Trial 946 finished with value: -0.1936417107583833 and parameters: {'n_estimators': 2865, 'min_samples_split': 42, 'max_features': 0.86, 'min_samples_leaf': 41, 'criterion': 'absolute_error', 'max_depth': 30, 'min_weight_fraction_leaf': 0.06, 'max_leaf_nodes': 150, 'bootstrap': False, 'ccp_alpha': 0.05}. Best is trial 621 with value: -0.18112741123578058.
[I 2025-04-15 23:54:35,082] Trial 947 finished with value: -0.18270789658166167 and parameters: {'n_estimators': 3179, 'min_samples_split': 132, 'max_features': 0.6900000000000001, 'min_samples_leaf': 31, 'criterion': 'absolute_error', 'max_depth': 20, 'min_weight_fraction_leaf': 0.02, 'max_leaf_nodes': 20, 'bootstrap': True, 'ccp_alpha': 0.091, 'max_samples': 0.5}. Best is trial 621 with value: -0.18112741123578058.
[I 2025-04-15 23:54:42,973] Trial 948 finished with value: -0.18399462663733873 and parameters: {'n_estimators': 6611, 'min_samples_split': 49, 'max_features': 0.9, 'min_samples_leaf': 26, 'criterion': 'absolute_error', 'max_depth': 15, 'min_weight_fraction_leaf': 0.01, 'max_leaf_nodes': 100, 'bootstrap': True, 'ccp_alpha': 0.11, 'max_samples': 0.5}. Best is trial 621 with value: -0.18112741123578058.
[I 2025-04-15 23:54:43,336] Trial 949 finished with value: -0.18900496581850984 and parameters: {'n_estimators': 176, 'min_samples_split': 175, 'max_features': 0.81, 'min_samples_leaf': 51, 'criterion': 'absolute_error', 'max_depth': 45, 'min_weight_fraction_leaf': 0.02, 'max_leaf_nodes': 10, 'bootstrap': True, 'ccp_alpha': 0.059000000000000004, 'max_samples': 0.75}. Best is trial 621 with value: -0.18112741123578058.
[I 2025-04-15 23:54:46,304] Trial 950 finished with value: -18.189892631303046 and parameters: {'n_estimators': 2617, 'min_samples_split': 19, 'max_features': 0.14, 'min_samples_leaf': 34, 'criterion': 'squared_error', 'max_depth': 30, 'min_weight_fraction_leaf': 0.0, 'max_leaf_nodes': 100, 'bootstrap': True, 'ccp_alpha': 0.17400000000000002, 'max_samples': 0.5}. Best is trial 621 with value: -0.18112741123578058.
[I 2025-04-15 23:54:50,281] Trial 951 finished with value: -0.18298420654451247 and parameters: {'n_estimators': 2874, 'min_samples_split': 27, 'max_features': 0.87, 'min_samples_leaf': 29, 'criterion': 'absolute_error', 'max_depth': None, 'min_weight_fraction_leaf': 0.01, 'max_leaf_nodes': 50, 'bootstrap': True, 'ccp_alpha': 0.081, 'max_samples': 0.5}. Best is trial 621 with value: -0.18112741123578058.
[I 2025-04-15 23:54:54,042] Trial 952 finished with value: -0.18336845235314972 and parameters: {'n_estimators': 3561, 'min_samples_split': 167, 'max_features': 0.8400000000000001, 'min_samples_leaf': 24, 'criterion': 'absolute_error', 'max_depth': 60, 'min_weight_fraction_leaf': 0.02, 'max_leaf_nodes': None, 'bootstrap': True, 'ccp_alpha': 0.097, 'max_samples': 0.5}. Best is trial 621 with value: -0.18112741123578058.
[I 2025-04-15 23:54:54,743] Trial 953 finished with value: -0.187436137173511 and parameters: {'n_estimators': 500, 'min_samples_split': 33, 'max_features': 0.31, 'min_samples_leaf': 19, 'criterion': 'absolute_error', 'max_depth': 5, 'min_weight_fraction_leaf': 0.01, 'max_leaf_nodes': 100, 'bootstrap': True, 'ccp_alpha': 0.07, 'max_samples': 0.5}. Best is trial 621 with value: -0.18112741123578058.
[I 2025-04-15 23:55:02,626] Trial 954 finished with value: -0.18383631353925106 and parameters: {'n_estimators': 6105, 'min_samples_split': 158, 'max_features': 0.86, 'min_samples_leaf': 63, 'criterion': 'absolute_error', 'max_depth': 30, 'min_weight_fraction_leaf': 0.03, 'max_leaf_nodes': 150, 'bootstrap': True, 'ccp_alpha': 0.08700000000000001, 'max_samples': 0.5}. Best is trial 621 with value: -0.18112741123578058.
[I 2025-04-15 23:55:06,041] Trial 955 finished with value: -17.876775946533154 and parameters: {'n_estimators': 3361, 'min_samples_split': 172, 'max_features': 0.79, 'min_samples_leaf': 27, 'criterion': 'poisson', 'max_depth': 45, 'min_weight_fraction_leaf': 0.0, 'max_leaf_nodes': 100, 'bootstrap': True, 'ccp_alpha': 0.043000000000000003, 'max_samples': 0.5}. Best is trial 621 with value: -0.18112741123578058.
[I 2025-04-15 23:55:09,315] Trial 956 finished with value: -0.18256914946014385 and parameters: {'n_estimators': 3021, 'min_samples_split': 183, 'max_features': 0.75, 'min_samples_leaf': 31, 'criterion': 'absolute_error', 'max_depth': 15, 'min_weight_fraction_leaf': 0.02, 'max_leaf_nodes': 100, 'bootstrap': True, 'ccp_alpha': 0.10300000000000001, 'max_samples': 0.5}. Best is trial 621 with value: -0.18112741123578058.
