[I 2025-04-16 01:41:52,241] Trial 2776 finished with value: -7.468181570775845 and parameters: {'n_estimators': 2845, 'min_samples_split': 12, 'max_features': 0.8400000000000001, 'min_samples_leaf': 7, 'criterion': 'absolute_error', 'max_depth': 5, 'min_weight_fraction_leaf': 0.0, 'max_leaf_nodes': 20, 'bootstrap': False, 'ccp_alpha': 0.0}. Best is trial 2774 with value: 0.046571421912873.
[I 2025-04-16 01:41:55,089] Trial 2777 finished with value: -0.1936417107583833 and parameters: {'n_estimators': 2944, 'min_samples_split': 8, 'max_features': 0.86, 'min_samples_leaf': 1, 'criterion': 'absolute_error', 'max_depth': 5, 'min_weight_fraction_leaf': 0.0, 'max_leaf_nodes': 20, 'bootstrap': False, 'ccp_alpha': 0.014}. Best is trial 2774 with value: 0.046571421912873.
[I 2025-04-16 01:41:57,537] Trial 2778 finished with value: -10.134855742180518 and parameters: {'n_estimators': 2996, 'min_samples_split': 12, 'max_features': 0.8300000000000001, 'min_samples_leaf': 3, 'criterion': 'absolute_error', 'max_depth': 5, 'min_weight_fraction_leaf': 0.0, 'max_leaf_nodes': 20, 'bootstrap': False, 'ccp_alpha': 0.0}. Best is trial 2774 with value: 0.046571421912873.
[I 2025-04-16 01:41:59,959] Trial 2779 finished with value: -17.52898638227699 and parameters: {'n_estimators': 2753, 'min_samples_split': 6, 'max_features': 0.85, 'min_samples_leaf': 5, 'criterion': 'friedman_mse', 'max_depth': 5, 'min_weight_fraction_leaf': 0.0, 'max_leaf_nodes': 20, 'bootstrap': False, 'ccp_alpha': 0.01}. Best is trial 2774 with value: 0.046571421912873.
[I 2025-04-16 01:42:02,957] Trial 2780 finished with value: -0.1936417107583833 and parameters: {'n_estimators': 2922, 'min_samples_split': 12, 'max_features': 0.85, 'min_samples_leaf': 1, 'criterion': 'absolute_error', 'max_depth': 5, 'min_weight_fraction_leaf': 0.0, 'max_leaf_nodes': 20, 'bootstrap': False, 'ccp_alpha': 0.018000000000000002}. Best is trial 2774 with value: 0.046571421912873.
[I 2025-04-16 01:42:05,866] Trial 2781 finished with value: -0.07790576356355386 and parameters: {'n_estimators': 3007, 'min_samples_split': 5, 'max_features': 0.8400000000000001, 'min_samples_leaf': 7, 'criterion': 'absolute_error', 'max_depth': 5, 'min_weight_fraction_leaf': 0.0, 'max_leaf_nodes': 20, 'bootstrap': False, 'ccp_alpha': 0.005}. Best is trial 2774 with value: 0.046571421912873.
[I 2025-04-16 01:42:08,695] Trial 2782 finished with value: -0.1936417107583833 and parameters: {'n_estimators': 3079, 'min_samples_split': 84, 'max_features': 0.85, 'min_samples_leaf': 3, 'criterion': 'absolute_error', 'max_depth': 5, 'min_weight_fraction_leaf': 0.0, 'max_leaf_nodes': 20, 'bootstrap': False, 'ccp_alpha': 0.034}. Best is trial 2774 with value: 0.046571421912873.
[I 2025-04-16 01:42:11,568] Trial 2783 finished with value: -0.1936417107583833 and parameters: {'n_estimators': 3076, 'min_samples_split': 6, 'max_features': 0.8300000000000001, 'min_samples_leaf': 5, 'criterion': 'absolute_error', 'max_depth': 5, 'min_weight_fraction_leaf': 0.0, 'max_leaf_nodes': 20, 'bootstrap': False, 'ccp_alpha': 0.01}. Best is trial 2774 with value: 0.046571421912873.
[I 2025-04-16 01:42:13,988] Trial 2784 finished with value: -0.1936417107583833 and parameters: {'n_estimators': 2797, 'min_samples_split': 74, 'max_features': 0.8300000000000001, 'min_samples_leaf': 3, 'criterion': 'absolute_error', 'max_depth': 5, 'min_weight_fraction_leaf': 0.0, 'max_leaf_nodes': 20, 'bootstrap': False, 'ccp_alpha': 0.0}. Best is trial 2774 with value: 0.046571421912873.
[I 2025-04-16 01:42:17,241] Trial 2785 finished with value: -0.1936417107583833 and parameters: {'n_estimators': 3086, 'min_samples_split': 8, 'max_features': 0.86, 'min_samples_leaf': 1, 'criterion': 'absolute_error', 'max_depth': 5, 'min_weight_fraction_leaf': 0.0, 'max_leaf_nodes': 20, 'bootstrap': False, 'ccp_alpha': 0.017}. Best is trial 2774 with value: 0.046571421912873.
[I 2025-04-16 01:42:20,313] Trial 2786 finished with value: -17.52898638227627 and parameters: {'n_estimators': 3153, 'min_samples_split': 12, 'max_features': 0.86, 'min_samples_leaf': 7, 'criterion': 'squared_error', 'max_depth': 5, 'min_weight_fraction_leaf': 0.0, 'max_leaf_nodes': 20, 'bootstrap': False, 'ccp_alpha': 0.005}. Best is trial 2774 with value: 0.046571421912873.
[I 2025-04-16 01:42:23,556] Trial 2787 finished with value: -0.1936417107583833 and parameters: {'n_estimators': 2931, 'min_samples_split': 5, 'max_features': 0.8300000000000001, 'min_samples_leaf': 5, 'criterion': 'absolute_error', 'max_depth': 5, 'min_weight_fraction_leaf': 0.0, 'max_leaf_nodes': 20, 'bootstrap': False, 'ccp_alpha': 0.024}. Best is trial 2774 with value: 0.046571421912873.
[I 2025-04-16 01:42:26,748] Trial 2788 finished with value: -0.1936417107583833 and parameters: {'n_estimators': 3098, 'min_samples_split': 2, 'max_features': 0.87, 'min_samples_leaf': 3, 'criterion': 'absolute_error', 'max_depth': 5, 'min_weight_fraction_leaf': 0.0, 'max_leaf_nodes': 20, 'bootstrap': False, 'ccp_alpha': 0.01}. Best is trial 2774 with value: 0.046571421912873.
[I 2025-04-16 01:42:29,346] Trial 2789 finished with value: -0.09254285912334956 and parameters: {'n_estimators': 2728, 'min_samples_split': 9, 'max_features': 0.8400000000000001, 'min_samples_leaf': 1, 'criterion': 'absolute_error', 'max_depth': 5, 'min_weight_fraction_leaf': 0.0, 'max_leaf_nodes': 20, 'bootstrap': False, 'ccp_alpha': 0.005}. Best is trial 2774 with value: 0.046571421912873.
[I 2025-04-16 01:42:32,047] Trial 2790 finished with value: -0.1936417107583833 and parameters: {'n_estimators': 3132, 'min_samples_split': 8, 'max_features': 0.86, 'min_samples_leaf': 5, 'criterion': 'absolute_error', 'max_depth': 5, 'min_weight_fraction_leaf': 0.0, 'max_leaf_nodes': 20, 'bootstrap': False, 'ccp_alpha': 0.015}. Best is trial 2774 with value: 0.046571421912873.
[I 2025-04-16 01:42:34,721] Trial 2791 finished with value: -0.1936417107583833 and parameters: {'n_estimators': 2934, 'min_samples_split': 2, 'max_features': 0.88, 'min_samples_leaf': 7, 'criterion': 'absolute_error', 'max_depth': 5, 'min_weight_fraction_leaf': 0.0, 'max_leaf_nodes': 20, 'bootstrap': False, 'ccp_alpha': 0.01}. Best is trial 2774 with value: 0.046571421912873.
[I 2025-04-16 01:42:37,543] Trial 2792 finished with value: -20.931996566179286 and parameters: {'n_estimators': 3125, 'min_samples_split': 12, 'max_features': 0.86, 'min_samples_leaf': 3, 'criterion': 'poisson', 'max_depth': 5, 'min_weight_fraction_leaf': 0.0, 'max_leaf_nodes': 20, 'bootstrap': False, 'ccp_alpha': 0.0}. Best is trial 2774 with value: 0.046571421912873.
[I 2025-04-16 01:42:40,420] Trial 2793 finished with value: -0.1936417107583833 and parameters: {'n_estimators': 3229, 'min_samples_split': 5, 'max_features': 0.88, 'min_samples_leaf': 4, 'criterion': 'absolute_error', 'max_depth': 5, 'min_weight_fraction_leaf': 0.0, 'max_leaf_nodes': 20, 'bootstrap': False, 'ccp_alpha': 0.22}. Best is trial 2774 with value: 0.046571421912873.
[I 2025-04-16 01:42:43,229] Trial 2794 finished with value: -0.1936417107583833 and parameters: {'n_estimators': 3116, 'min_samples_split': 8, 'max_features': 0.8400000000000001, 'min_samples_leaf': 1, 'criterion': 'absolute_error', 'max_depth': 5, 'min_weight_fraction_leaf': 0.0, 'max_leaf_nodes': 20, 'bootstrap': False, 'ccp_alpha': 0.015}. Best is trial 2774 with value: 0.046571421912873.
[I 2025-04-16 01:42:45,718] Trial 2795 finished with value: -0.0885984696352391 and parameters: {'n_estimators': 2676, 'min_samples_split': 12, 'max_features': 0.87, 'min_samples_leaf': 7, 'criterion': 'absolute_error', 'max_depth': 5, 'min_weight_fraction_leaf': 0.0, 'max_leaf_nodes': 20, 'bootstrap': False, 'ccp_alpha': 0.004}. Best is trial 2774 with value: 0.046571421912873.
[I 2025-04-16 01:42:48,931] Trial 2796 finished with value: -0.1936417107583833 and parameters: {'n_estimators': 3170, 'min_samples_split': 99, 'max_features': 0.88, 'min_samples_leaf': 3, 'criterion': 'absolute_error', 'max_depth': 5, 'min_weight_fraction_leaf': 0.0, 'max_leaf_nodes': 20, 'bootstrap': False, 'ccp_alpha': 0.01}. Best is trial 2774 with value: 0.046571421912873.
[I 2025-04-16 01:42:51,869] Trial 2797 finished with value: -0.1936417107583833 and parameters: {'n_estimators': 2955, 'min_samples_split': 5, 'max_features': 0.85, 'min_samples_leaf': 5, 'criterion': 'absolute_error', 'max_depth': 5, 'min_weight_fraction_leaf': 0.0, 'max_leaf_nodes': 20, 'bootstrap': False, 'ccp_alpha': 0.027}. Best is trial 2774 with value: 0.046571421912873.
[I 2025-04-16 01:42:54,560] Trial 2798 finished with value: -0.1936417107583833 and parameters: {'n_estimators': 2853, 'min_samples_split': 2, 'max_features': 0.49, 'min_samples_leaf': 1, 'criterion': 'absolute_error', 'max_depth': 5, 'min_weight_fraction_leaf': 0.0, 'max_leaf_nodes': 20, 'bootstrap': False, 'ccp_alpha': 0.02}. Best is trial 2774 with value: 0.046571421912873.
[I 2025-04-16 01:42:57,537] Trial 2799 finished with value: -0.07788675565751742 and parameters: {'n_estimators': 3241, 'min_samples_split': 8, 'max_features': 0.89, 'min_samples_leaf': 5, 'criterion': 'absolute_error', 'max_depth': 5, 'min_weight_fraction_leaf': 0.0, 'max_leaf_nodes': 20, 'bootstrap': False, 'ccp_alpha': 0.005}. Best is trial 2774 with value: 0.046571421912873.
[I 2025-04-16 01:43:00,423] Trial 2800 finished with value: -0.1936417107583833 and parameters: {'n_estimators': 3189, 'min_samples_split': 12, 'max_features': 0.87, 'min_samples_leaf': 86, 'criterion': 'absolute_error', 'max_depth': 5, 'min_weight_fraction_leaf': 0.0, 'max_leaf_nodes': 20, 'bootstrap': False, 'ccp_alpha': 0.0}. Best is trial 2774 with value: 0.046571421912873.
[I 2025-04-16 01:43:03,266] Trial 2801 finished with value: -0.1936417107583833 and parameters: {'n_estimators': 3021, 'min_samples_split': 5, 'max_features': 0.89, 'min_samples_leaf': 3, 'criterion': 'absolute_error', 'max_depth': 5, 'min_weight_fraction_leaf': 0.0, 'max_leaf_nodes': 20, 'bootstrap': False, 'ccp_alpha': 0.01}. Best is trial 2774 with value: 0.046571421912873.
[I 2025-04-16 01:43:06,039] Trial 2802 finished with value: -17.528986382275992 and parameters: {'n_estimators': 3241, 'min_samples_split': 2, 'max_features': 0.8300000000000001, 'min_samples_leaf': 7, 'criterion': 'friedman_mse', 'max_depth': 5, 'min_weight_fraction_leaf': 0.0, 'max_leaf_nodes': 20, 'bootstrap': False, 'ccp_alpha': 0.014}. Best is trial 2774 with value: 0.046571421912873.
[I 2025-04-16 01:43:08,521] Trial 2803 finished with value: -0.1936417107583833 and parameters: {'n_estimators': 2715, 'min_samples_split': 8, 'max_features': 0.9, 'min_samples_leaf': 1, 'criterion': 'absolute_error', 'max_depth': 5, 'min_weight_fraction_leaf': 0.0, 'max_leaf_nodes': 20, 'bootstrap': False, 'ccp_alpha': 0.01}. Best is trial 2774 with value: 0.046571421912873.
[I 2025-04-16 01:43:12,636] Trial 2804 finished with value: -0.07882566009775309 and parameters: {'n_estimators': 3260, 'min_samples_split': 12, 'max_features': 0.87, 'min_samples_leaf': 3, 'criterion': 'absolute_error', 'max_depth': 5, 'min_weight_fraction_leaf': 0.0, 'max_leaf_nodes': 20, 'bootstrap': False, 'ccp_alpha': 0.005}. Best is trial 2774 with value: 0.046571421912873.
[I 2025-04-16 01:43:15,284] Trial 2805 finished with value: -0.1936417107583833 and parameters: {'n_estimators': 2971, 'min_samples_split': 8, 'max_features': 0.89, 'min_samples_leaf': 5, 'criterion': 'absolute_error', 'max_depth': 5, 'min_weight_fraction_leaf': 0.0, 'max_leaf_nodes': 20, 'bootstrap': False, 'ccp_alpha': 0.019}. Best is trial 2774 with value: 0.046571421912873.
[I 2025-04-16 01:43:17,999] Trial 2806 finished with value: -7.467788869582982 and parameters: {'n_estimators': 3336, 'min_samples_split': 5, 'max_features': 0.85, 'min_samples_leaf': 7, 'criterion': 'absolute_error', 'max_depth': 5, 'min_weight_fraction_leaf': 0.0, 'max_leaf_nodes': 20, 'bootstrap': False, 'ccp_alpha': 0.0}. Best is trial 2774 with value: 0.046571421912873.
[I 2025-04-16 01:43:21,335] Trial 2807 finished with value: -0.007888460923148388 and parameters: {'n_estimators': 3182, 'min_samples_split': 2, 'max_features': 0.91, 'min_samples_leaf': 3, 'criterion': 'absolute_error', 'max_depth': 5, 'min_weight_fraction_leaf': 0.0, 'max_leaf_nodes': 20, 'bootstrap': False, 'ccp_alpha': 0.005}. Best is trial 2774 with value: 0.046571421912873.
[I 2025-04-16 01:43:23,699] Trial 2808 finished with value: -0.0805838402554621 and parameters: {'n_estimators': 2609, 'min_samples_split': 12, 'max_features': 0.87, 'min_samples_leaf': 1, 'criterion': 'absolute_error', 'max_depth': 5, 'min_weight_fraction_leaf': 0.0, 'max_leaf_nodes': 20, 'bootstrap': False, 'ccp_alpha': 0.005}. Best is trial 2774 with value: 0.046571421912873.
[I 2025-04-16 01:43:26,364] Trial 2809 finished with value: -13.280823348189568 and parameters: {'n_estimators': 2894, 'min_samples_split': 8, 'max_features': 0.9, 'min_samples_leaf': 5, 'criterion': 'absolute_error', 'max_depth': 5, 'min_weight_fraction_leaf': 0.0, 'max_leaf_nodes': 20, 'bootstrap': False, 'ccp_alpha': 0.0}. Best is trial 2774 with value: 0.046571421912873.
[I 2025-04-16 01:43:28,925] Trial 2810 finished with value: -0.1936417107583833 and parameters: {'n_estimators': 2947, 'min_samples_split': 5, 'max_features': 0.88, 'min_samples_leaf': 3, 'criterion': 'absolute_error', 'max_depth': 5, 'min_weight_fraction_leaf': 0.0, 'max_leaf_nodes': 20, 'bootstrap': False, 'ccp_alpha': 0.01}. Best is trial 2774 with value: 0.046571421912873.
[I 2025-04-16 01:43:31,870] Trial 2811 finished with value: -17.528986382276976 and parameters: {'n_estimators': 2725, 'min_samples_split': 12, 'max_features': 0.91, 'min_samples_leaf': 7, 'criterion': 'squared_error', 'max_depth': 5, 'min_weight_fraction_leaf': 0.0, 'max_leaf_nodes': 20, 'bootstrap': False, 'ccp_alpha': 0.014}. Best is trial 2774 with value: 0.046571421912873.
[I 2025-04-16 01:43:34,552] Trial 2812 finished with value: -2.464844306640177 and parameters: {'n_estimators': 2833, 'min_samples_split': 2, 'max_features': 0.8300000000000001, 'min_samples_leaf': 1, 'criterion': 'absolute_error', 'max_depth': 5, 'min_weight_fraction_leaf': 0.0, 'max_leaf_nodes': 20, 'bootstrap': False, 'ccp_alpha': 0.004}. Best is trial 2774 with value: 0.046571421912873.
[I 2025-04-16 01:43:37,215] Trial 2813 finished with value: -0.1936417107583833 and parameters: {'n_estimators': 2971, 'min_samples_split': 127, 'max_features': 0.89, 'min_samples_leaf': 5, 'criterion': 'absolute_error', 'max_depth': 5, 'min_weight_fraction_leaf': 0.0, 'max_leaf_nodes': 20, 'bootstrap': False, 'ccp_alpha': 0.015}. Best is trial 2774 with value: 0.046571421912873.
[I 2025-04-16 01:43:40,176] Trial 2814 finished with value: -0.08245816734891201 and parameters: {'n_estimators': 3088, 'min_samples_split': 8, 'max_features': 0.85, 'min_samples_leaf': 3, 'criterion': 'absolute_error', 'max_depth': 5, 'min_weight_fraction_leaf': 0.0, 'max_leaf_nodes': 20, 'bootstrap': False, 'ccp_alpha': 0.005}. Best is trial 2774 with value: 0.046571421912873.
[I 2025-04-16 01:43:42,943] Trial 2815 finished with value: -0.1936417107583833 and parameters: {'n_estimators': 3097, 'min_samples_split': 5, 'max_features': 0.91, 'min_samples_leaf': 5, 'criterion': 'absolute_error', 'max_depth': 5, 'min_weight_fraction_leaf': 0.0, 'max_leaf_nodes': 20, 'bootstrap': False, 'ccp_alpha': 0.023}. Best is trial 2774 with value: 0.046571421912873.
[I 2025-04-16 01:43:45,659] Trial 2816 finished with value: -20.29779732727475 and parameters: {'n_estimators': 2741, 'min_samples_split': 12, 'max_features': 0.87, 'min_samples_leaf': 3, 'criterion': 'poisson', 'max_depth': 5, 'min_weight_fraction_leaf': 0.0, 'max_leaf_nodes': 20, 'bootstrap': False, 'ccp_alpha': 0.01}. Best is trial 2774 with value: 0.046571421912873.
[I 2025-04-16 01:43:48,006] Trial 2817 finished with value: -8.689014068213945 and parameters: {'n_estimators': 2514, 'min_samples_split': 8, 'max_features': 0.91, 'min_samples_leaf': 7, 'criterion': 'absolute_error', 'max_depth': 5, 'min_weight_fraction_leaf': 0.0, 'max_leaf_nodes': 20, 'bootstrap': False, 'ccp_alpha': 0.0}. Best is trial 2774 with value: 0.046571421912873.
[I 2025-04-16 01:43:50,821] Trial 2818 finished with value: -0.1936417107583833 and parameters: {'n_estimators': 3114, 'min_samples_split': 2, 'max_features': 0.88, 'min_samples_leaf': 1, 'criterion': 'absolute_error', 'max_depth': 5, 'min_weight_fraction_leaf': 0.0, 'max_leaf_nodes': 20, 'bootstrap': False, 'ccp_alpha': 0.009000000000000001}. Best is trial 2774 with value: 0.046571421912873.
[I 2025-04-16 01:43:53,527] Trial 2819 finished with value: -0.1936417107583833 and parameters: {'n_estimators': 3083, 'min_samples_split': 89, 'max_features': 0.9, 'min_samples_leaf': 4, 'criterion': 'absolute_error', 'max_depth': 5, 'min_weight_fraction_leaf': 0.0, 'max_leaf_nodes': 20, 'bootstrap': False, 'ccp_alpha': 0.019}. Best is trial 2774 with value: 0.046571421912873.
[I 2025-04-16 01:43:56,913] Trial 2820 finished with value: 0.002956677658879414 and parameters: {'n_estimators': 3206, 'min_samples_split': 5, 'max_features': 0.91, 'min_samples_leaf': 1, 'criterion': 'absolute_error', 'max_depth': 5, 'min_weight_fraction_leaf': 0.0, 'max_leaf_nodes': 20, 'bootstrap': False, 'ccp_alpha': 0.005}. Best is trial 2774 with value: 0.046571421912873.
[I 2025-04-16 01:43:59,183] Trial 2821 finished with value: -7.454777560133489 and parameters: {'n_estimators': 2789, 'min_samples_split': 12, 'max_features': 0.87, 'min_samples_leaf': 7, 'criterion': 'absolute_error', 'max_depth': 5, 'min_weight_fraction_leaf': 0.0, 'max_leaf_nodes': 20, 'bootstrap': False, 'ccp_alpha': 0.0}. Best is trial 2774 with value: 0.046571421912873.
[I 2025-04-16 01:44:02,405] Trial 2822 finished with value: -0.08695228415119535 and parameters: {'n_estimators': 2873, 'min_samples_split': 9, 'max_features': 0.85, 'min_samples_leaf': 3, 'criterion': 'absolute_error', 'max_depth': 5, 'min_weight_fraction_leaf': 0.0, 'max_leaf_nodes': 20, 'bootstrap': False, 'ccp_alpha': 0.005}. Best is trial 2774 with value: 0.046571421912873.
[I 2025-04-16 01:44:05,373] Trial 2823 finished with value: -0.1936417107583833 and parameters: {'n_estimators': 2903, 'min_samples_split': 5, 'max_features': 0.89, 'min_samples_leaf': 5, 'criterion': 'absolute_error', 'max_depth': 5, 'min_weight_fraction_leaf': 0.0, 'max_leaf_nodes': 20, 'bootstrap': False, 'ccp_alpha': 0.014}. Best is trial 2774 with value: 0.046571421912873.
[I 2025-04-16 01:44:07,855] Trial 2824 finished with value: -0.08216854322882552 and parameters: {'n_estimators': 2601, 'min_samples_split': 8, 'max_features': 0.86, 'min_samples_leaf': 3, 'criterion': 'absolute_error', 'max_depth': 5, 'min_weight_fraction_leaf': 0.1, 'max_leaf_nodes': 20, 'bootstrap': False, 'ccp_alpha': 0.005}. Best is trial 2774 with value: 0.046571421912873.
[I 2025-04-16 01:44:10,342] Trial 2825 finished with value: -4.811269086952568 and parameters: {'n_estimators': 3042, 'min_samples_split': 2, 'max_features': 0.89, 'min_samples_leaf': 1, 'criterion': 'absolute_error', 'max_depth': 5, 'min_weight_fraction_leaf': 0.0, 'max_leaf_nodes': 20, 'bootstrap': False, 'ccp_alpha': 0.0}. Best is trial 2774 with value: 0.046571421912873.
[I 2025-04-16 01:44:12,917] Trial 2826 finished with value: -0.1936417107583833 and parameters: {'n_estimators': 2855, 'min_samples_split': 12, 'max_features': 0.89, 'min_samples_leaf': 5, 'criterion': 'absolute_error', 'max_depth': 5, 'min_weight_fraction_leaf': 0.0, 'max_leaf_nodes': 20, 'bootstrap': False, 'ccp_alpha': 0.01}. Best is trial 2774 with value: 0.046571421912873.
[I 2025-04-16 01:44:15,596] Trial 2827 finished with value: -17.52898638227648 and parameters: {'n_estimators': 3090, 'min_samples_split': 5, 'max_features': 0.86, 'min_samples_leaf': 7, 'criterion': 'friedman_mse', 'max_depth': 5, 'min_weight_fraction_leaf': 0.0, 'max_leaf_nodes': 20, 'bootstrap': False, 'ccp_alpha': 0.015}. Best is trial 2774 with value: 0.046571421912873.
[I 2025-04-16 01:44:18,314] Trial 2828 finished with value: -0.1936417107583833 and parameters: {'n_estimators': 2660, 'min_samples_split': 2, 'max_features': 0.8300000000000001, 'min_samples_leaf': 3, 'criterion': 'absolute_error', 'max_depth': 5, 'min_weight_fraction_leaf': 0.0, 'max_leaf_nodes': 20, 'bootstrap': False, 'ccp_alpha': 0.01}. Best is trial 2774 with value: 0.046571421912873.
[I 2025-04-16 01:44:20,916] Trial 2829 finished with value: -2.9102370677871923 and parameters: {'n_estimators': 3112, 'min_samples_split': 9, 'max_features': 0.91, 'min_samples_leaf': 1, 'criterion': 'absolute_error', 'max_depth': 5, 'min_weight_fraction_leaf': 0.0, 'max_leaf_nodes': 20, 'bootstrap': False, 'ccp_alpha': 0.0}. Best is trial 2774 with value: 0.046571421912873.
[I 2025-04-16 01:44:23,737] Trial 2830 finished with value: -0.07328047561527269 and parameters: {'n_estimators': 2934, 'min_samples_split': 8, 'max_features': 0.88, 'min_samples_leaf': 5, 'criterion': 'absolute_error', 'max_depth': 5, 'min_weight_fraction_leaf': 0.0, 'max_leaf_nodes': 20, 'bootstrap': False, 'ccp_alpha': 0.005}. Best is trial 2774 with value: 0.046571421912873.
[I 2025-04-16 01:44:26,921] Trial 2831 finished with value: -0.1936417107583833 and parameters: {'n_estimators': 3184, 'min_samples_split': 12, 'max_features': 0.64, 'min_samples_leaf': 7, 'criterion': 'absolute_error', 'max_depth': 5, 'min_weight_fraction_leaf': 0.0, 'max_leaf_nodes': 20, 'bootstrap': False, 'ccp_alpha': 0.02}. Best is trial 2774 with value: 0.046571421912873.
[I 2025-04-16 01:44:29,846] Trial 2832 finished with value: -0.1936417107583833 and parameters: {'n_estimators': 3168, 'min_samples_split': 5, 'max_features': 0.9, 'min_samples_leaf': 4, 'criterion': 'absolute_error', 'max_depth': 5, 'min_weight_fraction_leaf': 0.0, 'max_leaf_nodes': 20, 'bootstrap': False, 'ccp_alpha': 0.01}. Best is trial 2774 with value: 0.046571421912873.
