[I 2025-04-16 00:59:53,105] Trial 2043 finished with value: -0.1936417107583833 and parameters: {'n_estimators': 4550, 'min_samples_split': 14, 'max_features': 0.9500000000000001, 'min_samples_leaf': 18, 'criterion': 'absolute_error', 'max_depth': 60, 'min_weight_fraction_leaf': 0.01, 'max_leaf_nodes': 20, 'bootstrap': False, 'ccp_alpha': 0.006}. Best is trial 1828 with value: -0.15292978335836716.
[I 2025-04-16 00:59:56,432] Trial 2044 finished with value: -0.1936417107583833 and parameters: {'n_estimators': 3878, 'min_samples_split': 26, 'max_features': 1.0, 'min_samples_leaf': 12, 'criterion': 'absolute_error', 'max_depth': 60, 'min_weight_fraction_leaf': 0.0, 'max_leaf_nodes': 150, 'bootstrap': False, 'ccp_alpha': 0.011}. Best is trial 1828 with value: -0.15292978335836716.
[I 2025-04-16 01:00:00,140] Trial 2045 finished with value: -0.15910512167669713 and parameters: {'n_estimators': 4832, 'min_samples_split': 17, 'max_features': 0.9400000000000001, 'min_samples_leaf': 13, 'criterion': 'absolute_error', 'max_depth': 60, 'min_weight_fraction_leaf': 0.01, 'max_leaf_nodes': 150, 'bootstrap': False, 'ccp_alpha': 0.0}. Best is trial 1828 with value: -0.15292978335836716.
[I 2025-04-16 01:00:03,972] Trial 2046 finished with value: -0.1936417107583833 and parameters: {'n_estimators': 4188, 'min_samples_split': 8, 'max_features': 0.97, 'min_samples_leaf': 10, 'criterion': 'absolute_error', 'max_depth': 60, 'min_weight_fraction_leaf': 0.01, 'max_leaf_nodes': 150, 'bootstrap': False, 'ccp_alpha': 0.006}. Best is trial 1828 with value: -0.15292978335836716.
[I 2025-04-16 01:00:07,161] Trial 2047 finished with value: -0.1936417107583833 and parameters: {'n_estimators': 3552, 'min_samples_split': 13, 'max_features': 0.98, 'min_samples_leaf': 15, 'criterion': 'absolute_error', 'max_depth': 60, 'min_weight_fraction_leaf': 0.01, 'max_leaf_nodes': 150, 'bootstrap': False, 'ccp_alpha': 0.014}. Best is trial 1828 with value: -0.15292978335836716.
[I 2025-04-16 01:00:11,308] Trial 2048 finished with value: -0.1936417107583833 and parameters: {'n_estimators': 4446, 'min_samples_split': 21, 'max_features': 0.9600000000000001, 'min_samples_leaf': 9, 'criterion': 'absolute_error', 'max_depth': 60, 'min_weight_fraction_leaf': 0.01, 'max_leaf_nodes': 150, 'bootstrap': False, 'ccp_alpha': 0.006}. Best is trial 1828 with value: -0.15292978335836716.
[I 2025-04-16 01:00:14,432] Trial 2049 finished with value: -0.19364227087454206 and parameters: {'n_estimators': 3961, 'min_samples_split': 10, 'max_features': 0.9400000000000001, 'min_samples_leaf': 19, 'criterion': 'absolute_error', 'max_depth': 60, 'min_weight_fraction_leaf': 0.01, 'max_leaf_nodes': 150, 'bootstrap': False, 'ccp_alpha': 0.0}. Best is trial 1828 with value: -0.15292978335836716.
[I 2025-04-16 01:00:18,334] Trial 2050 finished with value: -0.1936417107583833 and parameters: {'n_estimators': 4297, 'min_samples_split': 5, 'max_features': 0.99, 'min_samples_leaf': 12, 'criterion': 'absolute_error', 'max_depth': 60, 'min_weight_fraction_leaf': 0.0, 'max_leaf_nodes': 150, 'bootstrap': False, 'ccp_alpha': 0.01}. Best is trial 1828 with value: -0.15292978335836716.
[I 2025-04-16 01:00:21,938] Trial 2051 finished with value: -17.52898638227469 and parameters: {'n_estimators': 3728, 'min_samples_split': 17, 'max_features': 0.9600000000000001, 'min_samples_leaf': 14, 'criterion': 'friedman_mse', 'max_depth': 60, 'min_weight_fraction_leaf': 0.01, 'max_leaf_nodes': 300, 'bootstrap': False, 'ccp_alpha': 0.019}. Best is trial 1828 with value: -0.15292978335836716.
[I 2025-04-16 01:00:25,580] Trial 2052 finished with value: -0.1936417107583833 and parameters: {'n_estimators': 4083, 'min_samples_split': 2, 'max_features': 0.93, 'min_samples_leaf': 17, 'criterion': 'absolute_error', 'max_depth': 60, 'min_weight_fraction_leaf': 0.01, 'max_leaf_nodes': 150, 'bootstrap': False, 'ccp_alpha': 0.005}. Best is trial 1828 with value: -0.15292978335836716.
[I 2025-04-16 01:00:29,158] Trial 2053 finished with value: -0.1936417107583833 and parameters: {'n_estimators': 3932, 'min_samples_split': 24, 'max_features': 1.0, 'min_samples_leaf': 10, 'criterion': 'absolute_error', 'max_depth': 60, 'min_weight_fraction_leaf': 0.01, 'max_leaf_nodes': 150, 'bootstrap': False, 'ccp_alpha': 0.263}. Best is trial 1828 with value: -0.15292978335836716.
[I 2025-04-16 01:00:32,743] Trial 2054 finished with value: -8.805012600411386 and parameters: {'n_estimators': 4203, 'min_samples_split': 13, 'max_features': 0.9600000000000001, 'min_samples_leaf': 12, 'criterion': 'absolute_error', 'max_depth': 10, 'min_weight_fraction_leaf': 0.01, 'max_leaf_nodes': 150, 'bootstrap': False, 'ccp_alpha': 0.0}. Best is trial 1828 with value: -0.15292978335836716.
[I 2025-04-16 01:00:35,958] Trial 2055 finished with value: -17.52898638227469 and parameters: {'n_estimators': 3728, 'min_samples_split': 18, 'max_features': 0.98, 'min_samples_leaf': 8, 'criterion': 'squared_error', 'max_depth': 60, 'min_weight_fraction_leaf': 0.01, 'max_leaf_nodes': 150, 'bootstrap': False, 'ccp_alpha': 0.011}. Best is trial 1828 with value: -0.15292978335836716.
[I 2025-04-16 01:00:40,212] Trial 2056 finished with value: -0.1936417107583833 and parameters: {'n_estimators': 4669, 'min_samples_split': 30, 'max_features': 0.9400000000000001, 'min_samples_leaf': 15, 'criterion': 'absolute_error', 'max_depth': 60, 'min_weight_fraction_leaf': 0.0, 'max_leaf_nodes': 150, 'bootstrap': False, 'ccp_alpha': 0.005}. Best is trial 1828 with value: -0.15292978335836716.
[I 2025-04-16 01:00:44,147] Trial 2057 finished with value: -0.1936417107583833 and parameters: {'n_estimators': 4391, 'min_samples_split': 10, 'max_features': 0.98, 'min_samples_leaf': 13, 'criterion': 'absolute_error', 'max_depth': 5, 'min_weight_fraction_leaf': 0.01, 'max_leaf_nodes': 150, 'bootstrap': False, 'ccp_alpha': 0.015}. Best is trial 1828 with value: -0.15292978335836716.
[I 2025-04-16 01:00:47,176] Trial 2058 finished with value: -8.726381972424997 and parameters: {'n_estimators': 3542, 'min_samples_split': 21, 'max_features': 0.9500000000000001, 'min_samples_leaf': 11, 'criterion': 'absolute_error', 'max_depth': 60, 'min_weight_fraction_leaf': 0.01, 'max_leaf_nodes': 150, 'bootstrap': False, 'ccp_alpha': 0.0}. Best is trial 1828 with value: -0.15292978335836716.
[I 2025-04-16 01:00:50,895] Trial 2059 finished with value: -0.1936417107583833 and parameters: {'n_estimators': 4038, 'min_samples_split': 15, 'max_features': 0.92, 'min_samples_leaf': 16, 'criterion': 'absolute_error', 'max_depth': 60, 'min_weight_fraction_leaf': 0.01, 'max_leaf_nodes': 150, 'bootstrap': False, 'ccp_alpha': 0.009000000000000001}. Best is trial 1828 with value: -0.15292978335836716.
[I 2025-04-16 01:00:54,149] Trial 2060 finished with value: -0.19362129526358873 and parameters: {'n_estimators': 3857, 'min_samples_split': 7, 'max_features': 0.9600000000000001, 'min_samples_leaf': 14, 'criterion': 'absolute_error', 'max_depth': 60, 'min_weight_fraction_leaf': 0.01, 'max_leaf_nodes': 150, 'bootstrap': False, 'ccp_alpha': 0.0}. Best is trial 1828 with value: -0.15292978335836716.
[I 2025-04-16 01:00:58,155] Trial 2061 finished with value: -0.1936417107583833 and parameters: {'n_estimators': 4167, 'min_samples_split': 15, 'max_features': 1.0, 'min_samples_leaf': 10, 'criterion': 'absolute_error', 'max_depth': 60, 'min_weight_fraction_leaf': 0.01, 'max_leaf_nodes': 150, 'bootstrap': False, 'ccp_alpha': 0.006}. Best is trial 1828 with value: -0.15292978335836716.
[I 2025-04-16 01:01:02,242] Trial 2062 finished with value: -17.52898638227343 and parameters: {'n_estimators': 4364, 'min_samples_split': 22, 'max_features': 0.9400000000000001, 'min_samples_leaf': 17, 'criterion': 'poisson', 'max_depth': 60, 'min_weight_fraction_leaf': 0.0, 'max_leaf_nodes': 150, 'bootstrap': False, 'ccp_alpha': 0.014}. Best is trial 1828 with value: -0.15292978335836716.
[I 2025-04-16 01:01:05,892] Trial 2063 finished with value: -0.1936417107583833 and parameters: {'n_estimators': 4022, 'min_samples_split': 26, 'max_features': 0.97, 'min_samples_leaf': 95, 'criterion': 'absolute_error', 'max_depth': 60, 'min_weight_fraction_leaf': 0.01, 'max_leaf_nodes': 150, 'bootstrap': False, 'ccp_alpha': 0.026000000000000002}. Best is trial 1828 with value: -0.15292978335836716.
[I 2025-04-16 01:01:13,479] Trial 2064 finished with value: -0.1936417107583833 and parameters: {'n_estimators': 9320, 'min_samples_split': 11, 'max_features': 0.98, 'min_samples_leaf': 13, 'criterion': 'absolute_error', 'max_depth': 60, 'min_weight_fraction_leaf': 0.01, 'max_leaf_nodes': 150, 'bootstrap': False, 'ccp_alpha': 0.274}. Best is trial 1828 with value: -0.15292978335836716.
[I 2025-04-16 01:01:16,562] Trial 2065 finished with value: -0.1936417107583833 and parameters: {'n_estimators': 3684, 'min_samples_split': 18, 'max_features': 0.93, 'min_samples_leaf': 8, 'criterion': 'absolute_error', 'max_depth': 60, 'min_weight_fraction_leaf': 0.01, 'max_leaf_nodes': 150, 'bootstrap': False, 'ccp_alpha': 0.005}. Best is trial 1828 with value: -0.15292978335836716.
[I 2025-04-16 01:01:20,355] Trial 2066 finished with value: -0.1936417107583833 and parameters: {'n_estimators': 4546, 'min_samples_split': 6, 'max_features': 0.9600000000000001, 'min_samples_leaf': 11, 'criterion': 'absolute_error', 'max_depth': 60, 'min_weight_fraction_leaf': 0.01, 'max_leaf_nodes': 150, 'bootstrap': False, 'ccp_alpha': 0.01}. Best is trial 1828 with value: -0.15292978335836716.
[I 2025-04-16 01:01:23,721] Trial 2067 finished with value: -0.19362431753199344 and parameters: {'n_estimators': 3887, 'min_samples_split': 13, 'max_features': 1.0, 'min_samples_leaf': 15, 'criterion': 'absolute_error', 'max_depth': 60, 'min_weight_fraction_leaf': 0.01, 'max_leaf_nodes': 150, 'bootstrap': False, 'ccp_alpha': 0.0}. Best is trial 1828 with value: -0.15292978335836716.
[I 2025-04-16 01:01:33,036] Trial 2068 finished with value: -0.1936417107583833 and parameters: {'n_estimators': 9725, 'min_samples_split': 18, 'max_features': 0.92, 'min_samples_leaf': 19, 'criterion': 'absolute_error', 'max_depth': 60, 'min_weight_fraction_leaf': 0.0, 'max_leaf_nodes': 20, 'bootstrap': False, 'ccp_alpha': 0.005}. Best is trial 1828 with value: -0.15292978335836716.
[I 2025-04-16 01:01:36,691] Trial 2069 finished with value: -0.1936417107583833 and parameters: {'n_estimators': 4226, 'min_samples_split': 9, 'max_features': 0.9500000000000001, 'min_samples_leaf': 13, 'criterion': 'absolute_error', 'max_depth': 60, 'min_weight_fraction_leaf': 0.01, 'max_leaf_nodes': 150, 'bootstrap': False, 'ccp_alpha': 0.018000000000000002}. Best is trial 1828 with value: -0.15292978335836716.
[I 2025-04-16 01:01:39,800] Trial 2070 finished with value: -17.528986382275114 and parameters: {'n_estimators': 3553, 'min_samples_split': 23, 'max_features': 0.98, 'min_samples_leaf': 11, 'criterion': 'friedman_mse', 'max_depth': 60, 'min_weight_fraction_leaf': 0.01, 'max_leaf_nodes': 150, 'bootstrap': False, 'ccp_alpha': 0.01}. Best is trial 1828 with value: -0.15292978335836716.
[I 2025-04-16 01:01:43,121] Trial 2071 finished with value: -0.19362492027774306 and parameters: {'n_estimators': 4030, 'min_samples_split': 15, 'max_features': 0.9400000000000001, 'min_samples_leaf': 15, 'criterion': 'absolute_error', 'max_depth': 60, 'min_weight_fraction_leaf': 0.01, 'max_leaf_nodes': 150, 'bootstrap': False, 'ccp_alpha': 0.0}. Best is trial 1828 with value: -0.15292978335836716.
[I 2025-04-16 01:01:46,989] Trial 2072 finished with value: -0.1936417107583833 and parameters: {'n_estimators': 4364, 'min_samples_split': 20, 'max_features': 0.97, 'min_samples_leaf': 13, 'criterion': 'absolute_error', 'max_depth': 60, 'min_weight_fraction_leaf': 0.01, 'max_leaf_nodes': 150, 'bootstrap': False, 'ccp_alpha': 0.006}. Best is trial 1828 with value: -0.15292978335836716.
[I 2025-04-16 01:01:50,391] Trial 2073 finished with value: -0.1936417107583833 and parameters: {'n_estimators': 3792, 'min_samples_split': 11, 'max_features': 0.91, 'min_samples_leaf': 17, 'criterion': 'absolute_error', 'max_depth': None, 'min_weight_fraction_leaf': 0.01, 'max_leaf_nodes': None, 'bootstrap': False, 'ccp_alpha': 0.015}. Best is trial 1828 with value: -0.15292978335836716.
[I 2025-04-16 01:01:54,173] Trial 2074 finished with value: -0.1936417107583833 and parameters: {'n_estimators': 4111, 'min_samples_split': 26, 'max_features': 0.9600000000000001, 'min_samples_leaf': 9, 'criterion': 'absolute_error', 'max_depth': 60, 'min_weight_fraction_leaf': 0.0, 'max_leaf_nodes': 150, 'bootstrap': False, 'ccp_alpha': 0.006}. Best is trial 1828 with value: -0.15292978335836716.
[I 2025-04-16 01:01:57,906] Trial 2075 finished with value: -0.1936417107583833 and parameters: {'n_estimators': 3880, 'min_samples_split': 15, 'max_features': 0.99, 'min_samples_leaf': 12, 'criterion': 'absolute_error', 'max_depth': 60, 'min_weight_fraction_leaf': 0.01, 'max_leaf_nodes': 150, 'bootstrap': False, 'ccp_alpha': 0.01}. Best is trial 1828 with value: -0.15292978335836716.
[I 2025-04-16 01:02:01,293] Trial 2076 finished with value: -0.1936213166377864 and parameters: {'n_estimators': 4235, 'min_samples_split': 5, 'max_features': 0.9400000000000001, 'min_samples_leaf': 14, 'criterion': 'absolute_error', 'max_depth': 60, 'min_weight_fraction_leaf': 0.01, 'max_leaf_nodes': 150, 'bootstrap': False, 'ccp_alpha': 0.0}. Best is trial 1828 with value: -0.15292978335836716.
[I 2025-04-16 01:02:05,575] Trial 2077 finished with value: -0.1936417107583833 and parameters: {'n_estimators': 4472, 'min_samples_split': 19, 'max_features': 0.98, 'min_samples_leaf': 16, 'criterion': 'absolute_error', 'max_depth': 60, 'min_weight_fraction_leaf': 0.01, 'max_leaf_nodes': 150, 'bootstrap': False, 'ccp_alpha': 0.005}. Best is trial 1828 with value: -0.15292978335836716.
[I 2025-04-16 01:02:08,807] Trial 2078 finished with value: -8.793339109158673 and parameters: {'n_estimators': 3683, 'min_samples_split': 30, 'max_features': 0.93, 'min_samples_leaf': 10, 'criterion': 'absolute_error', 'max_depth': 60, 'min_weight_fraction_leaf': 0.01, 'max_leaf_nodes': 300, 'bootstrap': False, 'ccp_alpha': 0.0}. Best is trial 1828 with value: -0.15292978335836716.
[I 2025-04-16 01:02:12,771] Trial 2079 finished with value: -17.52898638227297 and parameters: {'n_estimators': 4654, 'min_samples_split': 9, 'max_features': 0.9600000000000001, 'min_samples_leaf': 8, 'criterion': 'squared_error', 'max_depth': 60, 'min_weight_fraction_leaf': 0.01, 'max_leaf_nodes': 150, 'bootstrap': False, 'ccp_alpha': 0.02}. Best is trial 1828 with value: -0.15292978335836716.
[I 2025-04-16 01:02:16,500] Trial 2080 finished with value: -0.1936417107583833 and parameters: {'n_estimators': 4044, 'min_samples_split': 12, 'max_features': 1.0, 'min_samples_leaf': 12, 'criterion': 'absolute_error', 'max_depth': 60, 'min_weight_fraction_leaf': 0.01, 'max_leaf_nodes': 150, 'bootstrap': False, 'ccp_alpha': 0.013000000000000001}. Best is trial 1828 with value: -0.15292978335836716.
[I 2025-04-16 01:02:19,947] Trial 2081 finished with value: -0.1936417107583833 and parameters: {'n_estimators': 3544, 'min_samples_split': 16, 'max_features': 0.91, 'min_samples_leaf': 18, 'criterion': 'absolute_error', 'max_depth': 60, 'min_weight_fraction_leaf': 0.01, 'max_leaf_nodes': 150, 'bootstrap': False, 'ccp_alpha': 0.006}. Best is trial 1828 with value: -0.15292978335836716.
[I 2025-04-16 01:02:23,800] Trial 2082 finished with value: -0.19362502219882663 and parameters: {'n_estimators': 4868, 'min_samples_split': 2, 'max_features': 0.9500000000000001, 'min_samples_leaf': 15, 'criterion': 'absolute_error', 'max_depth': 10, 'min_weight_fraction_leaf': 0.01, 'max_leaf_nodes': 150, 'bootstrap': False, 'ccp_alpha': 0.0}. Best is trial 1828 with value: -0.15292978335836716.
[I 2025-04-16 01:02:27,626] Trial 2083 finished with value: -0.1936417107583833 and parameters: {'n_estimators': 4242, 'min_samples_split': 73, 'max_features': 0.97, 'min_samples_leaf': 13, 'criterion': 'absolute_error', 'max_depth': 5, 'min_weight_fraction_leaf': 0.0, 'max_leaf_nodes': 150, 'bootstrap': False, 'ccp_alpha': 0.01}. Best is trial 1828 with value: -0.15292978335836716.
[I 2025-04-16 01:02:30,899] Trial 2084 finished with value: -0.1936417107583833 and parameters: {'n_estimators': 3865, 'min_samples_split': 23, 'max_features': 0.93, 'min_samples_leaf': 11, 'criterion': 'absolute_error', 'max_depth': 60, 'min_weight_fraction_leaf': 0.01, 'max_leaf_nodes': 150, 'bootstrap': False, 'ccp_alpha': 0.006}. Best is trial 1828 with value: -0.15292978335836716.
[I 2025-04-16 01:02:34,510] Trial 2085 finished with value: -30.857969626218278 and parameters: {'n_estimators': 4065, 'min_samples_split': 19, 'max_features': 0.98, 'min_samples_leaf': 15, 'criterion': 'poisson', 'max_depth': 60, 'min_weight_fraction_leaf': 0.01, 'max_leaf_nodes': 150, 'bootstrap': False, 'ccp_alpha': 0.005}. Best is trial 1828 with value: -0.15292978335836716.
[I 2025-04-16 01:02:41,850] Trial 2086 finished with value: -0.1936417107583833 and parameters: {'n_estimators': 8445, 'min_samples_split': 8, 'max_features': 0.9500000000000001, 'min_samples_leaf': 10, 'criterion': 'absolute_error', 'max_depth': 60, 'min_weight_fraction_leaf': 0.01, 'max_leaf_nodes': 150, 'bootstrap': False, 'ccp_alpha': 0.015}. Best is trial 1828 with value: -0.15292978335836716.
[I 2025-04-16 01:02:45,495] Trial 2087 finished with value: -0.1936422348689461 and parameters: {'n_estimators': 4339, 'min_samples_split': 14, 'max_features': 1.0, 'min_samples_leaf': 17, 'criterion': 'absolute_error', 'max_depth': 60, 'min_weight_fraction_leaf': 0.0, 'max_leaf_nodes': 150, 'bootstrap': False, 'ccp_alpha': 0.0}. Best is trial 1828 with value: -0.15292978335836716.
[I 2025-04-16 01:02:48,780] Trial 2088 finished with value: -0.1936417107583833 and parameters: {'n_estimators': 3715, 'min_samples_split': 26, 'max_features': 0.9, 'min_samples_leaf': 13, 'criterion': 'absolute_error', 'max_depth': 60, 'min_weight_fraction_leaf': 0.01, 'max_leaf_nodes': 150, 'bootstrap': False, 'ccp_alpha': 0.009000000000000001}. Best is trial 1828 with value: -0.15292978335836716.
[I 2025-04-16 01:02:52,589] Trial 2089 finished with value: -0.1936417107583833 and parameters: {'n_estimators': 3934, 'min_samples_split': 21, 'max_features': 0.97, 'min_samples_leaf': 20, 'criterion': 'absolute_error', 'max_depth': 60, 'min_weight_fraction_leaf': 0.01, 'max_leaf_nodes': 150, 'bootstrap': False, 'ccp_alpha': 0.005}. Best is trial 1828 with value: -0.15292978335836716.
[I 2025-04-16 01:02:55,995] Trial 2090 finished with value: -0.1936249382635357 and parameters: {'n_estimators': 4136, 'min_samples_split': 12, 'max_features': 0.93, 'min_samples_leaf': 15, 'criterion': 'absolute_error', 'max_depth': 60, 'min_weight_fraction_leaf': 0.01, 'max_leaf_nodes': 150, 'bootstrap': False, 'ccp_alpha': 0.0}. Best is trial 1828 with value: -0.15292978335836716.
[I 2025-04-16 01:02:59,946] Trial 2091 finished with value: -0.1936417107583833 and parameters: {'n_estimators': 4520, 'min_samples_split': 17, 'max_features': 0.68, 'min_samples_leaf': 8, 'criterion': 'absolute_error', 'max_depth': 60, 'min_weight_fraction_leaf': 0.01, 'max_leaf_nodes': 150, 'bootstrap': False, 'ccp_alpha': 0.021}. Best is trial 1828 with value: -0.15292978335836716.
[I 2025-04-16 01:03:03,487] Trial 2092 finished with value: -0.1936417107583833 and parameters: {'n_estimators': 3913, 'min_samples_split': 6, 'max_features': 0.9500000000000001, 'min_samples_leaf': 12, 'criterion': 'absolute_error', 'max_depth': 60, 'min_weight_fraction_leaf': 0.01, 'max_leaf_nodes': 150, 'bootstrap': False, 'ccp_alpha': 0.014}. Best is trial 1828 with value: -0.15292978335836716.
[I 2025-04-16 01:03:07,226] Trial 2093 finished with value: -0.1936417107583833 and parameters: {'n_estimators': 4264, 'min_samples_split': 12, 'max_features': 0.98, 'min_samples_leaf': 14, 'criterion': 'absolute_error', 'max_depth': 60, 'min_weight_fraction_leaf': 0.01, 'max_leaf_nodes': 20, 'bootstrap': False, 'ccp_alpha': 0.01}. Best is trial 1828 with value: -0.15292978335836716.
[I 2025-04-16 01:03:10,423] Trial 2094 finished with value: -8.767379752614099 and parameters: {'n_estimators': 3736, 'min_samples_split': 16, 'max_features': 0.92, 'min_samples_leaf': 10, 'criterion': 'absolute_error', 'max_depth': 60, 'min_weight_fraction_leaf': 0.0, 'max_leaf_nodes': 150, 'bootstrap': False, 'ccp_alpha': 0.0}. Best is trial 1828 with value: -0.15292978335836716.
[I 2025-04-16 01:03:13,595] Trial 2095 finished with value: -0.1936417107583833 and parameters: {'n_estimators': 3539, 'min_samples_split': 22, 'max_features': 0.9600000000000001, 'min_samples_leaf': 17, 'criterion': 'absolute_error', 'max_depth': 60, 'min_weight_fraction_leaf': 0.01, 'max_leaf_nodes': 150, 'bootstrap': False, 'ccp_alpha': 0.006}. Best is trial 1828 with value: -0.15292978335836716.
[I 2025-04-16 01:03:17,040] Trial 2096 finished with value: -17.52898638227393 and parameters: {'n_estimators': 4086, 'min_samples_split': 9, 'max_features': 1.0, 'min_samples_leaf': 13, 'criterion': 'friedman_mse', 'max_depth': 60, 'min_weight_fraction_leaf': 0.09, 'max_leaf_nodes': 150, 'bootstrap': False, 'ccp_alpha': 0.01}. Best is trial 1828 with value: -0.15292978335836716.
[I 2025-04-16 01:03:20,593] Trial 2097 finished with value: -8.76869893399715 and parameters: {'n_estimators': 4353, 'min_samples_split': 19, 'max_features': 0.9400000000000001, 'min_samples_leaf': 11, 'criterion': 'absolute_error', 'max_depth': 60, 'min_weight_fraction_leaf': 0.01, 'max_leaf_nodes': None, 'bootstrap': False, 'ccp_alpha': 0.0}. Best is trial 1828 with value: -0.15292978335836716.
