[I 2025-04-15 23:02:49,096] A new study created in memory with name: no-name-e30598d0-aacc-4609-899f-e39dcf3981b5
[I 2025-04-15 23:03:01,959] Trial 0 finished with value: -12.658328488746386 and parameters: {'n_estimators': 100, 'min_samples_split': 2, 'max_features': 1.0, 'min_samples_leaf': 1, 'criterion': 'squared_error', 'max_depth': None, 'min_weight_fraction_leaf': 0.0, 'max_leaf_nodes': None, 'bootstrap': True, 'ccp_alpha': 0.0, 'max_samples': None}. Best is trial 0 with value: -12.658328488746386.
[I 2025-04-15 23:03:16,504] Trial 1 finished with value: -17.716852453713294 and parameters: {'n_estimators': 5126, 'min_samples_split': 145, 'max_features': 0.29000000000000004, 'min_samples_leaf': 4, 'criterion': 'friedman_mse', 'max_depth': 30, 'min_weight_fraction_leaf': 0.01, 'max_leaf_nodes': 300, 'bootstrap': True, 'ccp_alpha': 0.276, 'max_samples': 0.5}. Best is trial 0 with value: -12.658328488746386.
[I 2025-04-15 23:03:25,267] Trial 2 finished with value: -18.19069150673748 and parameters: {'n_estimators': 2587, 'min_samples_split': 197, 'max_features': 0.23, 'min_samples_leaf': 17, 'criterion': 'poisson', 'max_depth': None, 'min_weight_fraction_leaf': 0.06, 'max_leaf_nodes': 150, 'bootstrap': True, 'ccp_alpha': 0.171, 'max_samples': 0.5}. Best is trial 0 with value: -12.658328488746386.
[I 2025-04-15 23:03:37,308] Trial 3 finished with value: -17.626248176605596 and parameters: {'n_estimators': 7910, 'min_samples_split': 144, 'max_features': 0.72, 'min_samples_leaf': 26, 'criterion': 'friedman_mse', 'max_depth': 20, 'min_weight_fraction_leaf': 0.02, 'max_leaf_nodes': 300, 'bootstrap': True, 'ccp_alpha': 0.093, 'max_samples': 0.75}. Best is trial 0 with value: -12.658328488746386.
[I 2025-04-15 23:03:43,235] Trial 4 finished with value: -17.528986382272166 and parameters: {'n_estimators': 5266, 'min_samples_split': 56, 'max_features': 0.59, 'min_samples_leaf': 63, 'criterion': 'friedman_mse', 'max_depth': 30, 'min_weight_fraction_leaf': 0.01, 'max_leaf_nodes': 100, 'bootstrap': False, 'ccp_alpha': 0.233}. Best is trial 0 with value: -12.658328488746386.
[I 2025-04-15 23:03:47,916] Trial 5 finished with value: -18.16855413152357 and parameters: {'n_estimators': 2647, 'min_samples_split': 39, 'max_features': 0.6900000000000001, 'min_samples_leaf': 49, 'criterion': 'squared_error', 'max_depth': None, 'min_weight_fraction_leaf': 0.02, 'max_leaf_nodes': 10, 'bootstrap': True, 'ccp_alpha': 0.197, 'max_samples': 0.5}. Best is trial 0 with value: -12.658328488746386.
[I 2025-04-15 23:03:57,364] Trial 6 finished with value: -17.64029104206826 and parameters: {'n_estimators': 7453, 'min_samples_split': 58, 'max_features': 0.26, 'min_samples_leaf': 33, 'criterion': 'poisson', 'max_depth': None, 'min_weight_fraction_leaf': 0.06, 'max_leaf_nodes': None, 'bootstrap': True, 'ccp_alpha': 0.217, 'max_samples': 0.75}. Best is trial 0 with value: -12.658328488746386.
[I 2025-04-15 23:04:03,643] Trial 7 finished with value: -17.528986382271352 and parameters: {'n_estimators': 6076, 'min_samples_split': 34, 'max_features': 0.24000000000000002, 'min_samples_leaf': 55, 'criterion': 'friedman_mse', 'max_depth': 30, 'min_weight_fraction_leaf': 0.04, 'max_leaf_nodes': 50, 'bootstrap': False, 'ccp_alpha': 0.254}. Best is trial 0 with value: -12.658328488746386.
[I 2025-04-15 23:04:14,880] Trial 8 finished with value: -18.020538742001627 and parameters: {'n_estimators': 1193, 'min_samples_split': 82, 'max_features': 0.35000000000000003, 'min_samples_leaf': 9, 'criterion': 'friedman_mse', 'max_depth': 15, 'min_weight_fraction_leaf': 0.09, 'max_leaf_nodes': 10, 'bootstrap': True, 'ccp_alpha': 0.262, 'max_samples': 1.0}. Best is trial 0 with value: -12.658328488746386.
[I 2025-04-15 23:04:19,552] Trial 9 finished with value: -18.028194486448907 and parameters: {'n_estimators': 2646, 'min_samples_split': 125, 'max_features': 0.08, 'min_samples_leaf': 58, 'criterion': 'poisson', 'max_depth': 15, 'min_weight_fraction_leaf': 0.1, 'max_leaf_nodes': 100, 'bootstrap': True, 'ccp_alpha': 0.17200000000000001, 'max_samples': 1.0}. Best is trial 0 with value: -12.658328488746386.
[I 2025-04-15 23:04:22,426] Trial 10 finished with value: -17.5289863822749 and parameters: {'n_estimators': 151, 'min_samples_split': 9, 'max_features': 1.0, 'min_samples_leaf': 89, 'criterion': 'squared_error', 'max_depth': 45, 'min_weight_fraction_leaf': 0.04, 'max_leaf_nodes': None, 'bootstrap': False, 'ccp_alpha': 0.001}. Best is trial 0 with value: -12.658328488746386.
[I 2025-04-15 23:04:30,194] Trial 11 finished with value: -0.1936417107583833 and parameters: {'n_estimators': 6507, 'min_samples_split': 8, 'max_features': 0.01, 'min_samples_leaf': 76, 'criterion': 'absolute_error', 'max_depth': 60, 'min_weight_fraction_leaf': 0.04, 'max_leaf_nodes': 50, 'bootstrap': False, 'ccp_alpha': 0.093}. Best is trial 11 with value: -0.1936417107583833.
[I 2025-04-15 23:04:50,930] Trial 12 finished with value: -0.1936417107583833 and parameters: {'n_estimators': 9707, 'min_samples_split': 5, 'max_features': 0.9400000000000001, 'min_samples_leaf': 90, 'criterion': 'absolute_error', 'max_depth': 60, 'min_weight_fraction_leaf': 0.0, 'max_leaf_nodes': 20, 'bootstrap': False, 'ccp_alpha': 0.004}. Best is trial 11 with value: -0.1936417107583833.
[I 2025-04-15 23:04:58,265] Trial 13 finished with value: -0.1936417107583833 and parameters: {'n_estimators': 9781, 'min_samples_split': 89, 'max_features': 0.01, 'min_samples_leaf': 100, 'criterion': 'absolute_error', 'max_depth': 60, 'min_weight_fraction_leaf': 0.04, 'max_leaf_nodes': 20, 'bootstrap': False, 'ccp_alpha': 0.083}. Best is trial 11 with value: -0.1936417107583833.
[I 2025-04-15 23:05:05,751] Trial 14 finished with value: -0.1936417107583833 and parameters: {'n_estimators': 9525, 'min_samples_split': 27, 'max_features': 0.48000000000000004, 'min_samples_leaf': 77, 'criterion': 'absolute_error', 'max_depth': 60, 'min_weight_fraction_leaf': 0.06, 'max_leaf_nodes': 20, 'bootstrap': False, 'ccp_alpha': 0.07100000000000001}. Best is trial 11 with value: -0.1936417107583833.
[I 2025-04-15 23:05:11,316] Trial 15 finished with value: -0.1936417107583833 and parameters: {'n_estimators': 7747, 'min_samples_split': 64, 'max_features': 0.8200000000000001, 'min_samples_leaf': 78, 'criterion': 'absolute_error', 'max_depth': 10, 'min_weight_fraction_leaf': 0.08, 'max_leaf_nodes': 50, 'bootstrap': False, 'ccp_alpha': 0.05}. Best is trial 11 with value: -0.1936417107583833.
[I 2025-04-15 23:05:18,230] Trial 16 finished with value: -0.1936417107583833 and parameters: {'n_estimators': 8647, 'min_samples_split': 18, 'max_features': 0.46, 'min_samples_leaf': 71, 'criterion': 'absolute_error', 'max_depth': 5, 'min_weight_fraction_leaf': 0.03, 'max_leaf_nodes': 50, 'bootstrap': False, 'ccp_alpha': 0.12}. Best is trial 11 with value: -0.1936417107583833.
[I 2025-04-15 23:05:23,443] Trial 17 finished with value: -0.1936417107583833 and parameters: {'n_estimators': 6562, 'min_samples_split': 114, 'max_features': 0.86, 'min_samples_leaf': 93, 'criterion': 'absolute_error', 'max_depth': 60, 'min_weight_fraction_leaf': 0.0, 'max_leaf_nodes': 20, 'bootstrap': False, 'ccp_alpha': 0.037}. Best is trial 11 with value: -0.1936417107583833.
[I 2025-04-15 23:05:26,233] Trial 18 finished with value: -0.1936417107583833 and parameters: {'n_estimators': 3855, 'min_samples_split': 2, 'max_features': 0.13, 'min_samples_leaf': 86, 'criterion': 'absolute_error', 'max_depth': 60, 'min_weight_fraction_leaf': 0.07, 'max_leaf_nodes': 150, 'bootstrap': False, 'ccp_alpha': 0.129}. Best is trial 11 with value: -0.1936417107583833.
[I 2025-04-15 23:05:31,095] Trial 19 finished with value: -0.1936417107583833 and parameters: {'n_estimators': 6582, 'min_samples_split': 190, 'max_features': 0.4, 'min_samples_leaf': 43, 'criterion': 'absolute_error', 'max_depth': 60, 'min_weight_fraction_leaf': 0.03, 'max_leaf_nodes': 20, 'bootstrap': False, 'ccp_alpha': 0.034}. Best is trial 11 with value: -0.1936417107583833.
[I 2025-04-15 23:05:37,555] Trial 20 finished with value: -0.1936417107583833 and parameters: {'n_estimators': 8737, 'min_samples_split': 46, 'max_features': 0.59, 'min_samples_leaf': 68, 'criterion': 'absolute_error', 'max_depth': 45, 'min_weight_fraction_leaf': 0.05, 'max_leaf_nodes': 50, 'bootstrap': False, 'ccp_alpha': 0.134}. Best is trial 11 with value: -0.1936417107583833.
[I 2025-04-15 23:05:45,244] Trial 21 finished with value: -0.1936417107583833 and parameters: {'n_estimators': 9907, 'min_samples_split': 89, 'max_features': 0.01, 'min_samples_leaf': 99, 'criterion': 'absolute_error', 'max_depth': 60, 'min_weight_fraction_leaf': 0.04, 'max_leaf_nodes': 20, 'bootstrap': False, 'ccp_alpha': 0.098}. Best is trial 11 with value: -0.1936417107583833.
[I 2025-04-15 23:05:51,747] Trial 22 finished with value: -0.1936417107583833 and parameters: {'n_estimators': 8947, 'min_samples_split': 74, 'max_features': 0.11, 'min_samples_leaf': 100, 'criterion': 'absolute_error', 'max_depth': 60, 'min_weight_fraction_leaf': 0.05, 'max_leaf_nodes': 20, 'bootstrap': False, 'ccp_alpha': 0.081}. Best is trial 11 with value: -0.1936417107583833.
[I 2025-04-15 23:05:59,980] Trial 23 finished with value: -0.1936417107583833 and parameters: {'n_estimators': 9775, 'min_samples_split': 165, 'max_features': 0.18000000000000002, 'min_samples_leaf': 83, 'criterion': 'absolute_error', 'max_depth': 60, 'min_weight_fraction_leaf': 0.03, 'max_leaf_nodes': 20, 'bootstrap': False, 'ccp_alpha': 0.067}. Best is trial 11 with value: -0.1936417107583833.
[I 2025-04-15 23:06:03,617] Trial 24 finished with value: -0.1936417107583833 and parameters: {'n_estimators': 4116, 'min_samples_split': 97, 'max_features': 0.03, 'min_samples_leaf': 93, 'criterion': 'absolute_error', 'max_depth': 10, 'min_weight_fraction_leaf': 0.02, 'max_leaf_nodes': 20, 'bootstrap': False, 'ccp_alpha': 0.107}. Best is trial 11 with value: -0.1936417107583833.
[I 2025-04-15 23:06:10,533] Trial 25 finished with value: -0.1936417107583833 and parameters: {'n_estimators': 8414, 'min_samples_split': 22, 'max_features': 0.16, 'min_samples_leaf': 79, 'criterion': 'absolute_error', 'max_depth': 20, 'min_weight_fraction_leaf': 0.07, 'max_leaf_nodes': 50, 'bootstrap': False, 'ccp_alpha': 0.026000000000000002}. Best is trial 11 with value: -0.1936417107583833.
[I 2025-04-15 23:06:16,070] Trial 26 finished with value: -0.1936417107583833 and parameters: {'n_estimators': 7106, 'min_samples_split': 120, 'max_features': 0.87, 'min_samples_leaf': 71, 'criterion': 'absolute_error', 'max_depth': 5, 'min_weight_fraction_leaf': 0.01, 'max_leaf_nodes': 20, 'bootstrap': False, 'ccp_alpha': 0.154}. Best is trial 11 with value: -0.1936417107583833.
[I 2025-04-15 23:06:20,965] Trial 27 finished with value: -0.1936417107583833 and parameters: {'n_estimators': 6008, 'min_samples_split': 48, 'max_features': 0.5800000000000001, 'min_samples_leaf': 92, 'criterion': 'absolute_error', 'max_depth': 60, 'min_weight_fraction_leaf': 0.04, 'max_leaf_nodes': 10, 'bootstrap': False, 'ccp_alpha': 0.056}. Best is trial 11 with value: -0.1936417107583833.
[I 2025-04-15 23:06:27,528] Trial 28 finished with value: -17.528986382269583 and parameters: {'n_estimators': 9244, 'min_samples_split': 16, 'max_features': 0.060000000000000005, 'min_samples_leaf': 84, 'criterion': 'squared_error', 'max_depth': 60, 'min_weight_fraction_leaf': 0.05, 'max_leaf_nodes': 100, 'bootstrap': False, 'ccp_alpha': 0.019}. Best is trial 11 with value: -0.1936417107583833.
[I 2025-04-15 23:06:33,599] Trial 29 finished with value: -17.52898638227 and parameters: {'n_estimators': 8243, 'min_samples_split': 3, 'max_features': 0.93, 'min_samples_leaf': 93, 'criterion': 'poisson', 'max_depth': 60, 'min_weight_fraction_leaf': 0.0, 'max_leaf_nodes': 300, 'bootstrap': False, 'ccp_alpha': 0.001}. Best is trial 11 with value: -0.1936417107583833.
[I 2025-04-15 23:06:38,978] Trial 30 finished with value: -0.1936417107583833 and parameters: {'n_estimators': 7071, 'min_samples_split': 67, 'max_features': 0.33, 'min_samples_leaf': 100, 'criterion': 'absolute_error', 'max_depth': 60, 'min_weight_fraction_leaf': 0.03, 'max_leaf_nodes': 150, 'bootstrap': False, 'ccp_alpha': 0.084}. Best is trial 11 with value: -0.1936417107583833.
[I 2025-04-15 23:06:46,108] Trial 31 finished with value: -0.1936417107583833 and parameters: {'n_estimators': 9376, 'min_samples_split': 28, 'max_features': 0.74, 'min_samples_leaf': 77, 'criterion': 'absolute_error', 'max_depth': 60, 'min_weight_fraction_leaf': 0.06, 'max_leaf_nodes': 20, 'bootstrap': False, 'ccp_alpha': 0.069}. Best is trial 11 with value: -0.1936417107583833.
[I 2025-04-15 23:06:53,980] Trial 32 finished with value: -0.1936417107583833 and parameters: {'n_estimators': 9932, 'min_samples_split': 31, 'max_features': 0.5, 'min_samples_leaf': 75, 'criterion': 'absolute_error', 'max_depth': 60, 'min_weight_fraction_leaf': 0.07, 'max_leaf_nodes': 20, 'bootstrap': False, 'ccp_alpha': 0.114}. Best is trial 11 with value: -0.1936417107583833.
[I 2025-04-15 23:07:00,758] Trial 33 finished with value: -0.1936417107583833 and parameters: {'n_estimators': 9030, 'min_samples_split': 19, 'max_features': 0.65, 'min_samples_leaf': 64, 'criterion': 'absolute_error', 'max_depth': 60, 'min_weight_fraction_leaf': 0.06, 'max_leaf_nodes': 20, 'bootstrap': False, 'ccp_alpha': 0.048}. Best is trial 11 with value: -0.1936417107583833.
[I 2025-04-15 23:07:07,213] Trial 34 finished with value: -17.528986382269515 and parameters: {'n_estimators': 9426, 'min_samples_split': 12, 'max_features': 0.41000000000000003, 'min_samples_leaf': 83, 'criterion': 'squared_error', 'max_depth': 20, 'min_weight_fraction_leaf': 0.05, 'max_leaf_nodes': 20, 'bootstrap': False, 'ccp_alpha': 0.149}. Best is trial 11 with value: -0.1936417107583833.
[I 2025-04-15 23:07:13,518] Trial 35 finished with value: -0.1936417107583833 and parameters: {'n_estimators': 8274, 'min_samples_split': 42, 'max_features': 0.77, 'min_samples_leaf': 88, 'criterion': 'absolute_error', 'max_depth': 10, 'min_weight_fraction_leaf': 0.08, 'max_leaf_nodes': 300, 'bootstrap': False, 'ccp_alpha': 0.07}. Best is trial 11 with value: -0.1936417107583833.
[I 2025-04-15 23:07:18,094] Trial 36 finished with value: -17.74823979923257 and parameters: {'n_estimators': 4713, 'min_samples_split': 152, 'max_features': 0.19, 'min_samples_leaf': 63, 'criterion': 'poisson', 'max_depth': 30, 'min_weight_fraction_leaf': 0.02, 'max_leaf_nodes': None, 'bootstrap': True, 'ccp_alpha': 0.018000000000000002, 'max_samples': None}. Best is trial 11 with value: -0.1936417107583833.
[I 2025-04-15 23:07:24,117] Trial 37 finished with value: -17.528986382270137 and parameters: {'n_estimators': 7940, 'min_samples_split': 53, 'max_features': 0.3, 'min_samples_leaf': 43, 'criterion': 'friedman_mse', 'max_depth': None, 'min_weight_fraction_leaf': 0.0, 'max_leaf_nodes': 50, 'bootstrap': False, 'ccp_alpha': 0.096}. Best is trial 11 with value: -0.1936417107583833.
[I 2025-04-15 23:07:30,131] Trial 38 finished with value: -0.19130570172704764 and parameters: {'n_estimators': 5585, 'min_samples_split': 107, 'max_features': 0.01, 'min_samples_leaf': 96, 'criterion': 'absolute_error', 'max_depth': 5, 'min_weight_fraction_leaf': 0.01, 'max_leaf_nodes': 150, 'bootstrap': True, 'ccp_alpha': 0.297, 'max_samples': 0.75}. Best is trial 38 with value: -0.19130570172704764.
[I 2025-04-15 23:07:35,349] Trial 39 finished with value: -17.80252200531684 and parameters: {'n_estimators': 5327, 'min_samples_split': 112, 'max_features': 0.08, 'min_samples_leaf': 97, 'criterion': 'squared_error', 'max_depth': 5, 'min_weight_fraction_leaf': 0.01, 'max_leaf_nodes': 150, 'bootstrap': True, 'ccp_alpha': 0.294, 'max_samples': 0.75}. Best is trial 38 with value: -0.19130570172704764.
[I 2025-04-15 23:07:38,758] Trial 40 finished with value: -17.9082413570488 and parameters: {'n_estimators': 3503, 'min_samples_split': 135, 'max_features': 0.2, 'min_samples_leaf': 95, 'criterion': 'friedman_mse', 'max_depth': 5, 'min_weight_fraction_leaf': 0.01, 'max_leaf_nodes': 150, 'bootstrap': True, 'ccp_alpha': 0.199, 'max_samples': 0.75}. Best is trial 38 with value: -0.19130570172704764.
[I 2025-04-15 23:07:45,144] Trial 41 finished with value: -0.19135098511661536 and parameters: {'n_estimators': 5723, 'min_samples_split': 102, 'max_features': 0.01, 'min_samples_leaf': 90, 'criterion': 'absolute_error', 'max_depth': 5, 'min_weight_fraction_leaf': 0.02, 'max_leaf_nodes': 150, 'bootstrap': True, 'ccp_alpha': 0.163, 'max_samples': 0.75}. Best is trial 38 with value: -0.19130570172704764.
[I 2025-04-15 23:07:50,766] Trial 42 finished with value: -0.19146004312504047 and parameters: {'n_estimators': 4849, 'min_samples_split': 104, 'max_features': 0.01, 'min_samples_leaf': 90, 'criterion': 'absolute_error', 'max_depth': 5, 'min_weight_fraction_leaf': 0.02, 'max_leaf_nodes': 150, 'bootstrap': True, 'ccp_alpha': 0.241, 'max_samples': 0.75}. Best is trial 38 with value: -0.19130570172704764.
[I 2025-04-15 23:07:57,053] Trial 43 finished with value: -0.19132895607524664 and parameters: {'n_estimators': 5662, 'min_samples_split': 105, 'max_features': 0.12, 'min_samples_leaf': 87, 'criterion': 'absolute_error', 'max_depth': 5, 'min_weight_fraction_leaf': 0.02, 'max_leaf_nodes': 150, 'bootstrap': True, 'ccp_alpha': 0.234, 'max_samples': 0.75}. Best is trial 38 with value: -0.19130570172704764.
[I 2025-04-15 23:08:03,863] Trial 44 finished with value: -0.19122030243350432 and parameters: {'n_estimators': 5886, 'min_samples_split': 104, 'max_features': 0.13, 'min_samples_leaf': 83, 'criterion': 'absolute_error', 'max_depth': 5, 'min_weight_fraction_leaf': 0.02, 'max_leaf_nodes': 150, 'bootstrap': True, 'ccp_alpha': 0.23900000000000002, 'max_samples': 0.75}. Best is trial 44 with value: -0.19122030243350432.
[I 2025-04-15 23:08:09,928] Trial 45 finished with value: -17.684879782704456 and parameters: {'n_estimators': 5803, 'min_samples_split': 103, 'max_features': 0.12, 'min_samples_leaf': 87, 'criterion': 'poisson', 'max_depth': 5, 'min_weight_fraction_leaf': 0.02, 'max_leaf_nodes': 150, 'bootstrap': True, 'ccp_alpha': 0.23900000000000002, 'max_samples': 0.75}. Best is trial 44 with value: -0.19122030243350432.
[I 2025-04-15 23:08:15,340] Trial 46 finished with value: -0.19147819507672798 and parameters: {'n_estimators': 4726, 'min_samples_split': 104, 'max_features': 0.060000000000000005, 'min_samples_leaf': 24, 'criterion': 'absolute_error', 'max_depth': 5, 'min_weight_fraction_leaf': 0.01, 'max_leaf_nodes': 150, 'bootstrap': True, 'ccp_alpha': 0.267, 'max_samples': 0.75}. Best is trial 44 with value: -0.19122030243350432.
[I 2025-04-15 23:08:20,793] Trial 47 finished with value: -17.747862290361702 and parameters: {'n_estimators': 5453, 'min_samples_split': 128, 'max_features': 0.25, 'min_samples_leaf': 81, 'criterion': 'friedman_mse', 'max_depth': 5, 'min_weight_fraction_leaf': 0.02, 'max_leaf_nodes': 150, 'bootstrap': True, 'ccp_alpha': 0.3, 'max_samples': 0.75}. Best is trial 44 with value: -0.19122030243350432.
[I 2025-04-15 23:08:26,126] Trial 48 finished with value: -0.1914768205929483 and parameters: {'n_estimators': 4833, 'min_samples_split': 80, 'max_features': 0.14, 'min_samples_leaf': 90, 'criterion': 'absolute_error', 'max_depth': 5, 'min_weight_fraction_leaf': 0.02, 'max_leaf_nodes': 150, 'bootstrap': True, 'ccp_alpha': 0.224, 'max_samples': 0.75}. Best is trial 44 with value: -0.19122030243350432.
[I 2025-04-15 23:08:29,588] Trial 49 finished with value: -0.1909113797321708 and parameters: {'n_estimators': 3149, 'min_samples_split': 96, 'max_features': 0.09, 'min_samples_leaf': 72, 'criterion': 'absolute_error', 'max_depth': 5, 'min_weight_fraction_leaf': 0.03, 'max_leaf_nodes': 150, 'bootstrap': True, 'ccp_alpha': 0.247, 'max_samples': 0.75}. Best is trial 49 with value: -0.1909113797321708.
[I 2025-04-15 23:08:32,286] Trial 50 finished with value: -0.19138128186744763 and parameters: {'n_estimators': 2139, 'min_samples_split': 93, 'max_features': 0.09, 'min_samples_leaf': 73, 'criterion': 'absolute_error', 'max_depth': 5, 'min_weight_fraction_leaf': 0.03, 'max_leaf_nodes': 150, 'bootstrap': True, 'ccp_alpha': 0.28400000000000003, 'max_samples': 0.75}. Best is trial 49 with value: -0.1909113797321708.
[I 2025-04-15 23:08:34,573] Trial 51 finished with value: -0.19131091875821035 and parameters: {'n_estimators': 2017, 'min_samples_split': 93, 'max_features': 0.06999999999999999, 'min_samples_leaf': 71, 'criterion': 'absolute_error', 'max_depth': 5, 'min_weight_fraction_leaf': 0.03, 'max_leaf_nodes': 150, 'bootstrap': True, 'ccp_alpha': 0.28400000000000003, 'max_samples': 0.75}. Best is trial 49 with value: -0.1909113797321708.
[I 2025-04-15 23:08:36,699] Trial 52 finished with value: -0.19166712546718218 and parameters: {'n_estimators': 1761, 'min_samples_split': 112, 'max_features': 0.21000000000000002, 'min_samples_leaf': 64, 'criterion': 'absolute_error', 'max_depth': 5, 'min_weight_fraction_leaf': 0.03, 'max_leaf_nodes': 150, 'bootstrap': True, 'ccp_alpha': 0.252, 'max_samples': 0.75}. Best is trial 49 with value: -0.1909113797321708.
[I 2025-04-15 23:08:40,440] Trial 53 finished with value: -0.19113124868660653 and parameters: {'n_estimators': 3444, 'min_samples_split': 80, 'max_features': 0.04, 'min_samples_leaf': 49, 'criterion': 'absolute_error', 'max_depth': 15, 'min_weight_fraction_leaf': 0.01, 'max_leaf_nodes': 150, 'bootstrap': True, 'ccp_alpha': 0.28, 'max_samples': 0.75}. Best is trial 49 with value: -0.1909113797321708.
[I 2025-04-15 23:08:43,884] Trial 54 finished with value: -0.19092290485999977 and parameters: {'n_estimators': 3041, 'min_samples_split': 80, 'max_features': 0.060000000000000005, 'min_samples_leaf': 53, 'criterion': 'absolute_error', 'max_depth': 15, 'min_weight_fraction_leaf': 0.01, 'max_leaf_nodes': 150, 'bootstrap': True, 'ccp_alpha': 0.274, 'max_samples': 0.75}. Best is trial 49 with value: -0.1909113797321708.
