[I 2025-04-15 23:41:13,845] Trial 639 finished with value: -0.1857725031205808 and parameters: {'n_estimators': 659, 'min_samples_split': 25, 'max_features': 0.33, 'min_samples_leaf': 31, 'criterion': 'absolute_error', 'max_depth': 45, 'min_weight_fraction_leaf': 0.01, 'max_leaf_nodes': 100, 'bootstrap': True, 'ccp_alpha': 0.057, 'max_samples': 0.5}. Best is trial 621 with value: -0.18112741123578058.
[I 2025-04-15 23:41:14,375] Trial 640 finished with value: -0.19112184766316073 and parameters: {'n_estimators': 347, 'min_samples_split': 13, 'max_features': 0.23, 'min_samples_leaf': 30, 'criterion': 'absolute_error', 'max_depth': 45, 'min_weight_fraction_leaf': 0.07, 'max_leaf_nodes': 100, 'bootstrap': True, 'ccp_alpha': 0.054, 'max_samples': 0.75}. Best is trial 621 with value: -0.18112741123578058.
[I 2025-04-15 23:41:14,796] Trial 641 finished with value: -19.374574488055803 and parameters: {'n_estimators': 286, 'min_samples_split': 24, 'max_features': 0.25, 'min_samples_leaf': 35, 'criterion': 'poisson', 'max_depth': 45, 'min_weight_fraction_leaf': 0.01, 'max_leaf_nodes': 150, 'bootstrap': True, 'ccp_alpha': 0.059000000000000004, 'max_samples': 0.5}. Best is trial 621 with value: -0.18112741123578058.
[I 2025-04-15 23:41:15,151] Trial 642 finished with value: -0.18579406080266958 and parameters: {'n_estimators': 201, 'min_samples_split': 21, 'max_features': 0.31, 'min_samples_leaf': 32, 'criterion': 'absolute_error', 'max_depth': 45, 'min_weight_fraction_leaf': 0.01, 'max_leaf_nodes': 100, 'bootstrap': True, 'ccp_alpha': 0.067, 'max_samples': 0.5}. Best is trial 621 with value: -0.18112741123578058.
[I 2025-04-15 23:41:15,662] Trial 643 finished with value: -0.1936417107583833 and parameters: {'n_estimators': 463, 'min_samples_split': 26, 'max_features': 0.34, 'min_samples_leaf': 30, 'criterion': 'absolute_error', 'max_depth': 45, 'min_weight_fraction_leaf': 0.06, 'max_leaf_nodes': 100, 'bootstrap': False, 'ccp_alpha': 0.052000000000000005}. Best is trial 621 with value: -0.18112741123578058.
[I 2025-04-15 23:41:16,081] Trial 644 finished with value: -0.1849814219739771 and parameters: {'n_estimators': 176, 'min_samples_split': 16, 'max_features': 0.27, 'min_samples_leaf': 29, 'criterion': 'absolute_error', 'max_depth': 45, 'min_weight_fraction_leaf': 0.01, 'max_leaf_nodes': 100, 'bootstrap': True, 'ccp_alpha': 0.211, 'max_samples': 0.5}. Best is trial 621 with value: -0.18112741123578058.
[I 2025-04-15 23:41:16,801] Trial 645 finished with value: -0.18695023598616656 and parameters: {'n_estimators': 461, 'min_samples_split': 20, 'max_features': 0.37, 'min_samples_leaf': 33, 'criterion': 'absolute_error', 'max_depth': 45, 'min_weight_fraction_leaf': 0.01, 'max_leaf_nodes': 150, 'bootstrap': True, 'ccp_alpha': 0.2, 'max_samples': 0.5}. Best is trial 621 with value: -0.18112741123578058.
[I 2025-04-15 23:41:17,083] Trial 646 finished with value: -0.18251433104987633 and parameters: {'n_estimators': 127, 'min_samples_split': 28, 'max_features': 0.17, 'min_samples_leaf': 38, 'criterion': 'absolute_error', 'max_depth': 45, 'min_weight_fraction_leaf': 0.0, 'max_leaf_nodes': 50, 'bootstrap': True, 'ccp_alpha': 0.067, 'max_samples': 0.5}. Best is trial 621 with value: -0.18112741123578058.
[I 2025-04-15 23:41:17,425] Trial 647 finished with value: -0.18527688090619435 and parameters: {'n_estimators': 183, 'min_samples_split': 27, 'max_features': 0.29000000000000004, 'min_samples_leaf': 40, 'criterion': 'absolute_error', 'max_depth': 45, 'min_weight_fraction_leaf': 0.0, 'max_leaf_nodes': 50, 'bootstrap': True, 'ccp_alpha': 0.067, 'max_samples': 0.5}. Best is trial 621 with value: -0.18112741123578058.
[I 2025-04-15 23:41:18,736] Trial 648 finished with value: -0.18666195281162778 and parameters: {'n_estimators': 1176, 'min_samples_split': 24, 'max_features': 0.15000000000000002, 'min_samples_leaf': 38, 'criterion': 'absolute_error', 'max_depth': 45, 'min_weight_fraction_leaf': 0.0, 'max_leaf_nodes': 50, 'bootstrap': True, 'ccp_alpha': 0.063, 'max_samples': 0.5}. Best is trial 621 with value: -0.18112741123578058.
[I 2025-04-15 23:41:19,307] Trial 649 finished with value: -0.1883269143659021 and parameters: {'n_estimators': 397, 'min_samples_split': 28, 'max_features': 0.18000000000000002, 'min_samples_leaf': 39, 'criterion': 'absolute_error', 'max_depth': 45, 'min_weight_fraction_leaf': 0.0, 'max_leaf_nodes': 50, 'bootstrap': True, 'ccp_alpha': 0.07, 'max_samples': 0.5}. Best is trial 621 with value: -0.18112741123578058.
[I 2025-04-15 23:41:19,479] Trial 650 finished with value: -17.539682050862478 and parameters: {'n_estimators': 30, 'min_samples_split': 15, 'max_features': 0.11, 'min_samples_leaf': 36, 'criterion': 'friedman_mse', 'max_depth': 45, 'min_weight_fraction_leaf': 0.0, 'max_leaf_nodes': 50, 'bootstrap': True, 'ccp_alpha': 0.059000000000000004, 'max_samples': 0.5}. Best is trial 621 with value: -0.18112741123578058.
[I 2025-04-15 23:41:20,414] Trial 651 finished with value: -0.18591592251256084 and parameters: {'n_estimators': 686, 'min_samples_split': 29, 'max_features': 0.24000000000000002, 'min_samples_leaf': 36, 'criterion': 'absolute_error', 'max_depth': 45, 'min_weight_fraction_leaf': 0.0, 'max_leaf_nodes': 50, 'bootstrap': True, 'ccp_alpha': 0.046, 'max_samples': 0.5}. Best is trial 621 with value: -0.18112741123578058.
[I 2025-04-15 23:41:20,709] Trial 652 finished with value: -0.18265838061475376 and parameters: {'n_estimators': 129, 'min_samples_split': 21, 'max_features': 0.19, 'min_samples_leaf': 38, 'criterion': 'absolute_error', 'max_depth': 45, 'min_weight_fraction_leaf': 0.0, 'max_leaf_nodes': None, 'bootstrap': True, 'ccp_alpha': 0.07, 'max_samples': 0.5}. Best is trial 621 with value: -0.18112741123578058.
[I 2025-04-15 23:41:21,359] Trial 653 finished with value: -0.18704284294648588 and parameters: {'n_estimators': 468, 'min_samples_split': 23, 'max_features': 0.44, 'min_samples_leaf': 34, 'criterion': 'absolute_error', 'max_depth': 45, 'min_weight_fraction_leaf': 0.0, 'max_leaf_nodes': 50, 'bootstrap': True, 'ccp_alpha': 0.063, 'max_samples': 0.5}. Best is trial 621 with value: -0.18112741123578058.
[I 2025-04-15 23:41:21,817] Trial 654 finished with value: -0.1865408064457744 and parameters: {'n_estimators': 278, 'min_samples_split': 28, 'max_features': 0.41000000000000003, 'min_samples_leaf': 43, 'criterion': 'absolute_error', 'max_depth': 45, 'min_weight_fraction_leaf': 0.0, 'max_leaf_nodes': 50, 'bootstrap': True, 'ccp_alpha': 0.057, 'max_samples': 0.5}. Best is trial 621 with value: -0.18112741123578058.
[I 2025-04-15 23:41:21,999] Trial 655 finished with value: -0.19363846506332974 and parameters: {'n_estimators': 15, 'min_samples_split': 17, 'max_features': 0.26, 'min_samples_leaf': 32, 'criterion': 'absolute_error', 'max_depth': 45, 'min_weight_fraction_leaf': 0.0, 'max_leaf_nodes': 50, 'bootstrap': True, 'ccp_alpha': 0.05, 'max_samples': 0.5}. Best is trial 621 with value: -0.18112741123578058.
[I 2025-04-15 23:41:22,867] Trial 656 finished with value: -0.18571858487699258 and parameters: {'n_estimators': 654, 'min_samples_split': 24, 'max_features': 0.27, 'min_samples_leaf': 37, 'criterion': 'absolute_error', 'max_depth': 45, 'min_weight_fraction_leaf': 0.0, 'max_leaf_nodes': 50, 'bootstrap': True, 'ccp_alpha': 0.069, 'max_samples': 0.5}. Best is trial 621 with value: -0.18112741123578058.
[I 2025-04-15 23:41:23,285] Trial 657 finished with value: -0.19316642018582209 and parameters: {'n_estimators': 255, 'min_samples_split': 12, 'max_features': 0.23, 'min_samples_leaf': 28, 'criterion': 'absolute_error', 'max_depth': 45, 'min_weight_fraction_leaf': 0.0, 'max_leaf_nodes': 50, 'bootstrap': True, 'ccp_alpha': 0.28700000000000003, 'max_samples': None}. Best is trial 621 with value: -0.18112741123578058.
[I 2025-04-15 23:41:23,719] Trial 658 finished with value: -0.18629905739496047 and parameters: {'n_estimators': 268, 'min_samples_split': 29, 'max_features': 0.13, 'min_samples_leaf': 31, 'criterion': 'absolute_error', 'max_depth': 45, 'min_weight_fraction_leaf': 0.01, 'max_leaf_nodes': 300, 'bootstrap': True, 'ccp_alpha': 0.065, 'max_samples': 0.5}. Best is trial 621 with value: -0.18112741123578058.
[I 2025-04-15 23:41:23,880] Trial 659 finished with value: -16.627962788711812 and parameters: {'n_estimators': 13, 'min_samples_split': 24, 'max_features': 0.2, 'min_samples_leaf': 41, 'criterion': 'squared_error', 'max_depth': 20, 'min_weight_fraction_leaf': 0.01, 'max_leaf_nodes': 100, 'bootstrap': True, 'ccp_alpha': 0.059000000000000004, 'max_samples': 0.5}. Best is trial 621 with value: -0.18112741123578058.
[I 2025-04-15 23:41:24,508] Trial 660 finished with value: -0.18785308260518127 and parameters: {'n_estimators': 441, 'min_samples_split': 21, 'max_features': 0.19, 'min_samples_leaf': 33, 'criterion': 'absolute_error', 'max_depth': None, 'min_weight_fraction_leaf': 0.0, 'max_leaf_nodes': 100, 'bootstrap': True, 'ccp_alpha': 0.073, 'max_samples': 0.5}. Best is trial 621 with value: -0.18112741123578058.
[I 2025-04-15 23:41:24,673] Trial 661 finished with value: -0.19363780982859408 and parameters: {'n_estimators': 16, 'min_samples_split': 20, 'max_features': 0.26, 'min_samples_leaf': 35, 'criterion': 'absolute_error', 'max_depth': 45, 'min_weight_fraction_leaf': 0.01, 'max_leaf_nodes': 150, 'bootstrap': True, 'ccp_alpha': 0.049, 'max_samples': 0.5}. Best is trial 621 with value: -0.18112741123578058.
[I 2025-04-15 23:41:25,115] Trial 662 finished with value: -0.18708114903439635 and parameters: {'n_estimators': 303, 'min_samples_split': 143, 'max_features': 0.09999999999999999, 'min_samples_leaf': 30, 'criterion': 'absolute_error', 'max_depth': 60, 'min_weight_fraction_leaf': 0.01, 'max_leaf_nodes': 100, 'bootstrap': True, 'ccp_alpha': 0.065, 'max_samples': 0.5}. Best is trial 621 with value: -0.18112741123578058.
[I 2025-04-15 23:41:25,668] Trial 663 finished with value: -0.1936417107583833 and parameters: {'n_estimators': 515, 'min_samples_split': 29, 'max_features': 0.31, 'min_samples_leaf': 28, 'criterion': 'absolute_error', 'max_depth': 5, 'min_weight_fraction_leaf': 0.0, 'max_leaf_nodes': 50, 'bootstrap': False, 'ccp_alpha': 0.057}. Best is trial 621 with value: -0.18112741123578058.
[I 2025-04-15 23:41:26,735] Trial 664 finished with value: -0.18727917141109596 and parameters: {'n_estimators': 905, 'min_samples_split': 16, 'max_features': 0.34, 'min_samples_leaf': 34, 'criterion': 'absolute_error', 'max_depth': 45, 'min_weight_fraction_leaf': 0.06, 'max_leaf_nodes': 100, 'bootstrap': True, 'ccp_alpha': 0.07100000000000001, 'max_samples': 0.5}. Best is trial 621 with value: -0.18112741123578058.
[I 2025-04-15 23:41:27,183] Trial 665 finished with value: -0.19318398920684574 and parameters: {'n_estimators': 265, 'min_samples_split': 37, 'max_features': 0.29000000000000004, 'min_samples_leaf': 27, 'criterion': 'absolute_error', 'max_depth': 45, 'min_weight_fraction_leaf': 0.01, 'max_leaf_nodes': 100, 'bootstrap': True, 'ccp_alpha': 0.054, 'max_samples': 1.0}. Best is trial 621 with value: -0.18112741123578058.
[I 2025-04-15 23:41:27,487] Trial 666 finished with value: -0.18829394606897623 and parameters: {'n_estimators': 151, 'min_samples_split': 149, 'max_features': 0.15000000000000002, 'min_samples_leaf': 30, 'criterion': 'absolute_error', 'max_depth': 45, 'min_weight_fraction_leaf': 0.01, 'max_leaf_nodes': 150, 'bootstrap': True, 'ccp_alpha': 0.062, 'max_samples': 0.75}. Best is trial 621 with value: -0.18112741123578058.
[I 2025-04-15 23:41:28,326] Trial 667 finished with value: -0.18570770986266066 and parameters: {'n_estimators': 653, 'min_samples_split': 191, 'max_features': 0.36000000000000004, 'min_samples_leaf': 28, 'criterion': 'absolute_error', 'max_depth': 20, 'min_weight_fraction_leaf': 0.01, 'max_leaf_nodes': 100, 'bootstrap': True, 'ccp_alpha': 0.042, 'max_samples': 0.5}. Best is trial 621 with value: -0.18112741123578058.
[I 2025-04-15 23:41:28,497] Trial 668 finished with value: -17.610167997033415 and parameters: {'n_estimators': 22, 'min_samples_split': 189, 'max_features': 0.16, 'min_samples_leaf': 32, 'criterion': 'poisson', 'max_depth': None, 'min_weight_fraction_leaf': 0.05, 'max_leaf_nodes': 100, 'bootstrap': True, 'ccp_alpha': 0.23600000000000002, 'max_samples': 0.5}. Best is trial 621 with value: -0.18112741123578058.
[I 2025-04-15 23:41:29,090] Trial 669 finished with value: -0.1884898030692473 and parameters: {'n_estimators': 426, 'min_samples_split': 31, 'max_features': 0.22, 'min_samples_leaf': 27, 'criterion': 'absolute_error', 'max_depth': 60, 'min_weight_fraction_leaf': 0.0, 'max_leaf_nodes': 50, 'bootstrap': True, 'ccp_alpha': 0.219, 'max_samples': 0.5}. Best is trial 621 with value: -0.18112741123578058.
[I 2025-04-15 23:41:29,467] Trial 670 finished with value: -0.1862085274187944 and parameters: {'n_estimators': 220, 'min_samples_split': 116, 'max_features': 0.75, 'min_samples_leaf': 30, 'criterion': 'absolute_error', 'max_depth': 5, 'min_weight_fraction_leaf': 0.01, 'max_leaf_nodes': 20, 'bootstrap': True, 'ccp_alpha': 0.191, 'max_samples': 0.5}. Best is trial 621 with value: -0.18112741123578058.
[I 2025-04-15 23:41:29,657] Trial 671 finished with value: -0.1936354417750235 and parameters: {'n_estimators': 39, 'min_samples_split': 18, 'max_features': 0.21000000000000002, 'min_samples_leaf': 38, 'criterion': 'absolute_error', 'max_depth': 45, 'min_weight_fraction_leaf': 0.01, 'max_leaf_nodes': 150, 'bootstrap': True, 'ccp_alpha': 0.036000000000000004, 'max_samples': 0.5}. Best is trial 621 with value: -0.18112741123578058.
[I 2025-04-15 23:41:30,290] Trial 672 finished with value: -0.18838937456935131 and parameters: {'n_estimators': 402, 'min_samples_split': 27, 'max_features': 0.78, 'min_samples_leaf': 32, 'criterion': 'absolute_error', 'max_depth': 45, 'min_weight_fraction_leaf': 0.0, 'max_leaf_nodes': 100, 'bootstrap': True, 'ccp_alpha': 0.077, 'max_samples': 0.5}. Best is trial 621 with value: -0.18112741123578058.
[I 2025-04-15 23:41:30,454] Trial 673 finished with value: -0.19363718282020428 and parameters: {'n_estimators': 11, 'min_samples_split': 42, 'max_features': 0.18000000000000002, 'min_samples_leaf': 35, 'criterion': 'absolute_error', 'max_depth': 45, 'min_weight_fraction_leaf': 0.01, 'max_leaf_nodes': None, 'bootstrap': True, 'ccp_alpha': 0.073, 'max_samples': 0.5}. Best is trial 621 with value: -0.18112741123578058.
[I 2025-04-15 23:41:30,717] Trial 674 finished with value: -21.396523684501226 and parameters: {'n_estimators': 98, 'min_samples_split': 182, 'max_features': 0.8, 'min_samples_leaf': 27, 'criterion': 'friedman_mse', 'max_depth': 20, 'min_weight_fraction_leaf': 0.01, 'max_leaf_nodes': 100, 'bootstrap': True, 'ccp_alpha': 0.083, 'max_samples': 0.5}. Best is trial 621 with value: -0.18112741123578058.
[I 2025-04-15 23:41:31,150] Trial 675 finished with value: -0.18670837839940999 and parameters: {'n_estimators': 255, 'min_samples_split': 49, 'max_features': 0.21000000000000002, 'min_samples_leaf': 29, 'criterion': 'absolute_error', 'max_depth': 45, 'min_weight_fraction_leaf': 0.0, 'max_leaf_nodes': 100, 'bootstrap': True, 'ccp_alpha': 0.066, 'max_samples': 0.5}. Best is trial 621 with value: -0.18112741123578058.
[I 2025-04-15 23:41:31,904] Trial 676 finished with value: -0.18688151110461648 and parameters: {'n_estimators': 545, 'min_samples_split': 46, 'max_features': 0.33, 'min_samples_leaf': 31, 'criterion': 'absolute_error', 'max_depth': 5, 'min_weight_fraction_leaf': 0.07, 'max_leaf_nodes': 150, 'bootstrap': True, 'ccp_alpha': 0.052000000000000005, 'max_samples': 0.5}. Best is trial 621 with value: -0.18112741123578058.
[I 2025-04-15 23:41:32,403] Trial 677 finished with value: -0.18749336070187878 and parameters: {'n_estimators': 325, 'min_samples_split': 153, 'max_features': 0.73, 'min_samples_leaf': 26, 'criterion': 'absolute_error', 'max_depth': None, 'min_weight_fraction_leaf': 0.01, 'max_leaf_nodes': 100, 'bootstrap': True, 'ccp_alpha': 0.06, 'max_samples': 0.5}. Best is trial 621 with value: -0.18112741123578058.
[I 2025-04-15 23:41:32,823] Trial 678 finished with value: -0.18673535543637482 and parameters: {'n_estimators': 240, 'min_samples_split': 33, 'max_features': 0.77, 'min_samples_leaf': 34, 'criterion': 'absolute_error', 'max_depth': 60, 'min_weight_fraction_leaf': 0.06, 'max_leaf_nodes': 50, 'bootstrap': True, 'ccp_alpha': 0.07, 'max_samples': 0.5}. Best is trial 621 with value: -0.18112741123578058.
[I 2025-04-15 23:41:33,767] Trial 679 finished with value: -0.18619879021499885 and parameters: {'n_estimators': 746, 'min_samples_split': 187, 'max_features': 0.79, 'min_samples_leaf': 28, 'criterion': 'absolute_error', 'max_depth': 45, 'min_weight_fraction_leaf': 0.01, 'max_leaf_nodes': 100, 'bootstrap': True, 'ccp_alpha': 0.077, 'max_samples': 0.5}. Best is trial 621 with value: -0.18112741123578058.
[I 2025-04-15 23:41:34,417] Trial 680 finished with value: -0.18819746939383153 and parameters: {'n_estimators': 387, 'min_samples_split': 38, 'max_features': 0.08, 'min_samples_leaf': 30, 'criterion': 'absolute_error', 'max_depth': 45, 'min_weight_fraction_leaf': 0.0, 'max_leaf_nodes': 150, 'bootstrap': True, 'ccp_alpha': 0.047, 'max_samples': 0.5}. Best is trial 621 with value: -0.18112741123578058.
[I 2025-04-15 23:41:35,096] Trial 681 finished with value: -0.18827481228713538 and parameters: {'n_estimators': 408, 'min_samples_split': 25, 'max_features': 0.59, 'min_samples_leaf': 42, 'criterion': 'absolute_error', 'max_depth': 30, 'min_weight_fraction_leaf': 0.05, 'max_leaf_nodes': 100, 'bootstrap': True, 'ccp_alpha': 0.085, 'max_samples': 0.5}. Best is trial 621 with value: -0.18112741123578058.
[I 2025-04-15 23:41:35,846] Trial 682 finished with value: -0.19340424908205134 and parameters: {'n_estimators': 514, 'min_samples_split': 22, 'max_features': 0.8200000000000001, 'min_samples_leaf': 26, 'criterion': 'absolute_error', 'max_depth': 45, 'min_weight_fraction_leaf': 0.01, 'max_leaf_nodes': 100, 'bootstrap': True, 'ccp_alpha': 0.067, 'max_samples': None}. Best is trial 621 with value: -0.18112741123578058.
[I 2025-04-15 23:41:41,198] Trial 683 finished with value: -17.528986382270308 and parameters: {'n_estimators': 7616, 'min_samples_split': 179, 'max_features': 0.51, 'min_samples_leaf': 32, 'criterion': 'squared_error', 'max_depth': 30, 'min_weight_fraction_leaf': 0.0, 'max_leaf_nodes': 50, 'bootstrap': False, 'ccp_alpha': 0.056}. Best is trial 621 with value: -0.18112741123578058.
[I 2025-04-15 23:41:42,340] Trial 684 finished with value: -0.1865729217346887 and parameters: {'n_estimators': 941, 'min_samples_split': 43, 'max_features': 0.17, 'min_samples_leaf': 36, 'criterion': 'absolute_error', 'max_depth': 20, 'min_weight_fraction_leaf': 0.01, 'max_leaf_nodes': 150, 'bootstrap': True, 'ccp_alpha': 0.08, 'max_samples': 0.5}. Best is trial 621 with value: -0.18112741123578058.
[I 2025-04-15 23:41:42,537] Trial 685 finished with value: -0.19363486068152286 and parameters: {'n_estimators': 41, 'min_samples_split': 31, 'max_features': 0.42000000000000004, 'min_samples_leaf': 29, 'criterion': 'absolute_error', 'max_depth': 45, 'min_weight_fraction_leaf': 0.02, 'max_leaf_nodes': 300, 'bootstrap': True, 'ccp_alpha': 0.091, 'max_samples': 0.5}. Best is trial 621 with value: -0.18112741123578058.
[I 2025-04-15 23:41:42,678] Trial 686 finished with value: -0.1936179286822098 and parameters: {'n_estimators': 1, 'min_samples_split': 13, 'max_features': 0.55, 'min_samples_leaf': 5, 'criterion': 'absolute_error', 'max_depth': None, 'min_weight_fraction_leaf': 0.02, 'max_leaf_nodes': 100, 'bootstrap': True, 'ccp_alpha': 0.06, 'max_samples': 0.5}. Best is trial 621 with value: -0.18112741123578058.
[I 2025-04-15 23:41:50,636] Trial 687 finished with value: -0.18429800297153648 and parameters: {'n_estimators': 7171, 'min_samples_split': 56, 'max_features': 0.28, 'min_samples_leaf': 26, 'criterion': 'absolute_error', 'max_depth': 60, 'min_weight_fraction_leaf': 0.01, 'max_leaf_nodes': None, 'bootstrap': True, 'ccp_alpha': 0.07100000000000001, 'max_samples': 0.5}. Best is trial 621 with value: -0.18112741123578058.
[I 2025-04-15 23:41:56,203] Trial 688 finished with value: -0.18371794394360821 and parameters: {'n_estimators': 4968, 'min_samples_split': 36, 'max_features': 0.25, 'min_samples_leaf': 65, 'criterion': 'absolute_error', 'max_depth': 30, 'min_weight_fraction_leaf': 0.06, 'max_leaf_nodes': 100, 'bootstrap': True, 'ccp_alpha': 0.063, 'max_samples': 0.5}. Best is trial 621 with value: -0.18112741123578058.
[I 2025-04-15 23:41:56,702] Trial 689 finished with value: -0.19323296167643686 and parameters: {'n_estimators': 297, 'min_samples_split': 182, 'max_features': 0.39, 'min_samples_leaf': 33, 'criterion': 'absolute_error', 'max_depth': 30, 'min_weight_fraction_leaf': 0.02, 'max_leaf_nodes': 100, 'bootstrap': True, 'ccp_alpha': 0.031, 'max_samples': 1.0}. Best is trial 621 with value: -0.18112741123578058.
[I 2025-04-15 23:41:57,058] Trial 690 finished with value: -0.1855011343820537 and parameters: {'n_estimators': 193, 'min_samples_split': 149, 'max_features': 0.81, 'min_samples_leaf': 29, 'criterion': 'absolute_error', 'max_depth': 5, 'min_weight_fraction_leaf': 0.02, 'max_leaf_nodes': 150, 'bootstrap': True, 'ccp_alpha': 0.085, 'max_samples': 0.5}. Best is trial 621 with value: -0.18112741123578058.
[I 2025-04-15 23:41:57,887] Trial 691 finished with value: -17.428603670016983 and parameters: {'n_estimators': 644, 'min_samples_split': 155, 'max_features': 0.79, 'min_samples_leaf': 31, 'criterion': 'poisson', 'max_depth': 45, 'min_weight_fraction_leaf': 0.0, 'max_leaf_nodes': 100, 'bootstrap': True, 'ccp_alpha': 0.078, 'max_samples': 0.75}. Best is trial 621 with value: -0.18112741123578058.
