[I 2025-04-16 01:06:47,162] Trial 2153 finished with value: -0.1936417107583833 and parameters: {'n_estimators': 4259, 'min_samples_split': 6, 'max_features': 0.9, 'min_samples_leaf': 14, 'criterion': 'absolute_error', 'max_depth': 60, 'min_weight_fraction_leaf': 0.01, 'max_leaf_nodes': 150, 'bootstrap': False, 'ccp_alpha': 0.006}. Best is trial 1828 with value: -0.15292978335836716.
[I 2025-04-16 01:06:51,520] Trial 2154 finished with value: -0.1936417107583833 and parameters: {'n_estimators': 4896, 'min_samples_split': 15, 'max_features': 0.97, 'min_samples_leaf': 11, 'criterion': 'absolute_error', 'max_depth': None, 'min_weight_fraction_leaf': 0.01, 'max_leaf_nodes': 300, 'bootstrap': False, 'ccp_alpha': 0.016}. Best is trial 1828 with value: -0.15292978335836716.
[I 2025-04-16 01:06:54,868] Trial 2155 finished with value: -0.1936417107583833 and parameters: {'n_estimators': 3743, 'min_samples_split': 20, 'max_features': 0.9500000000000001, 'min_samples_leaf': 18, 'criterion': 'absolute_error', 'max_depth': 60, 'min_weight_fraction_leaf': 0.01, 'max_leaf_nodes': 150, 'bootstrap': False, 'ccp_alpha': 0.005}. Best is trial 1828 with value: -0.15292978335836716.
[I 2025-04-16 01:06:58,244] Trial 2156 finished with value: -0.1936249165668042 and parameters: {'n_estimators': 4036, 'min_samples_split': 11, 'max_features': 0.98, 'min_samples_leaf': 15, 'criterion': 'absolute_error', 'max_depth': 60, 'min_weight_fraction_leaf': 0.01, 'max_leaf_nodes': 150, 'bootstrap': False, 'ccp_alpha': 0.0}. Best is trial 1828 with value: -0.15292978335836716.
[I 2025-04-16 01:07:02,589] Trial 2157 finished with value: -0.1936417107583833 and parameters: {'n_estimators': 4622, 'min_samples_split': 17, 'max_features': 0.92, 'min_samples_leaf': 12, 'criterion': 'absolute_error', 'max_depth': 60, 'min_weight_fraction_leaf': 0.01, 'max_leaf_nodes': 150, 'bootstrap': False, 'ccp_alpha': 0.01}. Best is trial 1828 with value: -0.15292978335836716.
[I 2025-04-16 01:07:05,918] Trial 2158 finished with value: -10.721640799795717 and parameters: {'n_estimators': 3878, 'min_samples_split': 27, 'max_features': 1.0, 'min_samples_leaf': 8, 'criterion': 'absolute_error', 'max_depth': 60, 'min_weight_fraction_leaf': 0.0, 'max_leaf_nodes': 150, 'bootstrap': False, 'ccp_alpha': 0.0}. Best is trial 1828 with value: -0.15292978335836716.
[I 2025-04-16 01:07:08,986] Trial 2159 finished with value: -17.528986382275182 and parameters: {'n_estimators': 3528, 'min_samples_split': 9, 'max_features': 0.9600000000000001, 'min_samples_leaf': 13, 'criterion': 'poisson', 'max_depth': 10, 'min_weight_fraction_leaf': 0.01, 'max_leaf_nodes': 150, 'bootstrap': False, 'ccp_alpha': 0.019}. Best is trial 1828 with value: -0.15292978335836716.
[I 2025-04-16 01:07:13,003] Trial 2160 finished with value: -0.1936417107583833 and parameters: {'n_estimators': 4308, 'min_samples_split': 2, 'max_features': 0.93, 'min_samples_leaf': 10, 'criterion': 'absolute_error', 'max_depth': 60, 'min_weight_fraction_leaf': 0.01, 'max_leaf_nodes': 150, 'bootstrap': False, 'ccp_alpha': 0.006}. Best is trial 1828 with value: -0.15292978335836716.
[I 2025-04-16 01:07:16,604] Trial 2161 finished with value: -0.1936417107583833 and parameters: {'n_estimators': 4115, 'min_samples_split': 13, 'max_features': 0.9500000000000001, 'min_samples_leaf': 16, 'criterion': 'absolute_error', 'max_depth': 60, 'min_weight_fraction_leaf': 0.01, 'max_leaf_nodes': 150, 'bootstrap': False, 'ccp_alpha': 0.01}. Best is trial 1828 with value: -0.15292978335836716.
[I 2025-04-16 01:07:19,941] Trial 2162 finished with value: -0.1936417107583833 and parameters: {'n_estimators': 3879, 'min_samples_split': 21, 'max_features': 0.98, 'min_samples_leaf': 14, 'criterion': 'absolute_error', 'max_depth': 60, 'min_weight_fraction_leaf': 0.01, 'max_leaf_nodes': 150, 'bootstrap': False, 'ccp_alpha': 0.025}. Best is trial 1828 with value: -0.15292978335836716.
[I 2025-04-16 01:07:23,641] Trial 2163 finished with value: -8.761153197140931 and parameters: {'n_estimators': 4335, 'min_samples_split': 7, 'max_features': 0.97, 'min_samples_leaf': 11, 'criterion': 'absolute_error', 'max_depth': 5, 'min_weight_fraction_leaf': 0.01, 'max_leaf_nodes': 150, 'bootstrap': False, 'ccp_alpha': 0.0}. Best is trial 1828 with value: -0.15292978335836716.
[I 2025-04-16 01:07:27,242] Trial 2164 finished with value: -0.1936417107583833 and parameters: {'n_estimators': 3727, 'min_samples_split': 16, 'max_features': 0.9400000000000001, 'min_samples_leaf': 18, 'criterion': 'absolute_error', 'max_depth': 60, 'min_weight_fraction_leaf': 0.0, 'max_leaf_nodes': 150, 'bootstrap': False, 'ccp_alpha': 0.014}. Best is trial 1828 with value: -0.15292978335836716.
[I 2025-04-16 01:07:30,967] Trial 2165 finished with value: -0.1936417107583833 and parameters: {'n_estimators': 4119, 'min_samples_split': 24, 'max_features': 0.9, 'min_samples_leaf': 8, 'criterion': 'absolute_error', 'max_depth': 60, 'min_weight_fraction_leaf': 0.01, 'max_leaf_nodes': 150, 'bootstrap': False, 'ccp_alpha': 0.006}. Best is trial 1828 with value: -0.15292978335836716.
[I 2025-04-16 01:07:34,909] Trial 2166 finished with value: -0.1936417107583833 and parameters: {'n_estimators': 4468, 'min_samples_split': 30, 'max_features': 1.0, 'min_samples_leaf': 13, 'criterion': 'absolute_error', 'max_depth': 60, 'min_weight_fraction_leaf': 0.01, 'max_leaf_nodes': 150, 'bootstrap': False, 'ccp_alpha': 0.005}. Best is trial 1828 with value: -0.15292978335836716.
[I 2025-04-16 01:07:38,348] Trial 2167 finished with value: -0.19361572517794326 and parameters: {'n_estimators': 3937, 'min_samples_split': 13, 'max_features': 0.9600000000000001, 'min_samples_leaf': 16, 'criterion': 'absolute_error', 'max_depth': 60, 'min_weight_fraction_leaf': 0.01, 'max_leaf_nodes': 150, 'bootstrap': False, 'ccp_alpha': 0.0}. Best is trial 1828 with value: -0.15292978335836716.
[I 2025-04-16 01:07:41,682] Trial 2168 finished with value: -17.52898638227507 and parameters: {'n_estimators': 3571, 'min_samples_split': 19, 'max_features': 0.92, 'min_samples_leaf': 12, 'criterion': 'friedman_mse', 'max_depth': 60, 'min_weight_fraction_leaf': 0.01, 'max_leaf_nodes': 150, 'bootstrap': False, 'ccp_alpha': 0.01}. Best is trial 1828 with value: -0.15292978335836716.
[I 2025-04-16 01:07:45,449] Trial 2169 finished with value: -0.1936417107583833 and parameters: {'n_estimators': 4136, 'min_samples_split': 10, 'max_features': 0.98, 'min_samples_leaf': 15, 'criterion': 'absolute_error', 'max_depth': 60, 'min_weight_fraction_leaf': 0.01, 'max_leaf_nodes': 150, 'bootstrap': False, 'ccp_alpha': 0.005}. Best is trial 1828 with value: -0.15292978335836716.
[I 2025-04-16 01:07:48,855] Trial 2170 finished with value: -0.1936417107583833 and parameters: {'n_estimators': 3715, 'min_samples_split': 5, 'max_features': 0.9400000000000001, 'min_samples_leaf': 10, 'criterion': 'absolute_error', 'max_depth': 60, 'min_weight_fraction_leaf': 0.0, 'max_leaf_nodes': 150, 'bootstrap': False, 'ccp_alpha': 0.017}. Best is trial 1828 with value: -0.15292978335836716.
[I 2025-04-16 01:07:52,506] Trial 2171 finished with value: -0.19362137133602952 and parameters: {'n_estimators': 4572, 'min_samples_split': 16, 'max_features': 0.9600000000000001, 'min_samples_leaf': 14, 'criterion': 'absolute_error', 'max_depth': 60, 'min_weight_fraction_leaf': 0.01, 'max_leaf_nodes': 20, 'bootstrap': False, 'ccp_alpha': 0.0}. Best is trial 1828 with value: -0.15292978335836716.
[I 2025-04-16 01:07:56,375] Trial 2172 finished with value: -0.1936417107583833 and parameters: {'n_estimators': 3986, 'min_samples_split': 22, 'max_features': 0.98, 'min_samples_leaf': 12, 'criterion': 'absolute_error', 'max_depth': 60, 'min_weight_fraction_leaf': 0.01, 'max_leaf_nodes': 150, 'bootstrap': False, 'ccp_alpha': 0.01}. Best is trial 1828 with value: -0.15292978335836716.
[I 2025-04-16 01:08:00,782] Trial 2173 finished with value: -0.1936417107583833 and parameters: {'n_estimators': 4319, 'min_samples_split': 12, 'max_features': 0.92, 'min_samples_leaf': 9, 'criterion': 'absolute_error', 'max_depth': 60, 'min_weight_fraction_leaf': 0.01, 'max_leaf_nodes': 150, 'bootstrap': False, 'ccp_alpha': 0.005}. Best is trial 1828 with value: -0.15292978335836716.
[I 2025-04-16 01:08:04,290] Trial 2174 finished with value: -0.1936417107583833 and parameters: {'n_estimators': 3887, 'min_samples_split': 18, 'max_features': 0.9500000000000001, 'min_samples_leaf': 18, 'criterion': 'absolute_error', 'max_depth': 60, 'min_weight_fraction_leaf': 0.01, 'max_leaf_nodes': 150, 'bootstrap': False, 'ccp_alpha': 0.014}. Best is trial 1828 with value: -0.15292978335836716.
[I 2025-04-16 01:08:07,996] Trial 2175 finished with value: -0.1936417107583833 and parameters: {'n_estimators': 4106, 'min_samples_split': 25, 'max_features': 1.0, 'min_samples_leaf': 16, 'criterion': 'absolute_error', 'max_depth': 60, 'min_weight_fraction_leaf': 0.0, 'max_leaf_nodes': None, 'bootstrap': False, 'ccp_alpha': 0.005}. Best is trial 1828 with value: -0.15292978335836716.
[I 2025-04-16 01:08:11,360] Trial 2176 finished with value: -17.528986382274745 and parameters: {'n_estimators': 3704, 'min_samples_split': 8, 'max_features': 0.97, 'min_samples_leaf': 13, 'criterion': 'squared_error', 'max_depth': 60, 'min_weight_fraction_leaf': 0.01, 'max_leaf_nodes': 150, 'bootstrap': False, 'ccp_alpha': 0.01}. Best is trial 1828 with value: -0.15292978335836716.
[I 2025-04-16 01:08:14,808] Trial 2177 finished with value: -0.19364227235139336 and parameters: {'n_estimators': 4261, 'min_samples_split': 14, 'max_features': 0.9400000000000001, 'min_samples_leaf': 20, 'criterion': 'absolute_error', 'max_depth': 60, 'min_weight_fraction_leaf': 0.01, 'max_leaf_nodes': 150, 'bootstrap': False, 'ccp_alpha': 0.0}. Best is trial 1828 with value: -0.15292978335836716.
[I 2025-04-16 01:08:17,818] Trial 2178 finished with value: -8.74695062463522 and parameters: {'n_estimators': 3499, 'min_samples_split': 20, 'max_features': 0.98, 'min_samples_leaf': 11, 'criterion': 'absolute_error', 'max_depth': None, 'min_weight_fraction_leaf': 0.01, 'max_leaf_nodes': 150, 'bootstrap': False, 'ccp_alpha': 0.0}. Best is trial 1828 with value: -0.15292978335836716.
[I 2025-04-16 01:08:22,006] Trial 2179 finished with value: -0.1936417107583833 and parameters: {'n_estimators': 4708, 'min_samples_split': 13, 'max_features': 0.93, 'min_samples_leaf': 14, 'criterion': 'absolute_error', 'max_depth': 60, 'min_weight_fraction_leaf': 0.01, 'max_leaf_nodes': 150, 'bootstrap': False, 'ccp_alpha': 0.023}. Best is trial 1828 with value: -0.15292978335836716.
[I 2025-04-16 01:08:25,621] Trial 2180 finished with value: -0.1936417107583833 and parameters: {'n_estimators': 3992, 'min_samples_split': 5, 'max_features': 0.9, 'min_samples_leaf': 8, 'criterion': 'absolute_error', 'max_depth': 60, 'min_weight_fraction_leaf': 0.01, 'max_leaf_nodes': 300, 'bootstrap': False, 'ccp_alpha': 0.01}. Best is trial 1828 with value: -0.15292978335836716.
[I 2025-04-16 01:08:29,659] Trial 2181 finished with value: -0.1936417107583833 and parameters: {'n_estimators': 4393, 'min_samples_split': 16, 'max_features': 0.9600000000000001, 'min_samples_leaf': 16, 'criterion': 'absolute_error', 'max_depth': 60, 'min_weight_fraction_leaf': 0.0, 'max_leaf_nodes': 150, 'bootstrap': False, 'ccp_alpha': 0.006}. Best is trial 1828 with value: -0.15292978335836716.
[I 2025-04-16 01:08:33,394] Trial 2182 finished with value: -41.40327948598092 and parameters: {'n_estimators': 3875, 'min_samples_split': 9, 'max_features': 1.0, 'min_samples_leaf': 11, 'criterion': 'poisson', 'max_depth': 60, 'min_weight_fraction_leaf': 0.01, 'max_leaf_nodes': 150, 'bootstrap': False, 'ccp_alpha': 0.015}. Best is trial 1828 with value: -0.15292978335836716.
[I 2025-04-16 01:08:36,916] Trial 2183 finished with value: -0.19362130548309858 and parameters: {'n_estimators': 4212, 'min_samples_split': 21, 'max_features': 0.9500000000000001, 'min_samples_leaf': 14, 'criterion': 'absolute_error', 'max_depth': 60, 'min_weight_fraction_leaf': 0.01, 'max_leaf_nodes': 150, 'bootstrap': False, 'ccp_alpha': 0.0}. Best is trial 1828 with value: -0.15292978335836716.
[I 2025-04-16 01:08:40,233] Trial 2184 finished with value: -0.1936417107583833 and parameters: {'n_estimators': 3697, 'min_samples_split': 29, 'max_features': 0.98, 'min_samples_leaf': 12, 'criterion': 'absolute_error', 'max_depth': 60, 'min_weight_fraction_leaf': 0.01, 'max_leaf_nodes': 150, 'bootstrap': False, 'ccp_alpha': 0.006}. Best is trial 1828 with value: -0.15292978335836716.
[I 2025-04-16 01:08:44,096] Trial 2185 finished with value: -0.1936417107583833 and parameters: {'n_estimators': 4067, 'min_samples_split': 17, 'max_features': 0.92, 'min_samples_leaf': 10, 'criterion': 'absolute_error', 'max_depth': 60, 'min_weight_fraction_leaf': 0.01, 'max_leaf_nodes': 150, 'bootstrap': False, 'ccp_alpha': 0.01}. Best is trial 1828 with value: -0.15292978335836716.
[I 2025-04-16 01:08:47,250] Trial 2186 finished with value: -0.1936157425713958 and parameters: {'n_estimators': 3850, 'min_samples_split': 24, 'max_features': 0.9600000000000001, 'min_samples_leaf': 16, 'criterion': 'absolute_error', 'max_depth': 60, 'min_weight_fraction_leaf': 0.01, 'max_leaf_nodes': 150, 'bootstrap': False, 'ccp_alpha': 0.0}. Best is trial 1828 with value: -0.15292978335836716.
[I 2025-04-16 01:08:51,235] Trial 2187 finished with value: -0.1936417107583833 and parameters: {'n_estimators': 4473, 'min_samples_split': 11, 'max_features': 0.9400000000000001, 'min_samples_leaf': 13, 'criterion': 'absolute_error', 'max_depth': 60, 'min_weight_fraction_leaf': 0.01, 'max_leaf_nodes': 150, 'bootstrap': False, 'ccp_alpha': 0.018000000000000002}. Best is trial 1828 with value: -0.15292978335836716.
[I 2025-04-16 01:08:59,510] Trial 2188 finished with value: -0.1936417107583833 and parameters: {'n_estimators': 9042, 'min_samples_split': 14, 'max_features': 0.99, 'min_samples_leaf': 9, 'criterion': 'absolute_error', 'max_depth': 5, 'min_weight_fraction_leaf': 0.01, 'max_leaf_nodes': 150, 'bootstrap': False, 'ccp_alpha': 0.006}. Best is trial 1828 with value: -0.15292978335836716.
[I 2025-04-16 01:09:03,261] Trial 2189 finished with value: -0.1936417107583833 and parameters: {'n_estimators': 4192, 'min_samples_split': 20, 'max_features': 0.97, 'min_samples_leaf': 17, 'criterion': 'absolute_error', 'max_depth': 60, 'min_weight_fraction_leaf': 0.01, 'max_leaf_nodes': 150, 'bootstrap': False, 'ccp_alpha': 0.005}. Best is trial 1828 with value: -0.15292978335836716.
[I 2025-04-16 01:09:06,812] Trial 2190 finished with value: -0.1936417107583833 and parameters: {'n_estimators': 4068, 'min_samples_split': 17, 'max_features': 0.9, 'min_samples_leaf': 14, 'criterion': 'absolute_error', 'max_depth': 60, 'min_weight_fraction_leaf': 0.0, 'max_leaf_nodes': 150, 'bootstrap': False, 'ccp_alpha': 0.013000000000000001}. Best is trial 1828 with value: -0.15292978335836716.
[I 2025-04-16 01:09:10,053] Trial 2191 finished with value: -8.755811540274266 and parameters: {'n_estimators': 3594, 'min_samples_split': 2, 'max_features': 0.93, 'min_samples_leaf': 12, 'criterion': 'absolute_error', 'max_depth': 10, 'min_weight_fraction_leaf': 0.01, 'max_leaf_nodes': 150, 'bootstrap': False, 'ccp_alpha': 0.0}. Best is trial 1828 with value: -0.15292978335836716.
[I 2025-04-16 01:09:13,686] Trial 2192 finished with value: -17.52898638227439 and parameters: {'n_estimators': 3864, 'min_samples_split': 8, 'max_features': 0.9500000000000001, 'min_samples_leaf': 15, 'criterion': 'friedman_mse', 'max_depth': 60, 'min_weight_fraction_leaf': 0.01, 'max_leaf_nodes': 150, 'bootstrap': False, 'ccp_alpha': 0.006}. Best is trial 1828 with value: -0.15292978335836716.
[I 2025-04-16 01:09:17,708] Trial 2193 finished with value: -0.1936417107583833 and parameters: {'n_estimators': 4327, 'min_samples_split': 26, 'max_features': 1.0, 'min_samples_leaf': 18, 'criterion': 'absolute_error', 'max_depth': 60, 'min_weight_fraction_leaf': 0.01, 'max_leaf_nodes': 150, 'bootstrap': False, 'ccp_alpha': 0.028}. Best is trial 1828 with value: -0.15292978335836716.
[I 2025-04-16 01:09:22,333] Trial 2194 finished with value: -0.1936417107583833 and parameters: {'n_estimators': 4825, 'min_samples_split': 13, 'max_features': 0.97, 'min_samples_leaf': 10, 'criterion': 'absolute_error', 'max_depth': 60, 'min_weight_fraction_leaf': 0.01, 'max_leaf_nodes': 150, 'bootstrap': False, 'ccp_alpha': 0.011}. Best is trial 1828 with value: -0.15292978335836716.
[I 2025-04-16 01:09:26,222] Trial 2195 finished with value: -8.794422416282904 and parameters: {'n_estimators': 4584, 'min_samples_split': 22, 'max_features': 0.92, 'min_samples_leaf': 12, 'criterion': 'absolute_error', 'max_depth': 60, 'min_weight_fraction_leaf': 0.01, 'max_leaf_nodes': 150, 'bootstrap': False, 'ccp_alpha': 0.0}. Best is trial 1828 with value: -0.15292978335836716.
[I 2025-04-16 01:09:29,884] Trial 2196 finished with value: -0.1936417107583833 and parameters: {'n_estimators': 4006, 'min_samples_split': 10, 'max_features': 0.9500000000000001, 'min_samples_leaf': 7, 'criterion': 'absolute_error', 'max_depth': 60, 'min_weight_fraction_leaf': 0.01, 'max_leaf_nodes': 150, 'bootstrap': False, 'ccp_alpha': 0.006}. Best is trial 1828 with value: -0.15292978335836716.
[I 2025-04-16 01:09:33,215] Trial 2197 finished with value: -0.1936417107583833 and parameters: {'n_estimators': 3532, 'min_samples_split': 17, 'max_features': 0.98, 'min_samples_leaf': 14, 'criterion': 'absolute_error', 'max_depth': 60, 'min_weight_fraction_leaf': 0.01, 'max_leaf_nodes': 20, 'bootstrap': False, 'ccp_alpha': 0.016}. Best is trial 1828 with value: -0.15292978335836716.
[I 2025-04-16 01:09:36,901] Trial 2198 finished with value: -0.1936417107583833 and parameters: {'n_estimators': 4229, 'min_samples_split': 6, 'max_features': 0.9600000000000001, 'min_samples_leaf': 11, 'criterion': 'absolute_error', 'max_depth': 60, 'min_weight_fraction_leaf': 0.0, 'max_leaf_nodes': 150, 'bootstrap': False, 'ccp_alpha': 0.005}. Best is trial 1828 with value: -0.15292978335836716.
[I 2025-04-16 01:09:40,122] Trial 2199 finished with value: -39.329783434847585 and parameters: {'n_estimators': 3768, 'min_samples_split': 14, 'max_features': 0.93, 'min_samples_leaf': 15, 'criterion': 'squared_error', 'max_depth': 60, 'min_weight_fraction_leaf': 0.01, 'max_leaf_nodes': 150, 'bootstrap': False, 'ccp_alpha': 0.0}. Best is trial 1828 with value: -0.15292978335836716.
[I 2025-04-16 01:09:43,976] Trial 2200 finished with value: -0.1936417107583833 and parameters: {'n_estimators': 4027, 'min_samples_split': 20, 'max_features': 1.0, 'min_samples_leaf': 17, 'criterion': 'absolute_error', 'max_depth': 60, 'min_weight_fraction_leaf': 0.01, 'max_leaf_nodes': 150, 'bootstrap': False, 'ccp_alpha': 0.01}. Best is trial 1828 with value: -0.15292978335836716.
[I 2025-04-16 01:09:48,019] Trial 2201 finished with value: -0.1936417107583833 and parameters: {'n_estimators': 4374, 'min_samples_split': 31, 'max_features': 0.98, 'min_samples_leaf': 9, 'criterion': 'absolute_error', 'max_depth': 60, 'min_weight_fraction_leaf': 0.01, 'max_leaf_nodes': 150, 'bootstrap': False, 'ccp_alpha': 0.02}. Best is trial 1828 with value: -0.15292978335836716.
[I 2025-04-16 01:09:51,233] Trial 2202 finished with value: -0.1936417107583833 and parameters: {'n_estimators': 3842, 'min_samples_split': 116, 'max_features': 0.9400000000000001, 'min_samples_leaf': 13, 'criterion': 'absolute_error', 'max_depth': 60, 'min_weight_fraction_leaf': 0.01, 'max_leaf_nodes': None, 'bootstrap': False, 'ccp_alpha': 0.0}. Best is trial 1828 with value: -0.15292978335836716.
[I 2025-04-16 01:09:55,266] Trial 2203 finished with value: -0.1936417107583833 and parameters: {'n_estimators': 4178, 'min_samples_split': 11, 'max_features': 0.91, 'min_samples_leaf': 12, 'criterion': 'absolute_error', 'max_depth': 60, 'min_weight_fraction_leaf': 0.0, 'max_leaf_nodes': 150, 'bootstrap': False, 'ccp_alpha': 0.012}. Best is trial 1828 with value: -0.15292978335836716.
[I 2025-04-16 01:09:59,373] Trial 2204 finished with value: -0.1936417107583833 and parameters: {'n_estimators': 4545, 'min_samples_split': 17, 'max_features': 0.9600000000000001, 'min_samples_leaf': 19, 'criterion': 'absolute_error', 'max_depth': None, 'min_weight_fraction_leaf': 0.01, 'max_leaf_nodes': 150, 'bootstrap': False, 'ccp_alpha': 0.006}. Best is trial 1828 with value: -0.15292978335836716.
[I 2025-04-16 01:10:02,980] Trial 2205 finished with value: -0.1936417107583833 and parameters: {'n_estimators': 4000, 'min_samples_split': 23, 'max_features': 0.98, 'min_samples_leaf': 15, 'criterion': 'absolute_error', 'max_depth': 60, 'min_weight_fraction_leaf': 0.01, 'max_leaf_nodes': 150, 'bootstrap': False, 'ccp_alpha': 0.005}. Best is trial 1828 with value: -0.15292978335836716.
[I 2025-04-16 01:10:06,117] Trial 2206 finished with value: -30.607880116599517 and parameters: {'n_estimators': 3724, 'min_samples_split': 7, 'max_features': 0.9400000000000001, 'min_samples_leaf': 10, 'criterion': 'poisson', 'max_depth': 60, 'min_weight_fraction_leaf': 0.01, 'max_leaf_nodes': 150, 'bootstrap': False, 'ccp_alpha': 0.0}. Best is trial 1828 with value: -0.15292978335836716.
[I 2025-04-16 01:10:09,286] Trial 2207 finished with value: -0.1936417107583833 and parameters: {'n_estimators': 3521, 'min_samples_split': 13, 'max_features': 0.9600000000000001, 'min_samples_leaf': 13, 'criterion': 'absolute_error', 'max_depth': 60, 'min_weight_fraction_leaf': 0.01, 'max_leaf_nodes': 300, 'bootstrap': False, 'ccp_alpha': 0.012}. Best is trial 1828 with value: -0.15292978335836716.
[I 2025-04-16 01:10:13,128] Trial 2208 finished with value: -0.1936417107583833 and parameters: {'n_estimators': 4213, 'min_samples_split': 26, 'max_features': 1.0, 'min_samples_leaf': 91, 'criterion': 'absolute_error', 'max_depth': 60, 'min_weight_fraction_leaf': 0.01, 'max_leaf_nodes': 150, 'bootstrap': False, 'ccp_alpha': 0.006}. Best is trial 1828 with value: -0.15292978335836716.
