[I 2025-04-15 23:32:54,714] Trial 480 finished with value: -18.060147089840388 and parameters: {'n_estimators': 3063, 'min_samples_split': 35, 'max_features': 0.33, 'min_samples_leaf': 95, 'criterion': 'friedman_mse', 'max_depth': 15, 'min_weight_fraction_leaf': 0.01, 'max_leaf_nodes': 10, 'bootstrap': True, 'ccp_alpha': 0.076, 'max_samples': 0.5}. Best is trial 74 with value: -0.18167313469617832.
[I 2025-04-15 23:32:57,759] Trial 481 finished with value: -0.18278215704543554 and parameters: {'n_estimators': 2785, 'min_samples_split': 33, 'max_features': 0.8300000000000001, 'min_samples_leaf': 41, 'criterion': 'absolute_error', 'max_depth': 15, 'min_weight_fraction_leaf': 0.0, 'max_leaf_nodes': 10, 'bootstrap': True, 'ccp_alpha': 0.062, 'max_samples': 0.5}. Best is trial 74 with value: -0.18167313469617832.
[I 2025-04-15 23:33:00,453] Trial 482 finished with value: -0.19082016526915976 and parameters: {'n_estimators': 2380, 'min_samples_split': 26, 'max_features': 0.85, 'min_samples_leaf': 21, 'criterion': 'absolute_error', 'max_depth': 15, 'min_weight_fraction_leaf': 0.05, 'max_leaf_nodes': 10, 'bootstrap': True, 'ccp_alpha': 0.079, 'max_samples': 0.75}. Best is trial 74 with value: -0.18167313469617832.
[I 2025-04-15 23:33:03,830] Trial 483 finished with value: -0.19330896722025487 and parameters: {'n_estimators': 3221, 'min_samples_split': 37, 'max_features': 0.86, 'min_samples_leaf': 31, 'criterion': 'absolute_error', 'max_depth': 15, 'min_weight_fraction_leaf': 0.01, 'max_leaf_nodes': 10, 'bootstrap': True, 'ccp_alpha': 0.068, 'max_samples': 1.0}. Best is trial 74 with value: -0.18167313469617832.
[I 2025-04-15 23:33:07,664] Trial 484 finished with value: -0.182567883272178 and parameters: {'n_estimators': 2931, 'min_samples_split': 142, 'max_features': 0.78, 'min_samples_leaf': 23, 'criterion': 'absolute_error', 'max_depth': 15, 'min_weight_fraction_leaf': 0.01, 'max_leaf_nodes': 10, 'bootstrap': True, 'ccp_alpha': 0.053, 'max_samples': 0.5}. Best is trial 74 with value: -0.18167313469617832.
[I 2025-04-15 23:33:11,698] Trial 485 finished with value: -0.18323483272906174 and parameters: {'n_estimators': 3475, 'min_samples_split': 51, 'max_features': 0.59, 'min_samples_leaf': 85, 'criterion': 'absolute_error', 'max_depth': 15, 'min_weight_fraction_leaf': 0.06, 'max_leaf_nodes': 10, 'bootstrap': True, 'ccp_alpha': 0.08, 'max_samples': 0.5}. Best is trial 74 with value: -0.18167313469617832.
[I 2025-04-15 23:33:15,488] Trial 486 finished with value: -0.18261641759523545 and parameters: {'n_estimators': 3128, 'min_samples_split': 38, 'max_features': 0.8200000000000001, 'min_samples_leaf': 98, 'criterion': 'absolute_error', 'max_depth': 15, 'min_weight_fraction_leaf': 0.05, 'max_leaf_nodes': 20, 'bootstrap': True, 'ccp_alpha': 0.07, 'max_samples': 0.5}. Best is trial 74 with value: -0.18167313469617832.
[I 2025-04-15 23:33:18,112] Trial 487 finished with value: -18.217772199818306 and parameters: {'n_estimators': 2608, 'min_samples_split': 41, 'max_features': 0.68, 'min_samples_leaf': 89, 'criterion': 'squared_error', 'max_depth': 20, 'min_weight_fraction_leaf': 0.06, 'max_leaf_nodes': 50, 'bootstrap': True, 'ccp_alpha': 0.059000000000000004, 'max_samples': 0.5}. Best is trial 74 with value: -0.18167313469617832.
[I 2025-04-15 23:33:21,020] Trial 488 finished with value: -0.18290796439797133 and parameters: {'n_estimators': 2825, 'min_samples_split': 43, 'max_features': 0.8400000000000001, 'min_samples_leaf': 94, 'criterion': 'absolute_error', 'max_depth': 60, 'min_weight_fraction_leaf': 0.02, 'max_leaf_nodes': 150, 'bootstrap': True, 'ccp_alpha': 0.032, 'max_samples': 0.5}. Best is trial 74 with value: -0.18167313469617832.
[I 2025-04-15 23:33:24,709] Trial 489 finished with value: -0.18326912275268747 and parameters: {'n_estimators': 3567, 'min_samples_split': 153, 'max_features': 0.89, 'min_samples_leaf': 19, 'criterion': 'absolute_error', 'max_depth': 15, 'min_weight_fraction_leaf': 0.0, 'max_leaf_nodes': 10, 'bootstrap': True, 'ccp_alpha': 0.084, 'max_samples': 0.5}. Best is trial 74 with value: -0.18167313469617832.
[I 2025-04-15 23:33:28,299] Trial 490 finished with value: -0.18289961776754332 and parameters: {'n_estimators': 3294, 'min_samples_split': 101, 'max_features': 0.72, 'min_samples_leaf': 26, 'criterion': 'absolute_error', 'max_depth': 5, 'min_weight_fraction_leaf': 0.01, 'max_leaf_nodes': 150, 'bootstrap': True, 'ccp_alpha': 0.073, 'max_samples': 0.5}. Best is trial 74 with value: -0.18167313469617832.
[I 2025-04-15 23:33:30,803] Trial 491 finished with value: -0.1936417107583833 and parameters: {'n_estimators': 3018, 'min_samples_split': 109, 'max_features': 0.38, 'min_samples_leaf': 29, 'criterion': 'absolute_error', 'max_depth': 45, 'min_weight_fraction_leaf': 0.02, 'max_leaf_nodes': 150, 'bootstrap': False, 'ccp_alpha': 0.095}. Best is trial 74 with value: -0.18167313469617832.
[I 2025-04-15 23:33:32,233] Trial 492 finished with value: -0.18662944428019093 and parameters: {'n_estimators': 1170, 'min_samples_split': 31, 'max_features': 0.8, 'min_samples_leaf': 75, 'criterion': 'absolute_error', 'max_depth': 15, 'min_weight_fraction_leaf': 0.02, 'max_leaf_nodes': None, 'bootstrap': True, 'ccp_alpha': 0.089, 'max_samples': 0.5}. Best is trial 74 with value: -0.18167313469617832.
[I 2025-04-15 23:33:35,645] Trial 493 finished with value: -0.18254041031959284 and parameters: {'n_estimators': 3098, 'min_samples_split': 33, 'max_features': 0.87, 'min_samples_leaf': 80, 'criterion': 'absolute_error', 'max_depth': 10, 'min_weight_fraction_leaf': 0.02, 'max_leaf_nodes': 10, 'bootstrap': True, 'ccp_alpha': 0.101, 'max_samples': 0.5}. Best is trial 74 with value: -0.18167313469617832.
[I 2025-04-15 23:33:38,663] Trial 494 finished with value: -0.18287677188660098 and parameters: {'n_estimators': 2815, 'min_samples_split': 21, 'max_features': 0.86, 'min_samples_leaf': 81, 'criterion': 'absolute_error', 'max_depth': 10, 'min_weight_fraction_leaf': 0.02, 'max_leaf_nodes': 10, 'bootstrap': True, 'ccp_alpha': 0.10200000000000001, 'max_samples': 0.5}. Best is trial 74 with value: -0.18167313469617832.
[I 2025-04-15 23:33:47,678] Trial 495 finished with value: -17.51636751791805 and parameters: {'n_estimators': 8978, 'min_samples_split': 35, 'max_features': 0.76, 'min_samples_leaf': 87, 'criterion': 'poisson', 'max_depth': 10, 'min_weight_fraction_leaf': 0.02, 'max_leaf_nodes': 10, 'bootstrap': True, 'ccp_alpha': 0.081, 'max_samples': 0.5}. Best is trial 74 with value: -0.18167313469617832.
[I 2025-04-15 23:33:53,009] Trial 496 finished with value: -0.183687489412738 and parameters: {'n_estimators': 4866, 'min_samples_split': 28, 'max_features': 0.8400000000000001, 'min_samples_leaf': 88, 'criterion': 'absolute_error', 'max_depth': 45, 'min_weight_fraction_leaf': 0.02, 'max_leaf_nodes': 10, 'bootstrap': True, 'ccp_alpha': 0.137, 'max_samples': 0.5}. Best is trial 74 with value: -0.18167313469617832.
[I 2025-04-15 23:33:56,457] Trial 497 finished with value: -0.1829876223282309 and parameters: {'n_estimators': 3352, 'min_samples_split': 32, 'max_features': 0.17, 'min_samples_leaf': 80, 'criterion': 'absolute_error', 'max_depth': 10, 'min_weight_fraction_leaf': 0.02, 'max_leaf_nodes': 10, 'bootstrap': True, 'ccp_alpha': 0.096, 'max_samples': 0.5}. Best is trial 74 with value: -0.18167313469617832.
[I 2025-04-15 23:34:00,678] Trial 498 finished with value: -0.18307027120946473 and parameters: {'n_estimators': 3978, 'min_samples_split': 34, 'max_features': 0.79, 'min_samples_leaf': 22, 'criterion': 'absolute_error', 'max_depth': 10, 'min_weight_fraction_leaf': 0.01, 'max_leaf_nodes': 10, 'bootstrap': True, 'ccp_alpha': 0.09, 'max_samples': 0.5}. Best is trial 74 with value: -0.18167313469617832.
[I 2025-04-15 23:34:11,259] Trial 499 finished with value: -0.18477735155182354 and parameters: {'n_estimators': 9933, 'min_samples_split': 40, 'max_features': 0.8300000000000001, 'min_samples_leaf': 82, 'criterion': 'absolute_error', 'max_depth': 10, 'min_weight_fraction_leaf': 0.02, 'max_leaf_nodes': 10, 'bootstrap': True, 'ccp_alpha': 0.061, 'max_samples': 0.5}. Best is trial 74 with value: -0.18167313469617832.
[I 2025-04-15 23:34:14,670] Trial 500 finished with value: -0.18272141547605375 and parameters: {'n_estimators': 3073, 'min_samples_split': 25, 'max_features': 0.91, 'min_samples_leaf': 85, 'criterion': 'absolute_error', 'max_depth': 10, 'min_weight_fraction_leaf': 0.02, 'max_leaf_nodes': 10, 'bootstrap': True, 'ccp_alpha': 0.10400000000000001, 'max_samples': 0.5}. Best is trial 74 with value: -0.18167313469617832.
[I 2025-04-15 23:34:18,796] Trial 501 finished with value: -0.18347360495165602 and parameters: {'n_estimators': 3692, 'min_samples_split': 46, 'max_features': 0.81, 'min_samples_leaf': 79, 'criterion': 'absolute_error', 'max_depth': 10, 'min_weight_fraction_leaf': 0.01, 'max_leaf_nodes': 10, 'bootstrap': True, 'ccp_alpha': 0.084, 'max_samples': 0.5}. Best is trial 74 with value: -0.18167313469617832.
[I 2025-04-15 23:34:21,707] Trial 502 finished with value: -0.18288668551810328 and parameters: {'n_estimators': 2610, 'min_samples_split': 40, 'max_features': 0.87, 'min_samples_leaf': 80, 'criterion': 'absolute_error', 'max_depth': 10, 'min_weight_fraction_leaf': 0.02, 'max_leaf_nodes': 150, 'bootstrap': True, 'ccp_alpha': 0.042, 'max_samples': 0.5}. Best is trial 74 with value: -0.18167313469617832.
[I 2025-04-15 23:34:25,248] Trial 503 finished with value: -0.19330240486239822 and parameters: {'n_estimators': 3158, 'min_samples_split': 36, 'max_features': 0.98, 'min_samples_leaf': 82, 'criterion': 'absolute_error', 'max_depth': 15, 'min_weight_fraction_leaf': 0.02, 'max_leaf_nodes': 50, 'bootstrap': True, 'ccp_alpha': 0.067, 'max_samples': None}. Best is trial 74 with value: -0.18167313469617832.
[I 2025-04-15 23:34:28,559] Trial 504 finished with value: -0.18301155061259725 and parameters: {'n_estimators': 2883, 'min_samples_split': 31, 'max_features': 0.89, 'min_samples_leaf': 72, 'criterion': 'absolute_error', 'max_depth': 20, 'min_weight_fraction_leaf': 0.01, 'max_leaf_nodes': 10, 'bootstrap': True, 'ccp_alpha': 0.074, 'max_samples': 0.5}. Best is trial 74 with value: -0.18167313469617832.
[I 2025-04-15 23:34:30,451] Trial 505 finished with value: -17.873192725116642 and parameters: {'n_estimators': 1738, 'min_samples_split': 160, 'max_features': 0.36000000000000004, 'min_samples_leaf': 18, 'criterion': 'friedman_mse', 'max_depth': 15, 'min_weight_fraction_leaf': 0.02, 'max_leaf_nodes': 150, 'bootstrap': True, 'ccp_alpha': 0.245, 'max_samples': 0.5}. Best is trial 74 with value: -0.18167313469617832.
[I 2025-04-15 23:34:34,464] Trial 506 finished with value: -0.19329062412208967 and parameters: {'n_estimators': 3397, 'min_samples_split': 197, 'max_features': 0.56, 'min_samples_leaf': 31, 'criterion': 'absolute_error', 'max_depth': 5, 'min_weight_fraction_leaf': 0.0, 'max_leaf_nodes': 150, 'bootstrap': True, 'ccp_alpha': 0.053, 'max_samples': 1.0}. Best is trial 74 with value: -0.18167313469617832.
[I 2025-04-15 23:34:37,310] Trial 507 finished with value: -0.18373084239342874 and parameters: {'n_estimators': 2287, 'min_samples_split': 150, 'max_features': 0.74, 'min_samples_leaf': 43, 'criterion': 'absolute_error', 'max_depth': 60, 'min_weight_fraction_leaf': 0.02, 'max_leaf_nodes': None, 'bootstrap': True, 'ccp_alpha': 0.10200000000000001, 'max_samples': 0.5}. Best is trial 74 with value: -0.18167313469617832.
[I 2025-04-15 23:34:40,598] Trial 508 finished with value: -0.18258876355092202 and parameters: {'n_estimators': 2992, 'min_samples_split': 46, 'max_features': 0.85, 'min_samples_leaf': 77, 'criterion': 'absolute_error', 'max_depth': 45, 'min_weight_fraction_leaf': 0.01, 'max_leaf_nodes': 10, 'bootstrap': True, 'ccp_alpha': 0.257, 'max_samples': 0.5}. Best is trial 74 with value: -0.18167313469617832.
[I 2025-04-15 23:34:43,052] Trial 509 finished with value: -0.1936417107583833 and parameters: {'n_estimators': 2722, 'min_samples_split': 38, 'max_features': 0.8200000000000001, 'min_samples_leaf': 35, 'criterion': 'absolute_error', 'max_depth': 15, 'min_weight_fraction_leaf': 0.02, 'max_leaf_nodes': 150, 'bootstrap': False, 'ccp_alpha': 0.092}. Best is trial 74 with value: -0.18167313469617832.
[I 2025-04-15 23:34:46,754] Trial 510 finished with value: -0.19098508826065505 and parameters: {'n_estimators': 3248, 'min_samples_split': 156, 'max_features': 0.52, 'min_samples_leaf': 91, 'criterion': 'absolute_error', 'max_depth': 10, 'min_weight_fraction_leaf': 0.02, 'max_leaf_nodes': 20, 'bootstrap': True, 'ccp_alpha': 0.079, 'max_samples': 0.75}. Best is trial 74 with value: -0.18167313469617832.
[I 2025-04-15 23:34:49,905] Trial 511 finished with value: -18.124174324679014 and parameters: {'n_estimators': 3014, 'min_samples_split': 51, 'max_features': 0.9600000000000001, 'min_samples_leaf': 84, 'criterion': 'squared_error', 'max_depth': 15, 'min_weight_fraction_leaf': 0.01, 'max_leaf_nodes': 10, 'bootstrap': True, 'ccp_alpha': 0.097, 'max_samples': 0.5}. Best is trial 74 with value: -0.18167313469617832.
[I 2025-04-15 23:34:53,677] Trial 512 finished with value: -0.18334686930093752 and parameters: {'n_estimators': 3552, 'min_samples_split': 144, 'max_features': 0.87, 'min_samples_leaf': 24, 'criterion': 'absolute_error', 'max_depth': 45, 'min_weight_fraction_leaf': 0.01, 'max_leaf_nodes': 50, 'bootstrap': True, 'ccp_alpha': 0.08700000000000001, 'max_samples': 0.5}. Best is trial 74 with value: -0.18167313469617832.
[I 2025-04-15 23:34:58,789] Trial 513 finished with value: -0.18350386093397594 and parameters: {'n_estimators': 4614, 'min_samples_split': 68, 'max_features': 0.93, 'min_samples_leaf': 83, 'criterion': 'absolute_error', 'max_depth': 15, 'min_weight_fraction_leaf': 0.0, 'max_leaf_nodes': 150, 'bootstrap': True, 'ccp_alpha': 0.109, 'max_samples': 0.5}. Best is trial 74 with value: -0.18167313469617832.
[I 2025-04-15 23:35:02,614] Trial 514 finished with value: -0.18284921509650184 and parameters: {'n_estimators': 3249, 'min_samples_split': 29, 'max_features': 0.79, 'min_samples_leaf': 28, 'criterion': 'absolute_error', 'max_depth': 20, 'min_weight_fraction_leaf': 0.04, 'max_leaf_nodes': 100, 'bootstrap': True, 'ccp_alpha': 0.064, 'max_samples': 0.5}. Best is trial 74 with value: -0.18167313469617832.
[I 2025-04-15 23:35:05,383] Trial 515 finished with value: -0.18296519143247475 and parameters: {'n_estimators': 2569, 'min_samples_split': 34, 'max_features': 0.9, 'min_samples_leaf': 39, 'criterion': 'absolute_error', 'max_depth': 60, 'min_weight_fraction_leaf': 0.02, 'max_leaf_nodes': 150, 'bootstrap': True, 'ccp_alpha': 0.048, 'max_samples': 0.5}. Best is trial 74 with value: -0.18167313469617832.
[I 2025-04-15 23:35:06,491] Trial 516 finished with value: -0.18724002379076565 and parameters: {'n_estimators': 899, 'min_samples_split': 162, 'max_features': 0.85, 'min_samples_leaf': 75, 'criterion': 'absolute_error', 'max_depth': 5, 'min_weight_fraction_leaf': 0.02, 'max_leaf_nodes': 10, 'bootstrap': True, 'ccp_alpha': 0.074, 'max_samples': 0.5}. Best is trial 74 with value: -0.18167313469617832.
[I 2025-04-15 23:35:09,660] Trial 517 finished with value: -18.196533065753325 and parameters: {'n_estimators': 2843, 'min_samples_split': 44, 'max_features': 0.27, 'min_samples_leaf': 27, 'criterion': 'poisson', 'max_depth': 45, 'min_weight_fraction_leaf': 0.02, 'max_leaf_nodes': None, 'bootstrap': True, 'ccp_alpha': 0.096, 'max_samples': 0.5}. Best is trial 74 with value: -0.18167313469617832.
[I 2025-04-15 23:35:13,060] Trial 518 finished with value: -0.18262402539315375 and parameters: {'n_estimators': 3148, 'min_samples_split': 170, 'max_features': 0.77, 'min_samples_leaf': 21, 'criterion': 'absolute_error', 'max_depth': 15, 'min_weight_fraction_leaf': 0.01, 'max_leaf_nodes': 100, 'bootstrap': True, 'ccp_alpha': 0.107, 'max_samples': 0.5}. Best is trial 74 with value: -0.18167313469617832.
[I 2025-04-15 23:35:16,641] Trial 519 finished with value: -0.18304067186866974 and parameters: {'n_estimators': 3398, 'min_samples_split': 155, 'max_features': 0.81, 'min_samples_leaf': 25, 'criterion': 'absolute_error', 'max_depth': 30, 'min_weight_fraction_leaf': 0.0, 'max_leaf_nodes': 100, 'bootstrap': True, 'ccp_alpha': 0.056, 'max_samples': 0.5}. Best is trial 74 with value: -0.18167313469617832.
[I 2025-04-15 23:35:20,063] Trial 520 finished with value: -0.18261547459939606 and parameters: {'n_estimators': 2949, 'min_samples_split': 190, 'max_features': 0.44, 'min_samples_leaf': 30, 'criterion': 'absolute_error', 'max_depth': 30, 'min_weight_fraction_leaf': 0.01, 'max_leaf_nodes': 150, 'bootstrap': True, 'ccp_alpha': 0.101, 'max_samples': 0.5}. Best is trial 74 with value: -0.18167313469617832.
[I 2025-04-15 23:35:23,225] Trial 521 finished with value: -0.1827021072750023 and parameters: {'n_estimators': 2760, 'min_samples_split': 40, 'max_features': 0.88, 'min_samples_leaf': 51, 'criterion': 'absolute_error', 'max_depth': 15, 'min_weight_fraction_leaf': 0.02, 'max_leaf_nodes': 100, 'bootstrap': True, 'ccp_alpha': 0.091, 'max_samples': 0.5}. Best is trial 74 with value: -0.18167313469617832.
[I 2025-04-15 23:35:25,909] Trial 522 finished with value: -0.1832048851512047 and parameters: {'n_estimators': 2476, 'min_samples_split': 174, 'max_features': 0.8300000000000001, 'min_samples_leaf': 23, 'criterion': 'absolute_error', 'max_depth': 30, 'min_weight_fraction_leaf': 0.01, 'max_leaf_nodes': 10, 'bootstrap': True, 'ccp_alpha': 0.02, 'max_samples': 0.5}. Best is trial 74 with value: -0.18167313469617832.
[I 2025-04-15 23:35:29,562] Trial 523 finished with value: -0.18259513476335987 and parameters: {'n_estimators': 3117, 'min_samples_split': 165, 'max_features': 0.86, 'min_samples_leaf': 28, 'criterion': 'absolute_error', 'max_depth': 10, 'min_weight_fraction_leaf': 0.02, 'max_leaf_nodes': 100, 'bootstrap': True, 'ccp_alpha': 0.085, 'max_samples': 0.5}. Best is trial 74 with value: -0.18167313469617832.
[I 2025-04-15 23:35:33,144] Trial 524 finished with value: -0.18297275526966014 and parameters: {'n_estimators': 3324, 'min_samples_split': 184, 'max_features': 0.91, 'min_samples_leaf': 70, 'criterion': 'absolute_error', 'max_depth': 45, 'min_weight_fraction_leaf': 0.01, 'max_leaf_nodes': 50, 'bootstrap': True, 'ccp_alpha': 0.068, 'max_samples': 0.5}. Best is trial 74 with value: -0.18167313469617832.
[I 2025-04-15 23:35:37,281] Trial 525 finished with value: -0.18257899437201547 and parameters: {'n_estimators': 2937, 'min_samples_split': 159, 'max_features': 0.8400000000000001, 'min_samples_leaf': 47, 'criterion': 'absolute_error', 'max_depth': 30, 'min_weight_fraction_leaf': 0.02, 'max_leaf_nodes': 150, 'bootstrap': True, 'ccp_alpha': 0.079, 'max_samples': 0.5}. Best is trial 74 with value: -0.18167313469617832.
[I 2025-04-15 23:35:41,656] Trial 526 finished with value: -0.18333483213013438 and parameters: {'n_estimators': 3547, 'min_samples_split': 171, 'max_features': 0.79, 'min_samples_leaf': 33, 'criterion': 'absolute_error', 'max_depth': 15, 'min_weight_fraction_leaf': 0.02, 'max_leaf_nodes': 100, 'bootstrap': True, 'ccp_alpha': 0.112, 'max_samples': 0.5}. Best is trial 74 with value: -0.18167313469617832.
[I 2025-04-15 23:35:44,697] Trial 527 finished with value: -18.149580629319985 and parameters: {'n_estimators': 2702, 'min_samples_split': 148, 'max_features': 0.89, 'min_samples_leaf': 15, 'criterion': 'friedman_mse', 'max_depth': 20, 'min_weight_fraction_leaf': 0.01, 'max_leaf_nodes': 100, 'bootstrap': True, 'ccp_alpha': 0.061, 'max_samples': 0.5}. Best is trial 74 with value: -0.18167313469617832.
[I 2025-04-15 23:35:47,110] Trial 528 finished with value: -0.1936417107583833 and parameters: {'n_estimators': 3134, 'min_samples_split': 37, 'max_features': 0.92, 'min_samples_leaf': 25, 'criterion': 'absolute_error', 'max_depth': 30, 'min_weight_fraction_leaf': 0.02, 'max_leaf_nodes': 150, 'bootstrap': False, 'ccp_alpha': 0.101}. Best is trial 74 with value: -0.18167313469617832.
[I 2025-04-15 23:35:51,014] Trial 529 finished with value: -0.193287218854261 and parameters: {'n_estimators': 2929, 'min_samples_split': 27, 'max_features': 0.81, 'min_samples_leaf': 31, 'criterion': 'absolute_error', 'max_depth': 60, 'min_weight_fraction_leaf': 0.07, 'max_leaf_nodes': 10, 'bootstrap': True, 'ccp_alpha': 0.084, 'max_samples': None}. Best is trial 74 with value: -0.18167313469617832.
[I 2025-04-15 23:35:54,990] Trial 530 finished with value: -0.18320707215246532 and parameters: {'n_estimators': 3752, 'min_samples_split': 165, 'max_features': 0.86, 'min_samples_leaf': 27, 'criterion': 'absolute_error', 'max_depth': 5, 'min_weight_fraction_leaf': 0.0, 'max_leaf_nodes': 100, 'bootstrap': True, 'ccp_alpha': 0.092, 'max_samples': 0.5}. Best is trial 74 with value: -0.18167313469617832.
[I 2025-04-15 23:35:58,874] Trial 531 finished with value: -0.18289252902481495 and parameters: {'n_estimators': 3265, 'min_samples_split': 23, 'max_features': 0.8300000000000001, 'min_samples_leaf': 20, 'criterion': 'absolute_error', 'max_depth': 30, 'min_weight_fraction_leaf': 0.01, 'max_leaf_nodes': None, 'bootstrap': True, 'ccp_alpha': 0.131, 'max_samples': 0.5}. Best is trial 74 with value: -0.18167313469617832.
[I 2025-04-15 23:36:01,209] Trial 532 finished with value: -0.18523354280656 and parameters: {'n_estimators': 2008, 'min_samples_split': 33, 'max_features': 0.88, 'min_samples_leaf': 29, 'criterion': 'absolute_error', 'max_depth': 15, 'min_weight_fraction_leaf': 0.08, 'max_leaf_nodes': 100, 'bootstrap': True, 'ccp_alpha': 0.073, 'max_samples': 0.5}. Best is trial 74 with value: -0.18167313469617832.
