[I 2025-04-15 23:55:12,805] Trial 957 finished with value: -0.18268550088625282 and parameters: {'n_estimators': 3171, 'min_samples_split': 164, 'max_features': 0.25, 'min_samples_leaf': 38, 'criterion': 'absolute_error', 'max_depth': 30, 'min_weight_fraction_leaf': 0.02, 'max_leaf_nodes': 150, 'bootstrap': True, 'ccp_alpha': 0.077, 'max_samples': 0.5}. Best is trial 621 with value: -0.18112741123578058.
[I 2025-04-15 23:55:20,122] Trial 958 finished with value: -0.184209741588743 and parameters: {'n_estimators': 6921, 'min_samples_split': 38, 'max_features': 0.89, 'min_samples_leaf': 33, 'criterion': 'absolute_error', 'max_depth': 45, 'min_weight_fraction_leaf': 0.02, 'max_leaf_nodes': 100, 'bootstrap': True, 'ccp_alpha': 0.065, 'max_samples': 0.5}. Best is trial 621 with value: -0.18112741123578058.
[I 2025-04-15 23:55:22,784] Trial 959 finished with value: -0.18388042876009295 and parameters: {'n_estimators': 2242, 'min_samples_split': 29, 'max_features': 0.93, 'min_samples_leaf': 36, 'criterion': 'absolute_error', 'max_depth': 30, 'min_weight_fraction_leaf': 0.04, 'max_leaf_nodes': 10, 'bootstrap': True, 'ccp_alpha': 0.053, 'max_samples': 0.5}. Best is trial 621 with value: -0.18112741123578058.
[I 2025-04-15 23:55:25,763] Trial 960 finished with value: -0.1828202011103825 and parameters: {'n_estimators': 2797, 'min_samples_split': 154, 'max_features': 0.8200000000000001, 'min_samples_leaf': 70, 'criterion': 'absolute_error', 'max_depth': 15, 'min_weight_fraction_leaf': 0.01, 'max_leaf_nodes': 50, 'bootstrap': True, 'ccp_alpha': 0.111, 'max_samples': 0.5}. Best is trial 621 with value: -0.18112741123578058.
[I 2025-04-15 23:55:26,176] Trial 961 finished with value: -0.18572278953613272 and parameters: {'n_estimators': 199, 'min_samples_split': 175, 'max_features': 0.52, 'min_samples_leaf': 29, 'criterion': 'absolute_error', 'max_depth': 30, 'min_weight_fraction_leaf': 0.03, 'max_leaf_nodes': 100, 'bootstrap': True, 'ccp_alpha': 0.121, 'max_samples': 0.5}. Best is trial 621 with value: -0.18112741123578058.
[I 2025-04-15 23:55:29,336] Trial 962 finished with value: -0.18294467675011988 and parameters: {'n_estimators': 2563, 'min_samples_split': 192, 'max_features': 0.33, 'min_samples_leaf': 23, 'criterion': 'absolute_error', 'max_depth': 45, 'min_weight_fraction_leaf': 0.06, 'max_leaf_nodes': 100, 'bootstrap': True, 'ccp_alpha': 0.06, 'max_samples': 0.5}. Best is trial 621 with value: -0.18112741123578058.
[I 2025-04-15 23:55:32,575] Trial 963 finished with value: -0.18260169556809988 and parameters: {'n_estimators': 3032, 'min_samples_split': 180, 'max_features': 0.77, 'min_samples_leaf': 25, 'criterion': 'absolute_error', 'max_depth': 10, 'min_weight_fraction_leaf': 0.0, 'max_leaf_nodes': 150, 'bootstrap': True, 'ccp_alpha': 0.07100000000000001, 'max_samples': 0.5}. Best is trial 621 with value: -0.18112741123578058.
[I 2025-04-15 23:55:36,643] Trial 964 finished with value: -0.19328657853675443 and parameters: {'n_estimators': 3358, 'min_samples_split': 162, 'max_features': 0.8, 'min_samples_leaf': 28, 'criterion': 'absolute_error', 'max_depth': 30, 'min_weight_fraction_leaf': 0.01, 'max_leaf_nodes': 100, 'bootstrap': True, 'ccp_alpha': 0.037, 'max_samples': None}. Best is trial 621 with value: -0.18112741123578058.
[I 2025-04-15 23:55:39,021] Trial 965 finished with value: -0.1936417107583833 and parameters: {'n_estimators': 2834, 'min_samples_split': 23, 'max_features': 0.8400000000000001, 'min_samples_leaf': 31, 'criterion': 'absolute_error', 'max_depth': 20, 'min_weight_fraction_leaf': 0.02, 'max_leaf_nodes': 100, 'bootstrap': False, 'ccp_alpha': 0.091}. Best is trial 621 with value: -0.18112741123578058.
[I 2025-04-15 23:55:39,275] Trial 966 finished with value: -14.089135469568038 and parameters: {'n_estimators': 7, 'min_samples_split': 187, 'max_features': 0.65, 'min_samples_leaf': 60, 'criterion': 'friedman_mse', 'max_depth': None, 'min_weight_fraction_leaf': 0.01, 'max_leaf_nodes': 300, 'bootstrap': True, 'ccp_alpha': 0.223, 'max_samples': 0.5}. Best is trial 621 with value: -0.18112741123578058.
[I 2025-04-15 23:55:40,179] Trial 967 finished with value: -0.1859274310150242 and parameters: {'n_estimators': 677, 'min_samples_split': 169, 'max_features': 0.28, 'min_samples_leaf': 27, 'criterion': 'absolute_error', 'max_depth': 45, 'min_weight_fraction_leaf': 0.08, 'max_leaf_nodes': None, 'bootstrap': True, 'ccp_alpha': 0.105, 'max_samples': 0.5}. Best is trial 621 with value: -0.18112741123578058.
[I 2025-04-15 23:55:44,212] Trial 968 finished with value: -0.18341400589543255 and parameters: {'n_estimators': 3637, 'min_samples_split': 18, 'max_features': 0.88, 'min_samples_leaf': 21, 'criterion': 'absolute_error', 'max_depth': 60, 'min_weight_fraction_leaf': 0.03, 'max_leaf_nodes': 50, 'bootstrap': True, 'ccp_alpha': 0.097, 'max_samples': 0.5}. Best is trial 621 with value: -0.18112741123578058.
[I 2025-04-15 23:55:44,780] Trial 969 finished with value: -0.18808931082808095 and parameters: {'n_estimators': 379, 'min_samples_split': 34, 'max_features': 0.91, 'min_samples_leaf': 30, 'criterion': 'absolute_error', 'max_depth': 30, 'min_weight_fraction_leaf': 0.02, 'max_leaf_nodes': 150, 'bootstrap': True, 'ccp_alpha': 0.082, 'max_samples': 0.5}. Best is trial 621 with value: -0.18112741123578058.
[I 2025-04-15 23:55:48,792] Trial 970 finished with value: -0.1933066089171523 and parameters: {'n_estimators': 3198, 'min_samples_split': 43, 'max_features': 0.9500000000000001, 'min_samples_leaf': 26, 'criterion': 'absolute_error', 'max_depth': 15, 'min_weight_fraction_leaf': 0.07, 'max_leaf_nodes': 100, 'bootstrap': True, 'ccp_alpha': 0.049, 'max_samples': 1.0}. Best is trial 621 with value: -0.18112741123578058.
[I 2025-04-15 23:55:52,181] Trial 971 finished with value: -0.18258876355092202 and parameters: {'n_estimators': 2992, 'min_samples_split': 144, 'max_features': 0.86, 'min_samples_leaf': 34, 'criterion': 'absolute_error', 'max_depth': 5, 'min_weight_fraction_leaf': 0.01, 'max_leaf_nodes': 10, 'bootstrap': True, 'ccp_alpha': 0.067, 'max_samples': 0.5}. Best is trial 621 with value: -0.18112741123578058.
[I 2025-04-15 23:55:55,775] Trial 972 finished with value: -0.19073398377345355 and parameters: {'n_estimators': 2788, 'min_samples_split': 70, 'max_features': 0.8400000000000001, 'min_samples_leaf': 24, 'criterion': 'absolute_error', 'max_depth': 45, 'min_weight_fraction_leaf': 0.02, 'max_leaf_nodes': 100, 'bootstrap': True, 'ccp_alpha': 0.127, 'max_samples': 0.75}. Best is trial 621 with value: -0.18112741123578058.
[I 2025-04-15 23:55:57,503] Trial 973 finished with value: -18.039499891152794 and parameters: {'n_estimators': 1662, 'min_samples_split': 176, 'max_features': 0.8, 'min_samples_leaf': 3, 'criterion': 'squared_error', 'max_depth': 30, 'min_weight_fraction_leaf': 0.0, 'max_leaf_nodes': 100, 'bootstrap': True, 'ccp_alpha': 0.076, 'max_samples': 0.5}. Best is trial 621 with value: -0.18112741123578058.
[I 2025-04-15 23:56:00,488] Trial 974 finished with value: -0.18387208133202765 and parameters: {'n_estimators': 2432, 'min_samples_split': 29, 'max_features': 0.18000000000000002, 'min_samples_leaf': 33, 'criterion': 'absolute_error', 'max_depth': 30, 'min_weight_fraction_leaf': 0.02, 'max_leaf_nodes': 150, 'bootstrap': True, 'ccp_alpha': 0.089, 'max_samples': 0.5}. Best is trial 621 with value: -0.18112741123578058.
[I 2025-04-15 23:56:04,310] Trial 975 finished with value: -0.18296052591620554 and parameters: {'n_estimators': 3367, 'min_samples_split': 152, 'max_features': 0.89, 'min_samples_leaf': 29, 'criterion': 'absolute_error', 'max_depth': 45, 'min_weight_fraction_leaf': 0.02, 'max_leaf_nodes': 50, 'bootstrap': True, 'ccp_alpha': 0.06, 'max_samples': 0.5}. Best is trial 621 with value: -0.18112741123578058.
[I 2025-04-15 23:56:07,842] Trial 976 finished with value: -0.18271626709821404 and parameters: {'n_estimators': 3182, 'min_samples_split': 37, 'max_features': 0.38, 'min_samples_leaf': 31, 'criterion': 'absolute_error', 'max_depth': 15, 'min_weight_fraction_leaf': 0.02, 'max_leaf_nodes': 20, 'bootstrap': True, 'ccp_alpha': 0.26, 'max_samples': 0.5}. Best is trial 621 with value: -0.18112741123578058.
[I 2025-04-15 23:56:11,279] Trial 977 finished with value: -0.1826306072874273 and parameters: {'n_estimators': 2954, 'min_samples_split': 170, 'max_features': 0.8300000000000001, 'min_samples_leaf': 26, 'criterion': 'absolute_error', 'max_depth': 30, 'min_weight_fraction_leaf': 0.06, 'max_leaf_nodes': 100, 'bootstrap': True, 'ccp_alpha': 0.055, 'max_samples': 0.5}. Best is trial 621 with value: -0.18112741123578058.
[I 2025-04-15 23:56:14,260] Trial 978 finished with value: -0.18286887379730313 and parameters: {'n_estimators': 2686, 'min_samples_split': 159, 'max_features': 0.78, 'min_samples_leaf': 43, 'criterion': 'absolute_error', 'max_depth': 45, 'min_weight_fraction_leaf': 0.01, 'max_leaf_nodes': 100, 'bootstrap': True, 'ccp_alpha': 0.1, 'max_samples': 0.5}. Best is trial 621 with value: -0.18112741123578058.
[I 2025-04-15 23:56:14,670] Trial 979 finished with value: -18.37282539556764 and parameters: {'n_estimators': 228, 'min_samples_split': 57, 'max_features': 0.22, 'min_samples_leaf': 22, 'criterion': 'poisson', 'max_depth': 20, 'min_weight_fraction_leaf': 0.0, 'max_leaf_nodes': 150, 'bootstrap': True, 'ccp_alpha': 0.195, 'max_samples': 0.5}. Best is trial 621 with value: -0.18112741123578058.
[I 2025-04-15 23:56:18,640] Trial 980 finished with value: -0.1833484437987783 and parameters: {'n_estimators': 3524, 'min_samples_split': 47, 'max_features': 0.91, 'min_samples_leaf': 28, 'criterion': 'absolute_error', 'max_depth': 30, 'min_weight_fraction_leaf': 0.01, 'max_leaf_nodes': 100, 'bootstrap': True, 'ccp_alpha': 0.112, 'max_samples': 0.5}. Best is trial 621 with value: -0.18112741123578058.
[I 2025-04-15 23:56:20,875] Trial 981 finished with value: -0.18669968437761209 and parameters: {'n_estimators': 1878, 'min_samples_split': 166, 'max_features': 0.86, 'min_samples_leaf': 36, 'criterion': 'absolute_error', 'max_depth': 15, 'min_weight_fraction_leaf': 0.02, 'max_leaf_nodes': 10, 'bootstrap': True, 'ccp_alpha': 0.082, 'max_samples': 0.5}. Best is trial 621 with value: -0.18112741123578058.
[I 2025-04-15 23:56:24,463] Trial 982 finished with value: -0.18271852359223187 and parameters: {'n_estimators': 3072, 'min_samples_split': 180, 'max_features': 0.3, 'min_samples_leaf': 39, 'criterion': 'absolute_error', 'max_depth': 45, 'min_weight_fraction_leaf': 0.05, 'max_leaf_nodes': None, 'bootstrap': True, 'ccp_alpha': 0.07, 'max_samples': 0.5}. Best is trial 621 with value: -0.18112741123578058.
[I 2025-04-15 23:56:28,741] Trial 983 finished with value: -0.18350529771928065 and parameters: {'n_estimators': 3738, 'min_samples_split': 15, 'max_features': 0.6, 'min_samples_leaf': 32, 'criterion': 'absolute_error', 'max_depth': None, 'min_weight_fraction_leaf': 0.02, 'max_leaf_nodes': 100, 'bootstrap': True, 'ccp_alpha': 0.105, 'max_samples': 0.5}. Best is trial 621 with value: -0.18112741123578058.
[I 2025-04-15 23:56:29,332] Trial 984 finished with value: -0.1936417107583833 and parameters: {'n_estimators': 486, 'min_samples_split': 23, 'max_features': 0.8200000000000001, 'min_samples_leaf': 25, 'criterion': 'absolute_error', 'max_depth': 60, 'min_weight_fraction_leaf': 0.01, 'max_leaf_nodes': 50, 'bootstrap': False, 'ccp_alpha': 0.08700000000000001}. Best is trial 621 with value: -0.18112741123578058.
[I 2025-04-15 23:56:32,948] Trial 985 finished with value: -0.1829033061562247 and parameters: {'n_estimators': 3269, 'min_samples_split': 41, 'max_features': 0.35000000000000003, 'min_samples_leaf': 30, 'criterion': 'absolute_error', 'max_depth': 30, 'min_weight_fraction_leaf': 0.04, 'max_leaf_nodes': 100, 'bootstrap': True, 'ccp_alpha': 0.20500000000000002, 'max_samples': 0.5}. Best is trial 621 with value: -0.18112741123578058.
[I 2025-04-15 23:56:36,657] Trial 986 finished with value: -0.18294821797975577 and parameters: {'n_estimators': 2861, 'min_samples_split': 173, 'max_features': 0.88, 'min_samples_leaf': 28, 'criterion': 'absolute_error', 'max_depth': 5, 'min_weight_fraction_leaf': 0.0, 'max_leaf_nodes': 150, 'bootstrap': True, 'ccp_alpha': 0.095, 'max_samples': 0.5}. Best is trial 621 with value: -0.18112741123578058.
[I 2025-04-15 23:56:40,643] Trial 987 finished with value: -0.18250848157685207 and parameters: {'n_estimators': 3087, 'min_samples_split': 148, 'max_features': 0.93, 'min_samples_leaf': 23, 'criterion': 'absolute_error', 'max_depth': 30, 'min_weight_fraction_leaf': 0.02, 'max_leaf_nodes': 100, 'bootstrap': True, 'ccp_alpha': 0.075, 'max_samples': 0.5}. Best is trial 621 with value: -0.18112741123578058.
[I 2025-04-15 23:56:43,750] Trial 988 finished with value: -0.1827941015217524 and parameters: {'n_estimators': 2616, 'min_samples_split': 146, 'max_features': 0.98, 'min_samples_leaf': 22, 'criterion': 'absolute_error', 'max_depth': 30, 'min_weight_fraction_leaf': 0.02, 'max_leaf_nodes': 100, 'bootstrap': True, 'ccp_alpha': 0.075, 'max_samples': 0.5}. Best is trial 621 with value: -0.18112741123578058.
[I 2025-04-15 23:56:47,384] Trial 989 finished with value: -17.840598972531453 and parameters: {'n_estimators': 3431, 'min_samples_split': 149, 'max_features': 0.9600000000000001, 'min_samples_leaf': 18, 'criterion': 'friedman_mse', 'max_depth': 30, 'min_weight_fraction_leaf': 0.02, 'max_leaf_nodes': 100, 'bootstrap': True, 'ccp_alpha': 0.08, 'max_samples': 0.5}. Best is trial 621 with value: -0.18112741123578058.
[I 2025-04-15 23:56:51,048] Trial 990 finished with value: -0.19327700810294585 and parameters: {'n_estimators': 2936, 'min_samples_split': 150, 'max_features': 0.9500000000000001, 'min_samples_leaf': 21, 'criterion': 'absolute_error', 'max_depth': 30, 'min_weight_fraction_leaf': 0.02, 'max_leaf_nodes': 100, 'bootstrap': True, 'ccp_alpha': 0.076, 'max_samples': None}. Best is trial 621 with value: -0.18112741123578058.
[I 2025-04-15 23:56:51,605] Trial 991 finished with value: -0.1877534658271399 and parameters: {'n_estimators': 356, 'min_samples_split': 151, 'max_features': 0.9400000000000001, 'min_samples_leaf': 7, 'criterion': 'absolute_error', 'max_depth': 30, 'min_weight_fraction_leaf': 0.02, 'max_leaf_nodes': 100, 'bootstrap': True, 'ccp_alpha': 0.085, 'max_samples': 0.5}. Best is trial 621 with value: -0.18112741123578058.
[I 2025-04-15 23:56:55,098] Trial 992 finished with value: -0.18262686114904253 and parameters: {'n_estimators': 3149, 'min_samples_split': 153, 'max_features': 0.9600000000000001, 'min_samples_leaf': 20, 'criterion': 'absolute_error', 'max_depth': 30, 'min_weight_fraction_leaf': 0.02, 'max_leaf_nodes': 100, 'bootstrap': True, 'ccp_alpha': 0.075, 'max_samples': 0.5}. Best is trial 621 with value: -0.18112741123578058.
[I 2025-04-15 23:56:58,372] Trial 993 finished with value: -0.18269656886765753 and parameters: {'n_estimators': 2739, 'min_samples_split': 155, 'max_features': 0.9400000000000001, 'min_samples_leaf': 19, 'criterion': 'absolute_error', 'max_depth': 30, 'min_weight_fraction_leaf': 0.02, 'max_leaf_nodes': 100, 'bootstrap': True, 'ccp_alpha': 0.082, 'max_samples': 0.5}. Best is trial 621 with value: -0.18112741123578058.
[I 2025-04-15 23:56:58,762] Trial 994 finished with value: -0.18575858766369252 and parameters: {'n_estimators': 200, 'min_samples_split': 148, 'max_features': 0.92, 'min_samples_leaf': 16, 'criterion': 'absolute_error', 'max_depth': 30, 'min_weight_fraction_leaf': 0.03, 'max_leaf_nodes': 100, 'bootstrap': True, 'ccp_alpha': 0.07, 'max_samples': 0.5}. Best is trial 621 with value: -0.18112741123578058.
[I 2025-04-15 23:56:58,950] Trial 995 finished with value: -0.19363616285847823 and parameters: {'n_estimators': 4, 'min_samples_split': 157, 'max_features': 0.9, 'min_samples_leaf': 23, 'criterion': 'absolute_error', 'max_depth': 30, 'min_weight_fraction_leaf': 0.02, 'max_leaf_nodes': 100, 'bootstrap': True, 'ccp_alpha': 0.092, 'max_samples': 0.5}. Best is trial 621 with value: -0.18112741123578058.
[I 2025-04-15 23:57:02,845] Trial 996 finished with value: -0.19328186724328283 and parameters: {'n_estimators': 3283, 'min_samples_split': 143, 'max_features': 0.98, 'min_samples_leaf': 35, 'criterion': 'absolute_error', 'max_depth': 30, 'min_weight_fraction_leaf': 0.03, 'max_leaf_nodes': 100, 'bootstrap': True, 'ccp_alpha': 0.079, 'max_samples': 1.0}. Best is trial 621 with value: -0.18112741123578058.
[I 2025-04-15 23:57:05,372] Trial 997 finished with value: -0.18386968260628342 and parameters: {'n_estimators': 2416, 'min_samples_split': 156, 'max_features': 0.9400000000000001, 'min_samples_leaf': 33, 'criterion': 'absolute_error', 'max_depth': 30, 'min_weight_fraction_leaf': 0.02, 'max_leaf_nodes': 100, 'bootstrap': True, 'ccp_alpha': 0.08600000000000001, 'max_samples': 0.5}. Best is trial 621 with value: -0.18112741123578058.
[I 2025-04-15 23:57:08,837] Trial 998 finished with value: -0.18263640024871738 and parameters: {'n_estimators': 3008, 'min_samples_split': 137, 'max_features': 0.92, 'min_samples_leaf': 24, 'criterion': 'absolute_error', 'max_depth': 30, 'min_weight_fraction_leaf': 0.02, 'max_leaf_nodes': 100, 'bootstrap': True, 'ccp_alpha': 0.07100000000000001, 'max_samples': 0.5}. Best is trial 621 with value: -0.18112741123578058.
[I 2025-04-15 23:57:10,007] Trial 999 finished with value: -17.6625567981094 and parameters: {'n_estimators': 1042, 'min_samples_split': 163, 'max_features': 0.91, 'min_samples_leaf': 31, 'criterion': 'squared_error', 'max_depth': 30, 'min_weight_fraction_leaf': 0.02, 'max_leaf_nodes': 100, 'bootstrap': True, 'ccp_alpha': 0.066, 'max_samples': 0.75}. Best is trial 621 with value: -0.18112741123578058.
[I 2025-04-15 23:57:13,102] Trial 1000 finished with value: -0.1827980373676828 and parameters: {'n_estimators': 2790, 'min_samples_split': 159, 'max_features': 0.93, 'min_samples_leaf': 27, 'criterion': 'absolute_error', 'max_depth': 30, 'min_weight_fraction_leaf': 0.02, 'max_leaf_nodes': 100, 'bootstrap': True, 'ccp_alpha': 0.28800000000000003, 'max_samples': 0.5}. Best is trial 621 with value: -0.18112741123578058.
[I 2025-04-15 23:57:17,216] Trial 1001 finished with value: -0.18324226188122594 and parameters: {'n_estimators': 3478, 'min_samples_split': 148, 'max_features': 0.93, 'min_samples_leaf': 66, 'criterion': 'absolute_error', 'max_depth': 30, 'min_weight_fraction_leaf': 0.02, 'max_leaf_nodes': 100, 'bootstrap': True, 'ccp_alpha': 0.099, 'max_samples': 0.5}. Best is trial 621 with value: -0.18112741123578058.
[I 2025-04-15 23:57:20,833] Trial 1002 finished with value: -0.18264384248723436 and parameters: {'n_estimators': 3155, 'min_samples_split': 142, 'max_features': 0.89, 'min_samples_leaf': 26, 'criterion': 'absolute_error', 'max_depth': 30, 'min_weight_fraction_leaf': 0.02, 'max_leaf_nodes': 100, 'bootstrap': True, 'ccp_alpha': 0.136, 'max_samples': 0.5}. Best is trial 621 with value: -0.18112741123578058.
[I 2025-04-15 23:57:23,307] Trial 1003 finished with value: -0.1936417107583833 and parameters: {'n_estimators': 3000, 'min_samples_split': 151, 'max_features': 0.9, 'min_samples_leaf': 58, 'criterion': 'absolute_error', 'max_depth': 45, 'min_weight_fraction_leaf': 0.03, 'max_leaf_nodes': 100, 'bootstrap': False, 'ccp_alpha': 0.117}. Best is trial 621 with value: -0.18112741123578058.
[I 2025-04-15 23:57:25,807] Trial 1004 finished with value: -0.18474957504634912 and parameters: {'n_estimators': 2152, 'min_samples_split': 114, 'max_features': 0.92, 'min_samples_leaf': 37, 'criterion': 'absolute_error', 'max_depth': 30, 'min_weight_fraction_leaf': 0.02, 'max_leaf_nodes': 100, 'bootstrap': True, 'ccp_alpha': 0.076, 'max_samples': 0.5}. Best is trial 621 with value: -0.18112741123578058.
[I 2025-04-15 23:57:27,426] Trial 1005 finished with value: -0.186856813922143 and parameters: {'n_estimators': 1345, 'min_samples_split': 161, 'max_features': 0.45, 'min_samples_leaf': 29, 'criterion': 'absolute_error', 'max_depth': 30, 'min_weight_fraction_leaf': 0.02, 'max_leaf_nodes': 100, 'bootstrap': True, 'ccp_alpha': 0.107, 'max_samples': 0.5}. Best is trial 621 with value: -0.18112741123578058.
[I 2025-04-15 23:57:30,221] Trial 1006 finished with value: -18.19187370215049 and parameters: {'n_estimators': 2586, 'min_samples_split': 157, 'max_features': 0.47000000000000003, 'min_samples_leaf': 34, 'criterion': 'poisson', 'max_depth': 45, 'min_weight_fraction_leaf': 0.02, 'max_leaf_nodes': 300, 'bootstrap': True, 'ccp_alpha': 0.091, 'max_samples': 0.5}. Best is trial 621 with value: -0.18112741123578058.
[I 2025-04-15 23:57:34,173] Trial 1007 finished with value: -0.1829622282761733 and parameters: {'n_estimators': 3320, 'min_samples_split': 164, 'max_features': 0.9600000000000001, 'min_samples_leaf': 46, 'criterion': 'absolute_error', 'max_depth': 30, 'min_weight_fraction_leaf': 0.03, 'max_leaf_nodes': 10, 'bootstrap': True, 'ccp_alpha': 0.084, 'max_samples': 0.5}. Best is trial 621 with value: -0.18112741123578058.
[I 2025-04-15 23:57:35,107] Trial 1008 finished with value: -0.1857510156821886 and parameters: {'n_estimators': 657, 'min_samples_split': 177, 'max_features': 0.26, 'min_samples_leaf': 23, 'criterion': 'absolute_error', 'max_depth': 10, 'min_weight_fraction_leaf': 0.02, 'max_leaf_nodes': 50, 'bootstrap': True, 'ccp_alpha': 0.067, 'max_samples': 0.5}. Best is trial 621 with value: -0.18112741123578058.
[I 2025-04-15 23:57:39,742] Trial 1009 finished with value: -0.18293592689184632 and parameters: {'n_estimators': 3855, 'min_samples_split': 156, 'max_features': 0.91, 'min_samples_leaf': 32, 'criterion': 'absolute_error', 'max_depth': 45, 'min_weight_fraction_leaf': 0.02, 'max_leaf_nodes': 100, 'bootstrap': True, 'ccp_alpha': 0.073, 'max_samples': 0.5}. Best is trial 621 with value: -0.18112741123578058.
