[I 2025-04-16 02:08:13,595] Trial 3957 finished with value: -0.1936417107583833 and parameters: {'n_estimators': 779, 'min_samples_split': 116, 'max_features': 0.75, 'min_samples_leaf': 1, 'criterion': 'absolute_error', 'max_depth': 10, 'min_weight_fraction_leaf': 0.0, 'max_leaf_nodes': 300, 'bootstrap': False, 'ccp_alpha': 0.006}. Best is trial 3488 with value: 0.05528345733671649.
[I 2025-04-16 02:08:14,737] Trial 3958 finished with value: -0.1936417107583833 and parameters: {'n_estimators': 606, 'min_samples_split': 10, 'max_features': 0.7100000000000001, 'min_samples_leaf': 3, 'criterion': 'absolute_error', 'max_depth': 15, 'min_weight_fraction_leaf': 0.0, 'max_leaf_nodes': 300, 'bootstrap': False, 'ccp_alpha': 0.018000000000000002}. Best is trial 3488 with value: 0.05528345733671649.
[I 2025-04-16 02:08:15,540] Trial 3959 finished with value: -0.1936417107583833 and parameters: {'n_estimators': 325, 'min_samples_split': 6, 'max_features': 0.73, 'min_samples_leaf': 3, 'criterion': 'absolute_error', 'max_depth': 15, 'min_weight_fraction_leaf': 0.0, 'max_leaf_nodes': 300, 'bootstrap': False, 'ccp_alpha': 0.01}. Best is trial 3488 with value: 0.05528345733671649.
[I 2025-04-16 02:08:16,995] Trial 3960 finished with value: 0.04989223858838325 and parameters: {'n_estimators': 961, 'min_samples_split': 2, 'max_features': 0.8200000000000001, 'min_samples_leaf': 1, 'criterion': 'absolute_error', 'max_depth': 15, 'min_weight_fraction_leaf': 0.0, 'max_leaf_nodes': 300, 'bootstrap': False, 'ccp_alpha': 0.005}. Best is trial 3488 with value: 0.05528345733671649.
[I 2025-04-16 02:08:18,451] Trial 3961 finished with value: -11.360065625225072 and parameters: {'n_estimators': 1116, 'min_samples_split': 2, 'max_features': 0.81, 'min_samples_leaf': 5, 'criterion': 'absolute_error', 'max_depth': 15, 'min_weight_fraction_leaf': 0.0, 'max_leaf_nodes': 300, 'bootstrap': False, 'ccp_alpha': 0.0}. Best is trial 3488 with value: 0.05528345733671649.
[I 2025-04-16 02:08:20,134] Trial 3962 finished with value: -0.1936417107583833 and parameters: {'n_estimators': 1163, 'min_samples_split': 2, 'max_features': 0.8200000000000001, 'min_samples_leaf': 1, 'criterion': 'absolute_error', 'max_depth': 15, 'min_weight_fraction_leaf': 0.0, 'max_leaf_nodes': 300, 'bootstrap': False, 'ccp_alpha': 0.014}. Best is trial 3488 with value: 0.05528345733671649.
[I 2025-04-16 02:08:21,530] Trial 3963 finished with value: -17.528986382275598 and parameters: {'n_estimators': 982, 'min_samples_split': 2, 'max_features': 0.8200000000000001, 'min_samples_leaf': 3, 'criterion': 'friedman_mse', 'max_depth': 15, 'min_weight_fraction_leaf': 0.0, 'max_leaf_nodes': 300, 'bootstrap': False, 'ccp_alpha': 0.01}. Best is trial 3488 with value: 0.05528345733671649.
[I 2025-04-16 02:08:22,927] Trial 3964 finished with value: -0.1936417107583833 and parameters: {'n_estimators': 1044, 'min_samples_split': 2, 'max_features': 0.81, 'min_samples_leaf': 74, 'criterion': 'absolute_error', 'max_depth': 15, 'min_weight_fraction_leaf': 0.0, 'max_leaf_nodes': None, 'bootstrap': False, 'ccp_alpha': 0.021}. Best is trial 3488 with value: 0.05528345733671649.
[I 2025-04-16 02:08:24,534] Trial 3965 finished with value: -0.06895771395538393 and parameters: {'n_estimators': 1174, 'min_samples_split': 2, 'max_features': 0.8, 'min_samples_leaf': 5, 'criterion': 'absolute_error', 'max_depth': 15, 'min_weight_fraction_leaf': 0.0, 'max_leaf_nodes': 300, 'bootstrap': False, 'ccp_alpha': 0.005}. Best is trial 3488 with value: 0.05528345733671649.
[I 2025-04-16 02:08:26,034] Trial 3966 finished with value: -0.1936417107583833 and parameters: {'n_estimators': 1105, 'min_samples_split': 2, 'max_features': 0.8200000000000001, 'min_samples_leaf': 1, 'criterion': 'absolute_error', 'max_depth': 15, 'min_weight_fraction_leaf': 0.0, 'max_leaf_nodes': 300, 'bootstrap': False, 'ccp_alpha': 0.016}. Best is trial 3488 with value: 0.05528345733671649.
[I 2025-04-16 02:08:27,370] Trial 3967 finished with value: 0.024416753056532924 and parameters: {'n_estimators': 1037, 'min_samples_split': 2, 'max_features': 0.81, 'min_samples_leaf': 3, 'criterion': 'absolute_error', 'max_depth': 15, 'min_weight_fraction_leaf': 0.0, 'max_leaf_nodes': 300, 'bootstrap': False, 'ccp_alpha': 0.005}. Best is trial 3488 with value: 0.05528345733671649.
[I 2025-04-16 02:08:28,677] Trial 3968 finished with value: -11.414757049288529 and parameters: {'n_estimators': 861, 'min_samples_split': 6, 'max_features': 0.8200000000000001, 'min_samples_leaf': 5, 'criterion': 'absolute_error', 'max_depth': 15, 'min_weight_fraction_leaf': 0.0, 'max_leaf_nodes': 300, 'bootstrap': False, 'ccp_alpha': 0.0}. Best is trial 3488 with value: 0.05528345733671649.
[I 2025-04-16 02:08:29,988] Trial 3969 finished with value: -0.1936417107583833 and parameters: {'n_estimators': 993, 'min_samples_split': 6, 'max_features': 0.8200000000000001, 'min_samples_leaf': 1, 'criterion': 'absolute_error', 'max_depth': 15, 'min_weight_fraction_leaf': 0.0, 'max_leaf_nodes': 300, 'bootstrap': False, 'ccp_alpha': 0.01}. Best is trial 3488 with value: 0.05528345733671649.
[I 2025-04-16 02:08:31,367] Trial 3970 finished with value: -0.1936417107583833 and parameters: {'n_estimators': 805, 'min_samples_split': 2, 'max_features': 0.8, 'min_samples_leaf': 3, 'criterion': 'absolute_error', 'max_depth': 15, 'min_weight_fraction_leaf': 0.08, 'max_leaf_nodes': 300, 'bootstrap': False, 'ccp_alpha': 0.014}. Best is trial 3488 with value: 0.05528345733671649.
[I 2025-04-16 02:08:32,961] Trial 3971 finished with value: -17.528986382275566 and parameters: {'n_estimators': 966, 'min_samples_split': 6, 'max_features': 0.8200000000000001, 'min_samples_leaf': 3, 'criterion': 'squared_error', 'max_depth': 15, 'min_weight_fraction_leaf': 0.0, 'max_leaf_nodes': 300, 'bootstrap': False, 'ccp_alpha': 0.005}. Best is trial 3488 with value: 0.05528345733671649.
[I 2025-04-16 02:08:34,226] Trial 3972 finished with value: -0.1936417107583833 and parameters: {'n_estimators': 905, 'min_samples_split': 2, 'max_features': 0.8300000000000001, 'min_samples_leaf': 1, 'criterion': 'absolute_error', 'max_depth': 15, 'min_weight_fraction_leaf': 0.1, 'max_leaf_nodes': 300, 'bootstrap': False, 'ccp_alpha': 0.023}. Best is trial 3488 with value: 0.05528345733671649.
[I 2025-04-16 02:08:35,912] Trial 3973 finished with value: -0.1936417107583833 and parameters: {'n_estimators': 1164, 'min_samples_split': 6, 'max_features': 0.78, 'min_samples_leaf': 5, 'criterion': 'absolute_error', 'max_depth': 15, 'min_weight_fraction_leaf': 0.0, 'max_leaf_nodes': 300, 'bootstrap': False, 'ccp_alpha': 0.01}. Best is trial 3488 with value: 0.05528345733671649.
[I 2025-04-16 02:08:37,102] Trial 3974 finished with value: -10.527143143392053 and parameters: {'n_estimators': 898, 'min_samples_split': 2, 'max_features': 0.8, 'min_samples_leaf': 3, 'criterion': 'absolute_error', 'max_depth': 20, 'min_weight_fraction_leaf': 0.0, 'max_leaf_nodes': 300, 'bootstrap': False, 'ccp_alpha': 0.0}. Best is trial 3488 with value: 0.05528345733671649.
[I 2025-04-16 02:08:38,363] Trial 3975 finished with value: -0.1936417107583833 and parameters: {'n_estimators': 780, 'min_samples_split': 6, 'max_features': 0.8, 'min_samples_leaf': 1, 'criterion': 'absolute_error', 'max_depth': 15, 'min_weight_fraction_leaf': 0.0, 'max_leaf_nodes': 50, 'bootstrap': False, 'ccp_alpha': 0.014}. Best is trial 3488 with value: 0.05528345733671649.
[I 2025-04-16 02:08:39,547] Trial 3976 finished with value: -0.10821333320774303 and parameters: {'n_estimators': 688, 'min_samples_split': 2, 'max_features': 0.79, 'min_samples_leaf': 5, 'criterion': 'absolute_error', 'max_depth': 15, 'min_weight_fraction_leaf': 0.0, 'max_leaf_nodes': 300, 'bootstrap': False, 'ccp_alpha': 0.005}. Best is trial 3488 with value: 0.05528345733671649.
[I 2025-04-16 02:08:40,946] Trial 3977 finished with value: -0.1936417107583833 and parameters: {'n_estimators': 931, 'min_samples_split': 9, 'max_features': 0.8300000000000001, 'min_samples_leaf': 3, 'criterion': 'absolute_error', 'max_depth': 15, 'min_weight_fraction_leaf': 0.0, 'max_leaf_nodes': 300, 'bootstrap': False, 'ccp_alpha': 0.018000000000000002}. Best is trial 3488 with value: 0.05528345733671649.
[I 2025-04-16 02:08:42,268] Trial 3978 finished with value: -0.1936417107583833 and parameters: {'n_estimators': 753, 'min_samples_split': 6, 'max_features': 0.8200000000000001, 'min_samples_leaf': 1, 'criterion': 'absolute_error', 'max_depth': 15, 'min_weight_fraction_leaf': 0.0, 'max_leaf_nodes': 300, 'bootstrap': False, 'ccp_alpha': 0.009000000000000001}. Best is trial 3488 with value: 0.05528345733671649.
[I 2025-04-16 02:08:43,614] Trial 3979 finished with value: -10.513755696808696 and parameters: {'n_estimators': 1137, 'min_samples_split': 6, 'max_features': 0.79, 'min_samples_leaf': 4, 'criterion': 'absolute_error', 'max_depth': 10, 'min_weight_fraction_leaf': 0.0, 'max_leaf_nodes': 300, 'bootstrap': False, 'ccp_alpha': 0.0}. Best is trial 3488 with value: 0.05528345733671649.
[I 2025-04-16 02:08:44,758] Trial 3980 finished with value: -17.031910084359343 and parameters: {'n_estimators': 707, 'min_samples_split': 2, 'max_features': 0.78, 'min_samples_leaf': 1, 'criterion': 'poisson', 'max_depth': 15, 'min_weight_fraction_leaf': 0.0, 'max_leaf_nodes': 10, 'bootstrap': False, 'ccp_alpha': 0.009000000000000001}. Best is trial 3488 with value: 0.05528345733671649.
[I 2025-04-16 02:08:46,285] Trial 3981 finished with value: -0.2664034612040761 and parameters: {'n_estimators': 1147, 'min_samples_split': 10, 'max_features': 0.64, 'min_samples_leaf': 3, 'criterion': 'absolute_error', 'max_depth': 15, 'min_weight_fraction_leaf': 0.0, 'max_leaf_nodes': 300, 'bootstrap': False, 'ccp_alpha': 0.005}. Best is trial 3488 with value: 0.05528345733671649.
[I 2025-04-16 02:08:47,311] Trial 3982 finished with value: -0.1936417107583833 and parameters: {'n_estimators': 624, 'min_samples_split': 6, 'max_features': 0.8, 'min_samples_leaf': 5, 'criterion': 'absolute_error', 'max_depth': 15, 'min_weight_fraction_leaf': 0.0, 'max_leaf_nodes': 300, 'bootstrap': False, 'ccp_alpha': 0.014}. Best is trial 3488 with value: 0.05528345733671649.
[I 2025-04-16 02:08:48,579] Trial 3983 finished with value: -0.1936417107583833 and parameters: {'n_estimators': 880, 'min_samples_split': 2, 'max_features': 0.67, 'min_samples_leaf': 1, 'criterion': 'absolute_error', 'max_depth': 15, 'min_weight_fraction_leaf': 0.0, 'max_leaf_nodes': 300, 'bootstrap': False, 'ccp_alpha': 0.023}. Best is trial 3488 with value: 0.05528345733671649.
[I 2025-04-16 02:08:49,549] Trial 3984 finished with value: -14.782798070676037 and parameters: {'n_estimators': 578, 'min_samples_split': 6, 'max_features': 0.77, 'min_samples_leaf': 3, 'criterion': 'absolute_error', 'max_depth': 15, 'min_weight_fraction_leaf': 0.0, 'max_leaf_nodes': 300, 'bootstrap': False, 'ccp_alpha': 0.0}. Best is trial 3488 with value: 0.05528345733671649.
[I 2025-04-16 02:08:51,003] Trial 3985 finished with value: -0.1936417107583833 and parameters: {'n_estimators': 923, 'min_samples_split': 9, 'max_features': 0.8200000000000001, 'min_samples_leaf': 5, 'criterion': 'absolute_error', 'max_depth': 15, 'min_weight_fraction_leaf': 0.0, 'max_leaf_nodes': 300, 'bootstrap': False, 'ccp_alpha': 0.242}. Best is trial 3488 with value: 0.05528345733671649.
[I 2025-04-16 02:08:52,036] Trial 3986 finished with value: -0.1936417107583833 and parameters: {'n_estimators': 524, 'min_samples_split': 2, 'max_features': 0.78, 'min_samples_leaf': 1, 'criterion': 'absolute_error', 'max_depth': 15, 'min_weight_fraction_leaf': 0.0, 'max_leaf_nodes': 300, 'bootstrap': False, 'ccp_alpha': 0.009000000000000001}. Best is trial 3488 with value: 0.05528345733671649.
[I 2025-04-16 02:08:53,166] Trial 3987 finished with value: -17.52898638227494 and parameters: {'n_estimators': 754, 'min_samples_split': 10, 'max_features': 0.8300000000000001, 'min_samples_leaf': 3, 'criterion': 'friedman_mse', 'max_depth': 15, 'min_weight_fraction_leaf': 0.0, 'max_leaf_nodes': 300, 'bootstrap': False, 'ccp_alpha': 0.033}. Best is trial 3488 with value: 0.05528345733671649.
[I 2025-04-16 02:08:54,154] Trial 3988 finished with value: -0.1936417107583833 and parameters: {'n_estimators': 483, 'min_samples_split': 6, 'max_features': 0.7000000000000001, 'min_samples_leaf': 1, 'criterion': 'absolute_error', 'max_depth': 15, 'min_weight_fraction_leaf': 0.0, 'max_leaf_nodes': 300, 'bootstrap': False, 'ccp_alpha': 0.016}. Best is trial 3488 with value: 0.05528345733671649.
[I 2025-04-16 02:08:55,630] Trial 3989 finished with value: -0.09626466717380859 and parameters: {'n_estimators': 1138, 'min_samples_split': 6, 'max_features': 0.76, 'min_samples_leaf': 5, 'criterion': 'absolute_error', 'max_depth': 15, 'min_weight_fraction_leaf': 0.0, 'max_leaf_nodes': 300, 'bootstrap': False, 'ccp_alpha': 0.005}. Best is trial 3488 with value: 0.05528345733671649.
[I 2025-04-16 02:08:56,813] Trial 3990 finished with value: -0.1936417107583833 and parameters: {'n_estimators': 707, 'min_samples_split': 2, 'max_features': 0.79, 'min_samples_leaf': 3, 'criterion': 'absolute_error', 'max_depth': 15, 'min_weight_fraction_leaf': 0.0, 'max_leaf_nodes': 300, 'bootstrap': False, 'ccp_alpha': 0.01}. Best is trial 3488 with value: 0.05528345733671649.
[I 2025-04-16 02:08:57,600] Trial 3991 finished with value: -0.1936417107583833 and parameters: {'n_estimators': 340, 'min_samples_split': 10, 'max_features': 0.68, 'min_samples_leaf': 97, 'criterion': 'absolute_error', 'max_depth': 15, 'min_weight_fraction_leaf': 0.0, 'max_leaf_nodes': 300, 'bootstrap': False, 'ccp_alpha': 0.005}. Best is trial 3488 with value: 0.05528345733671649.
[I 2025-04-16 02:08:58,873] Trial 3992 finished with value: -0.1936417107583833 and parameters: {'n_estimators': 919, 'min_samples_split': 6, 'max_features': 0.8200000000000001, 'min_samples_leaf': 1, 'criterion': 'absolute_error', 'max_depth': 15, 'min_weight_fraction_leaf': 0.0, 'max_leaf_nodes': None, 'bootstrap': False, 'ccp_alpha': 0.16}. Best is trial 3488 with value: 0.05528345733671649.
[I 2025-04-16 02:08:59,556] Trial 3993 finished with value: -0.1936417107583833 and parameters: {'n_estimators': 168, 'min_samples_split': 2, 'max_features': 0.77, 'min_samples_leaf': 5, 'criterion': 'absolute_error', 'max_depth': 15, 'min_weight_fraction_leaf': 0.0, 'max_leaf_nodes': 300, 'bootstrap': False, 'ccp_alpha': 0.017}. Best is trial 3488 with value: 0.05528345733671649.
[I 2025-04-16 02:09:00,651] Trial 3994 finished with value: -0.2541225321112899 and parameters: {'n_estimators': 594, 'min_samples_split': 10, 'max_features': 0.7100000000000001, 'min_samples_leaf': 3, 'criterion': 'absolute_error', 'max_depth': 20, 'min_weight_fraction_leaf': 0.0, 'max_leaf_nodes': 300, 'bootstrap': False, 'ccp_alpha': 0.005}. Best is trial 3488 with value: 0.05528345733671649.
[I 2025-04-16 02:09:01,586] Trial 3995 finished with value: -0.1936417107583833 and parameters: {'n_estimators': 484, 'min_samples_split': 6, 'max_features': 0.75, 'min_samples_leaf': 1, 'criterion': 'absolute_error', 'max_depth': 15, 'min_weight_fraction_leaf': 0.0, 'max_leaf_nodes': 300, 'bootstrap': False, 'ccp_alpha': 0.013000000000000001}. Best is trial 3488 with value: 0.05528345733671649.
[I 2025-04-16 02:09:02,712] Trial 3996 finished with value: -8.287418353309386 and parameters: {'n_estimators': 774, 'min_samples_split': 2, 'max_features': 0.8, 'min_samples_leaf': 3, 'criterion': 'squared_error', 'max_depth': 15, 'min_weight_fraction_leaf': 0.0, 'max_leaf_nodes': 300, 'bootstrap': False, 'ccp_alpha': 0.0}. Best is trial 3488 with value: 0.05528345733671649.
[I 2025-04-16 02:09:03,410] Trial 3997 finished with value: -0.1936417107583833 and parameters: {'n_estimators': 171, 'min_samples_split': 10, 'max_features': 0.73, 'min_samples_leaf': 5, 'criterion': 'absolute_error', 'max_depth': 15, 'min_weight_fraction_leaf': 0.0, 'max_leaf_nodes': 300, 'bootstrap': False, 'ccp_alpha': 0.023}. Best is trial 3488 with value: 0.05528345733671649.
[I 2025-04-16 02:09:04,265] Trial 3998 finished with value: -0.1936417107583833 and parameters: {'n_estimators': 413, 'min_samples_split': 111, 'max_features': 0.7000000000000001, 'min_samples_leaf': 1, 'criterion': 'absolute_error', 'max_depth': 15, 'min_weight_fraction_leaf': 0.0, 'max_leaf_nodes': 300, 'bootstrap': False, 'ccp_alpha': 0.011}. Best is trial 3488 with value: 0.05528345733671649.
[I 2025-04-16 02:09:05,263] Trial 3999 finished with value: -12.37054120580674 and parameters: {'n_estimators': 635, 'min_samples_split': 6, 'max_features': 0.66, 'min_samples_leaf': 3, 'criterion': 'absolute_error', 'max_depth': 15, 'min_weight_fraction_leaf': 0.0, 'max_leaf_nodes': 300, 'bootstrap': False, 'ccp_alpha': 0.0}. Best is trial 3488 with value: 0.05528345733671649.
[I 2025-04-16 02:09:06,690] Trial 4000 finished with value: -0.1936417107583833 and parameters: {'n_estimators': 1137, 'min_samples_split': 2, 'max_features': 0.77, 'min_samples_leaf': 3, 'criterion': 'absolute_error', 'max_depth': 15, 'min_weight_fraction_leaf': 0.0, 'max_leaf_nodes': 300, 'bootstrap': False, 'ccp_alpha': 0.019}. Best is trial 3488 with value: 0.05528345733671649.
[I 2025-04-16 02:09:08,048] Trial 4001 finished with value: -17.52898638227553 and parameters: {'n_estimators': 949, 'min_samples_split': 6, 'max_features': 0.72, 'min_samples_leaf': 1, 'criterion': 'poisson', 'max_depth': 15, 'min_weight_fraction_leaf': 0.0, 'max_leaf_nodes': 300, 'bootstrap': False, 'ccp_alpha': 0.209}. Best is trial 3488 with value: 0.05528345733671649.
[I 2025-04-16 02:09:08,871] Trial 4002 finished with value: -0.1936417107583833 and parameters: {'n_estimators': 313, 'min_samples_split': 10, 'max_features': 0.75, 'min_samples_leaf': 5, 'criterion': 'absolute_error', 'max_depth': 10, 'min_weight_fraction_leaf': 0.0, 'max_leaf_nodes': 50, 'bootstrap': False, 'ccp_alpha': 0.009000000000000001}. Best is trial 3488 with value: 0.05528345733671649.
[I 2025-04-16 02:09:09,394] Trial 4003 finished with value: -0.1936417107583833 and parameters: {'n_estimators': 4, 'min_samples_split': 6, 'max_features': 0.79, 'min_samples_leaf': 1, 'criterion': 'absolute_error', 'max_depth': 15, 'min_weight_fraction_leaf': 0.0, 'max_leaf_nodes': 300, 'bootstrap': False, 'ccp_alpha': 0.005}. Best is trial 3488 with value: 0.05528345733671649.
[I 2025-04-16 02:09:10,497] Trial 4004 finished with value: -0.1936417107583833 and parameters: {'n_estimators': 633, 'min_samples_split': 5, 'max_features': 0.8200000000000001, 'min_samples_leaf': 3, 'criterion': 'absolute_error', 'max_depth': 15, 'min_weight_fraction_leaf': 0.0, 'max_leaf_nodes': 300, 'bootstrap': False, 'ccp_alpha': 0.014}. Best is trial 3488 with value: 0.05528345733671649.
[I 2025-04-16 02:09:11,460] Trial 4005 finished with value: -0.1936417107583833 and parameters: {'n_estimators': 450, 'min_samples_split': 2, 'max_features': 0.73, 'min_samples_leaf': 5, 'criterion': 'absolute_error', 'max_depth': 15, 'min_weight_fraction_leaf': 0.0, 'max_leaf_nodes': 10, 'bootstrap': False, 'ccp_alpha': 0.006}. Best is trial 3488 with value: 0.05528345733671649.
[I 2025-04-16 02:09:12,731] Trial 4006 finished with value: -0.1936417107583833 and parameters: {'n_estimators': 815, 'min_samples_split': 10, 'max_features': 0.6900000000000001, 'min_samples_leaf': 3, 'criterion': 'absolute_error', 'max_depth': 15, 'min_weight_fraction_leaf': 0.0, 'max_leaf_nodes': 300, 'bootstrap': False, 'ccp_alpha': 0.027}. Best is trial 3488 with value: 0.05528345733671649.
[I 2025-04-16 02:09:13,514] Trial 4007 finished with value: -34.07905163809138 and parameters: {'n_estimators': 273, 'min_samples_split': 2, 'max_features': 0.76, 'min_samples_leaf': 1, 'criterion': 'absolute_error', 'max_depth': 15, 'min_weight_fraction_leaf': 0.0, 'max_leaf_nodes': 300, 'bootstrap': False, 'ccp_alpha': 0.0}. Best is trial 3488 with value: 0.05528345733671649.
[I 2025-04-16 02:09:14,582] Trial 4008 finished with value: -0.1936417107583833 and parameters: {'n_estimators': 582, 'min_samples_split': 10, 'max_features': 0.8, 'min_samples_leaf': 5, 'criterion': 'absolute_error', 'max_depth': 15, 'min_weight_fraction_leaf': 0.0, 'max_leaf_nodes': 300, 'bootstrap': False, 'ccp_alpha': 0.01}. Best is trial 3488 with value: 0.05528345733671649.
[I 2025-04-16 02:09:15,294] Trial 4009 finished with value: -0.1936417107583833 and parameters: {'n_estimators': 160, 'min_samples_split': 6, 'max_features': 0.74, 'min_samples_leaf': 3, 'criterion': 'absolute_error', 'max_depth': 15, 'min_weight_fraction_leaf': 0.0, 'max_leaf_nodes': 300, 'bootstrap': False, 'ccp_alpha': 0.017}. Best is trial 3488 with value: 0.05528345733671649.
[I 2025-04-16 02:09:16,660] Trial 4010 finished with value: 0.01625080753760184 and parameters: {'n_estimators': 903, 'min_samples_split': 2, 'max_features': 0.7100000000000001, 'min_samples_leaf': 1, 'criterion': 'absolute_error', 'max_depth': 15, 'min_weight_fraction_leaf': 0.04, 'max_leaf_nodes': 300, 'bootstrap': False, 'ccp_alpha': 0.005}. Best is trial 3488 with value: 0.05528345733671649.
[I 2025-04-16 02:09:17,527] Trial 4011 finished with value: -17.528986382274876 and parameters: {'n_estimators': 391, 'min_samples_split': 6, 'max_features': 0.8300000000000001, 'min_samples_leaf': 3, 'criterion': 'friedman_mse', 'max_depth': 15, 'min_weight_fraction_leaf': 0.0, 'max_leaf_nodes': 300, 'bootstrap': False, 'ccp_alpha': 0.012}. Best is trial 3488 with value: 0.05528345733671649.
[I 2025-04-16 02:09:18,684] Trial 4012 finished with value: -0.1936417107583833 and parameters: {'n_estimators': 756, 'min_samples_split': 6, 'max_features': 0.78, 'min_samples_leaf': 5, 'criterion': 'absolute_error', 'max_depth': 15, 'min_weight_fraction_leaf': 0.0, 'max_leaf_nodes': 300, 'bootstrap': False, 'ccp_alpha': 0.006}. Best is trial 3488 with value: 0.05528345733671649.
