[I 2025-04-15 23:49:45,367] Trial 851 finished with value: -0.1936417107583833 and parameters: {'n_estimators': 12, 'min_samples_split': 168, 'max_features': 0.91, 'min_samples_leaf': 28, 'criterion': 'absolute_error', 'max_depth': 30, 'min_weight_fraction_leaf': 0.04, 'max_leaf_nodes': 150, 'bootstrap': False, 'ccp_alpha': 0.096}. Best is trial 621 with value: -0.18112741123578058.
[I 2025-04-15 23:49:48,654] Trial 852 finished with value: -17.963308025770566 and parameters: {'n_estimators': 3133, 'min_samples_split': 177, 'max_features': 0.86, 'min_samples_leaf': 32, 'criterion': 'squared_error', 'max_depth': 20, 'min_weight_fraction_leaf': 0.02, 'max_leaf_nodes': 100, 'bootstrap': True, 'ccp_alpha': 0.109, 'max_samples': 0.5}. Best is trial 621 with value: -0.18112741123578058.
[I 2025-04-15 23:49:52,378] Trial 853 finished with value: -0.1829859125934526 and parameters: {'n_estimators': 3329, 'min_samples_split': 136, 'max_features': 0.35000000000000003, 'min_samples_leaf': 24, 'criterion': 'absolute_error', 'max_depth': 45, 'min_weight_fraction_leaf': 0.03, 'max_leaf_nodes': 100, 'bootstrap': True, 'ccp_alpha': 0.057, 'max_samples': 0.5}. Best is trial 621 with value: -0.18112741123578058.
[I 2025-04-15 23:49:55,310] Trial 854 finished with value: -0.18294265332232182 and parameters: {'n_estimators': 2560, 'min_samples_split': 92, 'max_features': 0.8200000000000001, 'min_samples_leaf': 28, 'criterion': 'absolute_error', 'max_depth': None, 'min_weight_fraction_leaf': 0.01, 'max_leaf_nodes': 10, 'bootstrap': True, 'ccp_alpha': 0.084, 'max_samples': 0.5}. Best is trial 621 with value: -0.18112741123578058.
[I 2025-04-15 23:49:58,782] Trial 855 finished with value: -0.1829141817113021 and parameters: {'n_estimators': 2827, 'min_samples_split': 154, 'max_features': 0.8, 'min_samples_leaf': 35, 'criterion': 'absolute_error', 'max_depth': 60, 'min_weight_fraction_leaf': 0.02, 'max_leaf_nodes': 150, 'bootstrap': True, 'ccp_alpha': 0.07100000000000001, 'max_samples': 0.5}. Best is trial 621 with value: -0.18112741123578058.
[I 2025-04-15 23:50:02,173] Trial 856 finished with value: -0.1825661808617863 and parameters: {'n_estimators': 3020, 'min_samples_split': 182, 'max_features': 0.88, 'min_samples_leaf': 41, 'criterion': 'absolute_error', 'max_depth': 30, 'min_weight_fraction_leaf': 0.0, 'max_leaf_nodes': 100, 'bootstrap': True, 'ccp_alpha': 0.12, 'max_samples': 0.5}. Best is trial 621 with value: -0.18112741123578058.
[I 2025-04-15 23:50:06,682] Trial 857 finished with value: -0.18332896998481338 and parameters: {'n_estimators': 3592, 'min_samples_split': 188, 'max_features': 0.48000000000000004, 'min_samples_leaf': 62, 'criterion': 'absolute_error', 'max_depth': 15, 'min_weight_fraction_leaf': 0.01, 'max_leaf_nodes': 50, 'bootstrap': True, 'ccp_alpha': 0.091, 'max_samples': 0.5}. Best is trial 621 with value: -0.18112741123578058.
[I 2025-04-15 23:50:10,137] Trial 858 finished with value: -17.91230266479131 and parameters: {'n_estimators': 3281, 'min_samples_split': 24, 'max_features': 0.41000000000000003, 'min_samples_leaf': 30, 'criterion': 'poisson', 'max_depth': 5, 'min_weight_fraction_leaf': 0.07, 'max_leaf_nodes': 100, 'bootstrap': True, 'ccp_alpha': 0.053, 'max_samples': 0.5}. Best is trial 621 with value: -0.18112741123578058.
[I 2025-04-15 23:50:18,875] Trial 859 finished with value: -0.18456827190856182 and parameters: {'n_estimators': 8058, 'min_samples_split': 44, 'max_features': 0.8400000000000001, 'min_samples_leaf': 25, 'criterion': 'absolute_error', 'max_depth': 45, 'min_weight_fraction_leaf': 0.02, 'max_leaf_nodes': 100, 'bootstrap': True, 'ccp_alpha': 0.08, 'max_samples': 0.5}. Best is trial 621 with value: -0.18112741123578058.
[I 2025-04-15 23:50:20,203] Trial 860 finished with value: -0.1863601435345524 and parameters: {'n_estimators': 1057, 'min_samples_split': 35, 'max_features': 0.22, 'min_samples_leaf': 22, 'criterion': 'absolute_error', 'max_depth': 30, 'min_weight_fraction_leaf': 0.02, 'max_leaf_nodes': None, 'bootstrap': True, 'ccp_alpha': 0.062, 'max_samples': 0.5}. Best is trial 621 with value: -0.18112741123578058.
[I 2025-04-15 23:50:23,302] Trial 861 finished with value: -0.18281972948249997 and parameters: {'n_estimators': 2709, 'min_samples_split': 172, 'max_features': 0.76, 'min_samples_leaf': 33, 'criterion': 'absolute_error', 'max_depth': 30, 'min_weight_fraction_leaf': 0.01, 'max_leaf_nodes': 20, 'bootstrap': True, 'ccp_alpha': 0.101, 'max_samples': 0.5}. Best is trial 621 with value: -0.18112741123578058.
[I 2025-04-15 23:50:26,806] Trial 862 finished with value: -0.19328660235001985 and parameters: {'n_estimators': 3016, 'min_samples_split': 165, 'max_features': 0.9, 'min_samples_leaf': 18, 'criterion': 'absolute_error', 'max_depth': 45, 'min_weight_fraction_leaf': 0.03, 'max_leaf_nodes': 150, 'bootstrap': True, 'ccp_alpha': 0.114, 'max_samples': None}. Best is trial 621 with value: -0.18112741123578058.
[I 2025-04-15 23:50:29,543] Trial 863 finished with value: -0.18372730071853768 and parameters: {'n_estimators': 2343, 'min_samples_split': 21, 'max_features': 0.86, 'min_samples_leaf': 26, 'criterion': 'absolute_error', 'max_depth': 15, 'min_weight_fraction_leaf': 0.06, 'max_leaf_nodes': 100, 'bootstrap': True, 'ccp_alpha': 0.068, 'max_samples': 0.5}. Best is trial 621 with value: -0.18112741123578058.
[I 2025-04-15 23:50:29,961] Trial 864 finished with value: -0.1862085274187944 and parameters: {'n_estimators': 220, 'min_samples_split': 160, 'max_features': 0.26, 'min_samples_leaf': 29, 'criterion': 'absolute_error', 'max_depth': 30, 'min_weight_fraction_leaf': 0.01, 'max_leaf_nodes': 50, 'bootstrap': True, 'ccp_alpha': 0.044, 'max_samples': 0.5}. Best is trial 621 with value: -0.18112741123578058.
[I 2025-04-15 23:50:30,968] Trial 865 finished with value: -0.18590837647831937 and parameters: {'n_estimators': 628, 'min_samples_split': 147, 'max_features': 0.92, 'min_samples_leaf': 23, 'criterion': 'absolute_error', 'max_depth': 45, 'min_weight_fraction_leaf': 0.0, 'max_leaf_nodes': 100, 'bootstrap': True, 'ccp_alpha': 0.091, 'max_samples': 0.5}. Best is trial 621 with value: -0.18112741123578058.
[I 2025-04-15 23:50:34,170] Trial 866 finished with value: -0.1829963766536117 and parameters: {'n_estimators': 2878, 'min_samples_split': 30, 'max_features': 0.9500000000000001, 'min_samples_leaf': 31, 'criterion': 'absolute_error', 'max_depth': 30, 'min_weight_fraction_leaf': 0.02, 'max_leaf_nodes': 10, 'bootstrap': True, 'ccp_alpha': 0.077, 'max_samples': 0.5}. Best is trial 621 with value: -0.18112741123578058.
[I 2025-04-15 23:50:38,841] Trial 867 finished with value: -0.19333586617606877 and parameters: {'n_estimators': 3906, 'min_samples_split': 177, 'max_features': 0.8200000000000001, 'min_samples_leaf': 59, 'criterion': 'absolute_error', 'max_depth': 20, 'min_weight_fraction_leaf': 0.02, 'max_leaf_nodes': 150, 'bootstrap': True, 'ccp_alpha': 0.098, 'max_samples': 1.0}. Best is trial 621 with value: -0.18112741123578058.
[I 2025-04-15 23:50:42,340] Trial 868 finished with value: -17.872443511710276 and parameters: {'n_estimators': 3379, 'min_samples_split': 168, 'max_features': 0.38, 'min_samples_leaf': 1, 'criterion': 'friedman_mse', 'max_depth': 15, 'min_weight_fraction_leaf': 0.05, 'max_leaf_nodes': 100, 'bootstrap': True, 'ccp_alpha': 0.107, 'max_samples': 0.5}. Best is trial 621 with value: -0.18112741123578058.
[I 2025-04-15 23:50:45,822] Trial 869 finished with value: -0.18262969539399226 and parameters: {'n_estimators': 3150, 'min_samples_split': 39, 'max_features': 0.8, 'min_samples_leaf': 27, 'criterion': 'absolute_error', 'max_depth': 45, 'min_weight_fraction_leaf': 0.01, 'max_leaf_nodes': 100, 'bootstrap': True, 'ccp_alpha': 0.084, 'max_samples': 0.5}. Best is trial 621 with value: -0.18112741123578058.
[I 2025-04-15 23:50:48,463] Trial 870 finished with value: -0.1936417107583833 and parameters: {'n_estimators': 2748, 'min_samples_split': 157, 'max_features': 0.88, 'min_samples_leaf': 34, 'criterion': 'absolute_error', 'max_depth': None, 'min_weight_fraction_leaf': 0.02, 'max_leaf_nodes': 100, 'bootstrap': False, 'ccp_alpha': 0.06}. Best is trial 621 with value: -0.18112741123578058.
[I 2025-04-15 23:50:49,088] Trial 871 finished with value: -0.19144629566607216 and parameters: {'n_estimators': 400, 'min_samples_split': 180, 'max_features': 0.85, 'min_samples_leaf': 9, 'criterion': 'absolute_error', 'max_depth': 30, 'min_weight_fraction_leaf': 0.0, 'max_leaf_nodes': 150, 'bootstrap': True, 'ccp_alpha': 0.07100000000000001, 'max_samples': 0.75}. Best is trial 621 with value: -0.18112741123578058.
[I 2025-04-15 23:50:51,934] Trial 872 finished with value: -0.1829861649102565 and parameters: {'n_estimators': 2529, 'min_samples_split': 119, 'max_features': 0.29000000000000004, 'min_samples_leaf': 20, 'criterion': 'absolute_error', 'max_depth': 60, 'min_weight_fraction_leaf': 0.03, 'max_leaf_nodes': 50, 'bootstrap': True, 'ccp_alpha': 0.052000000000000005, 'max_samples': 0.5}. Best is trial 621 with value: -0.18112741123578058.
[I 2025-04-15 23:50:56,126] Trial 873 finished with value: -0.1833387392456834 and parameters: {'n_estimators': 3520, 'min_samples_split': 11, 'max_features': 0.19, 'min_samples_leaf': 29, 'criterion': 'absolute_error', 'max_depth': 10, 'min_weight_fraction_leaf': 0.02, 'max_leaf_nodes': 100, 'bootstrap': True, 'ccp_alpha': 0.066, 'max_samples': 0.5}. Best is trial 621 with value: -0.18112741123578058.
[I 2025-04-15 23:50:59,695] Trial 874 finished with value: -0.18259874391867376 and parameters: {'n_estimators': 3031, 'min_samples_split': 185, 'max_features': 0.78, 'min_samples_leaf': 25, 'criterion': 'absolute_error', 'max_depth': 30, 'min_weight_fraction_leaf': 0.01, 'max_leaf_nodes': None, 'bootstrap': True, 'ccp_alpha': 0.095, 'max_samples': 0.5}. Best is trial 621 with value: -0.18112741123578058.
[I 2025-04-15 23:51:03,503] Trial 875 finished with value: -0.1827900259295001 and parameters: {'n_estimators': 3211, 'min_samples_split': 152, 'max_features': 0.9, 'min_samples_leaf': 27, 'criterion': 'absolute_error', 'max_depth': 45, 'min_weight_fraction_leaf': 0.01, 'max_leaf_nodes': 300, 'bootstrap': True, 'ccp_alpha': 0.037, 'max_samples': 0.5}. Best is trial 621 with value: -0.18112741123578058.
[I 2025-04-15 23:51:03,884] Trial 876 finished with value: -18.585253665312027 and parameters: {'n_estimators': 207, 'min_samples_split': 46, 'max_features': 0.8300000000000001, 'min_samples_leaf': 37, 'criterion': 'squared_error', 'max_depth': 5, 'min_weight_fraction_leaf': 0.02, 'max_leaf_nodes': 10, 'bootstrap': True, 'ccp_alpha': 0.08700000000000001, 'max_samples': 0.5}. Best is trial 621 with value: -0.18112741123578058.
[I 2025-04-15 23:51:07,561] Trial 877 finished with value: -0.1830507845452304 and parameters: {'n_estimators': 2896, 'min_samples_split': 163, 'max_features': 0.86, 'min_samples_leaf': 31, 'criterion': 'absolute_error', 'max_depth': 15, 'min_weight_fraction_leaf': 0.0, 'max_leaf_nodes': 100, 'bootstrap': True, 'ccp_alpha': 0.076, 'max_samples': 0.5}. Best is trial 621 with value: -0.18112741123578058.
[I 2025-04-15 23:51:07,751] Trial 878 finished with value: -0.1936300657214804 and parameters: {'n_estimators': 2, 'min_samples_split': 174, 'max_features': 0.81, 'min_samples_leaf': 48, 'criterion': 'absolute_error', 'max_depth': 30, 'min_weight_fraction_leaf': 0.06, 'max_leaf_nodes': 150, 'bootstrap': True, 'ccp_alpha': 0.059000000000000004, 'max_samples': 0.5}. Best is trial 621 with value: -0.18112741123578058.
[I 2025-04-15 23:51:11,383] Trial 879 finished with value: -0.18300720217447486 and parameters: {'n_estimators': 3385, 'min_samples_split': 26, 'max_features': 0.93, 'min_samples_leaf': 33, 'criterion': 'absolute_error', 'max_depth': 45, 'min_weight_fraction_leaf': 0.01, 'max_leaf_nodes': 100, 'bootstrap': True, 'ccp_alpha': 0.10400000000000001, 'max_samples': 0.5}. Best is trial 621 with value: -0.18112741123578058.
[I 2025-04-15 23:51:14,716] Trial 880 finished with value: -0.18261927312875 and parameters: {'n_estimators': 3129, 'min_samples_split': 31, 'max_features': 0.88, 'min_samples_leaf': 43, 'criterion': 'absolute_error', 'max_depth': 30, 'min_weight_fraction_leaf': 0.02, 'max_leaf_nodes': 100, 'bootstrap': True, 'ccp_alpha': 0.113, 'max_samples': 0.5}. Best is trial 621 with value: -0.18112741123578058.
[I 2025-04-15 23:51:17,891] Trial 881 finished with value: -0.18291728899445356 and parameters: {'n_estimators': 2828, 'min_samples_split': 41, 'max_features': 0.5700000000000001, 'min_samples_leaf': 29, 'criterion': 'absolute_error', 'max_depth': 15, 'min_weight_fraction_leaf': 0.02, 'max_leaf_nodes': 50, 'bootstrap': True, 'ccp_alpha': 0.052000000000000005, 'max_samples': 0.5}. Best is trial 621 with value: -0.18112741123578058.
[I 2025-04-15 23:51:23,533] Trial 882 finished with value: -17.711026793611065 and parameters: {'n_estimators': 5318, 'min_samples_split': 19, 'max_features': 0.97, 'min_samples_leaf': 24, 'criterion': 'poisson', 'max_depth': 30, 'min_weight_fraction_leaf': 0.03, 'max_leaf_nodes': 100, 'bootstrap': True, 'ccp_alpha': 0.1, 'max_samples': 0.5}. Best is trial 621 with value: -0.18112741123578058.
[I 2025-04-15 23:51:26,360] Trial 883 finished with value: -0.18301694353935066 and parameters: {'n_estimators': 2598, 'min_samples_split': 34, 'max_features': 0.15000000000000002, 'min_samples_leaf': 31, 'criterion': 'absolute_error', 'max_depth': 45, 'min_weight_fraction_leaf': 0.04, 'max_leaf_nodes': 150, 'bootstrap': True, 'ccp_alpha': 0.082, 'max_samples': 0.5}. Best is trial 621 with value: -0.18112741123578058.
[I 2025-04-15 23:51:28,697] Trial 884 finished with value: -0.18505877758995543 and parameters: {'n_estimators': 2093, 'min_samples_split': 170, 'max_features': 0.8400000000000001, 'min_samples_leaf': 26, 'criterion': 'absolute_error', 'max_depth': 20, 'min_weight_fraction_leaf': 0.02, 'max_leaf_nodes': 100, 'bootstrap': True, 'ccp_alpha': 0.069, 'max_samples': 0.5}. Best is trial 621 with value: -0.18112741123578058.
[I 2025-04-15 23:51:32,226] Trial 885 finished with value: -0.18263992277755228 and parameters: {'n_estimators': 3045, 'min_samples_split': 178, 'max_features': 0.77, 'min_samples_leaf': 74, 'criterion': 'absolute_error', 'max_depth': 30, 'min_weight_fraction_leaf': 0.01, 'max_leaf_nodes': 10, 'bootstrap': True, 'ccp_alpha': 0.091, 'max_samples': 0.5}. Best is trial 621 with value: -0.18112741123578058.
[I 2025-04-15 23:51:38,500] Trial 886 finished with value: -0.18372830658989123 and parameters: {'n_estimators': 5701, 'min_samples_split': 164, 'max_features': 0.74, 'min_samples_leaf': 14, 'criterion': 'absolute_error', 'max_depth': None, 'min_weight_fraction_leaf': 0.02, 'max_leaf_nodes': 100, 'bootstrap': True, 'ccp_alpha': 0.047, 'max_samples': 0.5}. Best is trial 621 with value: -0.18112741123578058.
[I 2025-04-15 23:51:42,597] Trial 887 finished with value: -0.19331282190904253 and parameters: {'n_estimators': 3259, 'min_samples_split': 23, 'max_features': 0.8, 'min_samples_leaf': 28, 'criterion': 'absolute_error', 'max_depth': 45, 'min_weight_fraction_leaf': 0.0, 'max_leaf_nodes': 150, 'bootstrap': True, 'ccp_alpha': 0.062, 'max_samples': None}. Best is trial 621 with value: -0.18112741123578058.
[I 2025-04-15 23:51:43,226] Trial 888 finished with value: -0.18829625647305007 and parameters: {'n_estimators': 431, 'min_samples_split': 37, 'max_features': 0.87, 'min_samples_leaf': 21, 'criterion': 'absolute_error', 'max_depth': 60, 'min_weight_fraction_leaf': 0.01, 'max_leaf_nodes': 50, 'bootstrap': True, 'ccp_alpha': 0.11800000000000001, 'max_samples': 0.5}. Best is trial 621 with value: -0.18112741123578058.
[I 2025-04-15 23:51:47,246] Trial 889 finished with value: -0.18327186490421954 and parameters: {'n_estimators': 3490, 'min_samples_split': 173, 'max_features': 0.9, 'min_samples_leaf': 38, 'criterion': 'absolute_error', 'max_depth': 30, 'min_weight_fraction_leaf': 0.09, 'max_leaf_nodes': 100, 'bootstrap': True, 'ccp_alpha': 0.107, 'max_samples': 0.5}. Best is trial 621 with value: -0.18112741123578058.
[I 2025-04-15 23:51:49,795] Trial 890 finished with value: -0.1936417107583833 and parameters: {'n_estimators': 2939, 'min_samples_split': 157, 'max_features': 0.31, 'min_samples_leaf': 35, 'criterion': 'absolute_error', 'max_depth': 5, 'min_weight_fraction_leaf': 0.01, 'max_leaf_nodes': 20, 'bootstrap': False, 'ccp_alpha': 0.075}. Best is trial 621 with value: -0.18112741123578058.
[I 2025-04-15 23:51:53,217] Trial 891 finished with value: -0.18273426920055874 and parameters: {'n_estimators': 2770, 'min_samples_split': 190, 'max_features': 0.8300000000000001, 'min_samples_leaf': 31, 'criterion': 'absolute_error', 'max_depth': 45, 'min_weight_fraction_leaf': 0.02, 'max_leaf_nodes': None, 'bootstrap': True, 'ccp_alpha': 0.274, 'max_samples': 0.5}. Best is trial 621 with value: -0.18112741123578058.
[I 2025-04-15 23:51:53,588] Trial 892 finished with value: -0.1854367269134774 and parameters: {'n_estimators': 187, 'min_samples_split': 181, 'max_features': 0.85, 'min_samples_leaf': 23, 'criterion': 'absolute_error', 'max_depth': 15, 'min_weight_fraction_leaf': 0.01, 'max_leaf_nodes': 100, 'bootstrap': True, 'ccp_alpha': 0.056, 'max_samples': 0.5}. Best is trial 621 with value: -0.18112741123578058.
[I 2025-04-15 23:51:57,220] Trial 893 finished with value: -17.8437941602879 and parameters: {'n_estimators': 3745, 'min_samples_split': 26, 'max_features': 0.89, 'min_samples_leaf': 27, 'criterion': 'friedman_mse', 'max_depth': 30, 'min_weight_fraction_leaf': 0.02, 'max_leaf_nodes': 100, 'bootstrap': True, 'ccp_alpha': 0.095, 'max_samples': 1.0}. Best is trial 621 with value: -0.18112741123578058.
[I 2025-04-15 23:52:00,685] Trial 894 finished with value: -0.1827742742331778 and parameters: {'n_estimators': 3218, 'min_samples_split': 168, 'max_features': 0.92, 'min_samples_leaf': 25, 'criterion': 'absolute_error', 'max_depth': 30, 'min_weight_fraction_leaf': 0.06, 'max_leaf_nodes': 150, 'bootstrap': True, 'ccp_alpha': 0.166, 'max_samples': 0.5}. Best is trial 621 with value: -0.18112741123578058.
[I 2025-04-15 23:52:03,973] Trial 895 finished with value: -0.18262524686617523 and parameters: {'n_estimators': 3040, 'min_samples_split': 44, 'max_features': 0.8200000000000001, 'min_samples_leaf': 33, 'criterion': 'absolute_error', 'max_depth': 45, 'min_weight_fraction_leaf': 0.0, 'max_leaf_nodes': 100, 'bootstrap': True, 'ccp_alpha': 0.08600000000000001, 'max_samples': 0.5}. Best is trial 621 with value: -0.18112741123578058.
[I 2025-04-15 23:52:06,823] Trial 896 finished with value: -0.1908455932649936 and parameters: {'n_estimators': 2427, 'min_samples_split': 151, 'max_features': 0.24000000000000002, 'min_samples_leaf': 29, 'criterion': 'absolute_error', 'max_depth': 15, 'min_weight_fraction_leaf': 0.03, 'max_leaf_nodes': 50, 'bootstrap': True, 'ccp_alpha': 0.066, 'max_samples': 0.75}. Best is trial 621 with value: -0.18112741123578058.
[I 2025-04-15 23:52:07,628] Trial 897 finished with value: -0.1873801628020974 and parameters: {'n_estimators': 592, 'min_samples_split': 160, 'max_features': 0.79, 'min_samples_leaf': 27, 'criterion': 'absolute_error', 'max_depth': 30, 'min_weight_fraction_leaf': 0.01, 'max_leaf_nodes': 10, 'bootstrap': True, 'ccp_alpha': 0.216, 'max_samples': 0.5}. Best is trial 621 with value: -0.18112741123578058.
[I 2025-04-15 23:52:10,635] Trial 898 finished with value: -0.18290803509509684 and parameters: {'n_estimators': 2650, 'min_samples_split': 16, 'max_features': 0.86, 'min_samples_leaf': 30, 'criterion': 'absolute_error', 'max_depth': 45, 'min_weight_fraction_leaf': 0.02, 'max_leaf_nodes': 100, 'bootstrap': True, 'ccp_alpha': 0.081, 'max_samples': 0.5}. Best is trial 621 with value: -0.18112741123578058.
[I 2025-04-15 23:52:11,951] Trial 899 finished with value: -0.18716035197996678 and parameters: {'n_estimators': 887, 'min_samples_split': 34, 'max_features': 0.28, 'min_samples_leaf': 23, 'criterion': 'absolute_error', 'max_depth': 30, 'min_weight_fraction_leaf': 0.02, 'max_leaf_nodes': 150, 'bootstrap': True, 'ccp_alpha': 0.099, 'max_samples': 0.5}. Best is trial 621 with value: -0.18112741123578058.
[I 2025-04-15 23:52:15,517] Trial 900 finished with value: -0.18288983271914722 and parameters: {'n_estimators': 3264, 'min_samples_split': 175, 'max_features': 0.34, 'min_samples_leaf': 32, 'criterion': 'absolute_error', 'max_depth': 15, 'min_weight_fraction_leaf': 0.02, 'max_leaf_nodes': 100, 'bootstrap': True, 'ccp_alpha': 0.111, 'max_samples': 0.5}. Best is trial 621 with value: -0.18112741123578058.
[I 2025-04-15 23:52:17,218] Trial 901 finished with value: -18.12161379246985 and parameters: {'n_estimators': 1444, 'min_samples_split': 64, 'max_features': 0.8400000000000001, 'min_samples_leaf': 25, 'criterion': 'squared_error', 'max_depth': 20, 'min_weight_fraction_leaf': 0.01, 'max_leaf_nodes': 100, 'bootstrap': True, 'ccp_alpha': 0.027, 'max_samples': 0.5}. Best is trial 621 with value: -0.18112741123578058.
[I 2025-04-15 23:52:17,810] Trial 902 finished with value: -0.18782989638170214 and parameters: {'n_estimators': 361, 'min_samples_split': 48, 'max_features': 0.88, 'min_samples_leaf': 35, 'criterion': 'absolute_error', 'max_depth': 10, 'min_weight_fraction_leaf': 0.0, 'max_leaf_nodes': 300, 'bootstrap': True, 'ccp_alpha': 0.232, 'max_samples': 0.5}. Best is trial 621 with value: -0.18112741123578058.
[I 2025-04-15 23:52:21,581] Trial 903 finished with value: -0.18328884342864216 and parameters: {'n_estimators': 3528, 'min_samples_split': 185, 'max_features': 0.9400000000000001, 'min_samples_leaf': 29, 'criterion': 'absolute_error', 'max_depth': 60, 'min_weight_fraction_leaf': 0.02, 'max_leaf_nodes': 100, 'bootstrap': True, 'ccp_alpha': 0.073, 'max_samples': 0.5}. Best is trial 621 with value: -0.18112741123578058.
