[I 2025-04-16 02:07:18,271] Trial 3901 finished with value: -0.1936417107583833 and parameters: {'n_estimators': 134, 'min_samples_split': 2, 'max_features': 0.76, 'min_samples_leaf': 3, 'criterion': 'absolute_error', 'max_depth': 15, 'min_weight_fraction_leaf': 0.0, 'max_leaf_nodes': 300, 'bootstrap': False, 'ccp_alpha': 0.014}. Best is trial 3488 with value: 0.05528345733671649.
[I 2025-04-16 02:07:19,331] Trial 3902 finished with value: -0.1936417107583833 and parameters: {'n_estimators': 674, 'min_samples_split': 10, 'max_features': 0.7000000000000001, 'min_samples_leaf': 5, 'criterion': 'absolute_error', 'max_depth': 15, 'min_weight_fraction_leaf': 0.0, 'max_leaf_nodes': 300, 'bootstrap': False, 'ccp_alpha': 0.017}. Best is trial 3488 with value: 0.05528345733671649.
[I 2025-04-16 02:07:20,793] Trial 3903 finished with value: -0.1936417107583833 and parameters: {'n_estimators': 1065, 'min_samples_split': 6, 'max_features': 0.74, 'min_samples_leaf': 1, 'criterion': 'absolute_error', 'max_depth': 15, 'min_weight_fraction_leaf': 0.0, 'max_leaf_nodes': 50, 'bootstrap': False, 'ccp_alpha': 0.009000000000000001}. Best is trial 3488 with value: 0.05528345733671649.
[I 2025-04-16 02:07:21,634] Trial 3904 finished with value: -0.1936417107583833 and parameters: {'n_estimators': 345, 'min_samples_split': 70, 'max_features': 0.78, 'min_samples_leaf': 3, 'criterion': 'absolute_error', 'max_depth': 15, 'min_weight_fraction_leaf': 0.0, 'max_leaf_nodes': 300, 'bootstrap': False, 'ccp_alpha': 0.005}. Best is trial 3488 with value: 0.05528345733671649.
[I 2025-04-16 02:07:22,895] Trial 3905 finished with value: -14.617350610508609 and parameters: {'n_estimators': 886, 'min_samples_split': 10, 'max_features': 0.8200000000000001, 'min_samples_leaf': 1, 'criterion': 'absolute_error', 'max_depth': 15, 'min_weight_fraction_leaf': 0.0, 'max_leaf_nodes': 300, 'bootstrap': False, 'ccp_alpha': 0.0}. Best is trial 3488 with value: 0.05528345733671649.
[I 2025-04-16 02:07:23,873] Trial 3906 finished with value: -0.1936417107583833 and parameters: {'n_estimators': 523, 'min_samples_split': 2, 'max_features': 0.72, 'min_samples_leaf': 5, 'criterion': 'absolute_error', 'max_depth': 15, 'min_weight_fraction_leaf': 0.0, 'max_leaf_nodes': 300, 'bootstrap': False, 'ccp_alpha': 0.024}. Best is trial 3488 with value: 0.05528345733671649.
[I 2025-04-16 02:07:24,539] Trial 3907 finished with value: -0.1936417107583833 and parameters: {'n_estimators': 167, 'min_samples_split': 6, 'max_features': 0.75, 'min_samples_leaf': 3, 'criterion': 'absolute_error', 'max_depth': 15, 'min_weight_fraction_leaf': 0.0, 'max_leaf_nodes': 300, 'bootstrap': False, 'ccp_alpha': 0.01}. Best is trial 3488 with value: 0.05528345733671649.
[I 2025-04-16 02:07:25,761] Trial 3908 finished with value: -0.1936417107583833 and parameters: {'n_estimators': 745, 'min_samples_split': 10, 'max_features': 0.6900000000000001, 'min_samples_leaf': 1, 'criterion': 'absolute_error', 'max_depth': 20, 'min_weight_fraction_leaf': 0.0, 'max_leaf_nodes': 300, 'bootstrap': False, 'ccp_alpha': 0.018000000000000002}. Best is trial 3488 with value: 0.05528345733671649.
[I 2025-04-16 02:07:26,626] Trial 3909 finished with value: -0.1936417107583833 and parameters: {'n_estimators': 416, 'min_samples_split': 6, 'max_features': 0.73, 'min_samples_leaf': 5, 'criterion': 'absolute_error', 'max_depth': 15, 'min_weight_fraction_leaf': 0.0, 'max_leaf_nodes': 300, 'bootstrap': False, 'ccp_alpha': 0.009000000000000001}. Best is trial 3488 with value: 0.05528345733671649.
[I 2025-04-16 02:07:27,167] Trial 3910 finished with value: -18.66286549332387 and parameters: {'n_estimators': 14, 'min_samples_split': 6, 'max_features': 0.77, 'min_samples_leaf': 3, 'criterion': 'poisson', 'max_depth': 15, 'min_weight_fraction_leaf': 0.0, 'max_leaf_nodes': 300, 'bootstrap': False, 'ccp_alpha': 0.005}. Best is trial 3488 with value: 0.05528345733671649.
[I 2025-04-16 02:07:28,168] Trial 3911 finished with value: -0.1936417107583833 and parameters: {'n_estimators': 571, 'min_samples_split': 2, 'max_features': 0.79, 'min_samples_leaf': 1, 'criterion': 'absolute_error', 'max_depth': 15, 'min_weight_fraction_leaf': 0.0, 'max_leaf_nodes': 300, 'bootstrap': False, 'ccp_alpha': 0.013000000000000001}. Best is trial 3488 with value: 0.05528345733671649.
[I 2025-04-16 02:07:28,890] Trial 3912 finished with value: 0.010957663944242624 and parameters: {'n_estimators': 263, 'min_samples_split': 2, 'max_features': 0.75, 'min_samples_leaf': 3, 'criterion': 'absolute_error', 'max_depth': 15, 'min_weight_fraction_leaf': 0.0, 'max_leaf_nodes': 300, 'bootstrap': False, 'ccp_alpha': 0.005}. Best is trial 3488 with value: 0.05528345733671649.
[I 2025-04-16 02:07:30,179] Trial 3913 finished with value: -0.1936417107583833 and parameters: {'n_estimators': 906, 'min_samples_split': 9, 'max_features': 0.7000000000000001, 'min_samples_leaf': 5, 'criterion': 'absolute_error', 'max_depth': 15, 'min_weight_fraction_leaf': 0.0, 'max_leaf_nodes': 300, 'bootstrap': False, 'ccp_alpha': 0.014}. Best is trial 3488 with value: 0.05528345733671649.
[I 2025-04-16 02:07:31,269] Trial 3914 finished with value: -2.7382884827980045 and parameters: {'n_estimators': 689, 'min_samples_split': 6, 'max_features': 0.72, 'min_samples_leaf': 1, 'criterion': 'friedman_mse', 'max_depth': 15, 'min_weight_fraction_leaf': 0.0, 'max_leaf_nodes': 300, 'bootstrap': False, 'ccp_alpha': 0.0}. Best is trial 3488 with value: 0.05528345733671649.
[I 2025-04-16 02:07:32,122] Trial 3915 finished with value: -0.1936417107583833 and parameters: {'n_estimators': 358, 'min_samples_split': 2, 'max_features': 0.8200000000000001, 'min_samples_leaf': 3, 'criterion': 'absolute_error', 'max_depth': 10, 'min_weight_fraction_leaf': 0.0, 'max_leaf_nodes': 300, 'bootstrap': False, 'ccp_alpha': 0.02}. Best is trial 3488 with value: 0.05528345733671649.
[I 2025-04-16 02:07:33,133] Trial 3916 finished with value: -0.1936417107583833 and parameters: {'n_estimators': 536, 'min_samples_split': 10, 'max_features': 0.76, 'min_samples_leaf': 1, 'criterion': 'absolute_error', 'max_depth': 15, 'min_weight_fraction_leaf': 0.0, 'max_leaf_nodes': None, 'bootstrap': False, 'ccp_alpha': 0.009000000000000001}. Best is trial 3488 with value: 0.05528345733671649.
[I 2025-04-16 02:07:34,587] Trial 3917 finished with value: -0.1936417107583833 and parameters: {'n_estimators': 1100, 'min_samples_split': 6, 'max_features': 0.67, 'min_samples_leaf': 5, 'criterion': 'absolute_error', 'max_depth': 15, 'min_weight_fraction_leaf': 0.0, 'max_leaf_nodes': 300, 'bootstrap': False, 'ccp_alpha': 0.029}. Best is trial 3488 with value: 0.05528345733671649.
[I 2025-04-16 02:07:35,291] Trial 3918 finished with value: -0.27069128116090313 and parameters: {'n_estimators': 201, 'min_samples_split': 10, 'max_features': 0.73, 'min_samples_leaf': 3, 'criterion': 'absolute_error', 'max_depth': 15, 'min_weight_fraction_leaf': 0.0, 'max_leaf_nodes': 300, 'bootstrap': False, 'ccp_alpha': 0.005}. Best is trial 3488 with value: 0.05528345733671649.
[I 2025-04-16 02:07:36,412] Trial 3919 finished with value: -48.5354082300025 and parameters: {'n_estimators': 741, 'min_samples_split': 2, 'max_features': 0.8, 'min_samples_leaf': 1, 'criterion': 'absolute_error', 'max_depth': 15, 'min_weight_fraction_leaf': 0.0, 'max_leaf_nodes': 300, 'bootstrap': False, 'ccp_alpha': 0.0}. Best is trial 3488 with value: 0.05528345733671649.
[I 2025-04-16 02:07:37,296] Trial 3920 finished with value: -0.1936417107583833 and parameters: {'n_estimators': 429, 'min_samples_split': 6, 'max_features': 0.7000000000000001, 'min_samples_leaf': 4, 'criterion': 'absolute_error', 'max_depth': 15, 'min_weight_fraction_leaf': 0.0, 'max_leaf_nodes': 300, 'bootstrap': False, 'ccp_alpha': 0.013000000000000001}. Best is trial 3488 with value: 0.05528345733671649.
[I 2025-04-16 02:07:38,010] Trial 3921 finished with value: -0.20329182627004924 and parameters: {'n_estimators': 178, 'min_samples_split': 6, 'max_features': 0.61, 'min_samples_leaf': 3, 'criterion': 'absolute_error', 'max_depth': 15, 'min_weight_fraction_leaf': 0.0, 'max_leaf_nodes': 300, 'bootstrap': False, 'ccp_alpha': 0.005}. Best is trial 3488 with value: 0.05528345733671649.
[I 2025-04-16 02:07:39,342] Trial 3922 finished with value: -0.1936417107583833 and parameters: {'n_estimators': 935, 'min_samples_split': 2, 'max_features': 0.77, 'min_samples_leaf': 1, 'criterion': 'absolute_error', 'max_depth': 15, 'min_weight_fraction_leaf': 0.05, 'max_leaf_nodes': 300, 'bootstrap': False, 'ccp_alpha': 0.018000000000000002}. Best is trial 3488 with value: 0.05528345733671649.
[I 2025-04-16 02:07:40,391] Trial 3923 finished with value: -17.528986382274873 and parameters: {'n_estimators': 540, 'min_samples_split': 10, 'max_features': 0.74, 'min_samples_leaf': 5, 'criterion': 'squared_error', 'max_depth': 15, 'min_weight_fraction_leaf': 0.0, 'max_leaf_nodes': 300, 'bootstrap': False, 'ccp_alpha': 0.011}. Best is trial 3488 with value: 0.05528345733671649.
[I 2025-04-16 02:07:41,241] Trial 3924 finished with value: 0.017935246835757156 and parameters: {'n_estimators': 340, 'min_samples_split': 6, 'max_features': 0.7100000000000001, 'min_samples_leaf': 3, 'criterion': 'absolute_error', 'max_depth': 15, 'min_weight_fraction_leaf': 0.0, 'max_leaf_nodes': 300, 'bootstrap': False, 'ccp_alpha': 0.005}. Best is trial 3488 with value: 0.05528345733671649.
[I 2025-04-16 02:07:42,388] Trial 3925 finished with value: -0.1936417107583833 and parameters: {'n_estimators': 733, 'min_samples_split': 2, 'max_features': 0.78, 'min_samples_leaf': 1, 'criterion': 'absolute_error', 'max_depth': 15, 'min_weight_fraction_leaf': 0.0, 'max_leaf_nodes': 300, 'bootstrap': False, 'ccp_alpha': 0.01}. Best is trial 3488 with value: 0.05528345733671649.
[I 2025-04-16 02:07:43,304] Trial 3926 finished with value: -0.1936417107583833 and parameters: {'n_estimators': 532, 'min_samples_split': 5, 'max_features': 0.75, 'min_samples_leaf': 65, 'criterion': 'absolute_error', 'max_depth': 15, 'min_weight_fraction_leaf': 0.0, 'max_leaf_nodes': 50, 'bootstrap': False, 'ccp_alpha': 0.0}. Best is trial 3488 with value: 0.05528345733671649.
[I 2025-04-16 02:07:44,002] Trial 3927 finished with value: -0.1936417107583833 and parameters: {'n_estimators': 172, 'min_samples_split': 9, 'max_features': 0.68, 'min_samples_leaf': 5, 'criterion': 'absolute_error', 'max_depth': 15, 'min_weight_fraction_leaf': 0.0, 'max_leaf_nodes': 300, 'bootstrap': False, 'ccp_alpha': 0.023}. Best is trial 3488 with value: 0.05528345733671649.
[I 2025-04-16 02:07:45,369] Trial 3928 finished with value: -0.1936417107583833 and parameters: {'n_estimators': 926, 'min_samples_split': 10, 'max_features': 0.81, 'min_samples_leaf': 3, 'criterion': 'absolute_error', 'max_depth': 15, 'min_weight_fraction_leaf': 0.0, 'max_leaf_nodes': 300, 'bootstrap': False, 'ccp_alpha': 0.128}. Best is trial 3488 with value: 0.05528345733671649.
[I 2025-04-16 02:07:45,934] Trial 3929 finished with value: -24.137068112581904 and parameters: {'n_estimators': 19, 'min_samples_split': 2, 'max_features': 0.72, 'min_samples_leaf': 1, 'criterion': 'poisson', 'max_depth': 15, 'min_weight_fraction_leaf': 0.0, 'max_leaf_nodes': 300, 'bootstrap': False, 'ccp_alpha': 0.014}. Best is trial 3488 with value: 0.05528345733671649.
[I 2025-04-16 02:07:46,740] Trial 3930 finished with value: 0.004169491768804545 and parameters: {'n_estimators': 346, 'min_samples_split': 6, 'max_features': 0.74, 'min_samples_leaf': 3, 'criterion': 'absolute_error', 'max_depth': 15, 'min_weight_fraction_leaf': 0.0, 'max_leaf_nodes': 300, 'bootstrap': False, 'ccp_alpha': 0.006}. Best is trial 3488 with value: 0.05528345733671649.
[I 2025-04-16 02:07:48,241] Trial 3931 finished with value: -0.1936417107583833 and parameters: {'n_estimators': 1120, 'min_samples_split': 9, 'max_features': 0.77, 'min_samples_leaf': 5, 'criterion': 'absolute_error', 'max_depth': 15, 'min_weight_fraction_leaf': 0.0, 'max_leaf_nodes': 300, 'bootstrap': False, 'ccp_alpha': 0.009000000000000001}. Best is trial 3488 with value: 0.05528345733671649.
[I 2025-04-16 02:07:49,372] Trial 3932 finished with value: -36.077926674373195 and parameters: {'n_estimators': 669, 'min_samples_split': 2, 'max_features': 0.7100000000000001, 'min_samples_leaf': 1, 'criterion': 'absolute_error', 'max_depth': 15, 'min_weight_fraction_leaf': 0.0, 'max_leaf_nodes': 300, 'bootstrap': False, 'ccp_alpha': 0.0}. Best is trial 3488 with value: 0.05528345733671649.
[I 2025-04-16 02:07:50,331] Trial 3933 finished with value: -0.1936417107583833 and parameters: {'n_estimators': 422, 'min_samples_split': 10, 'max_features': 0.79, 'min_samples_leaf': 3, 'criterion': 'absolute_error', 'max_depth': 15, 'min_weight_fraction_leaf': 0.0, 'max_leaf_nodes': 300, 'bootstrap': False, 'ccp_alpha': 0.018000000000000002}. Best is trial 3488 with value: 0.05528345733671649.
[I 2025-04-16 02:07:51,562] Trial 3934 finished with value: -0.002760570762647796 and parameters: {'n_estimators': 782, 'min_samples_split': 5, 'max_features': 0.65, 'min_samples_leaf': 1, 'criterion': 'absolute_error', 'max_depth': 20, 'min_weight_fraction_leaf': 0.0, 'max_leaf_nodes': 300, 'bootstrap': False, 'ccp_alpha': 0.005}. Best is trial 3488 with value: 0.05528345733671649.
[I 2025-04-16 02:07:52,612] Trial 3935 finished with value: -0.1936417107583833 and parameters: {'n_estimators': 573, 'min_samples_split': 6, 'max_features': 0.73, 'min_samples_leaf': 5, 'criterion': 'absolute_error', 'max_depth': 15, 'min_weight_fraction_leaf': 0.0, 'max_leaf_nodes': 300, 'bootstrap': False, 'ccp_alpha': 0.013000000000000001}. Best is trial 3488 with value: 0.05528345733671649.
[I 2025-04-16 02:07:53,305] Trial 3936 finished with value: -8.888868661517389 and parameters: {'n_estimators': 194, 'min_samples_split': 2, 'max_features': 0.8200000000000001, 'min_samples_leaf': 3, 'criterion': 'absolute_error', 'max_depth': 10, 'min_weight_fraction_leaf': 0.0, 'max_leaf_nodes': 300, 'bootstrap': False, 'ccp_alpha': 0.0}. Best is trial 3488 with value: 0.05528345733671649.
[I 2025-04-16 02:07:54,184] Trial 3937 finished with value: -0.1936417107583833 and parameters: {'n_estimators': 333, 'min_samples_split': 56, 'max_features': 0.6900000000000001, 'min_samples_leaf': 1, 'criterion': 'absolute_error', 'max_depth': 15, 'min_weight_fraction_leaf': 0.0, 'max_leaf_nodes': 300, 'bootstrap': False, 'ccp_alpha': 0.011}. Best is trial 3488 with value: 0.05528345733671649.
[I 2025-04-16 02:07:54,722] Trial 3938 finished with value: -17.52898638227503 and parameters: {'n_estimators': 16, 'min_samples_split': 10, 'max_features': 0.76, 'min_samples_leaf': 5, 'criterion': 'friedman_mse', 'max_depth': 15, 'min_weight_fraction_leaf': 0.0, 'max_leaf_nodes': 300, 'bootstrap': False, 'ccp_alpha': 0.006}. Best is trial 3488 with value: 0.05528345733671649.
[I 2025-04-16 02:07:56,059] Trial 3939 finished with value: -0.1936417107583833 and parameters: {'n_estimators': 880, 'min_samples_split': 6, 'max_features': 0.75, 'min_samples_leaf': 3, 'criterion': 'absolute_error', 'max_depth': 15, 'min_weight_fraction_leaf': 0.0, 'max_leaf_nodes': None, 'bootstrap': False, 'ccp_alpha': 0.019}. Best is trial 3488 with value: 0.05528345733671649.
[I 2025-04-16 02:07:56,599] Trial 3940 finished with value: -0.1936417107583833 and parameters: {'n_estimators': 3, 'min_samples_split': 2, 'max_features': 0.73, 'min_samples_leaf': 1, 'criterion': 'absolute_error', 'max_depth': 15, 'min_weight_fraction_leaf': 0.0, 'max_leaf_nodes': 300, 'bootstrap': False, 'ccp_alpha': 0.005}. Best is trial 3488 with value: 0.05528345733671649.
[I 2025-04-16 02:07:57,681] Trial 3941 finished with value: -0.1936417107583833 and parameters: {'n_estimators': 613, 'min_samples_split': 10, 'max_features': 0.7100000000000001, 'min_samples_leaf': 3, 'criterion': 'absolute_error', 'max_depth': 15, 'min_weight_fraction_leaf': 0.0, 'max_leaf_nodes': 300, 'bootstrap': False, 'ccp_alpha': 0.015}. Best is trial 3488 with value: 0.05528345733671649.
[I 2025-04-16 02:07:59,084] Trial 3942 finished with value: -11.396086387395574 and parameters: {'n_estimators': 1094, 'min_samples_split': 6, 'max_features': 0.8, 'min_samples_leaf': 5, 'criterion': 'absolute_error', 'max_depth': 15, 'min_weight_fraction_leaf': 0.0, 'max_leaf_nodes': 300, 'bootstrap': False, 'ccp_alpha': 0.0}. Best is trial 3488 with value: 0.05528345733671649.
[I 2025-04-16 02:07:59,972] Trial 3943 finished with value: -0.1936417107583833 and parameters: {'n_estimators': 440, 'min_samples_split': 77, 'max_features': 0.77, 'min_samples_leaf': 1, 'criterion': 'absolute_error', 'max_depth': 15, 'min_weight_fraction_leaf': 0.0, 'max_leaf_nodes': 300, 'bootstrap': False, 'ccp_alpha': 0.009000000000000001}. Best is trial 3488 with value: 0.05528345733671649.
[I 2025-04-16 02:08:01,116] Trial 3944 finished with value: -0.1936417107583833 and parameters: {'n_estimators': 709, 'min_samples_split': 6, 'max_features': 0.6900000000000001, 'min_samples_leaf': 3, 'criterion': 'absolute_error', 'max_depth': 15, 'min_weight_fraction_leaf': 0.0, 'max_leaf_nodes': 300, 'bootstrap': False, 'ccp_alpha': 0.039}. Best is trial 3488 with value: 0.05528345733671649.
[I 2025-04-16 02:08:01,959] Trial 3945 finished with value: -0.1936417107583833 and parameters: {'n_estimators': 315, 'min_samples_split': 2, 'max_features': 0.74, 'min_samples_leaf': 5, 'criterion': 'absolute_error', 'max_depth': 15, 'min_weight_fraction_leaf': 0.0, 'max_leaf_nodes': 300, 'bootstrap': False, 'ccp_alpha': 0.028}. Best is trial 3488 with value: 0.05528345733671649.
[I 2025-04-16 02:08:02,928] Trial 3946 finished with value: -0.1936417107583833 and parameters: {'n_estimators': 513, 'min_samples_split': 10, 'max_features': 0.72, 'min_samples_leaf': 1, 'criterion': 'absolute_error', 'max_depth': 15, 'min_weight_fraction_leaf': 0.0, 'max_leaf_nodes': 300, 'bootstrap': False, 'ccp_alpha': 0.01}. Best is trial 3488 with value: 0.05528345733671649.
[I 2025-04-16 02:08:04,227] Trial 3947 finished with value: -0.1936417107583833 and parameters: {'n_estimators': 910, 'min_samples_split': 6, 'max_features': 0.78, 'min_samples_leaf': 3, 'criterion': 'absolute_error', 'max_depth': 15, 'min_weight_fraction_leaf': 0.0, 'max_leaf_nodes': 300, 'bootstrap': False, 'ccp_alpha': 0.02}. Best is trial 3488 with value: 0.05528345733671649.
[I 2025-04-16 02:08:04,959] Trial 3948 finished with value: 0.015279299591557249 and parameters: {'n_estimators': 227, 'min_samples_split': 2, 'max_features': 0.75, 'min_samples_leaf': 1, 'criterion': 'absolute_error', 'max_depth': 15, 'min_weight_fraction_leaf': 0.0, 'max_leaf_nodes': 300, 'bootstrap': False, 'ccp_alpha': 0.006}. Best is trial 3488 with value: 0.05528345733671649.
[I 2025-04-16 02:08:05,961] Trial 3949 finished with value: -9.296139319232466 and parameters: {'n_estimators': 616, 'min_samples_split': 10, 'max_features': 0.67, 'min_samples_leaf': 5, 'criterion': 'squared_error', 'max_depth': 15, 'min_weight_fraction_leaf': 0.0, 'max_leaf_nodes': 300, 'bootstrap': False, 'ccp_alpha': 0.0}. Best is trial 3488 with value: 0.05528345733671649.
[I 2025-04-16 02:08:06,843] Trial 3950 finished with value: -0.1936417107583833 and parameters: {'n_estimators': 420, 'min_samples_split': 6, 'max_features': 0.7100000000000001, 'min_samples_leaf': 3, 'criterion': 'absolute_error', 'max_depth': 20, 'min_weight_fraction_leaf': 0.0, 'max_leaf_nodes': 50, 'bootstrap': False, 'ccp_alpha': 0.014}. Best is trial 3488 with value: 0.05528345733671649.
[I 2025-04-16 02:08:08,032] Trial 3951 finished with value: -0.1936417107583833 and parameters: {'n_estimators': 777, 'min_samples_split': 2, 'max_features': 0.76, 'min_samples_leaf': 1, 'criterion': 'absolute_error', 'max_depth': 15, 'min_weight_fraction_leaf': 0.07, 'max_leaf_nodes': 300, 'bootstrap': False, 'ccp_alpha': 0.006}. Best is trial 3488 with value: 0.05528345733671649.
[I 2025-04-16 02:08:08,776] Trial 3952 finished with value: -0.1936417107583833 and parameters: {'n_estimators': 244, 'min_samples_split': 10, 'max_features': 0.8200000000000001, 'min_samples_leaf': 3, 'criterion': 'absolute_error', 'max_depth': 15, 'min_weight_fraction_leaf': 0.0, 'max_leaf_nodes': 300, 'bootstrap': False, 'ccp_alpha': 0.014}. Best is trial 3488 with value: 0.05528345733671649.
[I 2025-04-16 02:08:09,683] Trial 3953 finished with value: -17.528986382274873 and parameters: {'n_estimators': 499, 'min_samples_split': 50, 'max_features': 0.73, 'min_samples_leaf': 5, 'criterion': 'poisson', 'max_depth': 15, 'min_weight_fraction_leaf': 0.0, 'max_leaf_nodes': 300, 'bootstrap': False, 'ccp_alpha': 0.025}. Best is trial 3488 with value: 0.05528345733671649.
[I 2025-04-16 02:08:11,236] Trial 3954 finished with value: -0.1936417107583833 and parameters: {'n_estimators': 1129, 'min_samples_split': 6, 'max_features': 0.6900000000000001, 'min_samples_leaf': 1, 'criterion': 'absolute_error', 'max_depth': 15, 'min_weight_fraction_leaf': 0.0, 'max_leaf_nodes': 300, 'bootstrap': False, 'ccp_alpha': 0.009000000000000001}. Best is trial 3488 with value: 0.05528345733671649.
[I 2025-04-16 02:08:11,923] Trial 3955 finished with value: -0.1936417107583833 and parameters: {'n_estimators': 182, 'min_samples_split': 2, 'max_features': 0.8, 'min_samples_leaf': 3, 'criterion': 'absolute_error', 'max_depth': 15, 'min_weight_fraction_leaf': 0.0, 'max_leaf_nodes': 10, 'bootstrap': False, 'ccp_alpha': 0.18}. Best is trial 3488 with value: 0.05528345733671649.
[I 2025-04-16 02:08:12,461] Trial 3956 finished with value: -16.54884413917353 and parameters: {'n_estimators': 4, 'min_samples_split': 6, 'max_features': 0.78, 'min_samples_leaf': 5, 'criterion': 'absolute_error', 'max_depth': 15, 'min_weight_fraction_leaf': 0.0, 'max_leaf_nodes': 300, 'bootstrap': False, 'ccp_alpha': 0.0}. Best is trial 3488 with value: 0.05528345733671649.
