[I 2025-04-16 01:20:04,895] Trial 2377 finished with value: -0.1936417107583833 and parameters: {'n_estimators': 3372, 'min_samples_split': 5, 'max_features': 0.9, 'min_samples_leaf': 3, 'criterion': 'absolute_error', 'max_depth': 5, 'min_weight_fraction_leaf': 0.0, 'max_leaf_nodes': 150, 'bootstrap': False, 'ccp_alpha': 0.024}. Best is trial 2251 with value: 0.02361845659970214.
[I 2025-04-16 01:20:08,073] Trial 2378 finished with value: -29.72865482581485 and parameters: {'n_estimators': 3380, 'min_samples_split': 6, 'max_features': 0.91, 'min_samples_leaf': 3, 'criterion': 'poisson', 'max_depth': 5, 'min_weight_fraction_leaf': 0.0, 'max_leaf_nodes': 150, 'bootstrap': False, 'ccp_alpha': 0.017}. Best is trial 2251 with value: 0.02361845659970214.
[I 2025-04-16 01:20:11,229] Trial 2379 finished with value: -0.1936417107583833 and parameters: {'n_estimators': 3346, 'min_samples_split': 2, 'max_features': 0.89, 'min_samples_leaf': 1, 'criterion': 'absolute_error', 'max_depth': 5, 'min_weight_fraction_leaf': 0.0, 'max_leaf_nodes': 150, 'bootstrap': False, 'ccp_alpha': 0.019}. Best is trial 2251 with value: 0.02361845659970214.
[I 2025-04-16 01:20:14,446] Trial 2380 finished with value: -0.1936417107583833 and parameters: {'n_estimators': 3425, 'min_samples_split': 2, 'max_features': 0.89, 'min_samples_leaf': 5, 'criterion': 'absolute_error', 'max_depth': 5, 'min_weight_fraction_leaf': 0.0, 'max_leaf_nodes': 150, 'bootstrap': False, 'ccp_alpha': 0.031}. Best is trial 2251 with value: 0.02361845659970214.
[I 2025-04-16 01:20:17,508] Trial 2381 finished with value: -0.1936417107583833 and parameters: {'n_estimators': 3372, 'min_samples_split': 2, 'max_features': 0.89, 'min_samples_leaf': 3, 'criterion': 'absolute_error', 'max_depth': 5, 'min_weight_fraction_leaf': 0.0, 'max_leaf_nodes': 20, 'bootstrap': False, 'ccp_alpha': 0.014}. Best is trial 2251 with value: 0.02361845659970214.
[I 2025-04-16 01:20:20,658] Trial 2382 finished with value: -0.1936417107583833 and parameters: {'n_estimators': 3368, 'min_samples_split': 2, 'max_features': 0.91, 'min_samples_leaf': 1, 'criterion': 'absolute_error', 'max_depth': 5, 'min_weight_fraction_leaf': 0.0, 'max_leaf_nodes': 150, 'bootstrap': False, 'ccp_alpha': 0.011}. Best is trial 2251 with value: 0.02361845659970214.
[I 2025-04-16 01:20:24,021] Trial 2383 finished with value: -0.1936417107583833 and parameters: {'n_estimators': 3549, 'min_samples_split': 2, 'max_features': 0.91, 'min_samples_leaf': 5, 'criterion': 'absolute_error', 'max_depth': 5, 'min_weight_fraction_leaf': 0.0, 'max_leaf_nodes': 150, 'bootstrap': False, 'ccp_alpha': 0.018000000000000002}. Best is trial 2251 with value: 0.02361845659970214.
[I 2025-04-16 01:20:26,974] Trial 2384 finished with value: -0.1936417107583833 and parameters: {'n_estimators': 3315, 'min_samples_split': 6, 'max_features': 0.88, 'min_samples_leaf': 3, 'criterion': 'absolute_error', 'max_depth': 5, 'min_weight_fraction_leaf': 0.0, 'max_leaf_nodes': 150, 'bootstrap': False, 'ccp_alpha': 0.01}. Best is trial 2251 with value: 0.02361845659970214.
[I 2025-04-16 01:20:35,094] Trial 2385 finished with value: -0.1936417107583833 and parameters: {'n_estimators': 8639, 'min_samples_split': 2, 'max_features': 0.92, 'min_samples_leaf': 1, 'criterion': 'absolute_error', 'max_depth': 5, 'min_weight_fraction_leaf': 0.0, 'max_leaf_nodes': None, 'bootstrap': False, 'ccp_alpha': 0.026000000000000002}. Best is trial 2251 with value: 0.02361845659970214.
[I 2025-04-16 01:20:38,423] Trial 2386 finished with value: -0.1936417107583833 and parameters: {'n_estimators': 3573, 'min_samples_split': 6, 'max_features': 0.9, 'min_samples_leaf': 6, 'criterion': 'absolute_error', 'max_depth': 5, 'min_weight_fraction_leaf': 0.0, 'max_leaf_nodes': 150, 'bootstrap': False, 'ccp_alpha': 0.014}. Best is trial 2251 with value: 0.02361845659970214.
[I 2025-04-16 01:20:41,755] Trial 2387 finished with value: -17.52898638227507 and parameters: {'n_estimators': 3569, 'min_samples_split': 8, 'max_features': 0.92, 'min_samples_leaf': 4, 'criterion': 'friedman_mse', 'max_depth': 5, 'min_weight_fraction_leaf': 0.0, 'max_leaf_nodes': 150, 'bootstrap': False, 'ccp_alpha': 0.006}. Best is trial 2251 with value: 0.02361845659970214.
[I 2025-04-16 01:20:44,863] Trial 2388 finished with value: -0.1936417107583833 and parameters: {'n_estimators': 3370, 'min_samples_split': 6, 'max_features': 0.93, 'min_samples_leaf': 6, 'criterion': 'absolute_error', 'max_depth': 5, 'min_weight_fraction_leaf': 0.0, 'max_leaf_nodes': 150, 'bootstrap': False, 'ccp_alpha': 0.01}. Best is trial 2251 with value: 0.02361845659970214.
[I 2025-04-16 01:20:48,352] Trial 2389 finished with value: -0.1936417107583833 and parameters: {'n_estimators': 3679, 'min_samples_split': 2, 'max_features': 0.9, 'min_samples_leaf': 4, 'criterion': 'absolute_error', 'max_depth': 5, 'min_weight_fraction_leaf': 0.0, 'max_leaf_nodes': 150, 'bootstrap': False, 'ccp_alpha': 0.006}. Best is trial 2251 with value: 0.02361845659970214.
[I 2025-04-16 01:20:51,627] Trial 2390 finished with value: -0.1936417107583833 and parameters: {'n_estimators': 3540, 'min_samples_split': 6, 'max_features': 0.93, 'min_samples_leaf': 1, 'criterion': 'absolute_error', 'max_depth': 5, 'min_weight_fraction_leaf': 0.0, 'max_leaf_nodes': 150, 'bootstrap': False, 'ccp_alpha': 0.019}. Best is trial 2251 with value: 0.02361845659970214.
[I 2025-04-16 01:20:54,796] Trial 2391 finished with value: -0.1936417107583833 and parameters: {'n_estimators': 3362, 'min_samples_split': 2, 'max_features': 0.62, 'min_samples_leaf': 3, 'criterion': 'absolute_error', 'max_depth': 5, 'min_weight_fraction_leaf': 0.0, 'max_leaf_nodes': 300, 'bootstrap': False, 'ccp_alpha': 0.011}. Best is trial 2251 with value: 0.02361845659970214.
[I 2025-04-16 01:20:58,206] Trial 2392 finished with value: -0.1936417107583833 and parameters: {'n_estimators': 3567, 'min_samples_split': 9, 'max_features': 0.88, 'min_samples_leaf': 3, 'criterion': 'absolute_error', 'max_depth': 5, 'min_weight_fraction_leaf': 0.0, 'max_leaf_nodes': 150, 'bootstrap': False, 'ccp_alpha': 0.007}. Best is trial 2251 with value: 0.02361845659970214.
[I 2025-04-16 01:21:01,863] Trial 2393 finished with value: -0.1936417107583833 and parameters: {'n_estimators': 3684, 'min_samples_split': 6, 'max_features': 0.91, 'min_samples_leaf': 6, 'criterion': 'absolute_error', 'max_depth': 5, 'min_weight_fraction_leaf': 0.0, 'max_leaf_nodes': 150, 'bootstrap': False, 'ccp_alpha': 0.014}. Best is trial 2251 with value: 0.02361845659970214.
[I 2025-04-16 01:21:05,180] Trial 2394 finished with value: -0.1936417107583833 and parameters: {'n_estimators': 3669, 'min_samples_split': 8, 'max_features': 0.9400000000000001, 'min_samples_leaf': 5, 'criterion': 'absolute_error', 'max_depth': 5, 'min_weight_fraction_leaf': 0.0, 'max_leaf_nodes': 150, 'bootstrap': False, 'ccp_alpha': 0.007}. Best is trial 2251 with value: 0.02361845659970214.
[I 2025-04-16 01:21:08,283] Trial 2395 finished with value: -0.03215547250648867 and parameters: {'n_estimators': 3376, 'min_samples_split': 2, 'max_features': 0.93, 'min_samples_leaf': 3, 'criterion': 'absolute_error', 'max_depth': 5, 'min_weight_fraction_leaf': 0.0, 'max_leaf_nodes': 150, 'bootstrap': False, 'ccp_alpha': 0.006}. Best is trial 2251 with value: 0.02361845659970214.
[I 2025-04-16 01:21:11,385] Trial 2396 finished with value: -17.52898638227581 and parameters: {'n_estimators': 3300, 'min_samples_split': 5, 'max_features': 0.89, 'min_samples_leaf': 1, 'criterion': 'squared_error', 'max_depth': 5, 'min_weight_fraction_leaf': 0.0, 'max_leaf_nodes': 150, 'bootstrap': False, 'ccp_alpha': 0.024}. Best is trial 2251 with value: 0.02361845659970214.
[I 2025-04-16 01:21:14,654] Trial 2397 finished with value: -0.1936417107583833 and parameters: {'n_estimators': 3365, 'min_samples_split': 4, 'max_features': 0.89, 'min_samples_leaf': 3, 'criterion': 'absolute_error', 'max_depth': 5, 'min_weight_fraction_leaf': 0.0, 'max_leaf_nodes': 150, 'bootstrap': False, 'ccp_alpha': 0.019}. Best is trial 2251 with value: 0.02361845659970214.
[I 2025-04-16 01:21:17,794] Trial 2398 finished with value: -0.1936417107583833 and parameters: {'n_estimators': 3386, 'min_samples_split': 2, 'max_features': 0.91, 'min_samples_leaf': 3, 'criterion': 'absolute_error', 'max_depth': 5, 'min_weight_fraction_leaf': 0.0, 'max_leaf_nodes': 150, 'bootstrap': False, 'ccp_alpha': 0.017}. Best is trial 2251 with value: 0.02361845659970214.
[I 2025-04-16 01:21:20,894] Trial 2399 finished with value: -0.1936417107583833 and parameters: {'n_estimators': 3291, 'min_samples_split': 2, 'max_features': 0.9, 'min_samples_leaf': 1, 'criterion': 'absolute_error', 'max_depth': 5, 'min_weight_fraction_leaf': 0.0, 'max_leaf_nodes': 150, 'bootstrap': False, 'ccp_alpha': 0.023}. Best is trial 2251 with value: 0.02361845659970214.
[I 2025-04-16 01:21:23,868] Trial 2400 finished with value: -0.1936417107583833 and parameters: {'n_estimators': 3333, 'min_samples_split': 2, 'max_features': 0.88, 'min_samples_leaf': 5, 'criterion': 'absolute_error', 'max_depth': 5, 'min_weight_fraction_leaf': 0.0, 'max_leaf_nodes': 150, 'bootstrap': False, 'ccp_alpha': 0.014}. Best is trial 2251 with value: 0.02361845659970214.
[I 2025-04-16 01:21:27,120] Trial 2401 finished with value: -0.1936417107583833 and parameters: {'n_estimators': 3377, 'min_samples_split': 2, 'max_features': 0.91, 'min_samples_leaf': 3, 'criterion': 'absolute_error', 'max_depth': 5, 'min_weight_fraction_leaf': 0.0, 'max_leaf_nodes': 150, 'bootstrap': False, 'ccp_alpha': 0.015}. Best is trial 2251 with value: 0.02361845659970214.
[I 2025-04-16 01:21:30,312] Trial 2402 finished with value: -29.603641610789794 and parameters: {'n_estimators': 3518, 'min_samples_split': 5, 'max_features': 0.92, 'min_samples_leaf': 5, 'criterion': 'poisson', 'max_depth': 5, 'min_weight_fraction_leaf': 0.0, 'max_leaf_nodes': 150, 'bootstrap': False, 'ccp_alpha': 0.013000000000000001}. Best is trial 2251 with value: 0.02361845659970214.
[I 2025-04-16 01:21:33,640] Trial 2403 finished with value: -0.1936417107583833 and parameters: {'n_estimators': 3366, 'min_samples_split': 2, 'max_features': 0.93, 'min_samples_leaf': 6, 'criterion': 'absolute_error', 'max_depth': 5, 'min_weight_fraction_leaf': 0.0, 'max_leaf_nodes': 150, 'bootstrap': False, 'ccp_alpha': 0.009000000000000001}. Best is trial 2251 with value: 0.02361845659970214.
[I 2025-04-16 01:21:37,191] Trial 2404 finished with value: -0.1936417107583833 and parameters: {'n_estimators': 3532, 'min_samples_split': 5, 'max_features': 0.92, 'min_samples_leaf': 3, 'criterion': 'absolute_error', 'max_depth': 5, 'min_weight_fraction_leaf': 0.0, 'max_leaf_nodes': 150, 'bootstrap': False, 'ccp_alpha': 0.029}. Best is trial 2251 with value: 0.02361845659970214.
[I 2025-04-16 01:21:40,440] Trial 2405 finished with value: -0.1936417107583833 and parameters: {'n_estimators': 3603, 'min_samples_split': 6, 'max_features': 0.9, 'min_samples_leaf': 1, 'criterion': 'absolute_error', 'max_depth': 5, 'min_weight_fraction_leaf': 0.0, 'max_leaf_nodes': 150, 'bootstrap': False, 'ccp_alpha': 0.022}. Best is trial 2251 with value: 0.02361845659970214.
[I 2025-04-16 01:21:43,704] Trial 2406 finished with value: -0.1936417107583833 and parameters: {'n_estimators': 3538, 'min_samples_split': 8, 'max_features': 0.56, 'min_samples_leaf': 6, 'criterion': 'absolute_error', 'max_depth': 5, 'min_weight_fraction_leaf': 0.0, 'max_leaf_nodes': 150, 'bootstrap': False, 'ccp_alpha': 0.202}. Best is trial 2251 with value: 0.02361845659970214.
[I 2025-04-16 01:21:47,228] Trial 2407 finished with value: -0.032607324125034906 and parameters: {'n_estimators': 3308, 'min_samples_split': 2, 'max_features': 0.93, 'min_samples_leaf': 3, 'criterion': 'absolute_error', 'max_depth': 5, 'min_weight_fraction_leaf': 0.0, 'max_leaf_nodes': 20, 'bootstrap': False, 'ccp_alpha': 0.006}. Best is trial 2251 with value: 0.02361845659970214.
[I 2025-04-16 01:21:50,184] Trial 2408 finished with value: -0.1936417107583833 and parameters: {'n_estimators': 3231, 'min_samples_split': 4, 'max_features': 0.89, 'min_samples_leaf': 3, 'criterion': 'absolute_error', 'max_depth': 5, 'min_weight_fraction_leaf': 0.0, 'max_leaf_nodes': 20, 'bootstrap': False, 'ccp_alpha': 0.159}. Best is trial 2251 with value: 0.02361845659970214.
[I 2025-04-16 01:21:53,320] Trial 2409 finished with value: -0.1936417107583833 and parameters: {'n_estimators': 3360, 'min_samples_split': 6, 'max_features': 0.88, 'min_samples_leaf': 1, 'criterion': 'absolute_error', 'max_depth': 5, 'min_weight_fraction_leaf': 0.0, 'max_leaf_nodes': 20, 'bootstrap': False, 'ccp_alpha': 0.019}. Best is trial 2251 with value: 0.02361845659970214.
[I 2025-04-16 01:21:56,694] Trial 2410 finished with value: -0.1936417107583833 and parameters: {'n_estimators': 3292, 'min_samples_split': 2, 'max_features': 0.91, 'min_samples_leaf': 4, 'criterion': 'absolute_error', 'max_depth': 5, 'min_weight_fraction_leaf': 0.0, 'max_leaf_nodes': None, 'bootstrap': False, 'ccp_alpha': 0.017}. Best is trial 2251 with value: 0.02361845659970214.
[I 2025-04-16 01:21:59,885] Trial 2411 finished with value: -0.1936417107583833 and parameters: {'n_estimators': 3477, 'min_samples_split': 2, 'max_features': 0.88, 'min_samples_leaf': 3, 'criterion': 'absolute_error', 'max_depth': 5, 'min_weight_fraction_leaf': 0.0, 'max_leaf_nodes': 150, 'bootstrap': False, 'ccp_alpha': 0.023}. Best is trial 2251 with value: 0.02361845659970214.
[I 2025-04-16 01:22:03,078] Trial 2412 finished with value: -17.52898638227571 and parameters: {'n_estimators': 3333, 'min_samples_split': 6, 'max_features': 0.92, 'min_samples_leaf': 1, 'criterion': 'friedman_mse', 'max_depth': 5, 'min_weight_fraction_leaf': 0.0, 'max_leaf_nodes': 20, 'bootstrap': False, 'ccp_alpha': 0.013000000000000001}. Best is trial 2251 with value: 0.02361845659970214.
[I 2025-04-16 01:22:06,010] Trial 2413 finished with value: -0.1936417107583833 and parameters: {'n_estimators': 3335, 'min_samples_split': 2, 'max_features': 0.93, 'min_samples_leaf': 5, 'criterion': 'absolute_error', 'max_depth': 5, 'min_weight_fraction_leaf': 0.0, 'max_leaf_nodes': 20, 'bootstrap': False, 'ccp_alpha': 0.032}. Best is trial 2251 with value: 0.02361845659970214.
[I 2025-04-16 01:22:09,441] Trial 2414 finished with value: -0.1936417107583833 and parameters: {'n_estimators': 3297, 'min_samples_split': 5, 'max_features': 0.9, 'min_samples_leaf': 3, 'criterion': 'absolute_error', 'max_depth': 5, 'min_weight_fraction_leaf': 0.0, 'max_leaf_nodes': 20, 'bootstrap': False, 'ccp_alpha': 0.013000000000000001}. Best is trial 2251 with value: 0.02361845659970214.
[I 2025-04-16 01:22:12,644] Trial 2415 finished with value: -0.1936417107583833 and parameters: {'n_estimators': 3237, 'min_samples_split': 2, 'max_features': 0.93, 'min_samples_leaf': 6, 'criterion': 'absolute_error', 'max_depth': 5, 'min_weight_fraction_leaf': 0.0, 'max_leaf_nodes': 20, 'bootstrap': False, 'ccp_alpha': 0.01}. Best is trial 2251 with value: 0.02361845659970214.
[I 2025-04-16 01:22:15,385] Trial 2416 finished with value: -0.1936417107583833 and parameters: {'n_estimators': 3308, 'min_samples_split': 2, 'max_features': 0.91, 'min_samples_leaf': 1, 'criterion': 'absolute_error', 'max_depth': 5, 'min_weight_fraction_leaf': 0.0, 'max_leaf_nodes': 20, 'bootstrap': False, 'ccp_alpha': 0.017}. Best is trial 2251 with value: 0.02361845659970214.
[I 2025-04-16 01:22:18,901] Trial 2417 finished with value: -0.1936417107583833 and parameters: {'n_estimators': 3512, 'min_samples_split': 2, 'max_features': 0.9400000000000001, 'min_samples_leaf': 4, 'criterion': 'absolute_error', 'max_depth': 5, 'min_weight_fraction_leaf': 0.0, 'max_leaf_nodes': 20, 'bootstrap': False, 'ccp_alpha': 0.01}. Best is trial 2251 with value: 0.02361845659970214.
[I 2025-04-16 01:22:22,110] Trial 2418 finished with value: -0.1936417107583833 and parameters: {'n_estimators': 3544, 'min_samples_split': 6, 'max_features': 0.92, 'min_samples_leaf': 6, 'criterion': 'absolute_error', 'max_depth': 5, 'min_weight_fraction_leaf': 0.0, 'max_leaf_nodes': 300, 'bootstrap': False, 'ccp_alpha': 0.006}. Best is trial 2251 with value: 0.02361845659970214.
[I 2025-04-16 01:22:25,561] Trial 2419 finished with value: -0.1936417107583833 and parameters: {'n_estimators': 3287, 'min_samples_split': 6, 'max_features': 0.88, 'min_samples_leaf': 3, 'criterion': 'absolute_error', 'max_depth': 5, 'min_weight_fraction_leaf': 0.0, 'max_leaf_nodes': 20, 'bootstrap': False, 'ccp_alpha': 0.02}. Best is trial 2251 with value: 0.02361845659970214.
[I 2025-04-16 01:22:28,741] Trial 2420 finished with value: -0.1936417107583833 and parameters: {'n_estimators': 3535, 'min_samples_split': 2, 'max_features': 0.9400000000000001, 'min_samples_leaf': 5, 'criterion': 'absolute_error', 'max_depth': 5, 'min_weight_fraction_leaf': 0.0, 'max_leaf_nodes': None, 'bootstrap': False, 'ccp_alpha': 0.011}. Best is trial 2251 with value: 0.02361845659970214.
[I 2025-04-16 01:22:31,844] Trial 2421 finished with value: -0.1936417107583833 and parameters: {'n_estimators': 3341, 'min_samples_split': 8, 'max_features': 0.9, 'min_samples_leaf': 1, 'criterion': 'absolute_error', 'max_depth': 5, 'min_weight_fraction_leaf': 0.0, 'max_leaf_nodes': 20, 'bootstrap': False, 'ccp_alpha': 0.006}. Best is trial 2251 with value: 0.02361845659970214.
[I 2025-04-16 01:22:35,327] Trial 2422 finished with value: -17.52898638227517 and parameters: {'n_estimators': 3531, 'min_samples_split': 6, 'max_features': 0.92, 'min_samples_leaf': 3, 'criterion': 'squared_error', 'max_depth': 5, 'min_weight_fraction_leaf': 0.0, 'max_leaf_nodes': 150, 'bootstrap': False, 'ccp_alpha': 0.299}. Best is trial 2251 with value: 0.02361845659970214.
[I 2025-04-16 01:22:38,642] Trial 2423 finished with value: -0.1936417107583833 and parameters: {'n_estimators': 3287, 'min_samples_split': 9, 'max_features': 0.9400000000000001, 'min_samples_leaf': 6, 'criterion': 'absolute_error', 'max_depth': 5, 'min_weight_fraction_leaf': 0.0, 'max_leaf_nodes': 20, 'bootstrap': False, 'ccp_alpha': 0.025}. Best is trial 2251 with value: 0.02361845659970214.
[I 2025-04-16 01:22:41,813] Trial 2424 finished with value: -0.1936417107583833 and parameters: {'n_estimators': 3523, 'min_samples_split': 2, 'max_features': 0.9400000000000001, 'min_samples_leaf': 4, 'criterion': 'absolute_error', 'max_depth': 5, 'min_weight_fraction_leaf': 0.0, 'max_leaf_nodes': 20, 'bootstrap': False, 'ccp_alpha': 0.015}. Best is trial 2251 with value: 0.02361845659970214.
[I 2025-04-16 01:22:45,415] Trial 2425 finished with value: -0.032943344471090305 and parameters: {'n_estimators': 3661, 'min_samples_split': 6, 'max_features': 0.91, 'min_samples_leaf': 1, 'criterion': 'absolute_error', 'max_depth': 5, 'min_weight_fraction_leaf': 0.0, 'max_leaf_nodes': 20, 'bootstrap': False, 'ccp_alpha': 0.006}. Best is trial 2251 with value: 0.02361845659970214.
[I 2025-04-16 01:22:48,307] Trial 2426 finished with value: -0.1936417107583833 and parameters: {'n_estimators': 3362, 'min_samples_split': 6, 'max_features': 0.88, 'min_samples_leaf': 1, 'criterion': 'absolute_error', 'max_depth': 5, 'min_weight_fraction_leaf': 0.0, 'max_leaf_nodes': 20, 'bootstrap': False, 'ccp_alpha': 0.02}. Best is trial 2251 with value: 0.02361845659970214.
[I 2025-04-16 01:22:51,651] Trial 2427 finished with value: -0.1936417107583833 and parameters: {'n_estimators': 3525, 'min_samples_split': 2, 'max_features': 0.89, 'min_samples_leaf': 1, 'criterion': 'absolute_error', 'max_depth': 5, 'min_weight_fraction_leaf': 0.0, 'max_leaf_nodes': 20, 'bootstrap': False, 'ccp_alpha': 0.028}. Best is trial 2251 with value: 0.02361845659970214.
[I 2025-04-16 01:22:54,760] Trial 2428 finished with value: -23.15751464481255 and parameters: {'n_estimators': 3371, 'min_samples_split': 6, 'max_features': 0.89, 'min_samples_leaf': 3, 'criterion': 'poisson', 'max_depth': 5, 'min_weight_fraction_leaf': 0.0, 'max_leaf_nodes': 20, 'bootstrap': False, 'ccp_alpha': 0.017}. Best is trial 2251 with value: 0.02361845659970214.
[I 2025-04-16 01:22:57,817] Trial 2429 finished with value: -0.1936417107583833 and parameters: {'n_estimators': 3247, 'min_samples_split': 8, 'max_features': 0.9, 'min_samples_leaf': 1, 'criterion': 'absolute_error', 'max_depth': 5, 'min_weight_fraction_leaf': 0.0, 'max_leaf_nodes': 20, 'bootstrap': False, 'ccp_alpha': 0.015}. Best is trial 2251 with value: 0.02361845659970214.
[I 2025-04-16 01:23:01,082] Trial 2430 finished with value: -0.1936417107583833 and parameters: {'n_estimators': 3621, 'min_samples_split': 2, 'max_features': 0.88, 'min_samples_leaf': 3, 'criterion': 'absolute_error', 'max_depth': 5, 'min_weight_fraction_leaf': 0.0, 'max_leaf_nodes': 20, 'bootstrap': False, 'ccp_alpha': 0.011}. Best is trial 2251 with value: 0.02361845659970214.
[I 2025-04-16 01:23:03,944] Trial 2431 finished with value: -0.1936417107583833 and parameters: {'n_estimators': 3292, 'min_samples_split': 6, 'max_features': 0.91, 'min_samples_leaf': 1, 'criterion': 'absolute_error', 'max_depth': 5, 'min_weight_fraction_leaf': 0.0, 'max_leaf_nodes': 20, 'bootstrap': False, 'ccp_alpha': 0.024}. Best is trial 2251 with value: 0.02361845659970214.
[I 2025-04-16 01:23:07,107] Trial 2432 finished with value: -0.1936417107583833 and parameters: {'n_estimators': 3577, 'min_samples_split': 9, 'max_features': 0.91, 'min_samples_leaf': 3, 'criterion': 'absolute_error', 'max_depth': 5, 'min_weight_fraction_leaf': 0.0, 'max_leaf_nodes': 20, 'bootstrap': False, 'ccp_alpha': 0.01}. Best is trial 2251 with value: 0.02361845659970214.
[I 2025-04-16 01:23:10,628] Trial 2433 finished with value: -0.1936417107583833 and parameters: {'n_estimators': 3683, 'min_samples_split': 5, 'max_features': 0.9, 'min_samples_leaf': 5, 'criterion': 'absolute_error', 'max_depth': 5, 'min_weight_fraction_leaf': 0.0, 'max_leaf_nodes': 20, 'bootstrap': False, 'ccp_alpha': 0.018000000000000002}. Best is trial 2251 with value: 0.02361845659970214.
