[I 2025-04-16 01:54:54,160] Trial 3173 finished with value: -17.5289863822764 and parameters: {'n_estimators': 1547, 'min_samples_split': 18, 'max_features': 0.89, 'min_samples_leaf': 6, 'criterion': 'squared_error', 'max_depth': None, 'min_weight_fraction_leaf': 0.0, 'max_leaf_nodes': 300, 'bootstrap': False, 'ccp_alpha': 0.023}. Best is trial 2774 with value: 0.046571421912873.
[I 2025-04-16 01:54:55,589] Trial 3174 finished with value: -0.1936417107583833 and parameters: {'n_estimators': 1240, 'min_samples_split': 8, 'max_features': 0.86, 'min_samples_leaf': 8, 'criterion': 'absolute_error', 'max_depth': None, 'min_weight_fraction_leaf': 0.0, 'max_leaf_nodes': 300, 'bootstrap': False, 'ccp_alpha': 0.014}. Best is trial 2774 with value: 0.046571421912873.
[I 2025-04-16 01:54:57,574] Trial 3175 finished with value: -0.0764646691753 and parameters: {'n_estimators': 1734, 'min_samples_split': 12, 'max_features': 0.87, 'min_samples_leaf': 4, 'criterion': 'absolute_error', 'max_depth': None, 'min_weight_fraction_leaf': 0.0, 'max_leaf_nodes': 300, 'bootstrap': False, 'ccp_alpha': 0.005}. Best is trial 2774 with value: 0.046571421912873.
[I 2025-04-16 01:54:59,291] Trial 3176 finished with value: -8.654305799654502 and parameters: {'n_estimators': 1680, 'min_samples_split': 8, 'max_features': 0.91, 'min_samples_leaf': 9, 'criterion': 'absolute_error', 'max_depth': None, 'min_weight_fraction_leaf': 0.0, 'max_leaf_nodes': 300, 'bootstrap': False, 'ccp_alpha': 0.0}. Best is trial 2774 with value: 0.046571421912873.
[I 2025-04-16 01:55:01,401] Trial 3177 finished with value: -0.1936417107583833 and parameters: {'n_estimators': 1488, 'min_samples_split': 16, 'max_features': 0.9, 'min_samples_leaf': 6, 'criterion': 'absolute_error', 'max_depth': None, 'min_weight_fraction_leaf': 0.0, 'max_leaf_nodes': 50, 'bootstrap': False, 'ccp_alpha': 0.009000000000000001}. Best is trial 2774 with value: 0.046571421912873.
[I 2025-04-16 01:55:03,688] Trial 3178 finished with value: -0.1936417107583833 and parameters: {'n_estimators': 2395, 'min_samples_split': 12, 'max_features': 0.9, 'min_samples_leaf': 4, 'criterion': 'absolute_error', 'max_depth': None, 'min_weight_fraction_leaf': 0.07, 'max_leaf_nodes': 300, 'bootstrap': False, 'ccp_alpha': 0.016}. Best is trial 2774 with value: 0.046571421912873.
[I 2025-04-16 01:55:05,478] Trial 3179 finished with value: -20.158660837744247 and parameters: {'n_estimators': 1642, 'min_samples_split': 8, 'max_features': 0.8400000000000001, 'min_samples_leaf': 7, 'criterion': 'poisson', 'max_depth': None, 'min_weight_fraction_leaf': 0.0, 'max_leaf_nodes': 300, 'bootstrap': False, 'ccp_alpha': 0.01}. Best is trial 2774 with value: 0.046571421912873.
[I 2025-04-16 01:55:07,241] Trial 3180 finished with value: -0.1936417107583833 and parameters: {'n_estimators': 1763, 'min_samples_split': 12, 'max_features': 0.87, 'min_samples_leaf': 4, 'criterion': 'absolute_error', 'max_depth': None, 'min_weight_fraction_leaf': 0.0, 'max_leaf_nodes': 300, 'bootstrap': False, 'ccp_alpha': 0.019}. Best is trial 2774 with value: 0.046571421912873.
[I 2025-04-16 01:55:08,764] Trial 3181 finished with value: -0.1936417107583833 and parameters: {'n_estimators': 1246, 'min_samples_split': 17, 'max_features': 0.89, 'min_samples_leaf': 9, 'criterion': 'absolute_error', 'max_depth': None, 'min_weight_fraction_leaf': 0.0, 'max_leaf_nodes': 300, 'bootstrap': False, 'ccp_alpha': 0.005}. Best is trial 2774 with value: 0.046571421912873.
[I 2025-04-16 01:55:10,805] Trial 3182 finished with value: -10.966107718280607 and parameters: {'n_estimators': 2386, 'min_samples_split': 8, 'max_features': 0.91, 'min_samples_leaf': 6, 'criterion': 'absolute_error', 'max_depth': None, 'min_weight_fraction_leaf': 0.0, 'max_leaf_nodes': 300, 'bootstrap': False, 'ccp_alpha': 0.0}. Best is trial 2774 with value: 0.046571421912873.
[I 2025-04-16 01:55:12,399] Trial 3183 finished with value: -0.1936417107583833 and parameters: {'n_estimators': 1452, 'min_samples_split': 19, 'max_features': 0.88, 'min_samples_leaf': 3, 'criterion': 'absolute_error', 'max_depth': None, 'min_weight_fraction_leaf': 0.0, 'max_leaf_nodes': 300, 'bootstrap': False, 'ccp_alpha': 0.228}. Best is trial 2774 with value: 0.046571421912873.
[I 2025-04-16 01:55:14,463] Trial 3184 finished with value: -0.1936417107583833 and parameters: {'n_estimators': 1826, 'min_samples_split': 12, 'max_features': 0.91, 'min_samples_leaf': 6, 'criterion': 'absolute_error', 'max_depth': None, 'min_weight_fraction_leaf': 0.0, 'max_leaf_nodes': 300, 'bootstrap': False, 'ccp_alpha': 0.014}. Best is trial 2774 with value: 0.046571421912873.
[I 2025-04-16 01:55:15,808] Trial 3185 finished with value: -0.1936417107583833 and parameters: {'n_estimators': 1129, 'min_samples_split': 8, 'max_features': 0.89, 'min_samples_leaf': 8, 'criterion': 'absolute_error', 'max_depth': None, 'min_weight_fraction_leaf': 0.0, 'max_leaf_nodes': 300, 'bootstrap': False, 'ccp_alpha': 0.033}. Best is trial 2774 with value: 0.046571421912873.
[I 2025-04-16 01:55:17,504] Trial 3186 finished with value: -0.06814698187741408 and parameters: {'n_estimators': 1447, 'min_samples_split': 15, 'max_features': 0.85, 'min_samples_leaf': 4, 'criterion': 'absolute_error', 'max_depth': None, 'min_weight_fraction_leaf': 0.0, 'max_leaf_nodes': None, 'bootstrap': False, 'ccp_alpha': 0.005}. Best is trial 2774 with value: 0.046571421912873.
[I 2025-04-16 01:55:19,927] Trial 3187 finished with value: -0.1936417107583833 and parameters: {'n_estimators': 2521, 'min_samples_split': 8, 'max_features': 0.91, 'min_samples_leaf': 3, 'criterion': 'absolute_error', 'max_depth': None, 'min_weight_fraction_leaf': 0.0, 'max_leaf_nodes': 300, 'bootstrap': False, 'ccp_alpha': 0.009000000000000001}. Best is trial 2774 with value: 0.046571421912873.
[I 2025-04-16 01:55:22,105] Trial 3188 finished with value: -0.1936417107583833 and parameters: {'n_estimators': 2101, 'min_samples_split': 20, 'max_features': 0.87, 'min_samples_leaf': 9, 'criterion': 'absolute_error', 'max_depth': None, 'min_weight_fraction_leaf': 0.0, 'max_leaf_nodes': 300, 'bootstrap': False, 'ccp_alpha': 0.025}. Best is trial 2774 with value: 0.046571421912873.
[I 2025-04-16 01:55:24,094] Trial 3189 finished with value: -0.1936417107583833 and parameters: {'n_estimators': 1814, 'min_samples_split': 11, 'max_features': 0.9, 'min_samples_leaf': 6, 'criterion': 'absolute_error', 'max_depth': None, 'min_weight_fraction_leaf': 0.0, 'max_leaf_nodes': 50, 'bootstrap': False, 'ccp_alpha': 0.019}. Best is trial 2774 with value: 0.046571421912873.
[I 2025-04-16 01:55:25,773] Trial 3190 finished with value: -0.1936417107583833 and parameters: {'n_estimators': 1645, 'min_samples_split': 134, 'max_features': 0.92, 'min_samples_leaf': 4, 'criterion': 'absolute_error', 'max_depth': None, 'min_weight_fraction_leaf': 0.0, 'max_leaf_nodes': 300, 'bootstrap': False, 'ccp_alpha': 0.0}. Best is trial 2774 with value: 0.046571421912873.
[I 2025-04-16 01:55:27,234] Trial 3191 finished with value: -0.1936417107583833 and parameters: {'n_estimators': 1299, 'min_samples_split': 7, 'max_features': 0.89, 'min_samples_leaf': 7, 'criterion': 'absolute_error', 'max_depth': None, 'min_weight_fraction_leaf': 0.0, 'max_leaf_nodes': 300, 'bootstrap': False, 'ccp_alpha': 0.011}. Best is trial 2774 with value: 0.046571421912873.
[I 2025-04-16 01:55:29,558] Trial 3192 finished with value: -0.09605372027135195 and parameters: {'n_estimators': 2075, 'min_samples_split': 16, 'max_features': 0.86, 'min_samples_leaf': 5, 'criterion': 'absolute_error', 'max_depth': None, 'min_weight_fraction_leaf': 0.0, 'max_leaf_nodes': 300, 'bootstrap': False, 'ccp_alpha': 0.005}. Best is trial 2774 with value: 0.046571421912873.
[I 2025-04-16 01:55:32,036] Trial 3193 finished with value: -0.1936417107583833 and parameters: {'n_estimators': 2502, 'min_samples_split': 8, 'max_features': 0.91, 'min_samples_leaf': 9, 'criterion': 'absolute_error', 'max_depth': None, 'min_weight_fraction_leaf': 0.0, 'max_leaf_nodes': 300, 'bootstrap': False, 'ccp_alpha': 0.009000000000000001}. Best is trial 2774 with value: 0.046571421912873.
[I 2025-04-16 01:55:33,751] Trial 3194 finished with value: -0.1936417107583833 and parameters: {'n_estimators': 1551, 'min_samples_split': 80, 'max_features': 0.88, 'min_samples_leaf': 3, 'criterion': 'absolute_error', 'max_depth': None, 'min_weight_fraction_leaf': 0.0, 'max_leaf_nodes': 300, 'bootstrap': False, 'ccp_alpha': 0.014}. Best is trial 2774 with value: 0.046571421912873.
[I 2025-04-16 01:55:36,109] Trial 3195 finished with value: -0.0894043502102636 and parameters: {'n_estimators': 2337, 'min_samples_split': 12, 'max_features': 0.8400000000000001, 'min_samples_leaf': 7, 'criterion': 'absolute_error', 'max_depth': None, 'min_weight_fraction_leaf': 0.0, 'max_leaf_nodes': 300, 'bootstrap': False, 'ccp_alpha': 0.005}. Best is trial 2774 with value: 0.046571421912873.
[I 2025-04-16 01:55:37,474] Trial 3196 finished with value: -17.528986382276013 and parameters: {'n_estimators': 1208, 'min_samples_split': 13, 'max_features': 0.92, 'min_samples_leaf': 5, 'criterion': 'friedman_mse', 'max_depth': None, 'min_weight_fraction_leaf': 0.0, 'max_leaf_nodes': 300, 'bootstrap': False, 'ccp_alpha': 0.02}. Best is trial 2774 with value: 0.046571421912873.
[I 2025-04-16 01:55:39,435] Trial 3197 finished with value: -0.1936417107583833 and parameters: {'n_estimators': 1807, 'min_samples_split': 19, 'max_features': 0.9, 'min_samples_leaf': 3, 'criterion': 'absolute_error', 'max_depth': None, 'min_weight_fraction_leaf': 0.0, 'max_leaf_nodes': 300, 'bootstrap': False, 'ccp_alpha': 0.009000000000000001}. Best is trial 2774 with value: 0.046571421912873.
[I 2025-04-16 01:55:42,254] Trial 3198 finished with value: -7.177691545341533 and parameters: {'n_estimators': 2611, 'min_samples_split': 7, 'max_features': 0.87, 'min_samples_leaf': 8, 'criterion': 'absolute_error', 'max_depth': None, 'min_weight_fraction_leaf': 0.0, 'max_leaf_nodes': 300, 'bootstrap': False, 'ccp_alpha': 0.0}. Best is trial 2774 with value: 0.046571421912873.
[I 2025-04-16 01:55:43,704] Trial 3199 finished with value: -17.528986382276248 and parameters: {'n_estimators': 1392, 'min_samples_split': 16, 'max_features': 0.92, 'min_samples_leaf': 6, 'criterion': 'squared_error', 'max_depth': None, 'min_weight_fraction_leaf': 0.0, 'max_leaf_nodes': 300, 'bootstrap': False, 'ccp_alpha': 0.015}. Best is trial 2774 with value: 0.046571421912873.
[I 2025-04-16 01:55:45,253] Trial 3200 finished with value: -6.462799091425151 and parameters: {'n_estimators': 1551, 'min_samples_split': 11, 'max_features': 0.9, 'min_samples_leaf': 3, 'criterion': 'absolute_error', 'max_depth': None, 'min_weight_fraction_leaf': 0.0, 'max_leaf_nodes': 300, 'bootstrap': False, 'ccp_alpha': 0.0}. Best is trial 2774 with value: 0.046571421912873.
[I 2025-04-16 01:55:47,539] Trial 3201 finished with value: -0.1936417107583833 and parameters: {'n_estimators': 1948, 'min_samples_split': 7, 'max_features': 0.88, 'min_samples_leaf': 9, 'criterion': 'absolute_error', 'max_depth': None, 'min_weight_fraction_leaf': 0.0, 'max_leaf_nodes': 300, 'bootstrap': False, 'ccp_alpha': 0.005}. Best is trial 2774 with value: 0.046571421912873.
[I 2025-04-16 01:55:49,956] Trial 3202 finished with value: -0.1936417107583833 and parameters: {'n_estimators': 2349, 'min_samples_split': 15, 'max_features': 0.93, 'min_samples_leaf': 5, 'criterion': 'absolute_error', 'max_depth': None, 'min_weight_fraction_leaf': 0.0, 'max_leaf_nodes': 300, 'bootstrap': False, 'ccp_alpha': 0.01}. Best is trial 2774 with value: 0.046571421912873.
[I 2025-04-16 01:55:51,819] Trial 3203 finished with value: -0.1936417107583833 and parameters: {'n_estimators': 1648, 'min_samples_split': 20, 'max_features': 0.89, 'min_samples_leaf': 75, 'criterion': 'absolute_error', 'max_depth': None, 'min_weight_fraction_leaf': 0.0, 'max_leaf_nodes': 300, 'bootstrap': False, 'ccp_alpha': 0.025}. Best is trial 2774 with value: 0.046571421912873.
[I 2025-04-16 01:55:53,446] Trial 3204 finished with value: -0.1936417107583833 and parameters: {'n_estimators': 1385, 'min_samples_split': 12, 'max_features': 0.91, 'min_samples_leaf': 7, 'criterion': 'absolute_error', 'max_depth': None, 'min_weight_fraction_leaf': 0.0, 'max_leaf_nodes': 300, 'bootstrap': False, 'ccp_alpha': 0.015}. Best is trial 2774 with value: 0.046571421912873.
[I 2025-04-16 01:55:54,906] Trial 3205 finished with value: -0.06837665726721527 and parameters: {'n_estimators': 1201, 'min_samples_split': 11, 'max_features': 0.87, 'min_samples_leaf': 3, 'criterion': 'absolute_error', 'max_depth': None, 'min_weight_fraction_leaf': 0.0, 'max_leaf_nodes': 300, 'bootstrap': False, 'ccp_alpha': 0.005}. Best is trial 2774 with value: 0.046571421912873.
[I 2025-04-16 01:55:57,661] Trial 3206 finished with value: -28.3973602968289 and parameters: {'n_estimators': 2548, 'min_samples_split': 7, 'max_features': 0.93, 'min_samples_leaf': 5, 'criterion': 'poisson', 'max_depth': None, 'min_weight_fraction_leaf': 0.0, 'max_leaf_nodes': 300, 'bootstrap': False, 'ccp_alpha': 0.009000000000000001}. Best is trial 2774 with value: 0.046571421912873.
[I 2025-04-16 01:55:59,844] Trial 3207 finished with value: -8.620827963126155 and parameters: {'n_estimators': 2189, 'min_samples_split': 8, 'max_features': 0.9, 'min_samples_leaf': 9, 'criterion': 'absolute_error', 'max_depth': None, 'min_weight_fraction_leaf': 0.0, 'max_leaf_nodes': 300, 'bootstrap': False, 'ccp_alpha': 0.0}. Best is trial 2774 with value: 0.046571421912873.
[I 2025-04-16 01:56:01,778] Trial 3208 finished with value: -0.1936417107583833 and parameters: {'n_estimators': 1720, 'min_samples_split': 15, 'max_features': 0.92, 'min_samples_leaf': 6, 'criterion': 'absolute_error', 'max_depth': 15, 'min_weight_fraction_leaf': 0.05, 'max_leaf_nodes': 300, 'bootstrap': False, 'ccp_alpha': 0.14300000000000002}. Best is trial 2774 with value: 0.046571421912873.
[I 2025-04-16 01:56:03,929] Trial 3209 finished with value: -0.1936417107583833 and parameters: {'n_estimators': 1901, 'min_samples_split': 8, 'max_features': 0.86, 'min_samples_leaf': 3, 'criterion': 'absolute_error', 'max_depth': None, 'min_weight_fraction_leaf': 0.08, 'max_leaf_nodes': 300, 'bootstrap': False, 'ccp_alpha': 0.019}. Best is trial 2774 with value: 0.046571421912873.
[I 2025-04-16 01:56:05,309] Trial 3210 finished with value: -0.1936417107583833 and parameters: {'n_estimators': 1183, 'min_samples_split': 20, 'max_features': 0.89, 'min_samples_leaf': 7, 'criterion': 'absolute_error', 'max_depth': None, 'min_weight_fraction_leaf': 0.0, 'max_leaf_nodes': 300, 'bootstrap': False, 'ccp_alpha': 0.01}. Best is trial 2774 with value: 0.046571421912873.
[I 2025-04-16 01:56:08,096] Trial 3211 finished with value: -0.12935241163809338 and parameters: {'n_estimators': 2593, 'min_samples_split': 12, 'max_features': 0.63, 'min_samples_leaf': 4, 'criterion': 'absolute_error', 'max_depth': None, 'min_weight_fraction_leaf': 0.0, 'max_leaf_nodes': 300, 'bootstrap': False, 'ccp_alpha': 0.005}. Best is trial 2774 with value: 0.046571421912873.
[I 2025-04-16 01:56:10,286] Trial 3212 finished with value: -0.1936417107583833 and parameters: {'n_estimators': 2087, 'min_samples_split': 16, 'max_features': 0.9400000000000001, 'min_samples_leaf': 8, 'criterion': 'absolute_error', 'max_depth': None, 'min_weight_fraction_leaf': 0.0, 'max_leaf_nodes': 300, 'bootstrap': False, 'ccp_alpha': 0.012}. Best is trial 2774 with value: 0.046571421912873.
[I 2025-04-16 01:56:11,867] Trial 3213 finished with value: -9.641001051319137 and parameters: {'n_estimators': 1502, 'min_samples_split': 7, 'max_features': 0.6900000000000001, 'min_samples_leaf': 5, 'criterion': 'friedman_mse', 'max_depth': None, 'min_weight_fraction_leaf': 0.0, 'max_leaf_nodes': 300, 'bootstrap': False, 'ccp_alpha': 0.0}. Best is trial 2774 with value: 0.046571421912873.
[I 2025-04-16 01:56:14,363] Trial 3214 finished with value: -0.1936417107583833 and parameters: {'n_estimators': 2354, 'min_samples_split': 12, 'max_features': 0.91, 'min_samples_leaf': 9, 'criterion': 'absolute_error', 'max_depth': None, 'min_weight_fraction_leaf': 0.0, 'max_leaf_nodes': 300, 'bootstrap': False, 'ccp_alpha': 0.015}. Best is trial 2774 with value: 0.046571421912873.
[I 2025-04-16 01:56:16,232] Trial 3215 finished with value: 0.02450529407417552 and parameters: {'n_estimators': 1650, 'min_samples_split': 7, 'max_features': 0.8400000000000001, 'min_samples_leaf': 3, 'criterion': 'absolute_error', 'max_depth': None, 'min_weight_fraction_leaf': 0.0, 'max_leaf_nodes': 300, 'bootstrap': False, 'ccp_alpha': 0.005}. Best is trial 2774 with value: 0.046571421912873.
[I 2025-04-16 01:56:17,901] Trial 3216 finished with value: -0.1936417107583833 and parameters: {'n_estimators': 1511, 'min_samples_split': 8, 'max_features': 0.8300000000000001, 'min_samples_leaf': 3, 'criterion': 'absolute_error', 'max_depth': None, 'min_weight_fraction_leaf': 0.0, 'max_leaf_nodes': 300, 'bootstrap': False, 'ccp_alpha': 0.021}. Best is trial 2774 with value: 0.046571421912873.
[I 2025-04-16 01:56:19,856] Trial 3217 finished with value: -0.1936417107583833 and parameters: {'n_estimators': 1333, 'min_samples_split': 7, 'max_features': 0.8200000000000001, 'min_samples_leaf': 3, 'criterion': 'absolute_error', 'max_depth': None, 'min_weight_fraction_leaf': 0.0, 'max_leaf_nodes': 300, 'bootstrap': False, 'ccp_alpha': 0.009000000000000001}. Best is trial 2774 with value: 0.046571421912873.
[I 2025-04-16 01:56:21,256] Trial 3218 finished with value: 0.024196770926348886 and parameters: {'n_estimators': 1175, 'min_samples_split': 6, 'max_features': 0.8400000000000001, 'min_samples_leaf': 3, 'criterion': 'absolute_error', 'max_depth': None, 'min_weight_fraction_leaf': 0.0, 'max_leaf_nodes': 300, 'bootstrap': False, 'ccp_alpha': 0.005}. Best is trial 2774 with value: 0.046571421912873.
[I 2025-04-16 01:56:22,621] Trial 3219 finished with value: -0.1936417107583833 and parameters: {'n_estimators': 1126, 'min_samples_split': 6, 'max_features': 0.86, 'min_samples_leaf': 3, 'criterion': 'absolute_error', 'max_depth': None, 'min_weight_fraction_leaf': 0.0, 'max_leaf_nodes': 300, 'bootstrap': False, 'ccp_alpha': 0.015}. Best is trial 2774 with value: 0.046571421912873.
[I 2025-04-16 01:56:23,905] Trial 3220 finished with value: -9.246825604057644 and parameters: {'n_estimators': 980, 'min_samples_split': 7, 'max_features': 0.81, 'min_samples_leaf': 3, 'criterion': 'absolute_error', 'max_depth': None, 'min_weight_fraction_leaf': 0.0, 'max_leaf_nodes': 300, 'bootstrap': False, 'ccp_alpha': 0.0}. Best is trial 2774 with value: 0.046571421912873.
[I 2025-04-16 01:56:25,095] Trial 3221 finished with value: -17.52898638227561 and parameters: {'n_estimators': 983, 'min_samples_split': 6, 'max_features': 0.8, 'min_samples_leaf': 3, 'criterion': 'squared_error', 'max_depth': None, 'min_weight_fraction_leaf': 0.0, 'max_leaf_nodes': 300, 'bootstrap': False, 'ccp_alpha': 0.01}. Best is trial 2774 with value: 0.046571421912873.
[I 2025-04-16 01:56:26,296] Trial 3222 finished with value: 0.024574600118488887 and parameters: {'n_estimators': 989, 'min_samples_split': 7, 'max_features': 0.8200000000000001, 'min_samples_leaf': 3, 'criterion': 'absolute_error', 'max_depth': None, 'min_weight_fraction_leaf': 0.0, 'max_leaf_nodes': 300, 'bootstrap': False, 'ccp_alpha': 0.005}. Best is trial 2774 with value: 0.046571421912873.
[I 2025-04-16 01:56:27,374] Trial 3223 finished with value: -0.1936417107583833 and parameters: {'n_estimators': 793, 'min_samples_split': 6, 'max_features': 0.81, 'min_samples_leaf': 3, 'criterion': 'absolute_error', 'max_depth': None, 'min_weight_fraction_leaf': 0.0, 'max_leaf_nodes': 300, 'bootstrap': False, 'ccp_alpha': 0.018000000000000002}. Best is trial 2774 with value: 0.046571421912873.
[I 2025-04-16 01:56:28,475] Trial 3224 finished with value: -0.1936417107583833 and parameters: {'n_estimators': 835, 'min_samples_split': 6, 'max_features': 0.8200000000000001, 'min_samples_leaf': 3, 'criterion': 'absolute_error', 'max_depth': None, 'min_weight_fraction_leaf': 0.0, 'max_leaf_nodes': 300, 'bootstrap': False, 'ccp_alpha': 0.009000000000000001}. Best is trial 2774 with value: 0.046571421912873.
[I 2025-04-16 01:56:29,563] Trial 3225 finished with value: -0.1936417107583833 and parameters: {'n_estimators': 727, 'min_samples_split': 6, 'max_features': 0.81, 'min_samples_leaf': 3, 'criterion': 'absolute_error', 'max_depth': None, 'min_weight_fraction_leaf': 0.0, 'max_leaf_nodes': 300, 'bootstrap': False, 'ccp_alpha': 0.027}. Best is trial 2774 with value: 0.046571421912873.
[I 2025-04-16 01:56:30,781] Trial 3226 finished with value: 0.02155564357098978 and parameters: {'n_estimators': 851, 'min_samples_split': 6, 'max_features': 0.8200000000000001, 'min_samples_leaf': 3, 'criterion': 'absolute_error', 'max_depth': None, 'min_weight_fraction_leaf': 0.0, 'max_leaf_nodes': 300, 'bootstrap': False, 'ccp_alpha': 0.005}. Best is trial 2774 with value: 0.046571421912873.
[I 2025-04-16 01:56:31,922] Trial 3227 finished with value: -22.484640259126074 and parameters: {'n_estimators': 890, 'min_samples_split': 6, 'max_features': 0.8200000000000001, 'min_samples_leaf': 3, 'criterion': 'poisson', 'max_depth': None, 'min_weight_fraction_leaf': 0.0, 'max_leaf_nodes': 300, 'bootstrap': False, 'ccp_alpha': 0.013000000000000001}. Best is trial 2774 with value: 0.046571421912873.
[I 2025-04-16 01:56:33,171] Trial 3228 finished with value: 0.052087729354257054 and parameters: {'n_estimators': 949, 'min_samples_split': 7, 'max_features': 0.81, 'min_samples_leaf': 2, 'criterion': 'absolute_error', 'max_depth': None, 'min_weight_fraction_leaf': 0.0, 'max_leaf_nodes': 300, 'bootstrap': False, 'ccp_alpha': 0.005}. Best is trial 3228 with value: 0.052087729354257054.
