[I 2025-04-16 02:02:33,706] Trial 3621 finished with value: -0.19508325852989264 and parameters: {'n_estimators': 238, 'min_samples_split': 2, 'max_features': 0.78, 'min_samples_leaf': 4, 'criterion': 'absolute_error', 'max_depth': 15, 'min_weight_fraction_leaf': 0.0, 'max_leaf_nodes': 300, 'bootstrap': False, 'ccp_alpha': 0.005}. Best is trial 3488 with value: 0.05528345733671649.
[I 2025-04-16 02:02:35,074] Trial 3622 finished with value: -0.1936417107583833 and parameters: {'n_estimators': 1021, 'min_samples_split': 9, 'max_features': 0.68, 'min_samples_leaf': 1, 'criterion': 'absolute_error', 'max_depth': 15, 'min_weight_fraction_leaf': 0.0, 'max_leaf_nodes': 300, 'bootstrap': False, 'ccp_alpha': 0.023}. Best is trial 3488 with value: 0.05528345733671649.
[I 2025-04-16 02:02:36,154] Trial 3623 finished with value: -0.1936417107583833 and parameters: {'n_estimators': 661, 'min_samples_split': 5, 'max_features': 0.72, 'min_samples_leaf': 4, 'criterion': 'absolute_error', 'max_depth': 15, 'min_weight_fraction_leaf': 0.0, 'max_leaf_nodes': 300, 'bootstrap': False, 'ccp_alpha': 0.01}. Best is trial 3488 with value: 0.05528345733671649.
[I 2025-04-16 02:02:36,807] Trial 3624 finished with value: -13.88507871169991 and parameters: {'n_estimators': 171, 'min_samples_split': 5, 'max_features': 0.76, 'min_samples_leaf': 3, 'criterion': 'absolute_error', 'max_depth': 15, 'min_weight_fraction_leaf': 0.0, 'max_leaf_nodes': 300, 'bootstrap': False, 'ccp_alpha': 0.0}. Best is trial 3488 with value: 0.05528345733671649.
[I 2025-04-16 02:02:37,724] Trial 3625 finished with value: -17.528986382274876 and parameters: {'n_estimators': 435, 'min_samples_split': 2, 'max_features': 0.8, 'min_samples_leaf': 1, 'criterion': 'friedman_mse', 'max_depth': 15, 'min_weight_fraction_leaf': 0.0, 'max_leaf_nodes': 300, 'bootstrap': False, 'ccp_alpha': 0.017}. Best is trial 3488 with value: 0.05528345733671649.
[I 2025-04-16 02:02:38,854] Trial 3626 finished with value: -0.1936417107583833 and parameters: {'n_estimators': 732, 'min_samples_split': 8, 'max_features': 0.74, 'min_samples_leaf': 3, 'criterion': 'absolute_error', 'max_depth': 15, 'min_weight_fraction_leaf': 0.0, 'max_leaf_nodes': 300, 'bootstrap': False, 'ccp_alpha': 0.009000000000000001}. Best is trial 3488 with value: 0.05528345733671649.
[I 2025-04-16 02:02:39,863] Trial 3627 finished with value: -0.1936417107583833 and parameters: {'n_estimators': 580, 'min_samples_split': 9, 'max_features': 0.72, 'min_samples_leaf': 1, 'criterion': 'absolute_error', 'max_depth': 15, 'min_weight_fraction_leaf': 0.0, 'max_leaf_nodes': 300, 'bootstrap': False, 'ccp_alpha': 0.006}. Best is trial 3488 with value: 0.05528345733671649.
[I 2025-04-16 02:02:41,205] Trial 3628 finished with value: -0.1936417107583833 and parameters: {'n_estimators': 1001, 'min_samples_split': 2, 'max_features': 0.76, 'min_samples_leaf': 4, 'criterion': 'absolute_error', 'max_depth': 15, 'min_weight_fraction_leaf': 0.0, 'max_leaf_nodes': 300, 'bootstrap': False, 'ccp_alpha': 0.014}. Best is trial 3488 with value: 0.05528345733671649.
[I 2025-04-16 02:02:41,969] Trial 3629 finished with value: -14.007371227665482 and parameters: {'n_estimators': 348, 'min_samples_split': 5, 'max_features': 0.78, 'min_samples_leaf': 3, 'criterion': 'absolute_error', 'max_depth': 15, 'min_weight_fraction_leaf': 0.0, 'max_leaf_nodes': 300, 'bootstrap': False, 'ccp_alpha': 0.0}. Best is trial 3488 with value: 0.05528345733671649.
[I 2025-04-16 02:02:42,650] Trial 3630 finished with value: -0.1936417107583833 and parameters: {'n_estimators': 186, 'min_samples_split': 9, 'max_features': 0.74, 'min_samples_leaf': 1, 'criterion': 'absolute_error', 'max_depth': 15, 'min_weight_fraction_leaf': 0.0, 'max_leaf_nodes': 300, 'bootstrap': False, 'ccp_alpha': 0.019}. Best is trial 3488 with value: 0.05528345733671649.
[I 2025-04-16 02:02:43,843] Trial 3631 finished with value: -0.1936417107583833 and parameters: {'n_estimators': 830, 'min_samples_split': 5, 'max_features': 0.6900000000000001, 'min_samples_leaf': 4, 'criterion': 'absolute_error', 'max_depth': 15, 'min_weight_fraction_leaf': 0.0, 'max_leaf_nodes': 300, 'bootstrap': False, 'ccp_alpha': 0.009000000000000001}. Best is trial 3488 with value: 0.05528345733671649.
[I 2025-04-16 02:02:44,350] Trial 3632 finished with value: -0.1936417107583833 and parameters: {'n_estimators': 3, 'min_samples_split': 2, 'max_features': 0.72, 'min_samples_leaf': 1, 'criterion': 'absolute_error', 'max_depth': 15, 'min_weight_fraction_leaf': 0.0, 'max_leaf_nodes': 300, 'bootstrap': False, 'ccp_alpha': 0.005}. Best is trial 3488 with value: 0.05528345733671649.
[I 2025-04-16 02:02:45,321] Trial 3633 finished with value: -0.1936417107583833 and parameters: {'n_estimators': 532, 'min_samples_split': 8, 'max_features': 0.8, 'min_samples_leaf': 3, 'criterion': 'absolute_error', 'max_depth': 15, 'min_weight_fraction_leaf': 0.0, 'max_leaf_nodes': 300, 'bootstrap': False, 'ccp_alpha': 0.014}. Best is trial 3488 with value: 0.05528345733671649.
[I 2025-04-16 02:02:46,095] Trial 3634 finished with value: -17.528986382274876 and parameters: {'n_estimators': 421, 'min_samples_split': 62, 'max_features': 0.67, 'min_samples_leaf': 4, 'criterion': 'squared_error', 'max_depth': 15, 'min_weight_fraction_leaf': 0.0, 'max_leaf_nodes': 300, 'bootstrap': False, 'ccp_alpha': 0.0}. Best is trial 3488 with value: 0.05528345733671649.
[I 2025-04-16 02:02:47,085] Trial 3635 finished with value: -0.1936417107583833 and parameters: {'n_estimators': 588, 'min_samples_split': 2, 'max_features': 0.76, 'min_samples_leaf': 1, 'criterion': 'absolute_error', 'max_depth': 15, 'min_weight_fraction_leaf': 0.0, 'max_leaf_nodes': 300, 'bootstrap': False, 'ccp_alpha': 0.009000000000000001}. Best is trial 3488 with value: 0.05528345733671649.
[I 2025-04-16 02:02:48,301] Trial 3636 finished with value: -0.1936417107583833 and parameters: {'n_estimators': 790, 'min_samples_split': 9, 'max_features': 0.7000000000000001, 'min_samples_leaf': 3, 'criterion': 'absolute_error', 'max_depth': 15, 'min_weight_fraction_leaf': 0.0, 'max_leaf_nodes': 300, 'bootstrap': False, 'ccp_alpha': 0.022}. Best is trial 3488 with value: 0.05528345733671649.
[I 2025-04-16 02:02:49,651] Trial 3637 finished with value: 0.02575654296820813 and parameters: {'n_estimators': 1015, 'min_samples_split': 5, 'max_features': 0.74, 'min_samples_leaf': 1, 'criterion': 'absolute_error', 'max_depth': 15, 'min_weight_fraction_leaf': 0.0, 'max_leaf_nodes': 300, 'bootstrap': False, 'ccp_alpha': 0.005}. Best is trial 3488 with value: 0.05528345733671649.
[I 2025-04-16 02:02:50,390] Trial 3638 finished with value: -0.1936417107583833 and parameters: {'n_estimators': 313, 'min_samples_split': 5, 'max_features': 0.78, 'min_samples_leaf': 4, 'criterion': 'absolute_error', 'max_depth': 15, 'min_weight_fraction_leaf': 0.0, 'max_leaf_nodes': 300, 'bootstrap': False, 'ccp_alpha': 0.248}. Best is trial 3488 with value: 0.05528345733671649.
[I 2025-04-16 02:02:51,017] Trial 3639 finished with value: -0.1936417107583833 and parameters: {'n_estimators': 142, 'min_samples_split': 9, 'max_features': 0.73, 'min_samples_leaf': 1, 'criterion': 'absolute_error', 'max_depth': 15, 'min_weight_fraction_leaf': 0.0, 'max_leaf_nodes': 300, 'bootstrap': False, 'ccp_alpha': 0.014}. Best is trial 3488 with value: 0.05528345733671649.
[I 2025-04-16 02:02:52,048] Trial 3640 finished with value: 0.02451106517581303 and parameters: {'n_estimators': 633, 'min_samples_split': 2, 'max_features': 0.8, 'min_samples_leaf': 3, 'criterion': 'absolute_error', 'max_depth': 15, 'min_weight_fraction_leaf': 0.0, 'max_leaf_nodes': 300, 'bootstrap': False, 'ccp_alpha': 0.005}. Best is trial 3488 with value: 0.05528345733671649.
[I 2025-04-16 02:02:52,837] Trial 3641 finished with value: -15.891500983155561 and parameters: {'n_estimators': 376, 'min_samples_split': 6, 'max_features': 0.7100000000000001, 'min_samples_leaf': 4, 'criterion': 'poisson', 'max_depth': 15, 'min_weight_fraction_leaf': 0.0, 'max_leaf_nodes': 300, 'bootstrap': False, 'ccp_alpha': 0.01}. Best is trial 3488 with value: 0.05528345733671649.
[I 2025-04-16 02:02:53,994] Trial 3642 finished with value: -0.1936417107583833 and parameters: {'n_estimators': 810, 'min_samples_split': 9, 'max_features': 0.76, 'min_samples_leaf': 1, 'criterion': 'absolute_error', 'max_depth': 15, 'min_weight_fraction_leaf': 0.0, 'max_leaf_nodes': 300, 'bootstrap': False, 'ccp_alpha': 0.018000000000000002}. Best is trial 3488 with value: 0.05528345733671649.
[I 2025-04-16 02:02:54,925] Trial 3643 finished with value: -14.492722215042477 and parameters: {'n_estimators': 511, 'min_samples_split': 2, 'max_features': 0.75, 'min_samples_leaf': 3, 'criterion': 'absolute_error', 'max_depth': 15, 'min_weight_fraction_leaf': 0.0, 'max_leaf_nodes': 300, 'bootstrap': False, 'ccp_alpha': 0.0}. Best is trial 3488 with value: 0.05528345733671649.
[I 2025-04-16 02:02:55,611] Trial 3644 finished with value: -0.1936417107583833 and parameters: {'n_estimators': 216, 'min_samples_split': 9, 'max_features': 0.73, 'min_samples_leaf': 1, 'criterion': 'absolute_error', 'max_depth': 15, 'min_weight_fraction_leaf': 0.0, 'max_leaf_nodes': 300, 'bootstrap': False, 'ccp_alpha': 0.01}. Best is trial 3488 with value: 0.05528345733671649.
[I 2025-04-16 02:02:56,931] Trial 3645 finished with value: -0.1936417107583833 and parameters: {'n_estimators': 1002, 'min_samples_split': 131, 'max_features': 0.78, 'min_samples_leaf': 91, 'criterion': 'absolute_error', 'max_depth': 15, 'min_weight_fraction_leaf': 0.0, 'max_leaf_nodes': 300, 'bootstrap': False, 'ccp_alpha': 0.029}. Best is trial 3488 with value: 0.05528345733671649.
[I 2025-04-16 02:02:58,065] Trial 3646 finished with value: -0.1936417107583833 and parameters: {'n_estimators': 700, 'min_samples_split': 5, 'max_features': 0.7100000000000001, 'min_samples_leaf': 4, 'criterion': 'absolute_error', 'max_depth': 15, 'min_weight_fraction_leaf': 0.0, 'max_leaf_nodes': 300, 'bootstrap': False, 'ccp_alpha': 0.006}. Best is trial 3488 with value: 0.05528345733671649.
[I 2025-04-16 02:02:58,565] Trial 3647 finished with value: -0.1936417107583833 and parameters: {'n_estimators': 5, 'min_samples_split': 5, 'max_features': 0.8, 'min_samples_leaf': 3, 'criterion': 'absolute_error', 'max_depth': 15, 'min_weight_fraction_leaf': 0.0, 'max_leaf_nodes': 300, 'bootstrap': False, 'ccp_alpha': 0.281}. Best is trial 3488 with value: 0.05528345733671649.
[I 2025-04-16 02:02:59,371] Trial 3648 finished with value: -30.442913713212096 and parameters: {'n_estimators': 404, 'min_samples_split': 2, 'max_features': 0.68, 'min_samples_leaf': 1, 'criterion': 'absolute_error', 'max_depth': 15, 'min_weight_fraction_leaf': 0.0, 'max_leaf_nodes': 300, 'bootstrap': False, 'ccp_alpha': 0.0}. Best is trial 3488 with value: 0.05528345733671649.
[I 2025-04-16 02:03:00,455] Trial 3649 finished with value: -0.1936417107583833 and parameters: {'n_estimators': 610, 'min_samples_split': 9, 'max_features': 0.77, 'min_samples_leaf': 4, 'criterion': 'absolute_error', 'max_depth': 15, 'min_weight_fraction_leaf': 0.0, 'max_leaf_nodes': 300, 'bootstrap': False, 'ccp_alpha': 0.013000000000000001}. Best is trial 3488 with value: 0.05528345733671649.
[I 2025-04-16 02:03:01,548] Trial 3650 finished with value: -17.528986382275264 and parameters: {'n_estimators': 849, 'min_samples_split': 77, 'max_features': 0.74, 'min_samples_leaf': 1, 'criterion': 'friedman_mse', 'max_depth': 15, 'min_weight_fraction_leaf': 0.0, 'max_leaf_nodes': 300, 'bootstrap': False, 'ccp_alpha': 0.006}. Best is trial 3488 with value: 0.05528345733671649.
[I 2025-04-16 02:03:02,261] Trial 3651 finished with value: -0.1936417107583833 and parameters: {'n_estimators': 263, 'min_samples_split': 6, 'max_features': 0.7000000000000001, 'min_samples_leaf': 3, 'criterion': 'absolute_error', 'max_depth': 15, 'min_weight_fraction_leaf': 0.0, 'max_leaf_nodes': 300, 'bootstrap': False, 'ccp_alpha': 0.019}. Best is trial 3488 with value: 0.05528345733671649.
[I 2025-04-16 02:03:03,098] Trial 3652 finished with value: -0.1936417107583833 and parameters: {'n_estimators': 389, 'min_samples_split': 2, 'max_features': 0.75, 'min_samples_leaf': 1, 'criterion': 'absolute_error', 'max_depth': 15, 'min_weight_fraction_leaf': 0.0, 'max_leaf_nodes': 300, 'bootstrap': False, 'ccp_alpha': 0.01}. Best is trial 3488 with value: 0.05528345733671649.
[I 2025-04-16 02:03:04,026] Trial 3653 finished with value: -10.51327005185653 and parameters: {'n_estimators': 582, 'min_samples_split': 9, 'max_features': 0.72, 'min_samples_leaf': 4, 'criterion': 'absolute_error', 'max_depth': 15, 'min_weight_fraction_leaf': 0.0, 'max_leaf_nodes': 300, 'bootstrap': False, 'ccp_alpha': 0.0}. Best is trial 3488 with value: 0.05528345733671649.
[I 2025-04-16 02:03:05,349] Trial 3654 finished with value: -0.1936417107583833 and parameters: {'n_estimators': 1031, 'min_samples_split': 6, 'max_features': 0.63, 'min_samples_leaf': 84, 'criterion': 'absolute_error', 'max_depth': 15, 'min_weight_fraction_leaf': 0.0, 'max_leaf_nodes': 300, 'bootstrap': False, 'ccp_alpha': 0.014}. Best is trial 3488 with value: 0.05528345733671649.
[I 2025-04-16 02:03:06,565] Trial 3655 finished with value: 0.016797179064841173 and parameters: {'n_estimators': 804, 'min_samples_split': 2, 'max_features': 0.78, 'min_samples_leaf': 3, 'criterion': 'absolute_error', 'max_depth': 15, 'min_weight_fraction_leaf': 0.0, 'max_leaf_nodes': 300, 'bootstrap': False, 'ccp_alpha': 0.005}. Best is trial 3488 with value: 0.05528345733671649.
[I 2025-04-16 02:03:07,186] Trial 3656 finished with value: -0.1936417107583833 and parameters: {'n_estimators': 144, 'min_samples_split': 9, 'max_features': 0.76, 'min_samples_leaf': 1, 'criterion': 'absolute_error', 'max_depth': 15, 'min_weight_fraction_leaf': 0.0, 'max_leaf_nodes': 300, 'bootstrap': False, 'ccp_alpha': 0.021}. Best is trial 3488 with value: 0.05528345733671649.
[I 2025-04-16 02:03:08,102] Trial 3657 finished with value: -0.11637125955998959 and parameters: {'n_estimators': 467, 'min_samples_split': 5, 'max_features': 0.73, 'min_samples_leaf': 4, 'criterion': 'absolute_error', 'max_depth': 15, 'min_weight_fraction_leaf': 0.0, 'max_leaf_nodes': 300, 'bootstrap': False, 'ccp_alpha': 0.005}. Best is trial 3488 with value: 0.05528345733671649.
[I 2025-04-16 02:03:09,225] Trial 3658 finished with value: -0.1936417107583833 and parameters: {'n_estimators': 677, 'min_samples_split': 2, 'max_features': 0.8, 'min_samples_leaf': 1, 'criterion': 'absolute_error', 'max_depth': 15, 'min_weight_fraction_leaf': 0.0, 'max_leaf_nodes': 300, 'bootstrap': False, 'ccp_alpha': 0.036000000000000004}. Best is trial 3488 with value: 0.05528345733671649.
[I 2025-04-16 02:03:09,949] Trial 3659 finished with value: -17.528986382274887 and parameters: {'n_estimators': 250, 'min_samples_split': 6, 'max_features': 0.6900000000000001, 'min_samples_leaf': 3, 'criterion': 'squared_error', 'max_depth': 15, 'min_weight_fraction_leaf': 0.0, 'max_leaf_nodes': 300, 'bootstrap': False, 'ccp_alpha': 0.013000000000000001}. Best is trial 3488 with value: 0.05528345733671649.
[I 2025-04-16 02:03:10,455] Trial 3660 finished with value: -0.1936417107583833 and parameters: {'n_estimators': 6, 'min_samples_split': 9, 'max_features': 0.75, 'min_samples_leaf': 4, 'criterion': 'absolute_error', 'max_depth': 15, 'min_weight_fraction_leaf': 0.0, 'max_leaf_nodes': 300, 'bootstrap': False, 'ccp_alpha': 0.005}. Best is trial 3488 with value: 0.05528345733671649.
[I 2025-04-16 02:03:11,398] Trial 3661 finished with value: -0.1936417107583833 and parameters: {'n_estimators': 511, 'min_samples_split': 2, 'max_features': 0.7100000000000001, 'min_samples_leaf': 1, 'criterion': 'absolute_error', 'max_depth': 15, 'min_weight_fraction_leaf': 0.0, 'max_leaf_nodes': 300, 'bootstrap': False, 'ccp_alpha': 0.01}. Best is trial 3488 with value: 0.05528345733671649.
[I 2025-04-16 02:03:12,613] Trial 3662 finished with value: -0.1936417107583833 and parameters: {'n_estimators': 879, 'min_samples_split': 9, 'max_features': 0.67, 'min_samples_leaf': 3, 'criterion': 'absolute_error', 'max_depth': 15, 'min_weight_fraction_leaf': 0.0, 'max_leaf_nodes': 300, 'bootstrap': False, 'ccp_alpha': 0.024}. Best is trial 3488 with value: 0.05528345733671649.
[I 2025-04-16 02:03:13,391] Trial 3663 finished with value: -14.453440854156543 and parameters: {'n_estimators': 349, 'min_samples_split': 9, 'max_features': 0.73, 'min_samples_leaf': 1, 'criterion': 'absolute_error', 'max_depth': 15, 'min_weight_fraction_leaf': 0.0, 'max_leaf_nodes': 300, 'bootstrap': False, 'ccp_alpha': 0.0}. Best is trial 3488 with value: 0.05528345733671649.
[I 2025-04-16 02:03:14,721] Trial 3664 finished with value: -19.25396445798406 and parameters: {'n_estimators': 1036, 'min_samples_split': 5, 'max_features': 0.77, 'min_samples_leaf': 4, 'criterion': 'poisson', 'max_depth': 15, 'min_weight_fraction_leaf': 0.0, 'max_leaf_nodes': 300, 'bootstrap': False, 'ccp_alpha': 0.017}. Best is trial 3488 with value: 0.05528345733671649.
[I 2025-04-16 02:03:15,789] Trial 3665 finished with value: -0.1936417107583833 and parameters: {'n_estimators': 683, 'min_samples_split': 5, 'max_features': 0.8, 'min_samples_leaf': 1, 'criterion': 'absolute_error', 'max_depth': 15, 'min_weight_fraction_leaf': 0.0, 'max_leaf_nodes': 300, 'bootstrap': False, 'ccp_alpha': 0.009000000000000001}. Best is trial 3488 with value: 0.05528345733671649.
[I 2025-04-16 02:03:16,450] Trial 3666 finished with value: 0.010747175311723468 and parameters: {'n_estimators': 164, 'min_samples_split': 2, 'max_features': 0.74, 'min_samples_leaf': 3, 'criterion': 'absolute_error', 'max_depth': 15, 'min_weight_fraction_leaf': 0.0, 'max_leaf_nodes': 300, 'bootstrap': False, 'ccp_alpha': 0.005}. Best is trial 3488 with value: 0.05528345733671649.
[I 2025-04-16 02:03:17,321] Trial 3667 finished with value: -0.1936417107583833 and parameters: {'n_estimators': 431, 'min_samples_split': 9, 'max_features': 0.72, 'min_samples_leaf': 4, 'criterion': 'absolute_error', 'max_depth': 15, 'min_weight_fraction_leaf': 0.0, 'max_leaf_nodes': 300, 'bootstrap': False, 'ccp_alpha': 0.014}. Best is trial 3488 with value: 0.05528345733671649.
[I 2025-04-16 02:03:18,345] Trial 3668 finished with value: -37.63793394727347 and parameters: {'n_estimators': 713, 'min_samples_split': 5, 'max_features': 0.77, 'min_samples_leaf': 1, 'criterion': 'absolute_error', 'max_depth': 15, 'min_weight_fraction_leaf': 0.0, 'max_leaf_nodes': 300, 'bootstrap': False, 'ccp_alpha': 0.0}. Best is trial 3488 with value: 0.05528345733671649.
[I 2025-04-16 02:03:19,293] Trial 3669 finished with value: -0.1936417107583833 and parameters: {'n_estimators': 519, 'min_samples_split': 2, 'max_features': 0.6900000000000001, 'min_samples_leaf': 3, 'criterion': 'absolute_error', 'max_depth': 15, 'min_weight_fraction_leaf': 0.0, 'max_leaf_nodes': 300, 'bootstrap': False, 'ccp_alpha': 0.01}. Best is trial 3488 with value: 0.05528345733671649.
[I 2025-04-16 02:03:20,049] Trial 3670 finished with value: -0.1936417107583833 and parameters: {'n_estimators': 301, 'min_samples_split': 9, 'max_features': 0.75, 'min_samples_leaf': 1, 'criterion': 'absolute_error', 'max_depth': 15, 'min_weight_fraction_leaf': 0.0, 'max_leaf_nodes': 300, 'bootstrap': False, 'ccp_alpha': 0.17500000000000002}. Best is trial 3488 with value: 0.05528345733671649.
[I 2025-04-16 02:03:21,340] Trial 3671 finished with value: -0.10516563567605086 and parameters: {'n_estimators': 861, 'min_samples_split': 6, 'max_features': 0.7100000000000001, 'min_samples_leaf': 4, 'criterion': 'absolute_error', 'max_depth': 15, 'min_weight_fraction_leaf': 0.0, 'max_leaf_nodes': 300, 'bootstrap': False, 'ccp_alpha': 0.005}. Best is trial 3488 with value: 0.05528345733671649.
[I 2025-04-16 02:03:22,402] Trial 3672 finished with value: -0.1936417107583833 and parameters: {'n_estimators': 592, 'min_samples_split': 2, 'max_features': 0.79, 'min_samples_leaf': 1, 'criterion': 'absolute_error', 'max_depth': 15, 'min_weight_fraction_leaf': 0.0, 'max_leaf_nodes': 300, 'bootstrap': False, 'ccp_alpha': 0.018000000000000002}. Best is trial 3488 with value: 0.05528345733671649.
[I 2025-04-16 02:03:23,755] Trial 3673 finished with value: -0.1936417107583833 and parameters: {'n_estimators': 1025, 'min_samples_split': 6, 'max_features': 0.74, 'min_samples_leaf': 3, 'criterion': 'absolute_error', 'max_depth': 15, 'min_weight_fraction_leaf': 0.0, 'max_leaf_nodes': 300, 'bootstrap': False, 'ccp_alpha': 0.01}. Best is trial 3488 with value: 0.05528345733671649.
[I 2025-04-16 02:03:24,393] Trial 3674 finished with value: -17.5289863822749 and parameters: {'n_estimators': 167, 'min_samples_split': 9, 'max_features': 0.76, 'min_samples_leaf': 4, 'criterion': 'friedman_mse', 'max_depth': 15, 'min_weight_fraction_leaf': 0.0, 'max_leaf_nodes': 300, 'bootstrap': False, 'ccp_alpha': 0.005}. Best is trial 3488 with value: 0.05528345733671649.
[I 2025-04-16 02:03:25,175] Trial 3675 finished with value: -28.16585000714007 and parameters: {'n_estimators': 314, 'min_samples_split': 2, 'max_features': 0.65, 'min_samples_leaf': 1, 'criterion': 'absolute_error', 'max_depth': 15, 'min_weight_fraction_leaf': 0.0, 'max_leaf_nodes': 300, 'bootstrap': False, 'ccp_alpha': 0.0}. Best is trial 3488 with value: 0.05528345733671649.
[I 2025-04-16 02:03:26,292] Trial 3676 finished with value: -0.1936417107583833 and parameters: {'n_estimators': 747, 'min_samples_split': 6, 'max_features': 0.78, 'min_samples_leaf': 3, 'criterion': 'absolute_error', 'max_depth': 15, 'min_weight_fraction_leaf': 0.0, 'max_leaf_nodes': 300, 'bootstrap': False, 'ccp_alpha': 0.014}. Best is trial 3488 with value: 0.05528345733671649.
