[I 2025-04-16 02:24:19,274] Trial 4742 finished with value: -10.00626117553669 and parameters: {'n_estimators': 1087, 'min_samples_split': 9, 'max_features': 0.5, 'min_samples_leaf': 4, 'criterion': 'squared_error', 'max_depth': 10, 'min_weight_fraction_leaf': 0.0, 'max_leaf_nodes': 10, 'bootstrap': False, 'ccp_alpha': 0.0}. Best is trial 4539 with value: 0.19155472534689352.
[I 2025-04-16 02:24:20,694] Trial 4743 finished with value: -0.1936417107583833 and parameters: {'n_estimators': 888, 'min_samples_split': 5, 'max_features': 0.8200000000000001, 'min_samples_leaf': 3, 'criterion': 'absolute_error', 'max_depth': 15, 'min_weight_fraction_leaf': 0.0, 'max_leaf_nodes': None, 'bootstrap': False, 'ccp_alpha': 0.019}. Best is trial 4539 with value: 0.19155472534689352.
[I 2025-04-16 02:24:21,943] Trial 4744 finished with value: -0.1936417107583833 and parameters: {'n_estimators': 706, 'min_samples_split': 14, 'max_features': 0.68, 'min_samples_leaf': 1, 'criterion': 'absolute_error', 'max_depth': None, 'min_weight_fraction_leaf': 0.0, 'max_leaf_nodes': None, 'bootstrap': False, 'ccp_alpha': 0.009000000000000001}. Best is trial 4539 with value: 0.19155472534689352.
[I 2025-04-16 02:24:22,923] Trial 4745 finished with value: -0.1936417107583833 and parameters: {'n_estimators': 470, 'min_samples_split': 9, 'max_features': 0.73, 'min_samples_leaf': 5, 'criterion': 'absolute_error', 'max_depth': 15, 'min_weight_fraction_leaf': 0.0, 'max_leaf_nodes': 10, 'bootstrap': False, 'ccp_alpha': 0.013000000000000001}. Best is trial 4539 with value: 0.19155472534689352.
[I 2025-04-16 02:24:24,109] Trial 4746 finished with value: 0.02437711967772018 and parameters: {'n_estimators': 662, 'min_samples_split': 2, 'max_features': 0.8, 'min_samples_leaf': 3, 'criterion': 'absolute_error', 'max_depth': 15, 'min_weight_fraction_leaf': 0.0, 'max_leaf_nodes': 10, 'bootstrap': False, 'ccp_alpha': 0.005}. Best is trial 4539 with value: 0.19155472534689352.
[I 2025-04-16 02:24:32,008] Trial 4747 finished with value: -19.82051096464126 and parameters: {'n_estimators': 9134, 'min_samples_split': 6, 'max_features': 0.76, 'min_samples_leaf': 1, 'criterion': 'absolute_error', 'max_depth': 15, 'min_weight_fraction_leaf': 0.0, 'max_leaf_nodes': None, 'bootstrap': False, 'ccp_alpha': 0.0}. Best is trial 4539 with value: 0.19155472534689352.
[I 2025-04-16 02:24:32,983] Trial 4748 finished with value: -23.34490995773296 and parameters: {'n_estimators': 427, 'min_samples_split': 47, 'max_features': 0.7100000000000001, 'min_samples_leaf': 6, 'criterion': 'poisson', 'max_depth': 15, 'min_weight_fraction_leaf': 0.03, 'max_leaf_nodes': 10, 'bootstrap': False, 'ccp_alpha': 0.006}. Best is trial 4539 with value: 0.19155472534689352.
[I 2025-04-16 02:24:34,526] Trial 4749 finished with value: -0.1936417107583833 and parameters: {'n_estimators': 943, 'min_samples_split': 6, 'max_features': 0.8300000000000001, 'min_samples_leaf': 3, 'criterion': 'absolute_error', 'max_depth': 15, 'min_weight_fraction_leaf': 0.0, 'max_leaf_nodes': None, 'bootstrap': False, 'ccp_alpha': 0.02}. Best is trial 4539 with value: 0.19155472534689352.
[I 2025-04-16 02:24:36,121] Trial 4750 finished with value: -0.1936417107583833 and parameters: {'n_estimators': 1197, 'min_samples_split': 14, 'max_features': 0.73, 'min_samples_leaf': 1, 'criterion': 'absolute_error', 'max_depth': None, 'min_weight_fraction_leaf': 0.0, 'max_leaf_nodes': 10, 'bootstrap': False, 'ccp_alpha': 0.01}. Best is trial 4539 with value: 0.19155472534689352.
[I 2025-04-16 02:24:37,253] Trial 4751 finished with value: -0.1936417107583833 and parameters: {'n_estimators': 638, 'min_samples_split': 54, 'max_features': 0.78, 'min_samples_leaf': 5, 'criterion': 'absolute_error', 'max_depth': 15, 'min_weight_fraction_leaf': 0.0, 'max_leaf_nodes': 10, 'bootstrap': False, 'ccp_alpha': 0.028}. Best is trial 4539 with value: 0.19155472534689352.
[I 2025-04-16 02:24:38,222] Trial 4752 finished with value: 0.024427851996171944 and parameters: {'n_estimators': 429, 'min_samples_split': 2, 'max_features': 0.81, 'min_samples_leaf': 3, 'criterion': 'absolute_error', 'max_depth': 15, 'min_weight_fraction_leaf': 0.0, 'max_leaf_nodes': None, 'bootstrap': False, 'ccp_alpha': 0.005}. Best is trial 4539 with value: 0.19155472534689352.
[I 2025-04-16 02:24:39,432] Trial 4753 finished with value: -0.1936417107583833 and parameters: {'n_estimators': 782, 'min_samples_split': 9, 'max_features': 0.75, 'min_samples_leaf': 1, 'criterion': 'absolute_error', 'max_depth': 15, 'min_weight_fraction_leaf': 0.0, 'max_leaf_nodes': 10, 'bootstrap': False, 'ccp_alpha': 0.015}. Best is trial 4539 with value: 0.19155472534689352.
[I 2025-04-16 02:24:40,308] Trial 4754 finished with value: -5.438200773486292 and parameters: {'n_estimators': 348, 'min_samples_split': 6, 'max_features': 0.68, 'min_samples_leaf': 7, 'criterion': 'absolute_error', 'max_depth': 15, 'min_weight_fraction_leaf': 0.0, 'max_leaf_nodes': 10, 'bootstrap': False, 'ccp_alpha': 0.0}. Best is trial 4539 with value: 0.19155472534689352.
[I 2025-04-16 02:24:41,916] Trial 4755 finished with value: -0.1936417107583833 and parameters: {'n_estimators': 1032, 'min_samples_split': 2, 'max_features': 0.72, 'min_samples_leaf': 4, 'criterion': 'absolute_error', 'max_depth': 15, 'min_weight_fraction_leaf': 0.0, 'max_leaf_nodes': 300, 'bootstrap': False, 'ccp_alpha': 0.01}. Best is trial 4539 with value: 0.19155472534689352.
[I 2025-04-16 02:24:42,934] Trial 4756 finished with value: -0.19168802853422914 and parameters: {'n_estimators': 539, 'min_samples_split': 11, 'max_features': 0.77, 'min_samples_leaf': 1, 'criterion': 'absolute_error', 'max_depth': 15, 'min_weight_fraction_leaf': 0.0, 'max_leaf_nodes': None, 'bootstrap': False, 'ccp_alpha': 0.006}. Best is trial 4539 with value: 0.19155472534689352.
[I 2025-04-16 02:24:44,445] Trial 4757 finished with value: -17.5289863822752 and parameters: {'n_estimators': 828, 'min_samples_split': 6, 'max_features': 0.8, 'min_samples_leaf': 3, 'criterion': 'friedman_mse', 'max_depth': None, 'min_weight_fraction_leaf': 0.0, 'max_leaf_nodes': 300, 'bootstrap': False, 'ccp_alpha': 0.017}. Best is trial 4539 with value: 0.19155472534689352.
[I 2025-04-16 02:24:45,251] Trial 4758 finished with value: -9.60344790967044 and parameters: {'n_estimators': 311, 'min_samples_split': 2, 'max_features': 0.74, 'min_samples_leaf': 5, 'criterion': 'absolute_error', 'max_depth': 15, 'min_weight_fraction_leaf': 0.0, 'max_leaf_nodes': 300, 'bootstrap': False, 'ccp_alpha': 0.0}. Best is trial 4539 with value: 0.19155472534689352.
[I 2025-04-16 02:24:46,461] Trial 4759 finished with value: -0.1936417107583833 and parameters: {'n_estimators': 638, 'min_samples_split': 12, 'max_features': 0.8400000000000001, 'min_samples_leaf': 1, 'criterion': 'absolute_error', 'max_depth': 15, 'min_weight_fraction_leaf': 0.0, 'max_leaf_nodes': 300, 'bootstrap': False, 'ccp_alpha': 0.01}. Best is trial 4539 with value: 0.19155472534689352.
[I 2025-04-16 02:24:47,432] Trial 4760 finished with value: -0.17277170803618544 and parameters: {'n_estimators': 468, 'min_samples_split': 9, 'max_features': 0.7000000000000001, 'min_samples_leaf': 3, 'criterion': 'absolute_error', 'max_depth': 15, 'min_weight_fraction_leaf': 0.0, 'max_leaf_nodes': 10, 'bootstrap': False, 'ccp_alpha': 0.005}. Best is trial 4539 with value: 0.19155472534689352.
[I 2025-04-16 02:24:48,791] Trial 4761 finished with value: -0.1936417107583833 and parameters: {'n_estimators': 894, 'min_samples_split': 6, 'max_features': 0.79, 'min_samples_leaf': 7, 'criterion': 'absolute_error', 'max_depth': 20, 'min_weight_fraction_leaf': 0.0, 'max_leaf_nodes': 300, 'bootstrap': False, 'ccp_alpha': 0.023}. Best is trial 4539 with value: 0.19155472534689352.
[I 2025-04-16 02:24:50,593] Trial 4762 finished with value: -0.1936417107583833 and parameters: {'n_estimators': 1272, 'min_samples_split': 5, 'max_features': 0.76, 'min_samples_leaf': 3, 'criterion': 'absolute_error', 'max_depth': 45, 'min_weight_fraction_leaf': 0.04, 'max_leaf_nodes': 300, 'bootstrap': False, 'ccp_alpha': 0.013000000000000001}. Best is trial 4539 with value: 0.19155472534689352.
[I 2025-04-16 02:24:51,936] Trial 4763 finished with value: 0.041935533798176695 and parameters: {'n_estimators': 691, 'min_samples_split': 2, 'max_features': 0.72, 'min_samples_leaf': 1, 'criterion': 'absolute_error', 'max_depth': 15, 'min_weight_fraction_leaf': 0.0, 'max_leaf_nodes': 300, 'bootstrap': False, 'ccp_alpha': 0.005}. Best is trial 4539 with value: 0.19155472534689352.
[I 2025-04-16 02:24:52,790] Trial 4764 finished with value: -7.736553489827598 and parameters: {'n_estimators': 304, 'min_samples_split': 14, 'max_features': 0.81, 'min_samples_leaf': 5, 'criterion': 'absolute_error', 'max_depth': 15, 'min_weight_fraction_leaf': 0.0, 'max_leaf_nodes': 300, 'bootstrap': False, 'ccp_alpha': 0.0}. Best is trial 4539 with value: 0.19155472534689352.
[I 2025-04-16 02:24:53,827] Trial 4765 finished with value: -0.1936417107583833 and parameters: {'n_estimators': 506, 'min_samples_split': 6, 'max_features': 0.8300000000000001, 'min_samples_leaf': 3, 'criterion': 'absolute_error', 'max_depth': 15, 'min_weight_fraction_leaf': 0.0, 'max_leaf_nodes': None, 'bootstrap': False, 'ccp_alpha': 0.015}. Best is trial 4539 with value: 0.19155472534689352.
[I 2025-04-16 02:24:54,600] Trial 4766 finished with value: -17.5289863822749 and parameters: {'n_estimators': 166, 'min_samples_split': 9, 'max_features': 0.78, 'min_samples_leaf': 1, 'criterion': 'squared_error', 'max_depth': None, 'min_weight_fraction_leaf': 0.0, 'max_leaf_nodes': 10, 'bootstrap': False, 'ccp_alpha': 0.01}. Best is trial 4539 with value: 0.19155472534689352.
[I 2025-04-16 02:24:55,995] Trial 4767 finished with value: -0.1936417107583833 and parameters: {'n_estimators': 1001, 'min_samples_split': 2, 'max_features': 0.74, 'min_samples_leaf': 5, 'criterion': 'absolute_error', 'max_depth': 15, 'min_weight_fraction_leaf': 0.0, 'max_leaf_nodes': 300, 'bootstrap': False, 'ccp_alpha': 0.006}. Best is trial 4539 with value: 0.19155472534689352.
[I 2025-04-16 02:24:57,197] Trial 4768 finished with value: -0.1936417107583833 and parameters: {'n_estimators': 713, 'min_samples_split': 9, 'max_features': 0.76, 'min_samples_leaf': 3, 'criterion': 'absolute_error', 'max_depth': 15, 'min_weight_fraction_leaf': 0.0, 'max_leaf_nodes': 300, 'bootstrap': False, 'ccp_alpha': 0.02}. Best is trial 4539 with value: 0.19155472534689352.
[I 2025-04-16 02:24:57,807] Trial 4769 finished with value: -0.1936417107583833 and parameters: {'n_estimators': 6, 'min_samples_split': 14, 'max_features': 0.68, 'min_samples_leaf': 1, 'criterion': 'absolute_error', 'max_depth': 15, 'min_weight_fraction_leaf': 0.0, 'max_leaf_nodes': 300, 'bootstrap': False, 'ccp_alpha': 0.005}. Best is trial 4539 with value: 0.19155472534689352.
[I 2025-04-16 02:24:58,731] Trial 4770 finished with value: -0.1936417107583833 and parameters: {'n_estimators': 412, 'min_samples_split': 2, 'max_features': 0.6, 'min_samples_leaf': 7, 'criterion': 'absolute_error', 'max_depth': 10, 'min_weight_fraction_leaf': 0.0, 'max_leaf_nodes': 300, 'bootstrap': False, 'ccp_alpha': 0.033}. Best is trial 4539 with value: 0.19155472534689352.
[I 2025-04-16 02:24:59,937] Trial 4771 finished with value: -10.755658268410855 and parameters: {'n_estimators': 831, 'min_samples_split': 6, 'max_features': 0.7100000000000001, 'min_samples_leaf': 4, 'criterion': 'absolute_error', 'max_depth': 15, 'min_weight_fraction_leaf': 0.0, 'max_leaf_nodes': 10, 'bootstrap': False, 'ccp_alpha': 0.0}. Best is trial 4539 with value: 0.19155472534689352.
[I 2025-04-16 02:25:01,049] Trial 4772 finished with value: -0.1936417107583833 and parameters: {'n_estimators': 578, 'min_samples_split': 11, 'max_features': 0.78, 'min_samples_leaf': 1, 'criterion': 'absolute_error', 'max_depth': 15, 'min_weight_fraction_leaf': 0.0, 'max_leaf_nodes': 300, 'bootstrap': False, 'ccp_alpha': 0.014}. Best is trial 4539 with value: 0.19155472534689352.
[I 2025-04-16 02:25:01,904] Trial 4773 finished with value: -17.52898638227488 and parameters: {'n_estimators': 326, 'min_samples_split': 6, 'max_features': 0.81, 'min_samples_leaf': 57, 'criterion': 'poisson', 'max_depth': None, 'min_weight_fraction_leaf': 0.0, 'max_leaf_nodes': None, 'bootstrap': False, 'ccp_alpha': 0.01}. Best is trial 4539 with value: 0.19155472534689352.
[I 2025-04-16 02:25:03,408] Trial 4774 finished with value: -0.1936417107583833 and parameters: {'n_estimators': 1164, 'min_samples_split': 134, 'max_features': 0.74, 'min_samples_leaf': 3, 'criterion': 'absolute_error', 'max_depth': 15, 'min_weight_fraction_leaf': 0.0, 'max_leaf_nodes': 300, 'bootstrap': False, 'ccp_alpha': 0.006}. Best is trial 4539 with value: 0.19155472534689352.
[I 2025-04-16 02:25:04,163] Trial 4775 finished with value: -0.1936417107583833 and parameters: {'n_estimators': 174, 'min_samples_split': 2, 'max_features': 0.79, 'min_samples_leaf': 5, 'criterion': 'absolute_error', 'max_depth': 15, 'min_weight_fraction_leaf': 0.0, 'max_leaf_nodes': 300, 'bootstrap': False, 'ccp_alpha': 0.015}. Best is trial 4539 with value: 0.19155472534689352.
[I 2025-04-16 02:25:05,286] Trial 4776 finished with value: -10.579537670082235 and parameters: {'n_estimators': 605, 'min_samples_split': 9, 'max_features': 0.8400000000000001, 'min_samples_leaf': 3, 'criterion': 'absolute_error', 'max_depth': 15, 'min_weight_fraction_leaf': 0.0, 'max_leaf_nodes': 10, 'bootstrap': False, 'ccp_alpha': 0.0}. Best is trial 4539 with value: 0.19155472534689352.
[I 2025-04-16 02:25:06,617] Trial 4777 finished with value: -0.1936417107583833 and parameters: {'n_estimators': 898, 'min_samples_split': 6, 'max_features': 0.72, 'min_samples_leaf': 1, 'criterion': 'absolute_error', 'max_depth': 15, 'min_weight_fraction_leaf': 0.0, 'max_leaf_nodes': 300, 'bootstrap': False, 'ccp_alpha': 0.024}. Best is trial 4539 with value: 0.19155472534689352.
[I 2025-04-16 02:25:07,618] Trial 4778 finished with value: -0.1936417107583833 and parameters: {'n_estimators': 470, 'min_samples_split': 78, 'max_features': 0.76, 'min_samples_leaf': 6, 'criterion': 'absolute_error', 'max_depth': 15, 'min_weight_fraction_leaf': 0.0, 'max_leaf_nodes': 300, 'bootstrap': False, 'ccp_alpha': 0.009000000000000001}. Best is trial 4539 with value: 0.19155472534689352.
[I 2025-04-16 02:25:09,208] Trial 4779 finished with value: -0.01264649358379839 and parameters: {'n_estimators': 1064, 'min_samples_split': 2, 'max_features': 0.65, 'min_samples_leaf': 1, 'criterion': 'absolute_error', 'max_depth': 15, 'min_weight_fraction_leaf': 0.0, 'max_leaf_nodes': 300, 'bootstrap': False, 'ccp_alpha': 0.005}. Best is trial 4539 with value: 0.19155472534689352.
[I 2025-04-16 02:25:10,454] Trial 4780 finished with value: -0.1936417107583833 and parameters: {'n_estimators': 747, 'min_samples_split': 14, 'max_features': 0.8200000000000001, 'min_samples_leaf': 3, 'criterion': 'absolute_error', 'max_depth': None, 'min_weight_fraction_leaf': 0.0, 'max_leaf_nodes': 300, 'bootstrap': False, 'ccp_alpha': 0.017}. Best is trial 4539 with value: 0.19155472534689352.
[I 2025-04-16 02:25:11,364] Trial 4781 finished with value: -17.52898638227488 and parameters: {'n_estimators': 317, 'min_samples_split': 6, 'max_features': 0.74, 'min_samples_leaf': 4, 'criterion': 'friedman_mse', 'max_depth': 15, 'min_weight_fraction_leaf': 0.0, 'max_leaf_nodes': 10, 'bootstrap': False, 'ccp_alpha': 0.01}. Best is trial 4539 with value: 0.19155472534689352.
[I 2025-04-16 02:25:12,138] Trial 4782 finished with value: -0.1936417107583833 and parameters: {'n_estimators': 176, 'min_samples_split': 9, 'max_features': 0.8, 'min_samples_leaf': 76, 'criterion': 'absolute_error', 'max_depth': 15, 'min_weight_fraction_leaf': 0.0, 'max_leaf_nodes': 300, 'bootstrap': False, 'ccp_alpha': 0.0}. Best is trial 4539 with value: 0.19155472534689352.
[I 2025-04-16 02:25:13,269] Trial 4783 finished with value: 0.029304042565017153 and parameters: {'n_estimators': 581, 'min_samples_split': 2, 'max_features': 0.7000000000000001, 'min_samples_leaf': 1, 'criterion': 'absolute_error', 'max_depth': 15, 'min_weight_fraction_leaf': 0.0, 'max_leaf_nodes': None, 'bootstrap': False, 'ccp_alpha': 0.005}. Best is trial 4539 with value: 0.19155472534689352.
[I 2025-04-16 02:25:22,753] Trial 4784 finished with value: -0.1936417107583833 and parameters: {'n_estimators': 9993, 'min_samples_split': 11, 'max_features': 0.77, 'min_samples_leaf': 5, 'criterion': 'absolute_error', 'max_depth': 15, 'min_weight_fraction_leaf': 0.0, 'max_leaf_nodes': 300, 'bootstrap': False, 'ccp_alpha': 0.012}. Best is trial 4539 with value: 0.19155472534689352.
[I 2025-04-16 02:25:24,047] Trial 4785 finished with value: -0.1936417107583833 and parameters: {'n_estimators': 744, 'min_samples_split': 6, 'max_features': 0.73, 'min_samples_leaf': 7, 'criterion': 'absolute_error', 'max_depth': 15, 'min_weight_fraction_leaf': 0.0, 'max_leaf_nodes': 300, 'bootstrap': False, 'ccp_alpha': 0.019}. Best is trial 4539 with value: 0.19155472534689352.
[I 2025-04-16 02:25:24,989] Trial 4786 finished with value: 0.014303212864661274 and parameters: {'n_estimators': 409, 'min_samples_split': 5, 'max_features': 0.8400000000000001, 'min_samples_leaf': 3, 'criterion': 'absolute_error', 'max_depth': None, 'min_weight_fraction_leaf': 0.0, 'max_leaf_nodes': 300, 'bootstrap': False, 'ccp_alpha': 0.006}. Best is trial 4539 with value: 0.19155472534689352.
[I 2025-04-16 02:25:25,594] Trial 4787 finished with value: -0.1936417107583833 and parameters: {'n_estimators': 1, 'min_samples_split': 2, 'max_features': 0.76, 'min_samples_leaf': 1, 'criterion': 'absolute_error', 'max_depth': 15, 'min_weight_fraction_leaf': 0.0, 'max_leaf_nodes': 10, 'bootstrap': False, 'ccp_alpha': 0.013000000000000001}. Best is trial 4539 with value: 0.19155472534689352.
[I 2025-04-16 02:25:26,906] Trial 4788 finished with value: -0.1936417107583833 and parameters: {'n_estimators': 1016, 'min_samples_split': 117, 'max_features': 0.67, 'min_samples_leaf': 3, 'criterion': 'absolute_error', 'max_depth': 15, 'min_weight_fraction_leaf': 0.0, 'max_leaf_nodes': 300, 'bootstrap': False, 'ccp_alpha': 0.0}. Best is trial 4539 with value: 0.19155472534689352.
[I 2025-04-16 02:25:27,937] Trial 4789 finished with value: -0.1936417107583833 and parameters: {'n_estimators': 496, 'min_samples_split': 11, 'max_features': 0.7000000000000001, 'min_samples_leaf': 1, 'criterion': 'absolute_error', 'max_depth': 15, 'min_weight_fraction_leaf': 0.0, 'max_leaf_nodes': 300, 'bootstrap': False, 'ccp_alpha': 0.006}. Best is trial 4539 with value: 0.19155472534689352.
[I 2025-04-16 02:25:29,254] Trial 4790 finished with value: -17.528986382275264 and parameters: {'n_estimators': 849, 'min_samples_split': 6, 'max_features': 0.79, 'min_samples_leaf': 5, 'criterion': 'squared_error', 'max_depth': 20, 'min_weight_fraction_leaf': 0.0, 'max_leaf_nodes': 300, 'bootstrap': False, 'ccp_alpha': 0.01}. Best is trial 4539 with value: 0.19155472534689352.
[I 2025-04-16 02:25:34,202] Trial 4791 finished with value: -4.8429597050023805 and parameters: {'n_estimators': 5783, 'min_samples_split': 14, 'max_features': 0.41000000000000003, 'min_samples_leaf': 3, 'criterion': 'absolute_error', 'max_depth': 45, 'min_weight_fraction_leaf': 0.0, 'max_leaf_nodes': None, 'bootstrap': False, 'ccp_alpha': 0.0}. Best is trial 4539 with value: 0.19155472534689352.
[I 2025-04-16 02:25:35,985] Trial 4792 finished with value: -0.1936417107583833 and parameters: {'n_estimators': 1335, 'min_samples_split': 2, 'max_features': 0.8200000000000001, 'min_samples_leaf': 7, 'criterion': 'absolute_error', 'max_depth': 15, 'min_weight_fraction_leaf': 0.0, 'max_leaf_nodes': 300, 'bootstrap': False, 'ccp_alpha': 0.022}. Best is trial 4539 with value: 0.19155472534689352.
[I 2025-04-16 02:25:36,808] Trial 4793 finished with value: -0.1936417107583833 and parameters: {'n_estimators': 249, 'min_samples_split': 9, 'max_features': 0.75, 'min_samples_leaf': 49, 'criterion': 'absolute_error', 'max_depth': 15, 'min_weight_fraction_leaf': 0.0, 'max_leaf_nodes': 10, 'bootstrap': False, 'ccp_alpha': 0.014}. Best is trial 4539 with value: 0.19155472534689352.
[I 2025-04-16 02:25:38,006] Trial 4794 finished with value: -0.1936417107583833 and parameters: {'n_estimators': 646, 'min_samples_split': 6, 'max_features': 0.12, 'min_samples_leaf': 1, 'criterion': 'absolute_error', 'max_depth': 15, 'min_weight_fraction_leaf': 0.1, 'max_leaf_nodes': 300, 'bootstrap': False, 'ccp_alpha': 0.006}. Best is trial 4539 with value: 0.19155472534689352.
[I 2025-04-16 02:25:38,882] Trial 4795 finished with value: -0.10883129012697006 and parameters: {'n_estimators': 316, 'min_samples_split': 2, 'max_features': 0.72, 'min_samples_leaf': 5, 'criterion': 'absolute_error', 'max_depth': None, 'min_weight_fraction_leaf': 0.08, 'max_leaf_nodes': 300, 'bootstrap': False, 'ccp_alpha': 0.005}. Best is trial 4539 with value: 0.19155472534689352.
[I 2025-04-16 02:25:40,411] Trial 4796 finished with value: -0.1936417107583833 and parameters: {'n_estimators': 1113, 'min_samples_split': 6, 'max_features': 0.78, 'min_samples_leaf': 3, 'criterion': 'absolute_error', 'max_depth': 15, 'min_weight_fraction_leaf': 0.0, 'max_leaf_nodes': 300, 'bootstrap': False, 'ccp_alpha': 0.018000000000000002}. Best is trial 4539 with value: 0.19155472534689352.
[I 2025-04-16 02:25:41,449] Trial 4797 finished with value: -19.53668379527503 and parameters: {'n_estimators': 519, 'min_samples_split': 11, 'max_features': 0.81, 'min_samples_leaf': 1, 'criterion': 'poisson', 'max_depth': 10, 'min_weight_fraction_leaf': 0.0, 'max_leaf_nodes': 300, 'bootstrap': False, 'ccp_alpha': 0.01}. Best is trial 4539 with value: 0.19155472534689352.
