[I 2025-04-16 00:39:59,644] Trial 1710 finished with value: -0.1936249482163425 and parameters: {'n_estimators': 3626, 'min_samples_split': 6, 'max_features': 0.9500000000000001, 'min_samples_leaf': 15, 'criterion': 'absolute_error', 'max_depth': 60, 'min_weight_fraction_leaf': 0.01, 'max_leaf_nodes': 150, 'bootstrap': False, 'ccp_alpha': 0.0}. Best is trial 1439 with value: -0.15896829431478016.
[I 2025-04-16 00:40:03,594] Trial 1711 finished with value: -0.1936417107583833 and parameters: {'n_estimators': 4340, 'min_samples_split': 14, 'max_features': 0.97, 'min_samples_leaf': 14, 'criterion': 'absolute_error', 'max_depth': 60, 'min_weight_fraction_leaf': 0.01, 'max_leaf_nodes': 150, 'bootstrap': False, 'ccp_alpha': 0.01}. Best is trial 1439 with value: -0.15896829431478016.
[I 2025-04-16 00:40:07,086] Trial 1712 finished with value: -0.1936417107583833 and parameters: {'n_estimators': 4005, 'min_samples_split': 18, 'max_features': 0.91, 'min_samples_leaf': 12, 'criterion': 'absolute_error', 'max_depth': 60, 'min_weight_fraction_leaf': 0.0, 'max_leaf_nodes': 150, 'bootstrap': False, 'ccp_alpha': 0.006}. Best is trial 1439 with value: -0.15896829431478016.
[I 2025-04-16 00:40:10,268] Trial 1713 finished with value: -0.19364233187298024 and parameters: {'n_estimators': 3656, 'min_samples_split': 9, 'max_features': 1.0, 'min_samples_leaf': 18, 'criterion': 'absolute_error', 'max_depth': 60, 'min_weight_fraction_leaf': 0.01, 'max_leaf_nodes': 150, 'bootstrap': False, 'ccp_alpha': 0.0}. Best is trial 1439 with value: -0.15896829431478016.
[I 2025-04-16 00:40:13,881] Trial 1714 finished with value: -0.1936417107583833 and parameters: {'n_estimators': 4199, 'min_samples_split': 22, 'max_features': 0.9400000000000001, 'min_samples_leaf': 10, 'criterion': 'absolute_error', 'max_depth': 60, 'min_weight_fraction_leaf': 0.01, 'max_leaf_nodes': 150, 'bootstrap': False, 'ccp_alpha': 0.013000000000000001}. Best is trial 1439 with value: -0.15896829431478016.
[I 2025-04-16 00:40:17,695] Trial 1715 finished with value: -0.1936417107583833 and parameters: {'n_estimators': 3982, 'min_samples_split': 15, 'max_features': 0.9600000000000001, 'min_samples_leaf': 16, 'criterion': 'absolute_error', 'max_depth': 60, 'min_weight_fraction_leaf': 0.01, 'max_leaf_nodes': 150, 'bootstrap': False, 'ccp_alpha': 0.006}. Best is trial 1439 with value: -0.15896829431478016.
[I 2025-04-16 00:40:21,702] Trial 1716 finished with value: -0.1936417107583833 and parameters: {'n_estimators': 4380, 'min_samples_split': 10, 'max_features': 0.93, 'min_samples_leaf': 13, 'criterion': 'absolute_error', 'max_depth': 60, 'min_weight_fraction_leaf': 0.01, 'max_leaf_nodes': 150, 'bootstrap': False, 'ccp_alpha': 0.006}. Best is trial 1439 with value: -0.15896829431478016.
[I 2025-04-16 00:40:25,086] Trial 1717 finished with value: -39.249305339581625 and parameters: {'n_estimators': 3771, 'min_samples_split': 25, 'max_features': 0.98, 'min_samples_leaf': 14, 'criterion': 'squared_error', 'max_depth': 60, 'min_weight_fraction_leaf': 0.01, 'max_leaf_nodes': 150, 'bootstrap': False, 'ccp_alpha': 0.0}. Best is trial 1439 with value: -0.15896829431478016.
[I 2025-04-16 00:40:28,511] Trial 1718 finished with value: -0.1936417107583833 and parameters: {'n_estimators': 4120, 'min_samples_split': 18, 'max_features': 0.9600000000000001, 'min_samples_leaf': 10, 'criterion': 'absolute_error', 'max_depth': 60, 'min_weight_fraction_leaf': 0.01, 'max_leaf_nodes': 150, 'bootstrap': False, 'ccp_alpha': 0.016}. Best is trial 1439 with value: -0.15896829431478016.
[I 2025-04-16 00:40:32,495] Trial 1719 finished with value: -0.1936417107583833 and parameters: {'n_estimators': 3965, 'min_samples_split': 12, 'max_features': 0.91, 'min_samples_leaf': 16, 'criterion': 'absolute_error', 'max_depth': 60, 'min_weight_fraction_leaf': 0.01, 'max_leaf_nodes': 20, 'bootstrap': False, 'ccp_alpha': 0.011}. Best is trial 1439 with value: -0.15896829431478016.
[I 2025-04-16 00:40:35,540] Trial 1720 finished with value: -0.1936417107583833 and parameters: {'n_estimators': 3636, 'min_samples_split': 7, 'max_features': 0.9400000000000001, 'min_samples_leaf': 12, 'criterion': 'absolute_error', 'max_depth': 60, 'min_weight_fraction_leaf': 0.0, 'max_leaf_nodes': 150, 'bootstrap': False, 'ccp_alpha': 0.006}. Best is trial 1439 with value: -0.15896829431478016.
[I 2025-04-16 00:40:38,777] Trial 1721 finished with value: -0.1936213170918934 and parameters: {'n_estimators': 4249, 'min_samples_split': 16, 'max_features': 0.98, 'min_samples_leaf': 14, 'criterion': 'absolute_error', 'max_depth': 60, 'min_weight_fraction_leaf': 0.01, 'max_leaf_nodes': 150, 'bootstrap': False, 'ccp_alpha': 0.0}. Best is trial 1439 with value: -0.15896829431478016.
[I 2025-04-16 00:40:42,439] Trial 1722 finished with value: -0.1936417107583833 and parameters: {'n_estimators': 4588, 'min_samples_split': 21, 'max_features': 0.9600000000000001, 'min_samples_leaf': 12, 'criterion': 'absolute_error', 'max_depth': 60, 'min_weight_fraction_leaf': 0.01, 'max_leaf_nodes': 150, 'bootstrap': False, 'ccp_alpha': 0.018000000000000002}. Best is trial 1439 with value: -0.15896829431478016.
[I 2025-04-16 00:40:45,359] Trial 1723 finished with value: -17.528986382274432 and parameters: {'n_estimators': 3841, 'min_samples_split': 26, 'max_features': 0.93, 'min_samples_leaf': 19, 'criterion': 'poisson', 'max_depth': 60, 'min_weight_fraction_leaf': 0.01, 'max_leaf_nodes': 150, 'bootstrap': False, 'ccp_alpha': 0.005}. Best is trial 1439 with value: -0.15896829431478016.
[I 2025-04-16 00:40:49,095] Trial 1724 finished with value: -0.1936417107583833 and parameters: {'n_estimators': 4106, 'min_samples_split': 12, 'max_features': 1.0, 'min_samples_leaf': 9, 'criterion': 'absolute_error', 'max_depth': 60, 'min_weight_fraction_leaf': 0.01, 'max_leaf_nodes': 150, 'bootstrap': False, 'ccp_alpha': 0.011}. Best is trial 1439 with value: -0.15896829431478016.
[I 2025-04-16 00:40:52,255] Trial 1725 finished with value: -0.19361581395557162 and parameters: {'n_estimators': 4426, 'min_samples_split': 18, 'max_features': 0.9500000000000001, 'min_samples_leaf': 16, 'criterion': 'absolute_error', 'max_depth': 60, 'min_weight_fraction_leaf': 0.0, 'max_leaf_nodes': 150, 'bootstrap': False, 'ccp_alpha': 0.0}. Best is trial 1439 with value: -0.15896829431478016.
[I 2025-04-16 00:40:55,991] Trial 1726 finished with value: -0.1936417107583833 and parameters: {'n_estimators': 3955, 'min_samples_split': 14, 'max_features': 0.92, 'min_samples_leaf': 11, 'criterion': 'absolute_error', 'max_depth': 60, 'min_weight_fraction_leaf': 0.01, 'max_leaf_nodes': 300, 'bootstrap': False, 'ccp_alpha': 0.006}. Best is trial 1439 with value: -0.15896829431478016.
[I 2025-04-16 00:40:59,721] Trial 1727 finished with value: -0.1936417107583833 and parameters: {'n_estimators': 4270, 'min_samples_split': 8, 'max_features': 0.97, 'min_samples_leaf': 14, 'criterion': 'absolute_error', 'max_depth': 60, 'min_weight_fraction_leaf': 0.01, 'max_leaf_nodes': 150, 'bootstrap': False, 'ccp_alpha': 0.011}. Best is trial 1439 with value: -0.15896829431478016.
[I 2025-04-16 00:41:02,478] Trial 1728 finished with value: -0.19364218606032294 and parameters: {'n_estimators': 3810, 'min_samples_split': 21, 'max_features': 0.9400000000000001, 'min_samples_leaf': 17, 'criterion': 'absolute_error', 'max_depth': 60, 'min_weight_fraction_leaf': 0.01, 'max_leaf_nodes': 150, 'bootstrap': False, 'ccp_alpha': 0.0}. Best is trial 1439 with value: -0.15896829431478016.
[I 2025-04-16 00:41:05,483] Trial 1729 finished with value: -0.1936417107583833 and parameters: {'n_estimators': 3634, 'min_samples_split': 12, 'max_features': 0.98, 'min_samples_leaf': 13, 'criterion': 'absolute_error', 'max_depth': 60, 'min_weight_fraction_leaf': 0.01, 'max_leaf_nodes': 150, 'bootstrap': False, 'ccp_alpha': 0.006}. Best is trial 1439 with value: -0.15896829431478016.
[I 2025-04-16 00:41:08,890] Trial 1730 finished with value: -0.1936417107583833 and parameters: {'n_estimators': 4132, 'min_samples_split': 17, 'max_features': 0.91, 'min_samples_leaf': 11, 'criterion': 'absolute_error', 'max_depth': 60, 'min_weight_fraction_leaf': 0.01, 'max_leaf_nodes': 150, 'bootstrap': False, 'ccp_alpha': 0.013000000000000001}. Best is trial 1439 with value: -0.15896829431478016.
[I 2025-04-16 00:41:12,252] Trial 1731 finished with value: -0.1936417107583833 and parameters: {'n_estimators': 4025, 'min_samples_split': 23, 'max_features': 0.9600000000000001, 'min_samples_leaf': 15, 'criterion': 'absolute_error', 'max_depth': 60, 'min_weight_fraction_leaf': 0.01, 'max_leaf_nodes': 150, 'bootstrap': False, 'ccp_alpha': 0.005}. Best is trial 1439 with value: -0.15896829431478016.
[I 2025-04-16 00:41:16,406] Trial 1732 finished with value: -14.492191169295088 and parameters: {'n_estimators': 4444, 'min_samples_split': 6, 'max_features': 0.9400000000000001, 'min_samples_leaf': 9, 'criterion': 'friedman_mse', 'max_depth': 60, 'min_weight_fraction_leaf': 0.01, 'max_leaf_nodes': 150, 'bootstrap': False, 'ccp_alpha': 0.0}. Best is trial 1439 with value: -0.15896829431478016.
[I 2025-04-16 00:41:20,417] Trial 1733 finished with value: -0.1936417107583833 and parameters: {'n_estimators': 3819, 'min_samples_split': 15, 'max_features': 0.99, 'min_samples_leaf': 12, 'criterion': 'absolute_error', 'max_depth': 60, 'min_weight_fraction_leaf': 0.0, 'max_leaf_nodes': 150, 'bootstrap': False, 'ccp_alpha': 0.018000000000000002}. Best is trial 1439 with value: -0.15896829431478016.
[I 2025-04-16 00:41:23,890] Trial 1734 finished with value: -0.1936417107583833 and parameters: {'n_estimators': 4229, 'min_samples_split': 19, 'max_features': 0.9600000000000001, 'min_samples_leaf': 18, 'criterion': 'absolute_error', 'max_depth': 60, 'min_weight_fraction_leaf': 0.01, 'max_leaf_nodes': 150, 'bootstrap': False, 'ccp_alpha': 0.006}. Best is trial 1439 with value: -0.15896829431478016.
[I 2025-04-16 00:41:27,325] Trial 1735 finished with value: -0.1936417107583833 and parameters: {'n_estimators': 3644, 'min_samples_split': 11, 'max_features': 0.92, 'min_samples_leaf': 14, 'criterion': 'absolute_error', 'max_depth': 60, 'min_weight_fraction_leaf': 0.01, 'max_leaf_nodes': 150, 'bootstrap': False, 'ccp_alpha': 0.011}. Best is trial 1439 with value: -0.15896829431478016.
[I 2025-04-16 00:41:30,822] Trial 1736 finished with value: -8.814059016663126 and parameters: {'n_estimators': 3984, 'min_samples_split': 26, 'max_features': 0.9400000000000001, 'min_samples_leaf': 10, 'criterion': 'absolute_error', 'max_depth': 60, 'min_weight_fraction_leaf': 0.01, 'max_leaf_nodes': 150, 'bootstrap': False, 'ccp_alpha': 0.0}. Best is trial 1439 with value: -0.15896829431478016.
[I 2025-04-16 00:41:34,932] Trial 1737 finished with value: -0.1936417107583833 and parameters: {'n_estimators': 4659, 'min_samples_split': 15, 'max_features': 1.0, 'min_samples_leaf': 16, 'criterion': 'absolute_error', 'max_depth': 60, 'min_weight_fraction_leaf': 0.01, 'max_leaf_nodes': 150, 'bootstrap': False, 'ccp_alpha': 0.006}. Best is trial 1439 with value: -0.15896829431478016.
[I 2025-04-16 00:41:38,246] Trial 1738 finished with value: -0.1936417107583833 and parameters: {'n_estimators': 4320, 'min_samples_split': 7, 'max_features': 0.98, 'min_samples_leaf': 13, 'criterion': 'absolute_error', 'max_depth': 10, 'min_weight_fraction_leaf': 0.01, 'max_leaf_nodes': 150, 'bootstrap': False, 'ccp_alpha': 0.011}. Best is trial 1439 with value: -0.15896829431478016.
[I 2025-04-16 00:41:41,641] Trial 1739 finished with value: -8.785246635836941 and parameters: {'n_estimators': 4096, 'min_samples_split': 22, 'max_features': 0.9600000000000001, 'min_samples_leaf': 12, 'criterion': 'absolute_error', 'max_depth': 60, 'min_weight_fraction_leaf': 0.01, 'max_leaf_nodes': 150, 'bootstrap': False, 'ccp_alpha': 0.0}. Best is trial 1439 with value: -0.15896829431478016.
[I 2025-04-16 00:41:45,380] Trial 1740 finished with value: -0.1936417107583833 and parameters: {'n_estimators': 3889, 'min_samples_split': 18, 'max_features': 0.91, 'min_samples_leaf': 15, 'criterion': 'absolute_error', 'max_depth': 60, 'min_weight_fraction_leaf': 0.01, 'max_leaf_nodes': 150, 'bootstrap': False, 'ccp_alpha': 0.019}. Best is trial 1439 with value: -0.15896829431478016.
[I 2025-04-16 00:41:48,906] Trial 1741 finished with value: -0.1936417107583833 and parameters: {'n_estimators': 3609, 'min_samples_split': 11, 'max_features': 0.9400000000000001, 'min_samples_leaf': 10, 'criterion': 'absolute_error', 'max_depth': 60, 'min_weight_fraction_leaf': 0.01, 'max_leaf_nodes': 150, 'bootstrap': False, 'ccp_alpha': 0.006}. Best is trial 1439 with value: -0.15896829431478016.
[I 2025-04-16 00:41:52,438] Trial 1742 finished with value: -0.1936417107583833 and parameters: {'n_estimators': 4414, 'min_samples_split': 14, 'max_features': 0.97, 'min_samples_leaf': 19, 'criterion': 'absolute_error', 'max_depth': 60, 'min_weight_fraction_leaf': 0.0, 'max_leaf_nodes': 20, 'bootstrap': False, 'ccp_alpha': 0.01}. Best is trial 1439 with value: -0.15896829431478016.
[I 2025-04-16 00:41:55,959] Trial 1743 finished with value: -0.1936212895449317 and parameters: {'n_estimators': 4153, 'min_samples_split': 27, 'max_features': 0.93, 'min_samples_leaf': 14, 'criterion': 'absolute_error', 'max_depth': 60, 'min_weight_fraction_leaf': 0.01, 'max_leaf_nodes': 150, 'bootstrap': False, 'ccp_alpha': 0.0}. Best is trial 1439 with value: -0.15896829431478016.
[I 2025-04-16 00:41:59,094] Trial 1744 finished with value: -17.52898638227452 and parameters: {'n_estimators': 3803, 'min_samples_split': 20, 'max_features': 0.9500000000000001, 'min_samples_leaf': 17, 'criterion': 'squared_error', 'max_depth': 60, 'min_weight_fraction_leaf': 0.01, 'max_leaf_nodes': 150, 'bootstrap': False, 'ccp_alpha': 0.005}. Best is trial 1439 with value: -0.15896829431478016.
[I 2025-04-16 00:42:02,613] Trial 1745 finished with value: -0.1936417107583833 and parameters: {'n_estimators': 3988, 'min_samples_split': 9, 'max_features': 0.98, 'min_samples_leaf': 11, 'criterion': 'absolute_error', 'max_depth': 60, 'min_weight_fraction_leaf': 0.01, 'max_leaf_nodes': 150, 'bootstrap': False, 'ccp_alpha': 0.014}. Best is trial 1439 with value: -0.15896829431478016.
[I 2025-04-16 00:42:06,482] Trial 1746 finished with value: -0.1936417107583833 and parameters: {'n_estimators': 4605, 'min_samples_split': 17, 'max_features': 0.91, 'min_samples_leaf': 13, 'criterion': 'absolute_error', 'max_depth': 60, 'min_weight_fraction_leaf': 0.01, 'max_leaf_nodes': 150, 'bootstrap': False, 'ccp_alpha': 0.005}. Best is trial 1439 with value: -0.15896829431478016.
[I 2025-04-16 00:42:09,846] Trial 1747 finished with value: -39.335705546603236 and parameters: {'n_estimators': 4253, 'min_samples_split': 6, 'max_features': 0.9600000000000001, 'min_samples_leaf': 15, 'criterion': 'poisson', 'max_depth': 60, 'min_weight_fraction_leaf': 0.01, 'max_leaf_nodes': 150, 'bootstrap': False, 'ccp_alpha': 0.0}. Best is trial 1439 with value: -0.15896829431478016.
[I 2025-04-16 00:42:13,018] Trial 1748 finished with value: -0.1936417107583833 and parameters: {'n_estimators': 3610, 'min_samples_split': 22, 'max_features': 0.93, 'min_samples_leaf': 10, 'criterion': 'absolute_error', 'max_depth': 60, 'min_weight_fraction_leaf': 0.0, 'max_leaf_nodes': 150, 'bootstrap': False, 'ccp_alpha': 0.011}. Best is trial 1439 with value: -0.15896829431478016.
[I 2025-04-16 00:42:16,440] Trial 1749 finished with value: -0.1936417107583833 and parameters: {'n_estimators': 3867, 'min_samples_split': 12, 'max_features': 1.0, 'min_samples_leaf': 12, 'criterion': 'absolute_error', 'max_depth': 60, 'min_weight_fraction_leaf': 0.01, 'max_leaf_nodes': 150, 'bootstrap': False, 'ccp_alpha': 0.006}. Best is trial 1439 with value: -0.15896829431478016.
[I 2025-04-16 00:42:20,196] Trial 1750 finished with value: -0.1936417107583833 and parameters: {'n_estimators': 4086, 'min_samples_split': 16, 'max_features': 0.9500000000000001, 'min_samples_leaf': 16, 'criterion': 'absolute_error', 'max_depth': 60, 'min_weight_fraction_leaf': 0.01, 'max_leaf_nodes': 150, 'bootstrap': False, 'ccp_alpha': 0.016}. Best is trial 1439 with value: -0.15896829431478016.
[I 2025-04-16 00:42:24,258] Trial 1751 finished with value: -8.766494462233485 and parameters: {'n_estimators': 4438, 'min_samples_split': 23, 'max_features': 0.97, 'min_samples_leaf': 9, 'criterion': 'absolute_error', 'max_depth': 60, 'min_weight_fraction_leaf': 0.01, 'max_leaf_nodes': 150, 'bootstrap': False, 'ccp_alpha': 0.0}. Best is trial 1439 with value: -0.15896829431478016.
[I 2025-04-16 00:42:27,769] Trial 1752 finished with value: -0.1936417107583833 and parameters: {'n_estimators': 3813, 'min_samples_split': 12, 'max_features': 0.93, 'min_samples_leaf': 13, 'criterion': 'absolute_error', 'max_depth': 60, 'min_weight_fraction_leaf': 0.01, 'max_leaf_nodes': 150, 'bootstrap': False, 'ccp_alpha': 0.01}. Best is trial 1439 with value: -0.15896829431478016.
[I 2025-04-16 00:42:31,672] Trial 1753 finished with value: -0.1936417107583833 and parameters: {'n_estimators': 4278, 'min_samples_split': 18, 'max_features': 0.98, 'min_samples_leaf': 14, 'criterion': 'absolute_error', 'max_depth': 60, 'min_weight_fraction_leaf': 0.01, 'max_leaf_nodes': 150, 'bootstrap': False, 'ccp_alpha': 0.005}. Best is trial 1439 with value: -0.15896829431478016.
[I 2025-04-16 00:42:34,839] Trial 1754 finished with value: -0.1936422712382039 and parameters: {'n_estimators': 3995, 'min_samples_split': 9, 'max_features': 0.91, 'min_samples_leaf': 18, 'criterion': 'absolute_error', 'max_depth': 60, 'min_weight_fraction_leaf': 0.01, 'max_leaf_nodes': 300, 'bootstrap': False, 'ccp_alpha': 0.0}. Best is trial 1439 with value: -0.15896829431478016.
[I 2025-04-16 00:42:38,621] Trial 1755 finished with value: -0.1936417107583833 and parameters: {'n_estimators': 4175, 'min_samples_split': 15, 'max_features': 0.9500000000000001, 'min_samples_leaf': 11, 'criterion': 'absolute_error', 'max_depth': 60, 'min_weight_fraction_leaf': 0.01, 'max_leaf_nodes': 150, 'bootstrap': False, 'ccp_alpha': 0.019}. Best is trial 1439 with value: -0.15896829431478016.
[I 2025-04-16 00:42:42,039] Trial 1756 finished with value: -17.528986382274844 and parameters: {'n_estimators': 3661, 'min_samples_split': 27, 'max_features': 0.99, 'min_samples_leaf': 16, 'criterion': 'friedman_mse', 'max_depth': 60, 'min_weight_fraction_leaf': 0.01, 'max_leaf_nodes': 150, 'bootstrap': False, 'ccp_alpha': 0.01}. Best is trial 1439 with value: -0.15896829431478016.
[I 2025-04-16 00:42:45,683] Trial 1757 finished with value: -0.1936417107583833 and parameters: {'n_estimators': 3977, 'min_samples_split': 22, 'max_features': 0.9600000000000001, 'min_samples_leaf': 9, 'criterion': 'absolute_error', 'max_depth': 60, 'min_weight_fraction_leaf': 0.0, 'max_leaf_nodes': 150, 'bootstrap': False, 'ccp_alpha': 0.005}. Best is trial 1439 with value: -0.15896829431478016.
[I 2025-04-16 00:42:49,206] Trial 1758 finished with value: -8.782454565605754 and parameters: {'n_estimators': 4513, 'min_samples_split': 6, 'max_features': 0.93, 'min_samples_leaf': 12, 'criterion': 'absolute_error', 'max_depth': 60, 'min_weight_fraction_leaf': 0.01, 'max_leaf_nodes': 150, 'bootstrap': False, 'ccp_alpha': 0.0}. Best is trial 1439 with value: -0.15896829431478016.
[I 2025-04-16 00:42:52,481] Trial 1759 finished with value: -0.1936417107583833 and parameters: {'n_estimators': 3784, 'min_samples_split': 18, 'max_features': 0.97, 'min_samples_leaf': 14, 'criterion': 'absolute_error', 'max_depth': 60, 'min_weight_fraction_leaf': 0.01, 'max_leaf_nodes': 150, 'bootstrap': False, 'ccp_alpha': 0.011}. Best is trial 1439 with value: -0.15896829431478016.
[I 2025-04-16 00:42:56,449] Trial 1760 finished with value: -0.1936417107583833 and parameters: {'n_estimators': 4235, 'min_samples_split': 13, 'max_features': 0.9400000000000001, 'min_samples_leaf': 15, 'criterion': 'absolute_error', 'max_depth': 60, 'min_weight_fraction_leaf': 0.01, 'max_leaf_nodes': 150, 'bootstrap': False, 'ccp_alpha': 0.007}. Best is trial 1439 with value: -0.15896829431478016.
[I 2025-04-16 00:43:00,106] Trial 1761 finished with value: -0.1936417107583833 and parameters: {'n_estimators': 4007, 'min_samples_split': 20, 'max_features': 0.91, 'min_samples_leaf': 11, 'criterion': 'absolute_error', 'max_depth': 60, 'min_weight_fraction_leaf': 0.01, 'max_leaf_nodes': 150, 'bootstrap': False, 'ccp_alpha': 0.005}. Best is trial 1439 with value: -0.15896829431478016.
[I 2025-04-16 00:43:03,918] Trial 1762 finished with value: -0.1936417107583833 and parameters: {'n_estimators': 4424, 'min_samples_split': 10, 'max_features': 1.0, 'min_samples_leaf': 17, 'criterion': 'absolute_error', 'max_depth': 60, 'min_weight_fraction_leaf': 0.01, 'max_leaf_nodes': 150, 'bootstrap': False, 'ccp_alpha': 0.016}. Best is trial 1439 with value: -0.15896829431478016.
[I 2025-04-16 00:43:07,029] Trial 1763 finished with value: -8.76839301271681 and parameters: {'n_estimators': 3649, 'min_samples_split': 14, 'max_features': 0.9500000000000001, 'min_samples_leaf': 12, 'criterion': 'absolute_error', 'max_depth': 10, 'min_weight_fraction_leaf': 0.01, 'max_leaf_nodes': 150, 'bootstrap': False, 'ccp_alpha': 0.0}. Best is trial 1439 with value: -0.15896829431478016.
[I 2025-04-16 00:43:10,946] Trial 1764 finished with value: -0.1936417107583833 and parameters: {'n_estimators': 4647, 'min_samples_split': 16, 'max_features': 0.98, 'min_samples_leaf': 9, 'criterion': 'absolute_error', 'max_depth': 60, 'min_weight_fraction_leaf': 0.01, 'max_leaf_nodes': 150, 'bootstrap': False, 'ccp_alpha': 0.006}. Best is trial 1439 with value: -0.15896829431478016.
