[I 2025-04-16 01:32:47,144] Trial 2605 finished with value: -0.1936417107583833 and parameters: {'n_estimators': 3119, 'min_samples_split': 2, 'max_features': 0.85, 'min_samples_leaf': 3, 'criterion': 'absolute_error', 'max_depth': 5, 'min_weight_fraction_leaf': 0.0, 'max_leaf_nodes': 20, 'bootstrap': False, 'ccp_alpha': 0.014}. Best is trial 2586 with value: 0.023797084339743015.
[I 2025-04-16 01:32:50,391] Trial 2606 finished with value: -0.1936417107583833 and parameters: {'n_estimators': 3370, 'min_samples_split': 9, 'max_features': 0.86, 'min_samples_leaf': 1, 'criterion': 'absolute_error', 'max_depth': 5, 'min_weight_fraction_leaf': 0.0, 'max_leaf_nodes': 20, 'bootstrap': False, 'ccp_alpha': 0.029}. Best is trial 2586 with value: 0.023797084339743015.
[I 2025-04-16 01:32:53,492] Trial 2607 finished with value: -0.1936417107583833 and parameters: {'n_estimators': 3304, 'min_samples_split': 6, 'max_features': 0.87, 'min_samples_leaf': 3, 'criterion': 'absolute_error', 'max_depth': 5, 'min_weight_fraction_leaf': 0.0, 'max_leaf_nodes': 20, 'bootstrap': False, 'ccp_alpha': 0.01}. Best is trial 2586 with value: 0.023797084339743015.
[I 2025-04-16 01:32:56,434] Trial 2608 finished with value: -17.528986382275733 and parameters: {'n_estimators': 3326, 'min_samples_split': 2, 'max_features': 0.85, 'min_samples_leaf': 4, 'criterion': 'friedman_mse', 'max_depth': 5, 'min_weight_fraction_leaf': 0.0, 'max_leaf_nodes': 20, 'bootstrap': False, 'ccp_alpha': 0.02}. Best is trial 2586 with value: 0.023797084339743015.
[I 2025-04-16 01:32:59,860] Trial 2609 finished with value: -0.1936417107583833 and parameters: {'n_estimators': 3141, 'min_samples_split': 10, 'max_features': 0.88, 'min_samples_leaf': 1, 'criterion': 'absolute_error', 'max_depth': 5, 'min_weight_fraction_leaf': 0.0, 'max_leaf_nodes': 20, 'bootstrap': False, 'ccp_alpha': 0.011}. Best is trial 2586 with value: 0.023797084339743015.
[I 2025-04-16 01:33:03,155] Trial 2610 finished with value: -0.1936417107583833 and parameters: {'n_estimators': 3490, 'min_samples_split': 6, 'max_features': 0.88, 'min_samples_leaf': 4, 'criterion': 'absolute_error', 'max_depth': 5, 'min_weight_fraction_leaf': 0.0, 'max_leaf_nodes': 20, 'bootstrap': False, 'ccp_alpha': 0.015}. Best is trial 2586 with value: 0.023797084339743015.
[I 2025-04-16 01:33:06,479] Trial 2611 finished with value: -0.1936417107583833 and parameters: {'n_estimators': 3468, 'min_samples_split': 9, 'max_features': 0.86, 'min_samples_leaf': 1, 'criterion': 'absolute_error', 'max_depth': 5, 'min_weight_fraction_leaf': 0.0, 'max_leaf_nodes': 20, 'bootstrap': False, 'ccp_alpha': 0.009000000000000001}. Best is trial 2586 with value: 0.023797084339743015.
[I 2025-04-16 01:33:09,316] Trial 2612 finished with value: -0.1936417107583833 and parameters: {'n_estimators': 3131, 'min_samples_split': 2, 'max_features': 0.85, 'min_samples_leaf': 3, 'criterion': 'absolute_error', 'max_depth': 5, 'min_weight_fraction_leaf': 0.0, 'max_leaf_nodes': 20, 'bootstrap': False, 'ccp_alpha': 0.025}. Best is trial 2586 with value: 0.023797084339743015.
[I 2025-04-16 01:33:12,252] Trial 2613 finished with value: -0.1936417107583833 and parameters: {'n_estimators': 3353, 'min_samples_split': 6, 'max_features': 0.9, 'min_samples_leaf': 5, 'criterion': 'absolute_error', 'max_depth': 5, 'min_weight_fraction_leaf': 0.0, 'max_leaf_nodes': 20, 'bootstrap': False, 'ccp_alpha': 0.006}. Best is trial 2586 with value: 0.023797084339743015.
[I 2025-04-16 01:33:15,675] Trial 2614 finished with value: -0.1936417107583833 and parameters: {'n_estimators': 3524, 'min_samples_split': 10, 'max_features': 0.88, 'min_samples_leaf': 3, 'criterion': 'absolute_error', 'max_depth': 5, 'min_weight_fraction_leaf': 0.0, 'max_leaf_nodes': 20, 'bootstrap': False, 'ccp_alpha': 0.016}. Best is trial 2586 with value: 0.023797084339743015.
[I 2025-04-16 01:33:19,297] Trial 2615 finished with value: -0.0014127753232084038 and parameters: {'n_estimators': 3525, 'min_samples_split': 2, 'max_features': 0.89, 'min_samples_leaf': 1, 'criterion': 'absolute_error', 'max_depth': 5, 'min_weight_fraction_leaf': 0.0, 'max_leaf_nodes': 20, 'bootstrap': False, 'ccp_alpha': 0.006}. Best is trial 2586 with value: 0.023797084339743015.
[I 2025-04-16 01:33:22,509] Trial 2616 finished with value: -0.1936417107583833 and parameters: {'n_estimators': 3215, 'min_samples_split': 2, 'max_features': 0.9, 'min_samples_leaf': 5, 'criterion': 'absolute_error', 'max_depth': 5, 'min_weight_fraction_leaf': 0.0, 'max_leaf_nodes': 20, 'bootstrap': False, 'ccp_alpha': 0.02}. Best is trial 2586 with value: 0.023797084339743015.
[I 2025-04-16 01:33:25,541] Trial 2617 finished with value: -17.528986382276397 and parameters: {'n_estimators': 3114, 'min_samples_split': 2, 'max_features': 0.9, 'min_samples_leaf': 3, 'criterion': 'squared_error', 'max_depth': 5, 'min_weight_fraction_leaf': 0.0, 'max_leaf_nodes': 20, 'bootstrap': False, 'ccp_alpha': 0.011}. Best is trial 2586 with value: 0.023797084339743015.
[I 2025-04-16 01:33:28,541] Trial 2618 finished with value: -0.1936417107583833 and parameters: {'n_estimators': 3387, 'min_samples_split': 2, 'max_features': 0.89, 'min_samples_leaf': 6, 'criterion': 'absolute_error', 'max_depth': 5, 'min_weight_fraction_leaf': 0.0, 'max_leaf_nodes': 20, 'bootstrap': False, 'ccp_alpha': 0.016}. Best is trial 2586 with value: 0.023797084339743015.
[I 2025-04-16 01:33:31,498] Trial 2619 finished with value: -0.1936417107583833 and parameters: {'n_estimators': 3143, 'min_samples_split': 2, 'max_features': 0.91, 'min_samples_leaf': 1, 'criterion': 'absolute_error', 'max_depth': 5, 'min_weight_fraction_leaf': 0.0, 'max_leaf_nodes': 20, 'bootstrap': False, 'ccp_alpha': 0.01}. Best is trial 2586 with value: 0.023797084339743015.
[I 2025-04-16 01:33:34,396] Trial 2620 finished with value: -0.1936417107583833 and parameters: {'n_estimators': 3288, 'min_samples_split': 5, 'max_features': 0.89, 'min_samples_leaf': 3, 'criterion': 'absolute_error', 'max_depth': 5, 'min_weight_fraction_leaf': 0.0, 'max_leaf_nodes': 20, 'bootstrap': False, 'ccp_alpha': 0.026000000000000002}. Best is trial 2586 with value: 0.023797084339743015.
[I 2025-04-16 01:33:37,651] Trial 2621 finished with value: -0.1936417107583833 and parameters: {'n_estimators': 3525, 'min_samples_split': 5, 'max_features': 0.91, 'min_samples_leaf': 5, 'criterion': 'absolute_error', 'max_depth': 5, 'min_weight_fraction_leaf': 0.0, 'max_leaf_nodes': 20, 'bootstrap': False, 'ccp_alpha': 0.006}. Best is trial 2586 with value: 0.023797084339743015.
[I 2025-04-16 01:33:40,721] Trial 2622 finished with value: -0.1936417107583833 and parameters: {'n_estimators': 3367, 'min_samples_split': 2, 'max_features': 0.91, 'min_samples_leaf': 1, 'criterion': 'absolute_error', 'max_depth': 5, 'min_weight_fraction_leaf': 0.0, 'max_leaf_nodes': 20, 'bootstrap': False, 'ccp_alpha': 0.014}. Best is trial 2586 with value: 0.023797084339743015.
[I 2025-04-16 01:33:43,522] Trial 2623 finished with value: -17.528986382276535 and parameters: {'n_estimators': 3072, 'min_samples_split': 6, 'max_features': 0.89, 'min_samples_leaf': 7, 'criterion': 'poisson', 'max_depth': 5, 'min_weight_fraction_leaf': 0.0, 'max_leaf_nodes': 20, 'bootstrap': False, 'ccp_alpha': 0.17}. Best is trial 2586 with value: 0.023797084339743015.
[I 2025-04-16 01:33:50,890] Trial 2624 finished with value: -0.042231946628011705 and parameters: {'n_estimators': 8230, 'min_samples_split': 2, 'max_features': 0.91, 'min_samples_leaf': 3, 'criterion': 'absolute_error', 'max_depth': 5, 'min_weight_fraction_leaf': 0.0, 'max_leaf_nodes': 20, 'bootstrap': False, 'ccp_alpha': 0.006}. Best is trial 2586 with value: 0.023797084339743015.
[I 2025-04-16 01:33:57,073] Trial 2625 finished with value: -0.1936417107583833 and parameters: {'n_estimators': 6547, 'min_samples_split': 6, 'max_features': 0.89, 'min_samples_leaf': 7, 'criterion': 'absolute_error', 'max_depth': 5, 'min_weight_fraction_leaf': 0.0, 'max_leaf_nodes': 20, 'bootstrap': False, 'ccp_alpha': 0.02}. Best is trial 2586 with value: 0.023797084339743015.
[I 2025-04-16 01:34:04,604] Trial 2626 finished with value: -0.1936417107583833 and parameters: {'n_estimators': 8210, 'min_samples_split': 6, 'max_features': 0.88, 'min_samples_leaf': 5, 'criterion': 'absolute_error', 'max_depth': 5, 'min_weight_fraction_leaf': 0.0, 'max_leaf_nodes': 20, 'bootstrap': False, 'ccp_alpha': 0.01}. Best is trial 2586 with value: 0.023797084339743015.
[I 2025-04-16 01:34:07,883] Trial 2627 finished with value: -0.1936417107583833 and parameters: {'n_estimators': 3055, 'min_samples_split': 2, 'max_features': 0.91, 'min_samples_leaf': 4, 'criterion': 'absolute_error', 'max_depth': 5, 'min_weight_fraction_leaf': 0.0, 'max_leaf_nodes': 20, 'bootstrap': False, 'ccp_alpha': 0.006}. Best is trial 2586 with value: 0.023797084339743015.
[I 2025-04-16 01:34:10,677] Trial 2628 finished with value: -0.1936417107583833 and parameters: {'n_estimators': 3261, 'min_samples_split': 6, 'max_features': 0.89, 'min_samples_leaf': 7, 'criterion': 'absolute_error', 'max_depth': 5, 'min_weight_fraction_leaf': 0.0, 'max_leaf_nodes': 20, 'bootstrap': False, 'ccp_alpha': 0.014}. Best is trial 2586 with value: 0.023797084339743015.
[I 2025-04-16 01:34:17,420] Trial 2629 finished with value: -0.1936417107583833 and parameters: {'n_estimators': 6940, 'min_samples_split': 92, 'max_features': 0.88, 'min_samples_leaf': 4, 'criterion': 'absolute_error', 'max_depth': 5, 'min_weight_fraction_leaf': 0.0, 'max_leaf_nodes': 20, 'bootstrap': False, 'ccp_alpha': 0.006}. Best is trial 2586 with value: 0.023797084339743015.
[I 2025-04-16 01:34:23,703] Trial 2630 finished with value: -0.1936417107583833 and parameters: {'n_estimators': 7873, 'min_samples_split': 2, 'max_features': 0.91, 'min_samples_leaf': 6, 'criterion': 'absolute_error', 'max_depth': 5, 'min_weight_fraction_leaf': 0.0, 'max_leaf_nodes': 20, 'bootstrap': False, 'ccp_alpha': 0.018000000000000002}. Best is trial 2586 with value: 0.023797084339743015.
[I 2025-04-16 01:34:29,619] Trial 2631 finished with value: -0.1936417107583833 and parameters: {'n_estimators': 7083, 'min_samples_split': 6, 'max_features': 0.91, 'min_samples_leaf': 3, 'criterion': 'absolute_error', 'max_depth': 5, 'min_weight_fraction_leaf': 0.0, 'max_leaf_nodes': 20, 'bootstrap': False, 'ccp_alpha': 0.01}. Best is trial 2586 with value: 0.023797084339743015.
[I 2025-04-16 01:34:35,748] Trial 2632 finished with value: -17.52898638227075 and parameters: {'n_estimators': 6873, 'min_samples_split': 9, 'max_features': 0.91, 'min_samples_leaf': 3, 'criterion': 'friedman_mse', 'max_depth': 5, 'min_weight_fraction_leaf': 0.0, 'max_leaf_nodes': 20, 'bootstrap': False, 'ccp_alpha': 0.006}. Best is trial 2586 with value: 0.023797084339743015.
[I 2025-04-16 01:34:41,608] Trial 2633 finished with value: -0.1936417107583833 and parameters: {'n_estimators': 6419, 'min_samples_split': 6, 'max_features': 0.87, 'min_samples_leaf': 5, 'criterion': 'absolute_error', 'max_depth': 5, 'min_weight_fraction_leaf': 0.0, 'max_leaf_nodes': 20, 'bootstrap': False, 'ccp_alpha': 0.024}. Best is trial 2586 with value: 0.023797084339743015.
[I 2025-04-16 01:34:48,761] Trial 2634 finished with value: -0.1936417107583833 and parameters: {'n_estimators': 8887, 'min_samples_split': 2, 'max_features': 0.89, 'min_samples_leaf': 7, 'criterion': 'absolute_error', 'max_depth': 5, 'min_weight_fraction_leaf': 0.0, 'max_leaf_nodes': 20, 'bootstrap': False, 'ccp_alpha': 0.014}. Best is trial 2586 with value: 0.023797084339743015.
[I 2025-04-16 01:34:54,467] Trial 2635 finished with value: -0.1936417107583833 and parameters: {'n_estimators': 6691, 'min_samples_split': 10, 'max_features': 0.91, 'min_samples_leaf': 3, 'criterion': 'absolute_error', 'max_depth': 5, 'min_weight_fraction_leaf': 0.0, 'max_leaf_nodes': 20, 'bootstrap': False, 'ccp_alpha': 0.011}. Best is trial 2586 with value: 0.023797084339743015.
[I 2025-04-16 01:34:57,554] Trial 2636 finished with value: -0.1936417107583833 and parameters: {'n_estimators': 3303, 'min_samples_split': 6, 'max_features': 0.92, 'min_samples_leaf': 5, 'criterion': 'absolute_error', 'max_depth': 5, 'min_weight_fraction_leaf': 0.0, 'max_leaf_nodes': 20, 'bootstrap': False, 'ccp_alpha': 0.006}. Best is trial 2586 with value: 0.023797084339743015.
[I 2025-04-16 01:35:00,676] Trial 2637 finished with value: -0.1936417107583833 and parameters: {'n_estimators': 3495, 'min_samples_split': 56, 'max_features': 0.89, 'min_samples_leaf': 3, 'criterion': 'absolute_error', 'max_depth': 5, 'min_weight_fraction_leaf': 0.0, 'max_leaf_nodes': 20, 'bootstrap': False, 'ccp_alpha': 0.017}. Best is trial 2586 with value: 0.023797084339743015.
[I 2025-04-16 01:35:04,342] Trial 2638 finished with value: -0.040688604964939715 and parameters: {'n_estimators': 3475, 'min_samples_split': 2, 'max_features': 0.92, 'min_samples_leaf': 1, 'criterion': 'absolute_error', 'max_depth': 5, 'min_weight_fraction_leaf': 0.0, 'max_leaf_nodes': 20, 'bootstrap': False, 'ccp_alpha': 0.006}. Best is trial 2586 with value: 0.023797084339743015.
[I 2025-04-16 01:35:07,252] Trial 2639 finished with value: -0.1936417107583833 and parameters: {'n_estimators': 3078, 'min_samples_split': 10, 'max_features': 0.92, 'min_samples_leaf': 1, 'criterion': 'absolute_error', 'max_depth': 5, 'min_weight_fraction_leaf': 0.0, 'max_leaf_nodes': 20, 'bootstrap': False, 'ccp_alpha': 0.006}. Best is trial 2586 with value: 0.023797084339743015.
[I 2025-04-16 01:35:10,251] Trial 2640 finished with value: -0.1936417107583833 and parameters: {'n_estimators': 3363, 'min_samples_split': 6, 'max_features': 0.91, 'min_samples_leaf': 1, 'criterion': 'absolute_error', 'max_depth': 5, 'min_weight_fraction_leaf': 0.0, 'max_leaf_nodes': 20, 'bootstrap': False, 'ccp_alpha': 0.012}. Best is trial 2586 with value: 0.023797084339743015.
[I 2025-04-16 01:35:12,991] Trial 2641 finished with value: -0.1936417107583833 and parameters: {'n_estimators': 3096, 'min_samples_split': 9, 'max_features': 0.92, 'min_samples_leaf': 1, 'criterion': 'absolute_error', 'max_depth': 5, 'min_weight_fraction_leaf': 0.0, 'max_leaf_nodes': 20, 'bootstrap': False, 'ccp_alpha': 0.021}. Best is trial 2586 with value: 0.023797084339743015.
[I 2025-04-16 01:35:15,560] Trial 2642 finished with value: -17.528986382275924 and parameters: {'n_estimators': 3263, 'min_samples_split': 121, 'max_features': 0.92, 'min_samples_leaf': 1, 'criterion': 'squared_error', 'max_depth': 5, 'min_weight_fraction_leaf': 0.0, 'max_leaf_nodes': 20, 'bootstrap': False, 'ccp_alpha': 0.006}. Best is trial 2586 with value: 0.023797084339743015.
[I 2025-04-16 01:35:18,864] Trial 2643 finished with value: -0.1936417107583833 and parameters: {'n_estimators': 3500, 'min_samples_split': 2, 'max_features': 0.89, 'min_samples_leaf': 3, 'criterion': 'absolute_error', 'max_depth': 5, 'min_weight_fraction_leaf': 0.0, 'max_leaf_nodes': 20, 'bootstrap': False, 'ccp_alpha': 0.013000000000000001}. Best is trial 2586 with value: 0.023797084339743015.
[I 2025-04-16 01:35:22,286] Trial 2644 finished with value: -0.1936417107583833 and parameters: {'n_estimators': 3328, 'min_samples_split': 6, 'max_features': 0.92, 'min_samples_leaf': 5, 'criterion': 'absolute_error', 'max_depth': 5, 'min_weight_fraction_leaf': 0.0, 'max_leaf_nodes': 20, 'bootstrap': False, 'ccp_alpha': 0.033}. Best is trial 2586 with value: 0.023797084339743015.
[I 2025-04-16 01:35:25,233] Trial 2645 finished with value: -0.1936417107583833 and parameters: {'n_estimators': 3133, 'min_samples_split': 10, 'max_features': 0.54, 'min_samples_leaf': 3, 'criterion': 'absolute_error', 'max_depth': 5, 'min_weight_fraction_leaf': 0.0, 'max_leaf_nodes': 20, 'bootstrap': False, 'ccp_alpha': 0.006}. Best is trial 2586 with value: 0.023797084339743015.
[I 2025-04-16 01:35:28,463] Trial 2646 finished with value: -0.1936417107583833 and parameters: {'n_estimators': 3449, 'min_samples_split': 6, 'max_features': 0.89, 'min_samples_leaf': 5, 'criterion': 'absolute_error', 'max_depth': 5, 'min_weight_fraction_leaf': 0.0, 'max_leaf_nodes': 20, 'bootstrap': False, 'ccp_alpha': 0.018000000000000002}. Best is trial 2586 with value: 0.023797084339743015.
[I 2025-04-16 01:35:31,507] Trial 2647 finished with value: -21.327710410395564 and parameters: {'n_estimators': 3528, 'min_samples_split': 10, 'max_features': 0.87, 'min_samples_leaf': 1, 'criterion': 'poisson', 'max_depth': 5, 'min_weight_fraction_leaf': 0.0, 'max_leaf_nodes': 20, 'bootstrap': False, 'ccp_alpha': 0.011}. Best is trial 2586 with value: 0.023797084339743015.
[I 2025-04-16 01:35:34,658] Trial 2648 finished with value: -0.1936417107583833 and parameters: {'n_estimators': 3297, 'min_samples_split': 5, 'max_features': 0.92, 'min_samples_leaf': 3, 'criterion': 'absolute_error', 'max_depth': 5, 'min_weight_fraction_leaf': 0.0, 'max_leaf_nodes': 20, 'bootstrap': False, 'ccp_alpha': 0.026000000000000002}. Best is trial 2586 with value: 0.023797084339743015.
[I 2025-04-16 01:35:37,896] Trial 2649 finished with value: 0.022885014574742856 and parameters: {'n_estimators': 3506, 'min_samples_split': 2, 'max_features': 0.9, 'min_samples_leaf': 7, 'criterion': 'absolute_error', 'max_depth': 5, 'min_weight_fraction_leaf': 0.0, 'max_leaf_nodes': 20, 'bootstrap': False, 'ccp_alpha': 0.005}. Best is trial 2586 with value: 0.023797084339743015.
[I 2025-04-16 01:35:41,365] Trial 2650 finished with value: -0.09173042252676196 and parameters: {'n_estimators': 3572, 'min_samples_split': 2, 'max_features': 0.85, 'min_samples_leaf': 7, 'criterion': 'absolute_error', 'max_depth': 5, 'min_weight_fraction_leaf': 0.0, 'max_leaf_nodes': 20, 'bootstrap': False, 'ccp_alpha': 0.005}. Best is trial 2586 with value: 0.023797084339743015.
[I 2025-04-16 01:35:44,427] Trial 2651 finished with value: -0.1936417107583833 and parameters: {'n_estimators': 3269, 'min_samples_split': 10, 'max_features': 0.87, 'min_samples_leaf': 6, 'criterion': 'absolute_error', 'max_depth': 5, 'min_weight_fraction_leaf': 0.0, 'max_leaf_nodes': 20, 'bootstrap': False, 'ccp_alpha': 0.011}. Best is trial 2586 with value: 0.023797084339743015.
[I 2025-04-16 01:35:47,740] Trial 2652 finished with value: -0.08375885028221204 and parameters: {'n_estimators': 3518, 'min_samples_split': 6, 'max_features': 0.86, 'min_samples_leaf': 7, 'criterion': 'absolute_error', 'max_depth': 5, 'min_weight_fraction_leaf': 0.0, 'max_leaf_nodes': 20, 'bootstrap': False, 'ccp_alpha': 0.005}. Best is trial 2586 with value: 0.023797084339743015.
[I 2025-04-16 01:35:51,260] Trial 2653 finished with value: -0.1936417107583833 and parameters: {'n_estimators': 3582, 'min_samples_split': 6, 'max_features': 0.88, 'min_samples_leaf': 7, 'criterion': 'absolute_error', 'max_depth': 5, 'min_weight_fraction_leaf': 0.0, 'max_leaf_nodes': 20, 'bootstrap': False, 'ccp_alpha': 0.017}. Best is trial 2586 with value: 0.023797084339743015.
[I 2025-04-16 01:35:54,189] Trial 2654 finished with value: -0.07537677550948593 and parameters: {'n_estimators': 3123, 'min_samples_split': 2, 'max_features': 0.85, 'min_samples_leaf': 7, 'criterion': 'absolute_error', 'max_depth': 5, 'min_weight_fraction_leaf': 0.0, 'max_leaf_nodes': 20, 'bootstrap': False, 'ccp_alpha': 0.005}. Best is trial 2586 with value: 0.023797084339743015.
[I 2025-04-16 01:35:57,593] Trial 2655 finished with value: -0.1936417107583833 and parameters: {'n_estimators': 3581, 'min_samples_split': 10, 'max_features': 0.89, 'min_samples_leaf': 7, 'criterion': 'absolute_error', 'max_depth': 5, 'min_weight_fraction_leaf': 0.0, 'max_leaf_nodes': 20, 'bootstrap': False, 'ccp_alpha': 0.011}. Best is trial 2586 with value: 0.023797084339743015.
[I 2025-04-16 01:36:00,989] Trial 2656 finished with value: -0.07989510596216347 and parameters: {'n_estimators': 3353, 'min_samples_split': 6, 'max_features': 0.87, 'min_samples_leaf': 5, 'criterion': 'absolute_error', 'max_depth': 5, 'min_weight_fraction_leaf': 0.0, 'max_leaf_nodes': 20, 'bootstrap': False, 'ccp_alpha': 0.005}. Best is trial 2586 with value: 0.023797084339743015.
[I 2025-04-16 01:36:03,949] Trial 2657 finished with value: -17.528986382276493 and parameters: {'n_estimators': 3086, 'min_samples_split': 10, 'max_features': 0.9, 'min_samples_leaf': 5, 'criterion': 'friedman_mse', 'max_depth': 5, 'min_weight_fraction_leaf': 0.0, 'max_leaf_nodes': 20, 'bootstrap': False, 'ccp_alpha': 0.014}. Best is trial 2586 with value: 0.023797084339743015.
[I 2025-04-16 01:36:07,179] Trial 2658 finished with value: -0.1936417107583833 and parameters: {'n_estimators': 3533, 'min_samples_split': 2, 'max_features': 0.9, 'min_samples_leaf': 7, 'criterion': 'absolute_error', 'max_depth': 5, 'min_weight_fraction_leaf': 0.0, 'max_leaf_nodes': 20, 'bootstrap': False, 'ccp_alpha': 0.021}. Best is trial 2586 with value: 0.023797084339743015.
[I 2025-04-16 01:36:10,502] Trial 2659 finished with value: -0.1936417107583833 and parameters: {'n_estimators': 3336, 'min_samples_split': 70, 'max_features': 0.89, 'min_samples_leaf': 5, 'criterion': 'absolute_error', 'max_depth': 5, 'min_weight_fraction_leaf': 0.0, 'max_leaf_nodes': 20, 'bootstrap': False, 'ccp_alpha': 0.011}. Best is trial 2586 with value: 0.023797084339743015.
[I 2025-04-16 01:36:14,053] Trial 2660 finished with value: -0.1936417107583833 and parameters: {'n_estimators': 3619, 'min_samples_split': 5, 'max_features': 0.87, 'min_samples_leaf': 4, 'criterion': 'absolute_error', 'max_depth': 5, 'min_weight_fraction_leaf': 0.0, 'max_leaf_nodes': 20, 'bootstrap': False, 'ccp_alpha': 0.192}. Best is trial 2586 with value: 0.023797084339743015.
[I 2025-04-16 01:36:17,259] Trial 2661 finished with value: 0.02293725319211013 and parameters: {'n_estimators': 3627, 'min_samples_split': 10, 'max_features': 0.9, 'min_samples_leaf': 7, 'criterion': 'absolute_error', 'max_depth': 5, 'min_weight_fraction_leaf': 0.0, 'max_leaf_nodes': 20, 'bootstrap': False, 'ccp_alpha': 0.005}. Best is trial 2586 with value: 0.023797084339743015.
