[I 2025-04-16 00:43:14,691] Trial 1765 finished with value: -0.1936417107583833 and parameters: {'n_estimators': 4120, 'min_samples_split': 25, 'max_features': 0.93, 'min_samples_leaf': 14, 'criterion': 'absolute_error', 'max_depth': 60, 'min_weight_fraction_leaf': 0.01, 'max_leaf_nodes': 150, 'bootstrap': False, 'ccp_alpha': 0.013000000000000001}. Best is trial 1439 with value: -0.15896829431478016.
[I 2025-04-16 00:43:17,842] Trial 1766 finished with value: -0.1936417107583833 and parameters: {'n_estimators': 3839, 'min_samples_split': 6, 'max_features': 0.9600000000000001, 'min_samples_leaf': 13, 'criterion': 'absolute_error', 'max_depth': 60, 'min_weight_fraction_leaf': 0.0, 'max_leaf_nodes': 150, 'bootstrap': False, 'ccp_alpha': 0.005}. Best is trial 1439 with value: -0.15896829431478016.
[I 2025-04-16 00:43:21,471] Trial 1767 finished with value: -0.1936417107583833 and parameters: {'n_estimators': 4331, 'min_samples_split': 20, 'max_features': 0.91, 'min_samples_leaf': 19, 'criterion': 'absolute_error', 'max_depth': 60, 'min_weight_fraction_leaf': 0.01, 'max_leaf_nodes': 150, 'bootstrap': False, 'ccp_alpha': 0.01}. Best is trial 1439 with value: -0.15896829431478016.
[I 2025-04-16 00:43:24,896] Trial 1768 finished with value: -17.52898638227419 and parameters: {'n_estimators': 3956, 'min_samples_split': 11, 'max_features': 0.98, 'min_samples_leaf': 15, 'criterion': 'squared_error', 'max_depth': 60, 'min_weight_fraction_leaf': 0.01, 'max_leaf_nodes': 20, 'bootstrap': False, 'ccp_alpha': 0.018000000000000002}. Best is trial 1439 with value: -0.15896829431478016.
[I 2025-04-16 00:43:27,939] Trial 1769 finished with value: -8.74298133932809 and parameters: {'n_estimators': 3634, 'min_samples_split': 15, 'max_features': 0.9500000000000001, 'min_samples_leaf': 9, 'criterion': 'absolute_error', 'max_depth': 60, 'min_weight_fraction_leaf': 0.01, 'max_leaf_nodes': 150, 'bootstrap': False, 'ccp_alpha': 0.0}. Best is trial 1439 with value: -0.15896829431478016.
[I 2025-04-16 00:43:31,357] Trial 1770 finished with value: -8.777649764020643 and parameters: {'n_estimators': 4141, 'min_samples_split': 19, 'max_features': 0.93, 'min_samples_leaf': 12, 'criterion': 'absolute_error', 'max_depth': 60, 'min_weight_fraction_leaf': 0.01, 'max_leaf_nodes': 150, 'bootstrap': False, 'ccp_alpha': 0.0}. Best is trial 1439 with value: -0.15896829431478016.
[I 2025-04-16 00:43:34,778] Trial 1771 finished with value: -0.1936417107583833 and parameters: {'n_estimators': 3868, 'min_samples_split': 27, 'max_features': 0.97, 'min_samples_leaf': 17, 'criterion': 'absolute_error', 'max_depth': 60, 'min_weight_fraction_leaf': 0.01, 'max_leaf_nodes': 150, 'bootstrap': False, 'ccp_alpha': 0.006}. Best is trial 1439 with value: -0.15896829431478016.
[I 2025-04-16 00:43:38,752] Trial 1772 finished with value: -41.30736917008569 and parameters: {'n_estimators': 4285, 'min_samples_split': 10, 'max_features': 1.0, 'min_samples_leaf': 11, 'criterion': 'poisson', 'max_depth': 60, 'min_weight_fraction_leaf': 0.01, 'max_leaf_nodes': 150, 'bootstrap': False, 'ccp_alpha': 0.01}. Best is trial 1439 with value: -0.15896829431478016.
[I 2025-04-16 00:43:43,689] Trial 1773 finished with value: -0.1936417107583833 and parameters: {'n_estimators': 4060, 'min_samples_split': 23, 'max_features': 0.9500000000000001, 'min_samples_leaf': 14, 'criterion': 'absolute_error', 'max_depth': 60, 'min_weight_fraction_leaf': 0.0, 'max_leaf_nodes': 150, 'bootstrap': False, 'ccp_alpha': 0.005}. Best is trial 1439 with value: -0.15896829431478016.
[I 2025-04-16 00:43:47,399] Trial 1774 finished with value: -0.19361576976402076 and parameters: {'n_estimators': 3782, 'min_samples_split': 16, 'max_features': 0.91, 'min_samples_leaf': 16, 'criterion': 'absolute_error', 'max_depth': 60, 'min_weight_fraction_leaf': 0.01, 'max_leaf_nodes': 150, 'bootstrap': False, 'ccp_alpha': 0.0}. Best is trial 1439 with value: -0.15896829431478016.
[I 2025-04-16 00:43:51,250] Trial 1775 finished with value: -0.1936417107583833 and parameters: {'n_estimators': 4655, 'min_samples_split': 12, 'max_features': 0.97, 'min_samples_leaf': 13, 'criterion': 'absolute_error', 'max_depth': 60, 'min_weight_fraction_leaf': 0.01, 'max_leaf_nodes': 150, 'bootstrap': False, 'ccp_alpha': 0.014}. Best is trial 1439 with value: -0.15896829431478016.
[I 2025-04-16 00:43:54,082] Trial 1776 finished with value: -8.747867391317332 and parameters: {'n_estimators': 3595, 'min_samples_split': 7, 'max_features': 0.9400000000000001, 'min_samples_leaf': 10, 'criterion': 'absolute_error', 'max_depth': 60, 'min_weight_fraction_leaf': 0.01, 'max_leaf_nodes': 150, 'bootstrap': False, 'ccp_alpha': 0.0}. Best is trial 1439 with value: -0.15896829431478016.
[I 2025-04-16 00:43:57,941] Trial 1777 finished with value: -0.1936417107583833 and parameters: {'n_estimators': 4370, 'min_samples_split': 19, 'max_features': 0.9600000000000001, 'min_samples_leaf': 12, 'criterion': 'absolute_error', 'max_depth': 60, 'min_weight_fraction_leaf': 0.01, 'max_leaf_nodes': 150, 'bootstrap': False, 'ccp_alpha': 0.01}. Best is trial 1439 with value: -0.15896829431478016.
[I 2025-04-16 00:44:01,640] Trial 1778 finished with value: -0.1936417107583833 and parameters: {'n_estimators': 4131, 'min_samples_split': 15, 'max_features': 0.92, 'min_samples_leaf': 15, 'criterion': 'absolute_error', 'max_depth': 60, 'min_weight_fraction_leaf': 0.01, 'max_leaf_nodes': 300, 'bootstrap': False, 'ccp_alpha': 0.006}. Best is trial 1439 with value: -0.15896829431478016.
[I 2025-04-16 00:44:05,346] Trial 1779 finished with value: -0.1936417107583833 and parameters: {'n_estimators': 3956, 'min_samples_split': 21, 'max_features': 0.98, 'min_samples_leaf': 9, 'criterion': 'absolute_error', 'max_depth': 60, 'min_weight_fraction_leaf': 0.0, 'max_leaf_nodes': 150, 'bootstrap': False, 'ccp_alpha': 0.019}. Best is trial 1439 with value: -0.15896829431478016.
[I 2025-04-16 00:44:08,855] Trial 1780 finished with value: -17.528986382274535 and parameters: {'n_estimators': 3794, 'min_samples_split': 6, 'max_features': 0.9400000000000001, 'min_samples_leaf': 19, 'criterion': 'friedman_mse', 'max_depth': 60, 'min_weight_fraction_leaf': 0.01, 'max_leaf_nodes': 150, 'bootstrap': False, 'ccp_alpha': 0.006}. Best is trial 1439 with value: -0.15896829431478016.
[I 2025-04-16 00:44:12,489] Trial 1781 finished with value: -0.15901220371852287 and parameters: {'n_estimators': 4215, 'min_samples_split': 24, 'max_features': 0.99, 'min_samples_leaf': 13, 'criterion': 'absolute_error', 'max_depth': 60, 'min_weight_fraction_leaf': 0.01, 'max_leaf_nodes': 150, 'bootstrap': False, 'ccp_alpha': 0.0}. Best is trial 1439 with value: -0.15896829431478016.
[I 2025-04-16 00:44:17,414] Trial 1782 finished with value: -0.1936417107583833 and parameters: {'n_estimators': 4698, 'min_samples_split': 25, 'max_features': 1.0, 'min_samples_leaf': 16, 'criterion': 'absolute_error', 'max_depth': 60, 'min_weight_fraction_leaf': 0.01, 'max_leaf_nodes': 150, 'bootstrap': False, 'ccp_alpha': 0.015}. Best is trial 1439 with value: -0.15896829431478016.
[I 2025-04-16 00:44:21,416] Trial 1783 finished with value: -0.1936417107583833 and parameters: {'n_estimators': 4430, 'min_samples_split': 12, 'max_features': 1.0, 'min_samples_leaf': 11, 'criterion': 'absolute_error', 'max_depth': 60, 'min_weight_fraction_leaf': 0.1, 'max_leaf_nodes': 150, 'bootstrap': False, 'ccp_alpha': 0.01}. Best is trial 1439 with value: -0.15896829431478016.
[I 2025-04-16 00:44:25,205] Trial 1784 finished with value: -0.19361993307670033 and parameters: {'n_estimators': 4483, 'min_samples_split': 23, 'max_features': 1.0, 'min_samples_leaf': 14, 'criterion': 'absolute_error', 'max_depth': 60, 'min_weight_fraction_leaf': 0.01, 'max_leaf_nodes': 150, 'bootstrap': False, 'ccp_alpha': 0.0}. Best is trial 1439 with value: -0.15896829431478016.
[I 2025-04-16 00:44:29,132] Trial 1785 finished with value: -0.1936417107583833 and parameters: {'n_estimators': 4277, 'min_samples_split': 28, 'max_features': 0.99, 'min_samples_leaf': 17, 'criterion': 'absolute_error', 'max_depth': 60, 'min_weight_fraction_leaf': 0.01, 'max_leaf_nodes': 150, 'bootstrap': False, 'ccp_alpha': 0.006}. Best is trial 1439 with value: -0.15896829431478016.
[I 2025-04-16 00:44:33,026] Trial 1786 finished with value: -0.1936417107583833 and parameters: {'n_estimators': 4562, 'min_samples_split': 16, 'max_features': 0.98, 'min_samples_leaf': 12, 'criterion': 'absolute_error', 'max_depth': 60, 'min_weight_fraction_leaf': 0.01, 'max_leaf_nodes': 150, 'bootstrap': False, 'ccp_alpha': 0.006}. Best is trial 1439 with value: -0.15896829431478016.
[I 2025-04-16 00:44:36,586] Trial 1787 finished with value: -10.682827093963281 and parameters: {'n_estimators': 4270, 'min_samples_split': 11, 'max_features': 1.0, 'min_samples_leaf': 9, 'criterion': 'absolute_error', 'max_depth': 10, 'min_weight_fraction_leaf': 0.01, 'max_leaf_nodes': 150, 'bootstrap': False, 'ccp_alpha': 0.0}. Best is trial 1439 with value: -0.15896829431478016.
[I 2025-04-16 00:44:40,190] Trial 1788 finished with value: -0.1936417107583833 and parameters: {'n_estimators': 4168, 'min_samples_split': 18, 'max_features': 0.98, 'min_samples_leaf': 14, 'criterion': 'absolute_error', 'max_depth': 60, 'min_weight_fraction_leaf': 0.01, 'max_leaf_nodes': 150, 'bootstrap': False, 'ccp_alpha': 0.014}. Best is trial 1439 with value: -0.15896829431478016.
[I 2025-04-16 00:44:43,816] Trial 1789 finished with value: -17.528986382273338 and parameters: {'n_estimators': 4418, 'min_samples_split': 9, 'max_features': 0.98, 'min_samples_leaf': 11, 'criterion': 'squared_error', 'max_depth': 60, 'min_weight_fraction_leaf': 0.0, 'max_leaf_nodes': 150, 'bootstrap': False, 'ccp_alpha': 0.006}. Best is trial 1439 with value: -0.15896829431478016.
[I 2025-04-16 00:44:47,365] Trial 1790 finished with value: -0.1936417107583833 and parameters: {'n_estimators': 4103, 'min_samples_split': 14, 'max_features': 0.97, 'min_samples_leaf': 15, 'criterion': 'absolute_error', 'max_depth': 60, 'min_weight_fraction_leaf': 0.01, 'max_leaf_nodes': 150, 'bootstrap': False, 'ccp_alpha': 0.011}. Best is trial 1439 with value: -0.15896829431478016.
[I 2025-04-16 00:44:50,852] Trial 1791 finished with value: -0.15292978335836843 and parameters: {'n_estimators': 4721, 'min_samples_split': 5, 'max_features': 1.0, 'min_samples_leaf': 13, 'criterion': 'absolute_error', 'max_depth': 60, 'min_weight_fraction_leaf': 0.01, 'max_leaf_nodes': 150, 'bootstrap': False, 'ccp_alpha': 0.0}. Best is trial 1791 with value: -0.15292978335836843.
[I 2025-04-16 00:44:55,029] Trial 1792 finished with value: -0.1936417107583833 and parameters: {'n_estimators': 4734, 'min_samples_split': 4, 'max_features': 1.0, 'min_samples_leaf': 18, 'criterion': 'absolute_error', 'max_depth': 60, 'min_weight_fraction_leaf': 0.01, 'max_leaf_nodes': 150, 'bootstrap': False, 'ccp_alpha': 0.005}. Best is trial 1791 with value: -0.15292978335836843.
[I 2025-04-16 00:44:59,394] Trial 1793 finished with value: -0.1936417107583833 and parameters: {'n_estimators': 4684, 'min_samples_split': 5, 'max_features': 1.0, 'min_samples_leaf': 9, 'criterion': 'absolute_error', 'max_depth': 60, 'min_weight_fraction_leaf': 0.01, 'max_leaf_nodes': 150, 'bootstrap': False, 'ccp_alpha': 0.02}. Best is trial 1791 with value: -0.15292978335836843.
[I 2025-04-16 00:45:03,434] Trial 1794 finished with value: -0.1936417107583833 and parameters: {'n_estimators': 4535, 'min_samples_split': 8, 'max_features': 1.0, 'min_samples_leaf': 16, 'criterion': 'absolute_error', 'max_depth': 60, 'min_weight_fraction_leaf': 0.01, 'max_leaf_nodes': 20, 'bootstrap': False, 'ccp_alpha': 0.01}. Best is trial 1791 with value: -0.15292978335836843.
[I 2025-04-16 00:45:07,075] Trial 1795 finished with value: -41.30736917008544 and parameters: {'n_estimators': 4751, 'min_samples_split': 2, 'max_features': 1.0, 'min_samples_leaf': 12, 'criterion': 'poisson', 'max_depth': 60, 'min_weight_fraction_leaf': 0.01, 'max_leaf_nodes': 150, 'bootstrap': False, 'ccp_alpha': 0.0}. Best is trial 1791 with value: -0.15292978335836843.
[I 2025-04-16 00:45:10,705] Trial 1796 finished with value: -0.1936417107583833 and parameters: {'n_estimators': 4048, 'min_samples_split': 5, 'max_features': 1.0, 'min_samples_leaf': 14, 'criterion': 'absolute_error', 'max_depth': 60, 'min_weight_fraction_leaf': 0.01, 'max_leaf_nodes': 150, 'bootstrap': False, 'ccp_alpha': 0.005}. Best is trial 1791 with value: -0.15292978335836843.
[I 2025-04-16 00:45:14,904] Trial 1797 finished with value: -0.1936417107583833 and parameters: {'n_estimators': 4570, 'min_samples_split': 5, 'max_features': 0.99, 'min_samples_leaf': 11, 'criterion': 'absolute_error', 'max_depth': 60, 'min_weight_fraction_leaf': 0.01, 'max_leaf_nodes': 150, 'bootstrap': False, 'ccp_alpha': 0.013000000000000001}. Best is trial 1791 with value: -0.15292978335836843.
[I 2025-04-16 00:45:18,488] Trial 1798 finished with value: -0.19361575317513666 and parameters: {'n_estimators': 4272, 'min_samples_split': 8, 'max_features': 0.97, 'min_samples_leaf': 16, 'criterion': 'absolute_error', 'max_depth': 60, 'min_weight_fraction_leaf': 0.0, 'max_leaf_nodes': 150, 'bootstrap': False, 'ccp_alpha': 0.0}. Best is trial 1791 with value: -0.15292978335836843.
[I 2025-04-16 00:45:22,039] Trial 1799 finished with value: -0.1936417107583833 and parameters: {'n_estimators': 4419, 'min_samples_split': 2, 'max_features': 0.98, 'min_samples_leaf': 10, 'criterion': 'absolute_error', 'max_depth': 60, 'min_weight_fraction_leaf': 0.01, 'max_leaf_nodes': 150, 'bootstrap': False, 'ccp_alpha': 0.006}. Best is trial 1791 with value: -0.15292978335836843.
[I 2025-04-16 00:45:25,250] Trial 1800 finished with value: -0.1936417107583833 and parameters: {'n_estimators': 3998, 'min_samples_split': 5, 'max_features': 0.98, 'min_samples_leaf': 19, 'criterion': 'absolute_error', 'max_depth': 60, 'min_weight_fraction_leaf': 0.01, 'max_leaf_nodes': 150, 'bootstrap': False, 'ccp_alpha': 0.011}. Best is trial 1791 with value: -0.15292978335836843.
[I 2025-04-16 00:45:28,741] Trial 1801 finished with value: -0.1936417107583833 and parameters: {'n_estimators': 4165, 'min_samples_split': 9, 'max_features': 0.98, 'min_samples_leaf': 13, 'criterion': 'absolute_error', 'max_depth': 60, 'min_weight_fraction_leaf': 0.01, 'max_leaf_nodes': 150, 'bootstrap': False, 'ccp_alpha': 0.019}. Best is trial 1791 with value: -0.15292978335836843.
[I 2025-04-16 00:45:32,090] Trial 1802 finished with value: -0.1936417107583833 and parameters: {'n_estimators': 3984, 'min_samples_split': 10, 'max_features': 1.0, 'min_samples_leaf': 14, 'criterion': 'absolute_error', 'max_depth': 60, 'min_weight_fraction_leaf': 0.01, 'max_leaf_nodes': 300, 'bootstrap': False, 'ccp_alpha': 0.005}. Best is trial 1791 with value: -0.15292978335836843.
[I 2025-04-16 00:45:35,854] Trial 1803 finished with value: -8.76289622700305 and parameters: {'n_estimators': 4474, 'min_samples_split': 7, 'max_features': 0.98, 'min_samples_leaf': 11, 'criterion': 'absolute_error', 'max_depth': 60, 'min_weight_fraction_leaf': 0.0, 'max_leaf_nodes': 150, 'bootstrap': False, 'ccp_alpha': 0.0}. Best is trial 1791 with value: -0.15292978335836843.
[I 2025-04-16 00:45:39,874] Trial 1804 finished with value: -0.1936417107583833 and parameters: {'n_estimators': 4178, 'min_samples_split': 12, 'max_features': 0.97, 'min_samples_leaf': 9, 'criterion': 'absolute_error', 'max_depth': 60, 'min_weight_fraction_leaf': 0.01, 'max_leaf_nodes': 150, 'bootstrap': False, 'ccp_alpha': 0.01}. Best is trial 1791 with value: -0.15292978335836843.
[I 2025-04-16 00:45:43,213] Trial 1805 finished with value: -17.52898638227422 and parameters: {'n_estimators': 3942, 'min_samples_split': 5, 'max_features': 1.0, 'min_samples_leaf': 17, 'criterion': 'friedman_mse', 'max_depth': 60, 'min_weight_fraction_leaf': 0.01, 'max_leaf_nodes': 150, 'bootstrap': False, 'ccp_alpha': 0.006}. Best is trial 1791 with value: -0.15292978335836843.
[I 2025-04-16 00:45:47,317] Trial 1806 finished with value: -0.1936417107583833 and parameters: {'n_estimators': 4325, 'min_samples_split': 11, 'max_features': 0.97, 'min_samples_leaf': 13, 'criterion': 'absolute_error', 'max_depth': 60, 'min_weight_fraction_leaf': 0.01, 'max_leaf_nodes': 150, 'bootstrap': False, 'ccp_alpha': 0.015}. Best is trial 1791 with value: -0.15292978335836843.
[I 2025-04-16 00:45:51,319] Trial 1807 finished with value: -0.19362501367589724 and parameters: {'n_estimators': 4774, 'min_samples_split': 14, 'max_features': 0.9600000000000001, 'min_samples_leaf': 15, 'criterion': 'absolute_error', 'max_depth': 60, 'min_weight_fraction_leaf': 0.01, 'max_leaf_nodes': 150, 'bootstrap': False, 'ccp_alpha': 0.0}. Best is trial 1791 with value: -0.15292978335836843.
[I 2025-04-16 00:45:54,797] Trial 1808 finished with value: -0.1936417107583833 and parameters: {'n_estimators': 4150, 'min_samples_split': 11, 'max_features': 0.98, 'min_samples_leaf': 12, 'criterion': 'absolute_error', 'max_depth': 60, 'min_weight_fraction_leaf': 0.01, 'max_leaf_nodes': 150, 'bootstrap': False, 'ccp_alpha': 0.006}. Best is trial 1791 with value: -0.15292978335836843.
[I 2025-04-16 00:45:57,878] Trial 1809 finished with value: -0.1936249470209331 and parameters: {'n_estimators': 3809, 'min_samples_split': 8, 'max_features': 0.9600000000000001, 'min_samples_leaf': 15, 'criterion': 'absolute_error', 'max_depth': 60, 'min_weight_fraction_leaf': 0.01, 'max_leaf_nodes': 150, 'bootstrap': False, 'ccp_alpha': 0.0}. Best is trial 1791 with value: -0.15292978335836843.
[I 2025-04-16 00:46:02,197] Trial 1810 finished with value: -0.1936417107583833 and parameters: {'n_estimators': 4523, 'min_samples_split': 2, 'max_features': 1.0, 'min_samples_leaf': 9, 'criterion': 'absolute_error', 'max_depth': 60, 'min_weight_fraction_leaf': 0.01, 'max_leaf_nodes': 150, 'bootstrap': False, 'ccp_alpha': 0.012}. Best is trial 1791 with value: -0.15292978335836843.
[I 2025-04-16 00:46:05,734] Trial 1811 finished with value: -0.1936417107583833 and parameters: {'n_estimators': 4025, 'min_samples_split': 14, 'max_features': 0.9600000000000001, 'min_samples_leaf': 12, 'criterion': 'absolute_error', 'max_depth': 10, 'min_weight_fraction_leaf': 0.01, 'max_leaf_nodes': 150, 'bootstrap': False, 'ccp_alpha': 0.005}. Best is trial 1791 with value: -0.15292978335836843.
[I 2025-04-16 00:46:08,810] Trial 1812 finished with value: -0.1936417107583833 and parameters: {'n_estimators': 3612, 'min_samples_split': 8, 'max_features': 0.98, 'min_samples_leaf': 17, 'criterion': 'absolute_error', 'max_depth': 60, 'min_weight_fraction_leaf': 0.0, 'max_leaf_nodes': 150, 'bootstrap': False, 'ccp_alpha': 0.011}. Best is trial 1791 with value: -0.15292978335836843.
[I 2025-04-16 00:46:12,696] Trial 1813 finished with value: -0.1936417107583833 and parameters: {'n_estimators': 4308, 'min_samples_split': 15, 'max_features': 0.9600000000000001, 'min_samples_leaf': 14, 'criterion': 'absolute_error', 'max_depth': 60, 'min_weight_fraction_leaf': 0.01, 'max_leaf_nodes': 150, 'bootstrap': False, 'ccp_alpha': 0.016}. Best is trial 1791 with value: -0.15292978335836843.
[I 2025-04-16 00:46:15,983] Trial 1814 finished with value: -8.774155022134213 and parameters: {'n_estimators': 3884, 'min_samples_split': 21, 'max_features': 0.98, 'min_samples_leaf': 10, 'criterion': 'absolute_error', 'max_depth': 60, 'min_weight_fraction_leaf': 0.01, 'max_leaf_nodes': 150, 'bootstrap': False, 'ccp_alpha': 0.0}. Best is trial 1791 with value: -0.15292978335836843.
[I 2025-04-16 00:46:19,785] Trial 1815 finished with value: -0.1936417107583833 and parameters: {'n_estimators': 4136, 'min_samples_split': 12, 'max_features': 1.0, 'min_samples_leaf': 19, 'criterion': 'absolute_error', 'max_depth': 60, 'min_weight_fraction_leaf': 0.01, 'max_leaf_nodes': 150, 'bootstrap': False, 'ccp_alpha': 0.006}. Best is trial 1791 with value: -0.15292978335836843.
[I 2025-04-16 00:46:23,421] Trial 1816 finished with value: -17.52898638227466 and parameters: {'n_estimators': 3742, 'min_samples_split': 5, 'max_features': 0.9600000000000001, 'min_samples_leaf': 13, 'criterion': 'squared_error', 'max_depth': 60, 'min_weight_fraction_leaf': 0.01, 'max_leaf_nodes': 150, 'bootstrap': False, 'ccp_alpha': 0.02}. Best is trial 1791 with value: -0.15292978335836843.
[I 2025-04-16 00:46:27,185] Trial 1817 finished with value: -0.1936417107583833 and parameters: {'n_estimators': 4322, 'min_samples_split': 17, 'max_features': 0.98, 'min_samples_leaf': 11, 'criterion': 'absolute_error', 'max_depth': 60, 'min_weight_fraction_leaf': 0.01, 'max_leaf_nodes': 20, 'bootstrap': False, 'ccp_alpha': 0.005}. Best is trial 1791 with value: -0.15292978335836843.
[I 2025-04-16 00:46:30,913] Trial 1818 finished with value: -0.19361571780565182 and parameters: {'n_estimators': 3979, 'min_samples_split': 9, 'max_features': 0.9500000000000001, 'min_samples_leaf': 16, 'criterion': 'absolute_error', 'max_depth': 60, 'min_weight_fraction_leaf': 0.01, 'max_leaf_nodes': 150, 'bootstrap': False, 'ccp_alpha': 0.0}. Best is trial 1791 with value: -0.15292978335836843.
[I 2025-04-16 00:46:35,057] Trial 1819 finished with value: -0.1936417107583833 and parameters: {'n_estimators': 3605, 'min_samples_split': 23, 'max_features': 0.9600000000000001, 'min_samples_leaf': 14, 'criterion': 'absolute_error', 'max_depth': 60, 'min_weight_fraction_leaf': 0.0, 'max_leaf_nodes': 150, 'bootstrap': False, 'ccp_alpha': 0.011}. Best is trial 1791 with value: -0.15292978335836843.
[I 2025-04-16 00:46:38,797] Trial 1820 finished with value: -33.4776019104523 and parameters: {'n_estimators': 4629, 'min_samples_split': 15, 'max_features': 0.98, 'min_samples_leaf': 11, 'criterion': 'poisson', 'max_depth': 60, 'min_weight_fraction_leaf': 0.01, 'max_leaf_nodes': 150, 'bootstrap': False, 'ccp_alpha': 0.006}. Best is trial 1791 with value: -0.15292978335836843.
