[I 2025-04-16 02:04:20,067] Trial 3733 finished with value: -0.1936417107583833 and parameters: {'n_estimators': 819, 'min_samples_split': 9, 'max_features': 0.81, 'min_samples_leaf': 3, 'criterion': 'absolute_error', 'max_depth': 15, 'min_weight_fraction_leaf': 0.0, 'max_leaf_nodes': 300, 'bootstrap': False, 'ccp_alpha': 0.022}. Best is trial 3488 with value: 0.05528345733671649.
[I 2025-04-16 02:04:21,031] Trial 3734 finished with value: 0.026586932617103588 and parameters: {'n_estimators': 459, 'min_samples_split': 5, 'max_features': 0.74, 'min_samples_leaf': 1, 'criterion': 'absolute_error', 'max_depth': 15, 'min_weight_fraction_leaf': 0.0, 'max_leaf_nodes': 300, 'bootstrap': False, 'ccp_alpha': 0.005}. Best is trial 3488 with value: 0.05528345733671649.
[I 2025-04-16 02:04:22,493] Trial 3735 finished with value: -0.1936417107583833 and parameters: {'n_estimators': 1044, 'min_samples_split': 6, 'max_features': 0.7000000000000001, 'min_samples_leaf': 3, 'criterion': 'absolute_error', 'max_depth': 15, 'min_weight_fraction_leaf': 0.0, 'max_leaf_nodes': 300, 'bootstrap': False, 'ccp_alpha': 0.016}. Best is trial 3488 with value: 0.05528345733671649.
[I 2025-04-16 02:04:23,556] Trial 3736 finished with value: -19.335381692091254 and parameters: {'n_estimators': 677, 'min_samples_split': 2, 'max_features': 0.78, 'min_samples_leaf': 5, 'criterion': 'poisson', 'max_depth': 15, 'min_weight_fraction_leaf': 0.0, 'max_leaf_nodes': 300, 'bootstrap': False, 'ccp_alpha': 0.012}. Best is trial 3488 with value: 0.05528345733671649.
[I 2025-04-16 02:04:24,213] Trial 3737 finished with value: -0.1936417107583833 and parameters: {'n_estimators': 171, 'min_samples_split': 9, 'max_features': 0.72, 'min_samples_leaf': 1, 'criterion': 'absolute_error', 'max_depth': 15, 'min_weight_fraction_leaf': 0.0, 'max_leaf_nodes': 300, 'bootstrap': False, 'ccp_alpha': 0.193}. Best is trial 3488 with value: 0.05528345733671649.
[I 2025-04-16 02:04:25,146] Trial 3738 finished with value: -14.856785845357901 and parameters: {'n_estimators': 529, 'min_samples_split': 5, 'max_features': 0.75, 'min_samples_leaf': 3, 'criterion': 'absolute_error', 'max_depth': 15, 'min_weight_fraction_leaf': 0.0, 'max_leaf_nodes': 300, 'bootstrap': False, 'ccp_alpha': 0.0}. Best is trial 3488 with value: 0.05528345733671649.
[I 2025-04-16 02:04:26,433] Trial 3739 finished with value: -0.1936417107583833 and parameters: {'n_estimators': 910, 'min_samples_split': 9, 'max_features': 0.67, 'min_samples_leaf': 1, 'criterion': 'absolute_error', 'max_depth': 15, 'min_weight_fraction_leaf': 0.0, 'max_leaf_nodes': 300, 'bootstrap': False, 'ccp_alpha': 0.009000000000000001}. Best is trial 3488 with value: 0.05528345733671649.
[I 2025-04-16 02:04:27,260] Trial 3740 finished with value: -0.1936417107583833 and parameters: {'n_estimators': 355, 'min_samples_split': 83, 'max_features': 0.77, 'min_samples_leaf': 5, 'criterion': 'absolute_error', 'max_depth': 15, 'min_weight_fraction_leaf': 0.0, 'max_leaf_nodes': 300, 'bootstrap': False, 'ccp_alpha': 0.005}. Best is trial 3488 with value: 0.05528345733671649.
[I 2025-04-16 02:04:28,372] Trial 3741 finished with value: -0.1936417107583833 and parameters: {'n_estimators': 715, 'min_samples_split': 2, 'max_features': 0.73, 'min_samples_leaf': 3, 'criterion': 'absolute_error', 'max_depth': 15, 'min_weight_fraction_leaf': 0.0, 'max_leaf_nodes': 300, 'bootstrap': False, 'ccp_alpha': 0.017}. Best is trial 3488 with value: 0.05528345733671649.
[I 2025-04-16 02:04:29,118] Trial 3742 finished with value: -0.1936417107583833 and parameters: {'n_estimators': 284, 'min_samples_split': 6, 'max_features': 0.79, 'min_samples_leaf': 1, 'criterion': 'absolute_error', 'max_depth': 15, 'min_weight_fraction_leaf': 0.0, 'max_leaf_nodes': 300, 'bootstrap': False, 'ccp_alpha': 0.152}. Best is trial 3488 with value: 0.05528345733671649.
[I 2025-04-16 02:04:30,109] Trial 3743 finished with value: -0.1936417107583833 and parameters: {'n_estimators': 542, 'min_samples_split': 2, 'max_features': 0.7100000000000001, 'min_samples_leaf': 5, 'criterion': 'absolute_error', 'max_depth': 15, 'min_weight_fraction_leaf': 0.0, 'max_leaf_nodes': 300, 'bootstrap': False, 'ccp_alpha': 0.031}. Best is trial 3488 with value: 0.05528345733671649.
[I 2025-04-16 02:04:30,638] Trial 3744 finished with value: -0.1936417107583833 and parameters: {'n_estimators': 4, 'min_samples_split': 9, 'max_features': 0.75, 'min_samples_leaf': 3, 'criterion': 'absolute_error', 'max_depth': 15, 'min_weight_fraction_leaf': 0.0, 'max_leaf_nodes': 300, 'bootstrap': False, 'ccp_alpha': 0.01}. Best is trial 3488 with value: 0.05528345733671649.
[I 2025-04-16 02:04:31,954] Trial 3745 finished with value: -0.02645865544433168 and parameters: {'n_estimators': 907, 'min_samples_split': 5, 'max_features': 0.6900000000000001, 'min_samples_leaf': 1, 'criterion': 'absolute_error', 'max_depth': 15, 'min_weight_fraction_leaf': 0.0, 'max_leaf_nodes': 300, 'bootstrap': False, 'ccp_alpha': 0.005}. Best is trial 3488 with value: 0.05528345733671649.
[I 2025-04-16 02:04:32,610] Trial 3746 finished with value: -8.243443167318413 and parameters: {'n_estimators': 174, 'min_samples_split': 6, 'max_features': 0.81, 'min_samples_leaf': 3, 'criterion': 'friedman_mse', 'max_depth': 15, 'min_weight_fraction_leaf': 0.0, 'max_leaf_nodes': 300, 'bootstrap': False, 'ccp_alpha': 0.0}. Best is trial 3488 with value: 0.05528345733671649.
[I 2025-04-16 02:04:33,988] Trial 3747 finished with value: -0.1936417107583833 and parameters: {'n_estimators': 1080, 'min_samples_split': 9, 'max_features': 0.77, 'min_samples_leaf': 5, 'criterion': 'absolute_error', 'max_depth': 15, 'min_weight_fraction_leaf': 0.0, 'max_leaf_nodes': 300, 'bootstrap': False, 'ccp_alpha': 0.022}. Best is trial 3488 with value: 0.05528345733671649.
[I 2025-04-16 02:04:34,913] Trial 3748 finished with value: -0.1936417107583833 and parameters: {'n_estimators': 467, 'min_samples_split': 2, 'max_features': 0.74, 'min_samples_leaf': 1, 'criterion': 'absolute_error', 'max_depth': 15, 'min_weight_fraction_leaf': 0.0, 'max_leaf_nodes': 300, 'bootstrap': False, 'ccp_alpha': 0.013000000000000001}. Best is trial 3488 with value: 0.05528345733671649.
[I 2025-04-16 02:04:36,053] Trial 3749 finished with value: -0.1936417107583833 and parameters: {'n_estimators': 706, 'min_samples_split': 9, 'max_features': 0.65, 'min_samples_leaf': 3, 'criterion': 'absolute_error', 'max_depth': 15, 'min_weight_fraction_leaf': 0.0, 'max_leaf_nodes': 300, 'bootstrap': False, 'ccp_alpha': 0.006}. Best is trial 3488 with value: 0.05528345733671649.
[I 2025-04-16 02:04:36,851] Trial 3750 finished with value: -0.1936417107583833 and parameters: {'n_estimators': 301, 'min_samples_split': 5, 'max_features': 0.7100000000000001, 'min_samples_leaf': 1, 'criterion': 'absolute_error', 'max_depth': 15, 'min_weight_fraction_leaf': 0.0, 'max_leaf_nodes': 300, 'bootstrap': False, 'ccp_alpha': 0.014}. Best is trial 3488 with value: 0.05528345733671649.
[I 2025-04-16 02:04:37,788] Trial 3751 finished with value: -9.719756849279971 and parameters: {'n_estimators': 572, 'min_samples_split': 2, 'max_features': 0.73, 'min_samples_leaf': 5, 'criterion': 'absolute_error', 'max_depth': 15, 'min_weight_fraction_leaf': 0.0, 'max_leaf_nodes': 300, 'bootstrap': False, 'ccp_alpha': 0.0}. Best is trial 3488 with value: 0.05528345733671649.
[I 2025-04-16 02:04:39,070] Trial 3752 finished with value: -0.1936417107583833 and parameters: {'n_estimators': 821, 'min_samples_split': 6, 'max_features': 0.76, 'min_samples_leaf': 3, 'criterion': 'absolute_error', 'max_depth': 15, 'min_weight_fraction_leaf': 0.0, 'max_leaf_nodes': 300, 'bootstrap': False, 'ccp_alpha': 0.009000000000000001}. Best is trial 3488 with value: 0.05528345733671649.
[I 2025-04-16 02:04:39,847] Trial 3753 finished with value: -0.1936417107583833 and parameters: {'n_estimators': 314, 'min_samples_split': 9, 'max_features': 0.79, 'min_samples_leaf': 1, 'criterion': 'absolute_error', 'max_depth': 15, 'min_weight_fraction_leaf': 0.0, 'max_leaf_nodes': 300, 'bootstrap': False, 'ccp_alpha': 0.017}. Best is trial 3488 with value: 0.05528345733671649.
[I 2025-04-16 02:04:40,914] Trial 3754 finished with value: 0.018137965910135213 and parameters: {'n_estimators': 527, 'min_samples_split': 2, 'max_features': 0.72, 'min_samples_leaf': 3, 'criterion': 'absolute_error', 'max_depth': 15, 'min_weight_fraction_leaf': 0.0, 'max_leaf_nodes': 300, 'bootstrap': False, 'ccp_alpha': 0.005}. Best is trial 3488 with value: 0.05528345733671649.
[I 2025-04-16 02:04:41,585] Trial 3755 finished with value: -17.5289863822749 and parameters: {'n_estimators': 170, 'min_samples_split': 9, 'max_features': 0.6900000000000001, 'min_samples_leaf': 5, 'criterion': 'squared_error', 'max_depth': 15, 'min_weight_fraction_leaf': 0.0, 'max_leaf_nodes': 300, 'bootstrap': False, 'ccp_alpha': 0.011}. Best is trial 3488 with value: 0.05528345733671649.
[I 2025-04-16 02:04:42,797] Trial 3756 finished with value: -0.1936417107583833 and parameters: {'n_estimators': 728, 'min_samples_split': 5, 'max_features': 0.74, 'min_samples_leaf': 1, 'criterion': 'absolute_error', 'max_depth': 15, 'min_weight_fraction_leaf': 0.0, 'max_leaf_nodes': 300, 'bootstrap': False, 'ccp_alpha': 0.025}. Best is trial 3488 with value: 0.05528345733671649.
[I 2025-04-16 02:04:44,225] Trial 3757 finished with value: 0.0244085583056306 and parameters: {'n_estimators': 1024, 'min_samples_split': 2, 'max_features': 0.81, 'min_samples_leaf': 3, 'criterion': 'absolute_error', 'max_depth': 15, 'min_weight_fraction_leaf': 0.0, 'max_leaf_nodes': 300, 'bootstrap': False, 'ccp_alpha': 0.005}. Best is trial 3488 with value: 0.05528345733671649.
[I 2025-04-16 02:04:45,113] Trial 3758 finished with value: -0.1936417107583833 and parameters: {'n_estimators': 430, 'min_samples_split': 109, 'max_features': 0.76, 'min_samples_leaf': 5, 'criterion': 'absolute_error', 'max_depth': 15, 'min_weight_fraction_leaf': 0.0, 'max_leaf_nodes': 300, 'bootstrap': False, 'ccp_alpha': 0.014}. Best is trial 3488 with value: 0.05528345733671649.
[I 2025-04-16 02:04:46,169] Trial 3759 finished with value: -0.26934484110122 and parameters: {'n_estimators': 661, 'min_samples_split': 9, 'max_features': 0.78, 'min_samples_leaf': 1, 'criterion': 'absolute_error', 'max_depth': 15, 'min_weight_fraction_leaf': 0.0, 'max_leaf_nodes': 300, 'bootstrap': False, 'ccp_alpha': 0.005}. Best is trial 3488 with value: 0.05528345733671649.
[I 2025-04-16 02:04:46,824] Trial 3760 finished with value: -12.323234296009542 and parameters: {'n_estimators': 172, 'min_samples_split': 6, 'max_features': 0.67, 'min_samples_leaf': 3, 'criterion': 'poisson', 'max_depth': 15, 'min_weight_fraction_leaf': 0.0, 'max_leaf_nodes': 300, 'bootstrap': False, 'ccp_alpha': 0.0}. Best is trial 3488 with value: 0.05528345733671649.
[I 2025-04-16 02:04:48,103] Trial 3761 finished with value: -0.1936417107583833 and parameters: {'n_estimators': 841, 'min_samples_split': 2, 'max_features': 0.7000000000000001, 'min_samples_leaf': 5, 'criterion': 'absolute_error', 'max_depth': 15, 'min_weight_fraction_leaf': 0.0, 'max_leaf_nodes': 300, 'bootstrap': False, 'ccp_alpha': 0.019}. Best is trial 3488 with value: 0.05528345733671649.
[I 2025-04-16 02:04:48,960] Trial 3762 finished with value: -0.1936417107583833 and parameters: {'n_estimators': 381, 'min_samples_split': 6, 'max_features': 0.72, 'min_samples_leaf': 77, 'criterion': 'absolute_error', 'max_depth': 15, 'min_weight_fraction_leaf': 0.0, 'max_leaf_nodes': 300, 'bootstrap': False, 'ccp_alpha': 0.009000000000000001}. Best is trial 3488 with value: 0.05528345733671649.
[I 2025-04-16 02:04:49,863] Trial 3763 finished with value: -0.1936417107583833 and parameters: {'n_estimators': 546, 'min_samples_split': 9, 'max_features': 0.74, 'min_samples_leaf': 63, 'criterion': 'absolute_error', 'max_depth': 15, 'min_weight_fraction_leaf': 0.0, 'max_leaf_nodes': 300, 'bootstrap': False, 'ccp_alpha': 0.0}. Best is trial 3488 with value: 0.05528345733671649.
[I 2025-04-16 02:04:51,187] Trial 3764 finished with value: -0.1936417107583833 and parameters: {'n_estimators': 884, 'min_samples_split': 2, 'max_features': 0.81, 'min_samples_leaf': 1, 'criterion': 'absolute_error', 'max_depth': 15, 'min_weight_fraction_leaf': 0.0, 'max_leaf_nodes': 300, 'bootstrap': False, 'ccp_alpha': 0.013000000000000001}. Best is trial 3488 with value: 0.05528345733671649.
[I 2025-04-16 02:04:51,855] Trial 3765 finished with value: -0.1936417107583833 and parameters: {'n_estimators': 176, 'min_samples_split': 6, 'max_features': 0.76, 'min_samples_leaf': 3, 'criterion': 'absolute_error', 'max_depth': 15, 'min_weight_fraction_leaf': 0.0, 'max_leaf_nodes': 300, 'bootstrap': False, 'ccp_alpha': 0.009000000000000001}. Best is trial 3488 with value: 0.05528345733671649.
[I 2025-04-16 02:04:52,710] Trial 3766 finished with value: -0.1936417107583833 and parameters: {'n_estimators': 401, 'min_samples_split': 6, 'max_features': 0.79, 'min_samples_leaf': 3, 'criterion': 'absolute_error', 'max_depth': 15, 'min_weight_fraction_leaf': 0.0, 'max_leaf_nodes': 300, 'bootstrap': False, 'ccp_alpha': 0.019}. Best is trial 3488 with value: 0.05528345733671649.
[I 2025-04-16 02:04:53,230] Trial 3767 finished with value: -0.1936417107583833 and parameters: {'n_estimators': 4, 'min_samples_split': 9, 'max_features': 0.72, 'min_samples_leaf': 1, 'criterion': 'absolute_error', 'max_depth': 15, 'min_weight_fraction_leaf': 0.0, 'max_leaf_nodes': 300, 'bootstrap': False, 'ccp_alpha': 0.005}. Best is trial 3488 with value: 0.05528345733671649.
[I 2025-04-16 02:04:54,651] Trial 3768 finished with value: -0.1936417107583833 and parameters: {'n_estimators': 1112, 'min_samples_split': 2, 'max_features': 0.75, 'min_samples_leaf': 5, 'criterion': 'absolute_error', 'max_depth': 15, 'min_weight_fraction_leaf': 0.0, 'max_leaf_nodes': 300, 'bootstrap': False, 'ccp_alpha': 0.01}. Best is trial 3488 with value: 0.05528345733671649.
[I 2025-04-16 02:04:55,685] Trial 3769 finished with value: -12.36758181076548 and parameters: {'n_estimators': 687, 'min_samples_split': 9, 'max_features': 0.7000000000000001, 'min_samples_leaf': 3, 'criterion': 'absolute_error', 'max_depth': 15, 'min_weight_fraction_leaf': 0.0, 'max_leaf_nodes': 300, 'bootstrap': False, 'ccp_alpha': 0.0}. Best is trial 3488 with value: 0.05528345733671649.
[I 2025-04-16 02:04:56,607] Trial 3770 finished with value: -17.528986382274873 and parameters: {'n_estimators': 511, 'min_samples_split': 5, 'max_features': 0.77, 'min_samples_leaf': 1, 'criterion': 'friedman_mse', 'max_depth': 15, 'min_weight_fraction_leaf': 0.0, 'max_leaf_nodes': 300, 'bootstrap': False, 'ccp_alpha': 0.015}. Best is trial 3488 with value: 0.05528345733671649.
[I 2025-04-16 02:04:57,429] Trial 3771 finished with value: -0.1936417107583833 and parameters: {'n_estimators': 302, 'min_samples_split': 2, 'max_features': 0.68, 'min_samples_leaf': 5, 'criterion': 'absolute_error', 'max_depth': 15, 'min_weight_fraction_leaf': 0.0, 'max_leaf_nodes': 300, 'bootstrap': False, 'ccp_alpha': 0.027}. Best is trial 3488 with value: 0.05528345733671649.
[I 2025-04-16 02:04:58,653] Trial 3772 finished with value: -0.1936417107583833 and parameters: {'n_estimators': 840, 'min_samples_split': 9, 'max_features': 0.73, 'min_samples_leaf': 3, 'criterion': 'absolute_error', 'max_depth': 15, 'min_weight_fraction_leaf': 0.0, 'max_leaf_nodes': 300, 'bootstrap': False, 'ccp_alpha': 0.132}. Best is trial 3488 with value: 0.05528345733671649.
[I 2025-04-16 02:04:59,719] Trial 3773 finished with value: 0.03252667415536688 and parameters: {'n_estimators': 664, 'min_samples_split': 6, 'max_features': 0.7100000000000001, 'min_samples_leaf': 1, 'criterion': 'absolute_error', 'max_depth': 15, 'min_weight_fraction_leaf': 0.0, 'max_leaf_nodes': 300, 'bootstrap': False, 'ccp_alpha': 0.005}. Best is trial 3488 with value: 0.05528345733671649.
[I 2025-04-16 02:05:01,117] Trial 3774 finished with value: -0.1936417107583833 and parameters: {'n_estimators': 1026, 'min_samples_split': 2, 'max_features': 0.74, 'min_samples_leaf': 4, 'criterion': 'absolute_error', 'max_depth': 15, 'min_weight_fraction_leaf': 0.0, 'max_leaf_nodes': 300, 'bootstrap': False, 'ccp_alpha': 0.01}. Best is trial 3488 with value: 0.05528345733671649.
[I 2025-04-16 02:05:01,925] Trial 3775 finished with value: -0.1936417107583833 and parameters: {'n_estimators': 316, 'min_samples_split': 6, 'max_features': 0.79, 'min_samples_leaf': 1, 'criterion': 'absolute_error', 'max_depth': 15, 'min_weight_fraction_leaf': 0.0, 'max_leaf_nodes': 300, 'bootstrap': False, 'ccp_alpha': 0.021}. Best is trial 3488 with value: 0.05528345733671649.
[I 2025-04-16 02:05:02,809] Trial 3776 finished with value: -0.1936417107583833 and parameters: {'n_estimators': 473, 'min_samples_split': 59, 'max_features': 0.77, 'min_samples_leaf': 3, 'criterion': 'absolute_error', 'max_depth': 15, 'min_weight_fraction_leaf': 0.0, 'max_leaf_nodes': 300, 'bootstrap': False, 'ccp_alpha': 0.005}. Best is trial 3488 with value: 0.05528345733671649.
[I 2025-04-16 02:05:03,448] Trial 3777 finished with value: -11.719266401123294 and parameters: {'n_estimators': 171, 'min_samples_split': 9, 'max_features': 0.81, 'min_samples_leaf': 5, 'criterion': 'absolute_error', 'max_depth': 15, 'min_weight_fraction_leaf': 0.0, 'max_leaf_nodes': 300, 'bootstrap': False, 'ccp_alpha': 0.0}. Best is trial 3488 with value: 0.05528345733671649.
[I 2025-04-16 02:05:04,516] Trial 3778 finished with value: -17.528986382274866 and parameters: {'n_estimators': 642, 'min_samples_split': 2, 'max_features': 0.75, 'min_samples_leaf': 1, 'criterion': 'squared_error', 'max_depth': 15, 'min_weight_fraction_leaf': 0.0, 'max_leaf_nodes': 300, 'bootstrap': False, 'ccp_alpha': 0.012}. Best is trial 3488 with value: 0.05528345733671649.
[I 2025-04-16 02:05:05,759] Trial 3779 finished with value: 0.01819616676153508 and parameters: {'n_estimators': 878, 'min_samples_split': 6, 'max_features': 0.72, 'min_samples_leaf': 3, 'criterion': 'absolute_error', 'max_depth': 15, 'min_weight_fraction_leaf': 0.0, 'max_leaf_nodes': 300, 'bootstrap': False, 'ccp_alpha': 0.005}. Best is trial 3488 with value: 0.05528345733671649.
[I 2025-04-16 02:05:06,691] Trial 3780 finished with value: -0.1936417107583833 and parameters: {'n_estimators': 454, 'min_samples_split': 9, 'max_features': 0.68, 'min_samples_leaf': 5, 'criterion': 'absolute_error', 'max_depth': 15, 'min_weight_fraction_leaf': 0.0, 'max_leaf_nodes': 300, 'bootstrap': False, 'ccp_alpha': 0.018000000000000002}. Best is trial 3488 with value: 0.05528345733671649.
[I 2025-04-16 02:05:07,347] Trial 3781 finished with value: -0.1936417107583833 and parameters: {'n_estimators': 166, 'min_samples_split': 2, 'max_features': 0.62, 'min_samples_leaf': 1, 'criterion': 'absolute_error', 'max_depth': 15, 'min_weight_fraction_leaf': 0.0, 'max_leaf_nodes': 300, 'bootstrap': False, 'ccp_alpha': 0.01}. Best is trial 3488 with value: 0.05528345733671649.
[I 2025-04-16 02:05:08,664] Trial 3782 finished with value: -14.517159503370882 and parameters: {'n_estimators': 1094, 'min_samples_split': 5, 'max_features': 0.7000000000000001, 'min_samples_leaf': 3, 'criterion': 'absolute_error', 'max_depth': 15, 'min_weight_fraction_leaf': 0.0, 'max_leaf_nodes': 300, 'bootstrap': False, 'ccp_alpha': 0.0}. Best is trial 3488 with value: 0.05528345733671649.
[I 2025-04-16 02:05:09,831] Trial 3783 finished with value: -0.1936417107583833 and parameters: {'n_estimators': 711, 'min_samples_split': 9, 'max_features': 0.74, 'min_samples_leaf': 1, 'criterion': 'absolute_error', 'max_depth': 15, 'min_weight_fraction_leaf': 0.0, 'max_leaf_nodes': 300, 'bootstrap': False, 'ccp_alpha': 0.015}. Best is trial 3488 with value: 0.05528345733671649.
[I 2025-04-16 02:05:10,666] Trial 3784 finished with value: -0.1936417107583833 and parameters: {'n_estimators': 349, 'min_samples_split': 5, 'max_features': 0.77, 'min_samples_leaf': 5, 'criterion': 'absolute_error', 'max_depth': 15, 'min_weight_fraction_leaf': 0.0, 'max_leaf_nodes': 300, 'bootstrap': False, 'ccp_alpha': 0.006}. Best is trial 3488 with value: 0.05528345733671649.
[I 2025-04-16 02:05:11,190] Trial 3785 finished with value: -18.775122345317406 and parameters: {'n_estimators': 10, 'min_samples_split': 2, 'max_features': 0.73, 'min_samples_leaf': 3, 'criterion': 'poisson', 'max_depth': 15, 'min_weight_fraction_leaf': 0.0, 'max_leaf_nodes': 300, 'bootstrap': False, 'ccp_alpha': 0.01}. Best is trial 3488 with value: 0.05528345733671649.
[I 2025-04-16 02:05:12,188] Trial 3786 finished with value: -0.1936417107583833 and parameters: {'n_estimators': 587, 'min_samples_split': 93, 'max_features': 0.79, 'min_samples_leaf': 1, 'criterion': 'absolute_error', 'max_depth': 15, 'min_weight_fraction_leaf': 0.0, 'max_leaf_nodes': 300, 'bootstrap': False, 'ccp_alpha': 0.005}. Best is trial 3488 with value: 0.05528345733671649.
[I 2025-04-16 02:05:13,455] Trial 3787 finished with value: -0.1936417107583833 and parameters: {'n_estimators': 874, 'min_samples_split': 9, 'max_features': 0.75, 'min_samples_leaf': 3, 'criterion': 'absolute_error', 'max_depth': 15, 'min_weight_fraction_leaf': 0.0, 'max_leaf_nodes': 300, 'bootstrap': False, 'ccp_alpha': 0.021}. Best is trial 3488 with value: 0.05528345733671649.
[I 2025-04-16 02:05:14,302] Trial 3788 finished with value: -0.1936417107583833 and parameters: {'n_estimators': 351, 'min_samples_split': 5, 'max_features': 0.65, 'min_samples_leaf': 5, 'criterion': 'absolute_error', 'max_depth': 15, 'min_weight_fraction_leaf': 0.0, 'max_leaf_nodes': 300, 'bootstrap': False, 'ccp_alpha': 0.014}. Best is trial 3488 with value: 0.05528345733671649.
