[I 2025-04-16 00:18:47,062] Trial 1382 finished with value: -0.1805111979456146 and parameters: {'n_estimators': 4795, 'min_samples_split': 13, 'max_features': 1.0, 'min_samples_leaf': 7, 'criterion': 'absolute_error', 'max_depth': 60, 'min_weight_fraction_leaf': 0.01, 'max_leaf_nodes': 150, 'bootstrap': True, 'ccp_alpha': 0.027, 'max_samples': 0.5}. Best is trial 1359 with value: -0.17085383187140404.
[I 2025-04-16 00:18:52,399] Trial 1383 finished with value: -1.3885917970230153 and parameters: {'n_estimators': 4350, 'min_samples_split': 2, 'max_features': 0.97, 'min_samples_leaf': 2, 'criterion': 'absolute_error', 'max_depth': 60, 'min_weight_fraction_leaf': 0.01, 'max_leaf_nodes': 150, 'bootstrap': True, 'ccp_alpha': 0.013000000000000001, 'max_samples': 0.5}. Best is trial 1359 with value: -0.17085383187140404.
[I 2025-04-16 00:18:58,246] Trial 1384 finished with value: -0.18870545354176743 and parameters: {'n_estimators': 4695, 'min_samples_split': 8, 'max_features': 1.0, 'min_samples_leaf': 5, 'criterion': 'absolute_error', 'max_depth': 60, 'min_weight_fraction_leaf': 0.01, 'max_leaf_nodes': 150, 'bootstrap': True, 'ccp_alpha': 0.019, 'max_samples': 0.5}. Best is trial 1359 with value: -0.17085383187140404.
[I 2025-04-16 00:19:03,681] Trial 1385 finished with value: -0.18025548701052774 and parameters: {'n_estimators': 4464, 'min_samples_split': 13, 'max_features': 0.97, 'min_samples_leaf': 8, 'criterion': 'absolute_error', 'max_depth': 60, 'min_weight_fraction_leaf': 0.01, 'max_leaf_nodes': 150, 'bootstrap': True, 'ccp_alpha': 0.024, 'max_samples': 0.5}. Best is trial 1359 with value: -0.17085383187140404.
[I 2025-04-16 00:19:08,827] Trial 1386 finished with value: -0.1812202104794926 and parameters: {'n_estimators': 4479, 'min_samples_split': 13, 'max_features': 0.97, 'min_samples_leaf': 8, 'criterion': 'absolute_error', 'max_depth': 60, 'min_weight_fraction_leaf': 0.01, 'max_leaf_nodes': 150, 'bootstrap': True, 'ccp_alpha': 0.028, 'max_samples': 0.5}. Best is trial 1359 with value: -0.17085383187140404.
[I 2025-04-16 00:19:14,975] Trial 1387 finished with value: -0.18319131201376265 and parameters: {'n_estimators': 5189, 'min_samples_split': 6, 'max_features': 0.98, 'min_samples_leaf': 10, 'criterion': 'absolute_error', 'max_depth': 60, 'min_weight_fraction_leaf': 0.01, 'max_leaf_nodes': 150, 'bootstrap': True, 'ccp_alpha': 0.022, 'max_samples': 0.5}. Best is trial 1359 with value: -0.17085383187140404.
[I 2025-04-16 00:19:20,918] Trial 1388 finished with value: -0.1787311780745883 and parameters: {'n_estimators': 4805, 'min_samples_split': 13, 'max_features': 0.97, 'min_samples_leaf': 7, 'criterion': 'absolute_error', 'max_depth': 60, 'min_weight_fraction_leaf': 0.01, 'max_leaf_nodes': 150, 'bootstrap': True, 'ccp_alpha': 0.011, 'max_samples': 0.5}. Best is trial 1359 with value: -0.17085383187140404.
[I 2025-04-16 00:19:26,915] Trial 1389 finished with value: -0.2138803572298164 and parameters: {'n_estimators': 4755, 'min_samples_split': 10, 'max_features': 0.97, 'min_samples_leaf': 7, 'criterion': 'absolute_error', 'max_depth': 60, 'min_weight_fraction_leaf': 0.01, 'max_leaf_nodes': 150, 'bootstrap': True, 'ccp_alpha': 0.013000000000000001, 'max_samples': None}. Best is trial 1359 with value: -0.17085383187140404.
[I 2025-04-16 00:19:32,498] Trial 1390 finished with value: -0.18343441229161347 and parameters: {'n_estimators': 4994, 'min_samples_split': 14, 'max_features': 1.0, 'min_samples_leaf': 11, 'criterion': 'absolute_error', 'max_depth': 60, 'min_weight_fraction_leaf': 0.01, 'max_leaf_nodes': 150, 'bootstrap': True, 'ccp_alpha': 0.008, 'max_samples': 0.5}. Best is trial 1359 with value: -0.17085383187140404.
[I 2025-04-16 00:19:37,882] Trial 1391 finished with value: -0.198794675993329 and parameters: {'n_estimators': 4282, 'min_samples_split': 5, 'max_features': 0.97, 'min_samples_leaf': 5, 'criterion': 'absolute_error', 'max_depth': 60, 'min_weight_fraction_leaf': 0.01, 'max_leaf_nodes': 150, 'bootstrap': True, 'ccp_alpha': 0.017, 'max_samples': 0.5}. Best is trial 1359 with value: -0.17085383187140404.
[I 2025-04-16 00:19:43,275] Trial 1392 finished with value: -17.74415000355168 and parameters: {'n_estimators': 4535, 'min_samples_split': 9, 'max_features': 0.98, 'min_samples_leaf': 8, 'criterion': 'friedman_mse', 'max_depth': 60, 'min_weight_fraction_leaf': 0.01, 'max_leaf_nodes': 150, 'bootstrap': True, 'ccp_alpha': 0.024, 'max_samples': 0.5}. Best is trial 1359 with value: -0.17085383187140404.
[I 2025-04-16 00:19:48,812] Trial 1393 finished with value: -1.5637484367639172 and parameters: {'n_estimators': 4759, 'min_samples_split': 14, 'max_features': 1.0, 'min_samples_leaf': 3, 'criterion': 'absolute_error', 'max_depth': 60, 'min_weight_fraction_leaf': 0.01, 'max_leaf_nodes': 150, 'bootstrap': True, 'ccp_alpha': 0.011, 'max_samples': 0.5}. Best is trial 1359 with value: -0.17085383187140404.
[I 2025-04-16 00:19:54,145] Trial 1394 finished with value: -0.17395397300342638 and parameters: {'n_estimators': 4245, 'min_samples_split': 6, 'max_features': 0.97, 'min_samples_leaf': 6, 'criterion': 'absolute_error', 'max_depth': 60, 'min_weight_fraction_leaf': 0.01, 'max_leaf_nodes': 150, 'bootstrap': True, 'ccp_alpha': 0.017, 'max_samples': 0.5}. Best is trial 1359 with value: -0.17085383187140404.
[I 2025-04-16 00:19:59,648] Trial 1395 finished with value: -2.0622915937680286 and parameters: {'n_estimators': 4242, 'min_samples_split': 6, 'max_features': 0.97, 'min_samples_leaf': 6, 'criterion': 'absolute_error', 'max_depth': 60, 'min_weight_fraction_leaf': 0.01, 'max_leaf_nodes': 150, 'bootstrap': True, 'ccp_alpha': 0.005, 'max_samples': 1.0}. Best is trial 1359 with value: -0.17085383187140404.
[I 2025-04-16 00:20:03,639] Trial 1396 finished with value: -0.1936417107583833 and parameters: {'n_estimators': 4421, 'min_samples_split': 2, 'max_features': 0.98, 'min_samples_leaf': 4, 'criterion': 'absolute_error', 'max_depth': 60, 'min_weight_fraction_leaf': 0.01, 'max_leaf_nodes': 150, 'bootstrap': False, 'ccp_alpha': 0.016}. Best is trial 1359 with value: -0.17085383187140404.
[I 2025-04-16 00:20:09,341] Trial 1397 finished with value: -0.18311443073981298 and parameters: {'n_estimators': 4637, 'min_samples_split': 10, 'max_features': 1.0, 'min_samples_leaf': 9, 'criterion': 'absolute_error', 'max_depth': 60, 'min_weight_fraction_leaf': 0.01, 'max_leaf_nodes': 150, 'bootstrap': True, 'ccp_alpha': 0.029, 'max_samples': 0.5}. Best is trial 1359 with value: -0.17085383187140404.
[I 2025-04-16 00:20:14,367] Trial 1398 finished with value: -0.18883810391200223 and parameters: {'n_estimators': 4132, 'min_samples_split': 6, 'max_features': 0.97, 'min_samples_leaf': 6, 'criterion': 'absolute_error', 'max_depth': 60, 'min_weight_fraction_leaf': 0.01, 'max_leaf_nodes': 150, 'bootstrap': True, 'ccp_alpha': 0.021, 'max_samples': 0.75}. Best is trial 1359 with value: -0.17085383187140404.
[I 2025-04-16 00:20:20,450] Trial 1399 finished with value: -0.17860578943275657 and parameters: {'n_estimators': 4914, 'min_samples_split': 13, 'max_features': 0.9600000000000001, 'min_samples_leaf': 7, 'criterion': 'absolute_error', 'max_depth': 60, 'min_weight_fraction_leaf': 0.01, 'max_leaf_nodes': 150, 'bootstrap': True, 'ccp_alpha': 0.011, 'max_samples': 0.5}. Best is trial 1359 with value: -0.17085383187140404.
[I 2025-04-16 00:20:26,933] Trial 1400 finished with value: -0.17946426948155855 and parameters: {'n_estimators': 5303, 'min_samples_split': 12, 'max_features': 0.9600000000000001, 'min_samples_leaf': 7, 'criterion': 'absolute_error', 'max_depth': 60, 'min_weight_fraction_leaf': 0.01, 'max_leaf_nodes': 150, 'bootstrap': True, 'ccp_alpha': 0.011, 'max_samples': 0.5}. Best is trial 1359 with value: -0.17085383187140404.
[I 2025-04-16 00:20:32,291] Trial 1401 finished with value: -17.700569016053297 and parameters: {'n_estimators': 5283, 'min_samples_split': 2, 'max_features': 0.9600000000000001, 'min_samples_leaf': 12, 'criterion': 'squared_error', 'max_depth': 60, 'min_weight_fraction_leaf': 0.01, 'max_leaf_nodes': 150, 'bootstrap': True, 'ccp_alpha': 0.01, 'max_samples': 0.5}. Best is trial 1359 with value: -0.17085383187140404.
[I 2025-04-16 00:20:38,162] Trial 1402 finished with value: -0.18066560872997023 and parameters: {'n_estimators': 5050, 'min_samples_split': 8, 'max_features': 0.97, 'min_samples_leaf': 10, 'criterion': 'absolute_error', 'max_depth': 60, 'min_weight_fraction_leaf': 0.01, 'max_leaf_nodes': 150, 'bootstrap': True, 'ccp_alpha': 0.003, 'max_samples': 0.5}. Best is trial 1359 with value: -0.17085383187140404.
[I 2025-04-16 00:20:43,420] Trial 1403 finished with value: -0.37629716882318787 and parameters: {'n_estimators': 4374, 'min_samples_split': 10, 'max_features': 0.9600000000000001, 'min_samples_leaf': 4, 'criterion': 'absolute_error', 'max_depth': 60, 'min_weight_fraction_leaf': 0.01, 'max_leaf_nodes': 150, 'bootstrap': True, 'ccp_alpha': 0.015, 'max_samples': 0.5}. Best is trial 1359 with value: -0.17085383187140404.
[I 2025-04-16 00:20:49,565] Trial 1404 finished with value: -3.1409986045238845 and parameters: {'n_estimators': 5101, 'min_samples_split': 5, 'max_features': 0.98, 'min_samples_leaf': 1, 'criterion': 'absolute_error', 'max_depth': 60, 'min_weight_fraction_leaf': 0.01, 'max_leaf_nodes': 150, 'bootstrap': True, 'ccp_alpha': 0.01, 'max_samples': 0.5}. Best is trial 1359 with value: -0.17085383187140404.
[I 2025-04-16 00:20:56,280] Trial 1405 finished with value: -0.1776919496834517 and parameters: {'n_estimators': 5413, 'min_samples_split': 13, 'max_features': 0.9600000000000001, 'min_samples_leaf': 8, 'criterion': 'absolute_error', 'max_depth': 60, 'min_weight_fraction_leaf': 0.01, 'max_leaf_nodes': 150, 'bootstrap': True, 'ccp_alpha': 0.018000000000000002, 'max_samples': 0.5}. Best is trial 1359 with value: -0.17085383187140404.
[I 2025-04-16 00:21:02,410] Trial 1406 finished with value: -0.17830487062301584 and parameters: {'n_estimators': 5296, 'min_samples_split': 8, 'max_features': 0.9600000000000001, 'min_samples_leaf': 6, 'criterion': 'absolute_error', 'max_depth': 60, 'min_weight_fraction_leaf': 0.01, 'max_leaf_nodes': 150, 'bootstrap': True, 'ccp_alpha': 0.017, 'max_samples': 0.5}. Best is trial 1359 with value: -0.17085383187140404.
[I 2025-04-16 00:21:09,062] Trial 1407 finished with value: -2.7507220401858348 and parameters: {'n_estimators': 5333, 'min_samples_split': 2, 'max_features': 0.9600000000000001, 'min_samples_leaf': 4, 'criterion': 'absolute_error', 'max_depth': 60, 'min_weight_fraction_leaf': 0.01, 'max_leaf_nodes': 150, 'bootstrap': True, 'ccp_alpha': 0.005, 'max_samples': 0.5}. Best is trial 1359 with value: -0.17085383187140404.
[I 2025-04-16 00:21:15,979] Trial 1408 finished with value: -19.62984985997386 and parameters: {'n_estimators': 5353, 'min_samples_split': 6, 'max_features': 0.9600000000000001, 'min_samples_leaf': 6, 'criterion': 'poisson', 'max_depth': 60, 'min_weight_fraction_leaf': 0.01, 'max_leaf_nodes': 150, 'bootstrap': True, 'ccp_alpha': 0.016, 'max_samples': 0.5}. Best is trial 1359 with value: -0.17085383187140404.
[I 2025-04-16 00:21:22,671] Trial 1409 finished with value: -0.17977069266111192 and parameters: {'n_estimators': 5478, 'min_samples_split': 14, 'max_features': 1.0, 'min_samples_leaf': 9, 'criterion': 'absolute_error', 'max_depth': 60, 'min_weight_fraction_leaf': 0.01, 'max_leaf_nodes': 150, 'bootstrap': True, 'ccp_alpha': 0.011, 'max_samples': 0.5}. Best is trial 1359 with value: -0.17085383187140404.
[I 2025-04-16 00:21:28,840] Trial 1410 finished with value: -0.18259469575754336 and parameters: {'n_estimators': 5418, 'min_samples_split': 14, 'max_features': 0.98, 'min_samples_leaf': 10, 'criterion': 'absolute_error', 'max_depth': 60, 'min_weight_fraction_leaf': 0.01, 'max_leaf_nodes': 150, 'bootstrap': True, 'ccp_alpha': 0.011, 'max_samples': 0.5}. Best is trial 1359 with value: -0.17085383187140404.
[I 2025-04-16 00:21:35,390] Trial 1411 finished with value: -0.1744256200857967 and parameters: {'n_estimators': 5225, 'min_samples_split': 13, 'max_features': 0.9600000000000001, 'min_samples_leaf': 9, 'criterion': 'absolute_error', 'max_depth': 60, 'min_weight_fraction_leaf': 0.01, 'max_leaf_nodes': 150, 'bootstrap': True, 'ccp_alpha': 0.005, 'max_samples': 0.5}. Best is trial 1359 with value: -0.17085383187140404.
[I 2025-04-16 00:21:41,385] Trial 1412 finished with value: -0.1833823987044069 and parameters: {'n_estimators': 5599, 'min_samples_split': 14, 'max_features': 0.9600000000000001, 'min_samples_leaf': 11, 'criterion': 'absolute_error', 'max_depth': 60, 'min_weight_fraction_leaf': 0.01, 'max_leaf_nodes': 150, 'bootstrap': True, 'ccp_alpha': 0.0, 'max_samples': 0.5}. Best is trial 1359 with value: -0.17085383187140404.
[I 2025-04-16 00:21:47,723] Trial 1413 finished with value: -0.1836118111374065 and parameters: {'n_estimators': 5437, 'min_samples_split': 5, 'max_features': 0.9600000000000001, 'min_samples_leaf': 12, 'criterion': 'absolute_error', 'max_depth': 60, 'min_weight_fraction_leaf': 0.01, 'max_leaf_nodes': 150, 'bootstrap': True, 'ccp_alpha': 0.005, 'max_samples': 0.5}. Best is trial 1359 with value: -0.17085383187140404.
[I 2025-04-16 00:21:53,763] Trial 1414 finished with value: -0.16885873790889522 and parameters: {'n_estimators': 5231, 'min_samples_split': 10, 'max_features': 0.98, 'min_samples_leaf': 9, 'criterion': 'absolute_error', 'max_depth': 60, 'min_weight_fraction_leaf': 0.01, 'max_leaf_nodes': 150, 'bootstrap': True, 'ccp_alpha': 0.0, 'max_samples': 0.5}. Best is trial 1414 with value: -0.16885873790889522.
[I 2025-04-16 00:21:59,575] Trial 1415 finished with value: -0.2271053596830454 and parameters: {'n_estimators': 5152, 'min_samples_split': 14, 'max_features': 0.9600000000000001, 'min_samples_leaf': 9, 'criterion': 'absolute_error', 'max_depth': 60, 'min_weight_fraction_leaf': 0.01, 'max_leaf_nodes': 150, 'bootstrap': True, 'ccp_alpha': 0.007, 'max_samples': None}. Best is trial 1414 with value: -0.16885873790889522.
[I 2025-04-16 00:22:04,329] Trial 1416 finished with value: -8.841935536081357 and parameters: {'n_estimators': 5490, 'min_samples_split': 11, 'max_features': 0.98, 'min_samples_leaf': 9, 'criterion': 'absolute_error', 'max_depth': 60, 'min_weight_fraction_leaf': 0.01, 'max_leaf_nodes': 150, 'bootstrap': False, 'ccp_alpha': 0.001}. Best is trial 1414 with value: -0.16885873790889522.
[I 2025-04-16 00:22:10,010] Trial 1417 finished with value: -17.614187390840208 and parameters: {'n_estimators': 5630, 'min_samples_split': 5, 'max_features': 0.9600000000000001, 'min_samples_leaf': 12, 'criterion': 'friedman_mse', 'max_depth': 60, 'min_weight_fraction_leaf': 0.01, 'max_leaf_nodes': 150, 'bootstrap': True, 'ccp_alpha': 0.011, 'max_samples': 0.5}. Best is trial 1414 with value: -0.16885873790889522.
[I 2025-04-16 00:22:16,337] Trial 1418 finished with value: -2.948086100474895 and parameters: {'n_estimators': 5143, 'min_samples_split': 15, 'max_features': 0.9600000000000001, 'min_samples_leaf': 3, 'criterion': 'absolute_error', 'max_depth': 60, 'min_weight_fraction_leaf': 0.01, 'max_leaf_nodes': 150, 'bootstrap': True, 'ccp_alpha': 0.007, 'max_samples': 0.5}. Best is trial 1414 with value: -0.16885873790889522.
[I 2025-04-16 00:22:22,711] Trial 1419 finished with value: -0.25589116922387234 and parameters: {'n_estimators': 5326, 'min_samples_split': 2, 'max_features': 0.98, 'min_samples_leaf': 5, 'criterion': 'absolute_error', 'max_depth': 60, 'min_weight_fraction_leaf': 0.01, 'max_leaf_nodes': 150, 'bootstrap': True, 'ccp_alpha': 0.014, 'max_samples': 0.5}. Best is trial 1414 with value: -0.16885873790889522.
[I 2025-04-16 00:22:29,159] Trial 1420 finished with value: -0.16770904386563118 and parameters: {'n_estimators': 5519, 'min_samples_split': 10, 'max_features': 0.98, 'min_samples_leaf': 9, 'criterion': 'absolute_error', 'max_depth': 60, 'min_weight_fraction_leaf': 0.01, 'max_leaf_nodes': 150, 'bootstrap': True, 'ccp_alpha': 0.001, 'max_samples': 0.5}. Best is trial 1420 with value: -0.16770904386563118.
[I 2025-04-16 00:22:35,218] Trial 1421 finished with value: -0.18344611929776639 and parameters: {'n_estimators': 5743, 'min_samples_split': 9, 'max_features': 0.9600000000000001, 'min_samples_leaf': 11, 'criterion': 'absolute_error', 'max_depth': 60, 'min_weight_fraction_leaf': 0.01, 'max_leaf_nodes': 150, 'bootstrap': True, 'ccp_alpha': 0.0, 'max_samples': 0.5}. Best is trial 1420 with value: -0.16770904386563118.
[I 2025-04-16 00:22:41,367] Trial 1422 finished with value: -1.5617419958002086 and parameters: {'n_estimators': 4998, 'min_samples_split': 10, 'max_features': 0.98, 'min_samples_leaf': 5, 'criterion': 'absolute_error', 'max_depth': 60, 'min_weight_fraction_leaf': 0.01, 'max_leaf_nodes': 150, 'bootstrap': True, 'ccp_alpha': 0.006, 'max_samples': 1.0}. Best is trial 1420 with value: -0.16770904386563118.
[I 2025-04-16 00:22:47,161] Trial 1423 finished with value: -11.244951507859927 and parameters: {'n_estimators': 5130, 'min_samples_split': 6, 'max_features': 0.9600000000000001, 'min_samples_leaf': 2, 'criterion': 'absolute_error', 'max_depth': 60, 'min_weight_fraction_leaf': 0.01, 'max_leaf_nodes': 150, 'bootstrap': True, 'ccp_alpha': 0.0, 'max_samples': 0.5}. Best is trial 1420 with value: -0.16770904386563118.
[I 2025-04-16 00:22:53,133] Trial 1424 finished with value: -0.1827395361883266 and parameters: {'n_estimators': 5032, 'min_samples_split': 11, 'max_features': 0.98, 'min_samples_leaf': 9, 'criterion': 'absolute_error', 'max_depth': 60, 'min_weight_fraction_leaf': 0.01, 'max_leaf_nodes': 150, 'bootstrap': True, 'ccp_alpha': 0.016, 'max_samples': 0.5}. Best is trial 1420 with value: -0.16770904386563118.
[I 2025-04-16 00:22:59,388] Trial 1425 finished with value: -1.487969300854952 and parameters: {'n_estimators': 5514, 'min_samples_split': 2, 'max_features': 0.98, 'min_samples_leaf': 5, 'criterion': 'absolute_error', 'max_depth': 60, 'min_weight_fraction_leaf': 0.01, 'max_leaf_nodes': 150, 'bootstrap': True, 'ccp_alpha': 0.007, 'max_samples': 0.75}. Best is trial 1420 with value: -0.16770904386563118.
[I 2025-04-16 00:23:05,892] Trial 1426 finished with value: -0.17674942334818544 and parameters: {'n_estimators': 5210, 'min_samples_split': 6, 'max_features': 0.9600000000000001, 'min_samples_leaf': 8, 'criterion': 'absolute_error', 'max_depth': 60, 'min_weight_fraction_leaf': 0.01, 'max_leaf_nodes': 150, 'bootstrap': True, 'ccp_alpha': 0.017, 'max_samples': 0.5}. Best is trial 1420 with value: -0.16770904386563118.
[I 2025-04-16 00:23:11,837] Trial 1427 finished with value: -0.18358493722629624 and parameters: {'n_estimators': 5258, 'min_samples_split': 6, 'max_features': 0.98, 'min_samples_leaf': 12, 'criterion': 'absolute_error', 'max_depth': 60, 'min_weight_fraction_leaf': 0.01, 'max_leaf_nodes': 150, 'bootstrap': True, 'ccp_alpha': 0.017, 'max_samples': 0.5}. Best is trial 1420 with value: -0.16770904386563118.
[I 2025-04-16 00:23:16,830] Trial 1428 finished with value: -0.18229037228945208 and parameters: {'n_estimators': 4229, 'min_samples_split': 6, 'max_features': 0.9600000000000001, 'min_samples_leaf': 9, 'criterion': 'absolute_error', 'max_depth': 60, 'min_weight_fraction_leaf': 0.01, 'max_leaf_nodes': 150, 'bootstrap': True, 'ccp_alpha': 0.017, 'max_samples': 0.5}. Best is trial 1420 with value: -0.16770904386563118.
[I 2025-04-16 00:23:22,267] Trial 1429 finished with value: -0.1738657866922702 and parameters: {'n_estimators': 4839, 'min_samples_split': 2, 'max_features': 1.0, 'min_samples_leaf': 10, 'criterion': 'absolute_error', 'max_depth': 60, 'min_weight_fraction_leaf': 0.01, 'max_leaf_nodes': 150, 'bootstrap': True, 'ccp_alpha': 0.0, 'max_samples': 0.5}. Best is trial 1420 with value: -0.16770904386563118.
[I 2025-04-16 00:23:27,911] Trial 1430 finished with value: -0.1836667790231583 and parameters: {'n_estimators': 4958, 'min_samples_split': 4, 'max_features': 0.98, 'min_samples_leaf': 11, 'criterion': 'absolute_error', 'max_depth': 60, 'min_weight_fraction_leaf': 0.01, 'max_leaf_nodes': 150, 'bootstrap': True, 'ccp_alpha': 0.004, 'max_samples': 0.5}. Best is trial 1420 with value: -0.16770904386563118.
[I 2025-04-16 00:23:33,934] Trial 1431 finished with value: -18.84056770595304 and parameters: {'n_estimators': 4925, 'min_samples_split': 2, 'max_features': 0.9600000000000001, 'min_samples_leaf': 9, 'criterion': 'squared_error', 'max_depth': 60, 'min_weight_fraction_leaf': 0.01, 'max_leaf_nodes': 150, 'bootstrap': True, 'ccp_alpha': 0.001, 'max_samples': 0.5}. Best is trial 1420 with value: -0.16770904386563118.
[I 2025-04-16 00:23:39,174] Trial 1432 finished with value: -17.738720992805597 and parameters: {'n_estimators': 5185, 'min_samples_split': 2, 'max_features': 0.98, 'min_samples_leaf': 12, 'criterion': 'poisson', 'max_depth': 60, 'min_weight_fraction_leaf': 0.01, 'max_leaf_nodes': 150, 'bootstrap': True, 'ccp_alpha': 0.007, 'max_samples': 0.5}. Best is trial 1420 with value: -0.16770904386563118.
[I 2025-04-16 00:23:44,409] Trial 1433 finished with value: -0.17273908485442271 and parameters: {'n_estimators': 4071, 'min_samples_split': 9, 'max_features': 0.9500000000000001, 'min_samples_leaf': 8, 'criterion': 'absolute_error', 'max_depth': 60, 'min_weight_fraction_leaf': 0.01, 'max_leaf_nodes': 150, 'bootstrap': True, 'ccp_alpha': 0.01, 'max_samples': 0.5}. Best is trial 1420 with value: -0.16770904386563118.
[I 2025-04-16 00:23:50,869] Trial 1434 finished with value: -0.18281727896531272 and parameters: {'n_estimators': 5795, 'min_samples_split': 10, 'max_features': 0.9500000000000001, 'min_samples_leaf': 10, 'criterion': 'absolute_error', 'max_depth': 60, 'min_weight_fraction_leaf': 0.01, 'max_leaf_nodes': 150, 'bootstrap': True, 'ccp_alpha': 0.01, 'max_samples': 0.5}. Best is trial 1420 with value: -0.16770904386563118.
