[I 2025-04-16 02:26:48,702] Trial 4854 finished with value: -17.52898638227491 and parameters: {'n_estimators': 744, 'min_samples_split': 6, 'max_features': 0.75, 'min_samples_leaf': 1, 'criterion': 'friedman_mse', 'max_depth': 15, 'min_weight_fraction_leaf': 0.0, 'max_leaf_nodes': 300, 'bootstrap': False, 'ccp_alpha': 0.01}. Best is trial 4539 with value: 0.19155472534689352.
[I 2025-04-16 02:26:50,202] Trial 4855 finished with value: -10.587456460340757 and parameters: {'n_estimators': 1091, 'min_samples_split': 9, 'max_features': 0.67, 'min_samples_leaf': 3, 'criterion': 'absolute_error', 'max_depth': None, 'min_weight_fraction_leaf': 0.0, 'max_leaf_nodes': None, 'bootstrap': False, 'ccp_alpha': 0.0}. Best is trial 4539 with value: 0.19155472534689352.
[I 2025-04-16 02:26:51,014] Trial 4856 finished with value: -0.1936417107583833 and parameters: {'n_estimators': 193, 'min_samples_split': 2, 'max_features': 0.78, 'min_samples_leaf': 1, 'criterion': 'absolute_error', 'max_depth': 15, 'min_weight_fraction_leaf': 0.0, 'max_leaf_nodes': 300, 'bootstrap': False, 'ccp_alpha': 0.014}. Best is trial 4539 with value: 0.19155472534689352.
[I 2025-04-16 02:26:52,158] Trial 4857 finished with value: -0.1936417107583833 and parameters: {'n_estimators': 579, 'min_samples_split': 14, 'max_features': 0.6900000000000001, 'min_samples_leaf': 5, 'criterion': 'absolute_error', 'max_depth': 15, 'min_weight_fraction_leaf': 0.0, 'max_leaf_nodes': 300, 'bootstrap': False, 'ccp_alpha': 0.006}. Best is trial 4539 with value: 0.19155472534689352.
[I 2025-04-16 02:26:53,093] Trial 4858 finished with value: -0.1936417107583833 and parameters: {'n_estimators': 361, 'min_samples_split': 6, 'max_features': 0.73, 'min_samples_leaf': 3, 'criterion': 'absolute_error', 'max_depth': 15, 'min_weight_fraction_leaf': 0.0, 'max_leaf_nodes': 300, 'bootstrap': False, 'ccp_alpha': 0.01}. Best is trial 4539 with value: 0.19155472534689352.
[I 2025-04-16 02:26:54,523] Trial 4859 finished with value: -0.1936417107583833 and parameters: {'n_estimators': 907, 'min_samples_split': 9, 'max_features': 0.8, 'min_samples_leaf': 1, 'criterion': 'absolute_error', 'max_depth': 15, 'min_weight_fraction_leaf': 0.0, 'max_leaf_nodes': 10, 'bootstrap': False, 'ccp_alpha': 0.017}. Best is trial 4539 with value: 0.19155472534689352.
[I 2025-04-16 02:26:55,756] Trial 4860 finished with value: -0.11374753016567818 and parameters: {'n_estimators': 674, 'min_samples_split': 2, 'max_features': 0.76, 'min_samples_leaf': 5, 'criterion': 'absolute_error', 'max_depth': 15, 'min_weight_fraction_leaf': 0.0, 'max_leaf_nodes': 300, 'bootstrap': False, 'ccp_alpha': 0.005}. Best is trial 4539 with value: 0.19155472534689352.
[I 2025-04-16 02:26:56,511] Trial 4861 finished with value: -0.1936417107583833 and parameters: {'n_estimators': 159, 'min_samples_split': 12, 'max_features': 0.8300000000000001, 'min_samples_leaf': 3, 'criterion': 'absolute_error', 'max_depth': None, 'min_weight_fraction_leaf': 0.0, 'max_leaf_nodes': 300, 'bootstrap': False, 'ccp_alpha': 0.027}. Best is trial 4539 with value: 0.19155472534689352.
[I 2025-04-16 02:26:57,465] Trial 4862 finished with value: -6.557817369871553 and parameters: {'n_estimators': 427, 'min_samples_split': 6, 'max_features': 0.7100000000000001, 'min_samples_leaf': 7, 'criterion': 'absolute_error', 'max_depth': 15, 'min_weight_fraction_leaf': 0.0, 'max_leaf_nodes': 300, 'bootstrap': False, 'ccp_alpha': 0.0}. Best is trial 4539 with value: 0.19155472534689352.
[I 2025-04-16 02:26:58,809] Trial 4863 finished with value: -0.1936417107583833 and parameters: {'n_estimators': 839, 'min_samples_split': 5, 'max_features': 0.74, 'min_samples_leaf': 1, 'criterion': 'absolute_error', 'max_depth': 15, 'min_weight_fraction_leaf': 0.0, 'max_leaf_nodes': 300, 'bootstrap': False, 'ccp_alpha': 0.01}. Best is trial 4539 with value: 0.19155472534689352.
[I 2025-04-16 02:27:00,458] Trial 4864 finished with value: -0.24844034493492534 and parameters: {'n_estimators': 1148, 'min_samples_split': 9, 'max_features': 0.78, 'min_samples_leaf': 3, 'criterion': 'absolute_error', 'max_depth': 15, 'min_weight_fraction_leaf': 0.0, 'max_leaf_nodes': 10, 'bootstrap': False, 'ccp_alpha': 0.005}. Best is trial 4539 with value: 0.19155472534689352.
[I 2025-04-16 02:27:01,527] Trial 4865 finished with value: -17.528986382274873 and parameters: {'n_estimators': 564, 'min_samples_split': 2, 'max_features': 0.81, 'min_samples_leaf': 5, 'criterion': 'squared_error', 'max_depth': 15, 'min_weight_fraction_leaf': 0.0, 'max_leaf_nodes': None, 'bootstrap': False, 'ccp_alpha': 0.015}. Best is trial 4539 with value: 0.19155472534689352.
[I 2025-04-16 02:27:02,396] Trial 4866 finished with value: -7.341557840496854 and parameters: {'n_estimators': 304, 'min_samples_split': 15, 'max_features': 0.65, 'min_samples_leaf': 1, 'criterion': 'absolute_error', 'max_depth': 15, 'min_weight_fraction_leaf': 0.0, 'max_leaf_nodes': 300, 'bootstrap': False, 'ccp_alpha': 0.0}. Best is trial 4539 with value: 0.19155472534689352.
[I 2025-04-16 02:27:03,167] Trial 4867 finished with value: -0.1936417107583833 and parameters: {'n_estimators': 174, 'min_samples_split': 6, 'max_features': 0.76, 'min_samples_leaf': 3, 'criterion': 'absolute_error', 'max_depth': 15, 'min_weight_fraction_leaf': 0.0, 'max_leaf_nodes': 300, 'bootstrap': False, 'ccp_alpha': 0.022}. Best is trial 4539 with value: 0.19155472534689352.
[I 2025-04-16 02:27:04,400] Trial 4868 finished with value: -15.976972211193152 and parameters: {'n_estimators': 758, 'min_samples_split': 9, 'max_features': 0.72, 'min_samples_leaf': 1, 'criterion': 'poisson', 'max_depth': None, 'min_weight_fraction_leaf': 0.0, 'max_leaf_nodes': 300, 'bootstrap': False, 'ccp_alpha': 0.01}. Best is trial 4539 with value: 0.19155472534689352.
[I 2025-04-16 02:27:05,412] Trial 4869 finished with value: -0.1936417107583833 and parameters: {'n_estimators': 465, 'min_samples_split': 2, 'max_features': 0.7000000000000001, 'min_samples_leaf': 5, 'criterion': 'absolute_error', 'max_depth': 15, 'min_weight_fraction_leaf': 0.0, 'max_leaf_nodes': 300, 'bootstrap': False, 'ccp_alpha': 0.197}. Best is trial 4539 with value: 0.19155472534689352.
[I 2025-04-16 02:27:06,819] Trial 4870 finished with value: -0.04776569576407319 and parameters: {'n_estimators': 938, 'min_samples_split': 11, 'max_features': 0.8400000000000001, 'min_samples_leaf': 3, 'criterion': 'absolute_error', 'max_depth': 45, 'min_weight_fraction_leaf': 0.0, 'max_leaf_nodes': 10, 'bootstrap': False, 'ccp_alpha': 0.005}. Best is trial 4539 with value: 0.19155472534689352.
[I 2025-04-16 02:27:07,942] Trial 4871 finished with value: -0.1936417107583833 and parameters: {'n_estimators': 626, 'min_samples_split': 5, 'max_features': 0.74, 'min_samples_leaf': 1, 'criterion': 'absolute_error', 'max_depth': 15, 'min_weight_fraction_leaf': 0.08, 'max_leaf_nodes': 300, 'bootstrap': False, 'ccp_alpha': 0.015}. Best is trial 4539 with value: 0.19155472534689352.
[I 2025-04-16 02:27:08,950] Trial 4872 finished with value: -0.11715824288130047 and parameters: {'n_estimators': 304, 'min_samples_split': 2, 'max_features': 0.78, 'min_samples_leaf': 6, 'criterion': 'absolute_error', 'max_depth': 15, 'min_weight_fraction_leaf': 0.0, 'max_leaf_nodes': 300, 'bootstrap': False, 'ccp_alpha': 0.005}. Best is trial 4539 with value: 0.19155472534689352.
[I 2025-04-16 02:27:09,976] Trial 4873 finished with value: -0.1936417107583833 and parameters: {'n_estimators': 471, 'min_samples_split': 6, 'max_features': 0.79, 'min_samples_leaf': 3, 'criterion': 'absolute_error', 'max_depth': 20, 'min_weight_fraction_leaf': 0.0, 'max_leaf_nodes': None, 'bootstrap': False, 'ccp_alpha': 0.01}. Best is trial 4539 with value: 0.19155472534689352.
[I 2025-04-16 02:27:11,486] Trial 4874 finished with value: -15.70806290349121 and parameters: {'n_estimators': 1120, 'min_samples_split': 11, 'max_features': 0.81, 'min_samples_leaf': 1, 'criterion': 'absolute_error', 'max_depth': 15, 'min_weight_fraction_leaf': 0.0, 'max_leaf_nodes': 300, 'bootstrap': False, 'ccp_alpha': 0.0}. Best is trial 4539 with value: 0.19155472534689352.
[I 2025-04-16 02:27:19,491] Trial 4875 finished with value: -0.1936417107583833 and parameters: {'n_estimators': 8106, 'min_samples_split': 6, 'max_features': 0.75, 'min_samples_leaf': 4, 'criterion': 'absolute_error', 'max_depth': 15, 'min_weight_fraction_leaf': 0.0, 'max_leaf_nodes': 300, 'bootstrap': False, 'ccp_alpha': 0.17500000000000002}. Best is trial 4539 with value: 0.19155472534689352.
[I 2025-04-16 02:27:20,114] Trial 4876 finished with value: -0.1936417107583833 and parameters: {'n_estimators': 10, 'min_samples_split': 2, 'max_features': 0.72, 'min_samples_leaf': 7, 'criterion': 'absolute_error', 'max_depth': 15, 'min_weight_fraction_leaf': 0.06, 'max_leaf_nodes': 10, 'bootstrap': False, 'ccp_alpha': 0.04}. Best is trial 4539 with value: 0.19155472534689352.
[I 2025-04-16 02:27:21,356] Trial 4877 finished with value: -17.52898638227507 and parameters: {'n_estimators': 791, 'min_samples_split': 9, 'max_features': 0.68, 'min_samples_leaf': 3, 'criterion': 'friedman_mse', 'max_depth': None, 'min_weight_fraction_leaf': 0.0, 'max_leaf_nodes': 300, 'bootstrap': False, 'ccp_alpha': 0.23500000000000001}. Best is trial 4539 with value: 0.19155472534689352.
[I 2025-04-16 02:27:22,472] Trial 4878 finished with value: -0.1936417107583833 and parameters: {'n_estimators': 638, 'min_samples_split': 15, 'max_features': 0.8300000000000001, 'min_samples_leaf': 1, 'criterion': 'absolute_error', 'max_depth': 15, 'min_weight_fraction_leaf': 0.0, 'max_leaf_nodes': 300, 'bootstrap': False, 'ccp_alpha': 0.019}. Best is trial 4539 with value: 0.19155472534689352.
[I 2025-04-16 02:27:24,496] Trial 4879 finished with value: -0.1936417107583833 and parameters: {'n_estimators': 1324, 'min_samples_split': 6, 'max_features': 0.76, 'min_samples_leaf': 5, 'criterion': 'absolute_error', 'max_depth': 10, 'min_weight_fraction_leaf': 0.0, 'max_leaf_nodes': 300, 'bootstrap': False, 'ccp_alpha': 0.01}. Best is trial 4539 with value: 0.19155472534689352.
[I 2025-04-16 02:27:25,278] Trial 4880 finished with value: 0.018149930801010773 and parameters: {'n_estimators': 173, 'min_samples_split': 2, 'max_features': 0.73, 'min_samples_leaf': 3, 'criterion': 'absolute_error', 'max_depth': 15, 'min_weight_fraction_leaf': 0.0, 'max_leaf_nodes': 300, 'bootstrap': False, 'ccp_alpha': 0.005}. Best is trial 4539 with value: 0.19155472534689352.
[I 2025-04-16 02:27:26,641] Trial 4881 finished with value: -0.1936417107583833 and parameters: {'n_estimators': 962, 'min_samples_split': 11, 'max_features': 0.8, 'min_samples_leaf': 1, 'criterion': 'absolute_error', 'max_depth': 15, 'min_weight_fraction_leaf': 0.0, 'max_leaf_nodes': 10, 'bootstrap': False, 'ccp_alpha': 0.014}. Best is trial 4539 with value: 0.19155472534689352.
[I 2025-04-16 02:27:27,573] Trial 4882 finished with value: -6.49549009794606 and parameters: {'n_estimators': 448, 'min_samples_split': 6, 'max_features': 0.7000000000000001, 'min_samples_leaf': 7, 'criterion': 'absolute_error', 'max_depth': 15, 'min_weight_fraction_leaf': 0.0, 'max_leaf_nodes': None, 'bootstrap': False, 'ccp_alpha': 0.0}. Best is trial 4539 with value: 0.19155472534689352.
[I 2025-04-16 02:27:28,817] Trial 4883 finished with value: -0.1936417107583833 and parameters: {'n_estimators': 721, 'min_samples_split': 9, 'max_features': 0.8200000000000001, 'min_samples_leaf': 4, 'criterion': 'absolute_error', 'max_depth': 15, 'min_weight_fraction_leaf': 0.0, 'max_leaf_nodes': 300, 'bootstrap': False, 'ccp_alpha': 0.006}. Best is trial 4539 with value: 0.19155472534689352.
[I 2025-04-16 02:27:29,714] Trial 4884 finished with value: -0.1936417107583833 and parameters: {'n_estimators': 288, 'min_samples_split': 5, 'max_features': 0.77, 'min_samples_leaf': 1, 'criterion': 'absolute_error', 'max_depth': None, 'min_weight_fraction_leaf': 0.0, 'max_leaf_nodes': 300, 'bootstrap': False, 'ccp_alpha': 0.02}. Best is trial 4539 with value: 0.19155472534689352.
[I 2025-04-16 02:27:30,790] Trial 4885 finished with value: -0.1936417107583833 and parameters: {'n_estimators': 553, 'min_samples_split': 2, 'max_features': 0.74, 'min_samples_leaf': 3, 'criterion': 'absolute_error', 'max_depth': 15, 'min_weight_fraction_leaf': 0.0, 'max_leaf_nodes': 300, 'bootstrap': False, 'ccp_alpha': 0.01}. Best is trial 4539 with value: 0.19155472534689352.
[I 2025-04-16 02:27:32,162] Trial 4886 finished with value: -17.528986382275466 and parameters: {'n_estimators': 923, 'min_samples_split': 14, 'max_features': 0.8400000000000001, 'min_samples_leaf': 5, 'criterion': 'squared_error', 'max_depth': 15, 'min_weight_fraction_leaf': 0.0, 'max_leaf_nodes': 300, 'bootstrap': False, 'ccp_alpha': 0.006}. Best is trial 4539 with value: 0.19155472534689352.
[I 2025-04-16 02:27:33,058] Trial 4887 finished with value: -0.1936417107583833 and parameters: {'n_estimators': 317, 'min_samples_split': 9, 'max_features': 0.79, 'min_samples_leaf': 1, 'criterion': 'absolute_error', 'max_depth': 15, 'min_weight_fraction_leaf': 0.0, 'max_leaf_nodes': 10, 'bootstrap': False, 'ccp_alpha': 0.016}. Best is trial 4539 with value: 0.19155472534689352.
[I 2025-04-16 02:27:33,820] Trial 4888 finished with value: -0.1936417107583833 and parameters: {'n_estimators': 164, 'min_samples_split': 2, 'max_features': 0.7100000000000001, 'min_samples_leaf': 60, 'criterion': 'absolute_error', 'max_depth': 15, 'min_weight_fraction_leaf': 0.0, 'max_leaf_nodes': 300, 'bootstrap': False, 'ccp_alpha': 0.0}. Best is trial 4539 with value: 0.19155472534689352.
[I 2025-04-16 02:27:34,454] Trial 4889 finished with value: -0.1936417107583833 and parameters: {'n_estimators': 7, 'min_samples_split': 6, 'max_features': 0.77, 'min_samples_leaf': 3, 'criterion': 'absolute_error', 'max_depth': 15, 'min_weight_fraction_leaf': 0.0, 'max_leaf_nodes': 300, 'bootstrap': False, 'ccp_alpha': 0.01}. Best is trial 4539 with value: 0.19155472534689352.
[I 2025-04-16 02:27:35,597] Trial 4890 finished with value: -0.1936417107583833 and parameters: {'n_estimators': 690, 'min_samples_split': 12, 'max_features': 0.75, 'min_samples_leaf': 5, 'criterion': 'absolute_error', 'max_depth': 15, 'min_weight_fraction_leaf': 0.0, 'max_leaf_nodes': 300, 'bootstrap': False, 'ccp_alpha': 0.027}. Best is trial 4539 with value: 0.19155472534689352.
[I 2025-04-16 02:27:36,693] Trial 4891 finished with value: 0.024436052996866374 and parameters: {'n_estimators': 464, 'min_samples_split': 6, 'max_features': 0.8200000000000001, 'min_samples_leaf': 3, 'criterion': 'absolute_error', 'max_depth': None, 'min_weight_fraction_leaf': 0.0, 'max_leaf_nodes': 300, 'bootstrap': False, 'ccp_alpha': 0.005}. Best is trial 4539 with value: 0.19155472534689352.
[I 2025-04-16 02:27:37,967] Trial 4892 finished with value: -0.1936417107583833 and parameters: {'n_estimators': 872, 'min_samples_split': 9, 'max_features': 0.73, 'min_samples_leaf': 1, 'criterion': 'absolute_error', 'max_depth': 15, 'min_weight_fraction_leaf': 0.0, 'max_leaf_nodes': None, 'bootstrap': False, 'ccp_alpha': 0.013000000000000001}. Best is trial 4539 with value: 0.19155472534689352.
[I 2025-04-16 02:27:39,125] Trial 4893 finished with value: -15.717557832250998 and parameters: {'n_estimators': 594, 'min_samples_split': 2, 'max_features': 0.6900000000000001, 'min_samples_leaf': 7, 'criterion': 'poisson', 'max_depth': 15, 'min_weight_fraction_leaf': 0.0, 'max_leaf_nodes': 10, 'bootstrap': False, 'ccp_alpha': 0.01}. Best is trial 4539 with value: 0.19155472534689352.
[I 2025-04-16 02:27:40,582] Trial 4894 finished with value: -13.455325533567054 and parameters: {'n_estimators': 1148, 'min_samples_split': 6, 'max_features': 0.8, 'min_samples_leaf': 1, 'criterion': 'absolute_error', 'max_depth': 15, 'min_weight_fraction_leaf': 0.0, 'max_leaf_nodes': 300, 'bootstrap': False, 'ccp_alpha': 0.0}. Best is trial 4539 with value: 0.19155472534689352.
[I 2025-04-16 02:27:41,569] Trial 4895 finished with value: -0.1936417107583833 and parameters: {'n_estimators': 492, 'min_samples_split': 2, 'max_features': 0.78, 'min_samples_leaf': 3, 'criterion': 'absolute_error', 'max_depth': 15, 'min_weight_fraction_leaf': 0.0, 'max_leaf_nodes': 300, 'bootstrap': False, 'ccp_alpha': 0.019}. Best is trial 4539 with value: 0.19155472534689352.
[I 2025-04-16 02:27:42,474] Trial 4896 finished with value: -0.1265647494966585 and parameters: {'n_estimators': 315, 'min_samples_split': 15, 'max_features': 0.66, 'min_samples_leaf': 5, 'criterion': 'absolute_error', 'max_depth': 20, 'min_weight_fraction_leaf': 0.0, 'max_leaf_nodes': 300, 'bootstrap': False, 'ccp_alpha': 0.005}. Best is trial 4539 with value: 0.19155472534689352.
[I 2025-04-16 02:27:43,653] Trial 4897 finished with value: -0.1936417107583833 and parameters: {'n_estimators': 734, 'min_samples_split': 9, 'max_features': 0.75, 'min_samples_leaf': 1, 'criterion': 'absolute_error', 'max_depth': 15, 'min_weight_fraction_leaf': 0.0, 'max_leaf_nodes': 300, 'bootstrap': False, 'ccp_alpha': 0.014}. Best is trial 4539 with value: 0.19155472534689352.
[I 2025-04-16 02:27:45,223] Trial 4898 finished with value: 0.01890801744960251 and parameters: {'n_estimators': 1044, 'min_samples_split': 2, 'max_features': 0.72, 'min_samples_leaf': 3, 'criterion': 'absolute_error', 'max_depth': None, 'min_weight_fraction_leaf': 0.0, 'max_leaf_nodes': 10, 'bootstrap': False, 'ccp_alpha': 0.005}. Best is trial 4539 with value: 0.19155472534689352.
[I 2025-04-16 02:27:46,172] Trial 4899 finished with value: -0.17658436140867412 and parameters: {'n_estimators': 353, 'min_samples_split': 6, 'max_features': 0.03, 'min_samples_leaf': 5, 'criterion': 'absolute_error', 'max_depth': 45, 'min_weight_fraction_leaf': 0.04, 'max_leaf_nodes': 300, 'bootstrap': False, 'ccp_alpha': 0.005}. Best is trial 4539 with value: 0.19155472534689352.
[I 2025-04-16 02:27:54,677] Trial 4900 finished with value: -0.1936417107583833 and parameters: {'n_estimators': 8560, 'min_samples_split': 12, 'max_features': 0.8400000000000001, 'min_samples_leaf': 45, 'criterion': 'absolute_error', 'max_depth': 15, 'min_weight_fraction_leaf': 0.0, 'max_leaf_nodes': None, 'bootstrap': False, 'ccp_alpha': 0.0}. Best is trial 4539 with value: 0.19155472534689352.
[I 2025-04-16 02:27:56,148] Trial 4901 finished with value: -0.1936417107583833 and parameters: {'n_estimators': 793, 'min_samples_split': 6, 'max_features': 0.81, 'min_samples_leaf': 3, 'criterion': 'absolute_error', 'max_depth': 15, 'min_weight_fraction_leaf': 0.0, 'max_leaf_nodes': 300, 'bootstrap': False, 'ccp_alpha': 0.01}. Best is trial 4539 with value: 0.19155472534689352.
[I 2025-04-16 02:27:56,911] Trial 4902 finished with value: -17.5289863822749 and parameters: {'n_estimators': 155, 'min_samples_split': 9, 'max_features': 0.77, 'min_samples_leaf': 1, 'criterion': 'friedman_mse', 'max_depth': 15, 'min_weight_fraction_leaf': 0.0, 'max_leaf_nodes': 300, 'bootstrap': False, 'ccp_alpha': 0.021}. Best is trial 4539 with value: 0.19155472534689352.
[I 2025-04-16 02:27:58,101] Trial 4903 finished with value: -0.1936417107583833 and parameters: {'n_estimators': 516, 'min_samples_split': 5, 'max_features': 0.74, 'min_samples_leaf': 52, 'criterion': 'absolute_error', 'max_depth': 15, 'min_weight_fraction_leaf': 0.0, 'max_leaf_nodes': 300, 'bootstrap': False, 'ccp_alpha': 0.015}. Best is trial 4539 with value: 0.19155472534689352.
[I 2025-04-16 02:27:59,421] Trial 4904 finished with value: -7.9631954079274605 and parameters: {'n_estimators': 927, 'min_samples_split': 2, 'max_features': 0.79, 'min_samples_leaf': 6, 'criterion': 'absolute_error', 'max_depth': 15, 'min_weight_fraction_leaf': 0.0, 'max_leaf_nodes': 10, 'bootstrap': False, 'ccp_alpha': 0.0}. Best is trial 4539 with value: 0.19155472534689352.
[I 2025-04-16 02:28:00,579] Trial 4905 finished with value: -0.1936417107583833 and parameters: {'n_estimators': 656, 'min_samples_split': 11, 'max_features': 0.7100000000000001, 'min_samples_leaf': 3, 'criterion': 'absolute_error', 'max_depth': 15, 'min_weight_fraction_leaf': 0.0, 'max_leaf_nodes': 300, 'bootstrap': False, 'ccp_alpha': 0.009000000000000001}. Best is trial 4539 with value: 0.19155472534689352.
[I 2025-04-16 02:28:01,495] Trial 4906 finished with value: 0.01779475717811856 and parameters: {'n_estimators': 324, 'min_samples_split': 6, 'max_features': 0.8200000000000001, 'min_samples_leaf': 1, 'criterion': 'absolute_error', 'max_depth': 10, 'min_weight_fraction_leaf': 0.0, 'max_leaf_nodes': 300, 'bootstrap': False, 'ccp_alpha': 0.006}. Best is trial 4539 with value: 0.19155472534689352.
[I 2025-04-16 02:28:09,150] Trial 4907 finished with value: -0.1936417107583833 and parameters: {'n_estimators': 7891, 'min_samples_split': 2, 'max_features': 0.76, 'min_samples_leaf': 4, 'criterion': 'absolute_error', 'max_depth': None, 'min_weight_fraction_leaf': 0.0, 'max_leaf_nodes': 300, 'bootstrap': False, 'ccp_alpha': 0.015}. Best is trial 4539 with value: 0.19155472534689352.
[I 2025-04-16 02:28:10,698] Trial 4908 finished with value: -5.297279762930773 and parameters: {'n_estimators': 1229, 'min_samples_split': 15, 'max_features': 0.6900000000000001, 'min_samples_leaf': 7, 'criterion': 'absolute_error', 'max_depth': 15, 'min_weight_fraction_leaf': 0.0, 'max_leaf_nodes': 300, 'bootstrap': False, 'ccp_alpha': 0.0}. Best is trial 4539 with value: 0.19155472534689352.
[I 2025-04-16 02:28:11,704] Trial 4909 finished with value: -0.1936417107583833 and parameters: {'n_estimators': 461, 'min_samples_split': 9, 'max_features': 0.73, 'min_samples_leaf': 1, 'criterion': 'absolute_error', 'max_depth': 15, 'min_weight_fraction_leaf': 0.0, 'max_leaf_nodes': 10, 'bootstrap': False, 'ccp_alpha': 0.01}. Best is trial 4539 with value: 0.19155472534689352.
