[I 2025-04-16 00:00:28,482] Trial 1063 finished with value: -0.18351628417871915 and parameters: {'n_estimators': 4589, 'min_samples_split': 20, 'max_features': 0.18000000000000002, 'min_samples_leaf': 29, 'criterion': 'absolute_error', 'max_depth': 30, 'min_weight_fraction_leaf': 0.07, 'max_leaf_nodes': 100, 'bootstrap': True, 'ccp_alpha': 0.084, 'max_samples': 0.5}. Best is trial 621 with value: -0.18112741123578058.
[I 2025-04-16 00:00:29,107] Trial 1064 finished with value: -0.1877995679984375 and parameters: {'n_estimators': 359, 'min_samples_split': 172, 'max_features': 0.8300000000000001, 'min_samples_leaf': 25, 'criterion': 'absolute_error', 'max_depth': 45, 'min_weight_fraction_leaf': 0.01, 'max_leaf_nodes': None, 'bootstrap': True, 'ccp_alpha': 0.06, 'max_samples': 0.5}. Best is trial 621 with value: -0.18112741123578058.
[I 2025-04-16 00:00:32,582] Trial 1065 finished with value: -0.18267989485602634 and parameters: {'n_estimators': 3169, 'min_samples_split': 34, 'max_features': 0.86, 'min_samples_leaf': 38, 'criterion': 'absolute_error', 'max_depth': 30, 'min_weight_fraction_leaf': 0.02, 'max_leaf_nodes': 100, 'bootstrap': True, 'ccp_alpha': 0.10300000000000001, 'max_samples': 0.5}. Best is trial 621 with value: -0.18112741123578058.
[I 2025-04-16 00:00:36,473] Trial 1066 finished with value: -0.19329195693728493 and parameters: {'n_estimators': 3410, 'min_samples_split': 81, 'max_features': 0.25, 'min_samples_leaf': 33, 'criterion': 'absolute_error', 'max_depth': 20, 'min_weight_fraction_leaf': 0.0, 'max_leaf_nodes': 20, 'bootstrap': True, 'ccp_alpha': 0.088, 'max_samples': None}. Best is trial 621 with value: -0.18112741123578058.
[I 2025-04-16 00:00:40,496] Trial 1067 finished with value: -0.18259283880842214 and parameters: {'n_estimators': 3029, 'min_samples_split': 179, 'max_features': 0.92, 'min_samples_leaf': 27, 'criterion': 'absolute_error', 'max_depth': 30, 'min_weight_fraction_leaf': 0.02, 'max_leaf_nodes': 100, 'bootstrap': True, 'ccp_alpha': 0.112, 'max_samples': 0.5}. Best is trial 621 with value: -0.18112741123578058.
[I 2025-04-16 00:00:43,630] Trial 1068 finished with value: -0.18270855529635374 and parameters: {'n_estimators': 2762, 'min_samples_split': 13, 'max_features': 0.13, 'min_samples_leaf': 22, 'criterion': 'absolute_error', 'max_depth': None, 'min_weight_fraction_leaf': 0.01, 'max_leaf_nodes': 50, 'bootstrap': True, 'ccp_alpha': 0.067, 'max_samples': 0.5}. Best is trial 621 with value: -0.18112741123578058.
[I 2025-04-16 00:00:46,009] Trial 1069 finished with value: -0.18497395348499418 and parameters: {'n_estimators': 2068, 'min_samples_split': 145, 'max_features': 0.79, 'min_samples_leaf': 64, 'criterion': 'absolute_error', 'max_depth': 45, 'min_weight_fraction_leaf': 0.04, 'max_leaf_nodes': 10, 'bootstrap': True, 'ccp_alpha': 0.076, 'max_samples': 0.5}. Best is trial 621 with value: -0.18112741123578058.
[I 2025-04-16 00:00:48,567] Trial 1070 finished with value: -18.19425775309509 and parameters: {'n_estimators': 2569, 'min_samples_split': 27, 'max_features': 0.75, 'min_samples_leaf': 31, 'criterion': 'squared_error', 'max_depth': 60, 'min_weight_fraction_leaf': 0.02, 'max_leaf_nodes': 100, 'bootstrap': True, 'ccp_alpha': 0.094, 'max_samples': 0.5}. Best is trial 621 with value: -0.18112741123578058.
[I 2025-04-16 00:00:52,977] Trial 1071 finished with value: -0.1832088080194209 and parameters: {'n_estimators': 3754, 'min_samples_split': 165, 'max_features': 0.85, 'min_samples_leaf': 28, 'criterion': 'absolute_error', 'max_depth': 30, 'min_weight_fraction_leaf': 0.02, 'max_leaf_nodes': 100, 'bootstrap': True, 'ccp_alpha': 0.056, 'max_samples': 0.5}. Best is trial 621 with value: -0.18112741123578058.
[I 2025-04-16 00:00:53,365] Trial 1072 finished with value: -0.19300732804832504 and parameters: {'n_estimators': 173, 'min_samples_split': 109, 'max_features': 0.9, 'min_samples_leaf': 34, 'criterion': 'absolute_error', 'max_depth': 5, 'min_weight_fraction_leaf': 0.06, 'max_leaf_nodes': 100, 'bootstrap': True, 'ccp_alpha': 0.081, 'max_samples': 1.0}. Best is trial 621 with value: -0.18112741123578058.
[I 2025-04-16 00:00:56,763] Trial 1073 finished with value: -0.18277899877248222 and parameters: {'n_estimators': 3207, 'min_samples_split': 169, 'max_features': 0.88, 'min_samples_leaf': 24, 'criterion': 'absolute_error', 'max_depth': 45, 'min_weight_fraction_leaf': 0.0, 'max_leaf_nodes': 50, 'bootstrap': True, 'ccp_alpha': 0.105, 'max_samples': 0.5}. Best is trial 621 with value: -0.18112741123578058.
[I 2025-04-16 00:00:59,989] Trial 1074 finished with value: -0.18248930110785092 and parameters: {'n_estimators': 2959, 'min_samples_split': 159, 'max_features': 0.8300000000000001, 'min_samples_leaf': 29, 'criterion': 'absolute_error', 'max_depth': 30, 'min_weight_fraction_leaf': 0.02, 'max_leaf_nodes': 100, 'bootstrap': True, 'ccp_alpha': 0.062, 'max_samples': 0.5}. Best is trial 621 with value: -0.18112741123578058.
[I 2025-04-16 00:01:02,907] Trial 1075 finished with value: -0.1908247180039843 and parameters: {'n_estimators': 2384, 'min_samples_split': 154, 'max_features': 0.8400000000000001, 'min_samples_leaf': 31, 'criterion': 'absolute_error', 'max_depth': 30, 'min_weight_fraction_leaf': 0.02, 'max_leaf_nodes': 100, 'bootstrap': True, 'ccp_alpha': 0.098, 'max_samples': 0.75}. Best is trial 621 with value: -0.18112741123578058.
[I 2025-04-16 00:01:06,104] Trial 1076 finished with value: -0.18298116097529782 and parameters: {'n_estimators': 2873, 'min_samples_split': 158, 'max_features': 0.86, 'min_samples_leaf': 29, 'criterion': 'absolute_error', 'max_depth': 30, 'min_weight_fraction_leaf': 0.02, 'max_leaf_nodes': 100, 'bootstrap': True, 'ccp_alpha': 0.047, 'max_samples': 0.5}. Best is trial 621 with value: -0.18112741123578058.
[I 2025-04-16 00:01:09,098] Trial 1077 finished with value: -0.18294695858352567 and parameters: {'n_estimators': 2663, 'min_samples_split': 162, 'max_features': 0.8300000000000001, 'min_samples_leaf': 32, 'criterion': 'absolute_error', 'max_depth': 30, 'min_weight_fraction_leaf': 0.02, 'max_leaf_nodes': 100, 'bootstrap': True, 'ccp_alpha': 0.054, 'max_samples': 0.5}. Best is trial 621 with value: -0.18112741123578058.
[I 2025-04-16 00:01:12,411] Trial 1078 finished with value: -0.1827678020843168 and parameters: {'n_estimators': 2920, 'min_samples_split': 159, 'max_features': 0.87, 'min_samples_leaf': 30, 'criterion': 'absolute_error', 'max_depth': 30, 'min_weight_fraction_leaf': 0.02, 'max_leaf_nodes': 100, 'bootstrap': True, 'ccp_alpha': 0.061, 'max_samples': 0.5}. Best is trial 621 with value: -0.18112741123578058.
[I 2025-04-16 00:01:16,008] Trial 1079 finished with value: -17.52898638227285 and parameters: {'n_estimators': 4738, 'min_samples_split': 153, 'max_features': 0.8400000000000001, 'min_samples_leaf': 35, 'criterion': 'poisson', 'max_depth': 30, 'min_weight_fraction_leaf': 0.02, 'max_leaf_nodes': 100, 'bootstrap': False, 'ccp_alpha': 0.049}. Best is trial 621 with value: -0.18112741123578058.
[I 2025-04-16 00:01:16,842] Trial 1080 finished with value: -0.1873604299807917 and parameters: {'n_estimators': 590, 'min_samples_split': 158, 'max_features': 0.86, 'min_samples_leaf': 29, 'criterion': 'absolute_error', 'max_depth': 30, 'min_weight_fraction_leaf': 0.02, 'max_leaf_nodes': 100, 'bootstrap': True, 'ccp_alpha': 0.059000000000000004, 'max_samples': 0.5}. Best is trial 621 with value: -0.18112741123578058.
[I 2025-04-16 00:01:19,709] Trial 1081 finished with value: -0.18316899851661392 and parameters: {'n_estimators': 2493, 'min_samples_split': 161, 'max_features': 0.8200000000000001, 'min_samples_leaf': 32, 'criterion': 'absolute_error', 'max_depth': 30, 'min_weight_fraction_leaf': 0.02, 'max_leaf_nodes': 100, 'bootstrap': True, 'ccp_alpha': 0.114, 'max_samples': 0.5}. Best is trial 621 with value: -0.18112741123578058.
[I 2025-04-16 00:01:25,674] Trial 1082 finished with value: -0.18366519394614564 and parameters: {'n_estimators': 5405, 'min_samples_split': 152, 'max_features': 0.89, 'min_samples_leaf': 30, 'criterion': 'absolute_error', 'max_depth': 30, 'min_weight_fraction_leaf': 0.02, 'max_leaf_nodes': 100, 'bootstrap': True, 'ccp_alpha': 0.127, 'max_samples': 0.5}. Best is trial 621 with value: -0.18112741123578058.
[I 2025-04-16 00:01:26,085] Trial 1083 finished with value: -0.18575858766369252 and parameters: {'n_estimators': 200, 'min_samples_split': 150, 'max_features': 0.3, 'min_samples_leaf': 28, 'criterion': 'absolute_error', 'max_depth': 30, 'min_weight_fraction_leaf': 0.02, 'max_leaf_nodes': 100, 'bootstrap': True, 'ccp_alpha': 0.088, 'max_samples': 0.5}. Best is trial 621 with value: -0.18112741123578058.
[I 2025-04-16 00:01:29,256] Trial 1084 finished with value: -0.18294208429003955 and parameters: {'n_estimators': 2859, 'min_samples_split': 156, 'max_features': 0.93, 'min_samples_leaf': 33, 'criterion': 'absolute_error', 'max_depth': 30, 'min_weight_fraction_leaf': 0.03, 'max_leaf_nodes': 100, 'bootstrap': True, 'ccp_alpha': 0.066, 'max_samples': 0.5}. Best is trial 621 with value: -0.18112741123578058.
[I 2025-04-16 00:01:32,810] Trial 1085 finished with value: -0.1825519813328284 and parameters: {'n_estimators': 3102, 'min_samples_split': 163, 'max_features': 0.85, 'min_samples_leaf': 40, 'criterion': 'absolute_error', 'max_depth': 30, 'min_weight_fraction_leaf': 0.02, 'max_leaf_nodes': 100, 'bootstrap': True, 'ccp_alpha': 0.161, 'max_samples': 0.5}. Best is trial 621 with value: -0.18112741123578058.
[I 2025-04-16 00:01:35,704] Trial 1086 finished with value: -18.160035200745916 and parameters: {'n_estimators': 2742, 'min_samples_split': 166, 'max_features': 0.88, 'min_samples_leaf': 36, 'criterion': 'friedman_mse', 'max_depth': 30, 'min_weight_fraction_leaf': 0.03, 'max_leaf_nodes': 100, 'bootstrap': True, 'ccp_alpha': 0.10300000000000001, 'max_samples': 0.5}. Best is trial 621 with value: -0.18112741123578058.
[I 2025-04-16 00:01:36,352] Trial 1087 finished with value: -0.18821070067240533 and parameters: {'n_estimators': 388, 'min_samples_split': 3, 'max_features': 0.43, 'min_samples_leaf': 27, 'criterion': 'absolute_error', 'max_depth': 30, 'min_weight_fraction_leaf': 0.02, 'max_leaf_nodes': 100, 'bootstrap': True, 'ccp_alpha': 0.051000000000000004, 'max_samples': 0.5}. Best is trial 621 with value: -0.18112741123578058.
[I 2025-04-16 00:01:40,304] Trial 1088 finished with value: -0.18291983535728945 and parameters: {'n_estimators': 3304, 'min_samples_split': 161, 'max_features': 0.34, 'min_samples_leaf': 31, 'criterion': 'absolute_error', 'max_depth': 30, 'min_weight_fraction_leaf': 0.02, 'max_leaf_nodes': 100, 'bootstrap': True, 'ccp_alpha': 0.093, 'max_samples': 0.5}. Best is trial 621 with value: -0.18112741123578058.
[I 2025-04-16 00:01:43,790] Trial 1089 finished with value: -0.1826007084545722 and parameters: {'n_estimators': 2996, 'min_samples_split': 155, 'max_features': 0.9600000000000001, 'min_samples_leaf': 34, 'criterion': 'absolute_error', 'max_depth': 30, 'min_weight_fraction_leaf': 0.02, 'max_leaf_nodes': 100, 'bootstrap': True, 'ccp_alpha': 0.108, 'max_samples': 0.5}. Best is trial 621 with value: -0.18112741123578058.
[I 2025-04-16 00:01:47,792] Trial 1090 finished with value: -0.18310191573472306 and parameters: {'n_estimators': 3422, 'min_samples_split': 170, 'max_features': 0.38, 'min_samples_leaf': 70, 'criterion': 'absolute_error', 'max_depth': 30, 'min_weight_fraction_leaf': 0.03, 'max_leaf_nodes': 100, 'bootstrap': True, 'ccp_alpha': 0.07100000000000001, 'max_samples': 0.5}. Best is trial 621 with value: -0.18112741123578058.
[I 2025-04-16 00:01:50,799] Trial 1091 finished with value: -0.18369076206115728 and parameters: {'n_estimators': 2276, 'min_samples_split': 166, 'max_features': 0.8300000000000001, 'min_samples_leaf': 48, 'criterion': 'absolute_error', 'max_depth': 30, 'min_weight_fraction_leaf': 0.02, 'max_leaf_nodes': 100, 'bootstrap': True, 'ccp_alpha': 0.059000000000000004, 'max_samples': 0.5}. Best is trial 621 with value: -0.18112741123578058.
[I 2025-04-16 00:01:53,815] Trial 1092 finished with value: -0.18270629852467843 and parameters: {'n_estimators': 2742, 'min_samples_split': 158, 'max_features': 0.91, 'min_samples_leaf': 29, 'criterion': 'absolute_error', 'max_depth': 45, 'min_weight_fraction_leaf': 0.02, 'max_leaf_nodes': 100, 'bootstrap': True, 'ccp_alpha': 0.099, 'max_samples': 0.5}. Best is trial 621 with value: -0.18112741123578058.
[I 2025-04-16 00:01:58,874] Trial 1093 finished with value: -0.193290991169976 and parameters: {'n_estimators': 3054, 'min_samples_split': 189, 'max_features': 0.23, 'min_samples_leaf': 26, 'criterion': 'absolute_error', 'max_depth': 30, 'min_weight_fraction_leaf': 0.02, 'max_leaf_nodes': 100, 'bootstrap': True, 'ccp_alpha': 0.084, 'max_samples': None}. Best is trial 621 with value: -0.18112741123578058.
[I 2025-04-16 00:02:02,278] Trial 1094 finished with value: -0.1829481015140925 and parameters: {'n_estimators': 2564, 'min_samples_split': 175, 'max_features': 0.67, 'min_samples_leaf': 32, 'criterion': 'absolute_error', 'max_depth': 30, 'min_weight_fraction_leaf': 0.02, 'max_leaf_nodes': None, 'bootstrap': True, 'ccp_alpha': 0.043000000000000003, 'max_samples': 0.5}. Best is trial 621 with value: -0.18112741123578058.
[I 2025-04-16 00:02:02,650] Trial 1095 finished with value: -19.043910833079217 and parameters: {'n_estimators': 179, 'min_samples_split': 152, 'max_features': 0.86, 'min_samples_leaf': 37, 'criterion': 'squared_error', 'max_depth': 45, 'min_weight_fraction_leaf': 0.1, 'max_leaf_nodes': 10, 'bootstrap': True, 'ccp_alpha': 0.063, 'max_samples': 0.5}. Best is trial 621 with value: -0.18112741123578058.
[I 2025-04-16 00:02:06,678] Trial 1096 finished with value: -0.18278251732716178 and parameters: {'n_estimators': 3221, 'min_samples_split': 147, 'max_features': 0.8200000000000001, 'min_samples_leaf': 28, 'criterion': 'absolute_error', 'max_depth': 20, 'min_weight_fraction_leaf': 0.01, 'max_leaf_nodes': 100, 'bootstrap': True, 'ccp_alpha': 0.054, 'max_samples': 0.5}. Best is trial 621 with value: -0.18112741123578058.
[I 2025-04-16 00:02:06,899] Trial 1097 finished with value: -0.19363813473054853 and parameters: {'n_estimators': 14, 'min_samples_split': 181, 'max_features': 0.88, 'min_samples_leaf': 31, 'criterion': 'absolute_error', 'max_depth': 30, 'min_weight_fraction_leaf': 0.05, 'max_leaf_nodes': 100, 'bootstrap': True, 'ccp_alpha': 0.121, 'max_samples': 0.5}. Best is trial 621 with value: -0.18112741123578058.
[I 2025-04-16 00:02:09,234] Trial 1098 finished with value: -0.1936417107583833 and parameters: {'n_estimators': 2864, 'min_samples_split': 163, 'max_features': 0.98, 'min_samples_leaf': 27, 'criterion': 'absolute_error', 'max_depth': 30, 'min_weight_fraction_leaf': 0.02, 'max_leaf_nodes': 300, 'bootstrap': False, 'ccp_alpha': 0.074}. Best is trial 621 with value: -0.18112741123578058.
[I 2025-04-16 00:02:12,700] Trial 1099 finished with value: -0.19328282742314679 and parameters: {'n_estimators': 2984, 'min_samples_split': 169, 'max_features': 0.9400000000000001, 'min_samples_leaf': 30, 'criterion': 'absolute_error', 'max_depth': 60, 'min_weight_fraction_leaf': 0.01, 'max_leaf_nodes': 50, 'bootstrap': True, 'ccp_alpha': 0.078, 'max_samples': 1.0}. Best is trial 621 with value: -0.18112741123578058.
[I 2025-04-16 00:02:16,372] Trial 1100 finished with value: -0.1832249117274412 and parameters: {'n_estimators': 3471, 'min_samples_split': 176, 'max_features': 0.8400000000000001, 'min_samples_leaf': 34, 'criterion': 'absolute_error', 'max_depth': 45, 'min_weight_fraction_leaf': 0.02, 'max_leaf_nodes': 100, 'bootstrap': True, 'ccp_alpha': 0.091, 'max_samples': 0.5}. Best is trial 621 with value: -0.18112741123578058.
[I 2025-04-16 00:02:16,992] Trial 1101 finished with value: -17.793205319216916 and parameters: {'n_estimators': 406, 'min_samples_split': 157, 'max_features': 0.28, 'min_samples_leaf': 28, 'criterion': 'poisson', 'max_depth': None, 'min_weight_fraction_leaf': 0.03, 'max_leaf_nodes': 100, 'bootstrap': True, 'ccp_alpha': 0.069, 'max_samples': 0.75}. Best is trial 621 with value: -0.18112741123578058.
[I 2025-04-16 00:02:20,409] Trial 1102 finished with value: -0.18276074694383246 and parameters: {'n_estimators': 3198, 'min_samples_split': 22, 'max_features': 0.9, 'min_samples_leaf': 29, 'criterion': 'absolute_error', 'max_depth': 5, 'min_weight_fraction_leaf': 0.02, 'max_leaf_nodes': 100, 'bootstrap': True, 'ccp_alpha': 0.145, 'max_samples': 0.5}. Best is trial 621 with value: -0.18112741123578058.
[I 2025-04-16 00:02:21,324] Trial 1103 finished with value: -0.18588860843208885 and parameters: {'n_estimators': 670, 'min_samples_split': 185, 'max_features': 0.81, 'min_samples_leaf': 26, 'criterion': 'absolute_error', 'max_depth': 30, 'min_weight_fraction_leaf': 0.02, 'max_leaf_nodes': 10, 'bootstrap': True, 'ccp_alpha': 0.108, 'max_samples': 0.5}. Best is trial 621 with value: -0.18112741123578058.
[I 2025-04-16 00:02:24,411] Trial 1104 finished with value: -0.1827804419926232 and parameters: {'n_estimators': 2697, 'min_samples_split': 173, 'max_features': 0.16, 'min_samples_leaf': 31, 'criterion': 'absolute_error', 'max_depth': 45, 'min_weight_fraction_leaf': 0.01, 'max_leaf_nodes': 100, 'bootstrap': True, 'ccp_alpha': 0.1, 'max_samples': 0.5}. Best is trial 621 with value: -0.18112741123578058.
[I 2025-04-16 00:02:27,849] Trial 1105 finished with value: -0.1825317070181378 and parameters: {'n_estimators': 2973, 'min_samples_split': 165, 'max_features': 0.87, 'min_samples_leaf': 35, 'criterion': 'absolute_error', 'max_depth': 10, 'min_weight_fraction_leaf': 0.01, 'max_leaf_nodes': 50, 'bootstrap': True, 'ccp_alpha': 0.088, 'max_samples': 0.5}. Best is trial 621 with value: -0.18112741123578058.
[I 2025-04-16 00:02:31,451] Trial 1106 finished with value: -0.18297802247176378 and parameters: {'n_estimators': 3326, 'min_samples_split': 19, 'max_features': 0.85, 'min_samples_leaf': 26, 'criterion': 'absolute_error', 'max_depth': 30, 'min_weight_fraction_leaf': 0.02, 'max_leaf_nodes': 100, 'bootstrap': True, 'ccp_alpha': 0.063, 'max_samples': 0.5}. Best is trial 621 with value: -0.18112741123578058.
[I 2025-04-16 00:02:35,012] Trial 1107 finished with value: -0.18263922366546845 and parameters: {'n_estimators': 3136, 'min_samples_split': 148, 'max_features': 0.92, 'min_samples_leaf': 32, 'criterion': 'absolute_error', 'max_depth': 30, 'min_weight_fraction_leaf': 0.03, 'max_leaf_nodes': None, 'bootstrap': True, 'ccp_alpha': 0.115, 'max_samples': 0.5}. Best is trial 621 with value: -0.18112741123578058.
[I 2025-04-16 00:02:39,056] Trial 1108 finished with value: -0.18338816653364445 and parameters: {'n_estimators': 3617, 'min_samples_split': 141, 'max_features': 0.8300000000000001, 'min_samples_leaf': 38, 'criterion': 'absolute_error', 'max_depth': 45, 'min_weight_fraction_leaf': 0.01, 'max_leaf_nodes': 100, 'bootstrap': True, 'ccp_alpha': 0.081, 'max_samples': 0.5}. Best is trial 621 with value: -0.18112741123578058.
[I 2025-04-16 00:02:39,249] Trial 1109 finished with value: -0.19363616285847823 and parameters: {'n_estimators': 4, 'min_samples_split': 159, 'max_features': 0.9, 'min_samples_leaf': 29, 'criterion': 'absolute_error', 'max_depth': 30, 'min_weight_fraction_leaf': 0.02, 'max_leaf_nodes': 20, 'bootstrap': True, 'ccp_alpha': 0.057, 'max_samples': 0.5}. Best is trial 621 with value: -0.18112741123578058.
[I 2025-04-16 00:02:42,062] Trial 1110 finished with value: -0.1832048851512047 and parameters: {'n_estimators': 2476, 'min_samples_split': 170, 'max_features': 0.88, 'min_samples_leaf': 33, 'criterion': 'absolute_error', 'max_depth': 45, 'min_weight_fraction_leaf': 0.02, 'max_leaf_nodes': 100, 'bootstrap': True, 'ccp_alpha': 0.098, 'max_samples': 0.5}. Best is trial 621 with value: -0.18112741123578058.
[I 2025-04-16 00:02:49,751] Trial 1111 finished with value: -17.524713701200536 and parameters: {'n_estimators': 7690, 'min_samples_split': 177, 'max_features': 0.31, 'min_samples_leaf': 27, 'criterion': 'friedman_mse', 'max_depth': 20, 'min_weight_fraction_leaf': 0.01, 'max_leaf_nodes': 100, 'bootstrap': True, 'ccp_alpha': 0.074, 'max_samples': 0.5}. Best is trial 621 with value: -0.18112741123578058.
[I 2025-04-16 00:02:50,288] Trial 1112 finished with value: -0.18729391030542808 and parameters: {'n_estimators': 314, 'min_samples_split': 25, 'max_features': 0.81, 'min_samples_leaf': 30, 'criterion': 'absolute_error', 'max_depth': 30, 'min_weight_fraction_leaf': 0.02, 'max_leaf_nodes': 50, 'bootstrap': True, 'ccp_alpha': 0.245, 'max_samples': 0.5}. Best is trial 621 with value: -0.18112741123578058.
[I 2025-04-16 00:02:53,618] Trial 1113 finished with value: -0.18304777431603517 and parameters: {'n_estimators': 2895, 'min_samples_split': 155, 'max_features': 0.86, 'min_samples_leaf': 25, 'criterion': 'absolute_error', 'max_depth': None, 'min_weight_fraction_leaf': 0.01, 'max_leaf_nodes': 100, 'bootstrap': True, 'ccp_alpha': 0.066, 'max_samples': 0.5}. Best is trial 621 with value: -0.18112741123578058.
[I 2025-04-16 00:02:56,993] Trial 1114 finished with value: -0.18266725253948932 and parameters: {'n_estimators': 2730, 'min_samples_split': 181, 'max_features': 0.9400000000000001, 'min_samples_leaf': 61, 'criterion': 'absolute_error', 'max_depth': 30, 'min_weight_fraction_leaf': 0.06, 'max_leaf_nodes': 10, 'bootstrap': True, 'ccp_alpha': 0.092, 'max_samples': 0.5}. Best is trial 621 with value: -0.18112741123578058.
[I 2025-04-16 00:03:00,781] Trial 1115 finished with value: -0.18279567598619448 and parameters: {'n_estimators': 3227, 'min_samples_split': 191, 'max_features': 0.8400000000000001, 'min_samples_leaf': 36, 'criterion': 'absolute_error', 'max_depth': 60, 'min_weight_fraction_leaf': 0.09, 'max_leaf_nodes': 100, 'bootstrap': True, 'ccp_alpha': 0.084, 'max_samples': 0.5}. Best is trial 621 with value: -0.18112741123578058.
