[I 2025-04-16 01:23:13,839] Trial 2434 finished with value: -0.1936417107583833 and parameters: {'n_estimators': 3537, 'min_samples_split': 9, 'max_features': 0.93, 'min_samples_leaf': 3, 'criterion': 'absolute_error', 'max_depth': 5, 'min_weight_fraction_leaf': 0.0, 'max_leaf_nodes': 20, 'bootstrap': False, 'ccp_alpha': 0.011}. Best is trial 2251 with value: 0.02361845659970214.
[I 2025-04-16 01:23:17,411] Trial 2435 finished with value: -0.000927392335593269 and parameters: {'n_estimators': 3680, 'min_samples_split': 2, 'max_features': 0.88, 'min_samples_leaf': 1, 'criterion': 'absolute_error', 'max_depth': 5, 'min_weight_fraction_leaf': 0.0, 'max_leaf_nodes': 20, 'bootstrap': False, 'ccp_alpha': 0.006}. Best is trial 2251 with value: 0.02361845659970214.
[I 2025-04-16 01:23:20,535] Trial 2436 finished with value: -0.1936417107583833 and parameters: {'n_estimators': 3252, 'min_samples_split': 2, 'max_features': 0.89, 'min_samples_leaf': 1, 'criterion': 'absolute_error', 'max_depth': 5, 'min_weight_fraction_leaf': 0.0, 'max_leaf_nodes': 20, 'bootstrap': False, 'ccp_alpha': 0.024}. Best is trial 2251 with value: 0.02361845659970214.
[I 2025-04-16 01:23:23,661] Trial 2437 finished with value: -0.1936417107583833 and parameters: {'n_estimators': 3337, 'min_samples_split': 2, 'max_features': 0.88, 'min_samples_leaf': 1, 'criterion': 'absolute_error', 'max_depth': 5, 'min_weight_fraction_leaf': 0.0, 'max_leaf_nodes': 20, 'bootstrap': False, 'ccp_alpha': 0.224}. Best is trial 2251 with value: 0.02361845659970214.
[I 2025-04-16 01:23:27,057] Trial 2438 finished with value: -17.528986382275637 and parameters: {'n_estimators': 3361, 'min_samples_split': 2, 'max_features': 0.88, 'min_samples_leaf': 1, 'criterion': 'friedman_mse', 'max_depth': 5, 'min_weight_fraction_leaf': 0.0, 'max_leaf_nodes': 20, 'bootstrap': False, 'ccp_alpha': 0.02}. Best is trial 2251 with value: 0.02361845659970214.
[I 2025-04-16 01:23:32,501] Trial 2439 finished with value: -0.1936417107583833 and parameters: {'n_estimators': 6069, 'min_samples_split': 2, 'max_features': 0.91, 'min_samples_leaf': 3, 'criterion': 'absolute_error', 'max_depth': 5, 'min_weight_fraction_leaf': 0.0, 'max_leaf_nodes': 20, 'bootstrap': False, 'ccp_alpha': 0.015}. Best is trial 2251 with value: 0.02361845659970214.
[I 2025-04-16 01:23:35,736] Trial 2440 finished with value: -0.1936417107583833 and parameters: {'n_estimators': 3464, 'min_samples_split': 6, 'max_features': 0.88, 'min_samples_leaf': 4, 'criterion': 'absolute_error', 'max_depth': 5, 'min_weight_fraction_leaf': 0.0, 'max_leaf_nodes': 20, 'bootstrap': False, 'ccp_alpha': 0.017}. Best is trial 2251 with value: 0.02361845659970214.
[I 2025-04-16 01:23:39,319] Trial 2441 finished with value: -0.1936417107583833 and parameters: {'n_estimators': 3649, 'min_samples_split': 6, 'max_features': 0.88, 'min_samples_leaf': 1, 'criterion': 'absolute_error', 'max_depth': 5, 'min_weight_fraction_leaf': 0.0, 'max_leaf_nodes': 20, 'bootstrap': False, 'ccp_alpha': 0.014}. Best is trial 2251 with value: 0.02361845659970214.
[I 2025-04-16 01:23:42,741] Trial 2442 finished with value: -0.1936417107583833 and parameters: {'n_estimators': 3458, 'min_samples_split': 2, 'max_features': 0.9, 'min_samples_leaf': 3, 'criterion': 'absolute_error', 'max_depth': 5, 'min_weight_fraction_leaf': 0.0, 'max_leaf_nodes': 20, 'bootstrap': False, 'ccp_alpha': 0.031}. Best is trial 2251 with value: 0.02361845659970214.
[I 2025-04-16 01:23:45,979] Trial 2443 finished with value: -0.1936417107583833 and parameters: {'n_estimators': 3261, 'min_samples_split': 6, 'max_features': 0.91, 'min_samples_leaf': 5, 'criterion': 'absolute_error', 'max_depth': 5, 'min_weight_fraction_leaf': 0.0, 'max_leaf_nodes': 20, 'bootstrap': False, 'ccp_alpha': 0.01}. Best is trial 2251 with value: 0.02361845659970214.
[I 2025-04-16 01:23:49,701] Trial 2444 finished with value: -0.1936417107583833 and parameters: {'n_estimators': 3642, 'min_samples_split': 6, 'max_features': 0.88, 'min_samples_leaf': 3, 'criterion': 'absolute_error', 'max_depth': 5, 'min_weight_fraction_leaf': 0.0, 'max_leaf_nodes': 20, 'bootstrap': False, 'ccp_alpha': 0.01}. Best is trial 2251 with value: 0.02361845659970214.
[I 2025-04-16 01:23:53,259] Trial 2445 finished with value: -0.1936417107583833 and parameters: {'n_estimators': 3647, 'min_samples_split': 5, 'max_features': 0.9, 'min_samples_leaf': 1, 'criterion': 'absolute_error', 'max_depth': 5, 'min_weight_fraction_leaf': 0.0, 'max_leaf_nodes': 20, 'bootstrap': False, 'ccp_alpha': 0.023}. Best is trial 2251 with value: 0.02361845659970214.
[I 2025-04-16 01:23:56,757] Trial 2446 finished with value: -0.1936417107583833 and parameters: {'n_estimators': 3470, 'min_samples_split': 6, 'max_features': 0.9, 'min_samples_leaf': 4, 'criterion': 'absolute_error', 'max_depth': 5, 'min_weight_fraction_leaf': 0.0, 'max_leaf_nodes': 300, 'bootstrap': False, 'ccp_alpha': 0.019}. Best is trial 2251 with value: 0.02361845659970214.
[I 2025-04-16 01:23:59,950] Trial 2447 finished with value: -17.52898638227482 and parameters: {'n_estimators': 3673, 'min_samples_split': 2, 'max_features': 0.91, 'min_samples_leaf': 5, 'criterion': 'squared_error', 'max_depth': 5, 'min_weight_fraction_leaf': 0.0, 'max_leaf_nodes': 20, 'bootstrap': False, 'ccp_alpha': 0.009000000000000001}. Best is trial 2251 with value: 0.02361845659970214.
[I 2025-04-16 01:24:03,255] Trial 2448 finished with value: -0.1936417107583833 and parameters: {'n_estimators': 3302, 'min_samples_split': 2, 'max_features': 0.88, 'min_samples_leaf': 1, 'criterion': 'absolute_error', 'max_depth': 5, 'min_weight_fraction_leaf': 0.0, 'max_leaf_nodes': 20, 'bootstrap': False, 'ccp_alpha': 0.014}. Best is trial 2251 with value: 0.02361845659970214.
[I 2025-04-16 01:24:06,760] Trial 2449 finished with value: -0.1936417107583833 and parameters: {'n_estimators': 3700, 'min_samples_split': 8, 'max_features': 0.92, 'min_samples_leaf': 6, 'criterion': 'absolute_error', 'max_depth': 5, 'min_weight_fraction_leaf': 0.0, 'max_leaf_nodes': 20, 'bootstrap': False, 'ccp_alpha': 0.007}. Best is trial 2251 with value: 0.02361845659970214.
[I 2025-04-16 01:24:10,168] Trial 2450 finished with value: -0.1936417107583833 and parameters: {'n_estimators': 3486, 'min_samples_split': 9, 'max_features': 0.92, 'min_samples_leaf': 3, 'criterion': 'absolute_error', 'max_depth': 5, 'min_weight_fraction_leaf': 0.0, 'max_leaf_nodes': 20, 'bootstrap': False, 'ccp_alpha': 0.006}. Best is trial 2251 with value: 0.02361845659970214.
[I 2025-04-16 01:24:13,504] Trial 2451 finished with value: -30.811121122184478 and parameters: {'n_estimators': 3679, 'min_samples_split': 2, 'max_features': 0.9, 'min_samples_leaf': 3, 'criterion': 'poisson', 'max_depth': 5, 'min_weight_fraction_leaf': 0.0, 'max_leaf_nodes': 20, 'bootstrap': False, 'ccp_alpha': 0.015}. Best is trial 2251 with value: 0.02361845659970214.
[I 2025-04-16 01:24:16,730] Trial 2452 finished with value: -0.1936417107583833 and parameters: {'n_estimators': 3508, 'min_samples_split': 6, 'max_features': 0.88, 'min_samples_leaf': 6, 'criterion': 'absolute_error', 'max_depth': 5, 'min_weight_fraction_leaf': 0.0, 'max_leaf_nodes': 20, 'bootstrap': False, 'ccp_alpha': 0.006}. Best is trial 2251 with value: 0.02361845659970214.
[I 2025-04-16 01:24:20,218] Trial 2453 finished with value: -0.1936417107583833 and parameters: {'n_estimators': 3487, 'min_samples_split': 9, 'max_features': 0.92, 'min_samples_leaf': 1, 'criterion': 'absolute_error', 'max_depth': 5, 'min_weight_fraction_leaf': 0.0, 'max_leaf_nodes': 20, 'bootstrap': False, 'ccp_alpha': 0.011}. Best is trial 2251 with value: 0.02361845659970214.
[I 2025-04-16 01:24:23,813] Trial 2454 finished with value: -0.1936417107583833 and parameters: {'n_estimators': 3756, 'min_samples_split': 6, 'max_features': 0.6900000000000001, 'min_samples_leaf': 5, 'criterion': 'absolute_error', 'max_depth': 5, 'min_weight_fraction_leaf': 0.0, 'max_leaf_nodes': 20, 'bootstrap': False, 'ccp_alpha': 0.02}. Best is trial 2251 with value: 0.02361845659970214.
[I 2025-04-16 01:24:26,783] Trial 2455 finished with value: -0.1936417107583833 and parameters: {'n_estimators': 3274, 'min_samples_split': 2, 'max_features': 0.92, 'min_samples_leaf': 3, 'criterion': 'absolute_error', 'max_depth': 5, 'min_weight_fraction_leaf': 0.0, 'max_leaf_nodes': 20, 'bootstrap': False, 'ccp_alpha': 0.007}. Best is trial 2251 with value: 0.02361845659970214.
[I 2025-04-16 01:24:30,529] Trial 2456 finished with value: -0.1936417107583833 and parameters: {'n_estimators': 3746, 'min_samples_split': 9, 'max_features': 0.9, 'min_samples_leaf': 1, 'criterion': 'absolute_error', 'max_depth': 5, 'min_weight_fraction_leaf': 0.0, 'max_leaf_nodes': 20, 'bootstrap': False, 'ccp_alpha': 0.146}. Best is trial 2251 with value: 0.02361845659970214.
[I 2025-04-16 01:24:34,036] Trial 2457 finished with value: -0.1936417107583833 and parameters: {'n_estimators': 3716, 'min_samples_split': 6, 'max_features': 0.93, 'min_samples_leaf': 5, 'criterion': 'absolute_error', 'max_depth': 5, 'min_weight_fraction_leaf': 0.0, 'max_leaf_nodes': 20, 'bootstrap': False, 'ccp_alpha': 0.015}. Best is trial 2251 with value: 0.02361845659970214.
[I 2025-04-16 01:24:37,459] Trial 2458 finished with value: -0.03192089315231876 and parameters: {'n_estimators': 3491, 'min_samples_split': 2, 'max_features': 0.92, 'min_samples_leaf': 3, 'criterion': 'absolute_error', 'max_depth': 5, 'min_weight_fraction_leaf': 0.0, 'max_leaf_nodes': 20, 'bootstrap': False, 'ccp_alpha': 0.006}. Best is trial 2251 with value: 0.02361845659970214.
[I 2025-04-16 01:24:40,623] Trial 2459 finished with value: -0.1936417107583833 and parameters: {'n_estimators': 3313, 'min_samples_split': 2, 'max_features': 0.88, 'min_samples_leaf': 3, 'criterion': 'absolute_error', 'max_depth': 5, 'min_weight_fraction_leaf': 0.0, 'max_leaf_nodes': 20, 'bootstrap': False, 'ccp_alpha': 0.019}. Best is trial 2251 with value: 0.02361845659970214.
[I 2025-04-16 01:24:43,572] Trial 2460 finished with value: -0.1936417107583833 and parameters: {'n_estimators': 3344, 'min_samples_split': 2, 'max_features': 0.9, 'min_samples_leaf': 3, 'criterion': 'absolute_error', 'max_depth': 5, 'min_weight_fraction_leaf': 0.0, 'max_leaf_nodes': 20, 'bootstrap': False, 'ccp_alpha': 0.023}. Best is trial 2251 with value: 0.02361845659970214.
[I 2025-04-16 01:24:46,823] Trial 2461 finished with value: -17.52898638227587 and parameters: {'n_estimators': 3280, 'min_samples_split': 5, 'max_features': 0.89, 'min_samples_leaf': 5, 'criterion': 'friedman_mse', 'max_depth': 5, 'min_weight_fraction_leaf': 0.0, 'max_leaf_nodes': 20, 'bootstrap': False, 'ccp_alpha': 0.026000000000000002}. Best is trial 2251 with value: 0.02361845659970214.
[I 2025-04-16 01:24:49,766] Trial 2462 finished with value: -0.1936417107583833 and parameters: {'n_estimators': 3232, 'min_samples_split': 6, 'max_features': 0.88, 'min_samples_leaf': 1, 'criterion': 'absolute_error', 'max_depth': 5, 'min_weight_fraction_leaf': 0.0, 'max_leaf_nodes': 20, 'bootstrap': False, 'ccp_alpha': 0.015}. Best is trial 2251 with value: 0.02361845659970214.
[I 2025-04-16 01:24:53,578] Trial 2463 finished with value: -0.1936417107583833 and parameters: {'n_estimators': 3224, 'min_samples_split': 2, 'max_features': 0.91, 'min_samples_leaf': 3, 'criterion': 'absolute_error', 'max_depth': 5, 'min_weight_fraction_leaf': 0.0, 'max_leaf_nodes': 20, 'bootstrap': False, 'ccp_alpha': 0.015}. Best is trial 2251 with value: 0.02361845659970214.
[I 2025-04-16 01:24:57,521] Trial 2464 finished with value: -0.1936417107583833 and parameters: {'n_estimators': 3464, 'min_samples_split': 6, 'max_features': 0.9, 'min_samples_leaf': 6, 'criterion': 'absolute_error', 'max_depth': 5, 'min_weight_fraction_leaf': 0.0, 'max_leaf_nodes': 20, 'bootstrap': False, 'ccp_alpha': 0.011}. Best is trial 2251 with value: 0.02361845659970214.
[I 2025-04-16 01:25:00,839] Trial 2465 finished with value: -0.1936417107583833 and parameters: {'n_estimators': 3275, 'min_samples_split': 2, 'max_features': 0.91, 'min_samples_leaf': 4, 'criterion': 'absolute_error', 'max_depth': 5, 'min_weight_fraction_leaf': 0.0, 'max_leaf_nodes': 20, 'bootstrap': False, 'ccp_alpha': 0.02}. Best is trial 2251 with value: 0.02361845659970214.
[I 2025-04-16 01:25:03,627] Trial 2466 finished with value: -0.1936417107583833 and parameters: {'n_estimators': 3471, 'min_samples_split': 5, 'max_features': 0.87, 'min_samples_leaf': 3, 'criterion': 'absolute_error', 'max_depth': 5, 'min_weight_fraction_leaf': 0.0, 'max_leaf_nodes': 20, 'bootstrap': False, 'ccp_alpha': 0.011}. Best is trial 2251 with value: 0.02361845659970214.
[I 2025-04-16 01:25:06,683] Trial 2467 finished with value: -0.1936417107583833 and parameters: {'n_estimators': 3495, 'min_samples_split': 2, 'max_features': 0.9, 'min_samples_leaf': 6, 'criterion': 'absolute_error', 'max_depth': 5, 'min_weight_fraction_leaf': 0.0, 'max_leaf_nodes': 20, 'bootstrap': False, 'ccp_alpha': 0.027}. Best is trial 2251 with value: 0.02361845659970214.
[I 2025-04-16 01:25:09,782] Trial 2468 finished with value: -0.1936417107583833 and parameters: {'n_estimators': 3588, 'min_samples_split': 6, 'max_features': 0.88, 'min_samples_leaf': 1, 'criterion': 'absolute_error', 'max_depth': 5, 'min_weight_fraction_leaf': 0.0, 'max_leaf_nodes': 20, 'bootstrap': False, 'ccp_alpha': 0.01}. Best is trial 2251 with value: 0.02361845659970214.
[I 2025-04-16 01:25:13,014] Trial 2469 finished with value: -0.1936417107583833 and parameters: {'n_estimators': 3459, 'min_samples_split': 2, 'max_features': 0.9, 'min_samples_leaf': 4, 'criterion': 'absolute_error', 'max_depth': 5, 'min_weight_fraction_leaf': 0.0, 'max_leaf_nodes': 300, 'bootstrap': False, 'ccp_alpha': 0.006}. Best is trial 2251 with value: 0.02361845659970214.
[I 2025-04-16 01:25:15,771] Trial 2470 finished with value: -17.52898638227591 and parameters: {'n_estimators': 3268, 'min_samples_split': 9, 'max_features': 0.92, 'min_samples_leaf': 1, 'criterion': 'squared_error', 'max_depth': 5, 'min_weight_fraction_leaf': 0.0, 'max_leaf_nodes': 20, 'bootstrap': False, 'ccp_alpha': 0.016}. Best is trial 2251 with value: 0.02361845659970214.
[I 2025-04-16 01:25:19,295] Trial 2471 finished with value: -0.1936417107583833 and parameters: {'n_estimators': 3609, 'min_samples_split': 6, 'max_features': 0.92, 'min_samples_leaf': 6, 'criterion': 'absolute_error', 'max_depth': 5, 'min_weight_fraction_leaf': 0.0, 'max_leaf_nodes': 20, 'bootstrap': False, 'ccp_alpha': 0.006}. Best is trial 2251 with value: 0.02361845659970214.
[I 2025-04-16 01:25:22,373] Trial 2472 finished with value: -0.1936417107583833 and parameters: {'n_estimators': 3500, 'min_samples_split': 2, 'max_features': 0.92, 'min_samples_leaf': 3, 'criterion': 'absolute_error', 'max_depth': 5, 'min_weight_fraction_leaf': 0.0, 'max_leaf_nodes': 20, 'bootstrap': False, 'ccp_alpha': 0.013000000000000001}. Best is trial 2251 with value: 0.02361845659970214.
[I 2025-04-16 01:25:25,492] Trial 2473 finished with value: -0.1936417107583833 and parameters: {'n_estimators': 3675, 'min_samples_split': 9, 'max_features': 0.92, 'min_samples_leaf': 5, 'criterion': 'absolute_error', 'max_depth': 5, 'min_weight_fraction_leaf': 0.0, 'max_leaf_nodes': 20, 'bootstrap': False, 'ccp_alpha': 0.006}. Best is trial 2251 with value: 0.02361845659970214.
[I 2025-04-16 01:25:28,303] Trial 2474 finished with value: -0.1936417107583833 and parameters: {'n_estimators': 3227, 'min_samples_split': 6, 'max_features': 0.88, 'min_samples_leaf': 3, 'criterion': 'absolute_error', 'max_depth': 5, 'min_weight_fraction_leaf': 0.0, 'max_leaf_nodes': 20, 'bootstrap': False, 'ccp_alpha': 0.032}. Best is trial 2251 with value: 0.02361845659970214.
[I 2025-04-16 01:25:31,137] Trial 2475 finished with value: -0.1936417107583833 and parameters: {'n_estimators': 3240, 'min_samples_split': 9, 'max_features': 0.9, 'min_samples_leaf': 1, 'criterion': 'absolute_error', 'max_depth': 5, 'min_weight_fraction_leaf': 0.0, 'max_leaf_nodes': 20, 'bootstrap': False, 'ccp_alpha': 0.019}. Best is trial 2251 with value: 0.02361845659970214.
[I 2025-04-16 01:25:34,704] Trial 2476 finished with value: -0.1936417107583833 and parameters: {'n_estimators': 3697, 'min_samples_split': 2, 'max_features': 0.93, 'min_samples_leaf': 6, 'criterion': 'absolute_error', 'max_depth': 5, 'min_weight_fraction_leaf': 0.0, 'max_leaf_nodes': 20, 'bootstrap': False, 'ccp_alpha': 0.01}. Best is trial 2251 with value: 0.02361845659970214.
[I 2025-04-16 01:25:37,919] Trial 2477 finished with value: -29.390180727703147 and parameters: {'n_estimators': 3417, 'min_samples_split': 6, 'max_features': 0.92, 'min_samples_leaf': 3, 'criterion': 'poisson', 'max_depth': 5, 'min_weight_fraction_leaf': 0.0, 'max_leaf_nodes': 20, 'bootstrap': False, 'ccp_alpha': 0.006}. Best is trial 2251 with value: 0.02361845659970214.
[I 2025-04-16 01:25:41,206] Trial 2478 finished with value: -0.1936417107583833 and parameters: {'n_estimators': 3661, 'min_samples_split': 9, 'max_features': 0.9, 'min_samples_leaf': 1, 'criterion': 'absolute_error', 'max_depth': 5, 'min_weight_fraction_leaf': 0.0, 'max_leaf_nodes': 20, 'bootstrap': False, 'ccp_alpha': 0.013000000000000001}. Best is trial 2251 with value: 0.02361845659970214.
[I 2025-04-16 01:25:44,423] Trial 2479 finished with value: -0.1936417107583833 and parameters: {'n_estimators': 3523, 'min_samples_split': 2, 'max_features': 0.93, 'min_samples_leaf': 5, 'criterion': 'absolute_error', 'max_depth': 5, 'min_weight_fraction_leaf': 0.0, 'max_leaf_nodes': 20, 'bootstrap': False, 'ccp_alpha': 0.006}. Best is trial 2251 with value: 0.02361845659970214.
[I 2025-04-16 01:25:47,925] Trial 2480 finished with value: -0.1936417107583833 and parameters: {'n_estimators': 3706, 'min_samples_split': 5, 'max_features': 0.88, 'min_samples_leaf': 4, 'criterion': 'absolute_error', 'max_depth': 5, 'min_weight_fraction_leaf': 0.0, 'max_leaf_nodes': 20, 'bootstrap': False, 'ccp_alpha': 0.019}. Best is trial 2251 with value: 0.02361845659970214.
[I 2025-04-16 01:25:50,851] Trial 2481 finished with value: -0.1936417107583833 and parameters: {'n_estimators': 3233, 'min_samples_split': 9, 'max_features': 0.92, 'min_samples_leaf': 6, 'criterion': 'absolute_error', 'max_depth': 5, 'min_weight_fraction_leaf': 0.0, 'max_leaf_nodes': 20, 'bootstrap': False, 'ccp_alpha': 0.012}. Best is trial 2251 with value: 0.02361845659970214.
[I 2025-04-16 01:25:54,232] Trial 2482 finished with value: -0.1936417107583833 and parameters: {'n_estimators': 3468, 'min_samples_split': 6, 'max_features': 0.9, 'min_samples_leaf': 1, 'criterion': 'absolute_error', 'max_depth': 5, 'min_weight_fraction_leaf': 0.0, 'max_leaf_nodes': 20, 'bootstrap': False, 'ccp_alpha': 0.007}. Best is trial 2251 with value: 0.02361845659970214.
[I 2025-04-16 01:25:57,597] Trial 2483 finished with value: -0.0329603929291294 and parameters: {'n_estimators': 3689, 'min_samples_split': 2, 'max_features': 0.93, 'min_samples_leaf': 3, 'criterion': 'absolute_error', 'max_depth': 5, 'min_weight_fraction_leaf': 0.0, 'max_leaf_nodes': 20, 'bootstrap': False, 'ccp_alpha': 0.006}. Best is trial 2251 with value: 0.02361845659970214.
[I 2025-04-16 01:26:00,766] Trial 2484 finished with value: -0.1936417107583833 and parameters: {'n_estimators': 3268, 'min_samples_split': 2, 'max_features': 0.88, 'min_samples_leaf': 3, 'criterion': 'absolute_error', 'max_depth': 5, 'min_weight_fraction_leaf': 0.0, 'max_leaf_nodes': 20, 'bootstrap': False, 'ccp_alpha': 0.022}. Best is trial 2251 with value: 0.02361845659970214.
[I 2025-04-16 01:26:04,239] Trial 2485 finished with value: -0.1936417107583833 and parameters: {'n_estimators': 3507, 'min_samples_split': 2, 'max_features': 0.91, 'min_samples_leaf': 4, 'criterion': 'absolute_error', 'max_depth': 5, 'min_weight_fraction_leaf': 0.0, 'max_leaf_nodes': 20, 'bootstrap': False, 'ccp_alpha': 0.026000000000000002}. Best is trial 2251 with value: 0.02361845659970214.
[I 2025-04-16 01:26:07,470] Trial 2486 finished with value: -0.1936417107583833 and parameters: {'n_estimators': 3439, 'min_samples_split': 2, 'max_features': 0.9, 'min_samples_leaf': 3, 'criterion': 'absolute_error', 'max_depth': 5, 'min_weight_fraction_leaf': 0.0, 'max_leaf_nodes': 20, 'bootstrap': False, 'ccp_alpha': 0.017}. Best is trial 2251 with value: 0.02361845659970214.
[I 2025-04-16 01:26:10,352] Trial 2487 finished with value: -17.52898638227601 and parameters: {'n_estimators': 3235, 'min_samples_split': 5, 'max_features': 0.93, 'min_samples_leaf': 1, 'criterion': 'friedman_mse', 'max_depth': 5, 'min_weight_fraction_leaf': 0.0, 'max_leaf_nodes': 20, 'bootstrap': False, 'ccp_alpha': 0.018000000000000002}. Best is trial 2251 with value: 0.02361845659970214.
[I 2025-04-16 01:26:16,405] Trial 2488 finished with value: -0.1936417107583833 and parameters: {'n_estimators': 6578, 'min_samples_split': 2, 'max_features': 0.87, 'min_samples_leaf': 6, 'criterion': 'absolute_error', 'max_depth': 5, 'min_weight_fraction_leaf': 0.0, 'max_leaf_nodes': 20, 'bootstrap': False, 'ccp_alpha': 0.013000000000000001}. Best is trial 2251 with value: 0.02361845659970214.
[I 2025-04-16 01:26:19,962] Trial 2489 finished with value: -0.1936417107583833 and parameters: {'n_estimators': 3667, 'min_samples_split': 5, 'max_features': 0.92, 'min_samples_leaf': 3, 'criterion': 'absolute_error', 'max_depth': 5, 'min_weight_fraction_leaf': 0.0, 'max_leaf_nodes': 20, 'bootstrap': False, 'ccp_alpha': 0.023}. Best is trial 2251 with value: 0.02361845659970214.
[I 2025-04-16 01:26:23,350] Trial 2490 finished with value: -0.1936417107583833 and parameters: {'n_estimators': 3431, 'min_samples_split': 6, 'max_features': 0.9, 'min_samples_leaf': 5, 'criterion': 'absolute_error', 'max_depth': 5, 'min_weight_fraction_leaf': 0.0, 'max_leaf_nodes': 20, 'bootstrap': False, 'ccp_alpha': 0.014}. Best is trial 2251 with value: 0.02361845659970214.
