[I 2025-04-15 23:47:06,628] Trial 798 finished with value: -0.1827021072750023 and parameters: {'n_estimators': 2760, 'min_samples_split': 177, 'max_features': 0.88, 'min_samples_leaf': 30, 'criterion': 'absolute_error', 'max_depth': 45, 'min_weight_fraction_leaf': 0.03, 'max_leaf_nodes': 100, 'bootstrap': True, 'ccp_alpha': 0.061, 'max_samples': 0.5}. Best is trial 621 with value: -0.18112741123578058.
[I 2025-04-15 23:47:10,250] Trial 799 finished with value: -0.1826134824874938 and parameters: {'n_estimators': 3036, 'min_samples_split': 29, 'max_features': 0.8300000000000001, 'min_samples_leaf': 27, 'criterion': 'absolute_error', 'max_depth': 15, 'min_weight_fraction_leaf': 0.02, 'max_leaf_nodes': 100, 'bootstrap': True, 'ccp_alpha': 0.083, 'max_samples': 0.5}. Best is trial 621 with value: -0.18112741123578058.
[I 2025-04-15 23:47:14,735] Trial 800 finished with value: -0.18329974098907248 and parameters: {'n_estimators': 3504, 'min_samples_split': 22, 'max_features': 0.22, 'min_samples_leaf': 29, 'criterion': 'absolute_error', 'max_depth': 30, 'min_weight_fraction_leaf': 0.02, 'max_leaf_nodes': 50, 'bootstrap': True, 'ccp_alpha': 0.111, 'max_samples': 0.5}. Best is trial 621 with value: -0.18112741123578058.
[I 2025-04-15 23:47:18,897] Trial 801 finished with value: -0.18289946822990263 and parameters: {'n_estimators': 3839, 'min_samples_split': 166, 'max_features': 0.37, 'min_samples_leaf': 33, 'criterion': 'absolute_error', 'max_depth': 45, 'min_weight_fraction_leaf': 0.0, 'max_leaf_nodes': 20, 'bootstrap': True, 'ccp_alpha': 0.09, 'max_samples': 0.5}. Best is trial 621 with value: -0.18112741123578058.
[I 2025-04-15 23:47:22,488] Trial 802 finished with value: -0.18291137570246585 and parameters: {'n_estimators': 3272, 'min_samples_split': 171, 'max_features': 0.9400000000000001, 'min_samples_leaf': 27, 'criterion': 'absolute_error', 'max_depth': 30, 'min_weight_fraction_leaf': 0.01, 'max_leaf_nodes': 100, 'bootstrap': True, 'ccp_alpha': 0.049, 'max_samples': 0.5}. Best is trial 621 with value: -0.18112741123578058.
[I 2025-04-15 23:47:25,799] Trial 803 finished with value: -0.18262153114621582 and parameters: {'n_estimators': 2951, 'min_samples_split': 43, 'max_features': 0.86, 'min_samples_leaf': 38, 'criterion': 'absolute_error', 'max_depth': 15, 'min_weight_fraction_leaf': 0.01, 'max_leaf_nodes': 150, 'bootstrap': True, 'ccp_alpha': 0.25, 'max_samples': 0.5}. Best is trial 621 with value: -0.18112741123578058.
[I 2025-04-15 23:47:26,177] Trial 804 finished with value: -18.66587497062447 and parameters: {'n_estimators': 211, 'min_samples_split': 162, 'max_features': 0.78, 'min_samples_leaf': 23, 'criterion': 'squared_error', 'max_depth': 45, 'min_weight_fraction_leaf': 0.02, 'max_leaf_nodes': 10, 'bootstrap': True, 'ccp_alpha': 0.067, 'max_samples': 0.5}. Best is trial 621 with value: -0.18112741123578058.
[I 2025-04-15 23:47:29,154] Trial 805 finished with value: -0.18269331689287838 and parameters: {'n_estimators': 2738, 'min_samples_split': 155, 'max_features': 0.91, 'min_samples_leaf': 18, 'criterion': 'absolute_error', 'max_depth': 30, 'min_weight_fraction_leaf': 0.07, 'max_leaf_nodes': 100, 'bootstrap': True, 'ccp_alpha': 0.105, 'max_samples': 0.5}. Best is trial 621 with value: -0.18112741123578058.
[I 2025-04-15 23:47:31,799] Trial 806 finished with value: -0.1838280826131548 and parameters: {'n_estimators': 2373, 'min_samples_split': 18, 'max_features': 0.28, 'min_samples_leaf': 31, 'criterion': 'absolute_error', 'max_depth': 20, 'min_weight_fraction_leaf': 0.02, 'max_leaf_nodes': 100, 'bootstrap': True, 'ccp_alpha': 0.059000000000000004, 'max_samples': 0.5}. Best is trial 621 with value: -0.18112741123578058.
[I 2025-04-15 23:47:35,413] Trial 807 finished with value: -0.18262783159245996 and parameters: {'n_estimators': 3132, 'min_samples_split': 178, 'max_features': 0.6, 'min_samples_leaf': 35, 'criterion': 'absolute_error', 'max_depth': None, 'min_weight_fraction_leaf': 0.0, 'max_leaf_nodes': 150, 'bootstrap': True, 'ccp_alpha': 0.075, 'max_samples': 0.5}. Best is trial 621 with value: -0.18112741123578058.
[I 2025-04-15 23:47:38,999] Trial 808 finished with value: -0.18295430239740668 and parameters: {'n_estimators': 3317, 'min_samples_split': 25, 'max_features': 0.8300000000000001, 'min_samples_leaf': 25, 'criterion': 'absolute_error', 'max_depth': 30, 'min_weight_fraction_leaf': 0.01, 'max_leaf_nodes': 100, 'bootstrap': True, 'ccp_alpha': 0.095, 'max_samples': 0.5}. Best is trial 621 with value: -0.18112741123578058.
[I 2025-04-15 23:47:42,284] Trial 809 finished with value: -0.18259117965226895 and parameters: {'n_estimators': 2941, 'min_samples_split': 35, 'max_features': 0.88, 'min_samples_leaf': 29, 'criterion': 'absolute_error', 'max_depth': 60, 'min_weight_fraction_leaf': 0.02, 'max_leaf_nodes': 50, 'bootstrap': True, 'ccp_alpha': 0.089, 'max_samples': 0.5}. Best is trial 621 with value: -0.18112741123578058.
[I 2025-04-15 23:47:45,266] Trial 810 finished with value: -0.18295125572938192 and parameters: {'n_estimators': 2554, 'min_samples_split': 194, 'max_features': 0.81, 'min_samples_leaf': 21, 'criterion': 'absolute_error', 'max_depth': 45, 'min_weight_fraction_leaf': 0.01, 'max_leaf_nodes': 100, 'bootstrap': True, 'ccp_alpha': 0.1, 'max_samples': 0.5}. Best is trial 621 with value: -0.18112741123578058.
[I 2025-04-15 23:47:53,623] Trial 811 finished with value: -17.528893523893686 and parameters: {'n_estimators': 8542, 'min_samples_split': 39, 'max_features': 0.17, 'min_samples_leaf': 27, 'criterion': 'poisson', 'max_depth': 15, 'min_weight_fraction_leaf': 0.02, 'max_leaf_nodes': None, 'bootstrap': True, 'ccp_alpha': 0.15, 'max_samples': 0.5}. Best is trial 621 with value: -0.18112741123578058.
[I 2025-04-15 23:47:57,518] Trial 812 finished with value: -0.19329568677750159 and parameters: {'n_estimators': 3447, 'min_samples_split': 182, 'max_features': 0.86, 'min_samples_leaf': 33, 'criterion': 'absolute_error', 'max_depth': 30, 'min_weight_fraction_leaf': 0.01, 'max_leaf_nodes': 100, 'bootstrap': True, 'ccp_alpha': 0.069, 'max_samples': None}. Best is trial 621 with value: -0.18112741123578058.
[I 2025-04-15 23:48:01,104] Trial 813 finished with value: -0.18269111005118047 and parameters: {'n_estimators': 3173, 'min_samples_split': 30, 'max_features': 0.34, 'min_samples_leaf': 24, 'criterion': 'absolute_error', 'max_depth': 5, 'min_weight_fraction_leaf': 0.02, 'max_leaf_nodes': 10, 'bootstrap': True, 'ccp_alpha': 0.081, 'max_samples': 0.5}. Best is trial 621 with value: -0.18112741123578058.
[I 2025-04-15 23:48:01,440] Trial 814 finished with value: -0.1936417107583833 and parameters: {'n_estimators': 198, 'min_samples_split': 173, 'max_features': 0.8400000000000001, 'min_samples_leaf': 31, 'criterion': 'absolute_error', 'max_depth': 45, 'min_weight_fraction_leaf': 0.02, 'max_leaf_nodes': 150, 'bootstrap': False, 'ccp_alpha': 0.12}. Best is trial 621 with value: -0.18112741123578058.
[I 2025-04-15 23:48:04,930] Trial 815 finished with value: -0.18298116097529782 and parameters: {'n_estimators': 2873, 'min_samples_split': 168, 'max_features': 0.72, 'min_samples_leaf': 28, 'criterion': 'absolute_error', 'max_depth': 30, 'min_weight_fraction_leaf': 0.03, 'max_leaf_nodes': 100, 'bootstrap': True, 'ccp_alpha': 0.054, 'max_samples': 0.5}. Best is trial 621 with value: -0.18112741123578058.
[I 2025-04-15 23:48:05,567] Trial 816 finished with value: -0.1876753164751992 and parameters: {'n_estimators': 444, 'min_samples_split': 158, 'max_features': 0.77, 'min_samples_leaf': 26, 'criterion': 'absolute_error', 'max_depth': 30, 'min_weight_fraction_leaf': 0.01, 'max_leaf_nodes': 50, 'bootstrap': True, 'ccp_alpha': 0.06, 'max_samples': 0.5}. Best is trial 621 with value: -0.18112741123578058.
[I 2025-04-15 23:48:16,937] Trial 817 finished with value: -0.1932641534338287 and parameters: {'n_estimators': 9698, 'min_samples_split': 178, 'max_features': 0.92, 'min_samples_leaf': 29, 'criterion': 'absolute_error', 'max_depth': 45, 'min_weight_fraction_leaf': 0.0, 'max_leaf_nodes': 100, 'bootstrap': True, 'ccp_alpha': 0.106, 'max_samples': 1.0}. Best is trial 621 with value: -0.18112741123578058.
[I 2025-04-15 23:48:20,061] Trial 818 finished with value: -0.18280993448413688 and parameters: {'n_estimators': 2706, 'min_samples_split': 151, 'max_features': 0.88, 'min_samples_leaf': 35, 'criterion': 'absolute_error', 'max_depth': 15, 'min_weight_fraction_leaf': 0.01, 'max_leaf_nodes': 150, 'bootstrap': True, 'ccp_alpha': 0.076, 'max_samples': 0.5}. Best is trial 621 with value: -0.18112741123578058.
[I 2025-04-15 23:48:23,139] Trial 819 finished with value: -18.082403603503934 and parameters: {'n_estimators': 3037, 'min_samples_split': 48, 'max_features': 0.8, 'min_samples_leaf': 54, 'criterion': 'friedman_mse', 'max_depth': 30, 'min_weight_fraction_leaf': 0.06, 'max_leaf_nodes': 300, 'bootstrap': True, 'ccp_alpha': 0.085, 'max_samples': 0.5}. Best is trial 621 with value: -0.18112741123578058.
[I 2025-04-15 23:48:27,349] Trial 820 finished with value: -0.1911836972565109 and parameters: {'n_estimators': 3520, 'min_samples_split': 189, 'max_features': 0.13, 'min_samples_leaf': 31, 'criterion': 'absolute_error', 'max_depth': 45, 'min_weight_fraction_leaf': 0.02, 'max_leaf_nodes': 100, 'bootstrap': True, 'ccp_alpha': 0.046, 'max_samples': 0.75}. Best is trial 621 with value: -0.18112741123578058.
[I 2025-04-15 23:48:30,034] Trial 821 finished with value: -0.1838258659174759 and parameters: {'n_estimators': 2177, 'min_samples_split': 165, 'max_features': 0.9, 'min_samples_leaf': 22, 'criterion': 'absolute_error', 'max_depth': 20, 'min_weight_fraction_leaf': 0.1, 'max_leaf_nodes': 100, 'bootstrap': True, 'ccp_alpha': 0.095, 'max_samples': 0.5}. Best is trial 621 with value: -0.18112741123578058.
[I 2025-04-15 23:48:31,138] Trial 822 finished with value: -0.1865631880326455 and parameters: {'n_estimators': 804, 'min_samples_split': 185, 'max_features': 0.85, 'min_samples_leaf': 11, 'criterion': 'absolute_error', 'max_depth': 30, 'min_weight_fraction_leaf': 0.02, 'max_leaf_nodes': 10, 'bootstrap': True, 'ccp_alpha': 0.067, 'max_samples': 0.5}. Best is trial 621 with value: -0.18112741123578058.
[I 2025-04-15 23:48:34,704] Trial 823 finished with value: -0.18283561204462723 and parameters: {'n_estimators': 3244, 'min_samples_split': 16, 'max_features': 0.8200000000000001, 'min_samples_leaf': 24, 'criterion': 'absolute_error', 'max_depth': None, 'min_weight_fraction_leaf': 0.0, 'max_leaf_nodes': 100, 'bootstrap': True, 'ccp_alpha': 0.112, 'max_samples': 0.5}. Best is trial 621 with value: -0.18112741123578058.
[I 2025-04-15 23:48:38,860] Trial 824 finished with value: -0.183444412143269 and parameters: {'n_estimators': 3669, 'min_samples_split': 44, 'max_features': 0.24000000000000002, 'min_samples_leaf': 27, 'criterion': 'absolute_error', 'max_depth': 15, 'min_weight_fraction_leaf': 0.04, 'max_leaf_nodes': 150, 'bootstrap': True, 'ccp_alpha': 0.09, 'max_samples': 0.5}. Best is trial 621 with value: -0.18112741123578058.
[I 2025-04-15 23:48:39,031] Trial 825 finished with value: -0.19363718282020428 and parameters: {'n_estimators': 11, 'min_samples_split': 54, 'max_features': 0.9400000000000001, 'min_samples_leaf': 32, 'criterion': 'absolute_error', 'max_depth': 5, 'min_weight_fraction_leaf': 0.02, 'max_leaf_nodes': 50, 'bootstrap': True, 'ccp_alpha': 0.051000000000000004, 'max_samples': 0.5}. Best is trial 621 with value: -0.18112741123578058.
[I 2025-04-15 23:48:42,354] Trial 826 finished with value: -0.18258971160814266 and parameters: {'n_estimators': 2930, 'min_samples_split': 22, 'max_features': 0.87, 'min_samples_leaf': 29, 'criterion': 'absolute_error', 'max_depth': 45, 'min_weight_fraction_leaf': 0.01, 'max_leaf_nodes': 100, 'bootstrap': True, 'ccp_alpha': 0.101, 'max_samples': 0.5}. Best is trial 621 with value: -0.18112741123578058.
[I 2025-04-15 23:48:47,083] Trial 827 finished with value: -0.18311215336680498 and parameters: {'n_estimators': 4119, 'min_samples_split': 161, 'max_features': 0.74, 'min_samples_leaf': 26, 'criterion': 'absolute_error', 'max_depth': 60, 'min_weight_fraction_leaf': 0.02, 'max_leaf_nodes': 100, 'bootstrap': True, 'ccp_alpha': 0.062, 'max_samples': 0.5}. Best is trial 621 with value: -0.18112741123578058.
[I 2025-04-15 23:48:50,581] Trial 828 finished with value: -0.18256640512953376 and parameters: {'n_estimators': 3107, 'min_samples_split': 143, 'max_features': 0.79, 'min_samples_leaf': 33, 'criterion': 'absolute_error', 'max_depth': 30, 'min_weight_fraction_leaf': 0.08, 'max_leaf_nodes': None, 'bootstrap': True, 'ccp_alpha': 0.073, 'max_samples': 0.5}. Best is trial 621 with value: -0.18112741123578058.
[I 2025-04-15 23:48:53,553] Trial 829 finished with value: -0.18294109025977048 and parameters: {'n_estimators': 2660, 'min_samples_split': 37, 'max_features': 0.8300000000000001, 'min_samples_leaf': 30, 'criterion': 'absolute_error', 'max_depth': 30, 'min_weight_fraction_leaf': 0.01, 'max_leaf_nodes': 150, 'bootstrap': True, 'ccp_alpha': 0.08, 'max_samples': 0.5}. Best is trial 621 with value: -0.18112741123578058.
[I 2025-04-15 23:48:57,124] Trial 830 finished with value: -0.18297872804124285 and parameters: {'n_estimators': 3374, 'min_samples_split': 28, 'max_features': 0.7000000000000001, 'min_samples_leaf': 39, 'criterion': 'absolute_error', 'max_depth': 45, 'min_weight_fraction_leaf': 0.03, 'max_leaf_nodes': 100, 'bootstrap': True, 'ccp_alpha': 0.065, 'max_samples': 0.5}. Best is trial 621 with value: -0.18112741123578058.
[I 2025-04-15 23:48:57,733] Trial 831 finished with value: -19.207591967708275 and parameters: {'n_estimators': 338, 'min_samples_split': 169, 'max_features': 0.86, 'min_samples_leaf': 16, 'criterion': 'squared_error', 'max_depth': 15, 'min_weight_fraction_leaf': 0.0, 'max_leaf_nodes': 100, 'bootstrap': True, 'ccp_alpha': 0.057, 'max_samples': 0.5}. Best is trial 621 with value: -0.18112741123578058.
[I 2025-04-15 23:48:59,274] Trial 832 finished with value: -0.18677620249755345 and parameters: {'n_estimators': 1212, 'min_samples_split': 174, 'max_features': 0.89, 'min_samples_leaf': 37, 'criterion': 'absolute_error', 'max_depth': 30, 'min_weight_fraction_leaf': 0.02, 'max_leaf_nodes': 50, 'bootstrap': True, 'ccp_alpha': 0.097, 'max_samples': 0.5}. Best is trial 621 with value: -0.18112741123578058.
[I 2025-04-15 23:49:01,861] Trial 833 finished with value: -0.1936417107583833 and parameters: {'n_estimators': 2876, 'min_samples_split': 33, 'max_features': 0.3, 'min_samples_leaf': 24, 'criterion': 'absolute_error', 'max_depth': 45, 'min_weight_fraction_leaf': 0.02, 'max_leaf_nodes': 20, 'bootstrap': False, 'ccp_alpha': 0.126}. Best is trial 621 with value: -0.18112741123578058.
[I 2025-04-15 23:49:04,797] Trial 834 finished with value: -18.212541266471362 and parameters: {'n_estimators': 2439, 'min_samples_split': 149, 'max_features': 0.81, 'min_samples_leaf': 69, 'criterion': 'poisson', 'max_depth': 30, 'min_weight_fraction_leaf': 0.02, 'max_leaf_nodes': 10, 'bootstrap': True, 'ccp_alpha': 0.041, 'max_samples': 0.5}. Best is trial 621 with value: -0.18112741123578058.
[I 2025-04-15 23:49:08,110] Trial 835 finished with value: -0.1827069410541121 and parameters: {'n_estimators': 3068, 'min_samples_split': 155, 'max_features': 0.45, 'min_samples_leaf': 20, 'criterion': 'absolute_error', 'max_depth': 15, 'min_weight_fraction_leaf': 0.01, 'max_leaf_nodes': 150, 'bootstrap': True, 'ccp_alpha': 0.108, 'max_samples': 0.5}. Best is trial 621 with value: -0.18112741123578058.
[I 2025-04-15 23:49:11,836] Trial 836 finished with value: -0.19328636354594733 and parameters: {'n_estimators': 3325, 'min_samples_split': 179, 'max_features': 0.76, 'min_samples_leaf': 27, 'criterion': 'absolute_error', 'max_depth': 20, 'min_weight_fraction_leaf': 0.01, 'max_leaf_nodes': 100, 'bootstrap': True, 'ccp_alpha': 0.08600000000000001, 'max_samples': None}. Best is trial 621 with value: -0.18112741123578058.
[I 2025-04-15 23:49:14,846] Trial 837 finished with value: -0.18275986859458454 and parameters: {'n_estimators': 2778, 'min_samples_split': 25, 'max_features': 0.91, 'min_samples_leaf': 30, 'criterion': 'absolute_error', 'max_depth': 45, 'min_weight_fraction_leaf': 0.03, 'max_leaf_nodes': 100, 'bootstrap': True, 'ccp_alpha': 0.07100000000000001, 'max_samples': 0.5}. Best is trial 621 with value: -0.18112741123578058.
[I 2025-04-15 23:49:15,173] Trial 838 finished with value: -0.184142178761772 and parameters: {'n_estimators': 153, 'min_samples_split': 171, 'max_features': 0.9600000000000001, 'min_samples_leaf': 25, 'criterion': 'absolute_error', 'max_depth': 30, 'min_weight_fraction_leaf': 0.05, 'max_leaf_nodes': 100, 'bootstrap': True, 'ccp_alpha': 0.077, 'max_samples': 0.5}. Best is trial 621 with value: -0.18112741123578058.
[I 2025-04-15 23:49:18,330] Trial 839 finished with value: -0.18275243340795339 and parameters: {'n_estimators': 3195, 'min_samples_split': 41, 'max_features': 0.8400000000000001, 'min_samples_leaf': 45, 'criterion': 'absolute_error', 'max_depth': 60, 'min_weight_fraction_leaf': 0.0, 'max_leaf_nodes': 150, 'bootstrap': True, 'ccp_alpha': 0.115, 'max_samples': 0.5}. Best is trial 621 with value: -0.18112741123578058.
[I 2025-04-15 23:49:21,408] Trial 840 finished with value: -0.18254075316907287 and parameters: {'n_estimators': 2976, 'min_samples_split': 164, 'max_features': 0.89, 'min_samples_leaf': 7, 'criterion': 'absolute_error', 'max_depth': 30, 'min_weight_fraction_leaf': 0.02, 'max_leaf_nodes': 50, 'bootstrap': True, 'ccp_alpha': 0.093, 'max_samples': 0.5}. Best is trial 621 with value: -0.18112741123578058.
[I 2025-04-15 23:49:22,054] Trial 841 finished with value: -0.18829625647305007 and parameters: {'n_estimators': 431, 'min_samples_split': 19, 'max_features': 0.79, 'min_samples_leaf': 34, 'criterion': 'absolute_error', 'max_depth': None, 'min_weight_fraction_leaf': 0.01, 'max_leaf_nodes': 100, 'bootstrap': True, 'ccp_alpha': 0.241, 'max_samples': 0.5}. Best is trial 621 with value: -0.18112741123578058.
[I 2025-04-15 23:49:25,986] Trial 842 finished with value: -0.18320750762441063 and parameters: {'n_estimators': 3464, 'min_samples_split': 183, 'max_features': 0.51, 'min_samples_leaf': 22, 'criterion': 'absolute_error', 'max_depth': 5, 'min_weight_fraction_leaf': 0.06, 'max_leaf_nodes': 100, 'bootstrap': True, 'ccp_alpha': 0.056, 'max_samples': 0.5}. Best is trial 621 with value: -0.18112741123578058.
[I 2025-04-15 23:49:28,153] Trial 843 finished with value: -0.1912510139509918 and parameters: {'n_estimators': 1937, 'min_samples_split': 32, 'max_features': 0.86, 'min_samples_leaf': 66, 'criterion': 'absolute_error', 'max_depth': 45, 'min_weight_fraction_leaf': 0.02, 'max_leaf_nodes': None, 'bootstrap': True, 'ccp_alpha': 0.10400000000000001, 'max_samples': 0.75}. Best is trial 621 with value: -0.18112741123578058.
[I 2025-04-15 23:49:30,964] Trial 844 finished with value: -18.064573229437958 and parameters: {'n_estimators': 2677, 'min_samples_split': 160, 'max_features': 0.8200000000000001, 'min_samples_leaf': 28, 'criterion': 'friedman_mse', 'max_depth': 15, 'min_weight_fraction_leaf': 0.0, 'max_leaf_nodes': 10, 'bootstrap': True, 'ccp_alpha': 0.081, 'max_samples': 1.0}. Best is trial 621 with value: -0.18112741123578058.
[I 2025-04-15 23:49:31,865] Trial 845 finished with value: -0.18724967234762455 and parameters: {'n_estimators': 579, 'min_samples_split': 85, 'max_features': 0.93, 'min_samples_leaf': 52, 'criterion': 'absolute_error', 'max_depth': 30, 'min_weight_fraction_leaf': 0.02, 'max_leaf_nodes': 150, 'bootstrap': True, 'ccp_alpha': 0.063, 'max_samples': 0.5}. Best is trial 621 with value: -0.18112741123578058.
[I 2025-04-15 23:49:35,156] Trial 846 finished with value: -0.1827023078690489 and parameters: {'n_estimators': 3177, 'min_samples_split': 174, 'max_features': 0.32, 'min_samples_leaf': 57, 'criterion': 'absolute_error', 'max_depth': 45, 'min_weight_fraction_leaf': 0.02, 'max_leaf_nodes': 100, 'bootstrap': True, 'ccp_alpha': 0.049, 'max_samples': 0.5}. Best is trial 621 with value: -0.18112741123578058.
[I 2025-04-15 23:49:35,535] Trial 847 finished with value: -0.1860665594711329 and parameters: {'n_estimators': 209, 'min_samples_split': 38, 'max_features': 0.27, 'min_samples_leaf': 32, 'criterion': 'absolute_error', 'max_depth': 30, 'min_weight_fraction_leaf': 0.01, 'max_leaf_nodes': 300, 'bootstrap': True, 'ccp_alpha': 0.088, 'max_samples': 0.5}. Best is trial 621 with value: -0.18112741123578058.
[I 2025-04-15 23:49:40,096] Trial 848 finished with value: -0.18348277206971253 and parameters: {'n_estimators': 3696, 'min_samples_split': 14, 'max_features': 0.88, 'min_samples_leaf': 36, 'criterion': 'absolute_error', 'max_depth': 15, 'min_weight_fraction_leaf': 0.0, 'max_leaf_nodes': 100, 'bootstrap': True, 'ccp_alpha': 0.10200000000000001, 'max_samples': 0.5}. Best is trial 621 with value: -0.18112741123578058.
[I 2025-04-15 23:49:42,010] Trial 849 finished with value: -0.18722940509163483 and parameters: {'n_estimators': 1679, 'min_samples_split': 50, 'max_features': 0.8400000000000001, 'min_samples_leaf': 30, 'criterion': 'absolute_error', 'max_depth': 30, 'min_weight_fraction_leaf': 0.01, 'max_leaf_nodes': 100, 'bootstrap': True, 'ccp_alpha': 0.074, 'max_samples': 0.5}. Best is trial 621 with value: -0.18112741123578058.
[I 2025-04-15 23:49:45,192] Trial 850 finished with value: -0.18276173125836856 and parameters: {'n_estimators': 2918, 'min_samples_split': 28, 'max_features': 0.78, 'min_samples_leaf': 26, 'criterion': 'absolute_error', 'max_depth': 45, 'min_weight_fraction_leaf': 0.02, 'max_leaf_nodes': 50, 'bootstrap': True, 'ccp_alpha': 0.066, 'max_samples': 0.5}. Best is trial 621 with value: -0.18112741123578058.
