[I 2025-04-15 23:57:40,146] Trial 1010 finished with value: -0.18515269869290285 and parameters: {'n_estimators': 180, 'min_samples_split': 167, 'max_features': 0.08, 'min_samples_leaf': 30, 'criterion': 'absolute_error', 'max_depth': 20, 'min_weight_fraction_leaf': 0.02, 'max_leaf_nodes': 100, 'bootstrap': True, 'ccp_alpha': 0.096, 'max_samples': 0.5}. Best is trial 621 with value: -0.18112741123578058.
[I 2025-04-15 23:57:43,352] Trial 1011 finished with value: -0.18306879654985675 and parameters: {'n_estimators': 2902, 'min_samples_split': 184, 'max_features': 0.9400000000000001, 'min_samples_leaf': 20, 'criterion': 'absolute_error', 'max_depth': 30, 'min_weight_fraction_leaf': 0.02, 'max_leaf_nodes': 100, 'bootstrap': True, 'ccp_alpha': 0.10300000000000001, 'max_samples': 0.5}. Best is trial 621 with value: -0.18112741123578058.
[I 2025-04-15 23:57:47,175] Trial 1012 finished with value: -0.18257790940289764 and parameters: {'n_estimators': 3111, 'min_samples_split': 170, 'max_features': 0.88, 'min_samples_leaf': 28, 'criterion': 'absolute_error', 'max_depth': None, 'min_weight_fraction_leaf': 0.06, 'max_leaf_nodes': None, 'bootstrap': True, 'ccp_alpha': 0.08, 'max_samples': 0.5}. Best is trial 621 with value: -0.18112741123578058.
[I 2025-04-15 23:57:50,958] Trial 1013 finished with value: -17.810547041800554 and parameters: {'n_estimators': 3616, 'min_samples_split': 153, 'max_features': 0.2, 'min_samples_leaf': 25, 'criterion': 'friedman_mse', 'max_depth': 45, 'min_weight_fraction_leaf': 0.03, 'max_leaf_nodes': 50, 'bootstrap': True, 'ccp_alpha': 0.08700000000000001, 'max_samples': 0.5}. Best is trial 621 with value: -0.18112741123578058.
[I 2025-04-15 23:57:53,990] Trial 1014 finished with value: -0.1826891917284938 and parameters: {'n_estimators': 2756, 'min_samples_split': 147, 'max_features': 0.9, 'min_samples_leaf': 30, 'criterion': 'absolute_error', 'max_depth': 60, 'min_weight_fraction_leaf': 0.02, 'max_leaf_nodes': 100, 'bootstrap': True, 'ccp_alpha': 0.113, 'max_samples': 0.5}. Best is trial 621 with value: -0.18112741123578058.
[I 2025-04-15 23:57:54,556] Trial 1015 finished with value: -0.19326086816966828 and parameters: {'n_estimators': 319, 'min_samples_split': 19, 'max_features': 0.87, 'min_samples_leaf': 14, 'criterion': 'absolute_error', 'max_depth': 30, 'min_weight_fraction_leaf': 0.02, 'max_leaf_nodes': 100, 'bootstrap': True, 'ccp_alpha': 0.063, 'max_samples': None}. Best is trial 621 with value: -0.18112741123578058.
[I 2025-04-15 23:57:58,610] Trial 1016 finished with value: -0.1829542121466095 and parameters: {'n_estimators': 3288, 'min_samples_split': 10, 'max_features': 0.7100000000000001, 'min_samples_leaf': 35, 'criterion': 'absolute_error', 'max_depth': 5, 'min_weight_fraction_leaf': 0.0, 'max_leaf_nodes': 10, 'bootstrap': True, 'ccp_alpha': 0.07200000000000001, 'max_samples': 0.5}. Best is trial 621 with value: -0.18112741123578058.
[I 2025-04-15 23:58:02,260] Trial 1017 finished with value: -0.18268081115762436 and parameters: {'n_estimators': 3059, 'min_samples_split': 160, 'max_features': 0.89, 'min_samples_leaf': 27, 'criterion': 'absolute_error', 'max_depth': 30, 'min_weight_fraction_leaf': 0.02, 'max_leaf_nodes': 100, 'bootstrap': True, 'ccp_alpha': 0.09, 'max_samples': 0.5}. Best is trial 621 with value: -0.18112741123578058.
[I 2025-04-15 23:58:02,459] Trial 1018 finished with value: -0.1936378239788945 and parameters: {'n_estimators': 13, 'min_samples_split': 179, 'max_features': 0.92, 'min_samples_leaf': 32, 'criterion': 'absolute_error', 'max_depth': 45, 'min_weight_fraction_leaf': 0.02, 'max_leaf_nodes': 100, 'bootstrap': True, 'ccp_alpha': 0.079, 'max_samples': 0.5}. Best is trial 621 with value: -0.18112741123578058.
[I 2025-04-15 23:58:07,262] Trial 1019 finished with value: -0.18327204344362674 and parameters: {'n_estimators': 4298, 'min_samples_split': 189, 'max_features': 0.87, 'min_samples_leaf': 22, 'criterion': 'absolute_error', 'max_depth': 30, 'min_weight_fraction_leaf': 0.06, 'max_leaf_nodes': 20, 'bootstrap': True, 'ccp_alpha': 0.097, 'max_samples': 0.5}. Best is trial 621 with value: -0.18112741123578058.
[I 2025-04-15 23:58:11,305] Trial 1020 finished with value: -0.1832397862544068 and parameters: {'n_estimators': 3477, 'min_samples_split': 173, 'max_features': 0.5, 'min_samples_leaf': 25, 'criterion': 'absolute_error', 'max_depth': 45, 'min_weight_fraction_leaf': 0.02, 'max_leaf_nodes': 50, 'bootstrap': True, 'ccp_alpha': 0.066, 'max_samples': 0.5}. Best is trial 621 with value: -0.18112741123578058.
[I 2025-04-15 23:58:14,889] Trial 1021 finished with value: -0.1829800584883668 and parameters: {'n_estimators': 2537, 'min_samples_split': 25, 'max_features': 0.98, 'min_samples_leaf': 29, 'criterion': 'absolute_error', 'max_depth': 30, 'min_weight_fraction_leaf': 0.0, 'max_leaf_nodes': 100, 'bootstrap': True, 'ccp_alpha': 0.109, 'max_samples': 0.5}. Best is trial 621 with value: -0.18112741123578058.
[I 2025-04-15 23:58:15,522] Trial 1022 finished with value: -17.528986382274873 and parameters: {'n_estimators': 463, 'min_samples_split': 139, 'max_features': 0.32, 'min_samples_leaf': 39, 'criterion': 'squared_error', 'max_depth': 30, 'min_weight_fraction_leaf': 0.03, 'max_leaf_nodes': 100, 'bootstrap': False, 'ccp_alpha': 0.10200000000000001}. Best is trial 621 with value: -0.18112741123578058.
[I 2025-04-15 23:58:19,054] Trial 1023 finished with value: -0.1932854157029844 and parameters: {'n_estimators': 2914, 'min_samples_split': 154, 'max_features': 0.28, 'min_samples_leaf': 26, 'criterion': 'absolute_error', 'max_depth': 45, 'min_weight_fraction_leaf': 0.02, 'max_leaf_nodes': 100, 'bootstrap': True, 'ccp_alpha': 0.083, 'max_samples': 1.0}. Best is trial 621 with value: -0.18112741123578058.
[I 2025-04-15 23:58:22,779] Trial 1024 finished with value: -0.19096120466533817 and parameters: {'n_estimators': 3218, 'min_samples_split': 183, 'max_features': 0.85, 'min_samples_leaf': 33, 'criterion': 'absolute_error', 'max_depth': 20, 'min_weight_fraction_leaf': 0.02, 'max_leaf_nodes': 10, 'bootstrap': True, 'ccp_alpha': 0.073, 'max_samples': 0.75}. Best is trial 621 with value: -0.18112741123578058.
[I 2025-04-15 23:58:26,007] Trial 1025 finished with value: -0.182650907401335 and parameters: {'n_estimators': 2725, 'min_samples_split': 165, 'max_features': 0.93, 'min_samples_leaf': 23, 'criterion': 'absolute_error', 'max_depth': 30, 'min_weight_fraction_leaf': 0.02, 'max_leaf_nodes': None, 'bootstrap': True, 'ccp_alpha': 0.182, 'max_samples': 0.5}. Best is trial 621 with value: -0.18112741123578058.
[I 2025-04-15 23:58:29,820] Trial 1026 finished with value: -0.18265163987356797 and parameters: {'n_estimators': 3049, 'min_samples_split': 177, 'max_features': 0.24000000000000002, 'min_samples_leaf': 28, 'criterion': 'absolute_error', 'max_depth': None, 'min_weight_fraction_leaf': 0.0, 'max_leaf_nodes': 100, 'bootstrap': True, 'ccp_alpha': 0.15, 'max_samples': 0.5}. Best is trial 621 with value: -0.18112741123578058.
[I 2025-04-15 23:58:33,264] Trial 1027 finished with value: -0.18298500919275132 and parameters: {'n_estimators': 3351, 'min_samples_split': 170, 'max_features': 0.9, 'min_samples_leaf': 10, 'criterion': 'absolute_error', 'max_depth': 60, 'min_weight_fraction_leaf': 0.07, 'max_leaf_nodes': 50, 'bootstrap': True, 'ccp_alpha': 0.091, 'max_samples': 0.5}. Best is trial 621 with value: -0.18112741123578058.
[I 2025-04-15 23:58:36,371] Trial 1028 finished with value: -0.18294208429003955 and parameters: {'n_estimators': 2859, 'min_samples_split': 161, 'max_features': 0.15000000000000002, 'min_samples_leaf': 31, 'criterion': 'absolute_error', 'max_depth': 45, 'min_weight_fraction_leaf': 0.05, 'max_leaf_nodes': 100, 'bootstrap': True, 'ccp_alpha': 0.116, 'max_samples': 0.5}. Best is trial 621 with value: -0.18112741123578058.
[I 2025-04-15 23:58:36,747] Trial 1029 finished with value: -18.8000599258783 and parameters: {'n_estimators': 191, 'min_samples_split': 21, 'max_features': 0.87, 'min_samples_leaf': 36, 'criterion': 'poisson', 'max_depth': 5, 'min_weight_fraction_leaf': 0.03, 'max_leaf_nodes': 100, 'bootstrap': True, 'ccp_alpha': 0.124, 'max_samples': 0.5}. Best is trial 621 with value: -0.18112741123578058.
[I 2025-04-15 23:58:40,379] Trial 1030 finished with value: -0.18264327092317106 and parameters: {'n_estimators': 3156, 'min_samples_split': 174, 'max_features': 0.11, 'min_samples_leaf': 17, 'criterion': 'absolute_error', 'max_depth': 30, 'min_weight_fraction_leaf': 0.02, 'max_leaf_nodes': 300, 'bootstrap': True, 'ccp_alpha': 0.061, 'max_samples': 0.5}. Best is trial 621 with value: -0.18112741123578058.
[I 2025-04-15 23:58:42,984] Trial 1031 finished with value: -0.18380191455468955 and parameters: {'n_estimators': 2308, 'min_samples_split': 145, 'max_features': 0.85, 'min_samples_leaf': 27, 'criterion': 'absolute_error', 'max_depth': 30, 'min_weight_fraction_leaf': 0.0, 'max_leaf_nodes': 100, 'bootstrap': True, 'ccp_alpha': 0.068, 'max_samples': 0.5}. Best is trial 621 with value: -0.18112741123578058.
[I 2025-04-15 23:58:46,895] Trial 1032 finished with value: -0.1831675256557015 and parameters: {'n_estimators': 3448, 'min_samples_split': 27, 'max_features': 0.75, 'min_samples_leaf': 30, 'criterion': 'absolute_error', 'max_depth': 45, 'min_weight_fraction_leaf': 0.02, 'max_leaf_nodes': 100, 'bootstrap': True, 'ccp_alpha': 0.096, 'max_samples': 0.5}. Best is trial 621 with value: -0.18112741123578058.
[I 2025-04-15 23:58:49,735] Trial 1033 finished with value: -0.18279748602338725 and parameters: {'n_estimators': 2617, 'min_samples_split': 186, 'max_features': 0.89, 'min_samples_leaf': 41, 'criterion': 'absolute_error', 'max_depth': 30, 'min_weight_fraction_leaf': 0.02, 'max_leaf_nodes': 10, 'bootstrap': True, 'ccp_alpha': 0.077, 'max_samples': 0.5}. Best is trial 621 with value: -0.18112741123578058.
[I 2025-04-15 23:58:53,184] Trial 1034 finished with value: -0.18257093954666934 and parameters: {'n_estimators': 2932, 'min_samples_split': 181, 'max_features': 0.92, 'min_samples_leaf': 21, 'criterion': 'absolute_error', 'max_depth': 45, 'min_weight_fraction_leaf': 0.04, 'max_leaf_nodes': 50, 'bootstrap': True, 'ccp_alpha': 0.08600000000000001, 'max_samples': 0.5}. Best is trial 621 with value: -0.18112741123578058.
[I 2025-04-15 23:58:54,071] Trial 1035 finished with value: -0.18572694815690918 and parameters: {'n_estimators': 612, 'min_samples_split': 150, 'max_features': 0.36000000000000004, 'min_samples_leaf': 62, 'criterion': 'absolute_error', 'max_depth': 10, 'min_weight_fraction_leaf': 0.06, 'max_leaf_nodes': 100, 'bootstrap': True, 'ccp_alpha': 0.107, 'max_samples': 0.5}. Best is trial 621 with value: -0.18112741123578058.
[I 2025-04-15 23:58:58,519] Trial 1036 finished with value: -0.18346212839370404 and parameters: {'n_estimators': 3687, 'min_samples_split': 167, 'max_features': 0.9600000000000001, 'min_samples_leaf': 33, 'criterion': 'absolute_error', 'max_depth': 30, 'min_weight_fraction_leaf': 0.02, 'max_leaf_nodes': 100, 'bootstrap': True, 'ccp_alpha': 0.101, 'max_samples': 0.5}. Best is trial 621 with value: -0.18112741123578058.
[I 2025-04-15 23:59:02,152] Trial 1037 finished with value: -17.95645888135386 and parameters: {'n_estimators': 3187, 'min_samples_split': 18, 'max_features': 0.87, 'min_samples_leaf': 28, 'criterion': 'friedman_mse', 'max_depth': 20, 'min_weight_fraction_leaf': 0.02, 'max_leaf_nodes': None, 'bootstrap': True, 'ccp_alpha': 0.063, 'max_samples': 0.5}. Best is trial 621 with value: -0.18112741123578058.
[I 2025-04-15 23:59:02,567] Trial 1038 finished with value: -0.1858983767969386 and parameters: {'n_estimators': 204, 'min_samples_split': 154, 'max_features': 0.9400000000000001, 'min_samples_leaf': 24, 'criterion': 'absolute_error', 'max_depth': 30, 'min_weight_fraction_leaf': 0.02, 'max_leaf_nodes': 100, 'bootstrap': True, 'ccp_alpha': 0.079, 'max_samples': 0.5}. Best is trial 621 with value: -0.18112741123578058.
[I 2025-04-15 23:59:05,720] Trial 1039 finished with value: -0.18282335114744952 and parameters: {'n_estimators': 2798, 'min_samples_split': 162, 'max_features': 0.77, 'min_samples_leaf': 73, 'criterion': 'absolute_error', 'max_depth': 45, 'min_weight_fraction_leaf': 0.0, 'max_leaf_nodes': 100, 'bootstrap': True, 'ccp_alpha': 0.07200000000000001, 'max_samples': 0.5}. Best is trial 621 with value: -0.18112741123578058.
[I 2025-04-15 23:59:08,435] Trial 1040 finished with value: -0.1936417107583833 and parameters: {'n_estimators': 3035, 'min_samples_split': 177, 'max_features': 0.3, 'min_samples_leaf': 25, 'criterion': 'absolute_error', 'max_depth': None, 'min_weight_fraction_leaf': 0.01, 'max_leaf_nodes': 50, 'bootstrap': False, 'ccp_alpha': 0.093}. Best is trial 621 with value: -0.18112741123578058.
[I 2025-04-15 23:59:12,072] Trial 1041 finished with value: -0.1830063117755069 and parameters: {'n_estimators': 3338, 'min_samples_split': 87, 'max_features': 0.85, 'min_samples_leaf': 31, 'criterion': 'absolute_error', 'max_depth': 30, 'min_weight_fraction_leaf': 0.02, 'max_leaf_nodes': 100, 'bootstrap': True, 'ccp_alpha': 0.058, 'max_samples': 0.5}. Best is trial 621 with value: -0.18112741123578058.
[I 2025-04-15 23:59:12,266] Trial 1042 finished with value: -0.19363616285847823 and parameters: {'n_estimators': 4, 'min_samples_split': 170, 'max_features': 0.89, 'min_samples_leaf': 29, 'criterion': 'absolute_error', 'max_depth': 60, 'min_weight_fraction_leaf': 0.03, 'max_leaf_nodes': 20, 'bootstrap': True, 'ccp_alpha': 0.109, 'max_samples': 0.5}. Best is trial 621 with value: -0.18112741123578058.
[I 2025-04-15 23:59:13,329] Trial 1043 finished with value: -0.1928153346282233 and parameters: {'n_estimators': 820, 'min_samples_split': 129, 'max_features': 0.33, 'min_samples_leaf': 34, 'criterion': 'absolute_error', 'max_depth': 45, 'min_weight_fraction_leaf': 0.01, 'max_leaf_nodes': 10, 'bootstrap': True, 'ccp_alpha': 0.067, 'max_samples': None}. Best is trial 621 with value: -0.18112741123578058.
[I 2025-04-15 23:59:13,855] Trial 1044 finished with value: -0.1873311406411387 and parameters: {'n_estimators': 316, 'min_samples_split': 29, 'max_features': 0.8, 'min_samples_leaf': 26, 'criterion': 'absolute_error', 'max_depth': 30, 'min_weight_fraction_leaf': 0.0, 'max_leaf_nodes': 100, 'bootstrap': True, 'ccp_alpha': 0.085, 'max_samples': 0.5}. Best is trial 621 with value: -0.18112741123578058.
[I 2025-04-15 23:59:16,953] Trial 1045 finished with value: -0.18287811031294882 and parameters: {'n_estimators': 2641, 'min_samples_split': 24, 'max_features': 0.91, 'min_samples_leaf': 37, 'criterion': 'absolute_error', 'max_depth': 5, 'min_weight_fraction_leaf': 0.01, 'max_leaf_nodes': 100, 'bootstrap': True, 'ccp_alpha': 0.101, 'max_samples': 0.5}. Best is trial 621 with value: -0.18112741123578058.
[I 2025-04-15 23:59:20,546] Trial 1046 finished with value: -0.18259283880842214 and parameters: {'n_estimators': 3029, 'min_samples_split': 159, 'max_features': 0.8300000000000001, 'min_samples_leaf': 23, 'criterion': 'absolute_error', 'max_depth': 30, 'min_weight_fraction_leaf': 0.02, 'max_leaf_nodes': 100, 'bootstrap': True, 'ccp_alpha': 0.093, 'max_samples': 0.5}. Best is trial 621 with value: -0.18112741123578058.
[I 2025-04-15 23:59:23,417] Trial 1047 finished with value: -18.067409472440275 and parameters: {'n_estimators': 2852, 'min_samples_split': 15, 'max_features': 0.5800000000000001, 'min_samples_leaf': 32, 'criterion': 'squared_error', 'max_depth': 45, 'min_weight_fraction_leaf': 0.02, 'max_leaf_nodes': 50, 'bootstrap': True, 'ccp_alpha': 0.076, 'max_samples': 1.0}. Best is trial 621 with value: -0.18112741123578058.
[I 2025-04-15 23:59:27,035] Trial 1048 finished with value: -0.18295154399509803 and parameters: {'n_estimators': 3287, 'min_samples_split': 174, 'max_features': 0.87, 'min_samples_leaf': 27, 'criterion': 'absolute_error', 'max_depth': 30, 'min_weight_fraction_leaf': 0.02, 'max_leaf_nodes': 100, 'bootstrap': True, 'ccp_alpha': 0.12, 'max_samples': 0.5}. Best is trial 621 with value: -0.18112741123578058.
[I 2025-04-15 23:59:31,260] Trial 1049 finished with value: -0.19116805203736315 and parameters: {'n_estimators': 3497, 'min_samples_split': 165, 'max_features': 0.85, 'min_samples_leaf': 19, 'criterion': 'absolute_error', 'max_depth': 45, 'min_weight_fraction_leaf': 0.01, 'max_leaf_nodes': 100, 'bootstrap': True, 'ccp_alpha': 0.061, 'max_samples': 0.75}. Best is trial 621 with value: -0.18112741123578058.
[I 2025-04-15 23:59:31,991] Trial 1050 finished with value: -0.18715840856601024 and parameters: {'n_estimators': 477, 'min_samples_split': 179, 'max_features': 0.03, 'min_samples_leaf': 30, 'criterion': 'absolute_error', 'max_depth': 30, 'min_weight_fraction_leaf': 0.03, 'max_leaf_nodes': None, 'bootstrap': True, 'ccp_alpha': 0.07, 'max_samples': 0.5}. Best is trial 621 with value: -0.18112741123578058.
[I 2025-04-15 23:59:42,205] Trial 1051 finished with value: -0.18481907842339665 and parameters: {'n_estimators': 9130, 'min_samples_split': 186, 'max_features': 0.21000000000000002, 'min_samples_leaf': 28, 'criterion': 'absolute_error', 'max_depth': 20, 'min_weight_fraction_leaf': 0.0, 'max_leaf_nodes': 100, 'bootstrap': True, 'ccp_alpha': 0.082, 'max_samples': 0.5}. Best is trial 621 with value: -0.18112741123578058.
[I 2025-04-15 23:59:44,993] Trial 1052 finished with value: -0.1838754713230733 and parameters: {'n_estimators': 2433, 'min_samples_split': 155, 'max_features': 0.27, 'min_samples_leaf': 24, 'criterion': 'absolute_error', 'max_depth': 30, 'min_weight_fraction_leaf': 0.02, 'max_leaf_nodes': 10, 'bootstrap': True, 'ccp_alpha': 0.107, 'max_samples': 0.5}. Best is trial 621 with value: -0.18112741123578058.
[I 2025-04-15 23:59:48,291] Trial 1053 finished with value: -17.98172584672534 and parameters: {'n_estimators': 3121, 'min_samples_split': 193, 'max_features': 0.41000000000000003, 'min_samples_leaf': 35, 'criterion': 'poisson', 'max_depth': 45, 'min_weight_fraction_leaf': 0.01, 'max_leaf_nodes': 100, 'bootstrap': True, 'ccp_alpha': 0.089, 'max_samples': 0.5}. Best is trial 621 with value: -0.18112741123578058.
[I 2025-04-15 23:59:51,553] Trial 1054 finished with value: -0.18292365350121037 and parameters: {'n_estimators': 2853, 'min_samples_split': 104, 'max_features': 0.63, 'min_samples_leaf': 21, 'criterion': 'absolute_error', 'max_depth': None, 'min_weight_fraction_leaf': 0.0, 'max_leaf_nodes': 50, 'bootstrap': True, 'ccp_alpha': 0.099, 'max_samples': 0.5}. Best is trial 621 with value: -0.18112741123578058.
[I 2025-04-15 23:59:58,740] Trial 1055 finished with value: -0.1838040897304271 and parameters: {'n_estimators': 6416, 'min_samples_split': 174, 'max_features': 0.73, 'min_samples_leaf': 50, 'criterion': 'absolute_error', 'max_depth': 60, 'min_weight_fraction_leaf': 0.02, 'max_leaf_nodes': 100, 'bootstrap': True, 'ccp_alpha': 0.115, 'max_samples': 0.5}. Best is trial 621 with value: -0.18112741123578058.
[I 2025-04-16 00:00:02,348] Trial 1056 finished with value: -0.1828301609237984 and parameters: {'n_estimators': 3242, 'min_samples_split': 168, 'max_features': 0.54, 'min_samples_leaf': 68, 'criterion': 'absolute_error', 'max_depth': 30, 'min_weight_fraction_leaf': 0.06, 'max_leaf_nodes': 300, 'bootstrap': True, 'ccp_alpha': 0.065, 'max_samples': 0.5}. Best is trial 621 with value: -0.18112741123578058.
[I 2025-04-16 00:00:05,601] Trial 1057 finished with value: -0.1828655925911805 and parameters: {'n_estimators': 2685, 'min_samples_split': 30, 'max_features': 0.89, 'min_samples_leaf': 30, 'criterion': 'absolute_error', 'max_depth': 45, 'min_weight_fraction_leaf': 0.01, 'max_leaf_nodes': 100, 'bootstrap': True, 'ccp_alpha': 0.078, 'max_samples': 0.5}. Best is trial 621 with value: -0.18112741123578058.
[I 2025-04-16 00:00:11,664] Trial 1058 finished with value: -0.1835345862994579 and parameters: {'n_estimators': 5193, 'min_samples_split': 24, 'max_features': 0.78, 'min_samples_leaf': 26, 'criterion': 'absolute_error', 'max_depth': 5, 'min_weight_fraction_leaf': 0.02, 'max_leaf_nodes': 100, 'bootstrap': True, 'ccp_alpha': 0.095, 'max_samples': 0.5}. Best is trial 621 with value: -0.18112741123578058.
[I 2025-04-16 00:00:14,971] Trial 1059 finished with value: -0.18256481253706242 and parameters: {'n_estimators': 2984, 'min_samples_split': 158, 'max_features': 0.9500000000000001, 'min_samples_leaf': 32, 'criterion': 'absolute_error', 'max_depth': 30, 'min_weight_fraction_leaf': 0.03, 'max_leaf_nodes': 10, 'bootstrap': True, 'ccp_alpha': 0.054, 'max_samples': 0.5}. Best is trial 621 with value: -0.18112741123578058.
[I 2025-04-16 00:00:15,165] Trial 1060 finished with value: -0.1936417107583833 and parameters: {'n_estimators': 9, 'min_samples_split': 183, 'max_features': 0.81, 'min_samples_leaf': 56, 'criterion': 'absolute_error', 'max_depth': 30, 'min_weight_fraction_leaf': 0.02, 'max_leaf_nodes': 100, 'bootstrap': False, 'ccp_alpha': 0.299}. Best is trial 621 with value: -0.18112741123578058.
[I 2025-04-16 00:00:19,530] Trial 1061 finished with value: -17.83069716919668 and parameters: {'n_estimators': 4017, 'min_samples_split': 163, 'max_features': 0.91, 'min_samples_leaf': 53, 'criterion': 'friedman_mse', 'max_depth': 45, 'min_weight_fraction_leaf': 0.01, 'max_leaf_nodes': 50, 'bootstrap': True, 'ccp_alpha': 0.21, 'max_samples': 0.5}. Best is trial 621 with value: -0.18112741123578058.
[I 2025-04-16 00:00:23,402] Trial 1062 finished with value: -0.18331705758450484 and parameters: {'n_estimators': 3587, 'min_samples_split': 150, 'max_features': 0.88, 'min_samples_leaf': 44, 'criterion': 'absolute_error', 'max_depth': 10, 'min_weight_fraction_leaf': 0.02, 'max_leaf_nodes': 100, 'bootstrap': True, 'ccp_alpha': 0.07200000000000001, 'max_samples': 0.5}. Best is trial 621 with value: -0.18112741123578058.
